tested_configs_B1_H2_S16452_D128.json
{
  "batch_size": 1,
  "num_heads": 2,
  "seq_len": 16452,
  "head_dim": 128,
  "config_file": "tuning_space_attn_qk_int8.json",
  "tested_configs_successful": {
    "1652": {
      "BLOCK_SIZE_M": 64,
      "BLOCK_SIZE_N": 256,
      "num_warps": 8,
      "num_stages": 1,
      "waves_per_eu": 0,
      "stage": 3
    },
    "4701": {
      "BLOCK_SIZE_M": 256,
      "BLOCK_SIZE_N": 128,
      "num_warps": 8,
      "num_stages": 2,
      "waves_per_eu": 4,
      "stage": 4
    },
    "5266": {
      "BLOCK_SIZE_M": 256,
      "BLOCK_SIZE_N": 256,
      "num_warps": 8,
      "num_stages": 1,
      "waves_per_eu": 2,
      "stage": 5
    },
    "4071": {
      "BLOCK_SIZE_M": 256,
      "BLOCK_SIZE_N": 64,
      "num_warps": 8,
      "num_stages": 1,
      "waves_per_eu": 4,
      "stage": 4
    },
    "1678": {
      "BLOCK_SIZE_M": 64,
      "BLOCK_SIZE_N": 256,
      "num_warps": 8,
      "num_stages": 1,
      "waves_per_eu": 8,
      "stage": 5
    },
    "1085": {
      "BLOCK_SIZE_M": 64,
      "BLOCK_SIZE_N": 128,
      "num_warps": 8,
      "num_stages": 2,
      "waves_per_eu": 0,
      "stage": 6
    },
    "525": {
      "BLOCK_SIZE_M": 64,
      "BLOCK_SIZE_N": 64,
      "num_warps": 8,
      "num_stages": 4,
      "waves_per_eu": 2,
      "stage": 4
    },
    "4650": {
      "BLOCK_SIZE_M": 256,
      "BLOCK_SIZE_N": 128,
      "num_warps": 8,
      "num_stages": 1,
      "waves_per_eu": 0,
      "stage": 1
    },
    "828": {
      "BLOCK_SIZE_M": 64,
      "BLOCK_SIZE_N": 128,
      "num_warps": 2,
      "num_stages": 4,
      "waves_per_eu": 4,
      "stage": 1
    },
    "906": {
      "BLOCK_SIZE_M": 64,
      "BLOCK_SIZE_N": 128,
      "num_warps": 4,
      "num_stages": 1,
      "waves_per_eu": 1,
      "stage": 1
    },
    "4659": {
      "BLOCK_SIZE_M": 256,
      "BLOCK_SIZE_N": 128,
      "num_warps": 8,
      "num_stages": 1,
      "waves_per_eu": 1,
      "stage": 4
    },
    "1823": {
      "BLOCK_SIZE_M": 128,
      "BLOCK_SIZE_N": 64,
      "num_warps": 1,
      "num_stages": 1,
      "waves_per_eu": 4,
      "stage": 6
    },
    "1984": {
      "BLOCK_SIZE_M": 128,
      "BLOCK_SIZE_N": 64,
      "num_warps": 2,
      "num_stages": 2,
      "waves_per_eu": 0,
      "stage": 5
    },
    "356": {
      "BLOCK_SIZE_M": 64,
      "BLOCK_SIZE_N": 64,
      "num_warps": 4,
      "num_stages": 2,
      "waves_per_eu": 8,
      "stage": 3
    },
    "4053": {
      "BLOCK_SIZE_M": 256,
      "BLOCK_SIZE_N": 64,
      "num_warps": 8,
      "num_stages": 1,
      "waves_per_eu": 0,
      "stage": 4
    },
    "1370": {
      "BLOCK_SIZE_M": 64,
      "BLOCK_SIZE_N": 256,
      "num_warps": 2,
      "num_stages": 1,
      "waves_per_eu": 4,
      "stage": 3
    },
    "1863": {
      "BLOCK_SIZE_M": 128,
      "BLOCK_SIZE_N": 64,
      "num_warps": 1,
      "num_stages": 4,
      "waves_per_eu": 0,
      "stage": 4
    },
    "683": {
      "BLOCK_SIZE_M": 64,
      "BLOCK_SIZE_N": 128,
      "num_warps": 1,
      "num_stages": 4,
      "waves_per_eu": 4,
      "stage": 6
    },
    "2114": {
      "BLOCK_SIZE_M": 128,
      "BLOCK_SIZE_N": 64,
      "num_warps": 4,
      "num_stages": 1,
      "waves_per_eu": 2,
      "stage": 3
    },
    "2277": {
      "BLOCK_SIZE_M": 128,
      "BLOCK_SIZE_N": 64,
      "num_warps": 8,
      "num_stages": 1,
      "waves_per_eu": 8,
      "stage": 4
    },
    "2033": {
      "BLOCK_SIZE_M": 128,
      "BLOCK_SIZE_N": 64,
      "num_warps": 2,
      "num_stages": 4,
      "waves_per_eu": 4,
      "stage": 6
    },
    "226": {
      "BLOCK_SIZE_M": 64,
      "BLOCK_SIZE_N": 64,
      "num_warps": 2,
      "num_stages": 4,
      "waves_per_eu": 2,
      "stage": 5
    },
    "155": {
      "BLOCK_SIZE_M": 64,
      "BLOCK_SIZE_N": 64,
      "num_warps": 2,
      "num_stages": 1,
      "waves_per_eu": 0,
      "stage": 6
    },
    "461": {
      "BLOCK_SIZE_M": 64,
      "BLOCK_SIZE_N": 64,
      "num_warps": 8,
      "num_stages": 1,
      "waves_per_eu": 1,
      "stage": 6
    },
    "2141": {
      "BLOCK_SIZE_M": 128,
      "BLOCK_SIZE_N": 64,
      "num_warps": 4,
      "num_stages": 2,
      "waves_per_eu": 1,
      "stage": 6
    },
    "2757": {
      "BLOCK_SIZE_M": 128,
      "BLOCK_SIZE_N": 128,
      "num_warps": 4,
      "num_stages": 2,
      "waves_per_eu": 8,
      "stage": 4
    },
    "821": {
      "BLOCK_SIZE_M": 64,
      "BLOCK_SIZE_N": 128,
      "num_warps": 2,
      "num_stages": 4,
      "waves_per_eu": 1,
      "stage": 6
    },
    "4696": {
      "BLOCK_SIZE_M": 256,
      "BLOCK_SIZE_N": 128,
      "num_warps": 8,
      "num_stages": 2,
      "waves_per_eu": 2,
      "stage": 5
    },
    "388": {
      "BLOCK_SIZE_M": 64,
      "BLOCK_SIZE_N": 64,
      "num_warps": 4,
      "num_stages": 4,
      "waves_per_eu": 8,
      "stage": 5
    },
    "1379": {
      "BLOCK_SIZE_M": 64,
      "BLOCK_SIZE_N": 256,
      "num_warps": 2,
      "num_stages": 1,
      "waves_per_eu": 8,
      "stage": 6
    },
    "4255": {
      "BLOCK_SIZE_M": 256,
      "BLOCK_SIZE_N": 128,
      "num_warps": 1,
      "num_stages": 2,
      "waves_per_eu": 8,
      "stage": 2
    },
    "3649": {
      "BLOCK_SIZE_M": 256,
      "BLOCK_SIZE_N": 64,
      "num_warps": 1,
      "num_stages": 2,
      "waves_per_eu": 4,
      "stage": 2
    },
    "2470": {
      "BLOCK_SIZE_M": 128,
      "BLOCK_SIZE_N": 128,
      "num_warps": 1,
      "num_stages": 4,
      "waves_per_eu": 1,
      "stage": 5
    },
    "976": {
      "BLOCK_SIZE_M": 64,
      "BLOCK_SIZE_N": 128,
      "num_warps": 4,
      "num_stages": 4,
      "waves_per_eu": 2,
      "stage": 5
    },
    "2467": {
      "BLOCK_SIZE_M": 128,
      "BLOCK_SIZE_N": 128,
      "num_warps": 1,
      "num_stages": 4,
      "waves_per_eu": 1,
      "stage": 2
    },
    "71": {
      "BLOCK_SIZE_M": 64,
      "BLOCK_SIZE_N": 64,
      "num_warps": 1,
      "num_stages": 4,
      "waves_per_eu": 1,
      "stage": 6
    },
    "4422": {
      "BLOCK_SIZE_M": 256,
      "BLOCK_SIZE_N": 128,
      "num_warps": 2,
      "num_stages": 4,
      "waves_per_eu": 2,
      "stage": 1
    },
    "2429": {
      "BLOCK_SIZE_M": 128,
      "BLOCK_SIZE_N": 128,
      "num_warps": 1,
      "num_stages": 1,
      "waves_per_eu": 8,
      "stage": 6
    },
    "4554": {
      "BLOCK_SIZE_M": 256,
      "BLOCK_SIZE_N": 128,
      "num_warps": 4,
      "num_stages": 2,
      "waves_per_eu": 8,
      "stage": 1
    },
    "305": {
      "BLOCK_SIZE_M": 64,
      "BLOCK_SIZE_N": 64,
      "num_warps": 4,
      "num_stages": 1,
      "waves_per_eu": 0,
      "stage": 6
    },
    "169": {
      "BLOCK_SIZE_M": 64,
      "BLOCK_SIZE_N": 64,
      "num_warps": 2,
      "num_stages": 1,
      "waves_per_eu": 4,
      "stage": 2
    },
    "2580": {
      "BLOCK_SIZE_M": 128,
      "BLOCK_SIZE_N": 128,
      "num_warps": 2,
      "num_stages": 2,
      "waves_per_eu": 0,
      "stage": 1
    },
    "2026": {
      "BLOCK_SIZE_M": 128,
      "BLOCK_SIZE_N": 64,
      "num_warps": 2,
      "num_stages": 4,
      "waves_per_eu": 2,
      "stage": 5
    },
    "2603": {
      "BLOCK_SIZE_M": 128,
      "BLOCK_SIZE_N": 128,
      "num_warps": 2,
      "num_stages": 2,
      "waves_per_eu": 4,
      "stage": 6
    },
    "613": {
      "BLOCK_SIZE_M": 64,
      "BLOCK_SIZE_N": 128,
      "num_warps": 1,
      "num_stages": 1,
      "waves_per_eu": 2,
      "stage": 2
    },
    "370": {
      "BLOCK_SIZE_M": 64,
      "BLOCK_SIZE_N": 64,
      "num_warps": 4,
      "num_stages": 4,
      "waves_per_eu": 1,
      "stage": 5
    },
    "2771": {
      "BLOCK_SIZE_M": 128,
      "BLOCK_SIZE_N": 128,
      "num_warps": 4,
      "num_stages": 4,
      "waves_per_eu": 1,
      "stage": 6
    },
    "3814": {
      "BLOCK_SIZE_M": 256,
      "BLOCK_SIZE_N": 64,
      "num_warps": 2,
      "num_stages": 4,
      "waves_per_eu": 0,
      "stage": 5
    },
    "773": {
      "BLOCK_SIZE_M": 64,
      "BLOCK_SIZE_N": 128,
      "num_warps": 2,
      "num_stages": 1,
      "waves_per_eu": 4,
      "stage": 6
    },
    "4675": {
      "BLOCK_SIZE_M": 256,
      "BLOCK_SIZE_N": 128,
      "num_warps": 8,
      "num_stages": 1,
      "waves_per_eu": 8,
      "stage": 2
    },
    "2139": {
      "BLOCK_SIZE_M": 128,
      "BLOCK_SIZE_N": 64,
      "num_warps": 4,
      "num_stages": 2,
      "waves_per_eu": 1,
      "stage": 4
    },
    "3905": {
      "BLOCK_SIZE_M": 256,
      "BLOCK_SIZE_N": 64,
      "num_warps": 4,
      "num_stages": 1,
      "waves_per_eu": 0,
      "stage": 6
    },
    "978": {
      "BLOCK_SIZE_M": 64,
      "BLOCK_SIZE_N": 128,
      "num_warps": 4,
      "num_stages": 4,
      "waves_per_eu": 4,
      "stage": 1
    },
    "1811": {
      "BLOCK_SIZE_M": 128,
      "BLOCK_SIZE_N": 64,
      "num_warps": 1,
      "num_stages": 1,
      "waves_per_eu": 1,
      "stage": 6
    },
    "1072": {
      "BLOCK_SIZE_M": 64,
      "BLOCK_SIZE_N": 128,
      "num_warps": 8,
      "num_stages": 1,
      "waves_per_eu": 4,
      "stage": 5
    },
    "1504": {
      "BLOCK_SIZE_M": 64,
      "BLOCK_SIZE_N": 256,
      "num_warps": 4,
      "num_stages": 1,
      "waves_per_eu": 0,
      "stage": 5
    },
    "1505": {
      "BLOCK_SIZE_M": 64,
      "BLOCK_SIZE_N": 256,
      "num_warps": 4,
      "num_stages": 1,
      "waves_per_eu": 0,
      "stage": 6
    },
    "328": {
      "BLOCK_SIZE_M": 64,
      "BLOCK_SIZE_N": 64,
      "num_warps": 4,
      "num_stages": 1,
      "waves_per_eu": 8,
      "stage": 5
    },
    "2590": {
      "BLOCK_SIZE_M": 128,
      "BLOCK_SIZE_N": 128,
      "num_warps": 2,
      "num_stages": 2,
      "waves_per_eu": 1,
      "stage": 5
    },
    "3605": {
      "BLOCK_SIZE_M": 256,
      "BLOCK_SIZE_N": 64,
      "num_warps": 1,
      "num_stages": 1,
      "waves_per_eu": 0,
      "stage": 6
    },
    "5270": {
      "BLOCK_SIZE_M": 256,
      "BLOCK_SIZE_N": 256,
      "num_warps": 8,
      "num_stages": 1,
      "waves_per_eu": 4,
      "stage": 3
    },
    "827": {
      "BLOCK_SIZE_M": 64,
      "BLOCK_SIZE_N": 128,
      "num_warps": 2,
      "num_stages": 4,
      "waves_per_eu": 2,
      "stage": 6
    },
    "2488": {
      "BLOCK_SIZE_M": 128,
      "BLOCK_SIZE_N": 128,
      "num_warps": 1,
      "num_stages": 4,
      "waves_per_eu": 8,
      "stage": 5
    },
    "5276": {
      "BLOCK_SIZE_M": 256,
      "BLOCK_SIZE_N": 256,
      "num_warps": 8,
      "num_stages": 1,
      "waves_per_eu": 8,
      "stage": 3
    },
    "1854": {
      "BLOCK_SIZE_M": 128,
      "BLOCK_SIZE_N": 64,
      "num_warps": 1,
      "num_stages": 2,
      "waves_per_eu": 8,
      "stage": 1
    },
    "649": {
      "BLOCK_SIZE_M": 64,
      "BLOCK_SIZE_N": 128,
      "num_warps": 1,
      "num_stages": 2,
      "waves_per_eu": 4,
      "stage": 2
    },
    "2703": {
      "BLOCK_SIZE_M": 128,
      "BLOCK_SIZE_N": 128,
      "num_warps": 4,
      "num_stages": 1,
      "waves_per_eu": 0,
      "stage": 4
    },
    "2606": {
      "BLOCK_SIZE_M": 128,
      "BLOCK_SIZE_N": 128,
      "num_warps": 2,
      "num_stages": 2,
      "waves_per_eu": 8,
      "stage": 3
    },
    "792": {
      "BLOCK_SIZE_M": 64,
      "BLOCK_SIZE_N": 128,
      "num_warps": 2,
      "num_stages": 2,
      "waves_per_eu": 2,
      "stage": 1
    },
    "1663": {
      "BLOCK_SIZE_M": 64,
      "BLOCK_SIZE_N": 256,
      "num_warps": 8,
      "num_stages": 1,
      "waves_per_eu": 2,
      "stage": 2
    },
    "1963": {
      "BLOCK_SIZE_M": 128,
      "BLOCK_SIZE_N": 64,
      "num_warps": 2,
      "num_stages": 1,
      "waves_per_eu": 2,
      "stage": 2
    },
    "621": {
      "BLOCK_SIZE_M": 64,
      "BLOCK_SIZE_N": 128,
      "num_warps": 1,
      "num_stages": 1,
      "waves_per_eu": 4,
      "stage": 4
    },
    "1665": {
      "BLOCK_SIZE_M": 64,
      "BLOCK_SIZE_N": 256,
      "num_warps": 8,
      "num_stages": 1,
      "waves_per_eu": 2,
      "stage": 4
    },
    "4564": {
      "BLOCK_SIZE_M": 256,
      "BLOCK_SIZE_N": 128,
      "num_warps": 4,
      "num_stages": 4,
      "waves_per_eu": 0,
      "stage": 5
    },
    "3937": {
      "BLOCK_SIZE_M": 256,
      "BLOCK_SIZE_N": 64,
      "num_warps": 4,
      "num_stages": 2,
      "waves_per_eu": 1,
      "stage": 2
    },
    "3946": {
      "BLOCK_SIZE_M": 256,
      "BLOCK_SIZE_N": 64,
      "num_warps": 4,
      "num_stages": 2,
      "waves_per_eu": 2,
      "stage": 5
    },
    "234": {
      "BLOCK_SIZE_M": 64,
      "BLOCK_SIZE_N": 64,
      "num_warps": 2,
      "num_stages": 4,
      "waves_per_eu": 8,
      "stage": 1
    },
    "45": {
      "BLOCK_SIZE_M": 64,
      "BLOCK_SIZE_N": 64,
      "num_warps": 1,
      "num_stages": 2,
      "waves_per_eu": 2,
      "stage": 4
    },
    "802": {
      "BLOCK_SIZE_M": 64,
      "BLOCK_SIZE_N": 128,
      "num_warps": 2,
      "num_stages": 2,
      "waves_per_eu": 4,
      "stage": 5
    },
    "2480": {
      "BLOCK_SIZE_M": 128,
      "BLOCK_SIZE_N": 128,
      "num_warps": 1,
      "num_stages": 4,
      "waves_per_eu": 4,
      "stage": 3
    },
    "4680": {
      "BLOCK_SIZE_M": 256,
      "BLOCK_SIZE_N": 128,
      "num_warps": 8,
      "num_stages": 2,
      "waves_per_eu": 0,
      "stage": 1
    },
    "901": {
      "BLOCK_SIZE_M": 64,
      "BLOCK_SIZE_N": 128,
      "num_warps": 4,
      "num_stages": 1,
      "waves_per_eu": 0,
      "stage": 2
    },
    "186": {
      "BLOCK_SIZE_M": 64,
      "BLOCK_SIZE_N": 64,
      "num_warps": 2,
      "num_stages": 2,
      "waves_per_eu": 1,
      "stage": 1
    },
    "3664": {
      "BLOCK_SIZE_M": 256,
      "BLOCK_SIZE_N": 64,
      "num_warps": 1,
      "num_stages": 4,
      "waves_per_eu": 0,
      "stage": 5
    },
    "4249": {
      "BLOCK_SIZE_M": 256,
      "BLOCK_SIZE_N": 128,
      "num_warps": 1,
      "num_stages": 2,
      "waves_per_eu": 4,
      "stage": 2
    },
    "2446": {
      "BLOCK_SIZE_M": 128,
      "BLOCK_SIZE_N": 128,
      "num_warps": 1,
      "num_stages": 2,
      "waves_per_eu": 2,
      "stage": 5
    },
    "2305": {
      "BLOCK_SIZE_M": 128,
      "BLOCK_SIZE_N": 64,
      "num_warps": 8,
      "num_stages": 2,
      "waves_per_eu": 8,
      "stage": 2
    },
    "1355": {
      "BLOCK_SIZE_M": 64,
      "BLOCK_SIZE_N": 256,
      "num_warps": 2,
      "num_stages": 1,
      "waves_per_eu": 0,
      "stage": 6
    },
    "3804": {
      "BLOCK_SIZE_M": 256,
      "BLOCK_SIZE_N": 64,
      "num_warps": 2,
      "num_stages": 2,
      "waves_per_eu": 8,
      "stage": 1
    },
    "4429": {
      "BLOCK_SIZE_M": 256,
      "BLOCK_SIZE_N": 128,
      "num_warps": 2,
      "num_stages": 4,
      "waves_per_eu": 4,
      "stage": 2
    },
    "3154": {
      "BLOCK_SIZE_M": 128,
      "BLOCK_SIZE_N": 256,
      "num_warps": 2,
      "num_stages": 1,
      "waves_per_eu": 0,
      "stage": 5
    },
    "5108": {
      "BLOCK_SIZE_M": 256,
      "BLOCK_SIZE_N": 256,
      "num_warps": 4,
      "num_stages": 1,
      "waves_per_eu": 1,
      "stage": 3
    },
    "2015": {
      "BLOCK_SIZE_M": 128,
      "BLOCK_SIZE_N": 64,
      "num_warps": 2,
      "num_stages": 4,
      "waves_per_eu": 0,
      "stage": 6
    },
    "3644": {
      "BLOCK_SIZE_M": 256,
      "BLOCK_SIZE_N": 64,
      "num_warps": 1,
      "num_stages": 2,
      "waves_per_eu": 2,
      "stage": 3
    },
    "521": {
      "BLOCK_SIZE_M": 64,
      "BLOCK_SIZE_N": 64,
      "num_warps": 8,
      "num_stages": 4,
      "waves_per_eu": 1,
      "stage": 6
    },
    "2": {
      "BLOCK_SIZE_M": 64,
      "BLOCK_SIZE_N": 64,
      "num_warps": 1,
      "num_stages": 1,
      "waves_per_eu": 0,
      "stage": 3
    },
    "1846": {
      "BLOCK_SIZE_M": 128,
      "BLOCK_SIZE_N": 64,
      "num_warps": 1,
      "num_stages": 2,
      "waves_per_eu": 2,
      "stage": 5
    },
    "3017": {
      "BLOCK_SIZE_M": 128,
      "BLOCK_SIZE_N": 256,
      "num_warps": 1,
      "num_stages": 1,
      "waves_per_eu": 2,
      "stage": 6
    },
    "19": {
      "BLOCK_SIZE_M": 64,
      "BLOCK_SIZE_N": 64,
      "num_warps": 1,
      "num_stages": 1,
      "waves_per_eu": 4,
      "stage": 2
    },
    "1840": {
      "BLOCK_SIZE_M": 128,
      "BLOCK_SIZE_N": 64,
      "num_warps": 1,
      "num_stages": 2,
      "waves_per_eu": 1,
      "stage": 5
    },
    "1888": {
      "BLOCK_SIZE_M": 128,
      "BLOCK_SIZE_N": 64,
      "num_warps": 1,
      "num_stages": 4,
      "waves_per_eu": 8,
      "stage": 5
    },
    "3927": {
      "BLOCK_SIZE_M": 256,
      "BLOCK_SIZE_N": 64,
      "num_warps": 4,
      "num_stages": 1,
      "waves_per_eu": 8,
      "stage": 4
    },
    "4424": {
      "BLOCK_SIZE_M": 256,
      "BLOCK_SIZE_N": 128,
      "num_warps": 2,
      "num_stages": 4,
      "waves_per_eu": 2,
      "stage": 3
    },
    "3686": {
      "BLOCK_SIZE_M": 256,
      "BLOCK_SIZE_N": 64,
      "num_warps": 1,
      "num_stages": 4,
      "waves_per_eu": 8,
      "stage": 3
    },
    "199": {
      "BLOCK_SIZE_M": 64,
      "BLOCK_SIZE_N": 64,
      "num_warps": 2,
      "num_stages": 2,
      "waves_per_eu": 4,
      "stage": 2
    },
    "2415": {
      "BLOCK_SIZE_M": 128,
      "BLOCK_SIZE_N": 128,
      "num_warps": 1,
      "num_stages": 1,
      "waves_per_eu": 2,
      "stage": 4
    },
    "3956": {
      "BLOCK_SIZE_M": 256,
      "BLOCK_SIZE_N": 64,
      "num_warps": 4,
      "num_stages": 2,
      "waves_per_eu": 8,
      "stage": 3
    },
    "3151": {
      "BLOCK_SIZE_M": 128,
      "BLOCK_SIZE_N": 256,
      "num_warps": 2,
      "num_stages": 1,
      "waves_per_eu": 0,
      "stage": 2
    },
    "77": {
      "BLOCK_SIZE_M": 64,
      "BLOCK_SIZE_N": 64,
      "num_warps": 1,
      "num_stages": 4,
      "waves_per_eu": 2,
      "stage": 6
    },
    "1351": {
      "BLOCK_SIZE_M": 64,
      "BLOCK_SIZE_N": 256,
      "num_warps": 2,
      "num_stages": 1,
      "waves_per_eu": 0,
      "stage": 2
    },
    "2594": {
      "BLOCK_SIZE_M": 128,
      "BLOCK_SIZE_N": 128,
      "num_warps": 2,
      "num_stages": 2,
      "waves_per_eu": 2,
      "stage": 3
    },
    "2408": {
      "BLOCK_SIZE_M": 128,
      "BLOCK_SIZE_N": 128,
      "num_warps": 1,
      "num_stages": 1,
      "waves_per_eu": 1,
      "stage": 3
    },
    "4064": {
      "BLOCK_SIZE_M": 256,
      "BLOCK_SIZE_N": 64,
      "num_warps": 8,
      "num_stages": 1,
      "waves_per_eu": 2,
      "stage": 3
    },
    "2274": {
      "BLOCK_SIZE_M": 128,
      "BLOCK_SIZE_N": 64,
      "num_warps": 8,
      "num_stages": 1,
      "waves_per_eu": 8,
      "stage": 1
    },
    "4970": {
      "BLOCK_SIZE_M": 256,
      "BLOCK_SIZE_N": 256,
      "num_warps": 2,
      "num_stages": 1,
      "waves_per_eu": 4,
      "stage": 3
    },
    "203": {
      "BLOCK_SIZE_M": 64,
      "BLOCK_SIZE_N": 64,
      "num_warps": 2,
      "num_stages": 2,
      "waves_per_eu": 4,
      "stage": 6
    },
    "3987": {
      "BLOCK_SIZE_M": 256,
      "BLOCK_SIZE_N": 64,
      "num_warps": 4,
      "num_stages": 4,
      "waves_per_eu": 8,
      "stage": 4
    },
    "823": {
      "BLOCK_SIZE_M": 64,
      "BLOCK_SIZE_N": 128,
      "num_warps": 2,
      "num_stages": 4,
      "waves_per_eu": 2,
      "stage": 2
    },
    "3637": {
      "BLOCK_SIZE_M": 256,
      "BLOCK_SIZE_N": 64,
      "num_warps": 1,
      "num_stages": 2,
      "waves_per_eu": 1,
      "stage": 2
    },
    "1885": {
      "BLOCK_SIZE_M": 128,
      "BLOCK_SIZE_N": 64,
      "num_warps": 1,
      "num_stages": 4,
      "waves_per_eu": 8,
      "stage": 2
    },
    "469": {
      "BLOCK_SIZE_M": 64,
      "BLOCK_SIZE_N": 64,
      "num_warps": 8,
      "num_stages": 1,
      "waves_per_eu": 4,
      "stage": 2
    },
    "218": {
      "BLOCK_SIZE_M": 64,
      "BLOCK_SIZE_N": 64,
      "num_warps": 2,
      "num_stages": 4,
      "waves_per_eu": 1,
      "stage": 3
    },
    "2705": {
      "BLOCK_SIZE_M": 128,
      "BLOCK_SIZE_N": 128,
      "num_warps": 4,
      "num_stages": 1,
      "waves_per_eu": 0,
      "stage": 6
    },
    "2173": {
      "BLOCK_SIZE_M": 128,
      "BLOCK_SIZE_N": 64,
      "num_warps": 4,
      "num_stages": 4,
      "waves_per_eu": 2,
      "stage": 2
    },
    "4091": {
      "BLOCK_SIZE_M": 256,
      "BLOCK_SIZE_N": 64,
      "num_warps": 8,
      "num_stages": 2,
      "waves_per_eu": 1,
      "stage": 6
    },
    "3928": {
      "BLOCK_SIZE_M": 256,
      "BLOCK_SIZE_N": 64,
      "num_warps": 4,
      "num_stages": 1,
      "waves_per_eu": 8,
      "stage": 5
    },
    "3750": {
      "BLOCK_SIZE_M": 256,
      "BLOCK_SIZE_N": 64,
      "num_warps": 2,
      "num_stages": 1,
      "waves_per_eu": 0,
      "stage": 1
    },
    "2259": {
      "BLOCK_SIZE_M": 128,
      "BLOCK_SIZE_N": 64,
      "num_warps": 8,
      "num_stages": 1,
      "waves_per_eu": 1,
      "stage": 4
    },
    "4527": {
      "BLOCK_SIZE_M": 256,
      "BLOCK_SIZE_N": 128,
      "num_warps": 4,
      "num_stages": 1,
      "waves_per_eu": 8,
      "stage": 4
    },
    "2423": {
      "BLOCK_SIZE_M": 128,
      "BLOCK_SIZE_N": 128,
      "num_warps": 1,
      "num_stages": 1,
      "waves_per_eu": 4,
      "stage": 6
    },
    "4074": {
      "BLOCK_SIZE_M": 256,
      "BLOCK_SIZE_N": 64,
      "num_warps": 8,
      "num_stages": 1,
      "waves_per_eu": 8,
      "stage": 1
    },
    "4113": {
      "BLOCK_SIZE_M": 256,
      "BLOCK_SIZE_N": 64,
      "num_warps": 8,
      "num_stages": 4,
      "waves_per_eu": 0,
      "stage": 4
    },
    "4570": {
      "BLOCK_SIZE_M": 256,
      "BLOCK_SIZE_N": 128,
      "num_warps": 4,
      "num_stages": 4,
      "waves_per_eu": 1,
      "stage": 5
    },
    "1814": {
      "BLOCK_SIZE_M": 128,
      "BLOCK_SIZE_N": 64,
      "num_warps": 1,
      "num_stages": 1,
      "waves_per_eu": 2,
      "stage": 3
    },
    "1973": {
      "BLOCK_SIZE_M": 128,
      "BLOCK_SIZE_N": 64,
      "num_warps": 2,
      "num_stages": 1,
      "waves_per_eu": 4,
      "stage": 6
    },
    "4562": {
      "BLOCK_SIZE_M": 256,
      "BLOCK_SIZE_N": 128,
      "num_warps": 4,
      "num_stages": 4,
      "waves_per_eu": 0,
      "stage": 3
    },
    "4067": {
      "BLOCK_SIZE_M": 256,
      "BLOCK_SIZE_N": 64,
      "num_warps": 8,
      "num_stages": 1,
      "waves_per_eu": 2,
      "stage": 6
    },
    "4352": {
      "BLOCK_SIZE_M": 256,
      "BLOCK_SIZE_N": 128,
      "num_warps": 2,
      "num_stages": 1,
      "waves_per_eu": 0,
      "stage": 3
    },
    "2773": {
      "BLOCK_SIZE_M": 128,
      "BLOCK_SIZE_N": 128,
      "num_warps": 4,
      "num_stages": 4,
      "waves_per_eu": 2,
      "stage": 2
    },
    "358": {
      "BLOCK_SIZE_M": 64,
      "BLOCK_SIZE_N": 64,
      "num_warps": 4,
      "num_stages": 2,
      "waves_per_eu": 8,
      "stage": 5
    },
    "636": {
      "BLOCK_SIZE_M": 64,
      "BLOCK_SIZE_N": 128,
      "num_warps": 1,
      "num_stages": 2,
      "waves_per_eu": 1,
      "stage": 1
    },
    "3942": {
      "BLOCK_SIZE_M": 256,
      "BLOCK_SIZE_N": 64,
      "num_warps": 4,
      "num_stages": 2,
      "waves_per_eu": 2,
      "stage": 1
    },
    "4658": {
      "BLOCK_SIZE_M": 256,
      "BLOCK_SIZE_N": 128,
      "num_warps": 8,
      "num_stages": 1,
      "waves_per_eu": 1,
      "stage": 3
    },
    "1993": {
      "BLOCK_SIZE_M": 128,
      "BLOCK_SIZE_N": 64,
      "num_warps": 2,
      "num_stages": 2,
      "waves_per_eu": 2,
      "stage": 2
    },
    "3683": {
      "BLOCK_SIZE_M": 256,
      "BLOCK_SIZE_N": 64,
      "num_warps": 1,
      "num_stages": 4,
      "waves_per_eu": 4,
      "stage": 6
    },
    "633": {
      "BLOCK_SIZE_M": 64,
      "BLOCK_SIZE_N": 128,
      "num_warps": 1,
      "num_stages": 2,
      "waves_per_eu": 0,
      "stage": 4
    },
    "4388": {
      "BLOCK_SIZE_M": 256,
      "BLOCK_SIZE_N": 128,
      "num_warps": 2,
      "num_stages": 2,
      "waves_per_eu": 1,
      "stage": 3
    },
    "2568": {
      "BLOCK_SIZE_M": 128,
      "BLOCK_SIZE_N": 128,
      "num_warps": 2,
      "num_stages": 1,
      "waves_per_eu": 4,
      "stage": 1
    },
    "3619": {
      "BLOCK_SIZE_M": 256,
      "BLOCK_SIZE_N": 64,
      "num_warps": 1,
      "num_stages": 1,
      "waves_per_eu": 4,
      "stage": 2
    },
    "219": {
      "BLOCK_SIZE_M": 64,
      "BLOCK_SIZE_N": 64,
      "num_warps": 2,
      "num_stages": 4,
      "waves_per_eu": 1,
      "stage": 4
    },
    "1882": {
      "BLOCK_SIZE_M": 128,
      "BLOCK_SIZE_N": 64,
      "num_warps": 1,
      "num_stages": 4,
      "waves_per_eu": 4,
      "stage": 5
    },
    "3475": {
      "BLOCK_SIZE_M": 128,
      "BLOCK_SIZE_N": 256,
      "num_warps": 8,
      "num_stages": 1,
      "waves_per_eu": 8,
      "stage": 2
    },
    "2860": {
      "BLOCK_SIZE_M": 128,
      "BLOCK_SIZE_N": 128,
      "num_warps": 8,
      "num_stages": 1,
      "waves_per_eu": 1,
      "stage": 5
    },
    "808": {
      "BLOCK_SIZE_M": 64,
      "BLOCK_SIZE_N": 128,
      "num_warps": 2,
      "num_stages": 2,
      "waves_per_eu": 8,
      "stage": 5
    },
    "3763": {
      "BLOCK_SIZE_M": 256,
      "BLOCK_SIZE_N": 64,
      "num_warps": 2,
      "num_stages": 1,
      "waves_per_eu": 2,
      "stage": 2
    },
    "2001": {
      "BLOCK_SIZE_M": 128,
      "BLOCK_SIZE_N": 64,
      "num_warps": 2,
      "num_stages": 2,
      "waves_per_eu": 4,
      "stage": 4
    },
    "3300": {
      "BLOCK_SIZE_M": 128,
      "BLOCK_SIZE_N": 256,
      "num_warps": 4,
      "num_stages": 1,
      "waves_per_eu": 0,
      "stage": 1
    },
    "825": {
      "BLOCK_SIZE_M": 64,
      "BLOCK_SIZE_N": 128,
      "num_warps": 2,
      "num_stages": 4,
      "waves_per_eu": 2,
      "stage": 4
    },
    "1519": {
      "BLOCK_SIZE_M": 64,
      "BLOCK_SIZE_N": 256,
      "num_warps": 4,
      "num_stages": 1,
      "waves_per_eu": 4,
      "stage": 2
    },
    "4973": {
      "BLOCK_SIZE_M": 256,
      "BLOCK_SIZE_N": 256,
      "num_warps": 2,
      "num_stages": 1,
      "waves_per_eu": 4,
      "stage": 6
    },
    "5118": {
      "BLOCK_SIZE_M": 256,
      "BLOCK_SIZE_N": 256,
      "num_warps": 4,
      "num_stages": 1,
      "waves_per_eu": 4,
      "stage": 1
    },
    "3682": {
      "BLOCK_SIZE_M": 256,
      "BLOCK_SIZE_N": 64,
      "num_warps": 1,
      "num_stages": 4,
      "waves_per_eu": 4,
      "stage": 5
    },
    "831": {
      "BLOCK_SIZE_M": 64,
      "BLOCK_SIZE_N": 128,
      "num_warps": 2,
      "num_stages": 4,
      "waves_per_eu": 4,
      "stage": 4
    },
    "2137": {
      "BLOCK_SIZE_M": 128,
      "BLOCK_SIZE_N": 64,
      "num_warps": 4,
      "num_stages": 2,
      "waves_per_eu": 1,
      "stage": 2
    },
    "3821": {
      "BLOCK_SIZE_M": 256,
      "BLOCK_SIZE_N": 64,
      "num_warps": 2,
      "num_stages": 4,
      "waves_per_eu": 1,
      "stage": 6
    },
    "4528": {
      "BLOCK_SIZE_M": 256,
      "BLOCK_SIZE_N": 128,
      "num_warps": 4,
      "num_stages": 1,
      "waves_per_eu": 8,
      "stage": 5
    },
    "3777": {
      "BLOCK_SIZE_M": 256,
      "BLOCK_SIZE_N": 64,
      "num_warps": 2,
      "num_stages": 1,
      "waves_per_eu": 8,
      "stage": 4
    },
    "2872": {
      "BLOCK_SIZE_M": 128,
      "BLOCK_SIZE_N": 128,
      "num_warps": 8,
      "num_stages": 1,
      "waves_per_eu": 4,
      "stage": 5
    },
    "1214": {
      "BLOCK_SIZE_M": 64,
      "BLOCK_SIZE_N": 256,
      "num_warps": 1,
      "num_stages": 1,
      "waves_per_eu": 2,
      "stage": 3
    },
    "4267": {
      "BLOCK_SIZE_M": 256,
      "BLOCK_SIZE_N": 128,
      "num_warps": 1,
      "num_stages": 4,
      "waves_per_eu": 1,
      "stage": 2
    },
    "15": {
      "BLOCK_SIZE_M": 64,
      "BLOCK_SIZE_N": 64,
      "num_warps": 1,
      "num_stages": 1,
      "waves_per_eu": 2,
      "stage": 4
    },
    "4077": {
      "BLOCK_SIZE_M": 256,
      "BLOCK_SIZE_N": 64,
      "num_warps": 8,
      "num_stages": 1,
      "waves_per_eu": 8,
      "stage": 4
    },
    "2760": {
      "BLOCK_SIZE_M": 128,
      "BLOCK_SIZE_N": 128,
      "num_warps": 4,
      "num_stages": 4,
      "waves_per_eu": 0,
      "stage": 1
    },
    "505": {
      "BLOCK_SIZE_M": 64,
      "BLOCK_SIZE_N": 64,
      "num_warps": 8,
      "num_stages": 2,
      "waves_per_eu": 8,
      "stage": 2
    },
    "814": {
      "BLOCK_SIZE_M": 64,
      "BLOCK_SIZE_N": 128,
      "num_warps": 2,
      "num_stages": 4,
      "waves_per_eu": 0,
      "stage": 5
    },
    "4066": {
      "BLOCK_SIZE_M": 256,
      "BLOCK_SIZE_N": 64,
      "num_warps": 8,
      "num_stages": 1,
      "waves_per_eu": 2,
      "stage": 5
    },
    "4951": {
      "BLOCK_SIZE_M": 256,
      "BLOCK_SIZE_N": 256,
      "num_warps": 2,
      "num_stages": 1,
      "waves_per_eu": 0,
      "stage": 2
    },
    "2264": {
      "BLOCK_SIZE_M": 128,
      "BLOCK_SIZE_N": 64,
      "num_warps": 8,
      "num_stages": 1,
      "waves_per_eu": 2,
      "stage": 3
    },
    "4395": {
      "BLOCK_SIZE_M": 256,
      "BLOCK_SIZE_N": 128,
      "num_warps": 2,
      "num_stages": 2,
      "waves_per_eu": 2,
      "stage": 4
    },
    "1094": {
      "BLOCK_SIZE_M": 64,
      "BLOCK_SIZE_N": 128,
      "num_warps": 8,
      "num_stages": 2,
      "waves_per_eu": 2,
      "stage": 3
    },
    "4398": {
      "BLOCK_SIZE_M": 256,
      "BLOCK_SIZE_N": 128,
      "num_warps": 2,
      "num_stages": 2,
      "waves_per_eu": 4,
      "stage": 1
    },
    "4078": {
      "BLOCK_SIZE_M": 256,
      "BLOCK_SIZE_N": 64,
      "num_warps": 8,
      "num_stages": 1,
      "waves_per_eu": 8,
      "stage": 5
    },
    "1865": {
      "BLOCK_SIZE_M": 128,
      "BLOCK_SIZE_N": 64,
      "num_warps": 1,
      "num_stages": 4,
      "waves_per_eu": 0,
      "stage": 6
    },
    "1089": {
      "BLOCK_SIZE_M": 64,
      "BLOCK_SIZE_N": 128,
      "num_warps": 8,
      "num_stages": 2,
      "waves_per_eu": 1,
      "stage": 4
    },
    "3305": {
      "BLOCK_SIZE_M": 128,
      "BLOCK_SIZE_N": 256,
      "num_warps": 4,
      "num_stages": 1,
      "waves_per_eu": 0,
      "stage": 6
    },
    "1223": {
      "BLOCK_SIZE_M": 64,
      "BLOCK_SIZE_N": 256,
      "num_warps": 1,
      "num_stages": 1,
      "waves_per_eu": 4,
      "stage": 6
    },
    "2870": {
      "BLOCK_SIZE_M": 128,
      "BLOCK_SIZE_N": 128,
      "num_warps": 8,
      "num_stages": 1,
      "waves_per_eu": 4,
      "stage": 3
    },
    "3661": {
      "BLOCK_SIZE_M": 256,
      "BLOCK_SIZE_N": 64,
      "num_warps": 1,
      "num_stages": 4,
      "waves_per_eu": 0,
      "stage": 2
    },
    "4437": {
      "BLOCK_SIZE_M": 256,
      "BLOCK_SIZE_N": 128,
      "num_warps": 2,
      "num_stages": 4,
      "waves_per_eu": 8,
      "stage": 4
    },
    "211": {
      "BLOCK_SIZE_M": 64,
      "BLOCK_SIZE_N": 64,
      "num_warps": 2,
      "num_stages": 4,
      "waves_per_eu": 0,
      "stage": 2
    },
    "333": {
      "BLOCK_SIZE_M": 64,
      "BLOCK_SIZE_N": 64,
      "num_warps": 4,
      "num_stages": 2,
      "waves_per_eu": 0,
      "stage": 4
    },
    "4253": {
      "BLOCK_SIZE_M": 256,
      "BLOCK_SIZE_N": 128,
      "num_warps": 1,
      "num_stages": 2,
      "waves_per_eu": 4,
      "stage": 6
    },
    "2591": {
      "BLOCK_SIZE_M": 128,
      "BLOCK_SIZE_N": 128,
      "num_warps": 2,
      "num_stages": 2,
      "waves_per_eu": 1,
      "stage": 6
    },
    "2617": {
      "BLOCK_SIZE_M": 128,
      "BLOCK_SIZE_N": 128,
      "num_warps": 2,
      "num_stages": 4,
      "waves_per_eu": 1,
      "stage": 2
    },
    "182": {
      "BLOCK_SIZE_M": 64,
      "BLOCK_SIZE_N": 64,
      "num_warps": 2,
      "num_stages": 2,
      "waves_per_eu": 0,
      "stage": 3
    },
    "1063": {
      "BLOCK_SIZE_M": 64,
      "BLOCK_SIZE_N": 128,
      "num_warps": 8,
      "num_stages": 1,
      "waves_per_eu": 2,
      "stage": 2
    },
    "4100": {
      "BLOCK_SIZE_M": 256,
      "BLOCK_SIZE_N": 64,
      "num_warps": 8,
      "num_stages": 2,
      "waves_per_eu": 4,
      "stage": 3
    },
    "2339": {
      "BLOCK_SIZE_M": 128,
      "BLOCK_SIZE_N": 64,
      "num_warps": 8,
      "num_stages": 4,
      "waves_per_eu": 8,
      "stage": 6
    },
    "205": {
      "BLOCK_SIZE_M": 64,
      "BLOCK_SIZE_N": 64,
      "num_warps": 2,
      "num_stages": 2,
      "waves_per_eu": 8,
      "stage": 2
    },
    "815": {
      "BLOCK_SIZE_M": 64,
      "BLOCK_SIZE_N": 128,
      "num_warps": 2,
      "num_stages": 4,
      "waves_per_eu": 0,
      "stage": 6
    },
    "4506": {
      "BLOCK_SIZE_M": 256,
      "BLOCK_SIZE_N": 128,
      "num_warps": 4,
      "num_stages": 1,
      "waves_per_eu": 1,
      "stage": 1
    },
    "5109": {
      "BLOCK_SIZE_M": 256,
      "BLOCK_SIZE_N": 256,
      "num_warps": 4,
      "num_stages": 1,
      "waves_per_eu": 1,
      "stage": 4
    },
    "4106": {
      "BLOCK_SIZE_M": 256,
      "BLOCK_SIZE_N": 64,
      "num_warps": 8,
      "num_stages": 2,
      "waves_per_eu": 8,
      "stage": 3
    },
    "668": {
      "BLOCK_SIZE_M": 64,
      "BLOCK_SIZE_N": 128,
      "num_warps": 1,
      "num_stages": 4,
      "waves_per_eu": 1,
      "stage": 3
    },
    "4119": {
      "BLOCK_SIZE_M": 256,
      "BLOCK_SIZE_N": 64,
      "num_warps": 8,
      "num_stages": 4,
      "waves_per_eu": 1,
      "stage": 4
    },
    "76": {
      "BLOCK_SIZE_M": 64,
      "BLOCK_SIZE_N": 64,
      "num_warps": 1,
      "num_stages": 4,
      "waves_per_eu": 2,
      "stage": 5
    },
    "2789": {
      "BLOCK_SIZE_M": 128,
      "BLOCK_SIZE_N": 128,
      "num_warps": 4,
      "num_stages": 4,
      "waves_per_eu": 8,
      "stage": 6
    },
    "4573": {
      "BLOCK_SIZE_M": 256,
      "BLOCK_SIZE_N": 128,
      "num_warps": 4,
      "num_stages": 4,
      "waves_per_eu": 2,
      "stage": 2
    },
    "1830": {
      "BLOCK_SIZE_M": 128,
      "BLOCK_SIZE_N": 64,
      "num_warps": 1,
      "num_stages": 2,
      "waves_per_eu": 0,
      "stage": 1
    },
    "1852": {
      "BLOCK_SIZE_M": 128,
      "BLOCK_SIZE_N": 64,
      "num_warps": 1,
      "num_stages": 2,
      "waves_per_eu": 4,
      "stage": 5
    },
    "2115": {
      "BLOCK_SIZE_M": 128,
      "BLOCK_SIZE_N": 64,
      "num_warps": 4,
      "num_stages": 1,
      "waves_per_eu": 2,
      "stage": 4
    },
    "2168": {
      "BLOCK_SIZE_M": 128,
      "BLOCK_SIZE_N": 64,
      "num_warps": 4,
      "num_stages": 4,
      "waves_per_eu": 1,
      "stage": 3
    },
    "351": {
      "BLOCK_SIZE_M": 64,
      "BLOCK_SIZE_N": 64,
      "num_warps": 4,
      "num_stages": 2,
      "waves_per_eu": 4,
      "stage": 4
    },
    "2785": {
      "BLOCK_SIZE_M": 128,
      "BLOCK_SIZE_N": 128,
      "num_warps": 4,
      "num_stages": 4,
      "waves_per_eu": 8,
      "stage": 2
    },
    "484": {
      "BLOCK_SIZE_M": 64,
      "BLOCK_SIZE_N": 64,
      "num_warps": 8,
      "num_stages": 2,
      "waves_per_eu": 0,
      "stage": 5
    },
    "4431": {
      "BLOCK_SIZE_M": 256,
      "BLOCK_SIZE_N": 128,
      "num_warps": 2,
      "num_stages": 4,
      "waves_per_eu": 4,
      "stage": 4
    },
    "2443": {
      "BLOCK_SIZE_M": 128,
      "BLOCK_SIZE_N": 128,
      "num_warps": 1,
      "num_stages": 2,
      "waves_per_eu": 2,
      "stage": 2
    },
    "1215": {
      "BLOCK_SIZE_M": 64,
      "BLOCK_SIZE_N": 256,
      "num_warps": 1,
      "num_stages": 1,
      "waves_per_eu": 2,
      "stage": 4
    },
    "2628": {
      "BLOCK_SIZE_M": 128,
      "BLOCK_SIZE_N": 128,
      "num_warps": 2,
      "num_stages": 4,
      "waves_per_eu": 4,
      "stage": 1
    },
    "1954": {
      "BLOCK_SIZE_M": 128,
      "BLOCK_SIZE_N": 64,
      "num_warps": 2,
      "num_stages": 1,
      "waves_per_eu": 0,
      "stage": 5
    },
    "376": {
      "BLOCK_SIZE_M": 64,
      "BLOCK_SIZE_N": 64,
      "num_warps": 4,
      "num_stages": 4,
      "waves_per_eu": 2,
      "stage": 5
    },
    "1956": {
      "BLOCK_SIZE_M": 128,
      "BLOCK_SIZE_N": 64,
      "num_warps": 2,
      "num_stages": 1,
      "waves_per_eu": 1,
      "stage": 1
    },
    "1369": {
      "BLOCK_SIZE_M": 64,
      "BLOCK_SIZE_N": 256,
      "num_warps": 2,
      "num_stages": 1,
      "waves_per_eu": 4,
      "stage": 2
    },
    "1109": {
      "BLOCK_SIZE_M": 64,
      "BLOCK_SIZE_N": 128,
      "num_warps": 8,
      "num_stages": 2,
      "waves_per_eu": 8,
      "stage": 6
    },
    "4205": {
      "BLOCK_SIZE_M": 256,
      "BLOCK_SIZE_N": 128,
      "num_warps": 1,
      "num_stages": 1,
      "waves_per_eu": 0,
      "stage": 6
    },
    "4682": {
      "BLOCK_SIZE_M": 256,
      "BLOCK_SIZE_N": 128,
      "num_warps": 8,
      "num_stages": 2,
      "waves_per_eu": 0,
      "stage": 3
    },
    "4087": {
      "BLOCK_SIZE_M": 256,
      "BLOCK_SIZE_N": 64,
      "num_warps": 8,
      "num_stages": 2,
      "waves_per_eu": 1,
      "stage": 2
    },
    "4417": {
      "BLOCK_SIZE_M": 256,
      "BLOCK_SIZE_N": 128,
      "num_warps": 2,
      "num_stages": 4,
      "waves_per_eu": 1,
      "stage": 2
    },
    "5261": {
      "BLOCK_SIZE_M": 256,
      "BLOCK_SIZE_N": 256,
      "num_warps": 8,
      "num_stages": 1,
      "waves_per_eu": 1,
      "stage": 6
    },
    "2762": {
      "BLOCK_SIZE_M": 128,
      "BLOCK_SIZE_N": 128,
      "num_warps": 4,
      "num_stages": 4,
      "waves_per_eu": 0,
      "stage": 3
    },
    "4586": {
      "BLOCK_SIZE_M": 256,
      "BLOCK_SIZE_N": 128,
      "num_warps": 4,
      "num_stages": 4,
      "waves_per_eu": 8,
      "stage": 3
    },
    "4224": {
      "BLOCK_SIZE_M": 256,
      "BLOCK_SIZE_N": 128,
      "num_warps": 1,
      "num_stages": 1,
      "waves_per_eu": 8,
      "stage": 1
    },
    "4088": {
      "BLOCK_SIZE_M": 256,
      "BLOCK_SIZE_N": 64,
      "num_warps": 8,
      "num_stages": 2,
      "waves_per_eu": 1,
      "stage": 3
    },
    "5121": {
      "BLOCK_SIZE_M": 256,
      "BLOCK_SIZE_N": 256,
      "num_warps": 4,
      "num_stages": 1,
      "waves_per_eu": 4,
      "stage": 4
    },
    "2158": {
      "BLOCK_SIZE_M": 128,
      "BLOCK_SIZE_N": 64,
      "num_warps": 4,
      "num_stages": 2,
      "waves_per_eu": 8,
      "stage": 5
    },
    "929": {
      "BLOCK_SIZE_M": 64,
      "BLOCK_SIZE_N": 128,
      "num_warps": 4,
      "num_stages": 1,
      "waves_per_eu": 8,
      "stage": 6
    },
    "983": {
      "BLOCK_SIZE_M": 64,
      "BLOCK_SIZE_N": 128,
      "num_warps": 4,
      "num_stages": 4,
      "waves_per_eu": 4,
      "stage": 6
    },
    "1804": {
      "BLOCK_SIZE_M": 128,
      "BLOCK_SIZE_N": 64,
      "num_warps": 1,
      "num_stages": 1,
      "waves_per_eu": 0,
      "stage": 5
    },
    "4396": {
      "BLOCK_SIZE_M": 256,
      "BLOCK_SIZE_N": 128,
      "num_warps": 2,
      "num_stages": 2,
      "waves_per_eu": 2,
      "stage": 5
    },
    "4137": {
      "BLOCK_SIZE_M": 256,
      "BLOCK_SIZE_N": 64,
      "num_warps": 8,
      "num_stages": 4,
      "waves_per_eu": 8,
      "stage": 4
    },
    "2039": {
      "BLOCK_SIZE_M": 128,
      "BLOCK_SIZE_N": 64,
      "num_warps": 2,
      "num_stages": 4,
      "waves_per_eu": 8,
      "stage": 6
    },
    "3613": {
      "BLOCK_SIZE_M": 256,
      "BLOCK_SIZE_N": 64,
      "num_warps": 1,
      "num_stages": 1,
      "waves_per_eu": 2,
      "stage": 2
    },
    "3457": {
      "BLOCK_SIZE_M": 128,
      "BLOCK_SIZE_N": 256,
      "num_warps": 8,
      "num_stages": 1,
      "waves_per_eu": 1,
      "stage": 2
    },
    "2607": {
      "BLOCK_SIZE_M": 128,
      "BLOCK_SIZE_N": 128,
      "num_warps": 2,
      "num_stages": 2,
      "waves_per_eu": 8,
      "stage": 4
    },
    "198": {
      "BLOCK_SIZE_M": 64,
      "BLOCK_SIZE_N": 64,
      "num_warps": 2,
      "num_stages": 2,
      "waves_per_eu": 4,
      "stage": 1
    },
    "1974": {
      "BLOCK_SIZE_M": 128,
      "BLOCK_SIZE_N": 64,
      "num_warps": 2,
      "num_stages": 1,
      "waves_per_eu": 8,
      "stage": 1
    },
    "631": {
      "BLOCK_SIZE_M": 64,
      "BLOCK_SIZE_N": 128,
      "num_warps": 1,
      "num_stages": 2,
      "waves_per_eu": 0,
      "stage": 2
    },
    "329": {
      "BLOCK_SIZE_M": 64,
      "BLOCK_SIZE_N": 64,
      "num_warps": 4,
      "num_stages": 1,
      "waves_per_eu": 8,
      "stage": 6
    },
    "657": {
      "BLOCK_SIZE_M": 64,
      "BLOCK_SIZE_N": 128,
      "num_warps": 1,
      "num_stages": 2,
      "waves_per_eu": 8,
      "stage": 4
    },
    "3834": {
      "BLOCK_SIZE_M": 256,
      "BLOCK_SIZE_N": 64,
      "num_warps": 2,
      "num_stages": 4,
      "waves_per_eu": 8,
      "stage": 1
    },
    "322": {
      "BLOCK_SIZE_M": 64,
      "BLOCK_SIZE_N": 64,
      "num_warps": 4,
      "num_stages": 1,
      "waves_per_eu": 4,
      "stage": 5
    },
    "1372": {
      "BLOCK_SIZE_M": 64,
      "BLOCK_SIZE_N": 256,
      "num_warps": 2,
      "num_stages": 1,
      "waves_per_eu": 4,
      "stage": 5
    },
    "3021": {
      "BLOCK_SIZE_M": 128,
      "BLOCK_SIZE_N": 256,
      "num_warps": 1,
      "num_stages": 1,
      "waves_per_eu": 4,
      "stage": 4
    },
    "4553": {
      "BLOCK_SIZE_M": 256,
      "BLOCK_SIZE_N": 128,
      "num_warps": 4,
      "num_stages": 2,
      "waves_per_eu": 4,
      "stage": 6
    },
    "3900": {
      "BLOCK_SIZE_M": 256,
      "BLOCK_SIZE_N": 64,
      "num_warps": 4,
      "num_stages": 1,
      "waves_per_eu": 0,
      "stage": 1
    },
    "4568": {
      "BLOCK_SIZE_M": 256,
      "BLOCK_SIZE_N": 128,
      "num_warps": 4,
      "num_stages": 4,
      "waves_per_eu": 1,
      "stage": 3
    },
    "2179": {
      "BLOCK_SIZE_M": 128,
      "BLOCK_SIZE_N": 64,
      "num_warps": 4,
      "num_stages": 4,
      "waves_per_eu": 4,
      "stage": 2
    },
    "602": {
      "BLOCK_SIZE_M": 64,
      "BLOCK_SIZE_N": 128,
      "num_warps": 1,
      "num_stages": 1,
      "waves_per_eu": 0,
      "stage": 3
    },
    "4664": {
      "BLOCK_SIZE_M": 256,
      "BLOCK_SIZE_N": 128,
      "num_warps": 8,
      "num_stages": 1,
      "waves_per_eu": 2,
      "stage": 3
    },
    "4266": {
      "BLOCK_SIZE_M": 256,
      "BLOCK_SIZE_N": 128,
      "num_warps": 1,
      "num_stages": 4,
      "waves_per_eu": 1,
      "stage": 1
    },
    "3454": {
      "BLOCK_SIZE_M": 128,
      "BLOCK_SIZE_N": 256,
      "num_warps": 8,
      "num_stages": 1,
      "waves_per_eu": 0,
      "stage": 5
    },
    "3816": {
      "BLOCK_SIZE_M": 256,
      "BLOCK_SIZE_N": 64,
      "num_warps": 2,
      "num_stages": 4,
      "waves_per_eu": 1,
      "stage": 1
    },
    "338": {
      "BLOCK_SIZE_M": 64,
      "BLOCK_SIZE_N": 64,
      "num_warps": 4,
      "num_stages": 2,
      "waves_per_eu": 1,
      "stage": 3
    },
    "2301": {
      "BLOCK_SIZE_M": 128,
      "BLOCK_SIZE_N": 64,
      "num_warps": 8,
      "num_stages": 2,
      "waves_per_eu": 4,
      "stage": 4
    },
    "2579": {
      "BLOCK_SIZE_M": 128,
      "BLOCK_SIZE_N": 128,
      "num_warps": 2,
      "num_stages": 1,
      "waves_per_eu": 8,
      "stage": 6
    },
    "4514": {
      "BLOCK_SIZE_M": 256,
      "BLOCK_SIZE_N": 128,
      "num_warps": 4,
      "num_stages": 1,
      "waves_per_eu": 2,
      "stage": 3
    },
    "909": {
      "BLOCK_SIZE_M": 64,
      "BLOCK_SIZE_N": 128,
      "num_warps": 4,
      "num_stages": 1,
      "waves_per_eu": 1,
      "stage": 4
    },
    "2310": {
      "BLOCK_SIZE_M": 128,
      "BLOCK_SIZE_N": 64,
      "num_warps": 8,
      "num_stages": 4,
      "waves_per_eu": 0,
      "stage": 1
    },
    "3158": {
      "BLOCK_SIZE_M": 128,
      "BLOCK_SIZE_N": 256,
      "num_warps": 2,
      "num_stages": 1,
      "waves_per_eu": 1,
      "stage": 3
    },
    "535": {
      "BLOCK_SIZE_M": 64,
      "BLOCK_SIZE_N": 64,
      "num_warps": 8,
      "num_stages": 4,
      "waves_per_eu": 8,
      "stage": 2
    },
    "5255": {
      "BLOCK_SIZE_M": 256,
      "BLOCK_SIZE_N": 256,
      "num_warps": 8,
      "num_stages": 1,
      "waves_per_eu": 0,
      "stage": 6
    },
    "3600": {
      "BLOCK_SIZE_M": 256,
      "BLOCK_SIZE_N": 64,
      "num_warps": 1,
      "num_stages": 1,
      "waves_per_eu": 0,
      "stage": 1
    },
    "381": {
      "BLOCK_SIZE_M": 64,
      "BLOCK_SIZE_N": 64,
      "num_warps": 4,
      "num_stages": 4,
      "waves_per_eu": 4,
      "stage": 4
    },
    "839": {
      "BLOCK_SIZE_M": 64,
      "BLOCK_SIZE_N": 128,
      "num_warps": 2,
      "num_stages": 4,
      "waves_per_eu": 8,
      "stage": 6
    },
    "4974": {
      "BLOCK_SIZE_M": 256,
      "BLOCK_SIZE_N": 256,
      "num_warps": 2,
      "num_stages": 1,
      "waves_per_eu": 8,
      "stage": 1
    },
    "2417": {
      "BLOCK_SIZE_M": 128,
      "BLOCK_SIZE_N": 128,
      "num_warps": 1,
      "num_stages": 1,
      "waves_per_eu": 2,
      "stage": 6
    },
    "1824": {
      "BLOCK_SIZE_M": 128,
      "BLOCK_SIZE_N": 64,
      "num_warps": 1,
      "num_stages": 1,
      "waves_per_eu": 8,
      "stage": 1
    },
    "1368": {
      "BLOCK_SIZE_M": 64,
      "BLOCK_SIZE_N": 256,
      "num_warps": 2,
      "num_stages": 1,
      "waves_per_eu": 4,
      "stage": 1
    },
    "4373": {
      "BLOCK_SIZE_M": 256,
      "BLOCK_SIZE_N": 128,
      "num_warps": 2,
      "num_stages": 1,
      "waves_per_eu": 4,
      "stage": 6
    },
    "776": {
      "BLOCK_SIZE_M": 64,
      "BLOCK_SIZE_N": 128,
      "num_warps": 2,
      "num_stages": 1,
      "waves_per_eu": 8,
      "stage": 3
    },
    "2442": {
      "BLOCK_SIZE_M": 128,
      "BLOCK_SIZE_N": 128,
      "num_warps": 1,
      "num_stages": 2,
      "waves_per_eu": 2,
      "stage": 1
    },
    "2714": {
      "BLOCK_SIZE_M": 128,
      "BLOCK_SIZE_N": 128,
      "num_warps": 4,
      "num_stages": 1,
      "waves_per_eu": 2,
      "stage": 3
    },
    "504": {
      "BLOCK_SIZE_M": 64,
      "BLOCK_SIZE_N": 64,
      "num_warps": 8,
      "num_stages": 2,
      "waves_per_eu": 8,
      "stage": 1
    },
    "4109": {
      "BLOCK_SIZE_M": 256,
      "BLOCK_SIZE_N": 64,
      "num_warps": 8,
      "num_stages": 2,
      "waves_per_eu": 8,
      "stage": 6
    },
    "159": {
      "BLOCK_SIZE_M": 64,
      "BLOCK_SIZE_N": 64,
      "num_warps": 2,
      "num_stages": 1,
      "waves_per_eu": 1,
      "stage": 4
    },
    "4236": {
      "BLOCK_SIZE_M": 256,
      "BLOCK_SIZE_N": 128,
      "num_warps": 1,
      "num_stages": 2,
      "waves_per_eu": 1,
      "stage": 1
    },
    "3603": {
      "BLOCK_SIZE_M": 256,
      "BLOCK_SIZE_N": 64,
      "num_warps": 1,
      "num_stages": 1,
      "waves_per_eu": 0,
      "stage": 4
    },
    "2867": {
      "BLOCK_SIZE_M": 128,
      "BLOCK_SIZE_N": 128,
      "num_warps": 8,
      "num_stages": 1,
      "waves_per_eu": 2,
      "stage": 6
    },
    "4674": {
      "BLOCK_SIZE_M": 256,
      "BLOCK_SIZE_N": 128,
      "num_warps": 8,
      "num_stages": 1,
      "waves_per_eu": 8,
      "stage": 1
    },
    "4577": {
      "BLOCK_SIZE_M": 256,
      "BLOCK_SIZE_N": 128,
      "num_warps": 4,
      "num_stages": 4,
      "waves_per_eu": 2,
      "stage": 6
    },
    "762": {
      "BLOCK_SIZE_M": 64,
      "BLOCK_SIZE_N": 128,
      "num_warps": 2,
      "num_stages": 1,
      "waves_per_eu": 2,
      "stage": 1
    },
    "4544": {
      "BLOCK_SIZE_M": 256,
      "BLOCK_SIZE_N": 128,
      "num_warps": 4,
      "num_stages": 2,
      "waves_per_eu": 2,
      "stage": 3
    },
    "750": {
      "BLOCK_SIZE_M": 64,
      "BLOCK_SIZE_N": 128,
      "num_warps": 2,
      "num_stages": 1,
      "waves_per_eu": 0,
      "stage": 1
    },
    "4263": {
      "BLOCK_SIZE_M": 256,
      "BLOCK_SIZE_N": 128,
      "num_warps": 1,
      "num_stages": 4,
      "waves_per_eu": 0,
      "stage": 4
    },
    "4433": {
      "BLOCK_SIZE_M": 256,
      "BLOCK_SIZE_N": 128,
      "num_warps": 2,
      "num_stages": 4,
      "waves_per_eu": 4,
      "stage": 6
    },
    "2028": {
      "BLOCK_SIZE_M": 128,
      "BLOCK_SIZE_N": 64,
      "num_warps": 2,
      "num_stages": 4,
      "waves_per_eu": 4,
      "stage": 1
    },
    "194": {
      "BLOCK_SIZE_M": 64,
      "BLOCK_SIZE_N": 64,
      "num_warps": 2,
      "num_stages": 2,
      "waves_per_eu": 2,
      "stage": 3
    },
    "61": {
      "BLOCK_SIZE_M": 64,
      "BLOCK_SIZE_N": 64,
      "num_warps": 1,
      "num_stages": 4,
      "waves_per_eu": 0,
      "stage": 2
    },
    "51": {
      "BLOCK_SIZE_M": 64,
      "BLOCK_SIZE_N": 64,
      "num_warps": 1,
      "num_stages": 2,
      "waves_per_eu": 4,
      "stage": 4
    },
    "833": {
      "BLOCK_SIZE_M": 64,
      "BLOCK_SIZE_N": 128,
      "num_warps": 2,
      "num_stages": 4,
      "waves_per_eu": 4,
      "stage": 6
    },
    "4521": {
      "BLOCK_SIZE_M": 256,
      "BLOCK_SIZE_N": 128,
      "num_warps": 4,
      "num_stages": 1,
      "waves_per_eu": 4,
      "stage": 4
    },
    "4705": {
      "BLOCK_SIZE_M": 256,
      "BLOCK_SIZE_N": 128,
      "num_warps": 8,
      "num_stages": 2,
      "waves_per_eu": 8,
      "stage": 2
    },
    "1211": {
      "BLOCK_SIZE_M": 64,
      "BLOCK_SIZE_N": 256,
      "num_warps": 1,
      "num_stages": 1,
      "waves_per_eu": 1,
      "stage": 6
    },
    "1500": {
      "BLOCK_SIZE_M": 64,
      "BLOCK_SIZE_N": 256,
      "num_warps": 4,
      "num_stages": 1,
      "waves_per_eu": 0,
      "stage": 1
    },
    "2759": {
      "BLOCK_SIZE_M": 128,
      "BLOCK_SIZE_N": 128,
      "num_warps": 4,
      "num_stages": 2,
      "waves_per_eu": 8,
      "stage": 6
    },
    "2726": {
      "BLOCK_SIZE_M": 128,
      "BLOCK_SIZE_N": 128,
      "num_warps": 4,
      "num_stages": 1,
      "waves_per_eu": 8,
      "stage": 3
    },
    "908": {
      "BLOCK_SIZE_M": 64,
      "BLOCK_SIZE_N": 128,
      "num_warps": 4,
      "num_stages": 1,
      "waves_per_eu": 1,
      "stage": 3
    },
    "2116": {
      "BLOCK_SIZE_M": 128,
      "BLOCK_SIZE_N": 64,
      "num_warps": 4,
      "num_stages": 1,
      "waves_per_eu": 2,
      "stage": 5
    },
    "2787": {
      "BLOCK_SIZE_M": 128,
      "BLOCK_SIZE_N": 128,
      "num_warps": 4,
      "num_stages": 4,
      "waves_per_eu": 8,
      "stage": 4
    },
    "4524": {
      "BLOCK_SIZE_M": 256,
      "BLOCK_SIZE_N": 128,
      "num_warps": 4,
      "num_stages": 1,
      "waves_per_eu": 8,
      "stage": 1
    },
    "689": {
      "BLOCK_SIZE_M": 64,
      "BLOCK_SIZE_N": 128,
      "num_warps": 1,
      "num_stages": 4,
      "waves_per_eu": 8,
      "stage": 6
    },
    "453": {
      "BLOCK_SIZE_M": 64,
      "BLOCK_SIZE_N": 64,
      "num_warps": 8,
      "num_stages": 1,
      "waves_per_eu": 0,
      "stage": 4
    },
    "2578": {
      "BLOCK_SIZE_M": 128,
      "BLOCK_SIZE_N": 128,
      "num_warps": 2,
      "num_stages": 1,
      "waves_per_eu": 8,
      "stage": 5
    },
    "2306": {
      "BLOCK_SIZE_M": 128,
      "BLOCK_SIZE_N": 64,
      "num_warps": 8,
      "num_stages": 2,
      "waves_per_eu": 8,
      "stage": 3
    },
    "4533": {
      "BLOCK_SIZE_M": 256,
      "BLOCK_SIZE_N": 128,
      "num_warps": 4,
      "num_stages": 2,
      "waves_per_eu": 0,
      "stage": 4
    },
    "3839": {
      "BLOCK_SIZE_M": 256,
      "BLOCK_SIZE_N": 64,
      "num_warps": 2,
      "num_stages": 4,
      "waves_per_eu": 8,
      "stage": 6
    },
    "4256": {
      "BLOCK_SIZE_M": 256,
      "BLOCK_SIZE_N": 128,
      "num_warps": 1,
      "num_stages": 2,
      "waves_per_eu": 8,
      "stage": 3
    },
    "2261": {
      "BLOCK_SIZE_M": 128,
      "BLOCK_SIZE_N": 64,
      "num_warps": 8,
      "num_stages": 1,
      "waves_per_eu": 1,
      "stage": 6
    },
    "4530": {
      "BLOCK_SIZE_M": 256,
      "BLOCK_SIZE_N": 128,
      "num_warps": 4,
      "num_stages": 2,
      "waves_per_eu": 0,
      "stage": 1
    },
    "1207": {
      "BLOCK_SIZE_M": 64,
      "BLOCK_SIZE_N": 256,
      "num_warps": 1,
      "num_stages": 1,
      "waves_per_eu": 1,
      "stage": 2
    },
    "3687": {
      "BLOCK_SIZE_M": 256,
      "BLOCK_SIZE_N": 64,
      "num_warps": 1,
      "num_stages": 4,
      "waves_per_eu": 8,
      "stage": 4
    },
    "2453": {
      "BLOCK_SIZE_M": 128,
      "BLOCK_SIZE_N": 128,
      "num_warps": 1,
      "num_stages": 2,
      "waves_per_eu": 4,
      "stage": 6
    },
    "982": {
      "BLOCK_SIZE_M": 64,
      "BLOCK_SIZE_N": 128,
      "num_warps": 4,
      "num_stages": 4,
      "waves_per_eu": 4,
      "stage": 5
    },
    "213": {
      "BLOCK_SIZE_M": 64,
      "BLOCK_SIZE_N": 64,
      "num_warps": 2,
      "num_stages": 4,
      "waves_per_eu": 0,
      "stage": 4
    },
    "3178": {
      "BLOCK_SIZE_M": 128,
      "BLOCK_SIZE_N": 256,
      "num_warps": 2,
      "num_stages": 1,
      "waves_per_eu": 8,
      "stage": 5
    },
    "2154": {
      "BLOCK_SIZE_M": 128,
      "BLOCK_SIZE_N": 64,
      "num_warps": 4,
      "num_stages": 2,
      "waves_per_eu": 8,
      "stage": 1
    },
    "2286": {
      "BLOCK_SIZE_M": 128,
      "BLOCK_SIZE_N": 64,
      "num_warps": 8,
      "num_stages": 2,
      "waves_per_eu": 1,
      "stage": 1
    },
    "795": {
      "BLOCK_SIZE_M": 64,
      "BLOCK_SIZE_N": 128,
      "num_warps": 2,
      "num_stages": 2,
      "waves_per_eu": 2,
      "stage": 4
    },
    "1807": {
      "BLOCK_SIZE_M": 128,
      "BLOCK_SIZE_N": 64,
      "num_warps": 1,
      "num_stages": 1,
      "waves_per_eu": 1,
      "stage": 2
    },
    "3602": {
      "BLOCK_SIZE_M": 256,
      "BLOCK_SIZE_N": 64,
      "num_warps": 1,
      "num_stages": 1,
      "waves_per_eu": 0,
      "stage": 3
    },
    "609": {
      "BLOCK_SIZE_M": 64,
      "BLOCK_SIZE_N": 128,
      "num_warps": 1,
      "num_stages": 1,
      "waves_per_eu": 1,
      "stage": 4
    },
    "4406": {
      "BLOCK_SIZE_M": 256,
      "BLOCK_SIZE_N": 128,
      "num_warps": 2,
      "num_stages": 2,
      "waves_per_eu": 8,
      "stage": 3
    },
    "3913": {
      "BLOCK_SIZE_M": 256,
      "BLOCK_SIZE_N": 64,
      "num_warps": 4,
      "num_stages": 1,
      "waves_per_eu": 2,
      "stage": 2
    },
    "2610": {
      "BLOCK_SIZE_M": 128,
      "BLOCK_SIZE_N": 128,
      "num_warps": 2,
      "num_stages": 4,
      "waves_per_eu": 0,
      "stage": 1
    },
    "4657": {
      "BLOCK_SIZE_M": 256,
      "BLOCK_SIZE_N": 128,
      "num_warps": 8,
      "num_stages": 1,
      "waves_per_eu": 1,
      "stage": 2
    },
    "3461": {
      "BLOCK_SIZE_M": 128,
      "BLOCK_SIZE_N": 256,
      "num_warps": 8,
      "num_stages": 1,
      "waves_per_eu": 1,
      "stage": 6
    },
    "2136": {
      "BLOCK_SIZE_M": 128,
      "BLOCK_SIZE_N": 64,
      "num_warps": 4,
      "num_stages": 2,
      "waves_per_eu": 1,
      "stage": 1
    },
    "1221": {
      "BLOCK_SIZE_M": 64,
      "BLOCK_SIZE_N": 256,
      "num_warps": 1,
      "num_stages": 1,
      "waves_per_eu": 4,
      "stage": 4
    },
    "4689": {
      "BLOCK_SIZE_M": 256,
      "BLOCK_SIZE_N": 128,
      "num_warps": 8,
      "num_stages": 2,
      "waves_per_eu": 1,
      "stage": 4
    },
    "608": {
      "BLOCK_SIZE_M": 64,
      "BLOCK_SIZE_N": 128,
      "num_warps": 1,
      "num_stages": 1,
      "waves_per_eu": 1,
      "stage": 3
    },
    "1672": {
      "BLOCK_SIZE_M": 64,
      "BLOCK_SIZE_N": 256,
      "num_warps": 8,
      "num_stages": 1,
      "waves_per_eu": 4,
      "stage": 5
    },
    "3831": {
      "BLOCK_SIZE_M": 256,
      "BLOCK_SIZE_N": 64,
      "num_warps": 2,
      "num_stages": 4,
      "waves_per_eu": 4,
      "stage": 4
    },
    "4133": {
      "BLOCK_SIZE_M": 256,
      "BLOCK_SIZE_N": 64,
      "num_warps": 8,
      "num_stages": 4,
      "waves_per_eu": 4,
      "stage": 6
    },
    "984": {
      "BLOCK_SIZE_M": 64,
      "BLOCK_SIZE_N": 128,
      "num_warps": 4,
      "num_stages": 4,
      "waves_per_eu": 8,
      "stage": 1
    },
    "3802": {
      "BLOCK_SIZE_M": 256,
      "BLOCK_SIZE_N": 64,
      "num_warps": 2,
      "num_stages": 2,
      "waves_per_eu": 4,
      "stage": 5
    },
    "2700": {
      "BLOCK_SIZE_M": 128,
      "BLOCK_SIZE_N": 128,
      "num_warps": 4,
      "num_stages": 1,
      "waves_per_eu": 0,
      "stage": 1
    },
    "1208": {
      "BLOCK_SIZE_M": 64,
      "BLOCK_SIZE_N": 256,
      "num_warps": 1,
      "num_stages": 1,
      "waves_per_eu": 1,
      "stage": 3
    },
    "2781": {
      "BLOCK_SIZE_M": 128,
      "BLOCK_SIZE_N": 128,
      "num_warps": 4,
      "num_stages": 4,
      "waves_per_eu": 4,
      "stage": 4
    },
    "1669": {
      "BLOCK_SIZE_M": 64,
      "BLOCK_SIZE_N": 256,
      "num_warps": 8,
      "num_stages": 1,
      "waves_per_eu": 4,
      "stage": 2
    },
    "2112": {
      "BLOCK_SIZE_M": 128,
      "BLOCK_SIZE_N": 64,
      "num_warps": 4,
      "num_stages": 1,
      "waves_per_eu": 2,
      "stage": 1
    },
    "905": {
      "BLOCK_SIZE_M": 64,
      "BLOCK_SIZE_N": 128,
      "num_warps": 4,
      "num_stages": 1,
      "waves_per_eu": 0,
      "stage": 6
    },
    "3929": {
      "BLOCK_SIZE_M": 256,
      "BLOCK_SIZE_N": 64,
      "num_warps": 4,
      "num_stages": 1,
      "waves_per_eu": 8,
      "stage": 6
    },
    "1363": {
      "BLOCK_SIZE_M": 64,
      "BLOCK_SIZE_N": 256,
      "num_warps": 2,
      "num_stages": 1,
      "waves_per_eu": 2,
      "stage": 2
    },
    "52": {
      "BLOCK_SIZE_M": 64,
      "BLOCK_SIZE_N": 64,
      "num_warps": 1,
      "num_stages": 2,
      "waves_per_eu": 4,
      "stage": 5
    },
    "3621": {
      "BLOCK_SIZE_M": 256,
      "BLOCK_SIZE_N": 64,
      "num_warps": 1,
      "num_stages": 1,
      "waves_per_eu": 4,
      "stage": 4
    },
    "951": {
      "BLOCK_SIZE_M": 64,
      "BLOCK_SIZE_N": 128,
      "num_warps": 4,
      "num_stages": 2,
      "waves_per_eu": 4,
      "stage": 4
    },
    "4534": {
      "BLOCK_SIZE_M": 256,
      "BLOCK_SIZE_N": 128,
      "num_warps": 4,
      "num_stages": 2,
      "waves_per_eu": 0,
      "stage": 5
    },
    "2573": {
      "BLOCK_SIZE_M": 128,
      "BLOCK_SIZE_N": 128,
      "num_warps": 2,
      "num_stages": 1,
      "waves_per_eu": 4,
      "stage": 6
    },
    "1871": {
      "BLOCK_SIZE_M": 128,
      "BLOCK_SIZE_N": 64,
      "num_warps": 1,
      "num_stages": 4,
      "waves_per_eu": 1,
      "stage": 6
    },
    "2487": {
      "BLOCK_SIZE_M": 128,
      "BLOCK_SIZE_N": 128,
      "num_warps": 1,
      "num_stages": 4,
      "waves_per_eu": 8,
      "stage": 4
    },
    "1861": {
      "BLOCK_SIZE_M": 128,
      "BLOCK_SIZE_N": 64,
      "num_warps": 1,
      "num_stages": 4,
      "waves_per_eu": 0,
      "stage": 2
    },
    "2020": {
      "BLOCK_SIZE_M": 128,
      "BLOCK_SIZE_N": 64,
      "num_warps": 2,
      "num_stages": 4,
      "waves_per_eu": 1,
      "stage": 5
    },
    "474": {
      "BLOCK_SIZE_M": 64,
      "BLOCK_SIZE_N": 64,
      "num_warps": 8,
      "num_stages": 1,
      "waves_per_eu": 8,
      "stage": 1
    },
    "664": {
      "BLOCK_SIZE_M": 64,
      "BLOCK_SIZE_N": 128,
      "num_warps": 1,
      "num_stages": 4,
      "waves_per_eu": 0,
      "stage": 5
    },
    "667": {
      "BLOCK_SIZE_M": 64,
      "BLOCK_SIZE_N": 128,
      "num_warps": 1,
      "num_stages": 4,
      "waves_per_eu": 1,
      "stage": 2
    },
    "206": {
      "BLOCK_SIZE_M": 64,
      "BLOCK_SIZE_N": 64,
      "num_warps": 2,
      "num_stages": 2,
      "waves_per_eu": 8,
      "stage": 3
    },
    "5": {
      "BLOCK_SIZE_M": 64,
      "BLOCK_SIZE_N": 64,
      "num_warps": 1,
      "num_stages": 1,
      "waves_per_eu": 0,
      "stage": 6
    },
    "385": {
      "BLOCK_SIZE_M": 64,
      "BLOCK_SIZE_N": 64,
      "num_warps": 4,
      "num_stages": 4,
      "waves_per_eu": 8,
      "stage": 2
    },
    "3908": {
      "BLOCK_SIZE_M": 256,
      "BLOCK_SIZE_N": 64,
      "num_warps": 4,
      "num_stages": 1,
      "waves_per_eu": 1,
      "stage": 3
    },
    "4371": {
      "BLOCK_SIZE_M": 256,
      "BLOCK_SIZE_N": 128,
      "num_warps": 2,
      "num_stages": 1,
      "waves_per_eu": 4,
      "stage": 4
    },
    "3989": {
      "BLOCK_SIZE_M": 256,
      "BLOCK_SIZE_N": 64,
      "num_warps": 4,
      "num_stages": 4,
      "waves_per_eu": 8,
      "stage": 6
    },
    "1831": {
      "BLOCK_SIZE_M": 128,
      "BLOCK_SIZE_N": 64,
      "num_warps": 1,
      "num_stages": 2,
      "waves_per_eu": 0,
      "stage": 2
    },
    "2452": {
      "BLOCK_SIZE_M": 128,
      "BLOCK_SIZE_N": 128,
      "num_warps": 1,
      "num_stages": 2,
      "waves_per_eu": 4,
      "stage": 5
    },
    "3306": {
      "BLOCK_SIZE_M": 128,
      "BLOCK_SIZE_N": 256,
      "num_warps": 4,
      "num_stages": 1,
      "waves_per_eu": 1,
      "stage": 1
    },
    "58": {
      "BLOCK_SIZE_M": 64,
      "BLOCK_SIZE_N": 64,
      "num_warps": 1,
      "num_stages": 2,
      "waves_per_eu": 8,
      "stage": 5
    },
    "3659": {
      "BLOCK_SIZE_M": 256,
      "BLOCK_SIZE_N": 64,
      "num_warps": 1,
      "num_stages": 2,
      "waves_per_eu": 8,
      "stage": 6
    },
    "611": {
      "BLOCK_SIZE_M": 64,
      "BLOCK_SIZE_N": 128,
      "num_warps": 1,
      "num_stages": 1,
      "waves_per_eu": 1,
      "stage": 6
    },
    "3663": {
      "BLOCK_SIZE_M": 256,
      "BLOCK_SIZE_N": 64,
      "num_warps": 1,
      "num_stages": 4,
      "waves_per_eu": 0,
      "stage": 4
    },
    "500": {
      "BLOCK_SIZE_M": 64,
      "BLOCK_SIZE_N": 64,
      "num_warps": 8,
      "num_stages": 2,
      "waves_per_eu": 4,
      "stage": 3
    },
    "2615": {
      "BLOCK_SIZE_M": 128,
      "BLOCK_SIZE_N": 128,
      "num_warps": 2,
      "num_stages": 4,
      "waves_per_eu": 0,
      "stage": 6
    },
    "80": {
      "BLOCK_SIZE_M": 64,
      "BLOCK_SIZE_N": 64,
      "num_warps": 1,
      "num_stages": 4,
      "waves_per_eu": 4,
      "stage": 3
    },
    "800": {
      "BLOCK_SIZE_M": 64,
      "BLOCK_SIZE_N": 128,
      "num_warps": 2,
      "num_stages": 2,
      "waves_per_eu": 4,
      "stage": 3
    },
    "932": {
      "BLOCK_SIZE_M": 64,
      "BLOCK_SIZE_N": 128,
      "num_warps": 4,
      "num_stages": 2,
      "waves_per_eu": 0,
      "stage": 3
    },
    "662": {
      "BLOCK_SIZE_M": 64,
      "BLOCK_SIZE_N": 128,
      "num_warps": 1,
      "num_stages": 4,
      "waves_per_eu": 0,
      "stage": 3
    },
    "14": {
      "BLOCK_SIZE_M": 64,
      "BLOCK_SIZE_N": 64,
      "num_warps": 1,
      "num_stages": 1,
      "waves_per_eu": 2,
      "stage": 3
    },
    "454": {
      "BLOCK_SIZE_M": 64,
      "BLOCK_SIZE_N": 64,
      "num_warps": 8,
      "num_stages": 1,
      "waves_per_eu": 0,
      "stage": 5
    },
    "4215": {
      "BLOCK_SIZE_M": 256,
      "BLOCK_SIZE_N": 128,
      "num_warps": 1,
      "num_stages": 1,
      "waves_per_eu": 2,
      "stage": 4
    },
    "5257": {
      "BLOCK_SIZE_M": 256,
      "BLOCK_SIZE_N": 256,
      "num_warps": 8,
      "num_stages": 1,
      "waves_per_eu": 1,
      "stage": 2
    },
    "753": {
      "BLOCK_SIZE_M": 64,
      "BLOCK_SIZE_N": 128,
      "num_warps": 2,
      "num_stages": 1,
      "waves_per_eu": 0,
      "stage": 4
    },
    "3955": {
      "BLOCK_SIZE_M": 256,
      "BLOCK_SIZE_N": 64,
      "num_warps": 4,
      "num_stages": 2,
      "waves_per_eu": 8,
      "stage": 2
    },
    "3979": {
      "BLOCK_SIZE_M": 256,
      "BLOCK_SIZE_N": 64,
      "num_warps": 4,
      "num_stages": 4,
      "waves_per_eu": 4,
      "stage": 2
    },
    "78": {
      "BLOCK_SIZE_M": 64,
      "BLOCK_SIZE_N": 64,
      "num_warps": 1,
      "num_stages": 4,
      "waves_per_eu": 4,
      "stage": 1
    },
    "8": {
      "BLOCK_SIZE_M": 64,
      "BLOCK_SIZE_N": 64,
      "num_warps": 1,
      "num_stages": 1,
      "waves_per_eu": 1,
      "stage": 3
    },
    "334": {
      "BLOCK_SIZE_M": 64,
      "BLOCK_SIZE_N": 64,
      "num_warps": 4,
      "num_stages": 2,
      "waves_per_eu": 0,
      "stage": 5
    },
    "3772": {
      "BLOCK_SIZE_M": 256,
      "BLOCK_SIZE_N": 64,
      "num_warps": 2,
      "num_stages": 1,
      "waves_per_eu": 4,
      "stage": 5
    },
    "623": {
      "BLOCK_SIZE_M": 64,
      "BLOCK_SIZE_N": 128,
      "num_warps": 1,
      "num_stages": 1,
      "waves_per_eu": 4,
      "stage": 6
    },
    "4206": {
      "BLOCK_SIZE_M": 256,
      "BLOCK_SIZE_N": 128,
      "num_warps": 1,
      "num_stages": 1,
      "waves_per_eu": 1,
      "stage": 1
    },
    "763": {
      "BLOCK_SIZE_M": 64,
      "BLOCK_SIZE_N": 128,
      "num_warps": 2,
      "num_stages": 1,
      "waves_per_eu": 2,
      "stage": 2
    },
    "624": {
      "BLOCK_SIZE_M": 64,
      "BLOCK_SIZE_N": 128,
      "num_warps": 1,
      "num_stages": 1,
      "waves_per_eu": 8,
      "stage": 1
    },
    "2489": {
      "BLOCK_SIZE_M": 128,
      "BLOCK_SIZE_N": 128,
      "num_warps": 1,
      "num_stages": 4,
      "waves_per_eu": 8,
      "stage": 6
    },
    "160": {
      "BLOCK_SIZE_M": 64,
      "BLOCK_SIZE_N": 64,
      "num_warps": 2,
      "num_stages": 1,
      "waves_per_eu": 1,
      "stage": 5
    },
    "4569": {
      "BLOCK_SIZE_M": 256,
      "BLOCK_SIZE_N": 128,
      "num_warps": 4,
      "num_stages": 4,
      "waves_per_eu": 1,
      "stage": 4
    },
    "660": {
      "BLOCK_SIZE_M": 64,
      "BLOCK_SIZE_N": 128,
      "num_warps": 1,
      "num_stages": 4,
      "waves_per_eu": 0,
      "stage": 1
    },
    "4221": {
      "BLOCK_SIZE_M": 256,
      "BLOCK_SIZE_N": 128,
      "num_warps": 1,
      "num_stages": 1,
      "waves_per_eu": 4,
      "stage": 4
    },
    "1879": {
      "BLOCK_SIZE_M": 128,
      "BLOCK_SIZE_N": 64,
      "num_warps": 1,
      "num_stages": 4,
      "waves_per_eu": 4,
      "stage": 2
    },
    "2754": {
      "BLOCK_SIZE_M": 128,
      "BLOCK_SIZE_N": 128,
      "num_warps": 4,
      "num_stages": 2,
      "waves_per_eu": 8,
      "stage": 1
    },
    "354": {
      "BLOCK_SIZE_M": 64,
      "BLOCK_SIZE_N": 64,
      "num_warps": 4,
      "num_stages": 2,
      "waves_per_eu": 8,
      "stage": 1
    },
    "3632": {
      "BLOCK_SIZE_M": 256,
      "BLOCK_SIZE_N": 64,
      "num_warps": 1,
      "num_stages": 2,
      "waves_per_eu": 0,
      "stage": 3
    },
    "3962": {
      "BLOCK_SIZE_M": 256,
      "BLOCK_SIZE_N": 64,
      "num_warps": 4,
      "num_stages": 4,
      "waves_per_eu": 0,
      "stage": 3
    },
    "480": {
      "BLOCK_SIZE_M": 64,
      "BLOCK_SIZE_N": 64,
      "num_warps": 8,
      "num_stages": 2,
      "waves_per_eu": 0,
      "stage": 1
    },
    "167": {
      "BLOCK_SIZE_M": 64,
      "BLOCK_SIZE_N": 64,
      "num_warps": 2,
      "num_stages": 1,
      "waves_per_eu": 2,
      "stage": 6
    },
    "1060": {
      "BLOCK_SIZE_M": 64,
      "BLOCK_SIZE_N": 128,
      "num_warps": 8,
      "num_stages": 1,
      "waves_per_eu": 1,
      "stage": 5
    },
    "154": {
      "BLOCK_SIZE_M": 64,
      "BLOCK_SIZE_N": 64,
      "num_warps": 2,
      "num_stages": 1,
      "waves_per_eu": 0,
      "stage": 5
    },
    "767": {
      "BLOCK_SIZE_M": 64,
      "BLOCK_SIZE_N": 128,
      "num_warps": 2,
      "num_stages": 1,
      "waves_per_eu": 2,
      "stage": 6
    },
    "614": {
      "BLOCK_SIZE_M": 64,
      "BLOCK_SIZE_N": 128,
      "num_warps": 1,
      "num_stages": 1,
      "waves_per_eu": 2,
      "stage": 3
    },
    "3815": {
      "BLOCK_SIZE_M": 256,
      "BLOCK_SIZE_N": 64,
      "num_warps": 2,
      "num_stages": 4,
      "waves_per_eu": 0,
      "stage": 6
    },
    "4955": {
      "BLOCK_SIZE_M": 256,
      "BLOCK_SIZE_N": 256,
      "num_warps": 2,
      "num_stages": 1,
      "waves_per_eu": 0,
      "stage": 6
    },
    "2636": {
      "BLOCK_SIZE_M": 128,
      "BLOCK_SIZE_N": 128,
      "num_warps": 2,
      "num_stages": 4,
      "waves_per_eu": 8,
      "stage": 3
    },
    "4421": {
      "BLOCK_SIZE_M": 256,
      "BLOCK_SIZE_N": 128,
      "num_warps": 2,
      "num_stages": 4,
      "waves_per_eu": 1,
      "stage": 6
    },
    "617": {
      "BLOCK_SIZE_M": 64,
      "BLOCK_SIZE_N": 128,
      "num_warps": 1,
      "num_stages": 1,
      "waves_per_eu": 2,
      "stage": 6
    },
    "3470": {
      "BLOCK_SIZE_M": 128,
      "BLOCK_SIZE_N": 256,
      "num_warps": 8,
      "num_stages": 1,
      "waves_per_eu": 4,
      "stage": 3
    },
    "1513": {
      "BLOCK_SIZE_M": 64,
      "BLOCK_SIZE_N": 256,
      "num_warps": 4,
      "num_stages": 1,
      "waves_per_eu": 2,
      "stage": 2
    },
    "2632": {
      "BLOCK_SIZE_M": 128,
      "BLOCK_SIZE_N": 128,
      "num_warps": 2,
      "num_stages": 4,
      "waves_per_eu": 4,
      "stage": 5
    },
    "4824": {
      "BLOCK_SIZE_M": 256,
      "BLOCK_SIZE_N": 256,
      "num_warps": 1,
      "num_stages": 1,
      "waves_per_eu": 8,
      "stage": 1
    },
    "3681": {
      "BLOCK_SIZE_M": 256,
      "BLOCK_SIZE_N": 64,
      "num_warps": 1,
      "num_stages": 4,
      "waves_per_eu": 4,
      "stage": 4
    },
    "3945": {
      "BLOCK_SIZE_M": 256,
      "BLOCK_SIZE_N": 64,
      "num_warps": 4,
      "num_stages": 2,
      "waves_per_eu": 2,
      "stage": 4
    },
    "341": {
      "BLOCK_SIZE_M": 64,
      "BLOCK_SIZE_N": 64,
      "num_warps": 4,
      "num_stages": 2,
      "waves_per_eu": 1,
      "stage": 6
    },
    "3980": {
      "BLOCK_SIZE_M": 256,
      "BLOCK_SIZE_N": 64,
      "num_warps": 4,
      "num_stages": 4,
      "waves_per_eu": 4,
      "stage": 3
    },
    "5256": {
      "BLOCK_SIZE_M": 256,
      "BLOCK_SIZE_N": 256,
      "num_warps": 8,
      "num_stages": 1,
      "waves_per_eu": 1,
      "stage": 1
    },
    "4059": {
      "BLOCK_SIZE_M": 256,
      "BLOCK_SIZE_N": 64,
      "num_warps": 8,
      "num_stages": 1,
      "waves_per_eu": 1,
      "stage": 4
    },
    "3465": {
      "BLOCK_SIZE_M": 128,
      "BLOCK_SIZE_N": 256,
      "num_warps": 8,
      "num_stages": 1,
      "waves_per_eu": 2,
      "stage": 4
    },
    "3152": {
      "BLOCK_SIZE_M": 128,
      "BLOCK_SIZE_N": 256,
      "num_warps": 2,
      "num_stages": 1,
      "waves_per_eu": 0,
      "stage": 3
    },
    "798": {
      "BLOCK_SIZE_M": 64,
      "BLOCK_SIZE_N": 128,
      "num_warps": 2,
      "num_stages": 2,
      "waves_per_eu": 4,
      "stage": 1
    },
    "2462": {
      "BLOCK_SIZE_M": 128,
      "BLOCK_SIZE_N": 128,
      "num_warps": 1,
      "num_stages": 4,
      "waves_per_eu": 0,
      "stage": 3
    },
    "2037": {
      "BLOCK_SIZE_M": 128,
      "BLOCK_SIZE_N": 64,
      "num_warps": 2,
      "num_stages": 4,
      "waves_per_eu": 8,
      "stage": 4
    },
    "921": {
      "BLOCK_SIZE_M": 64,
      "BLOCK_SIZE_N": 128,
      "num_warps": 4,
      "num_stages": 1,
      "waves_per_eu": 4,
      "stage": 4
    },
    "4254": {
      "BLOCK_SIZE_M": 256,
      "BLOCK_SIZE_N": 128,
      "num_warps": 1,
      "num_stages": 2,
      "waves_per_eu": 8,
      "stage": 1
    },
    "5114": {
      "BLOCK_SIZE_M": 256,
      "BLOCK_SIZE_N": 256,
      "num_warps": 4,
      "num_stages": 1,
      "waves_per_eu": 2,
      "stage": 3
    },
    "1108": {
      "BLOCK_SIZE_M": 64,
      "BLOCK_SIZE_N": 128,
      "num_warps": 8,
      "num_stages": 2,
      "waves_per_eu": 8,
      "stage": 5
    },
    "50": {
      "BLOCK_SIZE_M": 64,
      "BLOCK_SIZE_N": 64,
      "num_warps": 1,
      "num_stages": 2,
      "waves_per_eu": 4,
      "stage": 3
    },
    "777": {
      "BLOCK_SIZE_M": 64,
      "BLOCK_SIZE_N": 128,
      "num_warps": 2,
      "num_stages": 1,
      "waves_per_eu": 8,
      "stage": 4
    },
    "3173": {
      "BLOCK_SIZE_M": 128,
      "BLOCK_SIZE_N": 256,
      "num_warps": 2,
      "num_stages": 1,
      "waves_per_eu": 4,
      "stage": 6
    },
    "942": {
      "BLOCK_SIZE_M": 64,
      "BLOCK_SIZE_N": 128,
      "num_warps": 4,
      "num_stages": 2,
      "waves_per_eu": 2,
      "stage": 1
    },
    "2472": {
      "BLOCK_SIZE_M": 128,
      "BLOCK_SIZE_N": 128,
      "num_warps": 1,
      "num_stages": 4,
      "waves_per_eu": 2,
      "stage": 1
    },
    "4098": {
      "BLOCK_SIZE_M": 256,
      "BLOCK_SIZE_N": 64,
      "num_warps": 8,
      "num_stages": 2,
      "waves_per_eu": 4,
      "stage": 1
    },
    "33": {
      "BLOCK_SIZE_M": 64,
      "BLOCK_SIZE_N": 64,
      "num_warps": 1,
      "num_stages": 2,
      "waves_per_eu": 0,
      "stage": 4
    },
    "3012": {
      "BLOCK_SIZE_M": 128,
      "BLOCK_SIZE_N": 256,
      "num_warps": 1,
      "num_stages": 1,
      "waves_per_eu": 2,
      "stage": 1
    },
    "3755": {
      "BLOCK_SIZE_M": 256,
      "BLOCK_SIZE_N": 64,
      "num_warps": 2,
      "num_stages": 1,
      "waves_per_eu": 0,
      "stage": 6
    },
    "4399": {
      "BLOCK_SIZE_M": 256,
      "BLOCK_SIZE_N": 128,
      "num_warps": 2,
      "num_stages": 2,
      "waves_per_eu": 4,
      "stage": 2
    },
    "4695": {
      "BLOCK_SIZE_M": 256,
      "BLOCK_SIZE_N": 128,
      "num_warps": 8,
      "num_stages": 2,
      "waves_per_eu": 2,
      "stage": 4
    },
    "3919": {
      "BLOCK_SIZE_M": 256,
      "BLOCK_SIZE_N": 64,
      "num_warps": 4,
      "num_stages": 1,
      "waves_per_eu": 4,
      "stage": 2
    },
    "604": {
      "BLOCK_SIZE_M": 64,
      "BLOCK_SIZE_N": 128,
      "num_warps": 1,
      "num_stages": 1,
      "waves_per_eu": 0,
      "stage": 5
    },
    "1962": {
      "BLOCK_SIZE_M": 128,
      "BLOCK_SIZE_N": 64,
      "num_warps": 2,
      "num_stages": 1,
      "waves_per_eu": 2,
      "stage": 1
    },
    "2144": {
      "BLOCK_SIZE_M": 128,
      "BLOCK_SIZE_N": 64,
      "num_warps": 4,
      "num_stages": 2,
      "waves_per_eu": 2,
      "stage": 3
    },
    "3638": {
      "BLOCK_SIZE_M": 256,
      "BLOCK_SIZE_N": 64,
      "num_warps": 1,
      "num_stages": 2,
      "waves_per_eu": 1,
      "stage": 3
    },
    "2461": {
      "BLOCK_SIZE_M": 128,
      "BLOCK_SIZE_N": 128,
      "num_warps": 1,
      "num_stages": 4,
      "waves_per_eu": 0,
      "stage": 2
    },
    "335": {
      "BLOCK_SIZE_M": 64,
      "BLOCK_SIZE_N": 64,
      "num_warps": 4,
      "num_stages": 2,
      "waves_per_eu": 0,
      "stage": 6
    },
    "4230": {
      "BLOCK_SIZE_M": 256,
      "BLOCK_SIZE_N": 128,
      "num_warps": 1,
      "num_stages": 2,
      "waves_per_eu": 0,
      "stage": 1
    },
    "4251": {
      "BLOCK_SIZE_M": 256,
      "BLOCK_SIZE_N": 128,
      "num_warps": 1,
      "num_stages": 2,
      "waves_per_eu": 4,
      "stage": 4
    },
    "4511": {
      "BLOCK_SIZE_M": 256,
      "BLOCK_SIZE_N": 128,
      "num_warps": 4,
      "num_stages": 1,
      "waves_per_eu": 1,
      "stage": 6
    },
    "510": {
      "BLOCK_SIZE_M": 64,
      "BLOCK_SIZE_N": 64,
      "num_warps": 8,
      "num_stages": 4,
      "waves_per_eu": 0,
      "stage": 1
    },
    "4200": {
      "BLOCK_SIZE_M": 256,
      "BLOCK_SIZE_N": 128,
      "num_warps": 1,
      "num_stages": 1,
      "waves_per_eu": 0,
      "stage": 1
    },
    "632": {
      "BLOCK_SIZE_M": 64,
      "BLOCK_SIZE_N": 128,
      "num_warps": 1,
      "num_stages": 2,
      "waves_per_eu": 0,
      "stage": 3
    },
    "374": {
      "BLOCK_SIZE_M": 64,
      "BLOCK_SIZE_N": 64,
      "num_warps": 4,
      "num_stages": 4,
      "waves_per_eu": 2,
      "stage": 3
    },
    "2032": {
      "BLOCK_SIZE_M": 128,
      "BLOCK_SIZE_N": 64,
      "num_warps": 2,
      "num_stages": 4,
      "waves_per_eu": 4,
      "stage": 5
    },
    "2595": {
      "BLOCK_SIZE_M": 128,
      "BLOCK_SIZE_N": 128,
      "num_warps": 2,
      "num_stages": 2,
      "waves_per_eu": 2,
      "stage": 4
    },
    "3943": {
      "BLOCK_SIZE_M": 256,
      "BLOCK_SIZE_N": 64,
      "num_warps": 4,
      "num_stages": 2,
      "waves_per_eu": 2,
      "stage": 2
    },
    "1213": {
      "BLOCK_SIZE_M": 64,
      "BLOCK_SIZE_N": 256,
      "num_warps": 1,
      "num_stages": 1,
      "waves_per_eu": 2,
      "stage": 2
    },
    "312": {
      "BLOCK_SIZE_M": 64,
      "BLOCK_SIZE_N": 64,
      "num_warps": 4,
      "num_stages": 1,
      "waves_per_eu": 2,
      "stage": 1
    },
    "2134": {
      "BLOCK_SIZE_M": 128,
      "BLOCK_SIZE_N": 64,
      "num_warps": 4,
      "num_stages": 2,
      "waves_per_eu": 0,
      "stage": 5
    },
    "2483": {
      "BLOCK_SIZE_M": 128,
      "BLOCK_SIZE_N": 128,
      "num_warps": 1,
      "num_stages": 4,
      "waves_per_eu": 4,
      "stage": 6
    },
    "3013": {
      "BLOCK_SIZE_M": 128,
      "BLOCK_SIZE_N": 256,
      "num_warps": 1,
      "num_stages": 1,
      "waves_per_eu": 2,
      "stage": 2
    },
    "4690": {
      "BLOCK_SIZE_M": 256,
      "BLOCK_SIZE_N": 128,
      "num_warps": 8,
      "num_stages": 2,
      "waves_per_eu": 1,
      "stage": 5
    },
    "2290": {
      "BLOCK_SIZE_M": 128,
      "BLOCK_SIZE_N": 64,
      "num_warps": 8,
      "num_stages": 2,
      "waves_per_eu": 1,
      "stage": 5
    },
    "4386": {
      "BLOCK_SIZE_M": 256,
      "BLOCK_SIZE_N": 128,
      "num_warps": 2,
      "num_stages": 2,
      "waves_per_eu": 1,
      "stage": 1
    },
    "2481": {
      "BLOCK_SIZE_M": 128,
      "BLOCK_SIZE_N": 128,
      "num_warps": 1,
      "num_stages": 4,
      "waves_per_eu": 4,
      "stage": 4
    },
    "2320": {
      "BLOCK_SIZE_M": 128,
      "BLOCK_SIZE_N": 64,
      "num_warps": 8,
      "num_stages": 4,
      "waves_per_eu": 1,
      "stage": 5
    },
    "616": {
      "BLOCK_SIZE_M": 64,
      "BLOCK_SIZE_N": 128,
      "num_warps": 1,
      "num_stages": 1,
      "waves_per_eu": 2,
      "stage": 5
    },
    "1813": {
      "BLOCK_SIZE_M": 128,
      "BLOCK_SIZE_N": 64,
      "num_warps": 1,
      "num_stages": 1,
      "waves_per_eu": 2,
      "stage": 2
    },
    "2250": {
      "BLOCK_SIZE_M": 128,
      "BLOCK_SIZE_N": 64,
      "num_warps": 8,
      "num_stages": 1,
      "waves_per_eu": 0,
      "stage": 1
    },
    "3931": {
      "BLOCK_SIZE_M": 256,
      "BLOCK_SIZE_N": 64,
      "num_warps": 4,
      "num_stages": 2,
      "waves_per_eu": 0,
      "stage": 2
    },
    "3799": {
      "BLOCK_SIZE_M": 256,
      "BLOCK_SIZE_N": 64,
      "num_warps": 2,
      "num_stages": 2,
      "waves_per_eu": 4,
      "stage": 2
    },
    "350": {
      "BLOCK_SIZE_M": 64,
      "BLOCK_SIZE_N": 64,
      "num_warps": 4,
      "num_stages": 2,
      "waves_per_eu": 4,
      "stage": 3
    },
    "794": {
      "BLOCK_SIZE_M": 64,
      "BLOCK_SIZE_N": 128,
      "num_warps": 2,
      "num_stages": 2,
      "waves_per_eu": 2,
      "stage": 3
    },
    "2744": {
      "BLOCK_SIZE_M": 128,
      "BLOCK_SIZE_N": 128,
      "num_warps": 4,
      "num_stages": 2,
      "waves_per_eu": 2,
      "stage": 3
    },
    "2323": {
      "BLOCK_SIZE_M": 128,
      "BLOCK_SIZE_N": 64,
      "num_warps": 8,
      "num_stages": 4,
      "waves_per_eu": 2,
      "stage": 2
    },
    "215": {
      "BLOCK_SIZE_M": 64,
      "BLOCK_SIZE_N": 64,
      "num_warps": 2,
      "num_stages": 4,
      "waves_per_eu": 0,
      "stage": 6
    },
    "2424": {
      "BLOCK_SIZE_M": 128,
      "BLOCK_SIZE_N": 128,
      "num_warps": 1,
      "num_stages": 1,
      "waves_per_eu": 8,
      "stage": 1
    },
    "4827": {
      "BLOCK_SIZE_M": 256,
      "BLOCK_SIZE_N": 256,
      "num_warps": 1,
      "num_stages": 1,
      "waves_per_eu": 8,
      "stage": 4
    },
    "4565": {
      "BLOCK_SIZE_M": 256,
      "BLOCK_SIZE_N": 128,
      "num_warps": 4,
      "num_stages": 4,
      "waves_per_eu": 0,
      "stage": 6
    },
    "3452": {
      "BLOCK_SIZE_M": 128,
      "BLOCK_SIZE_N": 256,
      "num_warps": 8,
      "num_stages": 1,
      "waves_per_eu": 0,
      "stage": 3
    },
    "3": {
      "BLOCK_SIZE_M": 64,
      "BLOCK_SIZE_N": 64,
      "num_warps": 1,
      "num_stages": 1,
      "waves_per_eu": 0,
      "stage": 4
    },
    "60": {
      "BLOCK_SIZE_M": 64,
      "BLOCK_SIZE_N": 64,
      "num_warps": 1,
      "num_stages": 4,
      "waves_per_eu": 0,
      "stage": 1
    },
    "3803": {
      "BLOCK_SIZE_M": 256,
      "BLOCK_SIZE_N": 64,
      "num_warps": 2,
      "num_stages": 2,
      "waves_per_eu": 4,
      "stage": 6
    },
    "3838": {
      "BLOCK_SIZE_M": 256,
      "BLOCK_SIZE_N": 64,
      "num_warps": 2,
      "num_stages": 4,
      "waves_per_eu": 8,
      "stage": 5
    },
    "3645": {
      "BLOCK_SIZE_M": 256,
      "BLOCK_SIZE_N": 64,
      "num_warps": 1,
      "num_stages": 2,
      "waves_per_eu": 2,
      "stage": 4
    },
    "1356": {
      "BLOCK_SIZE_M": 64,
      "BLOCK_SIZE_N": 256,
      "num_warps": 2,
      "num_stages": 1,
      "waves_per_eu": 1,
      "stage": 1
    },
    "3326": {
      "BLOCK_SIZE_M": 128,
      "BLOCK_SIZE_N": 256,
      "num_warps": 4,
      "num_stages": 1,
      "waves_per_eu": 8,
      "stage": 3
    },
    "1100": {
      "BLOCK_SIZE_M": 64,
      "BLOCK_SIZE_N": 128,
      "num_warps": 8,
      "num_stages": 2,
      "waves_per_eu": 4,
      "stage": 3
    },
    "4050": {
      "BLOCK_SIZE_M": 256,
      "BLOCK_SIZE_N": 64,
      "num_warps": 8,
      "num_stages": 1,
      "waves_per_eu": 0,
      "stage": 1
    },
    "3321": {
      "BLOCK_SIZE_M": 128,
      "BLOCK_SIZE_N": 256,
      "num_warps": 4,
      "num_stages": 1,
      "waves_per_eu": 4,
      "stage": 4
    },
    "4800": {
      "BLOCK_SIZE_M": 256,
      "BLOCK_SIZE_N": 256,
      "num_warps": 1,
      "num_stages": 1,
      "waves_per_eu": 0,
      "stage": 1
    },
    "3654": {
      "BLOCK_SIZE_M": 256,
      "BLOCK_SIZE_N": 64,
      "num_warps": 1,
      "num_stages": 2,
      "waves_per_eu": 8,
      "stage": 1
    },
    "4058": {
      "BLOCK_SIZE_M": 256,
      "BLOCK_SIZE_N": 64,
      "num_warps": 8,
      "num_stages": 1,
      "waves_per_eu": 1,
      "stage": 3
    },
    "1373": {
      "BLOCK_SIZE_M": 64,
      "BLOCK_SIZE_N": 256,
      "num_warps": 2,
      "num_stages": 1,
      "waves_per_eu": 4,
      "stage": 6
    },
    "1979": {
      "BLOCK_SIZE_M": 128,
      "BLOCK_SIZE_N": 64,
      "num_warps": 2,
      "num_stages": 1,
      "waves_per_eu": 8,
      "stage": 6
    },
    "1091": {
      "BLOCK_SIZE_M": 64,
      "BLOCK_SIZE_N": 128,
      "num_warps": 8,
      "num_stages": 2,
      "waves_per_eu": 1,
      "stage": 6
    },
    "4537": {
      "BLOCK_SIZE_M": 256,
      "BLOCK_SIZE_N": 128,
      "num_warps": 4,
      "num_stages": 2,
      "waves_per_eu": 1,
      "stage": 2
    },
    "3916": {
      "BLOCK_SIZE_M": 256,
      "BLOCK_SIZE_N": 64,
      "num_warps": 4,
      "num_stages": 1,
      "waves_per_eu": 2,
      "stage": 5
    },
    "4960": {
      "BLOCK_SIZE_M": 256,
      "BLOCK_SIZE_N": 256,
      "num_warps": 2,
      "num_stages": 1,
      "waves_per_eu": 1,
      "stage": 5
    },
    "4673": {
      "BLOCK_SIZE_M": 256,
      "BLOCK_SIZE_N": 128,
      "num_warps": 8,
      "num_stages": 1,
      "waves_per_eu": 4,
      "stage": 6
    },
    "1068": {
      "BLOCK_SIZE_M": 64,
      "BLOCK_SIZE_N": 128,
      "num_warps": 8,
      "num_stages": 1,
      "waves_per_eu": 4,
      "stage": 1
    },
    "346": {
      "BLOCK_SIZE_M": 64,
      "BLOCK_SIZE_N": 64,
      "num_warps": 4,
      "num_stages": 2,
      "waves_per_eu": 2,
      "stage": 5
    },
    "4683": {
      "BLOCK_SIZE_M": 256,
      "BLOCK_SIZE_N": 128,
      "num_warps": 8,
      "num_stages": 2,
      "waves_per_eu": 0,
      "stage": 4
    },
    "912": {
      "BLOCK_SIZE_M": 64,
      "BLOCK_SIZE_N": 128,
      "num_warps": 4,
      "num_stages": 1,
      "waves_per_eu": 2,
      "stage": 1
    },
    "805": {
      "BLOCK_SIZE_M": 64,
      "BLOCK_SIZE_N": 128,
      "num_warps": 2,
      "num_stages": 2,
      "waves_per_eu": 8,
      "stage": 2
    },
    "2634": {
      "BLOCK_SIZE_M": 128,
      "BLOCK_SIZE_N": 128,
      "num_warps": 2,
      "num_stages": 4,
      "waves_per_eu": 8,
      "stage": 1
    },
    "158": {
      "BLOCK_SIZE_M": 64,
      "BLOCK_SIZE_N": 64,
      "num_warps": 2,
      "num_stages": 1,
      "waves_per_eu": 1,
      "stage": 3
    },
    "1204": {
      "BLOCK_SIZE_M": 64,
      "BLOCK_SIZE_N": 256,
      "num_warps": 1,
      "num_stages": 1,
      "waves_per_eu": 0,
      "stage": 5
    },
    "30": {
      "BLOCK_SIZE_M": 64,
      "BLOCK_SIZE_N": 64,
      "num_warps": 1,
      "num_stages": 2,
      "waves_per_eu": 0,
      "stage": 1
    },
    "4688": {
      "BLOCK_SIZE_M": 256,
      "BLOCK_SIZE_N": 128,
      "num_warps": 8,
      "num_stages": 2,
      "waves_per_eu": 1,
      "stage": 3
    },
    "606": {
      "BLOCK_SIZE_M": 64,
      "BLOCK_SIZE_N": 128,
      "num_warps": 1,
      "num_stages": 1,
      "waves_per_eu": 1,
      "stage": 1
    },
    "4127": {
      "BLOCK_SIZE_M": 256,
      "BLOCK_SIZE_N": 64,
      "num_warps": 8,
      "num_stages": 4,
      "waves_per_eu": 2,
      "stage": 6
    },
    "2854": {
      "BLOCK_SIZE_M": 128,
      "BLOCK_SIZE_N": 128,
      "num_warps": 8,
      "num_stages": 1,
      "waves_per_eu": 0,
      "stage": 5
    },
    "959": {
      "BLOCK_SIZE_M": 64,
      "BLOCK_SIZE_N": 128,
      "num_warps": 4,
      "num_stages": 2,
      "waves_per_eu": 8,
      "stage": 6
    },
    "3789": {
      "BLOCK_SIZE_M": 256,
      "BLOCK_SIZE_N": 64,
      "num_warps": 2,
      "num_stages": 2,
      "waves_per_eu": 1,
      "stage": 4
    },
    "2189": {
      "BLOCK_SIZE_M": 128,
      "BLOCK_SIZE_N": 64,
      "num_warps": 4,
      "num_stages": 4,
      "waves_per_eu": 8,
      "stage": 6
    },
    "4280": {
      "BLOCK_SIZE_M": 256,
      "BLOCK_SIZE_N": 128,
      "num_warps": 1,
      "num_stages": 4,
      "waves_per_eu": 4,
      "stage": 3
    },
    "2174": {
      "BLOCK_SIZE_M": 128,
      "BLOCK_SIZE_N": 64,
      "num_warps": 4,
      "num_stages": 4,
      "waves_per_eu": 2,
      "stage": 3
    },
    "779": {
      "BLOCK_SIZE_M": 64,
      "BLOCK_SIZE_N": 128,
      "num_warps": 2,
      "num_stages": 1,
      "waves_per_eu": 8,
      "stage": 6
    },
    "485": {
      "BLOCK_SIZE_M": 64,
      "BLOCK_SIZE_N": 64,
      "num_warps": 8,
      "num_stages": 2,
      "waves_per_eu": 0,
      "stage": 6
    },
    "2562": {
      "BLOCK_SIZE_M": 128,
      "BLOCK_SIZE_N": 128,
      "num_warps": 2,
      "num_stages": 1,
      "waves_per_eu": 2,
      "stage": 1
    },
    "87": {
      "BLOCK_SIZE_M": 64,
      "BLOCK_SIZE_N": 64,
      "num_warps": 1,
      "num_stages": 4,
      "waves_per_eu": 8,
      "stage": 4
    },
    "523": {
      "BLOCK_SIZE_M": 64,
      "BLOCK_SIZE_N": 64,
      "num_warps": 8,
      "num_stages": 4,
      "waves_per_eu": 2,
      "stage": 2
    },
    "3923": {
      "BLOCK_SIZE_M": 256,
      "BLOCK_SIZE_N": 64,
      "num_warps": 4,
      "num_stages": 1,
      "waves_per_eu": 4,
      "stage": 6
    },
    "4976": {
      "BLOCK_SIZE_M": 256,
      "BLOCK_SIZE_N": 256,
      "num_warps": 2,
      "num_stages": 1,
      "waves_per_eu": 8,
      "stage": 3
    },
    "900": {
      "BLOCK_SIZE_M": 64,
      "BLOCK_SIZE_N": 128,
      "num_warps": 4,
      "num_stages": 1,
      "waves_per_eu": 0,
      "stage": 1
    },
    "3963": {
      "BLOCK_SIZE_M": 256,
      "BLOCK_SIZE_N": 64,
      "num_warps": 4,
      "num_stages": 4,
      "waves_per_eu": 0,
      "stage": 4
    },
    "221": {
      "BLOCK_SIZE_M": 64,
      "BLOCK_SIZE_N": 64,
      "num_warps": 2,
      "num_stages": 4,
      "waves_per_eu": 1,
      "stage": 6
    },
    "973": {
      "BLOCK_SIZE_M": 64,
      "BLOCK_SIZE_N": 128,
      "num_warps": 4,
      "num_stages": 4,
      "waves_per_eu": 2,
      "stage": 2
    },
    "2102": {
      "BLOCK_SIZE_M": 128,
      "BLOCK_SIZE_N": 64,
      "num_warps": 4,
      "num_stages": 1,
      "waves_per_eu": 0,
      "stage": 3
    },
    "4086": {
      "BLOCK_SIZE_M": 256,
      "BLOCK_SIZE_N": 64,
      "num_warps": 8,
      "num_stages": 2,
      "waves_per_eu": 1,
      "stage": 1
    },
    "4272": {
      "BLOCK_SIZE_M": 256,
      "BLOCK_SIZE_N": 128,
      "num_warps": 1,
      "num_stages": 4,
      "waves_per_eu": 2,
      "stage": 1
    },
    "1203": {
      "BLOCK_SIZE_M": 64,
      "BLOCK_SIZE_N": 256,
      "num_warps": 1,
      "num_stages": 1,
      "waves_per_eu": 0,
      "stage": 4
    },
    "1844": {
      "BLOCK_SIZE_M": 128,
      "BLOCK_SIZE_N": 64,
      "num_warps": 1,
      "num_stages": 2,
      "waves_per_eu": 2,
      "stage": 3
    },
    "2267": {
      "BLOCK_SIZE_M": 128,
      "BLOCK_SIZE_N": 64,
      "num_warps": 8,
      "num_stages": 1,
      "waves_per_eu": 2,
      "stage": 6
    },
    "4820": {
      "BLOCK_SIZE_M": 256,
      "BLOCK_SIZE_N": 256,
      "num_warps": 1,
      "num_stages": 1,
      "waves_per_eu": 4,
      "stage": 3
    },
    "2111": {
      "BLOCK_SIZE_M": 128,
      "BLOCK_SIZE_N": 64,
      "num_warps": 4,
      "num_stages": 1,
      "waves_per_eu": 1,
      "stage": 6
    },
    "3675": {
      "BLOCK_SIZE_M": 256,
      "BLOCK_SIZE_N": 64,
      "num_warps": 1,
      "num_stages": 4,
      "waves_per_eu": 2,
      "stage": 4
    },
    "1802": {
      "BLOCK_SIZE_M": 128,
      "BLOCK_SIZE_N": 64,
      "num_warps": 1,
      "num_stages": 1,
      "waves_per_eu": 0,
      "stage": 3
    },
    "4225": {
      "BLOCK_SIZE_M": 256,
      "BLOCK_SIZE_N": 128,
      "num_warps": 1,
      "num_stages": 1,
      "waves_per_eu": 8,
      "stage": 2
    },
    "2427": {
      "BLOCK_SIZE_M": 128,
      "BLOCK_SIZE_N": 128,
      "num_warps": 1,
      "num_stages": 1,
      "waves_per_eu": 8,
      "stage": 4
    },
    "2709": {
      "BLOCK_SIZE_M": 128,
      "BLOCK_SIZE_N": 128,
      "num_warps": 4,
      "num_stages": 1,
      "waves_per_eu": 1,
      "stage": 4
    },
    "4430": {
      "BLOCK_SIZE_M": 256,
      "BLOCK_SIZE_N": 128,
      "num_warps": 2,
      "num_stages": 4,
      "waves_per_eu": 4,
      "stage": 3
    },
    "4538": {
      "BLOCK_SIZE_M": 256,
      "BLOCK_SIZE_N": 128,
      "num_warps": 4,
      "num_stages": 2,
      "waves_per_eu": 1,
      "stage": 3
    },
    "4104": {
      "BLOCK_SIZE_M": 256,
      "BLOCK_SIZE_N": 64,
      "num_warps": 8,
      "num_stages": 2,
      "waves_per_eu": 8,
      "stage": 1
    },
    "1070": {
      "BLOCK_SIZE_M": 64,
      "BLOCK_SIZE_N": 128,
      "num_warps": 8,
      "num_stages": 1,
      "waves_per_eu": 4,
      "stage": 3
    },
    "961": {
      "BLOCK_SIZE_M": 64,
      "BLOCK_SIZE_N": 128,
      "num_warps": 4,
      "num_stages": 4,
      "waves_per_eu": 0,
      "stage": 2
    },
    "3317": {
      "BLOCK_SIZE_M": 128,
      "BLOCK_SIZE_N": 256,
      "num_warps": 4,
      "num_stages": 1,
      "waves_per_eu": 2,
      "stage": 6
    },
    "2743": {
      "BLOCK_SIZE_M": 128,
      "BLOCK_SIZE_N": 128,
      "num_warps": 4,
      "num_stages": 2,
      "waves_per_eu": 2,
      "stage": 2
    },
    "4379": {
      "BLOCK_SIZE_M": 256,
      "BLOCK_SIZE_N": 128,
      "num_warps": 2,
      "num_stages": 1,
      "waves_per_eu": 8,
      "stage": 6
    },
    "41": {
      "BLOCK_SIZE_M": 64,
      "BLOCK_SIZE_N": 64,
      "num_warps": 1,
      "num_stages": 2,
      "waves_per_eu": 1,
      "stage": 6
    },
    "3790": {
      "BLOCK_SIZE_M": 256,
      "BLOCK_SIZE_N": 64,
      "num_warps": 2,
      "num_stages": 2,
      "waves_per_eu": 1,
      "stage": 5
    },
    "384": {
      "BLOCK_SIZE_M": 64,
      "BLOCK_SIZE_N": 64,
      "num_warps": 4,
      "num_stages": 4,
      "waves_per_eu": 8,
      "stage": 1
    },
    "2337": {
      "BLOCK_SIZE_M": 128,
      "BLOCK_SIZE_N": 64,
      "num_warps": 8,
      "num_stages": 4,
      "waves_per_eu": 8,
      "stage": 4
    },
    "4575": {
      "BLOCK_SIZE_M": 256,
      "BLOCK_SIZE_N": 128,
      "num_warps": 4,
      "num_stages": 4,
      "waves_per_eu": 2,
      "stage": 4
    },
    "3641": {
      "BLOCK_SIZE_M": 256,
      "BLOCK_SIZE_N": 64,
      "num_warps": 1,
      "num_stages": 2,
      "waves_per_eu": 1,
      "stage": 6
    },
    "1821": {
      "BLOCK_SIZE_M": 128,
      "BLOCK_SIZE_N": 64,
      "num_warps": 1,
      "num_stages": 1,
      "waves_per_eu": 4,
      "stage": 4
    },
    "2324": {
      "BLOCK_SIZE_M": 128,
      "BLOCK_SIZE_N": 64,
      "num_warps": 8,
      "num_stages": 4,
      "waves_per_eu": 2,
      "stage": 3
    },
    "2178": {
      "BLOCK_SIZE_M": 128,
      "BLOCK_SIZE_N": 64,
      "num_warps": 4,
      "num_stages": 4,
      "waves_per_eu": 4,
      "stage": 1
    },
    "1367": {
      "BLOCK_SIZE_M": 64,
      "BLOCK_SIZE_N": 256,
      "num_warps": 2,
      "num_stages": 1,
      "waves_per_eu": 2,
      "stage": 6
    },
    "236": {
      "BLOCK_SIZE_M": 64,
      "BLOCK_SIZE_N": 64,
      "num_warps": 2,
      "num_stages": 4,
      "waves_per_eu": 8,
      "stage": 3
    },
    "4425": {
      "BLOCK_SIZE_M": 256,
      "BLOCK_SIZE_N": 128,
      "num_warps": 2,
      "num_stages": 4,
      "waves_per_eu": 2,
      "stage": 4
    },
    "933": {
      "BLOCK_SIZE_M": 64,
      "BLOCK_SIZE_N": 128,
      "num_warps": 4,
      "num_stages": 2,
      "waves_per_eu": 0,
      "stage": 4
    },
    "2100": {
      "BLOCK_SIZE_M": 128,
      "BLOCK_SIZE_N": 64,
      "num_warps": 4,
      "num_stages": 1,
      "waves_per_eu": 0,
      "stage": 1
    },
    "3320": {
      "BLOCK_SIZE_M": 128,
      "BLOCK_SIZE_N": 256,
      "num_warps": 4,
      "num_stages": 1,
      "waves_per_eu": 4,
      "stage": 3
    },
    "1212": {
      "BLOCK_SIZE_M": 64,
      "BLOCK_SIZE_N": 256,
      "num_warps": 1,
      "num_stages": 1,
      "waves_per_eu": 2,
      "stage": 1
    },
    "4216": {
      "BLOCK_SIZE_M": 256,
      "BLOCK_SIZE_N": 128,
      "num_warps": 1,
      "num_stages": 1,
      "waves_per_eu": 2,
      "stage": 5
    },
    "2285": {
      "BLOCK_SIZE_M": 128,
      "BLOCK_SIZE_N": 64,
      "num_warps": 8,
      "num_stages": 2,
      "waves_per_eu": 0,
      "stage": 6
    },
    "478": {
      "BLOCK_SIZE_M": 64,
      "BLOCK_SIZE_N": 64,
      "num_warps": 8,
      "num_stages": 1,
      "waves_per_eu": 8,
      "stage": 5
    },
    "4390": {
      "BLOCK_SIZE_M": 256,
      "BLOCK_SIZE_N": 128,
      "num_warps": 2,
      "num_stages": 2,
      "waves_per_eu": 1,
      "stage": 5
    },
    "3676": {
      "BLOCK_SIZE_M": 256,
      "BLOCK_SIZE_N": 64,
      "num_warps": 1,
      "num_stages": 4,
      "waves_per_eu": 2,
      "stage": 5
    },
    "3650": {
      "BLOCK_SIZE_M": 256,
      "BLOCK_SIZE_N": 64,
      "num_warps": 1,
      "num_stages": 2,
      "waves_per_eu": 4,
      "stage": 3
    },
    "3323": {
      "BLOCK_SIZE_M": 128,
      "BLOCK_SIZE_N": 256,
      "num_warps": 4,
      "num_stages": 1,
      "waves_per_eu": 4,
      "stage": 6
    },
    "1218": {
      "BLOCK_SIZE_M": 64,
      "BLOCK_SIZE_N": 256,
      "num_warps": 1,
      "num_stages": 1,
      "waves_per_eu": 4,
      "stage": 1
    },
    "4559": {
      "BLOCK_SIZE_M": 256,
      "BLOCK_SIZE_N": 128,
      "num_warps": 4,
      "num_stages": 2,
      "waves_per_eu": 8,
      "stage": 6
    },
    "1066": {
      "BLOCK_SIZE_M": 64,
      "BLOCK_SIZE_N": 128,
      "num_warps": 8,
      "num_stages": 1,
      "waves_per_eu": 2,
      "stage": 5
    },
    "4382": {
      "BLOCK_SIZE_M": 256,
      "BLOCK_SIZE_N": 128,
      "num_warps": 2,
      "num_stages": 2,
      "waves_per_eu": 0,
      "stage": 3
    },
    "4415": {
      "BLOCK_SIZE_M": 256,
      "BLOCK_SIZE_N": 128,
      "num_warps": 2,
      "num_stages": 4,
      "waves_per_eu": 0,
      "stage": 6
    },
    "4560": {
      "BLOCK_SIZE_M": 256,
      "BLOCK_SIZE_N": 128,
      "num_warps": 4,
      "num_stages": 4,
      "waves_per_eu": 0,
      "stage": 1
    },
    "2409": {
      "BLOCK_SIZE_M": 128,
      "BLOCK_SIZE_N": 128,
      "num_warps": 1,
      "num_stages": 1,
      "waves_per_eu": 1,
      "stage": 4
    },
    "5272": {
      "BLOCK_SIZE_M": 256,
      "BLOCK_SIZE_N": 256,
      "num_warps": 8,
      "num_stages": 1,
      "waves_per_eu": 4,
      "stage": 5
    },
    "1961": {
      "BLOCK_SIZE_M": 128,
      "BLOCK_SIZE_N": 64,
      "num_warps": 2,
      "num_stages": 1,
      "waves_per_eu": 1,
      "stage": 6
    },
    "4101": {
      "BLOCK_SIZE_M": 256,
      "BLOCK_SIZE_N": 64,
      "num_warps": 8,
      "num_stages": 2,
      "waves_per_eu": 4,
      "stage": 4
    },
    "2633": {
      "BLOCK_SIZE_M": 128,
      "BLOCK_SIZE_N": 128,
      "num_warps": 2,
      "num_stages": 4,
      "waves_per_eu": 4,
      "stage": 6
    },
    "987": {
      "BLOCK_SIZE_M": 64,
      "BLOCK_SIZE_N": 128,
      "num_warps": 4,
      "num_stages": 4,
      "waves_per_eu": 8,
      "stage": 4
    },
    "4374": {
      "BLOCK_SIZE_M": 256,
      "BLOCK_SIZE_N": 128,
      "num_warps": 2,
      "num_stages": 1,
      "waves_per_eu": 8,
      "stage": 1
    },
    "1224": {
      "BLOCK_SIZE_M": 64,
      "BLOCK_SIZE_N": 256,
      "num_warps": 1,
      "num_stages": 1,
      "waves_per_eu": 8,
      "stage": 1
    },
    "4131": {
      "BLOCK_SIZE_M": 256,
      "BLOCK_SIZE_N": 64,
      "num_warps": 8,
      "num_stages": 4,
      "waves_per_eu": 4,
      "stage": 4
    },
    "2564": {
      "BLOCK_SIZE_M": 128,
      "BLOCK_SIZE_N": 128,
      "num_warps": 2,
      "num_stages": 1,
      "waves_per_eu": 2,
      "stage": 3
    },
    "2557": {
      "BLOCK_SIZE_M": 128,
      "BLOCK_SIZE_N": 128,
      "num_warps": 2,
      "num_stages": 1,
      "waves_per_eu": 1,
      "stage": 2
    },
    "4391": {
      "BLOCK_SIZE_M": 256,
      "BLOCK_SIZE_N": 128,
      "num_warps": 2,
      "num_stages": 2,
      "waves_per_eu": 1,
      "stage": 6
    },
    "1512": {
      "BLOCK_SIZE_M": 64,
      "BLOCK_SIZE_N": 256,
      "num_warps": 4,
      "num_stages": 1,
      "waves_per_eu": 2,
      "stage": 1
    },
    "4821": {
      "BLOCK_SIZE_M": 256,
      "BLOCK_SIZE_N": 256,
      "num_warps": 1,
      "num_stages": 1,
      "waves_per_eu": 4,
      "stage": 4
    },
    "4354": {
      "BLOCK_SIZE_M": 256,
      "BLOCK_SIZE_N": 128,
      "num_warps": 2,
      "num_stages": 1,
      "waves_per_eu": 0,
      "stage": 5
    },
    "4691": {
      "BLOCK_SIZE_M": 256,
      "BLOCK_SIZE_N": 128,
      "num_warps": 8,
      "num_stages": 2,
      "waves_per_eu": 1,
      "stage": 6
    },
    "54": {
      "BLOCK_SIZE_M": 64,
      "BLOCK_SIZE_N": 64,
      "num_warps": 1,
      "num_stages": 2,
      "waves_per_eu": 8,
      "stage": 1
    },
    "3478": {
      "BLOCK_SIZE_M": 128,
      "BLOCK_SIZE_N": 256,
      "num_warps": 8,
      "num_stages": 1,
      "waves_per_eu": 8,
      "stage": 5
    },
    "171": {
      "BLOCK_SIZE_M": 64,
      "BLOCK_SIZE_N": 64,
      "num_warps": 2,
      "num_stages": 1,
      "waves_per_eu": 4,
      "stage": 4
    },
    "4817": {
      "BLOCK_SIZE_M": 256,
      "BLOCK_SIZE_N": 256,
      "num_warps": 1,
      "num_stages": 1,
      "waves_per_eu": 2,
      "stage": 6
    },
    "3328": {
      "BLOCK_SIZE_M": 128,
      "BLOCK_SIZE_N": 256,
      "num_warps": 4,
      "num_stages": 1,
      "waves_per_eu": 8,
      "stage": 5
    },
    "200": {
      "BLOCK_SIZE_M": 64,
      "BLOCK_SIZE_N": 64,
      "num_warps": 2,
      "num_stages": 2,
      "waves_per_eu": 4,
      "stage": 3
    },
    "2110": {
      "BLOCK_SIZE_M": 128,
      "BLOCK_SIZE_N": 64,
      "num_warps": 4,
      "num_stages": 1,
      "waves_per_eu": 1,
      "stage": 5
    },
    "4052": {
      "BLOCK_SIZE_M": 256,
      "BLOCK_SIZE_N": 64,
      "num_warps": 8,
      "num_stages": 1,
      "waves_per_eu": 0,
      "stage": 3
    },
    "3983": {
      "BLOCK_SIZE_M": 256,
      "BLOCK_SIZE_N": 64,
      "num_warps": 4,
      "num_stages": 4,
      "waves_per_eu": 4,
      "stage": 6
    },
    "43": {
      "BLOCK_SIZE_M": 64,
      "BLOCK_SIZE_N": 64,
      "num_warps": 1,
      "num_stages": 2,
      "waves_per_eu": 2,
      "stage": 2
    },
    "2411": {
      "BLOCK_SIZE_M": 128,
      "BLOCK_SIZE_N": 128,
      "num_warps": 1,
      "num_stages": 1,
      "waves_per_eu": 1,
      "stage": 6
    },
    "3609": {
      "BLOCK_SIZE_M": 256,
      "BLOCK_SIZE_N": 64,
      "num_warps": 1,
      "num_stages": 1,
      "waves_per_eu": 1,
      "stage": 4
    },
    "2406": {
      "BLOCK_SIZE_M": 128,
      "BLOCK_SIZE_N": 128,
      "num_warps": 1,
      "num_stages": 1,
      "waves_per_eu": 1,
      "stage": 1
    },
    "3170": {
      "BLOCK_SIZE_M": 128,
      "BLOCK_SIZE_N": 256,
      "num_warps": 2,
      "num_stages": 1,
      "waves_per_eu": 4,
      "stage": 3
    },
    "1975": {
      "BLOCK_SIZE_M": 128,
      "BLOCK_SIZE_N": 64,
      "num_warps": 2,
      "num_stages": 1,
      "waves_per_eu": 8,
      "stage": 2
    },
    "2034": {
      "BLOCK_SIZE_M": 128,
      "BLOCK_SIZE_N": 64,
      "num_warps": 2,
      "num_stages": 4,
      "waves_per_eu": 8,
      "stage": 1
    },
    "2318": {
      "BLOCK_SIZE_M": 128,
      "BLOCK_SIZE_N": 64,
      "num_warps": 8,
      "num_stages": 4,
      "waves_per_eu": 1,
      "stage": 3
    },
    "163": {
      "BLOCK_SIZE_M": 64,
      "BLOCK_SIZE_N": 64,
      "num_warps": 2,
      "num_stages": 1,
      "waves_per_eu": 2,
      "stage": 2
    },
    "4809": {
      "BLOCK_SIZE_M": 256,
      "BLOCK_SIZE_N": 256,
      "num_warps": 1,
      "num_stages": 1,
      "waves_per_eu": 1,
      "stage": 4
    },
    "2416": {
      "BLOCK_SIZE_M": 128,
      "BLOCK_SIZE_N": 128,
      "num_warps": 1,
      "num_stages": 1,
      "waves_per_eu": 2,
      "stage": 5
    },
    "4416": {
      "BLOCK_SIZE_M": 256,
      "BLOCK_SIZE_N": 128,
      "num_warps": 2,
      "num_stages": 4,
      "waves_per_eu": 1,
      "stage": 1
    },
    "3906": {
      "BLOCK_SIZE_M": 256,
      "BLOCK_SIZE_N": 64,
      "num_warps": 4,
      "num_stages": 1,
      "waves_per_eu": 1,
      "stage": 1
    },
    "4414": {
      "BLOCK_SIZE_M": 256,
      "BLOCK_SIZE_N": 128,
      "num_warps": 2,
      "num_stages": 4,
      "waves_per_eu": 0,
      "stage": 5
    },
    "1818": {
      "BLOCK_SIZE_M": 128,
      "BLOCK_SIZE_N": 64,
      "num_warps": 1,
      "num_stages": 1,
      "waves_per_eu": 4,
      "stage": 1
    },
    "2484": {
      "BLOCK_SIZE_M": 128,
      "BLOCK_SIZE_N": 128,
      "num_warps": 1,
      "num_stages": 4,
      "waves_per_eu": 8,
      "stage": 1
    },
    "179": {
      "BLOCK_SIZE_M": 64,
      "BLOCK_SIZE_N": 64,
      "num_warps": 2,
      "num_stages": 1,
      "waves_per_eu": 8,
      "stage": 6
    },
    "4700": {
      "BLOCK_SIZE_M": 256,
      "BLOCK_SIZE_N": 128,
      "num_warps": 8,
      "num_stages": 2,
      "waves_per_eu": 4,
      "stage": 3
    },
    "47": {
      "BLOCK_SIZE_M": 64,
      "BLOCK_SIZE_N": 64,
      "num_warps": 1,
      "num_stages": 2,
      "waves_per_eu": 2,
      "stage": 6
    },
    "3779": {
      "BLOCK_SIZE_M": 256,
      "BLOCK_SIZE_N": 64,
      "num_warps": 2,
      "num_stages": 1,
      "waves_per_eu": 8,
      "stage": 6
    },
    "2741": {
      "BLOCK_SIZE_M": 128,
      "BLOCK_SIZE_N": 128,
      "num_warps": 4,
      "num_stages": 2,
      "waves_per_eu": 1,
      "stage": 6
    },
    "63": {
      "BLOCK_SIZE_M": 64,
      "BLOCK_SIZE_N": 64,
      "num_warps": 1,
      "num_stages": 4,
      "waves_per_eu": 0,
      "stage": 4
    },
    "178": {
      "BLOCK_SIZE_M": 64,
      "BLOCK_SIZE_N": 64,
      "num_warps": 2,
      "num_stages": 1,
      "waves_per_eu": 8,
      "stage": 5
    },
    "1520": {
      "BLOCK_SIZE_M": 64,
      "BLOCK_SIZE_N": 256,
      "num_warps": 4,
      "num_stages": 1,
      "waves_per_eu": 4,
      "stage": 3
    },
    "3625": {
      "BLOCK_SIZE_M": 256,
      "BLOCK_SIZE_N": 64,
      "num_warps": 1,
      "num_stages": 1,
      "waves_per_eu": 8,
      "stage": 2
    },
    "2313": {
      "BLOCK_SIZE_M": 128,
      "BLOCK_SIZE_N": 64,
      "num_warps": 8,
      "num_stages": 4,
      "waves_per_eu": 0,
      "stage": 4
    },
    "2570": {
      "BLOCK_SIZE_M": 128,
      "BLOCK_SIZE_N": 128,
      "num_warps": 2,
      "num_stages": 1,
      "waves_per_eu": 4,
      "stage": 3
    },
    "3791": {
      "BLOCK_SIZE_M": 256,
      "BLOCK_SIZE_N": 64,
      "num_warps": 2,
      "num_stages": 2,
      "waves_per_eu": 1,
      "stage": 6
    },
    "4120": {
      "BLOCK_SIZE_M": 256,
      "BLOCK_SIZE_N": 64,
      "num_warps": 8,
      "num_stages": 4,
      "waves_per_eu": 1,
      "stage": 5
    },
    "2582": {
      "BLOCK_SIZE_M": 128,
      "BLOCK_SIZE_N": 128,
      "num_warps": 2,
      "num_stages": 2,
      "waves_per_eu": 0,
      "stage": 3
    },
    "323": {
      "BLOCK_SIZE_M": 64,
      "BLOCK_SIZE_N": 64,
      "num_warps": 4,
      "num_stages": 1,
      "waves_per_eu": 4,
      "stage": 6
    },
    "3607": {
      "BLOCK_SIZE_M": 256,
      "BLOCK_SIZE_N": 64,
      "num_warps": 1,
      "num_stages": 1,
      "waves_per_eu": 1,
      "stage": 2
    },
    "2559": {
      "BLOCK_SIZE_M": 128,
      "BLOCK_SIZE_N": 128,
      "num_warps": 2,
      "num_stages": 1,
      "waves_per_eu": 1,
      "stage": 4
    },
    "4213": {
      "BLOCK_SIZE_M": 256,
      "BLOCK_SIZE_N": 128,
      "num_warps": 1,
      "num_stages": 1,
      "waves_per_eu": 2,
      "stage": 2
    },
    "1092": {
      "BLOCK_SIZE_M": 64,
      "BLOCK_SIZE_N": 128,
      "num_warps": 8,
      "num_stages": 2,
      "waves_per_eu": 2,
      "stage": 1
    },
    "4054": {
      "BLOCK_SIZE_M": 256,
      "BLOCK_SIZE_N": 64,
      "num_warps": 8,
      "num_stages": 1,
      "waves_per_eu": 0,
      "stage": 5
    },
    "3171": {
      "BLOCK_SIZE_M": 128,
      "BLOCK_SIZE_N": 256,
      "num_warps": 2,
      "num_stages": 1,
      "waves_per_eu": 4,
      "stage": 4
    },
    "227": {
      "BLOCK_SIZE_M": 64,
      "BLOCK_SIZE_N": 64,
      "num_warps": 2,
      "num_stages": 4,
      "waves_per_eu": 2,
      "stage": 6
    },
    "2720": {
      "BLOCK_SIZE_M": 128,
      "BLOCK_SIZE_N": 128,
      "num_warps": 4,
      "num_stages": 1,
      "waves_per_eu": 4,
      "stage": 3
    },
    "5126": {
      "BLOCK_SIZE_M": 256,
      "BLOCK_SIZE_N": 256,
      "num_warps": 4,
      "num_stages": 1,
      "waves_per_eu": 8,
      "stage": 3
    },
    "1080": {
      "BLOCK_SIZE_M": 64,
      "BLOCK_SIZE_N": 128,
      "num_warps": 8,
      "num_stages": 2,
      "waves_per_eu": 0,
      "stage": 1
    },
    "1659": {
      "BLOCK_SIZE_M": 64,
      "BLOCK_SIZE_N": 256,
      "num_warps": 8,
      "num_stages": 1,
      "waves_per_eu": 1,
      "stage": 4
    },
    "1065": {
      "BLOCK_SIZE_M": 64,
      "BLOCK_SIZE_N": 128,
      "num_warps": 8,
      "num_stages": 1,
      "waves_per_eu": 2,
      "stage": 4
    },
    "2729": {
      "BLOCK_SIZE_M": 128,
      "BLOCK_SIZE_N": 128,
      "num_warps": 4,
      "num_stages": 1,
      "waves_per_eu": 8,
      "stage": 6
    },
    "3835": {
      "BLOCK_SIZE_M": 256,
      "BLOCK_SIZE_N": 64,
      "num_warps": 2,
      "num_stages": 4,
      "waves_per_eu": 8,
      "stage": 2
    },
    "1671": {
      "BLOCK_SIZE_M": 64,
      "BLOCK_SIZE_N": 256,
      "num_warps": 8,
      "num_stages": 1,
      "waves_per_eu": 4,
      "stage": 4
    },
    "355": {
      "BLOCK_SIZE_M": 64,
      "BLOCK_SIZE_N": 64,
      "num_warps": 4,
      "num_stages": 2,
      "waves_per_eu": 8,
      "stage": 2
    },
    "2025": {
      "BLOCK_SIZE_M": 128,
      "BLOCK_SIZE_N": 64,
      "num_warps": 2,
      "num_stages": 4,
      "waves_per_eu": 2,
      "stage": 4
    },
    "679": {
      "BLOCK_SIZE_M": 64,
      "BLOCK_SIZE_N": 128,
      "num_warps": 1,
      "num_stages": 4,
      "waves_per_eu": 4,
      "stage": 2
    },
    "3318": {
      "BLOCK_SIZE_M": 128,
      "BLOCK_SIZE_N": 256,
      "num_warps": 4,
      "num_stages": 1,
      "waves_per_eu": 4,
      "stage": 1
    },
    "788": {
      "BLOCK_SIZE_M": 64,
      "BLOCK_SIZE_N": 128,
      "num_warps": 2,
      "num_stages": 2,
      "waves_per_eu": 1,
      "stage": 3
    },
    "3949": {
      "BLOCK_SIZE_M": 256,
      "BLOCK_SIZE_N": 64,
      "num_warps": 4,
      "num_stages": 2,
      "waves_per_eu": 4,
      "stage": 2
    },
    "3788": {
      "BLOCK_SIZE_M": 256,
      "BLOCK_SIZE_N": 64,
      "num_warps": 2,
      "num_stages": 2,
      "waves_per_eu": 1,
      "stage": 3
    },
    "651": {
      "BLOCK_SIZE_M": 64,
      "BLOCK_SIZE_N": 128,
      "num_warps": 1,
      "num_stages": 2,
      "waves_per_eu": 4,
      "stage": 4
    },
    "2019": {
      "BLOCK_SIZE_M": 128,
      "BLOCK_SIZE_N": 64,
      "num_warps": 2,
      "num_stages": 4,
      "waves_per_eu": 1,
      "stage": 4
    },
    "53": {
      "BLOCK_SIZE_M": 64,
      "BLOCK_SIZE_N": 64,
      "num_warps": 1,
      "num_stages": 2,
      "waves_per_eu": 4,
      "stage": 6
    },
    "2108": {
      "BLOCK_SIZE_M": 128,
      "BLOCK_SIZE_N": 64,
      "num_warps": 4,
      "num_stages": 1,
      "waves_per_eu": 1,
      "stage": 3
    },
    "2185": {
      "BLOCK_SIZE_M": 128,
      "BLOCK_SIZE_N": 64,
      "num_warps": 4,
      "num_stages": 4,
      "waves_per_eu": 8,
      "stage": 2
    },
    "5251": {
      "BLOCK_SIZE_M": 256,
      "BLOCK_SIZE_N": 256,
      "num_warps": 8,
      "num_stages": 1,
      "waves_per_eu": 0,
      "stage": 2
    },
    "1849": {
      "BLOCK_SIZE_M": 128,
      "BLOCK_SIZE_N": 64,
      "num_warps": 1,
      "num_stages": 2,
      "waves_per_eu": 4,
      "stage": 2
    },
    "1517": {
      "BLOCK_SIZE_M": 64,
      "BLOCK_SIZE_N": 256,
      "num_warps": 4,
      "num_stages": 1,
      "waves_per_eu": 2,
      "stage": 6
    },
    "754": {
      "BLOCK_SIZE_M": 64,
      "BLOCK_SIZE_N": 128,
      "num_warps": 2,
      "num_stages": 1,
      "waves_per_eu": 0,
      "stage": 5
    },
    "685": {
      "BLOCK_SIZE_M": 64,
      "BLOCK_SIZE_N": 128,
      "num_warps": 1,
      "num_stages": 4,
      "waves_per_eu": 8,
      "stage": 2
    },
    "4699": {
      "BLOCK_SIZE_M": 256,
      "BLOCK_SIZE_N": 128,
      "num_warps": 8,
      "num_stages": 2,
      "waves_per_eu": 4,
      "stage": 2
    },
    "181": {
      "BLOCK_SIZE_M": 64,
      "BLOCK_SIZE_N": 64,
      "num_warps": 2,
      "num_stages": 2,
      "waves_per_eu": 0,
      "stage": 2
    },
    "492": {
      "BLOCK_SIZE_M": 64,
      "BLOCK_SIZE_N": 64,
      "num_warps": 8,
      "num_stages": 2,
      "waves_per_eu": 2,
      "stage": 1
    },
    "1985": {
      "BLOCK_SIZE_M": 128,
      "BLOCK_SIZE_N": 64,
      "num_warps": 2,
      "num_stages": 2,
      "waves_per_eu": 0,
      "stage": 6
    },
    "2124": {
      "BLOCK_SIZE_M": 128,
      "BLOCK_SIZE_N": 64,
      "num_warps": 4,
      "num_stages": 1,
      "waves_per_eu": 8,
      "stage": 1
    },
    "2864": {
      "BLOCK_SIZE_M": 128,
      "BLOCK_SIZE_N": 128,
      "num_warps": 8,
      "num_stages": 1,
      "waves_per_eu": 2,
      "stage": 3
    },
    "4222": {
      "BLOCK_SIZE_M": 256,
      "BLOCK_SIZE_N": 128,
      "num_warps": 1,
      "num_stages": 1,
      "waves_per_eu": 4,
      "stage": 5
    },
    "479": {
      "BLOCK_SIZE_M": 64,
      "BLOCK_SIZE_N": 64,
      "num_warps": 8,
      "num_stages": 1,
      "waves_per_eu": 8,
      "stage": 6
    },
    "2588": {
      "BLOCK_SIZE_M": 128,
      "BLOCK_SIZE_N": 128,
      "num_warps": 2,
      "num_stages": 2,
      "waves_per_eu": 1,
      "stage": 3
    },
    "1836": {
      "BLOCK_SIZE_M": 128,
      "BLOCK_SIZE_N": 64,
      "num_warps": 1,
      "num_stages": 2,
      "waves_per_eu": 1,
      "stage": 1
    },
    "3005": {
      "BLOCK_SIZE_M": 128,
      "BLOCK_SIZE_N": 256,
      "num_warps": 1,
      "num_stages": 1,
      "waves_per_eu": 0,
      "stage": 6
    },
    "4670": {
      "BLOCK_SIZE_M": 256,
      "BLOCK_SIZE_N": 128,
      "num_warps": 8,
      "num_stages": 1,
      "waves_per_eu": 4,
      "stage": 3
    },
    "2784": {
      "BLOCK_SIZE_M": 128,
      "BLOCK_SIZE_N": 128,
      "num_warps": 4,
      "num_stages": 4,
      "waves_per_eu": 8,
      "stage": 1
    },
    "4393": {
      "BLOCK_SIZE_M": 256,
      "BLOCK_SIZE_N": 128,
      "num_warps": 2,
      "num_stages": 2,
      "waves_per_eu": 2,
      "stage": 2
    },
    "345": {
      "BLOCK_SIZE_M": 64,
      "BLOCK_SIZE_N": 64,
      "num_warps": 4,
      "num_stages": 2,
      "waves_per_eu": 2,
      "stage": 4
    },
    "212": {
      "BLOCK_SIZE_M": 64,
      "BLOCK_SIZE_N": 64,
      "num_warps": 2,
      "num_stages": 4,
      "waves_per_eu": 0,
      "stage": 3
    },
    "759": {
      "BLOCK_SIZE_M": 64,
      "BLOCK_SIZE_N": 128,
      "num_warps": 2,
      "num_stages": 1,
      "waves_per_eu": 1,
      "stage": 4
    },
    "2419": {
      "BLOCK_SIZE_M": 128,
      "BLOCK_SIZE_N": 128,
      "num_warps": 1,
      "num_stages": 1,
      "waves_per_eu": 4,
      "stage": 2
    },
    "4672": {
      "BLOCK_SIZE_M": 256,
      "BLOCK_SIZE_N": 128,
      "num_warps": 8,
      "num_stages": 1,
      "waves_per_eu": 4,
      "stage": 5
    },
    "2265": {
      "BLOCK_SIZE_M": 128,
      "BLOCK_SIZE_N": 64,
      "num_warps": 8,
      "num_stages": 1,
      "waves_per_eu": 2,
      "stage": 4
    },
    "2616": {
      "BLOCK_SIZE_M": 128,
      "BLOCK_SIZE_N": 128,
      "num_warps": 2,
      "num_stages": 4,
      "waves_per_eu": 1,
      "stage": 1
    },
    "486": {
      "BLOCK_SIZE_M": 64,
      "BLOCK_SIZE_N": 64,
      "num_warps": 8,
      "num_stages": 2,
      "waves_per_eu": 1,
      "stage": 1
    },
    "1822": {
      "BLOCK_SIZE_M": 128,
      "BLOCK_SIZE_N": 64,
      "num_warps": 1,
      "num_stages": 1,
      "waves_per_eu": 4,
      "stage": 5
    },
    "4129": {
      "BLOCK_SIZE_M": 256,
      "BLOCK_SIZE_N": 64,
      "num_warps": 8,
      "num_stages": 4,
      "waves_per_eu": 4,
      "stage": 2
    },
    "3780": {
      "BLOCK_SIZE_M": 256,
      "BLOCK_SIZE_N": 64,
      "num_warps": 2,
      "num_stages": 2,
      "waves_per_eu": 0,
      "stage": 1
    },
    "4583": {
      "BLOCK_SIZE_M": 256,
      "BLOCK_SIZE_N": 128,
      "num_warps": 4,
      "num_stages": 4,
      "waves_per_eu": 4,
      "stage": 6
    },
    "3668": {
      "BLOCK_SIZE_M": 256,
      "BLOCK_SIZE_N": 64,
      "num_warps": 1,
      "num_stages": 4,
      "waves_per_eu": 1,
      "stage": 3
    },
    "2127": {
      "BLOCK_SIZE_M": 128,
      "BLOCK_SIZE_N": 64,
      "num_warps": 4,
      "num_stages": 1,
      "waves_per_eu": 8,
      "stage": 4
    },
    "2182": {
      "BLOCK_SIZE_M": 128,
      "BLOCK_SIZE_N": 64,
      "num_warps": 4,
      "num_stages": 4,
      "waves_per_eu": 4,
      "stage": 5
    },
    "539": {
      "BLOCK_SIZE_M": 64,
      "BLOCK_SIZE_N": 64,
      "num_warps": 8,
      "num_stages": 4,
      "waves_per_eu": 8,
      "stage": 6
    },
    "2554": {
      "BLOCK_SIZE_M": 128,
      "BLOCK_SIZE_N": 128,
      "num_warps": 2,
      "num_stages": 1,
      "waves_per_eu": 0,
      "stage": 5
    },
    "4669": {
      "BLOCK_SIZE_M": 256,
      "BLOCK_SIZE_N": 128,
      "num_warps": 8,
      "num_stages": 1,
      "waves_per_eu": 4,
      "stage": 2
    },
    "1058": {
      "BLOCK_SIZE_M": 64,
      "BLOCK_SIZE_N": 128,
      "num_warps": 8,
      "num_stages": 1,
      "waves_per_eu": 1,
      "stage": 3
    },
    "4108": {
      "BLOCK_SIZE_M": 256,
      "BLOCK_SIZE_N": 64,
      "num_warps": 8,
      "num_stages": 2,
      "waves_per_eu": 8,
      "stage": 5
    },
    "2619": {
      "BLOCK_SIZE_M": 128,
      "BLOCK_SIZE_N": 128,
      "num_warps": 2,
      "num_stages": 4,
      "waves_per_eu": 1,
      "stage": 4
    },
    "629": {
      "BLOCK_SIZE_M": 64,
      "BLOCK_SIZE_N": 128,
      "num_warps": 1,
      "num_stages": 1,
      "waves_per_eu": 8,
      "stage": 6
    },
    "4122": {
      "BLOCK_SIZE_M": 256,
      "BLOCK_SIZE_N": 64,
      "num_warps": 8,
      "num_stages": 4,
      "waves_per_eu": 2,
      "stage": 1
    },
    "4392": {
      "BLOCK_SIZE_M": 256,
      "BLOCK_SIZE_N": 128,
      "num_warps": 2,
      "num_stages": 2,
      "waves_per_eu": 2,
      "stage": 1
    },
    "498": {
      "BLOCK_SIZE_M": 64,
      "BLOCK_SIZE_N": 64,
      "num_warps": 8,
      "num_stages": 2,
      "waves_per_eu": 4,
      "stage": 1
    },
    "4818": {
      "BLOCK_SIZE_M": 256,
      "BLOCK_SIZE_N": 256,
      "num_warps": 1,
      "num_stages": 1,
      "waves_per_eu": 4,
      "stage": 1
    },
    "3827": {
      "BLOCK_SIZE_M": 256,
      "BLOCK_SIZE_N": 64,
      "num_warps": 2,
      "num_stages": 4,
      "waves_per_eu": 2,
      "stage": 6
    },
    "3934": {
      "BLOCK_SIZE_M": 256,
      "BLOCK_SIZE_N": 64,
      "num_warps": 4,
      "num_stages": 2,
      "waves_per_eu": 0,
      "stage": 5
    },
    "2722": {
      "BLOCK_SIZE_M": 128,
      "BLOCK_SIZE_N": 128,
      "num_warps": 4,
      "num_stages": 1,
      "waves_per_eu": 4,
      "stage": 5
    },
    "1868": {
      "BLOCK_SIZE_M": 128,
      "BLOCK_SIZE_N": 64,
      "num_warps": 1,
      "num_stages": 4,
      "waves_per_eu": 1,
      "stage": 3
    },
    "1990": {
      "BLOCK_SIZE_M": 128,
      "BLOCK_SIZE_N": 64,
      "num_warps": 2,
      "num_stages": 2,
      "waves_per_eu": 1,
      "stage": 5
    },
    "1887": {
      "BLOCK_SIZE_M": 128,
      "BLOCK_SIZE_N": 64,
      "num_warps": 1,
      "num_stages": 4,
      "waves_per_eu": 8,
      "stage": 4
    },
    "3969": {
      "BLOCK_SIZE_M": 256,
      "BLOCK_SIZE_N": 64,
      "num_warps": 4,
      "num_stages": 4,
      "waves_per_eu": 1,
      "stage": 4
    },
    "2325": {
      "BLOCK_SIZE_M": 128,
      "BLOCK_SIZE_N": 64,
      "num_warps": 8,
      "num_stages": 4,
      "waves_per_eu": 2,
      "stage": 4
    },
    "1858": {
      "BLOCK_SIZE_M": 128,
      "BLOCK_SIZE_N": 64,
      "num_warps": 1,
      "num_stages": 2,
      "waves_per_eu": 8,
      "stage": 5
    },
    "319": {
      "BLOCK_SIZE_M": 64,
      "BLOCK_SIZE_N": 64,
      "num_warps": 4,
      "num_stages": 1,
      "waves_per_eu": 4,
      "stage": 2
    },
    "89": {
      "BLOCK_SIZE_M": 64,
      "BLOCK_SIZE_N": 64,
      "num_warps": 1,
      "num_stages": 4,
      "waves_per_eu": 8,
      "stage": 6
    },
    "4668": {
      "BLOCK_SIZE_M": 256,
      "BLOCK_SIZE_N": 128,
      "num_warps": 8,
      "num_stages": 1,
      "waves_per_eu": 4,
      "stage": 1
    },
    "324": {
      "BLOCK_SIZE_M": 64,
      "BLOCK_SIZE_N": 64,
      "num_warps": 4,
      "num_stages": 1,
      "waves_per_eu": 8,
      "stage": 1
    },
    "3628": {
      "BLOCK_SIZE_M": 256,
      "BLOCK_SIZE_N": 64,
      "num_warps": 1,
      "num_stages": 1,
      "waves_per_eu": 8,
      "stage": 5
    },
    "313": {
      "BLOCK_SIZE_M": 64,
      "BLOCK_SIZE_N": 64,
      "num_warps": 4,
      "num_stages": 1,
      "waves_per_eu": 2,
      "stage": 2
    },
    "27": {
      "BLOCK_SIZE_M": 64,
      "BLOCK_SIZE_N": 64,
      "num_warps": 1,
      "num_stages": 1,
      "waves_per_eu": 8,
      "stage": 4
    },
    "2017": {
      "BLOCK_SIZE_M": 128,
      "BLOCK_SIZE_N": 64,
      "num_warps": 2,
      "num_stages": 4,
      "waves_per_eu": 1,
      "stage": 2
    },
    "1828": {
      "BLOCK_SIZE_M": 128,
      "BLOCK_SIZE_N": 64,
      "num_warps": 1,
      "num_stages": 1,
      "waves_per_eu": 8,
      "stage": 5
    },
    "2159": {
      "BLOCK_SIZE_M": 128,
      "BLOCK_SIZE_N": 64,
      "num_warps": 4,
      "num_stages": 2,
      "waves_per_eu": 8,
      "stage": 6
    },
    "4438": {
      "BLOCK_SIZE_M": 256,
      "BLOCK_SIZE_N": 128,
      "num_warps": 2,
      "num_stages": 4,
      "waves_per_eu": 8,
      "stage": 5
    },
    "1053": {
      "BLOCK_SIZE_M": 64,
      "BLOCK_SIZE_N": 128,
      "num_warps": 8,
      "num_stages": 1,
      "waves_per_eu": 0,
      "stage": 4
    },
    "3938": {
      "BLOCK_SIZE_M": 256,
      "BLOCK_SIZE_N": 64,
      "num_warps": 4,
      "num_stages": 2,
      "waves_per_eu": 1,
      "stage": 3
    },
    "4969": {
      "BLOCK_SIZE_M": 256,
      "BLOCK_SIZE_N": 256,
      "num_warps": 2,
      "num_stages": 1,
      "waves_per_eu": 4,
      "stage": 2
    },
    "3614": {
      "BLOCK_SIZE_M": 256,
      "BLOCK_SIZE_N": 64,
      "num_warps": 1,
      "num_stages": 1,
      "waves_per_eu": 2,
      "stage": 3
    },
    "816": {
      "BLOCK_SIZE_M": 64,
      "BLOCK_SIZE_N": 128,
      "num_warps": 2,
      "num_stages": 4,
      "waves_per_eu": 1,
      "stage": 1
    },
    "2101": {
      "BLOCK_SIZE_M": 128,
      "BLOCK_SIZE_N": 64,
      "num_warps": 4,
      "num_stages": 1,
      "waves_per_eu": 0,
      "stage": 2
    },
    "5262": {
      "BLOCK_SIZE_M": 256,
      "BLOCK_SIZE_N": 256,
      "num_warps": 8,
      "num_stages": 1,
      "waves_per_eu": 2,
      "stage": 1
    },
    "4384": {
      "BLOCK_SIZE_M": 256,
      "BLOCK_SIZE_N": 128,
      "num_warps": 2,
      "num_stages": 2,
      "waves_per_eu": 0,
      "stage": 5
    },
    "455": {
      "BLOCK_SIZE_M": 64,
      "BLOCK_SIZE_N": 64,
      "num_warps": 8,
      "num_stages": 1,
      "waves_per_eu": 0,
      "stage": 6
    },
    "2164": {
      "BLOCK_SIZE_M": 128,
      "BLOCK_SIZE_N": 64,
      "num_warps": 4,
      "num_stages": 4,
      "waves_per_eu": 0,
      "stage": 5
    },
    "84": {
      "BLOCK_SIZE_M": 64,
      "BLOCK_SIZE_N": 64,
      "num_warps": 1,
      "num_stages": 4,
      "waves_per_eu": 8,
      "stage": 1
    },
    "1803": {
      "BLOCK_SIZE_M": 128,
      "BLOCK_SIZE_N": 64,
      "num_warps": 1,
      "num_stages": 1,
      "waves_per_eu": 0,
      "stage": 4
    },
    "4666": {
      "BLOCK_SIZE_M": 256,
      "BLOCK_SIZE_N": 128,
      "num_warps": 8,
      "num_stages": 1,
      "waves_per_eu": 2,
      "stage": 5
    },
    "661": {
      "BLOCK_SIZE_M": 64,
      "BLOCK_SIZE_N": 128,
      "num_warps": 1,
      "num_stages": 4,
      "waves_per_eu": 0,
      "stage": 2
    },
    "4232": {
      "BLOCK_SIZE_M": 256,
      "BLOCK_SIZE_N": 128,
      "num_warps": 1,
      "num_stages": 2,
      "waves_per_eu": 0,
      "stage": 3
    },
    "1074": {
      "BLOCK_SIZE_M": 64,
      "BLOCK_SIZE_N": 128,
      "num_warps": 8,
      "num_stages": 1,
      "waves_per_eu": 8,
      "stage": 1
    },
    "838": {
      "BLOCK_SIZE_M": 64,
      "BLOCK_SIZE_N": 128,
      "num_warps": 2,
      "num_stages": 4,
      "waves_per_eu": 8,
      "stage": 5
    },
    "4": {
      "BLOCK_SIZE_M": 64,
      "BLOCK_SIZE_N": 64,
      "num_warps": 1,
      "num_stages": 1,
      "waves_per_eu": 0,
      "stage": 5
    },
    "3911": {
      "BLOCK_SIZE_M": 256,
      "BLOCK_SIZE_N": 64,
      "num_warps": 4,
      "num_stages": 1,
      "waves_per_eu": 1,
      "stage": 6
    },
    "4652": {
      "BLOCK_SIZE_M": 256,
      "BLOCK_SIZE_N": 128,
      "num_warps": 8,
      "num_stages": 1,
      "waves_per_eu": 0,
      "stage": 3
    },
    "4274": {
      "BLOCK_SIZE_M": 256,
      "BLOCK_SIZE_N": 128,
      "num_warps": 1,
      "num_stages": 4,
      "waves_per_eu": 2,
      "stage": 3
    },
    "4582": {
      "BLOCK_SIZE_M": 256,
      "BLOCK_SIZE_N": 128,
      "num_warps": 4,
      "num_stages": 4,
      "waves_per_eu": 4,
      "stage": 5
    },
    "3662": {
      "BLOCK_SIZE_M": 256,
      "BLOCK_SIZE_N": 64,
      "num_warps": 1,
      "num_stages": 4,
      "waves_per_eu": 0,
      "stage": 3
    },
    "2316": {
      "BLOCK_SIZE_M": 128,
      "BLOCK_SIZE_N": 64,
      "num_warps": 8,
      "num_stages": 4,
      "waves_per_eu": 1,
      "stage": 1
    },
    "3825": {
      "BLOCK_SIZE_M": 256,
      "BLOCK_SIZE_N": 64,
      "num_warps": 2,
      "num_stages": 4,
      "waves_per_eu": 2,
      "stage": 4
    },
    "2581": {
      "BLOCK_SIZE_M": 128,
      "BLOCK_SIZE_N": 128,
      "num_warps": 2,
      "num_stages": 2,
      "waves_per_eu": 0,
      "stage": 2
    },
    "4552": {
      "BLOCK_SIZE_M": 256,
      "BLOCK_SIZE_N": 128,
      "num_warps": 4,
      "num_stages": 2,
      "waves_per_eu": 4,
      "stage": 5
    },
    "3656": {
      "BLOCK_SIZE_M": 256,
      "BLOCK_SIZE_N": 64,
      "num_warps": 1,
      "num_stages": 2,
      "waves_per_eu": 8,
      "stage": 3
    },
    "1988": {
      "BLOCK_SIZE_M": 128,
      "BLOCK_SIZE_N": 64,
      "num_warps": 2,
      "num_stages": 2,
      "waves_per_eu": 1,
      "stage": 3
    },
    "675": {
      "BLOCK_SIZE_M": 64,
      "BLOCK_SIZE_N": 128,
      "num_warps": 1,
      "num_stages": 4,
      "waves_per_eu": 2,
      "stage": 4
    },
    "1676": {
      "BLOCK_SIZE_M": 64,
      "BLOCK_SIZE_N": 256,
      "num_warps": 8,
      "num_stages": 1,
      "waves_per_eu": 8,
      "stage": 3
    },
    "2143": {
      "BLOCK_SIZE_M": 128,
      "BLOCK_SIZE_N": 64,
      "num_warps": 4,
      "num_stages": 2,
      "waves_per_eu": 2,
      "stage": 2
    },
    "522": {
      "BLOCK_SIZE_M": 64,
      "BLOCK_SIZE_N": 64,
      "num_warps": 8,
      "num_stages": 4,
      "waves_per_eu": 2,
      "stage": 1
    },
    "4231": {
      "BLOCK_SIZE_M": 256,
      "BLOCK_SIZE_N": 128,
      "num_warps": 1,
      "num_stages": 2,
      "waves_per_eu": 0,
      "stage": 2
    },
    "3177": {
      "BLOCK_SIZE_M": 128,
      "BLOCK_SIZE_N": 256,
      "num_warps": 2,
      "num_stages": 1,
      "waves_per_eu": 8,
      "stage": 4
    },
    "1838": {
      "BLOCK_SIZE_M": 128,
      "BLOCK_SIZE_N": 64,
      "num_warps": 1,
      "num_stages": 2,
      "waves_per_eu": 1,
      "stage": 3
    },
    "2608": {
      "BLOCK_SIZE_M": 128,
      "BLOCK_SIZE_N": 128,
      "num_warps": 2,
      "num_stages": 2,
      "waves_per_eu": 8,
      "stage": 5
    },
    "37": {
      "BLOCK_SIZE_M": 64,
      "BLOCK_SIZE_N": 64,
      "num_warps": 1,
      "num_stages": 2,
      "waves_per_eu": 1,
      "stage": 2
    },
    "2740": {
      "BLOCK_SIZE_M": 128,
      "BLOCK_SIZE_N": 128,
      "num_warps": 4,
      "num_stages": 2,
      "waves_per_eu": 1,
      "stage": 5
    },
    "2612": {
      "BLOCK_SIZE_M": 128,
      "BLOCK_SIZE_N": 128,
      "num_warps": 2,
      "num_stages": 4,
      "waves_per_eu": 0,
      "stage": 3
    },
    "2023": {
      "BLOCK_SIZE_M": 128,
      "BLOCK_SIZE_N": 64,
      "num_warps": 2,
      "num_stages": 4,
      "waves_per_eu": 2,
      "stage": 2
    },
    "1350": {
      "BLOCK_SIZE_M": 64,
      "BLOCK_SIZE_N": 256,
      "num_warps": 2,
      "num_stages": 1,
      "waves_per_eu": 0,
      "stage": 1
    },
    "4529": {
      "BLOCK_SIZE_M": 256,
      "BLOCK_SIZE_N": 128,
      "num_warps": 4,
      "num_stages": 1,
      "waves_per_eu": 8,
      "stage": 6
    },
    "303": {
      "BLOCK_SIZE_M": 64,
      "BLOCK_SIZE_N": 64,
      "num_warps": 4,
      "num_stages": 1,
      "waves_per_eu": 0,
      "stage": 4
    },
    "1524": {
      "BLOCK_SIZE_M": 64,
      "BLOCK_SIZE_N": 256,
      "num_warps": 4,
      "num_stages": 1,
      "waves_per_eu": 8,
      "stage": 1
    },
    "3660": {
      "BLOCK_SIZE_M": 256,
      "BLOCK_SIZE_N": 64,
      "num_warps": 1,
      "num_stages": 4,
      "waves_per_eu": 0,
      "stage": 1
    },
    "4426": {
      "BLOCK_SIZE_M": 256,
      "BLOCK_SIZE_N": 128,
      "num_warps": 2,
      "num_stages": 4,
      "waves_per_eu": 2,
      "stage": 5
    },
    "615": {
      "BLOCK_SIZE_M": 64,
      "BLOCK_SIZE_N": 128,
      "num_warps": 1,
      "num_stages": 1,
      "waves_per_eu": 2,
      "stage": 4
    },
    "3631": {
      "BLOCK_SIZE_M": 256,
      "BLOCK_SIZE_N": 64,
      "num_warps": 1,
      "num_stages": 2,
      "waves_per_eu": 0,
      "stage": 2
    },
    "5267": {
      "BLOCK_SIZE_M": 256,
      "BLOCK_SIZE_N": 256,
      "num_warps": 8,
      "num_stages": 1,
      "waves_per_eu": 2,
      "stage": 6
    },
    "4532": {
      "BLOCK_SIZE_M": 256,
      "BLOCK_SIZE_N": 128,
      "num_warps": 4,
      "num_stages": 2,
      "waves_per_eu": 0,
      "stage": 3
    },
    "302": {
      "BLOCK_SIZE_M": 64,
      "BLOCK_SIZE_N": 64,
      "num_warps": 4,
      "num_stages": 1,
      "waves_per_eu": 0,
      "stage": 3
    },
    "2334": {
      "BLOCK_SIZE_M": 128,
      "BLOCK_SIZE_N": 64,
      "num_warps": 8,
      "num_stages": 4,
      "waves_per_eu": 8,
      "stage": 1
    },
    "902": {
      "BLOCK_SIZE_M": 64,
      "BLOCK_SIZE_N": 128,
      "num_warps": 4,
      "num_stages": 1,
      "waves_per_eu": 0,
      "stage": 3
    },
    "4258": {
      "BLOCK_SIZE_M": 256,
      "BLOCK_SIZE_N": 128,
      "num_warps": 1,
      "num_stages": 2,
      "waves_per_eu": 8,
      "stage": 5
    },
    "2330": {
      "BLOCK_SIZE_M": 128,
      "BLOCK_SIZE_N": 64,
      "num_warps": 8,
      "num_stages": 4,
      "waves_per_eu": 4,
      "stage": 3
    },
    "318": {
      "BLOCK_SIZE_M": 64,
      "BLOCK_SIZE_N": 64,
      "num_warps": 4,
      "num_stages": 1,
      "waves_per_eu": 4,
      "stage": 1
    },
    "3327": {
      "BLOCK_SIZE_M": 128,
      "BLOCK_SIZE_N": 256,
      "num_warps": 4,
      "num_stages": 1,
      "waves_per_eu": 8,
      "stage": 4
    },
    "4367": {
      "BLOCK_SIZE_M": 256,
      "BLOCK_SIZE_N": 128,
      "num_warps": 2,
      "num_stages": 1,
      "waves_per_eu": 2,
      "stage": 6
    },
    "4208": {
      "BLOCK_SIZE_M": 256,
      "BLOCK_SIZE_N": 128,
      "num_warps": 1,
      "num_stages": 1,
      "waves_per_eu": 1,
      "stage": 3
    },
    "308": {
      "BLOCK_SIZE_M": 64,
      "BLOCK_SIZE_N": 64,
      "num_warps": 4,
      "num_stages": 1,
      "waves_per_eu": 1,
      "stage": 3
    },
    "2166": {
      "BLOCK_SIZE_M": 128,
      "BLOCK_SIZE_N": 64,
      "num_warps": 4,
      "num_stages": 4,
      "waves_per_eu": 1,
      "stage": 1
    },
    "2436": {
      "BLOCK_SIZE_M": 128,
      "BLOCK_SIZE_N": 128,
      "num_warps": 1,
      "num_stages": 2,
      "waves_per_eu": 1,
      "stage": 1
    },
    "2401": {
      "BLOCK_SIZE_M": 128,
      "BLOCK_SIZE_N": 128,
      "num_warps": 1,
      "num_stages": 1,
      "waves_per_eu": 0,
      "stage": 2
    },
    "2287": {
      "BLOCK_SIZE_M": 128,
      "BLOCK_SIZE_N": 64,
      "num_warps": 8,
      "num_stages": 2,
      "waves_per_eu": 1,
      "stage": 2
    },
    "532": {
      "BLOCK_SIZE_M": 64,
      "BLOCK_SIZE_N": 64,
      "num_warps": 8,
      "num_stages": 4,
      "waves_per_eu": 4,
      "stage": 5
    },
    "904": {
      "BLOCK_SIZE_M": 64,
      "BLOCK_SIZE_N": 128,
      "num_warps": 4,
      "num_stages": 1,
      "waves_per_eu": 0,
      "stage": 5
    },
    "920": {
      "BLOCK_SIZE_M": 64,
      "BLOCK_SIZE_N": 128,
      "num_warps": 4,
      "num_stages": 1,
      "waves_per_eu": 4,
      "stage": 3
    },
    "1889": {
      "BLOCK_SIZE_M": 128,
      "BLOCK_SIZE_N": 64,
      "num_warps": 1,
      "num_stages": 4,
      "waves_per_eu": 8,
      "stage": 6
    },
    "1809": {
      "BLOCK_SIZE_M": 128,
      "BLOCK_SIZE_N": 64,
      "num_warps": 1,
      "num_stages": 1,
      "waves_per_eu": 1,
      "stage": 4
    },
    "2425": {
      "BLOCK_SIZE_M": 128,
      "BLOCK_SIZE_N": 128,
      "num_warps": 1,
      "num_stages": 1,
      "waves_per_eu": 8,
      "stage": 2
    },
    "512": {
      "BLOCK_SIZE_M": 64,
      "BLOCK_SIZE_N": 64,
      "num_warps": 8,
      "num_stages": 4,
      "waves_per_eu": 0,
      "stage": 3
    },
    "643": {
      "BLOCK_SIZE_M": 64,
      "BLOCK_SIZE_N": 128,
      "num_warps": 1,
      "num_stages": 2,
      "waves_per_eu": 2,
      "stage": 2
    },
    "2786": {
      "BLOCK_SIZE_M": 128,
      "BLOCK_SIZE_N": 128,
      "num_warps": 4,
      "num_stages": 4,
      "waves_per_eu": 8,
      "stage": 3
    },
    "3677": {
      "BLOCK_SIZE_M": 256,
      "BLOCK_SIZE_N": 64,
      "num_warps": 1,
      "num_stages": 4,
      "waves_per_eu": 2,
      "stage": 6
    },
    "3680": {
      "BLOCK_SIZE_M": 256,
      "BLOCK_SIZE_N": 64,
      "num_warps": 1,
      "num_stages": 4,
      "waves_per_eu": 4,
      "stage": 3
    },
    "2295": {
      "BLOCK_SIZE_M": 128,
      "BLOCK_SIZE_N": 64,
      "num_warps": 8,
      "num_stages": 2,
      "waves_per_eu": 2,
      "stage": 4
    },
    "5269": {
      "BLOCK_SIZE_M": 256,
      "BLOCK_SIZE_N": 256,
      "num_warps": 8,
      "num_stages": 1,
      "waves_per_eu": 4,
      "stage": 2
    },
    "153": {
      "BLOCK_SIZE_M": 64,
      "BLOCK_SIZE_N": 64,
      "num_warps": 2,
      "num_stages": 1,
      "waves_per_eu": 0,
      "stage": 4
    },
    "1660": {
      "BLOCK_SIZE_M": 64,
      "BLOCK_SIZE_N": 256,
      "num_warps": 8,
      "num_stages": 1,
      "waves_per_eu": 1,
      "stage": 5
    },
    "3322": {
      "BLOCK_SIZE_M": 128,
      "BLOCK_SIZE_N": 256,
      "num_warps": 4,
      "num_stages": 1,
      "waves_per_eu": 4,
      "stage": 5
    },
    "483": {
      "BLOCK_SIZE_M": 64,
      "BLOCK_SIZE_N": 64,
      "num_warps": 8,
      "num_stages": 2,
      "waves_per_eu": 0,
      "stage": 4
    },
    "4103": {
      "BLOCK_SIZE_M": 256,
      "BLOCK_SIZE_N": 64,
      "num_warps": 8,
      "num_stages": 2,
      "waves_per_eu": 4,
      "stage": 6
    },
    "4051": {
      "BLOCK_SIZE_M": 256,
      "BLOCK_SIZE_N": 64,
      "num_warps": 8,
      "num_stages": 1,
      "waves_per_eu": 0,
      "stage": 2
    },
    "3302": {
      "BLOCK_SIZE_M": 128,
      "BLOCK_SIZE_N": 256,
      "num_warps": 4,
      "num_stages": 1,
      "waves_per_eu": 0,
      "stage": 3
    },
    "230": {
      "BLOCK_SIZE_M": 64,
      "BLOCK_SIZE_N": 64,
      "num_warps": 2,
      "num_stages": 4,
      "waves_per_eu": 4,
      "stage": 3
    },
    "768": {
      "BLOCK_SIZE_M": 64,
      "BLOCK_SIZE_N": 128,
      "num_warps": 2,
      "num_stages": 1,
      "waves_per_eu": 4,
      "stage": 1
    },
    "3464": {
      "BLOCK_SIZE_M": 128,
      "BLOCK_SIZE_N": 256,
      "num_warps": 8,
      "num_stages": 1,
      "waves_per_eu": 2,
      "stage": 3
    },
    "1376": {
      "BLOCK_SIZE_M": 64,
      "BLOCK_SIZE_N": 256,
      "num_warps": 2,
      "num_stages": 1,
      "waves_per_eu": 8,
      "stage": 3
    },
    "4218": {
      "BLOCK_SIZE_M": 256,
      "BLOCK_SIZE_N": 128,
      "num_warps": 1,
      "num_stages": 1,
      "waves_per_eu": 4,
      "stage": 1
    },
    "537": {
      "BLOCK_SIZE_M": 64,
      "BLOCK_SIZE_N": 64,
      "num_warps": 8,
      "num_stages": 4,
      "waves_per_eu": 8,
      "stage": 4
    },
    "954": {
      "BLOCK_SIZE_M": 64,
      "BLOCK_SIZE_N": 128,
      "num_warps": 4,
      "num_stages": 2,
      "waves_per_eu": 8,
      "stage": 1
    },
    "5122": {
      "BLOCK_SIZE_M": 256,
      "BLOCK_SIZE_N": 256,
      "num_warps": 4,
      "num_stages": 1,
      "waves_per_eu": 4,
      "stage": 5
    },
    "2338": {
      "BLOCK_SIZE_M": 128,
      "BLOCK_SIZE_N": 64,
      "num_warps": 8,
      "num_stages": 4,
      "waves_per_eu": 8,
      "stage": 5
    },
    "2412": {
      "BLOCK_SIZE_M": 128,
      "BLOCK_SIZE_N": 128,
      "num_warps": 1,
      "num_stages": 1,
      "waves_per_eu": 2,
      "stage": 1
    },
    "1883": {
      "BLOCK_SIZE_M": 128,
      "BLOCK_SIZE_N": 64,
      "num_warps": 1,
      "num_stages": 4,
      "waves_per_eu": 4,
      "stage": 6
    },
    "4268": {
      "BLOCK_SIZE_M": 256,
      "BLOCK_SIZE_N": 128,
      "num_warps": 1,
      "num_stages": 4,
      "waves_per_eu": 1,
      "stage": 3
    },
    "2466": {
      "BLOCK_SIZE_M": 128,
      "BLOCK_SIZE_N": 128,
      "num_warps": 1,
      "num_stages": 4,
      "waves_per_eu": 1,
      "stage": 1
    },
    "4223": {
      "BLOCK_SIZE_M": 256,
      "BLOCK_SIZE_N": 128,
      "num_warps": 1,
      "num_stages": 1,
      "waves_per_eu": 4,
      "stage": 6
    },
    "3786": {
      "BLOCK_SIZE_M": 256,
      "BLOCK_SIZE_N": 64,
      "num_warps": 2,
      "num_stages": 2,
      "waves_per_eu": 1,
      "stage": 1
    },
    "4278": {
      "BLOCK_SIZE_M": 256,
      "BLOCK_SIZE_N": 128,
      "num_warps": 1,
      "num_stages": 4,
      "waves_per_eu": 4,
      "stage": 1
    },
    "3671": {
      "BLOCK_SIZE_M": 256,
      "BLOCK_SIZE_N": 64,
      "num_warps": 1,
      "num_stages": 4,
      "waves_per_eu": 1,
      "stage": 6
    },
    "4813": {
      "BLOCK_SIZE_M": 256,
      "BLOCK_SIZE_N": 256,
      "num_warps": 1,
      "num_stages": 1,
      "waves_per_eu": 2,
      "stage": 2
    },
    "2161": {
      "BLOCK_SIZE_M": 128,
      "BLOCK_SIZE_N": 64,
      "num_warps": 4,
      "num_stages": 4,
      "waves_per_eu": 0,
      "stage": 2
    },
    "960": {
      "BLOCK_SIZE_M": 64,
      "BLOCK_SIZE_N": 128,
      "num_warps": 4,
      "num_stages": 4,
      "waves_per_eu": 0,
      "stage": 1
    },
    "4557": {
      "BLOCK_SIZE_M": 256,
      "BLOCK_SIZE_N": 128,
      "num_warps": 4,
      "num_stages": 2,
      "waves_per_eu": 8,
      "stage": 4
    },
    "3766": {
      "BLOCK_SIZE_M": 256,
      "BLOCK_SIZE_N": 64,
      "num_warps": 2,
      "num_stages": 1,
      "waves_per_eu": 2,
      "stage": 5
    },
    "2333": {
      "BLOCK_SIZE_M": 128,
      "BLOCK_SIZE_N": 64,
      "num_warps": 8,
      "num_stages": 4,
      "waves_per_eu": 4,
      "stage": 6
    },
    "1655": {
      "BLOCK_SIZE_M": 64,
      "BLOCK_SIZE_N": 256,
      "num_warps": 8,
      "num_stages": 1,
      "waves_per_eu": 0,
      "stage": 6
    },
    "1102": {
      "BLOCK_SIZE_M": 64,
      "BLOCK_SIZE_N": 128,
      "num_warps": 8,
      "num_stages": 2,
      "waves_per_eu": 4,
      "stage": 5
    },
    "1851": {
      "BLOCK_SIZE_M": 128,
      "BLOCK_SIZE_N": 64,
      "num_warps": 1,
      "num_stages": 2,
      "waves_per_eu": 4,
      "stage": 4
    },
    "463": {
      "BLOCK_SIZE_M": 64,
      "BLOCK_SIZE_N": 64,
      "num_warps": 8,
      "num_stages": 1,
      "waves_per_eu": 2,
      "stage": 2
    },
    "3940": {
      "BLOCK_SIZE_M": 256,
      "BLOCK_SIZE_N": 64,
      "num_warps": 4,
      "num_stages": 2,
      "waves_per_eu": 1,
      "stage": 5
    },
    "1516": {
      "BLOCK_SIZE_M": 64,
      "BLOCK_SIZE_N": 256,
      "num_warps": 4,
      "num_stages": 1,
      "waves_per_eu": 2,
      "stage": 5
    },
    "3975": {
      "BLOCK_SIZE_M": 256,
      "BLOCK_SIZE_N": 64,
      "num_warps": 4,
      "num_stages": 4,
      "waves_per_eu": 2,
      "stage": 4
    },
    "536": {
      "BLOCK_SIZE_M": 64,
      "BLOCK_SIZE_N": 64,
      "num_warps": 8,
      "num_stages": 4,
      "waves_per_eu": 8,
      "stage": 3
    },
    "2485": {
      "BLOCK_SIZE_M": 128,
      "BLOCK_SIZE_N": 128,
      "num_warps": 1,
      "num_stages": 4,
      "waves_per_eu": 8,
      "stage": 2
    },
    "2749": {
      "BLOCK_SIZE_M": 128,
      "BLOCK_SIZE_N": 128,
      "num_warps": 4,
      "num_stages": 2,
      "waves_per_eu": 4,
      "stage": 2
    },
    "4950": {
      "BLOCK_SIZE_M": 256,
      "BLOCK_SIZE_N": 256,
      "num_warps": 2,
      "num_stages": 1,
      "waves_per_eu": 0,
      "stage": 1
    },
    "2474": {
      "BLOCK_SIZE_M": 128,
      "BLOCK_SIZE_N": 128,
      "num_warps": 1,
      "num_stages": 4,
      "waves_per_eu": 2,
      "stage": 3
    },
    "2327": {
      "BLOCK_SIZE_M": 128,
      "BLOCK_SIZE_N": 64,
      "num_warps": 8,
      "num_stages": 4,
      "waves_per_eu": 2,
      "stage": 6
    },
    "2586": {
      "BLOCK_SIZE_M": 128,
      "BLOCK_SIZE_N": 128,
      "num_warps": 2,
      "num_stages": 2,
      "waves_per_eu": 1,
      "stage": 1
    },
    "4968": {
      "BLOCK_SIZE_M": 256,
      "BLOCK_SIZE_N": 256,
      "num_warps": 2,
      "num_stages": 1,
      "waves_per_eu": 4,
      "stage": 1
    },
    "2764": {
      "BLOCK_SIZE_M": 128,
      "BLOCK_SIZE_N": 128,
      "num_warps": 4,
      "num_stages": 4,
      "waves_per_eu": 0,
      "stage": 5
    },
    "642": {
      "BLOCK_SIZE_M": 64,
      "BLOCK_SIZE_N": 128,
      "num_warps": 1,
      "num_stages": 2,
      "waves_per_eu": 2,
      "stage": 1
    },
    "4361": {
      "BLOCK_SIZE_M": 256,
      "BLOCK_SIZE_N": 128,
      "num_warps": 2,
      "num_stages": 1,
      "waves_per_eu": 1,
      "stage": 6
    },
    "793": {
      "BLOCK_SIZE_M": 64,
      "BLOCK_SIZE_N": 128,
      "num_warps": 2,
      "num_stages": 2,
      "waves_per_eu": 2,
      "stage": 2
    },
    "2120": {
      "BLOCK_SIZE_M": 128,
      "BLOCK_SIZE_N": 64,
      "num_warps": 4,
      "num_stages": 1,
      "waves_per_eu": 4,
      "stage": 3
    },
    "4543": {
      "BLOCK_SIZE_M": 256,
      "BLOCK_SIZE_N": 128,
      "num_warps": 4,
      "num_stages": 2,
      "waves_per_eu": 2,
      "stage": 2
    },
    "4427": {
      "BLOCK_SIZE_M": 256,
      "BLOCK_SIZE_N": 128,
      "num_warps": 2,
      "num_stages": 4,
      "waves_per_eu": 2,
      "stage": 6
    },
    "4362": {
      "BLOCK_SIZE_M": 256,
      "BLOCK_SIZE_N": 128,
      "num_warps": 2,
      "num_stages": 1,
      "waves_per_eu": 2,
      "stage": 1
    },
    "3924": {
      "BLOCK_SIZE_M": 256,
      "BLOCK_SIZE_N": 64,
      "num_warps": 4,
      "num_stages": 1,
      "waves_per_eu": 8,
      "stage": 1
    },
    "4262": {
      "BLOCK_SIZE_M": 256,
      "BLOCK_SIZE_N": 128,
      "num_warps": 1,
      "num_stages": 4,
      "waves_per_eu": 0,
      "stage": 3
    },
    "989": {
      "BLOCK_SIZE_M": 64,
      "BLOCK_SIZE_N": 128,
      "num_warps": 4,
      "num_stages": 4,
      "waves_per_eu": 8,
      "stage": 6
    },
    "1881": {
      "BLOCK_SIZE_M": 128,
      "BLOCK_SIZE_N": 64,
      "num_warps": 1,
      "num_stages": 4,
      "waves_per_eu": 4,
      "stage": 4
    },
    "4083": {
      "BLOCK_SIZE_M": 256,
      "BLOCK_SIZE_N": 64,
      "num_warps": 8,
      "num_stages": 2,
      "waves_per_eu": 0,
      "stage": 4
    },
    "459": {
      "BLOCK_SIZE_M": 64,
      "BLOCK_SIZE_N": 64,
      "num_warps": 8,
      "num_stages": 1,
      "waves_per_eu": 1,
      "stage": 4
    },
    "4081": {
      "BLOCK_SIZE_M": 256,
      "BLOCK_SIZE_N": 64,
      "num_warps": 8,
      "num_stages": 2,
      "waves_per_eu": 0,
      "stage": 2
    },
    "2022": {
      "BLOCK_SIZE_M": 128,
      "BLOCK_SIZE_N": 64,
      "num_warps": 2,
      "num_stages": 4,
      "waves_per_eu": 2,
      "stage": 1
    },
    "2336": {
      "BLOCK_SIZE_M": 128,
      "BLOCK_SIZE_N": 64,
      "num_warps": 8,
      "num_stages": 4,
      "waves_per_eu": 8,
      "stage": 3
    },
    "4829": {
      "BLOCK_SIZE_M": 256,
      "BLOCK_SIZE_N": 256,
      "num_warps": 1,
      "num_stages": 1,
      "waves_per_eu": 8,
      "stage": 6
    },
    "4273": {
      "BLOCK_SIZE_M": 256,
      "BLOCK_SIZE_N": 128,
      "num_warps": 1,
      "num_stages": 4,
      "waves_per_eu": 2,
      "stage": 2
    },
    "4512": {
      "BLOCK_SIZE_M": 256,
      "BLOCK_SIZE_N": 128,
      "num_warps": 4,
      "num_stages": 1,
      "waves_per_eu": 2,
      "stage": 1
    },
    "4954": {
      "BLOCK_SIZE_M": 256,
      "BLOCK_SIZE_N": 256,
      "num_warps": 2,
      "num_stages": 1,
      "waves_per_eu": 0,
      "stage": 5
    },
    "2625": {
      "BLOCK_SIZE_M": 128,
      "BLOCK_SIZE_N": 128,
      "num_warps": 2,
      "num_stages": 4,
      "waves_per_eu": 2,
      "stage": 4
    },
    "16": {
      "BLOCK_SIZE_M": 64,
      "BLOCK_SIZE_N": 64,
      "num_warps": 1,
      "num_stages": 1,
      "waves_per_eu": 2,
      "stage": 5
    },
    "5278": {
      "BLOCK_SIZE_M": 256,
      "BLOCK_SIZE_N": 256,
      "num_warps": 8,
      "num_stages": 1,
      "waves_per_eu": 8,
      "stage": 5
    },
    "20": {
      "BLOCK_SIZE_M": 64,
      "BLOCK_SIZE_N": 64,
      "num_warps": 1,
      "num_stages": 1,
      "waves_per_eu": 4,
      "stage": 3
    },
    "3471": {
      "BLOCK_SIZE_M": 128,
      "BLOCK_SIZE_N": 256,
      "num_warps": 8,
      "num_stages": 1,
      "waves_per_eu": 4,
      "stage": 4
    },
    "3651": {
      "BLOCK_SIZE_M": 256,
      "BLOCK_SIZE_N": 64,
      "num_warps": 1,
      "num_stages": 2,
      "waves_per_eu": 4,
      "stage": 4
    },
    "4698": {
      "BLOCK_SIZE_M": 256,
      "BLOCK_SIZE_N": 128,
      "num_warps": 8,
      "num_stages": 2,
      "waves_per_eu": 4,
      "stage": 1
    },
    "1857": {
      "BLOCK_SIZE_M": 128,
      "BLOCK_SIZE_N": 64,
      "num_warps": 1,
      "num_stages": 2,
      "waves_per_eu": 8,
      "stage": 4
    },
    "1087": {
      "BLOCK_SIZE_M": 64,
      "BLOCK_SIZE_N": 128,
      "num_warps": 8,
      "num_stages": 2,
      "waves_per_eu": 1,
      "stage": 2
    },
    "5277": {
      "BLOCK_SIZE_M": 256,
      "BLOCK_SIZE_N": 256,
      "num_warps": 8,
      "num_stages": 1,
      "waves_per_eu": 8,
      "stage": 4
    },
    "529": {
      "BLOCK_SIZE_M": 64,
      "BLOCK_SIZE_N": 64,
      "num_warps": 8,
      "num_stages": 4,
      "waves_per_eu": 4,
      "stage": 2
    },
    "5116": {
      "BLOCK_SIZE_M": 256,
      "BLOCK_SIZE_N": 256,
      "num_warps": 4,
      "num_stages": 1,
      "waves_per_eu": 2,
      "stage": 5
    },
    "4287": {
      "BLOCK_SIZE_M": 256,
      "BLOCK_SIZE_N": 128,
      "num_warps": 1,
      "num_stages": 4,
      "waves_per_eu": 8,
      "stage": 4
    },
    "658": {
      "BLOCK_SIZE_M": 64,
      "BLOCK_SIZE_N": 128,
      "num_warps": 1,
      "num_stages": 2,
      "waves_per_eu": 8,
      "stage": 5
    },
    "4428": {
      "BLOCK_SIZE_M": 256,
      "BLOCK_SIZE_N": 128,
      "num_warps": 2,
      "num_stages": 4,
      "waves_per_eu": 4,
      "stage": 1
    },
    "911": {
      "BLOCK_SIZE_M": 64,
      "BLOCK_SIZE_N": 128,
      "num_warps": 4,
      "num_stages": 1,
      "waves_per_eu": 1,
      "stage": 6
    },
    "4507": {
      "BLOCK_SIZE_M": 256,
      "BLOCK_SIZE_N": 128,
      "num_warps": 4,
      "num_stages": 1,
      "waves_per_eu": 1,
      "stage": 2
    },
    "3811": {
      "BLOCK_SIZE_M": 256,
      "BLOCK_SIZE_N": 64,
      "num_warps": 2,
      "num_stages": 4,
      "waves_per_eu": 0,
      "stage": 2
    },
    "343": {
      "BLOCK_SIZE_M": 64,
      "BLOCK_SIZE_N": 64,
      "num_warps": 4,
      "num_stages": 2,
      "waves_per_eu": 2,
      "stage": 2
    },
    "787": {
      "BLOCK_SIZE_M": 64,
      "BLOCK_SIZE_N": 128,
      "num_warps": 2,
      "num_stages": 2,
      "waves_per_eu": 1,
      "stage": 2
    },
    "1670": {
      "BLOCK_SIZE_M": 64,
      "BLOCK_SIZE_N": 256,
      "num_warps": 8,
      "num_stages": 1,
      "waves_per_eu": 4,
      "stage": 3
    },
    "4503": {
      "BLOCK_SIZE_M": 256,
      "BLOCK_SIZE_N": 128,
      "num_warps": 4,
      "num_stages": 1,
      "waves_per_eu": 0,
      "stage": 4
    },
    "316": {
      "BLOCK_SIZE_M": 64,
      "BLOCK_SIZE_N": 64,
      "num_warps": 4,
      "num_stages": 1,
      "waves_per_eu": 2,
      "stage": 5
    },
    "3939": {
      "BLOCK_SIZE_M": 256,
      "BLOCK_SIZE_N": 64,
      "num_warps": 4,
      "num_stages": 2,
      "waves_per_eu": 1,
      "stage": 4
    },
    "4418": {
      "BLOCK_SIZE_M": 256,
      "BLOCK_SIZE_N": 128,
      "num_warps": 2,
      "num_stages": 4,
      "waves_per_eu": 1,
      "stage": 3
    },
    "3830": {
      "BLOCK_SIZE_M": 256,
      "BLOCK_SIZE_N": 64,
      "num_warps": 2,
      "num_stages": 4,
      "waves_per_eu": 4,
      "stage": 3
    },
    "830": {
      "BLOCK_SIZE_M": 64,
      "BLOCK_SIZE_N": 128,
      "num_warps": 2,
      "num_stages": 4,
      "waves_per_eu": 4,
      "stage": 3
    },
    "1096": {
      "BLOCK_SIZE_M": 64,
      "BLOCK_SIZE_N": 128,
      "num_warps": 8,
      "num_stages": 2,
      "waves_per_eu": 2,
      "stage": 5
    },
    "4978": {
      "BLOCK_SIZE_M": 256,
      "BLOCK_SIZE_N": 256,
      "num_warps": 2,
      "num_stages": 1,
      "waves_per_eu": 8,
      "stage": 5
    },
    "688": {
      "BLOCK_SIZE_M": 64,
      "BLOCK_SIZE_N": 128,
      "num_warps": 1,
      "num_stages": 4,
      "waves_per_eu": 8,
      "stage": 5
    },
    "2622": {
      "BLOCK_SIZE_M": 128,
      "BLOCK_SIZE_N": 128,
      "num_warps": 2,
      "num_stages": 4,
      "waves_per_eu": 2,
      "stage": 1
    },
    "2400": {
      "BLOCK_SIZE_M": 128,
      "BLOCK_SIZE_N": 128,
      "num_warps": 1,
      "num_stages": 1,
      "waves_per_eu": 0,
      "stage": 1
    },
    "2724": {
      "BLOCK_SIZE_M": 128,
      "BLOCK_SIZE_N": 128,
      "num_warps": 4,
      "num_stages": 1,
      "waves_per_eu": 8,
      "stage": 1
    },
    "3627": {
      "BLOCK_SIZE_M": 256,
      "BLOCK_SIZE_N": 64,
      "num_warps": 1,
      "num_stages": 1,
      "waves_per_eu": 8,
      "stage": 4
    },
    "3624": {
      "BLOCK_SIZE_M": 256,
      "BLOCK_SIZE_N": 64,
      "num_warps": 1,
      "num_stages": 1,
      "waves_per_eu": 8,
      "stage": 1
    },
    "2404": {
      "BLOCK_SIZE_M": 128,
      "BLOCK_SIZE_N": 128,
      "num_warps": 1,
      "num_stages": 1,
      "waves_per_eu": 0,
      "stage": 5
    },
    "4686": {
      "BLOCK_SIZE_M": 256,
      "BLOCK_SIZE_N": 128,
      "num_warps": 8,
      "num_stages": 2,
      "waves_per_eu": 1,
      "stage": 1
    },
    "39": {
      "BLOCK_SIZE_M": 64,
      "BLOCK_SIZE_N": 64,
      "num_warps": 1,
      "num_stages": 2,
      "waves_per_eu": 1,
      "stage": 4
    },
    "340": {
      "BLOCK_SIZE_M": 64,
      "BLOCK_SIZE_N": 64,
      "num_warps": 4,
      "num_stages": 2,
      "waves_per_eu": 1,
      "stage": 5
    },
    "943": {
      "BLOCK_SIZE_M": 64,
      "BLOCK_SIZE_N": 128,
      "num_warps": 4,
      "num_stages": 2,
      "waves_per_eu": 2,
      "stage": 2
    },
    "4201": {
      "BLOCK_SIZE_M": 256,
      "BLOCK_SIZE_N": 128,
      "num_warps": 1,
      "num_stages": 1,
      "waves_per_eu": 0,
      "stage": 2
    },
    "4671": {
      "BLOCK_SIZE_M": 256,
      "BLOCK_SIZE_N": 128,
      "num_warps": 8,
      "num_stages": 1,
      "waves_per_eu": 4,
      "stage": 4
    },
    "1957": {
      "BLOCK_SIZE_M": 128,
      "BLOCK_SIZE_N": 64,
      "num_warps": 2,
      "num_stages": 1,
      "waves_per_eu": 1,
      "stage": 2
    },
    "2018": {
      "BLOCK_SIZE_M": 128,
      "BLOCK_SIZE_N": 64,
      "num_warps": 2,
      "num_stages": 4,
      "waves_per_eu": 1,
      "stage": 3
    },
    "4209": {
      "BLOCK_SIZE_M": 256,
      "BLOCK_SIZE_N": 128,
      "num_warps": 1,
      "num_stages": 1,
      "waves_per_eu": 1,
      "stage": 4
    },
    "3759": {
      "BLOCK_SIZE_M": 256,
      "BLOCK_SIZE_N": 64,
      "num_warps": 2,
      "num_stages": 1,
      "waves_per_eu": 1,
      "stage": 4
    },
    "1354": {
      "BLOCK_SIZE_M": 64,
      "BLOCK_SIZE_N": 256,
      "num_warps": 2,
      "num_stages": 1,
      "waves_per_eu": 0,
      "stage": 5
    },
    "2855": {
      "BLOCK_SIZE_M": 128,
      "BLOCK_SIZE_N": 128,
      "num_warps": 8,
      "num_stages": 1,
      "waves_per_eu": 0,
      "stage": 6
    },
    "1810": {
      "BLOCK_SIZE_M": 128,
      "BLOCK_SIZE_N": 64,
      "num_warps": 1,
      "num_stages": 1,
      "waves_per_eu": 1,
      "stage": 5
    },
    "1869": {
      "BLOCK_SIZE_M": 128,
      "BLOCK_SIZE_N": 64,
      "num_warps": 1,
      "num_stages": 4,
      "waves_per_eu": 1,
      "stage": 4
    },
    "4279": {
      "BLOCK_SIZE_M": 256,
      "BLOCK_SIZE_N": 128,
      "num_warps": 1,
      "num_stages": 4,
      "waves_per_eu": 4,
      "stage": 2
    },
    "5273": {
      "BLOCK_SIZE_M": 256,
      "BLOCK_SIZE_N": 256,
      "num_warps": 8,
      "num_stages": 1,
      "waves_per_eu": 4,
      "stage": 6
    },
    "4057": {
      "BLOCK_SIZE_M": 256,
      "BLOCK_SIZE_N": 64,
      "num_warps": 8,
      "num_stages": 1,
      "waves_per_eu": 1,
      "stage": 2
    },
    "3915": {
      "BLOCK_SIZE_M": 256,
      "BLOCK_SIZE_N": 64,
      "num_warps": 4,
      "num_stages": 1,
      "waves_per_eu": 2,
      "stage": 4
    },
    "3319": {
      "BLOCK_SIZE_M": 128,
      "BLOCK_SIZE_N": 256,
      "num_warps": 4,
      "num_stages": 1,
      "waves_per_eu": 4,
      "stage": 2
    },
    "1527": {
      "BLOCK_SIZE_M": 64,
      "BLOCK_SIZE_N": 256,
      "num_warps": 4,
      "num_stages": 1,
      "waves_per_eu": 8,
      "stage": 4
    },
    "2706": {
      "BLOCK_SIZE_M": 128,
      "BLOCK_SIZE_N": 128,
      "num_warps": 4,
      "num_stages": 1,
      "waves_per_eu": 1,
      "stage": 1
    },
    "2856": {
      "BLOCK_SIZE_M": 128,
      "BLOCK_SIZE_N": 128,
      "num_warps": 8,
      "num_stages": 1,
      "waves_per_eu": 1,
      "stage": 1
    },
    "1503": {
      "BLOCK_SIZE_M": 64,
      "BLOCK_SIZE_N": 256,
      "num_warps": 4,
      "num_stages": 1,
      "waves_per_eu": 0,
      "stage": 4
    },
    "4069": {
      "BLOCK_SIZE_M": 256,
      "BLOCK_SIZE_N": 64,
      "num_warps": 8,
      "num_stages": 1,
      "waves_per_eu": 4,
      "stage": 2
    },
    "3601": {
      "BLOCK_SIZE_M": 256,
      "BLOCK_SIZE_N": 64,
      "num_warps": 1,
      "num_stages": 1,
      "waves_per_eu": 0,
      "stage": 2
    },
    "3907": {
      "BLOCK_SIZE_M": 256,
      "BLOCK_SIZE_N": 64,
      "num_warps": 4,
      "num_stages": 1,
      "waves_per_eu": 1,
      "stage": 2
    },
    "2739": {
      "BLOCK_SIZE_M": 128,
      "BLOCK_SIZE_N": 128,
      "num_warps": 4,
      "num_stages": 2,
      "waves_per_eu": 1,
      "stage": 4
    },
    "65": {
      "BLOCK_SIZE_M": 64,
      "BLOCK_SIZE_N": 64,
      "num_warps": 1,
      "num_stages": 4,
      "waves_per_eu": 0,
      "stage": 6
    },
    "1651": {
      "BLOCK_SIZE_M": 64,
      "BLOCK_SIZE_N": 256,
      "num_warps": 8,
      "num_stages": 1,
      "waves_per_eu": 0,
      "stage": 2
    },
    "5265": {
      "BLOCK_SIZE_M": 256,
      "BLOCK_SIZE_N": 256,
      "num_warps": 8,
      "num_stages": 1,
      "waves_per_eu": 2,
      "stage": 4
    },
    "1650": {
      "BLOCK_SIZE_M": 64,
      "BLOCK_SIZE_N": 256,
      "num_warps": 8,
      "num_stages": 1,
      "waves_per_eu": 0,
      "stage": 1
    },
    "2639": {
      "BLOCK_SIZE_M": 128,
      "BLOCK_SIZE_N": 128,
      "num_warps": 2,
      "num_stages": 4,
      "waves_per_eu": 8,
      "stage": 6
    },
    "4411": {
      "BLOCK_SIZE_M": 256,
      "BLOCK_SIZE_N": 128,
      "num_warps": 2,
      "num_stages": 4,
      "waves_per_eu": 0,
      "stage": 2
    },
    "4509": {
      "BLOCK_SIZE_M": 256,
      "BLOCK_SIZE_N": 128,
      "num_warps": 4,
      "num_stages": 1,
      "waves_per_eu": 1,
      "stage": 4
    },
    "4420": {
      "BLOCK_SIZE_M": 256,
      "BLOCK_SIZE_N": 128,
      "num_warps": 2,
      "num_stages": 4,
      "waves_per_eu": 1,
      "stage": 5
    },
    "526": {
      "BLOCK_SIZE_M": 64,
      "BLOCK_SIZE_N": 64,
      "num_warps": 8,
      "num_stages": 4,
      "waves_per_eu": 2,
      "stage": 5
    },
    "3024": {
      "BLOCK_SIZE_M": 128,
      "BLOCK_SIZE_N": 256,
      "num_warps": 1,
      "num_stages": 1,
      "waves_per_eu": 8,
      "stage": 1
    },
    "1101": {
      "BLOCK_SIZE_M": 64,
      "BLOCK_SIZE_N": 128,
      "num_warps": 8,
      "num_stages": 2,
      "waves_per_eu": 4,
      "stage": 4
    },
    "986": {
      "BLOCK_SIZE_M": 64,
      "BLOCK_SIZE_N": 128,
      "num_warps": 4,
      "num_stages": 4,
      "waves_per_eu": 8,
      "stage": 3
    },
    "4203": {
      "BLOCK_SIZE_M": 256,
      "BLOCK_SIZE_N": 128,
      "num_warps": 1,
      "num_stages": 1,
      "waves_per_eu": 0,
      "stage": 4
    },
    "2874": {
      "BLOCK_SIZE_M": 128,
      "BLOCK_SIZE_N": 128,
      "num_warps": 8,
      "num_stages": 1,
      "waves_per_eu": 8,
      "stage": 1
    },
    "3986": {
      "BLOCK_SIZE_M": 256,
      "BLOCK_SIZE_N": 64,
      "num_warps": 4,
      "num_stages": 4,
      "waves_per_eu": 8,
      "stage": 3
    },
    "5274": {
      "BLOCK_SIZE_M": 256,
      "BLOCK_SIZE_N": 256,
      "num_warps": 8,
      "num_stages": 1,
      "waves_per_eu": 8,
      "stage": 1
    },
    "935": {
      "BLOCK_SIZE_M": 64,
      "BLOCK_SIZE_N": 128,
      "num_warps": 4,
      "num_stages": 2,
      "waves_per_eu": 0,
      "stage": 6
    }
  },
  "tested_configs_failed": {
    "2909": {
      "config": {
        "BLOCK_SIZE_M": 128,
        "BLOCK_SIZE_N": 128,
        "num_warps": 8,
        "num_stages": 2,
        "waves_per_eu": 8,
        "stage": 6
      },
      "error": "out of resource: shared memory, Required: 81920, Hardware limit: 65536. Reducing block sizes or `num_stages` may help."
    },
    "2948": {
      "config": {
        "BLOCK_SIZE_M": 128,
        "BLOCK_SIZE_N": 128,
        "num_warps": 8,
        "num_stages": 8,
        "waves_per_eu": 1,
        "stage": 3
      },
      "error": "out of resource: shared memory, Required: 376832, Hardware limit: 65536. Reducing block sizes or `num_stages` may help."
    },
    "1700": {
      "config": {
        "BLOCK_SIZE_M": 64,
        "BLOCK_SIZE_N": 256,
        "num_warps": 8,
        "num_stages": 2,
        "waves_per_eu": 4,
        "stage": 3
      },
      "error": "out of resource: shared memory, Required: 131072, Hardware limit: 65536. Reducing block sizes or `num_stages` may help."
    },
    "3342": {
      "config": {
        "BLOCK_SIZE_M": 128,
        "BLOCK_SIZE_N": 256,
        "num_warps": 4,
        "num_stages": 2,
        "waves_per_eu": 2,
        "stage": 1
      },
      "error": "out of resource: shared memory, Required: 98304, Hardware limit: 65536. Reducing block sizes or `num_stages` may help."
    },
    "390": {
      "config": {
        "BLOCK_SIZE_M": 64,
        "BLOCK_SIZE_N": 64,
        "num_warps": 4,
        "num_stages": 8,
        "waves_per_eu": 0,
        "stage": 1
      },
      "error": "out of resource: shared memory, Required: 180224, Hardware limit: 65536. Reducing block sizes or `num_stages` may help."
    },
    "2801": {
      "config": {
        "BLOCK_SIZE_M": 128,
        "BLOCK_SIZE_N": 128,
        "num_warps": 4,
        "num_stages": 8,
        "waves_per_eu": 1,
        "stage": 6
      },
      "error": "out of resource: shared memory, Required: 344064, Hardware limit: 65536. Reducing block sizes or `num_stages` may help."
    },
    "2376": {
      "config": {
        "BLOCK_SIZE_M": 128,
        "BLOCK_SIZE_N": 64,
        "num_warps": 8,
        "num_stages": 10,
        "waves_per_eu": 1,
        "stage": 1
      },
      "error": "out of resource: shared memory, Required: 237568, Hardware limit: 65536. Reducing block sizes or `num_stages` may help."
    },
    "3509": {
      "config": {
        "BLOCK_SIZE_M": 128,
        "BLOCK_SIZE_N": 256,
        "num_warps": 8,
        "num_stages": 2,
        "waves_per_eu": 8,
        "stage": 6
      },
      "error": "out of resource: shared memory, Required: 163840, Hardware limit: 65536. Reducing block sizes or `num_stages` may help."
    },
    "1189": {
      "config": {
        "BLOCK_SIZE_M": 64,
        "BLOCK_SIZE_N": 128,
        "num_warps": 8,
        "num_stages": 10,
        "waves_per_eu": 4,
        "stage": 2
      },
      "error": "out of resource: shared memory, Required: 458752, Hardware limit: 65536. Reducing block sizes or `num_stages` may help."
    },
    "2900": {
      "config": {
        "BLOCK_SIZE_M": 128,
        "BLOCK_SIZE_N": 128,
        "num_warps": 8,
        "num_stages": 2,
        "waves_per_eu": 4,
        "stage": 3
      },
      "error": "out of resource: shared memory, Required: 81920, Hardware limit: 65536. Reducing block sizes or `num_stages` may help."
    },
    "3556": {
      "config": {
        "BLOCK_SIZE_M": 128,
        "BLOCK_SIZE_N": 256,
        "num_warps": 8,
        "num_stages": 8,
        "waves_per_eu": 2,
        "stage": 5
      },
      "error": "out of resource: shared memory, Required: 753664, Hardware limit: 65536. Reducing block sizes or `num_stages` may help."
    },
    "1392": {
      "config": {
        "BLOCK_SIZE_M": 64,
        "BLOCK_SIZE_N": 256,
        "num_warps": 2,
        "num_stages": 2,
        "waves_per_eu": 2,
        "stage": 1
      },
      "error": "out of resource: shared memory, Required: 98304, Hardware limit: 65536. Reducing block sizes or `num_stages` may help."
    },
    "2836": {
      "config": {
        "BLOCK_SIZE_M": 128,
        "BLOCK_SIZE_N": 128,
        "num_warps": 4,
        "num_stages": 10,
        "waves_per_eu": 2,
        "stage": 5
      },
      "error": "out of resource: shared memory, Required: 442368, Hardware limit: 65536. Reducing block sizes or `num_stages` may help."
    },
    "2920": {
      "config": {
        "BLOCK_SIZE_M": 128,
        "BLOCK_SIZE_N": 128,
        "num_warps": 8,
        "num_stages": 4,
        "waves_per_eu": 1,
        "stage": 5
      },
      "error": "out of resource: shared memory, Required: 182272, Hardware limit: 65536. Reducing block sizes or `num_stages` may help."
    },
    "4755": {
      "config": {
        "BLOCK_SIZE_M": 256,
        "BLOCK_SIZE_N": 128,
        "num_warps": 8,
        "num_stages": 8,
        "waves_per_eu": 2,
        "stage": 4
      },
      "error": "out of resource: shared memory, Required: 344064, Hardware limit: 65536. Reducing block sizes or `num_stages` may help."
    },
    "5340": {
      "config": {
        "BLOCK_SIZE_M": 256,
        "BLOCK_SIZE_N": 256,
        "num_warps": 8,
        "num_stages": 8,
        "waves_per_eu": 0,
        "stage": 1
      },
      "error": "out of resource: shared memory, Required: 688128, Hardware limit: 65536. Reducing block sizes or `num_stages` may help."
    },
    "2657": {
      "config": {
        "BLOCK_SIZE_M": 128,
        "BLOCK_SIZE_N": 128,
        "num_warps": 2,
        "num_stages": 8,
        "waves_per_eu": 2,
        "stage": 6
      },
      "error": "out of resource: shared memory, Required: 344064, Hardware limit: 65536. Reducing block sizes or `num_stages` may help."
    },
    "5141": {
      "config": {
        "BLOCK_SIZE_M": 256,
        "BLOCK_SIZE_N": 256,
        "num_warps": 4,
        "num_stages": 2,
        "waves_per_eu": 1,
        "stage": 6
      },
      "error": "out of resource: shared memory, Required: 98304, Hardware limit: 65536. Reducing block sizes or `num_stages` may help."
    },
    "1557": {
      "config": {
        "BLOCK_SIZE_M": 64,
        "BLOCK_SIZE_N": 256,
        "num_warps": 4,
        "num_stages": 2,
        "waves_per_eu": 8,
        "stage": 4
      },
      "error": "out of resource: shared memory, Required: 131072, Hardware limit: 65536. Reducing block sizes or `num_stages` may help."
    },
    "3360": {
      "config": {
        "BLOCK_SIZE_M": 128,
        "BLOCK_SIZE_N": 256,
        "num_warps": 4,
        "num_stages": 4,
        "waves_per_eu": 0,
        "stage": 1
      },
      "error": "out of resource: shared memory, Required: 164864, Hardware limit: 65536. Reducing block sizes or `num_stages` may help."
    },
    "1448": {
      "config": {
        "BLOCK_SIZE_M": 64,
        "BLOCK_SIZE_N": 256,
        "num_warps": 2,
        "num_stages": 8,
        "waves_per_eu": 1,
        "stage": 3
      },
      "error": "out of resource: shared memory, Required: 688128, Hardware limit: 65536. Reducing block sizes or `num_stages` may help."
    },
    "1680": {
      "config": {
        "BLOCK_SIZE_M": 64,
        "BLOCK_SIZE_N": 256,
        "num_warps": 8,
        "num_stages": 2,
        "waves_per_eu": 0,
        "stage": 1
      },
      "error": "out of resource: shared memory, Required: 131072, Hardware limit: 65536. Reducing block sizes or `num_stages` may help."
    },
    "1621": {
      "config": {
        "BLOCK_SIZE_M": 64,
        "BLOCK_SIZE_N": 256,
        "num_warps": 4,
        "num_stages": 10,
        "waves_per_eu": 0,
        "stage": 2
      },
      "error": "out of resource: shared memory, Required: 917504, Hardware limit: 65536. Reducing block sizes or `num_stages` may help."
    },
    "2099": {
      "config": {
        "BLOCK_SIZE_M": 128,
        "BLOCK_SIZE_N": 64,
        "num_warps": 2,
        "num_stages": 10,
        "waves_per_eu": 8,
        "stage": 6
      },
      "error": "out of resource: shared memory, Required: 221184, Hardware limit: 65536. Reducing block sizes or `num_stages` may help."
    },
    "3431": {
      "config": {
        "BLOCK_SIZE_M": 128,
        "BLOCK_SIZE_N": 256,
        "num_warps": 4,
        "num_stages": 10,
        "waves_per_eu": 1,
        "stage": 6
      },
      "error": "out of resource: shared memory, Required: 884736, Hardware limit: 65536. Reducing block sizes or `num_stages` may help."
    },
    "1574": {
      "config": {
        "BLOCK_SIZE_M": 64,
        "BLOCK_SIZE_N": 256,
        "num_warps": 4,
        "num_stages": 4,
        "waves_per_eu": 2,
        "stage": 3
      },
      "error": "out of resource: shared memory, Required: 164864, Hardware limit: 65536. Reducing block sizes or `num_stages` may help."
    },
    "4628": {
      "config": {
        "BLOCK_SIZE_M": 256,
        "BLOCK_SIZE_N": 128,
        "num_warps": 4,
        "num_stages": 10,
        "waves_per_eu": 1,
        "stage": 3
      },
      "error": "out of resource: shared memory, Required: 442368, Hardware limit: 65536. Reducing block sizes or `num_stages` may help."
    },
    "3380": {
      "config": {
        "BLOCK_SIZE_M": 128,
        "BLOCK_SIZE_N": 256,
        "num_warps": 4,
        "num_stages": 4,
        "waves_per_eu": 4,
        "stage": 3
      },
      "error": "out of resource: shared memory, Required: 164864, Hardware limit: 65536. Reducing block sizes or `num_stages` may help."
    },
    "4781": {
      "config": {
        "BLOCK_SIZE_M": 256,
        "BLOCK_SIZE_N": 128,
        "num_warps": 8,
        "num_stages": 10,
        "waves_per_eu": 1,
        "stage": 6
      },
      "error": "out of resource: shared memory, Required: 442368, Hardware limit: 65536. Reducing block sizes or `num_stages` may help."
    },
    "1787": {
      "config": {
        "BLOCK_SIZE_M": 64,
        "BLOCK_SIZE_N": 256,
        "num_warps": 8,
        "num_stages": 10,
        "waves_per_eu": 2,
        "stage": 6
      },
      "error": "out of resource: shared memory, Required: 917504, Hardware limit: 65536. Reducing block sizes or `num_stages` may help."
    },
    "1550": {
      "config": {
        "BLOCK_SIZE_M": 64,
        "BLOCK_SIZE_N": 256,
        "num_warps": 4,
        "num_stages": 2,
        "waves_per_eu": 4,
        "stage": 3
      },
      "error": "out of resource: shared memory, Required: 131072, Hardware limit: 65536. Reducing block sizes or `num_stages` may help."
    },
    "2198": {
      "config": {
        "BLOCK_SIZE_M": 128,
        "BLOCK_SIZE_N": 64,
        "num_warps": 4,
        "num_stages": 8,
        "waves_per_eu": 1,
        "stage": 3
      },
      "error": "out of resource: shared memory, Required: 172032, Hardware limit: 65536. Reducing block sizes or `num_stages` may help."
    },
    "1936": {
      "config": {
        "BLOCK_SIZE_M": 128,
        "BLOCK_SIZE_N": 64,
        "num_warps": 1,
        "num_stages": 10,
        "waves_per_eu": 2,
        "stage": 5
      },
      "error": "out of resource: shared memory, Required: 221184, Hardware limit: 65536. Reducing block sizes or `num_stages` may help."
    },
    "5170": {
      "config": {
        "BLOCK_SIZE_M": 256,
        "BLOCK_SIZE_N": 256,
        "num_warps": 4,
        "num_stages": 4,
        "waves_per_eu": 1,
        "stage": 5
      },
      "error": "out of resource: shared memory, Required: 164864, Hardware limit: 65536. Reducing block sizes or `num_stages` may help."
    },
    "1237": {
      "config": {
        "BLOCK_SIZE_M": 64,
        "BLOCK_SIZE_N": 256,
        "num_warps": 1,
        "num_stages": 2,
        "waves_per_eu": 1,
        "stage": 2
      },
      "error": "out of resource: shared memory, Required: 98304, Hardware limit: 65536. Reducing block sizes or `num_stages` may help."
    },
    "2797": {
      "config": {
        "BLOCK_SIZE_M": 128,
        "BLOCK_SIZE_N": 128,
        "num_warps": 4,
        "num_stages": 8,
        "waves_per_eu": 1,
        "stage": 2
      },
      "error": "out of resource: shared memory, Required: 344064, Hardware limit: 65536. Reducing block sizes or `num_stages` may help."
    },
    "4603": {
      "config": {
        "BLOCK_SIZE_M": 256,
        "BLOCK_SIZE_N": 128,
        "num_warps": 4,
        "num_stages": 8,
        "waves_per_eu": 2,
        "stage": 2
      },
      "error": "out of resource: shared memory, Required: 344064, Hardware limit: 65536. Reducing block sizes or `num_stages` may help."
    },
    "4648": {
      "config": {
        "BLOCK_SIZE_M": 256,
        "BLOCK_SIZE_N": 128,
        "num_warps": 4,
        "num_stages": 10,
        "waves_per_eu": 8,
        "stage": 5
      },
      "error": "out of resource: shared memory, Required: 442368, Hardware limit: 65536. Reducing block sizes or `num_stages` may help."
    },
    "1431": {
      "config": {
        "BLOCK_SIZE_M": 64,
        "BLOCK_SIZE_N": 256,
        "num_warps": 2,
        "num_stages": 4,
        "waves_per_eu": 4,
        "stage": 4
      },
      "error": "out of resource: shared memory, Required: 131584, Hardware limit: 65536. Reducing block sizes or `num_stages` may help."
    },
    "1478": {
      "config": {
        "BLOCK_SIZE_M": 64,
        "BLOCK_SIZE_N": 256,
        "num_warps": 2,
        "num_stages": 10,
        "waves_per_eu": 1,
        "stage": 3
      },
      "error": "out of resource: shared memory, Required: 884736, Hardware limit: 65536. Reducing block sizes or `num_stages` may help."
    },
    "4857": {
      "config": {
        "BLOCK_SIZE_M": 256,
        "BLOCK_SIZE_N": 256,
        "num_warps": 1,
        "num_stages": 2,
        "waves_per_eu": 8,
        "stage": 4
      },
      "error": "out of resource: shared memory, Required: 98304, Hardware limit: 65536. Reducing block sizes or `num_stages` may help."
    },
    "3532": {
      "config": {
        "BLOCK_SIZE_M": 128,
        "BLOCK_SIZE_N": 256,
        "num_warps": 8,
        "num_stages": 4,
        "waves_per_eu": 4,
        "stage": 5
      },
      "error": "out of resource: shared memory, Required: 231424, Hardware limit: 65536. Reducing block sizes or `num_stages` may help."
    },
    "3896": {
      "config": {
        "BLOCK_SIZE_M": 256,
        "BLOCK_SIZE_N": 64,
        "num_warps": 2,
        "num_stages": 10,
        "waves_per_eu": 8,
        "stage": 3
      },
      "error": "out of resource: shared memory, Required: 221184, Hardware limit: 65536. Reducing block sizes or `num_stages` may help."
    },
    "4151": {
      "config": {
        "BLOCK_SIZE_M": 256,
        "BLOCK_SIZE_N": 64,
        "num_warps": 8,
        "num_stages": 8,
        "waves_per_eu": 1,
        "stage": 6
      },
      "error": "out of resource: shared memory, Required: 172032, Hardware limit: 65536. Reducing block sizes or `num_stages` may help."
    },
    "3340": {
      "config": {
        "BLOCK_SIZE_M": 128,
        "BLOCK_SIZE_N": 256,
        "num_warps": 4,
        "num_stages": 2,
        "waves_per_eu": 1,
        "stage": 5
      },
      "error": "out of resource: shared memory, Required: 98304, Hardware limit: 65536. Reducing block sizes or `num_stages` may help."
    },
    "1489": {
      "config": {
        "BLOCK_SIZE_M": 64,
        "BLOCK_SIZE_N": 256,
        "num_warps": 2,
        "num_stages": 10,
        "waves_per_eu": 4,
        "stage": 2
      },
      "error": "out of resource: shared memory, Required: 884736, Hardware limit: 65536. Reducing block sizes or `num_stages` may help."
    },
    "2834": {
      "config": {
        "BLOCK_SIZE_M": 128,
        "BLOCK_SIZE_N": 128,
        "num_warps": 4,
        "num_stages": 10,
        "waves_per_eu": 2,
        "stage": 3
      },
      "error": "out of resource: shared memory, Required: 442368, Hardware limit: 65536. Reducing block sizes or `num_stages` may help."
    },
    "3394": {
      "config": {
        "BLOCK_SIZE_M": 128,
        "BLOCK_SIZE_N": 256,
        "num_warps": 4,
        "num_stages": 8,
        "waves_per_eu": 0,
        "stage": 5
      },
      "error": "out of resource: shared memory, Required: 688128, Hardware limit: 65536. Reducing block sizes or `num_stages` may help."
    },
    "1551": {
      "config": {
        "BLOCK_SIZE_M": 64,
        "BLOCK_SIZE_N": 256,
        "num_warps": 4,
        "num_stages": 2,
        "waves_per_eu": 4,
        "stage": 4
      },
      "error": "out of resource: shared memory, Required: 131072, Hardware limit: 65536. Reducing block sizes or `num_stages` may help."
    },
    "5203": {
      "config": {
        "BLOCK_SIZE_M": 256,
        "BLOCK_SIZE_N": 256,
        "num_warps": 4,
        "num_stages": 8,
        "waves_per_eu": 2,
        "stage": 2
      },
      "error": "out of resource: shared memory, Required: 688128, Hardware limit: 65536. Reducing block sizes or `num_stages` may help."
    },
    "1484": {
      "config": {
        "BLOCK_SIZE_M": 64,
        "BLOCK_SIZE_N": 256,
        "num_warps": 2,
        "num_stages": 10,
        "waves_per_eu": 2,
        "stage": 3
      },
      "error": "out of resource: shared memory, Required: 884736, Hardware limit: 65536. Reducing block sizes or `num_stages` may help."
    },
    "4773": {
      "config": {
        "BLOCK_SIZE_M": 256,
        "BLOCK_SIZE_N": 128,
        "num_warps": 8,
        "num_stages": 10,
        "waves_per_eu": 0,
        "stage": 4
      },
      "error": "out of resource: shared memory, Required: 442368, Hardware limit: 65536. Reducing block sizes or `num_stages` may help."
    },
    "5200": {
      "config": {
        "BLOCK_SIZE_M": 256,
        "BLOCK_SIZE_N": 256,
        "num_warps": 4,
        "num_stages": 8,
        "waves_per_eu": 1,
        "stage": 5
      },
      "error": "out of resource: shared memory, Required: 688128, Hardware limit: 65536. Reducing block sizes or `num_stages` may help."
    },
    "3842": {
      "config": {
        "BLOCK_SIZE_M": 256,
        "BLOCK_SIZE_N": 64,
        "num_warps": 2,
        "num_stages": 8,
        "waves_per_eu": 0,
        "stage": 3
      },
      "error": "out of resource: shared memory, Required: 172032, Hardware limit: 65536. Reducing block sizes or `num_stages` may help."
    },
    "1242": {
      "config": {
        "BLOCK_SIZE_M": 64,
        "BLOCK_SIZE_N": 256,
        "num_warps": 1,
        "num_stages": 2,
        "waves_per_eu": 2,
        "stage": 1
      },
      "error": "out of resource: shared memory, Required: 98304, Hardware limit: 65536. Reducing block sizes or `num_stages` may help."
    },
    "597": {
      "config": {
        "BLOCK_SIZE_M": 64,
        "BLOCK_SIZE_N": 64,
        "num_warps": 8,
        "num_stages": 10,
        "waves_per_eu": 8,
        "stage": 4
      },
      "error": "out of resource: shared memory, Required: 229376, Hardware limit: 65536. Reducing block sizes or `num_stages` may help."
    },
    "1002": {
      "config": {
        "BLOCK_SIZE_M": 64,
        "BLOCK_SIZE_N": 128,
        "num_warps": 4,
        "num_stages": 8,
        "waves_per_eu": 2,
        "stage": 1
      },
      "error": "out of resource: shared memory, Required: 360448, Hardware limit: 65536. Reducing block sizes or `num_stages` may help."
    },
    "4466": {
      "config": {
        "BLOCK_SIZE_M": 256,
        "BLOCK_SIZE_N": 128,
        "num_warps": 2,
        "num_stages": 8,
        "waves_per_eu": 8,
        "stage": 3
      },
      "error": "out of resource: shared memory, Required: 344064, Hardware limit: 65536. Reducing block sizes or `num_stages` may help."
    },
    "4616": {
      "config": {
        "BLOCK_SIZE_M": 256,
        "BLOCK_SIZE_N": 128,
        "num_warps": 4,
        "num_stages": 8,
        "waves_per_eu": 8,
        "stage": 3
      },
      "error": "out of resource: shared memory, Required: 344064, Hardware limit: 65536. Reducing block sizes or `num_stages` may help."
    },
    "2811": {
      "config": {
        "BLOCK_SIZE_M": 128,
        "BLOCK_SIZE_N": 128,
        "num_warps": 4,
        "num_stages": 8,
        "waves_per_eu": 4,
        "stage": 4
      },
      "error": "out of resource: shared memory, Required: 344064, Hardware limit: 65536. Reducing block sizes or `num_stages` may help."
    },
    "5392": {
      "config": {
        "BLOCK_SIZE_M": 256,
        "BLOCK_SIZE_N": 256,
        "num_warps": 8,
        "num_stages": 10,
        "waves_per_eu": 4,
        "stage": 5
      },
      "error": "out of resource: shared memory, Required: 884736, Hardware limit: 65536. Reducing block sizes or `num_stages` may help."
    },
    "2663": {
      "config": {
        "BLOCK_SIZE_M": 128,
        "BLOCK_SIZE_N": 128,
        "num_warps": 2,
        "num_stages": 8,
        "waves_per_eu": 4,
        "stage": 6
      },
      "error": "out of resource: shared memory, Required: 344064, Hardware limit: 65536. Reducing block sizes or `num_stages` may help."
    },
    "1555": {
      "config": {
        "BLOCK_SIZE_M": 64,
        "BLOCK_SIZE_N": 256,
        "num_warps": 4,
        "num_stages": 2,
        "waves_per_eu": 8,
        "stage": 2
      },
      "error": "out of resource: shared memory, Required: 131072, Hardware limit: 65536. Reducing block sizes or `num_stages` may help."
    },
    "2238": {
      "config": {
        "BLOCK_SIZE_M": 128,
        "BLOCK_SIZE_N": 64,
        "num_warps": 4,
        "num_stages": 10,
        "waves_per_eu": 4,
        "stage": 1
      },
      "error": "out of resource: shared memory, Required: 221184, Hardware limit: 65536. Reducing block sizes or `num_stages` may help."
    },
    "3553": {
      "config": {
        "BLOCK_SIZE_M": 128,
        "BLOCK_SIZE_N": 256,
        "num_warps": 8,
        "num_stages": 8,
        "waves_per_eu": 2,
        "stage": 2
      },
      "error": "out of resource: shared memory, Required: 753664, Hardware limit: 65536. Reducing block sizes or `num_stages` may help."
    },
    "3506": {
      "config": {
        "BLOCK_SIZE_M": 128,
        "BLOCK_SIZE_N": 256,
        "num_warps": 8,
        "num_stages": 2,
        "waves_per_eu": 8,
        "stage": 3
      },
      "error": "out of resource: shared memory, Required: 163840, Hardware limit: 65536. Reducing block sizes or `num_stages` may help."
    },
    "1618": {
      "config": {
        "BLOCK_SIZE_M": 64,
        "BLOCK_SIZE_N": 256,
        "num_warps": 4,
        "num_stages": 8,
        "waves_per_eu": 8,
        "stage": 5
      },
      "error": "out of resource: shared memory, Required: 720896, Hardware limit: 65536. Reducing block sizes or `num_stages` may help."
    },
    "3263": {
      "config": {
        "BLOCK_SIZE_M": 128,
        "BLOCK_SIZE_N": 256,
        "num_warps": 2,
        "num_stages": 8,
        "waves_per_eu": 4,
        "stage": 6
      },
      "error": "out of resource: shared memory, Required: 688128, Hardware limit: 65536. Reducing block sizes or `num_stages` may help."
    },
    "2930": {
      "config": {
        "BLOCK_SIZE_M": 128,
        "BLOCK_SIZE_N": 128,
        "num_warps": 8,
        "num_stages": 4,
        "waves_per_eu": 4,
        "stage": 3
      },
      "error": "out of resource: shared memory, Required: 182272, Hardware limit: 65536. Reducing block sizes or `num_stages` may help."
    },
    "99": {
      "config": {
        "BLOCK_SIZE_M": 64,
        "BLOCK_SIZE_N": 64,
        "num_warps": 1,
        "num_stages": 8,
        "waves_per_eu": 1,
        "stage": 4
      },
      "error": "out of resource: shared memory, Required: 172032, Hardware limit: 65536. Reducing block sizes or `num_stages` may help."
    },
    "3405": {
      "config": {
        "BLOCK_SIZE_M": 128,
        "BLOCK_SIZE_N": 256,
        "num_warps": 4,
        "num_stages": 8,
        "waves_per_eu": 2,
        "stage": 4
      },
      "error": "out of resource: shared memory, Required: 688128, Hardware limit: 65536. Reducing block sizes or `num_stages` may help."
    },
    "3374": {
      "config": {
        "BLOCK_SIZE_M": 128,
        "BLOCK_SIZE_N": 256,
        "num_warps": 4,
        "num_stages": 4,
        "waves_per_eu": 2,
        "stage": 3
      },
      "error": "out of resource: shared memory, Required: 164864, Hardware limit: 65536. Reducing block sizes or `num_stages` may help."
    },
    "3222": {
      "config": {
        "BLOCK_SIZE_M": 128,
        "BLOCK_SIZE_N": 256,
        "num_warps": 2,
        "num_stages": 4,
        "waves_per_eu": 2,
        "stage": 1
      },
      "error": "out of resource: shared memory, Required: 131584, Hardware limit: 65536. Reducing block sizes or `num_stages` may help."
    },
    "295": {
      "config": {
        "BLOCK_SIZE_M": 64,
        "BLOCK_SIZE_N": 64,
        "num_warps": 2,
        "num_stages": 10,
        "waves_per_eu": 8,
        "stage": 2
      },
      "error": "out of resource: shared memory, Required: 221184, Hardware limit: 65536. Reducing block sizes or `num_stages` may help."
    },
    "4649": {
      "config": {
        "BLOCK_SIZE_M": 256,
        "BLOCK_SIZE_N": 128,
        "num_warps": 4,
        "num_stages": 10,
        "waves_per_eu": 8,
        "stage": 6
      },
      "error": "out of resource: shared memory, Required: 442368, Hardware limit: 65536. Reducing block sizes or `num_stages` may help."
    },
    "1268": {
      "config": {
        "BLOCK_SIZE_M": 64,
        "BLOCK_SIZE_N": 256,
        "num_warps": 1,
        "num_stages": 4,
        "waves_per_eu": 1,
        "stage": 3
      },
      "error": "out of resource: shared memory, Required: 114944, Hardware limit: 65536. Reducing block sizes or `num_stages` may help."
    },
    "1635": {
      "config": {
        "BLOCK_SIZE_M": 64,
        "BLOCK_SIZE_N": 256,
        "num_warps": 4,
        "num_stages": 10,
        "waves_per_eu": 2,
        "stage": 4
      },
      "error": "out of resource: shared memory, Required: 917504, Hardware limit: 65536. Reducing block sizes or `num_stages` may help."
    },
    "5306": {
      "config": {
        "BLOCK_SIZE_M": 256,
        "BLOCK_SIZE_N": 256,
        "num_warps": 8,
        "num_stages": 2,
        "waves_per_eu": 8,
        "stage": 3
      },
      "error": "out of resource: shared memory, Required: 98304, Hardware limit: 65536. Reducing block sizes or `num_stages` may help."
    },
    "1488": {
      "config": {
        "BLOCK_SIZE_M": 64,
        "BLOCK_SIZE_N": 256,
        "num_warps": 2,
        "num_stages": 10,
        "waves_per_eu": 4,
        "stage": 1
      },
      "error": "out of resource: shared memory, Required: 884736, Hardware limit: 65536. Reducing block sizes or `num_stages` may help."
    },
    "391": {
      "config": {
        "BLOCK_SIZE_M": 64,
        "BLOCK_SIZE_N": 64,
        "num_warps": 4,
        "num_stages": 8,
        "waves_per_eu": 0,
        "stage": 2
      },
      "error": "out of resource: shared memory, Required: 180224, Hardware limit: 65536. Reducing block sizes or `num_stages` may help."
    },
    "1434": {
      "config": {
        "BLOCK_SIZE_M": 64,
        "BLOCK_SIZE_N": 256,
        "num_warps": 2,
        "num_stages": 4,
        "waves_per_eu": 8,
        "stage": 1
      },
      "error": "out of resource: shared memory, Required: 131584, Hardware limit: 65536. Reducing block sizes or `num_stages` may help."
    },
    "4030": {
      "config": {
        "BLOCK_SIZE_M": 256,
        "BLOCK_SIZE_N": 64,
        "num_warps": 4,
        "num_stages": 10,
        "waves_per_eu": 1,
        "stage": 5
      },
      "error": "out of resource: shared memory, Required: 221184, Hardware limit: 65536. Reducing block sizes or `num_stages` may help."
    },
    "270": {
      "config": {
        "BLOCK_SIZE_M": 64,
        "BLOCK_SIZE_N": 64,
        "num_warps": 2,
        "num_stages": 10,
        "waves_per_eu": 0,
        "stage": 1
      },
      "error": "out of resource: shared memory, Required: 221184, Hardware limit: 65536. Reducing block sizes or `num_stages` may help."
    },
    "4146": {
      "config": {
        "BLOCK_SIZE_M": 256,
        "BLOCK_SIZE_N": 64,
        "num_warps": 8,
        "num_stages": 8,
        "waves_per_eu": 1,
        "stage": 1
      },
      "error": "out of resource: shared memory, Required: 172032, Hardware limit: 65536. Reducing block sizes or `num_stages` may help."
    },
    "4488": {
      "config": {
        "BLOCK_SIZE_M": 256,
        "BLOCK_SIZE_N": 128,
        "num_warps": 2,
        "num_stages": 10,
        "waves_per_eu": 4,
        "stage": 1
      },
      "error": "out of resource: shared memory, Required: 442368, Hardware limit: 65536. Reducing block sizes or `num_stages` may help."
    },
    "3285": {
      "config": {
        "BLOCK_SIZE_M": 128,
        "BLOCK_SIZE_N": 256,
        "num_warps": 2,
        "num_stages": 10,
        "waves_per_eu": 2,
        "stage": 4
      },
      "error": "out of resource: shared memory, Required: 884736, Hardware limit: 65536. Reducing block sizes or `num_stages` may help."
    },
    "1624": {
      "config": {
        "BLOCK_SIZE_M": 64,
        "BLOCK_SIZE_N": 256,
        "num_warps": 4,
        "num_stages": 10,
        "waves_per_eu": 0,
        "stage": 5
      },
      "error": "out of resource: shared memory, Required: 917504, Hardware limit: 65536. Reducing block sizes or `num_stages` may help."
    },
    "1934": {
      "config": {
        "BLOCK_SIZE_M": 128,
        "BLOCK_SIZE_N": 64,
        "num_warps": 1,
        "num_stages": 10,
        "waves_per_eu": 2,
        "stage": 3
      },
      "error": "out of resource: shared memory, Required: 221184, Hardware limit: 65536. Reducing block sizes or `num_stages` may help."
    },
    "1041": {
      "config": {
        "BLOCK_SIZE_M": 64,
        "BLOCK_SIZE_N": 128,
        "num_warps": 4,
        "num_stages": 10,
        "waves_per_eu": 4,
        "stage": 4
      },
      "error": "out of resource: shared memory, Required: 458752, Hardware limit: 65536. Reducing block sizes or `num_stages` may help."
    },
    "4634": {
      "config": {
        "BLOCK_SIZE_M": 256,
        "BLOCK_SIZE_N": 128,
        "num_warps": 4,
        "num_stages": 10,
        "waves_per_eu": 2,
        "stage": 3
      },
      "error": "out of resource: shared memory, Required: 442368, Hardware limit: 65536. Reducing block sizes or `num_stages` may help."
    },
    "2899": {
      "config": {
        "BLOCK_SIZE_M": 128,
        "BLOCK_SIZE_N": 128,
        "num_warps": 8,
        "num_stages": 2,
        "waves_per_eu": 4,
        "stage": 2
      },
      "error": "out of resource: shared memory, Required: 81920, Hardware limit: 65536. Reducing block sizes or `num_stages` may help."
    },
    "583": {
      "config": {
        "BLOCK_SIZE_M": 64,
        "BLOCK_SIZE_N": 64,
        "num_warps": 8,
        "num_stages": 10,
        "waves_per_eu": 2,
        "stage": 2
      },
      "error": "out of resource: shared memory, Required: 229376, Hardware limit: 65536. Reducing block sizes or `num_stages` may help."
    },
    "3264": {
      "config": {
        "BLOCK_SIZE_M": 128,
        "BLOCK_SIZE_N": 256,
        "num_warps": 2,
        "num_stages": 8,
        "waves_per_eu": 8,
        "stage": 1
      },
      "error": "out of resource: shared memory, Required: 688128, Hardware limit: 65536. Reducing block sizes or `num_stages` may help."
    },
    "1891": {
      "config": {
        "BLOCK_SIZE_M": 128,
        "BLOCK_SIZE_N": 64,
        "num_warps": 1,
        "num_stages": 8,
        "waves_per_eu": 0,
        "stage": 2
      },
      "error": "out of resource: shared memory, Required: 172032, Hardware limit: 65536. Reducing block sizes or `num_stages` may help."
    },
    "1292": {
      "config": {
        "BLOCK_SIZE_M": 64,
        "BLOCK_SIZE_N": 256,
        "num_warps": 1,
        "num_stages": 8,
        "waves_per_eu": 0,
        "stage": 3
      },
      "error": "out of resource: shared memory, Required: 688128, Hardware limit: 65536. Reducing block sizes or `num_stages` may help."
    },
    "420": {
      "config": {
        "BLOCK_SIZE_M": 64,
        "BLOCK_SIZE_N": 64,
        "num_warps": 4,
        "num_stages": 10,
        "waves_per_eu": 0,
        "stage": 1
      },
      "error": "out of resource: shared memory, Required: 229376, Hardware limit: 65536. Reducing block sizes or `num_stages` may help."
    },
    "1257": {
      "config": {
        "BLOCK_SIZE_M": 64,
        "BLOCK_SIZE_N": 256,
        "num_warps": 1,
        "num_stages": 2,
        "waves_per_eu": 8,
        "stage": 4
      },
      "error": "out of resource: shared memory, Required: 98304, Hardware limit: 65536. Reducing block sizes or `num_stages` may help."
    },
    "3279": {
      "config": {
        "BLOCK_SIZE_M": 128,
        "BLOCK_SIZE_N": 256,
        "num_warps": 2,
        "num_stages": 10,
        "waves_per_eu": 1,
        "stage": 4
      },
      "error": "out of resource: shared memory, Required: 884736, Hardware limit: 65536. Reducing block sizes or `num_stages` may help."
    },
    "2084": {
      "config": {
        "BLOCK_SIZE_M": 128,
        "BLOCK_SIZE_N": 64,
        "num_warps": 2,
        "num_stages": 10,
        "waves_per_eu": 2,
        "stage": 3
      },
      "error": "out of resource: shared memory, Required: 221184, Hardware limit: 65536. Reducing block sizes or `num_stages` may help."
    },
    "4627": {
      "config": {
        "BLOCK_SIZE_M": 256,
        "BLOCK_SIZE_N": 128,
        "num_warps": 4,
        "num_stages": 10,
        "waves_per_eu": 1,
        "stage": 2
      },
      "error": "out of resource: shared memory, Required: 442368, Hardware limit: 65536. Reducing block sizes or `num_stages` may help."
    },
    "254": {
      "config": {
        "BLOCK_SIZE_M": 64,
        "BLOCK_SIZE_N": 64,
        "num_warps": 2,
        "num_stages": 8,
        "waves_per_eu": 2,
        "stage": 3
      },
      "error": "out of resource: shared memory, Required: 172032, Hardware limit: 65536. Reducing block sizes or `num_stages` may help."
    },
    "2490": {
      "config": {
        "BLOCK_SIZE_M": 128,
        "BLOCK_SIZE_N": 128,
        "num_warps": 1,
        "num_stages": 8,
        "waves_per_eu": 0,
        "stage": 1
      },
      "error": "out of resource: shared memory, Required: 344064, Hardware limit: 65536. Reducing block sizes or `num_stages` may help."
    },
    "1001": {
      "config": {
        "BLOCK_SIZE_M": 64,
        "BLOCK_SIZE_N": 128,
        "num_warps": 4,
        "num_stages": 8,
        "waves_per_eu": 1,
        "stage": 6
      },
      "error": "out of resource: shared memory, Required: 360448, Hardware limit: 65536. Reducing block sizes or `num_stages` may help."
    },
    "1699": {
      "config": {
        "BLOCK_SIZE_M": 64,
        "BLOCK_SIZE_N": 256,
        "num_warps": 8,
        "num_stages": 2,
        "waves_per_eu": 4,
        "stage": 2
      },
      "error": "out of resource: shared memory, Required: 131072, Hardware limit: 65536. Reducing block sizes or `num_stages` may help."
    },
    "2491": {
      "config": {
        "BLOCK_SIZE_M": 128,
        "BLOCK_SIZE_N": 128,
        "num_warps": 1,
        "num_stages": 8,
        "waves_per_eu": 0,
        "stage": 2
      },
      "error": "out of resource: shared memory, Required: 344064, Hardware limit: 65536. Reducing block sizes or `num_stages` may help."
    },
    "700": {
      "config": {
        "BLOCK_SIZE_M": 64,
        "BLOCK_SIZE_N": 128,
        "num_warps": 1,
        "num_stages": 8,
        "waves_per_eu": 1,
        "stage": 5
      },
      "error": "out of resource: shared memory, Required: 344064, Hardware limit: 65536. Reducing block sizes or `num_stages` may help."
    },
    "3244": {
      "config": {
        "BLOCK_SIZE_M": 128,
        "BLOCK_SIZE_N": 256,
        "num_warps": 2,
        "num_stages": 8,
        "waves_per_eu": 0,
        "stage": 5
      },
      "error": "out of resource: shared memory, Required: 688128, Hardware limit: 65536. Reducing block sizes or `num_stages` may help."
    },
    "5142": {
      "config": {
        "BLOCK_SIZE_M": 256,
        "BLOCK_SIZE_N": 256,
        "num_warps": 4,
        "num_stages": 2,
        "waves_per_eu": 2,
        "stage": 1
      },
      "error": "out of resource: shared memory, Required: 98304, Hardware limit: 65536. Reducing block sizes or `num_stages` may help."
    },
    "1615": {
      "config": {
        "BLOCK_SIZE_M": 64,
        "BLOCK_SIZE_N": 256,
        "num_warps": 4,
        "num_stages": 8,
        "waves_per_eu": 8,
        "stage": 2
      },
      "error": "out of resource: shared memory, Required: 720896, Hardware limit: 65536. Reducing block sizes or `num_stages` may help."
    },
    "2052": {
      "config": {
        "BLOCK_SIZE_M": 128,
        "BLOCK_SIZE_N": 64,
        "num_warps": 2,
        "num_stages": 8,
        "waves_per_eu": 2,
        "stage": 1
      },
      "error": "out of resource: shared memory, Required: 172032, Hardware limit: 65536. Reducing block sizes or `num_stages` may help."
    },
    "4147": {
      "config": {
        "BLOCK_SIZE_M": 256,
        "BLOCK_SIZE_N": 64,
        "num_warps": 8,
        "num_stages": 8,
        "waves_per_eu": 1,
        "stage": 2
      },
      "error": "out of resource: shared memory, Required: 172032, Hardware limit: 65536. Reducing block sizes or `num_stages` may help."
    },
    "2204": {
      "config": {
        "BLOCK_SIZE_M": 128,
        "BLOCK_SIZE_N": 64,
        "num_warps": 4,
        "num_stages": 8,
        "waves_per_eu": 2,
        "stage": 3
      },
      "error": "out of resource: shared memory, Required: 172032, Hardware limit: 65536. Reducing block sizes or `num_stages` may help."
    },
    "5214": {
      "config": {
        "BLOCK_SIZE_M": 256,
        "BLOCK_SIZE_N": 256,
        "num_warps": 4,
        "num_stages": 8,
        "waves_per_eu": 8,
        "stage": 1
      },
      "error": "out of resource: shared memory, Required: 688128, Hardware limit: 65536. Reducing block sizes or `num_stages` may help."
    },
    "1780": {
      "config": {
        "BLOCK_SIZE_M": 64,
        "BLOCK_SIZE_N": 256,
        "num_warps": 8,
        "num_stages": 10,
        "waves_per_eu": 1,
        "stage": 5
      },
      "error": "out of resource: shared memory, Required: 917504, Hardware limit: 65536. Reducing block sizes or `num_stages` may help."
    },
    "3495": {
      "config": {
        "BLOCK_SIZE_M": 128,
        "BLOCK_SIZE_N": 256,
        "num_warps": 8,
        "num_stages": 2,
        "waves_per_eu": 2,
        "stage": 4
      },
      "error": "out of resource: shared memory, Required: 163840, Hardware limit: 65536. Reducing block sizes or `num_stages` may help."
    },
    "4748": {
      "config": {
        "BLOCK_SIZE_M": 256,
        "BLOCK_SIZE_N": 128,
        "num_warps": 8,
        "num_stages": 8,
        "waves_per_eu": 1,
        "stage": 3
      },
      "error": "out of resource: shared memory, Required: 344064, Hardware limit: 65536. Reducing block sizes or `num_stages` may help."
    },
    "3544": {
      "config": {
        "BLOCK_SIZE_M": 128,
        "BLOCK_SIZE_N": 256,
        "num_warps": 8,
        "num_stages": 8,
        "waves_per_eu": 0,
        "stage": 5
      },
      "error": "out of resource: shared memory, Required: 753664, Hardware limit: 65536. Reducing block sizes or `num_stages` may help."
    },
    "2389": {
      "config": {
        "BLOCK_SIZE_M": 128,
        "BLOCK_SIZE_N": 64,
        "num_warps": 8,
        "num_stages": 10,
        "waves_per_eu": 4,
        "stage": 2
      },
      "error": "out of resource: shared memory, Required: 237568, Hardware limit: 65536. Reducing block sizes or `num_stages` may help."
    },
    "2972": {
      "config": {
        "BLOCK_SIZE_M": 128,
        "BLOCK_SIZE_N": 128,
        "num_warps": 8,
        "num_stages": 10,
        "waves_per_eu": 0,
        "stage": 3
      },
      "error": "out of resource: shared memory, Required: 475136, Hardware limit: 65536. Reducing block sizes or `num_stages` may help."
    },
    "1251": {
      "config": {
        "BLOCK_SIZE_M": 64,
        "BLOCK_SIZE_N": 256,
        "num_warps": 1,
        "num_stages": 2,
        "waves_per_eu": 4,
        "stage": 4
      },
      "error": "out of resource: shared memory, Required: 98304, Hardware limit: 65536. Reducing block sizes or `num_stages` may help."
    },
    "3367": {
      "config": {
        "BLOCK_SIZE_M": 128,
        "BLOCK_SIZE_N": 256,
        "num_warps": 4,
        "num_stages": 4,
        "waves_per_eu": 1,
        "stage": 2
      },
      "error": "out of resource: shared memory, Required: 164864, Hardware limit: 65536. Reducing block sizes or `num_stages` may help."
    },
    "4160": {
      "config": {
        "BLOCK_SIZE_M": 256,
        "BLOCK_SIZE_N": 64,
        "num_warps": 8,
        "num_stages": 8,
        "waves_per_eu": 4,
        "stage": 3
      },
      "error": "out of resource: shared memory, Required: 172032, Hardware limit: 65536. Reducing block sizes or `num_stages` may help."
    },
    "1556": {
      "config": {
        "BLOCK_SIZE_M": 64,
        "BLOCK_SIZE_N": 256,
        "num_warps": 4,
        "num_stages": 2,
        "waves_per_eu": 8,
        "stage": 3
      },
      "error": "out of resource: shared memory, Required: 131072, Hardware limit: 65536. Reducing block sizes or `num_stages` may help."
    },
    "4633": {
      "config": {
        "BLOCK_SIZE_M": 256,
        "BLOCK_SIZE_N": 128,
        "num_warps": 4,
        "num_stages": 10,
        "waves_per_eu": 2,
        "stage": 2
      },
      "error": "out of resource: shared memory, Required: 442368, Hardware limit: 65536. Reducing block sizes or `num_stages` may help."
    },
    "2804": {
      "config": {
        "BLOCK_SIZE_M": 128,
        "BLOCK_SIZE_N": 128,
        "num_warps": 4,
        "num_stages": 8,
        "waves_per_eu": 2,
        "stage": 3
      },
      "error": "out of resource: shared memory, Required: 344064, Hardware limit: 65536. Reducing block sizes or `num_stages` may help."
    },
    "4799": {
      "config": {
        "BLOCK_SIZE_M": 256,
        "BLOCK_SIZE_N": 128,
        "num_warps": 8,
        "num_stages": 10,
        "waves_per_eu": 8,
        "stage": 6
      },
      "error": "out of resource: shared memory, Required: 442368, Hardware limit: 65536. Reducing block sizes or `num_stages` may help."
    },
    "146": {
      "config": {
        "BLOCK_SIZE_M": 64,
        "BLOCK_SIZE_N": 64,
        "num_warps": 1,
        "num_stages": 10,
        "waves_per_eu": 8,
        "stage": 3
      },
      "error": "out of resource: shared memory, Required: 221184, Hardware limit: 65536. Reducing block sizes or `num_stages` may help."
    },
    "3212": {
      "config": {
        "BLOCK_SIZE_M": 128,
        "BLOCK_SIZE_N": 256,
        "num_warps": 2,
        "num_stages": 4,
        "waves_per_eu": 0,
        "stage": 3
      },
      "error": "out of resource: shared memory, Required: 131584, Hardware limit: 65536. Reducing block sizes or `num_stages` may help."
    },
    "1232": {
      "config": {
        "BLOCK_SIZE_M": 64,
        "BLOCK_SIZE_N": 256,
        "num_warps": 1,
        "num_stages": 2,
        "waves_per_eu": 0,
        "stage": 3
      },
      "error": "out of resource: shared memory, Required: 98304, Hardware limit: 65536. Reducing block sizes or `num_stages` may help."
    },
    "3992": {
      "config": {
        "BLOCK_SIZE_M": 256,
        "BLOCK_SIZE_N": 64,
        "num_warps": 4,
        "num_stages": 8,
        "waves_per_eu": 0,
        "stage": 3
      },
      "error": "out of resource: shared memory, Required: 172032, Hardware limit: 65536. Reducing block sizes or `num_stages` may help."
    },
    "102": {
      "config": {
        "BLOCK_SIZE_M": 64,
        "BLOCK_SIZE_N": 64,
        "num_warps": 1,
        "num_stages": 8,
        "waves_per_eu": 2,
        "stage": 1
      },
      "error": "out of resource: shared memory, Required: 172032, Hardware limit: 65536. Reducing block sizes or `num_stages` may help."
    },
    "2348": {
      "config": {
        "BLOCK_SIZE_M": 128,
        "BLOCK_SIZE_N": 64,
        "num_warps": 8,
        "num_stages": 8,
        "waves_per_eu": 1,
        "stage": 3
      },
      "error": "out of resource: shared memory, Required: 188416, Hardware limit: 65536. Reducing block sizes or `num_stages` may help."
    },
    "3526": {
      "config": {
        "BLOCK_SIZE_M": 128,
        "BLOCK_SIZE_N": 256,
        "num_warps": 8,
        "num_stages": 4,
        "waves_per_eu": 2,
        "stage": 5
      },
      "error": "out of resource: shared memory, Required: 231424, Hardware limit: 65536. Reducing block sizes or `num_stages` may help."
    },
    "4023": {
      "config": {
        "BLOCK_SIZE_M": 256,
        "BLOCK_SIZE_N": 64,
        "num_warps": 4,
        "num_stages": 10,
        "waves_per_eu": 0,
        "stage": 4
      },
      "error": "out of resource: shared memory, Required: 221184, Hardware limit: 65536. Reducing block sizes or `num_stages` may help."
    },
    "5194": {
      "config": {
        "BLOCK_SIZE_M": 256,
        "BLOCK_SIZE_N": 256,
        "num_warps": 4,
        "num_stages": 8,
        "waves_per_eu": 0,
        "stage": 5
      },
      "error": "out of resource: shared memory, Required: 688128, Hardware limit: 65536. Reducing block sizes or `num_stages` may help."
    },
    "4611": {
      "config": {
        "BLOCK_SIZE_M": 256,
        "BLOCK_SIZE_N": 128,
        "num_warps": 4,
        "num_stages": 8,
        "waves_per_eu": 4,
        "stage": 4
      },
      "error": "out of resource: shared memory, Required: 344064, Hardware limit: 65536. Reducing block sizes or `num_stages` may help."
    },
    "1458": {
      "config": {
        "BLOCK_SIZE_M": 64,
        "BLOCK_SIZE_N": 256,
        "num_warps": 2,
        "num_stages": 8,
        "waves_per_eu": 4,
        "stage": 1
      },
      "error": "out of resource: shared memory, Required: 688128, Hardware limit: 65536. Reducing block sizes or `num_stages` may help."
    },
    "2497": {
      "config": {
        "BLOCK_SIZE_M": 128,
        "BLOCK_SIZE_N": 128,
        "num_warps": 1,
        "num_stages": 8,
        "waves_per_eu": 1,
        "stage": 2
      },
      "error": "out of resource: shared memory, Required: 344064, Hardware limit: 65536. Reducing block sizes or `num_stages` may help."
    },
    "4476": {
      "config": {
        "BLOCK_SIZE_M": 256,
        "BLOCK_SIZE_N": 128,
        "num_warps": 2,
        "num_stages": 10,
        "waves_per_eu": 1,
        "stage": 1
      },
      "error": "out of resource: shared memory, Required: 442368, Hardware limit: 65536. Reducing block sizes or `num_stages` may help."
    },
    "5174": {
      "config": {
        "BLOCK_SIZE_M": 256,
        "BLOCK_SIZE_N": 256,
        "num_warps": 4,
        "num_stages": 4,
        "waves_per_eu": 2,
        "stage": 3
      },
      "error": "out of resource: shared memory, Required: 164864, Hardware limit: 65536. Reducing block sizes or `num_stages` may help."
    },
    "1718": {
      "config": {
        "BLOCK_SIZE_M": 64,
        "BLOCK_SIZE_N": 256,
        "num_warps": 8,
        "num_stages": 4,
        "waves_per_eu": 1,
        "stage": 3
      },
      "error": "out of resource: shared memory, Required: 231424, Hardware limit: 65536. Reducing block sizes or `num_stages` may help."
    },
    "4192": {
      "config": {
        "BLOCK_SIZE_M": 256,
        "BLOCK_SIZE_N": 64,
        "num_warps": 8,
        "num_stages": 10,
        "waves_per_eu": 4,
        "stage": 5
      },
      "error": "out of resource: shared memory, Required: 221184, Hardware limit: 65536. Reducing block sizes or `num_stages` may help."
    },
    "4465": {
      "config": {
        "BLOCK_SIZE_M": 256,
        "BLOCK_SIZE_N": 128,
        "num_warps": 2,
        "num_stages": 8,
        "waves_per_eu": 8,
        "stage": 2
      },
      "error": "out of resource: shared memory, Required: 344064, Hardware limit: 65536. Reducing block sizes or `num_stages` may help."
    },
    "2534": {
      "config": {
        "BLOCK_SIZE_M": 128,
        "BLOCK_SIZE_N": 128,
        "num_warps": 1,
        "num_stages": 10,
        "waves_per_eu": 2,
        "stage": 3
      },
      "error": "out of resource: shared memory, Required: 442368, Hardware limit: 65536. Reducing block sizes or `num_stages` may help."
    },
    "3088": {
      "config": {
        "BLOCK_SIZE_M": 128,
        "BLOCK_SIZE_N": 256,
        "num_warps": 1,
        "num_stages": 4,
        "waves_per_eu": 8,
        "stage": 5
      },
      "error": "out of resource: shared memory, Required: 114944, Hardware limit: 65536. Reducing block sizes or `num_stages` may help."
    },
    "4917": {
      "config": {
        "BLOCK_SIZE_M": 256,
        "BLOCK_SIZE_N": 256,
        "num_warps": 1,
        "num_stages": 8,
        "waves_per_eu": 8,
        "stage": 4
      },
      "error": "out of resource: shared memory, Required: 688128, Hardware limit: 65536. Reducing block sizes or `num_stages` may help."
    },
    "5228": {
      "config": {
        "BLOCK_SIZE_M": 256,
        "BLOCK_SIZE_N": 256,
        "num_warps": 4,
        "num_stages": 10,
        "waves_per_eu": 1,
        "stage": 3
      },
      "error": "out of resource: shared memory, Required: 884736, Hardware limit: 65536. Reducing block sizes or `num_stages` may help."
    },
    "4918": {
      "config": {
        "BLOCK_SIZE_M": 256,
        "BLOCK_SIZE_N": 256,
        "num_warps": 1,
        "num_stages": 8,
        "waves_per_eu": 8,
        "stage": 5
      },
      "error": "out of resource: shared memory, Required: 688128, Hardware limit: 65536. Reducing block sizes or `num_stages` may help."
    },
    "3260": {
      "config": {
        "BLOCK_SIZE_M": 128,
        "BLOCK_SIZE_N": 256,
        "num_warps": 2,
        "num_stages": 8,
        "waves_per_eu": 4,
        "stage": 3
      },
      "error": "out of resource: shared memory, Required: 688128, Hardware limit: 65536. Reducing block sizes or `num_stages` may help."
    },
    "5032": {
      "config": {
        "BLOCK_SIZE_M": 256,
        "BLOCK_SIZE_N": 256,
        "num_warps": 2,
        "num_stages": 4,
        "waves_per_eu": 4,
        "stage": 5
      },
      "error": "out of resource: shared memory, Required: 131584, Hardware limit: 65536. Reducing block sizes or `num_stages` may help."
    },
    "5208": {
      "config": {
        "BLOCK_SIZE_M": 256,
        "BLOCK_SIZE_N": 256,
        "num_warps": 4,
        "num_stages": 8,
        "waves_per_eu": 4,
        "stage": 1
      },
      "error": "out of resource: shared memory, Required: 688128, Hardware limit: 65536. Reducing block sizes or `num_stages` may help."
    },
    "2392": {
      "config": {
        "BLOCK_SIZE_M": 128,
        "BLOCK_SIZE_N": 64,
        "num_warps": 8,
        "num_stages": 10,
        "waves_per_eu": 4,
        "stage": 5
      },
      "error": "out of resource: shared memory, Required: 237568, Hardware limit: 65536. Reducing block sizes or `num_stages` may help."
    },
    "1345": {
      "config": {
        "BLOCK_SIZE_M": 64,
        "BLOCK_SIZE_N": 256,
        "num_warps": 1,
        "num_stages": 10,
        "waves_per_eu": 8,
        "stage": 2
      },
      "error": "out of resource: shared memory, Required: 884736, Hardware limit: 65536. Reducing block sizes or `num_stages` may help."
    },
    "133": {
      "config": {
        "BLOCK_SIZE_M": 64,
        "BLOCK_SIZE_N": 64,
        "num_warps": 1,
        "num_stages": 10,
        "waves_per_eu": 2,
        "stage": 2
      },
      "error": "out of resource: shared memory, Required: 221184, Hardware limit: 65536. Reducing block sizes or `num_stages` may help."
    },
    "3077": {
      "config": {
        "BLOCK_SIZE_M": 128,
        "BLOCK_SIZE_N": 256,
        "num_warps": 1,
        "num_stages": 4,
        "waves_per_eu": 2,
        "stage": 6
      },
      "error": "out of resource: shared memory, Required: 114944, Hardware limit: 65536. Reducing block sizes or `num_stages` may help."
    },
    "1258": {
      "config": {
        "BLOCK_SIZE_M": 64,
        "BLOCK_SIZE_N": 256,
        "num_warps": 1,
        "num_stages": 2,
        "waves_per_eu": 8,
        "stage": 5
      },
      "error": "out of resource: shared memory, Required: 98304, Hardware limit: 65536. Reducing block sizes or `num_stages` may help."
    },
    "4711": {
      "config": {
        "BLOCK_SIZE_M": 256,
        "BLOCK_SIZE_N": 128,
        "num_warps": 8,
        "num_stages": 4,
        "waves_per_eu": 0,
        "stage": 2
      },
      "error": "out of resource: shared memory, Required: 182272, Hardware limit: 65536. Reducing block sizes or `num_stages` may help."
    },
    "5035": {
      "config": {
        "BLOCK_SIZE_M": 256,
        "BLOCK_SIZE_N": 256,
        "num_warps": 2,
        "num_stages": 4,
        "waves_per_eu": 8,
        "stage": 2
      },
      "error": "out of resource: shared memory, Required: 131584, Hardware limit: 65536. Reducing block sizes or `num_stages` may help."
    },
    "3208": {
      "config": {
        "BLOCK_SIZE_M": 128,
        "BLOCK_SIZE_N": 256,
        "num_warps": 2,
        "num_stages": 2,
        "waves_per_eu": 8,
        "stage": 5
      },
      "error": "out of resource: shared memory, Required: 98304, Hardware limit: 65536. Reducing block sizes or `num_stages` may help."
    },
    "1477": {
      "config": {
        "BLOCK_SIZE_M": 64,
        "BLOCK_SIZE_N": 256,
        "num_warps": 2,
        "num_stages": 10,
        "waves_per_eu": 1,
        "stage": 2
      },
      "error": "out of resource: shared memory, Required: 884736, Hardware limit: 65536. Reducing block sizes or `num_stages` may help."
    },
    "2936": {
      "config": {
        "BLOCK_SIZE_M": 128,
        "BLOCK_SIZE_N": 128,
        "num_warps": 8,
        "num_stages": 4,
        "waves_per_eu": 8,
        "stage": 3
      },
      "error": "out of resource: shared memory, Required: 182272, Hardware limit: 65536. Reducing block sizes or `num_stages` may help."
    },
    "705": {
      "config": {
        "BLOCK_SIZE_M": 64,
        "BLOCK_SIZE_N": 128,
        "num_warps": 1,
        "num_stages": 8,
        "waves_per_eu": 2,
        "stage": 4
      },
      "error": "out of resource: shared memory, Required: 344064, Hardware limit: 65536. Reducing block sizes or `num_stages` may help."
    },
    "3048": {
      "config": {
        "BLOCK_SIZE_M": 128,
        "BLOCK_SIZE_N": 256,
        "num_warps": 1,
        "num_stages": 2,
        "waves_per_eu": 4,
        "stage": 1
      },
      "error": "out of resource: shared memory, Required: 98304, Hardware limit: 65536. Reducing block sizes or `num_stages` may help."
    },
    "4042": {
      "config": {
        "BLOCK_SIZE_M": 256,
        "BLOCK_SIZE_N": 64,
        "num_warps": 4,
        "num_stages": 10,
        "waves_per_eu": 4,
        "stage": 5
      },
      "error": "out of resource: shared memory, Required: 221184, Hardware limit: 65536. Reducing block sizes or `num_stages` may help."
    },
    "1127": {
      "config": {
        "BLOCK_SIZE_M": 64,
        "BLOCK_SIZE_N": 128,
        "num_warps": 8,
        "num_stages": 4,
        "waves_per_eu": 2,
        "stage": 6
      },
      "error": "out of resource: shared memory, Required: 182272, Hardware limit: 65536. Reducing block sizes or `num_stages` may help."
    },
    "5328": {
      "config": {
        "BLOCK_SIZE_M": 256,
        "BLOCK_SIZE_N": 256,
        "num_warps": 8,
        "num_stages": 4,
        "waves_per_eu": 4,
        "stage": 1
      },
      "error": "out of resource: shared memory, Required: 231424, Hardware limit: 65536. Reducing block sizes or `num_stages` may help."
    },
    "3439": {
      "config": {
        "BLOCK_SIZE_M": 128,
        "BLOCK_SIZE_N": 256,
        "num_warps": 4,
        "num_stages": 10,
        "waves_per_eu": 4,
        "stage": 2
      },
      "error": "out of resource: shared memory, Required: 884736, Hardware limit: 65536. Reducing block sizes or `num_stages` may help."
    },
    "844": {
      "config": {
        "BLOCK_SIZE_M": 64,
        "BLOCK_SIZE_N": 128,
        "num_warps": 2,
        "num_stages": 8,
        "waves_per_eu": 0,
        "stage": 5
      },
      "error": "out of resource: shared memory, Required: 344064, Hardware limit: 65536. Reducing block sizes or `num_stages` may help."
    },
    "4882": {
      "config": {
        "BLOCK_SIZE_M": 256,
        "BLOCK_SIZE_N": 256,
        "num_warps": 1,
        "num_stages": 4,
        "waves_per_eu": 4,
        "stage": 5
      },
      "error": "out of resource: shared memory, Required: 114944, Hardware limit: 65536. Reducing block sizes or `num_stages` may help."
    },
    "2547": {
      "config": {
        "BLOCK_SIZE_M": 128,
        "BLOCK_SIZE_N": 128,
        "num_warps": 1,
        "num_stages": 10,
        "waves_per_eu": 8,
        "stage": 4
      },
      "error": "out of resource: shared memory, Required: 442368, Hardware limit: 65536. Reducing block sizes or `num_stages` may help."
    },
    "442": {
      "config": {
        "BLOCK_SIZE_M": 64,
        "BLOCK_SIZE_N": 64,
        "num_warps": 4,
        "num_stages": 10,
        "waves_per_eu": 4,
        "stage": 5
      },
      "error": "out of resource: shared memory, Required: 229376, Hardware limit: 65536. Reducing block sizes or `num_stages` may help."
    },
    "991": {
      "config": {
        "BLOCK_SIZE_M": 64,
        "BLOCK_SIZE_N": 128,
        "num_warps": 4,
        "num_stages": 8,
        "waves_per_eu": 0,
        "stage": 2
      },
      "error": "out of resource: shared memory, Required: 360448, Hardware limit: 65536. Reducing block sizes or `num_stages` may help."
    },
    "2647": {
      "config": {
        "BLOCK_SIZE_M": 128,
        "BLOCK_SIZE_N": 128,
        "num_warps": 2,
        "num_stages": 8,
        "waves_per_eu": 1,
        "stage": 2
      },
      "error": "out of resource: shared memory, Required: 344064, Hardware limit: 65536. Reducing block sizes or `num_stages` may help."
    },
    "1439": {
      "config": {
        "BLOCK_SIZE_M": 64,
        "BLOCK_SIZE_N": 256,
        "num_warps": 2,
        "num_stages": 4,
        "waves_per_eu": 8,
        "stage": 6
      },
      "error": "out of resource: shared memory, Required: 131584, Hardware limit: 65536. Reducing block sizes or `num_stages` may help."
    },
    "1480": {
      "config": {
        "BLOCK_SIZE_M": 64,
        "BLOCK_SIZE_N": 256,
        "num_warps": 2,
        "num_stages": 10,
        "waves_per_eu": 1,
        "stage": 5
      },
      "error": "out of resource: shared memory, Required: 884736, Hardware limit: 65536. Reducing block sizes or `num_stages` may help."
    },
    "2904": {
      "config": {
        "BLOCK_SIZE_M": 128,
        "BLOCK_SIZE_N": 128,
        "num_warps": 8,
        "num_stages": 2,
        "waves_per_eu": 8,
        "stage": 1
      },
      "error": "out of resource: shared memory, Required: 81920, Hardware limit: 65536. Reducing block sizes or `num_stages` may help."
    },
    "566": {
      "config": {
        "BLOCK_SIZE_M": 64,
        "BLOCK_SIZE_N": 64,
        "num_warps": 8,
        "num_stages": 8,
        "waves_per_eu": 8,
        "stage": 3
      },
      "error": "out of resource: shared memory, Required: 180224, Hardware limit: 65536. Reducing block sizes or `num_stages` may help."
    },
    "3490": {
      "config": {
        "BLOCK_SIZE_M": 128,
        "BLOCK_SIZE_N": 256,
        "num_warps": 8,
        "num_stages": 2,
        "waves_per_eu": 1,
        "stage": 5
      },
      "error": "out of resource: shared memory, Required: 163840, Hardware limit: 65536. Reducing block sizes or `num_stages` may help."
    },
    "3341": {
      "config": {
        "BLOCK_SIZE_M": 128,
        "BLOCK_SIZE_N": 256,
        "num_warps": 4,
        "num_stages": 2,
        "waves_per_eu": 1,
        "stage": 6
      },
      "error": "out of resource: shared memory, Required: 98304, Hardware limit: 65536. Reducing block sizes or `num_stages` may help."
    },
    "4481": {
      "config": {
        "BLOCK_SIZE_M": 256,
        "BLOCK_SIZE_N": 128,
        "num_warps": 2,
        "num_stages": 10,
        "waves_per_eu": 1,
        "stage": 6
      },
      "error": "out of resource: shared memory, Required: 442368, Hardware limit: 65536. Reducing block sizes or `num_stages` may help."
    },
    "2677": {
      "config": {
        "BLOCK_SIZE_M": 128,
        "BLOCK_SIZE_N": 128,
        "num_warps": 2,
        "num_stages": 10,
        "waves_per_eu": 1,
        "stage": 2
      },
      "error": "out of resource: shared memory, Required: 442368, Hardware limit: 65536. Reducing block sizes or `num_stages` may help."
    },
    "1742": {
      "config": {
        "BLOCK_SIZE_M": 64,
        "BLOCK_SIZE_N": 256,
        "num_warps": 8,
        "num_stages": 8,
        "waves_per_eu": 0,
        "stage": 3
      },
      "error": "out of resource: shared memory, Required: 720896, Hardware limit: 65536. Reducing block sizes or `num_stages` may help."
    },
    "3878": {
      "config": {
        "BLOCK_SIZE_M": 256,
        "BLOCK_SIZE_N": 64,
        "num_warps": 2,
        "num_stages": 10,
        "waves_per_eu": 1,
        "stage": 3
      },
      "error": "out of resource: shared memory, Required: 221184, Hardware limit: 65536. Reducing block sizes or `num_stages` may help."
    },
    "3860": {
      "config": {
        "BLOCK_SIZE_M": 256,
        "BLOCK_SIZE_N": 64,
        "num_warps": 2,
        "num_stages": 8,
        "waves_per_eu": 4,
        "stage": 3
      },
      "error": "out of resource: shared memory, Required: 172032, Hardware limit: 65536. Reducing block sizes or `num_stages` may help."
    },
    "3845": {
      "config": {
        "BLOCK_SIZE_M": 256,
        "BLOCK_SIZE_N": 64,
        "num_warps": 2,
        "num_stages": 8,
        "waves_per_eu": 0,
        "stage": 6
      },
      "error": "out of resource: shared memory, Required: 172032, Hardware limit: 65536. Reducing block sizes or `num_stages` may help."
    },
    "2241": {
      "config": {
        "BLOCK_SIZE_M": 128,
        "BLOCK_SIZE_N": 64,
        "num_warps": 4,
        "num_stages": 10,
        "waves_per_eu": 4,
        "stage": 4
      },
      "error": "out of resource: shared memory, Required: 221184, Hardware limit: 65536. Reducing block sizes or `num_stages` may help."
    },
    "733": {
      "config": {
        "BLOCK_SIZE_M": 64,
        "BLOCK_SIZE_N": 128,
        "num_warps": 1,
        "num_stages": 10,
        "waves_per_eu": 2,
        "stage": 2
      },
      "error": "out of resource: shared memory, Required: 442368, Hardware limit: 65536. Reducing block sizes or `num_stages` may help."
    },
    "107": {
      "config": {
        "BLOCK_SIZE_M": 64,
        "BLOCK_SIZE_N": 64,
        "num_warps": 1,
        "num_stages": 8,
        "waves_per_eu": 2,
        "stage": 6
      },
      "error": "out of resource: shared memory, Required: 172032, Hardware limit: 65536. Reducing block sizes or `num_stages` may help."
    },
    "1184": {
      "config": {
        "BLOCK_SIZE_M": 64,
        "BLOCK_SIZE_N": 128,
        "num_warps": 8,
        "num_stages": 10,
        "waves_per_eu": 2,
        "stage": 3
      },
      "error": "out of resource: shared memory, Required: 458752, Hardware limit: 65536. Reducing block sizes or `num_stages` may help."
    },
    "4613": {
      "config": {
        "BLOCK_SIZE_M": 256,
        "BLOCK_SIZE_N": 128,
        "num_warps": 4,
        "num_stages": 8,
        "waves_per_eu": 4,
        "stage": 6
      },
      "error": "out of resource: shared memory, Required: 344064, Hardware limit: 65536. Reducing block sizes or `num_stages` may help."
    },
    "2823": {
      "config": {
        "BLOCK_SIZE_M": 128,
        "BLOCK_SIZE_N": 128,
        "num_warps": 4,
        "num_stages": 10,
        "waves_per_eu": 0,
        "stage": 4
      },
      "error": "out of resource: shared memory, Required: 442368, Hardware limit: 65536. Reducing block sizes or `num_stages` may help."
    },
    "4010": {
      "config": {
        "BLOCK_SIZE_M": 256,
        "BLOCK_SIZE_N": 64,
        "num_warps": 4,
        "num_stages": 8,
        "waves_per_eu": 4,
        "stage": 3
      },
      "error": "out of resource: shared memory, Required: 172032, Hardware limit: 65536. Reducing block sizes or `num_stages` may help."
    },
    "4015": {
      "config": {
        "BLOCK_SIZE_M": 256,
        "BLOCK_SIZE_N": 64,
        "num_warps": 4,
        "num_stages": 8,
        "waves_per_eu": 8,
        "stage": 2
      },
      "error": "out of resource: shared memory, Required: 172032, Hardware limit: 65536. Reducing block sizes or `num_stages` may help."
    },
    "129": {
      "config": {
        "BLOCK_SIZE_M": 64,
        "BLOCK_SIZE_N": 64,
        "num_warps": 1,
        "num_stages": 10,
        "waves_per_eu": 1,
        "stage": 4
      },
      "error": "out of resource: shared memory, Required: 221184, Hardware limit: 65536. Reducing block sizes or `num_stages` may help."
    },
    "125": {
      "config": {
        "BLOCK_SIZE_M": 64,
        "BLOCK_SIZE_N": 64,
        "num_warps": 1,
        "num_stages": 10,
        "waves_per_eu": 0,
        "stage": 6
      },
      "error": "out of resource: shared memory, Required: 221184, Hardware limit: 65536. Reducing block sizes or `num_stages` may help."
    },
    "246": {
      "config": {
        "BLOCK_SIZE_M": 64,
        "BLOCK_SIZE_N": 64,
        "num_warps": 2,
        "num_stages": 8,
        "waves_per_eu": 1,
        "stage": 1
      },
      "error": "out of resource: shared memory, Required: 172032, Hardware limit: 65536. Reducing block sizes or `num_stages` may help."
    },
    "1265": {
      "config": {
        "BLOCK_SIZE_M": 64,
        "BLOCK_SIZE_N": 256,
        "num_warps": 1,
        "num_stages": 4,
        "waves_per_eu": 0,
        "stage": 6
      },
      "error": "out of resource: shared memory, Required: 114944, Hardware limit: 65536. Reducing block sizes or `num_stages` may help."
    },
    "2209": {
      "config": {
        "BLOCK_SIZE_M": 128,
        "BLOCK_SIZE_N": 64,
        "num_warps": 4,
        "num_stages": 8,
        "waves_per_eu": 4,
        "stage": 2
      },
      "error": "out of resource: shared memory, Required: 172032, Hardware limit: 65536. Reducing block sizes or `num_stages` may help."
    },
    "1195": {
      "config": {
        "BLOCK_SIZE_M": 64,
        "BLOCK_SIZE_N": 128,
        "num_warps": 8,
        "num_stages": 10,
        "waves_per_eu": 8,
        "stage": 2
      },
      "error": "out of resource: shared memory, Required: 458752, Hardware limit: 65536. Reducing block sizes or `num_stages` may help."
    },
    "1631": {
      "config": {
        "BLOCK_SIZE_M": 64,
        "BLOCK_SIZE_N": 256,
        "num_warps": 4,
        "num_stages": 10,
        "waves_per_eu": 1,
        "stage": 6
      },
      "error": "out of resource: shared memory, Required: 917504, Hardware limit: 65536. Reducing block sizes or `num_stages` may help."
    },
    "1459": {
      "config": {
        "BLOCK_SIZE_M": 64,
        "BLOCK_SIZE_N": 256,
        "num_warps": 2,
        "num_stages": 8,
        "waves_per_eu": 4,
        "stage": 2
      },
      "error": "out of resource: shared memory, Required: 688128, Hardware limit: 65536. Reducing block sizes or `num_stages` may help."
    },
    "715": {
      "config": {
        "BLOCK_SIZE_M": 64,
        "BLOCK_SIZE_N": 128,
        "num_warps": 1,
        "num_stages": 8,
        "waves_per_eu": 8,
        "stage": 2
      },
      "error": "out of resource: shared memory, Required: 344064, Hardware limit: 65536. Reducing block sizes or `num_stages` may help."
    },
    "3524": {
      "config": {
        "BLOCK_SIZE_M": 128,
        "BLOCK_SIZE_N": 256,
        "num_warps": 8,
        "num_stages": 4,
        "waves_per_eu": 2,
        "stage": 3
      },
      "error": "out of resource: shared memory, Required: 231424, Hardware limit: 65536. Reducing block sizes or `num_stages` may help."
    },
    "865": {
      "config": {
        "BLOCK_SIZE_M": 64,
        "BLOCK_SIZE_N": 128,
        "num_warps": 2,
        "num_stages": 8,
        "waves_per_eu": 8,
        "stage": 2
      },
      "error": "out of resource: shared memory, Required: 344064, Hardware limit: 65536. Reducing block sizes or `num_stages` may help."
    },
    "3288": {
      "config": {
        "BLOCK_SIZE_M": 128,
        "BLOCK_SIZE_N": 256,
        "num_warps": 2,
        "num_stages": 10,
        "waves_per_eu": 4,
        "stage": 1
      },
      "error": "out of resource: shared memory, Required: 884736, Hardware limit: 65536. Reducing block sizes or `num_stages` may help."
    },
    "890": {
      "config": {
        "BLOCK_SIZE_M": 64,
        "BLOCK_SIZE_N": 128,
        "num_warps": 2,
        "num_stages": 10,
        "waves_per_eu": 4,
        "stage": 3
      },
      "error": "out of resource: shared memory, Required: 442368, Hardware limit: 65536. Reducing block sizes or `num_stages` may help."
    },
    "2821": {
      "config": {
        "BLOCK_SIZE_M": 128,
        "BLOCK_SIZE_N": 128,
        "num_warps": 4,
        "num_stages": 10,
        "waves_per_eu": 0,
        "stage": 2
      },
      "error": "out of resource: shared memory, Required: 442368, Hardware limit: 65536. Reducing block sizes or `num_stages` may help."
    },
    "431": {
      "config": {
        "BLOCK_SIZE_M": 64,
        "BLOCK_SIZE_N": 64,
        "num_warps": 4,
        "num_stages": 10,
        "waves_per_eu": 1,
        "stage": 6
      },
      "error": "out of resource: shared memory, Required: 229376, Hardware limit: 65536. Reducing block sizes or `num_stages` may help."
    },
    "1280": {
      "config": {
        "BLOCK_SIZE_M": 64,
        "BLOCK_SIZE_N": 256,
        "num_warps": 1,
        "num_stages": 4,
        "waves_per_eu": 4,
        "stage": 3
      },
      "error": "out of resource: shared memory, Required: 114944, Hardware limit: 65536. Reducing block sizes or `num_stages` may help."
    },
    "4989": {
      "config": {
        "BLOCK_SIZE_M": 256,
        "BLOCK_SIZE_N": 256,
        "num_warps": 2,
        "num_stages": 2,
        "waves_per_eu": 1,
        "stage": 4
      },
      "error": "out of resource: shared memory, Required: 98304, Hardware limit: 65536. Reducing block sizes or `num_stages` may help."
    },
    "1788": {
      "config": {
        "BLOCK_SIZE_M": 64,
        "BLOCK_SIZE_N": 256,
        "num_warps": 8,
        "num_stages": 10,
        "waves_per_eu": 4,
        "stage": 1
      },
      "error": "out of resource: shared memory, Required: 917504, Hardware limit: 65536. Reducing block sizes or `num_stages` may help."
    },
    "1738": {
      "config": {
        "BLOCK_SIZE_M": 64,
        "BLOCK_SIZE_N": 256,
        "num_warps": 8,
        "num_stages": 4,
        "waves_per_eu": 8,
        "stage": 5
      },
      "error": "out of resource: shared memory, Required: 231424, Hardware limit: 65536. Reducing block sizes or `num_stages` may help."
    },
    "2978": {
      "config": {
        "BLOCK_SIZE_M": 128,
        "BLOCK_SIZE_N": 128,
        "num_warps": 8,
        "num_stages": 10,
        "waves_per_eu": 1,
        "stage": 3
      },
      "error": "out of resource: shared memory, Required: 475136, Hardware limit: 65536. Reducing block sizes or `num_stages` may help."
    },
    "1943": {
      "config": {
        "BLOCK_SIZE_M": 128,
        "BLOCK_SIZE_N": 64,
        "num_warps": 1,
        "num_stages": 10,
        "waves_per_eu": 4,
        "stage": 6
      },
      "error": "out of resource: shared memory, Required: 221184, Hardware limit: 65536. Reducing block sizes or `num_stages` may help."
    },
    "2075": {
      "config": {
        "BLOCK_SIZE_M": 128,
        "BLOCK_SIZE_N": 64,
        "num_warps": 2,
        "num_stages": 10,
        "waves_per_eu": 0,
        "stage": 6
      },
      "error": "out of resource: shared memory, Required: 221184, Hardware limit: 65536. Reducing block sizes or `num_stages` may help."
    },
    "2539": {
      "config": {
        "BLOCK_SIZE_M": 128,
        "BLOCK_SIZE_N": 128,
        "num_warps": 1,
        "num_stages": 10,
        "waves_per_eu": 4,
        "stage": 2
      },
      "error": "out of resource: shared memory, Required: 442368, Hardware limit: 65536. Reducing block sizes or `num_stages` may help."
    },
    "3536": {
      "config": {
        "BLOCK_SIZE_M": 128,
        "BLOCK_SIZE_N": 256,
        "num_warps": 8,
        "num_stages": 4,
        "waves_per_eu": 8,
        "stage": 3
      },
      "error": "out of resource: shared memory, Required: 231424, Hardware limit: 65536. Reducing block sizes or `num_stages` may help."
    },
    "1733": {
      "config": {
        "BLOCK_SIZE_M": 64,
        "BLOCK_SIZE_N": 256,
        "num_warps": 8,
        "num_stages": 4,
        "waves_per_eu": 4,
        "stage": 6
      },
      "error": "out of resource: shared memory, Required: 231424, Hardware limit: 65536. Reducing block sizes or `num_stages` may help."
    },
    "1921": {
      "config": {
        "BLOCK_SIZE_M": 128,
        "BLOCK_SIZE_N": 64,
        "num_warps": 1,
        "num_stages": 10,
        "waves_per_eu": 0,
        "stage": 2
      },
      "error": "out of resource: shared memory, Required: 221184, Hardware limit: 65536. Reducing block sizes or `num_stages` may help."
    },
    "996": {
      "config": {
        "BLOCK_SIZE_M": 64,
        "BLOCK_SIZE_N": 128,
        "num_warps": 4,
        "num_stages": 8,
        "waves_per_eu": 1,
        "stage": 1
      },
      "error": "out of resource: shared memory, Required: 360448, Hardware limit: 65536. Reducing block sizes or `num_stages` may help."
    },
    "122": {
      "config": {
        "BLOCK_SIZE_M": 64,
        "BLOCK_SIZE_N": 64,
        "num_warps": 1,
        "num_stages": 10,
        "waves_per_eu": 0,
        "stage": 3
      },
      "error": "out of resource: shared memory, Required: 221184, Hardware limit: 65536. Reducing block sizes or `num_stages` may help."
    },
    "1231": {
      "config": {
        "BLOCK_SIZE_M": 64,
        "BLOCK_SIZE_N": 256,
        "num_warps": 1,
        "num_stages": 2,
        "waves_per_eu": 0,
        "stage": 2
      },
      "error": "out of resource: shared memory, Required: 98304, Hardware limit: 65536. Reducing block sizes or `num_stages` may help."
    },
    "2949": {
      "config": {
        "BLOCK_SIZE_M": 128,
        "BLOCK_SIZE_N": 128,
        "num_warps": 8,
        "num_stages": 8,
        "waves_per_eu": 1,
        "stage": 4
      },
      "error": "out of resource: shared memory, Required: 376832, Hardware limit: 65536. Reducing block sizes or `num_stages` may help."
    },
    "3044": {
      "config": {
        "BLOCK_SIZE_M": 128,
        "BLOCK_SIZE_N": 256,
        "num_warps": 1,
        "num_stages": 2,
        "waves_per_eu": 2,
        "stage": 3
      },
      "error": "out of resource: shared memory, Required: 98304, Hardware limit: 65536. Reducing block sizes or `num_stages` may help."
    },
    "4843": {
      "config": {
        "BLOCK_SIZE_M": 256,
        "BLOCK_SIZE_N": 256,
        "num_warps": 1,
        "num_stages": 2,
        "waves_per_eu": 2,
        "stage": 2
      },
      "error": "out of resource: shared memory, Required: 98304, Hardware limit: 65536. Reducing block sizes or `num_stages` may help."
    },
    "1918": {
      "config": {
        "BLOCK_SIZE_M": 128,
        "BLOCK_SIZE_N": 64,
        "num_warps": 1,
        "num_stages": 8,
        "waves_per_eu": 8,
        "stage": 5
      },
      "error": "out of resource: shared memory, Required: 172032, Hardware limit: 65536. Reducing block sizes or `num_stages` may help."
    },
    "4729": {
      "config": {
        "BLOCK_SIZE_M": 256,
        "BLOCK_SIZE_N": 128,
        "num_warps": 8,
        "num_stages": 4,
        "waves_per_eu": 4,
        "stage": 2
      },
      "error": "out of resource: shared memory, Required: 182272, Hardware limit: 65536. Reducing block sizes or `num_stages` may help."
    },
    "402": {
      "config": {
        "BLOCK_SIZE_M": 64,
        "BLOCK_SIZE_N": 64,
        "num_warps": 4,
        "num_stages": 8,
        "waves_per_eu": 2,
        "stage": 1
      },
      "error": "out of resource: shared memory, Required: 180224, Hardware limit: 65536. Reducing block sizes or `num_stages` may help."
    },
    "3221": {
      "config": {
        "BLOCK_SIZE_M": 128,
        "BLOCK_SIZE_N": 256,
        "num_warps": 2,
        "num_stages": 4,
        "waves_per_eu": 1,
        "stage": 6
      },
      "error": "out of resource: shared memory, Required: 131584, Hardware limit: 65536. Reducing block sizes or `num_stages` may help."
    },
    "282": {
      "config": {
        "BLOCK_SIZE_M": 64,
        "BLOCK_SIZE_N": 64,
        "num_warps": 2,
        "num_stages": 10,
        "waves_per_eu": 2,
        "stage": 1
      },
      "error": "out of resource: shared memory, Required: 221184, Hardware limit: 65536. Reducing block sizes or `num_stages` may help."
    },
    "999": {
      "config": {
        "BLOCK_SIZE_M": 64,
        "BLOCK_SIZE_N": 128,
        "num_warps": 4,
        "num_stages": 8,
        "waves_per_eu": 1,
        "stage": 4
      },
      "error": "out of resource: shared memory, Required: 360448, Hardware limit: 65536. Reducing block sizes or `num_stages` may help."
    },
    "3868": {
      "config": {
        "BLOCK_SIZE_M": 256,
        "BLOCK_SIZE_N": 64,
        "num_warps": 2,
        "num_stages": 8,
        "waves_per_eu": 8,
        "stage": 5
      },
      "error": "out of resource: shared memory, Required: 172032, Hardware limit: 65536. Reducing block sizes or `num_stages` may help."
    },
    "2882": {
      "config": {
        "BLOCK_SIZE_M": 128,
        "BLOCK_SIZE_N": 128,
        "num_warps": 8,
        "num_stages": 2,
        "waves_per_eu": 0,
        "stage": 3
      },
      "error": "out of resource: shared memory, Required: 81920, Hardware limit: 65536. Reducing block sizes or `num_stages` may help."
    },
    "1538": {
      "config": {
        "BLOCK_SIZE_M": 64,
        "BLOCK_SIZE_N": 256,
        "num_warps": 4,
        "num_stages": 2,
        "waves_per_eu": 1,
        "stage": 3
      },
      "error": "out of resource: shared memory, Required: 131072, Hardware limit: 65536. Reducing block sizes or `num_stages` may help."
    },
    "1130": {
      "config": {
        "BLOCK_SIZE_M": 64,
        "BLOCK_SIZE_N": 128,
        "num_warps": 8,
        "num_stages": 4,
        "waves_per_eu": 4,
        "stage": 3
      },
      "error": "out of resource: shared memory, Required: 182272, Hardware limit: 65536. Reducing block sizes or `num_stages` may help."
    },
    "2356": {
      "config": {
        "BLOCK_SIZE_M": 128,
        "BLOCK_SIZE_N": 64,
        "num_warps": 8,
        "num_stages": 8,
        "waves_per_eu": 2,
        "stage": 5
      },
      "error": "out of resource: shared memory, Required: 188416, Hardware limit: 65536. Reducing block sizes or `num_stages` may help."
    },
    "3227": {
      "config": {
        "BLOCK_SIZE_M": 128,
        "BLOCK_SIZE_N": 256,
        "num_warps": 2,
        "num_stages": 4,
        "waves_per_eu": 2,
        "stage": 6
      },
      "error": "out of resource: shared memory, Required: 131584, Hardware limit: 65536. Reducing block sizes or `num_stages` may help."
    },
    "2975": {
      "config": {
        "BLOCK_SIZE_M": 128,
        "BLOCK_SIZE_N": 128,
        "num_warps": 8,
        "num_stages": 10,
        "waves_per_eu": 0,
        "stage": 6
      },
      "error": "out of resource: shared memory, Required: 475136, Hardware limit: 65536. Reducing block sizes or `num_stages` may help."
    },
    "1462": {
      "config": {
        "BLOCK_SIZE_M": 64,
        "BLOCK_SIZE_N": 256,
        "num_warps": 2,
        "num_stages": 8,
        "waves_per_eu": 4,
        "stage": 5
      },
      "error": "out of resource: shared memory, Required: 688128, Hardware limit: 65536. Reducing block sizes or `num_stages` may help."
    },
    "4444": {
      "config": {
        "BLOCK_SIZE_M": 256,
        "BLOCK_SIZE_N": 128,
        "num_warps": 2,
        "num_stages": 8,
        "waves_per_eu": 0,
        "stage": 5
      },
      "error": "out of resource: shared memory, Required: 344064, Hardware limit: 65536. Reducing block sizes or `num_stages` may help."
    },
    "3418": {
      "config": {
        "BLOCK_SIZE_M": 128,
        "BLOCK_SIZE_N": 256,
        "num_warps": 4,
        "num_stages": 8,
        "waves_per_eu": 8,
        "stage": 5
      },
      "error": "out of resource: shared memory, Required: 688128, Hardware limit: 65536. Reducing block sizes or `num_stages` may help."
    },
    "4725": {
      "config": {
        "BLOCK_SIZE_M": 256,
        "BLOCK_SIZE_N": 128,
        "num_warps": 8,
        "num_stages": 4,
        "waves_per_eu": 2,
        "stage": 4
      },
      "error": "out of resource: shared memory, Required: 182272, Hardware limit: 65536. Reducing block sizes or `num_stages` may help."
    },
    "2962": {
      "config": {
        "BLOCK_SIZE_M": 128,
        "BLOCK_SIZE_N": 128,
        "num_warps": 8,
        "num_stages": 8,
        "waves_per_eu": 4,
        "stage": 5
      },
      "error": "out of resource: shared memory, Required: 376832, Hardware limit: 65536. Reducing block sizes or `num_stages` may help."
    },
    "1546": {
      "config": {
        "BLOCK_SIZE_M": 64,
        "BLOCK_SIZE_N": 256,
        "num_warps": 4,
        "num_stages": 2,
        "waves_per_eu": 2,
        "stage": 5
      },
      "error": "out of resource: shared memory, Required: 131072, Hardware limit: 65536. Reducing block sizes or `num_stages` may help."
    },
    "1152": {
      "config": {
        "BLOCK_SIZE_M": 64,
        "BLOCK_SIZE_N": 128,
        "num_warps": 8,
        "num_stages": 8,
        "waves_per_eu": 2,
        "stage": 1
      },
      "error": "out of resource: shared memory, Required: 360448, Hardware limit: 65536. Reducing block sizes or `num_stages` may help."
    },
    "4026": {
      "config": {
        "BLOCK_SIZE_M": 256,
        "BLOCK_SIZE_N": 64,
        "num_warps": 4,
        "num_stages": 10,
        "waves_per_eu": 1,
        "stage": 1
      },
      "error": "out of resource: shared memory, Required: 221184, Hardware limit: 65536. Reducing block sizes or `num_stages` may help."
    },
    "1751": {
      "config": {
        "BLOCK_SIZE_M": 64,
        "BLOCK_SIZE_N": 256,
        "num_warps": 8,
        "num_stages": 8,
        "waves_per_eu": 1,
        "stage": 6
      },
      "error": "out of resource: shared memory, Required: 720896, Hardware limit: 65536. Reducing block sizes or `num_stages` may help."
    },
    "4783": {
      "config": {
        "BLOCK_SIZE_M": 256,
        "BLOCK_SIZE_N": 128,
        "num_warps": 8,
        "num_stages": 10,
        "waves_per_eu": 2,
        "stage": 2
      },
      "error": "out of resource: shared memory, Required: 442368, Hardware limit: 65536. Reducing block sizes or `num_stages` may help."
    },
    "2931": {
      "config": {
        "BLOCK_SIZE_M": 128,
        "BLOCK_SIZE_N": 128,
        "num_warps": 8,
        "num_stages": 4,
        "waves_per_eu": 4,
        "stage": 4
      },
      "error": "out of resource: shared memory, Required: 182272, Hardware limit: 65536. Reducing block sizes or `num_stages` may help."
    },
    "1797": {
      "config": {
        "BLOCK_SIZE_M": 64,
        "BLOCK_SIZE_N": 256,
        "num_warps": 8,
        "num_stages": 10,
        "waves_per_eu": 8,
        "stage": 4
      },
      "error": "out of resource: shared memory, Required: 917504, Hardware limit: 65536. Reducing block sizes or `num_stages` may help."
    },
    "3448": {
      "config": {
        "BLOCK_SIZE_M": 128,
        "BLOCK_SIZE_N": 256,
        "num_warps": 4,
        "num_stages": 10,
        "waves_per_eu": 8,
        "stage": 5
      },
      "error": "out of resource: shared memory, Required: 884736, Hardware limit: 65536. Reducing block sizes or `num_stages` may help."
    },
    "2951": {
      "config": {
        "BLOCK_SIZE_M": 128,
        "BLOCK_SIZE_N": 128,
        "num_warps": 8,
        "num_stages": 8,
        "waves_per_eu": 1,
        "stage": 6
      },
      "error": "out of resource: shared memory, Required: 376832, Hardware limit: 65536. Reducing block sizes or `num_stages` may help."
    },
    "1572": {
      "config": {
        "BLOCK_SIZE_M": 64,
        "BLOCK_SIZE_N": 256,
        "num_warps": 4,
        "num_stages": 4,
        "waves_per_eu": 2,
        "stage": 1
      },
      "error": "out of resource: shared memory, Required: 164864, Hardware limit: 65536. Reducing block sizes or `num_stages` may help."
    },
    "2358": {
      "config": {
        "BLOCK_SIZE_M": 128,
        "BLOCK_SIZE_N": 64,
        "num_warps": 8,
        "num_stages": 8,
        "waves_per_eu": 4,
        "stage": 1
      },
      "error": "out of resource: shared memory, Required: 188416, Hardware limit: 65536. Reducing block sizes or `num_stages` may help."
    },
    "2829": {
      "config": {
        "BLOCK_SIZE_M": 128,
        "BLOCK_SIZE_N": 128,
        "num_warps": 4,
        "num_stages": 10,
        "waves_per_eu": 1,
        "stage": 4
      },
      "error": "out of resource: shared memory, Required: 442368, Hardware limit: 65536. Reducing block sizes or `num_stages` may help."
    },
    "5344": {
      "config": {
        "BLOCK_SIZE_M": 256,
        "BLOCK_SIZE_N": 256,
        "num_warps": 8,
        "num_stages": 8,
        "waves_per_eu": 0,
        "stage": 5
      },
      "error": "out of resource: shared memory, Required: 688128, Hardware limit: 65536. Reducing block sizes or `num_stages` may help."
    },
    "3531": {
      "config": {
        "BLOCK_SIZE_M": 128,
        "BLOCK_SIZE_N": 256,
        "num_warps": 8,
        "num_stages": 4,
        "waves_per_eu": 4,
        "stage": 4
      },
      "error": "out of resource: shared memory, Required: 231424, Hardware limit: 65536. Reducing block sizes or `num_stages` may help."
    },
    "1561": {
      "config": {
        "BLOCK_SIZE_M": 64,
        "BLOCK_SIZE_N": 256,
        "num_warps": 4,
        "num_stages": 4,
        "waves_per_eu": 0,
        "stage": 2
      },
      "error": "out of resource: shared memory, Required: 164864, Hardware limit: 65536. Reducing block sizes or `num_stages` may help."
    },
    "5020": {
      "config": {
        "BLOCK_SIZE_M": 256,
        "BLOCK_SIZE_N": 256,
        "num_warps": 2,
        "num_stages": 4,
        "waves_per_eu": 1,
        "stage": 5
      },
      "error": "out of resource: shared memory, Required: 131584, Hardware limit: 65536. Reducing block sizes or `num_stages` may help."
    },
    "2662": {
      "config": {
        "BLOCK_SIZE_M": 128,
        "BLOCK_SIZE_N": 128,
        "num_warps": 2,
        "num_stages": 8,
        "waves_per_eu": 4,
        "stage": 5
      },
      "error": "out of resource: shared memory, Required: 344064, Hardware limit: 65536. Reducing block sizes or `num_stages` may help."
    },
    "257": {
      "config": {
        "BLOCK_SIZE_M": 64,
        "BLOCK_SIZE_N": 64,
        "num_warps": 2,
        "num_stages": 8,
        "waves_per_eu": 2,
        "stage": 6
      },
      "error": "out of resource: shared memory, Required: 172032, Hardware limit: 65536. Reducing block sizes or `num_stages` may help."
    },
    "4842": {
      "config": {
        "BLOCK_SIZE_M": 256,
        "BLOCK_SIZE_N": 256,
        "num_warps": 1,
        "num_stages": 2,
        "waves_per_eu": 2,
        "stage": 1
      },
      "error": "out of resource: shared memory, Required: 98304, Hardware limit: 65536. Reducing block sizes or `num_stages` may help."
    },
    "2643": {
      "config": {
        "BLOCK_SIZE_M": 128,
        "BLOCK_SIZE_N": 128,
        "num_warps": 2,
        "num_stages": 8,
        "waves_per_eu": 0,
        "stage": 4
      },
      "error": "out of resource: shared memory, Required: 344064, Hardware limit: 65536. Reducing block sizes or `num_stages` may help."
    },
    "1277": {
      "config": {
        "BLOCK_SIZE_M": 64,
        "BLOCK_SIZE_N": 256,
        "num_warps": 1,
        "num_stages": 4,
        "waves_per_eu": 2,
        "stage": 6
      },
      "error": "out of resource: shared memory, Required: 114944, Hardware limit: 65536. Reducing block sizes or `num_stages` may help."
    },
    "3083": {
      "config": {
        "BLOCK_SIZE_M": 128,
        "BLOCK_SIZE_N": 256,
        "num_warps": 1,
        "num_stages": 4,
        "waves_per_eu": 4,
        "stage": 6
      },
      "error": "out of resource: shared memory, Required: 114944, Hardware limit: 65536. Reducing block sizes or `num_stages` may help."
    },
    "4486": {
      "config": {
        "BLOCK_SIZE_M": 256,
        "BLOCK_SIZE_N": 128,
        "num_warps": 2,
        "num_stages": 10,
        "waves_per_eu": 2,
        "stage": 5
      },
      "error": "out of resource: shared memory, Required: 442368, Hardware limit: 65536. Reducing block sizes or `num_stages` may help."
    },
    "4313": {
      "config": {
        "BLOCK_SIZE_M": 256,
        "BLOCK_SIZE_N": 128,
        "num_warps": 1,
        "num_stages": 8,
        "waves_per_eu": 4,
        "stage": 6
      },
      "error": "out of resource: shared memory, Required: 344064, Hardware limit: 65536. Reducing block sizes or `num_stages` may help."
    },
    "4609": {
      "config": {
        "BLOCK_SIZE_M": 256,
        "BLOCK_SIZE_N": 128,
        "num_warps": 4,
        "num_stages": 8,
        "waves_per_eu": 4,
        "stage": 2
      },
      "error": "out of resource: shared memory, Required: 344064, Hardware limit: 65536. Reducing block sizes or `num_stages` may help."
    },
    "5377": {
      "config": {
        "BLOCK_SIZE_M": 256,
        "BLOCK_SIZE_N": 256,
        "num_warps": 8,
        "num_stages": 10,
        "waves_per_eu": 1,
        "stage": 2
      },
      "error": "out of resource: shared memory, Required: 884736, Hardware limit: 65536. Reducing block sizes or `num_stages` may help."
    },
    "1239": {
      "config": {
        "BLOCK_SIZE_M": 64,
        "BLOCK_SIZE_N": 256,
        "num_warps": 1,
        "num_stages": 2,
        "waves_per_eu": 1,
        "stage": 4
      },
      "error": "out of resource: shared memory, Required: 98304, Hardware limit: 65536. Reducing block sizes or `num_stages` may help."
    },
    "3730": {
      "config": {
        "BLOCK_SIZE_M": 256,
        "BLOCK_SIZE_N": 64,
        "num_warps": 1,
        "num_stages": 10,
        "waves_per_eu": 1,
        "stage": 5
      },
      "error": "out of resource: shared memory, Required: 221184, Hardware limit: 65536. Reducing block sizes or `num_stages` may help."
    },
    "4876": {
      "config": {
        "BLOCK_SIZE_M": 256,
        "BLOCK_SIZE_N": 256,
        "num_warps": 1,
        "num_stages": 4,
        "waves_per_eu": 2,
        "stage": 5
      },
      "error": "out of resource: shared memory, Required: 114944, Hardware limit: 65536. Reducing block sizes or `num_stages` may help."
    },
    "3224": {
      "config": {
        "BLOCK_SIZE_M": 128,
        "BLOCK_SIZE_N": 256,
        "num_warps": 2,
        "num_stages": 4,
        "waves_per_eu": 2,
        "stage": 3
      },
      "error": "out of resource: shared memory, Required: 131584, Hardware limit: 65536. Reducing block sizes or `num_stages` may help."
    },
    "3204": {
      "config": {
        "BLOCK_SIZE_M": 128,
        "BLOCK_SIZE_N": 256,
        "num_warps": 2,
        "num_stages": 2,
        "waves_per_eu": 8,
        "stage": 1
      },
      "error": "out of resource: shared memory, Required: 98304, Hardware limit: 65536. Reducing block sizes or `num_stages` may help."
    },
    "3731": {
      "config": {
        "BLOCK_SIZE_M": 256,
        "BLOCK_SIZE_N": 64,
        "num_warps": 1,
        "num_stages": 10,
        "waves_per_eu": 1,
        "stage": 6
      },
      "error": "out of resource: shared memory, Required: 221184, Hardware limit: 65536. Reducing block sizes or `num_stages` may help."
    },
    "3145": {
      "config": {
        "BLOCK_SIZE_M": 128,
        "BLOCK_SIZE_N": 256,
        "num_warps": 1,
        "num_stages": 10,
        "waves_per_eu": 8,
        "stage": 2
      },
      "error": "out of resource: shared memory, Required: 884736, Hardware limit: 65536. Reducing block sizes or `num_stages` may help."
    },
    "2903": {
      "config": {
        "BLOCK_SIZE_M": 128,
        "BLOCK_SIZE_N": 128,
        "num_warps": 8,
        "num_stages": 2,
        "waves_per_eu": 4,
        "stage": 6
      },
      "error": "out of resource: shared memory, Required: 81920, Hardware limit: 65536. Reducing block sizes or `num_stages` may help."
    },
    "4600": {
      "config": {
        "BLOCK_SIZE_M": 256,
        "BLOCK_SIZE_N": 128,
        "num_warps": 4,
        "num_stages": 8,
        "waves_per_eu": 1,
        "stage": 5
      },
      "error": "out of resource: shared memory, Required: 344064, Hardware limit: 65536. Reducing block sizes or `num_stages` may help."
    },
    "3038": {
      "config": {
        "BLOCK_SIZE_M": 128,
        "BLOCK_SIZE_N": 256,
        "num_warps": 1,
        "num_stages": 2,
        "waves_per_eu": 1,
        "stage": 3
      },
      "error": "out of resource: shared memory, Required: 98304, Hardware limit: 65536. Reducing block sizes or `num_stages` may help."
    },
    "2898": {
      "config": {
        "BLOCK_SIZE_M": 128,
        "BLOCK_SIZE_N": 128,
        "num_warps": 8,
        "num_stages": 2,
        "waves_per_eu": 4,
        "stage": 1
      },
      "error": "out of resource: shared memory, Required: 81920, Hardware limit: 65536. Reducing block sizes or `num_stages` may help."
    },
    "1198": {
      "config": {
        "BLOCK_SIZE_M": 64,
        "BLOCK_SIZE_N": 128,
        "num_warps": 8,
        "num_stages": 10,
        "waves_per_eu": 8,
        "stage": 5
      },
      "error": "out of resource: shared memory, Required: 458752, Hardware limit: 65536. Reducing block sizes or `num_stages` may help."
    },
    "1764": {
      "config": {
        "BLOCK_SIZE_M": 64,
        "BLOCK_SIZE_N": 256,
        "num_warps": 8,
        "num_stages": 8,
        "waves_per_eu": 8,
        "stage": 1
      },
      "error": "out of resource: shared memory, Required: 720896, Hardware limit: 65536. Reducing block sizes or `num_stages` may help."
    },
    "1193": {
      "config": {
        "BLOCK_SIZE_M": 64,
        "BLOCK_SIZE_N": 128,
        "num_warps": 8,
        "num_stages": 10,
        "waves_per_eu": 4,
        "stage": 6
      },
      "error": "out of resource: shared memory, Required: 458752, Hardware limit: 65536. Reducing block sizes or `num_stages` may help."
    },
    "4334": {
      "config": {
        "BLOCK_SIZE_M": 256,
        "BLOCK_SIZE_N": 128,
        "num_warps": 1,
        "num_stages": 10,
        "waves_per_eu": 2,
        "stage": 3
      },
      "error": "out of resource: shared memory, Required: 442368, Hardware limit: 65536. Reducing block sizes or `num_stages` may help."
    },
    "4994": {
      "config": {
        "BLOCK_SIZE_M": 256,
        "BLOCK_SIZE_N": 256,
        "num_warps": 2,
        "num_stages": 2,
        "waves_per_eu": 2,
        "stage": 3
      },
      "error": "out of resource: shared memory, Required: 98304, Hardware limit: 65536. Reducing block sizes or `num_stages` may help."
    },
    "587": {
      "config": {
        "BLOCK_SIZE_M": 64,
        "BLOCK_SIZE_N": 64,
        "num_warps": 8,
        "num_stages": 10,
        "waves_per_eu": 2,
        "stage": 6
      },
      "error": "out of resource: shared memory, Required: 229376, Hardware limit: 65536. Reducing block sizes or `num_stages` may help."
    },
    "3430": {
      "config": {
        "BLOCK_SIZE_M": 128,
        "BLOCK_SIZE_N": 256,
        "num_warps": 4,
        "num_stages": 10,
        "waves_per_eu": 1,
        "stage": 5
      },
      "error": "out of resource: shared memory, Required: 884736, Hardware limit: 65536. Reducing block sizes or `num_stages` may help."
    },
    "4333": {
      "config": {
        "BLOCK_SIZE_M": 256,
        "BLOCK_SIZE_N": 128,
        "num_warps": 1,
        "num_stages": 10,
        "waves_per_eu": 2,
        "stage": 2
      },
      "error": "out of resource: shared memory, Required: 442368, Hardware limit: 65536. Reducing block sizes or `num_stages` may help."
    },
    "2796": {
      "config": {
        "BLOCK_SIZE_M": 128,
        "BLOCK_SIZE_N": 128,
        "num_warps": 4,
        "num_stages": 8,
        "waves_per_eu": 1,
        "stage": 1
      },
      "error": "out of resource: shared memory, Required: 344064, Hardware limit: 65536. Reducing block sizes or `num_stages` may help."
    },
    "598": {
      "config": {
        "BLOCK_SIZE_M": 64,
        "BLOCK_SIZE_N": 64,
        "num_warps": 8,
        "num_stages": 10,
        "waves_per_eu": 8,
        "stage": 5
      },
      "error": "out of resource: shared memory, Required: 229376, Hardware limit: 65536. Reducing block sizes or `num_stages` may help."
    },
    "2652": {
      "config": {
        "BLOCK_SIZE_M": 128,
        "BLOCK_SIZE_N": 128,
        "num_warps": 2,
        "num_stages": 8,
        "waves_per_eu": 2,
        "stage": 1
      },
      "error": "out of resource: shared memory, Required: 344064, Hardware limit: 65536. Reducing block sizes or `num_stages` may help."
    },
    "1552": {
      "config": {
        "BLOCK_SIZE_M": 64,
        "BLOCK_SIZE_N": 256,
        "num_warps": 4,
        "num_stages": 2,
        "waves_per_eu": 4,
        "stage": 5
      },
      "error": "out of resource: shared memory, Required: 131072, Hardware limit: 65536. Reducing block sizes or `num_stages` may help."
    },
    "4455": {
      "config": {
        "BLOCK_SIZE_M": 256,
        "BLOCK_SIZE_N": 128,
        "num_warps": 2,
        "num_stages": 8,
        "waves_per_eu": 2,
        "stage": 4
      },
      "error": "out of resource: shared memory, Required: 344064, Hardware limit: 65536. Reducing block sizes or `num_stages` may help."
    },
    "2800": {
      "config": {
        "BLOCK_SIZE_M": 128,
        "BLOCK_SIZE_N": 128,
        "num_warps": 4,
        "num_stages": 8,
        "waves_per_eu": 1,
        "stage": 5
      },
      "error": "out of resource: shared memory, Required: 344064, Hardware limit: 65536. Reducing block sizes or `num_stages` may help."
    },
    "4305": {
      "config": {
        "BLOCK_SIZE_M": 256,
        "BLOCK_SIZE_N": 128,
        "num_warps": 1,
        "num_stages": 8,
        "waves_per_eu": 2,
        "stage": 4
      },
      "error": "out of resource: shared memory, Required: 344064, Hardware limit: 65536. Reducing block sizes or `num_stages` may help."
    },
    "5098": {
      "config": {
        "BLOCK_SIZE_M": 256,
        "BLOCK_SIZE_N": 256,
        "num_warps": 2,
        "num_stages": 10,
        "waves_per_eu": 8,
        "stage": 5
      },
      "error": "out of resource: shared memory, Required: 884736, Hardware limit: 65536. Reducing block sizes or `num_stages` may help."
    },
    "1182": {
      "config": {
        "BLOCK_SIZE_M": 64,
        "BLOCK_SIZE_N": 128,
        "num_warps": 8,
        "num_stages": 10,
        "waves_per_eu": 2,
        "stage": 1
      },
      "error": "out of resource: shared memory, Required: 458752, Hardware limit: 65536. Reducing block sizes or `num_stages` may help."
    },
    "1691": {
      "config": {
        "BLOCK_SIZE_M": 64,
        "BLOCK_SIZE_N": 256,
        "num_warps": 8,
        "num_stages": 2,
        "waves_per_eu": 1,
        "stage": 6
      },
      "error": "out of resource: shared memory, Required: 131072, Hardware limit: 65536. Reducing block sizes or `num_stages` may help."
    },
    "3590": {
      "config": {
        "BLOCK_SIZE_M": 128,
        "BLOCK_SIZE_N": 256,
        "num_warps": 8,
        "num_stages": 10,
        "waves_per_eu": 4,
        "stage": 3
      },
      "error": "out of resource: shared memory, Required: 950272, Hardware limit: 65536. Reducing block sizes or `num_stages` may help."
    },
    "3386": {
      "config": {
        "BLOCK_SIZE_M": 128,
