tuning_results_mhc/gfx950/raw_tuner_outputs/best_configs_mhc_fused_mhc_sk20_M1024_2048_4096_8192_16384_n4_C512_20260505_102959.json
{
  "M1024_n4_C512_sk20": {
    "config": {
      "BLOCK_M": 32,
      "BLOCK_N": 16,
      "BLOCK_K": 256,
      "BLOCK_C": 64,
      "NUM_KSPLIT": 1,
      "num_warps": 4,
      "num_stages": 2,
      "waves_per_eu": 2
    },
    "time_ms": 0.020377594403114662,
    "kernel": "fused_mhc",
    "M": 1024,
    "n": 4,
    "C": 512,
    "sinkhorn_iters": 20
  },
  "M2048_n4_C512_sk20": {
    "config": {
      "BLOCK_M": 32,
      "BLOCK_N": 16,
      "BLOCK_K": 256,
      "BLOCK_C": 128,
      "NUM_KSPLIT": 1,
      "num_warps": 4,
      "num_stages": 2,
      "waves_per_eu": 1
    },
    "time_ms": 0.021402451037822737,
    "kernel": "fused_mhc",
    "M": 2048,
    "n": 4,
    "C": 512,
    "sinkhorn_iters": 20
  },
  "M4096_n4_C512_sk20": {
    "config": {
      "BLOCK_M": 32,
      "BLOCK_N": 16,
      "BLOCK_K": 128,
      "BLOCK_C": 32,
      "NUM_KSPLIT": 8,
      "num_warps": 4,
      "num_stages": 1,
      "waves_per_eu": 0
    },
    "time_ms": 0.024325091609949463,
    "kernel": "fused_mhc",
    "M": 4096,
    "n": 4,
    "C": 512,
    "sinkhorn_iters": 20
  },
  "M8192_n4_C512_sk20": {
    "config": {
      "BLOCK_M": 32,
      "BLOCK_N": 16,
      "BLOCK_K": 64,
      "BLOCK_C": 64,
      "NUM_KSPLIT": 2,
      "num_warps": 4,
      "num_stages": 2,
      "waves_per_eu": 0
    },
    "time_ms": 0.02683806865143016,
    "kernel": "fused_mhc",
    "M": 8192,
    "n": 4,
    "C": 512,
    "sinkhorn_iters": 20
  }
}