tuning_results_mhc/gfx950/raw_tuner_outputs/best_configs_mhc_fused_mhc_sk20_M1024_2048_4096_8192_16384_n4_C1024_20260504_235529.json
{
  "M1024_n4_C1024_sk20": {
    "config": {
      "BLOCK_M": 32,
      "BLOCK_N": 16,
      "BLOCK_K": 256,
      "BLOCK_C": 128,
      "NUM_KSPLIT": 1,
      "num_warps": 4,
      "num_stages": 2,
      "waves_per_eu": 1
    },
    "time_ms": 0.02961298096085991,
    "kernel": "fused_mhc",
    "M": 1024,
    "n": 4,
    "C": 1024,
    "sinkhorn_iters": 20
  },
  "M2048_n4_C1024_sk20": {
    "config": {
      "BLOCK_M": 32,
      "BLOCK_N": 16,
      "BLOCK_K": 128,
      "BLOCK_C": 64,
      "NUM_KSPLIT": 4,
      "num_warps": 4,
      "num_stages": 2,
      "waves_per_eu": 1
    },
    "time_ms": 0.022271635413620133,
    "kernel": "fused_mhc",
    "M": 2048,
    "n": 4,
    "C": 1024,
    "sinkhorn_iters": 20
  },
  "M4096_n4_C1024_sk20": {
    "config": {
      "BLOCK_M": 32,
      "BLOCK_N": 16,
      "BLOCK_K": 128,
      "BLOCK_C": 64,
      "NUM_KSPLIT": 4,
      "num_warps": 4,
      "num_stages": 2,
      "waves_per_eu": 2
    },
    "time_ms": 0.026159702718519327,
    "kernel": "fused_mhc",
    "M": 4096,
    "n": 4,
    "C": 1024,
    "sinkhorn_iters": 20
  },
  "M8192_n4_C1024_sk20": {
    "config": {
      "BLOCK_M": 64,
      "BLOCK_N": 16,
      "BLOCK_K": 256,
      "BLOCK_C": 128,
      "NUM_KSPLIT": 2,
      "num_warps": 8,
      "num_stages": 2,
      "waves_per_eu": 0
    },
    "time_ms": 0.037663105403567196,
    "kernel": "fused_mhc",
    "M": 8192,
    "n": 4,
    "C": 1024,
    "sinkhorn_iters": 20
  },
  "M16384_n4_C1024_sk20": {
    "config": {
      "BLOCK_M": 32,
      "BLOCK_N": 16,
      "BLOCK_K": 128,
      "BLOCK_C": 64,
      "NUM_KSPLIT": 2,
      "num_warps": 2,
      "num_stages": 2,
      "waves_per_eu": 0
    },
    "time_ms": 0.06922295037774763,
    "kernel": "fused_mhc",
    "M": 16384,
    "n": 4,
    "C": 1024,
    "sinkhorn_iters": 20
  }
}