tuning_results_mhc/gfx950/raw_tuner_outputs/tested_configs_mhc_fused_mhc_sk20_M8192_n4_C512.json
{
  "kernel": "fused_mhc",
  "M": 8192,
  "n": 4,
  "C": 512,
  "sinkhorn_iters": 20,
  "config_file": "tuning_results/tuning_space_mhc.json",
  "tested_configs_successful": {
    "339": {
      "BLOCK_M": 32,
      "BLOCK_N": 16,
      "BLOCK_K": 32,
      "BLOCK_C": 256,
      "NUM_KSPLIT": 4,
      "num_warps": 8,
      "num_stages": 2,
      "waves_per_eu": 0
    },
    "1065": {
      "BLOCK_M": 32,
      "BLOCK_N": 16,
      "BLOCK_K": 128,
      "BLOCK_C": 256,
      "NUM_KSPLIT": 8,
      "num_warps": 2,
      "num_stages": 2,
      "waves_per_eu": 0
    },
    "4102": {
      "BLOCK_M": 128,
      "BLOCK_N": 16,
      "BLOCK_K": 256,
      "BLOCK_C": 32,
      "NUM_KSPLIT": 8,
      "num_warps": 8,
      "num_stages": 2,
      "waves_per_eu": 1
    },
    "3769": {
      "BLOCK_M": 128,
      "BLOCK_N": 16,
      "BLOCK_K": 128,
      "BLOCK_C": 64,
      "NUM_KSPLIT": 2,
      "num_warps": 4,
      "num_stages": 1,
      "waves_per_eu": 1
    },
    "3674": {
      "BLOCK_M": 128,
      "BLOCK_N": 16,
      "BLOCK_K": 128,
      "BLOCK_C": 32,
      "NUM_KSPLIT": 1,
      "num_warps": 2,
      "num_stages": 1,
      "waves_per_eu": 2
    },
    "3428": {
      "BLOCK_M": 128,
      "BLOCK_N": 16,
      "BLOCK_K": 64,
      "BLOCK_C": 64,
      "NUM_KSPLIT": 4,
      "num_warps": 4,
      "num_stages": 1,
      "waves_per_eu": 2
    },
    "542": {
      "BLOCK_M": 32,
      "BLOCK_N": 16,
      "BLOCK_K": 64,
      "BLOCK_C": 64,
      "NUM_KSPLIT": 4,
      "num_warps": 2,
      "num_stages": 1,
      "waves_per_eu": 2
    },
    "4715": {
      "BLOCK_M": 256,
      "BLOCK_N": 16,
      "BLOCK_K": 64,
      "BLOCK_C": 16,
      "NUM_KSPLIT": 2,
      "num_warps": 8,
      "num_stages": 2,
      "waves_per_eu": 2
    },
    "5146": {
      "BLOCK_M": 256,
      "BLOCK_N": 16,
      "BLOCK_K": 128,
      "BLOCK_C": 32,
      "NUM_KSPLIT": 2,
      "num_warps": 8,
      "num_stages": 2,
      "waves_per_eu": 1
    },
    "3495": {
      "BLOCK_M": 128,
      "BLOCK_N": 16,
      "BLOCK_K": 64,
      "BLOCK_C": 128,
      "NUM_KSPLIT": 4,
      "num_warps": 2,
      "num_stages": 2,
      "waves_per_eu": 0
    },
    "3545": {
      "BLOCK_M": 128,
      "BLOCK_N": 16,
      "BLOCK_K": 64,
      "BLOCK_C": 256,
      "NUM_KSPLIT": 1,
      "num_warps": 8,
      "num_stages": 2,
      "waves_per_eu": 2
    },
    "396": {
      "BLOCK_M": 32,
      "BLOCK_N": 16,
      "BLOCK_K": 64,
      "BLOCK_C": 16,
      "NUM_KSPLIT": 4,
      "num_warps": 2,
      "num_stages": 1,
      "waves_per_eu": 0
    },
    "464": {
      "BLOCK_M": 32,
      "BLOCK_N": 16,
      "BLOCK_K": 64,
      "BLOCK_C": 32,
      "NUM_KSPLIT": 2,
      "num_warps": 8,
      "num_stages": 1,
      "waves_per_eu": 2
    },
    "4733": {
      "BLOCK_M": 256,
      "BLOCK_N": 16,
      "BLOCK_K": 64,
      "BLOCK_C": 16,
      "NUM_KSPLIT": 4,
      "num_warps": 8,
      "num_stages": 2,
      "waves_per_eu": 2
    },
    "4654": {
      "BLOCK_M": 256,
      "BLOCK_N": 16,
      "BLOCK_K": 32,
      "BLOCK_C": 256,
      "NUM_KSPLIT": 4,
      "num_warps": 4,
      "num_stages": 2,
      "waves_per_eu": 1
    },
    "1602": {
      "BLOCK_M": 64,
      "BLOCK_N": 16,
      "BLOCK_K": 32,
      "BLOCK_C": 64,
      "NUM_KSPLIT": 2,
      "num_warps": 2,
      "num_stages": 1,
      "waves_per_eu": 0
    },
    "787": {
      "BLOCK_M": 32,
      "BLOCK_N": 16,
      "BLOCK_K": 128,
      "BLOCK_C": 16,
      "NUM_KSPLIT": 8,
      "num_warps": 8,
      "num_stages": 1,
      "waves_per_eu": 1
    },
    "3844": {
      "BLOCK_M": 128,
      "BLOCK_N": 16,
      "BLOCK_K": 128,
      "BLOCK_C": 128,
      "NUM_KSPLIT": 2,
      "num_warps": 4,
      "num_stages": 2,
      "waves_per_eu": 1
    },
    "595": {
      "BLOCK_M": 32,
      "BLOCK_N": 16,
      "BLOCK_K": 64,
      "BLOCK_C": 128,
      "NUM_KSPLIT": 2,
      "num_warps": 2,
      "num_stages": 1,
      "waves_per_eu": 1
    },
    "546": {
      "BLOCK_M": 32,
      "BLOCK_N": 16,
      "BLOCK_K": 64,
      "BLOCK_C": 64,
      "NUM_KSPLIT": 4,
      "num_warps": 4,
      "num_stages": 1,
      "waves_per_eu": 0
    },
    "261": {
      "BLOCK_M": 32,
      "BLOCK_N": 16,
      "BLOCK_K": 32,
      "BLOCK_C": 128,
      "NUM_KSPLIT": 4,
      "num_warps": 4,
      "num_stages": 2,
      "waves_per_eu": 0
    },
    "3673": {
      "BLOCK_M": 128,
      "BLOCK_N": 16,
      "BLOCK_K": 128,
      "BLOCK_C": 32,
      "NUM_KSPLIT": 1,
      "num_warps": 2,
      "num_stages": 1,
      "waves_per_eu": 1
    },
    "3268": {
      "BLOCK_M": 128,
      "BLOCK_N": 16,
      "BLOCK_K": 64,
      "BLOCK_C": 16,
      "NUM_KSPLIT": 2,
      "num_warps": 4,
      "num_stages": 2,
      "waves_per_eu": 1
    },
    "4000": {
      "BLOCK_M": 128,
      "BLOCK_N": 16,
      "BLOCK_K": 256,
      "BLOCK_C": 16,
      "NUM_KSPLIT": 4,
      "num_warps": 2,
      "num_stages": 2,
      "waves_per_eu": 1
    },
    "2468": {
      "BLOCK_M": 64,
      "BLOCK_N": 16,
      "BLOCK_K": 128,
      "BLOCK_C": 256,
      "NUM_KSPLIT": 2,
      "num_warps": 2,
      "num_stages": 1,
      "waves_per_eu": 2
    },
    "5738": {
      "BLOCK_M": 256,
      "BLOCK_N": 16,
      "BLOCK_K": 256,
      "BLOCK_C": 256,
      "NUM_KSPLIT": 4,
      "num_warps": 8,
      "num_stages": 1,
      "waves_per_eu": 2
    },
    "1594": {
      "BLOCK_M": 64,
      "BLOCK_N": 16,
      "BLOCK_K": 32,
      "BLOCK_C": 64,
      "NUM_KSPLIT": 1,
      "num_warps": 4,
      "num_stages": 2,
      "waves_per_eu": 1
    },
    "257": {
      "BLOCK_M": 32,
      "BLOCK_N": 16,
      "BLOCK_K": 32,
      "BLOCK_C": 128,
      "NUM_KSPLIT": 4,
      "num_warps": 2,
      "num_stages": 2,
      "waves_per_eu": 2
    },
    "244": {
      "BLOCK_M": 32,
      "BLOCK_N": 16,
      "BLOCK_K": 32,
      "BLOCK_C": 128,
      "NUM_KSPLIT": 2,
      "num_warps": 4,
      "num_stages": 2,
      "waves_per_eu": 1
    },
    "1583": {
      "BLOCK_M": 64,
      "BLOCK_N": 16,
      "BLOCK_K": 32,
      "BLOCK_C": 32,
      "NUM_KSPLIT": 8,
      "num_warps": 8,
      "num_stages": 2,
      "waves_per_eu": 2
    },
    "5176": {
      "BLOCK_M": 256,
      "BLOCK_N": 16,
      "BLOCK_K": 128,
      "BLOCK_C": 32,
      "NUM_KSPLIT": 8,
      "num_warps": 4,
      "num_stages": 2,
      "waves_per_eu": 1
    },
    "2820": {
      "BLOCK_M": 64,
      "BLOCK_N": 16,
      "BLOCK_K": 256,
      "BLOCK_C": 256,
      "NUM_KSPLIT": 1,
      "num_warps": 8,
      "num_stages": 1,
      "waves_per_eu": 0
    },
    "3766": {
      "BLOCK_M": 128,
      "BLOCK_N": 16,
      "BLOCK_K": 128,
      "BLOCK_C": 64,
      "NUM_KSPLIT": 2,
      "num_warps": 2,
      "num_stages": 2,
      "waves_per_eu": 1
    },
    "403": {
      "BLOCK_M": 32,
      "BLOCK_N": 16,
      "BLOCK_K": 64,
      "BLOCK_C": 16,
      "NUM_KSPLIT": 4,
      "num_warps": 4,
      "num_stages": 1,
      "waves_per_eu": 1
    },
    "165": {
      "BLOCK_M": 32,
      "BLOCK_N": 16,
      "BLOCK_K": 32,
      "BLOCK_C": 64,
      "NUM_KSPLIT": 2,
      "num_warps": 2,
      "num_stages": 2,
      "waves_per_eu": 0
    },
    "3721": {
      "BLOCK_M": 128,
      "BLOCK_N": 16,
      "BLOCK_K": 128,
      "BLOCK_C": 32,
      "NUM_KSPLIT": 4,
      "num_warps": 8,
      "num_stages": 1,
      "waves_per_eu": 1
    },
    "3422": {
      "BLOCK_M": 128,
      "BLOCK_N": 16,
      "BLOCK_K": 64,
      "BLOCK_C": 64,
      "NUM_KSPLIT": 4,
      "num_warps": 2,
      "num_stages": 1,
      "waves_per_eu": 2
    },
    "5183": {
      "BLOCK_M": 256,
      "BLOCK_N": 16,
      "BLOCK_K": 128,
      "BLOCK_C": 32,
      "NUM_KSPLIT": 8,
      "num_warps": 8,
      "num_stages": 2,
      "waves_per_eu": 2
    },
    "1624": {
      "BLOCK_M": 64,
      "BLOCK_N": 16,
      "BLOCK_K": 32,
      "BLOCK_C": 64,
      "NUM_KSPLIT": 4,
      "num_warps": 2,
      "num_stages": 2,
      "waves_per_eu": 1
    },
    "5381": {
      "BLOCK_M": 256,
      "BLOCK_N": 16,
      "BLOCK_K": 128,
      "BLOCK_C": 256,
      "NUM_KSPLIT": 4,
      "num_warps": 8,
      "num_stages": 2,
      "waves_per_eu": 2
    },
    "1332": {
      "BLOCK_M": 32,
      "BLOCK_N": 16,
      "BLOCK_K": 256,
      "BLOCK_C": 128,
      "NUM_KSPLIT": 4,
      "num_warps": 2,
      "num_stages": 1,
      "waves_per_eu": 0
    },
    "1419": {
      "BLOCK_M": 32,
      "BLOCK_N": 16,
      "BLOCK_K": 256,
      "BLOCK_C": 256,
      "NUM_KSPLIT": 4,
      "num_warps": 8,
      "num_stages": 2,
      "waves_per_eu": 0
    },
    "297": {
      "BLOCK_M": 32,
      "BLOCK_N": 16,
      "BLOCK_K": 32,
      "BLOCK_C": 256,
      "NUM_KSPLIT": 1,
      "num_warps": 4,
      "num_stages": 2,
      "waves_per_eu": 0
    },
    "4817": {
      "BLOCK_M": 256,
      "BLOCK_N": 16,
      "BLOCK_K": 64,
      "BLOCK_C": 32,
      "NUM_KSPLIT": 8,
      "num_warps": 4,
      "num_stages": 2,
      "waves_per_eu": 2
    },
    "2204": {
      "BLOCK_M": 64,
      "BLOCK_N": 16,
      "BLOCK_K": 128,
      "BLOCK_C": 16,
      "NUM_KSPLIT": 4,
      "num_warps": 4,
      "num_stages": 1,
      "waves_per_eu": 2
    },
    "915": {
      "BLOCK_M": 32,
      "BLOCK_N": 16,
      "BLOCK_K": 128,
      "BLOCK_C": 64,
      "NUM_KSPLIT": 4,
      "num_warps": 8,
      "num_stages": 2,
      "waves_per_eu": 0
    },
    "3481": {
      "BLOCK_M": 128,
      "BLOCK_N": 16,
      "BLOCK_K": 64,
      "BLOCK_C": 128,
      "NUM_KSPLIT": 2,
      "num_warps": 4,
      "num_stages": 1,
      "waves_per_eu": 1
    },
    "5138": {
      "BLOCK_M": 256,
      "BLOCK_N": 16,
      "BLOCK_K": 128,
      "BLOCK_C": 32,
      "NUM_KSPLIT": 2,
      "num_warps": 4,
      "num_stages": 1,
      "waves_per_eu": 2
    },
    "3088": {
      "BLOCK_M": 128,
      "BLOCK_N": 16,
      "BLOCK_K": 32,
      "BLOCK_C": 64,
      "NUM_KSPLIT": 8,
      "num_warps": 4,
      "num_stages": 2,
      "waves_per_eu": 1
    },
    "5277": {
      "BLOCK_M": 256,
      "BLOCK_N": 16,
      "BLOCK_K": 128,
      "BLOCK_C": 128,
      "NUM_KSPLIT": 2,
      "num_warps": 2,
      "num_stages": 2,
      "waves_per_eu": 0
    },
    "1070": {
      "BLOCK_M": 32,
      "BLOCK_N": 16,
      "BLOCK_K": 128,
      "BLOCK_C": 256,
      "NUM_KSPLIT": 8,
      "num_warps": 4,
      "num_stages": 1,
      "waves_per_eu": 2
    },
    "4686": {
      "BLOCK_M": 256,
      "BLOCK_N": 16,
      "BLOCK_K": 64,
      "BLOCK_C": 16,
      "NUM_KSPLIT": 1,
      "num_warps": 4,
      "num_stages": 1,
      "waves_per_eu": 0
    },
    "4983": {
      "BLOCK_M": 256,
      "BLOCK_N": 16,
      "BLOCK_K": 64,
      "BLOCK_C": 256,
      "NUM_KSPLIT": 1,
      "num_warps": 8,
      "num_stages": 2,
      "waves_per_eu": 0
    },
    "979": {
      "BLOCK_M": 32,
      "BLOCK_N": 16,
      "BLOCK_K": 128,
      "BLOCK_C": 128,
      "NUM_KSPLIT": 4,
      "num_warps": 4,
      "num_stages": 1,
      "waves_per_eu": 1
    },
    "645": {
      "BLOCK_M": 32,
      "BLOCK_N": 16,
      "BLOCK_K": 64,
      "BLOCK_C": 128,
      "NUM_KSPLIT": 8,
      "num_warps": 8,
      "num_stages": 2,
      "waves_per_eu": 0
    },
    "5565": {
      "BLOCK_M": 256,
      "BLOCK_N": 16,
      "BLOCK_K": 256,
      "BLOCK_C": 64,
      "NUM_KSPLIT": 2,
      "num_warps": 2,
      "num_stages": 2,
      "waves_per_eu": 0
    },
    "3903": {
      "BLOCK_M": 128,
      "BLOCK_N": 16,
      "BLOCK_K": 128,
      "BLOCK_C": 256,
      "NUM_KSPLIT": 1,
      "num_warps": 8,
      "num_stages": 2,
      "waves_per_eu": 0
    },
    "4572": {
      "BLOCK_M": 256,
      "BLOCK_N": 16,
      "BLOCK_K": 32,
      "BLOCK_C": 128,
      "NUM_KSPLIT": 4,
      "num_warps": 2,
      "num_stages": 1,
      "waves_per_eu": 0
    },
    "2218": {
      "BLOCK_M": 64,
      "BLOCK_N": 16,
      "BLOCK_K": 128,
      "BLOCK_C": 16,
      "NUM_KSPLIT": 8,
      "num_warps": 2,
      "num_stages": 2,
      "waves_per_eu": 1
    },
    "5106": {
      "BLOCK_M": 256,
      "BLOCK_N": 16,
      "BLOCK_K": 128,
      "BLOCK_C": 16,
      "NUM_KSPLIT": 8,
      "num_warps": 8,
      "num_stages": 1,
      "waves_per_eu": 0
    },
    "5354": {
      "BLOCK_M": 256,
      "BLOCK_N": 16,
      "BLOCK_K": 128,
      "BLOCK_C": 256,
      "NUM_KSPLIT": 2,
      "num_warps": 4,
      "num_stages": 1,
      "waves_per_eu": 2
    },
    "3807": {
      "BLOCK_M": 128,
      "BLOCK_N": 16,
      "BLOCK_K": 128,
      "BLOCK_C": 64,
      "NUM_KSPLIT": 8,
      "num_warps": 4,
      "num_stages": 2,
      "waves_per_eu": 0
    },
    "2704": {
      "BLOCK_M": 64,
      "BLOCK_N": 16,
      "BLOCK_K": 256,
      "BLOCK_C": 64,
      "NUM_KSPLIT": 4,
      "num_warps": 2,
      "num_stages": 2,
      "waves_per_eu": 1
    },
    "3095": {
      "BLOCK_M": 128,
      "BLOCK_N": 16,
      "BLOCK_K": 32,
      "BLOCK_C": 64,
      "NUM_KSPLIT": 8,
      "num_warps": 8,
      "num_stages": 2,
      "waves_per_eu": 2
    },
    "4808": {
      "BLOCK_M": 256,
      "BLOCK_N": 16,
      "BLOCK_K": 64,
      "BLOCK_C": 32,
      "NUM_KSPLIT": 8,
      "num_warps": 2,
      "num_stages": 1,
      "waves_per_eu": 2
    },
    "2825": {
      "BLOCK_M": 64,
      "BLOCK_N": 16,
      "BLOCK_K": 256,
      "BLOCK_C": 256,
      "NUM_KSPLIT": 1,
      "num_warps": 8,
      "num_stages": 2,
      "waves_per_eu": 2
    },
    "2311": {
      "BLOCK_M": 64,
      "BLOCK_N": 16,
      "BLOCK_K": 128,
      "BLOCK_C": 64,
      "NUM_KSPLIT": 1,
      "num_warps": 4,
      "num_stages": 1,
      "waves_per_eu": 1
    },
    "5522": {
      "BLOCK_M": 256,
      "BLOCK_N": 16,
      "BLOCK_K": 256,
      "BLOCK_C": 32,
      "NUM_KSPLIT": 4,
      "num_warps": 8,
      "num_stages": 1,
      "waves_per_eu": 2
    },
    "794": {
      "BLOCK_M": 32,
      "BLOCK_N": 16,
      "BLOCK_K": 128,
      "BLOCK_C": 32,
      "NUM_KSPLIT": 1,
      "num_warps": 2,
      "num_stages": 1,
      "waves_per_eu": 2
    },
    "1293": {
      "BLOCK_M": 32,
      "BLOCK_N": 16,
      "BLOCK_K": 256,
      "BLOCK_C": 64,
      "NUM_KSPLIT": 8,
      "num_warps": 8,
      "num_stages": 2,
      "waves_per_eu": 0
    },
    "1681": {
      "BLOCK_M": 64,
      "BLOCK_N": 16,
      "BLOCK_K": 32,
      "BLOCK_C": 128,
      "NUM_KSPLIT": 2,
      "num_warps": 4,
      "num_stages": 1,
      "waves_per_eu": 1
    },
    "765": {
      "BLOCK_M": 32,
      "BLOCK_N": 16,
      "BLOCK_K": 128,
      "BLOCK_C": 16,
      "NUM_KSPLIT": 4,
      "num_warps": 4,
      "num_stages": 2,
      "waves_per_eu": 0
    },
    "2207": {
      "BLOCK_M": 64,
      "BLOCK_N": 16,
      "BLOCK_K": 128,
      "BLOCK_C": 16,
      "NUM_KSPLIT": 4,
      "num_warps": 4,
      "num_stages": 2,
      "waves_per_eu": 2
    },
    "4676": {
      "BLOCK_M": 256,
      "BLOCK_N": 16,
      "BLOCK_K": 32,
      "BLOCK_C": 256,
      "NUM_KSPLIT": 8,
      "num_warps": 8,
      "num_stages": 1,
      "waves_per_eu": 2
    },
    "3282": {
      "BLOCK_M": 128,
      "BLOCK_N": 16,
      "BLOCK_K": 64,
      "BLOCK_C": 16,
      "NUM_KSPLIT": 4,
      "num_warps": 4,
      "num_stages": 1,
      "waves_per_eu": 0
    },
    "5273": {
      "BLOCK_M": 256,
      "BLOCK_N": 16,
      "BLOCK_K": 128,
      "BLOCK_C": 128,
      "NUM_KSPLIT": 1,
      "num_warps": 8,
      "num_stages": 2,
      "waves_per_eu": 2
    },
    "717": {
      "BLOCK_M": 32,
      "BLOCK_N": 16,
      "BLOCK_K": 64,
      "BLOCK_C": 256,
      "NUM_KSPLIT": 8,
      "num_warps": 8,
      "num_stages": 2,
      "waves_per_eu": 0
    },
    "87": {
      "BLOCK_M": 32,
      "BLOCK_N": 16,
      "BLOCK_K": 32,
      "BLOCK_C": 32,
      "NUM_KSPLIT": 1,
      "num_warps": 8,
      "num_stages": 2,
      "waves_per_eu": 0
    },
    "2258": {
      "BLOCK_M": 64,
      "BLOCK_N": 16,
      "BLOCK_K": 128,
      "BLOCK_C": 32,
      "NUM_KSPLIT": 2,
      "num_warps": 4,
      "num_stages": 1,
      "waves_per_eu": 2
    },
    "3565": {
      "BLOCK_M": 128,
      "BLOCK_N": 16,
      "BLOCK_K": 64,
      "BLOCK_C": 256,
      "NUM_KSPLIT": 4,
      "num_warps": 2,
      "num_stages": 1,
      "waves_per_eu": 1
    },
    "2731": {
      "BLOCK_M": 64,
      "BLOCK_N": 16,
      "BLOCK_K": 256,
      "BLOCK_C": 64,
      "NUM_KSPLIT": 8,
      "num_warps": 8,
      "num_stages": 1,
      "waves_per_eu": 1
    },
    "752": {
      "BLOCK_M": 32,
      "BLOCK_N": 16,
      "BLOCK_K": 128,
      "BLOCK_C": 16,
      "NUM_KSPLIT": 2,
      "num_warps": 8,
      "num_stages": 1,
      "waves_per_eu": 2
    },
    "1907": {
      "BLOCK_M": 64,
      "BLOCK_N": 16,
      "BLOCK_K": 64,
      "BLOCK_C": 32,
      "NUM_KSPLIT": 2,
      "num_warps": 8,
      "num_stages": 2,
      "waves_per_eu": 2
    },
    "5638": {
      "BLOCK_M": 256,
      "BLOCK_N": 16,
      "BLOCK_K": 256,
      "BLOCK_C": 128,
      "NUM_KSPLIT": 2,
      "num_warps": 2,
      "num_stages": 2,
      "waves_per_eu": 1
    },
    "154": {
      "BLOCK_M": 32,
      "BLOCK_N": 16,
      "BLOCK_K": 32,
      "BLOCK_C": 64,
      "NUM_KSPLIT": 1,
      "num_warps": 4,
      "num_stages": 2,
      "waves_per_eu": 1
    },
    "4159": {
      "BLOCK_M": 128,
      "BLOCK_N": 16,
      "BLOCK_K": 256,
      "BLOCK_C": 64,
      "NUM_KSPLIT": 8,
      "num_warps": 2,
      "num_stages": 1,
      "waves_per_eu": 1
    },
    "2748": {
      "BLOCK_M": 64,
      "BLOCK_N": 16,
      "BLOCK_K": 256,
      "BLOCK_C": 128,
      "NUM_KSPLIT": 1,
      "num_warps": 8,
      "num_stages": 1,
      "waves_per_eu": 0
    },
    "4290": {
      "BLOCK_M": 128,
      "BLOCK_N": 16,
      "BLOCK_K": 256,
      "BLOCK_C": 256,
      "NUM_KSPLIT": 4,
      "num_warps": 4,
      "num_stages": 1,
      "waves_per_eu": 0
    },
    "233": {
      "BLOCK_M": 32,
      "BLOCK_N": 16,
      "BLOCK_K": 32,
      "BLOCK_C": 128,
      "NUM_KSPLIT": 1,
      "num_warps": 8,
      "num_stages": 2,
      "waves_per_eu": 2
    },
    "2389": {
      "BLOCK_M": 64,
      "BLOCK_N": 16,
      "BLOCK_K": 128,
      "BLOCK_C": 128,
      "NUM_KSPLIT": 1,
      "num_warps": 8,
      "num_stages": 1,
      "waves_per_eu": 1
    },
    "5270": {
      "BLOCK_M": 256,
      "BLOCK_N": 16,
      "BLOCK_K": 128,
      "BLOCK_C": 128,
      "NUM_KSPLIT": 1,
      "num_warps": 8,
      "num_stages": 1,
      "waves_per_eu": 2
    },
    "5520": {
      "BLOCK_M": 256,
      "BLOCK_N": 16,
      "BLOCK_K": 256,
      "BLOCK_C": 32,
      "NUM_KSPLIT": 4,
      "num_warps": 8,
      "num_stages": 1,
      "waves_per_eu": 0
    },
    "1222": {
      "BLOCK_M": 32,
      "BLOCK_N": 16,
      "BLOCK_K": 256,
      "BLOCK_C": 32,
      "NUM_KSPLIT": 8,
      "num_warps": 8,
      "num_stages": 2,
      "waves_per_eu": 1
    },
    "2013": {
      "BLOCK_M": 64,
      "BLOCK_N": 16,
      "BLOCK_K": 64,
      "BLOCK_C": 64,
      "NUM_KSPLIT": 8,
      "num_warps": 8,
      "num_stages": 2,
      "waves_per_eu": 0
    },
    "2865": {
      "BLOCK_M": 64,
      "BLOCK_N": 16,
      "BLOCK_K": 256,
      "BLOCK_C": 256,
      "NUM_KSPLIT": 8,
      "num_warps": 2,
      "num_stages": 2,
      "waves_per_eu": 0
    },
    "3939": {
      "BLOCK_M": 128,
      "BLOCK_N": 16,
      "BLOCK_K": 128,
      "BLOCK_C": 256,
      "NUM_KSPLIT": 4,
      "num_warps": 8,
      "num_stages": 2,
      "waves_per_eu": 0
    },
    "1128": {
      "BLOCK_M": 32,
      "BLOCK_N": 16,
      "BLOCK_K": 256,
      "BLOCK_C": 16,
      "NUM_KSPLIT": 4,
      "num_warps": 8,
      "num_stages": 1,
      "waves_per_eu": 0
    },
    "3912": {
      "BLOCK_M": 128,
      "BLOCK_N": 16,
      "BLOCK_K": 128,
      "BLOCK_C": 256,
      "NUM_KSPLIT": 2,
      "num_warps": 4,
      "num_stages": 1,
      "waves_per_eu": 0
    },
    "600": {
      "BLOCK_M": 32,
      "BLOCK_N": 16,
      "BLOCK_K": 64,
      "BLOCK_C": 128,
      "NUM_KSPLIT": 2,
      "num_warps": 4,
      "num_stages": 1,
      "waves_per_eu": 0
    },
    "3475": {
      "BLOCK_M": 128,
      "BLOCK_N": 16,
      "BLOCK_K": 64,
      "BLOCK_C": 128,
      "NUM_KSPLIT": 2,
      "num_warps": 2,
      "num_stages": 1,
      "waves_per_eu": 1
    },
    "281": {
      "BLOCK_M": 32,
      "BLOCK_N": 16,
      "BLOCK_K": 32,
      "BLOCK_C": 128,
      "NUM_KSPLIT": 8,
      "num_warps": 4,
      "num_stages": 2,
      "waves_per_eu": 2
    },
    "131": {
      "BLOCK_M": 32,
      "BLOCK_N": 16,
      "BLOCK_K": 32,
      "BLOCK_C": 32,
      "NUM_KSPLIT": 8,
      "num_warps": 2,
      "num_stages": 2,
      "waves_per_eu": 2
    },
    "4510": {
      "BLOCK_M": 256,
      "BLOCK_N": 16,
      "BLOCK_K": 32,
      "BLOCK_C": 64,
      "NUM_KSPLIT": 4,
      "num_warps": 4,
      "num_stages": 2,
      "waves_per_eu": 1
    },
    "1504": {
      "BLOCK_M": 64,
      "BLOCK_N": 16,
      "BLOCK_K": 32,
      "BLOCK_C": 16,
      "NUM_KSPLIT": 8,
      "num_warps": 4,
      "num_stages": 2,
      "waves_per_eu": 1
    },
    "4695": {
      "BLOCK_M": 256,
      "BLOCK_N": 16,
      "BLOCK_K": 64,
      "BLOCK_C": 16,
      "NUM_KSPLIT": 1,
      "num_warps": 8,
      "num_stages": 2,
      "waves_per_eu": 0
    },
    "1967": {
      "BLOCK_M": 64,
      "BLOCK_N": 16,
      "BLOCK_K": 64,
      "BLOCK_C": 64,
      "NUM_KSPLIT": 2,
      "num_warps": 2,
      "num_stages": 2,
      "waves_per_eu": 2
    },
    "61": {
      "BLOCK_M": 32,
      "BLOCK_N": 16,
      "BLOCK_K": 32,
      "BLOCK_C": 16,
      "NUM_KSPLIT": 8,
      "num_warps": 4,
      "num_stages": 1,
      "waves_per_eu": 1
    },
    "3194": {
      "BLOCK_M": 128,
      "BLOCK_N": 16,
      "BLOCK_K": 32,
      "BLOCK_C": 256,
      "NUM_KSPLIT": 2,
      "num_warps": 4,
      "num_stages": 1,
      "waves_per_eu": 2
    },
    "2662": {
      "BLOCK_M": 64,
      "BLOCK_N": 16,
      "BLOCK_K": 256,
      "BLOCK_C": 32,
      "NUM_KSPLIT": 8,
      "num_warps": 8,
      "num_stages": 2,
      "waves_per_eu": 1
    },
    "1944": {
      "BLOCK_M": 64,
      "BLOCK_N": 16,
      "BLOCK_K": 64,
      "BLOCK_C": 64,
      "NUM_KSPLIT": 1,
      "num_warps": 2,
      "num_stages": 1,
      "waves_per_eu": 0
    },
    "4538": {
      "BLOCK_M": 256,
      "BLOCK_N": 16,
      "BLOCK_K": 32,
      "BLOCK_C": 128,
      "NUM_KSPLIT": 1,
      "num_warps": 2,
      "num_stages": 1,
      "waves_per_eu": 2
    },
    "2813": {
      "BLOCK_M": 64,
      "BLOCK_N": 16,
      "BLOCK_K": 256,
      "BLOCK_C": 256,
      "NUM_KSPLIT": 1,
      "num_warps": 2,
      "num_stages": 2,
      "waves_per_eu": 2
    },
    "5052": {
      "BLOCK_M": 256,
      "BLOCK_N": 16,
      "BLOCK_K": 128,
      "BLOCK_C": 16,
      "NUM_KSPLIT": 1,
      "num_warps": 8,
      "num_stages": 1,
      "waves_per_eu": 0
    },
    "5241": {
      "BLOCK_M": 256,
      "BLOCK_N": 16,
      "BLOCK_K": 128,
      "BLOCK_C": 64,
      "NUM_KSPLIT": 8,
      "num_warps": 2,
      "num_stages": 2,
      "waves_per_eu": 0
    },
    "2740": {
      "BLOCK_M": 64,
      "BLOCK_N": 16,
      "BLOCK_K": 256,
      "BLOCK_C": 128,
      "NUM_KSPLIT": 1,
      "num_warps": 2,
      "num_stages": 2,
      "waves_per_eu": 1
    },
    "3152": {
      "BLOCK_M": 128,
      "BLOCK_N": 16,
      "BLOCK_K": 32,
      "BLOCK_C": 128,
      "NUM_KSPLIT": 8,
      "num_warps": 2,
      "num_stages": 1,
      "waves_per_eu": 2
    },
    "5536": {
      "BLOCK_M": 256,
      "BLOCK_N": 16,
      "BLOCK_K": 256,
      "BLOCK_C": 32,
      "NUM_KSPLIT": 8,
      "num_warps": 4,
      "num_stages": 2,
      "waves_per_eu": 1
    },
    "362": {
      "BLOCK_M": 32,
      "BLOCK_N": 16,
      "BLOCK_K": 64,
      "BLOCK_C": 16,
      "NUM_KSPLIT": 1,
      "num_warps": 2,
      "num_stages": 1,
      "waves_per_eu": 2
    },
    "5125": {
      "BLOCK_M": 256,
      "BLOCK_N": 16,
      "BLOCK_K": 128,
      "BLOCK_C": 32,
      "NUM_KSPLIT": 1,
      "num_warps": 8,
      "num_stages": 1,
      "waves_per_eu": 1
    },
    "4568": {
      "BLOCK_M": 256,
      "BLOCK_N": 16,
      "BLOCK_K": 32,
      "BLOCK_C": 128,
      "NUM_KSPLIT": 2,
      "num_warps": 8,
      "num_stages": 1,
      "waves_per_eu": 2
    },
    "2792": {
      "BLOCK_M": 64,
      "BLOCK_N": 16,
      "BLOCK_K": 256,
      "BLOCK_C": 128,
      "NUM_KSPLIT": 8,
      "num_warps": 2,
      "num_stages": 1,
      "waves_per_eu": 2
    },
    "2608": {
      "BLOCK_M": 64,
      "BLOCK_N": 16,
      "BLOCK_K": 256,
      "BLOCK_C": 32,
      "NUM_KSPLIT": 1,
      "num_warps": 8,
      "num_stages": 2,
      "waves_per_eu": 1
    },
    "1239": {
      "BLOCK_M": 32,
      "BLOCK_N": 16,
      "BLOCK_K": 256,
      "BLOCK_C": 64,
      "NUM_KSPLIT": 1,
      "num_warps": 8,
      "num_stages": 2,
      "waves_per_eu": 0
    },
    "2750": {
      "BLOCK_M": 64,
      "BLOCK_N": 16,
      "BLOCK_K": 256,
      "BLOCK_C": 128,
      "NUM_KSPLIT": 1,
      "num_warps": 8,
      "num_stages": 1,
      "waves_per_eu": 2
    },
    "1792": {
      "BLOCK_M": 64,
      "BLOCK_N": 16,
      "BLOCK_K": 32,
      "BLOCK_C": 256,
      "NUM_KSPLIT": 8,
      "num_warps": 4,
      "num_stages": 2,
      "waves_per_eu": 1
    },
    "3767": {
      "BLOCK_M": 128,
      "BLOCK_N": 16,
      "BLOCK_K": 128,
      "BLOCK_C": 64,
      "NUM_KSPLIT": 2,
      "num_warps": 2,
      "num_stages": 2,
      "waves_per_eu": 2
    },
    "4957": {
      "BLOCK_M": 256,
      "BLOCK_N": 16,
      "BLOCK_K": 64,
      "BLOCK_C": 128,
      "NUM_KSPLIT": 8,
      "num_warps": 4,
      "num_stages": 1,
      "waves_per_eu": 1
    },
    "4951": {
      "BLOCK_M": 256,
      "BLOCK_N": 16,
      "BLOCK_K": 64,
      "BLOCK_C": 128,
      "NUM_KSPLIT": 8,
      "num_warps": 2,
      "num_stages": 1,
      "waves_per_eu": 1
    },
    "3340": {
      "BLOCK_M": 128,
      "BLOCK_N": 16,
      "BLOCK_K": 64,
      "BLOCK_C": 32,
      "NUM_KSPLIT": 2,
      "num_warps": 4,
      "num_stages": 2,
      "waves_per_eu": 1
    },
    "2934": {
      "BLOCK_M": 128,
      "BLOCK_N": 16,
      "BLOCK_K": 32,
      "BLOCK_C": 16,
      "NUM_KSPLIT": 8,
      "num_warps": 2,
      "num_stages": 1,
      "waves_per_eu": 0
    },
    "4282": {
      "BLOCK_M": 128,
      "BLOCK_N": 16,
      "BLOCK_K": 256,
      "BLOCK_C": 256,
      "NUM_KSPLIT": 2,
      "num_warps": 8,
      "num_stages": 2,
      "waves_per_eu": 1
    },
    "198": {
      "BLOCK_M": 32,
      "BLOCK_N": 16,
      "BLOCK_K": 32,
      "BLOCK_C": 64,
      "NUM_KSPLIT": 8,
      "num_warps": 2,
      "num_stages": 1,
      "waves_per_eu": 0
    },
    "2002": {
      "BLOCK_M": 64,
      "BLOCK_N": 16,
      "BLOCK_K": 64,
      "BLOCK_C": 64,
      "NUM_KSPLIT": 8,
      "num_warps": 2,
      "num_stages": 2,
      "waves_per_eu": 1
    },
    "2096": {
      "BLOCK_M": 64,
      "BLOCK_N": 16,
      "BLOCK_K": 64,
      "BLOCK_C": 256,
      "NUM_KSPLIT": 1,
      "num_warps": 4,
      "num_stages": 1,
      "waves_per_eu": 2
    },
    "5531": {
      "BLOCK_M": 256,
      "BLOCK_N": 16,
      "BLOCK_K": 256,
      "BLOCK_C": 32,
      "NUM_KSPLIT": 8,
      "num_warps": 2,
      "num_stages": 2,
      "waves_per_eu": 2
    },
    "2809": {
      "BLOCK_M": 64,
      "BLOCK_N": 16,
      "BLOCK_K": 256,
      "BLOCK_C": 256,
      "NUM_KSPLIT": 1,
      "num_warps": 2,
      "num_stages": 1,
      "waves_per_eu": 1
    },
    "5180": {
      "BLOCK_M": 256,
      "BLOCK_N": 16,
      "BLOCK_K": 128,
      "BLOCK_C": 32,
      "NUM_KSPLIT": 8,
      "num_warps": 8,
      "num_stages": 1,
      "waves_per_eu": 2
    },
    "5599": {
      "BLOCK_M": 256,
      "BLOCK_N": 16,
      "BLOCK_K": 256,
      "BLOCK_C": 64,
      "NUM_KSPLIT": 8,
      "num_warps": 2,
      "num_stages": 1,
      "waves_per_eu": 1
    },
    "4134": {
      "BLOCK_M": 128,
      "BLOCK_N": 16,
      "BLOCK_K": 256,
      "BLOCK_C": 64,
      "NUM_KSPLIT": 2,
      "num_warps": 8,
      "num_stages": 1,
      "waves_per_eu": 0
    },
    "434": {
      "BLOCK_M": 32,
      "BLOCK_N": 16,
      "BLOCK_K": 64,
      "BLOCK_C": 32,
      "NUM_KSPLIT": 1,
      "num_warps": 2,
      "num_stages": 1,
      "waves_per_eu": 2
    },
    "3444": {
      "BLOCK_M": 128,
      "BLOCK_N": 16,
      "BLOCK_K": 64,
      "BLOCK_C": 64,
      "NUM_KSPLIT": 8,
      "num_warps": 4,
      "num_stages": 1,
      "waves_per_eu": 0
    },
    "423": {
      "BLOCK_M": 32,
      "BLOCK_N": 16,
      "BLOCK_K": 64,
      "BLOCK_C": 16,
      "NUM_KSPLIT": 8,
      "num_warps": 4,
      "num_stages": 2,
      "waves_per_eu": 0
    },
    "66": {
      "BLOCK_M": 32,
      "BLOCK_N": 16,
      "BLOCK_K": 32,
      "BLOCK_C": 16,
      "NUM_KSPLIT": 8,
      "num_warps": 8,
      "num_stages": 1,
      "waves_per_eu": 0
    },
    "1453": {
      "BLOCK_M": 64,
      "BLOCK_N": 16,
      "BLOCK_K": 32,
      "BLOCK_C": 16,
      "NUM_KSPLIT": 1,
      "num_warps": 8,
      "num_stages": 1,
      "waves_per_eu": 1
    },
    "5418": {
      "BLOCK_M": 256,
      "BLOCK_N": 16,
      "BLOCK_K": 256,
      "BLOCK_C": 16,
      "NUM_KSPLIT": 2,
      "num_warps": 2,
      "num_stages": 1,
      "waves_per_eu": 0
    },
    "2953": {
      "BLOCK_M": 128,
      "BLOCK_N": 16,
      "BLOCK_K": 32,
      "BLOCK_C": 32,
      "NUM_KSPLIT": 1,
      "num_warps": 2,
      "num_stages": 1,
      "waves_per_eu": 1
    },
    "202": {
      "BLOCK_M": 32,
      "BLOCK_N": 16,
      "BLOCK_K": 32,
      "BLOCK_C": 64,
      "NUM_KSPLIT": 8,
      "num_warps": 2,
      "num_stages": 2,
      "waves_per_eu": 1
    },
    "4803": {
      "BLOCK_M": 256,
      "BLOCK_N": 16,
      "BLOCK_K": 64,
      "BLOCK_C": 32,
      "NUM_KSPLIT": 4,
      "num_warps": 8,
      "num_stages": 2,
      "waves_per_eu": 0
    },
    "438": {
      "BLOCK_M": 32,
      "BLOCK_N": 16,
      "BLOCK_K": 64,
      "BLOCK_C": 32,
      "NUM_KSPLIT": 1,
      "num_warps": 4,
      "num_stages": 1,
      "waves_per_eu": 0
    },
    "507": {
      "BLOCK_M": 32,
      "BLOCK_N": 16,
      "BLOCK_K": 64,
      "BLOCK_C": 64,
      "NUM_KSPLIT": 1,
      "num_warps": 2,
      "num_stages": 2,
      "waves_per_eu": 0
    },
    "5713": {
      "BLOCK_M": 256,
      "BLOCK_N": 16,
      "BLOCK_K": 256,
      "BLOCK_C": 256,
      "NUM_KSPLIT": 2,
      "num_warps": 4,
      "num_stages": 1,
      "waves_per_eu": 1
    },
    "282": {
      "BLOCK_M": 32,
      "BLOCK_N": 16,
      "BLOCK_K": 32,
      "BLOCK_C": 128,
      "NUM_KSPLIT": 8,
      "num_warps": 8,
      "num_stages": 1,
      "waves_per_eu": 0
    },
    "1153": {
      "BLOCK_M": 32,
      "BLOCK_N": 16,
      "BLOCK_K": 256,
      "BLOCK_C": 32,
      "NUM_KSPLIT": 1,
      "num_warps": 2,
      "num_stages": 1,
      "waves_per_eu": 1
    },
    "3954": {
      "BLOCK_M": 128,
      "BLOCK_N": 16,
      "BLOCK_K": 128,
      "BLOCK_C": 256,
      "NUM_KSPLIT": 8,
      "num_warps": 8,
      "num_stages": 1,
      "waves_per_eu": 0
    },
    "4427": {
      "BLOCK_M": 256,
      "BLOCK_N": 16,
      "BLOCK_K": 32,
      "BLOCK_C": 32,
      "NUM_KSPLIT": 2,
      "num_warps": 8,
      "num_stages": 2,
      "waves_per_eu": 2
    },
    "4393": {
      "BLOCK_M": 256,
      "BLOCK_N": 16,
      "BLOCK_K": 32,
      "BLOCK_C": 32,
      "NUM_KSPLIT": 1,
      "num_warps": 2,
      "num_stages": 1,
      "waves_per_eu": 1
    },
    "1578": {
      "BLOCK_M": 64,
      "BLOCK_N": 16,
      "BLOCK_K": 32,
      "BLOCK_C": 32,
      "NUM_KSPLIT": 8,
      "num_warps": 8,
      "num_stages": 1,
      "waves_per_eu": 0
    },
    "821": {
      "BLOCK_M": 32,
      "BLOCK_N": 16,
      "BLOCK_K": 128,
      "BLOCK_C": 32,
      "NUM_KSPLIT": 2,
      "num_warps": 4,
      "num_stages": 2,
      "waves_per_eu": 2
    },
    "2770": {
      "BLOCK_M": 64,
      "BLOCK_N": 16,
      "BLOCK_K": 256,
      "BLOCK_C": 128,
      "NUM_KSPLIT": 2,
      "num_warps": 8,
      "num_stages": 2,
      "waves_per_eu": 1
    },
    "715": {
      "BLOCK_M": 32,
      "BLOCK_N": 16,
      "BLOCK_K": 64,
      "BLOCK_C": 256,
      "NUM_KSPLIT": 8,
      "num_warps": 8,
      "num_stages": 1,
      "waves_per_eu": 1
    },
    "2490": {
      "BLOCK_M": 64,
      "BLOCK_N": 16,
      "BLOCK_K": 128,
      "BLOCK_C": 256,
      "NUM_KSPLIT": 4,
      "num_warps": 4,
      "num_stages": 1,
      "waves_per_eu": 0
    },
    "5647": {
      "BLOCK_M": 256,
      "BLOCK_N": 16,
      "BLOCK_K": 256,
      "BLOCK_C": 128,
      "NUM_KSPLIT": 2,
      "num_warps": 8,
      "num_stages": 1,
      "waves_per_eu": 1
    },
    "3121": {
      "BLOCK_M": 128,
      "BLOCK_N": 16,
      "BLOCK_K": 32,
      "BLOCK_C": 128,
      "NUM_KSPLIT": 2,
      "num_warps": 4,
      "num_stages": 1,
      "waves_per_eu": 1
    },
    "1": {
      "BLOCK_M": 32,
      "BLOCK_N": 16,
      "BLOCK_K": 32,
      "BLOCK_C": 16,
      "NUM_KSPLIT": 1,
      "num_warps": 2,
      "num_stages": 1,
      "waves_per_eu": 1
    },
    "1868": {
      "BLOCK_M": 64,
      "BLOCK_N": 16,
      "BLOCK_K": 64,
      "BLOCK_C": 16,
      "NUM_KSPLIT": 8,
      "num_warps": 8,
      "num_stages": 1,
      "waves_per_eu": 2
    },
    "4616": {
      "BLOCK_M": 256,
      "BLOCK_N": 16,
      "BLOCK_K": 32,
      "BLOCK_C": 256,
      "NUM_KSPLIT": 1,
      "num_warps": 4,
      "num_stages": 1,
      "waves_per_eu": 2
    },
    "1202": {
      "BLOCK_M": 32,
      "BLOCK_N": 16,
      "BLOCK_K": 256,
      "BLOCK_C": 32,
      "NUM_KSPLIT": 4,
      "num_warps": 8,
      "num_stages": 1,
      "waves_per_eu": 2
    },
    "4466": {
      "BLOCK_M": 256,
      "BLOCK_N": 16,
      "BLOCK_K": 32,
      "BLOCK_C": 64,
      "NUM_KSPLIT": 1,
      "num_warps": 2,
      "num_stages": 1,
      "waves_per_eu": 2
    },
    "501": {
      "BLOCK_M": 32,
      "BLOCK_N": 16,
      "BLOCK_K": 64,
      "BLOCK_C": 32,
      "NUM_KSPLIT": 8,
      "num_warps": 8,
      "num_stages": 2,
      "waves_per_eu": 0
    },
    "1138": {
      "BLOCK_M": 32,
      "BLOCK_N": 16,
      "BLOCK_K": 256,
      "BLOCK_C": 16,
      "NUM_KSPLIT": 8,
      "num_warps": 2,
      "num_stages": 2,
      "waves_per_eu": 1
    },
    "5302": {
      "BLOCK_M": 256,
      "BLOCK_N": 16,
      "BLOCK_K": 128,
      "BLOCK_C": 128,
      "NUM_KSPLIT": 4,
      "num_warps": 4,
      "num_stages": 2,
      "waves_per_eu": 1
    },
    "3477": {
      "BLOCK_M": 128,
      "BLOCK_N": 16,
      "BLOCK_K": 64,
      "BLOCK_C": 128,
      "NUM_KSPLIT": 2,
      "num_warps": 2,
      "num_stages": 2,
      "waves_per_eu": 0
    },
    "5441": {
      "BLOCK_M": 256,
      "BLOCK_N": 16,
      "BLOCK_K": 256,
      "BLOCK_C": 16,
      "NUM_KSPLIT": 4,
      "num_warps": 2,
      "num_stages": 2,
      "waves_per_eu": 2
    },
    "747": {
      "BLOCK_M": 32,
      "BLOCK_N": 16,
      "BLOCK_K": 128,
      "BLOCK_C": 16,
      "NUM_KSPLIT": 2,
      "num_warps": 4,
      "num_stages": 2,
      "waves_per_eu": 0
    },
    "4890": {
      "BLOCK_M": 256,
      "BLOCK_N": 16,
      "BLOCK_K": 64,
      "BLOCK_C": 64,
      "NUM_KSPLIT": 8,
      "num_warps": 8,
      "num_stages": 1,
      "waves_per_eu": 0
    },
    "3700": {
      "BLOCK_M": 128,
      "BLOCK_N": 16,
      "BLOCK_K": 128,
      "BLOCK_C": 32,
      "NUM_KSPLIT": 2,
      "num_warps": 4,
      "num_stages": 2,
      "waves_per_eu": 1
    },
    "5726": {
      "BLOCK_M": 256,
      "BLOCK_N": 16,
      "BLOCK_K": 256,
      "BLOCK_C": 256,
      "NUM_KSPLIT": 4,
      "num_warps": 2,
      "num_stages": 1,
      "waves_per_eu": 2
    },
    "2384": {
      "BLOCK_M": 64,
      "BLOCK_N": 16,
      "BLOCK_K": 128,
      "BLOCK_C": 128,
      "NUM_KSPLIT": 1,
      "num_warps": 4,
      "num_stages": 1,
      "waves_per_eu": 2
    },
    "1454": {
      "BLOCK_M": 64,
      "BLOCK_N": 16,
      "BLOCK_K": 32,
      "BLOCK_C": 16,
      "NUM_KSPLIT": 1,
      "num_warps": 8,
      "num_stages": 1,
      "waves_per_eu": 2
    },
    "2295": {
      "BLOCK_M": 64,
      "BLOCK_N": 16,
      "BLOCK_K": 128,
      "BLOCK_C": 32,
      "NUM_KSPLIT": 8,
      "num_warps": 4,
      "num_stages": 2,
      "waves_per_eu": 0
    },
    "4177": {
      "BLOCK_M": 128,
      "BLOCK_N": 16,
      "BLOCK_K": 256,
      "BLOCK_C": 128,
      "NUM_KSPLIT": 1,
      "num_warps": 2,
      "num_stages": 1,
      "waves_per_eu": 1
    },
    "4597": {
      "BLOCK_M": 256,
      "BLOCK_N": 16,
      "BLOCK_K": 32,
      "BLOCK_C": 128,
      "NUM_KSPLIT": 8,
      "num_warps": 4,
      "num_stages": 1,
      "waves_per_eu": 1
    },
    "1514": {
      "BLOCK_M": 64,
      "BLOCK_N": 16,
      "BLOCK_K": 32,
      "BLOCK_C": 32,
      "NUM_KSPLIT": 1,
      "num_warps": 2,
      "num_stages": 1,
      "waves_per_eu": 2
    },
    "1728": {
      "BLOCK_M": 64,
      "BLOCK_N": 16,
      "BLOCK_K": 32,
      "BLOCK_C": 256,
      "NUM_KSPLIT": 1,
      "num_warps": 2,
      "num_stages": 1,
      "waves_per_eu": 0
    },
    "4672": {
      "BLOCK_M": 256,
      "BLOCK_N": 16,
      "BLOCK_K": 32,
      "BLOCK_C": 256,
      "NUM_KSPLIT": 8,
      "num_warps": 4,
      "num_stages": 2,
      "waves_per_eu": 1
    },
    "3214": {
      "BLOCK_M": 128,
      "BLOCK_N": 16,
      "BLOCK_K": 32,
      "BLOCK_C": 256,
      "NUM_KSPLIT": 4,
      "num_warps": 4,
      "num_stages": 2,
      "waves_per_eu": 1
    },
    "2110": {
      "BLOCK_M": 64,
      "BLOCK_N": 16,
      "BLOCK_K": 64,
      "BLOCK_C": 256,
      "NUM_KSPLIT": 2,
      "num_warps": 2,
      "num_stages": 2,
      "waves_per_eu": 1
    },
    "3904": {
      "BLOCK_M": 128,
      "BLOCK_N": 16,
      "BLOCK_K": 128,
      "BLOCK_C": 256,
      "NUM_KSPLIT": 1,
      "num_warps": 8,
      "num_stages": 2,
      "waves_per_eu": 1
    },
    "964": {
      "BLOCK_M": 32,
      "BLOCK_N": 16,
      "BLOCK_K": 128,
      "BLOCK_C": 128,
      "NUM_KSPLIT": 2,
      "num_warps": 4,
      "num_stages": 2,
      "waves_per_eu": 1
    },
    "1988": {
      "BLOCK_M": 64,
      "BLOCK_N": 16,
      "BLOCK_K": 64,
      "BLOCK_C": 64,
      "NUM_KSPLIT": 4,
      "num_warps": 4,
      "num_stages": 1,
      "waves_per_eu": 2
    },
    "5159": {
      "BLOCK_M": 256,
      "BLOCK_N": 16,
      "BLOCK_K": 128,
      "BLOCK_C": 32,
      "NUM_KSPLIT": 4,
      "num_warps": 4,
      "num_stages": 2,
      "waves_per_eu": 2
    },
    "1152": {
      "BLOCK_M": 32,
      "BLOCK_N": 16,
      "BLOCK_K": 256,
      "BLOCK_C": 32,
      "NUM_KSPLIT": 1,
      "num_warps": 2,
      "num_stages": 1,
      "waves_per_eu": 0
    },
    "5131": {
      "BLOCK_M": 256,
      "BLOCK_N": 16,
      "BLOCK_K": 128,
      "BLOCK_C": 32,
      "NUM_KSPLIT": 2,
      "num_warps": 2,
      "num_stages": 1,
      "waves_per_eu": 1
    },
    "3106": {
      "BLOCK_M": 128,
      "BLOCK_N": 16,
      "BLOCK_K": 32,
      "BLOCK_C": 128,
      "NUM_KSPLIT": 1,
      "num_warps": 4,
      "num_stages": 2,
      "waves_per_eu": 1
    },
    "400": {
      "BLOCK_M": 32,
      "BLOCK_N": 16,
      "BLOCK_K": 64,
      "BLOCK_C": 16,
      "NUM_KSPLIT": 4,
      "num_warps": 2,
      "num_stages": 2,
      "waves_per_eu": 1
    },
    "11": {
      "BLOCK_M": 32,
      "BLOCK_N": 16,
      "BLOCK_K": 32,
      "BLOCK_C": 16,
      "NUM_KSPLIT": 1,
      "num_warps": 4,
      "num_stages": 2,
      "waves_per_eu": 2
    },
    "1212": {
      "BLOCK_M": 32,
      "BLOCK_N": 16,
      "BLOCK_K": 256,
      "BLOCK_C": 32,
      "NUM_KSPLIT": 8,
      "num_warps": 4,
      "num_stages": 1,
      "waves_per_eu": 0
    },
    "5546": {
      "BLOCK_M": 256,
      "BLOCK_N": 16,
      "BLOCK_K": 256,
      "BLOCK_C": 64,
      "NUM_KSPLIT": 1,
      "num_warps": 2,
      "num_stages": 1,
      "waves_per_eu": 2
    },
    "4963": {
      "BLOCK_M": 256,
      "BLOCK_N": 16,
      "BLOCK_K": 64,
      "BLOCK_C": 128,
      "NUM_KSPLIT": 8,
      "num_warps": 8,
      "num_stages": 1,
      "waves_per_eu": 1
    },
    "1613": {
      "BLOCK_M": 64,
      "BLOCK_N": 16,
      "BLOCK_K": 32,
      "BLOCK_C": 64,
      "NUM_KSPLIT": 2,
      "num_warps": 4,
      "num_stages": 2,
      "waves_per_eu": 2
    },
    "2886": {
      "BLOCK_M": 128,
      "BLOCK_N": 16,
      "BLOCK_K": 32,
      "BLOCK_C": 16,
      "NUM_KSPLIT": 1,
      "num_warps": 4,
      "num_stages": 1,
      "waves_per_eu": 0
    },
    "772": {
      "BLOCK_M": 32,
      "BLOCK_N": 16,
      "BLOCK_K": 128,
      "BLOCK_C": 16,
      "NUM_KSPLIT": 4,
      "num_warps": 8,
      "num_stages": 2,
      "waves_per_eu": 1
    },
    "2561": {
      "BLOCK_M": 64,
      "BLOCK_N": 16,
      "BLOCK_K": 256,
      "BLOCK_C": 16,
      "NUM_KSPLIT": 4,
      "num_warps": 2,
      "num_stages": 2,
      "waves_per_eu": 2
    },
    "4566": {
      "BLOCK_M": 256,
      "BLOCK_N": 16,
      "BLOCK_K": 32,
      "BLOCK_C": 128,
      "NUM_KSPLIT": 2,
      "num_warps": 8,
      "num_stages": 1,
      "waves_per_eu": 0
    },
    "1616": {
      "BLOCK_M": 64,
      "BLOCK_N": 16,
      "BLOCK_K": 32,
      "BLOCK_C": 64,
      "NUM_KSPLIT": 2,
      "num_warps": 8,
      "num_stages": 1,
      "waves_per_eu": 2
    },
    "492": {
      "BLOCK_M": 32,
      "BLOCK_N": 16,
      "BLOCK_K": 64,
      "BLOCK_C": 32,
      "NUM_KSPLIT": 8,
      "num_warps": 4,
      "num_stages": 1,
      "waves_per_eu": 0
    },
    "4796": {
      "BLOCK_M": 256,
      "BLOCK_N": 16,
      "BLOCK_K": 64,
      "BLOCK_C": 32,
      "NUM_KSPLIT": 4,
      "num_warps": 4,
      "num_stages": 1,
      "waves_per_eu": 2
    },
    "2806": {
      "BLOCK_M": 64,
      "BLOCK_N": 16,
      "BLOCK_K": 256,
      "BLOCK_C": 128,
      "NUM_KSPLIT": 8,
      "num_warps": 8,
      "num_stages": 2,
      "waves_per_eu": 1
    },
    "989": {
      "BLOCK_M": 32,
      "BLOCK_N": 16,
      "BLOCK_K": 128,
      "BLOCK_C": 128,
      "NUM_KSPLIT": 4,
      "num_warps": 8,
      "num_stages": 2,
      "waves_per_eu": 2
    },
    "1447": {
      "BLOCK_M": 64,
      "BLOCK_N": 16,
      "BLOCK_K": 32,
      "BLOCK_C": 16,
      "NUM_KSPLIT": 1,
      "num_warps": 4,
      "num_stages": 1,
      "waves_per_eu": 1
    },
    "252": {
      "BLOCK_M": 32,
      "BLOCK_N": 16,
      "BLOCK_K": 32,
      "BLOCK_C": 128,
      "NUM_KSPLIT": 4,
      "num_warps": 2,
      "num_stages": 1,
      "waves_per_eu": 0
    },
    "3621": {
      "BLOCK_M": 128,
      "BLOCK_N": 16,
      "BLOCK_K": 128,
      "BLOCK_C": 16,
      "NUM_KSPLIT": 2,
      "num_warps": 2,
      "num_stages": 2,
      "waves_per_eu": 0
    },
    "249": {
      "BLOCK_M": 32,
      "BLOCK_N": 16,
      "BLOCK_K": 32,
      "BLOCK_C": 128,
      "NUM_KSPLIT": 2,
      "num_warps": 8,
      "num_stages": 2,
      "waves_per_eu": 0
    },
    "3505": {
      "BLOCK_M": 128,
      "BLOCK_N": 16,
      "BLOCK_K": 64,
      "BLOCK_C": 128,
      "NUM_KSPLIT": 4,
      "num_warps": 8,
      "num_stages": 1,
      "waves_per_eu": 1
    },
    "4693": {
      "BLOCK_M": 256,
      "BLOCK_N": 16,
      "BLOCK_K": 64,
      "BLOCK_C": 16,
      "NUM_KSPLIT": 1,
      "num_warps": 8,
      "num_stages": 1,
      "waves_per_eu": 1
    },
    "3140": {
      "BLOCK_M": 128,
      "BLOCK_N": 16,
      "BLOCK_K": 32,
      "BLOCK_C": 128,
      "NUM_KSPLIT": 4,
      "num_warps": 4,
      "num_stages": 1,
      "waves_per_eu": 2
    },
    "3852": {
      "BLOCK_M": 128,
      "BLOCK_N": 16,
      "BLOCK_K": 128,
      "BLOCK_C": 128,
      "NUM_KSPLIT": 4,
      "num_warps": 2,
      "num_stages": 1,
      "waves_per_eu": 0
    },
    "4866": {
      "BLOCK_M": 256,
      "BLOCK_N": 16,
      "BLOCK_K": 64,
      "BLOCK_C": 64,
      "NUM_KSPLIT": 4,
      "num_warps": 4,
      "num_stages": 1,
      "waves_per_eu": 0
    },
    "5614": {
      "BLOCK_M": 256,
      "BLOCK_N": 16,
      "BLOCK_K": 256,
      "BLOCK_C": 64,
      "NUM_KSPLIT": 8,
      "num_warps": 8,
      "num_stages": 2,
      "waves_per_eu": 1
    },
    "2084": {
      "BLOCK_M": 64,
      "BLOCK_N": 16,
      "BLOCK_K": 64,
      "BLOCK_C": 128,
      "NUM_KSPLIT": 8,
      "num_warps": 8,
      "num_stages": 1,
      "waves_per_eu": 2
    },
    "155": {
      "BLOCK_M": 32,
      "BLOCK_N": 16,
      "BLOCK_K": 32,
      "BLOCK_C": 64,
      "NUM_KSPLIT": 1,
      "num_warps": 4,
      "num_stages": 2,
      "waves_per_eu": 2
    },
    "307": {
      "BLOCK_M": 32,
      "BLOCK_N": 16,
      "BLOCK_K": 32,
      "BLOCK_C": 256,
      "NUM_KSPLIT": 2,
      "num_warps": 2,
      "num_stages": 1,
      "waves_per_eu": 1
    },
    "1670": {
      "BLOCK_M": 64,
      "BLOCK_N": 16,
      "BLOCK_K": 32,
      "BLOCK_C": 128,
      "NUM_KSPLIT": 1,
      "num_warps": 8,
      "num_stages": 1,
      "waves_per_eu": 2
    },
    "5298": {
      "BLOCK_M": 256,
      "BLOCK_N": 16,
      "BLOCK_K": 128,
      "BLOCK_C": 128,
      "NUM_KSPLIT": 4,
      "num_warps": 4,
      "num_stages": 1,
      "waves_per_eu": 0
    },
    "323": {
      "BLOCK_M": 32,
      "BLOCK_N": 16,
      "BLOCK_K": 32,
      "BLOCK_C": 256,
      "NUM_KSPLIT": 2,
      "num_warps": 8,
      "num_stages": 2,
      "waves_per_eu": 2
    },
    "3055": {
      "BLOCK_M": 128,
      "BLOCK_N": 16,
      "BLOCK_K": 32,
      "BLOCK_C": 64,
      "NUM_KSPLIT": 2,
      "num_warps": 8,
      "num_stages": 1,
      "waves_per_eu": 1
    },
    "3741": {
      "BLOCK_M": 128,
      "BLOCK_N": 16,
      "BLOCK_K": 128,
      "BLOCK_C": 32,
      "NUM_KSPLIT": 8,
      "num_warps": 8,
      "num_stages": 2,
      "waves_per_eu": 0
    },
    "232": {
      "BLOCK_M": 32,
      "BLOCK_N": 16,
      "BLOCK_K": 32,
      "BLOCK_C": 128,
      "NUM_KSPLIT": 1,
      "num_warps": 8,
      "num_stages": 2,
      "waves_per_eu": 1
    },
    "2439": {
      "BLOCK_M": 64,
      "BLOCK_N": 16,
      "BLOCK_K": 128,
      "BLOCK_C": 128,
      "NUM_KSPLIT": 8,
      "num_warps": 4,
      "num_stages": 2,
      "waves_per_eu": 0
    },
    "465": {
      "BLOCK_M": 32,
      "BLOCK_N": 16,
      "BLOCK_K": 64,
      "BLOCK_C": 32,
      "NUM_KSPLIT": 2,
      "num_warps": 8,
      "num_stages": 2,
      "waves_per_eu": 0
    },
    "931": {
      "BLOCK_M": 32,
      "BLOCK_N": 16,
      "BLOCK_K": 128,
      "BLOCK_C": 64,
      "NUM_KSPLIT": 8,
      "num_warps": 8,
      "num_stages": 1,
      "waves_per_eu": 1
    },
    "2413": {
      "BLOCK_M": 64,
      "BLOCK_N": 16,
      "BLOCK_K": 128,
      "BLOCK_C": 128,
      "NUM_KSPLIT": 4,
      "num_warps": 2,
      "num_stages": 1,
      "waves_per_eu": 1
    },
    "3512": {
      "BLOCK_M": 128,
      "BLOCK_N": 16,
      "BLOCK_K": 64,
      "BLOCK_C": 128,
      "NUM_KSPLIT": 8,
      "num_warps": 2,
      "num_stages": 1,
      "waves_per_eu": 2
    },
    "618": {
      "BLOCK_M": 32,
      "BLOCK_N": 16,
      "BLOCK_K": 64,
      "BLOCK_C": 128,
      "NUM_KSPLIT": 4,
      "num_warps": 4,
      "num_stages": 1,
      "waves_per_eu": 0
    },
    "3760": {
      "BLOCK_M": 128,
      "BLOCK_N": 16,
      "BLOCK_K": 128,
      "BLOCK_C": 64,
      "NUM_KSPLIT": 1,
      "num_warps": 8,
      "num_stages": 2,
      "waves_per_eu": 1
    },
    "2431": {
      "BLOCK_M": 64,
      "BLOCK_N": 16,
      "BLOCK_K": 128,
      "BLOCK_C": 128,
      "NUM_KSPLIT": 8,
      "num_warps": 2,
      "num_stages": 1,
      "waves_per_eu": 1
    },
    "3797": {
      "BLOCK_M": 128,
      "BLOCK_N": 16,
      "BLOCK_K": 128,
      "BLOCK_C": 64,
      "NUM_KSPLIT": 4,
      "num_warps": 8,
      "num_stages": 2,
      "waves_per_eu": 2
    },
    "4712": {
      "BLOCK_M": 256,
      "BLOCK_N": 16,
      "BLOCK_K": 64,
      "BLOCK_C": 16,
      "NUM_KSPLIT": 2,
      "num_warps": 8,
      "num_stages": 1,
      "waves_per_eu": 2
    },
    "2454": {
      "BLOCK_M": 64,
      "BLOCK_N": 16,
      "BLOCK_K": 128,
      "BLOCK_C": 256,
      "NUM_KSPLIT": 1,
      "num_warps": 4,
      "num_stages": 1,
      "waves_per_eu": 0
    },
    "4265": {
      "BLOCK_M": 128,
      "BLOCK_N": 16,
      "BLOCK_K": 256,
      "BLOCK_C": 256,
      "NUM_KSPLIT": 1,
      "num_warps": 8,
      "num_stages": 2,
      "waves_per_eu": 2
    },
    "360": {
      "BLOCK_M": 32,
      "BLOCK_N": 16,
      "BLOCK_K": 64,
      "BLOCK_C": 16,
      "NUM_KSPLIT": 1,
      "num_warps": 2,
      "num_stages": 1,
      "waves_per_eu": 0
    },
    "1939": {
      "BLOCK_M": 64,
      "BLOCK_N": 16,
      "BLOCK_K": 64,
      "BLOCK_C": 32,
      "NUM_KSPLIT": 8,
      "num_warps": 8,
      "num_stages": 1,
      "waves_per_eu": 1
    },
    "3015": {
      "BLOCK_M": 128,
      "BLOCK_N": 16,
      "BLOCK_K": 32,
      "BLOCK_C": 32,
      "NUM_KSPLIT": 8,
      "num_warps": 4,
      "num_stages": 2,
      "waves_per_eu": 0
    },
    "3313": {
      "BLOCK_M": 128,
      "BLOCK_N": 16,
      "BLOCK_K": 64,
      "BLOCK_C": 32,
      "NUM_KSPLIT": 1,
      "num_warps": 2,
      "num_stages": 1,
      "waves_per_eu": 1
    },
    "3535": {
      "BLOCK_M": 128,
      "BLOCK_N": 16,
      "BLOCK_K": 64,
      "BLOCK_C": 256,
      "NUM_KSPLIT": 1,
      "num_warps": 4,
      "num_stages": 1,
      "waves_per_eu": 1
    },
    "1997": {
      "BLOCK_M": 64,
      "BLOCK_N": 16,
      "BLOCK_K": 64,
      "BLOCK_C": 64,
      "NUM_KSPLIT": 4,
      "num_warps": 8,
      "num_stages": 2,
      "waves_per_eu": 2
    },
    "4301": {
      "BLOCK_M": 128,
      "BLOCK_N": 16,
      "BLOCK_K": 256,
      "BLOCK_C": 256,
      "NUM_KSPLIT": 4,
      "num_warps": 8,
      "num_stages": 2,
      "waves_per_eu": 2
    },
    "709": {
      "BLOCK_M": 32,
      "BLOCK_N": 16,
      "BLOCK_K": 64,
      "BLOCK_C": 256,
      "NUM_KSPLIT": 8,
      "num_warps": 4,
      "num_stages": 1,
      "waves_per_eu": 1
    },
    "5443": {
      "BLOCK_M": 256,
      "BLOCK_N": 16,
      "BLOCK_K": 256,
      "BLOCK_C": 16,
      "NUM_KSPLIT": 4,
      "num_warps": 4,
      "num_stages": 1,
      "waves_per_eu": 1
    },
    "548": {
      "BLOCK_M": 32,
      "BLOCK_N": 16,
      "BLOCK_K": 64,
      "BLOCK_C": 64,
      "NUM_KSPLIT": 4,
      "num_warps": 4,
      "num_stages": 1,
      "waves_per_eu": 2
    },
    "2541": {
      "BLOCK_M": 64,
      "BLOCK_N": 16,
      "BLOCK_K": 256,
      "BLOCK_C": 16,
      "NUM_KSPLIT": 2,
      "num_warps": 2,
      "num_stages": 2,
      "waves_per_eu": 0
    },
    "5472": {
      "BLOCK_M": 256,
      "BLOCK_N": 16,
      "BLOCK_K": 256,
      "BLOCK_C": 32,
      "NUM_KSPLIT": 1,
      "num_warps": 2,
      "num_stages": 1,
      "waves_per_eu": 0
    },
    "5240": {
      "BLOCK_M": 256,
      "BLOCK_N": 16,
      "BLOCK_K": 128,
      "BLOCK_C": 64,
      "NUM_KSPLIT": 8,
      "num_warps": 2,
      "num_stages": 1,
      "waves_per_eu": 2
    },
    "177": {
      "BLOCK_M": 32,
      "BLOCK_N": 16,
      "BLOCK_K": 32,
      "BLOCK_C": 64,
      "NUM_KSPLIT": 2,
      "num_warps": 8,
      "num_stages": 2,
      "waves_per_eu": 0
    },
    "5278": {
      "BLOCK_M": 256,
      "BLOCK_N": 16,
      "BLOCK_K": 128,
      "BLOCK_C": 128,
      "NUM_KSPLIT": 2,
      "num_warps": 2,
      "num_stages": 2,
      "waves_per_eu": 1
    },
    "5047": {
      "BLOCK_M": 256,
      "BLOCK_N": 16,
      "BLOCK_K": 128,
      "BLOCK_C": 16,
      "NUM_KSPLIT": 1,
      "num_warps": 4,
      "num_stages": 1,
      "waves_per_eu": 1
    },
    "994": {
      "BLOCK_M": 32,
      "BLOCK_N": 16,
      "BLOCK_K": 128,
      "BLOCK_C": 128,
      "NUM_KSPLIT": 8,
      "num_warps": 2,
      "num_stages": 2,
      "waves_per_eu": 1
    },
    "5152": {
      "BLOCK_M": 256,
      "BLOCK_N": 16,
      "BLOCK_K": 128,
      "BLOCK_C": 32,
      "NUM_KSPLIT": 4,
      "num_warps": 2,
      "num_stages": 2,
      "waves_per_eu": 1
    },
    "1800": {
      "BLOCK_M": 64,
      "BLOCK_N": 16,
      "BLOCK_K": 64,
      "BLOCK_C": 16,
      "NUM_KSPLIT": 1,
      "num_warps": 2,
      "num_stages": 1,
      "waves_per_eu": 0
    },
    "1847": {
      "BLOCK_M": 64,
      "BLOCK_N": 16,
      "BLOCK_K": 64,
      "BLOCK_C": 16,
      "NUM_KSPLIT": 4,
      "num_warps": 4,
      "num_stages": 2,
      "waves_per_eu": 2
    },
    "2456": {
      "BLOCK_M": 64,
      "BLOCK_N": 16,
      "BLOCK_K": 128,
      "BLOCK_C": 256,
      "NUM_KSPLIT": 1,
      "num_warps": 4,
      "num_stages": 1,
      "waves_per_eu": 2
    },
    "2033": {
      "BLOCK_M": 64,
      "BLOCK_N": 16,
      "BLOCK_K": 64,
      "BLOCK_C": 128,
      "NUM_KSPLIT": 1,
      "num_warps": 8,
      "num_stages": 2,
      "waves_per_eu": 2
    },
    "1391": {
      "BLOCK_M": 32,
      "BLOCK_N": 16,
      "BLOCK_K": 256,
      "BLOCK_C": 256,
      "NUM_KSPLIT": 2,
      "num_warps": 2,
      "num_stages": 2,
      "waves_per_eu": 2
    },
    "4182": {
      "BLOCK_M": 128,
      "BLOCK_N": 16,
      "BLOCK_K": 256,
      "BLOCK_C": 128,
      "NUM_KSPLIT": 1,
      "num_warps": 4,
      "num_stages": 1,
      "waves_per_eu": 0
    },
    "2446": {
      "BLOCK_M": 64,
      "BLOCK_N": 16,
      "BLOCK_K": 128,
      "BLOCK_C": 128,
      "NUM_KSPLIT": 8,
      "num_warps": 8,
      "num_stages": 2,
      "waves_per_eu": 1
    },
    "335": {
      "BLOCK_M": 32,
      "BLOCK_N": 16,
      "BLOCK_K": 32,
      "BLOCK_C": 256,
      "NUM_KSPLIT": 4,
      "num_warps": 4,
      "num_stages": 2,
      "waves_per_eu": 2
    },
    "3018": {
      "BLOCK_M": 128,
      "BLOCK_N": 16,
      "BLOCK_K": 32,
      "BLOCK_C": 32,
      "NUM_KSPLIT": 8,
      "num_warps": 8,
      "num_stages": 1,
      "waves_per_eu": 0
    },
    "1237": {
      "BLOCK_M": 32,
      "BLOCK_N": 16,
      "BLOCK_K": 256,
      "BLOCK_C": 64,
      "NUM_KSPLIT": 1,
      "num_warps": 8,
      "num_stages": 1,
      "waves_per_eu": 1
    },
    "757": {
      "BLOCK_M": 32,
      "BLOCK_N": 16,
      "BLOCK_K": 128,
      "BLOCK_C": 16,
      "NUM_KSPLIT": 4,
      "num_warps": 2,
      "num_stages": 1,
      "waves_per_eu": 1
    },
    "3101": {
      "BLOCK_M": 128,
      "BLOCK_N": 16,
      "BLOCK_K": 32,
      "BLOCK_C": 128,
      "NUM_KSPLIT": 1,
      "num_warps": 2,
      "num_stages": 2,
      "waves_per_eu": 2
    },
    "1946": {
      "BLOCK_M": 64,
      "BLOCK_N": 16,
      "BLOCK_K": 64,
      "BLOCK_C": 64,
      "NUM_KSPLIT": 1,
      "num_warps": 2,
      "num_stages": 1,
      "waves_per_eu": 2
    },
    "1720": {
      "BLOCK_M": 64,
      "BLOCK_N": 16,
      "BLOCK_K": 32,
      "BLOCK_C": 128,
      "NUM_KSPLIT": 8,
      "num_warps": 4,
      "num_stages": 2,
      "waves_per_eu": 1
    },
    "643": {
      "BLOCK_M": 32,
      "BLOCK_N": 16,
      "BLOCK_K": 64,
      "BLOCK_C": 128,
      "NUM_KSPLIT": 8,
      "num_warps": 8,
      "num_stages": 1,
      "waves_per_eu": 1
    },
    "2403": {
      "BLOCK_M": 64,
      "BLOCK_N": 16,
      "BLOCK_K": 128,
      "BLOCK_C": 128,
      "NUM_KSPLIT": 2,
      "num_warps": 4,
      "num_stages": 2,
      "waves_per_eu": 0
    },
    "1243": {
      "BLOCK_M": 32,
      "BLOCK_N": 16,
      "BLOCK_K": 256,
      "BLOCK_C": 64,
      "NUM_KSPLIT": 2,
      "num_warps": 2,
      "num_stages": 1,
      "waves_per_eu": 1
    },
    "3067": {
      "BLOCK_M": 128,
      "BLOCK_N": 16,
      "BLOCK_K": 32,
      "BLOCK_C": 64,
      "NUM_KSPLIT": 4,
      "num_warps": 4,
      "num_stages": 1,
      "waves_per_eu": 1
    },
    "1190": {
      "BLOCK_M": 32,
      "BLOCK_N": 16,
      "BLOCK_K": 256,
      "BLOCK_C": 32,
      "NUM_KSPLIT": 4,
      "num_warps": 2,
      "num_stages": 1,
      "waves_per_eu": 2
    },
    "4978": {
      "BLOCK_M": 256,
      "BLOCK_N": 16,
      "BLOCK_K": 64,
      "BLOCK_C": 256,
      "NUM_KSPLIT": 1,
      "num_warps": 4,
      "num_stages": 2,
      "waves_per_eu": 1
    },
    "911": {
      "BLOCK_M": 32,
      "BLOCK_N": 16,
      "BLOCK_K": 128,
      "BLOCK_C": 64,
      "NUM_KSPLIT": 4,
      "num_warps": 4,
      "num_stages": 2,
      "waves_per_eu": 2
    },
    "2434": {
      "BLOCK_M": 64,
      "BLOCK_N": 16,
      "BLOCK_K": 128,
      "BLOCK_C": 128,
      "NUM_KSPLIT": 8,
      "num_warps": 2,
      "num_stages": 2,
      "waves_per_eu": 1
    },
    "3458": {
      "BLOCK_M": 128,
      "BLOCK_N": 16,
      "BLOCK_K": 64,
      "BLOCK_C": 128,
      "NUM_KSPLIT": 1,
      "num_warps": 2,
      "num_stages": 1,
      "waves_per_eu": 2
    },
    "2801": {
      "BLOCK_M": 64,
      "BLOCK_N": 16,
      "BLOCK_K": 256,
      "BLOCK_C": 128,
      "NUM_KSPLIT": 8,
      "num_warps": 4,
      "num_stages": 2,
      "waves_per_eu": 2
    },
    "736": {
      "BLOCK_M": 32,
      "BLOCK_N": 16,
      "BLOCK_K": 128,
      "BLOCK_C": 16,
      "NUM_KSPLIT": 1,
      "num_warps": 8,
      "num_stages": 2,
      "waves_per_eu": 1
    },
    "3329": {
      "BLOCK_M": 128,
      "BLOCK_N": 16,
      "BLOCK_K": 64,
      "BLOCK_C": 32,
      "NUM_KSPLIT": 1,
      "num_warps": 8,
      "num_stages": 2,
      "waves_per_eu": 2
    },
    "108": {
      "BLOCK_M": 32,
      "BLOCK_N": 16,
      "BLOCK_K": 32,
      "BLOCK_C": 32,
      "NUM_KSPLIT": 4,
      "num_warps": 2,
      "num_stages": 1,
      "waves_per_eu": 0
    },
    "5545": {
      "BLOCK_M": 256,
      "BLOCK_N": 16,
      "BLOCK_K": 256,
      "BLOCK_C": 64,
      "NUM_KSPLIT": 1,
      "num_warps": 2,
      "num_stages": 1,
      "waves_per_eu": 1
    },
    "2885": {
      "BLOCK_M": 128,
      "BLOCK_N": 16,
      "BLOCK_K": 32,
      "BLOCK_C": 16,
      "NUM_KSPLIT": 1,
      "num_warps": 2,
      "num_stages": 2,
      "waves_per_eu": 2
    },
    "223": {
      "BLOCK_M": 32,
      "BLOCK_N": 16,
      "BLOCK_K": 32,
      "BLOCK_C": 128,
      "NUM_KSPLIT": 1,
      "num_warps": 4,
      "num_stages": 1,
      "waves_per_eu": 1
    },
    "2525": {
      "BLOCK_M": 64,
      "BLOCK_N": 16,
      "BLOCK_K": 256,
      "BLOCK_C": 16,
      "NUM_KSPLIT": 1,
      "num_warps": 2,
      "num_stages": 2,
      "waves_per_eu": 2
    },
    "5328": {
      "BLOCK_M": 256,
      "BLOCK_N": 16,
      "BLOCK_K": 128,
      "BLOCK_C": 256,
      "NUM_KSPLIT": 1,
      "num_warps": 2,
      "num_stages": 1,
      "waves_per_eu": 0
    },
    "3857": {
      "BLOCK_M": 128,
      "BLOCK_N": 16,
      "BLOCK_K": 128,
      "BLOCK_C": 128,
      "NUM_KSPLIT": 4,
      "num_warps": 2,
      "num_stages": 2,
      "waves_per_eu": 2
    },
    "1478": {
      "BLOCK_M": 64,
      "BLOCK_N": 16,
      "BLOCK_K": 32,
      "BLOCK_C": 16,
      "NUM_KSPLIT": 4,
      "num_warps": 2,
      "num_stages": 1,
      "waves_per_eu": 2
    },
    "3406": {
      "BLOCK_M": 128,
      "BLOCK_N": 16,
      "BLOCK_K": 64,
      "BLOCK_C": 64,
      "NUM_KSPLIT": 2,
      "num_warps": 2,
      "num_stages": 2,
      "waves_per_eu": 1
    },
    "1680": {
      "BLOCK_M": 64,
      "BLOCK_N": 16,
      "BLOCK_K": 32,
      "BLOCK_C": 128,
      "NUM_KSPLIT": 2,
      "num_warps": 4,
      "num_stages": 1,
      "waves_per_eu": 0
    },
    "4995": {
      "BLOCK_M": 256,
      "BLOCK_N": 16,
      "BLOCK_K": 64,
      "BLOCK_C": 256,
      "NUM_KSPLIT": 2,
      "num_warps": 4,
      "num_stages": 2,
      "waves_per_eu": 0
    },
    "2757": {
      "BLOCK_M": 64,
      "BLOCK_N": 16,
      "BLOCK_K": 256,
      "BLOCK_C": 128,
      "NUM_KSPLIT": 2,
      "num_warps": 2,
      "num_stages": 2,
      "waves_per_eu": 0
    },
    "1924": {
      "BLOCK_M": 64,
      "BLOCK_N": 16,
      "BLOCK_K": 64,
      "BLOCK_C": 32,
      "NUM_KSPLIT": 4,
      "num_warps": 8,
      "num_stages": 2,
      "waves_per_eu": 1
    },
    "5117": {
      "BLOCK_M": 256,
      "BLOCK_N": 16,
      "BLOCK_K": 128,
      "BLOCK_C": 32,
      "NUM_KSPLIT": 1,
      "num_warps": 2,
      "num_stages": 2,
      "waves_per_eu": 2
    },
    "2000": {
      "BLOCK_M": 64,
      "BLOCK_N": 16,
      "BLOCK_K": 64,
      "BLOCK_C": 64,
      "NUM_KSPLIT": 8,
      "num_warps": 2,
      "num_stages": 1,
      "waves_per_eu": 2
    },
    "2853": {
      "BLOCK_M": 64,
      "BLOCK_N": 16,
      "BLOCK_K": 256,
      "BLOCK_C": 256,
      "NUM_KSPLIT": 4,
      "num_warps": 4,
      "num_stages": 2,
      "waves_per_eu": 0
    },
    "4220": {
      "BLOCK_M": 128,
      "BLOCK_N": 16,
      "BLOCK_K": 256,
      "BLOCK_C": 128,
      "NUM_KSPLIT": 4,
      "num_warps": 4,
      "num_stages": 1,
      "waves_per_eu": 2
    },
    "4060": {
      "BLOCK_M": 128,
      "BLOCK_N": 16,
      "BLOCK_K": 256,
      "BLOCK_C": 32,
      "NUM_KSPLIT": 2,
      "num_warps": 4,
      "num_stages": 2,
      "waves_per_eu": 1
    },
    "4665": {
      "BLOCK_M": 256,
      "BLOCK_N": 16,
      "BLOCK_K": 32,
      "BLOCK_C": 256,
      "NUM_KSPLIT": 8,
      "num_warps": 2,
      "num_stages": 2,
      "waves_per_eu": 0
    },
    "4056": {
      "BLOCK_M": 128,
      "BLOCK_N": 16,
      "BLOCK_K": 256,
      "BLOCK_C": 32,
      "NUM_KSPLIT": 2,
      "num_warps": 4,
      "num_stages": 1,
      "waves_per_eu": 0
    },
    "3892": {
      "BLOCK_M": 128,
      "BLOCK_N": 16,
      "BLOCK_K": 128,
      "BLOCK_C": 256,
      "NUM_KSPLIT": 1,
      "num_warps": 2,
      "num_stages": 2,
      "waves_per_eu": 1
    },
    "0": {
      "BLOCK_M": 32,
      "BLOCK_N": 16,
      "BLOCK_K": 32,
      "BLOCK_C": 16,
      "NUM_KSPLIT": 1,
      "num_warps": 2,
      "num_stages": 1,
      "waves_per_eu": 0
    },
    "1242": {
      "BLOCK_M": 32,
      "BLOCK_N": 16,
      "BLOCK_K": 256,
      "BLOCK_C": 64,
      "NUM_KSPLIT": 2,
      "num_warps": 2,
      "num_stages": 1,
      "waves_per_eu": 0
    },
    "3442": {
      "BLOCK_M": 128,
      "BLOCK_N": 16,
      "BLOCK_K": 64,
      "BLOCK_C": 64,
      "NUM_KSPLIT": 8,
      "num_warps": 2,
      "num_stages": 2,
      "waves_per_eu": 1
    },
    "1328": {
      "BLOCK_M": 32,
      "BLOCK_N": 16,
      "BLOCK_K": 256,
      "BLOCK_C": 128,
      "NUM_KSPLIT": 2,
      "num_warps": 8,
      "num_stages": 1,
      "waves_per_eu": 2
    },
    "2569": {
      "BLOCK_M": 64,
      "BLOCK_N": 16,
      "BLOCK_K": 256,
      "BLOCK_C": 16,
      "NUM_KSPLIT": 4,
      "num_warps": 8,
      "num_stages": 1,
      "waves_per_eu": 1
    },
    "2385": {
      "BLOCK_M": 64,
      "BLOCK_N": 16,
      "BLOCK_K": 128,
      "BLOCK_C": 128,
      "NUM_KSPLIT": 1,
      "num_warps": 4,
      "num_stages": 2,
      "waves_per_eu": 0
    },
    "539": {
      "BLOCK_M": 32,
      "BLOCK_N": 16,
      "BLOCK_K": 64,
      "BLOCK_C": 64,
      "NUM_KSPLIT": 2,
      "num_warps": 8,
      "num_stages": 2,
      "waves_per_eu": 2
    },
    "666": {
      "BLOCK_M": 32,
      "BLOCK_N": 16,
      "BLOCK_K": 64,
      "BLOCK_C": 256,
      "NUM_KSPLIT": 2,
      "num_warps": 2,
      "num_stages": 1,
      "waves_per_eu": 0
    },
    "3427": {
      "BLOCK_M": 128,
      "BLOCK_N": 16,
      "BLOCK_K": 64,
      "BLOCK_C": 64,
      "NUM_KSPLIT": 4,
      "num_warps": 4,
      "num_stages": 1,
      "waves_per_eu": 1
    },
    "1189": {
      "BLOCK_M": 32,
      "BLOCK_N": 16,
      "BLOCK_K": 256,
      "BLOCK_C": 32,
      "NUM_KSPLIT": 4,
      "num_warps": 2,
      "num_stages": 1,
      "waves_per_eu": 1
    },
    "969": {
      "BLOCK_M": 32,
      "BLOCK_N": 16,
      "BLOCK_K": 128,
      "BLOCK_C": 128,
      "NUM_KSPLIT": 2,
      "num_warps": 8,
      "num_stages": 2,
      "waves_per_eu": 0
    },
    "2099": {
      "BLOCK_M": 64,
      "BLOCK_N": 16,
      "BLOCK_K": 64,
      "BLOCK_C": 256,
      "NUM_KSPLIT": 1,
      "num_warps": 4,
      "num_stages": 2,
      "waves_per_eu": 2
    },
    "5525": {
      "BLOCK_M": 256,
      "BLOCK_N": 16,
      "BLOCK_K": 256,
      "BLOCK_C": 32,
      "NUM_KSPLIT": 4,
      "num_warps": 8,
      "num_stages": 2,
      "waves_per_eu": 2
    },
    "2128": {
      "BLOCK_M": 64,
      "BLOCK_N": 16,
      "BLOCK_K": 64,
      "BLOCK_C": 256,
      "NUM_KSPLIT": 4,
      "num_warps": 2,
      "num_stages": 2,
      "waves_per_eu": 1
    },
    "744": {
      "BLOCK_M": 32,
      "BLOCK_N": 16,
      "BLOCK_K": 128,
      "BLOCK_C": 16,
      "NUM_KSPLIT": 2,
      "num_warps": 4,
      "num_stages": 1,
      "waves_per_eu": 0
    },
    "2225": {
      "BLOCK_M": 64,
      "BLOCK_N": 16,
      "BLOCK_K": 128,
      "BLOCK_C": 16,
      "NUM_KSPLIT": 8,
      "num_warps": 4,
      "num_stages": 2,
      "waves_per_eu": 2
    },
    "513": {
      "BLOCK_M": 32,
      "BLOCK_N": 16,
      "BLOCK_K": 64,
      "BLOCK_C": 64,
      "NUM_KSPLIT": 1,
      "num_warps": 4,
      "num_stages": 2,
      "waves_per_eu": 0
    },
    "5021": {
      "BLOCK_M": 256,
      "BLOCK_N": 16,
      "BLOCK_K": 64,
      "BLOCK_C": 256,
      "NUM_KSPLIT": 4,
      "num_warps": 8,
      "num_stages": 2,
      "waves_per_eu": 2
    },
    "4093": {
      "BLOCK_M": 128,
      "BLOCK_N": 16,
      "BLOCK_K": 256,
      "BLOCK_C": 32,
      "NUM_KSPLIT": 8,
      "num_warps": 4,
      "num_stages": 1,
      "waves_per_eu": 1
    },
    "4372": {
      "BLOCK_M": 256,
      "BLOCK_N": 16,
      "BLOCK_K": 32,
      "BLOCK_C": 16,
      "NUM_KSPLIT": 4,
      "num_warps": 8,
      "num_stages": 2,
      "waves_per_eu": 1
    },
    "3831": {
      "BLOCK_M": 128,
      "BLOCK_N": 16,
      "BLOCK_K": 128,
      "BLOCK_C": 128,
      "NUM_KSPLIT": 1,
      "num_warps": 8,
      "num_stages": 2,
      "waves_per_eu": 0
    },
    "5570": {
      "BLOCK_M": 256,
      "BLOCK_N": 16,
      "BLOCK_K": 256,
      "BLOCK_C": 64,
      "NUM_KSPLIT": 2,
      "num_warps": 4,
      "num_stages": 1,
      "waves_per_eu": 2
    },
    "5149": {
      "BLOCK_M": 256,
      "BLOCK_N": 16,
      "BLOCK_K": 128,
      "BLOCK_C": 32,
      "NUM_KSPLIT": 4,
      "num_warps": 2,
      "num_stages": 1,
      "waves_per_eu": 1
    },
    "5130": {
      "BLOCK_M": 256,
      "BLOCK_N": 16,
      "BLOCK_K": 128,
      "BLOCK_C": 32,
      "NUM_KSPLIT": 2,
      "num_warps": 2,
      "num_stages": 1,
      "waves_per_eu": 0
    },
    "3578": {
      "BLOCK_M": 128,
      "BLOCK_N": 16,
      "BLOCK_K": 64,
      "BLOCK_C": 256,
      "NUM_KSPLIT": 4,
      "num_warps": 8,
      "num_stages": 1,
      "waves_per_eu": 2
    },
    "5192": {
      "BLOCK_M": 256,
      "BLOCK_N": 16,
      "BLOCK_K": 128,
      "BLOCK_C": 64,
      "NUM_KSPLIT": 1,
      "num_warps": 4,
      "num_stages": 1,
      "waves_per_eu": 2
    },
    "2071": {
      "BLOCK_M": 64,
      "BLOCK_N": 16,
      "BLOCK_K": 64,
      "BLOCK_C": 128,
      "NUM_KSPLIT": 8,
      "num_warps": 2,
      "num_stages": 1,
      "waves_per_eu": 1
    },
    "2683": {
      "BLOCK_M": 64,
      "BLOCK_N": 16,
      "BLOCK_K": 256,
      "BLOCK_C": 64,
      "NUM_KSPLIT": 2,
      "num_warps": 2,
      "num_stages": 1,
      "waves_per_eu": 1
    },
    "634": {
      "BLOCK_M": 32,
      "BLOCK_N": 16,
      "BLOCK_K": 64,
      "BLOCK_C": 128,
      "NUM_KSPLIT": 8,
      "num_warps": 2,
      "num_stages": 2,
      "waves_per_eu": 1
    },
    "5739": {
      "BLOCK_M": 256,
      "BLOCK_N": 16,
      "BLOCK_K": 256,
      "BLOCK_C": 256,
      "NUM_KSPLIT": 4,
      "num_warps": 8,
      "num_stages": 2,
      "waves_per_eu": 0
    },
    "4206": {
      "BLOCK_M": 128,
      "BLOCK_N": 16,
      "BLOCK_K": 256,
      "BLOCK_C": 128,
      "NUM_KSPLIT": 2,
      "num_warps": 8,
      "num_stages": 1,
      "waves_per_eu": 0
    },
    "2871": {
      "BLOCK_M": 64,
      "BLOCK_N": 16,
      "BLOCK_K": 256,
      "BLOCK_C": 256,
      "NUM_KSPLIT": 8,
      "num_warps": 4,
      "num_stages": 2,
      "waves_per_eu": 0
    },
    "4298": {
      "BLOCK_M": 128,
      "BLOCK_N": 16,
      "BLOCK_K": 256,
      "BLOCK_C": 256,
      "NUM_KSPLIT": 4,
      "num_warps": 8,
      "num_stages": 1,
      "waves_per_eu": 2
    },
    "2129": {
      "BLOCK_M": 64,
      "BLOCK_N": 16,
      "BLOCK_K": 64,
      "BLOCK_C": 256,
      "NUM_KSPLIT": 4,
      "num_warps": 2,
      "num_stages": 2,
      "waves_per_eu": 2
    },
    "6": {
      "BLOCK_M": 32,
      "BLOCK_N": 16,
      "BLOCK_K": 32,
      "BLOCK_C": 16,
      "NUM_KSPLIT": 1,
      "num_warps": 4,
      "num_stages": 1,
      "waves_per_eu": 0
    },
    "4618": {
      "BLOCK_M": 256,
      "BLOCK_N": 16,
      "BLOCK_K": 32,
      "BLOCK_C": 256,
      "NUM_KSPLIT": 1,
      "num_warps": 4,
      "num_stages": 2,
      "waves_per_eu": 1
    },
    "1813": {
      "BLOCK_M": 64,
      "BLOCK_N": 16,
      "BLOCK_K": 64,
      "BLOCK_C": 16,
      "NUM_KSPLIT": 1,
      "num_warps": 8,
      "num_stages": 1,
      "waves_per_eu": 1
    },
    "3574": {
      "BLOCK_M": 128,
      "BLOCK_N": 16,
      "BLOCK_K": 64,
      "BLOCK_C": 256,
      "NUM_KSPLIT": 4,
      "num_warps": 4,
      "num_stages": 2,
      "waves_per_eu": 1
    },
    "1962": {
      "BLOCK_M": 64,
      "BLOCK_N": 16,
      "BLOCK_K": 64,
      "BLOCK_C": 64,
      "NUM_KSPLIT": 2,
      "num_warps": 2,
      "num_stages": 1,
      "waves_per_eu": 0
    },
    "4109": {
      "BLOCK_M": 128,
      "BLOCK_N": 16,
      "BLOCK_K": 256,
      "BLOCK_C": 64,
      "NUM_KSPLIT": 1,
      "num_warps": 2,
      "num_stages": 2,
      "waves_per_eu": 2
    },
    "116": {
      "BLOCK_M": 32,
      "BLOCK_N": 16,
      "BLOCK_K": 32,
      "BLOCK_C": 32,
      "NUM_KSPLIT": 4,
      "num_warps": 4,
      "num_stages": 1,
      "waves_per_eu": 2
    },
    "5351": {
      "BLOCK_M": 256,
      "BLOCK_N": 16,
      "BLOCK_K": 128,
      "BLOCK_C": 256,
      "NUM_KSPLIT": 2,
      "num_warps": 2,
      "num_stages": 2,
      "waves_per_eu": 2
    },
    "961": {
      "BLOCK_M": 32,
      "BLOCK_N": 16,
      "BLOCK_K": 128,
      "BLOCK_C": 128,
      "NUM_KSPLIT": 2,
      "num_warps": 4,
      "num_stages": 1,
      "waves_per_eu": 1
    },
    "4535": {
      "BLOCK_M": 256,
      "BLOCK_N": 16,
      "BLOCK_K": 32,
      "BLOCK_C": 64,
      "NUM_KSPLIT": 8,
      "num_warps": 8,
      "num_stages": 2,
      "waves_per_eu": 2
    },
    "2115": {
      "BLOCK_M": 64,
      "BLOCK_N": 16,
      "BLOCK_K": 64,
      "BLOCK_C": 256,
      "NUM_KSPLIT": 2,
      "num_warps": 4,
      "num_stages": 2,
      "waves_per_eu": 0
    },
    "2406": {
      "BLOCK_M": 64,
      "BLOCK_N": 16,
      "BLOCK_K": 128,
      "BLOCK_C": 128,
      "NUM_KSPLIT": 2,
      "num_warps": 8,
      "num_stages": 1,
      "waves_per_eu": 0
    },
    "3299": {
      "BLOCK_M": 128,
      "BLOCK_N": 16,
      "BLOCK_K": 64,
      "BLOCK_C": 16,
      "NUM_KSPLIT": 8,
      "num_warps": 2,
      "num_stages": 2,
      "waves_per_eu": 2
    },
    "27": {
      "BLOCK_M": 32,
      "BLOCK_N": 16,
      "BLOCK_K": 32,
      "BLOCK_C": 16,
      "NUM_KSPLIT": 2,
      "num_warps": 4,
      "num_stages": 2,
      "waves_per_eu": 0
    },
    "5308": {
      "BLOCK_M": 256,
      "BLOCK_N": 16,
      "BLOCK_K": 128,
      "BLOCK_C": 128,
      "NUM_KSPLIT": 4,
      "num_warps": 8,
      "num_stages": 2,
      "waves_per_eu": 1
    },
    "5648": {
      "BLOCK_M": 256,
      "BLOCK_N": 16,
      "BLOCK_K": 256,
      "BLOCK_C": 128,
      "NUM_KSPLIT": 2,
      "num_warps": 8,
      "num_stages": 1,
      "waves_per_eu": 2
    },
    "207": {
      "BLOCK_M": 32,
      "BLOCK_N": 16,
      "BLOCK_K": 32,
      "BLOCK_C": 64,
      "NUM_KSPLIT": 8,
      "num_warps": 4,
      "num_stages": 2,
      "waves_per_eu": 0
    },
    "479": {
      "BLOCK_M": 32,
      "BLOCK_N": 16,
      "BLOCK_K": 64,
      "BLOCK_C": 32,
      "NUM_KSPLIT": 4,
      "num_warps": 4,
      "num_stages": 2,
      "waves_per_eu": 2
    },
    "2755": {
      "BLOCK_M": 64,
      "BLOCK_N": 16,
      "BLOCK_K": 256,
      "BLOCK_C": 128,
      "NUM_KSPLIT": 2,
      "num_warps": 2,
      "num_stages": 1,
      "waves_per_eu": 1
    },
    "1238": {
      "BLOCK_M": 32,
      "BLOCK_N": 16,
      "BLOCK_K": 256,
      "BLOCK_C": 64,
      "NUM_KSPLIT": 1,
      "num_warps": 8,
      "num_stages": 1,
      "waves_per_eu": 2
    },
    "1119": {
      "BLOCK_M": 32,
      "BLOCK_N": 16,
      "BLOCK_K": 256,
      "BLOCK_C": 16,
      "NUM_KSPLIT": 4,
      "num_warps": 2,
      "num_stages": 2,
      "waves_per_eu": 0
    },
    "5735": {
      "BLOCK_M": 256,
      "BLOCK_N": 16,
      "BLOCK_K": 256,
      "BLOCK_C": 256,
      "NUM_KSPLIT": 4,
      "num_warps": 4,
      "num_stages": 2,
      "waves_per_eu": 2
    },
    "4683": {
      "BLOCK_M": 256,
      "BLOCK_N": 16,
      "BLOCK_K": 64,
      "BLOCK_C": 16,
      "NUM_KSPLIT": 1,
      "num_warps": 2,
      "num_stages": 2,
      "waves_per_eu": 0
    },
    "971": {
      "BLOCK_M": 32,
      "BLOCK_N": 16,
      "BLOCK_K": 128,
      "BLOCK_C": 128,
      "NUM_KSPLIT": 2,
      "num_warps": 8,
      "num_stages": 2,
      "waves_per_eu": 2
    },
    "833": {
      "BLOCK_M": 32,
      "BLOCK_N": 16,
      "BLOCK_K": 128,
      "BLOCK_C": 32,
      "NUM_KSPLIT": 4,
      "num_warps": 2,
      "num_stages": 2,
      "waves_per_eu": 2
    },
    "1874": {
      "BLOCK_M": 64,
      "BLOCK_N": 16,
      "BLOCK_K": 64,
      "BLOCK_C": 32,
      "NUM_KSPLIT": 1,
      "num_warps": 2,
      "num_stages": 1,
      "waves_per_eu": 2
    },
    "274": {
      "BLOCK_M": 32,
      "BLOCK_N": 16,
      "BLOCK_K": 32,
      "BLOCK_C": 128,
      "NUM_KSPLIT": 8,
      "num_warps": 2,
      "num_stages": 2,
      "waves_per_eu": 1
    },
    "4670": {
      "BLOCK_M": 256,
      "BLOCK_N": 16,
      "BLOCK_K": 32,
      "BLOCK_C": 256,
      "NUM_KSPLIT": 8,
      "num_warps": 4,
      "num_stages": 1,
      "waves_per_eu": 2
    },
    "5016": {
      "BLOCK_M": 256,
      "BLOCK_N": 16,
      "BLOCK_K": 64,
      "BLOCK_C": 256,
      "NUM_KSPLIT": 4,
      "num_warps": 8,
      "num_stages": 1,
      "waves_per_eu": 0
    },
    "451": {
      "BLOCK_M": 32,
      "BLOCK_N": 16,
      "BLOCK_K": 64,
      "BLOCK_C": 32,
      "NUM_KSPLIT": 2,
      "num_warps": 2,
      "num_stages": 1,
      "waves_per_eu": 1
    },
    "3772": {
      "BLOCK_M": 128,
      "BLOCK_N": 16,
      "BLOCK_K": 128,
      "BLOCK_C": 64,
      "NUM_KSPLIT": 2,
      "num_warps": 4,
      "num_stages": 2,
      "waves_per_eu": 1
    },
    "312": {
      "BLOCK_M": 32,
      "BLOCK_N": 16,
      "BLOCK_K": 32,
      "BLOCK_C": 256,
      "NUM_KSPLIT": 2,
      "num_warps": 4,
      "num_stages": 1,
      "waves_per_eu": 0
    },
    "5629": {
      "BLOCK_M": 256,
      "BLOCK_N": 16,
      "BLOCK_K": 256,
      "BLOCK_C": 128,
      "NUM_KSPLIT": 1,
      "num_warps": 8,
      "num_stages": 1,
      "waves_per_eu": 1
    },
    "2332": {
      "BLOCK_M": 64,
      "BLOCK_N": 16,
      "BLOCK_K": 128,
      "BLOCK_C": 64,
      "NUM_KSPLIT": 2,
      "num_warps": 4,
      "num_stages": 2,
      "waves_per_eu": 1
    },
    "3714": {
      "BLOCK_M": 128,
      "BLOCK_N": 16,
      "BLOCK_K": 128,
      "BLOCK_C": 32,
      "NUM_KSPLIT": 4,
      "num_warps": 4,
      "num_stages": 1,
      "waves_per_eu": 0
    },
    "2939": {
      "BLOCK_M": 128,
      "BLOCK_N": 16,
      "BLOCK_K": 32,
      "BLOCK_C": 16,
      "NUM_KSPLIT": 8,
      "num_warps": 2,
      "num_stages": 2,
      "waves_per_eu": 2
    },
    "1900": {
      "BLOCK_M": 64,
      "BLOCK_N": 16,
      "BLOCK_K": 64,
      "BLOCK_C": 32,
      "NUM_KSPLIT": 2,
      "num_warps": 4,
      "num_stages": 2,
      "waves_per_eu": 1
    },
    "562": {
      "BLOCK_M": 32,
      "BLOCK_N": 16,
      "BLOCK_K": 64,
      "BLOCK_C": 64,
      "NUM_KSPLIT": 8,
      "num_warps": 2,
      "num_stages": 2,
      "waves_per_eu": 1
    },
    "4719": {
      "BLOCK_M": 256,
      "BLOCK_N": 16,
      "BLOCK_K": 64,
      "BLOCK_C": 16,
      "NUM_KSPLIT": 4,
      "num_warps": 2,
      "num_stages": 2,
      "waves_per_eu": 0
    },
    "4174": {
      "BLOCK_M": 128,
      "BLOCK_N": 16,
      "BLOCK_K": 256,
      "BLOCK_C": 64,
      "NUM_KSPLIT": 8,
      "num_warps": 8,
      "num_stages": 2,
      "waves_per_eu": 1
    },
    "5551": {
      "BLOCK_M": 256,
      "BLOCK_N": 16,
      "BLOCK_K": 256,
      "BLOCK_C": 64,
      "NUM_KSPLIT": 1,
      "num_warps": 4,
      "num_stages": 1,
      "waves_per_eu": 1
    },
    "4242": {
      "BLOCK_M": 128,
      "BLOCK_N": 16,
      "BLOCK_K": 256,
      "BLOCK_C": 128,
      "NUM_KSPLIT": 8,
      "num_warps": 8,
      "num_stages": 1,
      "waves_per_eu": 0
    },
    "231": {
      "BLOCK_M": 32,
      "BLOCK_N": 16,
      "BLOCK_K": 32,
      "BLOCK_C": 128,
      "NUM_KSPLIT": 1,
      "num_warps": 8,
      "num_stages": 2,
      "waves_per_eu": 0
    },
    "5250": {
      "BLOCK_M": 256,
      "BLOCK_N": 16,
      "BLOCK_K": 128,
      "BLOCK_C": 64,
      "NUM_KSPLIT": 8,
      "num_warps": 8,
      "num_stages": 1,
      "waves_per_eu": 0
    },
    "4417": {
      "BLOCK_M": 256,
      "BLOCK_N": 16,
      "BLOCK_K": 32,
      "BLOCK_C": 32,
      "NUM_KSPLIT": 2,
      "num_warps": 4,
      "num_stages": 1,
      "waves_per_eu": 1
    },
    "2511": {
      "BLOCK_M": 64,
      "BLOCK_N": 16,
      "BLOCK_K": 128,
      "BLOCK_C": 256,
      "NUM_KSPLIT": 8,
      "num_warps": 4,
      "num_stages": 2,
      "waves_per_eu": 0
    },
    "2127": {
      "BLOCK_M": 64,
      "BLOCK_N": 16,
      "BLOCK_K": 64,
      "BLOCK_C": 256,
      "NUM_KSPLIT": 4,
      "num_warps": 2,
      "num_stages": 2,
      "waves_per_eu": 0
    },
    "2308": {
      "BLOCK_M": 64,
      "BLOCK_N": 16,
      "BLOCK_K": 128,
      "BLOCK_C": 64,
      "NUM_KSPLIT": 1,
      "num_warps": 2,
      "num_stages": 2,
      "waves_per_eu": 1
    },
    "701": {
      "BLOCK_M": 32,
      "BLOCK_N": 16,
      "BLOCK_K": 64,
      "BLOCK_C": 256,
      "NUM_KSPLIT": 4,
      "num_warps": 8,
      "num_stages": 2,
      "waves_per_eu": 2
    },
    "608": {
      "BLOCK_M": 32,
      "BLOCK_N": 16,
      "BLOCK_K": 64,
      "BLOCK_C": 128,
      "NUM_KSPLIT": 2,
      "num_warps": 8,
      "num_stages": 1,
      "waves_per_eu": 2
    },
    "2422": {
      "BLOCK_M": 64,
      "BLOCK_N": 16,
      "BLOCK_K": 128,
      "BLOCK_C": 128,
      "NUM_KSPLIT": 4,
      "num_warps": 4,
      "num_stages": 2,
      "waves_per_eu": 1
    },
    "1918": {
      "BLOCK_M": 64,
      "BLOCK_N": 16,
      "BLOCK_K": 64,
      "BLOCK_C": 32,
      "NUM_KSPLIT": 4,
      "num_warps": 4,
      "num_stages": 2,
      "waves_per_eu": 1
    },
    "1123": {
      "BLOCK_M": 32,
      "BLOCK_N": 16,
      "BLOCK_K": 256,
      "BLOCK_C": 16,
      "NUM_KSPLIT": 4,
      "num_warps": 4,
      "num_stages": 1,
      "waves_per_eu": 1
    },
    "4820": {
      "BLOCK_M": 256,
      "BLOCK_N": 16,
      "BLOCK_K": 64,
      "BLOCK_C": 32,
      "NUM_KSPLIT": 8,
      "num_warps": 8,
      "num_stages": 1,
      "waves_per_eu": 2
    },
    "3796": {
      "BLOCK_M": 128,
      "BLOCK_N": 16,
      "BLOCK_K": 128,
      "BLOCK_C": 64,
      "NUM_KSPLIT": 4,
      "num_warps": 8,
      "num_stages": 2,
      "waves_per_eu": 1
    },
    "3733": {
      "BLOCK_M": 128,
      "BLOCK_N": 16,
      "BLOCK_K": 128,
      "BLOCK_C": 32,
      "NUM_KSPLIT": 8,
      "num_warps": 4,
      "num_stages": 1,
      "waves_per_eu": 1
    },
    "4790": {
      "BLOCK_M": 256,
      "BLOCK_N": 16,
      "BLOCK_K": 64,
      "BLOCK_C": 32,
      "NUM_KSPLIT": 4,
      "num_warps": 2,
      "num_stages": 1,
      "waves_per_eu": 2
    },
    "173": {
      "BLOCK_M": 32,
      "BLOCK_N": 16,
      "BLOCK_K": 32,
      "BLOCK_C": 64,
      "NUM_KSPLIT": 2,
      "num_warps": 4,
      "num_stages": 2,
      "waves_per_eu": 2
    },
    "5184": {
      "BLOCK_M": 256,
      "BLOCK_N": 16,
      "BLOCK_K": 128,
      "BLOCK_C": 64,
      "NUM_KSPLIT": 1,
      "num_warps": 2,
      "num_stages": 1,
      "waves_per_eu": 0
    },
    "4639": {
      "BLOCK_M": 256,
      "BLOCK_N": 16,
      "BLOCK_K": 32,
      "BLOCK_C": 256,
      "NUM_KSPLIT": 2,
      "num_warps": 8,
      "num_stages": 1,
      "waves_per_eu": 1
    },
    "2877": {
      "BLOCK_M": 64,
      "BLOCK_N": 16,
      "BLOCK_K": 256,
      "BLOCK_C": 256,
      "NUM_KSPLIT": 8,
      "num_warps": 8,
      "num_stages": 2,
      "waves_per_eu": 0
    },
    "1954": {
      "BLOCK_M": 64,
      "BLOCK_N": 16,
      "BLOCK_K": 64,
      "BLOCK_C": 64,
      "NUM_KSPLIT": 1,
      "num_warps": 4,
      "num_stages": 2,
      "waves_per_eu": 1
    },
    "4163": {
      "BLOCK_M": 128,
      "BLOCK_N": 16,
      "BLOCK_K": 256,
      "BLOCK_C": 64,
      "NUM_KSPLIT": 8,
      "num_warps": 2,
      "num_stages": 2,
      "waves_per_eu": 2
    },
    "352": {
      "BLOCK_M": 32,
      "BLOCK_N": 16,
      "BLOCK_K": 32,
      "BLOCK_C": 256,
      "NUM_KSPLIT": 8,
      "num_warps": 4,
      "num_stages": 2,
      "waves_per_eu": 1
    },
    "5362": {
      "BLOCK_M": 256,
      "BLOCK_N": 16,
      "BLOCK_K": 128,
      "BLOCK_C": 256,
      "NUM_KSPLIT": 2,
      "num_warps": 8,
      "num_stages": 2,
      "waves_per_eu": 1
    },
    "3020": {
      "BLOCK_M": 128,
      "BLOCK_N": 16,
      "BLOCK_K": 32,
      "BLOCK_C": 32,
      "NUM_KSPLIT": 8,
      "num_warps": 8,
      "num_stages": 1,
      "waves_per_eu": 2
    },
    "458": {
      "BLOCK_M": 32,
      "BLOCK_N": 16,
      "BLOCK_K": 64,
      "BLOCK_C": 32,
      "NUM_KSPLIT": 2,
      "num_warps": 4,
      "num_stages": 1,
      "waves_per_eu": 2
    },
    "2688": {
      "BLOCK_M": 64,
      "BLOCK_N": 16,
      "BLOCK_K": 256,
      "BLOCK_C": 64,
      "NUM_KSPLIT": 2,
      "num_warps": 4,
      "num_stages": 1,
      "waves_per_eu": 0
    },
    "2545": {
      "BLOCK_M": 64,
      "BLOCK_N": 16,
      "BLOCK_K": 256,
      "BLOCK_C": 16,
      "NUM_KSPLIT": 2,
      "num_warps": 4,
      "num_stages": 1,
      "waves_per_eu": 1
    },
    "419": {
      "BLOCK_M": 32,
      "BLOCK_N": 16,
      "BLOCK_K": 64,
      "BLOCK_C": 16,
      "NUM_KSPLIT": 8,
      "num_warps": 2,
      "num_stages": 2,
      "waves_per_eu": 2
    },
    "598": {
      "BLOCK_M": 32,
      "BLOCK_N": 16,
      "BLOCK_K": 64,
      "BLOCK_C": 128,
      "NUM_KSPLIT": 2,
      "num_warps": 2,
      "num_stages": 2,
      "waves_per_eu": 1
    },
    "1158": {
      "BLOCK_M": 32,
      "BLOCK_N": 16,
      "BLOCK_K": 256,
      "BLOCK_C": 32,
      "NUM_KSPLIT": 1,
      "num_warps": 4,
      "num_stages": 1,
      "waves_per_eu": 0
    },
    "3675": {
      "BLOCK_M": 128,
      "BLOCK_N": 16,
      "BLOCK_K": 128,
      "BLOCK_C": 32,
      "NUM_KSPLIT": 1,
      "num_warps": 2,
      "num_stages": 2,
      "waves_per_eu": 0
    },
    "5471": {
      "BLOCK_M": 256,
      "BLOCK_N": 16,
      "BLOCK_K": 256,
      "BLOCK_C": 16,
      "NUM_KSPLIT": 8,
      "num_warps": 8,
      "num_stages": 2,
      "waves_per_eu": 2
    },
    "4309": {
      "BLOCK_M": 128,
      "BLOCK_N": 16,
      "BLOCK_K": 256,
      "BLOCK_C": 256,
      "NUM_KSPLIT": 8,
      "num_warps": 4,
      "num_stages": 1,
      "waves_per_eu": 1
    },
    "3455": {
      "BLOCK_M": 128,
      "BLOCK_N": 16,
      "BLOCK_K": 64,
      "BLOCK_C": 64,
      "NUM_KSPLIT": 8,
      "num_warps": 8,
      "num_stages": 2,
      "waves_per_eu": 2
    },
    "3437": {
      "BLOCK_M": 128,
      "BLOCK_N": 16,
      "BLOCK_K": 64,
      "BLOCK_C": 64,
      "NUM_KSPLIT": 4,
      "num_warps": 8,
      "num_stages": 2,
      "waves_per_eu": 2
    },
    "2783": {
      "BLOCK_M": 64,
      "BLOCK_N": 16,
      "BLOCK_K": 256,
      "BLOCK_C": 128,
      "NUM_KSPLIT": 4,
      "num_warps": 4,
      "num_stages": 2,
      "waves_per_eu": 2
    },
    "4231": {
      "BLOCK_M": 128,
      "BLOCK_N": 16,
      "BLOCK_K": 256,
      "BLOCK_C": 128,
      "NUM_KSPLIT": 8,
      "num_warps": 2,
      "num_stages": 1,
      "waves_per_eu": 1
    },
    "1080": {
      "BLOCK_M": 32,
      "BLOCK_N": 16,
      "BLOCK_K": 256,
      "BLOCK_C": 16,
      "NUM_KSPLIT": 1,
      "num_warps": 2,
      "num_stages": 1,
      "waves_per_eu": 0
    },
    "3085": {
      "BLOCK_M": 128,
      "BLOCK_N": 16,
      "BLOCK_K": 32,
      "BLOCK_C": 64,
      "NUM_KSPLIT": 8,
      "num_warps": 4,
      "num_stages": 1,
      "waves_per_eu": 1
    },
    "316": {
      "BLOCK_M": 32,
      "BLOCK_N": 16,
      "BLOCK_K": 32,
      "BLOCK_C": 256,
      "NUM_KSPLIT": 2,
      "num_warps": 4,
      "num_stages": 2,
      "waves_per_eu": 1
    },
    "2135": {
      "BLOCK_M": 64,
      "BLOCK_N": 16,
      "BLOCK_K": 64,
      "BLOCK_C": 256,
      "NUM_KSPLIT": 4,
      "num_warps": 4,
      "num_stages": 2,
      "waves_per_eu": 2
    },
    "306": {
      "BLOCK_M": 32,
      "BLOCK_N": 16,
      "BLOCK_K": 32,
      "BLOCK_C": 256,
      "NUM_KSPLIT": 2,
      "num_warps": 2,
      "num_stages": 1,
      "waves_per_eu": 0
    },
    "5696": {
      "BLOCK_M": 256,
      "BLOCK_N": 16,
      "BLOCK_K": 256,
      "BLOCK_C": 256,
      "NUM_KSPLIT": 1,
      "num_warps": 4,
      "num_stages": 1,
      "waves_per_eu": 2
    },
    "3715": {
      "BLOCK_M": 128,
      "BLOCK_N": 16,
      "BLOCK_K": 128,
      "BLOCK_C": 32,
      "NUM_KSPLIT": 4,
      "num_warps": 4,
      "num_stages": 1,
      "waves_per_eu": 1
    },
    "1621": {
      "BLOCK_M": 64,
      "BLOCK_N": 16,
      "BLOCK_K": 32,
      "BLOCK_C": 64,
      "NUM_KSPLIT": 4,
      "num_warps": 2,
      "num_stages": 1,
      "waves_per_eu": 1
    },
    "5759": {
      "BLOCK_M": 256,
      "BLOCK_N": 16,
      "BLOCK_K": 256,
      "BLOCK_C": 256,
      "NUM_KSPLIT": 8,
      "num_warps": 8,
      "num_stages": 2,
      "waves_per_eu": 2
    },
    "3537": {
      "BLOCK_M": 128,
      "BLOCK_N": 16,
      "BLOCK_K": 64,
      "BLOCK_C": 256,
      "NUM_KSPLIT": 1,
      "num_warps": 4,
      "num_stages": 2,
      "waves_per_eu": 0
    },
    "4812": {
      "BLOCK_M": 256,
      "BLOCK_N": 16,
      "BLOCK_K": 64,
      "BLOCK_C": 32,
      "NUM_KSPLIT": 8,
      "num_warps": 4,
      "num_stages": 1,
      "waves_per_eu": 0
    },
    "5642": {
      "BLOCK_M": 256,
      "BLOCK_N": 16,
      "BLOCK_K": 256,
      "BLOCK_C": 128,
      "NUM_KSPLIT": 2,
      "num_warps": 4,
      "num_stages": 1,
      "waves_per_eu": 2
    },
    "4602": {
      "BLOCK_M": 256,
      "BLOCK_N": 16,
      "BLOCK_K": 32,
      "BLOCK_C": 128,
      "NUM_KSPLIT": 8,
      "num_warps": 8,
      "num_stages": 1,
      "waves_per_eu": 0
    },
    "2125": {
      "BLOCK_M": 64,
      "BLOCK_N": 16,
      "BLOCK_K": 64,
      "BLOCK_C": 256,
      "NUM_KSPLIT": 4,
      "num_warps": 2,
      "num_stages": 1,
      "waves_per_eu": 1
    },
    "1818": {
      "BLOCK_M": 64,
      "BLOCK_N": 16,
      "BLOCK_K": 64,
      "BLOCK_C": 16,
      "NUM_KSPLIT": 2,
      "num_warps": 2,
      "num_stages": 1,
      "waves_per_eu": 0
    },
    "4689": {
      "BLOCK_M": 256,
      "BLOCK_N": 16,
      "BLOCK_K": 64,
      "BLOCK_C": 16,
      "NUM_KSPLIT": 1,
      "num_warps": 4,
      "num_stages": 2,
      "waves_per_eu": 0
    },
    "3148": {
      "BLOCK_M": 128,
      "BLOCK_N": 16,
      "BLOCK_K": 32,
      "BLOCK_C": 128,
      "NUM_KSPLIT": 4,
      "num_warps": 8,
      "num_stages": 2,
      "waves_per_eu": 1
    },
    "1226": {
      "BLOCK_M": 32,
      "BLOCK_N": 16,
      "BLOCK_K": 256,
      "BLOCK_C": 64,
      "NUM_KSPLIT": 1,
      "num_warps": 2,
      "num_stages": 1,
      "waves_per_eu": 2
    },
    "1181": {
      "BLOCK_M": 32,
      "BLOCK_N": 16,
      "BLOCK_K": 256,
      "BLOCK_C": 32,
      "NUM_KSPLIT": 2,
      "num_warps": 4,
      "num_stages": 2,
      "waves_per_eu": 2
    },
    "452": {
      "BLOCK_M": 32,
      "BLOCK_N": 16,
      "BLOCK_K": 64,
      "BLOCK_C": 32,
      "NUM_KSPLIT": 2,
      "num_warps": 2,
      "num_stages": 1,
      "waves_per_eu": 2
    },
    "857": {
      "BLOCK_M": 32,
      "BLOCK_N": 16,
      "BLOCK_K": 128,
      "BLOCK_C": 32,
      "NUM_KSPLIT": 8,
      "num_warps": 4,
      "num_stages": 2,
      "waves_per_eu": 2
    },
    "353": {
      "BLOCK_M": 32,
      "BLOCK_N": 16,
      "BLOCK_K": 32,
      "BLOCK_C": 256,
      "NUM_KSPLIT": 8,
      "num_warps": 4,
      "num_stages": 2,
      "waves_per_eu": 2
    },
    "5042": {
      "BLOCK_M": 256,
      "BLOCK_N": 16,
      "BLOCK_K": 128,
      "BLOCK_C": 16,
      "NUM_KSPLIT": 1,
      "num_warps": 2,
      "num_stages": 1,
      "waves_per_eu": 2
    },
    "3829": {
      "BLOCK_M": 128,
      "BLOCK_N": 16,
      "BLOCK_K": 128,
      "BLOCK_C": 128,
      "NUM_KSPLIT": 1,
      "num_warps": 8,
      "num_stages": 1,
      "waves_per_eu": 1
    },
    "2270": {
      "BLOCK_M": 64,
      "BLOCK_N": 16,
      "BLOCK_K": 128,
      "BLOCK_C": 32,
      "NUM_KSPLIT": 4,
      "num_warps": 2,
      "num_stages": 1,
      "waves_per_eu": 2
    },
    "3580": {
      "BLOCK_M": 128,
      "BLOCK_N": 16,
      "BLOCK_K": 64,
      "BLOCK_C": 256,
      "NUM_KSPLIT": 4,
      "num_warps": 8,
      "num_stages": 2,
      "waves_per_eu": 1
    },
    "2925": {
      "BLOCK_M": 128,
      "BLOCK_N": 16,
      "BLOCK_K": 32,
      "BLOCK_C": 16,
      "NUM_KSPLIT": 4,
      "num_warps": 4,
      "num_stages": 2,
      "waves_per_eu": 0
    },
    "1555": {
      "BLOCK_M": 64,
      "BLOCK_N": 16,
      "BLOCK_K": 32,
      "BLOCK_C": 32,
      "NUM_KSPLIT": 4,
      "num_warps": 4,
      "num_stages": 1,
      "waves_per_eu": 1
    },
    "3759": {
      "BLOCK_M": 128,
      "BLOCK_N": 16,
      "BLOCK_K": 128,
      "BLOCK_C": 64,
      "NUM_KSPLIT": 1,
      "num_warps": 8,
      "num_stages": 2,
      "waves_per_eu": 0
    },
    "1833": {
      "BLOCK_M": 64,
      "BLOCK_N": 16,
      "BLOCK_K": 64,
      "BLOCK_C": 16,
      "NUM_KSPLIT": 2,
      "num_warps": 8,
      "num_stages": 2,
      "waves_per_eu": 0
    },
    "298": {
      "BLOCK_M": 32,
      "BLOCK_N": 16,
      "BLOCK_K": 32,
      "BLOCK_C": 256,
      "NUM_KSPLIT": 1,
      "num_warps": 4,
      "num_stages": 2,
      "waves_per_eu": 1
    },
    "1807": {
      "BLOCK_M": 64,
      "BLOCK_N": 16,
      "BLOCK_K": 64,
      "BLOCK_C": 16,
      "NUM_KSPLIT": 1,
      "num_warps": 4,
      "num_stages": 1,
      "waves_per_eu": 1
    },
    "2780": {
      "BLOCK_M": 64,
      "BLOCK_N": 16,
      "BLOCK_K": 256,
      "BLOCK_C": 128,
      "NUM_KSPLIT": 4,
      "num_warps": 4,
      "num_stages": 1,
      "waves_per_eu": 2
    },
    "1261": {
      "BLOCK_M": 32,
      "BLOCK_N": 16,
      "BLOCK_K": 256,
      "BLOCK_C": 64,
      "NUM_KSPLIT": 4,
      "num_warps": 2,
      "num_stages": 1,
      "waves_per_eu": 1
    },
    "591": {
      "BLOCK_M": 32,
      "BLOCK_N": 16,
      "BLOCK_K": 64,
      "BLOCK_C": 128,
      "NUM_KSPLIT": 1,
      "num_warps": 8,
      "num_stages": 2,
      "waves_per_eu": 0
    },
    "5164": {
      "BLOCK_M": 256,
      "BLOCK_N": 16,
      "BLOCK_K": 128,
      "BLOCK_C": 32,
      "NUM_KSPLIT": 4,
      "num_warps": 8,
      "num_stages": 2,
      "waves_per_eu": 1
    },
    "2146": {
      "BLOCK_M": 64,
      "BLOCK_N": 16,
      "BLOCK_K": 64,
      "BLOCK_C": 256,
      "NUM_KSPLIT": 8,
      "num_warps": 2,
      "num_stages": 2,
      "waves_per_eu": 1
    },
    "3718": {
      "BLOCK_M": 128,
      "BLOCK_N": 16,
      "BLOCK_K": 128,
      "BLOCK_C": 32,
      "NUM_KSPLIT": 4,
      "num_warps": 4,
      "num_stages": 2,
      "waves_per_eu": 1
    },
    "2793": {
      "BLOCK_M": 64,
      "BLOCK_N": 16,
      "BLOCK_K": 256,
      "BLOCK_C": 128,
      "NUM_KSPLIT": 8,
      "num_warps": 2,
      "num_stages": 2,
      "waves_per_eu": 0
    },
    "1747": {
      "BLOCK_M": 64,
      "BLOCK_N": 16,
      "BLOCK_K": 32,
      "BLOCK_C": 256,
      "NUM_KSPLIT": 2,
      "num_warps": 2,
      "num_stages": 1,
      "waves_per_eu": 1
    },
    "2050": {
      "BLOCK_M": 64,
      "BLOCK_N": 16,
      "BLOCK_K": 64,
      "BLOCK_C": 128,
      "NUM_KSPLIT": 2,
      "num_warps": 8,
      "num_stages": 2,
      "waves_per_eu": 1
    },
    "1896": {
      "BLOCK_M": 64,
      "BLOCK_N": 16,
      "BLOCK_K": 64,
      "BLOCK_C": 32,
      "NUM_KSPLIT": 2,
      "num_warps": 4,
      "num_stages": 1,
      "waves_per_eu": 0
    },
    "822": {
      "BLOCK_M": 32,
      "BLOCK_N": 16,
      "BLOCK_K": 128,
      "BLOCK_C": 32,
      "NUM_KSPLIT": 2,
      "num_warps": 8,
      "num_stages": 1,
      "waves_per_eu": 0
    },
    "4635": {
      "BLOCK_M": 256,
      "BLOCK_N": 16,
      "BLOCK_K": 32,
      "BLOCK_C": 256,
      "NUM_KSPLIT": 2,
      "num_warps": 4,
      "num_stages": 2,
      "waves_per_eu": 0
    },
    "3926": {
      "BLOCK_M": 128,
      "BLOCK_N": 16,
      "BLOCK_K": 128,
      "BLOCK_C": 256,
      "NUM_KSPLIT": 4,
      "num_warps": 2,
      "num_stages": 1,
      "waves_per_eu": 2
    },
    "476": {
      "BLOCK_M": 32,
      "BLOCK_N": 16,
      "BLOCK_K": 64,
      "BLOCK_C": 32,
      "NUM_KSPLIT": 4,
      "num_warps": 4,
      "num_stages": 1,
      "waves_per_eu": 2
    },
    "5274": {
      "BLOCK_M": 256,
      "BLOCK_N": 16,
      "BLOCK_K": 128,
      "BLOCK_C": 128,
      "NUM_KSPLIT": 2,
      "num_warps": 2,
      "num_stages": 1,
      "waves_per_eu": 0
    },
    "3325": {
      "BLOCK_M": 128,
      "BLOCK_N": 16,
      "BLOCK_K": 64,
      "BLOCK_C": 32,
      "NUM_KSPLIT": 1,
      "num_warps": 8,
      "num_stages": 1,
      "waves_per_eu": 1
    },
    "698": {
      "BLOCK_M": 32,
      "BLOCK_N": 16,
      "BLOCK_K": 64,
      "BLOCK_C": 256,
      "NUM_KSPLIT": 4,
      "num_warps": 8,
      "num_stages": 1,
      "waves_per_eu": 2
    },
    "1174": {
      "BLOCK_M": 32,
      "BLOCK_N": 16,
      "BLOCK_K": 256,
      "BLOCK_C": 32,
      "NUM_KSPLIT": 2,
      "num_warps": 2,
      "num_stages": 2,
      "waves_per_eu": 1
    },
    "5066": {
      "BLOCK_M": 256,
      "BLOCK_N": 16,
      "BLOCK_K": 128,
      "BLOCK_C": 16,
      "NUM_KSPLIT": 2,
      "num_warps": 4,
      "num_stages": 1,
      "waves_per_eu": 2
    },
    "4273": {
      "BLOCK_M": 128,
      "BLOCK_N": 16,
      "BLOCK_K": 256,
      "BLOCK_C": 256,
      "NUM_KSPLIT": 2,
      "num_warps": 4,
      "num_stages": 1,
      "waves_per_eu": 1
    },
    "3087": {
      "BLOCK_M": 128,
      "BLOCK_N": 16,
      "BLOCK_K": 32,
      "BLOCK_C": 64,
      "NUM_KSPLIT": 8,
      "num_warps": 4,
      "num_stages": 2,
      "waves_per_eu": 0
    },
    "2313": {
      "BLOCK_M": 64,
      "BLOCK_N": 16,
      "BLOCK_K": 128,
      "BLOCK_C": 64,
      "NUM_KSPLIT": 1,
      "num_warps": 4,
      "num_stages": 2,
      "waves_per_eu": 0
    },
    "4032": {
      "BLOCK_M": 128,
      "BLOCK_N": 16,
      "BLOCK_K": 256,
      "BLOCK_C": 32,
      "NUM_KSPLIT": 1,
      "num_warps": 2,
      "num_stages": 1,
      "waves_per_eu": 0
    },
    "4026": {
      "BLOCK_M": 128,
      "BLOCK_N": 16,
      "BLOCK_K": 256,
      "BLOCK_C": 16,
      "NUM_KSPLIT": 8,
      "num_warps": 8,
      "num_stages": 1,
      "waves_per_eu": 0
    },
    "243": {
      "BLOCK_M": 32,
      "BLOCK_N": 16,
      "BLOCK_K": 32,
      "BLOCK_C": 128,
      "NUM_KSPLIT": 2,
      "num_warps": 4,
      "num_stages": 2,
      "waves_per_eu": 0
    },
    "471": {
      "BLOCK_M": 32,
      "BLOCK_N": 16,
      "BLOCK_K": 64,
      "BLOCK_C": 32,
      "NUM_KSPLIT": 4,
      "num_warps": 2,
      "num_stages": 2,
      "waves_per_eu": 0
    },
    "2706": {
      "BLOCK_M": 64,
      "BLOCK_N": 16,
      "BLOCK_K": 256,
      "BLOCK_C": 64,
      "NUM_KSPLIT": 4,
      "num_warps": 4,
      "num_stages": 1,
      "waves_per_eu": 0
    },
    "48": {
      "BLOCK_M": 32,
      "BLOCK_N": 16,
      "BLOCK_K": 32,
      "BLOCK_C": 16,
      "NUM_KSPLIT": 4,
      "num_warps": 8,
      "num_stages": 1,
      "waves_per_eu": 0
    },
    "2485": {
      "BLOCK_M": 64,
      "BLOCK_N": 16,
      "BLOCK_K": 128,
      "BLOCK_C": 256,
      "NUM_KSPLIT": 4,
      "num_warps": 2,
      "num_stages": 1,
      "waves_per_eu": 1
    },
    "688": {
      "BLOCK_M": 32,
      "BLOCK_N": 16,
      "BLOCK_K": 64,
      "BLOCK_C": 256,
      "NUM_KSPLIT": 4,
      "num_warps": 2,
      "num_stages": 2,
      "waves_per_eu": 1
    },
    "771": {
      "BLOCK_M": 32,
      "BLOCK_N": 16,
      "BLOCK_K": 128,
      "BLOCK_C": 16,
      "NUM_KSPLIT": 4,
      "num_warps": 8,
      "num_stages": 2,
      "waves_per_eu": 0
    },
    "635": {
      "BLOCK_M": 32,
      "BLOCK_N": 16,
      "BLOCK_K": 64,
      "BLOCK_C": 128,
      "NUM_KSPLIT": 8,
      "num_warps": 2,
      "num_stages": 2,
      "waves_per_eu": 2
    },
    "601": {
      "BLOCK_M": 32,
      "BLOCK_N": 16,
      "BLOCK_K": 64,
      "BLOCK_C": 128,
      "NUM_KSPLIT": 2,
      "num_warps": 4,
      "num_stages": 1,
      "waves_per_eu": 1
    },
    "482": {
      "BLOCK_M": 32,
      "BLOCK_N": 16,
      "BLOCK_K": 64,
      "BLOCK_C": 32,
      "NUM_KSPLIT": 4,
      "num_warps": 8,
      "num_stages": 1,
      "waves_per_eu": 2
    },
    "2220": {
      "BLOCK_M": 64,
      "BLOCK_N": 16,
      "BLOCK_K": 128,
      "BLOCK_C": 16,
      "NUM_KSPLIT": 8,
      "num_warps": 4,
      "num_stages": 1,
      "waves_per_eu": 0
    },
    "55": {
      "BLOCK_M": 32,
      "BLOCK_N": 16,
      "BLOCK_K": 32,
      "BLOCK_C": 16,
      "NUM_KSPLIT": 8,
      "num_warps": 2,
      "num_stages": 1,
      "waves_per_eu": 1
    },
    "2527": {
      "BLOCK_M": 64,
      "BLOCK_N": 16,
      "BLOCK_K": 256,
      "BLOCK_C": 16,
      "NUM_KSPLIT": 1,
      "num_warps": 4,
      "num_stages": 1,
      "waves_per_eu": 1
    },
    "5186": {
      "BLOCK_M": 256,
      "BLOCK_N": 16,
      "BLOCK_K": 128,
      "BLOCK_C": 64,
      "NUM_KSPLIT": 1,
      "num_warps": 2,
      "num_stages": 1,
      "waves_per_eu": 2
    },
    "3484": {
      "BLOCK_M": 128,
      "BLOCK_N": 16,
      "BLOCK_K": 64,
      "BLOCK_C": 128,
      "NUM_KSPLIT": 2,
      "num_warps": 4,
      "num_stages": 2,
      "waves_per_eu": 1
    },
    "2850": {
      "BLOCK_M": 64,
      "BLOCK_N": 16,
      "BLOCK_K": 256,
      "BLOCK_C": 256,
      "NUM_KSPLIT": 4,
      "num_warps": 4,
      "num_stages": 1,
      "waves_per_eu": 0
    },
    "516": {
      "BLOCK_M": 32,
      "BLOCK_N": 16,
      "BLOCK_K": 64,
      "BLOCK_C": 64,
      "NUM_KSPLIT": 1,
      "num_warps": 8,
      "num_stages": 1,
      "waves_per_eu": 0
    },
    "1461": {
      "BLOCK_M": 64,
      "BLOCK_N": 16,
      "BLOCK_K": 32,
      "BLOCK_C": 16,
      "NUM_KSPLIT": 2,
      "num_warps": 2,
      "num_stages": 2,
      "waves_per_eu": 0
    },
    "1157": {
      "BLOCK_M": 32,
      "BLOCK_N": 16,
      "BLOCK_K": 256,
      "BLOCK_C": 32,
      "NUM_KSPLIT": 1,
      "num_warps": 2,
      "num_stages": 2,
      "waves_per_eu": 2
    },
    "4511": {
      "BLOCK_M": 256,
      "BLOCK_N": 16,
      "BLOCK_K": 32,
      "BLOCK_C": 64,
      "NUM_KSPLIT": 4,
      "num_warps": 4,
      "num_stages": 2,
      "waves_per_eu": 2
    },
    "3322": {
      "BLOCK_M": 128,
      "BLOCK_N": 16,
      "BLOCK_K": 64,
      "BLOCK_C": 32,
      "NUM_KSPLIT": 1,
      "num_warps": 4,
      "num_stages": 2,
      "waves_per_eu": 1
    },
    "4785": {
      "BLOCK_M": 256,
      "BLOCK_N": 16,
      "BLOCK_K": 64,
      "BLOCK_C": 32,
      "NUM_KSPLIT": 2,
      "num_warps": 8,
      "num_stages": 2,
      "waves_per_eu": 0
    },
    "1632": {
      "BLOCK_M": 64,
      "BLOCK_N": 16,
      "BLOCK_K": 32,
      "BLOCK_C": 64,
      "NUM_KSPLIT": 4,
      "num_warps": 8,
      "num_stages": 1,
      "waves_per_eu": 0
    },
    "2903": {
      "BLOCK_M": 128,
      "BLOCK_N": 16,
      "BLOCK_K": 32,
      "BLOCK_C": 16,
      "NUM_KSPLIT": 2,
      "num_warps": 2,
      "num_stages": 2,
      "waves_per_eu": 2
    },
    "1816": {
      "BLOCK_M": 64,
      "BLOCK_N": 16,
      "BLOCK_K": 64,
      "BLOCK_C": 16,
      "NUM_KSPLIT": 1,
      "num_warps": 8,
      "num_stages": 2,
      "waves_per_eu": 1
    },
    "3367": {
      "BLOCK_M": 128,
      "BLOCK_N": 16,
      "BLOCK_K": 64,
      "BLOCK_C": 32,
      "NUM_KSPLIT": 8,
      "num_warps": 2,
      "num_stages": 1,
      "waves_per_eu": 1
    },
    "4354": {
      "BLOCK_M": 256,
      "BLOCK_N": 16,
      "BLOCK_K": 32,
      "BLOCK_C": 16,
      "NUM_KSPLIT": 2,
      "num_warps": 8,
      "num_stages": 2,
      "waves_per_eu": 1
    },
    "3273": {
      "BLOCK_M": 128,
      "BLOCK_N": 16,
      "BLOCK_K": 64,
      "BLOCK_C": 16,
      "NUM_KSPLIT": 2,
      "num_warps": 8,
      "num_stages": 2,
      "waves_per_eu": 0
    },
    "4465": {
      "BLOCK_M": 256,
      "BLOCK_N": 16,
      "BLOCK_K": 32,
      "BLOCK_C": 64,
      "NUM_KSPLIT": 1,
      "num_warps": 2,
      "num_stages": 1,
      "waves_per_eu": 1
    },
    "4162": {
      "BLOCK_M": 128,
      "BLOCK_N": 16,
      "BLOCK_K": 256,
      "BLOCK_C": 64,
      "NUM_KSPLIT": 8,
      "num_warps": 2,
      "num_stages": 2,
      "waves_per_eu": 1
    },
    "1209": {
      "BLOCK_M": 32,
      "BLOCK_N": 16,
      "BLOCK_K": 256,
      "BLOCK_C": 32,
      "NUM_KSPLIT": 8,
      "num_warps": 2,
      "num_stages": 2,
      "waves_per_eu": 0
    },
    "275": {
      "BLOCK_M": 32,
      "BLOCK_N": 16,
      "BLOCK_K": 32,
      "BLOCK_C": 128,
      "NUM_KSPLIT": 8,
      "num_warps": 2,
      "num_stages": 2,
      "waves_per_eu": 2
    },
    "1220": {
      "BLOCK_M": 32,
      "BLOCK_N": 16,
      "BLOCK_K": 256,
      "BLOCK_C": 32,
      "NUM_KSPLIT": 8,
      "num_warps": 8,
      "num_stages": 1,
      "waves_per_eu": 2
    },
    "2365": {
      "BLOCK_M": 64,
      "BLOCK_N": 16,
      "BLOCK_K": 128,
      "BLOCK_C": 64,
      "NUM_KSPLIT": 8,
      "num_warps": 4,
      "num_stages": 1,
      "waves_per_eu": 1
    },
    "1108": {
      "BLOCK_M": 32,
      "BLOCK_N": 16,
      "BLOCK_K": 256,
      "BLOCK_C": 16,
      "NUM_KSPLIT": 2,
      "num_warps": 4,
      "num_stages": 2,
      "waves_per_eu": 1
    },
    "1558": {
      "BLOCK_M": 64,
      "BLOCK_N": 16,
      "BLOCK_K": 32,
      "BLOCK_C": 32,
      "NUM_KSPLIT": 4,
      "num_warps": 4,
      "num_stages": 2,
      "waves_per_eu": 1
    },
    "4246": {
      "BLOCK_M": 128,
      "BLOCK_N": 16,
      "BLOCK_K": 256,
      "BLOCK_C": 128,
      "NUM_KSPLIT": 8,
      "num_warps": 8,
      "num_stages": 2,
      "waves_per_eu": 1
    },
    "2808": {
      "BLOCK_M": 64,
      "BLOCK_N": 16,
      "BLOCK_K": 256,
      "BLOCK_C": 256,
      "NUM_KSPLIT": 1,
      "num_warps": 2,
      "num_stages": 1,
      "waves_per_eu": 0
    },
    "2299": {
      "BLOCK_M": 64,
      "BLOCK_N": 16,
      "BLOCK_K": 128,
      "BLOCK_C": 32,
      "NUM_KSPLIT": 8,
      "num_warps": 8,
      "num_stages": 1,
      "waves_per_eu": 1
    },
    "5337": {
      "BLOCK_M": 256,
      "BLOCK_N": 16,
      "BLOCK_K": 128,
      "BLOCK_C": 256,
      "NUM_KSPLIT": 1,
      "num_warps": 4,
      "num_stages": 2,
      "waves_per_eu": 0
    },
    "1409": {
      "BLOCK_M": 32,
      "BLOCK_N": 16,
      "BLOCK_K": 256,
      "BLOCK_C": 256,
      "NUM_KSPLIT": 4,
      "num_warps": 2,
      "num_stages": 2,
      "waves_per_eu": 2
    },
    "1596": {
      "BLOCK_M": 64,
      "BLOCK_N": 16,
      "BLOCK_K": 32,
      "BLOCK_C": 64,
      "NUM_KSPLIT": 1,
      "num_warps": 8,
      "num_stages": 1,
      "waves_per_eu": 0
    },
    "4722": {
      "BLOCK_M": 256,
      "BLOCK_N": 16,
      "BLOCK_K": 64,
      "BLOCK_C": 16,
      "NUM_KSPLIT": 4,
      "num_warps": 4,
      "num_stages": 1,
      "waves_per_eu": 0
    },
    "4445": {
      "BLOCK_M": 256,
      "BLOCK_N": 16,
      "BLOCK_K": 32,
      "BLOCK_C": 32,
      "NUM_KSPLIT": 4,
      "num_warps": 8,
      "num_stages": 2,
      "waves_per_eu": 2
    },
    "3467": {
      "BLOCK_M": 128,
      "BLOCK_N": 16,
      "BLOCK_K": 64,
      "BLOCK_C": 128,
      "NUM_KSPLIT": 1,
      "num_warps": 4,
      "num_stages": 2,
      "waves_per_eu": 2
    },
    "467": {
      "BLOCK_M": 32,
      "BLOCK_N": 16,
      "BLOCK_K": 64,
      "BLOCK_C": 32,
      "NUM_KSPLIT": 2,
      "num_warps": 8,
      "num_stages": 2,
      "waves_per_eu": 2
    },
    "5330": {
      "BLOCK_M": 256,
      "BLOCK_N": 16,
      "BLOCK_K": 128,
      "BLOCK_C": 256,
      "NUM_KSPLIT": 1,
      "num_warps": 2,
      "num_stages": 1,
      "waves_per_eu": 2
    },
    "3331": {
      "BLOCK_M": 128,
      "BLOCK_N": 16,
      "BLOCK_K": 64,
      "BLOCK_C": 32,
      "NUM_KSPLIT": 2,
      "num_warps": 2,
      "num_stages": 1,
      "waves_per_eu": 1
    },
    "3314": {
      "BLOCK_M": 128,
      "BLOCK_N": 16,
      "BLOCK_K": 64,
      "BLOCK_C": 32,
      "NUM_KSPLIT": 1,
      "num_warps": 2,
      "num_stages": 1,
      "waves_per_eu": 2
    },
    "4969": {
      "BLOCK_M": 256,
      "BLOCK_N": 16,
      "BLOCK_K": 64,
      "BLOCK_C": 256,
      "NUM_KSPLIT": 1,
      "num_warps": 2,
      "num_stages": 1,
      "waves_per_eu": 1
    },
    "4066": {
      "BLOCK_M": 128,
      "BLOCK_N": 16,
      "BLOCK_K": 256,
      "BLOCK_C": 32,
      "NUM_KSPLIT": 2,
      "num_warps": 8,
      "num_stages": 2,
      "waves_per_eu": 1
    },
    "605": {
      "BLOCK_M": 32,
      "BLOCK_N": 16,
      "BLOCK_K": 64,
      "BLOCK_C": 128,
      "NUM_KSPLIT": 2,
      "num_warps": 4,
      "num_stages": 2,
      "waves_per_eu": 2
    },
    "3221": {
      "BLOCK_M": 128,
      "BLOCK_N": 16,
      "BLOCK_K": 32,
      "BLOCK_C": 256,
      "NUM_KSPLIT": 4,
      "num_warps": 8,
      "num_stages": 2,
      "waves_per_eu": 2
    },
    "4100": {
      "BLOCK_M": 128,
      "BLOCK_N": 16,
      "BLOCK_K": 256,
      "BLOCK_C": 32,
      "NUM_KSPLIT": 8,
      "num_warps": 8,
      "num_stages": 1,
      "waves_per_eu": 2
    },
    "5219": {
      "BLOCK_M": 256,
      "BLOCK_N": 16,
      "BLOCK_K": 128,
      "BLOCK_C": 64,
      "NUM_KSPLIT": 2,
      "num_warps": 8,
      "num_stages": 2,
      "waves_per_eu": 2
    },
    "3978": {
      "BLOCK_M": 128,
      "BLOCK_N": 16,
      "BLOCK_K": 256,
      "BLOCK_C": 16,
      "NUM_KSPLIT": 2,
      "num_warps": 2,
      "num_stages": 1,
      "waves_per_eu": 0
    },
    "2368": {
      "BLOCK_M": 64,
      "BLOCK_N": 16,
      "BLOCK_K": 128,
      "BLOCK_C": 64,
      "NUM_KSPLIT": 8,
      "num_warps": 4,
      "num_stages": 2,
      "waves_per_eu": 1
    },
    "3392": {
      "BLOCK_M": 128,
      "BLOCK_N": 16,
      "BLOCK_K": 64,
      "BLOCK_C": 64,
      "NUM_KSPLIT": 1,
      "num_warps": 4,
      "num_stages": 1,
      "waves_per_eu": 2
    },
    "331": {
      "BLOCK_M": 32,
      "BLOCK_N": 16,
      "BLOCK_K": 32,
      "BLOCK_C": 256,
      "NUM_KSPLIT": 4,
      "num_warps": 4,
      "num_stages": 1,
      "waves_per_eu": 1
    },
    "3402": {
      "BLOCK_M": 128,
      "BLOCK_N": 16,
      "BLOCK_K": 64,
      "BLOCK_C": 64,
      "NUM_KSPLIT": 2,
      "num_warps": 2,
      "num_stages": 1,
      "waves_per_eu": 0
    },
    "193": {
      "BLOCK_M": 32,
      "BLOCK_N": 16,
      "BLOCK_K": 32,
      "BLOCK_C": 64,
      "NUM_KSPLIT": 4,
      "num_warps": 8,
      "num_stages": 1,
      "waves_per_eu": 1
    },
    "3026": {
      "BLOCK_M": 128,
      "BLOCK_N": 16,
      "BLOCK_K": 32,
      "BLOCK_C": 64,
      "NUM_KSPLIT": 1,
      "num_warps": 2,
      "num_stages": 1,
      "waves_per_eu": 2
    },
    "1798": {
      "BLOCK_M": 64,
      "BLOCK_N": 16,
      "BLOCK_K": 32,
      "BLOCK_C": 256,
      "NUM_KSPLIT": 8,
      "num_warps": 8,
      "num_stages": 2,
      "waves_per_eu": 1
    },
    "5712": {
      "BLOCK_M": 256,
      "BLOCK_N": 16,
      "BLOCK_K": 256,
      "BLOCK_C": 256,
      "NUM_KSPLIT": 2,
      "num_warps": 4,
      "num_stages": 1,
      "waves_per_eu": 0
    },
    "2097": {
      "BLOCK_M": 64,
      "BLOCK_N": 16,
      "BLOCK_K": 64,
      "BLOCK_C": 256,
      "NUM_KSPLIT": 1,
      "num_warps": 4,
      "num_stages": 2,
      "waves_per_eu": 0
    },
    "409": {
      "BLOCK_M": 32,
      "BLOCK_N": 16,
      "BLOCK_K": 64,
      "BLOCK_C": 16,
      "NUM_KSPLIT": 4,
      "num_warps": 8,
      "num_stages": 1,
      "waves_per_eu": 1
    },
    "1263": {
      "BLOCK_M": 32,
      "BLOCK_N": 16,
      "BLOCK_K": 256,
      "BLOCK_C": 64,
      "NUM_KSPLIT": 4,
      "num_warps": 2,
      "num_stages": 2,
      "waves_per_eu": 0
    },
    "1877": {
      "BLOCK_M": 64,
      "BLOCK_N": 16,
      "BLOCK_K": 64,
      "BLOCK_C": 32,
      "NUM_KSPLIT": 1,
      "num_warps": 2,
      "num_stages": 2,
      "waves_per_eu": 2
    },
    "1359": {
      "BLOCK_M": 32,
      "BLOCK_N": 16,
      "BLOCK_K": 256,
      "BLOCK_C": 128,
      "NUM_KSPLIT": 8,
      "num_warps": 4,
      "num_stages": 2,
      "waves_per_eu": 0
    },
    "2894": {
      "BLOCK_M": 128,
      "BLOCK_N": 16,
      "BLOCK_K": 32,
      "BLOCK_C": 16,
      "NUM_KSPLIT": 1,
      "num_warps": 8,
      "num_stages": 1,
      "waves_per_eu": 2
    },
    "3413": {
      "BLOCK_M": 128,
      "BLOCK_N": 16,
      "BLOCK_K": 64,
      "BLOCK_C": 64,
      "NUM_KSPLIT": 2,
      "num_warps": 4,
      "num_stages": 2,
      "waves_per_eu": 2
    },
    "3584": {
      "BLOCK_M": 128,
      "BLOCK_N": 16,
      "BLOCK_K": 64,
      "BLOCK_C": 256,
      "NUM_KSPLIT": 8,
      "num_warps": 2,
      "num_stages": 1,
      "waves_per_eu": 2
    },
    "1288": {
      "BLOCK_M": 32,
      "BLOCK_N": 16,
      "BLOCK_K": 256,
      "BLOCK_C": 64,
      "NUM_KSPLIT": 8,
      "num_warps": 4,
      "num_stages": 2,
      "waves_per_eu": 1
    },
    "5068": {
      "BLOCK_M": 256,
      "BLOCK_N": 16,
      "BLOCK_K": 128,
      "BLOCK_C": 16,
      "NUM_KSPLIT": 2,
      "num_warps": 4,
      "num_stages": 2,
      "waves_per_eu": 1
    },
    "1546": {
      "BLOCK_M": 64,
      "BLOCK_N": 16,
      "BLOCK_K": 32,
      "BLOCK_C": 32,
      "NUM_KSPLIT": 2,
      "num_warps": 8,
      "num_stages": 2,
      "waves_per_eu": 1
    },
    "1936": {
      "BLOCK_M": 64,
      "BLOCK_N": 16,
      "BLOCK_K": 64,
      "BLOCK_C": 32,
      "NUM_KSPLIT": 8,
      "num_warps": 4,
      "num_stages": 2,
      "waves_per_eu": 1
    },
    "3793": {
      "BLOCK_M": 128,
      "BLOCK_N": 16,
      "BLOCK_K": 128,
      "BLOCK_C": 64,
      "NUM_KSPLIT": 4,
      "num_warps": 8,
      "num_stages": 1,
      "waves_per_eu": 1
    },
    "1245": {
      "BLOCK_M": 32,
      "BLOCK_N": 16,
      "BLOCK_K": 256,
      "BLOCK_C": 64,
      "NUM_KSPLIT": 2,
      "num_warps": 2,
      "num_stages": 2,
      "waves_per_eu": 0
    },
    "1717": {
      "BLOCK_M": 64,
      "BLOCK_N": 16,
      "BLOCK_K": 32,
      "BLOCK_C": 128,
      "NUM_KSPLIT": 8,
      "num_warps": 4,
      "num_stages": 1,
      "waves_per_eu": 1
    },
    "3686": {
      "BLOCK_M": 128,
      "BLOCK_N": 16,
      "BLOCK_K": 128,
      "BLOCK_C": 32,
      "NUM_KSPLIT": 1,
      "num_warps": 8,
      "num_stages": 1,
      "waves_per_eu": 2
    },
    "1970": {
      "BLOCK_M": 64,
      "BLOCK_N": 16,
      "BLOCK_K": 64,
      "BLOCK_C": 64,
      "NUM_KSPLIT": 2,
      "num_warps": 4,
      "num_stages": 1,
      "waves_per_eu": 2
    },
    "3338": {
      "BLOCK_M": 128,
      "BLOCK_N": 16,
      "BLOCK_K": 64,
      "BLOCK_C": 32,
      "NUM_KSPLIT": 2,
      "num_warps": 4,
      "num_stages": 1,
      "waves_per_eu": 2
    },
    "4724": {
      "BLOCK_M": 256,
      "BLOCK_N": 16,
      "BLOCK_K": 64,
      "BLOCK_C": 16,
      "NUM_KSPLIT": 4,
      "num_warps": 4,
      "num_stages": 1,
      "waves_per_eu": 2
    },
    "3815": {
      "BLOCK_M": 128,
      "BLOCK_N": 16,
      "BLOCK_K": 128,
      "BLOCK_C": 64,
      "NUM_KSPLIT": 8,
      "num_warps": 8,
      "num_stages": 2,
      "waves_per_eu": 2
    },
    "4917": {
      "BLOCK_M": 256,
      "BLOCK_N": 16,
      "BLOCK_K": 64,
      "BLOCK_C": 128,
      "NUM_KSPLIT": 2,
      "num_warps": 2,
      "num_stages": 2,
      "waves_per_eu": 0
    },
    "805": {
      "BLOCK_M": 32,
      "BLOCK_N": 16,
      "BLOCK_K": 128,
      "BLOCK_C": 32,
      "NUM_KSPLIT": 1,
      "num_warps": 8,
      "num_stages": 1,
      "waves_per_eu": 1
    },
    "2766": {
      "BLOCK_M": 64,
      "BLOCK_N": 16,
      "BLOCK_K": 256,
      "BLOCK_C": 128,
      "NUM_KSPLIT": 2,
      "num_warps": 8,
      "num_stages": 1,
      "waves_per_eu": 0
    },
    "854": {
      "BLOCK_M": 32,
      "BLOCK_N": 16,
      "BLOCK_K": 128,
      "BLOCK_C": 32,
      "NUM_KSPLIT": 8,
      "num_warps": 4,
      "num_stages": 1,
      "waves_per_eu": 2
    },
    "1003": {
      "BLOCK_M": 32,
      "BLOCK_N": 16,
      "BLOCK_K": 128,
      "BLOCK_C": 128,
      "NUM_KSPLIT": 8,
      "num_warps": 8,
      "num_stages": 1,
      "waves_per_eu": 1
    },
    "2394": {
      "BLOCK_M": 64,
      "BLOCK_N": 16,
      "BLOCK_K": 128,
      "BLOCK_C": 128,
      "NUM_KSPLIT": 2,
      "num_warps": 2,
      "num_stages": 1,
      "waves_per_eu": 0
    },
    "3183": {
      "BLOCK_M": 128,
      "BLOCK_N": 16,
      "BLOCK_K": 32,
      "BLOCK_C": 256,
      "NUM_KSPLIT": 1,
      "num_warps": 8,
      "num_stages": 2,
      "waves_per_eu": 0
    },
    "930": {
      "BLOCK_M": 32,
      "BLOCK_N": 16,
      "BLOCK_K": 128,
      "BLOCK_C": 64,
      "NUM_KSPLIT": 8,
      "num_warps": 8,
      "num_stages": 1,
      "waves_per_eu": 0
    },
    "5090": {
      "BLOCK_M": 256,
      "BLOCK_N": 16,
      "BLOCK_K": 128,
      "BLOCK_C": 16,
      "NUM_KSPLIT": 4,
      "num_warps": 8,
      "num_stages": 1,
      "waves_per_eu": 2
    },
    "3292": {
      "BLOCK_M": 128,
      "BLOCK_N": 16,
      "BLOCK_K": 64,
      "BLOCK_C": 16,
      "NUM_KSPLIT": 4,
      "num_warps": 8,
      "num_stages": 2,
      "waves_per_eu": 1
    },
    "735": {
      "BLOCK_M": 32,
      "BLOCK_N": 16,
      "BLOCK_K": 128,
      "BLOCK_C": 16,
      "NUM_KSPLIT": 1,
      "num_warps": 8,
      "num_stages": 2,
      "waves_per_eu": 0
    },
    "1135": {
      "BLOCK_M": 32,
      "BLOCK_N": 16,
      "BLOCK_K": 256,
      "BLOCK_C": 16,
      "NUM_KSPLIT": 8,
      "num_warps": 2,
      "num_stages": 1,
      "waves_per_eu": 1
    },
    "1213": {
      "BLOCK_M": 32,
      "BLOCK_N": 16,
      "BLOCK_K": 256,
      "BLOCK_C": 32,
      "NUM_KSPLIT": 8,
      "num_warps": 4,
      "num_stages": 1,
      "waves_per_eu": 1
    },
    "3548": {
      "BLOCK_M": 128,
      "BLOCK_N": 16,
      "BLOCK_K": 64,
      "BLOCK_C": 256,
      "NUM_KSPLIT": 2,
      "num_warps": 2,
      "num_stages": 1,
      "waves_per_eu": 2
    },
    "2797": {
      "BLOCK_M": 64,
      "BLOCK_N": 16,
      "BLOCK_K": 256,
      "BLOCK_C": 128,
      "NUM_KSPLIT": 8,
      "num_warps": 4,
      "num_stages": 1,
      "waves_per_eu": 1
    },
    "3640": {
      "BLOCK_M": 128,
      "BLOCK_N": 16,
      "BLOCK_K": 128,
      "BLOCK_C": 16,
      "NUM_KSPLIT": 4,
      "num_warps": 2,
      "num_stages": 2,
      "waves_per_eu": 1
    },
    "460": {
      "BLOCK_M": 32,
      "BLOCK_N": 16,
      "BLOCK_K": 64,
      "BLOCK_C": 32,
      "NUM_KSPLIT": 2,
      "num_warps": 4,
      "num_stages": 2,
      "waves_per_eu": 1
    },
    "204": {
      "BLOCK_M": 32,
      "BLOCK_N": 16,
      "BLOCK_K": 32,
      "BLOCK_C": 64,
      "NUM_KSPLIT": 8,
      "num_warps": 4,
      "num_stages": 1,
      "waves_per_eu": 0
    },
    "236": {
      "BLOCK_M": 32,
      "BLOCK_N": 16,
      "BLOCK_K": 32,
      "BLOCK_C": 128,
      "NUM_KSPLIT": 2,
      "num_warps": 2,
      "num_stages": 1,
      "waves_per_eu": 2
    },
    "20": {
      "BLOCK_M": 32,
      "BLOCK_N": 16,
      "BLOCK_K": 32,
      "BLOCK_C": 16,
      "NUM_KSPLIT": 2,
      "num_warps": 2,
      "num_stages": 1,
      "waves_per_eu": 2
    },
    "5434": {
      "BLOCK_M": 256,
      "BLOCK_N": 16,
      "BLOCK_K": 256,
      "BLOCK_C": 16,
      "NUM_KSPLIT": 2,
      "num_warps": 8,
      "num_stages": 2,
      "waves_per_eu": 1
    },
    "1791": {
      "BLOCK_M": 64,
      "BLOCK_N": 16,
      "BLOCK_K": 32,
      "BLOCK_C": 256,
      "NUM_KSPLIT": 8,
      "num_warps": 4,
      "num_stages": 2,
      "waves_per_eu": 0
    },
    "4706": {
      "BLOCK_M": 256,
      "BLOCK_N": 16,
      "BLOCK_K": 64,
      "BLOCK_C": 16,
      "NUM_KSPLIT": 2,
      "num_warps": 4,
      "num_stages": 1,
      "waves_per_eu": 2
    },
    "5113": {
      "BLOCK_M": 256,
      "BLOCK_N": 16,
      "BLOCK_K": 128,
      "BLOCK_C": 32,
      "NUM_KSPLIT": 1,
      "num_warps": 2,
      "num_stages": 1,
      "waves_per_eu": 1
    },
    "1300": {
      "BLOCK_M": 32,
      "BLOCK_N": 16,
      "BLOCK_K": 256,
      "BLOCK_C": 128,
      "NUM_KSPLIT": 1,
      "num_warps": 2,
      "num_stages": 2,
      "waves_per_eu": 1
    },
    "76": {
      "BLOCK_M": 32,
      "BLOCK_N": 16,
      "BLOCK_K": 32,
      "BLOCK_C": 32,
      "NUM_KSPLIT": 1,
      "num_warps": 2,
      "num_stages": 2,
      "waves_per_eu": 1
    },
    "4804": {
      "BLOCK_M": 256,
      "BLOCK_N": 16,
      "BLOCK_K": 64,
      "BLOCK_C": 32,
      "NUM_KSPLIT": 4,
      "num_warps": 8,
      "num_stages": 2,
      "waves_per_eu": 1
    },
    "3425": {
      "BLOCK_M": 128,
      "BLOCK_N": 16,
      "BLOCK_K": 64,
      "BLOCK_C": 64,
      "NUM_KSPLIT": 4,
      "num_warps": 2,
      "num_stages": 2,
      "waves_per_eu": 2
    },
    "266": {
      "BLOCK_M": 32,
      "BLOCK_N": 16,
      "BLOCK_K": 32,
      "BLOCK_C": 128,
      "NUM_KSPLIT": 4,
      "num_warps": 8,
      "num_stages": 1,
      "waves_per_eu": 2
    },
    "2400": {
      "BLOCK_M": 64,
      "BLOCK_N": 16,
      "BLOCK_K": 128,
      "BLOCK_C": 128,
      "NUM_KSPLIT": 2,
      "num_warps": 4,
      "num_stages": 1,
      "waves_per_eu": 0
    },
    "3855": {
      "BLOCK_M": 128,
      "BLOCK_N": 16,
      "BLOCK_K": 128,
      "BLOCK_C": 128,
      "NUM_KSPLIT": 4,
      "num_warps": 2,
      "num_stages": 2,
      "waves_per_eu": 0
    },
    "3722": {
      "BLOCK_M": 128,
      "BLOCK_N": 16,
      "BLOCK_K": 128,
      "BLOCK_C": 32,
      "NUM_KSPLIT": 4,
      "num_warps": 8,
      "num_stages": 1,
      "waves_per_eu": 2
    },
    "3466": {
      "BLOCK_M": 128,
      "BLOCK_N": 16,
      "BLOCK_K": 64,
      "BLOCK_C": 128,
      "NUM_KSPLIT": 1,
      "num_warps": 4,
      "num_stages": 2,
      "waves_per_eu": 1
    },
    "998": {
      "BLOCK_M": 32,
      "BLOCK_N": 16,
      "BLOCK_K": 128,
      "BLOCK_C": 128,
      "NUM_KSPLIT": 8,
      "num_warps": 4,
      "num_stages": 1,
      "waves_per_eu": 2
    },
    "4329": {
      "BLOCK_M": 256,
      "BLOCK_N": 16,
      "BLOCK_K": 32,
      "BLOCK_C": 16,
      "NUM_KSPLIT": 1,
      "num_warps": 4,
      "num_stages": 2,
      "waves_per_eu": 0
    },
    "2548": {
      "BLOCK_M": 64,
      "BLOCK_N": 16,
      "BLOCK_K": 256,
      "BLOCK_C": 16,
      "NUM_KSPLIT": 2,
      "num_warps": 4,
      "num_stages": 2,
      "waves_per_eu": 1
    },
    "5533": {
      "BLOCK_M": 256,
      "BLOCK_N": 16,
      "BLOCK_K": 256,
      "BLOCK_C": 32,
      "NUM_KSPLIT": 8,
      "num_warps": 4,
      "num_stages": 1,
      "waves_per_eu": 1
    },
    "1912": {
      "BLOCK_M": 64,
      "BLOCK_N": 16,
      "BLOCK_K": 64,
      "BLOCK_C": 32,
      "NUM_KSPLIT": 4,
      "num_warps": 2,
      "num_stages": 2,
      "waves_per_eu": 1
    },
    "2074": {
      "BLOCK_M": 64,
      "BLOCK_N": 16,
      "BLOCK_K": 64,
      "BLOCK_C": 128,
      "NUM_KSPLIT": 8,
      "num_warps": 2,
      "num_stages": 2,
      "waves_per_eu": 1
    },
    "3212": {
      "BLOCK_M": 128,
      "BLOCK_N": 16,
      "BLOCK_K": 32,
      "BLOCK_C": 256,
      "NUM_KSPLIT": 4,
      "num_warps": 4,
      "num_stages": 1,
      "waves_per_eu": 2
    },
    "3265": {
      "BLOCK_M": 128,
      "BLOCK_N": 16,
      "BLOCK_K": 64,
      "BLOCK_C": 16,
      "NUM_KSPLIT": 2,
      "num_warps": 4,
      "num_stages": 1,
      "waves_per_eu": 1
    },
    "2918": {
      "BLOCK_M": 128,
      "BLOCK_N": 16,
      "BLOCK_K": 32,
      "BLOCK_C": 16,
      "NUM_KSPLIT": 4,
      "num_warps": 2,
      "num_stages": 1,
      "waves_per_eu": 2
    },
    "783": {
      "BLOCK_M": 32,
      "BLOCK_N": 16,
      "BLOCK_K": 128,
      "BLOCK_C": 16,
      "NUM_KSPLIT": 8,
      "num_warps": 4,
      "num_stages": 2,
      "waves_per_eu": 0
    },
    "2890": {
      "BLOCK_M": 128,
      "BLOCK_N": 16,
      "BLOCK_K": 32,
      "BLOCK_C": 16,
      "NUM_KSPLIT": 1,
      "num_warps": 4,
      "num_stages": 2,
      "waves_per_eu": 1
    },
    "1780": {
      "BLOCK_M": 64,
      "BLOCK_N": 16,
      "BLOCK_K": 32,
      "BLOCK_C": 256,
      "NUM_KSPLIT": 4,
      "num_warps": 8,
      "num_stages": 2,
      "waves_per_eu": 1
    },
    "5542": {
      "BLOCK_M": 256,
      "BLOCK_N": 16,
      "BLOCK_K": 256,
      "BLOCK_C": 32,
      "NUM_KSPLIT": 8,
      "num_warps": 8,
      "num_stages": 2,
      "waves_per_eu": 1
    },
    "1520": {
      "BLOCK_M": 64,
      "BLOCK_N": 16,
      "BLOCK_K": 32,
      "BLOCK_C": 32,
      "NUM_KSPLIT": 1,
      "num_warps": 4,
      "num_stages": 1,
      "waves_per_eu": 2
    },
    "2671": {
      "BLOCK_M": 64,
      "BLOCK_N": 16,
      "BLOCK_K": 256,
      "BLOCK_C": 64,
      "NUM_KSPLIT": 1,
      "num_warps": 4,
      "num_stages": 1,
      "waves_per_eu": 1
    },
    "1561": {
      "BLOCK_M": 64,
      "BLOCK_N": 16,
      "BLOCK_K": 32,
      "BLOCK_C": 32,
      "NUM_KSPLIT": 4,
      "num_warps": 8,
      "num_stages": 1,
      "waves_per_eu": 1
    },
    "3734": {
      "BLOCK_M": 128,
      "BLOCK_N": 16,
      "BLOCK_K": 128,
      "BLOCK_C": 32,
      "NUM_KSPLIT": 8,
      "num_warps": 4,
      "num_stages": 1,
      "waves_per_eu": 2
    },
    "4221": {
      "BLOCK_M": 128,
      "BLOCK_N": 16,
      "BLOCK_K": 256,
      "BLOCK_C": 128,
      "NUM_KSPLIT": 4,
      "num_warps": 4,
      "num_stages": 2,
      "waves_per_eu": 0
    },
    "1645": {
      "BLOCK_M": 64,
      "BLOCK_N": 16,
      "BLOCK_K": 32,
      "BLOCK_C": 64,
      "NUM_KSPLIT": 8,
      "num_warps": 4,
      "num_stages": 1,
      "waves_per_eu": 1
    },
    "1318": {
      "BLOCK_M": 32,
      "BLOCK_N": 16,
      "BLOCK_K": 256,
      "BLOCK_C": 128,
      "NUM_KSPLIT": 2,
      "num_warps": 2,
      "num_stages": 2,
      "waves_per_eu": 1
    },
    "4738": {
      "BLOCK_M": 256,
      "BLOCK_N": 16,
      "BLOCK_K": 64,
      "BLOCK_C": 16,
      "NUM_KSPLIT": 8,
      "num_warps": 2,
      "num_stages": 2,
      "waves_per_eu": 1
    },
    "2516": {
      "BLOCK_M": 64,
      "BLOCK_N": 16,
      "BLOCK_K": 128,
      "BLOCK_C": 256,
      "NUM_KSPLIT": 8,
      "num_warps": 8,
      "num_stages": 1,
      "waves_per_eu": 2
    },
    "766": {
      "BLOCK_M": 32,
      "BLOCK_N": 16,
      "BLOCK_K": 128,
      "BLOCK_C": 16,
      "NUM_KSPLIT": 4,
      "num_warps": 4,
      "num_stages": 2,
      "waves_per_eu": 1
    },
    "4061": {
      "BLOCK_M": 128,
      "BLOCK_N": 16,
      "BLOCK_K": 256,
      "BLOCK_C": 32,
      "NUM_KSPLIT": 2,
      "num_warps": 4,
      "num_stages": 2,
      "waves_per_eu": 2
    },
    "3798": {
      "BLOCK_M": 128,
      "BLOCK_N": 16,
      "BLOCK_K": 128,
      "BLOCK_C": 64,
      "NUM_KSPLIT": 8,
      "num_warps": 2,
      "num_stages": 1,
      "waves_per_eu": 0
    },
    "2371": {
      "BLOCK_M": 64,
      "BLOCK_N": 16,
      "BLOCK_K": 128,
      "BLOCK_C": 64,
      "NUM_KSPLIT": 8,
      "num_warps": 8,
      "num_stages": 1,
      "waves_per_eu": 1
    },
    "4673": {
      "BLOCK_M": 256,
      "BLOCK_N": 16,
      "BLOCK_K": 32,
      "BLOCK_C": 256,
      "NUM_KSPLIT": 8,
      "num_warps": 4,
      "num_stages": 2,
      "waves_per_eu": 2
    },
    "2206": {
      "BLOCK_M": 64,
      "BLOCK_N": 16,
      "BLOCK_K": 128,
      "BLOCK_C": 16,
      "NUM_KSPLIT": 4,
      "num_warps": 4,
      "num_stages": 2,
      "waves_per_eu": 1
    },
    "1256": {
      "BLOCK_M": 32,
      "BLOCK_N": 16,
      "BLOCK_K": 256,
      "BLOCK_C": 64,
      "NUM_KSPLIT": 2,
      "num_warps": 8,
      "num_stages": 1,
      "waves_per_eu": 2
    },
    "2244": {
      "BLOCK_M": 64,
      "BLOCK_N": 16,
      "BLOCK_K": 128,
      "BLOCK_C": 32,
      "NUM_KSPLIT": 1,
      "num_warps": 8,
      "num_stages": 1,
      "waves_per_eu": 0
    },
    "3961": {
      "BLOCK_M": 128,
      "BLOCK_N": 16,
      "BLOCK_K": 256,
      "BLOCK_C": 16,
      "NUM_KSPLIT": 1,
      "num_warps": 2,
      "num_stages": 1,
      "waves_per_eu": 1
    },
    "2342": {
      "BLOCK_M": 64,
      "BLOCK_N": 16,
      "BLOCK_K": 128,
      "BLOCK_C": 64,
      "NUM_KSPLIT": 4,
      "num_warps": 2,
      "num_stages": 1,
      "waves_per_eu": 2
    },
    "3250": {
      "BLOCK_M": 128,
      "BLOCK_N": 16,
      "BLOCK_K": 64,
      "BLOCK_C": 16,
      "NUM_KSPLIT": 1,
      "num_warps": 4,
      "num_stages": 2,
      "waves_per_eu": 1
    },
    "2639": {
      "BLOCK_M": 64,
      "BLOCK_N": 16,
      "BLOCK_K": 256,
      "BLOCK_C": 32,
      "NUM_KSPLIT": 4,
      "num_warps": 4,
      "num_stages": 2,
      "waves_per_eu": 2
    },
    "468": {
      "BLOCK_M": 32,
      "BLOCK_N": 16,
      "BLOCK_K": 64,
      "BLOCK_C": 32,
      "NUM_KSPLIT": 4,
      "num_warps": 2,
      "num_stages": 1,
      "waves_per_eu": 0
    },
    "2831": {
      "BLOCK_M": 64,
      "BLOCK_N": 16,
      "BLOCK_K": 256,
      "BLOCK_C": 256,
      "NUM_KSPLIT": 2,
      "num_warps": 2,
      "num_stages": 2,
      "waves_per_eu": 2
    },
    "1446": {
      "BLOCK_M": 64,
      "BLOCK_N": 16,
      "BLOCK_K": 32,
      "BLOCK_C": 16,
      "NUM_KSPLIT": 1,
      "num_warps": 4,
      "num_stages": 1,
      "waves_per_eu": 0
    },
    "3601": {
      "BLOCK_M": 128,
      "BLOCK_N": 16,
      "BLOCK_K": 128,
      "BLOCK_C": 16,
      "NUM_KSPLIT": 1,
      "num_warps": 2,
      "num_stages": 1,
      "waves_per_eu": 1
    },
    "2584": {
      "BLOCK_M": 64,
      "BLOCK_N": 16,
      "BLOCK_K": 256,
      "BLOCK_C": 16,
      "NUM_KSPLIT": 8,
      "num_warps": 4,
      "num_stages": 2,
      "waves_per_eu": 1
    },
    "4074": {
      "BLOCK_M": 128,
      "BLOCK_N": 16,
      "BLOCK_K": 256,
      "BLOCK_C": 32,
      "NUM_KSPLIT": 4,
      "num_warps": 4,
      "num_stages": 1,
      "waves_per_eu": 0
    },
    "1487": {
      "BLOCK_M": 64,
      "BLOCK_N": 16,
      "BLOCK_K": 32,
      "BLOCK_C": 16,
      "NUM_KSPLIT": 4,
      "num_warps": 4,
      "num_stages": 2,
      "waves_per_eu": 2
    },
    "4509": {
      "BLOCK_M": 256,
      "BLOCK_N": 16,
      "BLOCK_K": 32,
      "BLOCK_C": 64,
      "NUM_KSPLIT": 4,
      "num_warps": 4,
      "num_stages": 2,
      "waves_per_eu": 0
    },
    "1232": {
      "BLOCK_M": 32,
      "BLOCK_N": 16,
      "BLOCK_K": 256,
      "BLOCK_C": 64,
      "NUM_KSPLIT": 1,
      "num_warps": 4,
      "num_stages": 1,
      "waves_per_eu": 2
    },
    "5216": {
      "BLOCK_M": 256,
      "BLOCK_N": 16,
      "BLOCK_K": 128,
      "BLOCK_C": 64,
      "NUM_KSPLIT": 2,
      "num_warps": 8,
      "num_stages": 1,
      "waves_per_eu": 2
    },
    "4441": {
      "BLOCK_M": 256,
      "BLOCK_N": 16,
      "BLOCK_K": 32,
      "BLOCK_C": 32,
      "NUM_KSPLIT": 4,
      "num_warps": 8,
      "num_stages": 1,
      "waves_per_eu": 1
    },
    "3119": {
      "BLOCK_M": 128,
      "BLOCK_N": 16,
      "BLOCK_K": 32,
      "BLOCK_C": 128,
      "NUM_KSPLIT": 2,
      "num_warps": 2,
      "num_stages": 2,
      "waves_per_eu": 2
    },
    "4240": {
      "BLOCK_M": 128,
      "BLOCK_N": 16,
      "BLOCK_K": 256,
      "BLOCK_C": 128,
      "NUM_KSPLIT": 8,
      "num_warps": 4,
      "num_stages": 2,
      "waves_per_eu": 1
    },
    "3669": {
      "BLOCK_M": 128,
      "BLOCK_N": 16,
      "BLOCK_K": 128,
      "BLOCK_C": 16,
      "NUM_KSPLIT": 8,
      "num_warps": 8,
      "num_stages": 2,
      "waves_per_eu": 0
    },
    "4646": {
      "BLOCK_M": 256,
      "BLOCK_N": 16,
      "BLOCK_K": 32,
      "BLOCK_C": 256,
      "NUM_KSPLIT": 4,
      "num_warps": 2,
      "num_stages": 1,
      "waves_per_eu": 2
    },
    "1951": {
      "BLOCK_M": 64,
      "BLOCK_N": 16,
      "BLOCK_K": 64,
      "BLOCK_C": 64,
      "NUM_KSPLIT": 1,
      "num_warps": 4,
      "num_stages": 1,
      "waves_per_eu": 1
    },
    "5297": {
      "BLOCK_M": 256,
      "BLOCK_N": 16,
      "BLOCK_K": 128,
      "BLOCK_C": 128,
      "NUM_KSPLIT": 4,
      "num_warps": 2,
      "num_stages": 2,
      "waves_per_eu": 2
    },
    "4729": {
      "BLOCK_M": 256,
      "BLOCK_N": 16,
      "BLOCK_K": 64,
      "BLOCK_C": 16,
      "NUM_KSPLIT": 4,
      "num_warps": 8,
      "num_stages": 1,
      "waves_per_eu": 1
    },
    "3217": {
      "BLOCK_M": 128,
      "BLOCK_N": 16,
      "BLOCK_K": 32,
      "BLOCK_C": 256,
      "NUM_KSPLIT": 4,
      "num_warps": 8,
      "num_stages": 1,
      "waves_per_eu": 1
    },
    "1636": {
      "BLOCK_M": 64,
      "BLOCK_N": 16,
      "BLOCK_K": 32,
      "BLOCK_C": 64,
      "NUM_KSPLIT": 4,
      "num_warps": 8,
      "num_stages": 2,
      "waves_per_eu": 1
    },
    "4404": {
      "BLOCK_M": 256,
      "BLOCK_N": 16,
      "BLOCK_K": 32,
      "BLOCK_C": 32,
      "NUM_KSPLIT": 1,
      "num_warps": 8,
      "num_stages": 1,
      "waves_per_eu": 0
    },
    "3317": {
      "BLOCK_M": 128,
      "BLOCK_N": 16,
      "BLOCK_K": 64,
      "BLOCK_C": 32,
      "NUM_KSPLIT": 1,
      "num_warps": 2,
      "num_stages": 2,
      "waves_per_eu": 2
    },
    "3078": {
      "BLOCK_M": 128,
      "BLOCK_N": 16,
      "BLOCK_K": 32,
      "BLOCK_C": 64,
      "NUM_KSPLIT": 8,
      "num_warps": 2,
      "num_stages": 1,
      "waves_per_eu": 0
    },
    "5225": {
      "BLOCK_M": 256,
      "BLOCK_N": 16,
      "BLOCK_K": 128,
      "BLOCK_C": 64,
      "NUM_KSPLIT": 4,
      "num_warps": 2,
      "num_stages": 2,
      "waves_per_eu": 2
    },
    "2326": {
      "BLOCK_M": 64,
      "BLOCK_N": 16,
      "BLOCK_K": 128,
      "BLOCK_C": 64,
      "NUM_KSPLIT": 2,
      "num_warps": 2,
      "num_stages": 2,
      "waves_per_eu": 1
    },
    "105": {
      "BLOCK_M": 32,
      "BLOCK_N": 16,
      "BLOCK_K": 32,
      "BLOCK_C": 32,
      "NUM_KSPLIT": 2,
      "num_warps": 8,
      "num_stages": 2,
      "waves_per_eu": 0
    },
    "214": {
      "BLOCK_M": 32,
      "BLOCK_N": 16,
      "BLOCK_K": 32,
      "BLOCK_C": 64,
      "NUM_KSPLIT": 8,
      "num_warps": 8,
      "num_stages": 2,
      "waves_per_eu": 1
    },
    "4452": {
      "BLOCK_M": 256,
      "BLOCK_N": 16,
      "BLOCK_K": 32,
      "BLOCK_C": 32,
      "NUM_KSPLIT": 8,
      "num_warps": 4,
      "num_stages": 1,
      "waves_per_eu": 0
    },
    "5622": {
      "BLOCK_M": 256,
      "BLOCK_N": 16,
      "BLOCK_K": 256,
      "BLOCK_C": 128,
      "NUM_KSPLIT": 1,
      "num_warps": 4,
      "num_stages": 1,
      "waves_per_eu": 0
    },
    "54": {
      "BLOCK_M": 32,
      "BLOCK_N": 16,
      "BLOCK_K": 32,
      "BLOCK_C": 16,
      "NUM_KSPLIT": 8,
      "num_warps": 2,
      "num_stages": 1,
      "waves_per_eu": 0
    },
    "137": {
      "BLOCK_M": 32,
      "BLOCK_N": 16,
      "BLOCK_K": 32,
      "BLOCK_C": 32,
      "NUM_KSPLIT": 8,
      "num_warps": 4,
      "num_stages": 2,
      "waves_per_eu": 2
    },
    "2020": {
      "BLOCK_M": 64,
      "BLOCK_N": 16,
      "BLOCK_K": 64,
      "BLOCK_C": 128,
      "NUM_KSPLIT": 1,
      "num_warps": 2,
      "num_stages": 2,
      "waves_per_eu": 1
    },
    "4446": {
      "BLOCK_M": 256,
      "BLOCK_N": 16,
      "BLOCK_K": 32,
      "BLOCK_C": 32,
      "NUM_KSPLIT": 8,
      "num_warps": 2,
      "num_stages": 1,
      "waves_per_eu": 0
    },
    "1897": {
      "BLOCK_M": 64,
      "BLOCK_N": 16,
      "BLOCK_K": 64,
      "BLOCK_C": 32,
      "NUM_KSPLIT": 2,
      "num_warps": 4,
      "num_stages": 1,
      "waves_per_eu": 1
    },
    "1774": {
      "BLOCK_M": 64,
      "BLOCK_N": 16,
      "BLOCK_K": 32,
      "BLOCK_C": 256,
      "NUM_KSPLIT": 4,
      "num_warps": 4,
      "num_stages": 2,
      "waves_per_eu": 1
    },
    "2929": {
      "BLOCK_M": 128,
      "BLOCK_N": 16,
      "BLOCK_K": 32,
      "BLOCK_C": 16,
      "NUM_KSPLIT": 4,
      "num_warps": 8,
      "num_stages": 1,
      "waves_per_eu": 1
    },
    "1276": {
      "BLOCK_M": 32,
      "BLOCK_N": 16,
      "BLOCK_K": 256,
      "BLOCK_C": 64,
      "NUM_KSPLIT": 4,
      "num_warps": 8,
      "num_stages": 2,
      "waves_per_eu": 1
    },
    "2327": {
      "BLOCK_M": 64,
      "BLOCK_N": 16,
      "BLOCK_K": 128,
      "BLOCK_C": 64,
      "NUM_KSPLIT": 2,
      "num_warps": 2,
      "num_stages": 2,
      "waves_per_eu": 2
    },
    "2213": {
      "BLOCK_M": 64,
      "BLOCK_N": 16,
      "BLOCK_K": 128,
      "BLOCK_C": 16,
      "NUM_KSPLIT": 4,
      "num_warps": 8,
      "num_stages": 2,
      "waves_per_eu": 2
    },
    "2315": {
      "BLOCK_M": 64,
      "BLOCK_N": 16,
      "BLOCK_K": 128,
      "BLOCK_C": 64,
      "NUM_KSPLIT": 1,
      "num_warps": 4,
      "num_stages": 2,
      "waves_per_eu": 2
    },
    "768": {
      "BLOCK_M": 32,
      "BLOCK_N": 16,
      "BLOCK_K": 128,
      "BLOCK_C": 16,
      "NUM_KSPLIT": 4,
      "num_warps": 8,
      "num_stages": 1,
      "waves_per_eu": 0
    },
    "3405": {
      "BLOCK_M": 128,
      "BLOCK_N": 16,
      "BLOCK_K": 64,
      "BLOCK_C": 64,
      "NUM_KSPLIT": 2,
      "num_warps": 2,
      "num_stages": 2,
      "waves_per_eu": 0
    },
    "3561": {
      "BLOCK_M": 128,
      "BLOCK_N": 16,
      "BLOCK_K": 64,
      "BLOCK_C": 256,
      "NUM_KSPLIT": 2,
      "num_warps": 8,
      "num_stages": 2,
      "waves_per_eu": 0
    },
    "5388": {
      "BLOCK_M": 256,
      "BLOCK_N": 16,
      "BLOCK_K": 128,
      "BLOCK_C": 256,
      "NUM_KSPLIT": 8,
      "num_warps": 4,
      "num_stages": 1,
      "waves_per_eu": 0
    },
    "1776": {
      "BLOCK_M": 64,
      "BLOCK_N": 16,
      "BLOCK_K": 32,
      "BLOCK_C": 256,
      "NUM_KSPLIT": 4,
      "num_warps": 8,
      "num_stages": 1,
      "waves_per_eu": 0
    },
    "416": {
      "BLOCK_M": 32,
      "BLOCK_N": 16,
      "BLOCK_K": 64,
      "BLOCK_C": 16,
      "NUM_KSPLIT": 8,
      "num_warps": 2,
      "num_stages": 1,
      "waves_per_eu": 2
    },
    "2715": {
      "BLOCK_M": 64,
      "BLOCK_N": 16,
      "BLOCK_K": 256,
      "BLOCK_C": 64,
      "NUM_KSPLIT": 4,
      "num_warps": 8,
      "num_stages": 2,
      "waves_per_eu": 0
    },
    "2105": {
      "BLOCK_M": 64,
      "BLOCK_N": 16,
      "BLOCK_K": 64,
      "BLOCK_C": 256,
      "NUM_KSPLIT": 1,
      "num_warps": 8,
      "num_stages": 2,
      "waves_per_eu": 2
    },
    "443": {
      "BLOCK_M": 32,
      "BLOCK_N": 16,
      "BLOCK_K": 64,
      "BLOCK_C": 32,
      "NUM_KSPLIT": 1,
      "num_warps": 4,
      "num_stages": 2,
      "waves_per_eu": 2
    },
    "3566": {
      "BLOCK_M": 128,
      "BLOCK_N": 16,
      "BLOCK_K": 64,
      "BLOCK_C": 256,
      "NUM_KSPLIT": 4,
      "num_warps": 2,
      "num_stages": 1,
      "waves_per_eu": 2
    },
    "5446": {
      "BLOCK_M": 256,
      "BLOCK_N": 16,
      "BLOCK_K": 256,
      "BLOCK_C": 16,
      "NUM_KSPLIT": 4,
      "num_warps": 4,
      "num_stages": 2,
      "waves_per_eu": 1
    },
    "1605": {
      "BLOCK_M": 64,
      "BLOCK_N": 16,
      "BLOCK_K": 32,
      "BLOCK_C": 64,
      "NUM_KSPLIT": 2,
      "num_warps": 2,
      "num_stages": 2,
      "waves_per_eu": 0
    },
    "2325": {
      "BLOCK_M": 64,
      "BLOCK_N": 16,
      "BLOCK_K": 128,
      "BLOCK_C": 64,
      "NUM_KSPLIT": 2,
      "num_warps": 2,
      "num_stages": 2,
      "waves_per_eu": 0
    },
    "118": {
      "BLOCK_M": 32,
      "BLOCK_N": 16,
      "BLOCK_K": 32,
      "BLOCK_C": 32,
      "NUM_KSPLIT": 4,
      "num_warps": 4,
      "num_stages": 2,
      "waves_per_eu": 1
    },
    "2032": {
      "BLOCK_M": 64,
      "BLOCK_N": 16,
      "BLOCK_K": 64,
      "BLOCK_C": 128,
      "NUM_KSPLIT": 1,
      "num_warps": 8,
      "num_stages": 2,
      "waves_per_eu": 1
    },
    "1407": {
      "BLOCK_M": 32,
      "BLOCK_N": 16,
      "BLOCK_K": 256,
      "BLOCK_C": 256,
      "NUM_KSPLIT": 4,
      "num_warps": 2,
      "num_stages": 2,
      "waves_per_eu": 0
    },
    "2429": {
      "BLOCK_M": 64,
      "BLOCK_N": 16,
      "BLOCK_K": 128,
      "BLOCK_C": 128,
      "NUM_KSPLIT": 4,
      "num_warps": 8,
      "num_stages": 2,
      "waves_per_eu": 2
    },
    "1505": {
      "BLOCK_M": 64,
      "BLOCK_N": 16,
      "BLOCK_K": 32,
      "BLOCK_C": 16,
      "NUM_KSPLIT": 8,
      "num_warps": 4,
      "num_stages": 2,
      "waves_per_eu": 2
    },
    "1759": {
      "BLOCK_M": 64,
      "BLOCK_N": 16,
      "BLOCK_K": 32,
      "BLOCK_C": 256,
      "NUM_KSPLIT": 2,
      "num_warps": 8,
      "num_stages": 1,
      "waves_per_eu": 1
    },
    "172": {
      "BLOCK_M": 32,
      "BLOCK_N": 16,
      "BLOCK_K": 32,
      "BLOCK_C": 64,
      "NUM_KSPLIT": 2,
      "num_warps": 4,
      "num_stages": 2,
      "waves_per_eu": 1
    },
    "4478": {
      "BLOCK_M": 256,
      "BLOCK_N": 16,
      "BLOCK_K": 32,
      "BLOCK_C": 64,
      "NUM_KSPLIT": 1,
      "num_warps": 8,
      "num_stages": 1,
      "waves_per_eu": 2
    },
    "3511": {
      "BLOCK_M": 128,
      "BLOCK_N": 16,
      "BLOCK_K": 64,
      "BLOCK_C": 128,
      "NUM_KSPLIT": 8,
      "num_warps": 2,
      "num_stages": 1,
      "waves_per_eu": 1
    },
    "582": {
      "BLOCK_M": 32,
      "BLOCK_N": 16,
      "BLOCK_K": 64,
      "BLOCK_C": 128,
      "NUM_KSPLIT": 1,
      "num_warps": 4,
      "num_stages": 1,
      "waves_per_eu": 0
    },
    "947": {
      "BLOCK_M": 32,
      "BLOCK_N": 16,
      "BLOCK_K": 128,
      "BLOCK_C": 128,
      "NUM_KSPLIT": 1,
      "num_warps": 4,
      "num_stages": 2,
      "waves_per_eu": 2
    },
    "1932": {
      "BLOCK_M": 64,
      "BLOCK_N": 16,
      "BLOCK_K": 64,
      "BLOCK_C": 32,
      "NUM_KSPLIT": 8,
      "num_warps": 4,
      "num_stages": 1,
      "waves_per_eu": 0
    },
    "4235": {
      "BLOCK_M": 128,
      "BLOCK_N": 16,
      "BLOCK_K": 256,
      "BLOCK_C": 128,
      "NUM_KSPLIT": 8,
      "num_warps": 2,
      "num_stages": 2,
      "waves_per_eu": 2
    },
    "585": {
      "BLOCK_M": 32,
      "BLOCK_N": 16,
      "BLOCK_K": 64,
      "BLOCK_C": 128,
      "NUM_KSPLIT": 1,
      "num_warps": 4,
      "num_stages": 2,
      "waves_per_eu": 0
    },
    "205": {
      "BLOCK_M": 32,
      "BLOCK_N": 16,
      "BLOCK_K": 32,
      "BLOCK_C": 64,
      "NUM_KSPLIT": 8,
      "num_warps": 4,
      "num_stages": 1,
      "waves_per_eu": 1
    },
    "755": {
      "BLOCK_M": 32,
      "BLOCK_N": 16,
      "BLOCK_K": 128,
      "BLOCK_C": 16,
      "NUM_KSPLIT": 2,
      "num_warps": 8,
      "num_stages": 2,
      "waves_per_eu": 2
    },
    "2273": {
      "BLOCK_M": 64,
      "BLOCK_N": 16,
      "BLOCK_K": 128,
      "BLOCK_C": 32,
      "NUM_KSPLIT": 4,
      "num_warps": 2,
      "num_stages": 2,
      "waves_per_eu": 2
    },
    "5663": {
      "BLOCK_M": 256,
      "BLOCK_N": 16,
      "BLOCK_K": 256,
      "BLOCK_C": 128,
      "NUM_KSPLIT": 4,
      "num_warps": 4,
      "num_stages": 2,
      "waves_per_eu": 2
    },
    "1482": {
      "BLOCK_M": 64,
      "BLOCK_N": 16,
      "BLOCK_K": 32,
      "BLOCK_C": 16,
      "NUM_KSPLIT": 4,
      "num_warps": 4,
      "num_stages": 1,
      "waves_per_eu": 0
    },
    "5085": {
      "BLOCK_M": 256,
      "BLOCK_N": 16,
      "BLOCK_K": 128,
      "BLOCK_C": 16,
      "NUM_KSPLIT": 4,
      "num_warps": 4,
      "num_stages": 2,
      "waves_per_eu": 0
    },
    "2644": {
      "BLOCK_M": 64,
      "BLOCK_N": 16,
      "BLOCK_K": 256,
      "BLOCK_C": 32,
      "NUM_KSPLIT": 4,
      "num_warps": 8,
      "num_stages": 2,
      "waves_per_eu": 1
    },
    "4880": {
      "BLOCK_M": 256,
      "BLOCK_N": 16,
      "BLOCK_K": 64,
      "BLOCK_C": 64,
      "NUM_KSPLIT": 8,
      "num_warps": 2,
      "num_stages": 1,
      "waves_per_eu": 2
    },
    "1336": {
      "BLOCK_M": 32,
      "BLOCK_N": 16,
      "BLOCK_K": 256,
      "BLOCK_C": 128,
      "NUM_KSPLIT": 4,
      "num_warps": 2,
      "num_stages": 2,
      "waves_per_eu": 1
    },
    "4625": {
      "BLOCK_M": 256,
      "BLOCK_N": 16,
      "BLOCK_K": 32,
      "BLOCK_C": 256,
      "NUM_KSPLIT": 1,
      "num_warps": 8,
      "num_stages": 2,
      "waves_per_eu": 2
    },
    "4517": {
      "BLOCK_M": 256,
      "BLOCK_N": 16,
      "BLOCK_K": 32,
      "BLOCK_C": 64,
      "NUM_KSPLIT": 4,
      "num_warps": 8,
      "num_stages": 2,
      "waves_per_eu": 2
    },
    "1366": {
      "BLOCK_M": 32,
      "BLOCK_N": 16,
      "BLOCK_K": 256,
      "BLOCK_C": 128,
      "NUM_KSPLIT": 8,
      "num_warps": 8,
      "num_stages": 2,
      "waves_per_eu": 1
    },
    "4345": {
      "BLOCK_M": 256,
      "BLOCK_N": 16,
      "BLOCK_K": 32,
      "BLOCK_C": 16,
      "NUM_KSPLIT": 2,
      "num_warps": 4,
      "num_stages": 1,
      "waves_per_eu": 1
    },
    "2818": {
      "BLOCK_M": 64,
      "BLOCK_N": 16,
      "BLOCK_K": 256,
      "BLOCK_C": 256,
      "NUM_KSPLIT": 1,
      "num_warps": 4,
      "num_stages": 2,
      "waves_per_eu": 1
    },
    "4617": {
      "BLOCK_M": 256,
      "BLOCK_N": 16,
      "BLOCK_K": 32,
      "BLOCK_C": 256,
      "NUM_KSPLIT": 1,
      "num_warps": 4,
      "num_stages": 2,
      "waves_per_eu": 0
    },
    "5727": {
      "BLOCK_M": 256,
      "BLOCK_N": 16,
      "BLOCK_K": 256,
      "BLOCK_C": 256,
      "NUM_KSPLIT": 4,
      "num_warps": 2,
      "num_stages": 2,
      "waves_per_eu": 0
    },
    "3195": {
      "BLOCK_M": 128,
      "BLOCK_N": 16,
      "BLOCK_K": 32,
      "BLOCK_C": 256,
      "NUM_KSPLIT": 2,
      "num_warps": 4,
      "num_stages": 2,
      "waves_per_eu": 0
    },
    "5191": {
      "BLOCK_M": 256,
      "BLOCK_N": 16,
      "BLOCK_K": 128,
      "BLOCK_C": 64,
      "NUM_KSPLIT": 1,
      "num_warps": 4,
      "num_stages": 1,
      "waves_per_eu": 1
    },
    "4039": {
      "BLOCK_M": 128,
      "BLOCK_N": 16,
      "BLOCK_K": 256,
      "BLOCK_C": 32,
      "NUM_KSPLIT": 1,
      "num_warps": 4,
      "num_stages": 1,
      "waves_per_eu": 1
    },
    "5547": {
      "BLOCK_M": 256,
      "BLOCK_N": 16,
      "BLOCK_K": 256,
      "BLOCK_C": 64,
      "NUM_KSPLIT": 1,
      "num_warps": 2,
      "num_stages": 2,
      "waves_per_eu": 0
    },
    "5376": {
      "BLOCK_M": 256,
      "BLOCK_N": 16,
      "BLOCK_K": 128,
      "BLOCK_C": 256,
      "NUM_KSPLIT": 4,
      "num_warps": 8,
      "num_stages": 1,
      "waves_per_eu": 0
    },
    "1985": {
      "BLOCK_M": 64,
      "BLOCK_N": 16,
      "BLOCK_K": 64,
      "BLOCK_C": 64,
      "NUM_KSPLIT": 4,
      "num_warps": 2,
      "num_stages": 2,
      "waves_per_eu": 2
    },
    "1890": {
      "BLOCK_M": 64,
      "BLOCK_N": 16,
      "BLOCK_K": 64,
      "BLOCK_C": 32,
      "NUM_KSPLIT": 2,
      "num_warps": 2,
      "num_stages": 1,
      "waves_per_eu": 0
    },
    "774": {
      "BLOCK_M": 32,
      "BLOCK_N": 16,
      "BLOCK_K": 128,
      "BLOCK_C": 16,
      "NUM_KSPLIT": 8,
      "num_warps": 2,
      "num_stages": 1,
      "waves_per_eu": 0
    },
    "1603": {
      "BLOCK_M": 64,
      "BLOCK_N": 16,
      "BLOCK_K": 32,
      "BLOCK_C": 64,
      "NUM_KSPLIT": 2,
      "num_warps": 2,
      "num_stages": 1,
      "waves_per_eu": 1
    },
    "4391": {
      "BLOCK_M": 256,
      "BLOCK_N": 16,
      "BLOCK_K": 32,
      "BLOCK_C": 16,
      "NUM_KSPLIT": 8,
      "num_warps": 8,
      "num_stages": 2,
      "waves_per_eu": 2
    },
    "1804": {
      "BLOCK_M": 64,
      "BLOCK_N": 16,
      "BLOCK_K": 64,
      "BLOCK_C": 16,
      "NUM_KSPLIT": 1,
      "num_warps": 2,
      "num_stages": 2,
      "waves_per_eu": 1
    },
    "2588": {
      "BLOCK_M": 64,
      "BLOCK_N": 16,
      "BLOCK_K": 256,
      "BLOCK_C": 16,
      "NUM_KSPLIT": 8,
      "num_warps": 8,
      "num_stages": 1,
      "waves_per_eu": 2
    },
    "2810": {
      "BLOCK_M": 64,
      "BLOCK_N": 16,
      "BLOCK_K": 256,
      "BLOCK_C": 256,
      "NUM_KSPLIT": 1,
      "num_warps": 2,
      "num_stages": 1,
      "waves_per_eu": 2
    },
    "5425": {
      "BLOCK_M": 256,
      "BLOCK_N": 16,
      "BLOCK_K": 256,
      "BLOCK_C": 16,
      "NUM_KSPLIT": 2,
      "num_warps": 4,
      "num_stages": 1,
      "waves_per_eu": 1
    },
    "215": {
      "BLOCK_M": 32,
      "BLOCK_N": 16,
      "BLOCK_K": 32,
      "BLOCK_C": 64,
      "NUM_KSPLIT": 8,
      "num_warps": 8,
      "num_stages": 2,
      "waves_per_eu": 2
    },
    "2495": {
      "BLOCK_M": 64,
      "BLOCK_N": 16,
      "BLOCK_K": 128,
      "BLOCK_C": 256,
      "NUM_KSPLIT": 4,
      "num_warps": 4,
      "num_stages": 2,
      "waves_per_eu": 2
    },
    "4112": {
      "BLOCK_M": 128,
      "BLOCK_N": 16,
      "BLOCK_K": 256,
      "BLOCK_C": 64,
      "NUM_KSPLIT": 1,
      "num_warps": 4,
      "num_stages": 1,
      "waves_per_eu": 2
    },
    "1748": {
      "BLOCK_M": 64,
      "BLOCK_N": 16,
      "BLOCK_K": 32,
      "BLOCK_C": 256,
      "NUM_KSPLIT": 2,
      "num_warps": 2,
      "num_stages": 1,
      "waves_per_eu": 2
    },
    "1251": {
      "BLOCK_M": 32,
      "BLOCK_N": 16,
      "BLOCK_K": 256,
      "BLOCK_C": 64,
      "NUM_KSPLIT": 2,
      "num_warps": 4,
      "num_stages": 2,
      "waves_per_eu": 0
    },
    "3507": {
      "BLOCK_M": 128,
      "BLOCK_N": 16,
      "BLOCK_K": 64,
      "BLOCK_C": 128,
      "NUM_KSPLIT": 4,
      "num_warps": 8,
      "num_stages": 2,
      "waves_per_eu": 0
    },
    "3836": {
      "BLOCK_M": 128,
      "BLOCK_N": 16,
      "BLOCK_K": 128,
      "BLOCK_C": 128,
      "NUM_KSPLIT": 2,
      "num_warps": 2,
      "num_stages": 1,
      "waves_per_eu": 2
    },
    "1986": {
      "BLOCK_M": 64,
      "BLOCK_N": 16,
      "BLOCK_K": 64,
      "BLOCK_C": 64,
      "NUM_KSPLIT": 4,
      "num_warps": 4,
      "num_stages": 1,
      "waves_per_eu": 0
    },
    "5426": {
      "BLOCK_M": 256,
      "BLOCK_N": 16,
      "BLOCK_K": 256,
      "BLOCK_C": 16,
      "NUM_KSPLIT": 2,
      "num_warps": 4,
      "num_stages": 1,
      "waves_per_eu": 2
    },
    "4409": {
      "BLOCK_M": 256,
      "BLOCK_N": 16,
      "BLOCK_K": 32,
      "BLOCK_C": 32,
      "NUM_KSPLIT": 1,
      "num_warps": 8,
      "num_stages": 2,
      "waves_per_eu": 2
    },
    "2044": {
      "BLOCK_M": 64,
      "BLOCK_N": 16,
      "BLOCK_K": 64,
      "BLOCK_C": 128,
      "NUM_KSPLIT": 2,
      "num_warps": 4,
      "num_stages": 2,
      "waves_per_eu": 1
    },
    "5349": {
      "BLOCK_M": 256,
      "BLOCK_N": 16,
      "BLOCK_K": 128,
      "BLOCK_C": 256,
      "NUM_KSPLIT": 2,
      "num_warps": 2,
      "num_stages": 2,
      "waves_per_eu": 0
    },
    "5158": {
      "BLOCK_M": 256,
      "BLOCK_N": 16,
      "BLOCK_K": 128,
      "BLOCK_C": 32,
      "NUM_KSPLIT": 4,
      "num_warps": 4,
      "num_stages": 2,
      "waves_per_eu": 1
    },
    "206": {
      "BLOCK_M": 32,
      "BLOCK_N": 16,
      "BLOCK_K": 32,
      "BLOCK_C": 64,
      "NUM_KSPLIT": 8,
      "num_warps": 4,
      "num_stages": 1,
      "waves_per_eu": 2
    },
    "374": {
      "BLOCK_M": 32,
      "BLOCK_N": 16,
      "BLOCK_K": 64,
      "BLOCK_C": 16,
      "NUM_KSPLIT": 1,
      "num_warps": 8,
      "num_stages": 1,
      "waves_per_eu": 2
    },
    "2709": {
      "BLOCK_M": 64,
      "BLOCK_N": 16,
      "BLOCK_K": 256,
      "BLOCK_C": 64,
      "NUM_KSPLIT": 4,
      "num_warps": 4,
      "num_stages": 2,
      "waves_per_eu": 0
    },
    "1369": {
      "BLOCK_M": 32,
      "BLOCK_N": 16,
      "BLOCK_K": 256,
      "BLOCK_C": 256,
      "NUM_KSPLIT": 1,
      "num_warps": 2,
      "num_stages": 1,
      "waves_per_eu": 1
    },
    "285": {
      "BLOCK_M": 32,
      "BLOCK_N": 16,
      "BLOCK_K": 32,
      "BLOCK_C": 128,
      "NUM_KSPLIT": 8,
      "num_warps": 8,
      "num_stages": 2,
      "waves_per_eu": 0
    },
    "477": {
      "BLOCK_M": 32,
      "BLOCK_N": 16,
      "BLOCK_K": 64,
      "BLOCK_C": 32,
      "NUM_KSPLIT": 4,
      "num_warps": 4,
      "num_stages": 2,
      "waves_per_eu": 0
    },
    "256": {
      "BLOCK_M": 32,
      "BLOCK_N": 16,
      "BLOCK_K": 32,
      "BLOCK_C": 128,
      "NUM_KSPLIT": 4,
      "num_warps": 2,
      "num_stages": 2,
      "waves_per_eu": 1
    },
    "1170": {
      "BLOCK_M": 32,
      "BLOCK_N": 16,
      "BLOCK_K": 256,
      "BLOCK_C": 32,
      "NUM_KSPLIT": 2,
      "num_warps": 2,
      "num_stages": 1,
      "waves_per_eu": 0
    },
    "2961": {
      "BLOCK_M": 128,
      "BLOCK_N": 16,
      "BLOCK_K": 32,
      "BLOCK_C": 32,
      "NUM_KSPLIT": 1,
      "num_warps": 4,
      "num_stages": 2,
      "waves_per_eu": 0
    },
    "5162": {
      "BLOCK_M": 256,
      "BLOCK_N": 16,
      "BLOCK_K": 128,
      "BLOCK_C": 32,
      "NUM_KSPLIT": 4,
      "num_warps": 8,
      "num_stages": 1,
      "waves_per_eu": 2
    },
    "4677": {
      "BLOCK_M": 256,
      "BLOCK_N": 16,
      "BLOCK_K": 32,
      "BLOCK_C": 256,
      "NUM_KSPLIT": 8,
      "num_warps": 8,
      "num_stages": 2,
      "waves_per_eu": 0
    },
    "3841": {
      "BLOCK_M": 128,
      "BLOCK_N": 16,
      "BLOCK_K": 128,
      "BLOCK_C": 128,
      "NUM_KSPLIT": 2,
      "num_warps": 4,
      "num_stages": 1,
      "waves_per_eu": 1
    },
    "167": {
      "BLOCK_M": 32,
      "BLOCK_N": 16,
      "BLOCK_K": 32,
      "BLOCK_C": 64,
      "NUM_KSPLIT": 2,
      "num_warps": 2,
      "num_stages": 2,
      "waves_per_eu": 2
    },
    "56": {
      "BLOCK_M": 32,
      "BLOCK_N": 16,
      "BLOCK_K": 32,
      "BLOCK_C": 16,
      "NUM_KSPLIT": 8,
      "num_warps": 2,
      "num_stages": 1,
      "waves_per_eu": 2
    },
    "1411": {
      "BLOCK_M": 32,
      "BLOCK_N": 16,
      "BLOCK_K": 256,
      "BLOCK_C": 256,
      "NUM_KSPLIT": 4,
      "num_warps": 4,
      "num_stages": 1,
      "waves_per_eu": 1
    },
    "831": {
      "BLOCK_M": 32,
      "BLOCK_N": 16,
      "BLOCK_K": 128,
      "BLOCK_C": 32,
      "NUM_KSPLIT": 4,
      "num_warps": 2,
      "num_stages": 2,
      "waves_per_eu": 0
    },
    "566": {
      "BLOCK_M": 32,
      "BLOCK_N": 16,
      "BLOCK_K": 64,
      "BLOCK_C": 64,
      "NUM_KSPLIT": 8,
      "num_warps": 4,
      "num_stages": 1,
      "waves_per_eu": 2
    },
    "2304": {
      "BLOCK_M": 64,
      "BLOCK_N": 16,
      "BLOCK_K": 128,
      "BLOCK_C": 64,
      "NUM_KSPLIT": 1,
      "num_warps": 2,
      "num_stages": 1,
      "waves_per_eu": 0
    },
    "5329": {
      "BLOCK_M": 256,
      "BLOCK_N": 16,
      "BLOCK_K": 128,
      "BLOCK_C": 256,
      "NUM_KSPLIT": 1,
      "num_warps": 2,
      "num_stages": 1,
      "waves_per_eu": 1
    },
    "4096": {
      "BLOCK_M": 128,
      "BLOCK_N": 16,
      "BLOCK_K": 256,
      "BLOCK_C": 32,
      "NUM_KSPLIT": 8,
      "num_warps": 4,
      "num_stages": 2,
      "waves_per_eu": 1
    },
    "873": {
      "BLOCK_M": 32,
      "BLOCK_N": 16,
      "BLOCK_K": 128,
      "BLOCK_C": 64,
      "NUM_KSPLIT": 1,
      "num_warps": 4,
      "num_stages": 2,
      "waves_per_eu": 0
    },
    "2988": {
      "BLOCK_M": 128,
      "BLOCK_N": 16,
      "BLOCK_K": 32,
      "BLOCK_C": 32,
      "NUM_KSPLIT": 4,
      "num_warps": 2,
      "num_stages": 1,
      "waves_per_eu": 0
    },
    "2952": {
      "BLOCK_M": 128,
      "BLOCK_N": 16,
      "BLOCK_K": 32,
      "BLOCK_C": 32,
      "NUM_KSPLIT": 1,
      "num_warps": 2,
      "num_stages": 1,
      "waves_per_eu": 0
    },
    "3637": {
      "BLOCK_M": 128,
      "BLOCK_N": 16,
      "BLOCK_K": 128,
      "BLOCK_C": 16,
      "NUM_KSPLIT": 4,
      "num_warps": 2,
      "num_stages": 1,
      "waves_per_eu": 1
    },
    "5600": {
      "BLOCK_M": 256,
      "BLOCK_N": 16,
      "BLOCK_K": 256,
      "BLOCK_C": 64,
      "NUM_KSPLIT": 8,
      "num_warps": 2,
      "num_stages": 1,
      "waves_per_eu": 2
    },
    "2751": {
      "BLOCK_M": 64,
      "BLOCK_N": 16,
      "BLOCK_K": 256,
      "BLOCK_C": 128,
      "NUM_KSPLIT": 1,
      "num_warps": 8,
      "num_stages": 2,
      "waves_per_eu": 0
    },
    "3491": {
      "BLOCK_M": 128,
      "BLOCK_N": 16,
      "BLOCK_K": 64,
      "BLOCK_C": 128,
      "NUM_KSPLIT": 2,
      "num_warps": 8,
      "num_stages": 2,
      "waves_per_eu": 2
    },
    "4751": {
      "BLOCK_M": 256,
      "BLOCK_N": 16,
      "BLOCK_K": 64,
      "BLOCK_C": 16,
      "NUM_KSPLIT": 8,
      "num_warps": 8,
      "num_stages": 2,
      "waves_per_eu": 2
    },
    "2572": {
      "BLOCK_M": 64,
      "BLOCK_N": 16,
      "BLOCK_K": 256,
      "BLOCK_C": 16,
      "NUM_KSPLIT": 4,
      "num_warps": 8,
      "num_stages": 2,
      "waves_per_eu": 1
    },
    "5461": {
      "BLOCK_M": 256,
      "BLOCK_N": 16,
      "BLOCK_K": 256,
      "BLOCK_C": 16,
      "NUM_KSPLIT": 8,
      "num_warps": 4,
      "num_stages": 1,
      "waves_per_eu": 1
    },
    "4999": {
      "BLOCK_M": 256,
      "BLOCK_N": 16,
      "BLOCK_K": 64,
      "BLOCK_C": 256,
      "NUM_KSPLIT": 2,
      "num_warps": 8,
      "num_stages": 1,
      "waves_per_eu": 1
    },
    "901": {
      "BLOCK_M": 32,
      "BLOCK_N": 16,
      "BLOCK_K": 128,
      "BLOCK_C": 64,
      "NUM_KSPLIT": 4,
      "num_warps": 2,
      "num_stages": 1,
      "waves_per_eu": 1
    },
    "1398": {
      "BLOCK_M": 32,
      "BLOCK_N": 16,
      "BLOCK_K": 256,
      "BLOCK_C": 256,
      "NUM_KSPLIT": 2,
      "num_warps": 8,
      "num_stages": 1,
      "waves_per_eu": 0
    },
    "3190": {
      "BLOCK_M": 128,
      "BLOCK_N": 16,
      "BLOCK_K": 32,
      "BLOCK_C": 256,
      "NUM_KSPLIT": 2,
      "num_warps": 2,
      "num_stages": 2,
      "waves_per_eu": 1
    },
    "101": {
      "BLOCK_M": 32,
      "BLOCK_N": 16,
      "BLOCK_K": 32,
      "BLOCK_C": 32,
      "NUM_KSPLIT": 2,
      "num_warps": 4,
      "num_stages": 2,
      "waves_per_eu": 2
    },
    "739": {
      "BLOCK_M": 32,
      "BLOCK_N": 16,
      "BLOCK_K": 128,
      "BLOCK_C": 16,
      "NUM_KSPLIT": 2,
      "num_warps": 2,
      "num_stages": 1,
      "waves_per_eu": 1
    },
    "3082": {
      "BLOCK_M": 128,
      "BLOCK_N": 16,
      "BLOCK_K": 32,
      "BLOCK_C": 64,
      "NUM_KSPLIT": 8,
      "num_warps": 2,
      "num_stages": 2,
      "waves_per_eu": 1
    },
    "1303": {
      "BLOCK_M": 32,
      "BLOCK_N": 16,
      "BLOCK_K": 256,
      "BLOCK_C": 128,
      "NUM_KSPLIT": 1,
      "num_warps": 4,
      "num_stages": 1,
      "waves_per_eu": 1
    },
    "286": {
      "BLOCK_M": 32,
      "BLOCK_N": 16,
      "BLOCK_K": 32,
      "BLOCK_C": 128,
      "NUM_KSPLIT": 8,
      "num_warps": 8,
      "num_stages": 2,
      "waves_per_eu": 1
    },
    "1111": {
      "BLOCK_M": 32,
      "BLOCK_N": 16,
      "BLOCK_K": 256,
      "BLOCK_C": 16,
      "NUM_KSPLIT": 2,
      "num_warps": 8,
      "num_stages": 1,
      "waves_per_eu": 1
    },
    "432": {
      "BLOCK_M": 32,
      "BLOCK_N": 16,
      "BLOCK_K": 64,
      "BLOCK_C": 32,
      "NUM_KSPLIT": 1,
      "num_warps": 2,
      "num_stages": 1,
      "waves_per_eu": 0
    },
    "3436": {
      "BLOCK_M": 128,
      "BLOCK_N": 16,
      "BLOCK_K": 64,
      "BLOCK_C": 64,
      "NUM_KSPLIT": 4,
      "num_warps": 8,
      "num_stages": 2,
      "waves_per_eu": 1
    },
    "5518": {
      "BLOCK_M": 256,
      "BLOCK_N": 16,
      "BLOCK_K": 256,
      "BLOCK_C": 32,
      "NUM_KSPLIT": 4,
      "num_warps": 4,
      "num_stages": 2,
      "waves_per_eu": 1
    },
    "2387": {
      "BLOCK_M": 64,
      "BLOCK_N": 16,
      "BLOCK_K": 128,
      "BLOCK_C": 128,
      "NUM_KSPLIT": 1,
      "num_warps": 4,
      "num_stages": 2,
      "waves_per_eu": 2
    },
    "2449": {
      "BLOCK_M": 64,
      "BLOCK_N": 16,
      "BLOCK_K": 128,
      "BLOCK_C": 256,
      "NUM_KSPLIT": 1,
      "num_warps": 2,
      "num_stages": 1,
      "waves_per_eu": 1
    },
    "5390": {
      "BLOCK_M": 256,
      "BLOCK_N": 16,
      "BLOCK_K": 128,
      "BLOCK_C": 256,
      "NUM_KSPLIT": 8,
      "num_warps": 4,
      "num_stages": 1,
      "waves_per_eu": 2
    },
    "1511": {
      "BLOCK_M": 64,
      "BLOCK_N": 16,
      "BLOCK_K": 32,
      "BLOCK_C": 16,
      "NUM_KSPLIT": 8,
      "num_warps": 8,
      "num_stages": 2,
      "waves_per_eu": 2
    },
    "1401": {
      "BLOCK_M": 32,
      "BLOCK_N": 16,
      "BLOCK_K": 256,
      "BLOCK_C": 256,
      "NUM_KSPLIT": 2,
      "num_warps": 8,
      "num_stages": 2,
      "waves_per_eu": 0
    },
    "2836": {
      "BLOCK_M": 64,
      "BLOCK_N": 16,
      "BLOCK_K": 256,
      "BLOCK_C": 256,
      "NUM_KSPLIT": 2,
      "num_warps": 4,
      "num_stages": 2,
      "waves_per_eu": 1
    },
    "2093": {
      "BLOCK_M": 64,
      "BLOCK_N": 16,
      "BLOCK_K": 64,
      "BLOCK_C": 256,
      "NUM_KSPLIT": 1,
      "num_warps": 2,
      "num_stages": 2,
      "waves_per_eu": 2
    },
    "3666": {
      "BLOCK_M": 128,
      "BLOCK_N": 16,
      "BLOCK_K": 128,
      "BLOCK_C": 16,
      "NUM_KSPLIT": 8,
      "num_warps": 8,
      "num_stages": 1,
      "waves_per_eu": 0
    },
    "3782": {
      "BLOCK_M": 128,
      "BLOCK_N": 16,
      "BLOCK_K": 128,
      "BLOCK_C": 64,
      "NUM_KSPLIT": 4,
      "num_warps": 2,
      "num_stages": 1,
      "waves_per_eu": 2
    },
    "4370": {
      "BLOCK_M": 256,
      "BLOCK_N": 16,
      "BLOCK_K": 32,
      "BLOCK_C": 16,
      "NUM_KSPLIT": 4,
      "num_warps": 8,
      "num_stages": 1,
      "waves_per_eu": 2
    },
    "1027": {
      "BLOCK_M": 32,
      "BLOCK_N": 16,
      "BLOCK_K": 128,
      "BLOCK_C": 256,
      "NUM_KSPLIT": 2,
      "num_warps": 2,
      "num_stages": 1,
      "waves_per_eu": 1
    },
    "1875": {
      "BLOCK_M": 64,
      "BLOCK_N": 16,
      "BLOCK_K": 64,
      "BLOCK_C": 32,
      "NUM_KSPLIT": 1,
      "num_warps": 2,
      "num_stages": 2,
      "waves_per_eu": 0
    },
    "2077": {
      "BLOCK_M": 64,
      "BLOCK_N": 16,
      "BLOCK_K": 64,
      "BLOCK_C": 128,
      "NUM_KSPLIT": 8,
      "num_warps": 4,
      "num_stages": 1,
      "waves_per_eu": 1
    },
    "5603": {
      "BLOCK_M": 256,
      "BLOCK_N": 16,
      "BLOCK_K": 256,
      "BLOCK_C": 64,
      "NUM_KSPLIT": 8,
      "num_warps": 2,
      "num_stages": 2,
      "waves_per_eu": 2
    },
    "1663": {
      "BLOCK_M": 64,
      "BLOCK_N": 16,
      "BLOCK_K": 32,
      "BLOCK_C": 128,
      "NUM_KSPLIT": 1,
      "num_warps": 4,
      "num_stages": 1,
      "waves_per_eu": 1
    },
    "4128": {
      "BLOCK_M": 128,
      "BLOCK_N": 16,
      "BLOCK_K": 256,
      "BLOCK_C": 64,
      "NUM_KSPLIT": 2,
      "num_warps": 4,
      "num_stages": 1,
      "waves_per_eu": 0
    },
    "4055": {
      "BLOCK_M": 128,
      "BLOCK_N": 16,
      "BLOCK_K": 256,
      "BLOCK_C": 32,
      "NUM_KSPLIT": 2,
      "num_warps": 2,
      "num_stages": 2,
      "waves_per_eu": 2
    },
    "3372": {
      "BLOCK_M": 128,
      "BLOCK_N": 16,
      "BLOCK_K": 64,
      "BLOCK_C": 32,
      "NUM_KSPLIT": 8,
      "num_warps": 4,
      "num_stages": 1,
      "waves_per_eu": 0
    },
    "4687": {
      "BLOCK_M": 256,
      "BLOCK_N": 16,
      "BLOCK_K": 64,
      "BLOCK_C": 16,
      "NUM_KSPLIT": 1,
      "num_warps": 4,
      "num_stages": 1,
      "waves_per_eu": 1
    },
    "610": {
      "BLOCK_M": 32,
      "BLOCK_N": 16,
      "BLOCK_K": 64,
      "BLOCK_C": 128,
      "NUM_KSPLIT": 2,
      "num_warps": 8,
      "num_stages": 2,
      "waves_per_eu": 1
    },
    "4997": {
      "BLOCK_M": 256,
      "BLOCK_N": 16,
      "BLOCK_K": 64,
      "BLOCK_C": 256,
      "NUM_KSPLIT": 2,
      "num_warps": 4,
      "num_stages": 2,
      "waves_per_eu": 2
    },
    "2986": {
      "BLOCK_M": 128,
      "BLOCK_N": 16,
      "BLOCK_K": 32,
      "BLOCK_C": 32,
      "NUM_KSPLIT": 2,
      "num_warps": 8,
      "num_stages": 2,
      "waves_per_eu": 1
    },
    "1484": {
      "BLOCK_M": 64,
      "BLOCK_N": 16,
      "BLOCK_K": 32,
      "BLOCK_C": 16,
      "NUM_KSPLIT": 4,
      "num_warps": 4,
      "num_stages": 1,
      "waves_per_eu": 2
    },
    "4776": {
      "BLOCK_M": 256,
      "BLOCK_N": 16,
      "BLOCK_K": 64,
      "BLOCK_C": 32,
      "NUM_KSPLIT": 2,
      "num_warps": 4,
      "num_stages": 1,
      "waves_per_eu": 0
    },
    "5541": {
      "BLOCK_M": 256,
      "BLOCK_N": 16,
      "BLOCK_K": 256,
      "BLOCK_C": 32,
      "NUM_KSPLIT": 8,
      "num_warps": 8,
      "num_stages": 2,
      "waves_per_eu": 0
    },
    "3725": {
      "BLOCK_M": 128,
      "BLOCK_N": 16,
      "BLOCK_K": 128,
      "BLOCK_C": 32,
      "NUM_KSPLIT": 4,
      "num_warps": 8,
      "num_stages": 2,
      "waves_per_eu": 2
    },
    "3964": {
      "BLOCK_M": 128,
      "BLOCK_N": 16,
      "BLOCK_K": 256,
      "BLOCK_C": 16,
      "NUM_KSPLIT": 1,
      "num_warps": 2,
      "num_stages": 2,
      "waves_per_eu": 1
    },
    "1740": {
      "BLOCK_M": 64,
      "BLOCK_N": 16,
      "BLOCK_K": 32,
      "BLOCK_C": 256,
      "NUM_KSPLIT": 1,
      "num_warps": 8,
      "num_stages": 1,
      "waves_per_eu": 0
    },
    "2843": {
      "BLOCK_M": 64,
      "BLOCK_N": 16,
      "BLOCK_K": 256,
      "BLOCK_C": 256,
      "NUM_KSPLIT": 2,
      "num_warps": 8,
      "num_stages": 2,
      "waves_per_eu": 2
    },
    "2802": {
      "BLOCK_M": 64,
      "BLOCK_N": 16,
      "BLOCK_K": 256,
      "BLOCK_C": 128,
      "NUM_KSPLIT": 8,
      "num_warps": 8,
      "num_stages": 1,
      "waves_per_eu": 0
    },
    "1072": {
      "BLOCK_M": 32,
      "BLOCK_N": 16,
      "BLOCK_K": 128,
      "BLOCK_C": 256,
      "NUM_KSPLIT": 8,
      "num_warps": 4,
      "num_stages": 2,
      "waves_per_eu": 1
    },
    "2430": {
      "BLOCK_M": 64,
      "BLOCK_N": 16,
      "BLOCK_K": 128,
      "BLOCK_C": 128,
      "NUM_KSPLIT": 8,
      "num_warps": 2,
      "num_stages": 1,
      "waves_per_eu": 0
    },
    "1268": {
      "BLOCK_M": 32,
      "BLOCK_N": 16,
      "BLOCK_K": 256,
      "BLOCK_C": 64,
      "NUM_KSPLIT": 4,
      "num_warps": 4,
      "num_stages": 1,
      "waves_per_eu": 2
    },
    "2833": {
      "BLOCK_M": 64,
      "BLOCK_N": 16,
      "BLOCK_K": 256,
      "BLOCK_C": 256,
      "NUM_KSPLIT": 2,
      "num_warps": 4,
      "num_stages": 1,
      "waves_per_eu": 1
    },
    "894": {
      "BLOCK_M": 32,
      "BLOCK_N": 16,
      "BLOCK_K": 128,
      "BLOCK_C": 64,
      "NUM_KSPLIT": 2,
      "num_warps": 8,
      "num_stages": 1,
      "waves_per_eu": 0
    },
    "2090": {
      "BLOCK_M": 64,
      "BLOCK_N": 16,
      "BLOCK_K": 64,
      "BLOCK_C": 256,
      "NUM_KSPLIT": 1,
      "num_warps": 2,
      "num_stages": 1,
      "waves_per_eu": 2
    },
    "2249": {
      "BLOCK_M": 64,
      "BLOCK_N": 16,
      "BLOCK_K": 128,
      "BLOCK_C": 32,
      "NUM_KSPLIT": 1,
      "num_warps": 8,
      "num_stages": 2,
      "waves_per_eu": 2
    },
    "1741": {
      "BLOCK_M": 64,
      "BLOCK_N": 16,
      "BLOCK_K": 32,
      "BLOCK_C": 256,
      "NUM_KSPLIT": 1,
      "num_warps": 8,
      "num_stages": 1,
      "waves_per_eu": 1
    },
    "866": {
      "BLOCK_M": 32,
      "BLOCK_N": 16,
      "BLOCK_K": 128,
      "BLOCK_C": 64,
      "NUM_KSPLIT": 1,
      "num_warps": 2,
      "num_stages": 1,
      "waves_per_eu": 2
    },
    "2101": {
      "BLOCK_M": 64,
      "BLOCK_N": 16,
      "BLOCK_K": 64,
      "BLOCK_C": 256,
      "NUM_KSPLIT": 1,
      "num_warps": 8,
      "num_stages": 1,
      "waves_per_eu": 1
    },
    "5247": {
      "BLOCK_M": 256,
      "BLOCK_N": 16,
      "BLOCK_K": 128,
      "BLOCK_C": 64,
      "NUM_KSPLIT": 8,
      "num_warps": 4,
      "num_stages": 2,
      "waves_per_eu": 0
    },
    "1995": {
      "BLOCK_M": 64,
      "BLOCK_N": 16,
      "BLOCK_K": 64,
      "BLOCK_C": 64,
      "NUM_KSPLIT": 4,
      "num_warps": 8,
      "num_stages": 2,
      "waves_per_eu": 0
    },
    "3997": {
      "BLOCK_M": 128,
      "BLOCK_N": 16,
      "BLOCK_K": 256,
      "BLOCK_C": 16,
      "NUM_KSPLIT": 4,
      "num_warps": 2,
      "num_stages": 1,
      "waves_per_eu": 1
    },
    "2169": {
      "BLOCK_M": 64,
      "BLOCK_N": 16,
      "BLOCK_K": 128,
      "BLOCK_C": 16,
      "NUM_KSPLIT": 1,
      "num_warps": 4,
      "num_stages": 2,
      "waves_per_eu": 0
    },
    "4505": {
      "BLOCK_M": 256,
      "BLOCK_N": 16,
      "BLOCK_K": 32,
      "BLOCK_C": 64,
      "NUM_KSPLIT": 4,
      "num_warps": 2,
      "num_stages": 2,
      "waves_per_eu": 2
    },
    "4795": {
      "BLOCK_M": 256,
      "BLOCK_N": 16,
      "BLOCK_K": 64,
      "BLOCK_C": 32,
      "NUM_KSPLIT": 4,
      "num_warps": 4,
      "num_stages": 1,
      "waves_per_eu": 1
    },
    "4761": {
      "BLOCK_M": 256,
      "BLOCK_N": 16,
      "BLOCK_K": 64,
      "BLOCK_C": 32,
      "NUM_KSPLIT": 1,
      "num_warps": 4,
      "num_stages": 2,
      "waves_per_eu": 0
    },
    "70": {
      "BLOCK_M": 32,
      "BLOCK_N": 16,
      "BLOCK_K": 32,
      "BLOCK_C": 16,
      "NUM_KSPLIT": 8,
      "num_warps": 8,
      "num_stages": 2,
      "waves_per_eu": 1
    },
    "1738": {
      "BLOCK_M": 64,
      "BLOCK_N": 16,
      "BLOCK_K": 32,
      "BLOCK_C": 256,
      "NUM_KSPLIT": 1,
      "num_warps": 4,
      "num_stages": 2,
      "waves_per_eu": 1
    },
    "4631": {
      "BLOCK_M": 256,
      "BLOCK_N": 16,
      "BLOCK_K": 32,
      "BLOCK_C": 256,
      "NUM_KSPLIT": 2,
      "num_warps": 2,
      "num_stages": 2,
      "waves_per_eu": 2
    },
    "455": {
      "BLOCK_M": 32,
      "BLOCK_N": 16,
      "BLOCK_K": 64,
      "BLOCK_C": 32,
      "NUM_KSPLIT": 2,
      "num_warps": 2,
      "num_stages": 2,
      "waves_per_eu": 2
    },
    "949": {
      "BLOCK_M": 32,
      "BLOCK_N": 16,
      "BLOCK_K": 128,
      "BLOCK_C": 128,
      "NUM_KSPLIT": 1,
      "num_warps": 8,
      "num_stages": 1,
      "waves_per_eu": 1
    },
    "5368": {
      "BLOCK_M": 256,
      "BLOCK_N": 16,
      "BLOCK_K": 128,
      "BLOCK_C": 256,
      "NUM_KSPLIT": 4,
      "num_warps": 2,
      "num_stages": 2,
      "waves_per_eu": 1
    },
    "2941": {
      "BLOCK_M": 128,
      "BLOCK_N": 16,
      "BLOCK_K": 32,
      "BLOCK_C": 16,
      "NUM_KSPLIT": 8,
      "num_warps": 4,
      "num_stages": 1,
      "waves_per_eu": 1
    },
    "221": {
      "BLOCK_M": 32,
      "BLOCK_N": 16,
      "BLOCK_K": 32,
      "BLOCK_C": 128,
      "NUM_KSPLIT": 1,
      "num_warps": 2,
      "num_stages": 2,
      "waves_per_eu": 2
    },
    "3366": {
      "BLOCK_M": 128,
      "BLOCK_N": 16,
      "BLOCK_K": 64,
      "BLOCK_C": 32,
      "NUM_KSPLIT": 8,
      "num_warps": 2,
      "num_stages": 1,
      "waves_per_eu": 0
    },
    "1464": {
      "BLOCK_M": 64,
      "BLOCK_N": 16,
      "BLOCK_K": 32,
      "BLOCK_C": 16,
      "NUM_KSPLIT": 2,
      "num_warps": 4,
      "num_stages": 1,
      "waves_per_eu": 0
    },
    "3001": {
      "BLOCK_M": 128,
      "BLOCK_N": 16,
      "BLOCK_K": 32,
      "BLOCK_C": 32,
      "NUM_KSPLIT": 4,
      "num_warps": 8,
      "num_stages": 1,
      "waves_per_eu": 1
    },
    "536": {
      "BLOCK_M": 32,
      "BLOCK_N": 16,
      "BLOCK_K": 64,
      "BLOCK_C": 64,
      "NUM_KSPLIT": 2,
      "num_warps": 8,
      "num_stages": 1,
      "waves_per_eu": 2
    },
    "384": {
      "BLOCK_M": 32,
      "BLOCK_N": 16,
      "BLOCK_K": 64,
      "BLOCK_C": 16,
      "NUM_KSPLIT": 2,
      "num_warps": 4,
      "num_stages": 1,
      "waves_per_eu": 0
    },
    "2190": {
      "BLOCK_M": 64,
      "BLOCK_N": 16,
      "BLOCK_K": 128,
      "BLOCK_C": 16,
      "NUM_KSPLIT": 2,
      "num_warps": 8,
      "num_stages": 1,
      "waves_per_eu": 0
    },
    "2744": {
      "BLOCK_M": 64,
      "BLOCK_N": 16,
      "BLOCK_K": 256,
      "BLOCK_C": 128,
      "NUM_KSPLIT": 1,
      "num_warps": 4,
      "num_stages": 1,
      "waves_per_eu": 2
    },
    "2500": {
      "BLOCK_M": 64,
      "BLOCK_N": 16,
      "BLOCK_K": 128,
      "BLOCK_C": 256,
      "NUM_KSPLIT": 4,
      "num_warps": 8,
      "num_stages": 2,
      "waves_per_eu": 1
    },
    "1442": {
      "BLOCK_M": 64,
      "BLOCK_N": 16,
      "BLOCK_K": 32,
      "BLOCK_C": 16,
      "NUM_KSPLIT": 1,
      "num_warps": 2,
      "num_stages": 1,
      "waves_per_eu": 2
    },
    "3283": {
      "BLOCK_M": 128,
      "BLOCK_N": 16,
      "BLOCK_K": 64,
      "BLOCK_C": 16,
      "NUM_KSPLIT": 4,
      "num_warps": 4,
      "num_stages": 1,
      "waves_per_eu": 1
    },
    "4881": {
      "BLOCK_M": 256,
      "BLOCK_N": 16,
      "BLOCK_K": 64,
      "BLOCK_C": 64,
      "NUM_KSPLIT": 8,
      "num_warps": 2,
      "num_stages": 2,
      "waves_per_eu": 0
    },
    "3072": {
      "BLOCK_M": 128,
      "BLOCK_N": 16,
      "BLOCK_K": 32,
      "BLOCK_C": 64,
      "NUM_KSPLIT": 4,
      "num_warps": 8,
      "num_stages": 1,
      "waves_per_eu": 0
    },
    "3099": {
      "BLOCK_M": 128,
      "BLOCK_N": 16,
      "BLOCK_K": 32,
      "BLOCK_C": 128,
      "NUM_KSPLIT": 1,
      "num_warps": 2,
      "num_stages": 2,
      "waves_per_eu": 0
    },
    "5529": {
      "BLOCK_M": 256,
      "BLOCK_N": 16,
      "BLOCK_K": 256,
      "BLOCK_C": 32,
      "NUM_KSPLIT": 8,
      "num_warps": 2,
      "num_stages": 2,
      "waves_per_eu": 0
    },
    "4443": {
      "BLOCK_M": 256,
      "BLOCK_N": 16,
      "BLOCK_K": 32,
      "BLOCK_C": 32,
      "NUM_KSPLIT": 4,
      "num_warps": 8,
      "num_stages": 2,
      "waves_per_eu": 0
    },
    "4113": {
      "BLOCK_M": 128,
      "BLOCK_N": 16,
      "BLOCK_K": 256,
      "BLOCK_C": 64,
      "NUM_KSPLIT": 1,
      "num_warps": 4,
      "num_stages": 2,
      "waves_per_eu": 0
    },
    "2948": {
      "BLOCK_M": 128,
      "BLOCK_N": 16,
      "BLOCK_K": 32,
      "BLOCK_C": 16,
      "NUM_KSPLIT": 8,
      "num_warps": 8,
      "num_stages": 1,
      "waves_per_eu": 2
    },
    "5694": {
      "BLOCK_M": 256,
      "BLOCK_N": 16,
      "BLOCK_K": 256,
      "BLOCK_C": 256,
      "NUM_KSPLIT": 1,
      "num_warps": 4,
      "num_stages": 1,
      "waves_per_eu": 0
    },
    "2724": {
      "BLOCK_M": 64,
      "BLOCK_N": 16,
      "BLOCK_K": 256,
      "BLOCK_C": 64,
      "NUM_KSPLIT": 8,
      "num_warps": 4,
      "num_stages": 1,
      "waves_per_eu": 0
    },
    "3620": {
      "BLOCK_M": 128,
      "BLOCK_N": 16,
      "BLOCK_K": 128,
      "BLOCK_C": 16,
      "NUM_KSPLIT": 2,
      "num_warps": 2,
      "num_stages": 1,
      "waves_per_eu": 2
    },
    "660": {
      "BLOCK_M": 32,
      "BLOCK_N": 16,
      "BLOCK_K": 64,
      "BLOCK_C": 256,
      "NUM_KSPLIT": 1,
      "num_warps": 8,
      "num_stages": 1,
      "waves_per_eu": 0
    },
    "3681": {
      "BLOCK_M": 128,
      "BLOCK_N": 16,
      "BLOCK_K": 128,
      "BLOCK_C": 32,
      "NUM_KSPLIT": 1,
      "num_warps": 4,
      "num_stages": 2,
      "waves_per_eu": 0
    },
    "1593": {
      "BLOCK_M": 64,
      "BLOCK_N": 16,
      "BLOCK_K": 32,
      "BLOCK_C": 64,
      "NUM_KSPLIT": 1,
      "num_warps": 4,
      "num_stages": 2,
      "waves_per_eu": 0
    },
    "5684": {
      "BLOCK_M": 256,
      "BLOCK_N": 16,
      "BLOCK_K": 256,
      "BLOCK_C": 128,
      "NUM_KSPLIT": 8,
      "num_warps": 8,
      "num_stages": 1,
      "waves_per_eu": 2
    },
    "4367": {
      "BLOCK_M": 256,
      "BLOCK_N": 16,
      "BLOCK_K": 32,
      "BLOCK_C": 16,
      "NUM_KSPLIT": 4,
      "num_warps": 4,
      "num_stages": 2,
      "waves_per_eu": 2
    },
    "4876": {
      "BLOCK_M": 256,
      "BLOCK_N": 16,
      "BLOCK_K": 64,
      "BLOCK_C": 64,
      "NUM_KSPLIT": 4,
      "num_warps": 8,
      "num_stages": 2,
      "waves_per_eu": 1
    },
    "4387": {
      "BLOCK_M": 256,
      "BLOCK_N": 16,
      "BLOCK_K": 32,
      "BLOCK_C": 16,
      "NUM_KSPLIT": 8,
      "num_warps": 8,
      "num_stages": 1,
      "waves_per_eu": 1
    },
    "2670": {
      "BLOCK_M": 64,
      "BLOCK_N": 16,
      "BLOCK_K": 256,
      "BLOCK_C": 64,
      "NUM_KSPLIT": 1,
      "num_warps": 4,
      "num_stages": 1,
      "waves_per_eu": 0
    },
    "64": {
      "BLOCK_M": 32,
      "BLOCK_N": 16,
      "BLOCK_K": 32,
      "BLOCK_C": 16,
      "NUM_KSPLIT": 8,
      "num_warps": 4,
      "num_stages": 2,
      "waves_per_eu": 1
    },
    "1107": {
      "BLOCK_M": 32,
      "BLOCK_N": 16,
      "BLOCK_K": 256,
      "BLOCK_C": 16,
      "NUM_KSPLIT": 2,
      "num_warps": 4,
      "num_stages": 2,
      "waves_per_eu": 0
    },
    "2866": {
      "BLOCK_M": 64,
      "BLOCK_N": 16,
      "BLOCK_K": 256,
      "BLOCK_C": 256,
      "NUM_KSPLIT": 8,
      "num_warps": 2,
      "num_stages": 2,
      "waves_per_eu": 1
    },
    "2822": {
      "BLOCK_M": 64,
      "BLOCK_N": 16,
      "BLOCK_K": 256,
      "BLOCK_C": 256,
      "NUM_KSPLIT": 1,
      "num_warps": 8,
      "num_stages": 1,
      "waves_per_eu": 2
    },
    "3670": {
      "BLOCK_M": 128,
      "BLOCK_N": 16,
      "BLOCK_K": 128,
      "BLOCK_C": 16,
      "NUM_KSPLIT": 8,
      "num_warps": 8,
      "num_stages": 2,
      "waves_per_eu": 1
    },
    "37": {
      "BLOCK_M": 32,
      "BLOCK_N": 16,
      "BLOCK_K": 32,
      "BLOCK_C": 16,
      "NUM_KSPLIT": 4,
      "num_warps": 2,
      "num_stages": 1,
      "waves_per_eu": 1
    },
    "5103": {
      "BLOCK_M": 256,
      "BLOCK_N": 16,
      "BLOCK_K": 128,
      "BLOCK_C": 16,
      "NUM_KSPLIT": 8,
      "num_warps": 4,
      "num_stages": 2,
      "waves_per_eu": 0
    },
    "1592": {
      "BLOCK_M": 64,
      "BLOCK_N": 16,
      "BLOCK_K": 32,
      "BLOCK_C": 64,
      "NUM_KSPLIT": 1,
      "num_warps": 4,
      "num_stages": 1,
      "waves_per_eu": 2
    },
    "4353": {
      "BLOCK_M": 256,
      "BLOCK_N": 16,
      "BLOCK_K": 32,
      "BLOCK_C": 16,
      "NUM_KSPLIT": 2,
      "num_warps": 8,
      "num_stages": 2,
      "waves_per_eu": 0
    },
    "5313": {
      "BLOCK_M": 256,
      "BLOCK_N": 16,
      "BLOCK_K": 128,
      "BLOCK_C": 128,
      "NUM_KSPLIT": 8,
      "num_warps": 2,
      "num_stages": 2,
      "waves_per_eu": 0
    },
    "5095": {
      "BLOCK_M": 256,
      "BLOCK_N": 16,
      "BLOCK_K": 128,
      "BLOCK_C": 16,
      "NUM_KSPLIT": 8,
      "num_warps": 2,
      "num_stages": 1,
      "waves_per_eu": 1
    },
    "3044": {
      "BLOCK_M": 128,
      "BLOCK_N": 16,
      "BLOCK_K": 32,
      "BLOCK_C": 64,
      "NUM_KSPLIT": 2,
      "num_warps": 2,
      "num_stages": 1,
      "waves_per_eu": 2
    },
    "2284": {
      "BLOCK_M": 64,
      "BLOCK_N": 16,
      "BLOCK_K": 128,
      "BLOCK_C": 32,
      "NUM_KSPLIT": 4,
      "num_warps": 8,
      "num_stages": 2,
      "waves_per_eu": 1
    },
    "1940": {
      "BLOCK_M": 64,
      "BLOCK_N": 16,
      "BLOCK_K": 64,
      "BLOCK_C": 32,
      "NUM_KSPLIT": 8,
      "num_warps": 8,
      "num_stages": 1,
      "waves_per_eu": 2
    },
    "2692": {
      "BLOCK_M": 64,
      "BLOCK_N": 16,
      "BLOCK_K": 256,
      "BLOCK_C": 64,
      "NUM_KSPLIT": 2,
      "num_warps": 4,
      "num_stages": 2,
      "waves_per_eu": 1
    },
    "264": {
      "BLOCK_M": 32,
      "BLOCK_N": 16,
      "BLOCK_K": 32,
      "BLOCK_C": 128,
      "NUM_KSPLIT": 4,
      "num_warps": 8,
      "num_stages": 1,
      "waves_per_eu": 0
    },
    "1893": {
      "BLOCK_M": 64,
      "BLOCK_N": 16,
      "BLOCK_K": 64,
      "BLOCK_C": 32,
      "NUM_KSPLIT": 2,
      "num_warps": 2,
      "num_stages": 2,
      "waves_per_eu": 0
    },
    "3180": {
      "BLOCK_M": 128,
      "BLOCK_N": 16,
      "BLOCK_K": 32,
      "BLOCK_C": 256,
      "NUM_KSPLIT": 1,
      "num_warps": 8,
      "num_stages": 1,
      "waves_per_eu": 0
    },
    "957": {
      "BLOCK_M": 32,
      "BLOCK_N": 16,
      "BLOCK_K": 128,
      "BLOCK_C": 128,
      "NUM_KSPLIT": 2,
      "num_warps": 2,
      "num_stages": 2,
      "waves_per_eu": 0
    },
    "851": {
      "BLOCK_M": 32,
      "BLOCK_N": 16,
      "BLOCK_K": 128,
      "BLOCK_C": 32,
      "NUM_KSPLIT": 8,
      "num_warps": 2,
      "num_stages": 2,
      "waves_per_eu": 2
    },
    "5385": {
      "BLOCK_M": 256,
      "BLOCK_N": 16,
      "BLOCK_K": 128,
      "BLOCK_C": 256,
      "NUM_KSPLIT": 8,
      "num_warps": 2,
      "num_stages": 2,
      "waves_per_eu": 0
    },
    "1087": {
      "BLOCK_M": 32,
      "BLOCK_N": 16,
      "BLOCK_K": 256,
      "BLOCK_C": 16,
      "NUM_KSPLIT": 1,
      "num_warps": 4,
      "num_stages": 1,
      "waves_per_eu": 1
    },
    "1269": {
      "BLOCK_M": 32,
      "BLOCK_N": 16,
      "BLOCK_K": 256,
      "BLOCK_C": 64,
      "NUM_KSPLIT": 4,
      "num_warps": 4,
      "num_stages": 2,
      "waves_per_eu": 0
    },
    "1474": {
      "BLOCK_M": 64,
      "BLOCK_N": 16,
      "BLOCK_K": 32,
      "BLOCK_C": 16,
      "NUM_KSPLIT": 2,
      "num_warps": 8,
      "num_stages": 2,
      "waves_per_eu": 1
    },
    "320": {
      "BLOCK_M": 32,
      "BLOCK_N": 16,
      "BLOCK_K": 32,
      "BLOCK_C": 256,
      "NUM_KSPLIT": 2,
      "num_warps": 8,
      "num_stages": 1,
      "waves_per_eu": 2
    },
    "2417": {
      "BLOCK_M": 64,
      "BLOCK_N": 16,
      "BLOCK_K": 128,
      "BLOCK_C": 128,
      "NUM_KSPLIT": 4,
      "num_warps": 2,
      "num_stages": 2,
      "waves_per_eu": 2
    },
    "1716": {
      "BLOCK_M": 64,
      "BLOCK_N": 16,
      "BLOCK_K": 32,
      "BLOCK_C": 128,
      "NUM_KSPLIT": 8,
      "num_warps": 4,
      "num_stages": 1,
      "waves_per_eu": 0
    },
    "641": {
      "BLOCK_M": 32,
      "BLOCK_N": 16,
      "BLOCK_K": 64,
      "BLOCK_C": 128,
      "NUM_KSPLIT": 8,
      "num_warps": 4,
      "num_stages": 2,
      "waves_per_eu": 2
    },
    "4522": {
      "BLOCK_M": 256,
      "BLOCK_N": 16,
      "BLOCK_K": 32,
      "BLOCK_C": 64,
      "NUM_KSPLIT": 8,
      "num_warps": 2,
      "num_stages": 2,
      "waves_per_eu": 1
    },
    "1381": {
      "BLOCK_M": 32,
      "BLOCK_N": 16,
      "BLOCK_K": 256,
      "BLOCK_C": 256,
      "NUM_KSPLIT": 1,
      "num_warps": 8,
      "num_stages": 1,
      "waves_per_eu": 1
    },
    "1942": {
      "BLOCK_M": 64,
      "BLOCK_N": 16,
      "BLOCK_K": 64,
      "BLOCK_C": 32,
      "NUM_KSPLIT": 8,
      "num_warps": 8,
      "num_stages": 2,
      "waves_per_eu": 1
    },
    "5217": {
      "BLOCK_M": 256,
      "BLOCK_N": 16,
      "BLOCK_K": 128,
      "BLOCK_C": 64,
      "NUM_KSPLIT": 2,
      "num_warps": 8,
      "num_stages": 2,
      "waves_per_eu": 0
    },
    "1017": {
      "BLOCK_M": 32,
      "BLOCK_N": 16,
      "BLOCK_K": 128,
      "BLOCK_C": 256,
      "NUM_KSPLIT": 1,
      "num_warps": 4,
      "num_stages": 2,
      "waves_per_eu": 0
    },
    "309": {
      "BLOCK_M": 32,
      "BLOCK_N": 16,
      "BLOCK_K": 32,
      "BLOCK_C": 256,
      "NUM_KSPLIT": 2,
      "num_warps": 2,
      "num_stages": 2,
      "waves_per_eu": 0
    },
    "5510": {
      "BLOCK_M": 256,
      "BLOCK_N": 16,
      "BLOCK_K": 256,
      "BLOCK_C": 32,
      "NUM_KSPLIT": 4,
      "num_warps": 2,
      "num_stages": 1,
      "waves_per_eu": 2
    },
    "1499": {
      "BLOCK_M": 64,
      "BLOCK_N": 16,
      "BLOCK_K": 32,
      "BLOCK_C": 16,
      "NUM_KSPLIT": 8,
      "num_warps": 2,
      "num_stages": 2,
      "waves_per_eu": 2
    },
    "187": {
      "BLOCK_M": 32,
      "BLOCK_N": 16,
      "BLOCK_K": 32,
      "BLOCK_C": 64,
      "NUM_KSPLIT": 4,
      "num_warps": 4,
      "num_stages": 1,
      "waves_per_eu": 1
    },
    "4778": {
      "BLOCK_M": 256,
      "BLOCK_N": 16,
      "BLOCK_K": 64,
      "BLOCK_C": 32,
      "NUM_KSPLIT": 2,
      "num_warps": 4,
      "num_stages": 1,
      "waves_per_eu": 2
    },
    "2185": {
      "BLOCK_M": 64,
      "BLOCK_N": 16,
      "BLOCK_K": 128,
      "BLOCK_C": 16,
      "NUM_KSPLIT": 2,
      "num_warps": 4,
      "num_stages": 1,
      "waves_per_eu": 1
    },
    "1132": {
      "BLOCK_M": 32,
      "BLOCK_N": 16,
      "BLOCK_K": 256,
      "BLOCK_C": 16,
      "NUM_KSPLIT": 4,
      "num_warps": 8,
      "num_stages": 2,
      "waves_per_eu": 1
    },
    "4960": {
      "BLOCK_M": 256,
      "BLOCK_N": 16,
      "BLOCK_K": 64,
      "BLOCK_C": 128,
      "NUM_KSPLIT": 8,
      "num_warps": 4,
      "num_stages": 2,
      "waves_per_eu": 1
    },
    "547": {
      "BLOCK_M": 32,
      "BLOCK_N": 16,
      "BLOCK_K": 64,
      "BLOCK_C": 64,
      "NUM_KSPLIT": 4,
      "num_warps": 4,
      "num_stages": 1,
      "waves_per_eu": 1
    },
    "110": {
      "BLOCK_M": 32,
      "BLOCK_N": 16,
      "BLOCK_K": 32,
      "BLOCK_C": 32,
      "NUM_KSPLIT": 4,
      "num_warps": 2,
      "num_stages": 1,
      "waves_per_eu": 2
    },
    "267": {
      "BLOCK_M": 32,
      "BLOCK_N": 16,
      "BLOCK_K": 32,
      "BLOCK_C": 128,
      "NUM_KSPLIT": 4,
      "num_warps": 8,
      "num_stages": 2,
      "waves_per_eu": 0
    },
    "4952": {
      "BLOCK_M": 256,
      "BLOCK_N": 16,
      "BLOCK_K": 64,
      "BLOCK_C": 128,
      "NUM_KSPLIT": 8,
      "num_warps": 2,
      "num_stages": 1,
      "waves_per_eu": 2
    },
    "3050": {
      "BLOCK_M": 128,
      "BLOCK_N": 16,
      "BLOCK_K": 32,
      "BLOCK_C": 64,
      "NUM_KSPLIT": 2,
      "num_warps": 4,
      "num_stages": 1,
      "waves_per_eu": 2
    },
    "1732": {
      "BLOCK_M": 64,
      "BLOCK_N": 16,
      "BLOCK_K": 32,
      "BLOCK_C": 256,
      "NUM_KSPLIT": 1,
      "num_warps": 2,
      "num_stages": 2,
      "waves_per_eu": 1
    },
    "2917": {
      "BLOCK_M": 128,
      "BLOCK_N": 16,
      "BLOCK_K": 32,
      "BLOCK_C": 16,
      "NUM_KSPLIT": 4,
      "num_warps": 2,
      "num_stages": 1,
      "waves_per_eu": 1
    },
    "4777": {
      "BLOCK_M": 256,
      "BLOCK_N": 16,
      "BLOCK_K": 64,
      "BLOCK_C": 32,
      "NUM_KSPLIT": 2,
      "num_warps": 4,
      "num_stages": 1,
      "waves_per_eu": 1
    },
    "1588": {
      "BLOCK_M": 64,
      "BLOCK_N": 16,
      "BLOCK_K": 32,
      "BLOCK_C": 64,
      "NUM_KSPLIT": 1,
      "num_warps": 2,
      "num_stages": 2,
      "waves_per_eu": 1
    },
    "1331": {
      "BLOCK_M": 32,
      "BLOCK_N": 16,
      "BLOCK_K": 256,
      "BLOCK_C": 128,
      "NUM_KSPLIT": 2,
      "num_warps": 8,
      "num_stages": 2,
      "waves_per_eu": 2
    },
    "2277": {
      "BLOCK_M": 64,
      "BLOCK_N": 16,
      "BLOCK_K": 128,
      "BLOCK_C": 32,
      "NUM_KSPLIT": 4,
      "num_warps": 4,
      "num_stages": 2,
      "waves_per_eu": 0
    },
    "5400": {
      "BLOCK_M": 256,
      "BLOCK_N": 16,
      "BLOCK_K": 256,
      "BLOCK_C": 16,
      "NUM_KSPLIT": 1,
      "num_warps": 2,
      "num_stages": 1,
      "waves_per_eu": 0
    },
    "3529": {
      "BLOCK_M": 128,
      "BLOCK_N": 16,
      "BLOCK_K": 64,
      "BLOCK_C": 256,
      "NUM_KSPLIT": 1,
      "num_warps": 2,
      "num_stages": 1,
      "waves_per_eu": 1
    },
    "673": {
      "BLOCK_M": 32,
      "BLOCK_N": 16,
      "BLOCK_K": 64,
      "BLOCK_C": 256,
      "NUM_KSPLIT": 2,
      "num_warps": 4,
      "num_stages": 1,
      "waves_per_eu": 1
    },
    "5056": {
      "BLOCK_M": 256,
      "BLOCK_N": 16,
      "BLOCK_K": 128,
      "BLOCK_C": 16,
      "NUM_KSPLIT": 1,
      "num_warps": 8,
      "num_stages": 2,
      "waves_per_eu": 1
    },
    "4286": {
      "BLOCK_M": 128,
      "BLOCK_N": 16,
      "BLOCK_K": 256,
      "BLOCK_C": 256,
      "NUM_KSPLIT": 4,
      "num_warps": 2,
      "num_stages": 1,
      "waves_per_eu": 2
    },
    "1635": {
      "BLOCK_M": 64,
      "BLOCK_N": 16,
      "BLOCK_K": 32,
      "BLOCK_C": 64,
      "NUM_KSPLIT": 4,
      "num_warps": 8,
      "num_stages": 2,
      "waves_per_eu": 0
    },
    "5259": {
      "BLOCK_M": 256,
      "BLOCK_N": 16,
      "BLOCK_K": 128,
      "BLOCK_C": 128,
      "NUM_KSPLIT": 1,
      "num_warps": 2,
      "num_stages": 2,
      "waves_per_eu": 0
    },
    "4057": {
      "BLOCK_M": 128,
      "BLOCK_N": 16,
      "BLOCK_K": 256,
      "BLOCK_C": 32,
      "NUM_KSPLIT": 2,
      "num_warps": 4,
      "num_stages": 1,
      "waves_per_eu": 1
    },
    "406": {
      "BLOCK_M": 32,
      "BLOCK_N": 16,
      "BLOCK_K": 64,
      "BLOCK_C": 16,
      "NUM_KSPLIT": 4,
      "num_warps": 4,
      "num_stages": 2,
      "waves_per_eu": 1
    },
    "4361": {
      "BLOCK_M": 256,
      "BLOCK_N": 16,
      "BLOCK_K": 32,
      "BLOCK_C": 16,
      "NUM_KSPLIT": 4,
      "num_warps": 2,
      "num_stages": 2,
      "waves_per_eu": 2
    },
    "2224": {
      "BLOCK_M": 64,
      "BLOCK_N": 16,
      "BLOCK_K": 128,
      "BLOCK_C": 16,
      "NUM_KSPLIT": 8,
      "num_warps": 4,
      "num_stages": 2,
      "waves_per_eu": 1
    },
    "2521": {
      "BLOCK_M": 64,
      "BLOCK_N": 16,
      "BLOCK_K": 256,
      "BLOCK_C": 16,
      "NUM_KSPLIT": 1,
      "num_warps": 2,
      "num_stages": 1,
      "waves_per_eu": 1
    },
    "5353": {
      "BLOCK_M": 256,
      "BLOCK_N": 16,
      "BLOCK_K": 128,
      "BLOCK_C": 256,
      "NUM_KSPLIT": 2,
      "num_warps": 4,
      "num_stages": 1,
      "waves_per_eu": 1
    },
    "3280": {
      "BLOCK_M": 128,
      "BLOCK_N": 16,
      "BLOCK_K": 64,
      "BLOCK_C": 16,
      "NUM_KSPLIT": 4,
      "num_warps": 2,
      "num_stages": 2,
      "waves_per_eu": 1
    },
    "2121": {
      "BLOCK_M": 64,
      "BLOCK_N": 16,
      "BLOCK_K": 64,
      "BLOCK_C": 256,
      "NUM_KSPLIT": 2,
      "num_warps": 8,
      "num_stages": 2,
      "waves_per_eu": 0
    },
    "4380": {
      "BLOCK_M": 256,
      "BLOCK_N": 16,
      "BLOCK_K": 32,
      "BLOCK_C": 16,
      "NUM_KSPLIT": 8,
      "num_warps": 4,
      "num_stages": 1,
      "waves_per_eu": 0
    },
    "1839": {
      "BLOCK_M": 64,
      "BLOCK_N": 16,
      "BLOCK_K": 64,
      "BLOCK_C": 16,
      "NUM_KSPLIT": 4,
      "num_warps": 2,
      "num_stages": 2,
      "waves_per_eu": 0
    },
    "2184": {
      "BLOCK_M": 64,
      "BLOCK_N": 16,
      "BLOCK_K": 128,
      "BLOCK_C": 16,
      "NUM_KSPLIT": 2,
      "num_warps": 4,
      "num_stages": 1,
      "waves_per_eu": 0
    },
    "5369": {
      "BLOCK_M": 256,
      "BLOCK_N": 16,
      "BLOCK_K": 128,
      "BLOCK_C": 256,
      "NUM_KSPLIT": 4,
      "num_warps": 2,
      "num_stages": 2,
      "waves_per_eu": 2
    },
    "1913": {
      "BLOCK_M": 64,
      "BLOCK_N": 16,
      "BLOCK_K": 64,
      "BLOCK_C": 32,
      "NUM_KSPLIT": 4,
      "num_warps": 2,
      "num_stages": 2,
      "waves_per_eu": 2
    },
    "2314": {
      "BLOCK_M": 64,
      "BLOCK_N": 16,
      "BLOCK_K": 128,
      "BLOCK_C": 64,
      "NUM_KSPLIT": 1,
      "num_warps": 4,
      "num_stages": 2,
      "waves_per_eu": 1
    },
    "2201": {
      "BLOCK_M": 64,
      "BLOCK_N": 16,
      "BLOCK_K": 128,
      "BLOCK_C": 16,
      "NUM_KSPLIT": 4,
      "num_warps": 2,
      "num_stages": 2,
      "waves_per_eu": 2
    },
    "2854": {
      "BLOCK_M": 64,
      "BLOCK_N": 16,
      "BLOCK_K": 256,
      "BLOCK_C": 256,
      "NUM_KSPLIT": 4,
      "num_warps": 4,
      "num_stages": 2,
      "waves_per_eu": 1
    },
    "4765": {
      "BLOCK_M": 256,
      "BLOCK_N": 16,
      "BLOCK_K": 64,
      "BLOCK_C": 32,
      "NUM_KSPLIT": 1,
      "num_warps": 8,
      "num_stages": 1,
      "waves_per_eu": 1
    },
    "1321": {
      "BLOCK_M": 32,
      "BLOCK_N": 16,
      "BLOCK_K": 256,
      "BLOCK_C": 128,
      "NUM_KSPLIT": 2,
      "num_warps": 4,
      "num_stages": 1,
      "waves_per_eu": 1
    },
    "2944": {
      "BLOCK_M": 128,
      "BLOCK_N": 16,
      "BLOCK_K": 32,
      "BLOCK_C": 16,
      "NUM_KSPLIT": 8,
      "num_warps": 4,
      "num_stages": 2,
      "waves_per_eu": 1
    },
    "3118": {
      "BLOCK_M": 128,
      "BLOCK_N": 16,
      "BLOCK_K": 32,
      "BLOCK_C": 128,
      "NUM_KSPLIT": 2,
      "num_warps": 2,
      "num_stages": 2,
      "waves_per_eu": 1
    },
    "3039": {
      "BLOCK_M": 128,
      "BLOCK_N": 16,
      "BLOCK_K": 32,
      "BLOCK_C": 64,
      "NUM_KSPLIT": 1,
      "num_warps": 8,
      "num_stages": 2,
      "waves_per_eu": 0
    },
    "638": {
      "BLOCK_M": 32,
      "BLOCK_N": 16,
      "BLOCK_K": 64,
      "BLOCK_C": 128,
      "NUM_KSPLIT": 8,
      "num_warps": 4,
      "num_stages": 1,
      "waves_per_eu": 2
    },
    "1441": {
      "BLOCK_M": 64,
      "BLOCK_N": 16,
      "BLOCK_K": 32,
      "BLOCK_C": 16,
      "NUM_KSPLIT": 1,
      "num_warps": 2,
      "num_stages": 1,
      "waves_per_eu": 1
    },
    "32": {
      "BLOCK_M": 32,
      "BLOCK_N": 16,
      "BLOCK_K": 32,
      "BLOCK_C": 16,
      "NUM_KSPLIT": 2,
      "num_warps": 8,
      "num_stages": 1,
      "waves_per_eu": 2
    },
    "2440": {
      "BLOCK_M": 64,
      "BLOCK_N": 16,
      "BLOCK_K": 128,
      "BLOCK_C": 128,
      "NUM_KSPLIT": 8,
      "num_warps": 4,
      "num_stages": 2,
      "waves_per_eu": 1
    },
    "2509": {
      "BLOCK_M": 64,
      "BLOCK_N": 16,
      "BLOCK_K": 128,
      "BLOCK_C": 256,
      "NUM_KSPLIT": 8,
      "num_warps": 4,
      "num_stages": 1,
      "waves_per_eu": 1
    },
    "2395": {
      "BLOCK_M": 64,
      "BLOCK_N": 16,
      "BLOCK_K": 128,
      "BLOCK_C": 128,
      "NUM_KSPLIT": 2,
      "num_warps": 2,
      "num_stages": 1,
      "waves_per_eu": 1
    },
    "2079": {
      "BLOCK_M": 64,
      "BLOCK_N": 16,
      "BLOCK_K": 64,
      "BLOCK_C": 128,
      "NUM_KSPLIT": 8,
      "num_warps": 4,
      "num_stages": 2,
      "waves_per_eu": 0
    },
    "4653": {
      "BLOCK_M": 256,
      "BLOCK_N": 16,
      "BLOCK_K": 32,
      "BLOCK_C": 256,
      "NUM_KSPLIT": 4,
      "num_warps": 4,
      "num_stages": 2,
      "waves_per_eu": 0
    },
    "2227": {
      "BLOCK_M": 64,
      "BLOCK_N": 16,
      "BLOCK_K": 128,
      "BLOCK_C": 16,
      "NUM_KSPLIT": 8,
      "num_warps": 8,
      "num_stages": 1,
      "waves_per_eu": 1
    },
    "2720": {
      "BLOCK_M": 64,
      "BLOCK_N": 16,
      "BLOCK_K": 256,
      "BLOCK_C": 64,
      "NUM_KSPLIT": 8,
      "num_warps": 2,
      "num_stages": 1,
      "waves_per_eu": 2
    },
    "830": {
      "BLOCK_M": 32,
      "BLOCK_N": 16,
      "BLOCK_K": 128,
      "BLOCK_C": 32,
      "NUM_KSPLIT": 4,
      "num_warps": 2,
      "num_stages": 1,
      "waves_per_eu": 2
    },
    "1612": {
      "BLOCK_M": 64,
      "BLOCK_N": 16,
      "BLOCK_K": 32,
      "BLOCK_C": 64,
      "NUM_KSPLIT": 2,
      "num_warps": 4,
      "num_stages": 2,
      "waves_per_eu": 1
    },
    "292": {
      "BLOCK_M": 32,
      "BLOCK_N": 16,
      "BLOCK_K": 32,
      "BLOCK_C": 256,
      "NUM_KSPLIT": 1,
      "num_warps": 2,
      "num_stages": 2,
      "waves_per_eu": 1
    },
    "1397": {
      "BLOCK_M": 32,
      "BLOCK_N": 16,
      "BLOCK_K": 256,
      "BLOCK_C": 256,
      "NUM_KSPLIT": 2,
      "num_warps": 4,
      "num_stages": 2,
      "waves_per_eu": 2
    },
    "3800": {
      "BLOCK_M": 128,
      "BLOCK_N": 16,
      "BLOCK_K": 128,
      "BLOCK_C": 64,
      "NUM_KSPLIT": 8,
      "num_warps": 2,
      "num_stages": 1,
      "waves_per_eu": 2
    },
    "3848": {
      "BLOCK_M": 128,
      "BLOCK_N": 16,
      "BLOCK_K": 128,
      "BLOCK_C": 128,
      "NUM_KSPLIT": 2,
      "num_warps": 8,
      "num_stages": 1,
      "waves_per_eu": 2
    },
    "5537": {
      "BLOCK_M": 256,
      "BLOCK_N": 16,
      "BLOCK_K": 256,
      "BLOCK_C": 32,
      "NUM_KSPLIT": 8,
      "num_warps": 4,
      "num_stages": 2,
      "waves_per_eu": 2
    },
    "5499": {
      "BLOCK_M": 256,
      "BLOCK_N": 16,
      "BLOCK_K": 256,
      "BLOCK_C": 32,
      "NUM_KSPLIT": 2,
      "num_warps": 4,
      "num_stages": 2,
      "waves_per_eu": 0
    },
    "4054": {
      "BLOCK_M": 128,
      "BLOCK_N": 16,
      "BLOCK_K": 256,
      "BLOCK_C": 32,
      "NUM_KSPLIT": 2,
      "num_warps": 2,
      "num_stages": 2,
      "waves_per_eu": 1
    },
    "19": {
      "BLOCK_M": 32,
      "BLOCK_N": 16,
      "BLOCK_K": 32,
      "BLOCK_C": 16,
      "NUM_KSPLIT": 2,
      "num_warps": 2,
      "num_stages": 1,
      "waves_per_eu": 1
    },
    "3117": {
      "BLOCK_M": 128,
      "BLOCK_N": 16,
      "BLOCK_K": 32,
      "BLOCK_C": 128,
      "NUM_KSPLIT": 2,
      "num_warps": 2,
      "num_stages": 2,
      "waves_per_eu": 0
    },
    "1032": {
      "BLOCK_M": 32,
      "BLOCK_N": 16,
      "BLOCK_K": 128,
      "BLOCK_C": 256,
      "NUM_KSPLIT": 2,
      "num_warps": 4,
      "num_stages": 1,
      "waves_per_eu": 0
    },
    "289": {
      "BLOCK_M": 32,
      "BLOCK_N": 16,
      "BLOCK_K": 32,
      "BLOCK_C": 256,
      "NUM_KSPLIT": 1,
      "num_warps": 2,
      "num_stages": 1,
      "waves_per_eu": 1
    },
    "4521": {
      "BLOCK_M": 256,
      "BLOCK_N": 16,
      "BLOCK_K": 32,
      "BLOCK_C": 64,
      "NUM_KSPLIT": 8,
      "num_warps": 2,
      "num_stages": 2,
      "waves_per_eu": 0
    },
    "2673": {
      "BLOCK_M": 64,
      "BLOCK_N": 16,
      "BLOCK_K": 256,
      "BLOCK_C": 64,
      "NUM_KSPLIT": 1,
      "num_warps": 4,
      "num_stages": 2,
      "waves_per_eu": 0
    },
    "4349": {
      "BLOCK_M": 256,
      "BLOCK_N": 16,
      "BLOCK_K": 32,
      "BLOCK_C": 16,
      "NUM_KSPLIT": 2,
      "num_warps": 4,
      "num_stages": 2,
      "waves_per_eu": 2
    },
    "3496": {
      "BLOCK_M": 128,
      "BLOCK_N": 16,
      "BLOCK_K": 64,
      "BLOCK_C": 128,
      "NUM_KSPLIT": 4,
      "num_warps": 2,
      "num_stages": 2,
      "waves_per_eu": 1
    },
    "2782": {
      "BLOCK_M": 64,
      "BLOCK_N": 16,
      "BLOCK_K": 256,
      "BLOCK_C": 128,
      "NUM_KSPLIT": 4,
      "num_warps": 4,
      "num_stages": 2,
      "waves_per_eu": 1
    },
    "5235": {
      "BLOCK_M": 256,
      "BLOCK_N": 16,
      "BLOCK_K": 128,
      "BLOCK_C": 64,
      "NUM_KSPLIT": 4,
      "num_warps": 8,
      "num_stages": 2,
      "waves_per_eu": 0
    },
    "39": {
      "BLOCK_M": 32,
      "BLOCK_N": 16,
      "BLOCK_K": 32,
      "BLOCK_C": 16,
      "NUM_KSPLIT": 4,
      "num_warps": 2,
      "num_stages": 2,
      "waves_per_eu": 0
    },
    "3465": {
      "BLOCK_M": 128,
      "BLOCK_N": 16,
      "BLOCK_K": 64,
      "BLOCK_C": 128,
      "NUM_KSPLIT": 1,
      "num_warps": 4,
      "num_stages": 2,
      "waves_per_eu": 0
    },
    "3459": {
      "BLOCK_M": 128,
      "BLOCK_N": 16,
      "BLOCK_K": 64,
      "BLOCK_C": 128,
      "NUM_KSPLIT": 1,
      "num_warps": 2,
      "num_stages": 2,
      "waves_per_eu": 0
    },
    "2356": {
      "BLOCK_M": 64,
      "BLOCK_N": 16,
      "BLOCK_K": 128,
      "BLOCK_C": 64,
      "NUM_KSPLIT": 4,
      "num_warps": 8,
      "num_stages": 2,
      "waves_per_eu": 1
    },
    "3256": {
      "BLOCK_M": 128,
      "BLOCK_N": 16,
      "BLOCK_K": 64,
      "BLOCK_C": 16,
      "NUM_KSPLIT": 1,
      "num_warps": 8,
      "num_stages": 2,
      "waves_per_eu": 1
    },
    "4889": {
      "BLOCK_M": 256,
      "BLOCK_N": 16,
      "BLOCK_K": 64,
      "BLOCK_C": 64,
      "NUM_KSPLIT": 8,
      "num_warps": 4,
      "num_stages": 2,
      "waves_per_eu": 2
    },
    "2957": {
      "BLOCK_M": 128,
      "BLOCK_N": 16,
      "BLOCK_K": 32,
      "BLOCK_C": 32,
      "NUM_KSPLIT": 1,
      "num_warps": 2,
      "num_stages": 2,
      "waves_per_eu": 2
    },
    "3811": {
      "BLOCK_M": 128,
      "BLOCK_N": 16,
      "BLOCK_K": 128,
      "BLOCK_C": 64,
      "NUM_KSPLIT": 8,
      "num_warps": 8,
      "num_stages": 1,
      "waves_per_eu": 1
    },
    "2317": {
      "BLOCK_M": 64,
      "BLOCK_N": 16,
      "BLOCK_K": 128,
      "BLOCK_C": 64,
      "NUM_KSPLIT": 1,
      "num_warps": 8,
      "num_stages": 1,
      "waves_per_eu": 1
    },
    "2478": {
      "BLOCK_M": 64,
      "BLOCK_N": 16,
      "BLOCK_K": 128,
      "BLOCK_C": 256,
      "NUM_KSPLIT": 2,
      "num_warps": 8,
      "num_stages": 1,
      "waves_per_eu": 0
    },
    "437": {
      "BLOCK_M": 32,
      "BLOCK_N": 16,
      "BLOCK_K": 64,
      "BLOCK_C": 32,
      "NUM_KSPLIT": 1,
      "num_warps": 2,
      "num_stages": 2,
      "waves_per_eu": 2
    },
    "2624": {
      "BLOCK_M": 64,
      "BLOCK_N": 16,
      "BLOCK_K": 256,
      "BLOCK_C": 32,
      "NUM_KSPLIT": 2,
      "num_warps": 8,
      "num_stages": 1,
      "waves_per_eu": 2
    },
    "3870": {
      "BLOCK_M": 128,
      "BLOCK_N": 16,
      "BLOCK_K": 128,
      "BLOCK_C": 128,
      "NUM_KSPLIT": 8,
      "num_warps": 2,
      "num_stages": 1,
      "waves_per_eu": 0
    },
    "4691": {
      "BLOCK_M": 256,
      "BLOCK_N": 16,
      "BLOCK_K": 64,
      "BLOCK_C": 16,
      "NUM_KSPLIT": 1,
      "num_warps": 4,
      "num_stages": 2,
      "waves_per_eu": 2
    },
    "4932": {
      "BLOCK_M": 256,
      "BLOCK_N": 16,
      "BLOCK_K": 64,
      "BLOCK_C": 128,
      "NUM_KSPLIT": 4,
      "num_warps": 2,
      "num_stages": 1,
      "waves_per_eu": 0
    },
    "2158": {
      "BLOCK_M": 64,
      "BLOCK_N": 16,
      "BLOCK_K": 64,
      "BLOCK_C": 256,
      "NUM_KSPLIT": 8,
      "num_warps": 8,
      "num_stages": 2,
      "waves_per_eu": 1
    },
    "3352": {
      "BLOCK_M": 128,
      "BLOCK_N": 16,
      "BLOCK_K": 64,
      "BLOCK_C": 32,
      "NUM_KSPLIT": 4,
      "num_warps": 2,
      "num_stages": 2,
      "waves_per_eu": 1
    },
    "3202": {
      "BLOCK_M": 128,
      "BLOCK_N": 16,
      "BLOCK_K": 32,
      "BLOCK_C": 256,
      "NUM_KSPLIT": 2,
      "num_warps": 8,
      "num_stages": 2,
      "waves_per_eu": 1
    },
    "1018": {
      "BLOCK_M": 32,
      "BLOCK_N": 16,
      "BLOCK_K": 128,
      "BLOCK_C": 256,
      "NUM_KSPLIT": 1,
      "num_warps": 4,
      "num_stages": 2,
      "waves_per_eu": 1
    },
    "3837": {
      "BLOCK_M": 128,
      "BLOCK_N": 16,
      "BLOCK_K": 128,
      "BLOCK_C": 128,
      "NUM_KSPLIT": 2,
      "num_warps": 2,
      "num_stages": 2,
      "waves_per_eu": 0
    },
    "3462": {
      "BLOCK_M": 128,
      "BLOCK_N": 16,
      "BLOCK_K": 64,
      "BLOCK_C": 128,
      "NUM_KSPLIT": 1,
      "num_warps": 4,
      "num_stages": 1,
      "waves_per_eu": 0
    },
    "3787": {
      "BLOCK_M": 128,
      "BLOCK_N": 16,
      "BLOCK_K": 128,
      "BLOCK_C": 64,
      "NUM_KSPLIT": 4,
      "num_warps": 4,
      "num_stages": 1,
      "waves_per_eu": 1
    },
    "4882": {
      "BLOCK_M": 256,
      "BLOCK_N": 16,
      "BLOCK_K": 64,
      "BLOCK_C": 64,
      "NUM_KSPLIT": 8,
      "num_warps": 2,
      "num_stages": 2,
      "waves_per_eu": 1
    },
    "3359": {
      "BLOCK_M": 128,
      "BLOCK_N": 16,
      "BLOCK_K": 64,
      "BLOCK_C": 32,
      "NUM_KSPLIT": 4,
      "num_warps": 4,
      "num_stages": 2,
      "waves_per_eu": 2
    },
    "4236": {
      "BLOCK_M": 128,
      "BLOCK_N": 16,
      "BLOCK_K": 256,
      "BLOCK_C": 128,
      "NUM_KSPLIT": 8,
      "num_warps": 4,
      "num_stages": 1,
      "waves_per_eu": 0
    },
    "4133": {
      "BLOCK_M": 128,
      "BLOCK_N": 16,
      "BLOCK_K": 256,
      "BLOCK_C": 64,
      "NUM_KSPLIT": 2,
      "num_warps": 4,
      "num_stages": 2,
      "waves_per_eu": 2
    },
    "4001": {
      "BLOCK_M": 128,
      "BLOCK_N": 16,
      "BLOCK_K": 256,
      "BLOCK_C": 16,
      "NUM_KSPLIT": 4,
      "num_warps": 2,
      "num_stages": 2,
      "waves_per_eu": 2
    },
    "3457": {
      "BLOCK_M": 128,
      "BLOCK_N": 16,
      "BLOCK_K": 64,
      "BLOCK_C": 128,
      "NUM_KSPLIT": 1,
      "num_warps": 2,
      "num_stages": 1,
      "waves_per_eu": 1
    },
    "5229": {
      "BLOCK_M": 256,
      "BLOCK_N": 16,
      "BLOCK_K": 128,
      "BLOCK_C": 64,
      "NUM_KSPLIT": 4,
      "num_warps": 4,
      "num_stages": 2,
      "waves_per_eu": 0
    },
    "4682": {
      "BLOCK_M": 256,
      "BLOCK_N": 16,
      "BLOCK_K": 64,
      "BLOCK_C": 16,
      "NUM_KSPLIT": 1,
      "num_warps": 2,
      "num_stages": 1,
      "waves_per_eu": 2
    },
    "3587": {
      "BLOCK_M": 128,
      "BLOCK_N": 16,
      "BLOCK_K": 64,
      "BLOCK_C": 256,
      "NUM_KSPLIT": 8,
      "num_warps": 2,
      "num_stages": 2,
      "waves_per_eu": 2
    },
    "1701": {
      "BLOCK_M": 64,
      "BLOCK_N": 16,
      "BLOCK_K": 32,
      "BLOCK_C": 128,
      "NUM_KSPLIT": 4,
      "num_warps": 4,
      "num_stages": 2,
      "waves_per_eu": 0
    },
    "4480": {
      "BLOCK_M": 256,
      "BLOCK_N": 16,
      "BLOCK_K": 32,
      "BLOCK_C": 64,
      "NUM_KSPLIT": 1,
      "num_warps": 8,
      "num_stages": 2,
      "waves_per_eu": 1
    },
    "1548": {
      "BLOCK_M": 64,
      "BLOCK_N": 16,
      "BLOCK_K": 32,
      "BLOCK_C": 32,
      "NUM_KSPLIT": 4,
      "num_warps": 2,
      "num_stages": 1,
      "waves_per_eu": 0
    },
    "2772": {
      "BLOCK_M": 64,
      "BLOCK_N": 16,
      "BLOCK_K": 256,
      "BLOCK_C": 128,
      "NUM_KSPLIT": 4,
      "num_warps": 2,
      "num_stages": 1,
      "waves_per_eu": 0
    },
    "4185": {
      "BLOCK_M": 128,
      "BLOCK_N": 16,
      "BLOCK_K": 256,
      "BLOCK_C": 128,
      "NUM_KSPLIT": 1,
      "num_warps": 4,
      "num_stages": 2,
      "waves_per_eu": 0
    },
    "3434": {
      "BLOCK_M": 128,
      "BLOCK_N": 16,
      "BLOCK_K": 64,
      "BLOCK_C": 64,
      "NUM_KSPLIT": 4,
      "num_warps": 8,
      "num_stages": 1,
      "waves_per_eu": 2
    },
    "557": {
      "BLOCK_M": 32,
      "BLOCK_N": 16,
      "BLOCK_K": 64,
      "BLOCK_C": 64,
      "NUM_KSPLIT": 4,
      "num_warps": 8,
      "num_stages": 2,
      "waves_per_eu": 2
    },
    "649": {
      "BLOCK_M": 32,
      "BLOCK_N": 16,
      "BLOCK_K": 64,
      "BLOCK_C": 256,
      "NUM_KSPLIT": 1,
      "num_warps": 2,
      "num_stages": 1,
      "waves_per_eu": 1
    },
    "3551": {
      "BLOCK_M": 128,
      "BLOCK_N": 16,
      "BLOCK_K": 64,
      "BLOCK_C": 256,
      "NUM_KSPLIT": 2,
      "num_warps": 2,
      "num_stages": 2,
      "waves_per_eu": 2
    },
    "2837": {
      "BLOCK_M": 64,
      "BLOCK_N": 16,
      "BLOCK_K": 256,
      "BLOCK_C": 256,
      "NUM_KSPLIT": 2,
      "num_warps": 4,
      "num_stages": 2,
      "waves_per_eu": 2
    },
    "4386": {
      "BLOCK_M": 256,
      "BLOCK_N": 16,
      "BLOCK_K": 32,
      "BLOCK_C": 16,
      "NUM_KSPLIT": 8,
      "num_warps": 8,
      "num_stages": 1,
      "waves_per_eu": 0
    },
    "224": {
      "BLOCK_M": 32,
      "BLOCK_N": 16,
      "BLOCK_K": 32,
      "BLOCK_C": 128,
      "NUM_KSPLIT": 1,
      "num_warps": 4,
      "num_stages": 1,
      "waves_per_eu": 2
    },
    "4895": {
      "BLOCK_M": 256,
      "BLOCK_N": 16,
      "BLOCK_K": 64,
      "BLOCK_C": 64,
      "NUM_KSPLIT": 8,
      "num_warps": 8,
      "num_stages": 2,
      "waves_per_eu": 2
    },
    "3258": {
      "BLOCK_M": 128,
      "BLOCK_N": 16,
      "BLOCK_K": 64,
      "BLOCK_C": 16,
      "NUM_KSPLIT": 2,
      "num_warps": 2,
      "num_stages": 1,
      "waves_per_eu": 0
    },
    "2491": {
      "BLOCK_M": 64,
      "BLOCK_N": 16,
      "BLOCK_K": 128,
      "BLOCK_C": 256,
      "NUM_KSPLIT": 4,
      "num_warps": 4,
      "num_stages": 1,
      "waves_per_eu": 1
    },
    "2420": {
      "BLOCK_M": 64,
      "BLOCK_N": 16,
      "BLOCK_K": 128,
      "BLOCK_C": 128,
      "NUM_KSPLIT": 4,
      "num_warps": 4,
      "num_stages": 1,
      "waves_per_eu": 2
    },
    "2494": {
      "BLOCK_M": 64,
      "BLOCK_N": 16,
      "BLOCK_K": 128,
      "BLOCK_C": 256,
      "NUM_KSPLIT": 4,
      "num_warps": 4,
      "num_stages": 2,
      "waves_per_eu": 1
    },
    "456": {
      "BLOCK_M": 32,
      "BLOCK_N": 16,
      "BLOCK_K": 64,
      "BLOCK_C": 32,
      "NUM_KSPLIT": 2,
      "num_warps": 4,
      "num_stages": 1,
      "waves_per_eu": 0
    },
    "4437": {
      "BLOCK_M": 256,
      "BLOCK_N": 16,
      "BLOCK_K": 32,
      "BLOCK_C": 32,
      "NUM_KSPLIT": 4,
      "num_warps": 4,
      "num_stages": 2,
      "waves_per_eu": 0
    },
    "1496": {
      "BLOCK_M": 64,
      "BLOCK_N": 16,
      "BLOCK_K": 32,
      "BLOCK_C": 16,
      "NUM_KSPLIT": 8,
      "num_warps": 2,
      "num_stages": 1,
      "waves_per_eu": 2
    },
    "2795": {
      "BLOCK_M": 64,
      "BLOCK_N": 16,
      "BLOCK_K": 256,
      "BLOCK_C": 128,
      "NUM_KSPLIT": 8,
      "num_warps": 2,
      "num_stages": 2,
      "waves_per_eu": 2
    },
    "5006": {
      "BLOCK_M": 256,
      "BLOCK_N": 16,
      "BLOCK_K": 64,
      "BLOCK_C": 256,
      "NUM_KSPLIT": 4,
      "num_warps": 2,
      "num_stages": 1,
      "waves_per_eu": 2
    },
    "1465": {
      "BLOCK_M": 64,
      "BLOCK_N": 16,
      "BLOCK_K": 32,
      "BLOCK_C": 16,
      "NUM_KSPLIT": 2,
      "num_warps": 4,
      "num_stages": 1,
      "waves_per_eu": 1
    },
    "3233": {
      "BLOCK_M": 128,
      "BLOCK_N": 16,
      "BLOCK_K": 32,
      "BLOCK_C": 256,
      "NUM_KSPLIT": 8,
      "num_warps": 4,
      "num_stages": 2,
      "waves_per_eu": 2
    },
    "2931": {
      "BLOCK_M": 128,
      "BLOCK_N": 16,
      "BLOCK_K": 32,
      "BLOCK_C": 16,
      "NUM_KSPLIT": 4,
      "num_warps": 8,
      "num_stages": 2,
      "waves_per_eu": 0
    },
    "2382": {
      "BLOCK_M": 64,
      "BLOCK_N": 16,
      "BLOCK_K": 128,
      "BLOCK_C": 128,
      "NUM_KSPLIT": 1,
      "num_warps": 4,
      "num_stages": 1,
      "waves_per_eu": 0
    },
    "43": {
      "BLOCK_M": 32,
      "BLOCK_N": 16,
      "BLOCK_K": 32,
      "BLOCK_C": 16,
      "NUM_KSPLIT": 4,
      "num_warps": 4,
      "num_stages": 1,
      "waves_per_eu": 1
    },
    "576": {
      "BLOCK_M": 32,
      "BLOCK_N": 16,
      "BLOCK_K": 64,
      "BLOCK_C": 128,
      "NUM_KSPLIT": 1,
      "num_warps": 2,
      "num_stages": 1,
      "waves_per_eu": 0
    },
    "865": {
      "BLOCK_M": 32,
      "BLOCK_N": 16,
      "BLOCK_K": 128,
      "BLOCK_C": 64,
      "NUM_KSPLIT": 1,
      "num_warps": 2,
      "num_stages": 1,
      "waves_per_eu": 1
    },
    "4291": {
      "BLOCK_M": 128,
      "BLOCK_N": 16,
      "BLOCK_K": 256,
      "BLOCK_C": 256,
      "NUM_KSPLIT": 4,
      "num_warps": 4,
      "num_stages": 1,
      "waves_per_eu": 1
    },
    "3185": {
      "BLOCK_M": 128,
      "BLOCK_N": 16,
      "BLOCK_K": 32,
      "BLOCK_C": 256,
      "NUM_KSPLIT": 1,
      "num_warps": 8,
      "num_stages": 2,
      "waves_per_eu": 2
    },
    "4539": {
      "BLOCK_M": 256,
      "BLOCK_N": 16,
      "BLOCK_K": 32,
      "BLOCK_C": 128,
      "NUM_KSPLIT": 1,
      "num_warps": 2,
      "num_stages": 2,
      "waves_per_eu": 0
    },
    "3649": {
      "BLOCK_M": 128,
      "BLOCK_N": 16,
      "BLOCK_K": 128,
      "BLOCK_C": 16,
      "NUM_KSPLIT": 4,
      "num_warps": 8,
      "num_stages": 1,
      "waves_per_eu": 1
    },
    "1497": {
      "BLOCK_M": 64,
      "BLOCK_N": 16,
      "BLOCK_K": 32,
      "BLOCK_C": 16,
      "NUM_KSPLIT": 8,
      "num_warps": 2,
      "num_stages": 2,
      "waves_per_eu": 0
    },
    "3840": {
      "BLOCK_M": 128,
      "BLOCK_N": 16,
      "BLOCK_K": 128,
      "BLOCK_C": 128,
      "NUM_KSPLIT": 2,
      "num_warps": 4,
      "num_stages": 1,
      "waves_per_eu": 0
    },
    "2355": {
      "BLOCK_M": 64,
      "BLOCK_N": 16,
      "BLOCK_K": 128,
      "BLOCK_C": 64,
      "NUM_KSPLIT": 4,
      "num_warps": 8,
      "num_stages": 2,
      "waves_per_eu": 0
    },
    "2570": {
      "BLOCK_M": 64,
      "BLOCK_N": 16,
      "BLOCK_K": 256,
      "BLOCK_C": 16,
      "NUM_KSPLIT": 4,
      "num_warps": 8,
      "num_stages": 1,
      "waves_per_eu": 2
    },
    "3198": {
      "BLOCK_M": 128,
      "BLOCK_N": 16,
      "BLOCK_K": 32,
      "BLOCK_C": 256,
      "NUM_KSPLIT": 2,
      "num_warps": 8,
      "num_stages": 1,
      "waves_per_eu": 0
    },
    "919": {
      "BLOCK_M": 32,
      "BLOCK_N": 16,
      "BLOCK_K": 128,
      "BLOCK_C": 64,
      "NUM_KSPLIT": 8,
      "num_warps": 2,
      "num_stages": 1,
      "waves_per_eu": 1
    },
    "2183": {
      "BLOCK_M": 64,
      "BLOCK_N": 16,
      "BLOCK_K": 128,
      "BLOCK_C": 16,
      "NUM_KSPLIT": 2,
      "num_warps": 2,
      "num_stages": 2,
      "waves_per_eu": 2
    },
    "1102": {
      "BLOCK_M": 32,
      "BLOCK_N": 16,
      "BLOCK_K": 256,
      "BLOCK_C": 16,
      "NUM_KSPLIT": 2,
      "num_warps": 2,
      "num_stages": 2,
      "waves_per_eu": 1
    },
    "4031": {
      "BLOCK_M": 128,
      "BLOCK_N": 16,
      "BLOCK_K": 256,
      "BLOCK_C": 16,
      "NUM_KSPLIT": 8,
      "num_warps": 8,
      "num_stages": 2,
      "waves_per_eu": 2
    },
    "4527": {
      "BLOCK_M": 256,
      "BLOCK_N": 16,
      "BLOCK_K": 32,
      "BLOCK_C": 64,
      "NUM_KSPLIT": 8,
      "num_warps": 4,
      "num_stages": 2,
      "waves_per_eu": 0
    },
    "1571": {
      "BLOCK_M": 64,
      "BLOCK_N": 16,
      "BLOCK_K": 32,
      "BLOCK_C": 32,
      "NUM_KSPLIT": 8,
      "num_warps": 2,
      "num_stages": 2,
      "waves_per_eu": 2
    },
    "5102": {
      "BLOCK_M": 256,
      "BLOCK_N": 16,
      "BLOCK_K": 128,
      "BLOCK_C": 16,
      "NUM_KSPLIT": 8,
      "num_warps": 4,
      "num_stages": 1,
      "waves_per_eu": 2
    },
    "1479": {
      "BLOCK_M": 64,
      "BLOCK_N": 16,
      "BLOCK_K": 32,
      "BLOCK_C": 16,
      "NUM_KSPLIT": 4,
      "num_warps": 2,
      "num_stages": 2,
      "waves_per_eu": 0
    },
    "3854": {
      "BLOCK_M": 128,
      "BLOCK_N": 16,
      "BLOCK_K": 128,
      "BLOCK_C": 128,
      "NUM_KSPLIT": 4,
      "num_warps": 2,
      "num_stages": 1,
      "waves_per_eu": 2
    },
    "378": {
      "BLOCK_M": 32,
      "BLOCK_N": 16,
      "BLOCK_K": 64,
      "BLOCK_C": 16,
      "NUM_KSPLIT": 2,
      "num_warps": 2,
      "num_stages": 1,
      "waves_per_eu": 0
    },
    "2497": {
      "BLOCK_M": 64,
      "BLOCK_N": 16,
      "BLOCK_K": 128,
      "BLOCK_C": 256,
      "NUM_KSPLIT": 4,
      "num_warps": 8,
      "num_stages": 1,
      "waves_per_eu": 1
    },
    "2602": {
      "BLOCK_M": 64,
      "BLOCK_N": 16,
      "BLOCK_K": 256,
      "BLOCK_C": 32,
      "NUM_KSPLIT": 1,
      "num_warps": 4,
      "num_stages": 2,
      "waves_per_eu": 1
    },
    "3552": {
      "BLOCK_M": 128,
      "BLOCK_N": 16,
      "BLOCK_K": 64,
      "BLOCK_C": 256,
      "NUM_KSPLIT": 2,
      "num_warps": 4,
      "num_stages": 1,
      "waves_per_eu": 0
    },
    "1449": {
      "BLOCK_M": 64,
      "BLOCK_N": 16,
      "BLOCK_K": 32,
      "BLOCK_C": 16,
      "NUM_KSPLIT": 1,
      "num_warps": 4,
      "num_stages": 2,
      "waves_per_eu": 0
    },
    "2354": {
      "BLOCK_M": 64,
      "BLOCK_N": 16,
      "BLOCK_K": 128,
      "BLOCK_C": 64,
      "NUM_KSPLIT": 4,
      "num_warps": 8,
      "num_stages": 1,
      "waves_per_eu": 2
    },
    "5022": {
      "BLOCK_M": 256,
      "BLOCK_N": 16,
      "BLOCK_K": 64,
      "BLOCK_C": 256,
      "NUM_KSPLIT": 8,
      "num_warps": 2,
      "num_stages": 1,
      "waves_per_eu": 0
    },
    "3851": {
      "BLOCK_M": 128,
      "BLOCK_N": 16,
      "BLOCK_K": 128,
      "BLOCK_C": 128,
      "NUM_KSPLIT": 2,
      "num_warps": 8,
      "num_stages": 2,
      "waves_per_eu": 2
    },
    "714": {
      "BLOCK_M": 32,
      "BLOCK_N": 16,
      "BLOCK_K": 64,
      "BLOCK_C": 256,
      "NUM_KSPLIT": 8,
      "num_warps": 8,
      "num_stages": 1,
      "waves_per_eu": 0
    },
    "4869": {
      "BLOCK_M": 256,
      "BLOCK_N": 16,
      "BLOCK_K": 64,
      "BLOCK_C": 64,
      "NUM_KSPLIT": 4,
      "num_warps": 4,
      "num_stages": 2,
      "waves_per_eu": 0
    },
    "2210": {
      "BLOCK_M": 64,
      "BLOCK_N": 16,
      "BLOCK_K": 128,
      "BLOCK_C": 16,
      "NUM_KSPLIT": 4,
      "num_warps": 8,
      "num_stages": 1,
      "waves_per_eu": 2
    },
    "2102": {
      "BLOCK_M": 64,
      "BLOCK_N": 16,
      "BLOCK_K": 64,
      "BLOCK_C": 256,
      "NUM_KSPLIT": 1,
      "num_warps": 8,
      "num_stages": 1,
      "waves_per_eu": 2
    },
    "4582": {
      "BLOCK_M": 256,
      "BLOCK_N": 16,
      "BLOCK_K": 32,
      "BLOCK_C": 128,
      "NUM_KSPLIT": 4,
      "num_warps": 4,
      "num_stages": 2,
      "waves_per_eu": 1
    },
    "4958": {
      "BLOCK_M": 256,
      "BLOCK_N": 16,
      "BLOCK_K": 64,
      "BLOCK_C": 128,
      "NUM_KSPLIT": 8,
      "num_warps": 4,
      "num_stages": 1,
      "waves_per_eu": 2
    },
    "4650": {
      "BLOCK_M": 256,
      "BLOCK_N": 16,
      "BLOCK_K": 32,
      "BLOCK_C": 256,
      "NUM_KSPLIT": 4,
      "num_warps": 4,
      "num_stages": 1,
      "waves_per_eu": 0
    },
    "5519": {
      "BLOCK_M": 256,
      "BLOCK_N": 16,
      "BLOCK_K": 256,
      "BLOCK_C": 32,
      "NUM_KSPLIT": 4,
      "num_warps": 4,
      "num_stages": 2,
      "waves_per_eu": 2
    },
    "183": {
      "BLOCK_M": 32,
      "BLOCK_N": 16,
      "BLOCK_K": 32,
      "BLOCK_C": 64,
      "NUM_KSPLIT": 4,
      "num_warps": 2,
      "num_stages": 2,
      "waves_per_eu": 0
    },
    "530": {
      "BLOCK_M": 32,
      "BLOCK_N": 16,
      "BLOCK_K": 64,
      "BLOCK_C": 64,
      "NUM_KSPLIT": 2,
      "num_warps": 4,
      "num_stages": 1,
      "waves_per_eu": 2
    },
    "3696": {
      "BLOCK_M": 128,
      "BLOCK_N": 16,
      "BLOCK_K": 128,
      "BLOCK_C": 32,
      "NUM_KSPLIT": 2,
      "num_warps": 4,
      "num_stages": 1,
      "waves_per_eu": 0
    },
    "5412": {
      "BLOCK_M": 256,
      "BLOCK_N": 16,
      "BLOCK_K": 256,
      "BLOCK_C": 16,
      "NUM_KSPLIT": 1,
      "num_warps": 8,
      "num_stages": 1,
      "waves_per_eu": 0
    },
    "4141": {
      "BLOCK_M": 128,
      "BLOCK_N": 16,
      "BLOCK_K": 256,
      "BLOCK_C": 64,
      "NUM_KSPLIT": 4,
      "num_warps": 2,
      "num_stages": 1,
      "waves_per_eu": 1
    },
    "2585": {
      "BLOCK_M": 64,
      "BLOCK_N": 16,
      "BLOCK_K": 256,
      "BLOCK_C": 16,
      "NUM_KSPLIT": 8,
      "num_warps": 4,
      "num_stages": 2,
      "waves_per_eu": 2
    },
    "5489": {
      "BLOCK_M": 256,
      "BLOCK_N": 16,
      "BLOCK_K": 256,
      "BLOCK_C": 32,
      "NUM_KSPLIT": 1,
      "num_warps": 8,
      "num_stages": 2,
      "waves_per_eu": 2
    },
    "2743": {
      "BLOCK_M": 64,
      "BLOCK_N": 16,
      "BLOCK_K": 256,
      "BLOCK_C": 128,
      "NUM_KSPLIT": 1,
      "num_warps": 4,
      "num_stages": 1,
      "waves_per_eu": 1
    },
    "858": {
      "BLOCK_M": 32,
      "BLOCK_N": 16,
      "BLOCK_K": 128,
      "BLOCK_C": 32,
      "NUM_KSPLIT": 8,
      "num_warps": 8,
      "num_stages": 1,
      "waves_per_eu": 0
    },
    "4403": {
      "BLOCK_M": 256,
      "BLOCK_N": 16,
      "BLOCK_K": 32,
      "BLOCK_C": 32,
      "NUM_KSPLIT": 1,
      "num_warps": 4,
      "num_stages": 2,
      "waves_per_eu": 2
    },
    "3387": {
      "BLOCK_M": 128,
      "BLOCK_N": 16,
      "BLOCK_K": 64,
      "BLOCK_C": 64,
      "NUM_KSPLIT": 1,
      "num_warps": 2,
      "num_stages": 2,
      "waves_per_eu": 0
    },
    "4165": {
      "BLOCK_M": 128,
      "BLOCK_N": 16,
      "BLOCK_K": 256,
      "BLOCK_C": 64,
      "NUM_KSPLIT": 8,
      "num_warps": 4,
      "num_stages": 1,
      "waves_per_eu": 1
    },
    "5150": {
      "BLOCK_M": 256,
      "BLOCK_N": 16,
      "BLOCK_K": 128,
      "BLOCK_C": 32,
      "NUM_KSPLIT": 4,
      "num_warps": 2,
      "num_stages": 1,
      "waves_per_eu": 2
    },
    "217": {
      "BLOCK_M": 32,
      "BLOCK_N": 16,
      "BLOCK_K": 32,
      "BLOCK_C": 128,
      "NUM_KSPLIT": 1,
      "num_warps": 2,
      "num_stages": 1,
      "waves_per_eu": 1
    },
    "1533": {
      "BLOCK_M": 64,
      "BLOCK_N": 16,
      "BLOCK_K": 32,
      "BLOCK_C": 32,
      "NUM_KSPLIT": 2,
      "num_warps": 2,
      "num_stages": 2,
      "waves_per_eu": 0
    },
    "5324": {
      "BLOCK_M": 256,
      "BLOCK_N": 16,
      "BLOCK_K": 128,
      "BLOCK_C": 128,
      "NUM_KSPLIT": 8,
      "num_warps": 8,
      "num_stages": 1,
      "waves_per_eu": 2
    },
    "3934": {
      "BLOCK_M": 128,
      "BLOCK_N": 16,
      "BLOCK_K": 128,
      "BLOCK_C": 256,
      "NUM_KSPLIT": 4,
      "num_warps": 4,
      "num_stages": 2,
      "waves_per_eu": 1
    },
    "1665": {
      "BLOCK_M": 64,
      "BLOCK_N": 16,
      "BLOCK_K": 32,
      "BLOCK_C": 128,
      "NUM_KSPLIT": 1,
      "num_warps": 4,
      "num_stages": 2,
      "waves_per_eu": 0
    },
    "2993": {
      "BLOCK_M": 128,
      "BLOCK_N": 16,
      "BLOCK_K": 32,
      "BLOCK_C": 32,
      "NUM_KSPLIT": 4,
      "num_warps": 2,
      "num_stages": 2,
      "waves_per_eu": 2
    },
    "3654": {
      "BLOCK_M": 128,
      "BLOCK_N": 16,
      "BLOCK_K": 128,
      "BLOCK_C": 16,
      "NUM_KSPLIT": 8,
      "num_warps": 2,
      "num_stages": 1,
      "waves_per_eu": 0
    },
    "5433": {
      "BLOCK_M": 256,
      "BLOCK_N": 16,
      "BLOCK_K": 256,
      "BLOCK_C": 16,
      "NUM_KSPLIT": 2,
      "num_warps": 8,
      "num_stages": 2,
      "waves_per_eu": 0
    },
    "570": {
      "BLOCK_M": 32,
      "BLOCK_N": 16,
      "BLOCK_K": 64,
      "BLOCK_C": 64,
      "NUM_KSPLIT": 8,
      "num_warps": 8,
      "num_stages": 1,
      "waves_per_eu": 0
    },
    "4330": {
      "BLOCK_M": 256,
      "BLOCK_N": 16,
      "BLOCK_K": 32,
      "BLOCK_C": 16,
      "NUM_KSPLIT": 1,
      "num_warps": 4,
      "num_stages": 2,
      "waves_per_eu": 1
    },
    "4773": {
      "BLOCK_M": 256,
      "BLOCK_N": 16,
      "BLOCK_K": 64,
      "BLOCK_C": 32,
      "NUM_KSPLIT": 2,
      "num_warps": 2,
      "num_stages": 2,
      "waves_per_eu": 0
    },
    "2266": {
      "BLOCK_M": 64,
      "BLOCK_N": 16,
      "BLOCK_K": 128,
      "BLOCK_C": 32,
      "NUM_KSPLIT": 2,
      "num_warps": 8,
      "num_stages": 2,
      "waves_per_eu": 1
    },
    "3742": {
      "BLOCK_M": 128,
      "BLOCK_N": 16,
      "BLOCK_K": 128,
      "BLOCK_C": 32,
      "NUM_KSPLIT": 8,
      "num_warps": 8,
      "num_stages": 2,
      "waves_per_eu": 1
    },
    "2935": {
      "BLOCK_M": 128,
      "BLOCK_N": 16,
      "BLOCK_K": 32,
      "BLOCK_C": 16,
      "NUM_KSPLIT": 8,
      "num_warps": 2,
      "num_stages": 1,
      "waves_per_eu": 1
    },
    "1044": {
      "BLOCK_M": 32,
      "BLOCK_N": 16,
      "BLOCK_K": 128,
      "BLOCK_C": 256,
      "NUM_KSPLIT": 4,
      "num_warps": 2,
      "num_stages": 1,
      "waves_per_eu": 0
    },
    "2423": {
      "BLOCK_M": 64,
      "BLOCK_N": 16,
      "BLOCK_K": 128,
      "BLOCK_C": 128,
      "NUM_KSPLIT": 4,
      "num_warps": 4,
      "num_stages": 2,
      "waves_per_eu": 2
    },
    "3873": {
      "BLOCK_M": 128,
      "BLOCK_N": 16,
      "BLOCK_K": 128,
      "BLOCK_C": 128,
      "NUM_KSPLIT": 8,
      "num_warps": 2,
      "num_stages": 2,
      "waves_per_eu": 0
    },
    "175": {
      "BLOCK_M": 32,
      "BLOCK_N": 16,
      "BLOCK_K": 32,
      "BLOCK_C": 64,
      "NUM_KSPLIT": 2,
      "num_warps": 8,
      "num_stages": 1,
      "waves_per_eu": 1
    },
    "1568": {
      "BLOCK_M": 64,
      "BLOCK_N": 16,
      "BLOCK_K": 32,
      "BLOCK_C": 32,
      "NUM_KSPLIT": 8,
      "num_warps": 2,
      "num_stages": 1,
      "waves_per_eu": 2
    },
    "3164": {
      "BLOCK_M": 128,
      "BLOCK_N": 16,
      "BLOCK_K": 32,
      "BLOCK_C": 128,
      "NUM_KSPLIT": 8,
      "num_warps": 8,
      "num_stages": 1,
      "waves_per_eu": 2
    },
    "5445": {
      "BLOCK_M": 256,
      "BLOCK_N": 16,
      "BLOCK_K": 256,
      "BLOCK_C": 16,
      "NUM_KSPLIT": 4,
      "num_warps": 4,
      "num_stages": 2,
      "waves_per_eu": 0
    },
    "5457": {
      "BLOCK_M": 256,
      "BLOCK_N": 16,
      "BLOCK_K": 256,
      "BLOCK_C": 16,
      "NUM_KSPLIT": 8,
      "num_warps": 2,
      "num_stages": 2,
      "waves_per_eu": 0
    },
    "49": {
      "BLOCK_M": 32,
      "BLOCK_N": 16,
      "BLOCK_K": 32,
      "BLOCK_C": 16,
      "NUM_KSPLIT": 4,
      "num_warps": 8,
      "num_stages": 1,
      "waves_per_eu": 1
    },
    "2650": {
      "BLOCK_M": 64,
      "BLOCK_N": 16,
      "BLOCK_K": 256,
      "BLOCK_C": 32,
      "NUM_KSPLIT": 8,
      "num_warps": 2,
      "num_stages": 2,
      "waves_per_eu": 1
    },
    "3929": {
      "BLOCK_M": 128,
      "BLOCK_N": 16,
      "BLOCK_K": 128,
      "BLOCK_C": 256,
      "NUM_KSPLIT": 4,
      "num_warps": 2,
      "num_stages": 2,
      "waves_per_eu": 2
    },
    "3558": {
      "BLOCK_M": 128,
      "BLOCK_N": 16,
      "BLOCK_K": 64,
      "BLOCK_C": 256,
      "NUM_KSPLIT": 2,
      "num_warps": 8,
      "num_stages": 1,
      "waves_per_eu": 0
    },
    "943": {
      "BLOCK_M": 32,
      "BLOCK_N": 16,
      "BLOCK_K": 128,
      "BLOCK_C": 128,
      "NUM_KSPLIT": 1,
      "num_warps": 4,
      "num_stages": 1,
      "waves_per_eu": 1
    },
    "5037": {
      "BLOCK_M": 256,
      "BLOCK_N": 16,
      "BLOCK_K": 64,
      "BLOCK_C": 256,
      "NUM_KSPLIT": 8,
      "num_warps": 8,
      "num_stages": 2,
      "waves_per_eu": 0
    },
    "2334": {
      "BLOCK_M": 64,
      "BLOCK_N": 16,
      "BLOCK_K": 128,
      "BLOCK_C": 64,
      "NUM_KSPLIT": 2,
      "num_warps": 8,
      "num_stages": 1,
      "waves_per_eu": 0
    },
    "1837": {
      "BLOCK_M": 64,
      "BLOCK_N": 16,
      "BLOCK_K": 64,
      "BLOCK_C": 16,
      "NUM_KSPLIT": 4,
      "num_warps": 2,
      "num_stages": 1,
      "waves_per_eu": 1
    },
    "1325": {
      "BLOCK_M": 32,
      "BLOCK_N": 16,
      "BLOCK_K": 256,
      "BLOCK_C": 128,
      "NUM_KSPLIT": 2,
      "num_warps": 4,
      "num_stages": 2,
      "waves_per_eu": 2
    },
    "3896": {
      "BLOCK_M": 128,
      "BLOCK_N": 16,
      "BLOCK_K": 128,
      "BLOCK_C": 256,
      "NUM_KSPLIT": 1,
      "num_warps": 4,
      "num_stages": 1,
      "waves_per_eu": 2
    },
    "5498": {
      "BLOCK_M": 256,
      "BLOCK_N": 16,
      "BLOCK_K": 256,
      "BLOCK_C": 32,
      "NUM_KSPLIT": 2,
      "num_warps": 4,
      "num_stages": 1,
      "waves_per_eu": 2
    },
    "4976": {
      "BLOCK_M": 256,
      "BLOCK_N": 16,
      "BLOCK_K": 64,
      "BLOCK_C": 256,
      "NUM_KSPLIT": 1,
      "num_warps": 4,
      "num_stages": 1,
      "waves_per_eu": 2
    },
    "3397": {
      "BLOCK_M": 128,
      "BLOCK_N": 16,
      "BLOCK_K": 64,
      "BLOCK_C": 64,
      "NUM_KSPLIT": 1,
      "num_warps": 8,
      "num_stages": 1,
      "waves_per_eu": 1
    },
    "1976": {
      "BLOCK_M": 64,
      "BLOCK_N": 16,
      "BLOCK_K": 64,
      "BLOCK_C": 64,
      "NUM_KSPLIT": 2,
      "num_warps": 8,
      "num_stages": 1,
      "waves_per_eu": 2
    },
    "3614": {
      "BLOCK_M": 128,
      "BLOCK_N": 16,
      "BLOCK_K": 128,
      "BLOCK_C": 16,
      "NUM_KSPLIT": 1,
      "num_warps": 8,
      "num_stages": 1,
      "waves_per_eu": 2
    },
    "526": {
      "BLOCK_M": 32,
      "BLOCK_N": 16,
      "BLOCK_K": 64,
      "BLOCK_C": 64,
      "NUM_KSPLIT": 2,
      "num_warps": 2,
      "num_stages": 2,
      "waves_per_eu": 1
    },
    "4193": {
      "BLOCK_M": 128,
      "BLOCK_N": 16,
      "BLOCK_K": 256,
      "BLOCK_C": 128,
      "NUM_KSPLIT": 1,
      "num_warps": 8,
      "num_stages": 2,
      "waves_per_eu": 2
    },
    "2016": {
      "BLOCK_M": 64,
      "BLOCK_N": 16,
      "BLOCK_K": 64,
      "BLOCK_C": 128,
      "NUM_KSPLIT": 1,
      "num_warps": 2,
      "num_stages": 1,
      "waves_per_eu": 0
    },
    "2530": {
      "BLOCK_M": 64,
      "BLOCK_N": 16,
      "BLOCK_K": 256,
      "BLOCK_C": 16,
      "NUM_KSPLIT": 1,
      "num_warps": 4,
      "num_stages": 2,
      "waves_per_eu": 1
    },
    "4332": {
      "BLOCK_M": 256,
      "BLOCK_N": 16,
      "BLOCK_K": 32,
      "BLOCK_C": 16,
      "NUM_KSPLIT": 1,
      "num_warps": 8,
      "num_stages": 1,
      "waves_per_eu": 0
    },
    "2578": {
      "BLOCK_M": 64,
      "BLOCK_N": 16,
      "BLOCK_K": 256,
      "BLOCK_C": 16,
      "NUM_KSPLIT": 8,
      "num_warps": 2,
      "num_stages": 2,
      "waves_per_eu": 1
    },
    "3894": {
      "BLOCK_M": 128,
      "BLOCK_N": 16,
      "BLOCK_K": 128,
      "BLOCK_C": 256,
      "NUM_KSPLIT": 1,
      "num_warps": 4,
      "num_stages": 1,
      "waves_per_eu": 0
    },
    "4836": {
      "BLOCK_M": 256,
      "BLOCK_N": 16,
      "BLOCK_K": 64,
      "BLOCK_C": 64,
      "NUM_KSPLIT": 1,
      "num_warps": 8,
      "num_stages": 1,
      "waves_per_eu": 0
    },
    "5151": {
      "BLOCK_M": 256,
      "BLOCK_N": 16,
      "BLOCK_K": 128,
      "BLOCK_C": 32,
      "NUM_KSPLIT": 4,
      "num_warps": 2,
      "num_stages": 2,
      "waves_per_eu": 0
    },
    "124": {
      "BLOCK_M": 32,
      "BLOCK_N": 16,
      "BLOCK_K": 32,
      "BLOCK_C": 32,
      "NUM_KSPLIT": 4,
      "num_warps": 8,
      "num_stages": 2,
      "waves_per_eu": 1
    },
    "3081": {
      "BLOCK_M": 128,
      "BLOCK_N": 16,
      "BLOCK_K": 32,
      "BLOCK_C": 64,
      "NUM_KSPLIT": 8,
      "num_warps": 2,
      "num_stages": 2,
      "waves_per_eu": 0
    },
    "4202": {
      "BLOCK_M": 128,
      "BLOCK_N": 16,
      "BLOCK_K": 256,
      "BLOCK_C": 128,
      "NUM_KSPLIT": 2,
      "num_warps": 4,
      "num_stages": 1,
      "waves_per_eu": 2
    },
    "4783": {
      "BLOCK_M": 256,
      "BLOCK_N": 16,
      "BLOCK_K": 64,
      "BLOCK_C": 32,
      "NUM_KSPLIT": 2,
      "num_warps": 8,
      "num_stages": 1,
      "waves_per_eu": 1
    },
    "4924": {
      "BLOCK_M": 256,
      "BLOCK_N": 16,
      "BLOCK_K": 64,
      "BLOCK_C": 128,
      "NUM_KSPLIT": 2,
      "num_warps": 4,
      "num_stages": 2,
      "waves_per_eu": 1
    },
    "1802": {
      "BLOCK_M": 64,
      "BLOCK_N": 16,
      "BLOCK_K": 64,
      "BLOCK_C": 16,
      "NUM_KSPLIT": 1,
      "num_warps": 2,
      "num_stages": 1,
      "waves_per_eu": 2
    },
    "1842": {
      "BLOCK_M": 64,
      "BLOCK_N": 16,
      "BLOCK_K": 64,
      "BLOCK_C": 16,
      "NUM_KSPLIT": 4,
      "num_warps": 4,
      "num_stages": 1,
      "waves_per_eu": 0
    },
    "1656": {
      "BLOCK_M": 64,
      "BLOCK_N": 16,
      "BLOCK_K": 32,
      "BLOCK_C": 128,
      "NUM_KSPLIT": 1,
      "num_warps": 2,
      "num_stages": 1,
      "waves_per_eu": 0
    },
    "4975": {
      "BLOCK_M": 256,
      "BLOCK_N": 16,
      "BLOCK_K": 64,
      "BLOCK_C": 256,
      "NUM_KSPLIT": 1,
      "num_warps": 4,
      "num_stages": 1,
      "waves_per_eu": 1
    },
    "3667": {
      "BLOCK_M": 128,
      "BLOCK_N": 16,
      "BLOCK_K": 128,
      "BLOCK_C": 16,
      "NUM_KSPLIT": 8,
      "num_warps": 8,
      "num_stages": 1,
      "waves_per_eu": 1
    },
    "4678": {
      "BLOCK_M": 256,
      "BLOCK_N": 16,
      "BLOCK_K": 32,
      "BLOCK_C": 256,
      "NUM_KSPLIT": 8,
      "num_warps": 8,
      "num_stages": 2,
      "waves_per_eu": 1
    },
    "1494": {
      "BLOCK_M": 64,
      "BLOCK_N": 16,
      "BLOCK_K": 32,
      "BLOCK_C": 16,
      "NUM_KSPLIT": 8,
      "num_warps": 2,
      "num_stages": 1,
      "waves_per_eu": 0
    },
    "4105": {
      "BLOCK_M": 128,
      "BLOCK_N": 16,
      "BLOCK_K": 256,
      "BLOCK_C": 64,
      "NUM_KSPLIT": 1,
      "num_warps": 2,
      "num_stages": 1,
      "waves_per_eu": 1
    },
    "4260": {
      "BLOCK_M": 128,
      "BLOCK_N": 16,
      "BLOCK_K": 256,
      "BLOCK_C": 256,
      "NUM_KSPLIT": 1,
      "num_warps": 8,
      "num_stages": 1,
      "waves_per_eu": 0
    },
    "375": {
      "BLOCK_M": 32,
      "BLOCK_N": 16,
      "BLOCK_K": 64,
      "BLOCK_C": 16,
      "NUM_KSPLIT": 1,
      "num_warps": 8,
      "num_stages": 2,
      "waves_per_eu": 0
    },
    "3054": {
      "BLOCK_M": 128,
      "BLOCK_N": 16,
      "BLOCK_K": 32,
      "BLOCK_C": 64,
      "NUM_KSPLIT": 2,
      "num_warps": 8,
      "num_stages": 1,
      "waves_per_eu": 0
    },
    "1228": {
      "BLOCK_M": 32,
      "BLOCK_N": 16,
      "BLOCK_K": 256,
      "BLOCK_C": 64,
      "NUM_KSPLIT": 1,
      "num_warps": 2,
      "num_stages": 2,
      "waves_per_eu": 1
    },
    "4897": {
      "BLOCK_M": 256,
      "BLOCK_N": 16,
      "BLOCK_K": 64,
      "BLOCK_C": 128,
      "NUM_KSPLIT": 1,
      "num_warps": 2,
      "num_stages": 1,
      "waves_per_eu": 1
    },
    "2962": {
      "BLOCK_M": 128,
      "BLOCK_N": 16,
      "BLOCK_K": 32,
      "BLOCK_C": 32,
      "NUM_KSPLIT": 1,
      "num_warps": 4,
      "num_stages": 2,
      "waves_per_eu": 1
    },
    "3928": {
      "BLOCK_M": 128,
      "BLOCK_N": 16,
      "BLOCK_K": 128,
      "BLOCK_C": 256,
      "NUM_KSPLIT": 4,
      "num_warps": 2,
      "num_stages": 2,
      "waves_per_eu": 1
    },
    "5728": {
      "BLOCK_M": 256,
      "BLOCK_N": 16,
      "BLOCK_K": 256,
      "BLOCK_C": 256,
      "NUM_KSPLIT": 4,
      "num_warps": 2,
      "num_stages": 2,
      "waves_per_eu": 1
    },
    "2705": {
      "BLOCK_M": 64,
      "BLOCK_N": 16,
      "BLOCK_K": 256,
      "BLOCK_C": 64,
      "NUM_KSPLIT": 4,
      "num_warps": 2,
      "num_stages": 2,
      "waves_per_eu": 2
    },
    "3369": {
      "BLOCK_M": 128,
      "BLOCK_N": 16,
      "BLOCK_K": 64,
      "BLOCK_C": 32,
      "NUM_KSPLIT": 8,
      "num_warps": 2,
      "num_stages": 2,
      "waves_per_eu": 0
    },
    "1660": {
      "BLOCK_M": 64,
      "BLOCK_N": 16,
      "BLOCK_K": 32,
      "BLOCK_C": 128,
      "NUM_KSPLIT": 1,
      "num_warps": 2,
      "num_stages": 2,
      "waves_per_eu": 1
    },
    "497": {
      "BLOCK_M": 32,
      "BLOCK_N": 16,
      "BLOCK_K": 64,
      "BLOCK_C": 32,
      "NUM_KSPLIT": 8,
      "num_warps": 4,
      "num_stages": 2,
      "waves_per_eu": 2
    },
    "2349": {
      "BLOCK_M": 64,
      "BLOCK_N": 16,
      "BLOCK_K": 128,
      "BLOCK_C": 64,
      "NUM_KSPLIT": 4,
      "num_warps": 4,
      "num_stages": 2,
      "waves_per_eu": 0
    },
    "4901": {
      "BLOCK_M": 256,
      "BLOCK_N": 16,
      "BLOCK_K": 64,
      "BLOCK_C": 128,
      "NUM_KSPLIT": 1,
      "num_warps": 2,
      "num_stages": 2,
      "waves_per_eu": 2
    },
    "4862": {
      "BLOCK_M": 256,
      "BLOCK_N": 16,
      "BLOCK_K": 64,
      "BLOCK_C": 64,
      "NUM_KSPLIT": 4,
      "num_warps": 2,
      "num_stages": 1,
      "waves_per_eu": 2
    },
    "2856": {
      "BLOCK_M": 64,
      "BLOCK_N": 16,
      "BLOCK_K": 256,
      "BLOCK_C": 256,
      "NUM_KSPLIT": 4,
      "num_warps": 8,
      "num_stages": 1,
      "waves_per_eu": 0
    },
    "343": {
      "BLOCK_M": 32,
      "BLOCK_N": 16,
      "BLOCK_K": 32,
      "BLOCK_C": 256,
      "NUM_KSPLIT": 8,
      "num_warps": 2,
      "num_stages": 1,
      "waves_per_eu": 1
    },
    "5148": {
      "BLOCK_M": 256,
      "BLOCK_N": 16,
      "BLOCK_K": 128,
      "BLOCK_C": 32,
      "NUM_KSPLIT": 4,
      "num_warps": 2,
      "num_stages": 1,
      "waves_per_eu": 0
    },
    "72": {
      "BLOCK_M": 32,
      "BLOCK_N": 16,
      "BLOCK_K": 32,
      "BLOCK_C": 32,
      "NUM_KSPLIT": 1,
      "num_warps": 2,
      "num_stages": 1,
      "waves_per_eu": 0
    },
    "2564": {
      "BLOCK_M": 64,
      "BLOCK_N": 16,
      "BLOCK_K": 256,
      "BLOCK_C": 16,
      "NUM_KSPLIT": 4,
      "num_warps": 4,
      "num_stages": 1,
      "waves_per_eu": 2
    },
    "1557": {
      "BLOCK_M": 64,
      "BLOCK_N": 16,
      "BLOCK_K": 32,
      "BLOCK_C": 32,
      "NUM_KSPLIT": 4,
      "num_warps": 4,
      "num_stages": 2,
      "waves_per_eu": 0
    },
    "1305": {
      "BLOCK_M": 32,
      "BLOCK_N": 16,
      "BLOCK_K": 256,
      "BLOCK_C": 128,
      "NUM_KSPLIT": 1,
      "num_warps": 4,
      "num_stages": 2,
      "waves_per_eu": 0
    },
    "141": {
      "BLOCK_M": 32,
      "BLOCK_N": 16,
      "BLOCK_K": 32,
      "BLOCK_C": 32,
      "NUM_KSPLIT": 8,
      "num_warps": 8,
      "num_stages": 2,
      "waves_per_eu": 0
    },
    "1477": {
      "BLOCK_M": 64,
      "BLOCK_N": 16,
      "BLOCK_K": 32,
      "BLOCK_C": 16,
      "NUM_KSPLIT": 4,
      "num_warps": 2,
      "num_stages": 1,
      "waves_per_eu": 1
    },
    "1099": {
      "BLOCK_M": 32,
      "BLOCK_N": 16,
      "BLOCK_K": 256,
      "BLOCK_C": 16,
      "NUM_KSPLIT": 2,
      "num_warps": 2,
      "num_stages": 1,
      "waves_per_eu": 1
    },
    "1996": {
      "BLOCK_M": 64,
      "BLOCK_N": 16,
      "BLOCK_K": 64,
      "BLOCK_C": 64,
      "NUM_KSPLIT": 4,
      "num_warps": 8,
      "num_stages": 2,
      "waves_per_eu": 1
    },
    "1417": {
      "BLOCK_M": 32,
      "BLOCK_N": 16,
      "BLOCK_K": 256,
      "BLOCK_C": 256,
      "NUM_KSPLIT": 4,
      "num_warps": 8,
      "num_stages": 1,
      "waves_per_eu": 1
    },
    "4237": {
      "BLOCK_M": 128,
      "BLOCK_N": 16,
      "BLOCK_K": 256,
      "BLOCK_C": 128,
      "NUM_KSPLIT": 8,
      "num_warps": 4,
      "num_stages": 1,
      "waves_per_eu": 1
    },
    "992": {
      "BLOCK_M": 32,
      "BLOCK_N": 16,
      "BLOCK_K": 128,
      "BLOCK_C": 128,
      "NUM_KSPLIT": 8,
      "num_warps": 2,
      "num_stages": 1,
      "waves_per_eu": 2
    },
    "902": {
      "BLOCK_M": 32,
      "BLOCK_N": 16,
      "BLOCK_K": 128,
      "BLOCK_C": 64,
      "NUM_KSPLIT": 4,
      "num_warps": 2,
      "num_stages": 1,
      "waves_per_eu": 2
    },
    "622": {
      "BLOCK_M": 32,
      "BLOCK_N": 16,
      "BLOCK_K": 64,
      "BLOCK_C": 128,
      "NUM_KSPLIT": 4,
      "num_warps": 4,
      "num_stages": 2,
      "waves_per_eu": 1
    },
    "5319": {
      "BLOCK_M": 256,
      "BLOCK_N": 16,
      "BLOCK_K": 128,
      "BLOCK_C": 128,
      "NUM_KSPLIT": 8,
      "num_warps": 4,
      "num_stages": 2,
      "waves_per_eu": 0
    },
    "4992": {
      "BLOCK_M": 256,
      "BLOCK_N": 16,
      "BLOCK_K": 64,
      "BLOCK_C": 256,
      "NUM_KSPLIT": 2,
      "num_warps": 4,
      "num_stages": 1,
      "waves_per_eu": 0
    },
    "675": {
      "BLOCK_M": 32,
      "BLOCK_N": 16,
      "BLOCK_K": 64,
      "BLOCK_C": 256,
      "NUM_KSPLIT": 2,
      "num_warps": 4,
      "num_stages": 2,
      "waves_per_eu": 0
    },
    "5432": {
      "BLOCK_M": 256,
      "BLOCK_N": 16,
      "BLOCK_K": 256,
      "BLOCK_C": 16,
      "NUM_KSPLIT": 2,
      "num_warps": 8,
      "num_stages": 1,
      "waves_per_eu": 2
    },
    "1823": {
      "BLOCK_M": 64,
      "BLOCK_N": 16,
      "BLOCK_K": 64,
      "BLOCK_C": 16,
      "NUM_KSPLIT": 2,
      "num_warps": 2,
      "num_stages": 2,
      "waves_per_eu": 2
    },
    "448": {
      "BLOCK_M": 32,
      "BLOCK_N": 16,
      "BLOCK_K": 64,
      "BLOCK_C": 32,
      "NUM_KSPLIT": 1,
      "num_warps": 8,
      "num_stages": 2,
      "waves_per_eu": 1
    },
    "1462": {
      "BLOCK_M": 64,
      "BLOCK_N": 16,
      "BLOCK_K": 32,
      "BLOCK_C": 16,
      "NUM_KSPLIT": 2,
      "num_warps": 2,
      "num_stages": 2,
      "waves_per_eu": 1
    },
    "5664": {
      "BLOCK_M": 256,
      "BLOCK_N": 16,
      "BLOCK_K": 256,
      "BLOCK_C": 128,
      "NUM_KSPLIT": 4,
      "num_warps": 8,
      "num_stages": 1,
      "waves_per_eu": 0
    },
    "2171": {
      "BLOCK_M": 64,
      "BLOCK_N": 16,
      "BLOCK_K": 128,
      "BLOCK_C": 16,
      "NUM_KSPLIT": 1,
      "num_warps": 4,
      "num_stages": 2,
      "waves_per_eu": 2
    },
    "186": {
      "BLOCK_M": 32,
      "BLOCK_N": 16,
      "BLOCK_K": 32,
      "BLOCK_C": 64,
      "NUM_KSPLIT": 4,
      "num_warps": 4,
      "num_stages": 1,
      "waves_per_eu": 0
    },
    "3353": {
      "BLOCK_M": 128,
      "BLOCK_N": 16,
      "BLOCK_K": 64,
      "BLOCK_C": 32,
      "NUM_KSPLIT": 4,
      "num_warps": 2,
      "num_stages": 2,
      "waves_per_eu": 2
    },
    "3972": {
      "BLOCK_M": 128,
      "BLOCK_N": 16,
      "BLOCK_K": 256,
      "BLOCK_C": 16,
      "NUM_KSPLIT": 1,
      "num_warps": 8,
      "num_stages": 1,
      "waves_per_eu": 0
    },
    "4794": {
      "BLOCK_M": 256,
      "BLOCK_N": 16,
      "BLOCK_K": 64,
      "BLOCK_C": 32,
      "NUM_KSPLIT": 4,
      "num_warps": 4,
      "num_stages": 1,
      "waves_per_eu": 0
    },
    "299": {
      "BLOCK_M": 32,
      "BLOCK_N": 16,
      "BLOCK_K": 32,
      "BLOCK_C": 256,
      "NUM_KSPLIT": 1,
      "num_warps": 4,
      "num_stages": 2,
      "waves_per_eu": 2
    },
    "3704": {
      "BLOCK_M": 128,
      "BLOCK_N": 16,
      "BLOCK_K": 128,
      "BLOCK_C": 32,
      "NUM_KSPLIT": 2,
      "num_warps": 8,
      "num_stages": 1,
      "waves_per_eu": 2
    },
    "5323": {
      "BLOCK_M": 256,
      "BLOCK_N": 16,
      "BLOCK_K": 128,
      "BLOCK_C": 128,
      "NUM_KSPLIT": 8,
      "num_warps": 8,
      "num_stages": 1,
      "waves_per_eu": 1
    },
    "3866": {
      "BLOCK_M": 128,
      "BLOCK_N": 16,
      "BLOCK_K": 128,
      "BLOCK_C": 128,
      "NUM_KSPLIT": 4,
      "num_warps": 8,
      "num_stages": 1,
      "waves_per_eu": 2
    },
    "2362": {
      "BLOCK_M": 64,
      "BLOCK_N": 16,
      "BLOCK_K": 128,
      "BLOCK_C": 64,
      "NUM_KSPLIT": 8,
      "num_warps": 2,
      "num_stages": 2,
      "waves_per_eu": 1
    },
    "230": {
      "BLOCK_M": 32,
      "BLOCK_N": 16,
      "BLOCK_K": 32,
      "BLOCK_C": 128,
      "NUM_KSPLIT": 1,
      "num_warps": 8,
      "num_stages": 1,
      "waves_per_eu": 2
    },
    "3310": {
      "BLOCK_M": 128,
      "BLOCK_N": 16,
      "BLOCK_K": 64,
      "BLOCK_C": 16,
      "NUM_KSPLIT": 8,
      "num_warps": 8,
      "num_stages": 2,
      "waves_per_eu": 1
    },
    "4994": {
      "BLOCK_M": 256,
      "BLOCK_N": 16,
      "BLOCK_K": 64,
      "BLOCK_C": 256,
      "NUM_KSPLIT": 2,
      "num_warps": 4,
      "num_stages": 1,
      "waves_per_eu": 2
    },
    "3856": {
      "BLOCK_M": 128,
      "BLOCK_N": 16,
      "BLOCK_K": 128,
      "BLOCK_C": 128,
      "NUM_KSPLIT": 4,
      "num_warps": 2,
      "num_stages": 2,
      "waves_per_eu": 1
    },
    "2542": {
      "BLOCK_M": 64,
      "BLOCK_N": 16,
      "BLOCK_K": 256,
      "BLOCK_C": 16,
      "NUM_KSPLIT": 2,
      "num_warps": 2,
      "num_stages": 2,
      "waves_per_eu": 1
    },
    "4392": {
      "BLOCK_M": 256,
      "BLOCK_N": 16,
      "BLOCK_K": 32,
      "BLOCK_C": 32,
      "NUM_KSPLIT": 1,
      "num_warps": 2,
      "num_stages": 1,
      "waves_per_eu": 0
    },
    "3332": {
      "BLOCK_M": 128,
      "BLOCK_N": 16,
      "BLOCK_K": 64,
      "BLOCK_C": 32,
      "NUM_KSPLIT": 2,
      "num_warps": 2,
      "num_stages": 1,
      "waves_per_eu": 2
    },
    "3664": {
      "BLOCK_M": 128,
      "BLOCK_N": 16,
      "BLOCK_K": 128,
      "BLOCK_C": 16,
      "NUM_KSPLIT": 8,
      "num_warps": 4,
      "num_stages": 2,
      "waves_per_eu": 1
    },
    "318": {
      "BLOCK_M": 32,
      "BLOCK_N": 16,
      "BLOCK_K": 32,
      "BLOCK_C": 256,
      "NUM_KSPLIT": 2,
      "num_warps": 8,
      "num_stages": 1,
      "waves_per_eu": 0
    },
    "3770": {
      "BLOCK_M": 128,
      "BLOCK_N": 16,
      "BLOCK_K": 128,
      "BLOCK_C": 64,
      "NUM_KSPLIT": 2,
      "num_warps": 4,
      "num_stages": 1,
      "waves_per_eu": 2
    },
    "3963": {
      "BLOCK_M": 128,
      "BLOCK_N": 16,
      "BLOCK_K": 256,
      "BLOCK_C": 16,
      "NUM_KSPLIT": 1,
      "num_warps": 2,
      "num_stages": 2,
      "waves_per_eu": 0
    },
    "229": {
      "BLOCK_M": 32,
      "BLOCK_N": 16,
      "BLOCK_K": 32,
      "BLOCK_C": 128,
      "NUM_KSPLIT": 1,
      "num_warps": 8,
      "num_stages": 1,
      "waves_per_eu": 1
    },
    "1545": {
      "BLOCK_M": 64,
      "BLOCK_N": 16,
      "BLOCK_K": 32,
      "BLOCK_C": 32,
      "NUM_KSPLIT": 2,
      "num_warps": 8,
      "num_stages": 2,
      "waves_per_eu": 0
    },
    "3169": {
      "BLOCK_M": 128,
      "BLOCK_N": 16,
      "BLOCK_K": 32,
      "BLOCK_C": 256,
      "NUM_KSPLIT": 1,
      "num_warps": 2,
      "num_stages": 1,
      "waves_per_eu": 1
    },
    "538": {
      "BLOCK_M": 32,
      "BLOCK_N": 16,
      "BLOCK_K": 64,
      "BLOCK_C": 64,
      "NUM_KSPLIT": 2,
      "num_warps": 8,
      "num_stages": 2,
      "waves_per_eu": 1
    },
    "2739": {
      "BLOCK_M": 64,
      "BLOCK_N": 16,
      "BLOCK_K": 256,
      "BLOCK_C": 128,
      "NUM_KSPLIT": 1,
      "num_warps": 2,
      "num_stages": 2,
      "waves_per_eu": 0
    },
    "1418": {
      "BLOCK_M": 32,
      "BLOCK_N": 16,
      "BLOCK_K": 256,
      "BLOCK_C": 256,
      "NUM_KSPLIT": 4,
      "num_warps": 8,
      "num_stages": 1,
      "waves_per_eu": 2
    },
    "4664": {
      "BLOCK_M": 256,
      "BLOCK_N": 16,
      "BLOCK_K": 32,
      "BLOCK_C": 256,
      "NUM_KSPLIT": 8,
      "num_warps": 2,
      "num_stages": 1,
      "waves_per_eu": 2
    },
    "2668": {
      "BLOCK_M": 64,
      "BLOCK_N": 16,
      "BLOCK_K": 256,
      "BLOCK_C": 64,
      "NUM_KSPLIT": 1,
      "num_warps": 2,
      "num_stages": 2,
      "waves_per_eu": 1
    },
    "580": {
      "BLOCK_M": 32,
      "BLOCK_N": 16,
      "BLOCK_K": 64,
      "BLOCK_C": 128,
      "NUM_KSPLIT": 1,
      "num_warps": 2,
      "num_stages": 2,
      "waves_per_eu": 1
    },
    "4911": {
      "BLOCK_M": 256,
      "BLOCK_N": 16,
      "BLOCK_K": 64,
      "BLOCK_C": 128,
      "NUM_KSPLIT": 1,
      "num_warps": 8,
      "num_stages": 2,
      "waves_per_eu": 0
    },
    "208": {
      "BLOCK_M": 32,
      "BLOCK_N": 16,
      "BLOCK_K": 32,
      "BLOCK_C": 64,
      "NUM_KSPLIT": 8,
      "num_warps": 4,
      "num_stages": 2,
      "waves_per_eu": 1
    },
    "1574": {
      "BLOCK_M": 64,
      "BLOCK_N": 16,
      "BLOCK_K": 32,
      "BLOCK_C": 32,
      "NUM_KSPLIT": 8,
      "num_warps": 4,
      "num_stages": 1,
      "waves_per_eu": 2
    },
    "1661": {
      "BLOCK_M": 64,
      "BLOCK_N": 16,
      "BLOCK_K": 32,
      "BLOCK_C": 128,
      "NUM_KSPLIT": 1,
      "num_warps": 2,
      "num_stages": 2,
      "waves_per_eu": 2
    },
    "136": {
      "BLOCK_M": 32,
      "BLOCK_N": 16,
      "BLOCK_K": 32,
      "BLOCK_C": 32,
      "NUM_KSPLIT": 8,
      "num_warps": 4,
      "num_stages": 2,
      "waves_per_eu": 1
    },
    "4856": {
      "BLOCK_M": 256,
      "BLOCK_N": 16,
      "BLOCK_K": 64,
      "BLOCK_C": 64,
      "NUM_KSPLIT": 2,
      "num_warps": 8,
      "num_stages": 1,
      "waves_per_eu": 2
    },
    "1773": {
      "BLOCK_M": 64,
      "BLOCK_N": 16,
      "BLOCK_K": 32,
      "BLOCK_C": 256,
      "NUM_KSPLIT": 4,
      "num_warps": 4,
      "num_stages": 2,
      "waves_per_eu": 0
    },
    "1089": {
      "BLOCK_M": 32,
      "BLOCK_N": 16,
      "BLOCK_K": 256,
      "BLOCK_C": 16,
      "NUM_KSPLIT": 1,
      "num_warps": 4,
      "num_stages": 2,
      "waves_per_eu": 0
    },
    "4531": {
      "BLOCK_M": 256,
      "BLOCK_N": 16,
      "BLOCK_K": 32,
      "BLOCK_C": 64,
      "NUM_KSPLIT": 8,
      "num_warps": 8,
      "num_stages": 1,
      "waves_per_eu": 1
    },
    "4492": {
      "BLOCK_M": 256,
      "BLOCK_N": 16,
      "BLOCK_K": 32,
      "BLOCK_C": 64,
      "NUM_KSPLIT": 2,
      "num_warps": 4,
      "num_stages": 2,
      "waves_per_eu": 1
    },
    "5447": {
      "BLOCK_M": 256,
      "BLOCK_N": 16,
      "BLOCK_K": 256,
      "BLOCK_C": 16,
      "NUM_KSPLIT": 4,
      "num_warps": 4,
      "num_stages": 2,
      "waves_per_eu": 2
    },
    "5424": {
      "BLOCK_M": 256,
      "BLOCK_N": 16,
      "BLOCK_K": 256,
      "BLOCK_C": 16,
      "NUM_KSPLIT": 2,
      "num_warps": 4,
      "num_stages": 1,
      "waves_per_eu": 0
    },
    "3": {
      "BLOCK_M": 32,
      "BLOCK_N": 16,
      "BLOCK_K": 32,
      "BLOCK_C": 16,
      "NUM_KSPLIT": 1,
      "num_warps": 2,
      "num_stages": 2,
      "waves_per_eu": 0
    },
    "2122": {
      "BLOCK_M": 64,
      "BLOCK_N": 16,
      "BLOCK_K": 64,
      "BLOCK_C": 256,
      "NUM_KSPLIT": 2,
      "num_warps": 8,
      "num_stages": 2,
      "waves_per_eu": 1
    },
    "801": {
      "BLOCK_M": 32,
      "BLOCK_N": 16,
      "BLOCK_K": 128,
      "BLOCK_C": 32,
      "NUM_KSPLIT": 1,
      "num_warps": 4,
      "num_stages": 2,
      "waves_per_eu": 0
    },
    "1735": {
      "BLOCK_M": 64,
      "BLOCK_N": 16,
      "BLOCK_K": 32,
      "BLOCK_C": 256,
      "NUM_KSPLIT": 1,
      "num_warps": 4,
      "num_stages": 1,
      "waves_per_eu": 1
    },
    "5610": {
      "BLOCK_M": 256,
      "BLOCK_N": 16,
      "BLOCK_K": 256,
      "BLOCK_C": 64,
      "NUM_KSPLIT": 8,
      "num_warps": 8,
      "num_stages": 1,
      "waves_per_eu": 0
    },
    "2749": {
      "BLOCK_M": 64,
      "BLOCK_N": 16,
      "BLOCK_K": 256,
      "BLOCK_C": 128,
      "NUM_KSPLIT": 1,
      "num_warps": 8,
      "num_stages": 1,
      "waves_per_eu": 1
    },
    "100": {
      "BLOCK_M": 32,
      "BLOCK_N": 16,
      "BLOCK_K": 32,
      "BLOCK_C": 32,
      "NUM_KSPLIT": 2,
      "num_warps": 4,
      "num_stages": 2,
      "waves_per_eu": 1
    },
    "1923": {
      "BLOCK_M": 64,
      "BLOCK_N": 16,
      "BLOCK_K": 64,
      "BLOCK_C": 32,
      "NUM_KSPLIT": 4,
      "num_warps": 8,
      "num_stages": 2,
      "waves_per_eu": 0
    },
    "2589": {
      "BLOCK_M": 64,
      "BLOCK_N": 16,
      "BLOCK_K": 256,
      "BLOCK_C": 16,
      "NUM_KSPLIT": 8,
      "num_warps": 8,
      "num_stages": 2,
      "waves_per_eu": 0
    },
    "1736": {
      "BLOCK_M": 64,
      "BLOCK_N": 16,
      "BLOCK_K": 32,
      "BLOCK_C": 256,
      "NUM_KSPLIT": 1,
      "num_warps": 4,
      "num_stages": 1,
      "waves_per_eu": 2
    },
    "2711": {
      "BLOCK_M": 64,
      "BLOCK_N": 16,
      "BLOCK_K": 256,
      "BLOCK_C": 64,
      "NUM_KSPLIT": 4,
      "num_warps": 4,
      "num_stages": 2,
      "waves_per_eu": 2
    },
    "4717": {
      "BLOCK_M": 256,
      "BLOCK_N": 16,
      "BLOCK_K": 64,
      "BLOCK_C": 16,
      "NUM_KSPLIT": 4,
      "num_warps": 2,
      "num_stages": 1,
      "waves_per_eu": 1
    },
    "5321": {
      "BLOCK_M": 256,
      "BLOCK_N": 16,
      "BLOCK_K": 128,
      "BLOCK_C": 128,
      "NUM_KSPLIT": 8,
      "num_warps": 4,
      "num_stages": 2,
      "waves_per_eu": 2
    },
    "5716": {
      "BLOCK_M": 256,
      "BLOCK_N": 16,
      "BLOCK_K": 256,
      "BLOCK_C": 256,
      "NUM_KSPLIT": 2,
      "num_warps": 4,
      "num_stages": 2,
      "waves_per_eu": 1
    },
    "3768": {
      "BLOCK_M": 128,
      "BLOCK_N": 16,
      "BLOCK_K": 128,
      "BLOCK_C": 64,
      "NUM_KSPLIT": 2,
      "num_warps": 4,
      "num_stages": 1,
      "waves_per_eu": 0
    },
    "4107": {
      "BLOCK_M": 128,
      "BLOCK_N": 16,
      "BLOCK_K": 256,
      "BLOCK_C": 64,
      "NUM_KSPLIT": 1,
      "num_warps": 2,
      "num_stages": 2,
      "waves_per_eu": 0
    },
    "1214": {
      "BLOCK_M": 32,
      "BLOCK_N": 16,
      "BLOCK_K": 256,
      "BLOCK_C": 32,
      "NUM_KSPLIT": 8,
      "num_warps": 4,
      "num_stages": 1,
      "waves_per_eu": 2
    },
    "3638": {
      "BLOCK_M": 128,
      "BLOCK_N": 16,
      "BLOCK_K": 128,
      "BLOCK_C": 16,
      "NUM_KSPLIT": 4,
      "num_warps": 2,
      "num_stages": 1,
      "waves_per_eu": 2
    },
    "2069": {
      "BLOCK_M": 64,
      "BLOCK_N": 16,
      "BLOCK_K": 64,
      "BLOCK_C": 128,
      "NUM_KSPLIT": 4,
      "num_warps": 8,
      "num_stages": 2,
      "waves_per_eu": 2
    },
    "2279": {
      "BLOCK_M": 64,
      "BLOCK_N": 16,
      "BLOCK_K": 128,
      "BLOCK_C": 32,
      "NUM_KSPLIT": 4,
      "num_warps": 4,
      "num_stages": 2,
      "waves_per_eu": 2
    },
    "4375": {
      "BLOCK_M": 256,
      "BLOCK_N": 16,
      "BLOCK_K": 32,
      "BLOCK_C": 16,
      "NUM_KSPLIT": 8,
      "num_warps": 2,
      "num_stages": 1,
      "waves_per_eu": 1
    },
    "5463": {
      "BLOCK_M": 256,
      "BLOCK_N": 16,
      "BLOCK_K": 256,
      "BLOCK_C": 16,
      "NUM_KSPLIT": 8,
      "num_warps": 4,
      "num_stages": 2,
      "waves_per_eu": 0
    },
    "3694": {
      "BLOCK_M": 128,
      "BLOCK_N": 16,
      "BLOCK_K": 128,
      "BLOCK_C": 32,
      "NUM_KSPLIT": 2,
      "num_warps": 2,
      "num_stages": 2,
      "waves_per_eu": 1
    },
    "338": {
      "BLOCK_M": 32,
      "BLOCK_N": 16,
      "BLOCK_K": 32,
      "BLOCK_C": 256,
      "NUM_KSPLIT": 4,
      "num_warps": 8,
      "num_stages": 1,
      "waves_per_eu": 2
    },
    "3165": {
      "BLOCK_M": 128,
      "BLOCK_N": 16,
      "BLOCK_K": 32,
      "BLOCK_C": 128,
      "NUM_KSPLIT": 8,
      "num_warps": 8,
      "num_stages": 2,
      "waves_per_eu": 0
    },
    "511": {
      "BLOCK_M": 32,
      "BLOCK_N": 16,
      "BLOCK_K": 64,
      "BLOCK_C": 64,
      "NUM_KSPLIT": 1,
      "num_warps": 4,
      "num_stages": 1,
      "waves_per_eu": 1
    },
    "133": {
      "BLOCK_M": 32,
      "BLOCK_N": 16,
      "BLOCK_K": 32,
      "BLOCK_C": 32,
      "NUM_KSPLIT": 8,
      "num_warps": 4,
      "num_stages": 1,
      "waves_per_eu": 1
    },
    "3360": {
      "BLOCK_M": 128,
      "BLOCK_N": 16,
      "BLOCK_K": 64,
      "BLOCK_C": 32,
      "NUM_KSPLIT": 4,
      "num_warps": 8,
      "num_stages": 1,
      "waves_per_eu": 0
    },
    "2675": {
      "BLOCK_M": 64,
      "BLOCK_N": 16,
      "BLOCK_K": 256,
      "BLOCK_C": 64,
      "NUM_KSPLIT": 1,
      "num_warps": 4,
      "num_stages": 2,
      "waves_per_eu": 2
    },
    "2343": {
      "BLOCK_M": 64,
      "BLOCK_N": 16,
      "BLOCK_K": 128,
      "BLOCK_C": 64,
      "NUM_KSPLIT": 4,
      "num_warps": 2,
      "num_stages": 2,
      "waves_per_eu": 0
    },
    "4781": {
      "BLOCK_M": 256,
      "BLOCK_N": 16,
      "BLOCK_K": 64,
      "BLOCK_C": 32,
      "NUM_KSPLIT": 2,
      "num_warps": 4,
      "num_stages": 2,
      "waves_per_eu": 2
    },
    "4537": {
      "BLOCK_M": 256,
      "BLOCK_N": 16,
      "BLOCK_K": 32,
      "BLOCK_C": 128,
      "NUM_KSPLIT": 1,
      "num_warps": 2,
      "num_stages": 1,
      "waves_per_eu": 1
    },
    "418": {
      "BLOCK_M": 32,
      "BLOCK_N": 16,
      "BLOCK_K": 64,
      "BLOCK_C": 16,
      "NUM_KSPLIT": 8,
      "num_warps": 2,
      "num_stages": 2,
      "waves_per_eu": 1
    },
    "1841": {
      "BLOCK_M": 64,
      "BLOCK_N": 16,
      "BLOCK_K": 64,
      "BLOCK_C": 16,
      "NUM_KSPLIT": 4,
      "num_warps": 2,
      "num_stages": 2,
      "waves_per_eu": 2
    },
    "711": {
      "BLOCK_M": 32,
      "BLOCK_N": 16,
      "BLOCK_K": 64,
      "BLOCK_C": 256,
      "NUM_KSPLIT": 8,
      "num_warps": 4,
      "num_stages": 2,
      "waves_per_eu": 0
    },
    "2339": {
      "BLOCK_M": 64,
      "BLOCK_N": 16,
      "BLOCK_K": 128,
      "BLOCK_C": 64,
      "NUM_KSPLIT": 2,
      "num_warps": 8,
      "num_stages": 2,
      "waves_per_eu": 2
    },
    "2463": {
      "BLOCK_M": 64,
      "BLOCK_N": 16,
      "BLOCK_K": 128,
      "BLOCK_C": 256,
      "NUM_KSPLIT": 1,
      "num_warps": 8,
      "num_stages": 2,
      "waves_per_eu": 0
    },
    "3657": {
      "BLOCK_M": 128,
      "BLOCK_N": 16,
      "BLOCK_K": 128,
      "BLOCK_C": 16,
      "NUM_KSPLIT": 8,
      "num_warps": 2,
      "num_stages": 2,
      "waves_per_eu": 0
    },
    "1207": {
      "BLOCK_M": 32,
      "BLOCK_N": 16,
      "BLOCK_K": 256,
      "BLOCK_C": 32,
      "NUM_KSPLIT": 8,
      "num_warps": 2,
      "num_stages": 1,
      "waves_per_eu": 1
    },
    "5436": {
      "BLOCK_M": 256,
      "BLOCK_N": 16,
      "BLOCK_K": 256,
      "BLOCK_C": 16,
      "NUM_KSPLIT": 4,
      "num_warps": 2,
      "num_stages": 1,
      "waves_per_eu": 0
    },
    "5404": {
      "BLOCK_M": 256,
      "BLOCK_N": 16,
      "BLOCK_K": 256,
      "BLOCK_C": 16,
      "NUM_KSPLIT": 1,
      "num_warps": 2,
      "num_stages": 2,
      "waves_per_eu": 1
    },
    "3421": {
      "BLOCK_M": 128,
      "BLOCK_N": 16,
      "BLOCK_K": 64,
      "BLOCK_C": 64,
      "NUM_KSPLIT": 4,
      "num_warps": 2,
      "num_stages": 1,
      "waves_per_eu": 1
    },
    "4655": {
      "BLOCK_M": 256,
      "BLOCK_N": 16,
      "BLOCK_K": 32,
      "BLOCK_C": 256,
      "NUM_KSPLIT": 4,
      "num_warps": 4,
      "num_stages": 2,
      "waves_per_eu": 2
    },
    "1218": {
      "BLOCK_M": 32,
      "BLOCK_N": 16,
      "BLOCK_K": 256,
      "BLOCK_C": 32,
      "NUM_KSPLIT": 8,
      "num_warps": 8,
      "num_stages": 1,
      "waves_per_eu": 0
    },
    "2868": {
      "BLOCK_M": 64,
      "BLOCK_N": 16,
      "BLOCK_K": 256,
      "BLOCK_C": 256,
      "NUM_KSPLIT": 8,
      "num_warps": 4,
      "num_stages": 1,
      "waves_per_eu": 0
    },
    "5695": {
      "BLOCK_M": 256,
      "BLOCK_N": 16,
      "BLOCK_K": 256,
      "BLOCK_C": 256,
      "NUM_KSPLIT": 1,
      "num_warps": 4,
      "num_stages": 1,
      "waves_per_eu": 1
    },
    "241": {
      "BLOCK_M": 32,
      "BLOCK_N": 16,
      "BLOCK_K": 32,
      "BLOCK_C": 128,
      "NUM_KSPLIT": 2,
      "num_warps": 4,
      "num_stages": 1,
      "waves_per_eu": 1
    },
    "5244": {
      "BLOCK_M": 256,
      "BLOCK_N": 16,
      "BLOCK_K": 128,
      "BLOCK_C": 64,
      "NUM_KSPLIT": 8,
      "num_warps": 4,
      "num_stages": 1,
      "waves_per_eu": 0
    },
    "4277": {
      "BLOCK_M": 128,
      "BLOCK_N": 16,
      "BLOCK_K": 256,
      "BLOCK_C": 256,
      "NUM_KSPLIT": 2,
      "num_warps": 4,
      "num_stages": 2,
      "waves_per_eu": 2
    },
    "1380": {
      "BLOCK_M": 32,
      "BLOCK_N": 16,
      "BLOCK_K": 256,
      "BLOCK_C": 256,
      "NUM_KSPLIT": 1,
      "num_warps": 8,
      "num_stages": 1,
      "waves_per_eu": 0
    },
    "5232": {
      "BLOCK_M": 256,
      "BLOCK_N": 16,
      "BLOCK_K": 128,
      "BLOCK_C": 64,
      "NUM_KSPLIT": 4,
      "num_warps": 8,
      "num_stages": 1,
      "waves_per_eu": 0
    },
    "2737": {
      "BLOCK_M": 64,
      "BLOCK_N": 16,
      "BLOCK_K": 256,
      "BLOCK_C": 128,
      "NUM_KSPLIT": 1,
      "num_warps": 2,
      "num_stages": 1,
      "waves_per_eu": 1
    },
    "5462": {
      "BLOCK_M": 256,
      "BLOCK_N": 16,
      "BLOCK_K": 256,
      "BLOCK_C": 16,
      "NUM_KSPLIT": 8,
      "num_warps": 4,
      "num_stages": 1,
      "waves_per_eu": 2
    },
    "3089": {
      "BLOCK_M": 128,
      "BLOCK_N": 16,
      "BLOCK_K": 32,
      "BLOCK_C": 64,
      "NUM_KSPLIT": 8,
      "num_warps": 4,
      "num_stages": 2,
      "waves_per_eu": 2
    },
    "5419": {
      "BLOCK_M": 256,
      "BLOCK_N": 16,
      "BLOCK_K": 256,
      "BLOCK_C": 16,
      "NUM_KSPLIT": 2,
      "num_warps": 2,
      "num_stages": 1,
      "waves_per_eu": 1
    },
    "2059": {
      "BLOCK_M": 64,
      "BLOCK_N": 16,
      "BLOCK_K": 64,
      "BLOCK_C": 128,
      "NUM_KSPLIT": 4,
      "num_warps": 4,
      "num_stages": 1,
      "waves_per_eu": 1
    },
    "2369": {
      "BLOCK_M": 64,
      "BLOCK_N": 16,
      "BLOCK_K": 128,
      "BLOCK_C": 64,
      "NUM_KSPLIT": 8,
      "num_warps": 4,
      "num_stages": 2,
      "waves_per_eu": 2
    },
    "3735": {
      "BLOCK_M": 128,
      "BLOCK_N": 16,
      "BLOCK_K": 128,
      "BLOCK_C": 32,
      "NUM_KSPLIT": 8,
      "num_warps": 4,
      "num_stages": 2,
      "waves_per_eu": 0
    },
    "571": {
      "BLOCK_M": 32,
      "BLOCK_N": 16,
      "BLOCK_K": 64,
      "BLOCK_C": 64,
      "NUM_KSPLIT": 8,
      "num_warps": 8,
      "num_stages": 1,
      "waves_per_eu": 1
    },
    "4092": {
      "BLOCK_M": 128,
      "BLOCK_N": 16,
      "BLOCK_K": 256,
      "BLOCK_C": 32,
      "NUM_KSPLIT": 8,
      "num_warps": 4,
      "num_stages": 1,
      "waves_per_eu": 0
    },
    "5361": {
      "BLOCK_M": 256,
      "BLOCK_N": 16,
      "BLOCK_K": 128,
      "BLOCK_C": 256,
      "NUM_KSPLIT": 2,
      "num_warps": 8,
      "num_stages": 2,
      "waves_per_eu": 0
    },
    "5187": {
      "BLOCK_M": 256,
      "BLOCK_N": 16,
      "BLOCK_K": 128,
      "BLOCK_C": 64,
      "NUM_KSPLIT": 1,
      "num_warps": 2,
      "num_stages": 2,
      "waves_per_eu": 0
    },
    "120": {
      "BLOCK_M": 32,
      "BLOCK_N": 16,
      "BLOCK_K": 32,
      "BLOCK_C": 32,
      "NUM_KSPLIT": 4,
      "num_warps": 8,
      "num_stages": 1,
      "waves_per_eu": 0
    },
    "3958": {
      "BLOCK_M": 128,
      "BLOCK_N": 16,
      "BLOCK_K": 128,
      "BLOCK_C": 256,
      "NUM_KSPLIT": 8,
      "num_warps": 8,
      "num_stages": 2,
      "waves_per_eu": 1
    },
    "5079": {
      "BLOCK_M": 256,
      "BLOCK_N": 16,
      "BLOCK_K": 128,
      "BLOCK_C": 16,
      "NUM_KSPLIT": 4,
      "num_warps": 2,
      "num_stages": 2,
      "waves_per_eu": 0
    },
    "1159": {
      "BLOCK_M": 32,
      "BLOCK_N": 16,
      "BLOCK_K": 256,
      "BLOCK_C": 32,
      "NUM_KSPLIT": 1,
      "num_warps": 4,
      "num_stages": 1,
      "waves_per_eu": 1
    },
    "4877": {
      "BLOCK_M": 256,
      "BLOCK_N": 16,
      "BLOCK_K": 64,
      "BLOCK_C": 64,
      "NUM_KSPLIT": 4,
      "num_warps": 8,
      "num_stages": 2,
      "waves_per_eu": 2
    },
    "5650": {
      "BLOCK_M": 256,
      "BLOCK_N": 16,
      "BLOCK_K": 256,
      "BLOCK_C": 128,
      "NUM_KSPLIT": 2,
      "num_warps": 8,
      "num_stages": 2,
      "waves_per_eu": 1
    },
    "5372": {
      "BLOCK_M": 256,
      "BLOCK_N": 16,
      "BLOCK_K": 128,
      "BLOCK_C": 256,
      "NUM_KSPLIT": 4,
      "num_warps": 4,
      "num_stages": 1,
      "waves_per_eu": 2
    },
    "837": {
      "BLOCK_M": 32,
      "BLOCK_N": 16,
      "BLOCK_K": 128,
      "BLOCK_C": 32,
      "NUM_KSPLIT": 4,
      "num_warps": 4,
      "num_stages": 2,
      "waves_per_eu": 0
    },
    "3499": {
      "BLOCK_M": 128,
      "BLOCK_N": 16,
      "BLOCK_K": 64,
      "BLOCK_C": 128,
      "NUM_KSPLIT": 4,
      "num_warps": 4,
      "num_stages": 1,
      "waves_per_eu": 1
    },
    "182": {
      "BLOCK_M": 32,
      "BLOCK_N": 16,
      "BLOCK_K": 32,
      "BLOCK_C": 64,
      "NUM_KSPLIT": 4,
      "num_warps": 2,
      "num_stages": 1,
      "waves_per_eu": 2
    },
    "2661": {
      "BLOCK_M": 64,
      "BLOCK_N": 16,
      "BLOCK_K": 256,
      "BLOCK_C": 32,
      "NUM_KSPLIT": 8,
      "num_warps": 8,
      "num_stages": 2,
      "waves_per_eu": 0
    },
    "5575": {
      "BLOCK_M": 256,
      "BLOCK_N": 16,
      "BLOCK_K": 256,
      "BLOCK_C": 64,
      "NUM_KSPLIT": 2,
      "num_warps": 8,
      "num_stages": 1,
      "waves_per_eu": 1
    },
    "4707": {
      "BLOCK_M": 256,
