tuning_results_mhc/gfx950/raw_tuner_outputs/tested_configs_mhc_fused_mhc_sk20_M2048_n4_C1024.json
{
  "kernel": "fused_mhc",
  "M": 2048,
  "n": 4,
  "C": 1024,
  "sinkhorn_iters": 20,
  "config_file": "tuning_results/tuning_space_mhc.json",
  "tested_configs_successful": {
    "121": {
      "BLOCK_M": 32,
      "BLOCK_N": 16,
      "BLOCK_K": 32,
      "BLOCK_C": 32,
      "NUM_KSPLIT": 4,
      "num_warps": 8,
      "num_stages": 1,
      "waves_per_eu": 1
    },
    "2794": {
      "BLOCK_M": 64,
      "BLOCK_N": 16,
      "BLOCK_K": 256,
      "BLOCK_C": 128,
      "NUM_KSPLIT": 8,
      "num_warps": 2,
      "num_stages": 2,
      "waves_per_eu": 1
    },
    "910": {
      "BLOCK_M": 32,
      "BLOCK_N": 16,
      "BLOCK_K": 128,
      "BLOCK_C": 64,
      "NUM_KSPLIT": 4,
      "num_warps": 4,
      "num_stages": 2,
      "waves_per_eu": 1
    },
    "2489": {
      "BLOCK_M": 64,
      "BLOCK_N": 16,
      "BLOCK_K": 128,
      "BLOCK_C": 256,
      "NUM_KSPLIT": 4,
      "num_warps": 2,
      "num_stages": 2,
      "waves_per_eu": 2
    },
    "3832": {
      "BLOCK_M": 128,
      "BLOCK_N": 16,
      "BLOCK_K": 128,
      "BLOCK_C": 128,
      "NUM_KSPLIT": 1,
      "num_warps": 8,
      "num_stages": 2,
      "waves_per_eu": 1
    },
    "5499": {
      "BLOCK_M": 256,
      "BLOCK_N": 16,
      "BLOCK_K": 256,
      "BLOCK_C": 32,
      "NUM_KSPLIT": 2,
      "num_warps": 4,
      "num_stages": 2,
      "waves_per_eu": 0
    },
    "664": {
      "BLOCK_M": 32,
      "BLOCK_N": 16,
      "BLOCK_K": 64,
      "BLOCK_C": 256,
      "NUM_KSPLIT": 1,
      "num_warps": 8,
      "num_stages": 2,
      "waves_per_eu": 1
    },
    "2877": {
      "BLOCK_M": 64,
      "BLOCK_N": 16,
      "BLOCK_K": 256,
      "BLOCK_C": 256,
      "NUM_KSPLIT": 8,
      "num_warps": 8,
      "num_stages": 2,
      "waves_per_eu": 0
    },
    "4344": {
      "BLOCK_M": 256,
      "BLOCK_N": 16,
      "BLOCK_K": 32,
      "BLOCK_C": 16,
      "NUM_KSPLIT": 2,
      "num_warps": 4,
      "num_stages": 1,
      "waves_per_eu": 0
    },
    "3293": {
      "BLOCK_M": 128,
      "BLOCK_N": 16,
      "BLOCK_K": 64,
      "BLOCK_C": 16,
      "NUM_KSPLIT": 4,
      "num_warps": 8,
      "num_stages": 2,
      "waves_per_eu": 2
    },
    "2904": {
      "BLOCK_M": 128,
      "BLOCK_N": 16,
      "BLOCK_K": 32,
      "BLOCK_C": 16,
      "NUM_KSPLIT": 2,
      "num_warps": 4,
      "num_stages": 1,
      "waves_per_eu": 0
    },
    "1341": {
      "BLOCK_M": 32,
      "BLOCK_N": 16,
      "BLOCK_K": 256,
      "BLOCK_C": 128,
      "NUM_KSPLIT": 4,
      "num_warps": 4,
      "num_stages": 2,
      "waves_per_eu": 0
    },
    "5281": {
      "BLOCK_M": 256,
      "BLOCK_N": 16,
      "BLOCK_K": 128,
      "BLOCK_C": 128,
      "NUM_KSPLIT": 2,
      "num_warps": 4,
      "num_stages": 1,
      "waves_per_eu": 1
    },
    "5235": {
      "BLOCK_M": 256,
      "BLOCK_N": 16,
      "BLOCK_K": 128,
      "BLOCK_C": 64,
      "NUM_KSPLIT": 4,
      "num_warps": 8,
      "num_stages": 2,
      "waves_per_eu": 0
    },
    "5696": {
      "BLOCK_M": 256,
      "BLOCK_N": 16,
      "BLOCK_K": 256,
      "BLOCK_C": 256,
      "NUM_KSPLIT": 1,
      "num_warps": 4,
      "num_stages": 1,
      "waves_per_eu": 2
    },
    "1424": {
      "BLOCK_M": 32,
      "BLOCK_N": 16,
      "BLOCK_K": 256,
      "BLOCK_C": 256,
      "NUM_KSPLIT": 8,
      "num_warps": 2,
      "num_stages": 1,
      "waves_per_eu": 2
    },
    "3536": {
      "BLOCK_M": 128,
      "BLOCK_N": 16,
      "BLOCK_K": 64,
      "BLOCK_C": 256,
      "NUM_KSPLIT": 1,
      "num_warps": 4,
      "num_stages": 1,
      "waves_per_eu": 2
    },
    "4051": {
      "BLOCK_M": 128,
      "BLOCK_N": 16,
      "BLOCK_K": 256,
      "BLOCK_C": 32,
      "NUM_KSPLIT": 2,
      "num_warps": 2,
      "num_stages": 1,
      "waves_per_eu": 1
    },
    "4008": {
      "BLOCK_M": 128,
      "BLOCK_N": 16,
      "BLOCK_K": 256,
      "BLOCK_C": 16,
      "NUM_KSPLIT": 4,
      "num_warps": 8,
      "num_stages": 1,
      "waves_per_eu": 0
    },
    "1835": {
      "BLOCK_M": 64,
      "BLOCK_N": 16,
      "BLOCK_K": 64,
      "BLOCK_C": 16,
      "NUM_KSPLIT": 2,
      "num_warps": 8,
      "num_stages": 2,
      "waves_per_eu": 2
    },
    "855": {
      "BLOCK_M": 32,
      "BLOCK_N": 16,
      "BLOCK_K": 128,
      "BLOCK_C": 32,
      "NUM_KSPLIT": 8,
      "num_warps": 4,
      "num_stages": 2,
      "waves_per_eu": 0
    },
    "4331": {
      "BLOCK_M": 256,
      "BLOCK_N": 16,
      "BLOCK_K": 32,
      "BLOCK_C": 16,
      "NUM_KSPLIT": 1,
      "num_warps": 4,
      "num_stages": 2,
      "waves_per_eu": 2
    },
    "3941": {
      "BLOCK_M": 128,
      "BLOCK_N": 16,
      "BLOCK_K": 128,
      "BLOCK_C": 256,
      "NUM_KSPLIT": 4,
      "num_warps": 8,
      "num_stages": 2,
      "waves_per_eu": 2
    },
    "2763": {
      "BLOCK_M": 64,
      "BLOCK_N": 16,
      "BLOCK_K": 256,
      "BLOCK_C": 128,
      "NUM_KSPLIT": 2,
      "num_warps": 4,
      "num_stages": 2,
      "waves_per_eu": 0
    },
    "5346": {
      "BLOCK_M": 256,
      "BLOCK_N": 16,
      "BLOCK_K": 128,
      "BLOCK_C": 256,
      "NUM_KSPLIT": 2,
      "num_warps": 2,
      "num_stages": 1,
      "waves_per_eu": 0
    },
    "858": {
      "BLOCK_M": 32,
      "BLOCK_N": 16,
      "BLOCK_K": 128,
      "BLOCK_C": 32,
      "NUM_KSPLIT": 8,
      "num_warps": 8,
      "num_stages": 1,
      "waves_per_eu": 0
    },
    "4727": {
      "BLOCK_M": 256,
      "BLOCK_N": 16,
      "BLOCK_K": 64,
      "BLOCK_C": 16,
      "NUM_KSPLIT": 4,
      "num_warps": 4,
      "num_stages": 2,
      "waves_per_eu": 2
    },
    "4075": {
      "BLOCK_M": 128,
      "BLOCK_N": 16,
      "BLOCK_K": 256,
      "BLOCK_C": 32,
      "NUM_KSPLIT": 4,
      "num_warps": 4,
      "num_stages": 1,
      "waves_per_eu": 1
    },
    "2601": {
      "BLOCK_M": 64,
      "BLOCK_N": 16,
      "BLOCK_K": 256,
      "BLOCK_C": 32,
      "NUM_KSPLIT": 1,
      "num_warps": 4,
      "num_stages": 2,
      "waves_per_eu": 0
    },
    "5524": {
      "BLOCK_M": 256,
      "BLOCK_N": 16,
      "BLOCK_K": 256,
      "BLOCK_C": 32,
      "NUM_KSPLIT": 4,
      "num_warps": 8,
      "num_stages": 2,
      "waves_per_eu": 1
    },
    "2775": {
      "BLOCK_M": 64,
      "BLOCK_N": 16,
      "BLOCK_K": 256,
      "BLOCK_C": 128,
      "NUM_KSPLIT": 4,
      "num_warps": 2,
      "num_stages": 2,
      "waves_per_eu": 0
    },
    "4184": {
      "BLOCK_M": 128,
      "BLOCK_N": 16,
      "BLOCK_K": 256,
      "BLOCK_C": 128,
      "NUM_KSPLIT": 1,
      "num_warps": 4,
      "num_stages": 1,
      "waves_per_eu": 2
    },
    "5257": {
      "BLOCK_M": 256,
      "BLOCK_N": 16,
      "BLOCK_K": 128,
      "BLOCK_C": 128,
      "NUM_KSPLIT": 1,
      "num_warps": 2,
      "num_stages": 1,
      "waves_per_eu": 1
    },
    "477": {
      "BLOCK_M": 32,
      "BLOCK_N": 16,
      "BLOCK_K": 64,
      "BLOCK_C": 32,
      "NUM_KSPLIT": 4,
      "num_warps": 4,
      "num_stages": 2,
      "waves_per_eu": 0
    },
    "5378": {
      "BLOCK_M": 256,
      "BLOCK_N": 16,
      "BLOCK_K": 128,
      "BLOCK_C": 256,
      "NUM_KSPLIT": 4,
      "num_warps": 8,
      "num_stages": 1,
      "waves_per_eu": 2
    },
    "1666": {
      "BLOCK_M": 64,
      "BLOCK_N": 16,
      "BLOCK_K": 32,
      "BLOCK_C": 128,
      "NUM_KSPLIT": 1,
      "num_warps": 4,
      "num_stages": 2,
      "waves_per_eu": 1
    },
    "401": {
      "BLOCK_M": 32,
      "BLOCK_N": 16,
      "BLOCK_K": 64,
      "BLOCK_C": 16,
      "NUM_KSPLIT": 4,
      "num_warps": 2,
      "num_stages": 2,
      "waves_per_eu": 2
    },
    "3033": {
      "BLOCK_M": 128,
      "BLOCK_N": 16,
      "BLOCK_K": 32,
      "BLOCK_C": 64,
      "NUM_KSPLIT": 1,
      "num_warps": 4,
      "num_stages": 2,
      "waves_per_eu": 0
    },
    "3240": {
      "BLOCK_M": 128,
      "BLOCK_N": 16,
      "BLOCK_K": 64,
      "BLOCK_C": 16,
      "NUM_KSPLIT": 1,
      "num_warps": 2,
      "num_stages": 1,
      "waves_per_eu": 0
    },
    "5649": {
      "BLOCK_M": 256,
      "BLOCK_N": 16,
      "BLOCK_K": 256,
      "BLOCK_C": 128,
      "NUM_KSPLIT": 2,
      "num_warps": 8,
      "num_stages": 2,
      "waves_per_eu": 0
    },
    "5233": {
      "BLOCK_M": 256,
      "BLOCK_N": 16,
      "BLOCK_K": 128,
      "BLOCK_C": 64,
      "NUM_KSPLIT": 4,
      "num_warps": 8,
      "num_stages": 1,
      "waves_per_eu": 1
    },
    "5347": {
      "BLOCK_M": 256,
      "BLOCK_N": 16,
      "BLOCK_K": 128,
      "BLOCK_C": 256,
      "NUM_KSPLIT": 2,
      "num_warps": 2,
      "num_stages": 1,
      "waves_per_eu": 1
    },
    "1579": {
      "BLOCK_M": 64,
      "BLOCK_N": 16,
      "BLOCK_K": 32,
      "BLOCK_C": 32,
      "NUM_KSPLIT": 8,
      "num_warps": 8,
      "num_stages": 1,
      "waves_per_eu": 1
    },
    "4269": {
      "BLOCK_M": 128,
      "BLOCK_N": 16,
      "BLOCK_K": 256,
      "BLOCK_C": 256,
      "NUM_KSPLIT": 2,
      "num_warps": 2,
      "num_stages": 2,
      "waves_per_eu": 0
    },
    "2202": {
      "BLOCK_M": 64,
      "BLOCK_N": 16,
      "BLOCK_K": 128,
      "BLOCK_C": 16,
      "NUM_KSPLIT": 4,
      "num_warps": 4,
      "num_stages": 1,
      "waves_per_eu": 0
    },
    "5214": {
      "BLOCK_M": 256,
      "BLOCK_N": 16,
      "BLOCK_K": 128,
      "BLOCK_C": 64,
      "NUM_KSPLIT": 2,
      "num_warps": 8,
      "num_stages": 1,
      "waves_per_eu": 0
    },
    "1404": {
      "BLOCK_M": 32,
      "BLOCK_N": 16,
      "BLOCK_K": 256,
      "BLOCK_C": 256,
      "NUM_KSPLIT": 4,
      "num_warps": 2,
      "num_stages": 1,
      "waves_per_eu": 0
    },
    "2251": {
      "BLOCK_M": 64,
      "BLOCK_N": 16,
      "BLOCK_K": 128,
      "BLOCK_C": 32,
      "NUM_KSPLIT": 2,
      "num_warps": 2,
      "num_stages": 1,
      "waves_per_eu": 1
    },
    "3705": {
      "BLOCK_M": 128,
      "BLOCK_N": 16,
      "BLOCK_K": 128,
      "BLOCK_C": 32,
      "NUM_KSPLIT": 2,
      "num_warps": 8,
      "num_stages": 2,
      "waves_per_eu": 0
    },
    "1435": {
      "BLOCK_M": 32,
      "BLOCK_N": 16,
      "BLOCK_K": 256,
      "BLOCK_C": 256,
      "NUM_KSPLIT": 8,
      "num_warps": 8,
      "num_stages": 1,
      "waves_per_eu": 1
    },
    "3699": {
      "BLOCK_M": 128,
      "BLOCK_N": 16,
      "BLOCK_K": 128,
      "BLOCK_C": 32,
      "NUM_KSPLIT": 2,
      "num_warps": 4,
      "num_stages": 2,
      "waves_per_eu": 0
    },
    "4823": {
      "BLOCK_M": 256,
      "BLOCK_N": 16,
      "BLOCK_K": 64,
      "BLOCK_C": 32,
      "NUM_KSPLIT": 8,
      "num_warps": 8,
      "num_stages": 2,
      "waves_per_eu": 2
    },
    "235": {
      "BLOCK_M": 32,
      "BLOCK_N": 16,
      "BLOCK_K": 32,
      "BLOCK_C": 128,
      "NUM_KSPLIT": 2,
      "num_warps": 2,
      "num_stages": 1,
      "waves_per_eu": 1
    },
    "614": {
      "BLOCK_M": 32,
      "BLOCK_N": 16,
      "BLOCK_K": 64,
      "BLOCK_C": 128,
      "NUM_KSPLIT": 4,
      "num_warps": 2,
      "num_stages": 1,
      "waves_per_eu": 2
    },
    "5643": {
      "BLOCK_M": 256,
      "BLOCK_N": 16,
      "BLOCK_K": 256,
      "BLOCK_C": 128,
      "NUM_KSPLIT": 2,
      "num_warps": 4,
      "num_stages": 2,
      "waves_per_eu": 0
    },
    "4597": {
      "BLOCK_M": 256,
      "BLOCK_N": 16,
      "BLOCK_K": 32,
      "BLOCK_C": 128,
      "NUM_KSPLIT": 8,
      "num_warps": 4,
      "num_stages": 1,
      "waves_per_eu": 1
    },
    "167": {
      "BLOCK_M": 32,
      "BLOCK_N": 16,
      "BLOCK_K": 32,
      "BLOCK_C": 64,
      "NUM_KSPLIT": 2,
      "num_warps": 2,
      "num_stages": 2,
      "waves_per_eu": 2
    },
    "4093": {
      "BLOCK_M": 128,
      "BLOCK_N": 16,
      "BLOCK_K": 256,
      "BLOCK_C": 32,
      "NUM_KSPLIT": 8,
      "num_warps": 4,
      "num_stages": 1,
      "waves_per_eu": 1
    },
    "3695": {
      "BLOCK_M": 128,
      "BLOCK_N": 16,
      "BLOCK_K": 128,
      "BLOCK_C": 32,
      "NUM_KSPLIT": 2,
      "num_warps": 2,
      "num_stages": 2,
      "waves_per_eu": 2
    },
    "1546": {
      "BLOCK_M": 64,
      "BLOCK_N": 16,
      "BLOCK_K": 32,
      "BLOCK_C": 32,
      "NUM_KSPLIT": 2,
      "num_warps": 8,
      "num_stages": 2,
      "waves_per_eu": 1
    },
    "1353": {
      "BLOCK_M": 32,
      "BLOCK_N": 16,
      "BLOCK_K": 256,
      "BLOCK_C": 128,
      "NUM_KSPLIT": 8,
      "num_warps": 2,
      "num_stages": 2,
      "waves_per_eu": 0
    },
    "1312": {
      "BLOCK_M": 32,
      "BLOCK_N": 16,
      "BLOCK_K": 256,
      "BLOCK_C": 128,
      "NUM_KSPLIT": 1,
      "num_warps": 8,
      "num_stages": 2,
      "waves_per_eu": 1
    },
    "5286": {
      "BLOCK_M": 256,
      "BLOCK_N": 16,
      "BLOCK_K": 128,
      "BLOCK_C": 128,
      "NUM_KSPLIT": 2,
      "num_warps": 8,
      "num_stages": 1,
      "waves_per_eu": 0
    },
    "1174": {
      "BLOCK_M": 32,
      "BLOCK_N": 16,
      "BLOCK_K": 256,
      "BLOCK_C": 32,
      "NUM_KSPLIT": 2,
      "num_warps": 2,
      "num_stages": 2,
      "waves_per_eu": 1
    },
    "633": {
      "BLOCK_M": 32,
      "BLOCK_N": 16,
      "BLOCK_K": 64,
      "BLOCK_C": 128,
      "NUM_KSPLIT": 8,
      "num_warps": 2,
      "num_stages": 2,
      "waves_per_eu": 0
    },
    "1399": {
      "BLOCK_M": 32,
      "BLOCK_N": 16,
      "BLOCK_K": 256,
      "BLOCK_C": 256,
      "NUM_KSPLIT": 2,
      "num_warps": 8,
      "num_stages": 1,
      "waves_per_eu": 1
    },
    "2854": {
      "BLOCK_M": 64,
      "BLOCK_N": 16,
      "BLOCK_K": 256,
      "BLOCK_C": 256,
      "NUM_KSPLIT": 4,
      "num_warps": 4,
      "num_stages": 2,
      "waves_per_eu": 1
    },
    "526": {
      "BLOCK_M": 32,
      "BLOCK_N": 16,
      "BLOCK_K": 64,
      "BLOCK_C": 64,
      "NUM_KSPLIT": 2,
      "num_warps": 2,
      "num_stages": 2,
      "waves_per_eu": 1
    },
    "5597": {
      "BLOCK_M": 256,
      "BLOCK_N": 16,
      "BLOCK_K": 256,
      "BLOCK_C": 64,
      "NUM_KSPLIT": 4,
      "num_warps": 8,
      "num_stages": 2,
      "waves_per_eu": 2
    },
    "1542": {
      "BLOCK_M": 64,
      "BLOCK_N": 16,
      "BLOCK_K": 32,
      "BLOCK_C": 32,
      "NUM_KSPLIT": 2,
      "num_warps": 8,
      "num_stages": 1,
      "waves_per_eu": 0
    },
    "259": {
      "BLOCK_M": 32,
      "BLOCK_N": 16,
      "BLOCK_K": 32,
      "BLOCK_C": 128,
      "NUM_KSPLIT": 4,
      "num_warps": 4,
      "num_stages": 1,
      "waves_per_eu": 1
    },
    "2228": {
      "BLOCK_M": 64,
      "BLOCK_N": 16,
      "BLOCK_K": 128,
      "BLOCK_C": 16,
      "NUM_KSPLIT": 8,
      "num_warps": 8,
      "num_stages": 1,
      "waves_per_eu": 2
    },
    "22": {
      "BLOCK_M": 32,
      "BLOCK_N": 16,
      "BLOCK_K": 32,
      "BLOCK_C": 16,
      "NUM_KSPLIT": 2,
      "num_warps": 2,
      "num_stages": 2,
      "waves_per_eu": 1
    },
    "3829": {
      "BLOCK_M": 128,
      "BLOCK_N": 16,
      "BLOCK_K": 128,
      "BLOCK_C": 128,
      "NUM_KSPLIT": 1,
      "num_warps": 8,
      "num_stages": 1,
      "waves_per_eu": 1
    },
    "950": {
      "BLOCK_M": 32,
      "BLOCK_N": 16,
      "BLOCK_K": 128,
      "BLOCK_C": 128,
      "NUM_KSPLIT": 1,
      "num_warps": 8,
      "num_stages": 1,
      "waves_per_eu": 2
    },
    "756": {
      "BLOCK_M": 32,
      "BLOCK_N": 16,
      "BLOCK_K": 128,
      "BLOCK_C": 16,
      "NUM_KSPLIT": 4,
      "num_warps": 2,
      "num_stages": 1,
      "waves_per_eu": 0
    },
    "3521": {
      "BLOCK_M": 128,
      "BLOCK_N": 16,
      "BLOCK_K": 64,
      "BLOCK_C": 128,
      "NUM_KSPLIT": 8,
      "num_warps": 4,
      "num_stages": 2,
      "waves_per_eu": 2
    },
    "5322": {
      "BLOCK_M": 256,
      "BLOCK_N": 16,
      "BLOCK_K": 128,
      "BLOCK_C": 128,
      "NUM_KSPLIT": 8,
      "num_warps": 8,
      "num_stages": 1,
      "waves_per_eu": 0
    },
    "3054": {
      "BLOCK_M": 128,
      "BLOCK_N": 16,
      "BLOCK_K": 32,
      "BLOCK_C": 64,
      "NUM_KSPLIT": 2,
      "num_warps": 8,
      "num_stages": 1,
      "waves_per_eu": 0
    },
    "4042": {
      "BLOCK_M": 128,
      "BLOCK_N": 16,
      "BLOCK_K": 256,
      "BLOCK_C": 32,
      "NUM_KSPLIT": 1,
      "num_warps": 4,
      "num_stages": 2,
      "waves_per_eu": 1
    },
    "4633": {
      "BLOCK_M": 256,
      "BLOCK_N": 16,
      "BLOCK_K": 32,
      "BLOCK_C": 256,
      "NUM_KSPLIT": 2,
      "num_warps": 4,
      "num_stages": 1,
      "waves_per_eu": 1
    },
    "184": {
      "BLOCK_M": 32,
      "BLOCK_N": 16,
      "BLOCK_K": 32,
      "BLOCK_C": 64,
      "NUM_KSPLIT": 4,
      "num_warps": 2,
      "num_stages": 2,
      "waves_per_eu": 1
    },
    "4132": {
      "BLOCK_M": 128,
      "BLOCK_N": 16,
      "BLOCK_K": 256,
      "BLOCK_C": 64,
      "NUM_KSPLIT": 2,
      "num_warps": 4,
      "num_stages": 2,
      "waves_per_eu": 1
    },
    "2625": {
      "BLOCK_M": 64,
      "BLOCK_N": 16,
      "BLOCK_K": 256,
      "BLOCK_C": 32,
      "NUM_KSPLIT": 2,
      "num_warps": 8,
      "num_stages": 2,
      "waves_per_eu": 0
    },
    "5708": {
      "BLOCK_M": 256,
      "BLOCK_N": 16,
      "BLOCK_K": 256,
      "BLOCK_C": 256,
      "NUM_KSPLIT": 2,
      "num_warps": 2,
      "num_stages": 1,
      "waves_per_eu": 2
    },
    "5613": {
      "BLOCK_M": 256,
      "BLOCK_N": 16,
      "BLOCK_K": 256,
      "BLOCK_C": 64,
      "NUM_KSPLIT": 8,
      "num_warps": 8,
      "num_stages": 2,
      "waves_per_eu": 0
    },
    "4558": {
      "BLOCK_M": 256,
      "BLOCK_N": 16,
      "BLOCK_K": 32,
      "BLOCK_C": 128,
      "NUM_KSPLIT": 2,
      "num_warps": 2,
      "num_stages": 2,
      "waves_per_eu": 1
    },
    "1507": {
      "BLOCK_M": 64,
      "BLOCK_N": 16,
      "BLOCK_K": 32,
      "BLOCK_C": 16,
      "NUM_KSPLIT": 8,
      "num_warps": 8,
      "num_stages": 1,
      "waves_per_eu": 1
    },
    "1360": {
      "BLOCK_M": 32,
      "BLOCK_N": 16,
      "BLOCK_K": 256,
      "BLOCK_C": 128,
      "NUM_KSPLIT": 8,
      "num_warps": 4,
      "num_stages": 2,
      "waves_per_eu": 1
    },
    "4997": {
      "BLOCK_M": 256,
      "BLOCK_N": 16,
      "BLOCK_K": 64,
      "BLOCK_C": 256,
      "NUM_KSPLIT": 2,
      "num_warps": 4,
      "num_stages": 2,
      "waves_per_eu": 2
    },
    "3314": {
      "BLOCK_M": 128,
      "BLOCK_N": 16,
      "BLOCK_K": 64,
      "BLOCK_C": 32,
      "NUM_KSPLIT": 1,
      "num_warps": 2,
      "num_stages": 1,
      "waves_per_eu": 2
    },
    "5749": {
      "BLOCK_M": 256,
      "BLOCK_N": 16,
      "BLOCK_K": 256,
      "BLOCK_C": 256,
      "NUM_KSPLIT": 8,
      "num_warps": 4,
      "num_stages": 1,
      "waves_per_eu": 1
    },
    "3125": {
      "BLOCK_M": 128,
      "BLOCK_N": 16,
      "BLOCK_K": 32,
      "BLOCK_C": 128,
      "NUM_KSPLIT": 2,
      "num_warps": 4,
      "num_stages": 2,
      "waves_per_eu": 2
    },
    "5353": {
      "BLOCK_M": 256,
      "BLOCK_N": 16,
      "BLOCK_K": 128,
      "BLOCK_C": 256,
      "NUM_KSPLIT": 2,
      "num_warps": 4,
      "num_stages": 1,
      "waves_per_eu": 1
    },
    "1872": {
      "BLOCK_M": 64,
      "BLOCK_N": 16,
      "BLOCK_K": 64,
      "BLOCK_C": 32,
      "NUM_KSPLIT": 1,
      "num_warps": 2,
      "num_stages": 1,
      "waves_per_eu": 0
    },
    "4211": {
      "BLOCK_M": 128,
      "BLOCK_N": 16,
      "BLOCK_K": 256,
      "BLOCK_C": 128,
      "NUM_KSPLIT": 2,
      "num_warps": 8,
      "num_stages": 2,
      "waves_per_eu": 2
    },
    "3199": {
      "BLOCK_M": 128,
      "BLOCK_N": 16,
      "BLOCK_K": 32,
      "BLOCK_C": 256,
      "NUM_KSPLIT": 2,
      "num_warps": 8,
      "num_stages": 1,
      "waves_per_eu": 1
    },
    "1886": {
      "BLOCK_M": 64,
      "BLOCK_N": 16,
      "BLOCK_K": 64,
      "BLOCK_C": 32,
      "NUM_KSPLIT": 1,
      "num_warps": 8,
      "num_stages": 1,
      "waves_per_eu": 2
    },
    "3384": {
      "BLOCK_M": 128,
      "BLOCK_N": 16,
      "BLOCK_K": 64,
      "BLOCK_C": 64,
      "NUM_KSPLIT": 1,
      "num_warps": 2,
      "num_stages": 1,
      "waves_per_eu": 0
    },
    "66": {
      "BLOCK_M": 32,
      "BLOCK_N": 16,
      "BLOCK_K": 32,
      "BLOCK_C": 16,
      "NUM_KSPLIT": 8,
      "num_warps": 8,
      "num_stages": 1,
      "waves_per_eu": 0
    },
    "5566": {
      "BLOCK_M": 256,
      "BLOCK_N": 16,
      "BLOCK_K": 256,
      "BLOCK_C": 64,
      "NUM_KSPLIT": 2,
      "num_warps": 2,
      "num_stages": 2,
      "waves_per_eu": 1
    },
    "5283": {
      "BLOCK_M": 256,
      "BLOCK_N": 16,
      "BLOCK_K": 128,
      "BLOCK_C": 128,
      "NUM_KSPLIT": 2,
      "num_warps": 4,
      "num_stages": 2,
      "waves_per_eu": 0
    },
    "2042": {
      "BLOCK_M": 64,
      "BLOCK_N": 16,
      "BLOCK_K": 64,
      "BLOCK_C": 128,
      "NUM_KSPLIT": 2,
      "num_warps": 4,
      "num_stages": 1,
      "waves_per_eu": 2
    },
    "5127": {
      "BLOCK_M": 256,
      "BLOCK_N": 16,
      "BLOCK_K": 128,
      "BLOCK_C": 32,
      "NUM_KSPLIT": 1,
      "num_warps": 8,
      "num_stages": 2,
      "waves_per_eu": 0
    },
    "5689": {
      "BLOCK_M": 256,
      "BLOCK_N": 16,
      "BLOCK_K": 256,
      "BLOCK_C": 256,
      "NUM_KSPLIT": 1,
      "num_warps": 2,
      "num_stages": 1,
      "waves_per_eu": 1
    },
    "3899": {
      "BLOCK_M": 128,
      "BLOCK_N": 16,
      "BLOCK_K": 128,
      "BLOCK_C": 256,
      "NUM_KSPLIT": 1,
      "num_warps": 4,
      "num_stages": 2,
      "waves_per_eu": 2
    },
    "4057": {
      "BLOCK_M": 128,
      "BLOCK_N": 16,
      "BLOCK_K": 256,
      "BLOCK_C": 32,
      "NUM_KSPLIT": 2,
      "num_warps": 4,
      "num_stages": 1,
      "waves_per_eu": 1
    },
    "4674": {
      "BLOCK_M": 256,
      "BLOCK_N": 16,
      "BLOCK_K": 32,
      "BLOCK_C": 256,
      "NUM_KSPLIT": 8,
      "num_warps": 8,
      "num_stages": 1,
      "waves_per_eu": 0
    },
    "3937": {
      "BLOCK_M": 128,
      "BLOCK_N": 16,
      "BLOCK_K": 128,
      "BLOCK_C": 256,
      "NUM_KSPLIT": 4,
      "num_warps": 8,
      "num_stages": 1,
      "waves_per_eu": 1
    },
    "4810": {
      "BLOCK_M": 256,
      "BLOCK_N": 16,
      "BLOCK_K": 64,
      "BLOCK_C": 32,
      "NUM_KSPLIT": 8,
      "num_warps": 2,
      "num_stages": 2,
      "waves_per_eu": 1
    },
    "5066": {
      "BLOCK_M": 256,
      "BLOCK_N": 16,
      "BLOCK_K": 128,
      "BLOCK_C": 16,
      "NUM_KSPLIT": 2,
      "num_warps": 4,
      "num_stages": 1,
      "waves_per_eu": 2
    },
    "4393": {
      "BLOCK_M": 256,
      "BLOCK_N": 16,
      "BLOCK_K": 32,
      "BLOCK_C": 32,
      "NUM_KSPLIT": 1,
      "num_warps": 2,
      "num_stages": 1,
      "waves_per_eu": 1
    },
    "3847": {
      "BLOCK_M": 128,
      "BLOCK_N": 16,
      "BLOCK_K": 128,
      "BLOCK_C": 128,
      "NUM_KSPLIT": 2,
      "num_warps": 8,
      "num_stages": 1,
      "waves_per_eu": 1
    },
    "2621": {
      "BLOCK_M": 64,
      "BLOCK_N": 16,
      "BLOCK_K": 256,
      "BLOCK_C": 32,
      "NUM_KSPLIT": 2,
      "num_warps": 4,
      "num_stages": 2,
      "waves_per_eu": 2
    },
    "3624": {
      "BLOCK_M": 128,
      "BLOCK_N": 16,
      "BLOCK_K": 128,
      "BLOCK_C": 16,
      "NUM_KSPLIT": 2,
      "num_warps": 4,
      "num_stages": 1,
      "waves_per_eu": 0
    },
    "2508": {
      "BLOCK_M": 64,
      "BLOCK_N": 16,
      "BLOCK_K": 128,
      "BLOCK_C": 256,
      "NUM_KSPLIT": 8,
      "num_warps": 4,
      "num_stages": 1,
      "waves_per_eu": 0
    },
    "2842": {
      "BLOCK_M": 64,
      "BLOCK_N": 16,
      "BLOCK_K": 256,
      "BLOCK_C": 256,
      "NUM_KSPLIT": 2,
      "num_warps": 8,
      "num_stages": 2,
      "waves_per_eu": 1
    },
    "3854": {
      "BLOCK_M": 128,
      "BLOCK_N": 16,
      "BLOCK_K": 128,
      "BLOCK_C": 128,
      "NUM_KSPLIT": 4,
      "num_warps": 2,
      "num_stages": 1,
      "waves_per_eu": 2
    },
    "4112": {
      "BLOCK_M": 128,
      "BLOCK_N": 16,
      "BLOCK_K": 256,
      "BLOCK_C": 64,
      "NUM_KSPLIT": 1,
      "num_warps": 4,
      "num_stages": 1,
      "waves_per_eu": 2
    },
    "5167": {
      "BLOCK_M": 256,
      "BLOCK_N": 16,
      "BLOCK_K": 128,
      "BLOCK_C": 32,
      "NUM_KSPLIT": 8,
      "num_warps": 2,
      "num_stages": 1,
      "waves_per_eu": 1
    },
    "1651": {
      "BLOCK_M": 64,
      "BLOCK_N": 16,
      "BLOCK_K": 32,
      "BLOCK_C": 64,
      "NUM_KSPLIT": 8,
      "num_warps": 8,
      "num_stages": 1,
      "waves_per_eu": 1
    },
    "3885": {
      "BLOCK_M": 128,
      "BLOCK_N": 16,
      "BLOCK_K": 128,
      "BLOCK_C": 128,
      "NUM_KSPLIT": 8,
      "num_warps": 8,
      "num_stages": 2,
      "waves_per_eu": 0
    },
    "2448": {
      "BLOCK_M": 64,
      "BLOCK_N": 16,
      "BLOCK_K": 128,
      "BLOCK_C": 256,
      "NUM_KSPLIT": 1,
      "num_warps": 2,
      "num_stages": 1,
      "waves_per_eu": 0
    },
    "2769": {
      "BLOCK_M": 64,
      "BLOCK_N": 16,
      "BLOCK_K": 256,
      "BLOCK_C": 128,
      "NUM_KSPLIT": 2,
      "num_warps": 8,
      "num_stages": 2,
      "waves_per_eu": 0
    },
    "1957": {
      "BLOCK_M": 64,
      "BLOCK_N": 16,
      "BLOCK_K": 64,
      "BLOCK_C": 64,
      "NUM_KSPLIT": 1,
      "num_warps": 8,
      "num_stages": 1,
      "waves_per_eu": 1
    },
    "616": {
      "BLOCK_M": 32,
      "BLOCK_N": 16,
      "BLOCK_K": 64,
      "BLOCK_C": 128,
      "NUM_KSPLIT": 4,
      "num_warps": 2,
      "num_stages": 2,
      "waves_per_eu": 1
    },
    "76": {
      "BLOCK_M": 32,
      "BLOCK_N": 16,
      "BLOCK_K": 32,
      "BLOCK_C": 32,
      "NUM_KSPLIT": 1,
      "num_warps": 2,
      "num_stages": 2,
      "waves_per_eu": 1
    },
    "4249": {
      "BLOCK_M": 128,
      "BLOCK_N": 16,
      "BLOCK_K": 256,
      "BLOCK_C": 256,
      "NUM_KSPLIT": 1,
      "num_warps": 2,
      "num_stages": 1,
      "waves_per_eu": 1
    },
    "943": {
      "BLOCK_M": 32,
      "BLOCK_N": 16,
      "BLOCK_K": 128,
      "BLOCK_C": 128,
      "NUM_KSPLIT": 1,
      "num_warps": 4,
      "num_stages": 1,
      "waves_per_eu": 1
    },
    "2424": {
      "BLOCK_M": 64,
      "BLOCK_N": 16,
      "BLOCK_K": 128,
      "BLOCK_C": 128,
      "NUM_KSPLIT": 4,
      "num_warps": 8,
      "num_stages": 1,
      "waves_per_eu": 0
    },
    "1751": {
      "BLOCK_M": 64,
      "BLOCK_N": 16,
      "BLOCK_K": 32,
      "BLOCK_C": 256,
      "NUM_KSPLIT": 2,
      "num_warps": 2,
      "num_stages": 2,
      "waves_per_eu": 2
    },
    "4206": {
      "BLOCK_M": 128,
      "BLOCK_N": 16,
      "BLOCK_K": 256,
      "BLOCK_C": 128,
      "NUM_KSPLIT": 2,
      "num_warps": 8,
      "num_stages": 1,
      "waves_per_eu": 0
    },
    "1511": {
      "BLOCK_M": 64,
      "BLOCK_N": 16,
      "BLOCK_K": 32,
      "BLOCK_C": 16,
      "NUM_KSPLIT": 8,
      "num_warps": 8,
      "num_stages": 2,
      "waves_per_eu": 2
    },
    "294": {
      "BLOCK_M": 32,
      "BLOCK_N": 16,
      "BLOCK_K": 32,
      "BLOCK_C": 256,
      "NUM_KSPLIT": 1,
      "num_warps": 4,
      "num_stages": 1,
      "waves_per_eu": 0
    },
    "5487": {
      "BLOCK_M": 256,
      "BLOCK_N": 16,
      "BLOCK_K": 256,
      "BLOCK_C": 32,
      "NUM_KSPLIT": 1,
      "num_warps": 8,
      "num_stages": 2,
      "waves_per_eu": 0
    },
    "1298": {
      "BLOCK_M": 32,
      "BLOCK_N": 16,
      "BLOCK_K": 256,
      "BLOCK_C": 128,
      "NUM_KSPLIT": 1,
      "num_warps": 2,
      "num_stages": 1,
      "waves_per_eu": 2
    },
    "2890": {
      "BLOCK_M": 128,
      "BLOCK_N": 16,
      "BLOCK_K": 32,
      "BLOCK_C": 16,
      "NUM_KSPLIT": 1,
      "num_warps": 4,
      "num_stages": 2,
      "waves_per_eu": 1
    },
    "2235": {
      "BLOCK_M": 64,
      "BLOCK_N": 16,
      "BLOCK_K": 128,
      "BLOCK_C": 32,
      "NUM_KSPLIT": 1,
      "num_warps": 2,
      "num_stages": 2,
      "waves_per_eu": 0
    },
    "347": {
      "BLOCK_M": 32,
      "BLOCK_N": 16,
      "BLOCK_K": 32,
      "BLOCK_C": 256,
      "NUM_KSPLIT": 8,
      "num_warps": 2,
      "num_stages": 2,
      "waves_per_eu": 2
    },
    "4933": {
      "BLOCK_M": 256,
      "BLOCK_N": 16,
      "BLOCK_K": 64,
      "BLOCK_C": 128,
      "NUM_KSPLIT": 4,
      "num_warps": 2,
      "num_stages": 1,
      "waves_per_eu": 1
    },
    "3888": {
      "BLOCK_M": 128,
      "BLOCK_N": 16,
      "BLOCK_K": 128,
      "BLOCK_C": 256,
      "NUM_KSPLIT": 1,
      "num_warps": 2,
      "num_stages": 1,
      "waves_per_eu": 0
    },
    "5262": {
      "BLOCK_M": 256,
      "BLOCK_N": 16,
      "BLOCK_K": 128,
      "BLOCK_C": 128,
      "NUM_KSPLIT": 1,
      "num_warps": 4,
      "num_stages": 1,
      "waves_per_eu": 0
    },
    "3181": {
      "BLOCK_M": 128,
      "BLOCK_N": 16,
      "BLOCK_K": 32,
      "BLOCK_C": 256,
      "NUM_KSPLIT": 1,
      "num_warps": 8,
      "num_stages": 1,
      "waves_per_eu": 1
    },
    "814": {
      "BLOCK_M": 32,
      "BLOCK_N": 16,
      "BLOCK_K": 128,
      "BLOCK_C": 32,
      "NUM_KSPLIT": 2,
      "num_warps": 2,
      "num_stages": 2,
      "waves_per_eu": 1
    },
    "136": {
      "BLOCK_M": 32,
      "BLOCK_N": 16,
      "BLOCK_K": 32,
      "BLOCK_C": 32,
      "NUM_KSPLIT": 8,
      "num_warps": 4,
      "num_stages": 2,
      "waves_per_eu": 1
    },
    "4080": {
      "BLOCK_M": 128,
      "BLOCK_N": 16,
      "BLOCK_K": 256,
      "BLOCK_C": 32,
      "NUM_KSPLIT": 4,
      "num_warps": 8,
      "num_stages": 1,
      "waves_per_eu": 0
    },
    "653": {
      "BLOCK_M": 32,
      "BLOCK_N": 16,
      "BLOCK_K": 64,
      "BLOCK_C": 256,
      "NUM_KSPLIT": 1,
      "num_warps": 2,
      "num_stages": 2,
      "waves_per_eu": 2
    },
    "3085": {
      "BLOCK_M": 128,
      "BLOCK_N": 16,
      "BLOCK_K": 32,
      "BLOCK_C": 64,
      "NUM_KSPLIT": 8,
      "num_warps": 4,
      "num_stages": 1,
      "waves_per_eu": 1
    },
    "5310": {
      "BLOCK_M": 256,
      "BLOCK_N": 16,
      "BLOCK_K": 128,
      "BLOCK_C": 128,
      "NUM_KSPLIT": 8,
      "num_warps": 2,
      "num_stages": 1,
      "waves_per_eu": 0
    },
    "494": {
      "BLOCK_M": 32,
      "BLOCK_N": 16,
      "BLOCK_K": 64,
      "BLOCK_C": 32,
      "NUM_KSPLIT": 8,
      "num_warps": 4,
      "num_stages": 1,
      "waves_per_eu": 2
    },
    "2832": {
      "BLOCK_M": 64,
      "BLOCK_N": 16,
      "BLOCK_K": 256,
      "BLOCK_C": 256,
      "NUM_KSPLIT": 2,
      "num_warps": 4,
      "num_stages": 1,
      "waves_per_eu": 0
    },
    "3073": {
      "BLOCK_M": 128,
      "BLOCK_N": 16,
      "BLOCK_K": 32,
      "BLOCK_C": 64,
      "NUM_KSPLIT": 4,
      "num_warps": 8,
      "num_stages": 1,
      "waves_per_eu": 1
    },
    "520": {
      "BLOCK_M": 32,
      "BLOCK_N": 16,
      "BLOCK_K": 64,
      "BLOCK_C": 64,
      "NUM_KSPLIT": 1,
      "num_warps": 8,
      "num_stages": 2,
      "waves_per_eu": 1
    },
    "2011": {
      "BLOCK_M": 64,
      "BLOCK_N": 16,
      "BLOCK_K": 64,
      "BLOCK_C": 64,
      "NUM_KSPLIT": 8,
      "num_warps": 8,
      "num_stages": 1,
      "waves_per_eu": 1
    },
    "1555": {
      "BLOCK_M": 64,
      "BLOCK_N": 16,
      "BLOCK_K": 32,
      "BLOCK_C": 32,
      "NUM_KSPLIT": 4,
      "num_warps": 4,
      "num_stages": 1,
      "waves_per_eu": 1
    },
    "5014": {
      "BLOCK_M": 256,
      "BLOCK_N": 16,
      "BLOCK_K": 64,
      "BLOCK_C": 256,
      "NUM_KSPLIT": 4,
      "num_warps": 4,
      "num_stages": 2,
      "waves_per_eu": 1
    },
    "4335": {
      "BLOCK_M": 256,
      "BLOCK_N": 16,
      "BLOCK_K": 32,
      "BLOCK_C": 16,
      "NUM_KSPLIT": 1,
      "num_warps": 8,
      "num_stages": 2,
      "waves_per_eu": 0
    },
    "4820": {
      "BLOCK_M": 256,
      "BLOCK_N": 16,
      "BLOCK_K": 64,
      "BLOCK_C": 32,
      "NUM_KSPLIT": 8,
      "num_warps": 8,
      "num_stages": 1,
      "waves_per_eu": 2
    },
    "885": {
      "BLOCK_M": 32,
      "BLOCK_N": 16,
      "BLOCK_K": 128,
      "BLOCK_C": 64,
      "NUM_KSPLIT": 2,
      "num_warps": 2,
      "num_stages": 2,
      "waves_per_eu": 0
    },
    "211": {
      "BLOCK_M": 32,
      "BLOCK_N": 16,
      "BLOCK_K": 32,
      "BLOCK_C": 64,
      "NUM_KSPLIT": 8,
      "num_warps": 8,
      "num_stages": 1,
      "waves_per_eu": 1
    },
    "5263": {
      "BLOCK_M": 256,
      "BLOCK_N": 16,
      "BLOCK_K": 128,
      "BLOCK_C": 128,
      "NUM_KSPLIT": 1,
      "num_warps": 4,
      "num_stages": 1,
      "waves_per_eu": 1
    },
    "251": {
      "BLOCK_M": 32,
      "BLOCK_N": 16,
      "BLOCK_K": 32,
      "BLOCK_C": 128,
      "NUM_KSPLIT": 2,
      "num_warps": 8,
      "num_stages": 2,
      "waves_per_eu": 2
    },
    "1001": {
      "BLOCK_M": 32,
      "BLOCK_N": 16,
      "BLOCK_K": 128,
      "BLOCK_C": 128,
      "NUM_KSPLIT": 8,
      "num_warps": 4,
      "num_stages": 2,
      "waves_per_eu": 2
    },
    "4127": {
      "BLOCK_M": 128,
      "BLOCK_N": 16,
      "BLOCK_K": 256,
      "BLOCK_C": 64,
      "NUM_KSPLIT": 2,
      "num_warps": 2,
      "num_stages": 2,
      "waves_per_eu": 2
    },
    "2526": {
      "BLOCK_M": 64,
      "BLOCK_N": 16,
      "BLOCK_K": 256,
      "BLOCK_C": 16,
      "NUM_KSPLIT": 1,
      "num_warps": 4,
      "num_stages": 1,
      "waves_per_eu": 0
    },
    "5465": {
      "BLOCK_M": 256,
      "BLOCK_N": 16,
      "BLOCK_K": 256,
      "BLOCK_C": 16,
      "NUM_KSPLIT": 8,
      "num_warps": 4,
      "num_stages": 2,
      "waves_per_eu": 2
    },
    "5256": {
      "BLOCK_M": 256,
      "BLOCK_N": 16,
      "BLOCK_K": 128,
      "BLOCK_C": 128,
      "NUM_KSPLIT": 1,
      "num_warps": 2,
      "num_stages": 1,
      "waves_per_eu": 0
    },
    "1153": {
      "BLOCK_M": 32,
      "BLOCK_N": 16,
      "BLOCK_K": 256,
      "BLOCK_C": 32,
      "NUM_KSPLIT": 1,
      "num_warps": 2,
      "num_stages": 1,
      "waves_per_eu": 1
    },
    "5435": {
      "BLOCK_M": 256,
      "BLOCK_N": 16,
      "BLOCK_K": 256,
      "BLOCK_C": 16,
      "NUM_KSPLIT": 2,
      "num_warps": 8,
      "num_stages": 2,
      "waves_per_eu": 2
    },
    "546": {
      "BLOCK_M": 32,
      "BLOCK_N": 16,
      "BLOCK_K": 64,
      "BLOCK_C": 64,
      "NUM_KSPLIT": 4,
      "num_warps": 4,
      "num_stages": 1,
      "waves_per_eu": 0
    },
    "2660": {
      "BLOCK_M": 64,
      "BLOCK_N": 16,
      "BLOCK_K": 256,
      "BLOCK_C": 32,
      "NUM_KSPLIT": 8,
      "num_warps": 8,
      "num_stages": 1,
      "waves_per_eu": 2
    },
    "4914": {
      "BLOCK_M": 256,
      "BLOCK_N": 16,
      "BLOCK_K": 64,
      "BLOCK_C": 128,
      "NUM_KSPLIT": 2,
      "num_warps": 2,
      "num_stages": 1,
      "waves_per_eu": 0
    },
    "1885": {
      "BLOCK_M": 64,
      "BLOCK_N": 16,
      "BLOCK_K": 64,
      "BLOCK_C": 32,
      "NUM_KSPLIT": 1,
      "num_warps": 8,
      "num_stages": 1,
      "waves_per_eu": 1
    },
    "4064": {
      "BLOCK_M": 128,
      "BLOCK_N": 16,
      "BLOCK_K": 256,
      "BLOCK_C": 32,
      "NUM_KSPLIT": 2,
      "num_warps": 8,
      "num_stages": 1,
      "waves_per_eu": 2
    },
    "5418": {
      "BLOCK_M": 256,
      "BLOCK_N": 16,
      "BLOCK_K": 256,
      "BLOCK_C": 16,
      "NUM_KSPLIT": 2,
      "num_warps": 2,
      "num_stages": 1,
      "waves_per_eu": 0
    },
    "1398": {
      "BLOCK_M": 32,
      "BLOCK_N": 16,
      "BLOCK_K": 256,
      "BLOCK_C": 256,
      "NUM_KSPLIT": 2,
      "num_warps": 8,
      "num_stages": 1,
      "waves_per_eu": 0
    },
    "566": {
      "BLOCK_M": 32,
      "BLOCK_N": 16,
      "BLOCK_K": 64,
      "BLOCK_C": 64,
      "NUM_KSPLIT": 8,
      "num_warps": 4,
      "num_stages": 1,
      "waves_per_eu": 2
    },
    "5580": {
      "BLOCK_M": 256,
      "BLOCK_N": 16,
      "BLOCK_K": 256,
      "BLOCK_C": 64,
      "NUM_KSPLIT": 4,
      "num_warps": 2,
      "num_stages": 1,
      "waves_per_eu": 0
    },
    "3060": {
      "BLOCK_M": 128,
      "BLOCK_N": 16,
      "BLOCK_K": 32,
      "BLOCK_C": 64,
      "NUM_KSPLIT": 4,
      "num_warps": 2,
      "num_stages": 1,
      "waves_per_eu": 0
    },
    "828": {
      "BLOCK_M": 32,
      "BLOCK_N": 16,
      "BLOCK_K": 128,
      "BLOCK_C": 32,
      "NUM_KSPLIT": 4,
      "num_warps": 2,
      "num_stages": 1,
      "waves_per_eu": 0
    },
    "2497": {
      "BLOCK_M": 64,
      "BLOCK_N": 16,
      "BLOCK_K": 128,
      "BLOCK_C": 256,
      "NUM_KSPLIT": 4,
      "num_warps": 8,
      "num_stages": 1,
      "waves_per_eu": 1
    },
    "4379": {
      "BLOCK_M": 256,
      "BLOCK_N": 16,
      "BLOCK_K": 32,
      "BLOCK_C": 16,
      "NUM_KSPLIT": 8,
      "num_warps": 2,
      "num_stages": 2,
      "waves_per_eu": 2
    },
    "5670": {
      "BLOCK_M": 256,
      "BLOCK_N": 16,
      "BLOCK_K": 256,
      "BLOCK_C": 128,
      "NUM_KSPLIT": 8,
      "num_warps": 2,
      "num_stages": 1,
      "waves_per_eu": 0
    },
    "5509": {
      "BLOCK_M": 256,
      "BLOCK_N": 16,
      "BLOCK_K": 256,
      "BLOCK_C": 32,
      "NUM_KSPLIT": 4,
      "num_warps": 2,
      "num_stages": 1,
      "waves_per_eu": 1
    },
    "4228": {
      "BLOCK_M": 128,
      "BLOCK_N": 16,
      "BLOCK_K": 256,
      "BLOCK_C": 128,
      "NUM_KSPLIT": 4,
      "num_warps": 8,
      "num_stages": 2,
      "waves_per_eu": 1
    },
    "1582": {
      "BLOCK_M": 64,
      "BLOCK_N": 16,
      "BLOCK_K": 32,
      "BLOCK_C": 32,
      "NUM_KSPLIT": 8,
      "num_warps": 8,
      "num_stages": 2,
      "waves_per_eu": 1
    },
    "2198": {
      "BLOCK_M": 64,
      "BLOCK_N": 16,
      "BLOCK_K": 128,
      "BLOCK_C": 16,
      "NUM_KSPLIT": 4,
      "num_warps": 2,
      "num_stages": 1,
      "waves_per_eu": 2
    },
    "2992": {
      "BLOCK_M": 128,
      "BLOCK_N": 16,
      "BLOCK_K": 32,
      "BLOCK_C": 32,
      "NUM_KSPLIT": 4,
      "num_warps": 2,
      "num_stages": 2,
      "waves_per_eu": 1
    },
    "5219": {
      "BLOCK_M": 256,
      "BLOCK_N": 16,
      "BLOCK_K": 128,
      "BLOCK_C": 64,
      "NUM_KSPLIT": 2,
      "num_warps": 8,
      "num_stages": 2,
      "waves_per_eu": 2
    },
    "2412": {
      "BLOCK_M": 64,
      "BLOCK_N": 16,
      "BLOCK_K": 128,
      "BLOCK_C": 128,
      "NUM_KSPLIT": 4,
      "num_warps": 2,
      "num_stages": 1,
      "waves_per_eu": 0
    },
    "4286": {
      "BLOCK_M": 128,
      "BLOCK_N": 16,
      "BLOCK_K": 256,
      "BLOCK_C": 256,
      "NUM_KSPLIT": 4,
      "num_warps": 2,
      "num_stages": 1,
      "waves_per_eu": 2
    },
    "5232": {
      "BLOCK_M": 256,
      "BLOCK_N": 16,
      "BLOCK_K": 128,
      "BLOCK_C": 64,
      "NUM_KSPLIT": 4,
      "num_warps": 8,
      "num_stages": 1,
      "waves_per_eu": 0
    },
    "2372": {
      "BLOCK_M": 64,
      "BLOCK_N": 16,
      "BLOCK_K": 128,
      "BLOCK_C": 64,
      "NUM_KSPLIT": 8,
      "num_warps": 8,
      "num_stages": 1,
      "waves_per_eu": 2
    },
    "1606": {
      "BLOCK_M": 64,
      "BLOCK_N": 16,
      "BLOCK_K": 32,
      "BLOCK_C": 64,
      "NUM_KSPLIT": 2,
      "num_warps": 2,
      "num_stages": 2,
      "waves_per_eu": 1
    },
    "3915": {
      "BLOCK_M": 128,
      "BLOCK_N": 16,
      "BLOCK_K": 128,
      "BLOCK_C": 256,
      "NUM_KSPLIT": 2,
      "num_warps": 4,
      "num_stages": 2,
      "waves_per_eu": 0
    },
    "735": {
      "BLOCK_M": 32,
      "BLOCK_N": 16,
      "BLOCK_K": 128,
      "BLOCK_C": 16,
      "NUM_KSPLIT": 1,
      "num_warps": 8,
      "num_stages": 2,
      "waves_per_eu": 0
    },
    "5125": {
      "BLOCK_M": 256,
      "BLOCK_N": 16,
      "BLOCK_K": 128,
      "BLOCK_C": 32,
      "NUM_KSPLIT": 1,
      "num_warps": 8,
      "num_stages": 1,
      "waves_per_eu": 1
    },
    "4077": {
      "BLOCK_M": 128,
      "BLOCK_N": 16,
      "BLOCK_K": 256,
      "BLOCK_C": 32,
      "NUM_KSPLIT": 4,
      "num_warps": 4,
      "num_stages": 2,
      "waves_per_eu": 0
    },
    "2188": {
      "BLOCK_M": 64,
      "BLOCK_N": 16,
      "BLOCK_K": 128,
      "BLOCK_C": 16,
      "NUM_KSPLIT": 2,
      "num_warps": 4,
      "num_stages": 2,
      "waves_per_eu": 1
    },
    "771": {
      "BLOCK_M": 32,
      "BLOCK_N": 16,
      "BLOCK_K": 128,
      "BLOCK_C": 16,
      "NUM_KSPLIT": 4,
      "num_warps": 8,
      "num_stages": 2,
      "waves_per_eu": 0
    },
    "3758": {
      "BLOCK_M": 128,
      "BLOCK_N": 16,
      "BLOCK_K": 128,
      "BLOCK_C": 64,
      "NUM_KSPLIT": 1,
      "num_warps": 8,
      "num_stages": 1,
      "waves_per_eu": 2
    },
    "4056": {
      "BLOCK_M": 128,
      "BLOCK_N": 16,
      "BLOCK_K": 256,
      "BLOCK_C": 32,
      "NUM_KSPLIT": 2,
      "num_warps": 4,
      "num_stages": 1,
      "waves_per_eu": 0
    },
    "761": {
      "BLOCK_M": 32,
      "BLOCK_N": 16,
      "BLOCK_K": 128,
      "BLOCK_C": 16,
      "NUM_KSPLIT": 4,
      "num_warps": 2,
      "num_stages": 2,
      "waves_per_eu": 2
    },
    "5382": {
      "BLOCK_M": 256,
      "BLOCK_N": 16,
      "BLOCK_K": 128,
      "BLOCK_C": 256,
      "NUM_KSPLIT": 8,
      "num_warps": 2,
      "num_stages": 1,
      "waves_per_eu": 0
    },
    "2900": {
      "BLOCK_M": 128,
      "BLOCK_N": 16,
      "BLOCK_K": 32,
      "BLOCK_C": 16,
      "NUM_KSPLIT": 2,
      "num_warps": 2,
      "num_stages": 1,
      "waves_per_eu": 2
    },
    "1531": {
      "BLOCK_M": 64,
      "BLOCK_N": 16,
      "BLOCK_K": 32,
      "BLOCK_C": 32,
      "NUM_KSPLIT": 2,
      "num_warps": 2,
      "num_stages": 1,
      "waves_per_eu": 1
    },
    "3641": {
      "BLOCK_M": 128,
      "BLOCK_N": 16,
      "BLOCK_K": 128,
      "BLOCK_C": 16,
      "NUM_KSPLIT": 4,
      "num_warps": 2,
      "num_stages": 2,
      "waves_per_eu": 2
    },
    "3554": {
      "BLOCK_M": 128,
      "BLOCK_N": 16,
      "BLOCK_K": 64,
      "BLOCK_C": 256,
      "NUM_KSPLIT": 2,
      "num_warps": 4,
      "num_stages": 1,
      "waves_per_eu": 2
    },
    "5318": {
      "BLOCK_M": 256,
      "BLOCK_N": 16,
      "BLOCK_K": 128,
      "BLOCK_C": 128,
      "NUM_KSPLIT": 8,
      "num_warps": 4,
      "num_stages": 1,
      "waves_per_eu": 2
    },
    "2387": {
      "BLOCK_M": 64,
      "BLOCK_N": 16,
      "BLOCK_K": 128,
      "BLOCK_C": 128,
      "NUM_KSPLIT": 1,
      "num_warps": 4,
      "num_stages": 2,
      "waves_per_eu": 2
    },
    "3329": {
      "BLOCK_M": 128,
      "BLOCK_N": 16,
      "BLOCK_K": 64,
      "BLOCK_C": 32,
      "NUM_KSPLIT": 1,
      "num_warps": 8,
      "num_stages": 2,
      "waves_per_eu": 2
    },
    "775": {
      "BLOCK_M": 32,
      "BLOCK_N": 16,
      "BLOCK_K": 128,
      "BLOCK_C": 16,
      "NUM_KSPLIT": 8,
      "num_warps": 2,
      "num_stages": 1,
      "waves_per_eu": 1
    },
    "5108": {
      "BLOCK_M": 256,
      "BLOCK_N": 16,
      "BLOCK_K": 128,
      "BLOCK_C": 16,
      "NUM_KSPLIT": 8,
      "num_warps": 8,
      "num_stages": 1,
      "waves_per_eu": 2
    },
    "3156": {
      "BLOCK_M": 128,
      "BLOCK_N": 16,
      "BLOCK_K": 32,
      "BLOCK_C": 128,
      "NUM_KSPLIT": 8,
      "num_warps": 4,
      "num_stages": 1,
      "waves_per_eu": 0
    },
    "2927": {
      "BLOCK_M": 128,
      "BLOCK_N": 16,
      "BLOCK_K": 32,
      "BLOCK_C": 16,
      "NUM_KSPLIT": 4,
      "num_warps": 4,
      "num_stages": 2,
      "waves_per_eu": 2
    },
    "3274": {
      "BLOCK_M": 128,
      "BLOCK_N": 16,
      "BLOCK_K": 64,
      "BLOCK_C": 16,
      "NUM_KSPLIT": 2,
      "num_warps": 8,
      "num_stages": 2,
      "waves_per_eu": 1
    },
    "5381": {
      "BLOCK_M": 256,
      "BLOCK_N": 16,
      "BLOCK_K": 128,
      "BLOCK_C": 256,
      "NUM_KSPLIT": 4,
      "num_warps": 8,
      "num_stages": 2,
      "waves_per_eu": 2
    },
    "3157": {
      "BLOCK_M": 128,
      "BLOCK_N": 16,
      "BLOCK_K": 32,
      "BLOCK_C": 128,
      "NUM_KSPLIT": 8,
      "num_warps": 4,
      "num_stages": 1,
      "waves_per_eu": 1
    },
    "2297": {
      "BLOCK_M": 64,
      "BLOCK_N": 16,
      "BLOCK_K": 128,
      "BLOCK_C": 32,
      "NUM_KSPLIT": 8,
      "num_warps": 4,
      "num_stages": 2,
      "waves_per_eu": 2
    },
    "3894": {
      "BLOCK_M": 128,
      "BLOCK_N": 16,
      "BLOCK_K": 128,
      "BLOCK_C": 256,
      "NUM_KSPLIT": 1,
      "num_warps": 4,
      "num_stages": 1,
      "waves_per_eu": 0
    },
    "2742": {
      "BLOCK_M": 64,
      "BLOCK_N": 16,
      "BLOCK_K": 256,
      "BLOCK_C": 128,
      "NUM_KSPLIT": 1,
      "num_warps": 4,
      "num_stages": 1,
      "waves_per_eu": 0
    },
    "2483": {
      "BLOCK_M": 64,
      "BLOCK_N": 16,
      "BLOCK_K": 128,
      "BLOCK_C": 256,
      "NUM_KSPLIT": 2,
      "num_warps": 8,
      "num_stages": 2,
      "waves_per_eu": 2
    },
    "3048": {
      "BLOCK_M": 128,
      "BLOCK_N": 16,
      "BLOCK_K": 32,
      "BLOCK_C": 64,
      "NUM_KSPLIT": 2,
      "num_warps": 4,
      "num_stages": 1,
      "waves_per_eu": 0
    },
    "4343": {
      "BLOCK_M": 256,
      "BLOCK_N": 16,
      "BLOCK_K": 32,
      "BLOCK_C": 16,
      "NUM_KSPLIT": 2,
      "num_warps": 2,
      "num_stages": 2,
      "waves_per_eu": 2
    },
    "681": {
      "BLOCK_M": 32,
      "BLOCK_N": 16,
      "BLOCK_K": 64,
      "BLOCK_C": 256,
      "NUM_KSPLIT": 2,
      "num_warps": 8,
      "num_stages": 2,
      "waves_per_eu": 0
    },
    "5738": {
      "BLOCK_M": 256,
      "BLOCK_N": 16,
      "BLOCK_K": 256,
      "BLOCK_C": 256,
      "NUM_KSPLIT": 4,
      "num_warps": 8,
      "num_stages": 1,
      "waves_per_eu": 2
    },
    "4945": {
      "BLOCK_M": 256,
      "BLOCK_N": 16,
      "BLOCK_K": 64,
      "BLOCK_C": 128,
      "NUM_KSPLIT": 4,
      "num_warps": 8,
      "num_stages": 1,
      "waves_per_eu": 1
    },
    "5486": {
      "BLOCK_M": 256,
      "BLOCK_N": 16,
      "BLOCK_K": 256,
      "BLOCK_C": 32,
      "NUM_KSPLIT": 1,
      "num_warps": 8,
      "num_stages": 1,
      "waves_per_eu": 2
    },
    "4738": {
      "BLOCK_M": 256,
      "BLOCK_N": 16,
      "BLOCK_K": 64,
      "BLOCK_C": 16,
      "NUM_KSPLIT": 8,
      "num_warps": 2,
      "num_stages": 2,
      "waves_per_eu": 1
    },
    "1960": {
      "BLOCK_M": 64,
      "BLOCK_N": 16,
      "BLOCK_K": 64,
      "BLOCK_C": 64,
      "NUM_KSPLIT": 1,
      "num_warps": 8,
      "num_stages": 2,
      "waves_per_eu": 1
    },
    "4320": {
      "BLOCK_M": 256,
      "BLOCK_N": 16,
      "BLOCK_K": 32,
      "BLOCK_C": 16,
      "NUM_KSPLIT": 1,
      "num_warps": 2,
      "num_stages": 1,
      "waves_per_eu": 0
    },
    "2609": {
      "BLOCK_M": 64,
      "BLOCK_N": 16,
      "BLOCK_K": 256,
      "BLOCK_C": 32,
      "NUM_KSPLIT": 1,
      "num_warps": 8,
      "num_stages": 2,
      "waves_per_eu": 2
    },
    "34": {
      "BLOCK_M": 32,
      "BLOCK_N": 16,
      "BLOCK_K": 32,
      "BLOCK_C": 16,
      "NUM_KSPLIT": 2,
      "num_warps": 8,
      "num_stages": 2,
      "waves_per_eu": 1
    },
    "2290": {
      "BLOCK_M": 64,
      "BLOCK_N": 16,
      "BLOCK_K": 128,
      "BLOCK_C": 32,
      "NUM_KSPLIT": 8,
      "num_warps": 2,
      "num_stages": 2,
      "waves_per_eu": 1
    },
    "4036": {
      "BLOCK_M": 128,
      "BLOCK_N": 16,
      "BLOCK_K": 256,
      "BLOCK_C": 32,
      "NUM_KSPLIT": 1,
      "num_warps": 2,
      "num_stages": 2,
      "waves_per_eu": 1
    },
    "4469": {
      "BLOCK_M": 256,
      "BLOCK_N": 16,
      "BLOCK_K": 32,
      "BLOCK_C": 64,
      "NUM_KSPLIT": 1,
      "num_warps": 2,
      "num_stages": 2,
      "waves_per_eu": 2
    },
    "1892": {
      "BLOCK_M": 64,
      "BLOCK_N": 16,
      "BLOCK_K": 64,
      "BLOCK_C": 32,
      "NUM_KSPLIT": 2,
      "num_warps": 2,
      "num_stages": 1,
      "waves_per_eu": 2
    },
    "1293": {
      "BLOCK_M": 32,
      "BLOCK_N": 16,
      "BLOCK_K": 256,
      "BLOCK_C": 64,
      "NUM_KSPLIT": 8,
      "num_warps": 8,
      "num_stages": 2,
      "waves_per_eu": 0
    },
    "3763": {
      "BLOCK_M": 128,
      "BLOCK_N": 16,
      "BLOCK_K": 128,
      "BLOCK_C": 64,
      "NUM_KSPLIT": 2,
      "num_warps": 2,
      "num_stages": 1,
      "waves_per_eu": 1
    },
    "85": {
      "BLOCK_M": 32,
      "BLOCK_N": 16,
      "BLOCK_K": 32,
      "BLOCK_C": 32,
      "NUM_KSPLIT": 1,
      "num_warps": 8,
      "num_stages": 1,
      "waves_per_eu": 1
    },
    "2350": {
      "BLOCK_M": 64,
      "BLOCK_N": 16,
      "BLOCK_K": 128,
      "BLOCK_C": 64,
      "NUM_KSPLIT": 4,
      "num_warps": 4,
      "num_stages": 2,
      "waves_per_eu": 1
    },
    "2425": {
      "BLOCK_M": 64,
      "BLOCK_N": 16,
      "BLOCK_K": 128,
      "BLOCK_C": 128,
      "NUM_KSPLIT": 4,
      "num_warps": 8,
      "num_stages": 1,
      "waves_per_eu": 1
    },
    "2479": {
      "BLOCK_M": 64,
      "BLOCK_N": 16,
      "BLOCK_K": 128,
      "BLOCK_C": 256,
      "NUM_KSPLIT": 2,
      "num_warps": 8,
      "num_stages": 1,
      "waves_per_eu": 1
    },
    "2849": {
      "BLOCK_M": 64,
      "BLOCK_N": 16,
      "BLOCK_K": 256,
      "BLOCK_C": 256,
      "NUM_KSPLIT": 4,
      "num_warps": 2,
      "num_stages": 2,
      "waves_per_eu": 2
    },
    "1820": {
      "BLOCK_M": 64,
      "BLOCK_N": 16,
      "BLOCK_K": 64,
      "BLOCK_C": 16,
      "NUM_KSPLIT": 2,
      "num_warps": 2,
      "num_stages": 1,
      "waves_per_eu": 2
    },
    "3494": {
      "BLOCK_M": 128,
      "BLOCK_N": 16,
      "BLOCK_K": 64,
      "BLOCK_C": 128,
      "NUM_KSPLIT": 4,
      "num_warps": 2,
      "num_stages": 1,
      "waves_per_eu": 2
    },
    "5288": {
      "BLOCK_M": 256,
      "BLOCK_N": 16,
      "BLOCK_K": 128,
      "BLOCK_C": 128,
      "NUM_KSPLIT": 2,
      "num_warps": 8,
      "num_stages": 1,
      "waves_per_eu": 2
    },
    "3285": {
      "BLOCK_M": 128,
      "BLOCK_N": 16,
      "BLOCK_K": 64,
      "BLOCK_C": 16,
      "NUM_KSPLIT": 4,
      "num_warps": 4,
      "num_stages": 2,
      "waves_per_eu": 0
    },
    "1913": {
      "BLOCK_M": 64,
      "BLOCK_N": 16,
      "BLOCK_K": 64,
      "BLOCK_C": 32,
      "NUM_KSPLIT": 4,
      "num_warps": 2,
      "num_stages": 2,
      "waves_per_eu": 2
    },
    "2670": {
      "BLOCK_M": 64,
      "BLOCK_N": 16,
      "BLOCK_K": 256,
      "BLOCK_C": 64,
      "NUM_KSPLIT": 1,
      "num_warps": 4,
      "num_stages": 1,
      "waves_per_eu": 0
    },
    "3345": {
      "BLOCK_M": 128,
      "BLOCK_N": 16,
      "BLOCK_K": 64,
      "BLOCK_C": 32,
      "NUM_KSPLIT": 2,
      "num_warps": 8,
      "num_stages": 2,
      "waves_per_eu": 0
    },
    "7": {
      "BLOCK_M": 32,
      "BLOCK_N": 16,
      "BLOCK_K": 32,
      "BLOCK_C": 16,
      "NUM_KSPLIT": 1,
      "num_warps": 4,
      "num_stages": 1,
      "waves_per_eu": 1
    },
    "4593": {
      "BLOCK_M": 256,
      "BLOCK_N": 16,
      "BLOCK_K": 32,
      "BLOCK_C": 128,
      "NUM_KSPLIT": 8,
      "num_warps": 2,
      "num_stages": 2,
      "waves_per_eu": 0
    },
    "1604": {
      "BLOCK_M": 64,
      "BLOCK_N": 16,
      "BLOCK_K": 32,
      "BLOCK_C": 64,
      "NUM_KSPLIT": 2,
      "num_warps": 2,
      "num_stages": 1,
      "waves_per_eu": 2
    },
    "634": {
      "BLOCK_M": 32,
      "BLOCK_N": 16,
      "BLOCK_K": 64,
      "BLOCK_C": 128,
      "NUM_KSPLIT": 8,
      "num_warps": 2,
      "num_stages": 2,
      "waves_per_eu": 1
    },
    "4665": {
      "BLOCK_M": 256,
      "BLOCK_N": 16,
      "BLOCK_K": 32,
      "BLOCK_C": 256,
      "NUM_KSPLIT": 8,
      "num_warps": 2,
      "num_stages": 2,
      "waves_per_eu": 0
    },
    "4410": {
      "BLOCK_M": 256,
      "BLOCK_N": 16,
      "BLOCK_K": 32,
      "BLOCK_C": 32,
      "NUM_KSPLIT": 2,
      "num_warps": 2,
      "num_stages": 1,
      "waves_per_eu": 0
    },
    "5471": {
      "BLOCK_M": 256,
      "BLOCK_N": 16,
      "BLOCK_K": 256,
      "BLOCK_C": 16,
      "NUM_KSPLIT": 8,
      "num_warps": 8,
      "num_stages": 2,
      "waves_per_eu": 2
    },
    "4883": {
      "BLOCK_M": 256,
      "BLOCK_N": 16,
      "BLOCK_K": 64,
      "BLOCK_C": 64,
      "NUM_KSPLIT": 8,
      "num_warps": 2,
      "num_stages": 2,
      "waves_per_eu": 2
    },
    "2853": {
      "BLOCK_M": 64,
      "BLOCK_N": 16,
      "BLOCK_K": 256,
      "BLOCK_C": 256,
      "NUM_KSPLIT": 4,
      "num_warps": 4,
      "num_stages": 2,
      "waves_per_eu": 0
    },
    "1439": {
      "BLOCK_M": 32,
      "BLOCK_N": 16,
      "BLOCK_K": 256,
      "BLOCK_C": 256,
      "NUM_KSPLIT": 8,
      "num_warps": 8,
      "num_stages": 2,
      "waves_per_eu": 2
    },
    "4640": {
      "BLOCK_M": 256,
      "BLOCK_N": 16,
      "BLOCK_K": 32,
      "BLOCK_C": 256,
      "NUM_KSPLIT": 2,
      "num_warps": 8,
      "num_stages": 1,
      "waves_per_eu": 2
    },
    "2866": {
      "BLOCK_M": 64,
      "BLOCK_N": 16,
      "BLOCK_K": 256,
      "BLOCK_C": 256,
      "NUM_KSPLIT": 8,
      "num_warps": 2,
      "num_stages": 2,
      "waves_per_eu": 1
    },
    "969": {
      "BLOCK_M": 32,
      "BLOCK_N": 16,
      "BLOCK_K": 128,
      "BLOCK_C": 128,
      "NUM_KSPLIT": 2,
      "num_warps": 8,
      "num_stages": 2,
      "waves_per_eu": 0
    },
    "1124": {
      "BLOCK_M": 32,
      "BLOCK_N": 16,
      "BLOCK_K": 256,
      "BLOCK_C": 16,
      "NUM_KSPLIT": 4,
      "num_warps": 4,
      "num_stages": 1,
      "waves_per_eu": 2
    },
    "2072": {
      "BLOCK_M": 64,
      "BLOCK_N": 16,
      "BLOCK_K": 64,
      "BLOCK_C": 128,
      "NUM_KSPLIT": 8,
      "num_warps": 2,
      "num_stages": 1,
      "waves_per_eu": 2
    },
    "4060": {
      "BLOCK_M": 128,
      "BLOCK_N": 16,
      "BLOCK_K": 256,
      "BLOCK_C": 32,
      "NUM_KSPLIT": 2,
      "num_warps": 4,
      "num_stages": 2,
      "waves_per_eu": 1
    },
    "2071": {
      "BLOCK_M": 64,
      "BLOCK_N": 16,
      "BLOCK_K": 64,
      "BLOCK_C": 128,
      "NUM_KSPLIT": 8,
      "num_warps": 2,
      "num_stages": 1,
      "waves_per_eu": 1
    },
    "2629": {
      "BLOCK_M": 64,
      "BLOCK_N": 16,
      "BLOCK_K": 256,
      "BLOCK_C": 32,
      "NUM_KSPLIT": 4,
      "num_warps": 2,
      "num_stages": 1,
      "waves_per_eu": 1
    },
    "2597": {
      "BLOCK_M": 64,
      "BLOCK_N": 16,
      "BLOCK_K": 256,
      "BLOCK_C": 32,
      "NUM_KSPLIT": 1,
      "num_warps": 2,
      "num_stages": 2,
      "waves_per_eu": 2
    },
    "2792": {
      "BLOCK_M": 64,
      "BLOCK_N": 16,
      "BLOCK_K": 256,
      "BLOCK_C": 128,
      "NUM_KSPLIT": 8,
      "num_warps": 2,
      "num_stages": 1,
      "waves_per_eu": 2
    },
    "2459": {
      "BLOCK_M": 64,
      "BLOCK_N": 16,
      "BLOCK_K": 128,
      "BLOCK_C": 256,
      "NUM_KSPLIT": 1,
      "num_warps": 4,
      "num_stages": 2,
      "waves_per_eu": 2
    },
    "4386": {
      "BLOCK_M": 256,
      "BLOCK_N": 16,
      "BLOCK_K": 32,
      "BLOCK_C": 16,
      "NUM_KSPLIT": 8,
      "num_warps": 8,
      "num_stages": 1,
      "waves_per_eu": 0
    },
    "1021": {
      "BLOCK_M": 32,
      "BLOCK_N": 16,
      "BLOCK_K": 128,
      "BLOCK_C": 256,
      "NUM_KSPLIT": 1,
      "num_warps": 8,
      "num_stages": 1,
      "waves_per_eu": 1
    },
    "1822": {
      "BLOCK_M": 64,
      "BLOCK_N": 16,
      "BLOCK_K": 64,
      "BLOCK_C": 16,
      "NUM_KSPLIT": 2,
      "num_warps": 2,
      "num_stages": 2,
      "waves_per_eu": 1
    },
    "2126": {
      "BLOCK_M": 64,
      "BLOCK_N": 16,
      "BLOCK_K": 64,
      "BLOCK_C": 256,
      "NUM_KSPLIT": 4,
      "num_warps": 2,
      "num_stages": 1,
      "waves_per_eu": 2
    },
    "2364": {
      "BLOCK_M": 64,
      "BLOCK_N": 16,
      "BLOCK_K": 128,
      "BLOCK_C": 64,
      "NUM_KSPLIT": 8,
      "num_warps": 4,
      "num_stages": 1,
      "waves_per_eu": 0
    },
    "3262": {
      "BLOCK_M": 128,
      "BLOCK_N": 16,
      "BLOCK_K": 64,
      "BLOCK_C": 16,
      "NUM_KSPLIT": 2,
      "num_warps": 2,
      "num_stages": 2,
      "waves_per_eu": 1
    },
    "1064": {
      "BLOCK_M": 32,
      "BLOCK_N": 16,
      "BLOCK_K": 128,
      "BLOCK_C": 256,
      "NUM_KSPLIT": 8,
      "num_warps": 2,
      "num_stages": 1,
      "waves_per_eu": 2
    },
    "127": {
      "BLOCK_M": 32,
      "BLOCK_N": 16,
      "BLOCK_K": 32,
      "BLOCK_C": 32,
      "NUM_KSPLIT": 8,
      "num_warps": 2,
      "num_stages": 1,
      "waves_per_eu": 1
    },
    "450": {
      "BLOCK_M": 32,
      "BLOCK_N": 16,
      "BLOCK_K": 64,
      "BLOCK_C": 32,
      "NUM_KSPLIT": 2,
      "num_warps": 2,
      "num_stages": 1,
      "waves_per_eu": 0
    },
    "3953": {
      "BLOCK_M": 128,
      "BLOCK_N": 16,
      "BLOCK_K": 128,
      "BLOCK_C": 256,
      "NUM_KSPLIT": 8,
      "num_warps": 4,
      "num_stages": 2,
      "waves_per_eu": 2
    },
    "1162": {
      "BLOCK_M": 32,
      "BLOCK_N": 16,
      "BLOCK_K": 256,
      "BLOCK_C": 32,
      "NUM_KSPLIT": 1,
      "num_warps": 4,
      "num_stages": 2,
      "waves_per_eu": 1
    },
    "5001": {
      "BLOCK_M": 256,
      "BLOCK_N": 16,
      "BLOCK_K": 64,
      "BLOCK_C": 256,
      "NUM_KSPLIT": 2,
      "num_warps": 8,
      "num_stages": 2,
      "waves_per_eu": 0
    },
    "1176": {
      "BLOCK_M": 32,
      "BLOCK_N": 16,
      "BLOCK_K": 256,
      "BLOCK_C": 32,
      "NUM_KSPLIT": 2,
      "num_warps": 4,
      "num_stages": 1,
      "waves_per_eu": 0
    },
    "3591": {
      "BLOCK_M": 128,
      "BLOCK_N": 16,
      "BLOCK_K": 64,
      "BLOCK_C": 256,
      "NUM_KSPLIT": 8,
      "num_warps": 4,
      "num_stages": 2,
      "waves_per_eu": 0
    },
    "1593": {
      "BLOCK_M": 64,
      "BLOCK_N": 16,
      "BLOCK_K": 32,
      "BLOCK_C": 64,
      "NUM_KSPLIT": 1,
      "num_warps": 4,
      "num_stages": 2,
      "waves_per_eu": 0
    },
    "5758": {
      "BLOCK_M": 256,
      "BLOCK_N": 16,
      "BLOCK_K": 256,
      "BLOCK_C": 256,
      "NUM_KSPLIT": 8,
      "num_warps": 8,
      "num_stages": 2,
      "waves_per_eu": 1
    },
    "5130": {
      "BLOCK_M": 256,
      "BLOCK_N": 16,
      "BLOCK_K": 128,
      "BLOCK_C": 32,
      "NUM_KSPLIT": 2,
      "num_warps": 2,
      "num_stages": 1,
      "waves_per_eu": 0
    },
    "1525": {
      "BLOCK_M": 64,
      "BLOCK_N": 16,
      "BLOCK_K": 32,
      "BLOCK_C": 32,
      "NUM_KSPLIT": 1,
      "num_warps": 8,
      "num_stages": 1,
      "waves_per_eu": 1
    },
    "3821": {
      "BLOCK_M": 128,
      "BLOCK_N": 16,
      "BLOCK_K": 128,
      "BLOCK_C": 128,
      "NUM_KSPLIT": 1,
      "num_warps": 2,
      "num_stages": 2,
      "waves_per_eu": 2
    },
    "1492": {
      "BLOCK_M": 64,
      "BLOCK_N": 16,
      "BLOCK_K": 32,
      "BLOCK_C": 16,
      "NUM_KSPLIT": 4,
      "num_warps": 8,
      "num_stages": 2,
      "waves_per_eu": 1
    },
    "29": {
      "BLOCK_M": 32,
      "BLOCK_N": 16,
      "BLOCK_K": 32,
      "BLOCK_C": 16,
      "NUM_KSPLIT": 2,
      "num_warps": 4,
      "num_stages": 2,
      "waves_per_eu": 2
    },
    "333": {
      "BLOCK_M": 32,
      "BLOCK_N": 16,
      "BLOCK_K": 32,
      "BLOCK_C": 256,
      "NUM_KSPLIT": 4,
      "num_warps": 4,
      "num_stages": 2,
      "waves_per_eu": 0
    },
    "2203": {
      "BLOCK_M": 64,
      "BLOCK_N": 16,
      "BLOCK_K": 128,
      "BLOCK_C": 16,
      "NUM_KSPLIT": 4,
      "num_warps": 4,
      "num_stages": 1,
      "waves_per_eu": 1
    },
    "1975": {
      "BLOCK_M": 64,
      "BLOCK_N": 16,
      "BLOCK_K": 64,
      "BLOCK_C": 64,
      "NUM_KSPLIT": 2,
      "num_warps": 8,
      "num_stages": 1,
      "waves_per_eu": 1
    },
    "137": {
      "BLOCK_M": 32,
      "BLOCK_N": 16,
      "BLOCK_K": 32,
      "BLOCK_C": 32,
      "NUM_KSPLIT": 8,
      "num_warps": 4,
      "num_stages": 2,
      "waves_per_eu": 2
    },
    "4371": {
      "BLOCK_M": 256,
      "BLOCK_N": 16,
      "BLOCK_K": 32,
      "BLOCK_C": 16,
      "NUM_KSPLIT": 4,
      "num_warps": 8,
      "num_stages": 2,
      "waves_per_eu": 0
    },
    "3974": {
      "BLOCK_M": 128,
      "BLOCK_N": 16,
      "BLOCK_K": 256,
      "BLOCK_C": 16,
      "NUM_KSPLIT": 1,
      "num_warps": 8,
      "num_stages": 1,
      "waves_per_eu": 2
    },
    "2399": {
      "BLOCK_M": 64,
      "BLOCK_N": 16,
      "BLOCK_K": 128,
      "BLOCK_C": 128,
      "NUM_KSPLIT": 2,
      "num_warps": 2,
      "num_stages": 2,
      "waves_per_eu": 2
    },
    "2550": {
      "BLOCK_M": 64,
      "BLOCK_N": 16,
      "BLOCK_K": 256,
      "BLOCK_C": 16,
      "NUM_KSPLIT": 2,
      "num_warps": 8,
      "num_stages": 1,
      "waves_per_eu": 0
    },
    "4084": {
      "BLOCK_M": 128,
      "BLOCK_N": 16,
      "BLOCK_K": 256,
      "BLOCK_C": 32,
      "NUM_KSPLIT": 4,
      "num_warps": 8,
      "num_stages": 2,
      "waves_per_eu": 1
    },
    "417": {
      "BLOCK_M": 32,
      "BLOCK_N": 16,
      "BLOCK_K": 64,
      "BLOCK_C": 16,
      "NUM_KSPLIT": 8,
      "num_warps": 2,
      "num_stages": 2,
      "waves_per_eu": 0
    },
    "822": {
      "BLOCK_M": 32,
      "BLOCK_N": 16,
      "BLOCK_K": 128,
      "BLOCK_C": 32,
      "NUM_KSPLIT": 2,
      "num_warps": 8,
      "num_stages": 1,
      "waves_per_eu": 0
    },
    "5372": {
      "BLOCK_M": 256,
      "BLOCK_N": 16,
      "BLOCK_K": 128,
      "BLOCK_C": 256,
      "NUM_KSPLIT": 4,
      "num_warps": 4,
      "num_stages": 1,
      "waves_per_eu": 2
    },
    "3343": {
      "BLOCK_M": 128,
      "BLOCK_N": 16,
      "BLOCK_K": 64,
      "BLOCK_C": 32,
      "NUM_KSPLIT": 2,
      "num_warps": 8,
      "num_stages": 1,
      "waves_per_eu": 1
    },
    "3582": {
      "BLOCK_M": 128,
      "BLOCK_N": 16,
      "BLOCK_K": 64,
      "BLOCK_C": 256,
      "NUM_KSPLIT": 8,
      "num_warps": 2,
      "num_stages": 1,
      "waves_per_eu": 0
    },
    "3055": {
      "BLOCK_M": 128,
      "BLOCK_N": 16,
      "BLOCK_K": 32,
      "BLOCK_C": 64,
      "NUM_KSPLIT": 2,
      "num_warps": 8,
      "num_stages": 1,
      "waves_per_eu": 1
    },
    "404": {
      "BLOCK_M": 32,
      "BLOCK_N": 16,
      "BLOCK_K": 64,
      "BLOCK_C": 16,
      "NUM_KSPLIT": 4,
      "num_warps": 4,
      "num_stages": 1,
      "waves_per_eu": 2
    },
    "3354": {
      "BLOCK_M": 128,
      "BLOCK_N": 16,
      "BLOCK_K": 64,
      "BLOCK_C": 32,
      "NUM_KSPLIT": 4,
      "num_warps": 4,
      "num_stages": 1,
      "waves_per_eu": 0
    },
    "3194": {
      "BLOCK_M": 128,
      "BLOCK_N": 16,
      "BLOCK_K": 32,
      "BLOCK_C": 256,
      "NUM_KSPLIT": 2,
      "num_warps": 4,
      "num_stages": 1,
      "waves_per_eu": 2
    },
    "4623": {
      "BLOCK_M": 256,
      "BLOCK_N": 16,
      "BLOCK_K": 32,
      "BLOCK_C": 256,
      "NUM_KSPLIT": 1,
      "num_warps": 8,
      "num_stages": 2,
      "waves_per_eu": 0
    },
    "4490": {
      "BLOCK_M": 256,
      "BLOCK_N": 16,
      "BLOCK_K": 32,
      "BLOCK_C": 64,
      "NUM_KSPLIT": 2,
      "num_warps": 4,
      "num_stages": 1,
      "waves_per_eu": 2
    },
    "2619": {
      "BLOCK_M": 64,
      "BLOCK_N": 16,
      "BLOCK_K": 256,
      "BLOCK_C": 32,
      "NUM_KSPLIT": 2,
      "num_warps": 4,
      "num_stages": 2,
      "waves_per_eu": 0
    },
    "3271": {
      "BLOCK_M": 128,
      "BLOCK_N": 16,
      "BLOCK_K": 64,
      "BLOCK_C": 16,
      "NUM_KSPLIT": 2,
      "num_warps": 8,
      "num_stages": 1,
      "waves_per_eu": 1
    },
    "2444": {
      "BLOCK_M": 64,
      "BLOCK_N": 16,
      "BLOCK_K": 128,
      "BLOCK_C": 128,
      "NUM_KSPLIT": 8,
      "num_warps": 8,
      "num_stages": 1,
      "waves_per_eu": 2
    },
    "5493": {
      "BLOCK_M": 256,
      "BLOCK_N": 16,
      "BLOCK_K": 256,
      "BLOCK_C": 32,
      "NUM_KSPLIT": 2,
      "num_warps": 2,
      "num_stages": 2,
      "waves_per_eu": 0
    },
    "1196": {
      "BLOCK_M": 32,
      "BLOCK_N": 16,
      "BLOCK_K": 256,
      "BLOCK_C": 32,
      "NUM_KSPLIT": 4,
      "num_warps": 4,
      "num_stages": 1,
      "waves_per_eu": 2
    },
    "5542": {
      "BLOCK_M": 256,
      "BLOCK_N": 16,
      "BLOCK_K": 256,
      "BLOCK_C": 32,
      "NUM_KSPLIT": 8,
      "num_warps": 8,
      "num_stages": 2,
      "waves_per_eu": 1
    },
    "4017": {
      "BLOCK_M": 128,
      "BLOCK_N": 16,
      "BLOCK_K": 256,
      "BLOCK_C": 16,
      "NUM_KSPLIT": 8,
      "num_warps": 2,
      "num_stages": 2,
      "waves_per_eu": 0
    },
    "1741": {
      "BLOCK_M": 64,
      "BLOCK_N": 16,
      "BLOCK_K": 32,
      "BLOCK_C": 256,
      "NUM_KSPLIT": 1,
      "num_warps": 8,
      "num_stages": 1,
      "waves_per_eu": 1
    },
    "1880": {
      "BLOCK_M": 64,
      "BLOCK_N": 16,
      "BLOCK_K": 64,
      "BLOCK_C": 32,
      "NUM_KSPLIT": 1,
      "num_warps": 4,
      "num_stages": 1,
      "waves_per_eu": 2
    },
    "2976": {
      "BLOCK_M": 128,
      "BLOCK_N": 16,
      "BLOCK_K": 32,
      "BLOCK_C": 32,
      "NUM_KSPLIT": 2,
      "num_warps": 4,
      "num_stages": 1,
      "waves_per_eu": 0
    },
    "5217": {
      "BLOCK_M": 256,
      "BLOCK_N": 16,
      "BLOCK_K": 128,
      "BLOCK_C": 64,
      "NUM_KSPLIT": 2,
      "num_warps": 8,
      "num_stages": 2,
      "waves_per_eu": 0
    },
    "8": {
      "BLOCK_M": 32,
      "BLOCK_N": 16,
      "BLOCK_K": 32,
      "BLOCK_C": 16,
      "NUM_KSPLIT": 1,
      "num_warps": 4,
      "num_stages": 1,
      "waves_per_eu": 2
    },
    "5352": {
      "BLOCK_M": 256,
      "BLOCK_N": 16,
      "BLOCK_K": 128,
      "BLOCK_C": 256,
      "NUM_KSPLIT": 2,
      "num_warps": 4,
      "num_stages": 1,
      "waves_per_eu": 0
    },
    "4801": {
      "BLOCK_M": 256,
      "BLOCK_N": 16,
      "BLOCK_K": 64,
      "BLOCK_C": 32,
      "NUM_KSPLIT": 4,
      "num_warps": 8,
      "num_stages": 1,
      "waves_per_eu": 1
    },
    "4915": {
      "BLOCK_M": 256,
      "BLOCK_N": 16,
      "BLOCK_K": 64,
      "BLOCK_C": 128,
      "NUM_KSPLIT": 2,
      "num_warps": 2,
      "num_stages": 1,
      "waves_per_eu": 1
    },
    "3462": {
      "BLOCK_M": 128,
      "BLOCK_N": 16,
      "BLOCK_K": 64,
      "BLOCK_C": 128,
      "NUM_KSPLIT": 1,
      "num_warps": 4,
      "num_stages": 1,
      "waves_per_eu": 0
    },
    "962": {
      "BLOCK_M": 32,
      "BLOCK_N": 16,
      "BLOCK_K": 128,
      "BLOCK_C": 128,
      "NUM_KSPLIT": 2,
      "num_warps": 4,
      "num_stages": 1,
      "waves_per_eu": 2
    },
    "1641": {
      "BLOCK_M": 64,
      "BLOCK_N": 16,
      "BLOCK_K": 32,
      "BLOCK_C": 64,
      "NUM_KSPLIT": 8,
      "num_warps": 2,
      "num_stages": 2,
      "waves_per_eu": 0
    },
    "275": {
      "BLOCK_M": 32,
      "BLOCK_N": 16,
      "BLOCK_K": 32,
      "BLOCK_C": 128,
      "NUM_KSPLIT": 8,
      "num_warps": 2,
      "num_stages": 2,
      "waves_per_eu": 2
    },
    "2856": {
      "BLOCK_M": 64,
      "BLOCK_N": 16,
      "BLOCK_K": 256,
      "BLOCK_C": 256,
      "NUM_KSPLIT": 4,
      "num_warps": 8,
      "num_stages": 1,
      "waves_per_eu": 0
    },
    "383": {
      "BLOCK_M": 32,
      "BLOCK_N": 16,
      "BLOCK_K": 64,
      "BLOCK_C": 16,
      "NUM_KSPLIT": 2,
      "num_warps": 2,
      "num_stages": 2,
      "waves_per_eu": 2
    },
    "990": {
      "BLOCK_M": 32,
      "BLOCK_N": 16,
      "BLOCK_K": 128,
      "BLOCK_C": 128,
      "NUM_KSPLIT": 8,
      "num_warps": 2,
      "num_stages": 1,
      "waves_per_eu": 0
    },
    "678": {
      "BLOCK_M": 32,
      "BLOCK_N": 16,
      "BLOCK_K": 64,
      "BLOCK_C": 256,
      "NUM_KSPLIT": 2,
      "num_warps": 8,
      "num_stages": 1,
      "waves_per_eu": 0
    },
    "4843": {
      "BLOCK_M": 256,
      "BLOCK_N": 16,
      "BLOCK_K": 64,
      "BLOCK_C": 64,
      "NUM_KSPLIT": 2,
      "num_warps": 2,
      "num_stages": 1,
      "waves_per_eu": 1
    },
    "5202": {
      "BLOCK_M": 256,
      "BLOCK_N": 16,
      "BLOCK_K": 128,
      "BLOCK_C": 64,
      "NUM_KSPLIT": 2,
      "num_warps": 2,
      "num_stages": 1,
      "waves_per_eu": 0
    },
    "4375": {
      "BLOCK_M": 256,
      "BLOCK_N": 16,
      "BLOCK_K": 32,
      "BLOCK_C": 16,
      "NUM_KSPLIT": 8,
      "num_warps": 2,
      "num_stages": 1,
      "waves_per_eu": 1
    },
    "4128": {
      "BLOCK_M": 128,
      "BLOCK_N": 16,
      "BLOCK_K": 256,
      "BLOCK_C": 64,
      "NUM_KSPLIT": 2,
      "num_warps": 4,
      "num_stages": 1,
      "waves_per_eu": 0
    },
    "5529": {
      "BLOCK_M": 256,
      "BLOCK_N": 16,
      "BLOCK_K": 256,
      "BLOCK_C": 32,
      "NUM_KSPLIT": 8,
      "num_warps": 2,
      "num_stages": 2,
      "waves_per_eu": 0
    },
    "4462": {
      "BLOCK_M": 256,
      "BLOCK_N": 16,
      "BLOCK_K": 32,
      "BLOCK_C": 32,
      "NUM_KSPLIT": 8,
      "num_warps": 8,
      "num_stages": 2,
      "waves_per_eu": 1
    },
    "5043": {
      "BLOCK_M": 256,
      "BLOCK_N": 16,
      "BLOCK_K": 128,
      "BLOCK_C": 16,
      "NUM_KSPLIT": 1,
      "num_warps": 2,
      "num_stages": 2,
      "waves_per_eu": 0
    },
    "1275": {
      "BLOCK_M": 32,
      "BLOCK_N": 16,
      "BLOCK_K": 256,
      "BLOCK_C": 64,
      "NUM_KSPLIT": 4,
      "num_warps": 8,
      "num_stages": 2,
      "waves_per_eu": 0
    },
    "1069": {
      "BLOCK_M": 32,
      "BLOCK_N": 16,
      "BLOCK_K": 128,
      "BLOCK_C": 256,
      "NUM_KSPLIT": 8,
      "num_warps": 4,
      "num_stages": 1,
      "waves_per_eu": 1
    },
    "5289": {
      "BLOCK_M": 256,
      "BLOCK_N": 16,
      "BLOCK_K": 128,
      "BLOCK_C": 128,
      "NUM_KSPLIT": 2,
      "num_warps": 8,
      "num_stages": 2,
      "waves_per_eu": 0
    },
    "1984": {
      "BLOCK_M": 64,
      "BLOCK_N": 16,
      "BLOCK_K": 64,
      "BLOCK_C": 64,
      "NUM_KSPLIT": 4,
      "num_warps": 2,
      "num_stages": 2,
      "waves_per_eu": 1
    },
    "4592": {
      "BLOCK_M": 256,
      "BLOCK_N": 16,
      "BLOCK_K": 32,
      "BLOCK_C": 128,
      "NUM_KSPLIT": 8,
      "num_warps": 2,
      "num_stages": 1,
      "waves_per_eu": 2
    },
    "3947": {
      "BLOCK_M": 128,
      "BLOCK_N": 16,
      "BLOCK_K": 128,
      "BLOCK_C": 256,
      "NUM_KSPLIT": 8,
      "num_warps": 2,
      "num_stages": 2,
      "waves_per_eu": 2
    },
    "4942": {
      "BLOCK_M": 256,
      "BLOCK_N": 16,
      "BLOCK_K": 64,
      "BLOCK_C": 128,
      "NUM_KSPLIT": 4,
      "num_warps": 4,
      "num_stages": 2,
      "waves_per_eu": 1
    },
    "5240": {
      "BLOCK_M": 256,
      "BLOCK_N": 16,
      "BLOCK_K": 128,
      "BLOCK_C": 64,
      "NUM_KSPLIT": 8,
      "num_warps": 2,
      "num_stages": 1,
      "waves_per_eu": 2
    },
    "2593": {
      "BLOCK_M": 64,
      "BLOCK_N": 16,
      "BLOCK_K": 256,
      "BLOCK_C": 32,
      "NUM_KSPLIT": 1,
      "num_warps": 2,
      "num_stages": 1,
      "waves_per_eu": 1
    },
    "911": {
      "BLOCK_M": 32,
      "BLOCK_N": 16,
      "BLOCK_K": 128,
      "BLOCK_C": 64,
      "NUM_KSPLIT": 4,
      "num_warps": 4,
      "num_stages": 2,
      "waves_per_eu": 2
    },
    "4567": {
      "BLOCK_M": 256,
      "BLOCK_N": 16,
      "BLOCK_K": 32,
      "BLOCK_C": 128,
      "NUM_KSPLIT": 2,
      "num_warps": 8,
      "num_stages": 1,
      "waves_per_eu": 1
    },
    "1631": {
      "BLOCK_M": 64,
      "BLOCK_N": 16,
      "BLOCK_K": 32,
      "BLOCK_C": 64,
      "NUM_KSPLIT": 4,
      "num_warps": 4,
      "num_stages": 2,
      "waves_per_eu": 2
    },
    "452": {
      "BLOCK_M": 32,
      "BLOCK_N": 16,
      "BLOCK_K": 64,
      "BLOCK_C": 32,
      "NUM_KSPLIT": 2,
      "num_warps": 2,
      "num_stages": 1,
      "waves_per_eu": 2
    },
    "2779": {
      "BLOCK_M": 64,
      "BLOCK_N": 16,
      "BLOCK_K": 256,
      "BLOCK_C": 128,
      "NUM_KSPLIT": 4,
      "num_warps": 4,
      "num_stages": 1,
      "waves_per_eu": 1
    },
    "1240": {
      "BLOCK_M": 32,
      "BLOCK_N": 16,
      "BLOCK_K": 256,
      "BLOCK_C": 64,
      "NUM_KSPLIT": 1,
      "num_warps": 8,
      "num_stages": 2,
      "waves_per_eu": 1
    },
    "891": {
      "BLOCK_M": 32,
      "BLOCK_N": 16,
      "BLOCK_K": 128,
      "BLOCK_C": 64,
      "NUM_KSPLIT": 2,
      "num_warps": 4,
      "num_stages": 2,
      "waves_per_eu": 0
    },
    "2486": {
      "BLOCK_M": 64,
      "BLOCK_N": 16,
      "BLOCK_K": 128,
      "BLOCK_C": 256,
      "NUM_KSPLIT": 4,
      "num_warps": 2,
      "num_stages": 1,
      "waves_per_eu": 2
    },
    "2932": {
      "BLOCK_M": 128,
      "BLOCK_N": 16,
      "BLOCK_K": 32,
      "BLOCK_C": 16,
      "NUM_KSPLIT": 4,
      "num_warps": 8,
      "num_stages": 2,
      "waves_per_eu": 1
    },
    "157": {
      "BLOCK_M": 32,
      "BLOCK_N": 16,
      "BLOCK_K": 32,
      "BLOCK_C": 64,
      "NUM_KSPLIT": 1,
      "num_warps": 8,
      "num_stages": 1,
      "waves_per_eu": 1
    },
    "1692": {
      "BLOCK_M": 64,
      "BLOCK_N": 16,
      "BLOCK_K": 32,
      "BLOCK_C": 128,
      "NUM_KSPLIT": 4,
      "num_warps": 2,
      "num_stages": 1,
      "waves_per_eu": 0
    },
    "159": {
      "BLOCK_M": 32,
      "BLOCK_N": 16,
      "BLOCK_K": 32,
      "BLOCK_C": 64,
      "NUM_KSPLIT": 1,
      "num_warps": 8,
      "num_stages": 2,
      "waves_per_eu": 0
    },
    "2755": {
      "BLOCK_M": 64,
      "BLOCK_N": 16,
      "BLOCK_K": 256,
      "BLOCK_C": 128,
      "NUM_KSPLIT": 2,
      "num_warps": 2,
      "num_stages": 1,
      "waves_per_eu": 1
    },
    "3606": {
      "BLOCK_M": 128,
      "BLOCK_N": 16,
      "BLOCK_K": 128,
      "BLOCK_C": 16,
      "NUM_KSPLIT": 1,
      "num_warps": 4,
      "num_stages": 1,
      "waves_per_eu": 0
    },
    "4752": {
      "BLOCK_M": 256,
      "BLOCK_N": 16,
      "BLOCK_K": 64,
      "BLOCK_C": 32,
      "NUM_KSPLIT": 1,
      "num_warps": 2,
      "num_stages": 1,
      "waves_per_eu": 0
    },
    "1065": {
      "BLOCK_M": 32,
      "BLOCK_N": 16,
      "BLOCK_K": 128,
      "BLOCK_C": 256,
      "NUM_KSPLIT": 8,
      "num_warps": 2,
      "num_stages": 2,
      "waves_per_eu": 0
    },
    "1557": {
      "BLOCK_M": 64,
      "BLOCK_N": 16,
      "BLOCK_K": 32,
      "BLOCK_C": 32,
      "NUM_KSPLIT": 4,
      "num_warps": 4,
      "num_stages": 2,
      "waves_per_eu": 0
    },
    "1301": {
      "BLOCK_M": 32,
      "BLOCK_N": 16,
      "BLOCK_K": 256,
      "BLOCK_C": 128,
      "NUM_KSPLIT": 1,
      "num_warps": 2,
      "num_stages": 2,
      "waves_per_eu": 2
    },
    "1869": {
      "BLOCK_M": 64,
      "BLOCK_N": 16,
      "BLOCK_K": 64,
      "BLOCK_C": 16,
      "NUM_KSPLIT": 8,
      "num_warps": 8,
      "num_stages": 2,
      "waves_per_eu": 0
    },
    "1712": {
      "BLOCK_M": 64,
      "BLOCK_N": 16,
      "BLOCK_K": 32,
      "BLOCK_C": 128,
      "NUM_KSPLIT": 8,
      "num_warps": 2,
      "num_stages": 1,
      "waves_per_eu": 2
    },
    "4153": {
      "BLOCK_M": 128,
      "BLOCK_N": 16,
      "BLOCK_K": 256,
      "BLOCK_C": 64,
      "NUM_KSPLIT": 4,
      "num_warps": 8,
      "num_stages": 1,
      "waves_per_eu": 1
    },
    "2928": {
      "BLOCK_M": 128,
      "BLOCK_N": 16,
      "BLOCK_K": 32,
      "BLOCK_C": 16,
      "NUM_KSPLIT": 4,
      "num_warps": 8,
      "num_stages": 1,
      "waves_per_eu": 0
    },
    "2503": {
      "BLOCK_M": 64,
      "BLOCK_N": 16,
      "BLOCK_K": 128,
      "BLOCK_C": 256,
      "NUM_KSPLIT": 8,
      "num_warps": 2,
      "num_stages": 1,
      "waves_per_eu": 1
    },
    "5447": {
      "BLOCK_M": 256,
      "BLOCK_N": 16,
      "BLOCK_K": 256,
      "BLOCK_C": 16,
      "NUM_KSPLIT": 4,
      "num_warps": 4,
      "num_stages": 2,
      "waves_per_eu": 2
    },
    "5627": {
      "BLOCK_M": 256,
      "BLOCK_N": 16,
      "BLOCK_K": 256,
      "BLOCK_C": 128,
      "NUM_KSPLIT": 1,
      "num_warps": 4,
      "num_stages": 2,
      "waves_per_eu": 2
    },
    "4119": {
      "BLOCK_M": 128,
      "BLOCK_N": 16,
      "BLOCK_K": 256,
      "BLOCK_C": 64,
      "NUM_KSPLIT": 1,
      "num_warps": 8,
      "num_stages": 2,
      "waves_per_eu": 0
    },
    "3572": {
      "BLOCK_M": 128,
      "BLOCK_N": 16,
      "BLOCK_K": 64,
      "BLOCK_C": 256,
      "NUM_KSPLIT": 4,
      "num_warps": 4,
      "num_stages": 1,
      "waves_per_eu": 2
    },
    "3296": {
      "BLOCK_M": 128,
      "BLOCK_N": 16,
      "BLOCK_K": 64,
      "BLOCK_C": 16,
      "NUM_KSPLIT": 8,
      "num_warps": 2,
      "num_stages": 1,
      "waves_per_eu": 2
    },
    "575": {
      "BLOCK_M": 32,
      "BLOCK_N": 16,
      "BLOCK_K": 64,
      "BLOCK_C": 64,
      "NUM_KSPLIT": 8,
      "num_warps": 8,
      "num_stages": 2,
      "waves_per_eu": 2
    },
    "2585": {
      "BLOCK_M": 64,
      "BLOCK_N": 16,
      "BLOCK_K": 256,
      "BLOCK_C": 16,
      "NUM_KSPLIT": 8,
      "num_warps": 4,
      "num_stages": 2,
      "waves_per_eu": 2
    },
    "1506": {
      "BLOCK_M": 64,
      "BLOCK_N": 16,
      "BLOCK_K": 32,
      "BLOCK_C": 16,
      "NUM_KSPLIT": 8,
      "num_warps": 8,
      "num_stages": 1,
      "waves_per_eu": 0
    },
    "1479": {
      "BLOCK_M": 64,
      "BLOCK_N": 16,
      "BLOCK_K": 32,
      "BLOCK_C": 16,
      "NUM_KSPLIT": 4,
      "num_warps": 2,
      "num_stages": 2,
      "waves_per_eu": 0
    },
    "3948": {
      "BLOCK_M": 128,
      "BLOCK_N": 16,
      "BLOCK_K": 128,
      "BLOCK_C": 256,
      "NUM_KSPLIT": 8,
      "num_warps": 4,
      "num_stages": 1,
      "waves_per_eu": 0
    },
    "5165": {
      "BLOCK_M": 256,
      "BLOCK_N": 16,
      "BLOCK_K": 128,
      "BLOCK_C": 32,
      "NUM_KSPLIT": 4,
      "num_warps": 8,
      "num_stages": 2,
      "waves_per_eu": 2
    },
    "3651": {
      "BLOCK_M": 128,
      "BLOCK_N": 16,
      "BLOCK_K": 128,
      "BLOCK_C": 16,
      "NUM_KSPLIT": 4,
      "num_warps": 8,
      "num_stages": 2,
      "waves_per_eu": 0
    },
    "589": {
      "BLOCK_M": 32,
      "BLOCK_N": 16,
      "BLOCK_K": 64,
      "BLOCK_C": 128,
      "NUM_KSPLIT": 1,
      "num_warps": 8,
      "num_stages": 1,
      "waves_per_eu": 1
    },
    "2635": {
      "BLOCK_M": 64,
      "BLOCK_N": 16,
      "BLOCK_K": 256,
      "BLOCK_C": 32,
      "NUM_KSPLIT": 4,
      "num_warps": 4,
      "num_stages": 1,
      "waves_per_eu": 1
    },
    "132": {
      "BLOCK_M": 32,
      "BLOCK_N": 16,
      "BLOCK_K": 32,
      "BLOCK_C": 32,
      "NUM_KSPLIT": 8,
      "num_warps": 4,
      "num_stages": 1,
      "waves_per_eu": 0
    },
    "1082": {
      "BLOCK_M": 32,
      "BLOCK_N": 16,
      "BLOCK_K": 256,
      "BLOCK_C": 16,
      "NUM_KSPLIT": 1,
      "num_warps": 2,
      "num_stages": 1,
      "waves_per_eu": 2
    },
    "3645": {
      "BLOCK_M": 128,
      "BLOCK_N": 16,
      "BLOCK_K": 128,
      "BLOCK_C": 16,
      "NUM_KSPLIT": 4,
      "num_warps": 4,
      "num_stages": 2,
      "waves_per_eu": 0
    },
    "444": {
      "BLOCK_M": 32,
      "BLOCK_N": 16,
      "BLOCK_K": 64,
      "BLOCK_C": 32,
      "NUM_KSPLIT": 1,
      "num_warps": 8,
      "num_stages": 1,
      "waves_per_eu": 0
    },
    "1589": {
      "BLOCK_M": 64,
      "BLOCK_N": 16,
      "BLOCK_K": 32,
      "BLOCK_C": 64,
      "NUM_KSPLIT": 1,
      "num_warps": 2,
      "num_stages": 2,
      "waves_per_eu": 2
    },
    "4394": {
      "BLOCK_M": 256,
      "BLOCK_N": 16,
      "BLOCK_K": 32,
      "BLOCK_C": 32,
      "NUM_KSPLIT": 1,
      "num_warps": 2,
      "num_stages": 1,
      "waves_per_eu": 2
    },
    "2675": {
      "BLOCK_M": 64,
      "BLOCK_N": 16,
      "BLOCK_K": 256,
      "BLOCK_C": 64,
      "NUM_KSPLIT": 1,
      "num_warps": 4,
      "num_stages": 2,
      "waves_per_eu": 2
    },
    "2517": {
      "BLOCK_M": 64,
      "BLOCK_N": 16,
      "BLOCK_K": 128,
      "BLOCK_C": 256,
      "NUM_KSPLIT": 8,
      "num_warps": 8,
      "num_stages": 2,
      "waves_per_eu": 0
    },
    "2075": {
      "BLOCK_M": 64,
      "BLOCK_N": 16,
      "BLOCK_K": 64,
      "BLOCK_C": 128,
      "NUM_KSPLIT": 8,
      "num_warps": 2,
      "num_stages": 2,
      "waves_per_eu": 2
    },
    "5153": {
      "BLOCK_M": 256,
      "BLOCK_N": 16,
      "BLOCK_K": 128,
      "BLOCK_C": 32,
      "NUM_KSPLIT": 4,
      "num_warps": 2,
      "num_stages": 2,
      "waves_per_eu": 2
    },
    "3409": {
      "BLOCK_M": 128,
      "BLOCK_N": 16,
      "BLOCK_K": 64,
      "BLOCK_C": 64,
      "NUM_KSPLIT": 2,
      "num_warps": 4,
      "num_stages": 1,
      "waves_per_eu": 1
    },
    "5299": {
      "BLOCK_M": 256,
      "BLOCK_N": 16,
      "BLOCK_K": 128,
      "BLOCK_C": 128,
      "NUM_KSPLIT": 4,
      "num_warps": 4,
      "num_stages": 1,
      "waves_per_eu": 1
    },
    "3230": {
      "BLOCK_M": 128,
      "BLOCK_N": 16,
      "BLOCK_K": 32,
      "BLOCK_C": 256,
      "NUM_KSPLIT": 8,
      "num_warps": 4,
      "num_stages": 1,
      "waves_per_eu": 2
    },
    "732": {
      "BLOCK_M": 32,
      "BLOCK_N": 16,
      "BLOCK_K": 128,
      "BLOCK_C": 16,
      "NUM_KSPLIT": 1,
      "num_warps": 8,
      "num_stages": 1,
      "waves_per_eu": 0
    },
    "3346": {
      "BLOCK_M": 128,
      "BLOCK_N": 16,
      "BLOCK_K": 64,
      "BLOCK_C": 32,
      "NUM_KSPLIT": 2,
      "num_warps": 8,
      "num_stages": 2,
      "waves_per_eu": 1
    },
    "3880": {
      "BLOCK_M": 128,
      "BLOCK_N": 16,
      "BLOCK_K": 128,
      "BLOCK_C": 128,
      "NUM_KSPLIT": 8,
      "num_warps": 4,
      "num_stages": 2,
      "waves_per_eu": 1
    },
    "350": {
      "BLOCK_M": 32,
      "BLOCK_N": 16,
      "BLOCK_K": 32,
      "BLOCK_C": 256,
      "NUM_KSPLIT": 8,
      "num_warps": 4,
      "num_stages": 1,
      "waves_per_eu": 2
    },
    "4907": {
      "BLOCK_M": 256,
      "BLOCK_N": 16,
      "BLOCK_K": 64,
      "BLOCK_C": 128,
      "NUM_KSPLIT": 1,
      "num_warps": 4,
      "num_stages": 2,
      "waves_per_eu": 2
    },
    "1201": {
      "BLOCK_M": 32,
      "BLOCK_N": 16,
      "BLOCK_K": 256,
      "BLOCK_C": 32,
      "NUM_KSPLIT": 4,
      "num_warps": 8,
      "num_stages": 1,
      "waves_per_eu": 1
    },
    "3169": {
      "BLOCK_M": 128,
      "BLOCK_N": 16,
      "BLOCK_K": 32,
      "BLOCK_C": 256,
      "NUM_KSPLIT": 1,
      "num_warps": 2,
      "num_stages": 1,
      "waves_per_eu": 1
    },
    "954": {
      "BLOCK_M": 32,
      "BLOCK_N": 16,
      "BLOCK_K": 128,
      "BLOCK_C": 128,
      "NUM_KSPLIT": 2,
      "num_warps": 2,
      "num_stages": 1,
      "waves_per_eu": 0
    },
    "28": {
      "BLOCK_M": 32,
      "BLOCK_N": 16,
      "BLOCK_K": 32,
      "BLOCK_C": 16,
      "NUM_KSPLIT": 2,
      "num_warps": 4,
      "num_stages": 2,
      "waves_per_eu": 1
    },
    "3026": {
      "BLOCK_M": 128,
      "BLOCK_N": 16,
      "BLOCK_K": 32,
      "BLOCK_C": 64,
      "NUM_KSPLIT": 1,
      "num_warps": 2,
      "num_stages": 1,
      "waves_per_eu": 2
    },
    "429": {
      "BLOCK_M": 32,
      "BLOCK_N": 16,
      "BLOCK_K": 64,
      "BLOCK_C": 16,
      "NUM_KSPLIT": 8,
      "num_warps": 8,
      "num_stages": 2,
      "waves_per_eu": 0
    },
    "2661": {
      "BLOCK_M": 64,
      "BLOCK_N": 16,
      "BLOCK_K": 256,
      "BLOCK_C": 32,
      "NUM_KSPLIT": 8,
      "num_warps": 8,
      "num_stages": 2,
      "waves_per_eu": 0
    },
    "1680": {
      "BLOCK_M": 64,
      "BLOCK_N": 16,
      "BLOCK_K": 32,
      "BLOCK_C": 128,
      "NUM_KSPLIT": 2,
      "num_warps": 4,
      "num_stages": 1,
      "waves_per_eu": 0
    },
    "5732": {
      "BLOCK_M": 256,
      "BLOCK_N": 16,
      "BLOCK_K": 256,
      "BLOCK_C": 256,
      "NUM_KSPLIT": 4,
      "num_warps": 4,
      "num_stages": 1,
      "waves_per_eu": 2
    },
    "4224": {
      "BLOCK_M": 128,
      "BLOCK_N": 16,
      "BLOCK_K": 256,
      "BLOCK_C": 128,
      "NUM_KSPLIT": 4,
      "num_warps": 8,
      "num_stages": 1,
      "waves_per_eu": 0
    },
    "173": {
      "BLOCK_M": 32,
      "BLOCK_N": 16,
      "BLOCK_K": 32,
      "BLOCK_C": 64,
      "NUM_KSPLIT": 2,
      "num_warps": 4,
      "num_stages": 2,
      "waves_per_eu": 2
    },
    "2678": {
      "BLOCK_M": 64,
      "BLOCK_N": 16,
      "BLOCK_K": 256,
      "BLOCK_C": 64,
      "NUM_KSPLIT": 1,
      "num_warps": 8,
      "num_stages": 1,
      "waves_per_eu": 2
    },
    "644": {
      "BLOCK_M": 32,
      "BLOCK_N": 16,
      "BLOCK_K": 64,
      "BLOCK_C": 128,
      "NUM_KSPLIT": 8,
      "num_warps": 8,
      "num_stages": 1,
      "waves_per_eu": 2
    },
    "5083": {
      "BLOCK_M": 256,
      "BLOCK_N": 16,
      "BLOCK_K": 128,
      "BLOCK_C": 16,
      "NUM_KSPLIT": 4,
      "num_warps": 4,
      "num_stages": 1,
      "waves_per_eu": 1
    },
    "2481": {
      "BLOCK_M": 64,
      "BLOCK_N": 16,
      "BLOCK_K": 128,
      "BLOCK_C": 256,
      "NUM_KSPLIT": 2,
      "num_warps": 8,
      "num_stages": 2,
      "waves_per_eu": 0
    },
    "4534": {
      "BLOCK_M": 256,
      "BLOCK_N": 16,
      "BLOCK_K": 32,
      "BLOCK_C": 64,
      "NUM_KSPLIT": 8,
      "num_warps": 8,
      "num_stages": 2,
      "waves_per_eu": 1
    },
    "2487": {
      "BLOCK_M": 64,
      "BLOCK_N": 16,
      "BLOCK_K": 128,
      "BLOCK_C": 256,
      "NUM_KSPLIT": 4,
      "num_warps": 2,
      "num_stages": 2,
      "waves_per_eu": 0
    },
    "3702": {
      "BLOCK_M": 128,
      "BLOCK_N": 16,
      "BLOCK_K": 128,
      "BLOCK_C": 32,
      "NUM_KSPLIT": 2,
      "num_warps": 8,
      "num_stages": 1,
      "waves_per_eu": 0
    },
    "4317": {
      "BLOCK_M": 128,
      "BLOCK_N": 16,
      "BLOCK_K": 256,
      "BLOCK_C": 256,
      "NUM_KSPLIT": 8,
      "num_warps": 8,
      "num_stages": 2,
      "waves_per_eu": 0
    },
    "3467": {
      "BLOCK_M": 128,
      "BLOCK_N": 16,
      "BLOCK_K": 64,
      "BLOCK_C": 128,
      "NUM_KSPLIT": 1,
      "num_warps": 4,
      "num_stages": 2,
      "waves_per_eu": 2
    },
    "993": {
      "BLOCK_M": 32,
      "BLOCK_N": 16,
      "BLOCK_K": 128,
      "BLOCK_C": 128,
      "NUM_KSPLIT": 8,
      "num_warps": 2,
      "num_stages": 2,
      "waves_per_eu": 0
    },
    "3816": {
      "BLOCK_M": 128,
      "BLOCK_N": 16,
      "BLOCK_K": 128,
      "BLOCK_C": 128,
      "NUM_KSPLIT": 1,
      "num_warps": 2,
      "num_stages": 1,
      "waves_per_eu": 0
    },
    "4220": {
      "BLOCK_M": 128,
      "BLOCK_N": 16,
      "BLOCK_K": 256,
      "BLOCK_C": 128,
      "NUM_KSPLIT": 4,
      "num_warps": 4,
      "num_stages": 1,
      "waves_per_eu": 2
    },
    "4250": {
      "BLOCK_M": 128,
      "BLOCK_N": 16,
      "BLOCK_K": 256,
      "BLOCK_C": 256,
      "NUM_KSPLIT": 1,
      "num_warps": 2,
      "num_stages": 1,
      "waves_per_eu": 2
    },
    "3439": {
      "BLOCK_M": 128,
      "BLOCK_N": 16,
      "BLOCK_K": 64,
      "BLOCK_C": 64,
      "NUM_KSPLIT": 8,
      "num_warps": 2,
      "num_stages": 1,
      "waves_per_eu": 1
    },
    "1904": {
      "BLOCK_M": 64,
      "BLOCK_N": 16,
      "BLOCK_K": 64,
      "BLOCK_C": 32,
      "NUM_KSPLIT": 2,
      "num_warps": 8,
      "num_stages": 1,
      "waves_per_eu": 2
    },
    "2627": {
      "BLOCK_M": 64,
      "BLOCK_N": 16,
      "BLOCK_K": 256,
      "BLOCK_C": 32,
      "NUM_KSPLIT": 2,
      "num_warps": 8,
      "num_stages": 2,
      "waves_per_eu": 2
    },
    "330": {
      "BLOCK_M": 32,
      "BLOCK_N": 16,
      "BLOCK_K": 32,
      "BLOCK_C": 256,
      "NUM_KSPLIT": 4,
      "num_warps": 4,
      "num_stages": 1,
      "waves_per_eu": 0
    },
    "4432": {
      "BLOCK_M": 256,
      "BLOCK_N": 16,
      "BLOCK_K": 32,
      "BLOCK_C": 32,
      "NUM_KSPLIT": 4,
      "num_warps": 2,
      "num_stages": 2,
      "waves_per_eu": 1
    },
    "3415": {
      "BLOCK_M": 128,
      "BLOCK_N": 16,
      "BLOCK_K": 64,
      "BLOCK_C": 64,
      "NUM_KSPLIT": 2,
      "num_warps": 8,
      "num_stages": 1,
      "waves_per_eu": 1
    },
    "2219": {
      "BLOCK_M": 64,
      "BLOCK_N": 16,
      "BLOCK_K": 128,
      "BLOCK_C": 16,
      "NUM_KSPLIT": 8,
      "num_warps": 2,
      "num_stages": 2,
      "waves_per_eu": 2
    },
    "192": {
      "BLOCK_M": 32,
      "BLOCK_N": 16,
      "BLOCK_K": 32,
      "BLOCK_C": 64,
      "NUM_KSPLIT": 4,
      "num_warps": 8,
      "num_stages": 1,
      "waves_per_eu": 0
    },
    "93": {
      "BLOCK_M": 32,
      "BLOCK_N": 16,
      "BLOCK_K": 32,
      "BLOCK_C": 32,
      "NUM_KSPLIT": 2,
      "num_warps": 2,
      "num_stages": 2,
      "waves_per_eu": 0
    },
    "5707": {
      "BLOCK_M": 256,
      "BLOCK_N": 16,
      "BLOCK_K": 256,
      "BLOCK_C": 256,
      "NUM_KSPLIT": 2,
      "num_warps": 2,
      "num_stages": 1,
      "waves_per_eu": 1
    },
    "2857": {
      "BLOCK_M": 64,
      "BLOCK_N": 16,
      "BLOCK_K": 256,
      "BLOCK_C": 256,
      "NUM_KSPLIT": 4,
      "num_warps": 8,
      "num_stages": 1,
      "waves_per_eu": 1
    },
    "5664": {
      "BLOCK_M": 256,
      "BLOCK_N": 16,
      "BLOCK_K": 256,
      "BLOCK_C": 128,
      "NUM_KSPLIT": 4,
      "num_warps": 8,
      "num_stages": 1,
      "waves_per_eu": 0
    },
    "1963": {
      "BLOCK_M": 64,
      "BLOCK_N": 16,
      "BLOCK_K": 64,
      "BLOCK_C": 64,
      "NUM_KSPLIT": 2,
      "num_warps": 2,
      "num_stages": 1,
      "waves_per_eu": 1
    },
    "2040": {
      "BLOCK_M": 64,
      "BLOCK_N": 16,
      "BLOCK_K": 64,
      "BLOCK_C": 128,
      "NUM_KSPLIT": 2,
      "num_warps": 4,
      "num_stages": 1,
      "waves_per_eu": 0
    },
    "4647": {
      "BLOCK_M": 256,
      "BLOCK_N": 16,
      "BLOCK_K": 32,
      "BLOCK_C": 256,
      "NUM_KSPLIT": 4,
      "num_warps": 2,
      "num_stages": 2,
      "waves_per_eu": 0
    },
    "3964": {
      "BLOCK_M": 128,
      "BLOCK_N": 16,
      "BLOCK_K": 256,
      "BLOCK_C": 16,
      "NUM_KSPLIT": 1,
      "num_warps": 2,
      "num_stages": 2,
      "waves_per_eu": 1
    },
    "1013": {
      "BLOCK_M": 32,
      "BLOCK_N": 16,
      "BLOCK_K": 128,
      "BLOCK_C": 256,
      "NUM_KSPLIT": 1,
      "num_warps": 2,
      "num_stages": 2,
      "waves_per_eu": 2
    },
    "772": {
      "BLOCK_M": 32,
      "BLOCK_N": 16,
      "BLOCK_K": 128,
      "BLOCK_C": 16,
      "NUM_KSPLIT": 4,
      "num_warps": 8,
      "num_stages": 2,
      "waves_per_eu": 1
    },
    "5575": {
      "BLOCK_M": 256,
      "BLOCK_N": 16,
      "BLOCK_K": 256,
      "BLOCK_C": 64,
      "NUM_KSPLIT": 2,
      "num_warps": 8,
      "num_stages": 1,
      "waves_per_eu": 1
    },
    "1926": {
      "BLOCK_M": 64,
      "BLOCK_N": 16,
      "BLOCK_K": 64,
      "BLOCK_C": 32,
      "NUM_KSPLIT": 8,
      "num_warps": 2,
      "num_stages": 1,
      "waves_per_eu": 0
    },
    "1475": {
      "BLOCK_M": 64,
      "BLOCK_N": 16,
      "BLOCK_K": 32,
      "BLOCK_C": 16,
      "NUM_KSPLIT": 2,
      "num_warps": 8,
      "num_stages": 2,
      "waves_per_eu": 2
    },
    "852": {
      "BLOCK_M": 32,
      "BLOCK_N": 16,
      "BLOCK_K": 128,
      "BLOCK_C": 32,
      "NUM_KSPLIT": 8,
      "num_warps": 4,
      "num_stages": 1,
      "waves_per_eu": 0
    },
    "104": {
      "BLOCK_M": 32,
      "BLOCK_N": 16,
      "BLOCK_K": 32,
      "BLOCK_C": 32,
      "NUM_KSPLIT": 2,
      "num_warps": 8,
      "num_stages": 1,
      "waves_per_eu": 2
    },
    "1026": {
      "BLOCK_M": 32,
      "BLOCK_N": 16,
      "BLOCK_K": 128,
      "BLOCK_C": 256,
      "NUM_KSPLIT": 2,
      "num_warps": 2,
      "num_stages": 1,
      "waves_per_eu": 0
    },
    "2500": {
      "BLOCK_M": 64,
      "BLOCK_N": 16,
      "BLOCK_K": 128,
      "BLOCK_C": 256,
      "NUM_KSPLIT": 4,
      "num_warps": 8,
      "num_stages": 2,
      "waves_per_eu": 1
    },
    "5740": {
      "BLOCK_M": 256,
      "BLOCK_N": 16,
      "BLOCK_K": 256,
      "BLOCK_C": 256,
      "NUM_KSPLIT": 4,
      "num_warps": 8,
      "num_stages": 2,
      "waves_per_eu": 1
    },
    "1652": {
      "BLOCK_M": 64,
      "BLOCK_N": 16,
      "BLOCK_K": 32,
      "BLOCK_C": 64,
      "NUM_KSPLIT": 8,
      "num_warps": 8,
      "num_stages": 1,
      "waves_per_eu": 2
    },
    "1194": {
      "BLOCK_M": 32,
      "BLOCK_N": 16,
      "BLOCK_K": 256,
      "BLOCK_C": 32,
      "NUM_KSPLIT": 4,
      "num_warps": 4,
      "num_stages": 1,
      "waves_per_eu": 0
    },
    "1260": {
      "BLOCK_M": 32,
      "BLOCK_N": 16,
      "BLOCK_K": 256,
      "BLOCK_C": 64,
      "NUM_KSPLIT": 4,
      "num_warps": 2,
      "num_stages": 1,
      "waves_per_eu": 0
    },
    "1473": {
      "BLOCK_M": 64,
      "BLOCK_N": 16,
      "BLOCK_K": 32,
      "BLOCK_C": 16,
      "NUM_KSPLIT": 2,
      "num_warps": 8,
      "num_stages": 2,
      "waves_per_eu": 0
    },
    "2345": {
      "BLOCK_M": 64,
      "BLOCK_N": 16,
      "BLOCK_K": 128,
      "BLOCK_C": 64,
      "NUM_KSPLIT": 4,
      "num_warps": 2,
      "num_stages": 2,
      "waves_per_eu": 2
    },
    "3042": {
      "BLOCK_M": 128,
      "BLOCK_N": 16,
      "BLOCK_K": 32,
      "BLOCK_C": 64,
      "NUM_KSPLIT": 2,
      "num_warps": 2,
      "num_stages": 1,
      "waves_per_eu": 0
    },
    "5228": {
      "BLOCK_M": 256,
      "BLOCK_N": 16,
      "BLOCK_K": 128,
      "BLOCK_C": 64,
      "NUM_KSPLIT": 4,
      "num_warps": 4,
      "num_stages": 1,
      "waves_per_eu": 2
    },
    "1969": {
      "BLOCK_M": 64,
      "BLOCK_N": 16,
      "BLOCK_K": 64,
      "BLOCK_C": 64,
      "NUM_KSPLIT": 2,
      "num_warps": 4,
      "num_stages": 1,
      "waves_per_eu": 1
    },
    "2451": {
      "BLOCK_M": 64,
      "BLOCK_N": 16,
      "BLOCK_K": 128,
      "BLOCK_C": 256,
      "NUM_KSPLIT": 1,
      "num_warps": 2,
      "num_stages": 2,
      "waves_per_eu": 0
    },
    "2318": {
      "BLOCK_M": 64,
      "BLOCK_N": 16,
      "BLOCK_K": 128,
      "BLOCK_C": 64,
      "NUM_KSPLIT": 1,
      "num_warps": 8,
      "num_stages": 1,
      "waves_per_eu": 2
    },
    "3643": {
      "BLOCK_M": 128,
      "BLOCK_N": 16,
      "BLOCK_K": 128,
      "BLOCK_C": 16,
      "NUM_KSPLIT": 4,
      "num_warps": 4,
      "num_stages": 1,
      "waves_per_eu": 1
    },
    "296": {
      "BLOCK_M": 32,
      "BLOCK_N": 16,
      "BLOCK_K": 32,
      "BLOCK_C": 256,
      "NUM_KSPLIT": 1,
      "num_warps": 4,
      "num_stages": 1,
      "waves_per_eu": 2
    },
    "2727": {
      "BLOCK_M": 64,
      "BLOCK_N": 16,
      "BLOCK_K": 256,
      "BLOCK_C": 64,
      "NUM_KSPLIT": 8,
      "num_warps": 4,
      "num_stages": 2,
      "waves_per_eu": 0
    },
    "3828": {
      "BLOCK_M": 128,
      "BLOCK_N": 16,
      "BLOCK_K": 128,
      "BLOCK_C": 128,
      "NUM_KSPLIT": 1,
      "num_warps": 8,
      "num_stages": 1,
      "waves_per_eu": 0
    },
    "3108": {
      "BLOCK_M": 128,
      "BLOCK_N": 16,
      "BLOCK_K": 32,
      "BLOCK_C": 128,
      "NUM_KSPLIT": 1,
      "num_warps": 8,
      "num_stages": 1,
      "waves_per_eu": 0
    },
    "371": {
      "BLOCK_M": 32,
      "BLOCK_N": 16,
      "BLOCK_K": 64,
      "BLOCK_C": 16,
      "NUM_KSPLIT": 1,
      "num_warps": 4,
      "num_stages": 2,
      "waves_per_eu": 2
    },
    "329": {
      "BLOCK_M": 32,
      "BLOCK_N": 16,
      "BLOCK_K": 32,
      "BLOCK_C": 256,
      "NUM_KSPLIT": 4,
      "num_warps": 2,
      "num_stages": 2,
      "waves_per_eu": 2
    },
    "3383": {
      "BLOCK_M": 128,
      "BLOCK_N": 16,
      "BLOCK_K": 64,
      "BLOCK_C": 32,
      "NUM_KSPLIT": 8,
      "num_warps": 8,
      "num_stages": 2,
      "waves_per_eu": 2
    },
    "5683": {
      "BLOCK_M": 256,
      "BLOCK_N": 16,
      "BLOCK_K": 256,
      "BLOCK_C": 128,
      "NUM_KSPLIT": 8,
      "num_warps": 8,
      "num_stages": 1,
      "waves_per_eu": 1
    },
    "2622": {
      "BLOCK_M": 64,
      "BLOCK_N": 16,
      "BLOCK_K": 256,
      "BLOCK_C": 32,
      "NUM_KSPLIT": 2,
      "num_warps": 8,
      "num_stages": 1,
      "waves_per_eu": 0
    },
    "3174": {
      "BLOCK_M": 128,
      "BLOCK_N": 16,
      "BLOCK_K": 32,
      "BLOCK_C": 256,
      "NUM_KSPLIT": 1,
      "num_warps": 4,
      "num_stages": 1,
      "waves_per_eu": 0
    },
    "4825": {
      "BLOCK_M": 256,
      "BLOCK_N": 16,
      "BLOCK_K": 64,
      "BLOCK_C": 64,
      "NUM_KSPLIT": 1,
      "num_warps": 2,
      "num_stages": 1,
      "waves_per_eu": 1
    },
    "5017": {
      "BLOCK_M": 256,
      "BLOCK_N": 16,
      "BLOCK_K": 64,
      "BLOCK_C": 256,
      "NUM_KSPLIT": 4,
      "num_warps": 8,
      "num_stages": 1,
      "waves_per_eu": 1
    },
    "254": {
      "BLOCK_M": 32,
      "BLOCK_N": 16,
      "BLOCK_K": 32,
      "BLOCK_C": 128,
      "NUM_KSPLIT": 4,
      "num_warps": 2,
      "num_stages": 1,
      "waves_per_eu": 2
    },
    "74": {
      "BLOCK_M": 32,
      "BLOCK_N": 16,
      "BLOCK_K": 32,
      "BLOCK_C": 32,
      "NUM_KSPLIT": 1,
      "num_warps": 2,
      "num_stages": 1,
      "waves_per_eu": 2
    },
    "4485": {
      "BLOCK_M": 256,
      "BLOCK_N": 16,
      "BLOCK_K": 32,
      "BLOCK_C": 64,
      "NUM_KSPLIT": 2,
      "num_warps": 2,
      "num_stages": 2,
      "waves_per_eu": 0
    },
    "3556": {
      "BLOCK_M": 128,
      "BLOCK_N": 16,
      "BLOCK_K": 64,
      "BLOCK_C": 256,
      "NUM_KSPLIT": 2,
      "num_warps": 4,
      "num_stages": 2,
      "waves_per_eu": 1
    },
    "3067": {
      "BLOCK_M": 128,
      "BLOCK_N": 16,
      "BLOCK_K": 32,
      "BLOCK_C": 64,
      "NUM_KSPLIT": 4,
      "num_warps": 4,
      "num_stages": 1,
      "waves_per_eu": 1
    },
    "3818": {
      "BLOCK_M": 128,
      "BLOCK_N": 16,
      "BLOCK_K": 128,
      "BLOCK_C": 128,
      "NUM_KSPLIT": 1,
      "num_warps": 2,
      "num_stages": 1,
      "waves_per_eu": 2
    },
    "1057": {
      "BLOCK_M": 32,
      "BLOCK_N": 16,
      "BLOCK_K": 128,
      "BLOCK_C": 256,
      "NUM_KSPLIT": 4,
      "num_warps": 8,
      "num_stages": 1,
      "waves_per_eu": 1
    },
    "180": {
      "BLOCK_M": 32,
      "BLOCK_N": 16,
      "BLOCK_K": 32,
      "BLOCK_C": 64,
      "NUM_KSPLIT": 4,
      "num_warps": 2,
      "num_stages": 1,
      "waves_per_eu": 0
    },
    "5324": {
      "BLOCK_M": 256,
      "BLOCK_N": 16,
      "BLOCK_K": 128,
      "BLOCK_C": 128,
      "NUM_KSPLIT": 8,
      "num_warps": 8,
      "num_stages": 1,
      "waves_per_eu": 2
    },
    "4455": {
      "BLOCK_M": 256,
      "BLOCK_N": 16,
      "BLOCK_K": 32,
      "BLOCK_C": 32,
      "NUM_KSPLIT": 8,
      "num_warps": 4,
      "num_stages": 2,
      "waves_per_eu": 0
    },
    "4818": {
      "BLOCK_M": 256,
      "BLOCK_N": 16,
      "BLOCK_K": 64,
      "BLOCK_C": 32,
      "NUM_KSPLIT": 8,
      "num_warps": 8,
      "num_stages": 1,
      "waves_per_eu": 0
    },
    "725": {
      "BLOCK_M": 32,
      "BLOCK_N": 16,
      "BLOCK_K": 128,
      "BLOCK_C": 16,
      "NUM_KSPLIT": 1,
      "num_warps": 2,
      "num_stages": 2,
      "waves_per_eu": 2
    },
    "5553": {
      "BLOCK_M": 256,
      "BLOCK_N": 16,
      "BLOCK_K": 256,
      "BLOCK_C": 64,
      "NUM_KSPLIT": 1,
      "num_warps": 4,
      "num_stages": 2,
      "waves_per_eu": 0
    },
    "1128": {
      "BLOCK_M": 32,
      "BLOCK_N": 16,
      "BLOCK_K": 256,
      "BLOCK_C": 16,
      "NUM_KSPLIT": 4,
      "num_warps": 8,
      "num_stages": 1,
      "waves_per_eu": 0
    },
    "297": {
      "BLOCK_M": 32,
      "BLOCK_N": 16,
      "BLOCK_K": 32,
      "BLOCK_C": 256,
      "NUM_KSPLIT": 1,
      "num_warps": 4,
      "num_stages": 2,
      "waves_per_eu": 0
    },
    "280": {
      "BLOCK_M": 32,
      "BLOCK_N": 16,
      "BLOCK_K": 32,
      "BLOCK_C": 128,
      "NUM_KSPLIT": 8,
      "num_warps": 4,
      "num_stages": 2,
      "waves_per_eu": 1
    },
    "1391": {
      "BLOCK_M": 32,
      "BLOCK_N": 16,
      "BLOCK_K": 256,
      "BLOCK_C": 256,
      "NUM_KSPLIT": 2,
      "num_warps": 2,
      "num_stages": 2,
      "waves_per_eu": 2
    },
    "3337": {
      "BLOCK_M": 128,
      "BLOCK_N": 16,
      "BLOCK_K": 64,
      "BLOCK_C": 32,
      "NUM_KSPLIT": 2,
      "num_warps": 4,
      "num_stages": 1,
      "waves_per_eu": 1
    },
    "177": {
      "BLOCK_M": 32,
      "BLOCK_N": 16,
      "BLOCK_K": 32,
      "BLOCK_C": 64,
      "NUM_KSPLIT": 2,
      "num_warps": 8,
      "num_stages": 2,
      "waves_per_eu": 0
    },
    "2303": {
      "BLOCK_M": 64,
      "BLOCK_N": 16,
      "BLOCK_K": 128,
      "BLOCK_C": 32,
      "NUM_KSPLIT": 8,
      "num_warps": 8,
      "num_stages": 2,
      "waves_per_eu": 2
    },
    "5703": {
      "BLOCK_M": 256,
      "BLOCK_N": 16,
      "BLOCK_K": 256,
      "BLOCK_C": 256,
      "NUM_KSPLIT": 1,
      "num_warps": 8,
      "num_stages": 2,
      "waves_per_eu": 0
    },
    "2527": {
      "BLOCK_M": 64,
      "BLOCK_N": 16,
      "BLOCK_K": 256,
      "BLOCK_C": 16,
      "NUM_KSPLIT": 1,
      "num_warps": 4,
      "num_stages": 1,
      "waves_per_eu": 1
    },
    "1930": {
      "BLOCK_M": 64,
      "BLOCK_N": 16,
      "BLOCK_K": 64,
      "BLOCK_C": 32,
      "NUM_KSPLIT": 8,
      "num_warps": 2,
      "num_stages": 2,
      "waves_per_eu": 1
    },
    "4984": {
      "BLOCK_M": 256,
      "BLOCK_N": 16,
      "BLOCK_K": 64,
      "BLOCK_C": 256,
      "NUM_KSPLIT": 1,
      "num_warps": 8,
      "num_stages": 2,
      "waves_per_eu": 1
    },
    "3503": {
      "BLOCK_M": 128,
      "BLOCK_N": 16,
      "BLOCK_K": 64,
      "BLOCK_C": 128,
      "NUM_KSPLIT": 4,
      "num_warps": 4,
      "num_stages": 2,
      "waves_per_eu": 2
    },
    "3985": {
      "BLOCK_M": 128,
      "BLOCK_N": 16,
      "BLOCK_K": 256,
      "BLOCK_C": 16,
      "NUM_KSPLIT": 2,
      "num_warps": 4,
      "num_stages": 1,
      "waves_per_eu": 1
    },
    "5329": {
      "BLOCK_M": 256,
      "BLOCK_N": 16,
      "BLOCK_K": 128,
      "BLOCK_C": 256,
      "NUM_KSPLIT": 1,
      "num_warps": 2,
      "num_stages": 1,
      "waves_per_eu": 1
    },
    "4552": {
      "BLOCK_M": 256,
      "BLOCK_N": 16,
      "BLOCK_K": 32,
      "BLOCK_C": 128,
      "NUM_KSPLIT": 1,
      "num_warps": 8,
      "num_stages": 2,
      "waves_per_eu": 1
    },
    "5402": {
      "BLOCK_M": 256,
      "BLOCK_N": 16,
      "BLOCK_K": 256,
      "BLOCK_C": 16,
      "NUM_KSPLIT": 1,
      "num_warps": 2,
      "num_stages": 1,
      "waves_per_eu": 2
    },
    "277": {
      "BLOCK_M": 32,
      "BLOCK_N": 16,
      "BLOCK_K": 32,
      "BLOCK_C": 128,
      "NUM_KSPLIT": 8,
      "num_warps": 4,
      "num_stages": 1,
      "waves_per_eu": 1
    },
    "1154": {
      "BLOCK_M": 32,
      "BLOCK_N": 16,
      "BLOCK_K": 256,
      "BLOCK_C": 32,
      "NUM_KSPLIT": 1,
      "num_warps": 2,
      "num_stages": 1,
      "waves_per_eu": 2
    },
    "3102": {
      "BLOCK_M": 128,
      "BLOCK_N": 16,
      "BLOCK_K": 32,
      "BLOCK_C": 128,
      "NUM_KSPLIT": 1,
      "num_warps": 4,
      "num_stages": 1,
      "waves_per_eu": 0
    },
    "3015": {
      "BLOCK_M": 128,
      "BLOCK_N": 16,
      "BLOCK_K": 32,
      "BLOCK_C": 32,
      "NUM_KSPLIT": 8,
      "num_warps": 4,
      "num_stages": 2,
      "waves_per_eu": 0
    },
    "1086": {
      "BLOCK_M": 32,
      "BLOCK_N": 16,
      "BLOCK_K": 256,
      "BLOCK_C": 16,
      "NUM_KSPLIT": 1,
      "num_warps": 4,
      "num_stages": 1,
      "waves_per_eu": 0
    },
    "2455": {
      "BLOCK_M": 64,
      "BLOCK_N": 16,
      "BLOCK_K": 128,
      "BLOCK_C": 256,
      "NUM_KSPLIT": 1,
      "num_warps": 4,
      "num_stages": 1,
      "waves_per_eu": 1
    },
    "5752": {
      "BLOCK_M": 256,
      "BLOCK_N": 16,
      "BLOCK_K": 256,
      "BLOCK_C": 256,
      "NUM_KSPLIT": 8,
      "num_warps": 4,
      "num_stages": 2,
      "waves_per_eu": 1
    },
    "214": {
      "BLOCK_M": 32,
      "BLOCK_N": 16,
      "BLOCK_K": 32,
      "BLOCK_C": 64,
      "NUM_KSPLIT": 8,
      "num_warps": 8,
      "num_stages": 2,
      "waves_per_eu": 1
    },
    "469": {
      "BLOCK_M": 32,
      "BLOCK_N": 16,
      "BLOCK_K": 64,
      "BLOCK_C": 32,
      "NUM_KSPLIT": 4,
      "num_warps": 2,
      "num_stages": 1,
      "waves_per_eu": 1
    },
    "2886": {
      "BLOCK_M": 128,
      "BLOCK_N": 16,
      "BLOCK_K": 32,
      "BLOCK_C": 16,
      "NUM_KSPLIT": 1,
      "num_warps": 4,
      "num_stages": 1,
      "waves_per_eu": 0
    },
    "5388": {
      "BLOCK_M": 256,
      "BLOCK_N": 16,
      "BLOCK_K": 128,
      "BLOCK_C": 256,
      "NUM_KSPLIT": 8,
      "num_warps": 4,
      "num_stages": 1,
      "waves_per_eu": 0
    },
    "1141": {
      "BLOCK_M": 32,
      "BLOCK_N": 16,
      "BLOCK_K": 256,
      "BLOCK_C": 16,
      "NUM_KSPLIT": 8,
      "num_warps": 4,
      "num_stages": 1,
      "waves_per_eu": 1
    },
    "2980": {
      "BLOCK_M": 128,
      "BLOCK_N": 16,
      "BLOCK_K": 32,
      "BLOCK_C": 32,
      "NUM_KSPLIT": 2,
      "num_warps": 4,
      "num_stages": 2,
      "waves_per_eu": 1
    },
    "1235": {
      "BLOCK_M": 32,
      "BLOCK_N": 16,
      "BLOCK_K": 256,
      "BLOCK_C": 64,
      "NUM_KSPLIT": 1,
      "num_warps": 4,
      "num_stages": 2,
      "waves_per_eu": 2
    },
    "3870": {
      "BLOCK_M": 128,
      "BLOCK_N": 16,
      "BLOCK_K": 128,
      "BLOCK_C": 128,
      "NUM_KSPLIT": 8,
      "num_warps": 2,
      "num_stages": 1,
      "waves_per_eu": 0
    },
    "1101": {
      "BLOCK_M": 32,
      "BLOCK_N": 16,
      "BLOCK_K": 256,
      "BLOCK_C": 16,
      "NUM_KSPLIT": 2,
      "num_warps": 2,
      "num_stages": 2,
      "waves_per_eu": 0
    },
    "5138": {
      "BLOCK_M": 256,
      "BLOCK_N": 16,
      "BLOCK_K": 128,
      "BLOCK_C": 32,
      "NUM_KSPLIT": 2,
      "num_warps": 4,
      "num_stages": 1,
      "waves_per_eu": 2
    },
    "4691": {
      "BLOCK_M": 256,
      "BLOCK_N": 16,
      "BLOCK_K": 64,
      "BLOCK_C": 16,
      "NUM_KSPLIT": 1,
      "num_warps": 4,
      "num_stages": 2,
      "waves_per_eu": 2
    },
    "496": {
      "BLOCK_M": 32,
      "BLOCK_N": 16,
      "BLOCK_K": 64,
      "BLOCK_C": 32,
      "NUM_KSPLIT": 8,
      "num_warps": 4,
      "num_stages": 2,
      "waves_per_eu": 1
    },
    "626": {
      "BLOCK_M": 32,
      "BLOCK_N": 16,
      "BLOCK_K": 64,
      "BLOCK_C": 128,
      "NUM_KSPLIT": 4,
      "num_warps": 8,
      "num_stages": 1,
      "waves_per_eu": 2
    },
    "1982": {
      "BLOCK_M": 64,
      "BLOCK_N": 16,
      "BLOCK_K": 64,
      "BLOCK_C": 64,
      "NUM_KSPLIT": 4,
      "num_warps": 2,
      "num_stages": 1,
      "waves_per_eu": 2
    },
    "4334": {
      "BLOCK_M": 256,
      "BLOCK_N": 16,
      "BLOCK_K": 32,
      "BLOCK_C": 16,
      "NUM_KSPLIT": 1,
      "num_warps": 8,
      "num_stages": 1,
      "waves_per_eu": 2
    },
    "1677": {
      "BLOCK_M": 64,
      "BLOCK_N": 16,
      "BLOCK_K": 32,
      "BLOCK_C": 128,
      "NUM_KSPLIT": 2,
      "num_warps": 2,
      "num_stages": 2,
      "waves_per_eu": 0
    },
    "482": {
      "BLOCK_M": 32,
      "BLOCK_N": 16,
      "BLOCK_K": 64,
      "BLOCK_C": 32,
      "NUM_KSPLIT": 4,
      "num_warps": 8,
      "num_stages": 1,
      "waves_per_eu": 2
    },
    "144": {
      "BLOCK_M": 32,
      "BLOCK_N": 16,
      "BLOCK_K": 32,
      "BLOCK_C": 64,
      "NUM_KSPLIT": 1,
      "num_warps": 2,
      "num_stages": 1,
      "waves_per_eu": 0
    },
    "4202": {
      "BLOCK_M": 128,
      "BLOCK_N": 16,
      "BLOCK_K": 256,
      "BLOCK_C": 128,
      "NUM_KSPLIT": 2,
      "num_warps": 4,
      "num_stages": 1,
      "waves_per_eu": 2
    },
    "4099": {
      "BLOCK_M": 128,
      "BLOCK_N": 16,
      "BLOCK_K": 256,
      "BLOCK_C": 32,
      "NUM_KSPLIT": 8,
      "num_warps": 8,
      "num_stages": 1,
      "waves_per_eu": 1
    },
    "668": {
      "BLOCK_M": 32,
      "BLOCK_N": 16,
      "BLOCK_K": 64,
      "BLOCK_C": 256,
      "NUM_KSPLIT": 2,
      "num_warps": 2,
      "num_stages": 1,
      "waves_per_eu": 2
    },
    "1687": {
      "BLOCK_M": 64,
      "BLOCK_N": 16,
      "BLOCK_K": 32,
      "BLOCK_C": 128,
      "NUM_KSPLIT": 2,
      "num_warps": 8,
      "num_stages": 1,
      "waves_per_eu": 1
    },
    "1006": {
      "BLOCK_M": 32,
      "BLOCK_N": 16,
      "BLOCK_K": 128,
      "BLOCK_C": 128,
      "NUM_KSPLIT": 8,
      "num_warps": 8,
      "num_stages": 2,
      "waves_per_eu": 1
    },
    "4384": {
      "BLOCK_M": 256,
      "BLOCK_N": 16,
      "BLOCK_K": 32,
      "BLOCK_C": 16,
      "NUM_KSPLIT": 8,
      "num_warps": 4,
      "num_stages": 2,
      "waves_per_eu": 1
    },
    "331": {
      "BLOCK_M": 32,
      "BLOCK_N": 16,
      "BLOCK_K": 32,
      "BLOCK_C": 256,
      "NUM_KSPLIT": 4,
      "num_warps": 4,
      "num_stages": 1,
      "waves_per_eu": 1
    },
    "5514": {
      "BLOCK_M": 256,
      "BLOCK_N": 16,
      "BLOCK_K": 256,
      "BLOCK_C": 32,
      "NUM_KSPLIT": 4,
      "num_warps": 4,
      "num_stages": 1,
      "waves_per_eu": 0
    },
    "3404": {
      "BLOCK_M": 128,
      "BLOCK_N": 16,
      "BLOCK_K": 64,
      "BLOCK_C": 64,
      "NUM_KSPLIT": 2,
      "num_warps": 2,
      "num_stages": 1,
      "waves_per_eu": 2
    },
    "4890": {
      "BLOCK_M": 256,
      "BLOCK_N": 16,
      "BLOCK_K": 64,
      "BLOCK_C": 64,
      "NUM_KSPLIT": 8,
      "num_warps": 8,
      "num_stages": 1,
      "waves_per_eu": 0
    },
    "1656": {
      "BLOCK_M": 64,
      "BLOCK_N": 16,
      "BLOCK_K": 32,
      "BLOCK_C": 128,
      "NUM_KSPLIT": 1,
      "num_warps": 2,
      "num_stages": 1,
      "waves_per_eu": 0
    },
    "4711": {
      "BLOCK_M": 256,
      "BLOCK_N": 16,
      "BLOCK_K": 64,
      "BLOCK_C": 16,
      "NUM_KSPLIT": 2,
      "num_warps": 8,
      "num_stages": 1,
      "waves_per_eu": 1
    },
    "5000": {
      "BLOCK_M": 256,
      "BLOCK_N": 16,
      "BLOCK_K": 64,
      "BLOCK_C": 256,
      "NUM_KSPLIT": 2,
      "num_warps": 8,
      "num_stages": 1,
      "waves_per_eu": 2
    },
    "801": {
      "BLOCK_M": 32,
      "BLOCK_N": 16,
      "BLOCK_K": 128,
      "BLOCK_C": 32,
      "NUM_KSPLIT": 1,
      "num_warps": 4,
      "num_stages": 2,
      "waves_per_eu": 0
    },
    "5226": {
      "BLOCK_M": 256,
      "BLOCK_N": 16,
      "BLOCK_K": 128,
      "BLOCK_C": 64,
      "NUM_KSPLIT": 4,
      "num_warps": 4,
      "num_stages": 1,
      "waves_per_eu": 0
    },
    "4706": {
      "BLOCK_M": 256,
      "BLOCK_N": 16,
      "BLOCK_K": 64,
      "BLOCK_C": 16,
      "NUM_KSPLIT": 2,
      "num_warps": 4,
      "num_stages": 1,
      "waves_per_eu": 2
    },
    "5359": {
      "BLOCK_M": 256,
      "BLOCK_N": 16,
      "BLOCK_K": 128,
      "BLOCK_C": 256,
      "NUM_KSPLIT": 2,
      "num_warps": 8,
      "num_stages": 1,
      "waves_per_eu": 1
    },
    "2088": {
      "BLOCK_M": 64,
      "BLOCK_N": 16,
      "BLOCK_K": 64,
      "BLOCK_C": 256,
      "NUM_KSPLIT": 1,
      "num_warps": 2,
      "num_stages": 1,
      "waves_per_eu": 0
    },
    "5756": {
      "BLOCK_M": 256,
      "BLOCK_N": 16,
      "BLOCK_K": 256,
      "BLOCK_C": 256,
      "NUM_KSPLIT": 8,
      "num_warps": 8,
      "num_stages": 1,
      "waves_per_eu": 2
    },
    "5351": {
      "BLOCK_M": 256,
      "BLOCK_N": 16,
      "BLOCK_K": 128,
      "BLOCK_C": 256,
      "NUM_KSPLIT": 2,
      "num_warps": 2,
      "num_stages": 2,
      "waves_per_eu": 2
    },
    "2004": {
      "BLOCK_M": 64,
      "BLOCK_N": 16,
      "BLOCK_K": 64,
      "BLOCK_C": 64,
      "NUM_KSPLIT": 8,
      "num_warps": 4,
      "num_stages": 1,
      "waves_per_eu": 0
    },
    "4145": {
      "BLOCK_M": 128,
      "BLOCK_N": 16,
      "BLOCK_K": 256,
      "BLOCK_C": 64,
      "NUM_KSPLIT": 4,
      "num_warps": 2,
      "num_stages": 2,
      "waves_per_eu": 2
    },
    "2073": {
      "BLOCK_M": 64,
      "BLOCK_N": 16,
      "BLOCK_K": 64,
      "BLOCK_C": 128,
      "NUM_KSPLIT": 8,
      "num_warps": 2,
      "num_stages": 2,
      "waves_per_eu": 0
    },
    "4515": {
      "BLOCK_M": 256,
      "BLOCK_N": 16,
      "BLOCK_K": 32,
      "BLOCK_C": 64,
      "NUM_KSPLIT": 4,
      "num_warps": 8,
      "num_stages": 2,
      "waves_per_eu": 0
    },
    "957": {
      "BLOCK_M": 32,
      "BLOCK_N": 16,
      "BLOCK_K": 128,
      "BLOCK_C": 128,
      "NUM_KSPLIT": 2,
      "num_warps": 2,
      "num_stages": 2,
      "waves_per_eu": 0
    },
    "2134": {
      "BLOCK_M": 64,
      "BLOCK_N": 16,
      "BLOCK_K": 64,
      "BLOCK_C": 256,
      "NUM_KSPLIT": 4,
      "num_warps": 4,
      "num_stages": 2,
      "waves_per_eu": 1
    },
    "746": {
      "BLOCK_M": 32,
      "BLOCK_N": 16,
      "BLOCK_K": 128,
      "BLOCK_C": 16,
      "NUM_KSPLIT": 2,
      "num_warps": 4,
      "num_stages": 1,
      "waves_per_eu": 2
    },
    "2422": {
      "BLOCK_M": 64,
      "BLOCK_N": 16,
      "BLOCK_K": 128,
      "BLOCK_C": 128,
      "NUM_KSPLIT": 4,
      "num_warps": 4,
      "num_stages": 2,
      "waves_per_eu": 1
    },
    "4700": {
      "BLOCK_M": 256,
      "BLOCK_N": 16,
      "BLOCK_K": 64,
      "BLOCK_C": 16,
      "NUM_KSPLIT": 2,
      "num_warps": 2,
      "num_stages": 1,
      "waves_per_eu": 2
    },
    "3445": {
      "BLOCK_M": 128,
      "BLOCK_N": 16,
      "BLOCK_K": 64,
      "BLOCK_C": 64,
      "NUM_KSPLIT": 8,
      "num_warps": 4,
      "num_stages": 1,
      "waves_per_eu": 1
    },
    "2762": {
      "BLOCK_M": 64,
      "BLOCK_N": 16,
      "BLOCK_K": 256,
      "BLOCK_C": 128,
      "NUM_KSPLIT": 2,
      "num_warps": 4,
      "num_stages": 1,
      "waves_per_eu": 2
    },
    "1807": {
      "BLOCK_M": 64,
      "BLOCK_N": 16,
      "BLOCK_K": 64,
      "BLOCK_C": 16,
      "NUM_KSPLIT": 1,
      "num_warps": 4,
      "num_stages": 1,
      "waves_per_eu": 1
    },
    "4254": {
      "BLOCK_M": 128,
      "BLOCK_N": 16,
      "BLOCK_K": 256,
      "BLOCK_C": 256,
      "NUM_KSPLIT": 1,
      "num_warps": 4,
      "num_stages": 1,
      "waves_per_eu": 0
    },
    "2948": {
      "BLOCK_M": 128,
      "BLOCK_N": 16,
      "BLOCK_K": 32,
      "BLOCK_C": 16,
      "NUM_KSPLIT": 8,
      "num_warps": 8,
      "num_stages": 1,
      "waves_per_eu": 2
    },
    "1811": {
      "BLOCK_M": 64,
      "BLOCK_N": 16,
      "BLOCK_K": 64,
      "BLOCK_C": 16,
      "NUM_KSPLIT": 1,
      "num_warps": 4,
      "num_stages": 2,
      "waves_per_eu": 2
    },
    "1681": {
      "BLOCK_M": 64,
      "BLOCK_N": 16,
      "BLOCK_K": 32,
      "BLOCK_C": 128,
      "NUM_KSPLIT": 2,
      "num_warps": 4,
      "num_stages": 1,
      "waves_per_eu": 1
    },
    "1288": {
      "BLOCK_M": 32,
      "BLOCK_N": 16,
      "BLOCK_K": 256,
      "BLOCK_C": 64,
      "NUM_KSPLIT": 8,
      "num_warps": 4,
      "num_stages": 2,
      "waves_per_eu": 1
    },
    "636": {
      "BLOCK_M": 32,
      "BLOCK_N": 16,
      "BLOCK_K": 64,
      "BLOCK_C": 128,
      "NUM_KSPLIT": 8,
      "num_warps": 4,
      "num_stages": 1,
      "waves_per_eu": 0
    },
    "2589": {
      "BLOCK_M": 64,
      "BLOCK_N": 16,
      "BLOCK_K": 256,
      "BLOCK_C": 16,
      "NUM_KSPLIT": 8,
      "num_warps": 8,
      "num_stages": 2,
      "waves_per_eu": 0
    },
    "5009": {
      "BLOCK_M": 256,
      "BLOCK_N": 16,
      "BLOCK_K": 64,
      "BLOCK_C": 256,
      "NUM_KSPLIT": 4,
      "num_warps": 2,
      "num_stages": 2,
      "waves_per_eu": 2
    },
    "2211": {
      "BLOCK_M": 64,
      "BLOCK_N": 16,
      "BLOCK_K": 128,
      "BLOCK_C": 16,
      "NUM_KSPLIT": 4,
      "num_warps": 8,
      "num_stages": 2,
      "waves_per_eu": 0
    },
    "2502": {
      "BLOCK_M": 64,
      "BLOCK_N": 16,
      "BLOCK_K": 128,
      "BLOCK_C": 256,
      "NUM_KSPLIT": 8,
      "num_warps": 2,
      "num_stages": 1,
      "waves_per_eu": 0
    },
    "1071": {
      "BLOCK_M": 32,
      "BLOCK_N": 16,
      "BLOCK_K": 128,
      "BLOCK_C": 256,
      "NUM_KSPLIT": 8,
      "num_warps": 4,
      "num_stages": 2,
      "waves_per_eu": 0
    },
    "5137": {
      "BLOCK_M": 256,
      "BLOCK_N": 16,
      "BLOCK_K": 128,
      "BLOCK_C": 32,
      "NUM_KSPLIT": 2,
      "num_warps": 4,
      "num_stages": 1,
      "waves_per_eu": 1
    },
    "4803": {
      "BLOCK_M": 256,
      "BLOCK_N": 16,
      "BLOCK_K": 64,
      "BLOCK_C": 32,
      "NUM_KSPLIT": 4,
      "num_warps": 8,
      "num_stages": 2,
      "waves_per_eu": 0
    },
    "641": {
      "BLOCK_M": 32,
      "BLOCK_N": 16,
      "BLOCK_K": 64,
      "BLOCK_C": 128,
      "NUM_KSPLIT": 8,
      "num_warps": 4,
      "num_stages": 2,
      "waves_per_eu": 2
    },
    "3087": {
      "BLOCK_M": 128,
      "BLOCK_N": 16,
      "BLOCK_K": 32,
      "BLOCK_C": 64,
      "NUM_KSPLIT": 8,
      "num_warps": 4,
      "num_stages": 2,
      "waves_per_eu": 0
    },
    "187": {
      "BLOCK_M": 32,
      "BLOCK_N": 16,
      "BLOCK_K": 32,
      "BLOCK_C": 64,
      "NUM_KSPLIT": 4,
      "num_warps": 4,
      "num_stages": 1,
      "waves_per_eu": 1
    },
    "3730": {
      "BLOCK_M": 128,
      "BLOCK_N": 16,
      "BLOCK_K": 128,
      "BLOCK_C": 32,
      "NUM_KSPLIT": 8,
      "num_warps": 2,
      "num_stages": 2,
      "waves_per_eu": 1
    },
    "3239": {
      "BLOCK_M": 128,
      "BLOCK_N": 16,
      "BLOCK_K": 32,
      "BLOCK_C": 256,
      "NUM_KSPLIT": 8,
      "num_warps": 8,
      "num_stages": 2,
      "waves_per_eu": 2
    },
    "3273": {
      "BLOCK_M": 128,
      "BLOCK_N": 16,
      "BLOCK_K": 64,
      "BLOCK_C": 16,
      "NUM_KSPLIT": 2,
      "num_warps": 8,
      "num_stages": 2,
      "waves_per_eu": 0
    },
    "4122": {
      "BLOCK_M": 128,
      "BLOCK_N": 16,
      "BLOCK_K": 256,
      "BLOCK_C": 64,
      "NUM_KSPLIT": 2,
      "num_warps": 2,
      "num_stages": 1,
      "waves_per_eu": 0
    },
    "1867": {
      "BLOCK_M": 64,
      "BLOCK_N": 16,
      "BLOCK_K": 64,
      "BLOCK_C": 16,
      "NUM_KSPLIT": 8,
      "num_warps": 8,
      "num_stages": 1,
      "waves_per_eu": 1
    },
    "436": {
      "BLOCK_M": 32,
      "BLOCK_N": 16,
      "BLOCK_K": 64,
      "BLOCK_C": 32,
      "NUM_KSPLIT": 1,
      "num_warps": 2,
      "num_stages": 2,
      "waves_per_eu": 1
    },
    "4645": {
      "BLOCK_M": 256,
      "BLOCK_N": 16,
      "BLOCK_K": 32,
      "BLOCK_C": 256,
      "NUM_KSPLIT": 4,
      "num_warps": 2,
      "num_stages": 1,
      "waves_per_eu": 1
    },
    "4106": {
      "BLOCK_M": 128,
      "BLOCK_N": 16,
      "BLOCK_K": 256,
      "BLOCK_C": 64,
      "NUM_KSPLIT": 1,
      "num_warps": 2,
      "num_stages": 1,
      "waves_per_eu": 2
    },
    "2363": {
      "BLOCK_M": 64,
      "BLOCK_N": 16,
      "BLOCK_K": 128,
      "BLOCK_C": 64,
      "NUM_KSPLIT": 8,
      "num_warps": 2,
      "num_stages": 2,
      "waves_per_eu": 2
    },
    "4473": {
      "BLOCK_M": 256,
      "BLOCK_N": 16,
      "BLOCK_K": 32,
      "BLOCK_C": 64,
      "NUM_KSPLIT": 1,
      "num_warps": 4,
      "num_stages": 2,
      "waves_per_eu": 0
    },
    "1922": {
      "BLOCK_M": 64,
      "BLOCK_N": 16,
      "BLOCK_K": 64,
      "BLOCK_C": 32,
      "NUM_KSPLIT": 4,
      "num_warps": 8,
      "num_stages": 1,
      "waves_per_eu": 2
    },
    "5172": {
      "BLOCK_M": 256,
      "BLOCK_N": 16,
      "BLOCK_K": 128,
      "BLOCK_C": 32,
      "NUM_KSPLIT": 8,
      "num_warps": 4,
      "num_stages": 1,
      "waves_per_eu": 0
    },
    "2834": {
      "BLOCK_M": 64,
      "BLOCK_N": 16,
      "BLOCK_K": 256,
      "BLOCK_C": 256,
      "NUM_KSPLIT": 2,
      "num_warps": 4,
      "num_stages": 1,
      "waves_per_eu": 2
    },
    "2638": {
      "BLOCK_M": 64,
      "BLOCK_N": 16,
      "BLOCK_K": 256,
      "BLOCK_C": 32,
      "NUM_KSPLIT": 4,
      "num_warps": 4,
      "num_stages": 2,
      "waves_per_eu": 1
    },
    "2549": {
      "BLOCK_M": 64,
      "BLOCK_N": 16,
      "BLOCK_K": 256,
      "BLOCK_C": 16,
      "NUM_KSPLIT": 2,
      "num_warps": 4,
      "num_stages": 2,
      "waves_per_eu": 2
    },
    "5080": {
      "BLOCK_M": 256,
      "BLOCK_N": 16,
      "BLOCK_K": 128,
      "BLOCK_C": 16,
      "NUM_KSPLIT": 4,
      "num_warps": 2,
      "num_stages": 2,
      "waves_per_eu": 1
    },
    "3928": {
      "BLOCK_M": 128,
      "BLOCK_N": 16,
      "BLOCK_K": 128,
      "BLOCK_C": 256,
      "NUM_KSPLIT": 4,
      "num_warps": 2,
      "num_stages": 2,
      "waves_per_eu": 1
    },
    "1085": {
      "BLOCK_M": 32,
      "BLOCK_N": 16,
      "BLOCK_K": 256,
      "BLOCK_C": 16,
      "NUM_KSPLIT": 1,
      "num_warps": 2,
      "num_stages": 2,
      "waves_per_eu": 2
    },
    "4661": {
      "BLOCK_M": 256,
      "BLOCK_N": 16,
      "BLOCK_K": 32,
      "BLOCK_C": 256,
      "NUM_KSPLIT": 4,
      "num_warps": 8,
      "num_stages": 2,
      "waves_per_eu": 2
    },
    "128": {
      "BLOCK_M": 32,
      "BLOCK_N": 16,
      "BLOCK_K": 32,
      "BLOCK_C": 32,
      "NUM_KSPLIT": 8,
      "num_warps": 2,
      "num_stages": 1,
      "waves_per_eu": 2
    },
    "2433": {
      "BLOCK_M": 64,
      "BLOCK_N": 16,
      "BLOCK_K": 128,
      "BLOCK_C": 128,
      "NUM_KSPLIT": 8,
      "num_warps": 2,
      "num_stages": 2,
      "waves_per_eu": 0
    },
    "5380": {
      "BLOCK_M": 256,
      "BLOCK_N": 16,
      "BLOCK_K": 128,
      "BLOCK_C": 256,
      "NUM_KSPLIT": 4,
      "num_warps": 8,
      "num_stages": 2,
      "waves_per_eu": 1
    },
    "864": {
      "BLOCK_M": 32,
      "BLOCK_N": 16,
      "BLOCK_K": 128,
      "BLOCK_C": 64,
      "NUM_KSPLIT": 1,
      "num_warps": 2,
      "num_stages": 1,
      "waves_per_eu": 0
    },
    "3852": {
      "BLOCK_M": 128,
      "BLOCK_N": 16,
      "BLOCK_K": 128,
      "BLOCK_C": 128,
      "NUM_KSPLIT": 4,
      "num_warps": 2,
      "num_stages": 1,
      "waves_per_eu": 0
    },
    "4698": {
      "BLOCK_M": 256,
      "BLOCK_N": 16,
      "BLOCK_K": 64,
      "BLOCK_C": 16,
      "NUM_KSPLIT": 2,
      "num_warps": 2,
      "num_stages": 1,
      "waves_per_eu": 0
    },
    "1254": {
      "BLOCK_M": 32,
      "BLOCK_N": 16,
      "BLOCK_K": 256,
      "BLOCK_C": 64,
      "NUM_KSPLIT": 2,
      "num_warps": 8,
      "num_stages": 1,
      "waves_per_eu": 0
    },
    "921": {
      "BLOCK_M": 32,
      "BLOCK_N": 16,
      "BLOCK_K": 128,
      "BLOCK_C": 64,
      "NUM_KSPLIT": 8,
      "num_warps": 2,
      "num_stages": 2,
      "waves_per_eu": 0
    },
    "2766": {
      "BLOCK_M": 64,
      "BLOCK_N": 16,
      "BLOCK_K": 256,
      "BLOCK_C": 128,
      "NUM_KSPLIT": 2,
      "num_warps": 8,
      "num_stages": 1,
      "waves_per_eu": 0
    },
    "360": {
      "BLOCK_M": 32,
      "BLOCK_N": 16,
      "BLOCK_K": 64,
      "BLOCK_C": 16,
      "NUM_KSPLIT": 1,
      "num_warps": 2,
      "num_stages": 1,
      "waves_per_eu": 0
    },
    "612": {
      "BLOCK_M": 32,
      "BLOCK_N": 16,
      "BLOCK_K": 64,
      "BLOCK_C": 128,
      "NUM_KSPLIT": 4,
      "num_warps": 2,
      "num_stages": 1,
      "waves_per_eu": 0
    },
    "2592": {
      "BLOCK_M": 64,
      "BLOCK_N": 16,
      "BLOCK_K": 256,
      "BLOCK_C": 32,
      "NUM_KSPLIT": 1,
      "num_warps": 2,
      "num_stages": 1,
      "waves_per_eu": 0
    },
    "258": {
      "BLOCK_M": 32,
      "BLOCK_N": 16,
      "BLOCK_K": 32,
      "BLOCK_C": 128,
      "NUM_KSPLIT": 4,
      "num_warps": 4,
      "num_stages": 1,
      "waves_per_eu": 0
    },
    "5072": {
      "BLOCK_M": 256,
      "BLOCK_N": 16,
      "BLOCK_K": 128,
      "BLOCK_C": 16,
      "NUM_KSPLIT": 2,
      "num_warps": 8,
      "num_stages": 1,
      "waves_per_eu": 2
    },
    "2381": {
      "BLOCK_M": 64,
      "BLOCK_N": 16,
      "BLOCK_K": 128,
      "BLOCK_C": 128,
      "NUM_KSPLIT": 1,
      "num_warps": 2,
      "num_stages": 2,
      "waves_per_eu": 2
    },
    "142": {
      "BLOCK_M": 32,
      "BLOCK_N": 16,
      "BLOCK_K": 32,
      "BLOCK_C": 32,
      "NUM_KSPLIT": 8,
      "num_warps": 8,
      "num_stages": 2,
      "waves_per_eu": 1
    },
    "5312": {
      "BLOCK_M": 256,
      "BLOCK_N": 16,
      "BLOCK_K": 128,
      "BLOCK_C": 128,
      "NUM_KSPLIT": 8,
      "num_warps": 2,
      "num_stages": 1,
      "waves_per_eu": 2
    },
    "3971": {
      "BLOCK_M": 128,
      "BLOCK_N": 16,
      "BLOCK_K": 256,
      "BLOCK_C": 16,
      "NUM_KSPLIT": 1,
      "num_warps": 4,
      "num_stages": 2,
      "waves_per_eu": 2
    },
    "129": {
      "BLOCK_M": 32,
      "BLOCK_N": 16,
      "BLOCK_K": 32,
      "BLOCK_C": 32,
      "NUM_KSPLIT": 8,
      "num_warps": 2,
      "num_stages": 2,
      "waves_per_eu": 0
    },
    "5521": {
      "BLOCK_M": 256,
      "BLOCK_N": 16,
      "BLOCK_K": 256,
      "BLOCK_C": 32,
      "NUM_KSPLIT": 4,
      "num_warps": 8,
      "num_stages": 1,
      "waves_per_eu": 1
    },
    "5679": {
      "BLOCK_M": 256,
      "BLOCK_N": 16,
      "BLOCK_K": 256,
      "BLOCK_C": 128,
      "NUM_KSPLIT": 8,
      "num_warps": 4,
      "num_stages": 2,
      "waves_per_eu": 0
    },
    "4687": {
      "BLOCK_M": 256,
      "BLOCK_N": 16,
      "BLOCK_K": 64,
      "BLOCK_C": 16,
      "NUM_KSPLIT": 1,
      "num_warps": 4,
      "num_stages": 1,
      "waves_per_eu": 1
    },
    "4963": {
      "BLOCK_M": 256,
      "BLOCK_N": 16,
      "BLOCK_K": 64,
      "BLOCK_C": 128,
      "NUM_KSPLIT": 8,
      "num_warps": 8,
      "num_stages": 1,
      "waves_per_eu": 1
    },
    "4602": {
      "BLOCK_M": 256,
      "BLOCK_N": 16,
      "BLOCK_K": 32,
      "BLOCK_C": 128,
      "NUM_KSPLIT": 8,
      "num_warps": 8,
      "num_stages": 1,
      "waves_per_eu": 0
    },
    "2831": {
      "BLOCK_M": 64,
      "BLOCK_N": 16,
      "BLOCK_K": 256,
      "BLOCK_C": 256,
      "NUM_KSPLIT": 2,
      "num_warps": 2,
      "num_stages": 2,
      "waves_per_eu": 2
    },
    "1721": {
      "BLOCK_M": 64,
      "BLOCK_N": 16,
      "BLOCK_K": 32,
      "BLOCK_C": 128,
      "NUM_KSPLIT": 8,
      "num_warps": 4,
      "num_stages": 2,
      "waves_per_eu": 2
    },
    "1070": {
      "BLOCK_M": 32,
      "BLOCK_N": 16,
      "BLOCK_K": 128,
      "BLOCK_C": 256,
      "NUM_KSPLIT": 8,
      "num_warps": 4,
      "num_stages": 1,
      "waves_per_eu": 2
    },
    "2313": {
      "BLOCK_M": 64,
      "BLOCK_N": 16,
      "BLOCK_K": 128,
      "BLOCK_C": 64,
      "NUM_KSPLIT": 1,
      "num_warps": 4,
      "num_stages": 2,
      "waves_per_eu": 0
    },
    "1708": {
      "BLOCK_M": 64,
      "BLOCK_N": 16,
      "BLOCK_K": 32,
      "BLOCK_C": 128,
      "NUM_KSPLIT": 4,
      "num_warps": 8,
      "num_stages": 2,
      "waves_per_eu": 1
    },
    "5414": {
      "BLOCK_M": 256,
      "BLOCK_N": 16,
      "BLOCK_K": 256,
      "BLOCK_C": 16,
      "NUM_KSPLIT": 1,
      "num_warps": 8,
      "num_stages": 1,
      "waves_per_eu": 2
    },
    "1821": {
      "BLOCK_M": 64,
      "BLOCK_N": 16,
      "BLOCK_K": 64,
      "BLOCK_C": 16,
      "NUM_KSPLIT": 2,
      "num_warps": 2,
      "num_stages": 2,
      "waves_per_eu": 0
    },
    "4835": {
      "BLOCK_M": 256,
      "BLOCK_N": 16,
      "BLOCK_K": 64,
      "BLOCK_C": 64,
      "NUM_KSPLIT": 1,
      "num_warps": 4,
      "num_stages": 2,
      "waves_per_eu": 2
    },
    "3662": {
      "BLOCK_M": 128,
      "BLOCK_N": 16,
      "BLOCK_K": 128,
      "BLOCK_C": 16,
      "NUM_KSPLIT": 8,
      "num_warps": 4,
      "num_stages": 1,
      "waves_per_eu": 2
    },
    "3851": {
      "BLOCK_M": 128,
      "BLOCK_N": 16,
      "BLOCK_K": 128,
      "BLOCK_C": 128,
      "NUM_KSPLIT": 2,
      "num_warps": 8,
      "num_stages": 2,
      "waves_per_eu": 2
    },
    "15": {
      "BLOCK_M": 32,
      "BLOCK_N": 16,
      "BLOCK_K": 32,
      "BLOCK_C": 16,
      "NUM_KSPLIT": 1,
      "num_warps": 8,
      "num_stages": 2,
      "waves_per_eu": 0
    },
    "1437": {
      "BLOCK_M": 32,
      "BLOCK_N": 16,
      "BLOCK_K": 256,
      "BLOCK_C": 256,
      "NUM_KSPLIT": 8,
      "num_warps": 8,
      "num_stages": 2,
      "waves_per_eu": 0
    },
    "3602": {
      "BLOCK_M": 128,
      "BLOCK_N": 16,
      "BLOCK_K": 128,
      "BLOCK_C": 16,
      "NUM_KSPLIT": 1,
      "num_warps": 2,
      "num_stages": 1,
      "waves_per_eu": 2
    },
    "5227": {
      "BLOCK_M": 256,
      "BLOCK_N": 16,
      "BLOCK_K": 128,
      "BLOCK_C": 64,
      "NUM_KSPLIT": 4,
      "num_warps": 4,
      "num_stages": 1,
      "waves_per_eu": 1
    },
    "2880": {
      "BLOCK_M": 128,
      "BLOCK_N": 16,
      "BLOCK_K": 32,
      "BLOCK_C": 16,
      "NUM_KSPLIT": 1,
      "num_warps": 2,
      "num_stages": 1,
      "waves_per_eu": 0
    },
    "419": {
      "BLOCK_M": 32,
      "BLOCK_N": 16,
      "BLOCK_K": 64,
      "BLOCK_C": 16,
      "NUM_KSPLIT": 8,
      "num_warps": 2,
      "num_stages": 2,
      "waves_per_eu": 2
    },
    "1306": {
      "BLOCK_M": 32,
      "BLOCK_N": 16,
      "BLOCK_K": 256,
      "BLOCK_C": 128,
      "NUM_KSPLIT": 1,
      "num_warps": 4,
      "num_stages": 2,
      "waves_per_eu": 1
    },
    "5592": {
      "BLOCK_M": 256,
      "BLOCK_N": 16,
      "BLOCK_K": 256,
      "BLOCK_C": 64,
      "NUM_KSPLIT": 4,
      "num_warps": 8,
      "num_stages": 1,
      "waves_per_eu": 0
    },
    "1019": {
      "BLOCK_M": 32,
      "BLOCK_N": 16,
      "BLOCK_K": 128,
      "BLOCK_C": 256,
      "NUM_KSPLIT": 1,
      "num_warps": 4,
      "num_stages": 2,
      "waves_per_eu": 2
    },
    "5304": {
      "BLOCK_M": 256,
      "BLOCK_N": 16,
      "BLOCK_K": 128,
      "BLOCK_C": 128,
      "NUM_KSPLIT": 4,
      "num_warps": 8,
      "num_stages": 1,
      "waves_per_eu": 0
    },
    "645": {
      "BLOCK_M": 32,
      "BLOCK_N": 16,
      "BLOCK_K": 64,
      "BLOCK_C": 128,
      "NUM_KSPLIT": 8,
      "num_warps": 8,
      "num_stages": 2,
      "waves_per_eu": 0
    },
    "4237": {
      "BLOCK_M": 128,
      "BLOCK_N": 16,
      "BLOCK_K": 256,
      "BLOCK_C": 128,
      "NUM_KSPLIT": 8,
      "num_warps": 4,
      "num_stages": 1,
      "waves_per_eu": 1
    },
    "4257": {
      "BLOCK_M": 128,
      "BLOCK_N": 16,
      "BLOCK_K": 256,
      "BLOCK_C": 256,
      "NUM_KSPLIT": 1,
      "num_warps": 4,
      "num_stages": 2,
      "waves_per_eu": 0
    },
    "764": {
      "BLOCK_M": 32,
      "BLOCK_N": 16,
      "BLOCK_K": 128,
      "BLOCK_C": 16,
      "NUM_KSPLIT": 4,
      "num_warps": 4,
      "num_stages": 1,
      "waves_per_eu": 2
    },
    "266": {
      "BLOCK_M": 32,
      "BLOCK_N": 16,
      "BLOCK_K": 32,
      "BLOCK_C": 128,
      "NUM_KSPLIT": 4,
      "num_warps": 8,
      "num_stages": 1,
      "waves_per_eu": 2
    },
    "2278": {
      "BLOCK_M": 64,
      "BLOCK_N": 16,
      "BLOCK_K": 128,
      "BLOCK_C": 32,
      "NUM_KSPLIT": 4,
      "num_warps": 4,
      "num_stages": 2,
      "waves_per_eu": 1
    },
    "5205": {
      "BLOCK_M": 256,
      "BLOCK_N": 16,
      "BLOCK_K": 128,
      "BLOCK_C": 64,
      "NUM_KSPLIT": 2,
      "num_warps": 2,
      "num_stages": 2,
      "waves_per_eu": 0
    },
    "1633": {
      "BLOCK_M": 64,
      "BLOCK_N": 16,
      "BLOCK_K": 32,
      "BLOCK_C": 64,
      "NUM_KSPLIT": 4,
      "num_warps": 8,
      "num_stages": 1,
      "waves_per_eu": 1
    },
    "1559": {
      "BLOCK_M": 64,
      "BLOCK_N": 16,
      "BLOCK_K": 32,
      "BLOCK_C": 32,
      "NUM_KSPLIT": 4,
      "num_warps": 4,
      "num_stages": 2,
      "waves_per_eu": 2
    },
    "4078": {
      "BLOCK_M": 128,
      "BLOCK_N": 16,
      "BLOCK_K": 256,
      "BLOCK_C": 32,
      "NUM_KSPLIT": 4,
      "num_warps": 4,
      "num_stages": 2,
      "waves_per_eu": 1
    },
    "3589": {
      "BLOCK_M": 128,
      "BLOCK_N": 16,
      "BLOCK_K": 64,
      "BLOCK_C": 256,
      "NUM_KSPLIT": 8,
      "num_warps": 4,
      "num_stages": 1,
      "waves_per_eu": 1
    },
    "3795": {
      "BLOCK_M": 128,
      "BLOCK_N": 16,
      "BLOCK_K": 128,
      "BLOCK_C": 64,
      "NUM_KSPLIT": 4,
      "num_warps": 8,
      "num_stages": 2,
      "waves_per_eu": 0
    },
    "579": {
      "BLOCK_M": 32,
      "BLOCK_N": 16,
      "BLOCK_K": 64,
      "BLOCK_C": 128,
      "NUM_KSPLIT": 1,
      "num_warps": 2,
      "num_stages": 2,
      "waves_per_eu": 0
    },
    "3320": {
      "BLOCK_M": 128,
      "BLOCK_N": 16,
      "BLOCK_K": 64,
      "BLOCK_C": 32,
      "NUM_KSPLIT": 1,
      "num_warps": 4,
      "num_stages": 1,
      "waves_per_eu": 2
    },
    "5261": {
      "BLOCK_M": 256,
      "BLOCK_N": 16,
      "BLOCK_K": 128,
      "BLOCK_C": 128,
      "NUM_KSPLIT": 1,
      "num_warps": 2,
      "num_stages": 2,
      "waves_per_eu": 2
    },
    "3764": {
      "BLOCK_M": 128,
      "BLOCK_N": 16,
      "BLOCK_K": 128,
      "BLOCK_C": 64,
      "NUM_KSPLIT": 2,
      "num_warps": 2,
      "num_stages": 1,
      "waves_per_eu": 2
    },
    "3170": {
      "BLOCK_M": 128,
      "BLOCK_N": 16,
      "BLOCK_K": 32,
      "BLOCK_C": 256,
      "NUM_KSPLIT": 1,
      "num_warps": 2,
      "num_stages": 1,
      "waves_per_eu": 2
    },
    "3850": {
      "BLOCK_M": 128,
      "BLOCK_N": 16,
      "BLOCK_K": 128,
      "BLOCK_C": 128,
      "NUM_KSPLIT": 2,
      "num_warps": 8,
      "num_stages": 2,
      "waves_per_eu": 1
    },
    "1591": {
      "BLOCK_M": 64,
      "BLOCK_N": 16,
      "BLOCK_K": 32,
      "BLOCK_C": 64,
      "NUM_KSPLIT": 1,
      "num_warps": 4,
      "num_stages": 1,
      "waves_per_eu": 1
    },
    "4403": {
      "BLOCK_M": 256,
      "BLOCK_N": 16,
      "BLOCK_K": 32,
      "BLOCK_C": 32,
      "NUM_KSPLIT": 1,
      "num_warps": 4,
      "num_stages": 2,
      "waves_per_eu": 2
    },
    "451": {
      "BLOCK_M": 32,
      "BLOCK_N": 16,
      "BLOCK_K": 64,
      "BLOCK_C": 32,
      "NUM_KSPLIT": 2,
      "num_warps": 2,
      "num_stages": 1,
      "waves_per_eu": 1
    },
    "5431": {
      "BLOCK_M": 256,
      "BLOCK_N": 16,
      "BLOCK_K": 256,
      "BLOCK_C": 16,
      "NUM_KSPLIT": 2,
      "num_warps": 8,
      "num_stages": 1,
      "waves_per_eu": 1
    },
    "4715": {
      "BLOCK_M": 256,
      "BLOCK_N": 16,
      "BLOCK_K": 64,
      "BLOCK_C": 16,
      "NUM_KSPLIT": 2,
      "num_warps": 8,
      "num_stages": 2,
      "waves_per_eu": 2
    },
    "4348": {
      "BLOCK_M": 256,
      "BLOCK_N": 16,
      "BLOCK_K": 32,
      "BLOCK_C": 16,
      "NUM_KSPLIT": 2,
      "num_warps": 4,
      "num_stages": 2,
      "waves_per_eu": 1
    },
    "462": {
      "BLOCK_M": 32,
      "BLOCK_N": 16,
      "BLOCK_K": 64,
      "BLOCK_C": 32,
      "NUM_KSPLIT": 2,
      "num_warps": 8,
      "num_stages": 1,
      "waves_per_eu": 0
    },
    "241": {
      "BLOCK_M": 32,
      "BLOCK_N": 16,
      "BLOCK_K": 32,
      "BLOCK_C": 128,
      "NUM_KSPLIT": 2,
      "num_warps": 4,
      "num_stages": 1,
      "waves_per_eu": 1
    },
    "1701": {
      "BLOCK_M": 64,
      "BLOCK_N": 16,
      "BLOCK_K": 32,
      "BLOCK_C": 128,
      "NUM_KSPLIT": 4,
      "num_warps": 4,
      "num_stages": 2,
      "waves_per_eu": 0
    },
    "2752": {
      "BLOCK_M": 64,
      "BLOCK_N": 16,
      "BLOCK_K": 256,
      "BLOCK_C": 128,
      "NUM_KSPLIT": 1,
      "num_warps": 8,
      "num_stages": 2,
      "waves_per_eu": 1
    },
    "308": {
      "BLOCK_M": 32,
      "BLOCK_N": 16,
      "BLOCK_K": 32,
      "BLOCK_C": 256,
      "NUM_KSPLIT": 2,
      "num_warps": 2,
      "num_stages": 1,
      "waves_per_eu": 2
    },
    "2308": {
      "BLOCK_M": 64,
      "BLOCK_N": 16,
      "BLOCK_K": 128,
      "BLOCK_C": 64,
      "NUM_KSPLIT": 1,
      "num_warps": 2,
      "num_stages": 2,
      "waves_per_eu": 1
    },
    "1562": {
      "BLOCK_M": 64,
      "BLOCK_N": 16,
      "BLOCK_K": 32,
      "BLOCK_C": 32,
      "NUM_KSPLIT": 4,
      "num_warps": 8,
      "num_stages": 1,
      "waves_per_eu": 2
    },
    "958": {
      "BLOCK_M": 32,
      "BLOCK_N": 16,
      "BLOCK_K": 128,
      "BLOCK_C": 128,
      "NUM_KSPLIT": 2,
      "num_warps": 2,
      "num_stages": 2,
      "waves_per_eu": 1
    },
    "3689": {
      "BLOCK_M": 128,
      "BLOCK_N": 16,
      "BLOCK_K": 128,
      "BLOCK_C": 32,
      "NUM_KSPLIT": 1,
      "num_warps": 8,
      "num_stages": 2,
      "waves_per_eu": 2
    },
    "1895": {
      "BLOCK_M": 64,
      "BLOCK_N": 16,
      "BLOCK_K": 64,
      "BLOCK_C": 32,
      "NUM_KSPLIT": 2,
      "num_warps": 2,
      "num_stages": 2,
      "waves_per_eu": 2
    },
    "5248": {
      "BLOCK_M": 256,
      "BLOCK_N": 16,
      "BLOCK_K": 128,
      "BLOCK_C": 64,
      "NUM_KSPLIT": 8,
      "num_warps": 4,
      "num_stages": 2,
      "waves_per_eu": 1
    },
    "96": {
      "BLOCK_M": 32,
      "BLOCK_N": 16,
      "BLOCK_K": 32,
      "BLOCK_C": 32,
      "NUM_KSPLIT": 2,
      "num_warps": 4,
      "num_stages": 1,
      "waves_per_eu": 0
    },
    "5148": {
      "BLOCK_M": 256,
      "BLOCK_N": 16,
      "BLOCK_K": 128,
      "BLOCK_C": 32,
      "NUM_KSPLIT": 4,
      "num_warps": 2,
      "num_stages": 1,
      "waves_per_eu": 0
    },
    "1144": {
      "BLOCK_M": 32,
      "BLOCK_N": 16,
      "BLOCK_K": 256,
      "BLOCK_C": 16,
      "NUM_KSPLIT": 8,
      "num_warps": 4,
      "num_stages": 2,
      "waves_per_eu": 1
    },
    "919": {
      "BLOCK_M": 32,
      "BLOCK_N": 16,
      "BLOCK_K": 128,
      "BLOCK_C": 64,
      "NUM_KSPLIT": 8,
      "num_warps": 2,
      "num_stages": 1,
      "waves_per_eu": 1
    },
    "1769": {
      "BLOCK_M": 64,
      "BLOCK_N": 16,
      "BLOCK_K": 32,
      "BLOCK_C": 256,
      "NUM_KSPLIT": 4,
      "num_warps": 2,
      "num_stages": 2,
      "waves_per_eu": 2
    },
    "354": {
      "BLOCK_M": 32,
      "BLOCK_N": 16,
      "BLOCK_K": 32,
      "BLOCK_C": 256,
      "NUM_KSPLIT": 8,
      "num_warps": 8,
      "num_stages": 1,
      "waves_per_eu": 0
    },
    "3112": {
      "BLOCK_M": 128,
      "BLOCK_N": 16,
      "BLOCK_K": 32,
      "BLOCK_C": 128,
      "NUM_KSPLIT": 1,
      "num_warps": 8,
      "num_stages": 2,
      "waves_per_eu": 1
    },
    "3729": {
      "BLOCK_M": 128,
      "BLOCK_N": 16,
      "BLOCK_K": 128,
      "BLOCK_C": 32,
      "NUM_KSPLIT": 8,
      "num_warps": 2,
      "num_stages": 2,
      "waves_per_eu": 0
    },
    "4729": {
      "BLOCK_M": 256,
      "BLOCK_N": 16,
      "BLOCK_K": 64,
      "BLOCK_C": 16,
      "NUM_KSPLIT": 4,
      "num_warps": 8,
      "num_stages": 1,
      "waves_per_eu": 1
    },
    "3413": {
      "BLOCK_M": 128,
      "BLOCK_N": 16,
      "BLOCK_K": 64,
      "BLOCK_C": 64,
      "NUM_KSPLIT": 2,
      "num_warps": 4,
      "num_stages": 2,
      "waves_per_eu": 2
    },
    "178": {
      "BLOCK_M": 32,
      "BLOCK_N": 16,
      "BLOCK_K": 32,
      "BLOCK_C": 64,
      "NUM_KSPLIT": 2,
      "num_warps": 8,
      "num_stages": 2,
      "waves_per_eu": 1
    },
    "889": {
      "BLOCK_M": 32,
      "BLOCK_N": 16,
      "BLOCK_K": 128,
      "BLOCK_C": 64,
      "NUM_KSPLIT": 2,
      "num_warps": 4,
      "num_stages": 1,
      "waves_per_eu": 1
    },
    "3672": {
      "BLOCK_M": 128,
      "BLOCK_N": 16,
      "BLOCK_K": 128,
      "BLOCK_C": 32,
      "NUM_KSPLIT": 1,
      "num_warps": 2,
      "num_stages": 1,
      "waves_per_eu": 0
    },
    "3755": {
      "BLOCK_M": 128,
      "BLOCK_N": 16,
      "BLOCK_K": 128,
      "BLOCK_C": 64,
      "NUM_KSPLIT": 1,
      "num_warps": 4,
      "num_stages": 2,
      "waves_per_eu": 2
    },
    "5133": {
      "BLOCK_M": 256,
      "BLOCK_N": 16,
      "BLOCK_K": 128,
      "BLOCK_C": 32,
      "NUM_KSPLIT": 2,
      "num_warps": 2,
      "num_stages": 2,
      "waves_per_eu": 0
    },
    "989": {
      "BLOCK_M": 32,
      "BLOCK_N": 16,
      "BLOCK_K": 128,
      "BLOCK_C": 128,
      "NUM_KSPLIT": 4,
      "num_warps": 8,
      "num_stages": 2,
      "waves_per_eu": 2
    },
    "2189": {
      "BLOCK_M": 64,
      "BLOCK_N": 16,
      "BLOCK_K": 128,
      "BLOCK_C": 16,
      "NUM_KSPLIT": 2,
      "num_warps": 4,
      "num_stages": 2,
      "waves_per_eu": 2
    },
    "1760": {
      "BLOCK_M": 64,
      "BLOCK_N": 16,
      "BLOCK_K": 32,
      "BLOCK_C": 256,
      "NUM_KSPLIT": 2,
      "num_warps": 8,
      "num_stages": 1,
      "waves_per_eu": 2
    },
    "2116": {
      "BLOCK_M": 64,
      "BLOCK_N": 16,
      "BLOCK_K": 64,
      "BLOCK_C": 256,
      "NUM_KSPLIT": 2,
      "num_warps": 4,
      "num_stages": 2,
      "waves_per_eu": 1
    },
    "2299": {
      "BLOCK_M": 64,
      "BLOCK_N": 16,
      "BLOCK_K": 128,
      "BLOCK_C": 32,
      "NUM_KSPLIT": 8,
      "num_warps": 8,
      "num_stages": 1,
      "waves_per_eu": 1
    },
    "2086": {
      "BLOCK_M": 64,
      "BLOCK_N": 16,
      "BLOCK_K": 64,
      "BLOCK_C": 128,
      "NUM_KSPLIT": 8,
      "num_warps": 8,
      "num_stages": 2,
      "waves_per_eu": 1
    },
    "2954": {
      "BLOCK_M": 128,
      "BLOCK_N": 16,
      "BLOCK_K": 32,
      "BLOCK_C": 32,
      "NUM_KSPLIT": 1,
      "num_warps": 2,
      "num_stages": 1,
      "waves_per_eu": 2
    },
    "3499": {
      "BLOCK_M": 128,
      "BLOCK_N": 16,
      "BLOCK_K": 64,
      "BLOCK_C": 128,
      "NUM_KSPLIT": 4,
      "num_warps": 4,
      "num_stages": 1,
      "waves_per_eu": 1
    },
    "502": {
      "BLOCK_M": 32,
      "BLOCK_N": 16,
      "BLOCK_K": 64,
      "BLOCK_C": 32,
      "NUM_KSPLIT": 8,
      "num_warps": 8,
      "num_stages": 2,
      "waves_per_eu": 1
    },
    "5522": {
      "BLOCK_M": 256,
      "BLOCK_N": 16,
      "BLOCK_K": 256,
      "BLOCK_C": 32,
      "NUM_KSPLIT": 4,
      "num_warps": 8,
      "num_stages": 1,
      "waves_per_eu": 2
    },
    "1669": {
      "BLOCK_M": 64,
      "BLOCK_N": 16,
      "BLOCK_K": 32,
      "BLOCK_C": 128,
      "NUM_KSPLIT": 1,
      "num_warps": 8,
      "num_stages": 1,
      "waves_per_eu": 1
    },
    "55": {
      "BLOCK_M": 32,
      "BLOCK_N": 16,
      "BLOCK_K": 32,
      "BLOCK_C": 16,
      "NUM_KSPLIT": 8,
      "num_warps": 2,
      "num_stages": 1,
      "waves_per_eu": 1
    },
    "2858": {
      "BLOCK_M": 64,
      "BLOCK_N": 16,
      "BLOCK_K": 256,
      "BLOCK_C": 256,
      "NUM_KSPLIT": 4,
      "num_warps": 8,
      "num_stages": 1,
      "waves_per_eu": 2
    },
    "2285": {
      "BLOCK_M": 64,
      "BLOCK_N": 16,
      "BLOCK_K": 128,
      "BLOCK_C": 32,
      "NUM_KSPLIT": 4,
      "num_warps": 8,
      "num_stages": 2,
      "waves_per_eu": 2
    },
    "5410": {
      "BLOCK_M": 256,
      "BLOCK_N": 16,
      "BLOCK_K": 256,
      "BLOCK_C": 16,
      "NUM_KSPLIT": 1,
      "num_warps": 4,
      "num_stages": 2,
      "waves_per_eu": 1
    },
    "4817": {
      "BLOCK_M": 256,
      "BLOCK_N": 16,
      "BLOCK_K": 64,
      "BLOCK_C": 32,
      "NUM_KSPLIT": 8,
      "num_warps": 4,
      "num_stages": 2,
      "waves_per_eu": 2
    },
    "2207": {
      "BLOCK_M": 64,
      "BLOCK_N": 16,
      "BLOCK_K": 128,
      "BLOCK_C": 16,
      "NUM_KSPLIT": 4,
      "num_warps": 4,
      "num_stages": 2,
      "waves_per_eu": 2
    },
    "3209": {
      "BLOCK_M": 128,
      "BLOCK_N": 16,
      "BLOCK_K": 32,
      "BLOCK_C": 256,
      "NUM_KSPLIT": 4,
      "num_warps": 2,
      "num_stages": 2,
      "waves_per_eu": 2
    },
    "4639": {
      "BLOCK_M": 256,
      "BLOCK_N": 16,
      "BLOCK_K": 32,
      "BLOCK_C": 256,
      "NUM_KSPLIT": 2,
      "num_warps": 8,
      "num_stages": 1,
      "waves_per_eu": 1
    },
    "64": {
      "BLOCK_M": 32,
      "BLOCK_N": 16,
      "BLOCK_K": 32,
      "BLOCK_C": 16,
      "NUM_KSPLIT": 8,
      "num_warps": 4,
      "num_stages": 2,
      "waves_per_eu": 1
    },
    "3688": {
      "BLOCK_M": 128,
      "BLOCK_N": 16,
      "BLOCK_K": 128,
      "BLOCK_C": 32,
      "NUM_KSPLIT": 1,
      "num_warps": 8,
      "num_stages": 2,
      "waves_per_eu": 1
    },
    "4050": {
      "BLOCK_M": 128,
      "BLOCK_N": 16,
      "BLOCK_K": 256,
      "BLOCK_C": 32,
      "NUM_KSPLIT": 2,
      "num_warps": 2,
      "num_stages": 1,
      "waves_per_eu": 0
    },
    "4131": {
      "BLOCK_M": 128,
      "BLOCK_N": 16,
      "BLOCK_K": 256,
      "BLOCK_C": 64,
      "NUM_KSPLIT": 2,
      "num_warps": 4,
      "num_stages": 2,
      "waves_per_eu": 0
    },
    "148": {
      "BLOCK_M": 32,
      "BLOCK_N": 16,
      "BLOCK_K": 32,
      "BLOCK_C": 64,
      "NUM_KSPLIT": 1,
      "num_warps": 2,
      "num_stages": 2,
      "waves_per_eu": 1
    },
    "2246": {
      "BLOCK_M": 64,
      "BLOCK_N": 16,
      "BLOCK_K": 128,
      "BLOCK_C": 32,
      "NUM_KSPLIT": 1,
      "num_warps": 8,
      "num_stages": 1,
      "waves_per_eu": 2
    },
    "303": {
      "BLOCK_M": 32,
      "BLOCK_N": 16,
      "BLOCK_K": 32,
      "BLOCK_C": 256,
      "NUM_KSPLIT": 1,
      "num_warps": 8,
      "num_stages": 2,
      "waves_per_eu": 0
    },
    "1805": {
      "BLOCK_M": 64,
      "BLOCK_N": 16,
      "BLOCK_K": 64,
      "BLOCK_C": 16,
      "NUM_KSPLIT": 1,
      "num_warps": 2,
      "num_stages": 2,
      "waves_per_eu": 2
    },
    "1757": {
      "BLOCK_M": 64,
      "BLOCK_N": 16,
      "BLOCK_K": 32,
      "BLOCK_C": 256,
      "NUM_KSPLIT": 2,
      "num_warps": 4,
      "num_stages": 2,
      "waves_per_eu": 2
    },
    "607": {
      "BLOCK_M": 32,
      "BLOCK_N": 16,
      "BLOCK_K": 64,
      "BLOCK_C": 128,
      "NUM_KSPLIT": 2,
      "num_warps": 8,
      "num_stages": 1,
      "waves_per_eu": 1
    },
    "3777": {
      "BLOCK_M": 128,
      "BLOCK_N": 16,
      "BLOCK_K": 128,
      "BLOCK_C": 64,
      "NUM_KSPLIT": 2,
      "num_warps": 8,
      "num_stages": 2,
      "waves_per_eu": 0
    },
    "574": {
      "BLOCK_M": 32,
      "BLOCK_N": 16,
      "BLOCK_K": 64,
      "BLOCK_C": 64,
      "NUM_KSPLIT": 8,
      "num_warps": 8,
      "num_stages": 2,
      "waves_per_eu": 1
    },
    "310": {
      "BLOCK_M": 32,
      "BLOCK_N": 16,
      "BLOCK_K": 32,
      "BLOCK_C": 256,
      "NUM_KSPLIT": 2,
      "num_warps": 2,
      "num_stages": 2,
      "waves_per_eu": 1
    },
    "1848": {
      "BLOCK_M": 64,
      "BLOCK_N": 16,
      "BLOCK_K": 64,
      "BLOCK_C": 16,
      "NUM_KSPLIT": 4,
      "num_warps": 8,
      "num_stages": 1,
      "waves_per_eu": 0
    },
    "2815": {
      "BLOCK_M": 64,
      "BLOCK_N": 16,
      "BLOCK_K": 256,
      "BLOCK_C": 256,
      "NUM_KSPLIT": 1,
      "num_warps": 4,
      "num_stages": 1,
      "waves_per_eu": 1
    },
    "4917": {
      "BLOCK_M": 256,
      "BLOCK_N": 16,
      "BLOCK_K": 64,
      "BLOCK_C": 128,
      "NUM_KSPLIT": 2,
      "num_warps": 2,
      "num_stages": 2,
      "waves_per_eu": 0
    },
    "384": {
      "BLOCK_M": 32,
      "BLOCK_N": 16,
      "BLOCK_K": 64,
      "BLOCK_C": 16,
      "NUM_KSPLIT": 2,
      "num_warps": 4,
      "num_stages": 1,
      "waves_per_eu": 0
    },
    "5700": {
      "BLOCK_M": 256,
      "BLOCK_N": 16,
      "BLOCK_K": 256,
      "BLOCK_C": 256,
      "NUM_KSPLIT": 1,
      "num_warps": 8,
      "num_stages": 1,
      "waves_per_eu": 0
    },
    "523": {
      "BLOCK_M": 32,
      "BLOCK_N": 16,
      "BLOCK_K": 64,
      "BLOCK_C": 64,
      "NUM_KSPLIT": 2,
      "num_warps": 2,
      "num_stages": 1,
      "waves_per_eu": 1
    },
    "3295": {
      "BLOCK_M": 128,
      "BLOCK_N": 16,
      "BLOCK_K": 64,
      "BLOCK_C": 16,
      "NUM_KSPLIT": 8,
      "num_warps": 2,
      "num_stages": 1,
      "waves_per_eu": 1
    },
    "534": {
      "BLOCK_M": 32,
      "BLOCK_N": 16,
      "BLOCK_K": 64,
      "BLOCK_C": 64,
      "NUM_KSPLIT": 2,
      "num_warps": 8,
      "num_stages": 1,
      "waves_per_eu": 0
    },
    "5576": {
      "BLOCK_M": 256,
      "BLOCK_N": 16,
      "BLOCK_K": 256,
      "BLOCK_C": 64,
      "NUM_KSPLIT": 2,
      "num_warps": 8,
      "num_stages": 1,
      "waves_per_eu": 2
    },
    "130": {
      "BLOCK_M": 32,
      "BLOCK_N": 16,
      "BLOCK_K": 32,
      "BLOCK_C": 32,
      "NUM_KSPLIT": 8,
      "num_warps": 2,
      "num_stages": 2,
      "waves_per_eu": 1
    },
    "1626": {
      "BLOCK_M": 64,
      "BLOCK_N": 16,
      "BLOCK_K": 32,
      "BLOCK_C": 64,
      "NUM_KSPLIT": 4,
      "num_warps": 4,
      "num_stages": 1,
      "waves_per_eu": 0
    },
    "1056": {
      "BLOCK_M": 32,
      "BLOCK_N": 16,
      "BLOCK_K": 128,
      "BLOCK_C": 256,
      "NUM_KSPLIT": 4,
      "num_warps": 8,
      "num_stages": 1,
      "waves_per_eu": 0
    },
    "4125": {
      "BLOCK_M": 128,
      "BLOCK_N": 16,
      "BLOCK_K": 256,
      "BLOCK_C": 64,
      "NUM_KSPLIT": 2,
      "num_warps": 2,
      "num_stages": 2,
      "waves_per_eu": 0
    },
    "5249": {
      "BLOCK_M": 256,
      "BLOCK_N": 16,
      "BLOCK_K": 128,
      "BLOCK_C": 64,
      "NUM_KSPLIT": 8,
      "num_warps": 4,
      "num_stages": 2,
      "waves_per_eu": 2
    },
    "5535": {
      "BLOCK_M": 256,
      "BLOCK_N": 16,
      "BLOCK_K": 256,
      "BLOCK_C": 32,
      "NUM_KSPLIT": 8,
      "num_warps": 4,
      "num_stages": 2,
      "waves_per_eu": 0
    },
    "3541": {
      "BLOCK_M": 128,
      "BLOCK_N": 16,
      "BLOCK_K": 64,
      "BLOCK_C": 256,
      "NUM_KSPLIT": 1,
      "num_warps": 8,
      "num_stages": 1,
      "waves_per_eu": 1
    },
    "2563": {
      "BLOCK_M": 64,
      "BLOCK_N": 16,
      "BLOCK_K": 256,
      "BLOCK_C": 16,
      "NUM_KSPLIT": 4,
      "num_warps": 4,
      "num_stages": 1,
      "waves_per_eu": 1
    },
    "4016": {
      "BLOCK_M": 128,
      "BLOCK_N": 16,
      "BLOCK_K": 256,
      "BLOCK_C": 16,
      "NUM_KSPLIT": 8,
      "num_warps": 2,
      "num_stages": 1,
      "waves_per_eu": 2
    },
    "4221": {
      "BLOCK_M": 128,
      "BLOCK_N": 16,
      "BLOCK_K": 256,
      "BLOCK_C": 128,
      "NUM_KSPLIT": 4,
      "num_warps": 4,
      "num_stages": 2,
      "waves_per_eu": 0
    },
    "5095": {
      "BLOCK_M": 256,
      "BLOCK_N": 16,
      "BLOCK_K": 128,
      "BLOCK_C": 16,
      "NUM_KSPLIT": 8,
      "num_warps": 2,
      "num_stages": 1,
      "waves_per_eu": 1
    },
    "785": {
      "BLOCK_M": 32,
      "BLOCK_N": 16,
      "BLOCK_K": 128,
      "BLOCK_C": 16,
      "NUM_KSPLIT": 8,
      "num_warps": 4,
      "num_stages": 2,
      "waves_per_eu": 2
    },
    "1384": {
      "BLOCK_M": 32,
      "BLOCK_N": 16,
      "BLOCK_K": 256,
      "BLOCK_C": 256,
      "NUM_KSPLIT": 1,
      "num_warps": 8,
      "num_stages": 2,
      "waves_per_eu": 1
    },
    "4730": {
      "BLOCK_M": 256,
      "BLOCK_N": 16,
      "BLOCK_K": 64,
      "BLOCK_C": 16,
      "NUM_KSPLIT": 4,
      "num_warps": 8,
      "num_stages": 1,
      "waves_per_eu": 2
    },
    "1529": {
      "BLOCK_M": 64,
      "BLOCK_N": 16,
      "BLOCK_K": 32,
      "BLOCK_C": 32,
      "NUM_KSPLIT": 1,
      "num_warps": 8,
      "num_stages": 2,
      "waves_per_eu": 2
    },
    "5419": {
      "BLOCK_M": 256,
      "BLOCK_N": 16,
      "BLOCK_K": 256,
      "BLOCK_C": 16,
      "NUM_KSPLIT": 2,
      "num_warps": 2,
      "num_stages": 1,
      "waves_per_eu": 1
    },
    "204": {
      "BLOCK_M": 32,
      "BLOCK_N": 16,
      "BLOCK_K": 32,
      "BLOCK_C": 64,
      "NUM_KSPLIT": 8,
      "num_warps": 4,
      "num_stages": 1,
      "waves_per_eu": 0
    },
    "4194": {
      "BLOCK_M": 128,
      "BLOCK_N": 16,
      "BLOCK_K": 256,
      "BLOCK_C": 128,
      "NUM_KSPLIT": 2,
      "num_warps": 2,
      "num_stages": 1,
      "waves_per_eu": 0
    },
    "5397": {
      "BLOCK_M": 256,
      "BLOCK_N": 16,
      "BLOCK_K": 128,
      "BLOCK_C": 256,
      "NUM_KSPLIT": 8,
      "num_warps": 8,
      "num_stages": 2,
      "waves_per_eu": 0
    },
    "4032": {
      "BLOCK_M": 128,
      "BLOCK_N": 16,
      "BLOCK_K": 256,
      "BLOCK_C": 32,
      "NUM_KSPLIT": 1,
      "num_warps": 2,
      "num_stages": 1,
      "waves_per_eu": 0
    },
    "3907": {
      "BLOCK_M": 128,
      "BLOCK_N": 16,
      "BLOCK_K": 128,
      "BLOCK_C": 256,
      "NUM_KSPLIT": 2,
      "num_warps": 2,
      "num_stages": 1,
      "waves_per_eu": 1
    },
    "2694": {
      "BLOCK_M": 64,
      "BLOCK_N": 16,
      "BLOCK_K": 256,
      "BLOCK_C": 64,
      "NUM_KSPLIT": 2,
      "num_warps": 8,
      "num_stages": 1,
      "waves_per_eu": 0
    },
    "426": {
      "BLOCK_M": 32,
      "BLOCK_N": 16,
      "BLOCK_K": 64,
      "BLOCK_C": 16,
      "NUM_KSPLIT": 8,
      "num_warps": 8,
      "num_stages": 1,
      "waves_per_eu": 0
    },
    "342": {
      "BLOCK_M": 32,
      "BLOCK_N": 16,
      "BLOCK_K": 32,
      "BLOCK_C": 256,
      "NUM_KSPLIT": 8,
      "num_warps": 2,
      "num_stages": 1,
      "waves_per_eu": 0
    },
    "4862": {
      "BLOCK_M": 256,
      "BLOCK_N": 16,
      "BLOCK_K": 64,
      "BLOCK_C": 64,
      "NUM_KSPLIT": 4,
      "num_warps": 2,
      "num_stages": 1,
      "waves_per_eu": 2
    },
    "4800": {
      "BLOCK_M": 256,
      "BLOCK_N": 16,
      "BLOCK_K": 64,
      "BLOCK_C": 32,
      "NUM_KSPLIT": 4,
      "num_warps": 8,
      "num_stages": 1,
      "waves_per_eu": 0
    },
    "5109": {
      "BLOCK_M": 256,
      "BLOCK_N": 16,
      "BLOCK_K": 128,
      "BLOCK_C": 16,
      "NUM_KSPLIT": 8,
      "num_warps": 8,
      "num_stages": 2,
      "waves_per_eu": 0
    },
    "625": {
      "BLOCK_M": 32,
      "BLOCK_N": 16,
      "BLOCK_K": 64,
      "BLOCK_C": 128,
      "NUM_KSPLIT": 4,
      "num_warps": 8,
      "num_stages": 1,
      "waves_per_eu": 1
    },
    "428": {
      "BLOCK_M": 32,
      "BLOCK_N": 16,
      "BLOCK_K": 64,
      "BLOCK_C": 16,
      "NUM_KSPLIT": 8,
      "num_warps": 8,
      "num_stages": 1,
      "waves_per_eu": 2
    },
    "3065": {
      "BLOCK_M": 128,
      "BLOCK_N": 16,
      "BLOCK_K": 32,
      "BLOCK_C": 64,
      "NUM_KSPLIT": 4,
      "num_warps": 2,
      "num_stages": 2,
      "waves_per_eu": 2
    },
    "834": {
      "BLOCK_M": 32,
      "BLOCK_N": 16,
      "BLOCK_K": 128,
      "BLOCK_C": 32,
      "NUM_KSPLIT": 4,
      "num_warps": 4,
      "num_stages": 1,
      "waves_per_eu": 0
    },
    "672": {
      "BLOCK_M": 32,
      "BLOCK_N": 16,
      "BLOCK_K": 64,
      "BLOCK_C": 256,
      "NUM_KSPLIT": 2,
      "num_warps": 4,
      "num_stages": 1,
      "waves_per_eu": 0
    },
    "763": {
      "BLOCK_M": 32,
      "BLOCK_N": 16,
      "BLOCK_K": 128,
      "BLOCK_C": 16,
      "NUM_KSPLIT": 4,
      "num_warps": 4,
      "num_stages": 1,
      "waves_per_eu": 1
    },
    "4940": {
      "BLOCK_M": 256,
      "BLOCK_N": 16,
      "BLOCK_K": 64,
      "BLOCK_C": 128,
      "NUM_KSPLIT": 4,
      "num_warps": 4,
      "num_stages": 1,
      "waves_per_eu": 2
    },
    "281": {
      "BLOCK_M": 32,
      "BLOCK_N": 16,
      "BLOCK_K": 32,
      "BLOCK_C": 128,
      "NUM_KSPLIT": 8,
      "num_warps": 4,
      "num_stages": 2,
      "waves_per_eu": 2
    },
    "1452": {
      "BLOCK_M": 64,
      "BLOCK_N": 16,
      "BLOCK_K": 32,
      "BLOCK_C": 16,
      "NUM_KSPLIT": 1,
      "num_warps": 8,
      "num_stages": 1,
      "waves_per_eu": 0
    },
    "1280": {
      "BLOCK_M": 32,
      "BLOCK_N": 16,
      "BLOCK_K": 256,
      "BLOCK_C": 64,
      "NUM_KSPLIT": 8,
      "num_warps": 2,
      "num_stages": 1,
      "waves_per_eu": 2
    },
    "282": {
      "BLOCK_M": 32,
      "BLOCK_N": 16,
      "BLOCK_K": 32,
      "BLOCK_C": 128,
      "NUM_KSPLIT": 8,
      "num_warps": 8,
      "num_stages": 1,
      "waves_per_eu": 0
    },
    "791": {
      "BLOCK_M": 32,
      "BLOCK_N": 16,
      "BLOCK_K": 128,
      "BLOCK_C": 16,
      "NUM_KSPLIT": 8,
      "num_warps": 8,
      "num_stages": 2,
      "waves_per_eu": 2
    },
    "4557": {
      "BLOCK_M": 256,
      "BLOCK_N": 16,
      "BLOCK_K": 32,
      "BLOCK_C": 128,
      "NUM_KSPLIT": 2,
      "num_warps": 2,
      "num_stages": 2,
      "waves_per_eu": 0
    },
    "3887": {
      "BLOCK_M": 128,
      "BLOCK_N": 16,
      "BLOCK_K": 128,
      "BLOCK_C": 128,
      "NUM_KSPLIT": 8,
      "num_warps": 8,
      "num_stages": 2,
      "waves_per_eu": 2
    },
    "978": {
      "BLOCK_M": 32,
      "BLOCK_N": 16,
      "BLOCK_K": 128,
      "BLOCK_C": 128,
      "NUM_KSPLIT": 4,
      "num_warps": 4,
      "num_stages": 1,
      "waves_per_eu": 0
    },
    "1896": {
      "BLOCK_M": 64,
      "BLOCK_N": 16,
      "BLOCK_K": 64,
      "BLOCK_C": 32,
      "NUM_KSPLIT": 2,
      "num_warps": 4,
      "num_stages": 1,
      "waves_per_eu": 0
    },
    "1888": {
      "BLOCK_M": 64,
      "BLOCK_N": 16,
      "BLOCK_K": 64,
      "BLOCK_C": 32,
      "NUM_KSPLIT": 1,
      "num_warps": 8,
      "num_stages": 2,
      "waves_per_eu": 1
    },
    "1535": {
      "BLOCK_M": 64,
      "BLOCK_N": 16,
      "BLOCK_K": 32,
      "BLOCK_C": 32,
      "NUM_KSPLIT": 2,
      "num_warps": 2,
      "num_stages": 2,
      "waves_per_eu": 2
    },
    "5041": {
      "BLOCK_M": 256,
      "BLOCK_N": 16,
      "BLOCK_K": 128,
      "BLOCK_C": 16,
      "NUM_KSPLIT": 1,
      "num_warps": 2,
      "num_stages": 1,
      "waves_per_eu": 1
    },
    "357": {
      "BLOCK_M": 32,
      "BLOCK_N": 16,
      "BLOCK_K": 32,
      "BLOCK_C": 256,
      "NUM_KSPLIT": 8,
      "num_warps": 8,
      "num_stages": 2,
      "waves_per_eu": 0
    },
    "4988": {
      "BLOCK_M": 256,
      "BLOCK_N": 16,
      "BLOCK_K": 64,
      "BLOCK_C": 256,
      "NUM_KSPLIT": 2,
      "num_warps": 2,
      "num_stages": 1,
      "waves_per_eu": 2
    },
    "4299": {
      "BLOCK_M": 128,
      "BLOCK_N": 16,
      "BLOCK_K": 256,
      "BLOCK_C": 256,
      "NUM_KSPLIT": 4,
      "num_warps": 8,
      "num_stages": 2,
      "waves_per_eu": 0
    },
    "4425": {
      "BLOCK_M": 256,
      "BLOCK_N": 16,
      "BLOCK_K": 32,
      "BLOCK_C": 32,
      "NUM_KSPLIT": 2,
      "num_warps": 8,
      "num_stages": 2,
      "waves_per_eu": 0
    },
    "557": {
      "BLOCK_M": 32,
      "BLOCK_N": 16,
      "BLOCK_K": 64,
      "BLOCK_C": 64,
      "NUM_KSPLIT": 4,
      "num_warps": 8,
      "num_stages": 2,
      "waves_per_eu": 2
    },
    "3153": {
      "BLOCK_M": 128,
      "BLOCK_N": 16,
      "BLOCK_K": 32,
      "BLOCK_C": 128,
      "NUM_KSPLIT": 8,
      "num_warps": 2,
      "num_stages": 2,
      "waves_per_eu": 0
    },
    "3734": {
      "BLOCK_M": 128,
      "BLOCK_N": 16,
      "BLOCK_K": 128,
      "BLOCK_C": 32,
      "NUM_KSPLIT": 8,
      "num_warps": 4,
      "num_stages": 1,
      "waves_per_eu": 2
    },
    "3863": {
      "BLOCK_M": 128,
      "BLOCK_N": 16,
      "BLOCK_K": 128,
      "BLOCK_C": 128,
      "NUM_KSPLIT": 4,
      "num_warps": 4,
      "num_stages": 2,
      "waves_per_eu": 2
    },
    "2146": {
      "BLOCK_M": 64,
      "BLOCK_N": 16,
      "BLOCK_K": 64,
      "BLOCK_C": 256,
      "NUM_KSPLIT": 8,
      "num_warps": 2,
      "num_stages": 2,
      "waves_per_eu": 1
    },
    "4105": {
      "BLOCK_M": 128,
      "BLOCK_N": 16,
      "BLOCK_K": 256,
      "BLOCK_C": 64,
      "NUM_KSPLIT": 1,
      "num_warps": 2,
      "num_stages": 1,
      "waves_per_eu": 1
    },
    "126": {
      "BLOCK_M": 32,
      "BLOCK_N": 16,
      "BLOCK_K": 32,
      "BLOCK_C": 32,
      "NUM_KSPLIT": 8,
      "num_warps": 2,
      "num_stages": 1,
      "waves_per_eu": 0
    },
    "5482": {
      "BLOCK_M": 256,
      "BLOCK_N": 16,
      "BLOCK_K": 256,
      "BLOCK_C": 32,
      "NUM_KSPLIT": 1,
      "num_warps": 4,
      "num_stages": 2,
      "waves_per_eu": 1
    },
    "1227": {
      "BLOCK_M": 32,
      "BLOCK_N": 16,
      "BLOCK_K": 256,
      "BLOCK_C": 64,
      "NUM_KSPLIT": 1,
      "num_warps": 2,
      "num_stages": 2,
      "waves_per_eu": 0
    },
    "5314": {
      "BLOCK_M": 256,
      "BLOCK_N": 16,
      "BLOCK_K": 128,
      "BLOCK_C": 128,
      "NUM_KSPLIT": 8,
      "num_warps": 2,
      "num_stages": 2,
      "waves_per_eu": 1
    },
    "376": {
      "BLOCK_M": 32,
      "BLOCK_N": 16,
      "BLOCK_K": 64,
      "BLOCK_C": 16,
      "NUM_KSPLIT": 1,
      "num_warps": 8,
      "num_stages": 2,
      "waves_per_eu": 1
    },
    "3553": {
      "BLOCK_M": 128,
      "BLOCK_N": 16,
      "BLOCK_K": 64,
      "BLOCK_C": 256,
      "NUM_KSPLIT": 2,
      "num_warps": 4,
      "num_stages": 1,
      "waves_per_eu": 1
    },
    "2131": {
      "BLOCK_M": 64,
      "BLOCK_N": 16,
      "BLOCK_K": 64,
      "BLOCK_C": 256,
      "NUM_KSPLIT": 4,
      "num_warps": 4,
      "num_stages": 1,
      "waves_per_eu": 1
    },
    "5379": {
      "BLOCK_M": 256,
      "BLOCK_N": 16,
      "BLOCK_K": 128,
      "BLOCK_C": 256,
      "NUM_KSPLIT": 4,
      "num_warps": 8,
      "num_stages": 2,
      "waves_per_eu": 0
    },
    "3206": {
      "BLOCK_M": 128,
      "BLOCK_N": 16,
      "BLOCK_K": 32,
      "BLOCK_C": 256,
      "NUM_KSPLIT": 4,
      "num_warps": 2,
      "num_stages": 1,
      "waves_per_eu": 2
    },
    "3511": {
      "BLOCK_M": 128,
      "BLOCK_N": 16,
      "BLOCK_K": 64,
      "BLOCK_C": 128,
      "NUM_KSPLIT": 8,
      "num_warps": 2,
      "num_stages": 1,
      "waves_per_eu": 1
    },
    "967": {
      "BLOCK_M": 32,
      "BLOCK_N": 16,
      "BLOCK_K": 128,
      "BLOCK_C": 128,
      "NUM_KSPLIT": 2,
      "num_warps": 8,
      "num_stages": 1,
      "waves_per_eu": 1
    },
    "2634": {
      "BLOCK_M": 64,
      "BLOCK_N": 16,
      "BLOCK_K": 256,
      "BLOCK_C": 32,
      "NUM_KSPLIT": 4,
      "num_warps": 4,
      "num_stages": 1,
      "waves_per_eu": 0
    },
    "2796": {
      "BLOCK_M": 64,
      "BLOCK_N": 16,
      "BLOCK_K": 256,
      "BLOCK_C": 128,
      "NUM_KSPLIT": 8,
      "num_warps": 4,
      "num_stages": 1,
      "waves_per_eu": 0
    },
    "4728": {
      "BLOCK_M": 256,
      "BLOCK_N": 16,
      "BLOCK_K": 64,
      "BLOCK_C": 16,
      "NUM_KSPLIT": 4,
      "num_warps": 8,
      "num_stages": 1,
      "waves_per_eu": 0
    },
    "1868": {
      "BLOCK_M": 64,
      "BLOCK_N": 16,
      "BLOCK_K": 64,
      "BLOCK_C": 16,
      "NUM_KSPLIT": 8,
      "num_warps": 8,
      "num_stages": 1,
      "waves_per_eu": 2
    },
    "3560": {
      "BLOCK_M": 128,
      "BLOCK_N": 16,
      "BLOCK_K": 64,
      "BLOCK_C": 256,
      "NUM_KSPLIT": 2,
      "num_warps": 8,
      "num_stages": 1,
      "waves_per_eu": 2
    },
    "1690": {
      "BLOCK_M": 64,
      "BLOCK_N": 16,
      "BLOCK_K": 32,
      "BLOCK_C": 128,
      "NUM_KSPLIT": 2,
      "num_warps": 8,
      "num_stages": 2,
      "waves_per_eu": 1
    },
    "1164": {
      "BLOCK_M": 32,
      "BLOCK_N": 16,
      "BLOCK_K": 256,
      "BLOCK_C": 32,
      "NUM_KSPLIT": 1,
      "num_warps": 8,
      "num_stages": 1,
      "waves_per_eu": 0
    },
    "866": {
      "BLOCK_M": 32,
      "BLOCK_N": 16,
      "BLOCK_K": 128,
      "BLOCK_C": 64,
      "NUM_KSPLIT": 1,
      "num_warps": 2,
      "num_stages": 1,
      "waves_per_eu": 2
    },
    "3308": {
      "BLOCK_M": 128,
      "BLOCK_N": 16,
      "BLOCK_K": 64,
      "BLOCK_C": 16,
      "NUM_KSPLIT": 8,
      "num_warps": 8,
      "num_stages": 1,
      "waves_per_eu": 2
    },
    "5457": {
      "BLOCK_M": 256,
      "BLOCK_N": 16,
      "BLOCK_K": 256,
      "BLOCK_C": 16,
      "NUM_KSPLIT": 8,
      "num_warps": 2,
      "num_stages": 2,
      "waves_per_eu": 0
    },
    "5285": {
      "BLOCK_M": 256,
      "BLOCK_N": 16,
      "BLOCK_K": 128,
      "BLOCK_C": 128,
      "NUM_KSPLIT": 2,
      "num_warps": 4,
      "num_stages": 2,
      "waves_per_eu": 2
    },
    "4091": {
      "BLOCK_M": 128,
      "BLOCK_N": 16,
      "BLOCK_K": 256,
      "BLOCK_C": 32,
      "NUM_KSPLIT": 8,
      "num_warps": 2,
      "num_stages": 2,
      "waves_per_eu": 2
    },
    "411": {
      "BLOCK_M": 32,
      "BLOCK_N": 16,
      "BLOCK_K": 64,
      "BLOCK_C": 16,
      "NUM_KSPLIT": 4,
      "num_warps": 8,
      "num_stages": 2,
      "waves_per_eu": 0
    },
    "1165": {
      "BLOCK_M": 32,
      "BLOCK_N": 16,
      "BLOCK_K": 256,
      "BLOCK_C": 32,
      "NUM_KSPLIT": 1,
      "num_warps": 8,
      "num_stages": 1,
      "waves_per_eu": 1
    },
    "1925": {
      "BLOCK_M": 64,
      "BLOCK_N": 16,
      "BLOCK_K": 64,
      "BLOCK_C": 32,
      "NUM_KSPLIT": 4,
      "num_warps": 8,
      "num_stages": 2,
      "waves_per_eu": 2
    },
    "5563": {
      "BLOCK_M": 256,
      "BLOCK_N": 16,
      "BLOCK_K": 256,
      "BLOCK_C": 64,
      "NUM_KSPLIT": 2,
      "num_warps": 2,
      "num_stages": 1,
      "waves_per_eu": 1
    },
    "4690": {
      "BLOCK_M": 256,
      "BLOCK_N": 16,
      "BLOCK_K": 64,
      "BLOCK_C": 16,
      "NUM_KSPLIT": 1,
      "num_warps": 4,
      "num_stages": 2,
      "waves_per_eu": 1
    },
    "4043": {
      "BLOCK_M": 128,
      "BLOCK_N": 16,
      "BLOCK_K": 256,
      "BLOCK_C": 32,
      "NUM_KSPLIT": 1,
      "num_warps": 4,
      "num_stages": 2,
      "waves_per_eu": 2
    },
    "1376": {
      "BLOCK_M": 32,
      "BLOCK_N": 16,
      "BLOCK_K": 256,
      "BLOCK_C": 256,
      "NUM_KSPLIT": 1,
      "num_warps": 4,
      "num_stages": 1,
      "waves_per_eu": 2
    },
    "3977": {
      "BLOCK_M": 128,
      "BLOCK_N": 16,
      "BLOCK_K": 256,
      "BLOCK_C": 16,
      "NUM_KSPLIT": 1,
      "num_warps": 8,
      "num_stages": 2,
      "waves_per_eu": 2
    },
    "253": {
      "BLOCK_M": 32,
      "BLOCK_N": 16,
      "BLOCK_K": 32,
      "BLOCK_C": 128,
      "NUM_KSPLIT": 4,
      "num_warps": 2,
      "num_stages": 1,
      "waves_per_eu": 1
    },
    "3053": {
      "BLOCK_M": 128,
      "BLOCK_N": 16,
      "BLOCK_K": 32,
      "BLOCK_C": 64,
      "NUM_KSPLIT": 2,
      "num_warps": 4,
      "num_stages": 2,
      "waves_per_eu": 2
    },
    "1918": {
      "BLOCK_M": 64,
      "BLOCK_N": 16,
      "BLOCK_K": 64,
      "BLOCK_C": 32,
      "NUM_KSPLIT": 4,
      "num_warps": 4,
      "num_stages": 2,
      "waves_per_eu": 1
    },
    "3939": {
      "BLOCK_M": 128,
      "BLOCK_N": 16,
      "BLOCK_K": 128,
      "BLOCK_C": 256,
      "NUM_KSPLIT": 4,
      "num_warps": 8,
      "num_stages": 2,
      "waves_per_eu": 0
    },
    "3982": {
      "BLOCK_M": 128,
      "BLOCK_N": 16,
      "BLOCK_K": 256,
      "BLOCK_C": 16,
      "NUM_KSPLIT": 2,
      "num_warps": 2,
      "num_stages": 2,
      "waves_per_eu": 1
    },
    "5719": {
      "BLOCK_M": 256,
      "BLOCK_N": 16,
      "BLOCK_K": 256,
      "BLOCK_C": 256,
      "NUM_KSPLIT": 2,
      "num_warps": 8,
      "num_stages": 1,
      "waves_per_eu": 1
    },
    "4073": {
      "BLOCK_M": 128,
      "BLOCK_N": 16,
      "BLOCK_K": 256,
      "BLOCK_C": 32,
      "NUM_KSPLIT": 4,
      "num_warps": 2,
      "num_stages": 2,
      "waves_per_eu": 2
    },
    "2021": {
      "BLOCK_M": 64,
      "BLOCK_N": 16,
      "BLOCK_K": 64,
      "BLOCK_C": 128,
      "NUM_KSPLIT": 1,
      "num_warps": 2,
      "num_stages": 2,
      "waves_per_eu": 2
    },
    "1076": {
      "BLOCK_M": 32,
      "BLOCK_N": 16,
      "BLOCK_K": 128,
      "BLOCK_C": 256,
      "NUM_KSPLIT": 8,
      "num_warps": 8,
      "num_stages": 1,
      "waves_per_eu": 2
    },
    "5058": {
      "BLOCK_M": 256,
      "BLOCK_N": 16,
      "BLOCK_K": 128,
      "BLOCK_C": 16,
      "NUM_KSPLIT": 2,
      "num_warps": 2,
      "num_stages": 1,
      "waves_per_eu": 0
    },
    "1347": {
      "BLOCK_M": 32,
      "BLOCK_N": 16,
      "BLOCK_K": 256,
      "BLOCK_C": 128,
      "NUM_KSPLIT": 4,
      "num_warps": 8,
      "num_stages": 2,
      "waves_per_eu": 0
    },
    "1225": {
      "BLOCK_M": 32,
      "BLOCK_N": 16,
      "BLOCK_K": 256,
      "BLOCK_C": 64,
      "NUM_KSPLIT": 1,
      "num_warps": 2,
      "num_stages": 1,
      "waves_per_eu": 1
    },
    "138": {
      "BLOCK_M": 32,
      "BLOCK_N": 16,
      "BLOCK_K": 32,
      "BLOCK_C": 32,
      "NUM_KSPLIT": 8,
      "num_warps": 8,
      "num_stages": 1,
      "waves_per_eu": 0
    },
    "1191": {
      "BLOCK_M": 32,
      "BLOCK_N": 16,
      "BLOCK_K": 256,
      "BLOCK_C": 32,
      "NUM_KSPLIT": 4,
      "num_warps": 2,
      "num_stages": 2,
      "waves_per_eu": 0
    },
    "4504": {
      "BLOCK_M": 256,
      "BLOCK_N": 16,
      "BLOCK_K": 32,
      "BLOCK_C": 64,
      "NUM_KSPLIT": 4,
      "num_warps": 2,
      "num_stages": 2,
      "waves_per_eu": 1
    },
    "2306": {
      "BLOCK_M": 64,
      "BLOCK_N": 16,
      "BLOCK_K": 128,
      "BLOCK_C": 64,
      "NUM_KSPLIT": 1,
      "num_warps": 2,
      "num_stages": 1,
      "waves_per_eu": 2
    },
    "839": {
      "BLOCK_M": 32,
      "BLOCK_N": 16,
      "BLOCK_K": 128,
      "BLOCK_C": 32,
      "NUM_KSPLIT": 4,
      "num_warps": 4,
      "num_stages": 2,
      "waves_per_eu": 2
    },
    "1620": {
      "BLOCK_M": 64,
      "BLOCK_N": 16,
      "BLOCK_K": 32,
      "BLOCK_C": 64,
      "NUM_KSPLIT": 4,
      "num_warps": 2,
      "num_stages": 1,
      "waves_per_eu": 0
    },
    "4014": {
      "BLOCK_M": 128,
      "BLOCK_N": 16,
      "BLOCK_K": 256,
      "BLOCK_C": 16,
      "NUM_KSPLIT": 8,
      "num_warps": 2,
      "num_stages": 1,
      "waves_per_eu": 0
    },
    "3407": {
      "BLOCK_M": 128,
      "BLOCK_N": 16,
      "BLOCK_K": 64,
      "BLOCK_C": 64,
      "NUM_KSPLIT": 2,
      "num_warps": 2,
      "num_stages": 2,
      "waves_per_eu": 2
    },
    "3330": {
      "BLOCK_M": 128,
      "BLOCK_N": 16,
      "BLOCK_K": 64,
      "BLOCK_C": 32,
      "NUM_KSPLIT": 2,
      "num_warps": 2,
      "num_stages": 1,
      "waves_per_eu": 0
    },
    "4891": {
      "BLOCK_M": 256,
      "BLOCK_N": 16,
      "BLOCK_K": 64,
      "BLOCK_C": 64,
      "NUM_KSPLIT": 8,
      "num_warps": 8,
      "num_stages": 1,
      "waves_per_eu": 1
    },
    "3773": {
      "BLOCK_M": 128,
      "BLOCK_N": 16,
      "BLOCK_K": 128,
      "BLOCK_C": 64,
      "NUM_KSPLIT": 2,
      "num_warps": 4,
      "num_stages": 2,
      "waves_per_eu": 2
    },
    "5266": {
      "BLOCK_M": 256,
      "BLOCK_N": 16,
      "BLOCK_K": 128,
      "BLOCK_C": 128,
      "NUM_KSPLIT": 1,
      "num_warps": 4,
      "num_stages": 2,
      "waves_per_eu": 1
    },
    "4429": {
      "BLOCK_M": 256,
      "BLOCK_N": 16,
      "BLOCK_K": 32,
      "BLOCK_C": 32,
      "NUM_KSPLIT": 4,
      "num_warps": 2,
      "num_stages": 1,
      "waves_per_eu": 1
    },
    "3819": {
      "BLOCK_M": 128,
      "BLOCK_N": 16,
      "BLOCK_K": 128,
      "BLOCK_C": 128,
      "NUM_KSPLIT": 1,
      "num_warps": 2,
      "num_stages": 2,
      "waves_per_eu": 0
    },
    "535": {
      "BLOCK_M": 32,
      "BLOCK_N": 16,
      "BLOCK_K": 64,
      "BLOCK_C": 64,
      "NUM_KSPLIT": 2,
      "num_warps": 8,
      "num_stages": 1,
      "waves_per_eu": 1
    },
    "1862": {
      "BLOCK_M": 64,
      "BLOCK_N": 16,
      "BLOCK_K": 64,
      "BLOCK_C": 16,
      "NUM_KSPLIT": 8,
      "num_warps": 4,
      "num_stages": 1,
      "waves_per_eu": 2
    },
    "4154": {
      "BLOCK_M": 128,
      "BLOCK_N": 16,
      "BLOCK_K": 256,
      "BLOCK_C": 64,
      "NUM_KSPLIT": 4,
      "num_warps": 8,
      "num_stages": 1,
      "waves_per_eu": 2
    },
    "4595": {
      "BLOCK_M": 256,
      "BLOCK_N": 16,
      "BLOCK_K": 32,
      "BLOCK_C": 128,
      "NUM_KSPLIT": 8,
      "num_warps": 2,
      "num_stages": 2,
      "waves_per_eu": 2
    },
    "3603": {
      "BLOCK_M": 128,
      "BLOCK_N": 16,
      "BLOCK_K": 128,
      "BLOCK_C": 16,
      "NUM_KSPLIT": 1,
      "num_warps": 2,
      "num_stages": 2,
      "waves_per_eu": 0
    },
    "1540": {
      "BLOCK_M": 64,
      "BLOCK_N": 16,
      "BLOCK_K": 32,
      "BLOCK_C": 32,
      "NUM_KSPLIT": 2,
      "num_warps": 4,
      "num_stages": 2,
      "waves_per_eu": 1
    },
    "4739": {
      "BLOCK_M": 256,
      "BLOCK_N": 16,
      "BLOCK_K": 64,
      "BLOCK_C": 16,
      "NUM_KSPLIT": 8,
      "num_warps": 2,
      "num_stages": 2,
      "waves_per_eu": 2
    },
    "5342": {
      "BLOCK_M": 256,
      "BLOCK_N": 16,
      "BLOCK_K": 128,
      "BLOCK_C": 256,
      "NUM_KSPLIT": 1,
      "num_warps": 8,
      "num_stages": 1,
      "waves_per_eu": 2
    },
    "4806": {
      "BLOCK_M": 256,
      "BLOCK_N": 16,
      "BLOCK_K": 64,
      "BLOCK_C": 32,
      "NUM_KSPLIT": 8,
      "num_warps": 2,
      "num_stages": 1,
      "waves_per_eu": 0
    },
    "2765": {
      "BLOCK_M": 64,
      "BLOCK_N": 16,
      "BLOCK_K": 256,
      "BLOCK_C": 128,
      "NUM_KSPLIT": 2,
      "num_warps": 4,
      "num_stages": 2,
      "waves_per_eu": 2
    },
    "2949": {
      "BLOCK_M": 128,
      "BLOCK_N": 16,
      "BLOCK_K": 32,
      "BLOCK_C": 16,
      "NUM_KSPLIT": 8,
      "num_warps": 8,
      "num_stages": 2,
      "waves_per_eu": 0
    },
    "2674": {
      "BLOCK_M": 64,
      "BLOCK_N": 16,
      "BLOCK_K": 256,
      "BLOCK_C": 64,
      "NUM_KSPLIT": 1,
      "num_warps": 4,
      "num_stages": 2,
      "waves_per_eu": 1
    },
    "424": {
      "BLOCK_M": 32,
      "BLOCK_N": 16,
      "BLOCK_K": 64,
      "BLOCK_C": 16,
      "NUM_KSPLIT": 8,
      "num_warps": 4,
      "num_stages": 2,
      "waves_per_eu": 1
    },
    "1852": {
      "BLOCK_M": 64,
      "BLOCK_N": 16,
      "BLOCK_K": 64,
      "BLOCK_C": 16,
      "NUM_KSPLIT": 4,
      "num_warps": 8,
      "num_stages": 2,
      "waves_per_eu": 1
    },
    "630": {
      "BLOCK_M": 32,
      "BLOCK_N": 16,
      "BLOCK_K": 64,
      "BLOCK_C": 128,
      "NUM_KSPLIT": 8,
      "num_warps": 2,
      "num_stages": 1,
      "waves_per_eu": 0
    },
    "4541": {
      "BLOCK_M": 256,
      "BLOCK_N": 16,
      "BLOCK_K": 32,
      "BLOCK_C": 128,
      "NUM_KSPLIT": 1,
      "num_warps": 2,
      "num_stages": 2,
      "waves_per_eu": 2
    },
    "1826": {
      "BLOCK_M": 64,
      "BLOCK_N": 16,
      "BLOCK_K": 64,
      "BLOCK_C": 16,
      "NUM_KSPLIT": 2,
      "num_warps": 4,
      "num_stages": 1,
      "waves_per_eu": 2
    },
    "1469": {
      "BLOCK_M": 64,
      "BLOCK_N": 16,
      "BLOCK_K": 32,
      "BLOCK_C": 16,
      "NUM_KSPLIT": 2,
      "num_warps": 4,
      "num_stages": 2,
      "waves_per_eu": 2
    },
    "459": {
      "BLOCK_M": 32,
      "BLOCK_N": 16,
      "BLOCK_K": 64,
      "BLOCK_C": 32,
      "NUM_KSPLIT": 2,
      "num_warps": 4,
      "num_stages": 2,
      "waves_per_eu": 0
    },
    "1361": {
      "BLOCK_M": 32,
      "BLOCK_N": 16,
      "BLOCK_K": 256,
      "BLOCK_C": 128,
      "NUM_KSPLIT": 8,
      "num_warps": 4,
      "num_stages": 2,
      "waves_per_eu": 2
    },
    "4910": {
      "BLOCK_M": 256,
      "BLOCK_N": 16,
      "BLOCK_K": 64,
      "BLOCK_C": 128,
      "NUM_KSPLIT": 1,
      "num_warps": 8,
      "num_stages": 1,
      "waves_per_eu": 2
    },
    "3433": {
      "BLOCK_M": 128,
      "BLOCK_N": 16,
      "BLOCK_K": 64,
      "BLOCK_C": 64,
      "NUM_KSPLIT": 4,
      "num_warps": 8,
      "num_stages": 1,
      "waves_per_eu": 1
    },
    "5121": {
      "BLOCK_M": 256,
      "BLOCK_N": 16,
      "BLOCK_K": 128,
      "BLOCK_C": 32,
      "NUM_KSPLIT": 1,
      "num_warps": 4,
      "num_stages": 2,
      "waves_per_eu": 0
    },
    "4300": {
      "BLOCK_M": 128,
      "BLOCK_N": 16,
      "BLOCK_K": 256,
      "BLOCK_C": 256,
      "NUM_KSPLIT": 4,
      "num_warps": 8,
      "num_stages": 2,
      "waves_per_eu": 1
    },
    "5151": {
      "BLOCK_M": 256,
      "BLOCK_N": 16,
      "BLOCK_K": 128,
      "BLOCK_C": 32,
      "NUM_KSPLIT": 4,
      "num_warps": 2,
      "num_stages": 2,
      "waves_per_eu": 0
    },
    "4279": {
      "BLOCK_M": 128,
      "BLOCK_N": 16,
      "BLOCK_K": 256,
      "BLOCK_C": 256,
      "NUM_KSPLIT": 2,
      "num_warps": 8,
      "num_stages": 1,
      "waves_per_eu": 1
    },
    "4351": {
      "BLOCK_M": 256,
      "BLOCK_N": 16,
      "BLOCK_K": 32,
      "BLOCK_C": 16,
      "NUM_KSPLIT": 2,
      "num_warps": 8,
      "num_stages": 1,
      "waves_per_eu": 1
    },
    "5050": {
      "BLOCK_M": 256,
      "BLOCK_N": 16,
      "BLOCK_K": 128,
      "BLOCK_C": 16,
      "NUM_KSPLIT": 1,
      "num_warps": 4,
      "num_stages": 2,
      "waves_per_eu": 1
    },
    "4540": {
      "BLOCK_M": 256,
      "BLOCK_N": 16,
      "BLOCK_K": 32,
      "BLOCK_C": 128,
      "NUM_KSPLIT": 1,
      "num_warps": 2,
      "num_stages": 2,
      "waves_per_eu": 1
    },
    "2729": {
      "BLOCK_M": 64,
      "BLOCK_N": 16,
      "BLOCK_K": 256,
      "BLOCK_C": 64,
      "NUM_KSPLIT": 8,
      "num_warps": 4,
      "num_stages": 2,
      "waves_per_eu": 2
    },
    "2510": {
      "BLOCK_M": 64,
      "BLOCK_N": 16,
      "BLOCK_K": 128,
      "BLOCK_C": 256,
      "NUM_KSPLIT": 8,
      "num_warps": 4,
      "num_stages": 1,
      "waves_per_eu": 2
    },
    "2734": {
      "BLOCK_M": 64,
      "BLOCK_N": 16,
      "BLOCK_K": 256,
      "BLOCK_C": 64,
      "NUM_KSPLIT": 8,
      "num_warps": 8,
      "num_stages": 2,
      "waves_per_eu": 1
    },
    "4824": {
      "BLOCK_M": 256,
      "BLOCK_N": 16,
      "BLOCK_K": 64,
      "BLOCK_C": 64,
      "NUM_KSPLIT": 1,
      "num_warps": 2,
      "num_stages": 1,
      "waves_per_eu": 0
    },
    "1296": {
      "BLOCK_M": 32,
      "BLOCK_N": 16,
      "BLOCK_K": 256,
      "BLOCK_C": 128,
      "NUM_KSPLIT": 1,
      "num_warps": 2,
      "num_stages": 1,
      "waves_per_eu": 0
    },
    "3249": {
      "BLOCK_M": 128,
      "BLOCK_N": 16,
      "BLOCK_K": 64,
      "BLOCK_C": 16,
      "NUM_KSPLIT": 1,
      "num_warps": 4,
      "num_stages": 2,
      "waves_per_eu": 0
    },
    "5503": {
      "BLOCK_M": 256,
      "BLOCK_N": 16,
      "BLOCK_K": 256,
      "BLOCK_C": 32,
      "NUM_KSPLIT": 2,
      "num_warps": 8,
      "num_stages": 1,
      "waves_per_eu": 1
    },
    "4731": {
      "BLOCK_M": 256,
      "BLOCK_N": 16,
      "BLOCK_K": 64,
      "BLOCK_C": 16,
      "NUM_KSPLIT": 4,
      "num_warps": 8,
      "num_stages": 2,
      "waves_per_eu": 0
    },
    "2456": {
      "BLOCK_M": 64,
      "BLOCK_N": 16,
      "BLOCK_K": 128,
      "BLOCK_C": 256,
      "NUM_KSPLIT": 1,
      "num_warps": 4,
      "num_stages": 1,
      "waves_per_eu": 2
    },
    "2395": {
      "BLOCK_M": 64,
      "BLOCK_N": 16,
      "BLOCK_K": 128,
      "BLOCK_C": 128,
      "NUM_KSPLIT": 2,
      "num_warps": 2,
      "num_stages": 1,
      "waves_per_eu": 1
    },
    "4475": {
      "BLOCK_M": 256,
      "BLOCK_N": 16,
      "BLOCK_K": 32,
      "BLOCK_C": 64,
      "NUM_KSPLIT": 1,
      "num_warps": 4,
      "num_stages": 2,
      "waves_per_eu": 2
    },
    "2174": {
      "BLOCK_M": 64,
      "BLOCK_N": 16,
      "BLOCK_K": 128,
      "BLOCK_C": 16,
      "NUM_KSPLIT": 1,
      "num_warps": 8,
      "num_stages": 1,
      "waves_per_eu": 2
    },
    "4646": {
      "BLOCK_M": 256,
      "BLOCK_N": 16,
      "BLOCK_K": 32,
      "BLOCK_C": 256,
      "NUM_KSPLIT": 4,
      "num_warps": 2,
      "num_stages": 1,
      "waves_per_eu": 2
    },
    "2119": {
      "BLOCK_M": 64,
      "BLOCK_N": 16,
      "BLOCK_K": 64,
      "BLOCK_C": 256,
      "NUM_KSPLIT": 2,
      "num_warps": 8,
      "num_stages": 1,
      "waves_per_eu": 1
    },
    "1866": {
      "BLOCK_M": 64,
      "BLOCK_N": 16,
      "BLOCK_K": 64,
      "BLOCK_C": 16,
      "NUM_KSPLIT": 8,
      "num_warps": 8,
      "num_stages": 1,
      "waves_per_eu": 0
    },
    "65": {
      "BLOCK_M": 32,
      "BLOCK_N": 16,
      "BLOCK_K": 32,
      "BLOCK_C": 16,
      "NUM_KSPLIT": 8,
      "num_warps": 4,
      "num_stages": 2,
      "waves_per_eu": 2
    },
    "5390": {
      "BLOCK_M": 256,
      "BLOCK_N": 16,
      "BLOCK_K": 128,
      "BLOCK_C": 256,
      "NUM_KSPLIT": 8,
      "num_warps": 4,
      "num_stages": 1,
      "waves_per_eu": 2
    },
    "4359": {
      "BLOCK_M": 256,
      "BLOCK_N": 16,
      "BLOCK_K": 32,
      "BLOCK_C": 16,
      "NUM_KSPLIT": 4,
      "num_warps": 2,
      "num_stages": 2,
      "waves_per_eu": 0
    },
    "5114": {
      "BLOCK_M": 256,
      "BLOCK_N": 16,
      "BLOCK_K": 128,
      "BLOCK_C": 32,
      "NUM_KSPLIT": 1,
      "num_warps": 2,
      "num_stages": 1,
      "waves_per_eu": 2
    },
    "527": {
      "BLOCK_M": 32,
      "BLOCK_N": 16,
      "BLOCK_K": 64,
      "BLOCK_C": 64,
      "NUM_KSPLIT": 2,
      "num_warps": 2,
      "num_stages": 2,
      "waves_per_eu": 2
    },
    "2548": {
      "BLOCK_M": 64,
      "BLOCK_N": 16,
      "BLOCK_K": 256,
      "BLOCK_C": 16,
      "NUM_KSPLIT": 2,
      "num_warps": 4,
      "num_stages": 2,
      "waves_per_eu": 1
    },
    "2891": {
      "BLOCK_M": 128,
      "BLOCK_N": 16,
      "BLOCK_K": 32,
      "BLOCK_C": 16,
      "NUM_KSPLIT": 1,
      "num_warps": 4,
      "num_stages": 2,
      "waves_per_eu": 2
    },
    "4167": {
      "BLOCK_M": 128,
      "BLOCK_N": 16,
      "BLOCK_K": 256,
      "BLOCK_C": 64,
      "NUM_KSPLIT": 8,
      "num_warps": 4,
      "num_stages": 2,
      "waves_per_eu": 0
    },
    "5490": {
      "BLOCK_M": 256,
      "BLOCK_N": 16,
      "BLOCK_K": 256,
      "BLOCK_C": 32,
      "NUM_KSPLIT": 2,
      "num_warps": 2,
      "num_stages": 1,
      "waves_per_eu": 0
    },
    "301": {
      "BLOCK_M": 32,
      "BLOCK_N": 16,
      "BLOCK_K": 32,
      "BLOCK_C": 256,
      "NUM_KSPLIT": 1,
      "num_warps": 8,
      "num_stages": 1,
      "waves_per_eu": 1
    },
    "1775": {
      "BLOCK_M": 64,
      "BLOCK_N": 16,
      "BLOCK_K": 32,
      "BLOCK_C": 256,
      "NUM_KSPLIT": 4,
      "num_warps": 4,
      "num_stages": 2,
      "waves_per_eu": 2
    },
    "3444": {
      "BLOCK_M": 128,
      "BLOCK_N": 16,
      "BLOCK_K": 64,
      "BLOCK_C": 64,
      "NUM_KSPLIT": 8,
      "num_warps": 4,
      "num_stages": 1,
      "waves_per_eu": 0
    },
    "4710": {
      "BLOCK_M": 256,
      "BLOCK_N": 16,
      "BLOCK_K": 64,
      "BLOCK_C": 16,
      "NUM_KSPLIT": 2,
      "num_warps": 8,
      "num_stages": 1,
      "waves_per_eu": 0
    },
    "1879": {
      "BLOCK_M": 64,
      "BLOCK_N": 16,
      "BLOCK_K": 64,
      "BLOCK_C": 32,
      "NUM_KSPLIT": 1,
      "num_warps": 4,
      "num_stages": 1,
      "waves_per_eu": 1
    },
    "4893": {
      "BLOCK_M": 256,
      "BLOCK_N": 16,
      "BLOCK_K": 64,
      "BLOCK_C": 64,
      "NUM_KSPLIT": 8,
      "num_warps": 8,
      "num_stages": 2,
      "waves_per_eu": 0
    },
    "2428": {
      "BLOCK_M": 64,
      "BLOCK_N": 16,
      "BLOCK_K": 128,
      "BLOCK_C": 128,
      "NUM_KSPLIT": 4,
      "num_warps": 8,
      "num_stages": 2,
      "waves_per_eu": 1
    },
    "4434": {
      "BLOCK_M": 256,
      "BLOCK_N": 16,
      "BLOCK_K": 32,
      "BLOCK_C": 32,
      "NUM_KSPLIT": 4,
      "num_warps": 4,
      "num_stages": 1,
      "waves_per_eu": 0
    },
    "4901": {
      "BLOCK_M": 256,
      "BLOCK_N": 16,
      "BLOCK_K": 64,
      "BLOCK_C": 128,
      "NUM_KSPLIT": 1,
      "num_warps": 2,
      "num_stages": 2,
      "waves_per_eu": 2
    },
    "4802": {
      "BLOCK_M": 256,
      "BLOCK_N": 16,
      "BLOCK_K": 64,
      "BLOCK_C": 32,
      "NUM_KSPLIT": 4,
      "num_warps": 8,
      "num_stages": 1,
      "waves_per_eu": 2
    },
    "1941": {
      "BLOCK_M": 64,
      "BLOCK_N": 16,
      "BLOCK_K": 64,
      "BLOCK_C": 32,
      "NUM_KSPLIT": 8,
      "num_warps": 8,
      "num_stages": 2,
      "waves_per_eu": 0
    },
    "1387": {
      "BLOCK_M": 32,
      "BLOCK_N": 16,
      "BLOCK_K": 256,
      "BLOCK_C": 256,
      "NUM_KSPLIT": 2,
      "num_warps": 2,
      "num_stages": 1,
      "waves_per_eu": 1
    },
    "1890": {
      "BLOCK_M": 64,
      "BLOCK_N": 16,
      "BLOCK_K": 64,
      "BLOCK_C": 32,
      "NUM_KSPLIT": 2,
      "num_warps": 2,
      "num_stages": 1,
      "waves_per_eu": 0
    },
    "1664": {
      "BLOCK_M": 64,
      "BLOCK_N": 16,
      "BLOCK_K": 32,
      "BLOCK_C": 128,
      "NUM_KSPLIT": 1,
      "num_warps": 4,
      "num_stages": 1,
      "waves_per_eu": 2
    },
    "3704": {
      "BLOCK_M": 128,
      "BLOCK_N": 16,
      "BLOCK_K": 128,
      "BLOCK_C": 32,
      "NUM_KSPLIT": 2,
      "num_warps": 8,
      "num_stages": 1,
      "waves_per_eu": 2
    },
    "3380": {
      "BLOCK_M": 128,
      "BLOCK_N": 16,
      "BLOCK_K": 64,
      "BLOCK_C": 32,
      "NUM_KSPLIT": 8,
      "num_warps": 8,
      "num_stages": 1,
      "waves_per_eu": 2
    },
    "4849": {
      "BLOCK_M": 256,
      "BLOCK_N": 16,
      "BLOCK_K": 64,
      "BLOCK_C": 64,
      "NUM_KSPLIT": 2,
      "num_warps": 4,
      "num_stages": 1,
      "waves_per_eu": 1
    },
    "313": {
      "BLOCK_M": 32,
      "BLOCK_N": 16,
      "BLOCK_K": 32,
      "BLOCK_C": 256,
      "NUM_KSPLIT": 2,
      "num_warps": 4,
      "num_stages": 1,
      "waves_per_eu": 1
    },
    "5417": {
      "BLOCK_M": 256,
      "BLOCK_N": 16,
      "BLOCK_K": 256,
      "BLOCK_C": 16,
      "NUM_KSPLIT": 1,
      "num_warps": 8,
      "num_stages": 2,
      "waves_per_eu": 2
    },
    "2878": {
      "BLOCK_M": 64,
      "BLOCK_N": 16,
      "BLOCK_K": 256,
      "BLOCK_C": 256,
      "NUM_KSPLIT": 8,
      "num_warps": 8,
      "num_stages": 2,
      "waves_per_eu": 1
    },
    "3266": {
      "BLOCK_M": 128,
      "BLOCK_N": 16,
      "BLOCK_K": 64,
      "BLOCK_C": 16,
      "NUM_KSPLIT": 2,
      "num_warps": 4,
      "num_stages": 1,
      "waves_per_eu": 2
    },
    "655": {
      "BLOCK_M": 32,
      "BLOCK_N": 16,
      "BLOCK_K": 64,
      "BLOCK_C": 256,
      "NUM_KSPLIT": 1,
      "num_warps": 4,
      "num_stages": 1,
      "waves_per_eu": 1
    },
    "1195": {
      "BLOCK_M": 32,
      "BLOCK_N": 16,
      "BLOCK_K": 256,
      "BLOCK_C": 32,
      "NUM_KSPLIT": 4,
      "num_warps": 4,
      "num_stages": 1,
      "waves_per_eu": 1
    },
    "1622": {
      "BLOCK_M": 64,
      "BLOCK_N": 16,
      "BLOCK_K": 32,
      "BLOCK_C": 64,
      "NUM_KSPLIT": 4,
      "num_warps": 2,
      "num_stages": 1,
      "waves_per_eu": 2
    },
    "3900": {
      "BLOCK_M": 128,
      "BLOCK_N": 16,
      "BLOCK_K": 128,
      "BLOCK_C": 256,
      "NUM_KSPLIT": 1,
      "num_warps": 8,
      "num_stages": 1,
      "waves_per_eu": 0
    },
    "1368": {
      "BLOCK_M": 32,
      "BLOCK_N": 16,
      "BLOCK_K": 256,
      "BLOCK_C": 256,
      "NUM_KSPLIT": 1,
      "num_warps": 2,
      "num_stages": 1,
      "waves_per_eu": 0
    },
    "3703": {
      "BLOCK_M": 128,
      "BLOCK_N": 16,
      "BLOCK_K": 128,
      "BLOCK_C": 32,
      "NUM_KSPLIT": 2,
      "num_warps": 8,
      "num_stages": 1,
      "waves_per_eu": 1
    },
    "1605": {
      "BLOCK_M": 64,
      "BLOCK_N": 16,
      "BLOCK_K": 32,
      "BLOCK_C": 64,
      "NUM_KSPLIT": 2,
      "num_warps": 2,
      "num_stages": 2,
      "waves_per_eu": 0
    },
    "730": {
      "BLOCK_M": 32,
      "BLOCK_N": 16,
      "BLOCK_K": 128,
      "BLOCK_C": 16,
      "NUM_KSPLIT": 1,
      "num_warps": 4,
      "num_stages": 2,
      "waves_per_eu": 1
    },
    "4622": {
      "BLOCK_M": 256,
      "BLOCK_N": 16,
      "BLOCK_K": 32,
      "BLOCK_C": 256,
      "NUM_KSPLIT": 1,
      "num_warps": 8,
      "num_stages": 1,
      "waves_per_eu": 2
    },
    "2241": {
      "BLOCK_M": 64,
      "BLOCK_N": 16,
      "BLOCK_K": 128,
      "BLOCK_C": 32,
      "NUM_KSPLIT": 1,
      "num_warps": 4,
      "num_stages": 2,
      "waves_per_eu": 0
    },
    "2532": {
      "BLOCK_M": 64,
      "BLOCK_N": 16,
      "BLOCK_K": 256,
      "BLOCK_C": 16,
      "NUM_KSPLIT": 1,
      "num_warps": 8,
      "num_stages": 1,
      "waves_per_eu": 0
    },
    "3359": {
      "BLOCK_M": 128,
      "BLOCK_N": 16,
      "BLOCK_K": 64,
      "BLOCK_C": 32,
      "NUM_KSPLIT": 4,
      "num_warps": 4,
      "num_stages": 2,
      "waves_per_eu": 2
    },
    "3581": {
      "BLOCK_M": 128,
      "BLOCK_N": 16,
      "BLOCK_K": 64,
      "BLOCK_C": 256,
      "NUM_KSPLIT": 4,
      "num_warps": 8,
      "num_stages": 2,
      "waves_per_eu": 2
    },
    "1839": {
      "BLOCK_M": 64,
      "BLOCK_N": 16,
      "BLOCK_K": 64,
      "BLOCK_C": 16,
      "NUM_KSPLIT": 4,
      "num_warps": 2,
      "num_stages": 2,
      "waves_per_eu": 0
    },
    "99": {
      "BLOCK_M": 32,
      "BLOCK_N": 16,
      "BLOCK_K": 32,
      "BLOCK_C": 32,
      "NUM_KSPLIT": 2,
      "num_warps": 4,
      "num_stages": 2,
      "waves_per_eu": 0
    },
    "1747": {
      "BLOCK_M": 64,
      "BLOCK_N": 16,
      "BLOCK_K": 32,
      "BLOCK_C": 256,
      "NUM_KSPLIT": 2,
      "num_warps": 2,
      "num_stages": 1,
      "waves_per_eu": 1
    },
    "1776": {
      "BLOCK_M": 64,
      "BLOCK_N": 16,
      "BLOCK_K": 32,
      "BLOCK_C": 256,
      "NUM_KSPLIT": 4,
      "num_warps": 8,
      "num_stages": 1,
      "waves_per_eu": 0
    },
    "5594": {
      "BLOCK_M": 256,
      "BLOCK_N": 16,
      "BLOCK_K": 256,
      "BLOCK_C": 64,
      "NUM_KSPLIT": 4,
      "num_warps": 8,
      "num_stages": 1,
      "waves_per_eu": 2
    },
    "2572": {
      "BLOCK_M": 64,
      "BLOCK_N": 16,
      "BLOCK_K": 256,
      "BLOCK_C": 16,
      "NUM_KSPLIT": 4,
      "num_warps": 8,
      "num_stages": 2,
      "waves_per_eu": 1
    },
    "650": {
      "BLOCK_M": 32,
      "BLOCK_N": 16,
      "BLOCK_K": 64,
      "BLOCK_C": 256,
      "NUM_KSPLIT": 1,
      "num_warps": 2,
      "num_stages": 1,
      "waves_per_eu": 2
    },
    "1524": {
      "BLOCK_M": 64,
      "BLOCK_N": 16,
      "BLOCK_K": 32,
      "BLOCK_C": 32,
      "NUM_KSPLIT": 1,
      "num_warps": 8,
      "num_stages": 1,
      "waves_per_eu": 0
    },
    "2430": {
      "BLOCK_M": 64,
      "BLOCK_N": 16,
      "BLOCK_K": 128,
      "BLOCK_C": 128,
      "NUM_KSPLIT": 8,
      "num_warps": 2,
      "num_stages": 1,
      "waves_per_eu": 0
    },
    "4587": {
      "BLOCK_M": 256,
      "BLOCK_N": 16,
      "BLOCK_K": 32,
      "BLOCK_C": 128,
      "NUM_KSPLIT": 4,
      "num_warps": 8,
      "num_stages": 2,
      "waves_per_eu": 0
    },
    "1944": {
      "BLOCK_M": 64,
      "BLOCK_N": 16,
      "BLOCK_K": 64,
      "BLOCK_C": 64,
      "NUM_KSPLIT": 1,
      "num_warps": 2,
      "num_stages": 1,
      "waves_per_eu": 0
    },
    "3113": {
      "BLOCK_M": 128,
      "BLOCK_N": 16,
      "BLOCK_K": 32,
      "BLOCK_C": 128,
      "NUM_KSPLIT": 1,
      "num_warps": 8,
      "num_stages": 2,
      "waves_per_eu": 2
    },
    "2408": {
      "BLOCK_M": 64,
      "BLOCK_N": 16,
      "BLOCK_K": 128,
      "BLOCK_C": 128,
      "NUM_KSPLIT": 2,
      "num_warps": 8,
      "num_stages": 1,
      "waves_per_eu": 2
    },
    "1625": {
      "BLOCK_M": 64,
      "BLOCK_N": 16,
      "BLOCK_K": 32,
      "BLOCK_C": 64,
      "NUM_KSPLIT": 4,
      "num_warps": 2,
      "num_stages": 2,
      "waves_per_eu": 2
    },
    "2061": {
      "BLOCK_M": 64,
      "BLOCK_N": 16,
      "BLOCK_K": 64,
      "BLOCK_C": 128,
      "NUM_KSPLIT": 4,
      "num_warps": 4,
      "num_stages": 2,
      "waves_per_eu": 0
    },
    "3220": {
      "BLOCK_M": 128,
      "BLOCK_N": 16,
      "BLOCK_K": 32,
      "BLOCK_C": 256,
      "NUM_KSPLIT": 4,
      "num_warps": 8,
      "num_stages": 2,
      "waves_per_eu": 1
    },
    "618": {
      "BLOCK_M": 32,
      "BLOCK_N": 16,
      "BLOCK_K": 64,
      "BLOCK_C": 128,
      "NUM_KSPLIT": 4,
      "num_warps": 4,
      "num_stages": 1,
      "waves_per_eu": 0
    },
    "5149": {
      "BLOCK_M": 256,
      "BLOCK_N": 16,
      "BLOCK_K": 128,
      "BLOCK_C": 32,
      "NUM_KSPLIT": 4,
      "num_warps": 2,
      "num_stages": 1,
      "waves_per_eu": 1
    },
    "4325": {
      "BLOCK_M": 256,
      "BLOCK_N": 16,
      "BLOCK_K": 32,
      "BLOCK_C": 16,
      "NUM_KSPLIT": 1,
      "num_warps": 2,
      "num_stages": 2,
      "waves_per_eu": 2
    },
    "2230": {
      "BLOCK_M": 64,
      "BLOCK_N": 16,
      "BLOCK_K": 128,
      "BLOCK_C": 16,
      "NUM_KSPLIT": 8,
      "num_warps": 8,
      "num_stages": 2,
      "waves_per_eu": 1
    },
    "5628": {
      "BLOCK_M": 256,
      "BLOCK_N": 16,
      "BLOCK_K": 256,
      "BLOCK_C": 128,
      "NUM_KSPLIT": 1,
      "num_warps": 8,
      "num_stages": 1,
      "waves_per_eu": 0
    },
    "1324": {
      "BLOCK_M": 32,
      "BLOCK_N": 16,
      "BLOCK_K": 256,
      "BLOCK_C": 128,
      "NUM_KSPLIT": 2,
      "num_warps": 4,
      "num_stages": 2,
      "waves_per_eu": 1
    },
    "3618": {
      "BLOCK_M": 128,
      "BLOCK_N": 16,
      "BLOCK_K": 128,
      "BLOCK_C": 16,
      "NUM_KSPLIT": 2,
      "num_warps": 2,
      "num_stages": 1,
      "waves_per_eu": 0
    },
    "2956": {
      "BLOCK_M": 128,
      "BLOCK_N": 16,
      "BLOCK_K": 32,
      "BLOCK_C": 32,
      "NUM_KSPLIT": 1,
      "num_warps": 2,
      "num_stages": 2,
      "waves_per_eu": 1
    },
    "5038": {
      "BLOCK_M": 256,
      "BLOCK_N": 16,
      "BLOCK_K": 64,
      "BLOCK_C": 256,
      "NUM_KSPLIT": 8,
      "num_warps": 8,
      "num_stages": 2,
      "waves_per_eu": 1
    },
    "4953": {
      "BLOCK_M": 256,
      "BLOCK_N": 16,
      "BLOCK_K": 64,
      "BLOCK_C": 128,
      "NUM_KSPLIT": 8,
      "num_warps": 2,
      "num_stages": 2,
      "waves_per_eu": 0
    },
    "3625": {
      "BLOCK_M": 128,
      "BLOCK_N": 16,
      "BLOCK_K": 128,
      "BLOCK_C": 16,
      "NUM_KSPLIT": 2,
      "num_warps": 4,
      "num_stages": 1,
      "waves_per_eu": 1
    },
    "2970": {
      "BLOCK_M": 128,
      "BLOCK_N": 16,
      "BLOCK_K": 32,
      "BLOCK_C": 32,
      "NUM_KSPLIT": 2,
      "num_warps": 2,
      "num_stages": 1,
      "waves_per_eu": 0
    },
    "3387": {
      "BLOCK_M": 128,
      "BLOCK_N": 16,
      "BLOCK_K": 64,
      "BLOCK_C": 64,
      "NUM_KSPLIT": 1,
      "num_warps": 2,
      "num_stages": 2,
      "waves_per_eu": 0
    },
    "4205": {
      "BLOCK_M": 128,
      "BLOCK_N": 16,
      "BLOCK_K": 256,
      "BLOCK_C": 128,
      "NUM_KSPLIT": 2,
      "num_warps": 4,
      "num_stages": 2,
      "waves_per_eu": 2
    },
    "4133": {
      "BLOCK_M": 128,
      "BLOCK_N": 16,
      "BLOCK_K": 256,
      "BLOCK_C": 64,
      "NUM_KSPLIT": 2,
      "num_warps": 4,
      "num_stages": 2,
      "waves_per_eu": 2
    },
    "2132": {
      "BLOCK_M": 64,
      "BLOCK_N": 16,
      "BLOCK_K": 64,
      "BLOCK_C": 256,
      "NUM_KSPLIT": 4,
      "num_warps": 4,
      "num_stages": 1,
      "waves_per_eu": 2
    },
    "319": {
      "BLOCK_M": 32,
      "BLOCK_N": 16,
      "BLOCK_K": 32,
      "BLOCK_C": 256,
      "NUM_KSPLIT": 2,
      "num_warps": 8,
      "num_stages": 1,
      "waves_per_eu": 1
    },
    "439": {
      "BLOCK_M": 32,
      "BLOCK_N": 16,
      "BLOCK_K": 64,
      "BLOCK_C": 32,
      "NUM_KSPLIT": 1,
      "num_warps": 4,
      "num_stages": 1,
      "waves_per_eu": 1
    },
    "2490": {
      "BLOCK_M": 64,
      "BLOCK_N": 16,
      "BLOCK_K": 128,
      "BLOCK_C": 256,
      "NUM_KSPLIT": 4,
      "num_warps": 4,
      "num_stages": 1,
      "waves_per_eu": 0
    },
    "1973": {
      "BLOCK_M": 64,
      "BLOCK_N": 16,
      "BLOCK_K": 64,
      "BLOCK_C": 64,
      "NUM_KSPLIT": 2,
      "num_warps": 4,
      "num_stages": 2,
      "waves_per_eu": 2
    },
    "5527": {
      "BLOCK_M": 256,
      "BLOCK_N": 16,
      "BLOCK_K": 256,
      "BLOCK_C": 32,
      "NUM_KSPLIT": 8,
      "num_warps": 2,
      "num_stages": 1,
      "waves_per_eu": 1
    },
    "5120": {
      "BLOCK_M": 256,
      "BLOCK_N": 16,
      "BLOCK_K": 128,
      "BLOCK_C": 32,
      "NUM_KSPLIT": 1,
      "num_warps": 4,
      "num_stages": 1,
      "waves_per_eu": 2
    },
    "4480": {
      "BLOCK_M": 256,
      "BLOCK_N": 16,
      "BLOCK_K": 32,
      "BLOCK_C": 64,
      "NUM_KSPLIT": 1,
      "num_warps": 8,
      "num_stages": 2,
      "waves_per_eu": 1
    },
    "680": {
      "BLOCK_M": 32,
      "BLOCK_N": 16,
      "BLOCK_K": 64,
      "BLOCK_C": 256,
      "NUM_KSPLIT": 2,
      "num_warps": 8,
      "num_stages": 1,
      "waves_per_eu": 2
    },
    "1259": {
      "BLOCK_M": 32,
      "BLOCK_N": 16,
      "BLOCK_K": 256,
      "BLOCK_C": 64,
      "NUM_KSPLIT": 2,
      "num_warps": 8,
      "num_stages": 2,
      "waves_per_eu": 2
    },
    "2347": {
      "BLOCK_M": 64,
      "BLOCK_N": 16,
      "BLOCK_K": 128,
      "BLOCK_C": 64,
      "NUM_KSPLIT": 4,
      "num_warps": 4,
      "num_stages": 1,
      "waves_per_eu": 1
    },
    "1040": {
      "BLOCK_M": 32,
      "BLOCK_N": 16,
      "BLOCK_K": 128,
      "BLOCK_C": 256,
      "NUM_KSPLIT": 2,
      "num_warps": 8,
      "num_stages": 1,
      "waves_per_eu": 2
    },
    "3921": {
      "BLOCK_M": 128,
      "BLOCK_N": 16,
      "BLOCK_K": 128,
      "BLOCK_C": 256,
      "NUM_KSPLIT": 2,
      "num_warps": 8,
      "num_stages": 2,
      "waves_per_eu": 0
    },
    "2522": {
      "BLOCK_M": 64,
      "BLOCK_N": 16,
      "BLOCK_K": 256,
      "BLOCK_C": 16,
      "NUM_KSPLIT": 1,
      "num_warps": 2,
      "num_stages": 1,
      "waves_per_eu": 2
    },
    "5093": {
      "BLOCK_M": 256,
      "BLOCK_N": 16,
      "BLOCK_K": 128,
      "BLOCK_C": 16,
      "NUM_KSPLIT": 4,
      "num_warps": 8,
      "num_stages": 2,
      "waves_per_eu": 2
    },
    "2003": {
      "BLOCK_M": 64,
      "BLOCK_N": 16,
      "BLOCK_K": 64,
      "BLOCK_C": 64,
      "NUM_KSPLIT": 8,
      "num_warps": 2,
      "num_stages": 2,
      "waves_per_eu": 2
    },
    "1272": {
      "BLOCK_M": 32,
      "BLOCK_N": 16,
      "BLOCK_K": 256,
      "BLOCK_C": 64,
      "NUM_KSPLIT": 4,
      "num_warps": 8,
      "num_stages": 1,
      "waves_per_eu": 0
    },
    "610": {
      "BLOCK_M": 32,
      "BLOCK_N": 16,
      "BLOCK_K": 64,
      "BLOCK_C": 128,
      "NUM_KSPLIT": 2,
      "num_warps": 8,
      "num_stages": 2,
      "waves_per_eu": 1
    },
    "1837": {
      "BLOCK_M": 64,
      "BLOCK_N": 16,
      "BLOCK_K": 64,
      "BLOCK_C": 16,
      "NUM_KSPLIT": 4,
      "num_warps": 2,
      "num_stages": 1,
      "waves_per_eu": 1
    },
    "831": {
      "BLOCK_M": 32,
      "BLOCK_N": 16,
      "BLOCK_K": 128,
      "BLOCK_C": 32,
      "NUM_KSPLIT": 4,
      "num_warps": 2,
      "num_stages": 2,
      "waves_per_eu": 0
    },
    "1027": {
      "BLOCK_M": 32,
      "BLOCK_N": 16,
      "BLOCK_K": 128,
      "BLOCK_C": 256,
      "NUM_KSPLIT": 2,
      "num_warps": 2,
      "num_stages": 1,
      "waves_per_eu": 1
    },
    "871": {
      "BLOCK_M": 32,
      "BLOCK_N": 16,
      "BLOCK_K": 128,
      "BLOCK_C": 64,
      "NUM_KSPLIT": 1,
      "num_warps": 4,
      "num_stages": 1,
      "waves_per_eu": 1
    },
    "900": {
      "BLOCK_M": 32,
      "BLOCK_N": 16,
      "BLOCK_K": 128,
      "BLOCK_C": 64,
      "NUM_KSPLIT": 4,
      "num_warps": 2,
      "num_stages": 1,
      "waves_per_eu": 0
    },
    "1520": {
      "BLOCK_M": 64,
      "BLOCK_N": 16,
      "BLOCK_K": 32,
      "BLOCK_C": 32,
      "NUM_KSPLIT": 1,
      "num_warps": 4,
      "num_stages": 1,
      "waves_per_eu": 2
    },
    "3681": {
      "BLOCK_M": 128,
      "BLOCK_N": 16,
      "BLOCK_K": 128,
      "BLOCK_C": 32,
      "NUM_KSPLIT": 1,
      "num_warps": 4,
      "num_stages": 2,
      "waves_per_eu": 0
    },
    "2098": {
      "BLOCK_M": 64,
      "BLOCK_N": 16,
      "BLOCK_K": 64,
      "BLOCK_C": 256,
      "NUM_KSPLIT": 1,
      "num_warps": 4,
      "num_stages": 2,
      "waves_per_eu": 1
    },
    "101": {
      "BLOCK_M": 32,
      "BLOCK_N": 16,
      "BLOCK_K": 32,
      "BLOCK_C": 32,
      "NUM_KSPLIT": 2,
      "num_warps": 4,
      "num_stages": 2,
      "waves_per_eu": 2
    },
    "5743": {
      "BLOCK_M": 256,
      "BLOCK_N": 16,
      "BLOCK_K": 256,
      "BLOCK_C": 256,
      "NUM_KSPLIT": 8,
      "num_warps": 2,
      "num_stages": 1,
      "waves_per_eu": 1
    },
    "2078": {
      "BLOCK_M": 64,
      "BLOCK_N": 16,
      "BLOCK_K": 64,
      "BLOCK_C": 128,
      "NUM_KSPLIT": 8,
      "num_warps": 4,
      "num_stages": 1,
      "waves_per_eu": 2
    },
    "3068": {
      "BLOCK_M": 128,
      "BLOCK_N": 16,
      "BLOCK_K": 32,
      "BLOCK_C": 64,
      "NUM_KSPLIT": 4,
      "num_warps": 4,
      "num_stages": 1,
      "waves_per_eu": 2
    },
    "3716": {
      "BLOCK_M": 128,
      "BLOCK_N": 16,
      "BLOCK_K": 128,
      "BLOCK_C": 32,
      "NUM_KSPLIT": 4,
      "num_warps": 4,
      "num_stages": 1,
      "waves_per_eu": 2
    },
    "5639": {
      "BLOCK_M": 256,
      "BLOCK_N": 16,
      "BLOCK_K": 256,
      "BLOCK_C": 128,
      "NUM_KSPLIT": 2,
      "num_warps": 2,
      "num_stages": 2,
      "waves_per_eu": 2
    },
    "829": {
      "BLOCK_M": 32,
      "BLOCK_N": 16,
      "BLOCK_K": 128,
      "BLOCK_C": 32,
      "NUM_KSPLIT": 4,
      "num_warps": 2,
      "num_stages": 1,
      "waves_per_eu": 1
    },
    "1160": {
      "BLOCK_M": 32,
      "BLOCK_N": 16,
      "BLOCK_K": 256,
      "BLOCK_C": 32,
      "NUM_KSPLIT": 1,
      "num_warps": 4,
      "num_stages": 1,
      "waves_per_eu": 2
    },
    "3756": {
      "BLOCK_M": 128,
      "BLOCK_N": 16,
      "BLOCK_K": 128,
      "BLOCK_C": 64,
      "NUM_KSPLIT": 1,
      "num_warps": 8,
      "num_stages": 1,
      "waves_per_eu": 0
    },
    "4439": {
      "BLOCK_M": 256,
      "BLOCK_N": 16,
      "BLOCK_K": 32,
      "BLOCK_C": 32,
      "NUM_KSPLIT": 4,
      "num_warps": 4,
      "num_stages": 2,
      "waves_per_eu": 2
    },
    "809": {
      "BLOCK_M": 32,
      "BLOCK_N": 16,
      "BLOCK_K": 128,
      "BLOCK_C": 32,
      "NUM_KSPLIT": 1,
      "num_warps": 8,
      "num_stages": 2,
      "waves_per_eu": 2
    },
    "1642": {
      "BLOCK_M": 64,
      "BLOCK_N": 16,
      "BLOCK_K": 32,
      "BLOCK_C": 64,
      "NUM_KSPLIT": 8,
      "num_warps": 2,
      "num_stages": 2,
      "waves_per_eu": 1
    },
    "5016": {
      "BLOCK_M": 256,
      "BLOCK_N": 16,
      "BLOCK_K": 64,
      "BLOCK_C": 256,
      "NUM_KSPLIT": 4,
      "num_warps": 8,
      "num_stages": 1,
      "waves_per_eu": 0
    },
    "2511": {
      "BLOCK_M": 64,
      "BLOCK_N": 16,
      "BLOCK_K": 128,
      "BLOCK_C": 256,
      "NUM_KSPLIT": 8,
      "num_warps": 4,
      "num_stages": 2,
      "waves_per_eu": 0
    },
    "3020": {
      "BLOCK_M": 128,
      "BLOCK_N": 16,
      "BLOCK_K": 32,
      "BLOCK_C": 32,
      "NUM_KSPLIT": 8,
      "num_warps": 8,
      "num_stages": 1,
      "waves_per_eu": 2
    },
    "905": {
      "BLOCK_M": 32,
      "BLOCK_N": 16,
      "BLOCK_K": 128,
      "BLOCK_C": 64,
      "NUM_KSPLIT": 4,
      "num_warps": 2,
      "num_stages": 2,
      "waves_per_eu": 2
    },
    "3254": {
      "BLOCK_M": 128,
      "BLOCK_N": 16,
      "BLOCK_K": 64,
      "BLOCK_C": 16,
      "NUM_KSPLIT": 1,
      "num_warps": 8,
      "num_stages": 1,
      "waves_per_eu": 2
    },
    "1809": {
      "BLOCK_M": 64,
      "BLOCK_N": 16,
      "BLOCK_K": 64,
      "BLOCK_C": 16,
      "NUM_KSPLIT": 1,
      "num_warps": 4,
      "num_stages": 2,
      "waves_per_eu": 0
    },
    "39": {
      "BLOCK_M": 32,
      "BLOCK_N": 16,
      "BLOCK_K": 32,
      "BLOCK_C": 16,
      "NUM_KSPLIT": 4,
      "num_warps": 2,
      "num_stages": 2,
      "waves_per_eu": 0
    },
    "4733": {
      "BLOCK_M": 256,
      "BLOCK_N": 16,
      "BLOCK_K": 64,
      "BLOCK_C": 16,
      "NUM_KSPLIT": 4,
      "num_warps": 8,
      "num_stages": 2,
      "waves_per_eu": 2
    },
    "2603": {
      "BLOCK_M": 64,
      "BLOCK_N": 16,
      "BLOCK_K": 256,
      "BLOCK_C": 32,
      "NUM_KSPLIT": 1,
      "num_warps": 4,
      "num_stages": 2,
      "waves_per_eu": 2
    },
    "3370": {
      "BLOCK_M": 128,
      "BLOCK_N": 16,
      "BLOCK_K": 64,
      "BLOCK_C": 32,
      "NUM_KSPLIT": 8,
      "num_warps": 2,
      "num_stages": 2,
      "waves_per_eu": 1
    },
    "4071": {
      "BLOCK_M": 128,
      "BLOCK_N": 16,
      "BLOCK_K": 256,
      "BLOCK_C": 32,
      "NUM_KSPLIT": 4,
      "num_warps": 2,
      "num_stages": 2,
      "waves_per_eu": 0
    },
    "1463": {
      "BLOCK_M": 64,
      "BLOCK_N": 16,
      "BLOCK_K": 32,
      "BLOCK_C": 16,
      "NUM_KSPLIT": 2,
      "num_warps": 2,
      "num_stages": 2,
      "waves_per_eu": 2
    },
    "3309": {
      "BLOCK_M": 128,
      "BLOCK_N": 16,
      "BLOCK_K": 64,
      "BLOCK_C": 16,
      "NUM_KSPLIT": 8,
      "num_warps": 8,
      "num_stages": 2,
      "waves_per_eu": 0
    },
    "4002": {
      "BLOCK_M": 128,
      "BLOCK_N": 16,
      "BLOCK_K": 256,
      "BLOCK_C": 16,
      "NUM_KSPLIT": 4,
      "num_warps": 4,
      "num_stages": 1,
      "waves_per_eu": 0
    },
    "5396": {
      "BLOCK_M": 256,
      "BLOCK_N": 16,
      "BLOCK_K": 128,
      "BLOCK_C": 256,
      "NUM_KSPLIT": 8,
      "num_warps": 8,
      "num_stages": 1,
      "waves_per_eu": 2
    },
    "4992": {
      "BLOCK_M": 256,
      "BLOCK_N": 16,
      "BLOCK_K": 64,
      "BLOCK_C": 256,
      "NUM_KSPLIT": 2,
      "num_warps": 4,
      "num_stages": 1,
      "waves_per_eu": 0
    },
    "4463": {
      "BLOCK_M": 256,
      "BLOCK_N": 16,
      "BLOCK_K": 32,
      "BLOCK_C": 32,
      "NUM_KSPLIT": 8,
      "num_warps": 8,
      "num_stages": 2,
      "waves_per_eu": 2
    },
    "3633": {
      "BLOCK_M": 128,
      "BLOCK_N": 16,
      "BLOCK_K": 128,
      "BLOCK_C": 16,
      "NUM_KSPLIT": 2,
      "num_warps": 8,
      "num_stages": 2,
      "waves_per_eu": 0
    },
    "5027": {
      "BLOCK_M": 256,
      "BLOCK_N": 16,
      "BLOCK_K": 64,
      "BLOCK_C": 256,
      "NUM_KSPLIT": 8,
      "num_warps": 2,
      "num_stages": 2,
      "waves_per_eu": 2
    },
    "4173": {
      "BLOCK_M": 128,
      "BLOCK_N": 16,
      "BLOCK_K": 256,
      "BLOCK_C": 64,
      "NUM_KSPLIT": 8,
      "num_warps": 8,
      "num_stages": 2,
      "waves_per_eu": 0
    },
    "5044": {
      "BLOCK_M": 256,
      "BLOCK_N": 16,
      "BLOCK_K": 128,
      "BLOCK_C": 16,
      "NUM_KSPLIT": 1,
      "num_warps": 2,
      "num_stages": 2,
      "waves_per_eu": 1
    },
    "311": {
      "BLOCK_M": 32,
      "BLOCK_N": 16,
      "BLOCK_K": 32,
      "BLOCK_C": 256,
      "NUM_KSPLIT": 2,
      "num_warps": 2,
      "num_stages": 2,
      "waves_per_eu": 2
    },
    "3957": {
      "BLOCK_M": 128,
      "BLOCK_N": 16,
      "BLOCK_K": 128,
      "BLOCK_C": 256,
      "NUM_KSPLIT": 8,
      "num_warps": 8,
      "num_stages": 2,
      "waves_per_eu": 0
    },
    "78": {
      "BLOCK_M": 32,
      "BLOCK_N": 16,
      "BLOCK_K": 32,
      "BLOCK_C": 32,
      "NUM_KSPLIT": 1,
      "num_warps": 4,
      "num_stages": 1,
      "waves_per_eu": 0
    },
    "3027": {
      "BLOCK_M": 128,
      "BLOCK_N": 16,
      "BLOCK_K": 32,
      "BLOCK_C": 64,
      "NUM_KSPLIT": 1,
      "num_warps": 2,
      "num_stages": 2,
      "waves_per_eu": 0
    },
    "4187": {
      "BLOCK_M": 128,
      "BLOCK_N": 16,
      "BLOCK_K": 256,
      "BLOCK_C": 128,
      "NUM_KSPLIT": 1,
      "num_warps": 4,
      "num_stages": 2,
      "waves_per_eu": 2
    },
    "2208": {
      "BLOCK_M": 64,
      "BLOCK_N": 16,
      "BLOCK_K": 128,
      "BLOCK_C": 16,
      "NUM_KSPLIT": 4,
      "num_warps": 8,
      "num_stages": 1,
      "waves_per_eu": 0
    },
    "842": {
      "BLOCK_M": 32,
      "BLOCK_N": 16,
      "BLOCK_K": 128,
      "BLOCK_C": 32,
      "NUM_KSPLIT": 4,
      "num_warps": 8,
      "num_stages": 1,
      "waves_per_eu": 2
    },
    "2646": {
      "BLOCK_M": 64,
      "BLOCK_N": 16,
      "BLOCK_K": 256,
      "BLOCK_C": 32,
      "NUM_KSPLIT": 8,
      "num_warps": 2,
      "num_stages": 1,
      "waves_per_eu": 0
    },
    "5636": {
      "BLOCK_M": 256,
      "BLOCK_N": 16,
      "BLOCK_K": 256,
      "BLOCK_C": 128,
      "NUM_KSPLIT": 2,
      "num_warps": 2,
      "num_stages": 1,
      "waves_per_eu": 2
    },
    "3133": {
      "BLOCK_M": 128,
      "BLOCK_N": 16,
      "BLOCK_K": 32,
      "BLOCK_C": 128,
      "NUM_KSPLIT": 4,
      "num_warps": 2,
      "num_stages": 1,
      "waves_per_eu": 1
    },
    "5729": {
      "BLOCK_M": 256,
      "BLOCK_N": 16,
      "BLOCK_K": 256,
      "BLOCK_C": 256,
      "NUM_KSPLIT": 4,
      "num_warps": 2,
      "num_stages": 2,
      "waves_per_eu": 2
    },
    "4340": {
      "BLOCK_M": 256,
      "BLOCK_N": 16,
      "BLOCK_K": 32,
      "BLOCK_C": 16,
      "NUM_KSPLIT": 2,
      "num_warps": 2,
      "num_stages": 1,
      "waves_per_eu": 2
    },
    "140": {
      "BLOCK_M": 32,
      "BLOCK_N": 16,
      "BLOCK_K": 32,
      "BLOCK_C": 32,
      "NUM_KSPLIT": 8,
      "num_warps": 8,
      "num_stages": 1,
      "waves_per_eu": 2
    },
    "4433": {
      "BLOCK_M": 256,
      "BLOCK_N": 16,
      "BLOCK_K": 32,
      "BLOCK_C": 32,
      "NUM_KSPLIT": 4,
      "num_warps": 2,
      "num_stages": 2,
      "waves_per_eu": 2
    },
    "4692": {
      "BLOCK_M": 256,
      "BLOCK_N": 16,
      "BLOCK_K": 64,
      "BLOCK_C": 16,
      "NUM_KSPLIT": 1,
      "num_warps": 8,
      "num_stages": 1,
      "waves_per_eu": 0
    },
    "745": {
      "BLOCK_M": 32,
      "BLOCK_N": 16,
      "BLOCK_K": 128,
      "BLOCK_C": 16,
      "NUM_KSPLIT": 2,
      "num_warps": 4,
      "num_stages": 1,
      "waves_per_eu": 1
    },
    "2618": {
      "BLOCK_M": 64,
      "BLOCK_N": 16,
      "BLOCK_K": 256,
      "BLOCK_C": 32,
      "NUM_KSPLIT": 2,
      "num_warps": 4,
      "num_stages": 1,
      "waves_per_eu": 2
    },
    "2220": {
      "BLOCK_M": 64,
      "BLOCK_N": 16,
      "BLOCK_K": 128,
      "BLOCK_C": 16,
      "NUM_KSPLIT": 8,
      "num_warps": 4,
      "num_stages": 1,
      "waves_per_eu": 0
    },
    "5557": {
      "BLOCK_M": 256,
      "BLOCK_N": 16,
      "BLOCK_K": 256,
      "BLOCK_C": 64,
      "NUM_KSPLIT": 1,
      "num_warps": 8,
      "num_stages": 1,
      "waves_per_eu": 1
    },
    "5635": {
      "BLOCK_M": 256,
      "BLOCK_N": 16,
      "BLOCK_K": 256,
      "BLOCK_C": 128,
      "NUM_KSPLIT": 2,
      "num_warps": 2,
      "num_stages": 1,
      "waves_per_eu": 1
    },
    "3350": {
      "BLOCK_M": 128,
      "BLOCK_N": 16,
      "BLOCK_K": 64,
      "BLOCK_C": 32,
      "NUM_KSPLIT": 4,
      "num_warps": 2,
      "num_stages": 1,
      "waves_per_eu": 2
    },
    "3738": {
      "BLOCK_M": 128,
      "BLOCK_N": 16,
      "BLOCK_K": 128,
      "BLOCK_C": 32,
      "NUM_KSPLIT": 8,
      "num_warps": 8,
      "num_stages": 1,
      "waves_per_eu": 0
    },
    "4222": {
      "BLOCK_M": 128,
      "BLOCK_N": 16,
      "BLOCK_K": 256,
      "BLOCK_C": 128,
      "NUM_KSPLIT": 4,
      "num_warps": 4,
      "num_stages": 2,
      "waves_per_eu": 1
    },
    "2153": {
      "BLOCK_M": 64,
      "BLOCK_N": 16,
      "BLOCK_K": 64,
      "BLOCK_C": 256,
      "NUM_KSPLIT": 8,
      "num_warps": 4,
      "num_stages": 2,
      "waves_per_eu": 2
    },
    "1823": {
      "BLOCK_M": 64,
      "BLOCK_N": 16,
      "BLOCK_K": 64,
      "BLOCK_C": 16,
      "NUM_KSPLIT": 2,
      "num_warps": 2,
      "num_stages": 2,
      "waves_per_eu": 2
    },
    "4308": {
      "BLOCK_M": 128,
      "BLOCK_N": 16,
      "BLOCK_K": 256,
      "BLOCK_C": 256,
      "NUM_KSPLIT": 8,
      "num_warps": 4,
      "num_stages": 1,
      "waves_per_eu": 0
    },
    "1217": {
      "BLOCK_M": 32,
      "BLOCK_N": 16,
      "BLOCK_K": 256,
      "BLOCK_C": 32,
      "NUM_KSPLIT": 8,
      "num_warps": 4,
      "num_stages": 2,
      "waves_per_eu": 2
    },
    "2361": {
      "BLOCK_M": 64,
      "BLOCK_N": 16,
      "BLOCK_K": 128,
      "BLOCK_C": 64,
      "NUM_KSPLIT": 8,
      "num_warps": 2,
      "num_stages": 2,
      "waves_per_eu": 0
    },
    "3583": {
      "BLOCK_M": 128,
      "BLOCK_N": 16,
      "BLOCK_K": 64,
      "BLOCK_C": 256,
      "NUM_KSPLIT": 8,
      "num_warps": 2,
      "num_stages": 1,
      "waves_per_eu": 1
    },
    "3594": {
      "BLOCK_M": 128,
      "BLOCK_N": 16,
      "BLOCK_K": 64,
      "BLOCK_C": 256,
      "NUM_KSPLIT": 8,
      "num_warps": 8,
      "num_stages": 1,
      "waves_per_eu": 0
    },
    "1841": {
      "BLOCK_M": 64,
      "BLOCK_N": 16,
      "BLOCK_K": 64,
      "BLOCK_C": 16,
      "NUM_KSPLIT": 4,
      "num_warps": 2,
      "num_stages": 2,
      "waves_per_eu": 2
    },
    "3151": {
      "BLOCK_M": 128,
      "BLOCK_N": 16,
      "BLOCK_K": 32,
      "BLOCK_C": 128,
      "NUM_KSPLIT": 8,
      "num_warps": 2,
      "num_stages": 1,
      "waves_per_eu": 1
    },
    "838": {
      "BLOCK_M": 32,
      "BLOCK_N": 16,
      "BLOCK_K": 128,
      "BLOCK_C": 32,
      "NUM_KSPLIT": 4,
      "num_warps": 4,
      "num_stages": 2,
      "waves_per_eu": 1
    },
    "5278": {
      "BLOCK_M": 256,
      "BLOCK_N": 16,
      "BLOCK_K": 128,
      "BLOCK_C": 128,
      "NUM_KSPLIT": 2,
      "num_warps": 2,
      "num_stages": 2,
      "waves_per_eu": 1
    },
    "4522": {
      "BLOCK_M": 256,
      "BLOCK_N": 16,
      "BLOCK_K": 32,
      "BLOCK_C": 64,
      "NUM_KSPLIT": 8,
      "num_warps": 2,
      "num_stages": 2,
      "waves_per_eu": 1
    },
    "2881": {
      "BLOCK_M": 128,
      "BLOCK_N": 16,
      "BLOCK_K": 32,
      "BLOCK_C": 16,
      "NUM_KSPLIT": 1,
      "num_warps": 2,
      "num_stages": 1,
      "waves_per_eu": 1
    },
    "2141": {
      "BLOCK_M": 64,
      "BLOCK_N": 16,
      "BLOCK_K": 64,
      "BLOCK_C": 256,
      "NUM_KSPLIT": 4,
      "num_warps": 8,
      "num_stages": 2,
      "waves_per_eu": 2
    },
    "5141": {
      "BLOCK_M": 256,
      "BLOCK_N": 16,
      "BLOCK_K": 128,
      "BLOCK_C": 32,
      "NUM_KSPLIT": 2,
      "num_warps": 4,
      "num_stages": 2,
      "waves_per_eu": 2
    },
    "4111": {
      "BLOCK_M": 128,
      "BLOCK_N": 16,
      "BLOCK_K": 256,
      "BLOCK_C": 64,
      "NUM_KSPLIT": 1,
      "num_warps": 4,
      "num_stages": 1,
      "waves_per_eu": 1
    },
    "5306": {
      "BLOCK_M": 256,
      "BLOCK_N": 16,
      "BLOCK_K": 128,
      "BLOCK_C": 128,
      "NUM_KSPLIT": 4,
      "num_warps": 8,
      "num_stages": 1,
      "waves_per_eu": 2
    },
    "3731": {
      "BLOCK_M": 128,
      "BLOCK_N": 16,
      "BLOCK_K": 128,
      "BLOCK_C": 32,
      "NUM_KSPLIT": 8,
      "num_warps": 2,
      "num_stages": 2,
      "waves_per_eu": 2
    },
    "2545": {
      "BLOCK_M": 64,
      "BLOCK_N": 16,
      "BLOCK_K": 256,
      "BLOCK_C": 16,
      "NUM_KSPLIT": 2,
      "num_warps": 4,
      "num_stages": 1,
      "waves_per_eu": 1
    },
    "4006": {
      "BLOCK_M": 128,
      "BLOCK_N": 16,
      "BLOCK_K": 256,
      "BLOCK_C": 16,
      "NUM_KSPLIT": 4,
      "num_warps": 4,
      "num_stages": 2,
      "waves_per_eu": 1
    },
    "549": {
      "BLOCK_M": 32,
      "BLOCK_N": 16,
      "BLOCK_K": 64,
      "BLOCK_C": 64,
      "NUM_KSPLIT": 4,
      "num_warps": 4,
      "num_stages": 2,
      "waves_per_eu": 0
    },
    "5511": {
      "BLOCK_M": 256,
      "BLOCK_N": 16,
      "BLOCK_K": 256,
      "BLOCK_C": 32,
      "NUM_KSPLIT": 4,
      "num_warps": 2,
      "num_stages": 2,
      "waves_per_eu": 0
    },
    "4887": {
      "BLOCK_M": 256,
      "BLOCK_N": 16,
      "BLOCK_K": 64,
      "BLOCK_C": 64,
      "NUM_KSPLIT": 8,
      "num_warps": 4,
      "num_stages": 2,
      "waves_per_eu": 0
    },
    "2827": {
      "BLOCK_M": 64,
      "BLOCK_N": 16,
      "BLOCK_K": 256,
      "BLOCK_C": 256,
      "NUM_KSPLIT": 2,
      "num_warps": 2,
      "num_stages": 1,
      "waves_per_eu": 1
    },
    "2178": {
      "BLOCK_M": 64,
      "BLOCK_N": 16,
      "BLOCK_K": 128,
      "BLOCK_C": 16,
      "NUM_KSPLIT": 2,
      "num_warps": 2,
      "num_stages": 1,
      "waves_per_eu": 0
    },
    "4956": {
      "BLOCK_M": 256,
      "BLOCK_N": 16,
      "BLOCK_K": 64,
      "BLOCK_C": 128,
      "NUM_KSPLIT": 8,
      "num_warps": 4,
      "num_stages": 1,
      "waves_per_eu": 0
    },
    "4282": {
      "BLOCK_M": 128,
      "BLOCK_N": 16,
      "BLOCK_K": 256,
      "BLOCK_C": 256,
      "NUM_KSPLIT": 2,
      "num_warps": 8,
      "num_stages": 2,
      "waves_per_eu": 1
    },
    "2689": {
      "BLOCK_M": 64,
      "BLOCK_N": 16,
      "BLOCK_K": 256,
      "BLOCK_C": 64,
      "NUM_KSPLIT": 2,
      "num_warps": 4,
      "num_stages": 1,
      "waves_per_eu": 1
    },
    "2771": {
      "BLOCK_M": 64,
      "BLOCK_N": 16,
      "BLOCK_K": 256,
      "BLOCK_C": 128,
      "NUM_KSPLIT": 2,
      "num_warps": 8,
      "num_stages": 2,
      "waves_per_eu": 2
    },
    "5316": {
      "BLOCK_M": 256,
      "BLOCK_N": 16,
      "BLOCK_K": 128,
      "BLOCK_C": 128,
      "NUM_KSPLIT": 8,
      "num_warps": 4,
      "num_stages": 1,
      "waves_per_eu": 0
    },
    "4554": {
      "BLOCK_M": 256,
      "BLOCK_N": 16,
      "BLOCK_K": 32,
      "BLOCK_C": 128,
      "NUM_KSPLIT": 2,
      "num_warps": 2,
      "num_stages": 1,
      "waves_per_eu": 0
    },
    "936": {
      "BLOCK_M": 32,
      "BLOCK_N": 16,
      "BLOCK_K": 128,
      "BLOCK_C": 128,
      "NUM_KSPLIT": 1,
      "num_warps": 2,
      "num_stages": 1,
      "waves_per_eu": 0
    },
    "4114": {
      "BLOCK_M": 128,
      "BLOCK_N": 16,
      "BLOCK_K": 256,
      "BLOCK_C": 64,
      "NUM_KSPLIT": 1,
      "num_warps": 4,
      "num_stages": 2,
      "waves_per_eu": 1
    },
    "5748": {
      "BLOCK_M": 256,
      "BLOCK_N": 16,
      "BLOCK_K": 256,
      "BLOCK_C": 256,
      "NUM_KSPLIT": 8,
      "num_warps": 4,
      "num_stages": 1,
      "waves_per_eu": 0
    },
    "4643": {
      "BLOCK_M": 256,
      "BLOCK_N": 16,
      "BLOCK_K": 32,
      "BLOCK_C": 256,
      "NUM_KSPLIT": 2,
      "num_warps": 8,
      "num_stages": 2,
      "waves_per_eu": 2
    },
    "1938": {
      "BLOCK_M": 64,
      "BLOCK_N": 16,
      "BLOCK_K": 64,
      "BLOCK_C": 32,
      "NUM_KSPLIT": 8,
      "num_warps": 8,
      "num_stages": 1,
      "waves_per_eu": 0
    },
    "2817": {
      "BLOCK_M": 64,
      "BLOCK_N": 16,
      "BLOCK_K": 256,
      "BLOCK_C": 256,
      "NUM_KSPLIT": 1,
      "num_warps": 4,
      "num_stages": 2,
      "waves_per_eu": 0
    },
    "1790": {
      "BLOCK_M": 64,
      "BLOCK_N": 16,
      "BLOCK_K": 32,
      "BLOCK_C": 256,
      "NUM_KSPLIT": 8,
      "num_warps": 4,
      "num_stages": 1,
      "waves_per_eu": 2
    },
    "2221": {
      "BLOCK_M": 64,
      "BLOCK_N": 16,
      "BLOCK_K": 128,
      "BLOCK_C": 16,
      "NUM_KSPLIT": 8,
      "num_warps": 4,
      "num_stages": 1,
      "waves_per_eu": 1
    },
    "3316": {
      "BLOCK_M": 128,
      "BLOCK_N": 16,
      "BLOCK_K": 64,
      "BLOCK_C": 32,
      "NUM_KSPLIT": 1,
      "num_warps": 2,
      "num_stages": 2,
      "waves_per_eu": 1
    },
    "4948": {
      "BLOCK_M": 256,
      "BLOCK_N": 16,
      "BLOCK_K": 64,
      "BLOCK_C": 128,
      "NUM_KSPLIT": 4,
      "num_warps": 8,
      "num_stages": 2,
      "waves_per_eu": 1
    },
    "1711": {
      "BLOCK_M": 64,
      "BLOCK_N": 16,
      "BLOCK_K": 32,
      "BLOCK_C": 128,
      "NUM_KSPLIT": 8,
      "num_warps": 2,
      "num_stages": 1,
      "waves_per_eu": 1
    },
    "4537": {
      "BLOCK_M": 256,
      "BLOCK_N": 16,
      "BLOCK_K": 32,
      "BLOCK_C": 128,
      "NUM_KSPLIT": 1,
      "num_warps": 2,
      "num_stages": 1,
      "waves_per_eu": 1
    },
    "1510": {
      "BLOCK_M": 64,
      "BLOCK_N": 16,
      "BLOCK_K": 32,
      "BLOCK_C": 16,
      "NUM_KSPLIT": 8,
      "num_warps": 8,
      "num_stages": 2,
      "waves_per_eu": 1
    },
    "1921": {
      "BLOCK_M": 64,
      "BLOCK_N": 16,
      "BLOCK_K": 64,
      "BLOCK_C": 32,
      "NUM_KSPLIT": 4,
      "num_warps": 8,
      "num_stages": 1,
      "waves_per_eu": 1
    },
    "1200": {
      "BLOCK_M": 32,
      "BLOCK_N": 16,
      "BLOCK_K": 256,
      "BLOCK_C": 32,
      "NUM_KSPLIT": 4,
      "num_warps": 8,
      "num_stages": 1,
      "waves_per_eu": 0
    },
    "5270": {
      "BLOCK_M": 256,
      "BLOCK_N": 16,
      "BLOCK_K": 128,
      "BLOCK_C": 128,
      "NUM_KSPLIT": 1,
      "num_warps": 8,
      "num_stages": 1,
      "waves_per_eu": 2
    },
    "1500": {
      "BLOCK_M": 64,
      "BLOCK_N": 16,
      "BLOCK_K": 32,
      "BLOCK_C": 16,
      "NUM_KSPLIT": 8,
      "num_warps": 4,
      "num_stages": 1,
      "waves_per_eu": 0
    },
    "2705": {
      "BLOCK_M": 64,
      "BLOCK_N": 16,
      "BLOCK_K": 256,
      "BLOCK_C": 64,
      "NUM_KSPLIT": 4,
      "num_warps": 2,
      "num_stages": 2,
      "waves_per_eu": 2
    },
    "1541": {
      "BLOCK_M": 64,
      "BLOCK_N": 16,
      "BLOCK_K": 32,
      "BLOCK_C": 32,
      "NUM_KSPLIT": 2,
      "num_warps": 4,
      "num_stages": 2,
      "waves_per_eu": 2
    },
    "2107": {
      "BLOCK_M": 64,
      "BLOCK_N": 16,
      "BLOCK_K": 64,
      "BLOCK_C": 256,
      "NUM_KSPLIT": 2,
      "num_warps": 2,
      "num_stages": 1,
      "waves_per_eu": 1
    },
    "2993": {
      "BLOCK_M": 128,
      "BLOCK_N": 16,
      "BLOCK_K": 32,
      "BLOCK_C": 32,
      "NUM_KSPLIT": 4,
      "num_warps": 2,
      "num_stages": 2,
      "waves_per_eu": 2
    },
    "2123": {
      "BLOCK_M": 64,
      "BLOCK_N": 16,
      "BLOCK_K": 64,
      "BLOCK_C": 256,
      "NUM_KSPLIT": 2,
      "num_warps": 8,
      "num_stages": 2,
      "waves_per_eu": 2
    },
    "3522": {
      "BLOCK_M": 128,
      "BLOCK_N": 16,
      "BLOCK_K": 64,
      "BLOCK_C": 128,
      "NUM_KSPLIT": 8,
      "num_warps": 8,
      "num_stages": 1,
      "waves_per_eu": 0
    },
    "4994": {
      "BLOCK_M": 256,
      "BLOCK_N": 16,
      "BLOCK_K": 64,
      "BLOCK_C": 256,
      "NUM_KSPLIT": 2,
      "num_warps": 4,
      "num_stages": 1,
      "waves_per_eu": 2
    },
    "5426": {
      "BLOCK_M": 256,
      "BLOCK_N": 16,
      "BLOCK_K": 256,
      "BLOCK_C": 16,
      "NUM_KSPLIT": 2,
      "num_warps": 4,
      "num_stages": 1,
      "waves_per_eu": 2
    },
    "4655": {
      "BLOCK_M": 256,
      "BLOCK_N": 16,
      "BLOCK_K": 32,
      "BLOCK_C": 256,
      "NUM_KSPLIT": 4,
      "num_warps": 4,
      "num_stages": 2,
      "waves_per_eu": 2
    },
    "4027": {
      "BLOCK_M": 128,
      "BLOCK_N": 16,
      "BLOCK_K": 256,
      "BLOCK_C": 16,
      "NUM_KSPLIT": 8,
      "num_warps": 8,
      "num_stages": 1,
      "waves_per_eu": 1
    },
    "508": {
      "BLOCK_M": 32,
      "BLOCK_N": 16,
      "BLOCK_K": 64,
      "BLOCK_C": 64,
      "NUM_KSPLIT": 1,
      "num_warps": 2,
      "num_stages": 2,
      "waves_per_eu": 1
    },
    "1527": {
      "BLOCK_M": 64,
      "BLOCK_N": 16,
      "BLOCK_K": 32,
      "BLOCK_C": 32,
      "NUM_KSPLIT": 1,
      "num_warps": 8,
      "num_stages": 2,
      "waves_per_eu": 0
    },
    "1043": {
      "BLOCK_M": 32,
      "BLOCK_N": 16,
      "BLOCK_K": 128,
      "BLOCK_C": 256,
      "NUM_KSPLIT": 2,
      "num_warps": 8,
      "num_stages": 2,
      "waves_per_eu": 2
    },
    "1177": {
      "BLOCK_M": 32,
      "BLOCK_N": 16,
      "BLOCK_K": 256,
      "BLOCK_C": 32,
      "NUM_KSPLIT": 2,
      "num_warps": 4,
      "num_stages": 1,
      "waves_per_eu": 1
    },
    "4572": {
      "BLOCK_M": 256,
      "BLOCK_N": 16,
      "BLOCK_K": 32,
      "BLOCK_C": 128,
      "NUM_KSPLIT": 4,
      "num_warps": 2,
      "num_stages": 1,
      "waves_per_eu": 0
    },
    "5124": {
      "BLOCK_M": 256,
      "BLOCK_N": 16,
      "BLOCK_K": 128,
      "BLOCK_C": 32,
      "NUM_KSPLIT": 1,
      "num_warps": 8,
      "num_stages": 1,
      "waves_per_eu": 0
    },
    "362": {
      "BLOCK_M": 32,
      "BLOCK_N": 16,
      "BLOCK_K": 64,
      "BLOCK_C": 16,
      "NUM_KSPLIT": 1,
      "num_warps": 2,
      "num_stages": 1,
      "waves_per_eu": 2
    },
    "212": {
      "BLOCK_M": 32,
      "BLOCK_N": 16,
      "BLOCK_K": 32,
      "BLOCK_C": 64,
      "NUM_KSPLIT": 8,
      "num_warps": 8,
      "num_stages": 1,
      "waves_per_eu": 2
    },
    "2304": {
      "BLOCK_M": 64,
      "BLOCK_N": 16,
      "BLOCK_K": 128,
      "BLOCK_C": 64,
      "NUM_KSPLIT": 1,
      "num_warps": 2,
      "num_stages": 1,
      "waves_per_eu": 0
    },
    "5706": {
      "BLOCK_M": 256,
      "BLOCK_N": 16,
      "BLOCK_K": 256,
      "BLOCK_C": 256,
      "NUM_KSPLIT": 2,
      "num_warps": 2,
      "num_stages": 1,
      "waves_per_eu": 0
    },
    "5437": {
      "BLOCK_M": 256,
      "BLOCK_N": 16,
      "BLOCK_K": 256,
      "BLOCK_C": 16,
      "NUM_KSPLIT": 4,
      "num_warps": 2,
      "num_stages": 1,
      "waves_per_eu": 1
    },
    "5154": {
      "BLOCK_M": 256,
      "BLOCK_N": 16,
      "BLOCK_K": 128,
      "BLOCK_C": 32,
      "NUM_KSPLIT": 4,
      "num_warps": 4,
      "num_stages": 1,
      "waves_per_eu": 0
    },
    "2499": {
      "BLOCK_M": 64,
      "BLOCK_N": 16,
      "BLOCK_K": 128,
      "BLOCK_C": 256,
      "NUM_KSPLIT": 4,
      "num_warps": 8,
      "num_stages": 2,
      "waves_per_eu": 0
    },
    "1125": {
      "BLOCK_M": 32,
      "BLOCK_N": 16,
      "BLOCK_K": 256,
      "BLOCK_C": 16,
      "NUM_KSPLIT": 4,
      "num_warps": 4,
      "num_stages": 2,
      "waves_per_eu": 0
    },
    "530": {
      "BLOCK_M": 32,
      "BLOCK_N": 16,
      "BLOCK_K": 64,
      "BLOCK_C": 64,
      "NUM_KSPLIT": 2,
      "num_warps": 4,
      "num_stages": 1,
      "waves_per_eu": 2
    },
    "4278": {
      "BLOCK_M": 128,
      "BLOCK_N": 16,
      "BLOCK_K": 256,
      "BLOCK_C": 256,
      "NUM_KSPLIT": 2,
      "num_warps": 8,
      "num_stages": 1,
      "waves_per_eu": 0
    },
    "1993": {
      "BLOCK_M": 64,
      "BLOCK_N": 16,
      "BLOCK_K": 64,
      "BLOCK_C": 64,
      "NUM_KSPLIT": 4,
      "num_warps": 8,
      "num_stages": 1,
      "waves_per_eu": 1
    },
    "4608": {
      "BLOCK_M": 256,
      "BLOCK_N": 16,
      "BLOCK_K": 32,
      "BLOCK_C": 256,
      "NUM_KSPLIT": 1,
      "num_warps": 2,
      "num_stages": 1,
      "waves_per_eu": 0
    },
    "5550": {
      "BLOCK_M": 256,
      "BLOCK_N": 16,
      "BLOCK_K": 256,
      "BLOCK_C": 64,
      "NUM_KSPLIT": 1,
      "num_warps": 4,
      "num_stages": 1,
      "waves_per_eu": 0
    },
    "4796": {
      "BLOCK_M": 256,
      "BLOCK_N": 16,
      "BLOCK_K": 64,
      "BLOCK_C": 32,
      "NUM_KSPLIT": 4,
      "num_warps": 4,
      "num_stages": 1,
      "waves_per_eu": 2
    },
    "5572": {
      "BLOCK_M": 256,
      "BLOCK_N": 16,
      "BLOCK_K": 256,
      "BLOCK_C": 64,
      "NUM_KSPLIT": 2,
      "num_warps": 4,
      "num_stages": 2,
      "waves_per_eu": 1
    },
    "1287": {
      "BLOCK_M": 32,
      "BLOCK_N": 16,
      "BLOCK_K": 256,
      "BLOCK_C": 64,
      "NUM_KSPLIT": 8,
      "num_warps": 4,
      "num_stages": 2,
      "waves_per_eu": 0
    },
    "5385": {
      "BLOCK_M": 256,
      "BLOCK_N": 16,
      "BLOCK_K": 128,
      "BLOCK_C": 256,
      "NUM_KSPLIT": 8,
      "num_warps": 2,
      "num_stages": 2,
      "waves_per_eu": 0
    },
    "1106": {
      "BLOCK_M": 32,
      "BLOCK_N": 16,
      "BLOCK_K": 256,
      "BLOCK_C": 16,
      "NUM_KSPLIT": 2,
      "num_warps": 4,
      "num_stages": 1,
      "waves_per_eu": 2
    },
    "4790": {
      "BLOCK_M": 256,
      "BLOCK_N": 16,
      "BLOCK_K": 64,
      "BLOCK_C": 32,
      "NUM_KSPLIT": 4,
      "num_warps": 2,
      "num_stages": 1,
      "waves_per_eu": 2
    },
    "2113": {
      "BLOCK_M": 64,
      "BLOCK_N": 16,
      "BLOCK_K": 64,
      "BLOCK_C": 256,
      "NUM_KSPLIT": 2,
      "num_warps": 4,
      "num_stages": 1,
      "waves_per_eu": 1
    },
    "3420": {
      "BLOCK_M": 128,
      "BLOCK_N": 16,
      "BLOCK_K": 64,
      "BLOCK_C": 64,
      "NUM_KSPLIT": 4,
      "num_warps": 2,
      "num_stages": 1,
      "waves_per_eu": 0
    },
    "3495": {
      "BLOCK_M": 128,
      "BLOCK_N": 16,
      "BLOCK_K": 64,
      "BLOCK_C": 128,
      "NUM_KSPLIT": 4,
      "num_warps": 2,
      "num_stages": 2,
      "waves_per_eu": 0
    },
    "5409": {
      "BLOCK_M": 256,
      "BLOCK_N": 16,
      "BLOCK_K": 256,
      "BLOCK_C": 16,
      "NUM_KSPLIT": 1,
      "num_warps": 4,
      "num_stages": 2,
      "waves_per_eu": 0
    },
    "3623": {
      "BLOCK_M": 128,
      "BLOCK_N": 16,
      "BLOCK_K": 128,
      "BLOCK_C": 16,
      "NUM_KSPLIT": 2,
      "num_warps": 2,
      "num_stages": 2,
      "waves_per_eu": 2
    },
    "3558": {
      "BLOCK_M": 128,
      "BLOCK_N": 16,
      "BLOCK_K": 64,
      "BLOCK_C": 256,
      "NUM_KSPLIT": 2,
      "num_warps": 8,
      "num_stages": 1,
      "waves_per_eu": 0
    },
    "1169": {
      "BLOCK_M": 32,
      "BLOCK_N": 16,
      "BLOCK_K": 256,
      "BLOCK_C": 32,
      "NUM_KSPLIT": 1,
      "num_warps": 8,
      "num_stages": 2,
      "waves_per_eu": 2
    },
    "924": {
      "BLOCK_M": 32,
      "BLOCK_N": 16,
      "BLOCK_K": 128,
      "BLOCK_C": 64,
      "NUM_KSPLIT": 8,
      "num_warps": 4,
      "num_stages": 1,
      "waves_per_eu": 0
    },
    "5033": {
      "BLOCK_M": 256,
      "BLOCK_N": 16,
      "BLOCK_K": 64,
      "BLOCK_C": 256,
      "NUM_KSPLIT": 8,
      "num_warps": 4,
      "num_stages": 2,
      "waves_per_eu": 2
    },
    "1314": {
      "BLOCK_M": 32,
      "BLOCK_N": 16,
      "BLOCK_K": 256,
      "BLOCK_C": 128,
      "NUM_KSPLIT": 2,
      "num_warps": 2,
      "num_stages": 1,
      "waves_per_eu": 0
    },
    "2457": {
      "BLOCK_M": 64,
      "BLOCK_N": 16,
      "BLOCK_K": 128,
      "BLOCK_C": 256,
      "NUM_KSPLIT": 1,
      "num_warps": 4,
      "num_stages": 2,
      "waves_per_eu": 0
    },
    "3639": {
      "BLOCK_M": 128,
      "BLOCK_N": 16,
      "BLOCK_K": 128,
      "BLOCK_C": 16,
      "NUM_KSPLIT": 4,
      "num_warps": 2,
      "num_stages": 2,
      "waves_per_eu": 0
    },
    "4980": {
      "BLOCK_M": 256,
      "BLOCK_N": 16,
      "BLOCK_K": 64,
      "BLOCK_C": 256,
      "NUM_KSPLIT": 1,
      "num_warps": 8,
      "num_stages": 1,
      "waves_per_eu": 0
    },
    "2283": {
      "BLOCK_M": 64,
      "BLOCK_N": 16,
      "BLOCK_K": 128,
      "BLOCK_C": 32,
      "NUM_KSPLIT": 4,
      "num_warps": 8,
      "num_stages": 2,
      "waves_per_eu": 0
    },
    "5229": {
      "BLOCK_M": 256,
      "BLOCK_N": 16,
      "BLOCK_K": 128,
      "BLOCK_C": 64,
      "NUM_KSPLIT": 4,
      "num_warps": 4,
      "num_stages": 2,
      "waves_per_eu": 0
    },
    "977": {
      "BLOCK_M": 32,
      "BLOCK_N": 16,
      "BLOCK_K": 128,
      "BLOCK_C": 128,
      "NUM_KSPLIT": 4,
      "num_warps": 2,
      "num_stages": 2,
      "waves_per_eu": 2
    },
    "2536": {
      "BLOCK_M": 64,
      "BLOCK_N": 16,
      "BLOCK_K": 256,
      "BLOCK_C": 16,
      "NUM_KSPLIT": 1,
      "num_warps": 8,
      "num_stages": 2,
      "waves_per_eu": 1
    },
    "2289": {
      "BLOCK_M": 64,
      "BLOCK_N": 16,
      "BLOCK_K": 128,
      "BLOCK_C": 32,
      "NUM_KSPLIT": 8,
      "num_warps": 2,
      "num_stages": 2,
      "waves_per_eu": 0
    },
    "5449": {
      "BLOCK_M": 256,
      "BLOCK_N": 16,
      "BLOCK_K": 256,
      "BLOCK_C": 16,
      "NUM_KSPLIT": 4,
      "num_warps": 8,
      "num_stages": 1,
      "waves_per_eu": 1
    },
    "4204": {
      "BLOCK_M": 128,
      "BLOCK_N": 16,
      "BLOCK_K": 256,
      "BLOCK_C": 128,
      "NUM_KSPLIT": 2,
      "num_warps": 4,
      "num_stages": 2,
      "waves_per_eu": 1
    },
    "5297": {
      "BLOCK_M": 256,
      "BLOCK_N": 16,
      "BLOCK_K": 128,
      "BLOCK_C": 128,
      "NUM_KSPLIT": 4,
      "num_warps": 2,
      "num_stages": 2,
      "waves_per_eu": 2
    },
    "3551": {
      "BLOCK_M": 128,
      "BLOCK_N": 16,
      "BLOCK_K": 64,
      "BLOCK_C": 256,
      "NUM_KSPLIT": 2,
      "num_warps": 2,
      "num_stages": 2,
      "waves_per_eu": 2
    },
    "3782": {
      "BLOCK_M": 128,
      "BLOCK_N": 16,
      "BLOCK_K": 128,
      "BLOCK_C": 64,
      "NUM_KSPLIT": 4,
      "num_warps": 2,
      "num_stages": 1,
      "waves_per_eu": 2
    },
    "2903": {
      "BLOCK_M": 128,
      "BLOCK_N": 16,
      "BLOCK_K": 32,
      "BLOCK_C": 16,
      "NUM_KSPLIT": 2,
      "num_warps": 2,
      "num_stages": 2,
      "waves_per_eu": 2
    },
    "2277": {
      "BLOCK_M": 64,
      "BLOCK_N": 16,
      "BLOCK_K": 128,
      "BLOCK_C": 32,
      "NUM_KSPLIT": 4,
      "num_warps": 4,
      "num_stages": 2,
      "waves_per_eu": 0
    },
    "1322": {
      "BLOCK_M": 32,
      "BLOCK_N": 16,
      "BLOCK_K": 256,
      "BLOCK_C": 128,
      "NUM_KSPLIT": 2,
      "num_warps": 4,
      "num_stages": 1,
      "waves_per_eu": 2
    },
    "1864": {
      "BLOCK_M": 64,
      "BLOCK_N": 16,
      "BLOCK_K": 64,
      "BLOCK_C": 16,
      "NUM_KSPLIT": 8,
      "num_warps": 4,
      "num_stages": 2,
      "waves_per_eu": 1
    },
    "478": {
      "BLOCK_M": 32,
      "BLOCK_N": 16,
      "BLOCK_K": 64,
      "BLOCK_C": 32,
      "NUM_KSPLIT": 4,
      "num_warps": 4,
      "num_stages": 2,
      "waves_per_eu": 1
    },
    "5196": {
      "BLOCK_M": 256,
      "BLOCK_N": 16,
      "BLOCK_K": 128,
      "BLOCK_C": 64,
      "NUM_KSPLIT": 1,
      "num_warps": 8,
      "num_stages": 1,
      "waves_per_eu": 0
    },
    "4160": {
      "BLOCK_M": 128,
      "BLOCK_N": 16,
      "BLOCK_K": 256,
      "BLOCK_C": 64,
      "NUM_KSPLIT": 8,
      "num_warps": 2,
      "num_stages": 1,
      "waves_per_eu": 2
    },
    "2876": {
      "BLOCK_M": 64,
      "BLOCK_N": 16,
      "BLOCK_K": 256,
      "BLOCK_C": 256,
      "NUM_KSPLIT": 8,
      "num_warps": 8,
      "num_stages": 1,
      "waves_per_eu": 2
    },
    "2080": {
      "BLOCK_M": 64,
      "BLOCK_N": 16,
      "BLOCK_K": 64,
      "BLOCK_C": 128,
      "NUM_KSPLIT": 8,
      "num_warps": 4,
      "num_stages": 2,
      "waves_per_eu": 1
    },
    "787": {
      "BLOCK_M": 32,
      "BLOCK_N": 16,
      "BLOCK_K": 128,
      "BLOCK_C": 16,
      "NUM_KSPLIT": 8,
      "num_warps": 8,
      "num_stages": 1,
      "waves_per_eu": 1
    },
    "2648": {
      "BLOCK_M": 64,
      "BLOCK_N": 16,
      "BLOCK_K": 256,
      "BLOCK_C": 32,
      "NUM_KSPLIT": 8,
      "num_warps": 2,
      "num_stages": 1,
      "waves_per_eu": 2
    },
    "91": {
      "BLOCK_M": 32,
      "BLOCK_N": 16,
      "BLOCK_K": 32,
      "BLOCK_C": 32,
      "NUM_KSPLIT": 2,
      "num_warps": 2,
      "num_stages": 1,
      "waves_per_eu": 1
    },
    "255": {
      "BLOCK_M": 32,
      "BLOCK_N": 16,
      "BLOCK_K": 32,
      "BLOCK_C": 128,
      "NUM_KSPLIT": 4,
      "num_warps": 2,
      "num_stages": 2,
      "waves_per_eu": 0
    },
    "4952": {
      "BLOCK_M": 256,
      "BLOCK_N": 16,
      "BLOCK_K": 64,
      "BLOCK_C": 128,
      "NUM_KSPLIT": 8,
      "num_warps": 2,
      "num_stages": 1,
      "waves_per_eu": 2
    },
    "1242": {
      "BLOCK_M": 32,
      "BLOCK_N": 16,
      "BLOCK_K": 256,
      "BLOCK_C": 64,
      "NUM_KSPLIT": 2,
      "num_warps": 2,
      "num_stages": 1,
      "waves_per_eu": 0
    },
    "2664": {
      "BLOCK_M": 64,
      "BLOCK_N": 16,
      "BLOCK_K": 256,
      "BLOCK_C": 64,
      "NUM_KSPLIT": 1,
      "num_warps": 2,
      "num_stages": 1,
      "waves_per_eu": 0
    },
    "483": {
      "BLOCK_M": 32,
      "BLOCK_N": 16,
      "BLOCK_K": 64,
      "BLOCK_C": 32,
      "NUM_KSPLIT": 4,
      "num_warps": 8,
      "num_stages": 2,
      "waves_per_eu": 0
    },
    "5338": {
      "BLOCK_M": 256,
      "BLOCK_N": 16,
      "BLOCK_K": 128,
      "BLOCK_C": 256,
      "NUM_KSPLIT": 1,
      "num_warps": 4,
      "num_stages": 2,
      "waves_per_eu": 1
    },
    "75": {
      "BLOCK_M": 32,
      "BLOCK_N": 16,
      "BLOCK_K": 32,
      "BLOCK_C": 32,
      "NUM_KSPLIT": 1,
      "num_warps": 2,
      "num_stages": 2,
      "waves_per_eu": 0
    },
    "2238": {
      "BLOCK_M": 64,
      "BLOCK_N": 16,
      "BLOCK_K": 128,
      "BLOCK_C": 32,
      "NUM_KSPLIT": 1,
      "num_warps": 4,
      "num_stages": 1,
      "waves_per_eu": 0
    },
    "5192": {
      "BLOCK_M": 256,
      "BLOCK_N": 16,
      "BLOCK_K": 128,
      "BLOCK_C": 64,
      "NUM_KSPLIT": 1,
      "num_warps": 4,
      "num_stages": 1,
      "waves_per_eu": 2
    },
    "1974": {
      "BLOCK_M": 64,
      "BLOCK_N": 16,
      "BLOCK_K": 64,
      "BLOCK_C": 64,
      "NUM_KSPLIT": 2,
      "num_warps": 8,
      "num_stages": 1,
      "waves_per_eu": 0
    },
    "3944": {
      "BLOCK_M": 128,
      "BLOCK_N": 16,
      "BLOCK_K": 128,
      "BLOCK_C": 256,
      "NUM_KSPLIT": 8,
      "num_warps": 2,
      "num_stages": 1,
      "waves_per_eu": 2
    },
    "486": {
      "BLOCK_M": 32,
      "BLOCK_N": 16,
      "BLOCK_K": 64,
      "BLOCK_C": 32,
      "NUM_KSPLIT": 8,
      "num_warps": 2,
      "num_stages": 1,
      "waves_per_eu": 0
    },
    "3657": {
      "BLOCK_M": 128,
      "BLOCK_N": 16,
      "BLOCK_K": 128,
      "BLOCK_C": 16,
      "NUM_KSPLIT": 8,
      "num_warps": 2,
      "num_stages": 2,
      "waves_per_eu": 0
    },
    "1587": {
      "BLOCK_M": 64,
      "BLOCK_N": 16,
      "BLOCK_K": 32,
      "BLOCK_C": 64,
      "NUM_KSPLIT": 1,
      "num_warps": 2,
      "num_stages": 2,
      "waves_per_eu": 0
    },
    "200": {
      "BLOCK_M": 32,
      "BLOCK_N": 16,
      "BLOCK_K": 32,
      "BLOCK_C": 64,
      "NUM_KSPLIT": 8,
      "num_warps": 2,
      "num_stages": 1,
      "waves_per_eu": 2
    },
    "5224": {
      "BLOCK_M": 256,
      "BLOCK_N": 16,
      "BLOCK_K": 128,
      "BLOCK_C": 64,
      "NUM_KSPLIT": 4,
      "num_warps": 2,
      "num_stages": 2,
      "waves_per_eu": 1
    },
    "4838": {
      "BLOCK_M": 256,
      "BLOCK_N": 16,
      "BLOCK_K": 64,
      "BLOCK_C": 64,
      "NUM_KSPLIT": 1,
      "num_warps": 8,
      "num_stages": 1,
      "waves_per_eu": 2
    },
    "2226": {
      "BLOCK_M": 64,
      "BLOCK_N": 16,
      "BLOCK_K": 128,
      "BLOCK_C": 16,
      "NUM_KSPLIT": 8,
      "num_warps": 8,
      "num_stages": 1,
      "waves_per_eu": 0
    },
    "1560": {
      "BLOCK_M": 64,
      "BLOCK_N": 16,
      "BLOCK_K": 32,
      "BLOCK_C": 32,
      "NUM_KSPLIT": 4,
      "num_warps": 8,
      "num_stages": 1,
      "waves_per_eu": 0
    },
    "5052": {
      "BLOCK_M": 256,
      "BLOCK_N": 16,
      "BLOCK_K": 128,
      "BLOCK_C": 16,
      "NUM_KSPLIT": 1,
      "num_warps": 8,
      "num_stages": 1,
      "waves_per_eu": 0
    },
    "5500": {
      "BLOCK_M": 256,
      "BLOCK_N": 16,
      "BLOCK_K": 256,
      "BLOCK_C": 32,
      "NUM_KSPLIT": 2,
      "num_warps": 4,
      "num_stages": 2,
      "waves_per_eu": 1
    },
    "2104": {
      "BLOCK_M": 64,
      "BLOCK_N": 16,
      "BLOCK_K": 64,
      "BLOCK_C": 256,
      "NUM_KSPLIT": 1,
      "num_warps": 8,
      "num_stages": 2,
      "waves_per_eu": 1
    },
    "4487": {
      "BLOCK_M": 256,
      "BLOCK_N": 16,
      "BLOCK_K": 32,
      "BLOCK_C": 64,
      "NUM_KSPLIT": 2,
      "num_warps": 2,
      "num_stages": 2,
      "waves_per_eu": 2
    },
    "2460": {
      "BLOCK_M": 64,
      "BLOCK_N": 16,
      "BLOCK_K": 128,
      "BLOCK_C": 256,
      "NUM_KSPLIT": 1,
      "num_warps": 8,
      "num_stages": 1,
      "waves_per_eu": 0
    },
    "5173": {
      "BLOCK_M": 256,
      "BLOCK_N": 16,
      "BLOCK_K": 128,
      "BLOCK_C": 32,
      "NUM_KSPLIT": 8,
      "num_warps": 4,
      "num_stages": 1,
      "waves_per_eu": 1
    },
    "4520": {
      "BLOCK_M": 256,
      "BLOCK_N": 16,
      "BLOCK_K": 32,
      "BLOCK_C": 64,
      "NUM_KSPLIT": 8,
      "num_warps": 2,
      "num_stages": 1,
      "waves_per_eu": 2
    },
    "5547": {
      "BLOCK_M": 256,
      "BLOCK_N": 16,
      "BLOCK_K": 256,
      "BLOCK_C": 64,
      "NUM_KSPLIT": 1,
      "num_warps": 2,
      "num_stages": 2,
      "waves_per_eu": 0
    },
    "2801": {
      "BLOCK_M": 64,
      "BLOCK_N": 16,
      "BLOCK_K": 256,
      "BLOCK_C": 128,
      "NUM_KSPLIT": 8,
      "num_warps": 4,
      "num_stages": 2,
      "waves_per_eu": 2
    },
    "4418": {
      "BLOCK_M": 256,
      "BLOCK_N": 16,
      "BLOCK_K": 32,
      "BLOCK_C": 32,
      "NUM_KSPLIT": 2,
      "num_warps": 4,
      "num_stages": 1,
      "waves_per_eu": 2
    },
    "2429": {
      "BLOCK_M": 64,
      "BLOCK_N": 16,
      "BLOCK_K": 128,
      "BLOCK_C": 128,
      "NUM_KSPLIT": 4,
      "num_warps": 8,
      "num_stages": 2,
      "waves_per_eu": 2
    },
    "3277": {
      "BLOCK_M": 128,
      "BLOCK_N": 16,
      "BLOCK_K": 64,
      "BLOCK_C": 16,
      "NUM_KSPLIT": 4,
      "num_warps": 2,
      "num_stages": 1,
      "waves_per_eu": 1
    },
    "898": {
      "BLOCK_M": 32,
      "BLOCK_N": 16,
      "BLOCK_K": 128,
      "BLOCK_C": 64,
      "NUM_KSPLIT": 2,
      "num_warps": 8,
      "num_stages": 2,
      "waves_per_eu": 1
    },
    "3375": {
      "BLOCK_M": 128,
      "BLOCK_N": 16,
      "BLOCK_K": 64,
      "BLOCK_C": 32,
      "NUM_KSPLIT": 8,
      "num_warps": 4,
      "num_stages": 2,
      "waves_per_eu": 0
    },
    "4571": {
      "BLOCK_M": 256,
      "BLOCK_N": 16,
      "BLOCK_K": 32,
      "BLOCK_C": 128,
      "NUM_KSPLIT": 2,
      "num_warps": 8,
      "num_stages": 2,
      "waves_per_eu": 2
    },
    "784": {
      "BLOCK_M": 32,
      "BLOCK_N": 16,
      "BLOCK_K": 128,
      "BLOCK_C": 16,
      "NUM_KSPLIT": 8,
      "num_warps": 4,
      "num_stages": 2,
      "waves_per_eu": 1
    },
    "4385": {
      "BLOCK_M": 256,
      "BLOCK_N": 16,
      "BLOCK_K": 32,
      "BLOCK_C": 16,
      "NUM_KSPLIT": 8,
      "num_warps": 4,
      "num_stages": 2,
      "waves_per_eu": 2
    },
    "5587": {
      "BLOCK_M": 256,
      "BLOCK_N": 16,
      "BLOCK_K": 256,
      "BLOCK_C": 64,
      "NUM_KSPLIT": 4,
      "num_warps": 4,
      "num_stages": 1,
      "waves_per_eu": 1
    },
    "2720": {
      "BLOCK_M": 64,
      "BLOCK_N": 16,
      "BLOCK_K": 256,
      "BLOCK_C": 64,
      "NUM_KSPLIT": 8,
      "num_warps": 2,
      "num_stages": 1,
      "waves_per_eu": 2
    },
    "2728": {
      "BLOCK_M": 64,
      "BLOCK_N": 16,
      "BLOCK_K": 256,
      "BLOCK_C": 64,
      "NUM_KSPLIT": 8,
      "num_warps": 4,
      "num_stages": 2,
      "waves_per_eu": 1
    },
    "4003": {
      "BLOCK_M": 128,
      "BLOCK_N": 16,
      "BLOCK_K": 256,
      "BLOCK_C": 16,
      "NUM_KSPLIT": 4,
      "num_warps": 4,
      "num_stages": 1,
      "waves_per_eu": 1
    },
    "1485": {
      "BLOCK_M": 64,
      "BLOCK_N": 16,
      "BLOCK_K": 32,
      "BLOCK_C": 16,
      "NUM_KSPLIT": 4,
      "num_warps": 4,
      "num_stages": 2,
      "waves_per_eu": 0
    },
    "203": {
      "BLOCK_M": 32,
      "BLOCK_N": 16,
      "BLOCK_K": 32,
      "BLOCK_C": 64,
      "NUM_KSPLIT": 8,
      "num_warps": 2,
      "num_stages": 2,
      "waves_per_eu": 2
    },
    "4323": {
      "BLOCK_M": 256,
      "BLOCK_N": 16,
      "BLOCK_K": 32,
      "BLOCK_C": 16,
      "NUM_KSPLIT": 1,
      "num_warps": 2,
      "num_stages": 2,
      "waves_per_eu": 0
    },
    "4034": {
      "BLOCK_M": 128,
      "BLOCK_N": 16,
      "BLOCK_K": 256,
      "BLOCK_C": 32,
      "NUM_KSPLIT": 1,
      "num_warps": 2,
      "num_stages": 1,
      "waves_per_eu": 2
    },
    "2673": {
      "BLOCK_M": 64,
      "BLOCK_N": 16,
      "BLOCK_K": 256,
      "BLOCK_C": 64,
      "NUM_KSPLIT": 1,
      "num_warps": 4,
      "num_stages": 2,
      "waves_per_eu": 0
    },
    "662": {
      "BLOCK_M": 32,
      "BLOCK_N": 16,
      "BLOCK_K": 64,
      "BLOCK_C": 256,
      "NUM_KSPLIT": 1,
      "num_warps": 8,
      "num_stages": 1,
      "waves_per_eu": 2
    },
    "1549": {
      "BLOCK_M": 64,
      "BLOCK_N": 16,
      "BLOCK_K": 32,
      "BLOCK_C": 32,
      "NUM_KSPLIT": 4,
      "num_warps": 2,
      "num_stages": 1,
      "waves_per_eu": 1
    },
    "3382": {
      "BLOCK_M": 128,
      "BLOCK_N": 16,
      "BLOCK_K": 64,
      "BLOCK_C": 32,
      "NUM_KSPLIT": 8,
      "num_warps": 8,
      "num_stages": 2,
      "waves_per_eu": 1
    },
    "1051": {
      "BLOCK_M": 32,
      "BLOCK_N": 16,
      "BLOCK_K": 128,
      "BLOCK_C": 256,
      "NUM_KSPLIT": 4,
      "num_warps": 4,
      "num_stages": 1,
      "waves_per_eu": 1
    },
    "2148": {
      "BLOCK_M": 64,
      "BLOCK_N": 16,
      "BLOCK_K": 64,
      "BLOCK_C": 256,
      "NUM_KSPLIT": 8,
      "num_warps": 4,
      "num_stages": 1,
      "waves_per_eu": 0
    },
    "1390": {
      "BLOCK_M": 32,
      "BLOCK_N": 16,
      "BLOCK_K": 256,
      "BLOCK_C": 256,
      "NUM_KSPLIT": 2,
      "num_warps": 2,
      "num_stages": 2,
      "waves_per_eu": 1
    },
    "1943": {
      "BLOCK_M": 64,
      "BLOCK_N": 16,
      "BLOCK_K": 64,
      "BLOCK_C": 32,
      "NUM_KSPLIT": 8,
      "num_warps": 8,
      "num_stages": 2,
      "waves_per_eu": 2
    },
    "3830": {
      "BLOCK_M": 128,
      "BLOCK_N": 16,
      "BLOCK_K": 128,
      "BLOCK_C": 128,
      "NUM_KSPLIT": 1,
      "num_warps": 8,
      "num_stages": 1,
      "waves_per_eu": 2
    },
    "2741": {
      "BLOCK_M": 64,
      "BLOCK_N": 16,
      "BLOCK_K": 256,
      "BLOCK_C": 128,
      "NUM_KSPLIT": 1,
      "num_warps": 2,
      "num_stages": 2,
      "waves_per_eu": 2
    },
    "1874": {
      "BLOCK_M": 64,
      "BLOCK_N": 16,
      "BLOCK_K": 64,
      "BLOCK_C": 32,
      "NUM_KSPLIT": 1,
      "num_warps": 2,
      "num_stages": 1,
      "waves_per_eu": 2
    },
    "3340": {
      "BLOCK_M": 128,
      "BLOCK_N": 16,
      "BLOCK_K": 64,
      "BLOCK_C": 32,
      "NUM_KSPLIT": 2,
      "num_warps": 4,
      "num_stages": 2,
      "waves_per_eu": 1
    },
    "5045": {
      "BLOCK_M": 256,
      "BLOCK_N": 16,
      "BLOCK_K": 128,
      "BLOCK_C": 16,
      "NUM_KSPLIT": 1,
      "num_warps": 2,
      "num_stages": 2,
      "waves_per_eu": 2
    },
    "2090": {
      "BLOCK_M": 64,
      "BLOCK_N": 16,
      "BLOCK_K": 64,
      "BLOCK_C": 256,
      "NUM_KSPLIT": 1,
      "num_warps": 2,
      "num_stages": 1,
      "waves_per_eu": 2
    },
    "998": {
      "BLOCK_M": 32,
      "BLOCK_N": 16,
      "BLOCK_K": 128,
      "BLOCK_C": 128,
      "NUM_KSPLIT": 8,
      "num_warps": 4,
      "num_stages": 1,
      "waves_per_eu": 2
    },
    "500": {
      "BLOCK_M": 32,
      "BLOCK_N": 16,
      "BLOCK_K": 64,
      "BLOCK_C": 32,
      "NUM_KSPLIT": 8,
      "num_warps": 8,
      "num_stages": 1,
      "waves_per_eu": 2
    },
    "3217": {
      "BLOCK_M": 128,
      "BLOCK_N": 16,
      "BLOCK_K": 32,
      "BLOCK_C": 256,
      "NUM_KSPLIT": 4,
      "num_warps": 8,
      "num_stages": 1,
      "waves_per_eu": 1
    },
    "1109": {
      "BLOCK_M": 32,
      "BLOCK_N": 16,
      "BLOCK_K": 256,
      "BLOCK_C": 16,
      "NUM_KSPLIT": 2,
      "num_warps": 4,
      "num_stages": 2,
      "waves_per_eu": 2
    },
    "1824": {
      "BLOCK_M": 64,
      "BLOCK_N": 16,
      "BLOCK_K": 64,
      "BLOCK_C": 16,
      "NUM_KSPLIT": 2,
      "num_warps": 4,
      "num_stages": 1,
      "waves_per_eu": 0
    },
    "2023": {
      "BLOCK_M": 64,
      "BLOCK_N": 16,
      "BLOCK_K": 64,
      "BLOCK_C": 128,
      "NUM_KSPLIT": 1,
      "num_warps": 4,
      "num_stages": 1,
      "waves_per_eu": 1
    },
    "4959": {
      "BLOCK_M": 256,
      "BLOCK_N": 16,
      "BLOCK_K": 64,
      "BLOCK_C": 128,
      "NUM_KSPLIT": 8,
      "num_warps": 4,
      "num_stages": 2,
      "waves_per_eu": 0
    },
    "780": {
      "BLOCK_M": 32,
      "BLOCK_N": 16,
      "BLOCK_K": 128,
      "BLOCK_C": 16,
      "NUM_KSPLIT": 8,
      "num_warps": 4,
      "num_stages": 1,
      "waves_per_eu": 0
    },
    "4833": {
      "BLOCK_M": 256,
      "BLOCK_N": 16,
      "BLOCK_K": 64,
      "BLOCK_C": 64,
      "NUM_KSPLIT": 1,
      "num_warps": 4,
      "num_stages": 2,
      "waves_per_eu": 0
    },
    "4724": {
      "BLOCK_M": 256,
      "BLOCK_N": 16,
      "BLOCK_K": 64,
      "BLOCK_C": 16,
      "NUM_KSPLIT": 4,
      "num_warps": 4,
      "num_stages": 1,
      "waves_per_eu": 2
    },
    "3166": {
      "BLOCK_M": 128,
      "BLOCK_N": 16,
      "BLOCK_K": 32,
      "BLOCK_C": 128,
      "NUM_KSPLIT": 8,
      "num_warps": 8,
      "num_stages": 2,
      "waves_per_eu": 1
    },
    "5460": {
      "BLOCK_M": 256,
      "BLOCK_N": 16,
      "BLOCK_K": 256,
      "BLOCK_C": 16,
      "NUM_KSPLIT": 8,
      "num_warps": 4,
      "num_stages": 1,
      "waves_per_eu": 0
    },
    "1629": {
      "BLOCK_M": 64,
      "BLOCK_N": 16,
      "BLOCK_K": 32,
      "BLOCK_C": 64,
      "NUM_KSPLIT": 4,
      "num_warps": 4,
      "num_stages": 2,
      "waves_per_eu": 0
    },
    "3652": {
      "BLOCK_M": 128,
      "BLOCK_N": 16,
      "BLOCK_K": 128,
      "BLOCK_C": 16,
      "NUM_KSPLIT": 4,
      "num_warps": 8,
      "num_stages": 2,
      "waves_per_eu": 1
    },
    "5181": {
      "BLOCK_M": 256,
      "BLOCK_N": 16,
      "BLOCK_K": 128,
      "BLOCK_C": 32,
      "NUM_KSPLIT": 8,
      "num_warps": 8,
      "num_stages": 2,
      "waves_per_eu": 0
    },
    "2144": {
      "BLOCK_M": 64,
      "BLOCK_N": 16,
      "BLOCK_K": 64,
      "BLOCK_C": 256,
      "NUM_KSPLIT": 8,
      "num_warps": 2,
      "num_stages": 1,
      "waves_per_eu": 2
    },
    "3129": {
      "BLOCK_M": 128,
      "BLOCK_N": 16,
      "BLOCK_K": 32,
      "BLOCK_C": 128,
      "NUM_KSPLIT": 2,
      "num_warps": 8,
      "num_stages": 2,
      "waves_per_eu": 0
    },
    "4021": {
      "BLOCK_M": 128,
      "BLOCK_N": 16,
      "BLOCK_K": 256,
      "BLOCK_C": 16,
      "NUM_KSPLIT": 8,
      "num_warps": 4,
      "num_stages": 1,
      "waves_per_eu": 1
    },
    "2509": {
      "BLOCK_M": 64,
      "BLOCK_N": 16,
      "BLOCK_K": 128,
      "BLOCK_C": 256,
      "NUM_KSPLIT": 8,
      "num_warps": 4,
      "num_stages": 1,
      "waves_per_eu": 1
    },
    "1266": {
      "BLOCK_M": 32,
      "BLOCK_N": 16,
      "BLOCK_K": 256,
      "BLOCK_C": 64,
      "NUM_KSPLIT": 4,
      "num_warps": 4,
      "num_stages": 1,
      "waves_per_eu": 0
    },
    "334": {
      "BLOCK_M": 32,
      "BLOCK_N": 16,
      "BLOCK_K": 32,
      "BLOCK_C": 256,
      "NUM_KSPLIT": 4,
      "num_warps": 4,
      "num_stages": 2,
      "waves_per_eu": 1
    },
    "1906": {
      "BLOCK_M": 64,
      "BLOCK_N": 16,
      "BLOCK_K": 64,
      "BLOCK_C": 32,
      "NUM_KSPLIT": 2,
      "num_warps": 8,
      "num_stages": 2,
      "waves_per_eu": 1
    },
    "5678": {
      "BLOCK_M": 256,
      "BLOCK_N": 16,
      "BLOCK_K": 256,
      "BLOCK_C": 128,
      "NUM_KSPLIT": 8,
      "num_warps": 4,
      "num_stages": 1,
      "waves_per_eu": 2
    },
    "4446": {
      "BLOCK_M": 256,
      "BLOCK_N": 16,
      "BLOCK_K": 32,
      "BLOCK_C": 32,
      "NUM_KSPLIT": 8,
      "num_warps": 2,
      "num_stages": 1,
      "waves_per_eu": 0
    },
    "868": {
      "BLOCK_M": 32,
      "BLOCK_N": 16,
      "BLOCK_K": 128,
      "BLOCK_C": 64,
      "NUM_KSPLIT": 1,
      "num_warps": 2,
      "num_stages": 2,
      "waves_per_eu": 1
    },
    "3096": {
      "BLOCK_M": 128,
      "BLOCK_N": 16,
      "BLOCK_K": 32,
      "BLOCK_C": 128,
      "NUM_KSPLIT": 1,
      "num_warps": 2,
      "num_stages": 1,
      "waves_per_eu": 0
    },
    "4682": {
      "BLOCK_M": 256,
      "BLOCK_N": 16,
      "BLOCK_K": 64,
      "BLOCK_C": 16,
      "NUM_KSPLIT": 1,
      "num_warps": 2,
      "num_stages": 1,
      "waves_per_eu": 2
    },
    "3917": {
      "BLOCK_M": 128,
      "BLOCK_N": 16,
      "BLOCK_K": 128,
      "BLOCK_C": 256,
      "NUM_KSPLIT": 2,
      "num_warps": 4,
      "num_stages": 2,
      "waves_per_eu": 2
    },
    "1645": {
      "BLOCK_M": 64,
      "BLOCK_N": 16,
      "BLOCK_K": 32,
      "BLOCK_C": 64,
      "NUM_KSPLIT": 8,
      "num_warps": 4,
      "num_stages": 1,
      "waves_per_eu": 1
    },
    "1521": {
      "BLOCK_M": 64,
      "BLOCK_N": 16,
      "BLOCK_K": 32,
      "BLOCK_C": 32,
      "NUM_KSPLIT": 1,
      "num_warps": 4,
      "num_stages": 2,
      "waves_per_eu": 0
    },
    "1723": {
      "BLOCK_M": 64,
      "BLOCK_N": 16,
      "BLOCK_K": 32,
      "BLOCK_C": 128,
      "NUM_KSPLIT": 8,
      "num_warps": 8,
      "num_stages": 1,
      "waves_per_eu": 1
    },
    "545": {
      "BLOCK_M": 32,
      "BLOCK_N": 16,
      "BLOCK_K": 64,
      "BLOCK_C": 64,
      "NUM_KSPLIT": 4,
      "num_warps": 2,
      "num_stages": 2,
      "waves_per_eu": 2
    },
    "5334": {
      "BLOCK_M": 256,
      "BLOCK_N": 16,
      "BLOCK_K": 128,
      "BLOCK_C": 256,
      "NUM_KSPLIT": 1,
      "num_warps": 4,
      "num_stages": 1,
      "waves_per_eu": 0
    },
    "5098": {
      "BLOCK_M": 256,
      "BLOCK_N": 16,
      "BLOCK_K": 128,
      "BLOCK_C": 16,
      "NUM_KSPLIT": 8,
      "num_warps": 2,
      "num_stages": 2,
      "waves_per_eu": 1
    },
    "5671": {
      "BLOCK_M": 256,
      "BLOCK_N": 16,
      "BLOCK_K": 256,
      "BLOCK_C": 128,
      "NUM_KSPLIT": 8,
      "num_warps": 2,
      "num_stages": 1,
      "waves_per_eu": 1
    },
    "4853": {
      "BLOCK_M": 256,
      "BLOCK_N": 16,
      "BLOCK_K": 64,
      "BLOCK_C": 64,
      "NUM_KSPLIT": 2,
      "num_warps": 4,
      "num_stages": 2,
      "waves_per_eu": 2
    },
    "5559": {
      "BLOCK_M": 256,
      "BLOCK_N": 16,
      "BLOCK_K": 256,
      "BLOCK_C": 64,
      "NUM_KSPLIT": 1,
      "num_warps": 8,
      "num_stages": 2,
      "waves_per_eu": 0
    },
    "4104": {
      "BLOCK_M": 128,
      "BLOCK_N": 16,
      "BLOCK_K": 256,
      "BLOCK_C": 64,
      "NUM_KSPLIT": 1,
      "num_warps": 2,
      "num_stages": 1,
      "waves_per_eu": 0
    },
    "963": {
      "BLOCK_M": 32,
      "BLOCK_N": 16,
      "BLOCK_K": 128,
      "BLOCK_C": 128,
      "NUM_KSPLIT": 2,
      "num_warps": 4,
      "num_stages": 2,
      "waves_per_eu": 0
    },
    "1618": {
      "BLOCK_M": 64,
      "BLOCK_N": 16,
      "BLOCK_K": 32,
      "BLOCK_C": 64,
      "NUM_KSPLIT": 2,
      "num_warps": 8,
      "num_stages": 2,
      "waves_per_eu": 1
    },
    "687": {
      "BLOCK_M": 32,
      "BLOCK_N": 16,
      "BLOCK_K": 64,
      "BLOCK_C": 256,
      "NUM_KSPLIT": 4,
      "num_warps": 2,
      "num_stages": 2,
      "waves_per_eu": 0
    },
    "4314": {
      "BLOCK_M": 128,
      "BLOCK_N": 16,
      "BLOCK_K": 256,
      "BLOCK_C": 256,
      "NUM_KSPLIT": 8,
      "num_warps": 8,
      "num_stages": 1,
      "waves_per_eu": 0
    },
    "2733": {
      "BLOCK_M": 64,
      "BLOCK_N": 16,
      "BLOCK_K": 256,
      "BLOCK_C": 64,
      "NUM_KSPLIT": 8,
      "num_warps": 8,
      "num_stages": 2,
      "waves_per_eu": 0
    },
    "4696": {
      "BLOCK_M": 256,
      "BLOCK_N": 16,
      "BLOCK_K": 64,
      "BLOCK_C": 16,
      "NUM_KSPLIT": 1,
      "num_warps": 8,
      "num_stages": 2,
      "waves_per_eu": 1
    },
    "1920": {
      "BLOCK_M": 64,
      "BLOCK_N": 16,
      "BLOCK_K": 64,
      "BLOCK_C": 32,
      "NUM_KSPLIT": 4,
      "num_warps": 8,
      "num_stages": 1,
      "waves_per_eu": 0
    },
    "3706": {
      "BLOCK_M": 128,
      "BLOCK_N": 16,
      "BLOCK_K": 128,
      "BLOCK_C": 32,
      "NUM_KSPLIT": 2,
      "num_warps": 8,
      "num_stages": 2,
      "waves_per_eu": 1
    },
    "4882": {
      "BLOCK_M": 256,
      "BLOCK_N": 16,
      "BLOCK_K": 64,
      "BLOCK_C": 64,
      "NUM_KSPLIT": 8,
      "num_warps": 2,
      "num_stages": 2,
      "waves_per_eu": 1
    },
    "5458": {
      "BLOCK_M": 256,
      "BLOCK_N": 16,
      "BLOCK_K": 256,
      "BLOCK_C": 16,
      "NUM_KSPLIT": 8,
      "num_warps": 2,
      "num_stages": 2,
      "waves_per_eu": 1
    },
    "5002": {
      "BLOCK_M": 256,
      "BLOCK_N": 16,
      "BLOCK_K": 64,
      "BLOCK_C": 256,
      "NUM_KSPLIT": 2,
      "num_warps": 8,
      "num_stages": 2,
      "waves_per_eu": 1
    },
    "1801": {
      "BLOCK_M": 64,
      "BLOCK_N": 16,
      "BLOCK_K": 64,
      "BLOCK_C": 16,
      "NUM_KSPLIT": 1,
      "num_warps": 2,
      "num_stages": 1,
      "waves_per_eu": 1
    },
    "4517": {
      "BLOCK_M": 256,
      "BLOCK_N": 16,
      "BLOCK_K": 32,
      "BLOCK_C": 64,
      "NUM_KSPLIT": 4,
      "num_warps": 8,
      "num_stages": 2,
      "waves_per_eu": 2
    },
    "3767": {
      "BLOCK_M": 128,
      "BLOCK_N": 16,
      "BLOCK_K": 128,
      "BLOCK_C": 64,
      "NUM_KSPLIT": 2,
      "num_warps": 2,
      "num_stages": 2,
      "waves_per_eu": 2
    },
    "3745": {
      "BLOCK_M": 128,
      "BLOCK_N": 16,
      "BLOCK_K": 128,
      "BLOCK_C": 64,
      "NUM_KSPLIT": 1,
      "num_warps": 2,
      "num_stages": 1,
      "waves_per_eu": 1
    },
    "3376": {
      "BLOCK_M": 128,
      "BLOCK_N": 16,
      "BLOCK_K": 64,
      "BLOCK_C": 32,
      "NUM_KSPLIT": 8,
      "num_warps": 4,
      "num_stages": 2,
      "waves_per_eu": 1
    },
    "16": {
      "BLOCK_M": 32,
      "BLOCK_N": 16,
      "BLOCK_K": 32,
      "BLOCK_C": 16,
      "NUM_KSPLIT": 1,
      "num_warps": 8,
      "num_stages": 2,
      "waves_per_eu": 1
    },
    "1887": {
      "BLOCK_M": 64,
      "BLOCK_N": 16,
      "BLOCK_K": 64,
      "BLOCK_C": 32,
      "NUM_KSPLIT": 1,
      "num_warps": 8,
      "num_stages": 2,
      "waves_per_eu": 0
    },
    "2262": {
      "BLOCK_M": 64,
      "BLOCK_N": 16,
      "BLOCK_K": 128,
      "BLOCK_C": 32,
      "NUM_KSPLIT": 2,
      "num_warps": 8,
      "num_stages": 1,
      "waves_per_eu": 0
    },
    "3241": {
      "BLOCK_M": 128,
      "BLOCK_N": 16,
      "BLOCK_K": 64,
      "BLOCK_C": 16,
      "NUM_KSPLIT": 1,
      "num_warps": 2,
      "num_stages": 1,
      "waves_per_eu": 1
    },
    "880": {
      "BLOCK_M": 32,
      "BLOCK_N": 16,
      "BLOCK_K": 128,
      "BLOCK_C": 64,
      "NUM_KSPLIT": 1,
      "num_warps": 8,
      "num_stages": 2,
      "waves_per_eu": 1
    },
    "3279": {
      "BLOCK_M": 128,
      "BLOCK_N": 16,
      "BLOCK_K": 64,
      "BLOCK_C": 16,
      "NUM_KSPLIT": 4,
      "num_warps": 2,
      "num_stages": 2,
      "waves_per_eu": 0
    },
    "4226": {
      "BLOCK_M": 128,
      "BLOCK_N": 16,
      "BLOCK_K": 256,
      "BLOCK_C": 128,
      "NUM_KSPLIT": 4,
      "num_warps": 8,
      "num_stages": 1,
      "waves_per_eu": 2
    },
    "3793": {
      "BLOCK_M": 128,
      "BLOCK_N": 16,
      "BLOCK_K": 128,
      "BLOCK_C": 64,
      "NUM_KSPLIT": 4,
      "num_warps": 8,
      "num_stages": 1,
      "waves_per_eu": 1
    },
    "352": {
      "BLOCK_M": 32,
      "BLOCK_N": 16,
      "BLOCK_K": 32,
      "BLOCK_C": 256,
      "NUM_KSPLIT": 8,
      "num_warps": 4,
      "num_stages": 2,
      "waves_per_eu": 1
    },
    "4171": {
      "BLOCK_M": 128,
      "BLOCK_N": 16,
      "BLOCK_K": 256,
      "BLOCK_C": 64,
      "NUM_KSPLIT": 8,
      "num_warps": 8,
      "num_stages": 1,
      "waves_per_eu": 1
    },
    "3979": {
      "BLOCK_M": 128,
      "BLOCK_N": 16,
      "BLOCK_K": 256,
      "BLOCK_C": 16,
      "NUM_KSPLIT": 2,
      "num_warps": 2,
      "num_stages": 1,
      "waves_per_eu": 1
    },
    "1908": {
      "BLOCK_M": 64,
      "BLOCK_N": 16,
      "BLOCK_K": 64,
      "BLOCK_C": 32,
      "NUM_KSPLIT": 4,
