tuning_results_mhc/gfx950/raw_tuner_outputs/tested_configs_mhc_fused_mhc_sk20_M4096_n4_C512.json
{
  "kernel": "fused_mhc",
  "M": 4096,
  "n": 4,
  "C": 512,
  "sinkhorn_iters": 20,
  "config_file": "tuning_results/tuning_space_mhc.json",
  "tested_configs_successful": {
    "339": {
      "BLOCK_M": 32,
      "BLOCK_N": 16,
      "BLOCK_K": 32,
      "BLOCK_C": 256,
      "NUM_KSPLIT": 4,
      "num_warps": 8,
      "num_stages": 2,
      "waves_per_eu": 0
    },
    "1065": {
      "BLOCK_M": 32,
      "BLOCK_N": 16,
      "BLOCK_K": 128,
      "BLOCK_C": 256,
      "NUM_KSPLIT": 8,
      "num_warps": 2,
      "num_stages": 2,
      "waves_per_eu": 0
    },
    "4102": {
      "BLOCK_M": 128,
      "BLOCK_N": 16,
      "BLOCK_K": 256,
      "BLOCK_C": 32,
      "NUM_KSPLIT": 8,
      "num_warps": 8,
      "num_stages": 2,
      "waves_per_eu": 1
    },
    "3769": {
      "BLOCK_M": 128,
      "BLOCK_N": 16,
      "BLOCK_K": 128,
      "BLOCK_C": 64,
      "NUM_KSPLIT": 2,
      "num_warps": 4,
      "num_stages": 1,
      "waves_per_eu": 1
    },
    "3674": {
      "BLOCK_M": 128,
      "BLOCK_N": 16,
      "BLOCK_K": 128,
      "BLOCK_C": 32,
      "NUM_KSPLIT": 1,
      "num_warps": 2,
      "num_stages": 1,
      "waves_per_eu": 2
    },
    "3428": {
      "BLOCK_M": 128,
      "BLOCK_N": 16,
      "BLOCK_K": 64,
      "BLOCK_C": 64,
      "NUM_KSPLIT": 4,
      "num_warps": 4,
      "num_stages": 1,
      "waves_per_eu": 2
    },
    "542": {
      "BLOCK_M": 32,
      "BLOCK_N": 16,
      "BLOCK_K": 64,
      "BLOCK_C": 64,
      "NUM_KSPLIT": 4,
      "num_warps": 2,
      "num_stages": 1,
      "waves_per_eu": 2
    },
    "4715": {
      "BLOCK_M": 256,
      "BLOCK_N": 16,
      "BLOCK_K": 64,
      "BLOCK_C": 16,
      "NUM_KSPLIT": 2,
      "num_warps": 8,
      "num_stages": 2,
      "waves_per_eu": 2
    },
    "5146": {
      "BLOCK_M": 256,
      "BLOCK_N": 16,
      "BLOCK_K": 128,
      "BLOCK_C": 32,
      "NUM_KSPLIT": 2,
      "num_warps": 8,
      "num_stages": 2,
      "waves_per_eu": 1
    },
    "3495": {
      "BLOCK_M": 128,
      "BLOCK_N": 16,
      "BLOCK_K": 64,
      "BLOCK_C": 128,
      "NUM_KSPLIT": 4,
      "num_warps": 2,
      "num_stages": 2,
      "waves_per_eu": 0
    },
    "3545": {
      "BLOCK_M": 128,
      "BLOCK_N": 16,
      "BLOCK_K": 64,
      "BLOCK_C": 256,
      "NUM_KSPLIT": 1,
      "num_warps": 8,
      "num_stages": 2,
      "waves_per_eu": 2
    },
    "396": {
      "BLOCK_M": 32,
      "BLOCK_N": 16,
      "BLOCK_K": 64,
      "BLOCK_C": 16,
      "NUM_KSPLIT": 4,
      "num_warps": 2,
      "num_stages": 1,
      "waves_per_eu": 0
    },
    "464": {
      "BLOCK_M": 32,
      "BLOCK_N": 16,
      "BLOCK_K": 64,
      "BLOCK_C": 32,
      "NUM_KSPLIT": 2,
      "num_warps": 8,
      "num_stages": 1,
      "waves_per_eu": 2
    },
    "4733": {
      "BLOCK_M": 256,
      "BLOCK_N": 16,
      "BLOCK_K": 64,
      "BLOCK_C": 16,
      "NUM_KSPLIT": 4,
      "num_warps": 8,
      "num_stages": 2,
      "waves_per_eu": 2
    },
    "1602": {
      "BLOCK_M": 64,
      "BLOCK_N": 16,
      "BLOCK_K": 32,
      "BLOCK_C": 64,
      "NUM_KSPLIT": 2,
      "num_warps": 2,
      "num_stages": 1,
      "waves_per_eu": 0
    },
    "4654": {
      "BLOCK_M": 256,
      "BLOCK_N": 16,
      "BLOCK_K": 32,
      "BLOCK_C": 256,
      "NUM_KSPLIT": 4,
      "num_warps": 4,
      "num_stages": 2,
      "waves_per_eu": 1
    },
    "787": {
      "BLOCK_M": 32,
      "BLOCK_N": 16,
      "BLOCK_K": 128,
      "BLOCK_C": 16,
      "NUM_KSPLIT": 8,
      "num_warps": 8,
      "num_stages": 1,
      "waves_per_eu": 1
    },
    "3844": {
      "BLOCK_M": 128,
      "BLOCK_N": 16,
      "BLOCK_K": 128,
      "BLOCK_C": 128,
      "NUM_KSPLIT": 2,
      "num_warps": 4,
      "num_stages": 2,
      "waves_per_eu": 1
    },
    "595": {
      "BLOCK_M": 32,
      "BLOCK_N": 16,
      "BLOCK_K": 64,
      "BLOCK_C": 128,
      "NUM_KSPLIT": 2,
      "num_warps": 2,
      "num_stages": 1,
      "waves_per_eu": 1
    },
    "546": {
      "BLOCK_M": 32,
      "BLOCK_N": 16,
      "BLOCK_K": 64,
      "BLOCK_C": 64,
      "NUM_KSPLIT": 4,
      "num_warps": 4,
      "num_stages": 1,
      "waves_per_eu": 0
    },
    "261": {
      "BLOCK_M": 32,
      "BLOCK_N": 16,
      "BLOCK_K": 32,
      "BLOCK_C": 128,
      "NUM_KSPLIT": 4,
      "num_warps": 4,
      "num_stages": 2,
      "waves_per_eu": 0
    },
    "3673": {
      "BLOCK_M": 128,
      "BLOCK_N": 16,
      "BLOCK_K": 128,
      "BLOCK_C": 32,
      "NUM_KSPLIT": 1,
      "num_warps": 2,
      "num_stages": 1,
      "waves_per_eu": 1
    },
    "3268": {
      "BLOCK_M": 128,
      "BLOCK_N": 16,
      "BLOCK_K": 64,
      "BLOCK_C": 16,
      "NUM_KSPLIT": 2,
      "num_warps": 4,
      "num_stages": 2,
      "waves_per_eu": 1
    },
    "4000": {
      "BLOCK_M": 128,
      "BLOCK_N": 16,
      "BLOCK_K": 256,
      "BLOCK_C": 16,
      "NUM_KSPLIT": 4,
      "num_warps": 2,
      "num_stages": 2,
      "waves_per_eu": 1
    },
    "2468": {
      "BLOCK_M": 64,
      "BLOCK_N": 16,
      "BLOCK_K": 128,
      "BLOCK_C": 256,
      "NUM_KSPLIT": 2,
      "num_warps": 2,
      "num_stages": 1,
      "waves_per_eu": 2
    },
    "5738": {
      "BLOCK_M": 256,
      "BLOCK_N": 16,
      "BLOCK_K": 256,
      "BLOCK_C": 256,
      "NUM_KSPLIT": 4,
      "num_warps": 8,
      "num_stages": 1,
      "waves_per_eu": 2
    },
    "1594": {
      "BLOCK_M": 64,
      "BLOCK_N": 16,
      "BLOCK_K": 32,
      "BLOCK_C": 64,
      "NUM_KSPLIT": 1,
      "num_warps": 4,
      "num_stages": 2,
      "waves_per_eu": 1
    },
    "257": {
      "BLOCK_M": 32,
      "BLOCK_N": 16,
      "BLOCK_K": 32,
      "BLOCK_C": 128,
      "NUM_KSPLIT": 4,
      "num_warps": 2,
      "num_stages": 2,
      "waves_per_eu": 2
    },
    "244": {
      "BLOCK_M": 32,
      "BLOCK_N": 16,
      "BLOCK_K": 32,
      "BLOCK_C": 128,
      "NUM_KSPLIT": 2,
      "num_warps": 4,
      "num_stages": 2,
      "waves_per_eu": 1
    },
    "1583": {
      "BLOCK_M": 64,
      "BLOCK_N": 16,
      "BLOCK_K": 32,
      "BLOCK_C": 32,
      "NUM_KSPLIT": 8,
      "num_warps": 8,
      "num_stages": 2,
      "waves_per_eu": 2
    },
    "5176": {
      "BLOCK_M": 256,
      "BLOCK_N": 16,
      "BLOCK_K": 128,
      "BLOCK_C": 32,
      "NUM_KSPLIT": 8,
      "num_warps": 4,
      "num_stages": 2,
      "waves_per_eu": 1
    },
    "2820": {
      "BLOCK_M": 64,
      "BLOCK_N": 16,
      "BLOCK_K": 256,
      "BLOCK_C": 256,
      "NUM_KSPLIT": 1,
      "num_warps": 8,
      "num_stages": 1,
      "waves_per_eu": 0
    },
    "3766": {
      "BLOCK_M": 128,
      "BLOCK_N": 16,
      "BLOCK_K": 128,
      "BLOCK_C": 64,
      "NUM_KSPLIT": 2,
      "num_warps": 2,
      "num_stages": 2,
      "waves_per_eu": 1
    },
    "403": {
      "BLOCK_M": 32,
      "BLOCK_N": 16,
      "BLOCK_K": 64,
      "BLOCK_C": 16,
      "NUM_KSPLIT": 4,
      "num_warps": 4,
      "num_stages": 1,
      "waves_per_eu": 1
    },
    "165": {
      "BLOCK_M": 32,
      "BLOCK_N": 16,
      "BLOCK_K": 32,
      "BLOCK_C": 64,
      "NUM_KSPLIT": 2,
      "num_warps": 2,
      "num_stages": 2,
      "waves_per_eu": 0
    },
    "3721": {
      "BLOCK_M": 128,
      "BLOCK_N": 16,
      "BLOCK_K": 128,
      "BLOCK_C": 32,
      "NUM_KSPLIT": 4,
      "num_warps": 8,
      "num_stages": 1,
      "waves_per_eu": 1
    },
    "5183": {
      "BLOCK_M": 256,
      "BLOCK_N": 16,
      "BLOCK_K": 128,
      "BLOCK_C": 32,
      "NUM_KSPLIT": 8,
      "num_warps": 8,
      "num_stages": 2,
      "waves_per_eu": 2
    },
    "3422": {
      "BLOCK_M": 128,
      "BLOCK_N": 16,
      "BLOCK_K": 64,
      "BLOCK_C": 64,
      "NUM_KSPLIT": 4,
      "num_warps": 2,
      "num_stages": 1,
      "waves_per_eu": 2
    },
    "1624": {
      "BLOCK_M": 64,
      "BLOCK_N": 16,
      "BLOCK_K": 32,
      "BLOCK_C": 64,
      "NUM_KSPLIT": 4,
      "num_warps": 2,
      "num_stages": 2,
      "waves_per_eu": 1
    },
    "5381": {
      "BLOCK_M": 256,
      "BLOCK_N": 16,
      "BLOCK_K": 128,
      "BLOCK_C": 256,
      "NUM_KSPLIT": 4,
      "num_warps": 8,
      "num_stages": 2,
      "waves_per_eu": 2
    },
    "1332": {
      "BLOCK_M": 32,
      "BLOCK_N": 16,
      "BLOCK_K": 256,
      "BLOCK_C": 128,
      "NUM_KSPLIT": 4,
      "num_warps": 2,
      "num_stages": 1,
      "waves_per_eu": 0
    },
    "1419": {
      "BLOCK_M": 32,
      "BLOCK_N": 16,
      "BLOCK_K": 256,
      "BLOCK_C": 256,
      "NUM_KSPLIT": 4,
      "num_warps": 8,
      "num_stages": 2,
      "waves_per_eu": 0
    },
    "297": {
      "BLOCK_M": 32,
      "BLOCK_N": 16,
      "BLOCK_K": 32,
      "BLOCK_C": 256,
      "NUM_KSPLIT": 1,
      "num_warps": 4,
      "num_stages": 2,
      "waves_per_eu": 0
    },
    "4817": {
      "BLOCK_M": 256,
      "BLOCK_N": 16,
      "BLOCK_K": 64,
      "BLOCK_C": 32,
      "NUM_KSPLIT": 8,
      "num_warps": 4,
      "num_stages": 2,
      "waves_per_eu": 2
    },
    "2204": {
      "BLOCK_M": 64,
      "BLOCK_N": 16,
      "BLOCK_K": 128,
      "BLOCK_C": 16,
      "NUM_KSPLIT": 4,
      "num_warps": 4,
      "num_stages": 1,
      "waves_per_eu": 2
    },
    "915": {
      "BLOCK_M": 32,
      "BLOCK_N": 16,
      "BLOCK_K": 128,
      "BLOCK_C": 64,
      "NUM_KSPLIT": 4,
      "num_warps": 8,
      "num_stages": 2,
      "waves_per_eu": 0
    },
    "3481": {
      "BLOCK_M": 128,
      "BLOCK_N": 16,
      "BLOCK_K": 64,
      "BLOCK_C": 128,
      "NUM_KSPLIT": 2,
      "num_warps": 4,
      "num_stages": 1,
      "waves_per_eu": 1
    },
    "5138": {
      "BLOCK_M": 256,
      "BLOCK_N": 16,
      "BLOCK_K": 128,
      "BLOCK_C": 32,
      "NUM_KSPLIT": 2,
      "num_warps": 4,
      "num_stages": 1,
      "waves_per_eu": 2
    },
    "3088": {
      "BLOCK_M": 128,
      "BLOCK_N": 16,
      "BLOCK_K": 32,
      "BLOCK_C": 64,
      "NUM_KSPLIT": 8,
      "num_warps": 4,
      "num_stages": 2,
      "waves_per_eu": 1
    },
    "5277": {
      "BLOCK_M": 256,
      "BLOCK_N": 16,
      "BLOCK_K": 128,
      "BLOCK_C": 128,
      "NUM_KSPLIT": 2,
      "num_warps": 2,
      "num_stages": 2,
      "waves_per_eu": 0
    },
    "1070": {
      "BLOCK_M": 32,
      "BLOCK_N": 16,
      "BLOCK_K": 128,
      "BLOCK_C": 256,
      "NUM_KSPLIT": 8,
      "num_warps": 4,
      "num_stages": 1,
      "waves_per_eu": 2
    },
    "4686": {
      "BLOCK_M": 256,
      "BLOCK_N": 16,
      "BLOCK_K": 64,
      "BLOCK_C": 16,
      "NUM_KSPLIT": 1,
      "num_warps": 4,
      "num_stages": 1,
      "waves_per_eu": 0
    },
    "645": {
      "BLOCK_M": 32,
      "BLOCK_N": 16,
      "BLOCK_K": 64,
      "BLOCK_C": 128,
      "NUM_KSPLIT": 8,
      "num_warps": 8,
      "num_stages": 2,
      "waves_per_eu": 0
    },
    "4983": {
      "BLOCK_M": 256,
      "BLOCK_N": 16,
      "BLOCK_K": 64,
      "BLOCK_C": 256,
      "NUM_KSPLIT": 1,
      "num_warps": 8,
      "num_stages": 2,
      "waves_per_eu": 0
    },
    "979": {
      "BLOCK_M": 32,
      "BLOCK_N": 16,
      "BLOCK_K": 128,
      "BLOCK_C": 128,
      "NUM_KSPLIT": 4,
      "num_warps": 4,
      "num_stages": 1,
      "waves_per_eu": 1
    },
    "4572": {
      "BLOCK_M": 256,
      "BLOCK_N": 16,
      "BLOCK_K": 32,
      "BLOCK_C": 128,
      "NUM_KSPLIT": 4,
      "num_warps": 2,
      "num_stages": 1,
      "waves_per_eu": 0
    },
    "5565": {
      "BLOCK_M": 256,
      "BLOCK_N": 16,
      "BLOCK_K": 256,
      "BLOCK_C": 64,
      "NUM_KSPLIT": 2,
      "num_warps": 2,
      "num_stages": 2,
      "waves_per_eu": 0
    },
    "3903": {
      "BLOCK_M": 128,
      "BLOCK_N": 16,
      "BLOCK_K": 128,
      "BLOCK_C": 256,
      "NUM_KSPLIT": 1,
      "num_warps": 8,
      "num_stages": 2,
      "waves_per_eu": 0
    },
    "5106": {
      "BLOCK_M": 256,
      "BLOCK_N": 16,
      "BLOCK_K": 128,
      "BLOCK_C": 16,
      "NUM_KSPLIT": 8,
      "num_warps": 8,
      "num_stages": 1,
      "waves_per_eu": 0
    },
    "5354": {
      "BLOCK_M": 256,
      "BLOCK_N": 16,
      "BLOCK_K": 128,
      "BLOCK_C": 256,
      "NUM_KSPLIT": 2,
      "num_warps": 4,
      "num_stages": 1,
      "waves_per_eu": 2
    },
    "2218": {
      "BLOCK_M": 64,
      "BLOCK_N": 16,
      "BLOCK_K": 128,
      "BLOCK_C": 16,
      "NUM_KSPLIT": 8,
      "num_warps": 2,
      "num_stages": 2,
      "waves_per_eu": 1
    },
    "3095": {
      "BLOCK_M": 128,
      "BLOCK_N": 16,
      "BLOCK_K": 32,
      "BLOCK_C": 64,
      "NUM_KSPLIT": 8,
      "num_warps": 8,
      "num_stages": 2,
      "waves_per_eu": 2
    },
    "2704": {
      "BLOCK_M": 64,
      "BLOCK_N": 16,
      "BLOCK_K": 256,
      "BLOCK_C": 64,
      "NUM_KSPLIT": 4,
      "num_warps": 2,
      "num_stages": 2,
      "waves_per_eu": 1
    },
    "3807": {
      "BLOCK_M": 128,
      "BLOCK_N": 16,
      "BLOCK_K": 128,
      "BLOCK_C": 64,
      "NUM_KSPLIT": 8,
      "num_warps": 4,
      "num_stages": 2,
      "waves_per_eu": 0
    },
    "2311": {
      "BLOCK_M": 64,
      "BLOCK_N": 16,
      "BLOCK_K": 128,
      "BLOCK_C": 64,
      "NUM_KSPLIT": 1,
      "num_warps": 4,
      "num_stages": 1,
      "waves_per_eu": 1
    },
    "5522": {
      "BLOCK_M": 256,
      "BLOCK_N": 16,
      "BLOCK_K": 256,
      "BLOCK_C": 32,
      "NUM_KSPLIT": 4,
      "num_warps": 8,
      "num_stages": 1,
      "waves_per_eu": 2
    },
    "4808": {
      "BLOCK_M": 256,
      "BLOCK_N": 16,
      "BLOCK_K": 64,
      "BLOCK_C": 32,
      "NUM_KSPLIT": 8,
      "num_warps": 2,
      "num_stages": 1,
      "waves_per_eu": 2
    },
    "2825": {
      "BLOCK_M": 64,
      "BLOCK_N": 16,
      "BLOCK_K": 256,
      "BLOCK_C": 256,
      "NUM_KSPLIT": 1,
      "num_warps": 8,
      "num_stages": 2,
      "waves_per_eu": 2
    },
    "765": {
      "BLOCK_M": 32,
      "BLOCK_N": 16,
      "BLOCK_K": 128,
      "BLOCK_C": 16,
      "NUM_KSPLIT": 4,
      "num_warps": 4,
      "num_stages": 2,
      "waves_per_eu": 0
    },
    "794": {
      "BLOCK_M": 32,
      "BLOCK_N": 16,
      "BLOCK_K": 128,
      "BLOCK_C": 32,
      "NUM_KSPLIT": 1,
      "num_warps": 2,
      "num_stages": 1,
      "waves_per_eu": 2
    },
    "1293": {
      "BLOCK_M": 32,
      "BLOCK_N": 16,
      "BLOCK_K": 256,
      "BLOCK_C": 64,
      "NUM_KSPLIT": 8,
      "num_warps": 8,
      "num_stages": 2,
      "waves_per_eu": 0
    },
    "4676": {
      "BLOCK_M": 256,
      "BLOCK_N": 16,
      "BLOCK_K": 32,
      "BLOCK_C": 256,
      "NUM_KSPLIT": 8,
      "num_warps": 8,
      "num_stages": 1,
      "waves_per_eu": 2
    },
    "1681": {
      "BLOCK_M": 64,
      "BLOCK_N": 16,
      "BLOCK_K": 32,
      "BLOCK_C": 128,
      "NUM_KSPLIT": 2,
      "num_warps": 4,
      "num_stages": 1,
      "waves_per_eu": 1
    },
    "2207": {
      "BLOCK_M": 64,
      "BLOCK_N": 16,
      "BLOCK_K": 128,
      "BLOCK_C": 16,
      "NUM_KSPLIT": 4,
      "num_warps": 4,
      "num_stages": 2,
      "waves_per_eu": 2
    },
    "87": {
      "BLOCK_M": 32,
      "BLOCK_N": 16,
      "BLOCK_K": 32,
      "BLOCK_C": 32,
      "NUM_KSPLIT": 1,
      "num_warps": 8,
      "num_stages": 2,
      "waves_per_eu": 0
    },
    "3282": {
      "BLOCK_M": 128,
      "BLOCK_N": 16,
      "BLOCK_K": 64,
      "BLOCK_C": 16,
      "NUM_KSPLIT": 4,
      "num_warps": 4,
      "num_stages": 1,
      "waves_per_eu": 0
    },
    "2731": {
      "BLOCK_M": 64,
      "BLOCK_N": 16,
      "BLOCK_K": 256,
      "BLOCK_C": 64,
      "NUM_KSPLIT": 8,
      "num_warps": 8,
      "num_stages": 1,
      "waves_per_eu": 1
    },
    "717": {
      "BLOCK_M": 32,
      "BLOCK_N": 16,
      "BLOCK_K": 64,
      "BLOCK_C": 256,
      "NUM_KSPLIT": 8,
      "num_warps": 8,
      "num_stages": 2,
      "waves_per_eu": 0
    },
    "5273": {
      "BLOCK_M": 256,
      "BLOCK_N": 16,
      "BLOCK_K": 128,
      "BLOCK_C": 128,
      "NUM_KSPLIT": 1,
      "num_warps": 8,
      "num_stages": 2,
      "waves_per_eu": 2
    },
    "1907": {
      "BLOCK_M": 64,
      "BLOCK_N": 16,
      "BLOCK_K": 64,
      "BLOCK_C": 32,
      "NUM_KSPLIT": 2,
      "num_warps": 8,
      "num_stages": 2,
      "waves_per_eu": 2
    },
    "3565": {
      "BLOCK_M": 128,
      "BLOCK_N": 16,
      "BLOCK_K": 64,
      "BLOCK_C": 256,
      "NUM_KSPLIT": 4,
      "num_warps": 2,
      "num_stages": 1,
      "waves_per_eu": 1
    },
    "2258": {
      "BLOCK_M": 64,
      "BLOCK_N": 16,
      "BLOCK_K": 128,
      "BLOCK_C": 32,
      "NUM_KSPLIT": 2,
      "num_warps": 4,
      "num_stages": 1,
      "waves_per_eu": 2
    },
    "752": {
      "BLOCK_M": 32,
      "BLOCK_N": 16,
      "BLOCK_K": 128,
      "BLOCK_C": 16,
      "NUM_KSPLIT": 2,
      "num_warps": 8,
      "num_stages": 1,
      "waves_per_eu": 2
    },
    "2748": {
      "BLOCK_M": 64,
      "BLOCK_N": 16,
      "BLOCK_K": 256,
      "BLOCK_C": 128,
      "NUM_KSPLIT": 1,
      "num_warps": 8,
      "num_stages": 1,
      "waves_per_eu": 0
    },
    "5638": {
      "BLOCK_M": 256,
      "BLOCK_N": 16,
      "BLOCK_K": 256,
      "BLOCK_C": 128,
      "NUM_KSPLIT": 2,
      "num_warps": 2,
      "num_stages": 2,
      "waves_per_eu": 1
    },
    "154": {
      "BLOCK_M": 32,
      "BLOCK_N": 16,
      "BLOCK_K": 32,
      "BLOCK_C": 64,
      "NUM_KSPLIT": 1,
      "num_warps": 4,
      "num_stages": 2,
      "waves_per_eu": 1
    },
    "4159": {
      "BLOCK_M": 128,
      "BLOCK_N": 16,
      "BLOCK_K": 256,
      "BLOCK_C": 64,
      "NUM_KSPLIT": 8,
      "num_warps": 2,
      "num_stages": 1,
      "waves_per_eu": 1
    },
    "2389": {
      "BLOCK_M": 64,
      "BLOCK_N": 16,
      "BLOCK_K": 128,
      "BLOCK_C": 128,
      "NUM_KSPLIT": 1,
      "num_warps": 8,
      "num_stages": 1,
      "waves_per_eu": 1
    },
    "4290": {
      "BLOCK_M": 128,
      "BLOCK_N": 16,
      "BLOCK_K": 256,
      "BLOCK_C": 256,
      "NUM_KSPLIT": 4,
      "num_warps": 4,
      "num_stages": 1,
      "waves_per_eu": 0
    },
    "233": {
      "BLOCK_M": 32,
      "BLOCK_N": 16,
      "BLOCK_K": 32,
      "BLOCK_C": 128,
      "NUM_KSPLIT": 1,
      "num_warps": 8,
      "num_stages": 2,
      "waves_per_eu": 2
    },
    "1222": {
      "BLOCK_M": 32,
      "BLOCK_N": 16,
      "BLOCK_K": 256,
      "BLOCK_C": 32,
      "NUM_KSPLIT": 8,
      "num_warps": 8,
      "num_stages": 2,
      "waves_per_eu": 1
    },
    "5270": {
      "BLOCK_M": 256,
      "BLOCK_N": 16,
      "BLOCK_K": 128,
      "BLOCK_C": 128,
      "NUM_KSPLIT": 1,
      "num_warps": 8,
      "num_stages": 1,
      "waves_per_eu": 2
    },
    "1128": {
      "BLOCK_M": 32,
      "BLOCK_N": 16,
      "BLOCK_K": 256,
      "BLOCK_C": 16,
      "NUM_KSPLIT": 4,
      "num_warps": 8,
      "num_stages": 1,
      "waves_per_eu": 0
    },
    "5520": {
      "BLOCK_M": 256,
      "BLOCK_N": 16,
      "BLOCK_K": 256,
      "BLOCK_C": 32,
      "NUM_KSPLIT": 4,
      "num_warps": 8,
      "num_stages": 1,
      "waves_per_eu": 0
    },
    "2013": {
      "BLOCK_M": 64,
      "BLOCK_N": 16,
      "BLOCK_K": 64,
      "BLOCK_C": 64,
      "NUM_KSPLIT": 8,
      "num_warps": 8,
      "num_stages": 2,
      "waves_per_eu": 0
    },
    "3475": {
      "BLOCK_M": 128,
      "BLOCK_N": 16,
      "BLOCK_K": 64,
      "BLOCK_C": 128,
      "NUM_KSPLIT": 2,
      "num_warps": 2,
      "num_stages": 1,
      "waves_per_eu": 1
    },
    "2865": {
      "BLOCK_M": 64,
      "BLOCK_N": 16,
      "BLOCK_K": 256,
      "BLOCK_C": 256,
      "NUM_KSPLIT": 8,
      "num_warps": 2,
      "num_stages": 2,
      "waves_per_eu": 0
    },
    "3939": {
      "BLOCK_M": 128,
      "BLOCK_N": 16,
      "BLOCK_K": 128,
      "BLOCK_C": 256,
      "NUM_KSPLIT": 4,
      "num_warps": 8,
      "num_stages": 2,
      "waves_per_eu": 0
    },
    "3912": {
      "BLOCK_M": 128,
      "BLOCK_N": 16,
      "BLOCK_K": 128,
      "BLOCK_C": 256,
      "NUM_KSPLIT": 2,
      "num_warps": 4,
      "num_stages": 1,
      "waves_per_eu": 0
    },
    "1504": {
      "BLOCK_M": 64,
      "BLOCK_N": 16,
      "BLOCK_K": 32,
      "BLOCK_C": 16,
      "NUM_KSPLIT": 8,
      "num_warps": 4,
      "num_stages": 2,
      "waves_per_eu": 1
    },
    "600": {
      "BLOCK_M": 32,
      "BLOCK_N": 16,
      "BLOCK_K": 64,
      "BLOCK_C": 128,
      "NUM_KSPLIT": 2,
      "num_warps": 4,
      "num_stages": 1,
      "waves_per_eu": 0
    },
    "281": {
      "BLOCK_M": 32,
      "BLOCK_N": 16,
      "BLOCK_K": 32,
      "BLOCK_C": 128,
      "NUM_KSPLIT": 8,
      "num_warps": 4,
      "num_stages": 2,
      "waves_per_eu": 2
    },
    "61": {
      "BLOCK_M": 32,
      "BLOCK_N": 16,
      "BLOCK_K": 32,
      "BLOCK_C": 16,
      "NUM_KSPLIT": 8,
      "num_warps": 4,
      "num_stages": 1,
      "waves_per_eu": 1
    },
    "131": {
      "BLOCK_M": 32,
      "BLOCK_N": 16,
      "BLOCK_K": 32,
      "BLOCK_C": 32,
      "NUM_KSPLIT": 8,
      "num_warps": 2,
      "num_stages": 2,
      "waves_per_eu": 2
    },
    "4510": {
      "BLOCK_M": 256,
      "BLOCK_N": 16,
      "BLOCK_K": 32,
      "BLOCK_C": 64,
      "NUM_KSPLIT": 4,
      "num_warps": 4,
      "num_stages": 2,
      "waves_per_eu": 1
    },
    "1967": {
      "BLOCK_M": 64,
      "BLOCK_N": 16,
      "BLOCK_K": 64,
      "BLOCK_C": 64,
      "NUM_KSPLIT": 2,
      "num_warps": 2,
      "num_stages": 2,
      "waves_per_eu": 2
    },
    "4695": {
      "BLOCK_M": 256,
      "BLOCK_N": 16,
      "BLOCK_K": 64,
      "BLOCK_C": 16,
      "NUM_KSPLIT": 1,
      "num_warps": 8,
      "num_stages": 2,
      "waves_per_eu": 0
    },
    "3194": {
      "BLOCK_M": 128,
      "BLOCK_N": 16,
      "BLOCK_K": 32,
      "BLOCK_C": 256,
      "NUM_KSPLIT": 2,
      "num_warps": 4,
      "num_stages": 1,
      "waves_per_eu": 2
    },
    "2662": {
      "BLOCK_M": 64,
      "BLOCK_N": 16,
      "BLOCK_K": 256,
      "BLOCK_C": 32,
      "NUM_KSPLIT": 8,
      "num_warps": 8,
      "num_stages": 2,
      "waves_per_eu": 1
    },
    "1944": {
      "BLOCK_M": 64,
      "BLOCK_N": 16,
      "BLOCK_K": 64,
      "BLOCK_C": 64,
      "NUM_KSPLIT": 1,
      "num_warps": 2,
      "num_stages": 1,
      "waves_per_eu": 0
    },
    "2813": {
      "BLOCK_M": 64,
      "BLOCK_N": 16,
      "BLOCK_K": 256,
      "BLOCK_C": 256,
      "NUM_KSPLIT": 1,
      "num_warps": 2,
      "num_stages": 2,
      "waves_per_eu": 2
    },
    "4538": {
      "BLOCK_M": 256,
      "BLOCK_N": 16,
      "BLOCK_K": 32,
      "BLOCK_C": 128,
      "NUM_KSPLIT": 1,
      "num_warps": 2,
      "num_stages": 1,
      "waves_per_eu": 2
    },
    "5052": {
      "BLOCK_M": 256,
      "BLOCK_N": 16,
      "BLOCK_K": 128,
      "BLOCK_C": 16,
      "NUM_KSPLIT": 1,
      "num_warps": 8,
      "num_stages": 1,
      "waves_per_eu": 0
    },
    "5125": {
      "BLOCK_M": 256,
      "BLOCK_N": 16,
      "BLOCK_K": 128,
      "BLOCK_C": 32,
      "NUM_KSPLIT": 1,
      "num_warps": 8,
      "num_stages": 1,
      "waves_per_eu": 1
    },
    "2740": {
      "BLOCK_M": 64,
      "BLOCK_N": 16,
      "BLOCK_K": 256,
      "BLOCK_C": 128,
      "NUM_KSPLIT": 1,
      "num_warps": 2,
      "num_stages": 2,
      "waves_per_eu": 1
    },
    "5241": {
      "BLOCK_M": 256,
      "BLOCK_N": 16,
      "BLOCK_K": 128,
      "BLOCK_C": 64,
      "NUM_KSPLIT": 8,
      "num_warps": 2,
      "num_stages": 2,
      "waves_per_eu": 0
    },
    "362": {
      "BLOCK_M": 32,
      "BLOCK_N": 16,
      "BLOCK_K": 64,
      "BLOCK_C": 16,
      "NUM_KSPLIT": 1,
      "num_warps": 2,
      "num_stages": 1,
      "waves_per_eu": 2
    },
    "3152": {
      "BLOCK_M": 128,
      "BLOCK_N": 16,
      "BLOCK_K": 32,
      "BLOCK_C": 128,
      "NUM_KSPLIT": 8,
      "num_warps": 2,
      "num_stages": 1,
      "waves_per_eu": 2
    },
    "5536": {
      "BLOCK_M": 256,
      "BLOCK_N": 16,
      "BLOCK_K": 256,
      "BLOCK_C": 32,
      "NUM_KSPLIT": 8,
      "num_warps": 4,
      "num_stages": 2,
      "waves_per_eu": 1
    },
    "4568": {
      "BLOCK_M": 256,
      "BLOCK_N": 16,
      "BLOCK_K": 32,
      "BLOCK_C": 128,
      "NUM_KSPLIT": 2,
      "num_warps": 8,
      "num_stages": 1,
      "waves_per_eu": 2
    },
    "2792": {
      "BLOCK_M": 64,
      "BLOCK_N": 16,
      "BLOCK_K": 256,
      "BLOCK_C": 128,
      "NUM_KSPLIT": 8,
      "num_warps": 2,
      "num_stages": 1,
      "waves_per_eu": 2
    },
    "2608": {
      "BLOCK_M": 64,
      "BLOCK_N": 16,
      "BLOCK_K": 256,
      "BLOCK_C": 32,
      "NUM_KSPLIT": 1,
      "num_warps": 8,
      "num_stages": 2,
      "waves_per_eu": 1
    },
    "1239": {
      "BLOCK_M": 32,
      "BLOCK_N": 16,
      "BLOCK_K": 256,
      "BLOCK_C": 64,
      "NUM_KSPLIT": 1,
      "num_warps": 8,
      "num_stages": 2,
      "waves_per_eu": 0
    },
    "2750": {
      "BLOCK_M": 64,
      "BLOCK_N": 16,
      "BLOCK_K": 256,
      "BLOCK_C": 128,
      "NUM_KSPLIT": 1,
      "num_warps": 8,
      "num_stages": 1,
      "waves_per_eu": 2
    },
    "1792": {
      "BLOCK_M": 64,
      "BLOCK_N": 16,
      "BLOCK_K": 32,
      "BLOCK_C": 256,
      "NUM_KSPLIT": 8,
      "num_warps": 4,
      "num_stages": 2,
      "waves_per_eu": 1
    },
    "3767": {
      "BLOCK_M": 128,
      "BLOCK_N": 16,
      "BLOCK_K": 128,
      "BLOCK_C": 64,
      "NUM_KSPLIT": 2,
      "num_warps": 2,
      "num_stages": 2,
      "waves_per_eu": 2
    },
    "4957": {
      "BLOCK_M": 256,
      "BLOCK_N": 16,
      "BLOCK_K": 64,
      "BLOCK_C": 128,
      "NUM_KSPLIT": 8,
      "num_warps": 4,
      "num_stages": 1,
      "waves_per_eu": 1
    },
    "4951": {
      "BLOCK_M": 256,
      "BLOCK_N": 16,
      "BLOCK_K": 64,
      "BLOCK_C": 128,
      "NUM_KSPLIT": 8,
      "num_warps": 2,
      "num_stages": 1,
      "waves_per_eu": 1
    },
    "3340": {
      "BLOCK_M": 128,
      "BLOCK_N": 16,
      "BLOCK_K": 64,
      "BLOCK_C": 32,
      "NUM_KSPLIT": 2,
      "num_warps": 4,
      "num_stages": 2,
      "waves_per_eu": 1
    },
    "2934": {
      "BLOCK_M": 128,
      "BLOCK_N": 16,
      "BLOCK_K": 32,
      "BLOCK_C": 16,
      "NUM_KSPLIT": 8,
      "num_warps": 2,
      "num_stages": 1,
      "waves_per_eu": 0
    },
    "4282": {
      "BLOCK_M": 128,
      "BLOCK_N": 16,
      "BLOCK_K": 256,
      "BLOCK_C": 256,
      "NUM_KSPLIT": 2,
      "num_warps": 8,
      "num_stages": 2,
      "waves_per_eu": 1
    },
    "198": {
      "BLOCK_M": 32,
      "BLOCK_N": 16,
      "BLOCK_K": 32,
      "BLOCK_C": 64,
      "NUM_KSPLIT": 8,
      "num_warps": 2,
      "num_stages": 1,
      "waves_per_eu": 0
    },
    "2002": {
      "BLOCK_M": 64,
      "BLOCK_N": 16,
      "BLOCK_K": 64,
      "BLOCK_C": 64,
      "NUM_KSPLIT": 8,
      "num_warps": 2,
      "num_stages": 2,
      "waves_per_eu": 1
    },
    "2096": {
      "BLOCK_M": 64,
      "BLOCK_N": 16,
      "BLOCK_K": 64,
      "BLOCK_C": 256,
      "NUM_KSPLIT": 1,
      "num_warps": 4,
      "num_stages": 1,
      "waves_per_eu": 2
    },
    "5531": {
      "BLOCK_M": 256,
      "BLOCK_N": 16,
      "BLOCK_K": 256,
      "BLOCK_C": 32,
      "NUM_KSPLIT": 8,
      "num_warps": 2,
      "num_stages": 2,
      "waves_per_eu": 2
    },
    "5599": {
      "BLOCK_M": 256,
      "BLOCK_N": 16,
      "BLOCK_K": 256,
      "BLOCK_C": 64,
      "NUM_KSPLIT": 8,
      "num_warps": 2,
      "num_stages": 1,
      "waves_per_eu": 1
    },
    "5180": {
      "BLOCK_M": 256,
      "BLOCK_N": 16,
      "BLOCK_K": 128,
      "BLOCK_C": 32,
      "NUM_KSPLIT": 8,
      "num_warps": 8,
      "num_stages": 1,
      "waves_per_eu": 2
    },
    "423": {
      "BLOCK_M": 32,
      "BLOCK_N": 16,
      "BLOCK_K": 64,
      "BLOCK_C": 16,
      "NUM_KSPLIT": 8,
      "num_warps": 4,
      "num_stages": 2,
      "waves_per_eu": 0
    },
    "2809": {
      "BLOCK_M": 64,
      "BLOCK_N": 16,
      "BLOCK_K": 256,
      "BLOCK_C": 256,
      "NUM_KSPLIT": 1,
      "num_warps": 2,
      "num_stages": 1,
      "waves_per_eu": 1
    },
    "434": {
      "BLOCK_M": 32,
      "BLOCK_N": 16,
      "BLOCK_K": 64,
      "BLOCK_C": 32,
      "NUM_KSPLIT": 1,
      "num_warps": 2,
      "num_stages": 1,
      "waves_per_eu": 2
    },
    "4134": {
      "BLOCK_M": 128,
      "BLOCK_N": 16,
      "BLOCK_K": 256,
      "BLOCK_C": 64,
      "NUM_KSPLIT": 2,
      "num_warps": 8,
      "num_stages": 1,
      "waves_per_eu": 0
    },
    "2953": {
      "BLOCK_M": 128,
      "BLOCK_N": 16,
      "BLOCK_K": 32,
      "BLOCK_C": 32,
      "NUM_KSPLIT": 1,
      "num_warps": 2,
      "num_stages": 1,
      "waves_per_eu": 1
    },
    "3444": {
      "BLOCK_M": 128,
      "BLOCK_N": 16,
      "BLOCK_K": 64,
      "BLOCK_C": 64,
      "NUM_KSPLIT": 8,
      "num_warps": 4,
      "num_stages": 1,
      "waves_per_eu": 0
    },
    "1453": {
      "BLOCK_M": 64,
      "BLOCK_N": 16,
      "BLOCK_K": 32,
      "BLOCK_C": 16,
      "NUM_KSPLIT": 1,
      "num_warps": 8,
      "num_stages": 1,
      "waves_per_eu": 1
    },
    "66": {
      "BLOCK_M": 32,
      "BLOCK_N": 16,
      "BLOCK_K": 32,
      "BLOCK_C": 16,
      "NUM_KSPLIT": 8,
      "num_warps": 8,
      "num_stages": 1,
      "waves_per_eu": 0
    },
    "507": {
      "BLOCK_M": 32,
      "BLOCK_N": 16,
      "BLOCK_K": 64,
      "BLOCK_C": 64,
      "NUM_KSPLIT": 1,
      "num_warps": 2,
      "num_stages": 2,
      "waves_per_eu": 0
    },
    "5418": {
      "BLOCK_M": 256,
      "BLOCK_N": 16,
      "BLOCK_K": 256,
      "BLOCK_C": 16,
      "NUM_KSPLIT": 2,
      "num_warps": 2,
      "num_stages": 1,
      "waves_per_eu": 0
    },
    "202": {
      "BLOCK_M": 32,
      "BLOCK_N": 16,
      "BLOCK_K": 32,
      "BLOCK_C": 64,
      "NUM_KSPLIT": 8,
      "num_warps": 2,
      "num_stages": 2,
      "waves_per_eu": 1
    },
    "5713": {
      "BLOCK_M": 256,
      "BLOCK_N": 16,
      "BLOCK_K": 256,
      "BLOCK_C": 256,
      "NUM_KSPLIT": 2,
      "num_warps": 4,
      "num_stages": 1,
      "waves_per_eu": 1
    },
    "4803": {
      "BLOCK_M": 256,
      "BLOCK_N": 16,
      "BLOCK_K": 64,
      "BLOCK_C": 32,
      "NUM_KSPLIT": 4,
      "num_warps": 8,
      "num_stages": 2,
      "waves_per_eu": 0
    },
    "438": {
      "BLOCK_M": 32,
      "BLOCK_N": 16,
      "BLOCK_K": 64,
      "BLOCK_C": 32,
      "NUM_KSPLIT": 1,
      "num_warps": 4,
      "num_stages": 1,
      "waves_per_eu": 0
    },
    "282": {
      "BLOCK_M": 32,
      "BLOCK_N": 16,
      "BLOCK_K": 32,
      "BLOCK_C": 128,
      "NUM_KSPLIT": 8,
      "num_warps": 8,
      "num_stages": 1,
      "waves_per_eu": 0
    },
    "4393": {
      "BLOCK_M": 256,
      "BLOCK_N": 16,
      "BLOCK_K": 32,
      "BLOCK_C": 32,
      "NUM_KSPLIT": 1,
      "num_warps": 2,
      "num_stages": 1,
      "waves_per_eu": 1
    },
    "3954": {
      "BLOCK_M": 128,
      "BLOCK_N": 16,
      "BLOCK_K": 128,
      "BLOCK_C": 256,
      "NUM_KSPLIT": 8,
      "num_warps": 8,
      "num_stages": 1,
      "waves_per_eu": 0
    },
    "1153": {
      "BLOCK_M": 32,
      "BLOCK_N": 16,
      "BLOCK_K": 256,
      "BLOCK_C": 32,
      "NUM_KSPLIT": 1,
      "num_warps": 2,
      "num_stages": 1,
      "waves_per_eu": 1
    },
    "2770": {
      "BLOCK_M": 64,
      "BLOCK_N": 16,
      "BLOCK_K": 256,
      "BLOCK_C": 128,
      "NUM_KSPLIT": 2,
      "num_warps": 8,
      "num_stages": 2,
      "waves_per_eu": 1
    },
    "4427": {
      "BLOCK_M": 256,
      "BLOCK_N": 16,
      "BLOCK_K": 32,
      "BLOCK_C": 32,
      "NUM_KSPLIT": 2,
      "num_warps": 8,
      "num_stages": 2,
      "waves_per_eu": 2
    },
    "821": {
      "BLOCK_M": 32,
      "BLOCK_N": 16,
      "BLOCK_K": 128,
      "BLOCK_C": 32,
      "NUM_KSPLIT": 2,
      "num_warps": 4,
      "num_stages": 2,
      "waves_per_eu": 2
    },
    "2490": {
      "BLOCK_M": 64,
      "BLOCK_N": 16,
      "BLOCK_K": 128,
      "BLOCK_C": 256,
      "NUM_KSPLIT": 4,
      "num_warps": 4,
      "num_stages": 1,
      "waves_per_eu": 0
    },
    "715": {
      "BLOCK_M": 32,
      "BLOCK_N": 16,
      "BLOCK_K": 64,
      "BLOCK_C": 256,
      "NUM_KSPLIT": 8,
      "num_warps": 8,
      "num_stages": 1,
      "waves_per_eu": 1
    },
    "1578": {
      "BLOCK_M": 64,
      "BLOCK_N": 16,
      "BLOCK_K": 32,
      "BLOCK_C": 32,
      "NUM_KSPLIT": 8,
      "num_warps": 8,
      "num_stages": 1,
      "waves_per_eu": 0
    },
    "1": {
      "BLOCK_M": 32,
      "BLOCK_N": 16,
      "BLOCK_K": 32,
      "BLOCK_C": 16,
      "NUM_KSPLIT": 1,
      "num_warps": 2,
      "num_stages": 1,
      "waves_per_eu": 1
    },
    "5647": {
      "BLOCK_M": 256,
      "BLOCK_N": 16,
      "BLOCK_K": 256,
      "BLOCK_C": 128,
      "NUM_KSPLIT": 2,
      "num_warps": 8,
      "num_stages": 1,
      "waves_per_eu": 1
    },
    "3121": {
      "BLOCK_M": 128,
      "BLOCK_N": 16,
      "BLOCK_K": 32,
      "BLOCK_C": 128,
      "NUM_KSPLIT": 2,
      "num_warps": 4,
      "num_stages": 1,
      "waves_per_eu": 1
    },
    "1868": {
      "BLOCK_M": 64,
      "BLOCK_N": 16,
      "BLOCK_K": 64,
      "BLOCK_C": 16,
      "NUM_KSPLIT": 8,
      "num_warps": 8,
      "num_stages": 1,
      "waves_per_eu": 2
    },
    "4616": {
      "BLOCK_M": 256,
      "BLOCK_N": 16,
      "BLOCK_K": 32,
      "BLOCK_C": 256,
      "NUM_KSPLIT": 1,
      "num_warps": 4,
      "num_stages": 1,
      "waves_per_eu": 2
    },
    "4466": {
      "BLOCK_M": 256,
      "BLOCK_N": 16,
      "BLOCK_K": 32,
      "BLOCK_C": 64,
      "NUM_KSPLIT": 1,
      "num_warps": 2,
      "num_stages": 1,
      "waves_per_eu": 2
    },
    "501": {
      "BLOCK_M": 32,
      "BLOCK_N": 16,
      "BLOCK_K": 64,
      "BLOCK_C": 32,
      "NUM_KSPLIT": 8,
      "num_warps": 8,
      "num_stages": 2,
      "waves_per_eu": 0
    },
    "1202": {
      "BLOCK_M": 32,
      "BLOCK_N": 16,
      "BLOCK_K": 256,
      "BLOCK_C": 32,
      "NUM_KSPLIT": 4,
      "num_warps": 8,
      "num_stages": 1,
      "waves_per_eu": 2
    },
    "5302": {
      "BLOCK_M": 256,
      "BLOCK_N": 16,
      "BLOCK_K": 128,
      "BLOCK_C": 128,
      "NUM_KSPLIT": 4,
      "num_warps": 4,
      "num_stages": 2,
      "waves_per_eu": 1
    },
    "1138": {
      "BLOCK_M": 32,
      "BLOCK_N": 16,
      "BLOCK_K": 256,
      "BLOCK_C": 16,
      "NUM_KSPLIT": 8,
      "num_warps": 2,
      "num_stages": 2,
      "waves_per_eu": 1
    },
    "5726": {
      "BLOCK_M": 256,
      "BLOCK_N": 16,
      "BLOCK_K": 256,
      "BLOCK_C": 256,
      "NUM_KSPLIT": 4,
      "num_warps": 2,
      "num_stages": 1,
      "waves_per_eu": 2
    },
    "3477": {
      "BLOCK_M": 128,
      "BLOCK_N": 16,
      "BLOCK_K": 64,
      "BLOCK_C": 128,
      "NUM_KSPLIT": 2,
      "num_warps": 2,
      "num_stages": 2,
      "waves_per_eu": 0
    },
    "5441": {
      "BLOCK_M": 256,
      "BLOCK_N": 16,
      "BLOCK_K": 256,
      "BLOCK_C": 16,
      "NUM_KSPLIT": 4,
      "num_warps": 2,
      "num_stages": 2,
      "waves_per_eu": 2
    },
    "4890": {
      "BLOCK_M": 256,
      "BLOCK_N": 16,
      "BLOCK_K": 64,
      "BLOCK_C": 64,
      "NUM_KSPLIT": 8,
      "num_warps": 8,
      "num_stages": 1,
      "waves_per_eu": 0
    },
    "747": {
      "BLOCK_M": 32,
      "BLOCK_N": 16,
      "BLOCK_K": 128,
      "BLOCK_C": 16,
      "NUM_KSPLIT": 2,
      "num_warps": 4,
      "num_stages": 2,
      "waves_per_eu": 0
    },
    "1454": {
      "BLOCK_M": 64,
      "BLOCK_N": 16,
      "BLOCK_K": 32,
      "BLOCK_C": 16,
      "NUM_KSPLIT": 1,
      "num_warps": 8,
      "num_stages": 1,
      "waves_per_eu": 2
    },
    "3700": {
      "BLOCK_M": 128,
      "BLOCK_N": 16,
      "BLOCK_K": 128,
      "BLOCK_C": 32,
      "NUM_KSPLIT": 2,
      "num_warps": 4,
      "num_stages": 2,
      "waves_per_eu": 1
    },
    "2384": {
      "BLOCK_M": 64,
      "BLOCK_N": 16,
      "BLOCK_K": 128,
      "BLOCK_C": 128,
      "NUM_KSPLIT": 1,
      "num_warps": 4,
      "num_stages": 1,
      "waves_per_eu": 2
    },
    "1728": {
      "BLOCK_M": 64,
      "BLOCK_N": 16,
      "BLOCK_K": 32,
      "BLOCK_C": 256,
      "NUM_KSPLIT": 1,
      "num_warps": 2,
      "num_stages": 1,
      "waves_per_eu": 0
    },
    "2295": {
      "BLOCK_M": 64,
      "BLOCK_N": 16,
      "BLOCK_K": 128,
      "BLOCK_C": 32,
      "NUM_KSPLIT": 8,
      "num_warps": 4,
      "num_stages": 2,
      "waves_per_eu": 0
    },
    "3214": {
      "BLOCK_M": 128,
      "BLOCK_N": 16,
      "BLOCK_K": 32,
      "BLOCK_C": 256,
      "NUM_KSPLIT": 4,
      "num_warps": 4,
      "num_stages": 2,
      "waves_per_eu": 1
    },
    "4177": {
      "BLOCK_M": 128,
      "BLOCK_N": 16,
      "BLOCK_K": 256,
      "BLOCK_C": 128,
      "NUM_KSPLIT": 1,
      "num_warps": 2,
      "num_stages": 1,
      "waves_per_eu": 1
    },
    "4597": {
      "BLOCK_M": 256,
      "BLOCK_N": 16,
      "BLOCK_K": 32,
      "BLOCK_C": 128,
      "NUM_KSPLIT": 8,
      "num_warps": 4,
      "num_stages": 1,
      "waves_per_eu": 1
    },
    "4672": {
      "BLOCK_M": 256,
      "BLOCK_N": 16,
      "BLOCK_K": 32,
      "BLOCK_C": 256,
      "NUM_KSPLIT": 8,
      "num_warps": 4,
      "num_stages": 2,
      "waves_per_eu": 1
    },
    "1514": {
      "BLOCK_M": 64,
      "BLOCK_N": 16,
      "BLOCK_K": 32,
      "BLOCK_C": 32,
      "NUM_KSPLIT": 1,
      "num_warps": 2,
      "num_stages": 1,
      "waves_per_eu": 2
    },
    "5159": {
      "BLOCK_M": 256,
      "BLOCK_N": 16,
      "BLOCK_K": 128,
      "BLOCK_C": 32,
      "NUM_KSPLIT": 4,
      "num_warps": 4,
      "num_stages": 2,
      "waves_per_eu": 2
    },
    "2110": {
      "BLOCK_M": 64,
      "BLOCK_N": 16,
      "BLOCK_K": 64,
      "BLOCK_C": 256,
      "NUM_KSPLIT": 2,
      "num_warps": 2,
      "num_stages": 2,
      "waves_per_eu": 1
    },
    "3904": {
      "BLOCK_M": 128,
      "BLOCK_N": 16,
      "BLOCK_K": 128,
      "BLOCK_C": 256,
      "NUM_KSPLIT": 1,
      "num_warps": 8,
      "num_stages": 2,
      "waves_per_eu": 1
    },
    "3106": {
      "BLOCK_M": 128,
      "BLOCK_N": 16,
      "BLOCK_K": 32,
      "BLOCK_C": 128,
      "NUM_KSPLIT": 1,
      "num_warps": 4,
      "num_stages": 2,
      "waves_per_eu": 1
    },
    "964": {
      "BLOCK_M": 32,
      "BLOCK_N": 16,
      "BLOCK_K": 128,
      "BLOCK_C": 128,
      "NUM_KSPLIT": 2,
      "num_warps": 4,
      "num_stages": 2,
      "waves_per_eu": 1
    },
    "1988": {
      "BLOCK_M": 64,
      "BLOCK_N": 16,
      "BLOCK_K": 64,
      "BLOCK_C": 64,
      "NUM_KSPLIT": 4,
      "num_warps": 4,
      "num_stages": 1,
      "waves_per_eu": 2
    },
    "1212": {
      "BLOCK_M": 32,
      "BLOCK_N": 16,
      "BLOCK_K": 256,
      "BLOCK_C": 32,
      "NUM_KSPLIT": 8,
      "num_warps": 4,
      "num_stages": 1,
      "waves_per_eu": 0
    },
    "1613": {
      "BLOCK_M": 64,
      "BLOCK_N": 16,
      "BLOCK_K": 32,
      "BLOCK_C": 64,
      "NUM_KSPLIT": 2,
      "num_warps": 4,
      "num_stages": 2,
      "waves_per_eu": 2
    },
    "1152": {
      "BLOCK_M": 32,
      "BLOCK_N": 16,
      "BLOCK_K": 256,
      "BLOCK_C": 32,
      "NUM_KSPLIT": 1,
      "num_warps": 2,
      "num_stages": 1,
      "waves_per_eu": 0
    },
    "5131": {
      "BLOCK_M": 256,
      "BLOCK_N": 16,
      "BLOCK_K": 128,
      "BLOCK_C": 32,
      "NUM_KSPLIT": 2,
      "num_warps": 2,
      "num_stages": 1,
      "waves_per_eu": 1
    },
    "492": {
      "BLOCK_M": 32,
      "BLOCK_N": 16,
      "BLOCK_K": 64,
      "BLOCK_C": 32,
      "NUM_KSPLIT": 8,
      "num_warps": 4,
      "num_stages": 1,
      "waves_per_eu": 0
    },
    "5546": {
      "BLOCK_M": 256,
      "BLOCK_N": 16,
      "BLOCK_K": 256,
      "BLOCK_C": 64,
      "NUM_KSPLIT": 1,
      "num_warps": 2,
      "num_stages": 1,
      "waves_per_eu": 2
    },
    "400": {
      "BLOCK_M": 32,
      "BLOCK_N": 16,
      "BLOCK_K": 64,
      "BLOCK_C": 16,
      "NUM_KSPLIT": 4,
      "num_warps": 2,
      "num_stages": 2,
      "waves_per_eu": 1
    },
    "11": {
      "BLOCK_M": 32,
      "BLOCK_N": 16,
      "BLOCK_K": 32,
      "BLOCK_C": 16,
      "NUM_KSPLIT": 1,
      "num_warps": 4,
      "num_stages": 2,
      "waves_per_eu": 2
    },
    "989": {
      "BLOCK_M": 32,
      "BLOCK_N": 16,
      "BLOCK_K": 128,
      "BLOCK_C": 128,
      "NUM_KSPLIT": 4,
      "num_warps": 8,
      "num_stages": 2,
      "waves_per_eu": 2
    },
    "2886": {
      "BLOCK_M": 128,
      "BLOCK_N": 16,
      "BLOCK_K": 32,
      "BLOCK_C": 16,
      "NUM_KSPLIT": 1,
      "num_warps": 4,
      "num_stages": 1,
      "waves_per_eu": 0
    },
    "4963": {
      "BLOCK_M": 256,
      "BLOCK_N": 16,
      "BLOCK_K": 64,
      "BLOCK_C": 128,
      "NUM_KSPLIT": 8,
      "num_warps": 8,
      "num_stages": 1,
      "waves_per_eu": 1
    },
    "4566": {
      "BLOCK_M": 256,
      "BLOCK_N": 16,
      "BLOCK_K": 32,
      "BLOCK_C": 128,
      "NUM_KSPLIT": 2,
      "num_warps": 8,
      "num_stages": 1,
      "waves_per_eu": 0
    },
    "772": {
      "BLOCK_M": 32,
      "BLOCK_N": 16,
      "BLOCK_K": 128,
      "BLOCK_C": 16,
      "NUM_KSPLIT": 4,
      "num_warps": 8,
      "num_stages": 2,
      "waves_per_eu": 1
    },
    "2561": {
      "BLOCK_M": 64,
      "BLOCK_N": 16,
      "BLOCK_K": 256,
      "BLOCK_C": 16,
      "NUM_KSPLIT": 4,
      "num_warps": 2,
      "num_stages": 2,
      "waves_per_eu": 2
    },
    "4693": {
      "BLOCK_M": 256,
      "BLOCK_N": 16,
      "BLOCK_K": 64,
      "BLOCK_C": 16,
      "NUM_KSPLIT": 1,
      "num_warps": 8,
      "num_stages": 1,
      "waves_per_eu": 1
    },
    "4796": {
      "BLOCK_M": 256,
      "BLOCK_N": 16,
      "BLOCK_K": 64,
      "BLOCK_C": 32,
      "NUM_KSPLIT": 4,
      "num_warps": 4,
      "num_stages": 1,
      "waves_per_eu": 2
    },
    "1616": {
      "BLOCK_M": 64,
      "BLOCK_N": 16,
      "BLOCK_K": 32,
      "BLOCK_C": 64,
      "NUM_KSPLIT": 2,
      "num_warps": 8,
      "num_stages": 1,
      "waves_per_eu": 2
    },
    "4866": {
      "BLOCK_M": 256,
      "BLOCK_N": 16,
      "BLOCK_K": 64,
      "BLOCK_C": 64,
      "NUM_KSPLIT": 4,
      "num_warps": 4,
      "num_stages": 1,
      "waves_per_eu": 0
    },
    "2806": {
      "BLOCK_M": 64,
      "BLOCK_N": 16,
      "BLOCK_K": 256,
      "BLOCK_C": 128,
      "NUM_KSPLIT": 8,
      "num_warps": 8,
      "num_stages": 2,
      "waves_per_eu": 1
    },
    "3621": {
      "BLOCK_M": 128,
      "BLOCK_N": 16,
      "BLOCK_K": 128,
      "BLOCK_C": 16,
      "NUM_KSPLIT": 2,
      "num_warps": 2,
      "num_stages": 2,
      "waves_per_eu": 0
    },
    "1447": {
      "BLOCK_M": 64,
      "BLOCK_N": 16,
      "BLOCK_K": 32,
      "BLOCK_C": 16,
      "NUM_KSPLIT": 1,
      "num_warps": 4,
      "num_stages": 1,
      "waves_per_eu": 1
    },
    "252": {
      "BLOCK_M": 32,
      "BLOCK_N": 16,
      "BLOCK_K": 32,
      "BLOCK_C": 128,
      "NUM_KSPLIT": 4,
      "num_warps": 2,
      "num_stages": 1,
      "waves_per_eu": 0
    },
    "3140": {
      "BLOCK_M": 128,
      "BLOCK_N": 16,
      "BLOCK_K": 32,
      "BLOCK_C": 128,
      "NUM_KSPLIT": 4,
      "num_warps": 4,
      "num_stages": 1,
      "waves_per_eu": 2
    },
    "1670": {
      "BLOCK_M": 64,
      "BLOCK_N": 16,
      "BLOCK_K": 32,
      "BLOCK_C": 128,
      "NUM_KSPLIT": 1,
      "num_warps": 8,
      "num_stages": 1,
      "waves_per_eu": 2
    },
    "3505": {
      "BLOCK_M": 128,
      "BLOCK_N": 16,
      "BLOCK_K": 64,
      "BLOCK_C": 128,
      "NUM_KSPLIT": 4,
      "num_warps": 8,
      "num_stages": 1,
      "waves_per_eu": 1
    },
    "249": {
      "BLOCK_M": 32,
      "BLOCK_N": 16,
      "BLOCK_K": 32,
      "BLOCK_C": 128,
      "NUM_KSPLIT": 2,
      "num_warps": 8,
      "num_stages": 2,
      "waves_per_eu": 0
    },
    "155": {
      "BLOCK_M": 32,
      "BLOCK_N": 16,
      "BLOCK_K": 32,
      "BLOCK_C": 64,
      "NUM_KSPLIT": 1,
      "num_warps": 4,
      "num_stages": 2,
      "waves_per_eu": 2
    },
    "3741": {
      "BLOCK_M": 128,
      "BLOCK_N": 16,
      "BLOCK_K": 128,
      "BLOCK_C": 32,
      "NUM_KSPLIT": 8,
      "num_warps": 8,
      "num_stages": 2,
      "waves_per_eu": 0
    },
    "3852": {
      "BLOCK_M": 128,
      "BLOCK_N": 16,
      "BLOCK_K": 128,
      "BLOCK_C": 128,
      "NUM_KSPLIT": 4,
      "num_warps": 2,
      "num_stages": 1,
      "waves_per_eu": 0
    },
    "2439": {
      "BLOCK_M": 64,
      "BLOCK_N": 16,
      "BLOCK_K": 128,
      "BLOCK_C": 128,
      "NUM_KSPLIT": 8,
      "num_warps": 4,
      "num_stages": 2,
      "waves_per_eu": 0
    },
    "5614": {
      "BLOCK_M": 256,
      "BLOCK_N": 16,
      "BLOCK_K": 256,
      "BLOCK_C": 64,
      "NUM_KSPLIT": 8,
      "num_warps": 8,
      "num_stages": 2,
      "waves_per_eu": 1
    },
    "2084": {
      "BLOCK_M": 64,
      "BLOCK_N": 16,
      "BLOCK_K": 64,
      "BLOCK_C": 128,
      "NUM_KSPLIT": 8,
      "num_warps": 8,
      "num_stages": 1,
      "waves_per_eu": 2
    },
    "5298": {
      "BLOCK_M": 256,
      "BLOCK_N": 16,
      "BLOCK_K": 128,
      "BLOCK_C": 128,
      "NUM_KSPLIT": 4,
      "num_warps": 4,
      "num_stages": 1,
      "waves_per_eu": 0
    },
    "931": {
      "BLOCK_M": 32,
      "BLOCK_N": 16,
      "BLOCK_K": 128,
      "BLOCK_C": 64,
      "NUM_KSPLIT": 8,
      "num_warps": 8,
      "num_stages": 1,
      "waves_per_eu": 1
    },
    "307": {
      "BLOCK_M": 32,
      "BLOCK_N": 16,
      "BLOCK_K": 32,
      "BLOCK_C": 256,
      "NUM_KSPLIT": 2,
      "num_warps": 2,
      "num_stages": 1,
      "waves_per_eu": 1
    },
    "3055": {
      "BLOCK_M": 128,
      "BLOCK_N": 16,
      "BLOCK_K": 32,
      "BLOCK_C": 64,
      "NUM_KSPLIT": 2,
      "num_warps": 8,
      "num_stages": 1,
      "waves_per_eu": 1
    },
    "323": {
      "BLOCK_M": 32,
      "BLOCK_N": 16,
      "BLOCK_K": 32,
      "BLOCK_C": 256,
      "NUM_KSPLIT": 2,
      "num_warps": 8,
      "num_stages": 2,
      "waves_per_eu": 2
    },
    "3760": {
      "BLOCK_M": 128,
      "BLOCK_N": 16,
      "BLOCK_K": 128,
      "BLOCK_C": 64,
      "NUM_KSPLIT": 1,
      "num_warps": 8,
      "num_stages": 2,
      "waves_per_eu": 1
    },
    "465": {
      "BLOCK_M": 32,
      "BLOCK_N": 16,
      "BLOCK_K": 64,
      "BLOCK_C": 32,
      "NUM_KSPLIT": 2,
      "num_warps": 8,
      "num_stages": 2,
      "waves_per_eu": 0
    },
    "4712": {
      "BLOCK_M": 256,
      "BLOCK_N": 16,
      "BLOCK_K": 64,
      "BLOCK_C": 16,
      "NUM_KSPLIT": 2,
      "num_warps": 8,
      "num_stages": 1,
      "waves_per_eu": 2
    },
    "232": {
      "BLOCK_M": 32,
      "BLOCK_N": 16,
      "BLOCK_K": 32,
      "BLOCK_C": 128,
      "NUM_KSPLIT": 1,
      "num_warps": 8,
      "num_stages": 2,
      "waves_per_eu": 1
    },
    "3512": {
      "BLOCK_M": 128,
      "BLOCK_N": 16,
      "BLOCK_K": 64,
      "BLOCK_C": 128,
      "NUM_KSPLIT": 8,
      "num_warps": 2,
      "num_stages": 1,
      "waves_per_eu": 2
    },
    "2413": {
      "BLOCK_M": 64,
      "BLOCK_N": 16,
      "BLOCK_K": 128,
      "BLOCK_C": 128,
      "NUM_KSPLIT": 4,
      "num_warps": 2,
      "num_stages": 1,
      "waves_per_eu": 1
    },
    "360": {
      "BLOCK_M": 32,
      "BLOCK_N": 16,
      "BLOCK_K": 64,
      "BLOCK_C": 16,
      "NUM_KSPLIT": 1,
      "num_warps": 2,
      "num_stages": 1,
      "waves_per_eu": 0
    },
    "2431": {
      "BLOCK_M": 64,
      "BLOCK_N": 16,
      "BLOCK_K": 128,
      "BLOCK_C": 128,
      "NUM_KSPLIT": 8,
      "num_warps": 2,
      "num_stages": 1,
      "waves_per_eu": 1
    },
    "618": {
      "BLOCK_M": 32,
      "BLOCK_N": 16,
      "BLOCK_K": 64,
      "BLOCK_C": 128,
      "NUM_KSPLIT": 4,
      "num_warps": 4,
      "num_stages": 1,
      "waves_per_eu": 0
    },
    "3797": {
      "BLOCK_M": 128,
      "BLOCK_N": 16,
      "BLOCK_K": 128,
      "BLOCK_C": 64,
      "NUM_KSPLIT": 4,
      "num_warps": 8,
      "num_stages": 2,
      "waves_per_eu": 2
    },
    "3313": {
      "BLOCK_M": 128,
      "BLOCK_N": 16,
      "BLOCK_K": 64,
      "BLOCK_C": 32,
      "NUM_KSPLIT": 1,
      "num_warps": 2,
      "num_stages": 1,
      "waves_per_eu": 1
    },
    "4265": {
      "BLOCK_M": 128,
      "BLOCK_N": 16,
      "BLOCK_K": 256,
      "BLOCK_C": 256,
      "NUM_KSPLIT": 1,
      "num_warps": 8,
      "num_stages": 2,
      "waves_per_eu": 2
    },
    "1997": {
      "BLOCK_M": 64,
      "BLOCK_N": 16,
      "BLOCK_K": 64,
      "BLOCK_C": 64,
      "NUM_KSPLIT": 4,
      "num_warps": 8,
      "num_stages": 2,
      "waves_per_eu": 2
    },
    "1939": {
      "BLOCK_M": 64,
      "BLOCK_N": 16,
      "BLOCK_K": 64,
      "BLOCK_C": 32,
      "NUM_KSPLIT": 8,
      "num_warps": 8,
      "num_stages": 1,
      "waves_per_eu": 1
    },
    "709": {
      "BLOCK_M": 32,
      "BLOCK_N": 16,
      "BLOCK_K": 64,
      "BLOCK_C": 256,
      "NUM_KSPLIT": 8,
      "num_warps": 4,
      "num_stages": 1,
      "waves_per_eu": 1
    },
    "3015": {
      "BLOCK_M": 128,
      "BLOCK_N": 16,
      "BLOCK_K": 32,
      "BLOCK_C": 32,
      "NUM_KSPLIT": 8,
      "num_warps": 4,
      "num_stages": 2,
      "waves_per_eu": 0
    },
    "2454": {
      "BLOCK_M": 64,
      "BLOCK_N": 16,
      "BLOCK_K": 128,
      "BLOCK_C": 256,
      "NUM_KSPLIT": 1,
      "num_warps": 4,
      "num_stages": 1,
      "waves_per_eu": 0
    },
    "548": {
      "BLOCK_M": 32,
      "BLOCK_N": 16,
      "BLOCK_K": 64,
      "BLOCK_C": 64,
      "NUM_KSPLIT": 4,
      "num_warps": 4,
      "num_stages": 1,
      "waves_per_eu": 2
    },
    "4301": {
      "BLOCK_M": 128,
      "BLOCK_N": 16,
      "BLOCK_K": 256,
      "BLOCK_C": 256,
      "NUM_KSPLIT": 4,
      "num_warps": 8,
      "num_stages": 2,
      "waves_per_eu": 2
    },
    "5240": {
      "BLOCK_M": 256,
      "BLOCK_N": 16,
      "BLOCK_K": 128,
      "BLOCK_C": 64,
      "NUM_KSPLIT": 8,
      "num_warps": 2,
      "num_stages": 1,
      "waves_per_eu": 2
    },
    "3535": {
      "BLOCK_M": 128,
      "BLOCK_N": 16,
      "BLOCK_K": 64,
      "BLOCK_C": 256,
      "NUM_KSPLIT": 1,
      "num_warps": 4,
      "num_stages": 1,
      "waves_per_eu": 1
    },
    "177": {
      "BLOCK_M": 32,
      "BLOCK_N": 16,
      "BLOCK_K": 32,
      "BLOCK_C": 64,
      "NUM_KSPLIT": 2,
      "num_warps": 8,
      "num_stages": 2,
      "waves_per_eu": 0
    },
    "2541": {
      "BLOCK_M": 64,
      "BLOCK_N": 16,
      "BLOCK_K": 256,
      "BLOCK_C": 16,
      "NUM_KSPLIT": 2,
      "num_warps": 2,
      "num_stages": 2,
      "waves_per_eu": 0
    },
    "5443": {
      "BLOCK_M": 256,
      "BLOCK_N": 16,
      "BLOCK_K": 256,
      "BLOCK_C": 16,
      "NUM_KSPLIT": 4,
      "num_warps": 4,
      "num_stages": 1,
      "waves_per_eu": 1
    },
    "5047": {
      "BLOCK_M": 256,
      "BLOCK_N": 16,
      "BLOCK_K": 128,
      "BLOCK_C": 16,
      "NUM_KSPLIT": 1,
      "num_warps": 4,
      "num_stages": 1,
      "waves_per_eu": 1
    },
    "5472": {
      "BLOCK_M": 256,
      "BLOCK_N": 16,
      "BLOCK_K": 256,
      "BLOCK_C": 32,
      "NUM_KSPLIT": 1,
      "num_warps": 2,
      "num_stages": 1,
      "waves_per_eu": 0
    },
    "1800": {
      "BLOCK_M": 64,
      "BLOCK_N": 16,
      "BLOCK_K": 64,
      "BLOCK_C": 16,
      "NUM_KSPLIT": 1,
      "num_warps": 2,
      "num_stages": 1,
      "waves_per_eu": 0
    },
    "2033": {
      "BLOCK_M": 64,
      "BLOCK_N": 16,
      "BLOCK_K": 64,
      "BLOCK_C": 128,
      "NUM_KSPLIT": 1,
      "num_warps": 8,
      "num_stages": 2,
      "waves_per_eu": 2
    },
    "2446": {
      "BLOCK_M": 64,
      "BLOCK_N": 16,
      "BLOCK_K": 128,
      "BLOCK_C": 128,
      "NUM_KSPLIT": 8,
      "num_warps": 8,
      "num_stages": 2,
      "waves_per_eu": 1
    },
    "5278": {
      "BLOCK_M": 256,
      "BLOCK_N": 16,
      "BLOCK_K": 128,
      "BLOCK_C": 128,
      "NUM_KSPLIT": 2,
      "num_warps": 2,
      "num_stages": 2,
      "waves_per_eu": 1
    },
    "5152": {
      "BLOCK_M": 256,
      "BLOCK_N": 16,
      "BLOCK_K": 128,
      "BLOCK_C": 32,
      "NUM_KSPLIT": 4,
      "num_warps": 2,
      "num_stages": 2,
      "waves_per_eu": 1
    },
    "3018": {
      "BLOCK_M": 128,
      "BLOCK_N": 16,
      "BLOCK_K": 32,
      "BLOCK_C": 32,
      "NUM_KSPLIT": 8,
      "num_warps": 8,
      "num_stages": 1,
      "waves_per_eu": 0
    },
    "994": {
      "BLOCK_M": 32,
      "BLOCK_N": 16,
      "BLOCK_K": 128,
      "BLOCK_C": 128,
      "NUM_KSPLIT": 8,
      "num_warps": 2,
      "num_stages": 2,
      "waves_per_eu": 1
    },
    "1847": {
      "BLOCK_M": 64,
      "BLOCK_N": 16,
      "BLOCK_K": 64,
      "BLOCK_C": 16,
      "NUM_KSPLIT": 4,
      "num_warps": 4,
      "num_stages": 2,
      "waves_per_eu": 2
    },
    "2456": {
      "BLOCK_M": 64,
      "BLOCK_N": 16,
      "BLOCK_K": 128,
      "BLOCK_C": 256,
      "NUM_KSPLIT": 1,
      "num_warps": 4,
      "num_stages": 1,
      "waves_per_eu": 2
    },
    "3101": {
      "BLOCK_M": 128,
      "BLOCK_N": 16,
      "BLOCK_K": 32,
      "BLOCK_C": 128,
      "NUM_KSPLIT": 1,
      "num_warps": 2,
      "num_stages": 2,
      "waves_per_eu": 2
    },
    "1391": {
      "BLOCK_M": 32,
      "BLOCK_N": 16,
      "BLOCK_K": 256,
      "BLOCK_C": 256,
      "NUM_KSPLIT": 2,
      "num_warps": 2,
      "num_stages": 2,
      "waves_per_eu": 2
    },
    "1237": {
      "BLOCK_M": 32,
      "BLOCK_N": 16,
      "BLOCK_K": 256,
      "BLOCK_C": 64,
      "NUM_KSPLIT": 1,
      "num_warps": 8,
      "num_stages": 1,
      "waves_per_eu": 1
    },
    "4182": {
      "BLOCK_M": 128,
      "BLOCK_N": 16,
      "BLOCK_K": 256,
      "BLOCK_C": 128,
      "NUM_KSPLIT": 1,
      "num_warps": 4,
      "num_stages": 1,
      "waves_per_eu": 0
    },
    "335": {
      "BLOCK_M": 32,
      "BLOCK_N": 16,
      "BLOCK_K": 32,
      "BLOCK_C": 256,
      "NUM_KSPLIT": 4,
      "num_warps": 4,
      "num_stages": 2,
      "waves_per_eu": 2
    },
    "757": {
      "BLOCK_M": 32,
      "BLOCK_N": 16,
      "BLOCK_K": 128,
      "BLOCK_C": 16,
      "NUM_KSPLIT": 4,
      "num_warps": 2,
      "num_stages": 1,
      "waves_per_eu": 1
    },
    "1946": {
      "BLOCK_M": 64,
      "BLOCK_N": 16,
      "BLOCK_K": 64,
      "BLOCK_C": 64,
      "NUM_KSPLIT": 1,
      "num_warps": 2,
      "num_stages": 1,
      "waves_per_eu": 2
    },
    "1720": {
      "BLOCK_M": 64,
      "BLOCK_N": 16,
      "BLOCK_K": 32,
      "BLOCK_C": 128,
      "NUM_KSPLIT": 8,
      "num_warps": 4,
      "num_stages": 2,
      "waves_per_eu": 1
    },
    "643": {
      "BLOCK_M": 32,
      "BLOCK_N": 16,
      "BLOCK_K": 64,
      "BLOCK_C": 128,
      "NUM_KSPLIT": 8,
      "num_warps": 8,
      "num_stages": 1,
      "waves_per_eu": 1
    },
    "4978": {
      "BLOCK_M": 256,
      "BLOCK_N": 16,
      "BLOCK_K": 64,
      "BLOCK_C": 256,
      "NUM_KSPLIT": 1,
      "num_warps": 4,
      "num_stages": 2,
      "waves_per_eu": 1
    },
    "2403": {
      "BLOCK_M": 64,
      "BLOCK_N": 16,
      "BLOCK_K": 128,
      "BLOCK_C": 128,
      "NUM_KSPLIT": 2,
      "num_warps": 4,
      "num_stages": 2,
      "waves_per_eu": 0
    },
    "911": {
      "BLOCK_M": 32,
      "BLOCK_N": 16,
      "BLOCK_K": 128,
      "BLOCK_C": 64,
      "NUM_KSPLIT": 4,
      "num_warps": 4,
      "num_stages": 2,
      "waves_per_eu": 2
    },
    "2434": {
      "BLOCK_M": 64,
      "BLOCK_N": 16,
      "BLOCK_K": 128,
      "BLOCK_C": 128,
      "NUM_KSPLIT": 8,
      "num_warps": 2,
      "num_stages": 2,
      "waves_per_eu": 1
    },
    "1243": {
      "BLOCK_M": 32,
      "BLOCK_N": 16,
      "BLOCK_K": 256,
      "BLOCK_C": 64,
      "NUM_KSPLIT": 2,
      "num_warps": 2,
      "num_stages": 1,
      "waves_per_eu": 1
    },
    "2801": {
      "BLOCK_M": 64,
      "BLOCK_N": 16,
      "BLOCK_K": 256,
      "BLOCK_C": 128,
      "NUM_KSPLIT": 8,
      "num_warps": 4,
      "num_stages": 2,
      "waves_per_eu": 2
    },
    "3067": {
      "BLOCK_M": 128,
      "BLOCK_N": 16,
      "BLOCK_K": 32,
      "BLOCK_C": 64,
      "NUM_KSPLIT": 4,
      "num_warps": 4,
      "num_stages": 1,
      "waves_per_eu": 1
    },
    "3329": {
      "BLOCK_M": 128,
      "BLOCK_N": 16,
      "BLOCK_K": 64,
      "BLOCK_C": 32,
      "NUM_KSPLIT": 1,
      "num_warps": 8,
      "num_stages": 2,
      "waves_per_eu": 2
    },
    "1190": {
      "BLOCK_M": 32,
      "BLOCK_N": 16,
      "BLOCK_K": 256,
      "BLOCK_C": 32,
      "NUM_KSPLIT": 4,
      "num_warps": 2,
      "num_stages": 1,
      "waves_per_eu": 2
    },
    "108": {
      "BLOCK_M": 32,
      "BLOCK_N": 16,
      "BLOCK_K": 32,
      "BLOCK_C": 32,
      "NUM_KSPLIT": 4,
      "num_warps": 2,
      "num_stages": 1,
      "waves_per_eu": 0
    },
    "2525": {
      "BLOCK_M": 64,
      "BLOCK_N": 16,
      "BLOCK_K": 256,
      "BLOCK_C": 16,
      "NUM_KSPLIT": 1,
      "num_warps": 2,
      "num_stages": 2,
      "waves_per_eu": 2
    },
    "3458": {
      "BLOCK_M": 128,
      "BLOCK_N": 16,
      "BLOCK_K": 64,
      "BLOCK_C": 128,
      "NUM_KSPLIT": 1,
      "num_warps": 2,
      "num_stages": 1,
      "waves_per_eu": 2
    },
    "736": {
      "BLOCK_M": 32,
      "BLOCK_N": 16,
      "BLOCK_K": 128,
      "BLOCK_C": 16,
      "NUM_KSPLIT": 1,
      "num_warps": 8,
      "num_stages": 2,
      "waves_per_eu": 1
    },
    "5545": {
      "BLOCK_M": 256,
      "BLOCK_N": 16,
      "BLOCK_K": 256,
      "BLOCK_C": 64,
      "NUM_KSPLIT": 1,
      "num_warps": 2,
      "num_stages": 1,
      "waves_per_eu": 1
    },
    "2885": {
      "BLOCK_M": 128,
      "BLOCK_N": 16,
      "BLOCK_K": 32,
      "BLOCK_C": 16,
      "NUM_KSPLIT": 1,
      "num_warps": 2,
      "num_stages": 2,
      "waves_per_eu": 2
    },
    "223": {
      "BLOCK_M": 32,
      "BLOCK_N": 16,
      "BLOCK_K": 32,
      "BLOCK_C": 128,
      "NUM_KSPLIT": 1,
      "num_warps": 4,
      "num_stages": 1,
      "waves_per_eu": 1
    },
    "5328": {
      "BLOCK_M": 256,
      "BLOCK_N": 16,
      "BLOCK_K": 128,
      "BLOCK_C": 256,
      "NUM_KSPLIT": 1,
      "num_warps": 2,
      "num_stages": 1,
      "waves_per_eu": 0
    },
    "3406": {
      "BLOCK_M": 128,
      "BLOCK_N": 16,
      "BLOCK_K": 64,
      "BLOCK_C": 64,
      "NUM_KSPLIT": 2,
      "num_warps": 2,
      "num_stages": 2,
      "waves_per_eu": 1
    },
    "3857": {
      "BLOCK_M": 128,
      "BLOCK_N": 16,
      "BLOCK_K": 128,
      "BLOCK_C": 128,
      "NUM_KSPLIT": 4,
      "num_warps": 2,
      "num_stages": 2,
      "waves_per_eu": 2
    },
    "1680": {
      "BLOCK_M": 64,
      "BLOCK_N": 16,
      "BLOCK_K": 32,
      "BLOCK_C": 128,
      "NUM_KSPLIT": 2,
      "num_warps": 4,
      "num_stages": 1,
      "waves_per_eu": 0
    },
    "1478": {
      "BLOCK_M": 64,
      "BLOCK_N": 16,
      "BLOCK_K": 32,
      "BLOCK_C": 16,
      "NUM_KSPLIT": 4,
      "num_warps": 2,
      "num_stages": 1,
      "waves_per_eu": 2
    },
    "1924": {
      "BLOCK_M": 64,
      "BLOCK_N": 16,
      "BLOCK_K": 64,
      "BLOCK_C": 32,
      "NUM_KSPLIT": 4,
      "num_warps": 8,
      "num_stages": 2,
      "waves_per_eu": 1
    },
    "3892": {
      "BLOCK_M": 128,
      "BLOCK_N": 16,
      "BLOCK_K": 128,
      "BLOCK_C": 256,
      "NUM_KSPLIT": 1,
      "num_warps": 2,
      "num_stages": 2,
      "waves_per_eu": 1
    },
    "4995": {
      "BLOCK_M": 256,
      "BLOCK_N": 16,
      "BLOCK_K": 64,
      "BLOCK_C": 256,
      "NUM_KSPLIT": 2,
      "num_warps": 4,
      "num_stages": 2,
      "waves_per_eu": 0
    },
    "2000": {
      "BLOCK_M": 64,
      "BLOCK_N": 16,
      "BLOCK_K": 64,
      "BLOCK_C": 64,
      "NUM_KSPLIT": 8,
      "num_warps": 2,
      "num_stages": 1,
      "waves_per_eu": 2
    },
    "2757": {
      "BLOCK_M": 64,
      "BLOCK_N": 16,
      "BLOCK_K": 256,
      "BLOCK_C": 128,
      "NUM_KSPLIT": 2,
      "num_warps": 2,
      "num_stages": 2,
      "waves_per_eu": 0
    },
    "5117": {
      "BLOCK_M": 256,
      "BLOCK_N": 16,
      "BLOCK_K": 128,
      "BLOCK_C": 32,
      "NUM_KSPLIT": 1,
      "num_warps": 2,
      "num_stages": 2,
      "waves_per_eu": 2
    },
    "2385": {
      "BLOCK_M": 64,
      "BLOCK_N": 16,
      "BLOCK_K": 128,
      "BLOCK_C": 128,
      "NUM_KSPLIT": 1,
      "num_warps": 4,
      "num_stages": 2,
      "waves_per_eu": 0
    },
    "2853": {
      "BLOCK_M": 64,
      "BLOCK_N": 16,
      "BLOCK_K": 256,
      "BLOCK_C": 256,
      "NUM_KSPLIT": 4,
      "num_warps": 4,
      "num_stages": 2,
      "waves_per_eu": 0
    },
    "4060": {
      "BLOCK_M": 128,
      "BLOCK_N": 16,
      "BLOCK_K": 256,
      "BLOCK_C": 32,
      "NUM_KSPLIT": 2,
      "num_warps": 4,
      "num_stages": 2,
      "waves_per_eu": 1
    },
    "1189": {
      "BLOCK_M": 32,
      "BLOCK_N": 16,
      "BLOCK_K": 256,
      "BLOCK_C": 32,
      "NUM_KSPLIT": 4,
      "num_warps": 2,
      "num_stages": 1,
      "waves_per_eu": 1
    },
    "4220": {
      "BLOCK_M": 128,
      "BLOCK_N": 16,
      "BLOCK_K": 256,
      "BLOCK_C": 128,
      "NUM_KSPLIT": 4,
      "num_warps": 4,
      "num_stages": 1,
      "waves_per_eu": 2
    },
    "4665": {
      "BLOCK_M": 256,
      "BLOCK_N": 16,
      "BLOCK_K": 32,
      "BLOCK_C": 256,
      "NUM_KSPLIT": 8,
      "num_warps": 2,
      "num_stages": 2,
      "waves_per_eu": 0
    },
    "1242": {
      "BLOCK_M": 32,
      "BLOCK_N": 16,
      "BLOCK_K": 256,
      "BLOCK_C": 64,
      "NUM_KSPLIT": 2,
      "num_warps": 2,
      "num_stages": 1,
      "waves_per_eu": 0
    },
    "2128": {
      "BLOCK_M": 64,
      "BLOCK_N": 16,
      "BLOCK_K": 64,
      "BLOCK_C": 256,
      "NUM_KSPLIT": 4,
      "num_warps": 2,
      "num_stages": 2,
      "waves_per_eu": 1
    },
    "4056": {
      "BLOCK_M": 128,
      "BLOCK_N": 16,
      "BLOCK_K": 256,
      "BLOCK_C": 32,
      "NUM_KSPLIT": 2,
      "num_warps": 4,
      "num_stages": 1,
      "waves_per_eu": 0
    },
    "1328": {
      "BLOCK_M": 32,
      "BLOCK_N": 16,
      "BLOCK_K": 256,
      "BLOCK_C": 128,
      "NUM_KSPLIT": 2,
      "num_warps": 8,
      "num_stages": 1,
      "waves_per_eu": 2
    },
    "0": {
      "BLOCK_M": 32,
      "BLOCK_N": 16,
      "BLOCK_K": 32,
      "BLOCK_C": 16,
      "NUM_KSPLIT": 1,
      "num_warps": 2,
      "num_stages": 1,
      "waves_per_eu": 0
    },
    "4093": {
      "BLOCK_M": 128,
      "BLOCK_N": 16,
      "BLOCK_K": 256,
      "BLOCK_C": 32,
      "NUM_KSPLIT": 8,
      "num_warps": 4,
      "num_stages": 1,
      "waves_per_eu": 1
    },
    "3442": {
      "BLOCK_M": 128,
      "BLOCK_N": 16,
      "BLOCK_K": 64,
      "BLOCK_C": 64,
      "NUM_KSPLIT": 8,
      "num_warps": 2,
      "num_stages": 2,
      "waves_per_eu": 1
    },
    "2569": {
      "BLOCK_M": 64,
      "BLOCK_N": 16,
      "BLOCK_K": 256,
      "BLOCK_C": 16,
      "NUM_KSPLIT": 4,
      "num_warps": 8,
      "num_stages": 1,
      "waves_per_eu": 1
    },
    "2099": {
      "BLOCK_M": 64,
      "BLOCK_N": 16,
      "BLOCK_K": 64,
      "BLOCK_C": 256,
      "NUM_KSPLIT": 1,
      "num_warps": 4,
      "num_stages": 2,
      "waves_per_eu": 2
    },
    "539": {
      "BLOCK_M": 32,
      "BLOCK_N": 16,
      "BLOCK_K": 64,
      "BLOCK_C": 64,
      "NUM_KSPLIT": 2,
      "num_warps": 8,
      "num_stages": 2,
      "waves_per_eu": 2
    },
    "666": {
      "BLOCK_M": 32,
      "BLOCK_N": 16,
      "BLOCK_K": 64,
      "BLOCK_C": 256,
      "NUM_KSPLIT": 2,
      "num_warps": 2,
      "num_stages": 1,
      "waves_per_eu": 0
    },
    "744": {
      "BLOCK_M": 32,
      "BLOCK_N": 16,
      "BLOCK_K": 128,
      "BLOCK_C": 16,
      "NUM_KSPLIT": 2,
      "num_warps": 4,
      "num_stages": 1,
      "waves_per_eu": 0
    },
    "5149": {
      "BLOCK_M": 256,
      "BLOCK_N": 16,
      "BLOCK_K": 128,
      "BLOCK_C": 32,
      "NUM_KSPLIT": 4,
      "num_warps": 2,
      "num_stages": 1,
      "waves_per_eu": 1
    },
    "3427": {
      "BLOCK_M": 128,
      "BLOCK_N": 16,
      "BLOCK_K": 64,
      "BLOCK_C": 64,
      "NUM_KSPLIT": 4,
      "num_warps": 4,
      "num_stages": 1,
      "waves_per_eu": 1
    },
    "5021": {
      "BLOCK_M": 256,
      "BLOCK_N": 16,
      "BLOCK_K": 64,
      "BLOCK_C": 256,
      "NUM_KSPLIT": 4,
      "num_warps": 8,
      "num_stages": 2,
      "waves_per_eu": 2
    },
    "969": {
      "BLOCK_M": 32,
      "BLOCK_N": 16,
      "BLOCK_K": 128,
      "BLOCK_C": 128,
      "NUM_KSPLIT": 2,
      "num_warps": 8,
      "num_stages": 2,
      "waves_per_eu": 0
    },
    "5525": {
      "BLOCK_M": 256,
      "BLOCK_N": 16,
      "BLOCK_K": 256,
      "BLOCK_C": 32,
      "NUM_KSPLIT": 4,
      "num_warps": 8,
      "num_stages": 2,
      "waves_per_eu": 2
    },
    "5570": {
      "BLOCK_M": 256,
      "BLOCK_N": 16,
      "BLOCK_K": 256,
      "BLOCK_C": 64,
      "NUM_KSPLIT": 2,
      "num_warps": 4,
      "num_stages": 1,
      "waves_per_eu": 2
    },
    "2225": {
      "BLOCK_M": 64,
      "BLOCK_N": 16,
      "BLOCK_K": 128,
      "BLOCK_C": 16,
      "NUM_KSPLIT": 8,
      "num_warps": 4,
      "num_stages": 2,
      "waves_per_eu": 2
    },
    "513": {
      "BLOCK_M": 32,
      "BLOCK_N": 16,
      "BLOCK_K": 64,
      "BLOCK_C": 64,
      "NUM_KSPLIT": 1,
      "num_warps": 4,
      "num_stages": 2,
      "waves_per_eu": 0
    },
    "3578": {
      "BLOCK_M": 128,
      "BLOCK_N": 16,
      "BLOCK_K": 64,
      "BLOCK_C": 256,
      "NUM_KSPLIT": 4,
      "num_warps": 8,
      "num_stages": 1,
      "waves_per_eu": 2
    },
    "4372": {
      "BLOCK_M": 256,
      "BLOCK_N": 16,
      "BLOCK_K": 32,
      "BLOCK_C": 16,
      "NUM_KSPLIT": 4,
      "num_warps": 8,
      "num_stages": 2,
      "waves_per_eu": 1
    },
    "2071": {
      "BLOCK_M": 64,
      "BLOCK_N": 16,
      "BLOCK_K": 64,
      "BLOCK_C": 128,
      "NUM_KSPLIT": 8,
      "num_warps": 2,
      "num_stages": 1,
      "waves_per_eu": 1
    },
    "3831": {
      "BLOCK_M": 128,
      "BLOCK_N": 16,
      "BLOCK_K": 128,
      "BLOCK_C": 128,
      "NUM_KSPLIT": 1,
      "num_warps": 8,
      "num_stages": 2,
      "waves_per_eu": 0
    },
    "634": {
      "BLOCK_M": 32,
      "BLOCK_N": 16,
      "BLOCK_K": 64,
      "BLOCK_C": 128,
      "NUM_KSPLIT": 8,
      "num_warps": 2,
      "num_stages": 2,
      "waves_per_eu": 1
    },
    "4206": {
      "BLOCK_M": 128,
      "BLOCK_N": 16,
      "BLOCK_K": 256,
      "BLOCK_C": 128,
      "NUM_KSPLIT": 2,
      "num_warps": 8,
      "num_stages": 1,
      "waves_per_eu": 0
    },
    "5130": {
      "BLOCK_M": 256,
      "BLOCK_N": 16,
      "BLOCK_K": 128,
      "BLOCK_C": 32,
      "NUM_KSPLIT": 2,
      "num_warps": 2,
      "num_stages": 1,
      "waves_per_eu": 0
    },
    "4618": {
      "BLOCK_M": 256,
      "BLOCK_N": 16,
      "BLOCK_K": 32,
      "BLOCK_C": 256,
      "NUM_KSPLIT": 1,
      "num_warps": 4,
      "num_stages": 2,
      "waves_per_eu": 1
    },
    "5192": {
      "BLOCK_M": 256,
      "BLOCK_N": 16,
      "BLOCK_K": 128,
      "BLOCK_C": 64,
      "NUM_KSPLIT": 1,
      "num_warps": 4,
      "num_stages": 1,
      "waves_per_eu": 2
    },
    "2683": {
      "BLOCK_M": 64,
      "BLOCK_N": 16,
      "BLOCK_K": 256,
      "BLOCK_C": 64,
      "NUM_KSPLIT": 2,
      "num_warps": 2,
      "num_stages": 1,
      "waves_per_eu": 1
    },
    "3574": {
      "BLOCK_M": 128,
      "BLOCK_N": 16,
      "BLOCK_K": 64,
      "BLOCK_C": 256,
      "NUM_KSPLIT": 4,
      "num_warps": 4,
      "num_stages": 2,
      "waves_per_eu": 1
    },
    "116": {
      "BLOCK_M": 32,
      "BLOCK_N": 16,
      "BLOCK_K": 32,
      "BLOCK_C": 32,
      "NUM_KSPLIT": 4,
      "num_warps": 4,
      "num_stages": 1,
      "waves_per_eu": 2
    },
    "5739": {
      "BLOCK_M": 256,
      "BLOCK_N": 16,
      "BLOCK_K": 256,
      "BLOCK_C": 256,
      "NUM_KSPLIT": 4,
      "num_warps": 8,
      "num_stages": 2,
      "waves_per_eu": 0
    },
    "2871": {
      "BLOCK_M": 64,
      "BLOCK_N": 16,
      "BLOCK_K": 256,
      "BLOCK_C": 256,
      "NUM_KSPLIT": 8,
      "num_warps": 4,
      "num_stages": 2,
      "waves_per_eu": 0
    },
    "2115": {
      "BLOCK_M": 64,
      "BLOCK_N": 16,
      "BLOCK_K": 64,
      "BLOCK_C": 256,
      "NUM_KSPLIT": 2,
      "num_warps": 4,
      "num_stages": 2,
      "waves_per_eu": 0
    },
    "4298": {
      "BLOCK_M": 128,
      "BLOCK_N": 16,
      "BLOCK_K": 256,
      "BLOCK_C": 256,
      "NUM_KSPLIT": 4,
      "num_warps": 8,
      "num_stages": 1,
      "waves_per_eu": 2
    },
    "2129": {
      "BLOCK_M": 64,
      "BLOCK_N": 16,
      "BLOCK_K": 64,
      "BLOCK_C": 256,
      "NUM_KSPLIT": 4,
      "num_warps": 2,
      "num_stages": 2,
      "waves_per_eu": 2
    },
    "4109": {
      "BLOCK_M": 128,
      "BLOCK_N": 16,
      "BLOCK_K": 256,
      "BLOCK_C": 64,
      "NUM_KSPLIT": 1,
      "num_warps": 2,
      "num_stages": 2,
      "waves_per_eu": 2
    },
    "5308": {
      "BLOCK_M": 256,
      "BLOCK_N": 16,
      "BLOCK_K": 128,
      "BLOCK_C": 128,
      "NUM_KSPLIT": 4,
      "num_warps": 8,
      "num_stages": 2,
      "waves_per_eu": 1
    },
    "4535": {
      "BLOCK_M": 256,
      "BLOCK_N": 16,
      "BLOCK_K": 32,
      "BLOCK_C": 64,
      "NUM_KSPLIT": 8,
      "num_warps": 8,
      "num_stages": 2,
      "waves_per_eu": 2
    },
    "6": {
      "BLOCK_M": 32,
      "BLOCK_N": 16,
      "BLOCK_K": 32,
      "BLOCK_C": 16,
      "NUM_KSPLIT": 1,
      "num_warps": 4,
      "num_stages": 1,
      "waves_per_eu": 0
    },
    "479": {
      "BLOCK_M": 32,
      "BLOCK_N": 16,
      "BLOCK_K": 64,
      "BLOCK_C": 32,
      "NUM_KSPLIT": 4,
      "num_warps": 4,
      "num_stages": 2,
      "waves_per_eu": 2
    },
    "1813": {
      "BLOCK_M": 64,
      "BLOCK_N": 16,
      "BLOCK_K": 64,
      "BLOCK_C": 16,
      "NUM_KSPLIT": 1,
      "num_warps": 8,
      "num_stages": 1,
      "waves_per_eu": 1
    },
    "1962": {
      "BLOCK_M": 64,
      "BLOCK_N": 16,
      "BLOCK_K": 64,
      "BLOCK_C": 64,
      "NUM_KSPLIT": 2,
      "num_warps": 2,
      "num_stages": 1,
      "waves_per_eu": 0
    },
    "5351": {
      "BLOCK_M": 256,
      "BLOCK_N": 16,
      "BLOCK_K": 128,
      "BLOCK_C": 256,
      "NUM_KSPLIT": 2,
      "num_warps": 2,
      "num_stages": 2,
      "waves_per_eu": 2
    },
    "4683": {
      "BLOCK_M": 256,
      "BLOCK_N": 16,
      "BLOCK_K": 64,
      "BLOCK_C": 16,
      "NUM_KSPLIT": 1,
      "num_warps": 2,
      "num_stages": 2,
      "waves_per_eu": 0
    },
    "961": {
      "BLOCK_M": 32,
      "BLOCK_N": 16,
      "BLOCK_K": 128,
      "BLOCK_C": 128,
      "NUM_KSPLIT": 2,
      "num_warps": 4,
      "num_stages": 1,
      "waves_per_eu": 1
    },
    "2406": {
      "BLOCK_M": 64,
      "BLOCK_N": 16,
      "BLOCK_K": 128,
      "BLOCK_C": 128,
      "NUM_KSPLIT": 2,
      "num_warps": 8,
      "num_stages": 1,
      "waves_per_eu": 0
    },
    "5735": {
      "BLOCK_M": 256,
      "BLOCK_N": 16,
      "BLOCK_K": 256,
      "BLOCK_C": 256,
      "NUM_KSPLIT": 4,
      "num_warps": 4,
      "num_stages": 2,
      "waves_per_eu": 2
    },
    "4670": {
      "BLOCK_M": 256,
      "BLOCK_N": 16,
      "BLOCK_K": 32,
      "BLOCK_C": 256,
      "NUM_KSPLIT": 8,
      "num_warps": 4,
      "num_stages": 1,
      "waves_per_eu": 2
    },
    "27": {
      "BLOCK_M": 32,
      "BLOCK_N": 16,
      "BLOCK_K": 32,
      "BLOCK_C": 16,
      "NUM_KSPLIT": 2,
      "num_warps": 4,
      "num_stages": 2,
      "waves_per_eu": 0
    },
    "971": {
      "BLOCK_M": 32,
      "BLOCK_N": 16,
      "BLOCK_K": 128,
      "BLOCK_C": 128,
      "NUM_KSPLIT": 2,
      "num_warps": 8,
      "num_stages": 2,
      "waves_per_eu": 2
    },
    "3299": {
      "BLOCK_M": 128,
      "BLOCK_N": 16,
      "BLOCK_K": 64,
      "BLOCK_C": 16,
      "NUM_KSPLIT": 8,
      "num_warps": 2,
      "num_stages": 2,
      "waves_per_eu": 2
    },
    "312": {
      "BLOCK_M": 32,
      "BLOCK_N": 16,
      "BLOCK_K": 32,
      "BLOCK_C": 256,
      "NUM_KSPLIT": 2,
      "num_warps": 4,
      "num_stages": 1,
      "waves_per_eu": 0
    },
    "207": {
      "BLOCK_M": 32,
      "BLOCK_N": 16,
      "BLOCK_K": 32,
      "BLOCK_C": 64,
      "NUM_KSPLIT": 8,
      "num_warps": 4,
      "num_stages": 2,
      "waves_per_eu": 0
    },
    "5648": {
      "BLOCK_M": 256,
      "BLOCK_N": 16,
      "BLOCK_K": 256,
      "BLOCK_C": 128,
      "NUM_KSPLIT": 2,
      "num_warps": 8,
      "num_stages": 1,
      "waves_per_eu": 2
    },
    "5016": {
      "BLOCK_M": 256,
      "BLOCK_N": 16,
      "BLOCK_K": 64,
      "BLOCK_C": 256,
      "NUM_KSPLIT": 4,
      "num_warps": 8,
      "num_stages": 1,
      "waves_per_eu": 0
    },
    "2755": {
      "BLOCK_M": 64,
      "BLOCK_N": 16,
      "BLOCK_K": 256,
      "BLOCK_C": 128,
      "NUM_KSPLIT": 2,
      "num_warps": 2,
      "num_stages": 1,
      "waves_per_eu": 1
    },
    "3772": {
      "BLOCK_M": 128,
      "BLOCK_N": 16,
      "BLOCK_K": 128,
      "BLOCK_C": 64,
      "NUM_KSPLIT": 2,
      "num_warps": 4,
      "num_stages": 2,
      "waves_per_eu": 1
    },
    "1119": {
      "BLOCK_M": 32,
      "BLOCK_N": 16,
      "BLOCK_K": 256,
      "BLOCK_C": 16,
      "NUM_KSPLIT": 4,
      "num_warps": 2,
      "num_stages": 2,
      "waves_per_eu": 0
    },
    "3714": {
      "BLOCK_M": 128,
      "BLOCK_N": 16,
      "BLOCK_K": 128,
      "BLOCK_C": 32,
      "NUM_KSPLIT": 4,
      "num_warps": 4,
      "num_stages": 1,
      "waves_per_eu": 0
    },
    "5551": {
      "BLOCK_M": 256,
      "BLOCK_N": 16,
      "BLOCK_K": 256,
      "BLOCK_C": 64,
      "NUM_KSPLIT": 1,
      "num_warps": 4,
      "num_stages": 1,
      "waves_per_eu": 1
    },
    "1238": {
      "BLOCK_M": 32,
      "BLOCK_N": 16,
      "BLOCK_K": 256,
      "BLOCK_C": 64,
      "NUM_KSPLIT": 1,
      "num_warps": 8,
      "num_stages": 1,
      "waves_per_eu": 2
    },
    "833": {
      "BLOCK_M": 32,
      "BLOCK_N": 16,
      "BLOCK_K": 128,
      "BLOCK_C": 32,
      "NUM_KSPLIT": 4,
      "num_warps": 2,
      "num_stages": 2,
      "waves_per_eu": 2
    },
    "4417": {
      "BLOCK_M": 256,
      "BLOCK_N": 16,
      "BLOCK_K": 32,
      "BLOCK_C": 32,
      "NUM_KSPLIT": 2,
      "num_warps": 4,
      "num_stages": 1,
      "waves_per_eu": 1
    },
    "1900": {
      "BLOCK_M": 64,
      "BLOCK_N": 16,
      "BLOCK_K": 64,
      "BLOCK_C": 32,
      "NUM_KSPLIT": 2,
      "num_warps": 4,
      "num_stages": 2,
      "waves_per_eu": 1
    },
    "1874": {
      "BLOCK_M": 64,
      "BLOCK_N": 16,
      "BLOCK_K": 64,
      "BLOCK_C": 32,
      "NUM_KSPLIT": 1,
      "num_warps": 2,
      "num_stages": 1,
      "waves_per_eu": 2
    },
    "701": {
      "BLOCK_M": 32,
      "BLOCK_N": 16,
      "BLOCK_K": 64,
      "BLOCK_C": 256,
      "NUM_KSPLIT": 4,
      "num_warps": 8,
      "num_stages": 2,
      "waves_per_eu": 2
    },
    "274": {
      "BLOCK_M": 32,
      "BLOCK_N": 16,
      "BLOCK_K": 32,
      "BLOCK_C": 128,
      "NUM_KSPLIT": 8,
      "num_warps": 2,
      "num_stages": 2,
      "waves_per_eu": 1
    },
    "4242": {
      "BLOCK_M": 128,
      "BLOCK_N": 16,
      "BLOCK_K": 256,
      "BLOCK_C": 128,
      "NUM_KSPLIT": 8,
      "num_warps": 8,
      "num_stages": 1,
      "waves_per_eu": 0
    },
    "451": {
      "BLOCK_M": 32,
      "BLOCK_N": 16,
      "BLOCK_K": 64,
      "BLOCK_C": 32,
      "NUM_KSPLIT": 2,
      "num_warps": 2,
      "num_stages": 1,
      "waves_per_eu": 1
    },
    "5629": {
      "BLOCK_M": 256,
      "BLOCK_N": 16,
      "BLOCK_K": 256,
      "BLOCK_C": 128,
      "NUM_KSPLIT": 1,
      "num_warps": 8,
      "num_stages": 1,
      "waves_per_eu": 1
    },
    "1918": {
      "BLOCK_M": 64,
      "BLOCK_N": 16,
      "BLOCK_K": 64,
      "BLOCK_C": 32,
      "NUM_KSPLIT": 4,
      "num_warps": 4,
      "num_stages": 2,
      "waves_per_eu": 1
    },
    "5250": {
      "BLOCK_M": 256,
      "BLOCK_N": 16,
      "BLOCK_K": 128,
      "BLOCK_C": 64,
      "NUM_KSPLIT": 8,
      "num_warps": 8,
      "num_stages": 1,
      "waves_per_eu": 0
    },
    "2511": {
      "BLOCK_M": 64,
      "BLOCK_N": 16,
      "BLOCK_K": 128,
      "BLOCK_C": 256,
      "NUM_KSPLIT": 8,
      "num_warps": 4,
      "num_stages": 2,
      "waves_per_eu": 0
    },
    "2332": {
      "BLOCK_M": 64,
      "BLOCK_N": 16,
      "BLOCK_K": 128,
      "BLOCK_C": 64,
      "NUM_KSPLIT": 2,
      "num_warps": 4,
      "num_stages": 2,
      "waves_per_eu": 1
    },
    "3796": {
      "BLOCK_M": 128,
      "BLOCK_N": 16,
      "BLOCK_K": 128,
      "BLOCK_C": 64,
      "NUM_KSPLIT": 4,
      "num_warps": 8,
      "num_stages": 2,
      "waves_per_eu": 1
    },
    "2422": {
      "BLOCK_M": 64,
      "BLOCK_N": 16,
      "BLOCK_K": 128,
      "BLOCK_C": 128,
      "NUM_KSPLIT": 4,
      "num_warps": 4,
      "num_stages": 2,
      "waves_per_eu": 1
    },
    "4719": {
      "BLOCK_M": 256,
      "BLOCK_N": 16,
      "BLOCK_K": 64,
      "BLOCK_C": 16,
      "NUM_KSPLIT": 4,
      "num_warps": 2,
      "num_stages": 2,
      "waves_per_eu": 0
    },
    "2939": {
      "BLOCK_M": 128,
      "BLOCK_N": 16,
      "BLOCK_K": 32,
      "BLOCK_C": 16,
      "NUM_KSPLIT": 8,
      "num_warps": 2,
      "num_stages": 2,
      "waves_per_eu": 2
    },
    "4174": {
      "BLOCK_M": 128,
      "BLOCK_N": 16,
      "BLOCK_K": 256,
      "BLOCK_C": 64,
      "NUM_KSPLIT": 8,
      "num_warps": 8,
      "num_stages": 2,
      "waves_per_eu": 1
    },
    "4790": {
      "BLOCK_M": 256,
      "BLOCK_N": 16,
      "BLOCK_K": 64,
      "BLOCK_C": 32,
      "NUM_KSPLIT": 4,
      "num_warps": 2,
      "num_stages": 1,
      "waves_per_eu": 2
    },
    "562": {
      "BLOCK_M": 32,
      "BLOCK_N": 16,
      "BLOCK_K": 64,
      "BLOCK_C": 64,
      "NUM_KSPLIT": 8,
      "num_warps": 2,
      "num_stages": 2,
      "waves_per_eu": 1
    },
    "4820": {
      "BLOCK_M": 256,
      "BLOCK_N": 16,
      "BLOCK_K": 64,
      "BLOCK_C": 32,
      "NUM_KSPLIT": 8,
      "num_warps": 8,
      "num_stages": 1,
      "waves_per_eu": 2
    },
    "4639": {
      "BLOCK_M": 256,
      "BLOCK_N": 16,
      "BLOCK_K": 32,
      "BLOCK_C": 256,
      "NUM_KSPLIT": 2,
      "num_warps": 8,
      "num_stages": 1,
      "waves_per_eu": 1
    },
    "3733": {
      "BLOCK_M": 128,
      "BLOCK_N": 16,
      "BLOCK_K": 128,
      "BLOCK_C": 32,
      "NUM_KSPLIT": 8,
      "num_warps": 4,
      "num_stages": 1,
      "waves_per_eu": 1
    },
    "231": {
      "BLOCK_M": 32,
      "BLOCK_N": 16,
      "BLOCK_K": 32,
      "BLOCK_C": 128,
      "NUM_KSPLIT": 1,
      "num_warps": 8,
      "num_stages": 2,
      "waves_per_eu": 0
    },
    "352": {
      "BLOCK_M": 32,
      "BLOCK_N": 16,
      "BLOCK_K": 32,
      "BLOCK_C": 256,
      "NUM_KSPLIT": 8,
      "num_warps": 4,
      "num_stages": 2,
      "waves_per_eu": 1
    },
    "2308": {
      "BLOCK_M": 64,
      "BLOCK_N": 16,
      "BLOCK_K": 128,
      "BLOCK_C": 64,
      "NUM_KSPLIT": 1,
      "num_warps": 2,
      "num_stages": 2,
      "waves_per_eu": 1
    },
    "173": {
      "BLOCK_M": 32,
      "BLOCK_N": 16,
      "BLOCK_K": 32,
      "BLOCK_C": 64,
      "NUM_KSPLIT": 2,
      "num_warps": 4,
      "num_stages": 2,
      "waves_per_eu": 2
    },
    "608": {
      "BLOCK_M": 32,
      "BLOCK_N": 16,
      "BLOCK_K": 64,
      "BLOCK_C": 128,
      "NUM_KSPLIT": 2,
      "num_warps": 8,
      "num_stages": 1,
      "waves_per_eu": 2
    },
    "2127": {
      "BLOCK_M": 64,
      "BLOCK_N": 16,
      "BLOCK_K": 64,
      "BLOCK_C": 256,
      "NUM_KSPLIT": 4,
      "num_warps": 2,
      "num_stages": 2,
      "waves_per_eu": 0
    },
    "2545": {
      "BLOCK_M": 64,
      "BLOCK_N": 16,
      "BLOCK_K": 256,
      "BLOCK_C": 16,
      "NUM_KSPLIT": 2,
      "num_warps": 4,
      "num_stages": 1,
      "waves_per_eu": 1
    },
    "1123": {
      "BLOCK_M": 32,
      "BLOCK_N": 16,
      "BLOCK_K": 256,
      "BLOCK_C": 16,
      "NUM_KSPLIT": 4,
      "num_warps": 4,
      "num_stages": 1,
      "waves_per_eu": 1
    },
    "1954": {
      "BLOCK_M": 64,
      "BLOCK_N": 16,
      "BLOCK_K": 64,
      "BLOCK_C": 64,
      "NUM_KSPLIT": 1,
      "num_warps": 4,
      "num_stages": 2,
      "waves_per_eu": 1
    },
    "3020": {
      "BLOCK_M": 128,
      "BLOCK_N": 16,
      "BLOCK_K": 32,
      "BLOCK_C": 32,
      "NUM_KSPLIT": 8,
      "num_warps": 8,
      "num_stages": 1,
      "waves_per_eu": 2
    },
    "3675": {
      "BLOCK_M": 128,
      "BLOCK_N": 16,
      "BLOCK_K": 128,
      "BLOCK_C": 32,
      "NUM_KSPLIT": 1,
      "num_warps": 2,
      "num_stages": 2,
      "waves_per_eu": 0
    },
    "4309": {
      "BLOCK_M": 128,
      "BLOCK_N": 16,
      "BLOCK_K": 256,
      "BLOCK_C": 256,
      "NUM_KSPLIT": 8,
      "num_warps": 4,
      "num_stages": 1,
      "waves_per_eu": 1
    },
    "5184": {
      "BLOCK_M": 256,
      "BLOCK_N": 16,
      "BLOCK_K": 128,
      "BLOCK_C": 64,
      "NUM_KSPLIT": 1,
      "num_warps": 2,
      "num_stages": 1,
      "waves_per_eu": 0
    },
    "3437": {
      "BLOCK_M": 128,
      "BLOCK_N": 16,
      "BLOCK_K": 64,
      "BLOCK_C": 64,
      "NUM_KSPLIT": 4,
      "num_warps": 8,
      "num_stages": 2,
      "waves_per_eu": 2
    },
    "4163": {
      "BLOCK_M": 128,
      "BLOCK_N": 16,
      "BLOCK_K": 256,
      "BLOCK_C": 64,
      "NUM_KSPLIT": 8,
      "num_warps": 2,
      "num_stages": 2,
      "waves_per_eu": 2
    },
    "4231": {
      "BLOCK_M": 128,
      "BLOCK_N": 16,
      "BLOCK_K": 256,
      "BLOCK_C": 128,
      "NUM_KSPLIT": 8,
      "num_warps": 2,
      "num_stages": 1,
      "waves_per_eu": 1
    },
    "316": {
      "BLOCK_M": 32,
      "BLOCK_N": 16,
      "BLOCK_K": 32,
      "BLOCK_C": 256,
      "NUM_KSPLIT": 2,
      "num_warps": 4,
      "num_stages": 2,
      "waves_per_eu": 1
    },
    "2877": {
      "BLOCK_M": 64,
      "BLOCK_N": 16,
      "BLOCK_K": 256,
      "BLOCK_C": 256,
      "NUM_KSPLIT": 8,
      "num_warps": 8,
      "num_stages": 2,
      "waves_per_eu": 0
    },
    "2688": {
      "BLOCK_M": 64,
      "BLOCK_N": 16,
      "BLOCK_K": 256,
      "BLOCK_C": 64,
      "NUM_KSPLIT": 2,
      "num_warps": 4,
      "num_stages": 1,
      "waves_per_eu": 0
    },
    "5362": {
      "BLOCK_M": 256,
      "BLOCK_N": 16,
      "BLOCK_K": 128,
      "BLOCK_C": 256,
      "NUM_KSPLIT": 2,
      "num_warps": 8,
      "num_stages": 2,
      "waves_per_eu": 1
    },
    "306": {
      "BLOCK_M": 32,
      "BLOCK_N": 16,
      "BLOCK_K": 32,
      "BLOCK_C": 256,
      "NUM_KSPLIT": 2,
      "num_warps": 2,
      "num_stages": 1,
      "waves_per_eu": 0
    },
    "458": {
      "BLOCK_M": 32,
      "BLOCK_N": 16,
      "BLOCK_K": 64,
      "BLOCK_C": 32,
      "NUM_KSPLIT": 2,
      "num_warps": 4,
      "num_stages": 1,
      "waves_per_eu": 2
    },
    "598": {
      "BLOCK_M": 32,
      "BLOCK_N": 16,
      "BLOCK_K": 64,
      "BLOCK_C": 128,
      "NUM_KSPLIT": 2,
      "num_warps": 2,
      "num_stages": 2,
      "waves_per_eu": 1
    },
    "1621": {
      "BLOCK_M": 64,
      "BLOCK_N": 16,
      "BLOCK_K": 32,
      "BLOCK_C": 64,
      "NUM_KSPLIT": 4,
      "num_warps": 2,
      "num_stages": 1,
      "waves_per_eu": 1
    },
    "419": {
      "BLOCK_M": 32,
      "BLOCK_N": 16,
      "BLOCK_K": 64,
      "BLOCK_C": 16,
      "NUM_KSPLIT": 8,
      "num_warps": 2,
      "num_stages": 2,
      "waves_per_eu": 2
    },
    "1158": {
      "BLOCK_M": 32,
      "BLOCK_N": 16,
      "BLOCK_K": 256,
      "BLOCK_C": 32,
      "NUM_KSPLIT": 1,
      "num_warps": 4,
      "num_stages": 1,
      "waves_per_eu": 0
    },
    "4689": {
      "BLOCK_M": 256,
      "BLOCK_N": 16,
      "BLOCK_K": 64,
      "BLOCK_C": 16,
      "NUM_KSPLIT": 1,
      "num_warps": 4,
      "num_stages": 2,
      "waves_per_eu": 0
    },
    "3455": {
      "BLOCK_M": 128,
      "BLOCK_N": 16,
      "BLOCK_K": 64,
      "BLOCK_C": 64,
      "NUM_KSPLIT": 8,
      "num_warps": 8,
      "num_stages": 2,
      "waves_per_eu": 2
    },
    "3148": {
      "BLOCK_M": 128,
      "BLOCK_N": 16,
      "BLOCK_K": 32,
      "BLOCK_C": 128,
      "NUM_KSPLIT": 4,
      "num_warps": 8,
      "num_stages": 2,
      "waves_per_eu": 1
    },
    "5471": {
      "BLOCK_M": 256,
      "BLOCK_N": 16,
      "BLOCK_K": 256,
      "BLOCK_C": 16,
      "NUM_KSPLIT": 8,
      "num_warps": 8,
      "num_stages": 2,
      "waves_per_eu": 2
    },
    "5696": {
      "BLOCK_M": 256,
      "BLOCK_N": 16,
      "BLOCK_K": 256,
      "BLOCK_C": 256,
      "NUM_KSPLIT": 1,
      "num_warps": 4,
      "num_stages": 1,
      "waves_per_eu": 2
    },
    "452": {
      "BLOCK_M": 32,
      "BLOCK_N": 16,
      "BLOCK_K": 64,
      "BLOCK_C": 32,
      "NUM_KSPLIT": 2,
      "num_warps": 2,
      "num_stages": 1,
      "waves_per_eu": 2
    },
    "1080": {
      "BLOCK_M": 32,
      "BLOCK_N": 16,
      "BLOCK_K": 256,
      "BLOCK_C": 16,
      "NUM_KSPLIT": 1,
      "num_warps": 2,
      "num_stages": 1,
      "waves_per_eu": 0
    },
    "353": {
      "BLOCK_M": 32,
      "BLOCK_N": 16,
      "BLOCK_K": 32,
      "BLOCK_C": 256,
      "NUM_KSPLIT": 8,
      "num_warps": 4,
      "num_stages": 2,
      "waves_per_eu": 2
    },
    "4812": {
      "BLOCK_M": 256,
      "BLOCK_N": 16,
      "BLOCK_K": 64,
      "BLOCK_C": 32,
      "NUM_KSPLIT": 8,
      "num_warps": 4,
      "num_stages": 1,
      "waves_per_eu": 0
    },
    "2783": {
      "BLOCK_M": 64,
      "BLOCK_N": 16,
      "BLOCK_K": 256,
      "BLOCK_C": 128,
      "NUM_KSPLIT": 4,
      "num_warps": 4,
      "num_stages": 2,
      "waves_per_eu": 2
    },
    "5642": {
      "BLOCK_M": 256,
      "BLOCK_N": 16,
      "BLOCK_K": 256,
      "BLOCK_C": 128,
      "NUM_KSPLIT": 2,
      "num_warps": 4,
      "num_stages": 1,
      "waves_per_eu": 2
    },
    "3580": {
      "BLOCK_M": 128,
      "BLOCK_N": 16,
      "BLOCK_K": 64,
      "BLOCK_C": 256,
      "NUM_KSPLIT": 4,
      "num_warps": 8,
      "num_stages": 2,
      "waves_per_eu": 1
    },
    "3085": {
      "BLOCK_M": 128,
      "BLOCK_N": 16,
      "BLOCK_K": 32,
      "BLOCK_C": 64,
      "NUM_KSPLIT": 8,
      "num_warps": 4,
      "num_stages": 1,
      "waves_per_eu": 1
    },
    "2135": {
      "BLOCK_M": 64,
      "BLOCK_N": 16,
      "BLOCK_K": 64,
      "BLOCK_C": 256,
      "NUM_KSPLIT": 4,
      "num_warps": 4,
      "num_stages": 2,
      "waves_per_eu": 2
    },
    "1833": {
      "BLOCK_M": 64,
      "BLOCK_N": 16,
      "BLOCK_K": 64,
      "BLOCK_C": 16,
      "NUM_KSPLIT": 2,
      "num_warps": 8,
      "num_stages": 2,
      "waves_per_eu": 0
    },
    "3537": {
      "BLOCK_M": 128,
      "BLOCK_N": 16,
      "BLOCK_K": 64,
      "BLOCK_C": 256,
      "NUM_KSPLIT": 1,
      "num_warps": 4,
      "num_stages": 2,
      "waves_per_eu": 0
    },
    "3715": {
      "BLOCK_M": 128,
      "BLOCK_N": 16,
      "BLOCK_K": 128,
      "BLOCK_C": 32,
      "NUM_KSPLIT": 4,
      "num_warps": 4,
      "num_stages": 1,
      "waves_per_eu": 1
    },
    "2125": {
      "BLOCK_M": 64,
      "BLOCK_N": 16,
      "BLOCK_K": 64,
      "BLOCK_C": 256,
      "NUM_KSPLIT": 4,
      "num_warps": 2,
      "num_stages": 1,
      "waves_per_eu": 1
    },
    "591": {
      "BLOCK_M": 32,
      "BLOCK_N": 16,
      "BLOCK_K": 64,
      "BLOCK_C": 128,
      "NUM_KSPLIT": 1,
      "num_warps": 8,
      "num_stages": 2,
      "waves_per_eu": 0
    },
    "5759": {
      "BLOCK_M": 256,
      "BLOCK_N": 16,
      "BLOCK_K": 256,
      "BLOCK_C": 256,
      "NUM_KSPLIT": 8,
      "num_warps": 8,
      "num_stages": 2,
      "waves_per_eu": 2
    },
    "4602": {
      "BLOCK_M": 256,
      "BLOCK_N": 16,
      "BLOCK_K": 32,
      "BLOCK_C": 128,
      "NUM_KSPLIT": 8,
      "num_warps": 8,
      "num_stages": 1,
      "waves_per_eu": 0
    },
    "2050": {
      "BLOCK_M": 64,
      "BLOCK_N": 16,
      "BLOCK_K": 64,
      "BLOCK_C": 128,
      "NUM_KSPLIT": 2,
      "num_warps": 8,
      "num_stages": 2,
      "waves_per_eu": 1
    },
    "5042": {
      "BLOCK_M": 256,
      "BLOCK_N": 16,
      "BLOCK_K": 128,
      "BLOCK_C": 16,
      "NUM_KSPLIT": 1,
      "num_warps": 2,
      "num_stages": 1,
      "waves_per_eu": 2
    },
    "1818": {
      "BLOCK_M": 64,
      "BLOCK_N": 16,
      "BLOCK_K": 64,
      "BLOCK_C": 16,
      "NUM_KSPLIT": 2,
      "num_warps": 2,
      "num_stages": 1,
      "waves_per_eu": 0
    },
    "1226": {
      "BLOCK_M": 32,
      "BLOCK_N": 16,
      "BLOCK_K": 256,
      "BLOCK_C": 64,
      "NUM_KSPLIT": 1,
      "num_warps": 2,
      "num_stages": 1,
      "waves_per_eu": 2
    },
    "822": {
      "BLOCK_M": 32,
      "BLOCK_N": 16,
      "BLOCK_K": 128,
      "BLOCK_C": 32,
      "NUM_KSPLIT": 2,
      "num_warps": 8,
      "num_stages": 1,
      "waves_per_eu": 0
    },
    "476": {
      "BLOCK_M": 32,
      "BLOCK_N": 16,
      "BLOCK_K": 64,
      "BLOCK_C": 32,
      "NUM_KSPLIT": 4,
      "num_warps": 4,
      "num_stages": 1,
      "waves_per_eu": 2
    },
    "857": {
      "BLOCK_M": 32,
      "BLOCK_N": 16,
      "BLOCK_K": 128,
      "BLOCK_C": 32,
      "NUM_KSPLIT": 8,
      "num_warps": 4,
      "num_stages": 2,
      "waves_per_eu": 2
    },
    "3759": {
      "BLOCK_M": 128,
      "BLOCK_N": 16,
      "BLOCK_K": 128,
      "BLOCK_C": 64,
      "NUM_KSPLIT": 1,
      "num_warps": 8,
      "num_stages": 2,
      "waves_per_eu": 0
    },
    "1181": {
      "BLOCK_M": 32,
      "BLOCK_N": 16,
      "BLOCK_K": 256,
      "BLOCK_C": 32,
      "NUM_KSPLIT": 2,
      "num_warps": 4,
      "num_stages": 2,
      "waves_per_eu": 2
    },
    "2270": {
      "BLOCK_M": 64,
      "BLOCK_N": 16,
      "BLOCK_K": 128,
      "BLOCK_C": 32,
      "NUM_KSPLIT": 4,
      "num_warps": 2,
      "num_stages": 1,
      "waves_per_eu": 2
    },
    "2780": {
      "BLOCK_M": 64,
      "BLOCK_N": 16,
      "BLOCK_K": 256,
      "BLOCK_C": 128,
      "NUM_KSPLIT": 4,
      "num_warps": 4,
      "num_stages": 1,
      "waves_per_eu": 2
    },
    "3829": {
      "BLOCK_M": 128,
      "BLOCK_N": 16,
      "BLOCK_K": 128,
      "BLOCK_C": 128,
      "NUM_KSPLIT": 1,
      "num_warps": 8,
      "num_stages": 1,
      "waves_per_eu": 1
    },
    "1555": {
      "BLOCK_M": 64,
      "BLOCK_N": 16,
      "BLOCK_K": 32,
      "BLOCK_C": 32,
      "NUM_KSPLIT": 4,
      "num_warps": 4,
      "num_stages": 1,
      "waves_per_eu": 1
    },
    "5164": {
      "BLOCK_M": 256,
      "BLOCK_N": 16,
      "BLOCK_K": 128,
      "BLOCK_C": 32,
      "NUM_KSPLIT": 4,
      "num_warps": 8,
      "num_stages": 2,
      "waves_per_eu": 1
    },
    "4032": {
      "BLOCK_M": 128,
      "BLOCK_N": 16,
      "BLOCK_K": 256,
      "BLOCK_C": 32,
      "NUM_KSPLIT": 1,
      "num_warps": 2,
      "num_stages": 1,
      "waves_per_eu": 0
    },
    "2925": {
      "BLOCK_M": 128,
      "BLOCK_N": 16,
      "BLOCK_K": 32,
      "BLOCK_C": 16,
      "NUM_KSPLIT": 4,
      "num_warps": 4,
      "num_stages": 2,
      "waves_per_eu": 0
    },
    "1747": {
      "BLOCK_M": 64,
      "BLOCK_N": 16,
      "BLOCK_K": 32,
      "BLOCK_C": 256,
      "NUM_KSPLIT": 2,
      "num_warps": 2,
      "num_stages": 1,
      "waves_per_eu": 1
    },
    "1807": {
      "BLOCK_M": 64,
      "BLOCK_N": 16,
      "BLOCK_K": 64,
      "BLOCK_C": 16,
      "NUM_KSPLIT": 1,
      "num_warps": 4,
      "num_stages": 1,
      "waves_per_eu": 1
    },
    "471": {
      "BLOCK_M": 32,
      "BLOCK_N": 16,
      "BLOCK_K": 64,
      "BLOCK_C": 32,
      "NUM_KSPLIT": 4,
      "num_warps": 2,
      "num_stages": 2,
      "waves_per_eu": 0
    },
    "2485": {
      "BLOCK_M": 64,
      "BLOCK_N": 16,
      "BLOCK_K": 128,
      "BLOCK_C": 256,
      "NUM_KSPLIT": 4,
      "num_warps": 2,
      "num_stages": 1,
      "waves_per_eu": 1
    },
    "4635": {
      "BLOCK_M": 256,
      "BLOCK_N": 16,
      "BLOCK_K": 32,
      "BLOCK_C": 256,
      "NUM_KSPLIT": 2,
      "num_warps": 4,
      "num_stages": 2,
      "waves_per_eu": 0
    },
    "298": {
      "BLOCK_M": 32,
      "BLOCK_N": 16,
      "BLOCK_K": 32,
      "BLOCK_C": 256,
      "NUM_KSPLIT": 1,
      "num_warps": 4,
      "num_stages": 2,
      "waves_per_eu": 1
    },
    "3718": {
      "BLOCK_M": 128,
      "BLOCK_N": 16,
      "BLOCK_K": 128,
      "BLOCK_C": 32,
      "NUM_KSPLIT": 4,
      "num_warps": 4,
      "num_stages": 2,
      "waves_per_eu": 1
    },
    "635": {
      "BLOCK_M": 32,
      "BLOCK_N": 16,
      "BLOCK_K": 64,
      "BLOCK_C": 128,
      "NUM_KSPLIT": 8,
      "num_warps": 2,
      "num_stages": 2,
      "waves_per_eu": 2
    },
    "1261": {
      "BLOCK_M": 32,
      "BLOCK_N": 16,
      "BLOCK_K": 256,
      "BLOCK_C": 64,
      "NUM_KSPLIT": 4,
      "num_warps": 2,
      "num_stages": 1,
      "waves_per_eu": 1
    },
    "5274": {
      "BLOCK_M": 256,
      "BLOCK_N": 16,
      "BLOCK_K": 128,
      "BLOCK_C": 128,
      "NUM_KSPLIT": 2,
      "num_warps": 2,
      "num_stages": 1,
      "waves_per_eu": 0
    },
    "2146": {
      "BLOCK_M": 64,
      "BLOCK_N": 16,
      "BLOCK_K": 64,
      "BLOCK_C": 256,
      "NUM_KSPLIT": 8,
      "num_warps": 2,
      "num_stages": 2,
      "waves_per_eu": 1
    },
    "698": {
      "BLOCK_M": 32,
      "BLOCK_N": 16,
      "BLOCK_K": 64,
      "BLOCK_C": 256,
      "NUM_KSPLIT": 4,
      "num_warps": 8,
      "num_stages": 1,
      "waves_per_eu": 2
    },
    "2793": {
      "BLOCK_M": 64,
      "BLOCK_N": 16,
      "BLOCK_K": 256,
      "BLOCK_C": 128,
      "NUM_KSPLIT": 8,
      "num_warps": 2,
      "num_stages": 2,
      "waves_per_eu": 0
    },
    "3926": {
      "BLOCK_M": 128,
      "BLOCK_N": 16,
      "BLOCK_K": 128,
      "BLOCK_C": 256,
      "NUM_KSPLIT": 4,
      "num_warps": 2,
      "num_stages": 1,
      "waves_per_eu": 2
    },
    "2527": {
      "BLOCK_M": 64,
      "BLOCK_N": 16,
      "BLOCK_K": 256,
      "BLOCK_C": 16,
      "NUM_KSPLIT": 1,
      "num_warps": 4,
      "num_stages": 1,
      "waves_per_eu": 1
    },
    "1896": {
      "BLOCK_M": 64,
      "BLOCK_N": 16,
      "BLOCK_K": 64,
      "BLOCK_C": 32,
      "NUM_KSPLIT": 2,
      "num_warps": 4,
      "num_stages": 1,
      "waves_per_eu": 0
    },
    "3325": {
      "BLOCK_M": 128,
      "BLOCK_N": 16,
      "BLOCK_K": 64,
      "BLOCK_C": 32,
      "NUM_KSPLIT": 1,
      "num_warps": 8,
      "num_stages": 1,
      "waves_per_eu": 1
    },
    "2313": {
      "BLOCK_M": 64,
      "BLOCK_N": 16,
      "BLOCK_K": 128,
      "BLOCK_C": 64,
      "NUM_KSPLIT": 1,
      "num_warps": 4,
      "num_stages": 2,
      "waves_per_eu": 0
    },
    "1157": {
      "BLOCK_M": 32,
      "BLOCK_N": 16,
      "BLOCK_K": 256,
      "BLOCK_C": 32,
      "NUM_KSPLIT": 1,
      "num_warps": 2,
      "num_stages": 2,
      "waves_per_eu": 2
    },
    "4273": {
      "BLOCK_M": 128,
      "BLOCK_N": 16,
      "BLOCK_K": 256,
      "BLOCK_C": 256,
      "NUM_KSPLIT": 2,
      "num_warps": 4,
      "num_stages": 1,
      "waves_per_eu": 1
    },
    "2706": {
      "BLOCK_M": 64,
      "BLOCK_N": 16,
      "BLOCK_K": 256,
      "BLOCK_C": 64,
      "NUM_KSPLIT": 4,
      "num_warps": 4,
      "num_stages": 1,
      "waves_per_eu": 0
    },
    "1174": {
      "BLOCK_M": 32,
      "BLOCK_N": 16,
      "BLOCK_K": 256,
      "BLOCK_C": 32,
      "NUM_KSPLIT": 2,
      "num_warps": 2,
      "num_stages": 2,
      "waves_per_eu": 1
    },
    "688": {
      "BLOCK_M": 32,
      "BLOCK_N": 16,
      "BLOCK_K": 64,
      "BLOCK_C": 256,
      "NUM_KSPLIT": 4,
      "num_warps": 2,
      "num_stages": 2,
      "waves_per_eu": 1
    },
    "5066": {
      "BLOCK_M": 256,
      "BLOCK_N": 16,
      "BLOCK_K": 128,
      "BLOCK_C": 16,
      "NUM_KSPLIT": 2,
      "num_warps": 4,
      "num_stages": 1,
      "waves_per_eu": 2
    },
    "3087": {
      "BLOCK_M": 128,
      "BLOCK_N": 16,
      "BLOCK_K": 32,
      "BLOCK_C": 64,
      "NUM_KSPLIT": 8,
      "num_warps": 4,
      "num_stages": 2,
      "waves_per_eu": 0
    },
    "601": {
      "BLOCK_M": 32,
      "BLOCK_N": 16,
      "BLOCK_K": 64,
      "BLOCK_C": 128,
      "NUM_KSPLIT": 2,
      "num_warps": 4,
      "num_stages": 1,
      "waves_per_eu": 1
    },
    "4026": {
      "BLOCK_M": 128,
      "BLOCK_N": 16,
      "BLOCK_K": 256,
      "BLOCK_C": 16,
      "NUM_KSPLIT": 8,
      "num_warps": 8,
      "num_stages": 1,
      "waves_per_eu": 0
    },
    "1816": {
      "BLOCK_M": 64,
      "BLOCK_N": 16,
      "BLOCK_K": 64,
      "BLOCK_C": 16,
      "NUM_KSPLIT": 1,
      "num_warps": 8,
      "num_stages": 2,
      "waves_per_eu": 1
    },
    "2220": {
      "BLOCK_M": 64,
      "BLOCK_N": 16,
      "BLOCK_K": 128,
      "BLOCK_C": 16,
      "NUM_KSPLIT": 8,
      "num_warps": 4,
      "num_stages": 1,
      "waves_per_eu": 0
    },
    "243": {
      "BLOCK_M": 32,
      "BLOCK_N": 16,
      "BLOCK_K": 32,
      "BLOCK_C": 128,
      "NUM_KSPLIT": 2,
      "num_warps": 4,
      "num_stages": 2,
      "waves_per_eu": 0
    },
    "4354": {
      "BLOCK_M": 256,
      "BLOCK_N": 16,
      "BLOCK_K": 32,
      "BLOCK_C": 16,
      "NUM_KSPLIT": 2,
      "num_warps": 8,
      "num_stages": 2,
      "waves_per_eu": 1
    },
    "48": {
      "BLOCK_M": 32,
      "BLOCK_N": 16,
      "BLOCK_K": 32,
      "BLOCK_C": 16,
      "NUM_KSPLIT": 4,
      "num_warps": 8,
      "num_stages": 1,
      "waves_per_eu": 0
    },
    "516": {
      "BLOCK_M": 32,
      "BLOCK_N": 16,
      "BLOCK_K": 64,
      "BLOCK_C": 64,
      "NUM_KSPLIT": 1,
      "num_warps": 8,
      "num_stages": 1,
      "waves_per_eu": 0
    },
    "771": {
      "BLOCK_M": 32,
      "BLOCK_N": 16,
      "BLOCK_K": 128,
      "BLOCK_C": 16,
      "NUM_KSPLIT": 4,
      "num_warps": 8,
      "num_stages": 2,
      "waves_per_eu": 0
    },
    "5186": {
      "BLOCK_M": 256,
      "BLOCK_N": 16,
      "BLOCK_K": 128,
      "BLOCK_C": 64,
      "NUM_KSPLIT": 1,
      "num_warps": 2,
      "num_stages": 1,
      "waves_per_eu": 2
    },
    "482": {
      "BLOCK_M": 32,
      "BLOCK_N": 16,
      "BLOCK_K": 64,
      "BLOCK_C": 32,
      "NUM_KSPLIT": 4,
      "num_warps": 8,
      "num_stages": 1,
      "waves_per_eu": 2
    },
    "2850": {
      "BLOCK_M": 64,
      "BLOCK_N": 16,
      "BLOCK_K": 256,
      "BLOCK_C": 256,
      "NUM_KSPLIT": 4,
      "num_warps": 4,
      "num_stages": 1,
      "waves_per_eu": 0
    },
    "4511": {
      "BLOCK_M": 256,
      "BLOCK_N": 16,
      "BLOCK_K": 32,
      "BLOCK_C": 64,
      "NUM_KSPLIT": 4,
      "num_warps": 4,
      "num_stages": 2,
      "waves_per_eu": 2
    },
    "55": {
      "BLOCK_M": 32,
      "BLOCK_N": 16,
      "BLOCK_K": 32,
      "BLOCK_C": 16,
      "NUM_KSPLIT": 8,
      "num_warps": 2,
      "num_stages": 1,
      "waves_per_eu": 1
    },
    "3484": {
      "BLOCK_M": 128,
      "BLOCK_N": 16,
      "BLOCK_K": 64,
      "BLOCK_C": 128,
      "NUM_KSPLIT": 2,
      "num_warps": 4,
      "num_stages": 2,
      "waves_per_eu": 1
    },
    "2903": {
      "BLOCK_M": 128,
      "BLOCK_N": 16,
      "BLOCK_K": 32,
      "BLOCK_C": 16,
      "NUM_KSPLIT": 2,
      "num_warps": 2,
      "num_stages": 2,
      "waves_per_eu": 2
    },
    "3322": {
      "BLOCK_M": 128,
      "BLOCK_N": 16,
      "BLOCK_K": 64,
      "BLOCK_C": 32,
      "NUM_KSPLIT": 1,
      "num_warps": 4,
      "num_stages": 2,
      "waves_per_eu": 1
    },
    "1461": {
      "BLOCK_M": 64,
      "BLOCK_N": 16,
      "BLOCK_K": 32,
      "BLOCK_C": 16,
      "NUM_KSPLIT": 2,
      "num_warps": 2,
      "num_stages": 2,
      "waves_per_eu": 0
    },
    "1632": {
      "BLOCK_M": 64,
      "BLOCK_N": 16,
      "BLOCK_K": 32,
      "BLOCK_C": 64,
      "NUM_KSPLIT": 4,
      "num_warps": 8,
      "num_stages": 1,
      "waves_per_eu": 0
    },
    "4785": {
      "BLOCK_M": 256,
      "BLOCK_N": 16,
      "BLOCK_K": 64,
      "BLOCK_C": 32,
      "NUM_KSPLIT": 2,
      "num_warps": 8,
      "num_stages": 2,
      "waves_per_eu": 0
    },
    "3367": {
      "BLOCK_M": 128,
      "BLOCK_N": 16,
      "BLOCK_K": 64,
      "BLOCK_C": 32,
      "NUM_KSPLIT": 8,
      "num_warps": 2,
      "num_stages": 1,
      "waves_per_eu": 1
    },
    "4465": {
      "BLOCK_M": 256,
      "BLOCK_N": 16,
      "BLOCK_K": 32,
      "BLOCK_C": 64,
      "NUM_KSPLIT": 1,
      "num_warps": 2,
      "num_stages": 1,
      "waves_per_eu": 1
    },
    "3273": {
      "BLOCK_M": 128,
      "BLOCK_N": 16,
      "BLOCK_K": 64,
      "BLOCK_C": 16,
      "NUM_KSPLIT": 2,
      "num_warps": 8,
      "num_stages": 2,
      "waves_per_eu": 0
    },
    "1209": {
      "BLOCK_M": 32,
      "BLOCK_N": 16,
      "BLOCK_K": 256,
      "BLOCK_C": 32,
      "NUM_KSPLIT": 8,
      "num_warps": 2,
      "num_stages": 2,
      "waves_per_eu": 0
    },
    "4162": {
      "BLOCK_M": 128,
      "BLOCK_N": 16,
      "BLOCK_K": 256,
      "BLOCK_C": 64,
      "NUM_KSPLIT": 8,
      "num_warps": 2,
      "num_stages": 2,
      "waves_per_eu": 1
    },
    "1220": {
      "BLOCK_M": 32,
      "BLOCK_N": 16,
      "BLOCK_K": 256,
      "BLOCK_C": 32,
      "NUM_KSPLIT": 8,
      "num_warps": 8,
      "num_stages": 1,
      "waves_per_eu": 2
    },
    "275": {
      "BLOCK_M": 32,
      "BLOCK_N": 16,
      "BLOCK_K": 32,
      "BLOCK_C": 128,
      "NUM_KSPLIT": 8,
      "num_warps": 2,
      "num_stages": 2,
      "waves_per_eu": 2
    },
    "2365": {
      "BLOCK_M": 64,
      "BLOCK_N": 16,
      "BLOCK_K": 128,
      "BLOCK_C": 64,
      "NUM_KSPLIT": 8,
      "num_warps": 4,
      "num_stages": 1,
      "waves_per_eu": 1
    },
    "1108": {
      "BLOCK_M": 32,
      "BLOCK_N": 16,
      "BLOCK_K": 256,
      "BLOCK_C": 16,
      "NUM_KSPLIT": 2,
      "num_warps": 4,
      "num_stages": 2,
      "waves_per_eu": 1
    },
    "1558": {
      "BLOCK_M": 64,
      "BLOCK_N": 16,
      "BLOCK_K": 32,
      "BLOCK_C": 32,
      "NUM_KSPLIT": 4,
      "num_warps": 4,
      "num_stages": 2,
      "waves_per_eu": 1
    },
    "4246": {
      "BLOCK_M": 128,
      "BLOCK_N": 16,
      "BLOCK_K": 256,
      "BLOCK_C": 128,
      "NUM_KSPLIT": 8,
      "num_warps": 8,
      "num_stages": 2,
      "waves_per_eu": 1
    },
    "2808": {
      "BLOCK_M": 64,
      "BLOCK_N": 16,
      "BLOCK_K": 256,
      "BLOCK_C": 256,
      "NUM_KSPLIT": 1,
      "num_warps": 2,
      "num_stages": 1,
      "waves_per_eu": 0
    },
    "2299": {
      "BLOCK_M": 64,
      "BLOCK_N": 16,
      "BLOCK_K": 128,
      "BLOCK_C": 32,
      "NUM_KSPLIT": 8,
      "num_warps": 8,
      "num_stages": 1,
      "waves_per_eu": 1
    },
    "5337": {
      "BLOCK_M": 256,
      "BLOCK_N": 16,
      "BLOCK_K": 128,
      "BLOCK_C": 256,
      "NUM_KSPLIT": 1,
      "num_warps": 4,
      "num_stages": 2,
      "waves_per_eu": 0
    },
    "1596": {
      "BLOCK_M": 64,
      "BLOCK_N": 16,
      "BLOCK_K": 32,
      "BLOCK_C": 64,
      "NUM_KSPLIT": 1,
      "num_warps": 8,
      "num_stages": 1,
      "waves_per_eu": 0
    },
    "1409": {
      "BLOCK_M": 32,
      "BLOCK_N": 16,
      "BLOCK_K": 256,
      "BLOCK_C": 256,
      "NUM_KSPLIT": 4,
      "num_warps": 2,
      "num_stages": 2,
      "waves_per_eu": 2
    },
    "4722": {
      "BLOCK_M": 256,
      "BLOCK_N": 16,
      "BLOCK_K": 64,
      "BLOCK_C": 16,
      "NUM_KSPLIT": 4,
      "num_warps": 4,
      "num_stages": 1,
      "waves_per_eu": 0
    },
    "3467": {
      "BLOCK_M": 128,
      "BLOCK_N": 16,
      "BLOCK_K": 64,
      "BLOCK_C": 128,
      "NUM_KSPLIT": 1,
      "num_warps": 4,
      "num_stages": 2,
      "waves_per_eu": 2
    },
    "4445": {
      "BLOCK_M": 256,
      "BLOCK_N": 16,
      "BLOCK_K": 32,
      "BLOCK_C": 32,
      "NUM_KSPLIT": 4,
      "num_warps": 8,
      "num_stages": 2,
      "waves_per_eu": 2
    },
    "467": {
      "BLOCK_M": 32,
      "BLOCK_N": 16,
      "BLOCK_K": 64,
      "BLOCK_C": 32,
      "NUM_KSPLIT": 2,
      "num_warps": 8,
      "num_stages": 2,
      "waves_per_eu": 2
    },
    "3331": {
      "BLOCK_M": 128,
      "BLOCK_N": 16,
      "BLOCK_K": 64,
      "BLOCK_C": 32,
      "NUM_KSPLIT": 2,
      "num_warps": 2,
      "num_stages": 1,
      "waves_per_eu": 1
    },
    "3838": {
      "BLOCK_M": 128,
      "BLOCK_N": 16,
      "BLOCK_K": 128,
      "BLOCK_C": 128,
      "NUM_KSPLIT": 2,
      "num_warps": 2,
      "num_stages": 2,
      "waves_per_eu": 1
    },
    "3314": {
      "BLOCK_M": 128,
      "BLOCK_N": 16,
      "BLOCK_K": 64,
      "BLOCK_C": 32,
      "NUM_KSPLIT": 1,
      "num_warps": 2,
      "num_stages": 1,
      "waves_per_eu": 2
    },
    "3523": {
      "BLOCK_M": 128,
      "BLOCK_N": 16,
      "BLOCK_K": 64,
      "BLOCK_C": 128,
      "NUM_KSPLIT": 8,
      "num_warps": 8,
      "num_stages": 1,
      "waves_per_eu": 1
    },
    "2980": {
      "BLOCK_M": 128,
      "BLOCK_N": 16,
      "BLOCK_K": 32,
      "BLOCK_C": 32,
      "NUM_KSPLIT": 2,
      "num_warps": 4,
      "num_stages": 2,
      "waves_per_eu": 1
    },
    "5330": {
      "BLOCK_M": 256,
      "BLOCK_N": 16,
      "BLOCK_K": 128,
      "BLOCK_C": 256,
      "NUM_KSPLIT": 1,
      "num_warps": 2,
      "num_stages": 1,
      "waves_per_eu": 2
    },
    "1356": {
      "BLOCK_M": 32,
      "BLOCK_N": 16,
      "BLOCK_K": 256,
      "BLOCK_C": 128,
      "NUM_KSPLIT": 8,
      "num_warps": 4,
      "num_stages": 1,
      "waves_per_eu": 0
    },
    "1098": {
      "BLOCK_M": 32,
      "BLOCK_N": 16,
      "BLOCK_K": 256,
      "BLOCK_C": 16,
      "NUM_KSPLIT": 2,
      "num_warps": 2,
      "num_stages": 1,
      "waves_per_eu": 0
    },
    "974": {
      "BLOCK_M": 32,
      "BLOCK_N": 16,
      "BLOCK_K": 128,
      "BLOCK_C": 128,
      "NUM_KSPLIT": 4,
      "num_warps": 2,
      "num_stages": 1,
      "waves_per_eu": 2
    },
    "1002": {
      "BLOCK_M": 32,
      "BLOCK_N": 16,
      "BLOCK_K": 128,
      "BLOCK_C": 128,
      "NUM_KSPLIT": 8,
      "num_warps": 8,
      "num_stages": 1,
      "waves_per_eu": 0
    },
    "393": {
      "BLOCK_M": 32,
      "BLOCK_N": 16,
      "BLOCK_K": 64,
      "BLOCK_C": 16,
      "NUM_KSPLIT": 2,
      "num_warps": 8,
      "num_stages": 2,
      "waves_per_eu": 0
    },
    "753": {
      "BLOCK_M": 32,
      "BLOCK_N": 16,
      "BLOCK_K": 128,
      "BLOCK_C": 16,
      "NUM_KSPLIT": 2,
      "num_warps": 8,
      "num_stages": 2,
      "waves_per_eu": 0
    },
    "3480": {
      "BLOCK_M": 128,
      "BLOCK_N": 16,
      "BLOCK_K": 64,
      "BLOCK_C": 128,
      "NUM_KSPLIT": 2,
      "num_warps": 4,
      "num_stages": 1,
      "waves_per_eu": 0
    },
    "3257": {
      "BLOCK_M": 128,
      "BLOCK_N": 16,
      "BLOCK_K": 64,
      "BLOCK_C": 16,
      "NUM_KSPLIT": 1,
      "num_warps": 8,
      "num_stages": 2,
      "waves_per_eu": 2
    },
    "3309": {
      "BLOCK_M": 128,
      "BLOCK_N": 16,
      "BLOCK_K": 64,
      "BLOCK_C": 16,
      "NUM_KSPLIT": 8,
      "num_warps": 8,
      "num_stages": 2,
      "waves_per_eu": 0
    },
    "5065": {
      "BLOCK_M": 256,
      "BLOCK_N": 16,
      "BLOCK_K": 128,
      "BLOCK_C": 16,
      "NUM_KSPLIT": 2,
      "num_warps": 4,
      "num_stages": 1,
      "waves_per_eu": 1
    },
    "3657": {
      "BLOCK_M": 128,
      "BLOCK_N": 16,
      "BLOCK_K": 128,
      "BLOCK_C": 16,
      "NUM_KSPLIT": 8,
      "num_warps": 2,
      "num_stages": 2,
      "waves_per_eu": 0
    },
    "2562": {
      "BLOCK_M": 64,
      "BLOCK_N": 16,
      "BLOCK_K": 256,
      "BLOCK_C": 16,
      "NUM_KSPLIT": 4,
      "num_warps": 4,
      "num_stages": 1,
      "waves_per_eu": 0
    },
    "891": {
      "BLOCK_M": 32,
      "BLOCK_N": 16,
      "BLOCK_K": 128,
      "BLOCK_C": 64,
      "NUM_KSPLIT": 2,
      "num_warps": 4,
      "num_stages": 2,
      "waves_per_eu": 0
    },
    "2583": {
      "BLOCK_M": 64,
      "BLOCK_N": 16,
      "BLOCK_K": 256,
      "BLOCK_C": 16,
      "NUM_KSPLIT": 8,
      "num_warps": 4,
      "num_stages": 2,
      "waves_per_eu": 0
    },
    "4444": {
      "BLOCK_M": 256,
      "BLOCK_N": 16,
      "BLOCK_K": 32,
      "BLOCK_C": 32,
      "NUM_KSPLIT": 4,
      "num_warps": 8,
      "num_stages": 2,
      "waves_per_eu": 1
    },
    "2845": {
      "BLOCK_M": 64,
      "BLOCK_N": 16,
      "BLOCK_K": 256,
      "BLOCK_C": 256,
      "NUM_KSPLIT": 4,
      "num_warps": 2,
      "num_stages": 1,
      "waves_per_eu": 1
    },
    "1361": {
      "BLOCK_M": 32,
      "BLOCK_N": 16,
      "BLOCK_K": 256,
      "BLOCK_C": 128,
      "NUM_KSPLIT": 8,
      "num_warps": 4,
      "num_stages": 2,
      "waves_per_eu": 2
    },
    "5566": {
      "BLOCK_M": 256,
      "BLOCK_N": 16,
      "BLOCK_K": 256,
      "BLOCK_C": 64,
      "NUM_KSPLIT": 2,
      "num_warps": 2,
      "num_stages": 2,
      "waves_per_eu": 1
    },
    "224": {
      "BLOCK_M": 32,
      "BLOCK_N": 16,
      "BLOCK_K": 32,
      "BLOCK_C": 128,
      "NUM_KSPLIT": 1,
      "num_warps": 4,
      "num_stages": 1,
      "waves_per_eu": 2
    },
    "4969": {
      "BLOCK_M": 256,
      "BLOCK_N": 16,
      "BLOCK_K": 64,
      "BLOCK_C": 256,
      "NUM_KSPLIT": 1,
      "num_warps": 2,
      "num_stages": 1,
      "waves_per_eu": 1
    },
    "2790": {
      "BLOCK_M": 64,
      "BLOCK_N": 16,
      "BLOCK_K": 256,
      "BLOCK_C": 128,
      "NUM_KSPLIT": 8,
      "num_warps": 2,
      "num_stages": 1,
      "waves_per_eu": 0
    },
    "4604": {
      "BLOCK_M": 256,
      "BLOCK_N": 16,
      "BLOCK_K": 32,
      "BLOCK_C": 128,
      "NUM_KSPLIT": 8,
      "num_warps": 8,
      "num_stages": 1,
      "waves_per_eu": 2
    },
    "5191": {
      "BLOCK_M": 256,
      "BLOCK_N": 16,
      "BLOCK_K": 128,
      "BLOCK_C": 64,
      "NUM_KSPLIT": 1,
      "num_warps": 4,
      "num_stages": 1,
      "waves_per_eu": 1
    },
    "1173": {
      "BLOCK_M": 32,
      "BLOCK_N": 16,
      "BLOCK_K": 256,
      "BLOCK_C": 32,
      "NUM_KSPLIT": 2,
      "num_warps": 2,
      "num_stages": 2,
      "waves_per_eu": 0
    },
    "3103": {
      "BLOCK_M": 128,
      "BLOCK_N": 16,
      "BLOCK_K": 32,
      "BLOCK_C": 128,
      "NUM_KSPLIT": 1,
      "num_warps": 4,
      "num_stages": 1,
      "waves_per_eu": 1
    },
    "1282": {
      "BLOCK_M": 32,
      "BLOCK_N": 16,
      "BLOCK_K": 256,
      "BLOCK_C": 64,
      "NUM_KSPLIT": 8,
      "num_warps": 2,
      "num_stages": 2,
      "waves_per_eu": 1
    },
    "259": {
      "BLOCK_M": 32,
      "BLOCK_N": 16,
      "BLOCK_K": 32,
      "BLOCK_C": 128,
      "NUM_KSPLIT": 4,
      "num_warps": 4,
      "num_stages": 1,
      "waves_per_eu": 1
    },
    "1492": {
      "BLOCK_M": 64,
      "BLOCK_N": 16,
      "BLOCK_K": 32,
      "BLOCK_C": 16,
      "NUM_KSPLIT": 4,
      "num_warps": 8,
      "num_stages": 2,
      "waves_per_eu": 1
    },
    "2263": {
      "BLOCK_M": 64,
      "BLOCK_N": 16,
      "BLOCK_K": 128,
      "BLOCK_C": 32,
      "NUM_KSPLIT": 2,
      "num_warps": 8,
      "num_stages": 1,
      "waves_per_eu": 1
    },
    "1457": {
      "BLOCK_M": 64,
      "BLOCK_N": 16,
      "BLOCK_K": 32,
      "BLOCK_C": 16,
      "NUM_KSPLIT": 1,
      "num_warps": 8,
      "num_stages": 2,
      "waves_per_eu": 2
    },
    "208": {
      "BLOCK_M": 32,
      "BLOCK_N": 16,
      "BLOCK_K": 32,
      "BLOCK_C": 64,
      "NUM_KSPLIT": 8,
      "num_warps": 4,
      "num_stages": 2,
      "waves_per_eu": 1
    },
    "3494": {
      "BLOCK_M": 128,
      "BLOCK_N": 16,
      "BLOCK_K": 64,
      "BLOCK_C": 128,
      "NUM_KSPLIT": 4,
      "num_warps": 2,
      "num_stages": 1,
      "waves_per_eu": 2
    },
    "3066": {
      "BLOCK_M": 128,
      "BLOCK_N": 16,
      "BLOCK_K": 32,
      "BLOCK_C": 64,
      "NUM_KSPLIT": 4,
      "num_warps": 4,
      "num_stages": 1,
      "waves_per_eu": 0
    },
    "229": {
      "BLOCK_M": 32,
      "BLOCK_N": 16,
      "BLOCK_K": 32,
      "BLOCK_C": 128,
      "NUM_KSPLIT": 1,
      "num_warps": 8,
      "num_stages": 1,
      "waves_per_eu": 1
    },
    "260": {
      "BLOCK_M": 32,
      "BLOCK_N": 16,
      "BLOCK_K": 32,
      "BLOCK_C": 128,
      "NUM_KSPLIT": 4,
      "num_warps": 4,
      "num_stages": 1,
      "waves_per_eu": 2
    },
    "2418": {
      "BLOCK_M": 64,
      "BLOCK_N": 16,
      "BLOCK_K": 128,
      "BLOCK_C": 128,
      "NUM_KSPLIT": 4,
      "num_warps": 4,
      "num_stages": 1,
      "waves_per_eu": 0
    },
    "5462": {
      "BLOCK_M": 256,
      "BLOCK_N": 16,
      "BLOCK_K": 256,
      "BLOCK_C": 16,
      "NUM_KSPLIT": 8,
      "num_warps": 4,
      "num_stages": 1,
      "waves_per_eu": 2
    },
    "4311": {
      "BLOCK_M": 128,
      "BLOCK_N": 16,
      "BLOCK_K": 256,
      "BLOCK_C": 256,
      "NUM_KSPLIT": 8,
      "num_warps": 4,
      "num_stages": 2,
      "waves_per_eu": 0
    },
    "2021": {
      "BLOCK_M": 64,
      "BLOCK_N": 16,
      "BLOCK_K": 64,
      "BLOCK_C": 128,
      "NUM_KSPLIT": 1,
      "num_warps": 2,
      "num_stages": 2,
      "waves_per_eu": 2
    },
    "2373": {
      "BLOCK_M": 64,
      "BLOCK_N": 16,
      "BLOCK_K": 128,
      "BLOCK_C": 64,
      "NUM_KSPLIT": 8,
      "num_warps": 8,
      "num_stages": 2,
      "waves_per_eu": 0
    },
    "3817": {
      "BLOCK_M": 128,
      "BLOCK_N": 16,
      "BLOCK_K": 128,
      "BLOCK_C": 128,
      "NUM_KSPLIT": 1,
      "num_warps": 2,
      "num_stages": 1,
      "waves_per_eu": 1
    },
    "1075": {
      "BLOCK_M": 32,
      "BLOCK_N": 16,
      "BLOCK_K": 128,
      "BLOCK_C": 256,
      "NUM_KSPLIT": 8,
      "num_warps": 8,
      "num_stages": 1,
      "waves_per_eu": 1
    },
    "2893": {
      "BLOCK_M": 128,
      "BLOCK_N": 16,
      "BLOCK_K": 32,
      "BLOCK_C": 16,
      "NUM_KSPLIT": 1,
      "num_warps": 8,
      "num_stages": 1,
      "waves_per_eu": 1
    },
    "3371": {
      "BLOCK_M": 128,
      "BLOCK_N": 16,
      "BLOCK_K": 64,
      "BLOCK_C": 32,
      "NUM_KSPLIT": 8,
      "num_warps": 2,
      "num_stages": 2,
      "waves_per_eu": 2
    },
    "2799": {
      "BLOCK_M": 64,
      "BLOCK_N": 16,
      "BLOCK_K": 256,
      "BLOCK_C": 128,
      "NUM_KSPLIT": 8,
      "num_warps": 4,
      "num_stages": 2,
      "waves_per_eu": 0
    },
    "3426": {
      "BLOCK_M": 128,
      "BLOCK_N": 16,
      "BLOCK_K": 64,
      "BLOCK_C": 64,
      "NUM_KSPLIT": 4,
      "num_warps": 4,
      "num_stages": 1,
      "waves_per_eu": 0
    },
    "2862": {
      "BLOCK_M": 64,
      "BLOCK_N": 16,
      "BLOCK_K": 256,
      "BLOCK_C": 256,
      "NUM_KSPLIT": 8,
      "num_warps": 2,
      "num_stages": 1,
      "waves_per_eu": 0
    },
    "3977": {
      "BLOCK_M": 128,
      "BLOCK_N": 16,
      "BLOCK_K": 256,
      "BLOCK_C": 16,
      "NUM_KSPLIT": 1,
      "num_warps": 8,
      "num_stages": 2,
      "waves_per_eu": 2
    },
    "2297": {
      "BLOCK_M": 64,
      "BLOCK_N": 16,
      "BLOCK_K": 128,
      "BLOCK_C": 32,
      "NUM_KSPLIT": 8,
      "num_warps": 4,
      "num_stages": 2,
      "waves_per_eu": 2
    },
    "567": {
      "BLOCK_M": 32,
      "BLOCK_N": 16,
      "BLOCK_K": 64,
      "BLOCK_C": 64,
      "NUM_KSPLIT": 8,
      "num_warps": 4,
      "num_stages": 2,
      "waves_per_eu": 0
    },
    "1745": {
      "BLOCK_M": 64,
      "BLOCK_N": 16,
      "BLOCK_K": 32,
      "BLOCK_C": 256,
      "NUM_KSPLIT": 1,
      "num_warps": 8,
      "num_stages": 2,
      "waves_per_eu": 2
    },
    "2444": {
      "BLOCK_M": 64,
      "BLOCK_N": 16,
      "BLOCK_K": 128,
      "BLOCK_C": 128,
      "NUM_KSPLIT": 8,
      "num_warps": 8,
      "num_stages": 1,
      "waves_per_eu": 2
    },
    "5414": {
      "BLOCK_M": 256,
      "BLOCK_N": 16,
      "BLOCK_K": 256,
      "BLOCK_C": 16,
      "NUM_KSPLIT": 1,
      "num_warps": 8,
      "num_stages": 1,
      "waves_per_eu": 2
    },
    "474": {
      "BLOCK_M": 32,
      "BLOCK_N": 16,
      "BLOCK_K": 64,
      "BLOCK_C": 32,
      "NUM_KSPLIT": 4,
      "num_warps": 4,
      "num_stages": 1,
      "waves_per_eu": 0
    },
    "1169": {
      "BLOCK_M": 32,
      "BLOCK_N": 16,
      "BLOCK_K": 256,
      "BLOCK_C": 32,
      "NUM_KSPLIT": 1,
      "num_warps": 8,
      "num_stages": 2,
      "waves_per_eu": 2
    },
    "2728": {
      "BLOCK_M": 64,
      "BLOCK_N": 16,
      "BLOCK_K": 256,
      "BLOCK_C": 64,
      "NUM_KSPLIT": 8,
      "num_warps": 4,
      "num_stages": 2,
      "waves_per_eu": 1
    },
    "1773": {
      "BLOCK_M": 64,
      "BLOCK_N": 16,
      "BLOCK_K": 32,
      "BLOCK_C": 256,
      "NUM_KSPLIT": 4,
      "num_warps": 4,
      "num_stages": 2,
      "waves_per_eu": 0
    },
    "4358": {
      "BLOCK_M": 256,
      "BLOCK_N": 16,
      "BLOCK_K": 32,
      "BLOCK_C": 16,
      "NUM_KSPLIT": 4,
      "num_warps": 2,
      "num_stages": 1,
      "waves_per_eu": 2
    },
    "578": {
      "BLOCK_M": 32,
      "BLOCK_N": 16,
      "BLOCK_K": 64,
      "BLOCK_C": 128,
      "NUM_KSPLIT": 1,
      "num_warps": 2,
      "num_stages": 1,
      "waves_per_eu": 2
    },
    "2379": {
      "BLOCK_M": 64,
      "BLOCK_N": 16,
      "BLOCK_K": 128,
      "BLOCK_C": 128,
      "NUM_KSPLIT": 1,
      "num_warps": 2,
      "num_stages": 2,
      "waves_per_eu": 0
    },
    "4744": {
      "BLOCK_M": 256,
      "BLOCK_N": 16,
      "BLOCK_K": 64,
      "BLOCK_C": 16,
      "NUM_KSPLIT": 8,
      "num_warps": 4,
      "num_stages": 2,
      "waves_per_eu": 1
    },
    "1679": {
      "BLOCK_M": 64,
      "BLOCK_N": 16,
      "BLOCK_K": 32,
      "BLOCK_C": 128,
      "NUM_KSPLIT": 2,
      "num_warps": 2,
      "num_stages": 2,
      "waves_per_eu": 2
    },
    "2550": {
      "BLOCK_M": 64,
      "BLOCK_N": 16,
      "BLOCK_K": 256,
      "BLOCK_C": 16,
      "NUM_KSPLIT": 2,
      "num_warps": 8,
      "num_stages": 1,
      "waves_per_eu": 0
    },
    "5598": {
      "BLOCK_M": 256,
      "BLOCK_N": 16,
      "BLOCK_K": 256,
      "BLOCK_C": 64,
      "NUM_KSPLIT": 8,
      "num_warps": 2,
      "num_stages": 1,
      "waves_per_eu": 0
    },
    "4333": {
      "BLOCK_M": 256,
      "BLOCK_N": 16,
      "BLOCK_K": 32,
      "BLOCK_C": 16,
      "NUM_KSPLIT": 1,
      "num_warps": 8,
      "num_stages": 1,
      "waves_per_eu": 1
    },
    "3175": {
      "BLOCK_M": 128,
      "BLOCK_N": 16,
      "BLOCK_K": 32,
      "BLOCK_C": 256,
      "NUM_KSPLIT": 1,
      "num_warps": 4,
      "num_stages": 1,
      "waves_per_eu": 1
    },
    "4824": {
      "BLOCK_M": 256,
      "BLOCK_N": 16,
      "BLOCK_K": 64,
      "BLOCK_C": 64,
      "NUM_KSPLIT": 1,
      "num_warps": 2,
      "num_stages": 1,
      "waves_per_eu": 0
    },
    "201": {
      "BLOCK_M": 32,
      "BLOCK_N": 16,
      "BLOCK_K": 32,
      "BLOCK_C": 64,
      "NUM_KSPLIT": 8,
      "num_warps": 2,
      "num_stages": 2,
      "waves_per_eu": 0
    },
    "1644": {
      "BLOCK_M": 64,
      "BLOCK_N": 16,
      "BLOCK_K": 32,
      "BLOCK_C": 64,
      "NUM_KSPLIT": 8,
      "num_warps": 4,
      "num_stages": 1,
      "waves_per_eu": 0
    },
    "5584": {
      "BLOCK_M": 256,
      "BLOCK_N": 16,
      "BLOCK_K": 256,
      "BLOCK_C": 64,
      "NUM_KSPLIT": 4,
      "num_warps": 2,
      "num_stages": 2,
      "waves_per_eu": 1
    },
    "4131": {
      "BLOCK_M": 128,
      "BLOCK_N": 16,
      "BLOCK_K": 256,
      "BLOCK_C": 64,
      "NUM_KSPLIT": 2,
      "num_warps": 4,
      "num_stages": 2,
      "waves_per_eu": 0
    },
    "1383": {
      "BLOCK_M": 32,
      "BLOCK_N": 16,
      "BLOCK_K": 256,
      "BLOCK_C": 256,
      "NUM_KSPLIT": 1,
      "num_warps": 8,
      "num_stages": 2,
      "waves_per_eu": 0
    },
    "587": {
      "BLOCK_M": 32,
      "BLOCK_N": 16,
      "BLOCK_K": 64,
      "BLOCK_C": 128,
      "NUM_KSPLIT": 1,
      "num_warps": 4,
      "num_stages": 2,
      "waves_per_eu": 2
    },
    "4365": {
      "BLOCK_M": 256,
      "BLOCK_N": 16,
      "BLOCK_K": 32,
      "BLOCK_C": 16,
      "NUM_KSPLIT": 4,
      "num_warps": 4,
      "num_stages": 2,
      "waves_per_eu": 0
    },
    "3372": {
      "BLOCK_M": 128,
      "BLOCK_N": 16,
      "BLOCK_K": 64,
      "BLOCK_C": 32,
      "NUM_KSPLIT": 8,
      "num_warps": 4,
      "num_stages": 1,
      "waves_per_eu": 0
    },
    "1588": {
      "BLOCK_M": 64,
      "BLOCK_N": 16,
      "BLOCK_K": 32,
      "BLOCK_C": 64,
      "NUM_KSPLIT": 1,
      "num_warps": 2,
      "num_stages": 2,
      "waves_per_eu": 1
    },
    "5604": {
      "BLOCK_M": 256,
      "BLOCK_N": 16,
      "BLOCK_K": 256,
      "BLOCK_C": 64,
      "NUM_KSPLIT": 8,
      "num_warps": 4,
      "num_stages": 1,
      "waves_per_eu": 0
    },
    "428": {
      "BLOCK_M": 32,
      "BLOCK_N": 16,
      "BLOCK_K": 64,
      "BLOCK_C": 16,
      "NUM_KSPLIT": 8,
      "num_warps": 8,
      "num_stages": 1,
      "waves_per_eu": 2
    },
    "5562": {
      "BLOCK_M": 256,
      "BLOCK_N": 16,
      "BLOCK_K": 256,
      "BLOCK_C": 64,
      "NUM_KSPLIT": 2,
      "num_warps": 2,
      "num_stages": 1,
      "waves_per_eu": 0
    },
    "3474": {
      "BLOCK_M": 128,
      "BLOCK_N": 16,
      "BLOCK_K": 64,
      "BLOCK_C": 128,
      "NUM_KSPLIT": 2,
      "num_warps": 2,
      "num_stages": 1,
      "waves_per_eu": 0
    },
    "1626": {
      "BLOCK_M": 64,
      "BLOCK_N": 16,
      "BLOCK_K": 32,
      "BLOCK_C": 64,
      "NUM_KSPLIT": 4,
      "num_warps": 4,
      "num_stages": 1,
      "waves_per_eu": 0
    },
    "5142": {
      "BLOCK_M": 256,
      "BLOCK_N": 16,
      "BLOCK_K": 128,
      "BLOCK_C": 32,
      "NUM_KSPLIT": 2,
      "num_warps": 8,
      "num_stages": 1,
      "waves_per_eu": 0
    },
    "2269": {
      "BLOCK_M": 64,
      "BLOCK_N": 16,
      "BLOCK_K": 128,
      "BLOCK_C": 32,
      "NUM_KSPLIT": 4,
      "num_warps": 2,
      "num_stages": 1,
      "waves_per_eu": 1
    },
    "4243": {
      "BLOCK_M": 128,
      "BLOCK_N": 16,
      "BLOCK_K": 256,
      "BLOCK_C": 128,
      "NUM_KSPLIT": 8,
      "num_warps": 8,
      "num_stages": 1,
      "waves_per_eu": 1
    },
    "1329": {
      "BLOCK_M": 32,
      "BLOCK_N": 16,
      "BLOCK_K": 256,
      "BLOCK_C": 128,
      "NUM_KSPLIT": 2,
      "num_warps": 8,
      "num_stages": 2,
      "waves_per_eu": 0
    },
    "4001": {
      "BLOCK_M": 128,
      "BLOCK_N": 16,
      "BLOCK_K": 256,
      "BLOCK_C": 16,
      "NUM_KSPLIT": 4,
      "num_warps": 2,
      "num_stages": 2,
      "waves_per_eu": 2
    },
    "3729": {
      "BLOCK_M": 128,
      "BLOCK_N": 16,
      "BLOCK_K": 128,
      "BLOCK_C": 32,
      "NUM_KSPLIT": 8,
      "num_warps": 2,
      "num_stages": 2,
      "waves_per_eu": 0
    },
    "902": {
      "BLOCK_M": 32,
      "BLOCK_N": 16,
      "BLOCK_K": 128,
      "BLOCK_C": 64,
      "NUM_KSPLIT": 4,
      "num_warps": 2,
      "num_stages": 1,
      "waves_per_eu": 2
    },
    "3917": {
      "BLOCK_M": 128,
      "BLOCK_N": 16,
      "BLOCK_K": 128,
      "BLOCK_C": 256,
      "NUM_KSPLIT": 2,
      "num_warps": 4,
      "num_stages": 2,
      "waves_per_eu": 2
    },
    "1938": {
      "BLOCK_M": 64,
      "BLOCK_N": 16,
      "BLOCK_K": 64,
      "BLOCK_C": 32,
      "NUM_KSPLIT": 8,
      "num_warps": 8,
      "num_stages": 1,
      "waves_per_eu": 0
    },
    "4952": {
      "BLOCK_M": 256,
      "BLOCK_N": 16,
      "BLOCK_K": 64,
      "BLOCK_C": 128,
      "NUM_KSPLIT": 8,
      "num_warps": 2,
      "num_stages": 1,
      "waves_per_eu": 2
    },
    "2498": {
      "BLOCK_M": 64,
      "BLOCK_N": 16,
      "BLOCK_K": 128,
      "BLOCK_C": 256,
      "NUM_KSPLIT": 4,
      "num_warps": 8,
      "num_stages": 1,
      "waves_per_eu": 2
    },
    "2828": {
      "BLOCK_M": 64,
      "BLOCK_N": 16,
      "BLOCK_K": 256,
      "BLOCK_C": 256,
      "NUM_KSPLIT": 2,
      "num_warps": 2,
      "num_stages": 1,
      "waves_per_eu": 2
    },
    "1296": {
      "BLOCK_M": 32,
      "BLOCK_N": 16,
      "BLOCK_K": 256,
      "BLOCK_C": 128,
      "NUM_KSPLIT": 1,
      "num_warps": 2,
      "num_stages": 1,
      "waves_per_eu": 0
    },
    "5474": {
      "BLOCK_M": 256,
      "BLOCK_N": 16,
      "BLOCK_K": 256,
      "BLOCK_C": 32,
      "NUM_KSPLIT": 1,
      "num_warps": 2,
      "num_stages": 1,
      "waves_per_eu": 2
    },
    "3036": {
      "BLOCK_M": 128,
      "BLOCK_N": 16,
      "BLOCK_K": 32,
      "BLOCK_C": 64,
      "NUM_KSPLIT": 1,
      "num_warps": 8,
      "num_stages": 1,
      "waves_per_eu": 0
    },
    "4343": {
      "BLOCK_M": 256,
      "BLOCK_N": 16,
      "BLOCK_K": 32,
      "BLOCK_C": 16,
      "NUM_KSPLIT": 2,
      "num_warps": 2,
      "num_stages": 2,
      "waves_per_eu": 2
    },
    "3622": {
      "BLOCK_M": 128,
      "BLOCK_N": 16,
      "BLOCK_K": 128,
      "BLOCK_C": 16,
      "NUM_KSPLIT": 2,
      "num_warps": 2,
      "num_stages": 2,
      "waves_per_eu": 1
    },
    "1156": {
      "BLOCK_M": 32,
      "BLOCK_N": 16,
      "BLOCK_K": 256,
      "BLOCK_C": 32,
      "NUM_KSPLIT": 1,
      "num_warps": 2,
      "num_stages": 2,
      "waves_per_eu": 1
    },
    "1768": {
      "BLOCK_M": 64,
      "BLOCK_N": 16,
      "BLOCK_K": 32,
      "BLOCK_C": 256,
      "NUM_KSPLIT": 4,
      "num_warps": 2,
      "num_stages": 2,
      "waves_per_eu": 1
    },
    "4415": {
      "BLOCK_M": 256,
      "BLOCK_N": 16,
      "BLOCK_K": 32,
      "BLOCK_C": 32,
      "NUM_KSPLIT": 2,
      "num_warps": 2,
      "num_stages": 2,
      "waves_per_eu": 2
    },
    "5568": {
      "BLOCK_M": 256,
      "BLOCK_N": 16,
      "BLOCK_K": 256,
      "BLOCK_C": 64,
      "NUM_KSPLIT": 2,
      "num_warps": 4,
      "num_stages": 1,
      "waves_per_eu": 0
    },
    "3836": {
      "BLOCK_M": 128,
      "BLOCK_N": 16,
      "BLOCK_K": 128,
      "BLOCK_C": 128,
      "NUM_KSPLIT": 2,
      "num_warps": 2,
      "num_stages": 1,
      "waves_per_eu": 2
    },
    "1617": {
      "BLOCK_M": 64,
      "BLOCK_N": 16,
      "BLOCK_K": 32,
      "BLOCK_C": 64,
      "NUM_KSPLIT": 2,
      "num_warps": 8,
      "num_stages": 2,
      "waves_per_eu": 0
    },
    "5193": {
      "BLOCK_M": 256,
      "BLOCK_N": 16,
      "BLOCK_K": 128,
      "BLOCK_C": 64,
      "NUM_KSPLIT": 1,
      "num_warps": 4,
      "num_stages": 2,
      "waves_per_eu": 0
    },
    "4985": {
      "BLOCK_M": 256,
      "BLOCK_N": 16,
      "BLOCK_K": 64,
      "BLOCK_C": 256,
      "NUM_KSPLIT": 1,
      "num_warps": 8,
      "num_stages": 2,
      "waves_per_eu": 2
    },
    "4260": {
      "BLOCK_M": 128,
      "BLOCK_N": 16,
      "BLOCK_K": 256,
      "BLOCK_C": 256,
      "NUM_KSPLIT": 1,
      "num_warps": 8,
      "num_stages": 1,
      "waves_per_eu": 0
    },
    "4034": {
      "BLOCK_M": 128,
      "BLOCK_N": 16,
      "BLOCK_K": 256,
      "BLOCK_C": 32,
      "NUM_KSPLIT": 1,
      "num_warps": 2,
      "num_stages": 1,
      "waves_per_eu": 2
    },
    "325": {
      "BLOCK_M": 32,
      "BLOCK_N": 16,
      "BLOCK_K": 32,
      "BLOCK_C": 256,
      "NUM_KSPLIT": 4,
      "num_warps": 2,
      "num_stages": 1,
      "waves_per_eu": 1
    },
    "2372": {
      "BLOCK_M": 64,
      "BLOCK_N": 16,
      "BLOCK_K": 128,
      "BLOCK_C": 64,
      "NUM_KSPLIT": 8,
      "num_warps": 8,
      "num_stages": 1,
      "waves_per_eu": 2
    },
    "4826": {
      "BLOCK_M": 256,
      "BLOCK_N": 16,
      "BLOCK_K": 64,
      "BLOCK_C": 64,
      "NUM_KSPLIT": 1,
      "num_warps": 2,
      "num_stages": 1,
      "waves_per_eu": 2
    },
    "4950": {
      "BLOCK_M": 256,
      "BLOCK_N": 16,
      "BLOCK_K": 64,
      "BLOCK_C": 128,
      "NUM_KSPLIT": 8,
      "num_warps": 2,
      "num_stages": 1,
      "waves_per_eu": 0
    },
    "4643": {
      "BLOCK_M": 256,
      "BLOCK_N": 16,
      "BLOCK_K": 32,
      "BLOCK_C": 256,
      "NUM_KSPLIT": 2,
      "num_warps": 8,
      "num_stages": 2,
      "waves_per_eu": 2
    },
    "5304": {
      "BLOCK_M": 256,
      "BLOCK_N": 16,
      "BLOCK_K": 128,
      "BLOCK_C": 128,
      "NUM_KSPLIT": 4,
      "num_warps": 8,
      "num_stages": 1,
      "waves_per_eu": 0
    },
    "4244": {
      "BLOCK_M": 128,
      "BLOCK_N": 16,
      "BLOCK_K": 256,
      "BLOCK_C": 128,
      "NUM_KSPLIT": 8,
      "num_warps": 8,
      "num_stages": 1,
      "waves_per_eu": 2
    },
    "2891": {
      "BLOCK_M": 128,
      "BLOCK_N": 16,
      "BLOCK_K": 32,
      "BLOCK_C": 16,
      "NUM_KSPLIT": 1,
      "num_warps": 4,
      "num_stages": 2,
      "waves_per_eu": 2
    },
    "890": {
      "BLOCK_M": 32,
      "BLOCK_N": 16,
      "BLOCK_K": 128,
      "BLOCK_C": 64,
      "NUM_KSPLIT": 2,
      "num_warps": 4,
      "num_stages": 1,
      "waves_per_eu": 2
    },
    "273": {
      "BLOCK_M": 32,
      "BLOCK_N": 16,
      "BLOCK_K": 32,
      "BLOCK_C": 128,
      "NUM_KSPLIT": 8,
      "num_warps": 2,
      "num_stages": 2,
      "waves_per_eu": 0
    },
    "4157": {
      "BLOCK_M": 128,
      "BLOCK_N": 16,
      "BLOCK_K": 256,
      "BLOCK_C": 64,
      "NUM_KSPLIT": 4,
      "num_warps": 8,
      "num_stages": 2,
      "waves_per_eu": 2
    },
    "1862": {
      "BLOCK_M": 64,
      "BLOCK_N": 16,
      "BLOCK_K": 64,
      "BLOCK_C": 16,
      "NUM_KSPLIT": 8,
      "num_warps": 4,
      "num_stages": 1,
      "waves_per_eu": 2
    },
    "4956": {
      "BLOCK_M": 256,
      "BLOCK_N": 16,
      "BLOCK_K": 64,
      "BLOCK_C": 128,
      "NUM_KSPLIT": 8,
      "num_warps": 4,
      "num_stages": 1,
      "waves_per_eu": 0
    },
    "5122": {
      "BLOCK_M": 256,
      "BLOCK_N": 16,
      "BLOCK_K": 128,
      "BLOCK_C": 32,
      "NUM_KSPLIT": 1,
      "num_warps": 4,
      "num_stages": 2,
      "waves_per_eu": 1
    },
    "4294": {
      "BLOCK_M": 128,
      "BLOCK_N": 16,
      "BLOCK_K": 256,
      "BLOCK_C": 256,
      "NUM_KSPLIT": 4,
      "num_warps": 4,
      "num_stages": 2,
      "waves_per_eu": 1
    },
    "5093": {
      "BLOCK_M": 256,
      "BLOCK_N": 16,
      "BLOCK_K": 128,
      "BLOCK_C": 16,
      "NUM_KSPLIT": 4,
      "num_warps": 8,
      "num_stages": 2,
      "waves_per_eu": 2
    },
    "3438": {
      "BLOCK_M": 128,
      "BLOCK_N": 16,
      "BLOCK_K": 64,
      "BLOCK_C": 64,
      "NUM_KSPLIT": 8,
      "num_warps": 2,
      "num_stages": 1,
      "waves_per_eu": 0
    },
    "5703": {
      "BLOCK_M": 256,
      "BLOCK_N": 16,
      "BLOCK_K": 256,
      "BLOCK_C": 256,
      "NUM_KSPLIT": 1,
      "num_warps": 8,
      "num_stages": 2,
      "waves_per_eu": 0
    },
    "3779": {
      "BLOCK_M": 128,
      "BLOCK_N": 16,
      "BLOCK_K": 128,
      "BLOCK_C": 64,
      "NUM_KSPLIT": 2,
      "num_warps": 8,
      "num_stages": 2,
      "waves_per_eu": 2
    },
    "1041": {
      "BLOCK_M": 32,
      "BLOCK_N": 16,
      "BLOCK_K": 128,
      "BLOCK_C": 256,
      "NUM_KSPLIT": 2,
      "num_warps": 8,
      "num_stages": 2,
      "waves_per_eu": 0
    },
    "2645": {
      "BLOCK_M": 64,
      "BLOCK_N": 16,
      "BLOCK_K": 256,
      "BLOCK_C": 32,
      "NUM_KSPLIT": 4,
      "num_warps": 8,
      "num_stages": 2,
      "waves_per_eu": 2
    },
    "5013": {
      "BLOCK_M": 256,
      "BLOCK_N": 16,
      "BLOCK_K": 64,
      "BLOCK_C": 256,
      "NUM_KSPLIT": 4,
      "num_warps": 4,
      "num_stages": 2,
      "waves_per_eu": 0
    },
    "2975": {
      "BLOCK_M": 128,
      "BLOCK_N": 16,
      "BLOCK_K": 32,
      "BLOCK_C": 32,
      "NUM_KSPLIT": 2,
      "num_warps": 2,
      "num_stages": 2,
      "waves_per_eu": 2
    },
    "1744": {
      "BLOCK_M": 64,
      "BLOCK_N": 16,
      "BLOCK_K": 32,
      "BLOCK_C": 256,
      "NUM_KSPLIT": 1,
      "num_warps": 8,
      "num_stages": 2,
      "waves_per_eu": 1
    },
    "2863": {
      "BLOCK_M": 64,
      "BLOCK_N": 16,
      "BLOCK_K": 256,
      "BLOCK_C": 256,
      "NUM_KSPLIT": 8,
      "num_warps": 2,
      "num_stages": 1,
      "waves_per_eu": 1
    },
    "1848": {
      "BLOCK_M": 64,
      "BLOCK_N": 16,
      "BLOCK_K": 64,
      "BLOCK_C": 16,
      "NUM_KSPLIT": 4,
      "num_warps": 8,
      "num_stages": 1,
      "waves_per_eu": 0
    },
    "2121": {
      "BLOCK_M": 64,
      "BLOCK_N": 16,
      "BLOCK_K": 64,
      "BLOCK_C": 256,
      "NUM_KSPLIT": 2,
      "num_warps": 8,
      "num_stages": 2,
      "waves_per_eu": 0
    },
    "1431": {
      "BLOCK_M": 32,
      "BLOCK_N": 16,
      "BLOCK_K": 256,
      "BLOCK_C": 256,
      "NUM_KSPLIT": 8,
      "num_warps": 4,
      "num_stages": 2,
      "waves_per_eu": 0
    },
    "2019": {
      "BLOCK_M": 64,
      "BLOCK_N": 16,
      "BLOCK_K": 64,
      "BLOCK_C": 128,
      "NUM_KSPLIT": 1,
      "num_warps": 2,
      "num_stages": 2,
      "waves_per_eu": 0
    },
    "2697": {
      "BLOCK_M": 64,
      "BLOCK_N": 16,
      "BLOCK_K": 256,
      "BLOCK_C": 64,
      "NUM_KSPLIT": 2,
      "num_warps": 8,
      "num_stages": 2,
      "waves_per_eu": 0
    },
    "1207": {
      "BLOCK_M": 32,
      "BLOCK_N": 16,
      "BLOCK_K": 256,
      "BLOCK_C": 32,
      "NUM_KSPLIT": 8,
      "num_warps": 2,
      "num_stages": 1,
      "waves_per_eu": 1
    },
    "486": {
      "BLOCK_M": 32,
      "BLOCK_N": 16,
      "BLOCK_K": 64,
      "BLOCK_C": 32,
      "NUM_KSPLIT": 8,
      "num_warps": 2,
      "num_stages": 1,
      "waves_per_eu": 0
    },
    "1963": {
      "BLOCK_M": 64,
      "BLOCK_N": 16,
      "BLOCK_K": 64,
      "BLOCK_C": 64,
      "NUM_KSPLIT": 2,
      "num_warps": 2,
      "num_stages": 1,
      "waves_per_eu": 1
    },
    "5576": {
      "BLOCK_M": 256,
      "BLOCK_N": 16,
      "BLOCK_K": 256,
      "BLOCK_C": 64,
      "NUM_KSPLIT": 2,
      "num_warps": 8,
      "num_stages": 1,
      "waves_per_eu": 2
    },
    "4286": {
      "BLOCK_M": 128,
      "BLOCK_N": 16,
      "BLOCK_K": 256,
      "BLOCK_C": 256,
      "NUM_KSPLIT": 4,
      "num_warps": 2,
      "num_stages": 1,
      "waves_per_eu": 2
    },
    "4078": {
      "BLOCK_M": 128,
      "BLOCK_N": 16,
      "BLOCK_K": 256,
      "BLOCK_C": 32,
      "NUM_KSPLIT": 4,
      "num_warps": 4,
      "num_stages": 2,
      "waves_per_eu": 1
    },
    "3197": {
      "BLOCK_M": 128,
      "BLOCK_N": 16,
      "BLOCK_K": 32,
      "BLOCK_C": 256,
      "NUM_KSPLIT": 2,
      "num_warps": 4,
      "num_stages": 2,
      "waves_per_eu": 2
    },
    "71": {
      "BLOCK_M": 32,
      "BLOCK_N": 16,
      "BLOCK_K": 32,
      "BLOCK_C": 16,
      "NUM_KSPLIT": 8,
      "num_warps": 8,
      "num_stages": 2,
      "waves_per_eu": 2
    },
    "1103": {
      "BLOCK_M": 32,
      "BLOCK_N": 16,
      "BLOCK_K": 256,
      "BLOCK_C": 16,
      "NUM_KSPLIT": 2,
      "num_warps": 2,
      "num_stages": 2,
      "waves_per_eu": 2
    },
    "5714": {
      "BLOCK_M": 256,
      "BLOCK_N": 16,
      "BLOCK_K": 256,
      "BLOCK_C": 256,
      "NUM_KSPLIT": 2,
      "num_warps": 4,
      "num_stages": 1,
      "waves_per_eu": 2
    },
    "1122": {
      "BLOCK_M": 32,
      "BLOCK_N": 16,
      "BLOCK_K": 256,
      "BLOCK_C": 16,
      "NUM_KSPLIT": 4,
      "num_warps": 4,
      "num_stages": 1,
      "waves_per_eu": 0
    },
    "1562": {
      "BLOCK_M": 64,
      "BLOCK_N": 16,
      "BLOCK_K": 32,
      "BLOCK_C": 32,
      "NUM_KSPLIT": 4,
      "num_warps": 8,
      "num_stages": 1,
      "waves_per_eu": 2
    },
    "535": {
      "BLOCK_M": 32,
      "BLOCK_N": 16,
      "BLOCK_K": 64,
      "BLOCK_C": 64,
      "NUM_KSPLIT": 2,
      "num_warps": 8,
      "num_stages": 1,
      "waves_per_eu": 1
    },
    "277": {
      "BLOCK_M": 32,
      "BLOCK_N": 16,
      "BLOCK_K": 32,
      "BLOCK_C": 128,
      "NUM_KSPLIT": 8,
      "num_warps": 4,
      "num_stages": 1,
      "waves_per_eu": 1
    },
    "3541": {
      "BLOCK_M": 128,
      "BLOCK_N": 16,
      "BLOCK_K": 64,
      "BLOCK_C": 256,
      "NUM_KSPLIT": 1,
      "num_warps": 8,
      "num_stages": 1,
      "waves_per_eu": 1
    },
    "2535": {
      "BLOCK_M": 64,
      "BLOCK_N": 16,
      "BLOCK_K": 256,
      "BLOCK_C": 16,
      "NUM_KSPLIT": 1,
      "num_warps": 8,
      "num_stages": 2,
      "waves_per_eu": 0
    },
    "1986": {
      "BLOCK_M": 64,
      "BLOCK_N": 16,
      "BLOCK_K": 64,
      "BLOCK_C": 64,
      "NUM_KSPLIT": 4,
      "num_warps": 4,
      "num_stages": 1,
      "waves_per_eu": 0
    },
    "3743": {
      "BLOCK_M": 128,
      "BLOCK_N": 16,
      "BLOCK_K": 128,
      "BLOCK_C": 32,
      "NUM_KSPLIT": 8,
      "num_warps": 8,
      "num_stages": 2,
      "waves_per_eu": 2
    },
    "4195": {
      "BLOCK_M": 128,
      "BLOCK_N": 16,
      "BLOCK_K": 256,
      "BLOCK_C": 128,
      "NUM_KSPLIT": 2,
      "num_warps": 2,
      "num_stages": 1,
      "waves_per_eu": 1
    },
    "4997": {
      "BLOCK_M": 256,
      "BLOCK_N": 16,
      "BLOCK_K": 64,
      "BLOCK_C": 256,
      "NUM_KSPLIT": 2,
      "num_warps": 4,
      "num_stages": 2,
      "waves_per_eu": 2
    },
    "4442": {
      "BLOCK_M": 256,
      "BLOCK_N": 16,
      "BLOCK_K": 32,
      "BLOCK_C": 32,
      "NUM_KSPLIT": 4,
      "num_warps": 8,
      "num_stages": 1,
      "waves_per_eu": 2
    },
    "5597": {
      "BLOCK_M": 256,
      "BLOCK_N": 16,
      "BLOCK_K": 256,
      "BLOCK_C": 64,
      "NUM_KSPLIT": 4,
      "num_warps": 8,
      "num_stages": 2,
      "waves_per_eu": 2
    },
    "4797": {
      "BLOCK_M": 256,
      "BLOCK_N": 16,
      "BLOCK_K": 64,
      "BLOCK_C": 32,
      "NUM_KSPLIT": 4,
      "num_warps": 4,
      "num_stages": 2,
      "waves_per_eu": 0
    },
    "577": {
      "BLOCK_M": 32,
      "BLOCK_N": 16,
      "BLOCK_K": 64,
      "BLOCK_C": 128,
      "NUM_KSPLIT": 1,
      "num_warps": 2,
      "num_stages": 1,
      "waves_per_eu": 1
    },
    "5397": {
      "BLOCK_M": 256,
      "BLOCK_N": 16,
      "BLOCK_K": 128,
      "BLOCK_C": 256,
      "NUM_KSPLIT": 8,
      "num_warps": 8,
      "num_stages": 2,
      "waves_per_eu": 0
    },
    "3582": {
      "BLOCK_M": 128,
      "BLOCK_N": 16,
      "BLOCK_K": 64,
      "BLOCK_C": 256,
      "NUM_KSPLIT": 8,
      "num_warps": 2,
      "num_stages": 1,
      "waves_per_eu": 0
    },
    "3891": {
      "BLOCK_M": 128,
      "BLOCK_N": 16,
      "BLOCK_K": 128,
      "BLOCK_C": 256,
      "NUM_KSPLIT": 1,
      "num_warps": 2,
      "num_stages": 2,
      "waves_per_eu": 0
    },
    "392": {
      "BLOCK_M": 32,
      "BLOCK_N": 16,
      "BLOCK_K": 64,
      "BLOCK_C": 16,
      "NUM_KSPLIT": 2,
      "num_warps": 8,
      "num_stages": 1,
      "waves_per_eu": 2
    },
    "2499": {
      "BLOCK_M": 64,
      "BLOCK_N": 16,
      "BLOCK_K": 128,
      "BLOCK_C": 256,
      "NUM_KSPLIT": 4,
      "num_warps": 8,
      "num_stages": 2,
      "waves_per_eu": 0
    },
    "3818": {
      "BLOCK_M": 128,
      "BLOCK_N": 16,
      "BLOCK_K": 128,
      "BLOCK_C": 128,
      "NUM_KSPLIT": 1,
      "num_warps": 2,
      "num_stages": 1,
      "waves_per_eu": 2
    },
    "1789": {
      "BLOCK_M": 64,
      "BLOCK_N": 16,
      "BLOCK_K": 32,
      "BLOCK_C": 256,
      "NUM_KSPLIT": 8,
      "num_warps": 4,
      "num_stages": 1,
      "waves_per_eu": 1
    },
    "125": {
      "BLOCK_M": 32,
      "BLOCK_N": 16,
      "BLOCK_K": 32,
      "BLOCK_C": 32,
      "NUM_KSPLIT": 4,
      "num_warps": 8,
      "num_stages": 2,
      "waves_per_eu": 2
    },
    "1465": {
      "BLOCK_M": 64,
      "BLOCK_N": 16,
      "BLOCK_K": 32,
      "BLOCK_C": 16,
      "NUM_KSPLIT": 2,
      "num_warps": 4,
      "num_stages": 1,
      "waves_per_eu": 1
    },
    "3108": {
      "BLOCK_M": 128,
      "BLOCK_N": 16,
      "BLOCK_K": 32,
      "BLOCK_C": 128,
      "NUM_KSPLIT": 1,
      "num_warps": 8,
      "num_stages": 1,
      "waves_per_eu": 0
    },
    "2637": {
      "BLOCK_M": 64,
      "BLOCK_N": 16,
      "BLOCK_K": 256,
      "BLOCK_C": 32,
      "NUM_KSPLIT": 4,
      "num_warps": 4,
      "num_stages": 2,
      "waves_per_eu": 0
    },
    "4315": {
      "BLOCK_M": 128,
      "BLOCK_N": 16,
      "BLOCK_K": 256,
      "BLOCK_C": 256,
      "NUM_KSPLIT": 8,
      "num_warps": 8,
      "num_stages": 1,
      "waves_per_eu": 1
    },
    "2749": {
      "BLOCK_M": 64,
      "BLOCK_N": 16,
      "BLOCK_K": 256,
      "BLOCK_C": 128,
      "NUM_KSPLIT": 1,
      "num_warps": 8,
      "num_stages": 1,
      "waves_per_eu": 1
    },
    "4757": {
      "BLOCK_M": 256,
      "BLOCK_N": 16,
      "BLOCK_K": 64,
      "BLOCK_C": 32,
      "NUM_KSPLIT": 1,
      "num_warps": 2,
      "num_stages": 2,
      "waves_per_eu": 2
    },
    "623": {
      "BLOCK_M": 32,
      "BLOCK_N": 16,
      "BLOCK_K": 64,
      "BLOCK_C": 128,
      "NUM_KSPLIT": 4,
      "num_warps": 4,
      "num_stages": 2,
      "waves_per_eu": 2
    },
    "4886": {
      "BLOCK_M": 256,
      "BLOCK_N": 16,
      "BLOCK_K": 64,
      "BLOCK_C": 64,
      "NUM_KSPLIT": 8,
      "num_warps": 4,
      "num_stages": 1,
      "waves_per_eu": 2
    },
    "568": {
      "BLOCK_M": 32,
      "BLOCK_N": 16,
      "BLOCK_K": 64,
      "BLOCK_C": 64,
      "NUM_KSPLIT": 8,
      "num_warps": 4,
      "num_stages": 2,
      "waves_per_eu": 1
    },
    "350": {
      "BLOCK_M": 32,
      "BLOCK_N": 16,
      "BLOCK_K": 32,
      "BLOCK_C": 256,
      "NUM_KSPLIT": 8,
      "num_warps": 4,
      "num_stages": 1,
      "waves_per_eu": 2
    },
    "2960": {
      "BLOCK_M": 128,
      "BLOCK_N": 16,
      "BLOCK_K": 32,
      "BLOCK_C": 32,
      "NUM_KSPLIT": 1,
      "num_warps": 4,
      "num_stages": 1,
      "waves_per_eu": 2
    },
    "4446": {
      "BLOCK_M": 256,
      "BLOCK_N": 16,
      "BLOCK_K": 32,
      "BLOCK_C": 32,
      "NUM_KSPLIT": 8,
      "num_warps": 2,
      "num_stages": 1,
      "waves_per_eu": 0
    },
    "2520": {
      "BLOCK_M": 64,
      "BLOCK_N": 16,
      "BLOCK_K": 256,
      "BLOCK_C": 16,
      "NUM_KSPLIT": 1,
      "num_warps": 2,
      "num_stages": 1,
      "waves_per_eu": 0
    },
    "3958": {
      "BLOCK_M": 128,
      "BLOCK_N": 16,
      "BLOCK_K": 128,
      "BLOCK_C": 256,
      "NUM_KSPLIT": 8,
      "num_warps": 8,
      "num_stages": 2,
      "waves_per_eu": 1
    },
    "1393": {
      "BLOCK_M": 32,
      "BLOCK_N": 16,
      "BLOCK_K": 256,
      "BLOCK_C": 256,
      "NUM_KSPLIT": 2,
      "num_warps": 4,
      "num_stages": 1,
      "waves_per_eu": 1
    },
    "3576": {
      "BLOCK_M": 128,
      "BLOCK_N": 16,
      "BLOCK_K": 64,
      "BLOCK_C": 256,
      "NUM_KSPLIT": 4,
      "num_warps": 8,
      "num_stages": 1,
      "waves_per_eu": 0
    },
    "764": {
      "BLOCK_M": 32,
      "BLOCK_N": 16,
      "BLOCK_K": 128,
      "BLOCK_C": 16,
      "NUM_KSPLIT": 4,
      "num_warps": 4,
      "num_stages": 1,
      "waves_per_eu": 2
    },
    "4694": {
      "BLOCK_M": 256,
      "BLOCK_N": 16,
      "BLOCK_K": 64,
      "BLOCK_C": 16,
      "NUM_KSPLIT": 1,
      "num_warps": 8,
      "num_stages": 1,
      "waves_per_eu": 2
    },
    "4470": {
      "BLOCK_M": 256,
      "BLOCK_N": 16,
      "BLOCK_K": 32,
      "BLOCK_C": 64,
      "NUM_KSPLIT": 1,
      "num_warps": 4,
      "num_stages": 1,
      "waves_per_eu": 0
    },
    "2100": {
      "BLOCK_M": 64,
      "BLOCK_N": 16,
      "BLOCK_K": 64,
      "BLOCK_C": 256,
      "NUM_KSPLIT": 1,
      "num_warps": 8,
      "num_stages": 1,
      "waves_per_eu": 0
    },
    "3155": {
      "BLOCK_M": 128,
      "BLOCK_N": 16,
      "BLOCK_K": 32,
      "BLOCK_C": 128,
      "NUM_KSPLIT": 8,
      "num_warps": 2,
      "num_stages": 2,
      "waves_per_eu": 2
    },
    "371": {
      "BLOCK_M": 32,
      "BLOCK_N": 16,
      "BLOCK_K": 64,
      "BLOCK_C": 16,
      "NUM_KSPLIT": 1,
      "num_warps": 4,
      "num_stages": 2,
      "waves_per_eu": 2
    },
    "4914": {
      "BLOCK_M": 256,
      "BLOCK_N": 16,
      "BLOCK_K": 64,
      "BLOCK_C": 128,
      "NUM_KSPLIT": 2,
      "num_warps": 2,
      "num_stages": 1,
      "waves_per_eu": 0
    },
    "5619": {
      "BLOCK_M": 256,
      "BLOCK_N": 16,
      "BLOCK_K": 256,
      "BLOCK_C": 128,
      "NUM_KSPLIT": 1,
      "num_warps": 2,
      "num_stages": 2,
      "waves_per_eu": 0
    },
    "5253": {
      "BLOCK_M": 256,
      "BLOCK_N": 16,
      "BLOCK_K": 128,
      "BLOCK_C": 64,
      "NUM_KSPLIT": 8,
      "num_warps": 8,
      "num_stages": 2,
      "waves_per_eu": 0
    },
    "3225": {
      "BLOCK_M": 128,
      "BLOCK_N": 16,
      "BLOCK_K": 32,
      "BLOCK_C": 256,
      "NUM_KSPLIT": 8,
      "num_warps": 2,
      "num_stages": 2,
      "waves_per_eu": 0
    },
    "2926": {
      "BLOCK_M": 128,
      "BLOCK_N": 16,
      "BLOCK_K": 32,
      "BLOCK_C": 16,
      "NUM_KSPLIT": 4,
      "num_warps": 4,
      "num_stages": 2,
      "waves_per_eu": 1
    },
    "301": {
      "BLOCK_M": 32,
      "BLOCK_N": 16,
      "BLOCK_K": 32,
      "BLOCK_C": 256,
      "NUM_KSPLIT": 1,
      "num_warps": 8,
      "num_stages": 1,
      "waves_per_eu": 1
    },
    "2742": {
      "BLOCK_M": 64,
      "BLOCK_N": 16,
      "BLOCK_K": 256,
      "BLOCK_C": 128,
      "NUM_KSPLIT": 1,
      "num_warps": 4,
      "num_stages": 1,
      "waves_per_eu": 0
    },
    "2126": {
      "BLOCK_M": 64,
      "BLOCK_N": 16,
      "BLOCK_K": 64,
      "BLOCK_C": 256,
      "NUM_KSPLIT": 4,
      "num_warps": 2,
      "num_stages": 1,
      "waves_per_eu": 2
    },
    "2964": {
      "BLOCK_M": 128,
      "BLOCK_N": 16,
      "BLOCK_K": 32,
      "BLOCK_C": 32,
      "NUM_KSPLIT": 1,
      "num_warps": 8,
      "num_stages": 1,
      "waves_per_eu": 0
    },
    "4772": {
      "BLOCK_M": 256,
      "BLOCK_N": 16,
      "BLOCK_K": 64,
      "BLOCK_C": 32,
      "NUM_KSPLIT": 2,
      "num_warps": 2,
      "num_stages": 1,
      "waves_per_eu": 2
    },
    "3648": {
      "BLOCK_M": 128,
      "BLOCK_N": 16,
      "BLOCK_K": 128,
      "BLOCK_C": 16,
      "NUM_KSPLIT": 4,
      "num_warps": 8,
      "num_stages": 1,
      "waves_per_eu": 0
    },
    "5684": {
      "BLOCK_M": 256,
      "BLOCK_N": 16,
      "BLOCK_K": 256,
      "BLOCK_C": 128,
      "NUM_KSPLIT": 8,
      "num_warps": 8,
      "num_stages": 1,
      "waves_per_eu": 2
    },
    "4860": {
      "BLOCK_M": 256,
      "BLOCK_N": 16,
      "BLOCK_K": 64,
      "BLOCK_C": 64,
      "NUM_KSPLIT": 4,
      "num_warps": 2,
      "num_stages": 1,
      "waves_per_eu": 0
    },
    "170": {
      "BLOCK_M": 32,
      "BLOCK_N": 16,
      "BLOCK_K": 32,
      "BLOCK_C": 64,
      "NUM_KSPLIT": 2,
      "num_warps": 4,
      "num_stages": 1,
      "waves_per_eu": 2
    },
    "417": {
      "BLOCK_M": 32,
      "BLOCK_N": 16,
      "BLOCK_K": 64,
      "BLOCK_C": 16,
      "NUM_KSPLIT": 8,
      "num_warps": 2,
      "num_stages": 2,
      "waves_per_eu": 0
    },
    "2241": {
      "BLOCK_M": 64,
      "BLOCK_N": 16,
      "BLOCK_K": 128,
      "BLOCK_C": 32,
      "NUM_KSPLIT": 1,
      "num_warps": 4,
      "num_stages": 2,
      "waves_per_eu": 0
    },
    "4266": {
      "BLOCK_M": 128,
      "BLOCK_N": 16,
      "BLOCK_K": 256,
      "BLOCK_C": 256,
      "NUM_KSPLIT": 2,
      "num_warps": 2,
      "num_stages": 1,
      "waves_per_eu": 0
    },
    "5687": {
      "BLOCK_M": 256,
      "BLOCK_N": 16,
      "BLOCK_K": 256,
      "BLOCK_C": 128,
      "NUM_KSPLIT": 8,
      "num_warps": 8,
      "num_stages": 2,
      "waves_per_eu": 2
    },
    "795": {
      "BLOCK_M": 32,
      "BLOCK_N": 16,
      "BLOCK_K": 128,
      "BLOCK_C": 32,
      "NUM_KSPLIT": 1,
      "num_warps": 2,
      "num_stages": 2,
      "waves_per_eu": 0
    },
    "731": {
      "BLOCK_M": 32,
      "BLOCK_N": 16,
      "BLOCK_K": 128,
      "BLOCK_C": 16,
      "NUM_KSPLIT": 1,
      "num_warps": 4,
      "num_stages": 2,
      "waves_per_eu": 2
    },
    "3691": {
      "BLOCK_M": 128,
      "BLOCK_N": 16,
      "BLOCK_K": 128,
      "BLOCK_C": 32,
      "NUM_KSPLIT": 2,
      "num_warps": 2,
      "num_stages": 1,
      "waves_per_eu": 1
    },
    "5355": {
      "BLOCK_M": 256,
      "BLOCK_N": 16,
      "BLOCK_K": 128,
      "BLOCK_C": 256,
      "NUM_KSPLIT": 2,
      "num_warps": 4,
      "num_stages": 2,
      "waves_per_eu": 0
    },
    "354": {
      "BLOCK_M": 32,
      "BLOCK_N": 16,
      "BLOCK_K": 32,
      "BLOCK_C": 256,
      "NUM_KSPLIT": 8,
      "num_warps": 8,
      "num_stages": 1,
      "waves_per_eu": 0
    },
    "4993": {
      "BLOCK_M": 256,
      "BLOCK_N": 16,
      "BLOCK_K": 64,
      "BLOCK_C": 256,
      "NUM_KSPLIT": 2,
      "num_warps": 4,
      "num_stages": 1,
      "waves_per_eu": 1
    },
    "4041": {
      "BLOCK_M": 128,
      "BLOCK_N": 16,
      "BLOCK_K": 256,
      "BLOCK_C": 32,
      "NUM_KSPLIT": 1,
      "num_warps": 4,
      "num_stages": 2,
      "waves_per_eu": 0
    },
    "2116": {
      "BLOCK_M": 64,
      "BLOCK_N": 16,
      "BLOCK_K": 64,
      "BLOCK_C": 256,
      "NUM_KSPLIT": 2,
      "num_warps": 4,
      "num_stages": 2,
      "waves_per_eu": 1
    },
    "3792": {
      "BLOCK_M": 128,
      "BLOCK_N": 16,
      "BLOCK_K": 128,
      "BLOCK_C": 64,
      "NUM_KSPLIT": 4,
      "num_warps": 8,
      "num_stages": 1,
      "waves_per_eu": 0
    },
    "2787": {
      "BLOCK_M": 64,
      "BLOCK_N": 16,
      "BLOCK_K": 256,
      "BLOCK_C": 128,
      "NUM_KSPLIT": 4,
      "num_warps": 8,
      "num_stages": 2,
      "waves_per_eu": 0
    },
    "2673": {
      "BLOCK_M": 64,
      "BLOCK_N": 16,
      "BLOCK_K": 256,
      "BLOCK_C": 64,
      "NUM_KSPLIT": 1,
      "num_warps": 4,
      "num_stages": 2,
      "waves_per_eu": 0
    },
    "2896": {
      "BLOCK_M": 128,
      "BLOCK_N": 16,
      "BLOCK_K": 32,
      "BLOCK_C": 16,
      "NUM_KSPLIT": 1,
      "num_warps": 8,
      "num_stages": 2,
      "waves_per_eu": 1
    },
    "178": {
      "BLOCK_M": 32,
      "BLOCK_N": 16,
      "BLOCK_K": 32,
      "BLOCK_C": 64,
      "NUM_KSPLIT": 2,
      "num_warps": 8,
      "num_stages": 2,
      "waves_per_eu": 1
    },
    "2551": {
      "BLOCK_M": 64,
      "BLOCK_N": 16,
      "BLOCK_K": 256,
      "BLOCK_C": 16,
      "NUM_KSPLIT": 2,
      "num_warps": 8,
      "num_stages": 1,
      "waves_per_eu": 1
    },
    "922": {
      "BLOCK_M": 32,
      "BLOCK_N": 16,
      "BLOCK_K": 128,
      "BLOCK_C": 64,
      "NUM_KSPLIT": 8,
      "num_warps": 2,
      "num_stages": 2,
      "waves_per_eu": 1
    },
    "4895": {
      "BLOCK_M": 256,
      "BLOCK_N": 16,
      "BLOCK_K": 64,
      "BLOCK_C": 64,
      "NUM_KSPLIT": 8,
      "num_warps": 8,
      "num_stages": 2,
      "waves_per_eu": 2
    },
    "188": {
      "BLOCK_M": 32,
      "BLOCK_N": 16,
      "BLOCK_K": 32,
      "BLOCK_C": 64,
      "NUM_KSPLIT": 4,
      "num_warps": 4,
      "num_stages": 1,
      "waves_per_eu": 2
    },
    "5033": {
      "BLOCK_M": 256,
      "BLOCK_N": 16,
      "BLOCK_K": 64,
      "BLOCK_C": 256,
      "NUM_KSPLIT": 8,
      "num_warps": 4,
      "num_stages": 2,
      "waves_per_eu": 2
    },
    "1662": {
      "BLOCK_M": 64,
      "BLOCK_N": 16,
      "BLOCK_K": 32,
      "BLOCK_C": 128,
      "NUM_KSPLIT": 1,
      "num_warps": 4,
      "num_stages": 1,
      "waves_per_eu": 0
    },
    "2414": {
      "BLOCK_M": 64,
      "BLOCK_N": 16,
      "BLOCK_K": 128,
      "BLOCK_C": 128,
      "NUM_KSPLIT": 4,
      "num_warps": 2,
      "num_stages": 1,
      "waves_per_eu": 2
    },
    "2206": {
      "BLOCK_M": 64,
      "BLOCK_N": 16,
      "BLOCK_K": 128,
      "BLOCK_C": 16,
      "NUM_KSPLIT": 4,
      "num_warps": 4,
      "num_stages": 2,
      "waves_per_eu": 1
    },
    "1823": {
      "BLOCK_M": 64,
      "BLOCK_N": 16,
      "BLOCK_K": 64,
      "BLOCK_C": 16,
      "NUM_KSPLIT": 2,
      "num_warps": 2,
      "num_stages": 2,
      "waves_per_eu": 2
    },
    "5158": {
      "BLOCK_M": 256,
      "BLOCK_N": 16,
      "BLOCK_K": 128,
      "BLOCK_C": 32,
      "NUM_KSPLIT": 4,
      "num_warps": 4,
      "num_stages": 2,
      "waves_per_eu": 1
    },
    "3598": {
      "BLOCK_M": 128,
      "BLOCK_N": 16,
      "BLOCK_K": 64,
      "BLOCK_C": 256,
      "NUM_KSPLIT": 8,
      "num_warps": 8,
      "num_stages": 2,
      "waves_per_eu": 1
    },
    "5216": {
      "BLOCK_M": 256,
      "BLOCK_N": 16,
      "BLOCK_K": 128,
      "BLOCK_C": 64,
      "NUM_KSPLIT": 2,
      "num_warps": 8,
      "num_stages": 1,
      "waves_per_eu": 2
    },
    "4542": {
      "BLOCK_M": 256,
      "BLOCK_N": 16,
      "BLOCK_K": 32,
      "BLOCK_C": 128,
      "NUM_KSPLIT": 1,
      "num_warps": 4,
      "num_stages": 1,
      "waves_per_eu": 0
    },
    "5136": {
      "BLOCK_M": 256,
      "BLOCK_N": 16,
      "BLOCK_K": 128,
      "BLOCK_C": 32,
      "NUM_KSPLIT": 2,
      "num_warps": 4,
      "num_stages": 1,
      "waves_per_eu": 0
    },
    "2565": {
      "BLOCK_M": 64,
      "BLOCK_N": 16,
      "BLOCK_K": 256,
      "BLOCK_C": 16,
      "NUM_KSPLIT": 4,
      "num_warps": 4,
      "num_stages": 2,
      "waves_per_eu": 0
    },
    "75": {
      "BLOCK_M": 32,
      "BLOCK_N": 16,
      "BLOCK_K": 32,
      "BLOCK_C": 32,
      "NUM_KSPLIT": 1,
      "num_warps": 2,
      "num_stages": 2,
      "waves_per_eu": 0
    },
    "78": {
      "BLOCK_M": 32,
      "BLOCK_N": 16,
      "BLOCK_K": 32,
      "BLOCK_C": 32,
      "NUM_KSPLIT": 1,
      "num_warps": 4,
      "num_stages": 1,
      "waves_per_eu": 0
    },
    "5318": {
      "BLOCK_M": 256,
      "BLOCK_N": 16,
      "BLOCK_K": 128,
      "BLOCK_C": 128,
      "NUM_KSPLIT": 8,
      "num_warps": 4,
      "num_stages": 1,
      "waves_per_eu": 2
    },
    "5127": {
      "BLOCK_M": 256,
      "BLOCK_N": 16,
      "BLOCK_K": 128,
      "BLOCK_C": 32,
      "NUM_KSPLIT": 1,
      "num_warps": 8,
      "num_stages": 2,
      "waves_per_eu": 0
    },
    "2325": {
      "BLOCK_M": 64,
      "BLOCK_N": 16,
      "BLOCK_K": 128,
      "BLOCK_C": 64,
      "NUM_KSPLIT": 2,
      "num_warps": 2,
      "num_stages": 2,
      "waves_per_eu": 0
    },
    "4011": {
      "BLOCK_M": 128,
      "BLOCK_N": 16,
      "BLOCK_K": 256,
      "BLOCK_C": 16,
      "NUM_KSPLIT": 4,
      "num_warps": 8,
      "num_stages": 2,
      "waves_per_eu": 0
    },
    "2650": {
      "BLOCK_M": 64,
      "BLOCK_N": 16,
      "BLOCK_K": 256,
      "BLOCK_C": 32,
      "NUM_KSPLIT": 8,
      "num_warps": 2,
      "num_stages": 2,
      "waves_per_eu": 1
    },
    "3102": {
      "BLOCK_M": 128,
      "BLOCK_N": 16,
      "BLOCK_K": 32,
      "BLOCK_C": 128,
      "NUM_KSPLIT": 1,
      "num_warps": 4,
      "num_stages": 1,
      "waves_per_eu": 0
    },
    "1599": {
      "BLOCK_M": 64,
      "BLOCK_N": 16,
      "BLOCK_K": 32,
      "BLOCK_C": 64,
      "NUM_KSPLIT": 1,
      "num_warps": 8,
      "num_stages": 2,
      "waves_per_eu": 0
    },
    "1721": {
      "BLOCK_M": 64,
      "BLOCK_N": 16,
      "BLOCK_K": 32,
      "BLOCK_C": 128,
      "NUM_KSPLIT": 8,
      "num_warps": 4,
      "num_stages": 2,
      "waves_per_eu": 2
    },
    "4776": {
      "BLOCK_M": 256,
      "BLOCK_N": 16,
      "BLOCK_K": 64,
      "BLOCK_C": 32,
      "NUM_KSPLIT": 2,
      "num_warps": 4,
      "num_stages": 1,
      "waves_per_eu": 0
    },
    "4430": {
      "BLOCK_M": 256,
      "BLOCK_N": 16,
      "BLOCK_K": 32,
      "BLOCK_C": 32,
      "NUM_KSPLIT": 4,
      "num_warps": 2,
      "num_stages": 1,
      "waves_per_eu": 2
    },
    "3243": {
      "BLOCK_M": 128,
      "BLOCK_N": 16,
      "BLOCK_K": 64,
      "BLOCK_C": 16,
      "NUM_KSPLIT": 1,
      "num_warps": 2,
      "num_stages": 2,
      "waves_per_eu": 0
    },
    "5758": {
      "BLOCK_M": 256,
      "BLOCK_N": 16,
      "BLOCK_K": 256,
      "BLOCK_C": 256,
      "NUM_KSPLIT": 8,
      "num_warps": 8,
      "num_stages": 2,
      "waves_per_eu": 1
    },
    "1725": {
      "BLOCK_M": 64,
      "BLOCK_N": 16,
      "BLOCK_K": 32,
      "BLOCK_C": 128,
      "NUM_KSPLIT": 8,
      "num_warps": 8,
      "num_stages": 2,
      "waves_per_eu": 0
    },
    "3538": {
      "BLOCK_M": 128,
      "BLOCK_N": 16,
      "BLOCK_K": 64,
      "BLOCK_C": 256,
      "NUM_KSPLIT": 1,
      "num_warps": 4,
      "num_stages": 2,
      "waves_per_eu": 1
    },
    "2165": {
      "BLOCK_M": 64,
      "BLOCK_N": 16,
      "BLOCK_K": 128,
      "BLOCK_C": 16,
      "NUM_KSPLIT": 1,
      "num_warps": 2,
      "num_stages": 2,
      "waves_per_eu": 2
    },
    "3348": {
      "BLOCK_M": 128,
      "BLOCK_N": 16,
      "BLOCK_K": 64,
      "BLOCK_C": 32,
      "NUM_KSPLIT": 4,
      "num_warps": 2,
      "num_stages": 1,
      "waves_per_eu": 0
    },
    "4302": {
      "BLOCK_M": 128,
      "BLOCK_N": 16,
      "BLOCK_K": 256,
      "BLOCK_C": 256,
      "NUM_KSPLIT": 8,
      "num_warps": 2,
      "num_stages": 1,
      "waves_per_eu": 0
    },
    "3806": {
      "BLOCK_M": 128,
      "BLOCK_N": 16,
      "BLOCK_K": 128,
      "BLOCK_C": 64,
      "NUM_KSPLIT": 8,
      "num_warps": 4,
      "num_stages": 1,
      "waves_per_eu": 2
    },
    "1809": {
      "BLOCK_M": 64,
      "BLOCK_N": 16,
      "BLOCK_K": 64,
      "BLOCK_C": 16,
      "NUM_KSPLIT": 1,
      "num_warps": 4,
      "num_stages": 2,
      "waves_per_eu": 0
    },
    "1432": {
      "BLOCK_M": 32,
      "BLOCK_N": 16,
      "BLOCK_K": 256,
      "BLOCK_C": 256,
      "NUM_KSPLIT": 8,
      "num_warps": 4,
      "num_stages": 2,
      "waves_per_eu": 1
    },
    "4300": {
      "BLOCK_M": 128,
      "BLOCK_N": 16,
      "BLOCK_K": 256,
      "BLOCK_C": 256,
      "NUM_KSPLIT": 4,
      "num_warps": 8,
      "num_stages": 2,
      "waves_per_eu": 1
    },
    "3247": {
      "BLOCK_M": 128,
      "BLOCK_N": 16,
      "BLOCK_K": 64,
      "BLOCK_C": 16,
      "NUM_KSPLIT": 1,
      "num_warps": 4,
      "num_stages": 1,
      "waves_per_eu": 1
    },
    "2523": {
      "BLOCK_M": 64,
      "BLOCK_N": 16,
      "BLOCK_K": 256,
      "BLOCK_C": 16,
      "NUM_KSPLIT": 1,
      "num_warps": 2,
      "num_stages": 2,
      "waves_per_eu": 0
    },
    "5189": {
      "BLOCK_M": 256,
      "BLOCK_N": 16,
      "BLOCK_K": 128,
      "BLOCK_C": 64,
      "NUM_KSPLIT": 1,
      "num_warps": 2,
      "num_stages": 2,
      "waves_per_eu": 2
    },
    "1477": {
      "BLOCK_M": 64,
      "BLOCK_N": 16,
      "BLOCK_K": 32,
      "BLOCK_C": 16,
      "NUM_KSPLIT": 4,
      "num_warps": 2,
      "num_stages": 1,
      "waves_per_eu": 1
    },
    "1118": {
      "BLOCK_M": 32,
      "BLOCK_N": 16,
      "BLOCK_K": 256,
      "BLOCK_C": 16,
      "NUM_KSPLIT": 4,
      "num_warps": 2,
      "num_stages": 1,
      "waves_per_eu": 2
    },
    "2663": {
      "BLOCK_M": 64,
      "BLOCK_N": 16,
      "BLOCK_K": 256,
      "BLOCK_C": 32,
      "NUM_KSPLIT": 8,
      "num_warps": 8,
      "num_stages": 2,
      "waves_per_eu": 2
    },
    "2594": {
      "BLOCK_M": 64,
      "BLOCK_N": 16,
      "BLOCK_K": 256,
      "BLOCK_C": 32,
      "NUM_KSPLIT": 1,
      "num_warps": 2,
      "num_stages": 1,
      "waves_per_eu": 2
    },
    "3951": {
      "BLOCK_M": 128,
      "BLOCK_N": 16,
      "BLOCK_K": 128,
      "BLOCK_C": 256,
      "NUM_KSPLIT": 8,
      "num_warps": 4,
      "num_stages": 2,
      "waves_per_eu": 0
    },
    "571": {
      "BLOCK_M": 32,
      "BLOCK_N": 16,
      "BLOCK_K": 64,
      "BLOCK_C": 64,
      "NUM_KSPLIT": 8,
      "num_warps": 8,
      "num_stages": 1,
      "waves_per_eu": 1
    },
    "461": {
      "BLOCK_M": 32,
      "BLOCK_N": 16,
      "BLOCK_K": 64,
      "BLOCK_C": 32,
      "NUM_KSPLIT": 2,
      "num_warps": 4,
      "num_stages": 2,
      "waves_per_eu": 2
    },
    "70": {
      "BLOCK_M": 32,
      "BLOCK_N": 16,
      "BLOCK_K": 32,
      "BLOCK_C": 16,
      "NUM_KSPLIT": 8,
      "num_warps": 8,
      "num_stages": 2,
      "waves_per_eu": 1
    },
    "191": {
      "BLOCK_M": 32,
      "BLOCK_N": 16,
      "BLOCK_K": 32,
      "BLOCK_C": 64,
      "NUM_KSPLIT": 4,
      "num_warps": 4,
      "num_stages": 2,
      "waves_per_eu": 2
    },
    "2416": {
      "BLOCK_M": 64,
      "BLOCK_N": 16,
      "BLOCK_K": 128,
      "BLOCK_C": 128,
      "NUM_KSPLIT": 4,
      "num_warps": 2,
      "num_stages": 2,
      "waves_per_eu": 1
    },
    "3936": {
      "BLOCK_M": 128,
      "BLOCK_N": 16,
      "BLOCK_K": 128,
      "BLOCK_C": 256,
      "NUM_KSPLIT": 4,
      "num_warps": 8,
      "num_stages": 1,
      "waves_per_eu": 0
    },
    "4551": {
      "BLOCK_M": 256,
      "BLOCK_N": 16,
      "BLOCK_K": 32,
      "BLOCK_C": 128,
      "NUM_KSPLIT": 1,
      "num_warps": 8,
      "num_stages": 2,
      "waves_per_eu": 0
    },
    "5294": {
      "BLOCK_M": 256,
      "BLOCK_N": 16,
      "BLOCK_K": 128,
      "BLOCK_C": 128,
      "NUM_KSPLIT": 4,
      "num_warps": 2,
      "num_stages": 1,
      "waves_per_eu": 2
    },
    "3185": {
      "BLOCK_M": 128,
      "BLOCK_N": 16,
      "BLOCK_K": 32,
      "BLOCK_C": 256,
      "NUM_KSPLIT": 1,
      "num_warps": 8,
      "num_stages": 2,
      "waves_per_eu": 2
    },
    "263": {
      "BLOCK_M": 32,
      "BLOCK_N": 16,
      "BLOCK_K": 32,
      "BLOCK_C": 128,
      "NUM_KSPLIT": 4,
      "num_warps": 4,
      "num_stages": 2,
      "waves_per_eu": 2
    },
    "4878": {
      "BLOCK_M": 256,
      "BLOCK_N": 16,
      "BLOCK_K": 64,
      "BLOCK_C": 64,
      "NUM_KSPLIT": 8,
      "num_warps": 2,
      "num_stages": 1,
      "waves_per_eu": 0
    },
    "653": {
      "BLOCK_M": 32,
      "BLOCK_N": 16,
      "BLOCK_K": 64,
      "BLOCK_C": 256,
      "NUM_KSPLIT": 1,
      "num_warps": 2,
      "num_stages": 2,
      "waves_per_eu": 2
    },
    "3186": {
      "BLOCK_M": 128,
      "BLOCK_N": 16,
      "BLOCK_K": 32,
      "BLOCK_C": 256,
      "NUM_KSPLIT": 2,
      "num_warps": 2,
      "num_stages": 1,
      "waves_per_eu": 0
    },
    "1784": {
      "BLOCK_M": 64,
      "BLOCK_N": 16,
      "BLOCK_K": 32,
      "BLOCK_C": 256,
      "NUM_KSPLIT": 8,
      "num_warps": 2,
      "num_stages": 1,
      "waves_per_eu": 2
    },
    "2517": {
      "BLOCK_M": 64,
      "BLOCK_N": 16,
      "BLOCK_K": 128,
      "BLOCK_C": 256,
      "NUM_KSPLIT": 8,
      "num_warps": 8,
      "num_stages": 2,
      "waves_per_eu": 0
    },
    "3109": {
      "BLOCK_M": 128,
      "BLOCK_N": 16,
      "BLOCK_K": 32,
      "BLOCK_C": 128,
      "NUM_KSPLIT": 1,
      "num_warps": 8,
      "num_stages": 1,
      "waves_per_eu": 1
    },
    "5409": {
      "BLOCK_M": 256,
      "BLOCK_N": 16,
      "BLOCK_K": 256,
      "BLOCK_C": 16,
      "NUM_KSPLIT": 1,
      "num_warps": 4,
      "num_stages": 2,
      "waves_per_eu": 0
    },
    "2154": {
      "BLOCK_M": 64,
      "BLOCK_N": 16,
      "BLOCK_K": 64,
      "BLOCK_C": 256,
      "NUM_KSPLIT": 8,
      "num_warps": 8,
      "num_stages": 1,
      "waves_per_eu": 0
    },
    "3355": {
      "BLOCK_M": 128,
      "BLOCK_N": 16,
      "BLOCK_K": 64,
      "BLOCK_C": 32,
      "NUM_KSPLIT": 4,
      "num_warps": 4,
      "num_stages": 1,
      "waves_per_eu": 1
    },
    "3439": {
      "BLOCK_M": 128,
      "BLOCK_N": 16,
      "BLOCK_K": 64,
      "BLOCK_C": 64,
      "NUM_KSPLIT": 8,
      "num_warps": 2,
      "num_stages": 1,
      "waves_per_eu": 1
    },
    "3124": {
      "BLOCK_M": 128,
      "BLOCK_N": 16,
      "BLOCK_K": 32,
      "BLOCK_C": 128,
      "NUM_KSPLIT": 2,
      "num_warps": 4,
      "num_stages": 2,
      "waves_per_eu": 1
    },
    "10": {
      "BLOCK_M": 32,
      "BLOCK_N": 16,
      "BLOCK_K": 32,
      "BLOCK_C": 16,
      "NUM_KSPLIT": 1,
      "num_warps": 4,
      "num_stages": 2,
      "waves_per_eu": 1
    },
    "1375": {
      "BLOCK_M": 32,
      "BLOCK_N": 16,
      "BLOCK_K": 256,
      "BLOCK_C": 256,
      "NUM_KSPLIT": 1,
      "num_warps": 4,
      "num_stages": 1,
      "waves_per_eu": 1
    },
    "5133": {
      "BLOCK_M": 256,
      "BLOCK_N": 16,
      "BLOCK_K": 128,
      "BLOCK_C": 32,
      "NUM_KSPLIT": 2,
      "num_warps": 2,
      "num_stages": 2,
      "waves_per_eu": 0
    },
    "4974": {
      "BLOCK_M": 256,
      "BLOCK_N": 16,
      "BLOCK_K": 64,
      "BLOCK_C": 256,
      "NUM_KSPLIT": 1,
      "num_warps": 4,
      "num_stages": 1,
      "waves_per_eu": 0
    },
    "3955": {
      "BLOCK_M": 128,
      "BLOCK_N": 16,
      "BLOCK_K": 128,
      "BLOCK_C": 256,
      "NUM_KSPLIT": 8,
      "num_warps": 8,
      "num_stages": 1,
      "waves_per_eu": 1
    },
    "2966": {
      "BLOCK_M": 128,
      "BLOCK_N": 16,
      "BLOCK_K": 32,
      "BLOCK_C": 32,
      "NUM_KSPLIT": 1,
      "num_warps": 8,
      "num_stages": 1,
      "waves_per_eu": 2
    },
    "2020": {
      "BLOCK_M": 64,
      "BLOCK_N": 16,
      "BLOCK_K": 64,
      "BLOCK_C": 128,
      "NUM_KSPLIT": 1,
      "num_warps": 2,
      "num_stages": 2,
      "waves_per_eu": 1
    },
    "4464": {
      "BLOCK_M": 256,
      "BLOCK_N": 16,
      "BLOCK_K": 32,
      "BLOCK_C": 64,
      "NUM_KSPLIT": 1,
      "num_warps": 2,
      "num_stages": 1,
      "waves_per_eu": 0
    },
    "196": {
      "BLOCK_M": 32,
      "BLOCK_N": 16,
      "BLOCK_K": 32,
      "BLOCK_C": 64,
      "NUM_KSPLIT": 4,
      "num_warps": 8,
      "num_stages": 2,
      "waves_per_eu": 1
    },
    "797": {
      "BLOCK_M": 32,
      "BLOCK_N": 16,
      "BLOCK_K": 128,
      "BLOCK_C": 32,
      "NUM_KSPLIT": 1,
      "num_warps": 2,
      "num_stages": 2,
      "waves_per_eu": 2
    },
    "1642": {
      "BLOCK_M": 64,
      "BLOCK_N": 16,
      "BLOCK_K": 32,
      "BLOCK_C": 64,
      "NUM_KSPLIT": 8,
      "num_warps": 2,
      "num_stages": 2,
      "waves_per_eu": 1
    },
    "4988": {
      "BLOCK_M": 256,
      "BLOCK_N": 16,
      "BLOCK_K": 64,
      "BLOCK_C": 256,
      "NUM_KSPLIT": 2,
      "num_warps": 2,
      "num_stages": 1,
      "waves_per_eu": 2
    },
    "767": {
      "BLOCK_M": 32,
      "BLOCK_N": 16,
      "BLOCK_K": 128,
      "BLOCK_C": 16,
      "NUM_KSPLIT": 4,
      "num_warps": 4,
      "num_stages": 2,
      "waves_per_eu": 2
    },
    "5334": {
      "BLOCK_M": 256,
      "BLOCK_N": 16,
      "BLOCK_K": 128,
      "BLOCK_C": 256,
      "NUM_KSPLIT": 1,
      "num_warps": 4,
      "num_stages": 1,
      "waves_per_eu": 0
    },
    "1553": {
      "BLOCK_M": 64,
      "BLOCK_N": 16,
      "BLOCK_K": 32,
      "BLOCK_C": 32,
      "NUM_KSPLIT": 4,
      "num_warps": 2,
      "num_stages": 2,
      "waves_per_eu": 2
    },
    "5515": {
      "BLOCK_M": 256,
      "BLOCK_N": 16,
      "BLOCK_K": 256,
      "BLOCK_C": 32,
      "NUM_KSPLIT": 4,
      "num_warps": 4,
      "num_stages": 1,
      "waves_per_eu": 1
    },
    "5400": {
      "BLOCK_M": 256,
      "BLOCK_N": 16,
      "BLOCK_K": 256,
      "BLOCK_C": 16,
      "NUM_KSPLIT": 1,
      "num_warps": 2,
      "num_stages": 1,
      "waves_per_eu": 0
    },
    "5469": {
      "BLOCK_M": 256,
      "BLOCK_N": 16,
      "BLOCK_K": 256,
      "BLOCK_C": 16,
      "NUM_KSPLIT": 8,
      "num_warps": 8,
      "num_stages": 2,
      "waves_per_eu": 0
    },
    "365": {
      "BLOCK_M": 32,
      "BLOCK_N": 16,
      "BLOCK_K": 64,
      "BLOCK_C": 16,
      "NUM_KSPLIT": 1,
      "num_warps": 2,
      "num_stages": 2,
      "waves_per_eu": 2
    },
    "3835": {
      "BLOCK_M": 128,
      "BLOCK_N": 16,
      "BLOCK_K": 128,
      "BLOCK_C": 128,
      "NUM_KSPLIT": 2,
      "num_warps": 2,
      "num_stages": 1,
      "waves_per_eu": 1
    },
    "3288": {
      "BLOCK_M": 128,
      "BLOCK_N": 16,
      "BLOCK_K": 64,
      "BLOCK_C": 16,
      "NUM_KSPLIT": 4,
      "num_warps": 8,
      "num_stages": 1,
      "waves_per_eu": 0
    },
    "5702": {
      "BLOCK_M": 256,
      "BLOCK_N": 16,
      "BLOCK_K": 256,
      "BLOCK_C": 256,
      "NUM_KSPLIT": 1,
      "num_warps": 8,
      "num_stages": 1,
      "waves_per_eu": 2
    },
    "937": {
      "BLOCK_M": 32,
      "BLOCK_N": 16,
      "BLOCK_K": 128,
      "BLOCK_C": 128,
      "NUM_KSPLIT": 1,
      "num_warps": 2,
      "num_stages": 1,
      "waves_per_eu": 1
    },
    "983": {
      "BLOCK_M": 32,
      "BLOCK_N": 16,
      "BLOCK_K": 128,
      "BLOCK_C": 128,
      "NUM_KSPLIT": 4,
      "num_warps": 4,
      "num_stages": 2,
      "waves_per_eu": 2
    },
    "2161": {
      "BLOCK_M": 64,
      "BLOCK_N": 16,
      "BLOCK_K": 128,
      "BLOCK_C": 16,
      "NUM_KSPLIT": 1,
      "num_warps": 2,
      "num_stages": 1,
      "waves_per_eu": 1
    },
    "5640": {
      "BLOCK_M": 256,
      "BLOCK_N": 16,
      "BLOCK_K": 256,
      "BLOCK_C": 128,
      "NUM_KSPLIT": 2,
      "num_warps": 4,
      "num_stages": 1,
      "waves_per_eu": 0
    },
    "3799": {
      "BLOCK_M": 128,
      "BLOCK_N": 16,
      "BLOCK_K": 128,
      "BLOCK_C": 64,
      "NUM_KSPLIT": 8,
      "num_warps": 2,
      "num_stages": 1,
      "waves_per_eu": 1
    },
    "1643": {
      "BLOCK_M": 64,
      "BLOCK_N": 16,
      "BLOCK_K": 32,
      "BLOCK_C": 64,
      "NUM_KSPLIT": 8,
      "num_warps": 2,
      "num_stages": 2,
      "waves_per_eu": 2
    },
    "4342": {
      "BLOCK_M": 256,
      "BLOCK_N": 16,
      "BLOCK_K": 32,
      "BLOCK_C": 16,
      "NUM_KSPLIT": 2,
      "num_warps": 2,
      "num_stages": 2,
      "waves_per_eu": 1
    },
    "4821": {
      "BLOCK_M": 256,
      "BLOCK_N": 16,
      "BLOCK_K": 64,
      "BLOCK_C": 32,
      "NUM_KSPLIT": 8,
      "num_warps": 8,
      "num_stages": 2,
      "waves_per_eu": 0
    },
    "76": {
      "BLOCK_M": 32,
      "BLOCK_N": 16,
      "BLOCK_K": 32,
      "BLOCK_C": 32,
      "NUM_KSPLIT": 1,
      "num_warps": 2,
      "num_stages": 2,
      "waves_per_eu": 1
    },
    "4240": {
      "BLOCK_M": 128,
      "BLOCK_N": 16,
      "BLOCK_K": 256,
      "BLOCK_C": 128,
      "NUM_KSPLIT": 8,
      "num_warps": 4,
      "num_stages": 2,
      "waves_per_eu": 1
    },
    "3614": {
      "BLOCK_M": 128,
      "BLOCK_N": 16,
      "BLOCK_K": 128,
      "BLOCK_C": 16,
      "NUM_KSPLIT": 1,
      "num_warps": 8,
      "num_stages": 1,
      "waves_per_eu": 2
    },
    "3119": {
      "BLOCK_M": 128,
      "BLOCK_N": 16,
      "BLOCK_K": 32,
      "BLOCK_C": 128,
      "NUM_KSPLIT": 2,
      "num_warps": 2,
      "num_stages": 2,
      "waves_per_eu": 2
    },
    "1319": {
      "BLOCK_M": 32,
      "BLOCK_N": 16,
      "BLOCK_K": 256,
      "BLOCK_C": 128,
      "NUM_KSPLIT": 2,
      "num_warps": 2,
      "num_stages": 2,
      "waves_per_eu": 2
    },
    "2734": {
      "BLOCK_M": 64,
      "BLOCK_N": 16,
      "BLOCK_K": 256,
      "BLOCK_C": 64,
      "NUM_KSPLIT": 8,
      "num_warps": 8,
      "num_stages": 2,
      "waves_per_eu": 1
    },
    "936": {
      "BLOCK_M": 32,
      "BLOCK_N": 16,
      "BLOCK_K": 128,
      "BLOCK_C": 128,
      "NUM_KSPLIT": 1,
      "num_warps": 2,
      "num_stages": 1,
      "waves_per_eu": 0
    },
    "1482": {
      "BLOCK_M": 64,
      "BLOCK_N": 16,
      "BLOCK_K": 32,
      "BLOCK_C": 16,
      "NUM_KSPLIT": 4,
      "num_warps": 4,
      "num_stages": 1,
      "waves_per_eu": 0
    },
    "1165": {
      "BLOCK_M": 32,
      "BLOCK_N": 16,
      "BLOCK_K": 256,
      "BLOCK_C": 32,
      "NUM_KSPLIT": 1,
      "num_warps": 8,
      "num_stages": 1,
      "waves_per_eu": 1
    },
    "3466": {
      "BLOCK_M": 128,
      "BLOCK_N": 16,
      "BLOCK_K": 64,
      "BLOCK_C": 128,
      "NUM_KSPLIT": 1,
      "num_warps": 4,
      "num_stages": 2,
      "waves_per_eu": 1
    },
    "1804": {
      "BLOCK_M": 64,
      "BLOCK_N": 16,
      "BLOCK_K": 64,
      "BLOCK_C": 16,
      "NUM_KSPLIT": 1,
      "num_warps": 2,
      "num_stages": 2,
      "waves_per_eu": 1
    },
    "3158": {
      "BLOCK_M": 128,
      "BLOCK_N": 16,
      "BLOCK_K": 32,
      "BLOCK_C": 128,
      "NUM_KSPLIT": 8,
      "num_warps": 4,
      "num_stages": 1,
      "waves_per_eu": 2
    },
    "1327": {
      "BLOCK_M": 32,
      "BLOCK_N": 16,
      "BLOCK_K": 256,
      "BLOCK_C": 128,
      "NUM_KSPLIT": 2,
      "num_warps": 8,
      "num_stages": 1,
      "waves_per_eu": 1
    },
    "836": {
      "BLOCK_M": 32,
      "BLOCK_N": 16,
      "BLOCK_K": 128,
      "BLOCK_C": 32,
      "NUM_KSPLIT": 4,
      "num_warps": 4,
      "num_stages": 1,
      "waves_per_eu": 2
    },
    "1674": {
      "BLOCK_M": 64,
      "BLOCK_N": 16,
      "BLOCK_K": 32,
      "BLOCK_C": 128,
      "NUM_KSPLIT": 2,
      "num_warps": 2,
      "num_stages": 1,
      "waves_per_eu": 0
    },
    "1111": {
      "BLOCK_M": 32,
      "BLOCK_N": 16,
      "BLOCK_K": 256,
      "BLOCK_C": 16,
      "NUM_KSPLIT": 2,
      "num_warps": 8,
      "num_stages": 1,
      "waves_per_eu": 1
    },
    "1020": {
      "BLOCK_M": 32,
      "BLOCK_N": 16,
      "BLOCK_K": 128,
      "BLOCK_C": 256,
      "NUM_KSPLIT": 1,
      "num_warps": 8,
      "num_stages": 1,
      "waves_per_eu": 0
    },
    "502": {
      "BLOCK_M": 32,
      "BLOCK_N": 16,
      "BLOCK_K": 64,
      "BLOCK_C": 32,
      "NUM_KSPLIT": 8,
      "num_warps": 8,
      "num_stages": 2,
      "waves_per_eu": 1
    },
    "3919": {
      "BLOCK_M": 128,
      "BLOCK_N": 16,
      "BLOCK_K": 128,
      "BLOCK_C": 256,
      "NUM_KSPLIT": 2,
      "num_warps": 8,
      "num_stages": 1,
      "waves_per_eu": 1
    },
    "939": {
      "BLOCK_M": 32,
      "BLOCK_N": 16,
      "BLOCK_K": 128,
      "BLOCK_C": 128,
      "NUM_KSPLIT": 1,
      "num_warps": 2,
      "num_stages": 2,
      "waves_per_eu": 0
    },
    "2758": {
      "BLOCK_M": 64,
      "BLOCK_N": 16,
      "BLOCK_K": 256,
      "BLOCK_C": 128,
      "NUM_KSPLIT": 2,
      "num_warps": 2,
      "num_stages": 2,
      "waves_per_eu": 1
    },
    "493": {
      "BLOCK_M": 32,
      "BLOCK_N": 16,
      "BLOCK_K": 64,
      "BLOCK_C": 32,
      "NUM_KSPLIT": 8,
      "num_warps": 4,
      "num_stages": 1,
      "waves_per_eu": 1
    },
    "3204": {
      "BLOCK_M": 128,
      "BLOCK_N": 16,
      "BLOCK_K": 32,
      "BLOCK_C": 256,
      "NUM_KSPLIT": 4,
      "num_warps": 2,
      "num_stages": 1,
      "waves_per_eu": 0
    },
    "4684": {
      "BLOCK_M": 256,
      "BLOCK_N": 16,
      "BLOCK_K": 64,
      "BLOCK_C": 16,
      "NUM_KSPLIT": 1,
      "num_warps": 2,
      "num_stages": 2,
      "waves_per_eu": 1
    },
    "4178": {
      "BLOCK_M": 128,
      "BLOCK_N": 16,
      "BLOCK_K": 256,
      "BLOCK_C": 128,
      "NUM_KSPLIT": 1,
      "num_warps": 2,
      "num_stages": 1,
      "waves_per_eu": 2
    },
    "2679": {
      "BLOCK_M": 64,
      "BLOCK_N": 16,
      "BLOCK_K": 256,
      "BLOCK_C": 64,
      "NUM_KSPLIT": 1,
      "num_warps": 8,
      "num_stages": 2,
      "waves_per_eu": 0
    },
    "3866": {
      "BLOCK_M": 128,
      "BLOCK_N": 16,
      "BLOCK_K": 128,
      "BLOCK_C": 128,
      "NUM_KSPLIT": 4,
      "num_warps": 8,
      "num_stages": 1,
      "waves_per_eu": 2
    },
    "3099": {
      "BLOCK_M": 128,
      "BLOCK_N": 16,
      "BLOCK_K": 32,
      "BLOCK_C": 128,
      "NUM_KSPLIT": 1,
      "num_warps": 2,
      "num_stages": 2,
      "waves_per_eu": 0
    },
    "2405": {
      "BLOCK_M": 64,
      "BLOCK_N": 16,
      "BLOCK_K": 128,
      "BLOCK_C": 128,
      "NUM_KSPLIT": 2,
      "num_warps": 4,
      "num_stages": 2,
      "waves_per_eu": 2
    },
    "2834": {
      "BLOCK_M": 64,
      "BLOCK_N": 16,
      "BLOCK_K": 256,
      "BLOCK_C": 256,
      "NUM_KSPLIT": 2,
      "num_warps": 4,
      "num_stages": 1,
      "waves_per_eu": 2
    },
    "4500": {
      "BLOCK_M": 256,
      "BLOCK_N": 16,
      "BLOCK_K": 32,
      "BLOCK_C": 64,
      "NUM_KSPLIT": 4,
      "num_warps": 2,
      "num_stages": 1,
      "waves_per_eu": 0
    },
    "2469": {
      "BLOCK_M": 64,
      "BLOCK_N": 16,
      "BLOCK_K": 128,
      "BLOCK_C": 256,
      "NUM_KSPLIT": 2,
      "num_warps": 2,
      "num_stages": 2,
      "waves_per_eu": 0
    },
    "379": {
      "BLOCK_M": 32,
      "BLOCK_N": 16,
      "BLOCK_K": 64,
      "BLOCK_C": 16,
      "NUM_KSPLIT": 2,
      "num_warps": 2,
      "num_stages": 1,
      "waves_per_eu": 1
    },
    "1548": {
      "BLOCK_M": 64,
      "BLOCK_N": 16,
      "BLOCK_K": 32,
      "BLOCK_C": 32,
      "NUM_KSPLIT": 4,
      "num_warps": 2,
      "num_stages": 1,
      "waves_per_eu": 0
    },
    "2798": {
      "BLOCK_M": 64,
      "BLOCK_N": 16,
      "BLOCK_K": 256,
      "BLOCK_C": 128,
      "NUM_KSPLIT": 8,
      "num_warps": 4,
      "num_stages": 1,
      "waves_per_eu": 2
    },
    "2945": {
      "BLOCK_M": 128,
      "BLOCK_N": 16,
      "BLOCK_K": 32,
      "BLOCK_C": 16,
      "NUM_KSPLIT": 8,
      "num_warps": 4,
      "num_stages": 2,
      "waves_per_eu": 2
    },
    "1586": {
      "BLOCK_M": 64,
      "BLOCK_N": 16,
      "BLOCK_K": 32,
      "BLOCK_C": 64,
      "NUM_KSPLIT": 1,
      "num_warps": 2,
      "num_stages": 1,
      "waves_per_eu": 2
    },
    "3516": {
      "BLOCK_M": 128,
      "BLOCK_N": 16,
      "BLOCK_K": 64,
      "BLOCK_C": 128,
      "NUM_KSPLIT": 8,
      "num_warps": 4,
      "num_stages": 1,
      "waves_per_eu": 0
    },
    "2153": {
      "BLOCK_M": 64,
      "BLOCK_N": 16,
      "BLOCK_K": 64,
      "BLOCK_C": 256,
      "NUM_KSPLIT": 8,
      "num_warps": 4,
      "num_stages": 2,
      "waves_per_eu": 2
    },
    "1521": {
      "BLOCK_M": 64,
      "BLOCK_N": 16,
      "BLOCK_K": 32,
      "BLOCK_C": 32,
      "NUM_KSPLIT": 1,
      "num_warps": 4,
      "num_stages": 2,
      "waves_per_eu": 0
    },
    "4763": {
      "BLOCK_M": 256,
      "BLOCK_N": 16,
      "BLOCK_K": 64,
      "BLOCK_C": 32,
      "NUM_KSPLIT": 1,
      "num_warps": 4,
      "num_stages": 2,
      "waves_per_eu": 2
    },
    "779": {
      "BLOCK_M": 32,
      "BLOCK_N": 16,
      "BLOCK_K": 128,
      "BLOCK_C": 16,
      "NUM_KSPLIT": 8,
      "num_warps": 2,
      "num_stages": 2,
      "waves_per_eu": 2
    },
    "742": {
      "BLOCK_M": 32,
      "BLOCK_N": 16,
      "BLOCK_K": 128,
      "BLOCK_C": 16,
      "NUM_KSPLIT": 2,
      "num_warps": 2,
      "num_stages": 2,
      "waves_per_eu": 1
    },
    "4783": {
      "BLOCK_M": 256,
      "BLOCK_N": 16,
      "BLOCK_K": 64,
      "BLOCK_C": 32,
      "NUM_KSPLIT": 2,
      "num_warps": 8,
      "num_stages": 1,
      "waves_per_eu": 1
    },
    "1043": {
      "BLOCK_M": 32,
      "BLOCK_N": 16,
      "BLOCK_K": 128,
      "BLOCK_C": 256,
      "NUM_KSPLIT": 2,
      "num_warps": 8,
      "num_stages": 2,
      "waves_per_eu": 2
    },
    "3462": {
      "BLOCK_M": 128,
      "BLOCK_N": 16,
      "BLOCK_K": 64,
      "BLOCK_C": 128,
      "NUM_KSPLIT": 1,
      "num_warps": 4,
      "num_stages": 1,
      "waves_per_eu": 0
    },
    "1998": {
      "BLOCK_M": 64,
      "BLOCK_N": 16,
      "BLOCK_K": 64,
      "BLOCK_C": 64,
      "NUM_KSPLIT": 8,
      "num_warps": 2,
      "num_stages": 1,
      "waves_per_eu": 0
    },
    "4484": {
      "BLOCK_M": 256,
      "BLOCK_N": 16,
      "BLOCK_K": 32,
      "BLOCK_C": 64,
      "NUM_KSPLIT": 2,
      "num_warps": 2,
      "num_stages": 1,
      "waves_per_eu": 2
    },
    "682": {
      "BLOCK_M": 32,
      "BLOCK_N": 16,
      "BLOCK_K": 64,
      "BLOCK_C": 256,
      "NUM_KSPLIT": 2,
      "num_warps": 8,
      "num_stages": 2,
      "waves_per_eu": 1
    },
    "3248": {
      "BLOCK_M": 128,
      "BLOCK_N": 16,
      "BLOCK_K": 64,
      "BLOCK_C": 16,
      "NUM_KSPLIT": 1,
      "num_warps": 4,
      "num_stages": 1,
      "waves_per_eu": 2
    },
    "4147": {
      "BLOCK_M": 128,
      "BLOCK_N": 16,
      "BLOCK_K": 256,
      "BLOCK_C": 64,
      "NUM_KSPLIT": 4,
      "num_warps": 4,
      "num_stages": 1,
      "waves_per_eu": 1
    },
    "5269": {
      "BLOCK_M": 256,
      "BLOCK_N": 16,
      "BLOCK_K": 128,
      "BLOCK_C": 128,
      "NUM_KSPLIT": 1,
      "num_warps": 8,
      "num_stages": 1,
      "waves_per_eu": 1
    },
    "864": {
      "BLOCK_M": 32,
      "BLOCK_N": 16,
      "BLOCK_K": 128,
      "BLOCK_C": 64,
      "NUM_KSPLIT": 1,
      "num_warps": 2,
      "num_stages": 1,
      "waves_per_eu": 0
    },
    "4610": {
      "BLOCK_M": 256,
      "BLOCK_N": 16,
      "BLOCK_K": 32,
      "BLOCK_C": 256,
      "NUM_KSPLIT": 1,
      "num_warps": 2,
      "num_stages": 1,
      "waves_per_eu": 2
    },
    "148": {
      "BLOCK_M": 32,
      "BLOCK_N": 16,
      "BLOCK_K": 32,
      "BLOCK_C": 64,
      "NUM_KSPLIT": 1,
      "num_warps": 2,
      "num_stages": 2,
      "waves_per_eu": 1
    },
    "219": {
      "BLOCK_M": 32,
      "BLOCK_N": 16,
      "BLOCK_K": 32,
      "BLOCK_C": 128,
      "NUM_KSPLIT": 1,
      "num_warps": 2,
      "num_stages": 2,
      "waves_per_eu": 0
    },
    "4758": {
      "BLOCK_M": 256,
      "BLOCK_N": 16,
      "BLOCK_K": 64,
      "BLOCK_C": 32,
      "NUM_KSPLIT": 1,
      "num_warps": 4,
      "num_stages": 1,
      "waves_per_eu": 0
    },
    "2593": {
      "BLOCK_M": 64,
      "BLOCK_N": 16,
      "BLOCK_K": 256,
      "BLOCK_C": 32,
      "NUM_KSPLIT": 1,
      "num_warps": 2,
      "num_stages": 1,
      "waves_per_eu": 1
    },
    "881": {
      "BLOCK_M": 32,
      "BLOCK_N": 16,
      "BLOCK_K": 128,
      "BLOCK_C": 64,
      "NUM_KSPLIT": 1,
      "num_warps": 8,
      "num_stages": 2,
      "waves_per_eu": 2
    },
    "2870": {
      "BLOCK_M": 64,
      "BLOCK_N": 16,
      "BLOCK_K": 256,
      "BLOCK_C": 256,
      "NUM_KSPLIT": 8,
      "num_warps": 4,
      "num_stages": 1,
      "waves_per_eu": 2
    },
    "624": {
      "BLOCK_M": 32,
      "BLOCK_N": 16,
      "BLOCK_K": 64,
      "BLOCK_C": 128,
      "NUM_KSPLIT": 4,
      "num_warps": 8,
      "num_stages": 1,
      "waves_per_eu": 0
    },
    "4787": {
      "BLOCK_M": 256,
      "BLOCK_N": 16,
      "BLOCK_K": 64,
      "BLOCK_C": 32,
      "NUM_KSPLIT": 2,
      "num_warps": 8,
      "num_stages": 2,
      "waves_per_eu": 2
    },
    "3534": {
      "BLOCK_M": 128,
      "BLOCK_N": 16,
      "BLOCK_K": 64,
      "BLOCK_C": 256,
      "NUM_KSPLIT": 1,
      "num_warps": 4,
      "num_stages": 1,
      "waves_per_eu": 0
    },
    "629": {
      "BLOCK_M": 32,
      "BLOCK_N": 16,
      "BLOCK_K": 64,
      "BLOCK_C": 128,
      "NUM_KSPLIT": 4,
      "num_warps": 8,
      "num_stages": 2,
      "waves_per_eu": 2
    },
    "2212": {
      "BLOCK_M": 64,
      "BLOCK_N": 16,
      "BLOCK_K": 128,
      "BLOCK_C": 16,
      "NUM_KSPLIT": 4,
      "num_warps": 8,
      "num_stages": 2,
      "waves_per_eu": 1
    },
    "506": {
      "BLOCK_M": 32,
      "BLOCK_N": 16,
      "BLOCK_K": 64,
      "BLOCK_C": 64,
      "NUM_KSPLIT": 1,
      "num_warps": 2,
      "num_stages": 1,
      "waves_per_eu": 2
    },
    "2596": {
      "BLOCK_M": 64,
      "BLOCK_N": 16,
      "BLOCK_K": 256,
      "BLOCK_C": 32,
      "NUM_KSPLIT": 1,
      "num_warps": 2,
      "num_stages": 2,
      "waves_per_eu": 1
    },
    "5659": {
      "BLOCK_M": 256,
      "BLOCK_N": 16,
      "BLOCK_K": 256,
      "BLOCK_C": 128,
      "NUM_KSPLIT": 4,
      "num_warps": 4,
      "num_stages": 1,
      "waves_per_eu": 1
    },
    "1815": {
      "BLOCK_M": 64,
      "BLOCK_N": 16,
      "BLOCK_K": 64,
      "BLOCK_C": 16,
      "NUM_KSPLIT": 1,
      "num_warps": 8,
      "num_stages": 2,
      "waves_per_eu": 0
    },
    "2329": {
      "BLOCK_M": 64,
      "BLOCK_N": 16,
      "BLOCK_K": 128,
      "BLOCK_C": 64,
      "NUM_KSPLIT": 2,
      "num_warps": 4,
      "num_stages": 1,
      "waves_per_eu": 1
    },
    "4212": {
      "BLOCK_M": 128,
      "BLOCK_N": 16,
      "BLOCK_K": 256,
      "BLOCK_C": 128,
      "NUM_KSPLIT": 4,
      "num_warps": 2,
      "num_stages": 1,
      "waves_per_eu": 0
    },
    "248": {
      "BLOCK_M": 32,
      "BLOCK_N": 16,
      "BLOCK_K": 32,
      "BLOCK_C": 128,
      "NUM_KSPLIT": 2,
      "num_warps": 8,
      "num_stages": 1,
      "waves_per_eu": 2
    },
    "5678": {
      "BLOCK_M": 256,
      "BLOCK_N": 16,
      "BLOCK_K": 256,
      "BLOCK_C": 128,
      "NUM_KSPLIT": 8,
      "num_warps": 4,
      "num_stages": 1,
      "waves_per_eu": 2
    },
    "3924": {
      "BLOCK_M": 128,
      "BLOCK_N": 16,
      "BLOCK_K": 128,
      "BLOCK_C": 256,
      "NUM_KSPLIT": 4,
      "num_warps": 2,
      "num_stages": 1,
      "waves_per_eu": 0
    },
    "53": {
      "BLOCK_M": 32,
      "BLOCK_N": 16,
      "BLOCK_K": 32,
      "BLOCK_C": 16,
      "NUM_KSPLIT": 4,
      "num_warps": 8,
      "num_stages": 2,
      "waves_per_eu": 2
    },
    "3046": {
      "BLOCK_M": 128,
      "BLOCK_N": 16,
      "BLOCK_K": 32,
      "BLOCK_C": 64,
      "NUM_KSPLIT": 2,
      "num_warps": 2,
      "num_stages": 2,
      "waves_per_eu": 1
    },
    "1660": {
      "BLOCK_M": 64,
      "BLOCK_N": 16,
      "BLOCK_K": 32,
      "BLOCK_C": 128,
      "NUM_KSPLIT": 1,
      "num_warps": 2,
      "num_stages": 2,
      "waves_per_eu": 1
    },
    "68": {
      "BLOCK_M": 32,
      "BLOCK_N": 16,
      "BLOCK_K": 32,
      "BLOCK_C": 16,
      "NUM_KSPLIT": 8,
      "num_warps": 8,
      "num_stages": 1,
      "waves_per_eu": 2
    },
    "5630": {
      "BLOCK_M": 256,
      "BLOCK_N": 16,
      "BLOCK_K": 256,
      "BLOCK_C": 128,
      "NUM_KSPLIT": 1,
      "num_warps": 8,
      "num_stages": 1,
      "waves_per_eu": 2
    },
    "1097": {
      "BLOCK_M": 32,
      "BLOCK_N": 16,
      "BLOCK_K": 256,
      "BLOCK_C": 16,
      "NUM_KSPLIT": 1,
      "num_warps": 8,
      "num_stages": 2,
      "waves_per_eu": 2
    },
    "654": {
      "BLOCK_M": 32,
      "BLOCK_N": 16,
      "BLOCK_K": 64,
      "BLOCK_C": 256,
      "NUM_KSPLIT": 1,
      "num_warps": 4,
      "num_stages": 1,
      "waves_per_eu": 0
    },
    "1010": {
      "BLOCK_M": 32,
      "BLOCK_N": 16,
      "BLOCK_K": 128,
      "BLOCK_C": 256,
      "NUM_KSPLIT": 1,
      "num_warps": 2,
      "num_stages": 1,
      "waves_per_eu": 2
    },
    "4494": {
      "BLOCK_M": 256,
      "BLOCK_N": 16,
      "BLOCK_K": 32,
      "BLOCK_C": 64,
      "NUM_KSPLIT": 2,
      "num_warps": 8,
      "num_stages": 1,
      "waves_per_eu": 0
    },
    "876": {
      "BLOCK_M": 32,
      "BLOCK_N": 16,
      "BLOCK_K": 128,
      "BLOCK_C": 64,
      "NUM_KSPLIT": 1,
      "num_warps": 8,
      "num_stages": 1,
      "waves_per_eu": 0
    },
    "4086": {
      "BLOCK_M": 128,
      "BLOCK_N": 16,
      "BLOCK_K": 256,
      "BLOCK_C": 32,
      "NUM_KSPLIT": 8,
      "num_warps": 2,
      "num_stages": 1,
      "waves_per_eu": 0
    },
    "92": {
      "BLOCK_M": 32,
      "BLOCK_N": 16,
      "BLOCK_K": 32,
      "BLOCK_C": 32,
      "NUM_KSPLIT": 2,
      "num_warps": 2,
      "num_stages": 1,
      "waves_per_eu": 2
    },
    "3957": {
      "BLOCK_M": 128,
      "BLOCK_N": 16,
      "BLOCK_K": 128,
      "BLOCK_C": 256,
      "NUM_KSPLIT": 8,
      "num_warps": 8,
      "num_stages": 2,
      "waves_per_eu": 0
    },
    "3848": {
      "BLOCK_M": 128,
      "BLOCK_N": 16,
      "BLOCK_K": 128,
      "BLOCK_C": 128,
      "NUM_KSPLIT": 2,
      "num_warps": 8,
      "num_stages": 1,
      "waves_per_eu": 2
    },
    "490": {
      "BLOCK_M": 32,
      "BLOCK_N": 16,
      "BLOCK_K": 64,
      "BLOCK_C": 32,
      "NUM_KSPLIT": 8,
      "num_warps": 2,
      "num_stages": 2,
      "waves_per_eu": 1
    },
    "1184": {
      "BLOCK_M": 32,
      "BLOCK_N": 16,
      "BLOCK_K": 256,
      "BLOCK_C": 32,
      "NUM_KSPLIT": 2,
      "num_warps": 8,
      "num_stages": 1,
      "waves_per_eu": 2
    },
    "4649": {
      "BLOCK_M": 256,
      "BLOCK_N": 16,
      "BLOCK_K": 32,
      "BLOCK_C": 256,
      "NUM_KSPLIT": 4,
      "num_warps": 2,
      "num_stages": 2,
      "waves_per_eu": 2
    },
    "4087": {
      "BLOCK_M": 128,
      "BLOCK_N": 16,
      "BLOCK_K": 256,
      "BLOCK_C": 32,
      "NUM_KSPLIT": 8,
      "num_warps": 2,
      "num_stages": 1,
      "waves_per_eu": 1
    },
    "3701": {
      "BLOCK_M": 128,
      "BLOCK_N": 16,
      "BLOCK_K": 128,
      "BLOCK_C": 32,
      "NUM_KSPLIT": 2,
      "num_warps": 4,
      "num_stages": 2,
      "waves_per_eu": 2
    },
    "886": {
      "BLOCK_M": 32,
      "BLOCK_N": 16,
      "BLOCK_K": 128,
      "BLOCK_C": 64,
      "NUM_KSPLIT": 2,
      "num_warps": 2,
      "num_stages": 2,
      "waves_per_eu": 1
    },
    "3416": {
      "BLOCK_M": 128,
      "BLOCK_N": 16,
      "BLOCK_K": 64,
      "BLOCK_C": 64,
      "NUM_KSPLIT": 2,
      "num_warps": 8,
      "num_stages": 1,
      "waves_per_eu": 2
    },
    "4507": {
      "BLOCK_M": 256,
      "BLOCK_N": 16,
      "BLOCK_K": 32,
      "BLOCK_C": 64,
      "NUM_KSPLIT": 4,
      "num_warps": 4,
      "num_stages": 1,
      "waves_per_eu": 1
    },
    "1213": {
      "BLOCK_M": 32,
      "BLOCK_N": 16,
      "BLOCK_K": 256,
      "BLOCK_C": 32,
      "NUM_KSPLIT": 8,
      "num_warps": 4,
      "num_stages": 1,
      "waves_per_eu": 1
    },
    "3202": {
      "BLOCK_M": 128,
      "BLOCK_N": 16,
      "BLOCK_K": 32,
      "BLOCK_C": 256,
      "NUM_KSPLIT": 2,
      "num_warps": 8,
      "num_stages": 2,
      "waves_per_eu": 1
    },
    "4189": {
      "BLOCK_M": 128,
      "BLOCK_N": 16,
      "BLOCK_K": 256,
      "BLOCK_C": 128,
      "NUM_KSPLIT": 1,
      "num_warps": 8,
      "num_stages": 1,
      "waves_per_eu": 1
    },
    "2950": {
      "BLOCK_M": 128,
      "BLOCK_N": 16,
      "BLOCK_K": 32,
      "BLOCK_C": 16,
      "NUM_KSPLIT": 8,
      "num_warps": 8,
      "num_stages": 2,
      "waves_per_eu": 1
    },
    "4805": {
      "BLOCK_M": 256,
      "BLOCK_N": 16,
      "BLOCK_K": 64,
      "BLOCK_C": 32,
      "NUM_KSPLIT": 4,
      "num_warps": 8,
      "num_stages": 2,
      "waves_per_eu": 2
    },
    "1719": {
      "BLOCK_M": 64,
      "BLOCK_N": 16,
      "BLOCK_K": 32,
      "BLOCK_C": 128,
      "NUM_KSPLIT": 8,
      "num_warps": 4,
      "num_stages": 2,
      "waves_per_eu": 0
    },
    "5715": {
      "BLOCK_M": 256,
      "BLOCK_N": 16,
      "BLOCK_K": 256,
      "BLOCK_C": 256,
      "NUM_KSPLIT": 2,
      "num_warps": 4,
      "num_stages": 2,
      "waves_per_eu": 0
    },
    "3798": {
      "BLOCK_M": 128,
      "BLOCK_N": 16,
      "BLOCK_K": 128,
      "BLOCK_C": 64,
      "NUM_KSPLIT": 8,
      "num_warps": 2,
      "num_stages": 1,
      "waves_per_eu": 0
    },
    "4853": {
      "BLOCK_M": 256,
      "BLOCK_N": 16,
      "BLOCK_K": 64,
      "BLOCK_C": 64,
      "NUM_KSPLIT": 2,
      "num_warps": 4,
      "num_stages": 2,
      "waves_per_eu": 2
    },
    "1612": {
      "BLOCK_M": 64,
      "BLOCK_N": 16,
      "BLOCK_K": 32,
      "BLOCK_C": 64,
      "NUM_KSPLIT": 2,
      "num_warps": 4,
      "num_stages": 2,
      "waves_per_eu": 1
    },
    "3132": {
      "BLOCK_M": 128,
      "BLOCK_N": 16,
      "BLOCK_K": 32,
      "BLOCK_C": 128,
      "NUM_KSPLIT": 4,
      "num_warps": 2,
      "num_stages": 1,
      "waves_per_eu": 0
    },
    "3448": {
      "BLOCK_M": 128,
      "BLOCK_N": 16,
      "BLOCK_K": 64,
      "BLOCK_C": 64,
      "NUM_KSPLIT": 8,
      "num_warps": 4,
      "num_stages": 2,
      "waves_per_eu": 1
    },
    "4692": {
      "BLOCK_M": 256,
      "BLOCK_N": 16,
      "BLOCK_K": 64,
      "BLOCK_C": 16,
      "NUM_KSPLIT": 1,
      "num_warps": 8,
      "num_stages": 1,
      "waves_per_eu": 0
    },
    "2944": {
      "BLOCK_M": 128,
      "BLOCK_N": 16,
      "BLOCK_K": 32,
      "BLOCK_C": 16,
      "NUM_KSPLIT": 8,
      "num_warps": 4,
      "num_stages": 2,
      "waves_per_eu": 1
    },
    "5249": {
      "BLOCK_M": 256,
      "BLOCK_N": 16,
      "BLOCK_K": 128,
      "BLOCK_C": 64,
      "NUM_KSPLIT": 8,
      "num_warps": 4,
      "num_stages": 2,
      "waves_per_eu": 2
    },
    "1436": {
      "BLOCK_M": 32,
      "BLOCK_N": 16,
      "BLOCK_K": 256,
      "BLOCK_C": 256,
      "NUM_KSPLIT": 8,
      "num_warps": 8,
      "num_stages": 1,
      "waves_per_eu": 2
    },
    "1686": {
      "BLOCK_M": 64,
      "BLOCK_N": 16,
      "BLOCK_K": 32,
      "BLOCK_C": 128,
      "NUM_KSPLIT": 2,
      "num_warps": 8,
      "num_stages": 1,
      "waves_per_eu": 0
    },
    "3642": {
      "BLOCK_M": 128,
      "BLOCK_N": 16,
      "BLOCK_K": 128,
      "BLOCK_C": 16,
      "NUM_KSPLIT": 4,
      "num_warps": 4,
      "num_stages": 1,
      "waves_per_eu": 0
    },
    "2655": {
      "BLOCK_M": 64,
      "BLOCK_N": 16,
      "BLOCK_K": 256,
      "BLOCK_C": 32,
      "NUM_KSPLIT": 8,
      "num_warps": 4,
      "num_stages": 2,
      "waves_per_eu": 0
    },
    "3393": {
      "BLOCK_M": 128,
      "BLOCK_N": 16,
      "BLOCK_K": 64,
      "BLOCK_C": 64,
      "NUM_KSPLIT": 1,
      "num_warps": 4,
      "num_stages": 2,
      "waves_per_eu": 0
    },
    "4607": {
      "BLOCK_M": 256,
      "BLOCK_N": 16,
      "BLOCK_K": 32,
      "BLOCK_C": 128,
      "NUM_KSPLIT": 8,
      "num_warps": 8,
      "num_stages": 2,
      "waves_per_eu": 2
    },
    "2195": {
      "BLOCK_M": 64,
      "BLOCK_N": 16,
      "BLOCK_K": 128,
      "BLOCK_C": 16,
      "NUM_KSPLIT": 2,
      "num_warps": 8,
      "num_stages": 2,
      "waves_per_eu": 2
    },
    "3176": {
      "BLOCK_M": 128,
      "BLOCK_N": 16,
      "BLOCK_K": 32,
      "BLOCK_C": 256,
      "NUM_KSPLIT": 1,
      "num_warps": 4,
      "num_stages": 1,
      "waves_per_eu": 2
    },
    "4964": {
      "BLOCK_M": 256,
      "BLOCK_N": 16,
      "BLOCK_K": 64,
      "BLOCK_C": 128,
      "NUM_KSPLIT": 8,
      "num_warps": 8,
      "num_stages": 1,
      "waves_per_eu": 2
    },
    "1425": {
      "BLOCK_M": 32,
      "BLOCK_N": 16,
      "BLOCK_K": 256,
      "BLOCK_C": 256,
      "NUM_KSPLIT": 8,
      "num_warps": 2,
      "num_stages": 2,
      "waves_per_eu": 0
    },
    "4596": {
      "BLOCK_M": 256,
      "BLOCK_N": 16,
      "BLOCK_K": 32,
      "BLOCK_C": 128,
      "NUM_KSPLIT": 8,
      "num_warps": 4,
      "num_stages": 1,
      "waves_per_eu": 0
    },
    "1905": {
      "BLOCK_M": 64,
      "BLOCK_N": 16,
      "BLOCK_K": 64,
      "BLOCK_C": 32,
      "NUM_KSPLIT": 2,
      "num_warps": 8,
      "num_stages": 2,
      "waves_per_eu": 0
    },
    "181": {
      "BLOCK_M": 32,
      "BLOCK_N": 16,
      "BLOCK_K": 32,
      "BLOCK_C": 64,
      "NUM_KSPLIT": 4,
      "num_warps": 2,
      "num_stages": 1,
      "waves_per_eu": 1
    },
    "3526": {
      "BLOCK_M": 128,
      "BLOCK_N": 16,
      "BLOCK_K": 64,
      "BLOCK_C": 128,
      "NUM_KSPLIT": 8,
      "num_warps": 8,
      "num_stages": 2,
      "waves_per_eu": 1
    },
    "120": {
      "BLOCK_M": 32,
      "BLOCK_N": 16,
      "BLOCK_K": 32,
      "BLOCK_C": 32,
      "NUM_KSPLIT": 4,
      "num_warps": 8,
      "num_stages": 1,
      "waves_per_eu": 0
    },
    "190": {
      "BLOCK_M": 32,
      "BLOCK_N": 16,
      "BLOCK_K": 32,
      "BLOCK_C": 64,
      "NUM_KSPLIT": 4,
      "num_warps": 4,
      "num_stages": 2,
      "waves_per_eu": 1
    },
    "1985": {
      "BLOCK_M": 64,
      "BLOCK_N": 16,
      "BLOCK_K": 64,
      "BLOCK_C": 64,
      "NUM_KSPLIT": 4,
      "num_warps": 2,
      "num_stages": 2,
      "waves_per_eu": 2
    },
    "2397": {
      "BLOCK_M": 64,
      "BLOCK_N": 16,
      "BLOCK_K": 128,
      "BLOCK_C": 128,
      "NUM_KSPLIT": 2,
      "num_warps": 2,
      "num_stages": 2,
      "waves_per_eu": 0
    },
    "1652": {
      "BLOCK_M": 64,
      "BLOCK_N": 16,
      "BLOCK_K": 32,
      "BLOCK_C": 64,
      "NUM_KSPLIT": 8,
      "num_warps": 8,
      "num_stages": 1,
      "waves_per_eu": 2
    },
    "5264": {
      "BLOCK_M": 256,
      "BLOCK_N": 16,
      "BLOCK_K": 128,
      "BLOCK_C": 128,
      "NUM_KSPLIT": 1,
      "num_warps": 4,
      "num_stages": 1,
      "waves_per_eu": 2
    },
    "854": {
      "BLOCK_M": 32,
      "BLOCK_N": 16,
      "BLOCK_K": 128,
      "BLOCK_C": 32,
      "NUM_KSPLIT": 8,
      "num_warps": 4,
      "num_stages": 1,
      "waves_per_eu": 2
    },
    "5743": {
      "BLOCK_M": 256,
      "BLOCK_N": 16,
      "BLOCK_K": 256,
      "BLOCK_C": 256,
      "NUM_KSPLIT": 8,
      "num_warps": 2,
      "num_stages": 1,
      "waves_per_eu": 1
    },
    "5547": {
      "BLOCK_M": 256,
      "BLOCK_N": 16,
      "BLOCK_K": 256,
      "BLOCK_C": 64,
      "NUM_KSPLIT": 1,
      "num_warps": 2,
      "num_stages": 2,
      "waves_per_eu": 0
    },
    "4485": {
      "BLOCK_M": 256,
      "BLOCK_N": 16,
      "BLOCK_K": 32,
      "BLOCK_C": 64,
      "NUM_KSPLIT": 2,
      "num_warps": 2,
      "num_stages": 2,
      "waves_per_eu": 0
    },
    "5746": {
      "BLOCK_M": 256,
      "BLOCK_N": 16,
      "BLOCK_K": 256,
      "BLOCK_C": 256,
      "NUM_KSPLIT": 8,
      "num_warps": 2,
      "num_stages": 2,
      "waves_per_eu": 1
    },
    "254": {
      "BLOCK_M": 32,
      "BLOCK_N": 16,
      "BLOCK_K": 32,
      "BLOCK_C": 128,
      "NUM_KSPLIT": 4,
      "num_warps": 2,
      "num_stages": 1,
      "waves_per_eu": 2
    },
    "1055": {
      "BLOCK_M": 32,
      "BLOCK_N": 16,
      "BLOCK_K": 128,
      "BLOCK_C": 256,
      "NUM_KSPLIT": 4,
      "num_warps": 4,
      "num_stages": 2,
      "waves_per_eu": 2
    },
    "4324": {
      "BLOCK_M": 256,
      "BLOCK_N": 16,
      "BLOCK_K": 32,
      "BLOCK_C": 16,
      "NUM_KSPLIT": 1,
      "num_warps": 2,
      "num_stages": 2,
      "waves_per_eu": 1
    },
    "657": {
      "BLOCK_M": 32,
      "BLOCK_N": 16,
      "BLOCK_K": 64,
      "BLOCK_C": 256,
      "NUM_KSPLIT": 1,
      "num_warps": 4,
      "num_stages": 2,
      "waves_per_eu": 0
    },
    "3999": {
      "BLOCK_M": 128,
      "BLOCK_N": 16,
      "BLOCK_K": 256,
      "BLOCK_C": 16,
      "NUM_KSPLIT": 4,
      "num_warps": 2,
      "num_stages": 2,
      "waves_per_eu": 0
    },
    "5200": {
      "BLOCK_M": 256,
      "BLOCK_N": 16,
      "BLOCK_K": 128,
      "BLOCK_C": 64,
      "NUM_KSPLIT": 1,
      "num_warps": 8,
      "num_stages": 2,
      "waves_per_eu": 1
    },
    "2323": {
      "BLOCK_M": 64,
      "BLOCK_N": 16,
      "BLOCK_K": 128,
      "BLOCK_C": 64,
      "NUM_KSPLIT": 2,
      "num_warps": 2,
      "num_stages": 1,
      "waves_per_eu": 1
    },
    "2083": {
      "BLOCK_M": 64,
      "BLOCK_N": 16,
      "BLOCK_K": 64,
      "BLOCK_C": 128,
      "NUM_KSPLIT": 8,
      "num_warps": 8,
      "num_stages": 1,
      "waves_per_eu": 1
    },
    "2636": {
      "BLOCK_M": 64,
      "BLOCK_N": 16,
      "BLOCK_K": 256,
      "BLOCK_C": 32,
      "NUM_KSPLIT": 4,
      "num_warps": 4,
      "num_stages": 1,
      "waves_per_eu": 2
    },
    "1565": {
      "BLOCK_M": 64,
      "BLOCK_N": 16,
      "BLOCK_K": 32,
      "BLOCK_C": 32,
      "NUM_KSPLIT": 4,
      "num_warps": 8,
      "num_stages": 2,
      "waves_per_eu": 2
    },
    "3931": {
      "BLOCK_M": 128,
      "BLOCK_N": 16,
      "BLOCK_K": 128,
      "BLOCK_C": 256,
      "NUM_KSPLIT": 4,
      "num_warps": 4,
      "num_stages": 1,
      "waves_per_eu": 1
    },
    "5512": {
      "BLOCK_M": 256,
      "BLOCK_N": 16,
      "BLOCK_K": 256,
      "BLOCK_C": 32,
      "NUM_KSPLIT": 4,
      "num_warps": 2,
      "num_stages": 2,
      "waves_per_eu": 1
    },
    "1210": {
      "BLOCK_M": 32,
      "BLOCK_N": 16,
      "BLOCK_K": 256,
      "BLOCK_C": 32,
      "NUM_KSPLIT": 8,
      "num_warps": 2,
      "num_stages": 2,
      "waves_per_eu": 1
    },
    "4834": {
      "BLOCK_M": 256,
      "BLOCK_N": 16,
      "BLOCK_K": 64,
      "BLOCK_C": 64,
      "NUM_KSPLIT": 1,
      "num_warps": 4,
      "num_stages": 2,
      "waves_per_eu": 1
    },
    "1392": {
      "BLOCK_M": 32,
      "BLOCK_N": 16,
      "BLOCK_K": 256,
      "BLOCK_C": 256,
      "NUM_KSPLIT": 2,
      "num_warps": 4,
      "num_stages": 1,
      "waves_per_eu": 0
    },
    "138": {
      "BLOCK_M": 32,
      "BLOCK_N": 16,
      "BLOCK_K": 32,
      "BLOCK_C": 32,
      "NUM_KSPLIT": 8,
      "num_warps": 8,
      "num_stages": 1,
      "waves_per_eu": 0
    },
    "745": {
      "BLOCK_M": 32,
      "BLOCK_N": 16,
      "BLOCK_K": 128,
      "BLOCK_C": 16,
      "NUM_KSPLIT": 2,
      "num_warps": 4,
      "num_stages": 1,
      "waves_per_eu": 1
    },
    "3397": {
      "BLOCK_M": 128,
      "BLOCK_N": 16,
      "BLOCK_K": 64,
      "BLOCK_C": 64,
      "NUM_KSPLIT": 1,
      "num_warps": 8,
      "num_stages": 1,
      "waves_per_eu": 1
    },
    "5618": {
      "BLOCK_M": 256,
      "BLOCK_N": 16,
      "BLOCK_K": 256,
      "BLOCK_C": 128,
      "NUM_KSPLIT": 1,
      "num_warps": 2,
      "num_stages": 1,
      "waves_per_eu": 2
    },
    "1851": {
      "BLOCK_M": 64,
      "BLOCK_N": 16,
      "BLOCK_K": 64,
      "BLOCK_C": 16,
      "NUM_KSPLIT": 4,
      "num_warps": 8,
      "num_stages": 2,
      "waves_per_eu": 0
    },
    "622": {
      "BLOCK_M": 32,
      "BLOCK_N": 16,
      "BLOCK_K": 64,
      "BLOCK_C": 128,
      "NUM_KSPLIT": 4,
      "num_warps": 4,
      "num_stages": 2,
      "waves_per_eu": 1
    },
    "4609": {
      "BLOCK_M": 256,
      "BLOCK_N": 16,
      "BLOCK_K": 32,
      "BLOCK_C": 256,
      "NUM_KSPLIT": 1,
      "num_warps": 2,
      "num_stages": 1,
      "waves_per_eu": 1
    },
    "761": {
      "BLOCK_M": 32,
      "BLOCK_N": 16,
      "BLOCK_K": 128,
      "BLOCK_C": 16,
      "NUM_KSPLIT": 4,
      "num_warps": 2,
      "num_stages": 2,
      "waves_per_eu": 2
    },
    "3604": {
      "BLOCK_M": 128,
      "BLOCK_N": 16,
      "BLOCK_K": 128,
      "BLOCK_C": 16,
      "NUM_KSPLIT": 1,
      "num_warps": 2,
      "num_stages": 2,
      "waves_per_eu": 1
    },
    "4083": {
      "BLOCK_M": 128,
      "BLOCK_N": 16,
      "BLOCK_K": 256,
      "BLOCK_C": 32,
      "NUM_KSPLIT": 4,
      "num_warps": 8,
      "num_stages": 2,
      "waves_per_eu": 0
    },
    "965": {
      "BLOCK_M": 32,
      "BLOCK_N": 16,
      "BLOCK_K": 128,
      "BLOCK_C": 128,
      "NUM_KSPLIT": 2,
      "num_warps": 4,
      "num_stages": 2,
      "waves_per_eu": 2
    },
    "3713": {
      "BLOCK_M": 128,
      "BLOCK_N": 16,
      "BLOCK_K": 128,
      "BLOCK_C": 32,
      "NUM_KSPLIT": 4,
      "num_warps": 2,
      "num_stages": 2,
      "waves_per_eu": 2
    },
    "3446": {
      "BLOCK_M": 128,
      "BLOCK_N": 16,
      "BLOCK_K": 64,
      "BLOCK_C": 64,
      "NUM_KSPLIT": 8,
      "num_warps": 4,
      "num_stages": 1,
      "waves_per_eu": 2
    },
    "2433": {
      "BLOCK_M": 64,
      "BLOCK_N": 16,
      "BLOCK_K": 128,
      "BLOCK_C": 128,
      "NUM_KSPLIT": 8,
      "num_warps": 2,
      "num_stages": 2,
      "waves_per_eu": 0
    },
    "4679": {
      "BLOCK_M": 256,
      "BLOCK_N": 16,
      "BLOCK_K": 32,
      "BLOCK_C": 256,
      "NUM_KSPLIT": 8,
      "num_warps": 8,
      "num_stages": 2,
      "waves_per_eu": 2
    },
    "1268": {
      "BLOCK_M": 32,
      "BLOCK_N": 16,
      "BLOCK_K": 256,
      "BLOCK_C": 64,
      "NUM_KSPLIT": 4,
      "num_warps": 4,
      "num_stages": 1,
      "waves_per_eu": 2
    },
    "858": {
      "BLOCK_M": 32,
      "BLOCK_N": 16,
      "BLOCK_K": 128,
      "BLOCK_C": 32,
      "NUM_KSPLIT": 8,
      "num_warps": 8,
      "num_stages": 1,
      "waves_per_eu": 0
    },
    "4010": {
      "BLOCK_M": 128,
      "BLOCK_N": 16,
      "BLOCK_K": 256,
      "BLOCK_C": 16,
      "NUM_KSPLIT": 4,
      "num_warps": 8,
      "num_stages": 1,
      "waves_per_eu": 2
    },
    "3000": {
      "BLOCK_M": 128,
      "BLOCK_N": 16,
      "BLOCK_K": 32,
      "BLOCK_C": 32,
      "NUM_KSPLIT": 4,
      "num_warps": 8,
      "num_stages": 1,
      "waves_per_eu": 0
    },
    "2713": {
      "BLOCK_M": 64,
      "BLOCK_N": 16,
      "BLOCK_K": 256,
      "BLOCK_C": 64,
      "NUM_KSPLIT": 4,
      "num_warps": 8,
      "num_stages": 1,
      "waves_per_eu": 1
    },
    "3995": {
      "BLOCK_M": 128,
      "BLOCK_N": 16,
      "BLOCK_K": 256,
      "BLOCK_C": 16,
      "NUM_KSPLIT": 2,
      "num_warps": 8,
      "num_stages": 2,
      "waves_per_eu": 2
    },
    "16": {
      "BLOCK_M": 32,
      "BLOCK_N": 16,
      "BLOCK_K": 32,
      "BLOCK_C": 16,
      "NUM_KSPLIT": 1,
      "num_warps": 8,
      "num_stages": 2,
      "waves_per_eu": 1
    },
    "4007": {
      "BLOCK_M": 128,
      "BLOCK_N": 16,
      "BLOCK_K": 256,
      "BLOCK_C": 16,
      "NUM_KSPLIT": 4,
      "num_warps": 4,
      "num_stages": 2,
      "waves_per_eu": 2
    },
    "2280": {
      "BLOCK_M": 64,
      "BLOCK_N": 16,
      "BLOCK_K": 128,
      "BLOCK_C": 32,
      "NUM_KSPLIT": 4,
      "num_warps": 8,
      "num_stages": 1,
      "waves_per_eu": 0
    },
    "3557": {
      "BLOCK_M": 128,
      "BLOCK_N": 16,
      "BLOCK_K": 64,
      "BLOCK_C": 256,
      "NUM_KSPLIT": 2,
      "num_warps": 4,
      "num_stages": 2,
      "waves_per_eu": 2
    },
    "183": {
      "BLOCK_M": 32,
      "BLOCK_N": 16,
      "BLOCK_K": 32,
      "BLOCK_C": 64,
      "NUM_KSPLIT": 4,
      "num_warps": 2,
      "num_stages": 2,
      "waves_per_eu": 0
    },
    "1708": {
      "BLOCK_M": 64,
      "BLOCK_N": 16,
      "BLOCK_K": 32,
      "BLOCK_C": 128,
      "NUM_KSPLIT": 4,
      "num_warps": 8,
      "num_stages": 2,
      "waves_per_eu": 1
    },
    "2011": {
      "BLOCK_M": 64,
      "BLOCK_N": 16,
      "BLOCK_K": 64,
      "BLOCK_C": 64,
      "NUM_KSPLIT": 8,
      "num_warps": 8,
      "num_stages": 1,
      "waves_per_eu": 1
    },
    "4262": {
      "BLOCK_M": 128,
      "BLOCK_N": 16,
      "BLOCK_K": 256,
      "BLOCK_C": 256,
      "NUM_KSPLIT": 1,
      "num_warps": 8,
      "num_stages": 1,
      "waves_per_eu": 2
    },
    "1528": {
      "BLOCK_M": 64,
      "BLOCK_N": 16,
      "BLOCK_K": 32,
      "BLOCK_C": 32,
      "NUM_KSPLIT": 1,
      "num_warps": 8,
      "num_stages": 2,
      "waves_per_eu": 1
    },
    "2894": {
      "BLOCK_M": 128,
      "BLOCK_N": 16,
      "BLOCK_K": 32,
      "BLOCK_C": 16,
      "NUM_KSPLIT": 1,
      "num_warps": 8,
      "num_stages": 1,
      "waves_per_eu": 2
    },
    "2077": {
      "BLOCK_M": 64,
      "BLOCK_N": 16,
      "BLOCK_K": 64,
      "BLOCK_C": 128,
      "NUM_KSPLIT": 8,
      "num_warps": 4,
      "num_stages": 1,
      "waves_per_eu": 1
    },
    "415": {
      "BLOCK_M": 32,
      "BLOCK_N": 16,
      "BLOCK_K": 64,
      "BLOCK_C": 16,
      "NUM_KSPLIT": 8,
      "num_warps": 2,
      "num_stages": 1,
      "waves_per_eu": 1
    },
    "1696": {
      "BLOCK_M": 64,
      "BLOCK_N": 16,
      "BLOCK_K": 32,
      "BLOCK_C": 128,
      "NUM_KSPLIT": 4,
      "num_warps": 2,
      "num_stages": 2,
      "waves_per_eu": 1
    },
    "4066": {
      "BLOCK_M": 128,
      "BLOCK_N": 16,
      "BLOCK_K": 256,
      "BLOCK_C": 32,
      "NUM_KSPLIT": 2,
      "num_warps": 8,
      "num_stages": 2,
      "waves_per_eu": 1
    },
    "605": {
      "BLOCK_M": 32,
      "BLOCK_N": 16,
      "BLOCK_K": 64,
      "BLOCK_C": 128,
      "NUM_KSPLIT": 2,
      "num_warps": 4,
      "num_stages": 2,
      "waves_per_eu": 2
    },
    "3221": {
      "BLOCK_M": 128,
      "BLOCK_N": 16,
      "BLOCK_K": 32,
      "BLOCK_C": 256,
      "NUM_KSPLIT": 4,
      "num_warps": 8,
      "num_stages": 2,
      "waves_per_eu": 2
    },
    "4100": {
      "BLOCK_M": 128,
      "BLOCK_N": 16,
      "BLOCK_K": 256,
      "BLOCK_C": 32,
      "NUM_KSPLIT": 8,
      "num_warps": 8,
      "num_stages": 1,
      "waves_per_eu": 2
    },
    "5219": {
      "BLOCK_M": 256,
      "BLOCK_N": 16,
      "BLOCK_K": 128,
      "BLOCK_C": 64,
      "NUM_KSPLIT": 2,
      "num_warps": 8,
      "num_stages": 2,
      "waves_per_eu": 2
    },
    "3978": {
      "BLOCK_M": 128,
      "BLOCK_N": 16,
      "BLOCK_K": 256,
      "BLOCK_C": 16,
      "NUM_KSPLIT": 2,
      "num_warps": 2,
      "num_stages": 1,
      "waves_per_eu": 0
    },
    "2368": {
      "BLOCK_M": 64,
      "BLOCK_N": 16,
      "BLOCK_K": 128,
      "BLOCK_C": 64,
      "NUM_KSPLIT": 8,
      "num_warps": 4,
      "num_stages": 2,
      "waves_per_eu": 1
    },
    "3392": {
      "BLOCK_M": 128,
      "BLOCK_N": 16,
      "BLOCK_K": 64,
      "BLOCK_C": 64,
      "NUM_KSPLIT": 1,
      "num_warps": 4,
      "num_stages": 1,
      "waves_per_eu": 2
    },
    "331": {
      "BLOCK_M": 32,
      "BLOCK_N": 16,
      "BLOCK_K": 32,
      "BLOCK_C": 256,
      "NUM_KSPLIT": 4,
      "num_warps": 4,
      "num_stages": 1,
      "waves_per_eu": 1
    },
    "3402": {
      "BLOCK_M": 128,
      "BLOCK_N": 16,
      "BLOCK_K": 64,
      "BLOCK_C": 64,
      "NUM_KSPLIT": 2,
      "num_warps": 2,
      "num_stages": 1,
      "waves_per_eu": 0
    },
    "3026": {
      "BLOCK_M": 128,
      "BLOCK_N": 16,
      "BLOCK_K": 32,
      "BLOCK_C": 64,
      "NUM_KSPLIT": 1,
      "num_warps": 2,
      "num_stages": 1,
      "waves_per_eu": 2
    },
    "1798": {
      "BLOCK_M": 64,
      "BLOCK_N": 16,
      "BLOCK_K": 32,
      "BLOCK_C": 256,
      "NUM_KSPLIT": 8,
      "num_warps": 8,
      "num_stages": 2,
      "waves_per_eu": 1
    },
    "2097": {
      "BLOCK_M": 64,
      "BLOCK_N": 16,
      "BLOCK_K": 64,
      "BLOCK_C": 256,
      "NUM_KSPLIT": 1,
      "num_warps": 4,
      "num_stages": 2,
      "waves_per_eu": 0
    },
    "1489": {
      "BLOCK_M": 64,
      "BLOCK_N": 16,
      "BLOCK_K": 32,
      "BLOCK_C": 16,
      "NUM_KSPLIT": 4,
      "num_warps": 8,
      "num_stages": 1,
      "waves_per_eu": 1
    },
    "1877": {
      "BLOCK_M": 64,
      "BLOCK_N": 16,
      "BLOCK_K": 64,
      "BLOCK_C": 32,
      "NUM_KSPLIT": 1,
      "num_warps": 2,
      "num_stages": 2,
      "waves_per_eu": 2
    },
    "1706": {
      "BLOCK_M": 64,
      "BLOCK_N": 16,
      "BLOCK_K": 32,
      "BLOCK_C": 128,
      "NUM_KSPLIT": 4,
      "num_warps": 8,
      "num_stages": 1,
      "waves_per_eu": 2
    },
    "3584": {
      "BLOCK_M": 128,
      "BLOCK_N": 16,
      "BLOCK_K": 64,
      "BLOCK_C": 256,
      "NUM_KSPLIT": 8,
      "num_warps": 2,
      "num_stages": 1,
      "waves_per_eu": 2
    },
    "193": {
      "BLOCK_M": 32,
      "BLOCK_N": 16,
      "BLOCK_K": 32,
      "BLOCK_C": 64,
      "NUM_KSPLIT": 4,
      "num_warps": 8,
      "num_stages": 1,
      "waves_per_eu": 1
    },
    "5712": {
      "BLOCK_M": 256,
      "BLOCK_N": 16,
      "BLOCK_K": 256,
      "BLOCK_C": 256,
      "NUM_KSPLIT": 2,
      "num_warps": 4,
      "num_stages": 1,
      "waves_per_eu": 0
    },
    "409": {
      "BLOCK_M": 32,
      "BLOCK_N": 16,
      "BLOCK_K": 64,
      "BLOCK_C": 16,
      "NUM_KSPLIT": 4,
      "num_warps": 8,
      "num_stages": 1,
      "waves_per_eu": 1
    },
    "5068": {
      "BLOCK_M": 256,
      "BLOCK_N": 16,
      "BLOCK_K": 128,
      "BLOCK_C": 16,
      "NUM_KSPLIT": 2,
      "num_warps": 4,
      "num_stages": 2,
      "waves_per_eu": 1
    },
    "1263": {
      "BLOCK_M": 32,
      "BLOCK_N": 16,
      "BLOCK_K": 256,
      "BLOCK_C": 64,
      "NUM_KSPLIT": 4,
      "num_warps": 2,
      "num_stages": 2,
      "waves_per_eu": 0
    },
    "1245": {
      "BLOCK_M": 32,
      "BLOCK_N": 16,
      "BLOCK_K": 256,
      "BLOCK_C": 64,
      "NUM_KSPLIT": 2,
      "num_warps": 2,
      "num_stages": 2,
      "waves_per_eu": 0
    },
    "1359": {
      "BLOCK_M": 32,
      "BLOCK_N": 16,
      "BLOCK_K": 256,
      "BLOCK_C": 128,
      "NUM_KSPLIT": 8,
      "num_warps": 4,
      "num_stages": 2,
      "waves_per_eu": 0
    },
    "3413": {
      "BLOCK_M": 128,
      "BLOCK_N": 16,
      "BLOCK_K": 64,
      "BLOCK_C": 64,
      "NUM_KSPLIT": 2,
      "num_warps": 4,
      "num_stages": 2,
      "waves_per_eu": 2
    },
    "3686": {
      "BLOCK_M": 128,
      "BLOCK_N": 16,
      "BLOCK_K": 128,
      "BLOCK_C": 32,
      "NUM_KSPLIT": 1,
      "num_warps": 8,
      "num_stages": 1,
      "waves_per_eu": 2
    },
    "1288": {
      "BLOCK_M": 32,
      "BLOCK_N": 16,
      "BLOCK_K": 256,
      "BLOCK_C": 64,
      "NUM_KSPLIT": 8,
      "num_warps": 4,
      "num_stages": 2,
      "waves_per_eu": 1
    },
    "3338": {
      "BLOCK_M": 128,
      "BLOCK_N": 16,
      "BLOCK_K": 64,
      "BLOCK_C": 32,
      "NUM_KSPLIT": 2,
      "num_warps": 4,
      "num_stages": 1,
      "waves_per_eu": 2
    },
    "1546": {
      "BLOCK_M": 64,
      "BLOCK_N": 16,
      "BLOCK_K": 32,
      "BLOCK_C": 32,
      "NUM_KSPLIT": 2,
      "num_warps": 8,
      "num_stages": 2,
      "waves_per_eu": 1
    },
    "4724": {
      "BLOCK_M": 256,
      "BLOCK_N": 16,
      "BLOCK_K": 64,
      "BLOCK_C": 16,
      "NUM_KSPLIT": 4,
      "num_warps": 4,
      "num_stages": 1,
      "waves_per_eu": 2
    },
    "1936": {
      "BLOCK_M": 64,
      "BLOCK_N": 16,
      "BLOCK_K": 64,
      "BLOCK_C": 32,
      "NUM_KSPLIT": 8,
      "num_warps": 4,
      "num_stages": 2,
      "waves_per_eu": 1
    },
    "3793": {
      "BLOCK_M": 128,
      "BLOCK_N": 16,
      "BLOCK_K": 128,
      "BLOCK_C": 64,
      "NUM_KSPLIT": 4,
      "num_warps": 8,
      "num_stages": 1,
      "waves_per_eu": 1
    },
    "805": {
      "BLOCK_M": 32,
      "BLOCK_N": 16,
      "BLOCK_K": 128,
      "BLOCK_C": 32,
      "NUM_KSPLIT": 1,
      "num_warps": 8,
      "num_stages": 1,
      "waves_per_eu": 1
    },
    "1717": {
      "BLOCK_M": 64,
      "BLOCK_N": 16,
      "BLOCK_K": 32,
      "BLOCK_C": 128,
      "NUM_KSPLIT": 8,
      "num_warps": 4,
      "num_stages": 1,
      "waves_per_eu": 1
    },
    "2394": {
      "BLOCK_M": 64,
      "BLOCK_N": 16,
      "BLOCK_K": 128,
      "BLOCK_C": 128,
      "NUM_KSPLIT": 2,
      "num_warps": 2,
      "num_stages": 1,
      "waves_per_eu": 0
    },
    "1970": {
      "BLOCK_M": 64,
      "BLOCK_N": 16,
      "BLOCK_K": 64,
      "BLOCK_C": 64,
      "NUM_KSPLIT": 2,
      "num_warps": 4,
      "num_stages": 1,
      "waves_per_eu": 2
    },
    "5090": {
      "BLOCK_M": 256,
      "BLOCK_N": 16,
      "BLOCK_K": 128,
      "BLOCK_C": 16,
      "NUM_KSPLIT": 4,
      "num_warps": 8,
      "num_stages": 1,
      "waves_per_eu": 2
    },
    "3292": {
      "BLOCK_M": 128,
      "BLOCK_N": 16,
      "BLOCK_K": 64,
      "BLOCK_C": 16,
      "NUM_KSPLIT": 4,
      "num_warps": 8,
      "num_stages": 2,
      "waves_per_eu": 1
    },
    "4917": {
      "BLOCK_M": 256,
      "BLOCK_N": 16,
      "BLOCK_K": 64,
      "BLOCK_C": 128,
      "NUM_KSPLIT": 2,
      "num_warps": 2,
      "num_stages": 2,
      "waves_per_eu": 0
    },
    "2797": {
      "BLOCK_M": 64,
      "BLOCK_N": 16,
      "BLOCK_K": 256,
      "BLOCK_C": 128,
      "NUM_KSPLIT": 8,
      "num_warps": 4,
      "num_stages": 1,
      "waves_per_eu": 1
    },
    "1003": {
      "BLOCK_M": 32,
      "BLOCK_N": 16,
      "BLOCK_K": 128,
      "BLOCK_C": 128,
      "NUM_KSPLIT": 8,
      "num_warps": 8,
      "num_stages": 1,
      "waves_per_eu": 1
    },
    "204": {
      "BLOCK_M": 32,
      "BLOCK_N": 16,
      "BLOCK_K": 32,
      "BLOCK_C": 64,
      "NUM_KSPLIT": 8,
      "num_warps": 4,
      "num_stages": 1,
      "waves_per_eu": 0
    },
    "930": {
      "BLOCK_M": 32,
      "BLOCK_N": 16,
      "BLOCK_K": 128,
      "BLOCK_C": 64,
      "NUM_KSPLIT": 8,
      "num_warps": 8,
      "num_stages": 1,
      "waves_per_eu": 0
    },
    "1135": {
      "BLOCK_M": 32,
      "BLOCK_N": 16,
      "BLOCK_K": 256,
      "BLOCK_C": 16,
      "NUM_KSPLIT": 8,
      "num_warps": 2,
      "num_stages": 1,
      "waves_per_eu": 1
    },
    "3425": {
      "BLOCK_M": 128,
      "BLOCK_N": 16,
      "BLOCK_K": 64,
      "BLOCK_C": 64,
      "NUM_KSPLIT": 4,
      "num_warps": 2,
      "num_stages": 2,
      "waves_per_eu": 2
    },
    "3548": {
      "BLOCK_M": 128,
      "BLOCK_N": 16,
      "BLOCK_K": 64,
      "BLOCK_C": 256,
      "NUM_KSPLIT": 2,
      "num_warps": 2,
      "num_stages": 1,
      "waves_per_eu": 2
    },
    "998": {
      "BLOCK_M": 32,
      "BLOCK_N": 16,
      "BLOCK_K": 128,
      "BLOCK_C": 128,
      "NUM_KSPLIT": 8,
      "num_warps": 4,
      "num_stages": 1,
      "waves_per_eu": 2
    },
    "1912": {
      "BLOCK_M": 64,
      "BLOCK_N": 16,
      "BLOCK_K": 64,
      "BLOCK_C": 32,
      "NUM_KSPLIT": 4,
      "num_warps": 2,
      "num_stages": 2,
      "waves_per_eu": 1
    },
    "460": {
      "BLOCK_M": 32,
      "BLOCK_N": 16,
      "BLOCK_K": 64,
      "BLOCK_C": 32,
      "NUM_KSPLIT": 2,
      "num_warps": 4,
      "num_stages": 2,
      "waves_per_eu": 1
    },
    "5113": {
      "BLOCK_M": 256,
      "BLOCK_N": 16,
      "BLOCK_K": 128,
      "BLOCK_C": 32,
      "NUM_KSPLIT": 1,
      "num_warps": 2,
      "num_stages": 1,
      "waves_per_eu": 1
    },
    "783": {
      "BLOCK_M": 32,
      "BLOCK_N": 16,
      "BLOCK_K": 128,
      "BLOCK_C": 16,
      "NUM_KSPLIT": 8,
      "num_warps": 4,
      "num_stages": 2,
      "waves_per_eu": 0
    },
    "4804": {
      "BLOCK_M": 256,
      "BLOCK_N": 16,
      "BLOCK_K": 64,
      "BLOCK_C": 32,
      "NUM_KSPLIT": 4,
      "num_warps": 8,
      "num_stages": 2,
      "waves_per_eu": 1
    },
    "5434": {
      "BLOCK_M": 256,
      "BLOCK_N": 16,
      "BLOCK_K": 256,
      "BLOCK_C": 16,
      "NUM_KSPLIT": 2,
      "num_warps": 8,
      "num_stages": 2,
      "waves_per_eu": 1
    },
    "1520": {
      "BLOCK_M": 64,
      "BLOCK_N": 16,
      "BLOCK_K": 32,
      "BLOCK_C": 32,
      "NUM_KSPLIT": 1,
      "num_warps": 4,
      "num_stages": 1,
      "waves_per_eu": 2
    },
    "266": {
      "BLOCK_M": 32,
      "BLOCK_N": 16,
      "BLOCK_K": 32,
      "BLOCK_C": 128,
      "NUM_KSPLIT": 4,
      "num_warps": 8,
      "num_stages": 1,
      "waves_per_eu": 2
    },
    "1561": {
      "BLOCK_M": 64,
      "BLOCK_N": 16,
      "BLOCK_K": 32,
      "BLOCK_C": 32,
      "NUM_KSPLIT": 4,
      "num_warps": 8,
      "num_stages": 1,
      "waves_per_eu": 1
    },
    "4706": {
      "BLOCK_M": 256,
      "BLOCK_N": 16,
      "BLOCK_K": 64,
      "BLOCK_C": 16,
      "NUM_KSPLIT": 2,
      "num_warps": 4,
      "num_stages": 1,
      "waves_per_eu": 2
    },
    "3722": {
      "BLOCK_M": 128,
      "BLOCK_N": 16,
      "BLOCK_K": 128,
      "BLOCK_C": 32,
      "NUM_KSPLIT": 4,
      "num_warps": 8,
      "num_stages": 1,
      "waves_per_eu": 2
    },
    "2548": {
      "BLOCK_M": 64,
      "BLOCK_N": 16,
      "BLOCK_K": 256,
      "BLOCK_C": 16,
      "NUM_KSPLIT": 2,
      "num_warps": 4,
      "num_stages": 2,
      "waves_per_eu": 1
    },
    "4061": {
      "BLOCK_M": 128,
      "BLOCK_N": 16,
      "BLOCK_K": 256,
      "BLOCK_C": 32,
      "NUM_KSPLIT": 2,
      "num_warps": 4,
      "num_stages": 2,
      "waves_per_eu": 2
    },
    "3855": {
      "BLOCK_M": 128,
      "BLOCK_N": 16,
      "BLOCK_K": 128,
      "BLOCK_C": 128,
      "NUM_KSPLIT": 4,
      "num_warps": 2,
      "num_stages": 2,
      "waves_per_eu": 0
    },
    "3212": {
      "BLOCK_M": 128,
      "BLOCK_N": 16,
      "BLOCK_K": 32,
      "BLOCK_C": 256,
      "NUM_KSPLIT": 4,
      "num_warps": 4,
      "num_stages": 1,
      "waves_per_eu": 2
    },
    "2371": {
      "BLOCK_M": 64,
      "BLOCK_N": 16,
      "BLOCK_K": 128,
      "BLOCK_C": 64,
      "NUM_KSPLIT": 8,
      "num_warps": 8,
      "num_stages": 1,
      "waves_per_eu": 1
    },
    "3265": {
      "BLOCK_M": 128,
      "BLOCK_N": 16,
      "BLOCK_K": 64,
      "BLOCK_C": 16,
      "NUM_KSPLIT": 2,
      "num_warps": 4,
      "num_stages": 1,
      "waves_per_eu": 1
    },
    "1780": {
      "BLOCK_M": 64,
      "BLOCK_N": 16,
      "BLOCK_K": 32,
      "BLOCK_C": 256,
      "NUM_KSPLIT": 4,
      "num_warps": 8,
      "num_stages": 2,
      "waves_per_eu": 1
    },
    "5542": {
      "BLOCK_M": 256,
      "BLOCK_N": 16,
      "BLOCK_K": 256,
      "BLOCK_C": 32,
      "NUM_KSPLIT": 8,
      "num_warps": 8,
      "num_stages": 2,
      "waves_per_eu": 1
    },
    "3250": {
      "BLOCK_M": 128,
      "BLOCK_N": 16,
      "BLOCK_K": 64,
      "BLOCK_C": 16,
      "NUM_KSPLIT": 1,
      "num_warps": 4,
      "num_stages": 2,
      "waves_per_eu": 1
    },
    "5533": {
      "BLOCK_M": 256,
      "BLOCK_N": 16,
      "BLOCK_K": 256,
      "BLOCK_C": 32,
      "NUM_KSPLIT": 8,
      "num_warps": 4,
      "num_stages": 1,
      "waves_per_eu": 1
    },
    "468": {
      "BLOCK_M": 32,
      "BLOCK_N": 16,
      "BLOCK_K": 64,
      "BLOCK_C": 32,
      "NUM_KSPLIT": 4,
      "num_warps": 2,
      "num_stages": 1,
      "waves_per_eu": 0
    },
    "2584": {
      "BLOCK_M": 64,
      "BLOCK_N": 16,
      "BLOCK_K": 256,
      "BLOCK_C": 16,
      "NUM_KSPLIT": 8,
      "num_warps": 4,
      "num_stages": 2,
      "waves_per_eu": 1
    },
    "2890": {
      "BLOCK_M": 128,
      "BLOCK_N": 16,
      "BLOCK_K": 32,
      "BLOCK_C": 16,
      "NUM_KSPLIT": 1,
      "num_warps": 4,
      "num_stages": 2,
      "waves_per_eu": 1
    },
    "4738": {
      "BLOCK_M": 256,
      "BLOCK_N": 16,
      "BLOCK_K": 64,
      "BLOCK_C": 16,
      "NUM_KSPLIT": 8,
      "num_warps": 2,
      "num_stages": 2,
      "waves_per_eu": 1
    },
    "2244": {
      "BLOCK_M": 64,
      "BLOCK_N": 16,
      "BLOCK_K": 128,
      "BLOCK_C": 32,
      "NUM_KSPLIT": 1,
      "num_warps": 8,
      "num_stages": 1,
      "waves_per_eu": 0
    },
    "4221": {
      "BLOCK_M": 128,
      "BLOCK_N": 16,
      "BLOCK_K": 256,
      "BLOCK_C": 128,
      "NUM_KSPLIT": 4,
      "num_warps": 4,
      "num_stages": 2,
      "waves_per_eu": 0
    },
    "2342": {
      "BLOCK_M": 64,
      "BLOCK_N": 16,
      "BLOCK_K": 128,
      "BLOCK_C": 64,
      "NUM_KSPLIT": 4,
      "num_warps": 2,
      "num_stages": 1,
      "waves_per_eu": 2
    },
    "1318": {
      "BLOCK_M": 32,
      "BLOCK_N": 16,
      "BLOCK_K": 256,
      "BLOCK_C": 128,
      "NUM_KSPLIT": 2,
      "num_warps": 2,
      "num_stages": 2,
      "waves_per_eu": 1
    },
    "766": {
      "BLOCK_M": 32,
      "BLOCK_N": 16,
      "BLOCK_K": 128,
      "BLOCK_C": 16,
      "NUM_KSPLIT": 4,
      "num_warps": 4,
      "num_stages": 2,
      "waves_per_eu": 1
    },
    "2516": {
      "BLOCK_M": 64,
      "BLOCK_N": 16,
      "BLOCK_K": 128,
      "BLOCK_C": 256,
      "NUM_KSPLIT": 8,
      "num_warps": 8,
      "num_stages": 1,
      "waves_per_eu": 2
    },
    "5297": {
      "BLOCK_M": 256,
      "BLOCK_N": 16,
      "BLOCK_K": 128,
      "BLOCK_C": 128,
      "NUM_KSPLIT": 4,
      "num_warps": 2,
      "num_stages": 2,
      "waves_per_eu": 2
    },
    "1636": {
      "BLOCK_M": 64,
      "BLOCK_N": 16,
      "BLOCK_K": 32,
      "BLOCK_C": 64,
      "NUM_KSPLIT": 4,
      "num_warps": 8,
      "num_stages": 2,
      "waves_per_eu": 1
    },
    "3601": {
      "BLOCK_M": 128,
      "BLOCK_N": 16,
      "BLOCK_K": 128,
      "BLOCK_C": 16,
      "NUM_KSPLIT": 1,
      "num_warps": 2,
      "num_stages": 1,
      "waves_per_eu": 1
    },
    "4673": {
      "BLOCK_M": 256,
      "BLOCK_N": 16,
      "BLOCK_K": 32,
      "BLOCK_C": 256,
      "NUM_KSPLIT": 8,
      "num_warps": 4,
      "num_stages": 2,
      "waves_per_eu": 2
    },
    "4509": {
      "BLOCK_M": 256,
      "BLOCK_N": 16,
      "BLOCK_K": 32,
      "BLOCK_C": 64,
      "NUM_KSPLIT": 4,
      "num_warps": 4,
      "num_stages": 2,
      "waves_per_eu": 0
    },
    "1256": {
      "BLOCK_M": 32,
      "BLOCK_N": 16,
      "BLOCK_K": 256,
      "BLOCK_C": 64,
      "NUM_KSPLIT": 2,
      "num_warps": 8,
      "num_stages": 1,
      "waves_per_eu": 2
    },
    "3961": {
      "BLOCK_M": 128,
      "BLOCK_N": 16,
      "BLOCK_K": 256,
      "BLOCK_C": 16,
      "NUM_KSPLIT": 1,
      "num_warps": 2,
      "num_stages": 1,
      "waves_per_eu": 1
    },
    "1951": {
      "BLOCK_M": 64,
      "BLOCK_N": 16,
      "BLOCK_K": 64,
      "BLOCK_C": 64,
      "NUM_KSPLIT": 1,
      "num_warps": 4,
      "num_stages": 1,
      "waves_per_eu": 1
    },
    "2639": {
      "BLOCK_M": 64,
      "BLOCK_N": 16,
      "BLOCK_K": 256,
      "BLOCK_C": 32,
      "NUM_KSPLIT": 4,
      "num_warps": 4,
      "num_stages": 2,
      "waves_per_eu": 2
    },
    "3217": {
      "BLOCK_M": 128,
      "BLOCK_N": 16,
      "BLOCK_K": 32,
      "BLOCK_C": 256,
      "NUM_KSPLIT": 4,
      "num_warps": 8,
      "num_stages": 1,
      "waves_per_eu": 1
    },
    "2831": {
      "BLOCK_M": 64,
      "BLOCK_N": 16,
      "BLOCK_K": 256,
      "BLOCK_C": 256,
      "NUM_KSPLIT": 2,
      "num_warps": 2,
      "num_stages": 2,
      "waves_per_eu": 2
    },
    "1446": {
      "BLOCK_M": 64,
      "BLOCK_N": 16,
      "BLOCK_K": 32,
      "BLOCK_C": 16,
      "NUM_KSPLIT": 1,
      "num_warps": 4,
      "num_stages": 1,
      "waves_per_eu": 0
    },
    "4074": {
      "BLOCK_M": 128,
      "BLOCK_N": 16,
      "BLOCK_K": 256,
      "BLOCK_C": 32,
      "NUM_KSPLIT": 4,
      "num_warps": 4,
      "num_stages": 1,
      "waves_per_eu": 0
    },
    "5622": {
      "BLOCK_M": 256,
      "BLOCK_N": 16,
      "BLOCK_K": 256,
      "BLOCK_C": 128,
      "NUM_KSPLIT": 1,
      "num_warps": 4,
      "num_stages": 1,
      "waves_per_eu": 0
    },
    "4404": {
      "BLOCK_M": 256,
      "BLOCK_N": 16,
      "BLOCK_K": 32,
      "BLOCK_C": 32,
      "NUM_KSPLIT": 1,
      "num_warps": 8,
      "num_stages": 1,
      "waves_per_eu": 0
    },
    "1487": {
      "BLOCK_M": 64,
      "BLOCK_N": 16,
      "BLOCK_K": 32,
      "BLOCK_C": 16,
      "NUM_KSPLIT": 4,
      "num_warps": 4,
      "num_stages": 2,
      "waves_per_eu": 2
    },
    "1897": {
      "BLOCK_M": 64,
      "BLOCK_N": 16,
      "BLOCK_K": 64,
      "BLOCK_C": 32,
      "NUM_KSPLIT": 2,
      "num_warps": 4,
      "num_stages": 1,
      "waves_per_eu": 1
    },
    "3669": {
      "BLOCK_M": 128,
      "BLOCK_N": 16,
      "BLOCK_K": 128,
      "BLOCK_C": 16,
      "NUM_KSPLIT": 8,
      "num_warps": 8,
      "num_stages": 2,
      "waves_per_eu": 0
    },
    "1232": {
      "BLOCK_M": 32,
      "BLOCK_N": 16,
      "BLOCK_K": 256,
      "BLOCK_C": 64,
      "NUM_KSPLIT": 1,
      "num_warps": 4,
      "num_stages": 1,
      "waves_per_eu": 2
    },
    "2929": {
      "BLOCK_M": 128,
      "BLOCK_N": 16,
      "BLOCK_K": 32,
      "BLOCK_C": 16,
      "NUM_KSPLIT": 4,
      "num_warps": 8,
      "num_stages": 1,
      "waves_per_eu": 1
    },
    "2326": {
      "BLOCK_M": 64,
      "BLOCK_N": 16,
      "BLOCK_K": 128,
      "BLOCK_C": 64,
      "NUM_KSPLIT": 2,
      "num_warps": 2,
      "num_stages": 2,
      "waves_per_eu": 1
    },
    "5225": {
      "BLOCK_M": 256,
      "BLOCK_N": 16,
      "BLOCK_K": 128,
      "BLOCK_C": 64,
      "NUM_KSPLIT": 4,
      "num_warps": 2,
      "num_stages": 2,
      "waves_per_eu": 2
    },
    "4441": {
      "BLOCK_M": 256,
      "BLOCK_N": 16,
      "BLOCK_K": 32,
      "BLOCK_C": 32,
      "NUM_KSPLIT": 4,
      "num_warps": 8,
      "num_stages": 1,
      "waves_per_eu": 1
    },
    "4452": {
      "BLOCK_M": 256,
      "BLOCK_N": 16,
      "BLOCK_K": 32,
      "BLOCK_C": 32,
      "NUM_KSPLIT": 8,
      "num_warps": 4,
      "num_stages": 1,
      "waves_per_eu": 0
    },
    "214": {
      "BLOCK_M": 32,
      "BLOCK_N": 16,
      "BLOCK_K": 32,
      "BLOCK_C": 64,
      "NUM_KSPLIT": 8,
      "num_warps": 8,
      "num_stages": 2,
      "waves_per_eu": 1
    },
    "2213": {
      "BLOCK_M": 64,
      "BLOCK_N": 16,
      "BLOCK_K": 128,
      "BLOCK_C": 16,
      "NUM_KSPLIT": 4,
      "num_warps": 8,
      "num_stages": 2,
      "waves_per_eu": 2
    },
    "4646": {
      "BLOCK_M": 256,
      "BLOCK_N": 16,
      "BLOCK_K": 32,
      "BLOCK_C": 256,
      "NUM_KSPLIT": 4,
      "num_warps": 2,
      "num_stages": 1,
      "waves_per_eu": 2
    },
    "54": {
      "BLOCK_M": 32,
      "BLOCK_N": 16,
      "BLOCK_K": 32,
      "BLOCK_C": 16,
      "NUM_KSPLIT": 8,
      "num_warps": 2,
      "num_stages": 1,
      "waves_per_eu": 0
    },
    "3405": {
      "BLOCK_M": 128,
      "BLOCK_N": 16,
      "BLOCK_K": 64,
      "BLOCK_C": 64,
      "NUM_KSPLIT": 2,
      "num_warps": 2,
      "num_stages": 2,
      "waves_per_eu": 0
    },
    "137": {
      "BLOCK_M": 32,
      "BLOCK_N": 16,
      "BLOCK_K": 32,
      "BLOCK_C": 32,
      "NUM_KSPLIT": 8,
      "num_warps": 4,
      "num_stages": 2,
      "waves_per_eu": 2
    },
    "4729": {
      "BLOCK_M": 256,
      "BLOCK_N": 16,
      "BLOCK_K": 64,
      "BLOCK_C": 16,
      "NUM_KSPLIT": 4,
      "num_warps": 8,
      "num_stages": 1,
      "waves_per_eu": 1
    },
    "1776": {
      "BLOCK_M": 64,
      "BLOCK_N": 16,
      "BLOCK_K": 32,
      "BLOCK_C": 256,
      "NUM_KSPLIT": 4,
      "num_warps": 8,
      "num_stages": 1,
      "waves_per_eu": 0
    },
    "2327": {
      "BLOCK_M": 64,
      "BLOCK_N": 16,
      "BLOCK_K": 128,
      "BLOCK_C": 64,
      "NUM_KSPLIT": 2,
      "num_warps": 2,
      "num_stages": 2,
      "waves_per_eu": 2
    },
    "2715": {
      "BLOCK_M": 64,
      "BLOCK_N": 16,
      "BLOCK_K": 256,
      "BLOCK_C": 64,
      "NUM_KSPLIT": 4,
      "num_warps": 8,
      "num_stages": 2,
      "waves_per_eu": 0
    },
    "1276": {
      "BLOCK_M": 32,
      "BLOCK_N": 16,
      "BLOCK_K": 256,
      "BLOCK_C": 64,
      "NUM_KSPLIT": 4,
      "num_warps": 8,
      "num_stages": 2,
      "waves_per_eu": 1
    },
    "5388": {
      "BLOCK_M": 256,
      "BLOCK_N": 16,
      "BLOCK_K": 128,
      "BLOCK_C": 256,
      "NUM_KSPLIT": 8,
      "num_warps": 4,
      "num_stages": 1,
      "waves_per_eu": 0
    },
    "443": {
      "BLOCK_M": 32,
      "BLOCK_N": 16,
      "BLOCK_K": 64,
      "BLOCK_C": 32,
      "NUM_KSPLIT": 1,
      "num_warps": 4,
      "num_stages": 2,
      "waves_per_eu": 2
    },
    "768": {
      "BLOCK_M": 32,
      "BLOCK_N": 16,
      "BLOCK_K": 128,
      "BLOCK_C": 16,
      "NUM_KSPLIT": 4,
      "num_warps": 8,
      "num_stages": 1,
      "waves_per_eu": 0
    },
    "3317": {
      "BLOCK_M": 128,
      "BLOCK_N": 16,
      "BLOCK_K": 64,
      "BLOCK_C": 32,
      "NUM_KSPLIT": 1,
      "num_warps": 2,
      "num_stages": 2,
      "waves_per_eu": 2
    },
    "1407": {
      "BLOCK_M": 32,
      "BLOCK_N": 16,
      "BLOCK_K": 256,
      "BLOCK_C": 256,
      "NUM_KSPLIT": 4,
      "num_warps": 2,
      "num_stages": 2,
      "waves_per_eu": 0
    },
    "3561": {
      "BLOCK_M": 128,
      "BLOCK_N": 16,
      "BLOCK_K": 64,
      "BLOCK_C": 256,
      "NUM_KSPLIT": 2,
      "num_warps": 8,
      "num_stages": 2,
      "waves_per_eu": 0
    },
    "3078": {
      "BLOCK_M": 128,
      "BLOCK_N": 16,
      "BLOCK_K": 32,
      "BLOCK_C": 64,
      "NUM_KSPLIT": 8,
      "num_warps": 2,
      "num_stages": 1,
      "waves_per_eu": 0
    },
    "105": {
      "BLOCK_M": 32,
      "BLOCK_N": 16,
      "BLOCK_K": 32,
      "BLOCK_C": 32,
      "NUM_KSPLIT": 2,
      "num_warps": 8,
      "num_stages": 2,
      "waves_per_eu": 0
    },
    "416": {
      "BLOCK_M": 32,
      "BLOCK_N": 16,
      "BLOCK_K": 64,
      "BLOCK_C": 16,
      "NUM_KSPLIT": 8,
      "num_warps": 2,
      "num_stages": 1,
      "waves_per_eu": 2
    },
    "1774": {
      "BLOCK_M": 64,
      "BLOCK_N": 16,
      "BLOCK_K": 32,
      "BLOCK_C": 256,
      "NUM_KSPLIT": 4,
      "num_warps": 4,
      "num_stages": 2,
      "waves_per_eu": 1
    },
    "4478": {
      "BLOCK_M": 256,
      "BLOCK_N": 16,
      "BLOCK_K": 32,
      "BLOCK_C": 64,
      "NUM_KSPLIT": 1,
      "num_warps": 8,
      "num_stages": 1,
      "waves_per_eu": 2
    },
    "2810": {
      "BLOCK_M": 64,
      "BLOCK_N": 16,
      "BLOCK_K": 256,
      "BLOCK_C": 256,
      "NUM_KSPLIT": 1,
      "num_warps": 2,
      "num_stages": 1,
      "waves_per_eu": 2
    },
    "3511": {
      "BLOCK_M": 128,
      "BLOCK_N": 16,
      "BLOCK_K": 64,
      "BLOCK_C": 128,
      "NUM_KSPLIT": 8,
      "num_warps": 2,
      "num_stages": 1,
      "waves_per_eu": 1
    },
    "5425": {
      "BLOCK_M": 256,
      "BLOCK_N": 16,
      "BLOCK_K": 256,
      "BLOCK_C": 16,
      "NUM_KSPLIT": 2,
      "num_warps": 4,
      "num_stages": 1,
      "waves_per_eu": 1
    },
    "2105": {
      "BLOCK_M": 64,
      "BLOCK_N": 16,
      "BLOCK_K": 64,
      "BLOCK_C": 256,
      "NUM_KSPLIT": 1,
      "num_warps": 8,
      "num_stages": 2,
      "waves_per_eu": 2
    },
    "2315": {
      "BLOCK_M": 64,
      "BLOCK_N": 16,
      "BLOCK_K": 128,
      "BLOCK_C": 64,
      "NUM_KSPLIT": 1,
      "num_warps": 4,
      "num_stages": 2,
      "waves_per_eu": 2
    },
    "1932": {
      "BLOCK_M": 64,
      "BLOCK_N": 16,
      "BLOCK_K": 64,
      "BLOCK_C": 32,
      "NUM_KSPLIT": 8,
      "num_warps": 4,
      "num_stages": 1,
      "waves_per_eu": 0
    },
    "2495": {
      "BLOCK_M": 64,
      "BLOCK_N": 16,
      "BLOCK_K": 128,
      "BLOCK_C": 256,
      "NUM_KSPLIT": 4,
      "num_warps": 4,
      "num_stages": 2,
      "waves_per_eu": 2
    },
    "3566": {
      "BLOCK_M": 128,
      "BLOCK_N": 16,
      "BLOCK_K": 64,
      "BLOCK_C": 256,
      "NUM_KSPLIT": 4,
      "num_warps": 2,
      "num_stages": 1,
      "waves_per_eu": 2
    },
    "1605": {
      "BLOCK_M": 64,
      "BLOCK_N": 16,
      "BLOCK_K": 32,
      "BLOCK_C": 64,
      "NUM_KSPLIT": 2,
      "num_warps": 2,
      "num_stages": 2,
      "waves_per_eu": 0
    },
    "118": {
      "BLOCK_M": 32,
      "BLOCK_N": 16,
      "BLOCK_K": 32,
      "BLOCK_C": 32,
      "NUM_KSPLIT": 4,
      "num_warps": 4,
      "num_stages": 2,
      "waves_per_eu": 1
    },
    "1251": {
      "BLOCK_M": 32,
      "BLOCK_N": 16,
      "BLOCK_K": 256,
      "BLOCK_C": 64,
      "NUM_KSPLIT": 2,
      "num_warps": 4,
      "num_stages": 2,
      "waves_per_eu": 0
    },
    "2273": {
      "BLOCK_M": 64,
      "BLOCK_N": 16,
      "BLOCK_K": 128,
      "BLOCK_C": 32,
      "NUM_KSPLIT": 4,
      "num_warps": 2,
      "num_stages": 2,
      "waves_per_eu": 2
    },
    "2429": {
      "BLOCK_M": 64,
      "BLOCK_N": 16,
      "BLOCK_K": 128,
      "BLOCK_C": 128,
      "NUM_KSPLIT": 4,
      "num_warps": 8,
      "num_stages": 2,
      "waves_per_eu": 2
    },
    "5663": {
      "BLOCK_M": 256,
      "BLOCK_N": 16,
      "BLOCK_K": 256,
      "BLOCK_C": 128,
      "NUM_KSPLIT": 4,
      "num_warps": 4,
      "num_stages": 2,
      "waves_per_eu": 2
    },
    "1759": {
      "BLOCK_M": 64,
      "BLOCK_N": 16,
      "BLOCK_K": 32,
      "BLOCK_C": 256,
      "NUM_KSPLIT": 2,
      "num_warps": 8,
      "num_stages": 1,
      "waves_per_eu": 1
    },
    "4409": {
      "BLOCK_M": 256,
      "BLOCK_N": 16,
      "BLOCK_K": 32,
      "BLOCK_C": 32,
      "NUM_KSPLIT": 1,
      "num_warps": 8,
      "num_stages": 2,
      "waves_per_eu": 2
    },
    "206": {
      "BLOCK_M": 32,
      "BLOCK_N": 16,
      "BLOCK_K": 32,
      "BLOCK_C": 64,
      "NUM_KSPLIT": 8,
      "num_warps": 4,
      "num_stages": 1,
      "waves_per_eu": 2
    },
    "5446": {
      "BLOCK_M": 256,
      "BLOCK_N": 16,
      "BLOCK_K": 256,
      "BLOCK_C": 16,
      "NUM_KSPLIT": 4,
      "num_warps": 4,
      "num_stages": 2,
      "waves_per_eu": 1
    },
    "2709": {
      "BLOCK_M": 64,
      "BLOCK_N": 16,
      "BLOCK_K": 256,
      "BLOCK_C": 64,
      "NUM_KSPLIT": 4,
      "num_warps": 4,
      "num_stages": 2,
      "waves_per_eu": 0
    },
    "582": {
      "BLOCK_M": 32,
      "BLOCK_N": 16,
      "BLOCK_K": 64,
      "BLOCK_C": 128,
      "NUM_KSPLIT": 1,
      "num_warps": 4,
      "num_stages": 1,
      "waves_per_eu": 0
    },
    "2032": {
      "BLOCK_M": 64,
      "BLOCK_N": 16,
      "BLOCK_K": 64,
      "BLOCK_C": 128,
      "NUM_KSPLIT": 1,
      "num_warps": 8,
      "num_stages": 2,
      "waves_per_eu": 1
    },
    "585": {
      "BLOCK_M": 32,
      "BLOCK_N": 16,
      "BLOCK_K": 64,
      "BLOCK_C": 128,
      "NUM_KSPLIT": 1,
      "num_warps": 4,
      "num_stages": 2,
      "waves_per_eu": 0
    },
    "1505": {
      "BLOCK_M": 64,
      "BLOCK_N": 16,
      "BLOCK_K": 32,
      "BLOCK_C": 16,
      "NUM_KSPLIT": 8,
      "num_warps": 4,
      "num_stages": 2,
      "waves_per_eu": 2
    },
    "755": {
      "BLOCK_M": 32,
      "BLOCK_N": 16,
      "BLOCK_K": 128,
      "BLOCK_C": 16,
      "NUM_KSPLIT": 2,
      "num_warps": 8,
      "num_stages": 2,
      "waves_per_eu": 2
    },
    "172": {
      "BLOCK_M": 32,
      "BLOCK_N": 16,
      "BLOCK_K": 32,
      "BLOCK_C": 64,
      "NUM_KSPLIT": 2,
      "num_warps": 4,
      "num_stages": 2,
      "waves_per_eu": 1
    },
    "2644": {
      "BLOCK_M": 64,
      "BLOCK_N": 16,
      "BLOCK_K": 256,
      "BLOCK_C": 32,
      "NUM_KSPLIT": 4,
      "num_warps": 8,
      "num_stages": 2,
      "waves_per_eu": 1
    },
    "947": {
      "BLOCK_M": 32,
      "BLOCK_N": 16,
      "BLOCK_K": 128,
      "BLOCK_C": 128,
      "NUM_KSPLIT": 1,
      "num_warps": 4,
      "num_stages": 2,
      "waves_per_eu": 2
    },
    "4235": {
      "BLOCK_M": 128,
      "BLOCK_N": 16,
      "BLOCK_K": 256,
      "BLOCK_C": 128,
      "NUM_KSPLIT": 8,
      "num_warps": 2,
      "num_stages": 2,
      "waves_per_eu": 2
    },
    "205": {
      "BLOCK_M": 32,
      "BLOCK_N": 16,
      "BLOCK_K": 32,
      "BLOCK_C": 64,
      "NUM_KSPLIT": 8,
      "num_warps": 4,
      "num_stages": 1,
      "waves_per_eu": 1
    },
    "4625": {
      "BLOCK_M": 256,
      "BLOCK_N": 16,
      "BLOCK_K": 32,
      "BLOCK_C": 256,
      "NUM_KSPLIT": 1,
      "num_warps": 8,
      "num_stages": 2,
      "waves_per_eu": 2
    },
    "5085": {
      "BLOCK_M": 256,
      "BLOCK_N": 16,
      "BLOCK_K": 128,
      "BLOCK_C": 16,
      "NUM_KSPLIT": 4,
      "num_warps": 4,
      "num_stages": 2,
      "waves_per_eu": 0
    },
    "4880": {
      "BLOCK_M": 256,
      "BLOCK_N": 16,
      "BLOCK_K": 64,
      "BLOCK_C": 64,
      "NUM_KSPLIT": 8,
      "num_warps": 2,
      "num_stages": 1,
      "waves_per_eu": 2
    },
    "2818": {
      "BLOCK_M": 64,
      "BLOCK_N": 16,
      "BLOCK_K": 256,
      "BLOCK_C": 256,
      "NUM_KSPLIT": 1,
      "num_warps": 4,
      "num_stages": 2,
      "waves_per_eu": 1
    },
    "5600": {
      "BLOCK_M": 256,
      "BLOCK_N": 16,
      "BLOCK_K": 256,
      "BLOCK_C": 64,
      "NUM_KSPLIT": 8,
      "num_warps": 2,
      "num_stages": 1,
      "waves_per_eu": 2
    },
    "1336": {
      "BLOCK_M": 32,
      "BLOCK_N": 16,
      "BLOCK_K": 256,
      "BLOCK_C": 128,
      "NUM_KSPLIT": 4,
      "num_warps": 2,
      "num_stages": 2,
      "waves_per_eu": 1
    },
    "2572": {
      "BLOCK_M": 64,
      "BLOCK_N": 16,
      "BLOCK_K": 256,
      "BLOCK_C": 16,
      "NUM_KSPLIT": 4,
      "num_warps": 8,
      "num_stages": 2,
      "waves_per_eu": 1
    },
    "4517": {
      "BLOCK_M": 256,
      "BLOCK_N": 16,
      "BLOCK_K": 32,
      "BLOCK_C": 64,
      "NUM_KSPLIT": 4,
      "num_warps": 8,
      "num_stages": 2,
      "waves_per_eu": 2
    },
    "5727": {
      "BLOCK_M": 256,
      "BLOCK_N": 16,
      "BLOCK_K": 256,
      "BLOCK_C": 256,
      "NUM_KSPLIT": 4,
      "num_warps": 2,
      "num_stages": 2,
      "waves_per_eu": 0
    },
    "1366": {
      "BLOCK_M": 32,
      "BLOCK_N": 16,
      "BLOCK_K": 256,
      "BLOCK_C": 128,
      "NUM_KSPLIT": 8,
      "num_warps": 8,
      "num_stages": 2,
      "waves_per_eu": 1
    },
    "1398": {
      "BLOCK_M": 32,
      "BLOCK_N": 16,
      "BLOCK_K": 256,
      "BLOCK_C": 256,
      "NUM_KSPLIT": 2,
      "num_warps": 8,
      "num_stages": 1,
      "waves_per_eu": 0
    },
    "4345": {
      "BLOCK_M": 256,
      "BLOCK_N": 16,
      "BLOCK_K": 32,
      "BLOCK_C": 16,
      "NUM_KSPLIT": 2,
      "num_warps": 4,
      "num_stages": 1,
      "waves_per_eu": 1
    },
    "3195": {
      "BLOCK_M": 128,
      "BLOCK_N": 16,
      "BLOCK_K": 32,
      "BLOCK_C": 256,
      "NUM_KSPLIT": 2,
      "num_warps": 4,
      "num_stages": 2,
      "waves_per_eu": 0
    },
    "1303": {
      "BLOCK_M": 32,
      "BLOCK_N": 16,
      "BLOCK_K": 256,
      "BLOCK_C": 128,
      "NUM_KSPLIT": 1,
      "num_warps": 4,
      "num_stages": 1,
      "waves_per_eu": 1
    },
    "4039": {
      "BLOCK_M": 128,
      "BLOCK_N": 16,
      "BLOCK_K": 256,
      "BLOCK_C": 32,
      "NUM_KSPLIT": 1,
      "num_warps": 4,
      "num_stages": 1,
      "waves_per_eu": 1
    },
    "1890": {
      "BLOCK_M": 64,
      "BLOCK_N": 16,
      "BLOCK_K": 64,
      "BLOCK_C": 32,
      "NUM_KSPLIT": 2,
      "num_warps": 2,
      "num_stages": 1,
      "waves_per_eu": 0
    },
    "1603": {
      "BLOCK_M": 64,
      "BLOCK_N": 16,
      "BLOCK_K": 32,
      "BLOCK_C": 64,
      "NUM_KSPLIT": 2,
      "num_warps": 2,
      "num_stages": 1,
      "waves_per_eu": 1
    },
    "2449": {
      "BLOCK_M": 64,
      "BLOCK_N": 16,
      "BLOCK_K": 128,
      "BLOCK_C": 256,
      "NUM_KSPLIT": 1,
      "num_warps": 2,
      "num_stages": 1,
      "waves_per_eu": 1
    },
    "1511": {
      "BLOCK_M": 64,
      "BLOCK_N": 16,
      "BLOCK_K": 32,
      "BLOCK_C": 16,
      "NUM_KSPLIT": 8,
      "num_warps": 8,
      "num_stages": 2,
      "waves_per_eu": 2
    },
    "3782": {
      "BLOCK_M": 128,
      "BLOCK_N": 16,
      "BLOCK_K": 128,
      "BLOCK_C": 64,
      "NUM_KSPLIT": 4,
      "num_warps": 2,
      "num_stages": 1,
      "waves_per_eu": 2
    },
    "4112": {
      "BLOCK_M": 128,
      "BLOCK_N": 16,
      "BLOCK_K": 256,
      "BLOCK_C": 64,
      "NUM_KSPLIT": 1,
      "num_warps": 4,
      "num_stages": 1,
      "waves_per_eu": 2
    },
    "1027": {
      "BLOCK_M": 32,
      "BLOCK_N": 16,
      "BLOCK_K": 128,
      "BLOCK_C": 256,
      "NUM_KSPLIT": 2,
      "num_warps": 2,
      "num_stages": 1,
      "waves_per_eu": 1
    },
    "4128": {
      "BLOCK_M": 128,
      "BLOCK_N": 16,
      "BLOCK_K": 256,
      "BLOCK_C": 64,
      "NUM_KSPLIT": 2,
      "num_warps": 4,
      "num_stages": 1,
      "waves_per_eu": 0
    },
    "3507": {
      "BLOCK_M": 128,
      "BLOCK_N": 16,
      "BLOCK_K": 64,
      "BLOCK_C": 128,
      "NUM_KSPLIT": 4,
      "num_warps": 8,
      "num_stages": 2,
      "waves_per_eu": 0
    },
    "610": {
      "BLOCK_M": 32,
      "BLOCK_N": 16,
      "BLOCK_K": 64,
      "BLOCK_C": 128,
      "NUM_KSPLIT": 2,
      "num_warps": 8,
      "num_stages": 2,
      "waves_per_eu": 1
    },
    "2044": {
      "BLOCK_M": 64,
      "BLOCK_N": 16,
      "BLOCK_K": 64,
      "BLOCK_C": 128,
      "NUM_KSPLIT": 2,
      "num_warps": 4,
      "num_stages": 2,
      "waves_per_eu": 1
    },
    "4617": {
      "BLOCK_M": 256,
      "BLOCK_N": 16,
      "BLOCK_K": 32,
      "BLOCK_C": 256,
      "NUM_KSPLIT": 1,
      "num_warps": 4,
      "num_stages": 2,
      "waves_per_eu": 0
    },
    "5541": {
      "BLOCK_M": 256,
      "BLOCK_N": 16,
      "BLOCK_K": 256,
      "BLOCK_C": 32,
      "NUM_KSPLIT": 8,
      "num_warps": 8,
      "num_stages": 2,
      "waves_per_eu": 0
    },
    "5376": {
      "BLOCK_M": 256,
      "BLOCK_N": 16,
      "BLOCK_K": 128,
      "BLOCK_C": 256,
      "NUM_KSPLIT": 4,
      "num_warps": 8,
      "num_stages": 1,
      "waves_per_eu": 0
    },
    "3725": {
      "BLOCK_M": 128,
      "BLOCK_N": 16,
      "BLOCK_K": 128,
      "BLOCK_C": 32,
      "NUM_KSPLIT": 4,
      "num_warps": 8,
      "num_stages": 2,
      "waves_per_eu": 2
    },
    "774": {
      "BLOCK_M": 32,
      "BLOCK_N": 16,
      "BLOCK_K": 128,
      "BLOCK_C": 16,
      "NUM_KSPLIT": 8,
      "num_warps": 2,
      "num_stages": 1,
      "waves_per_eu": 0
    },
    "1369": {
      "BLOCK_M": 32,
      "BLOCK_N": 16,
      "BLOCK_K": 256,
      "BLOCK_C": 256,
      "NUM_KSPLIT": 1,
      "num_warps": 2,
      "num_stages": 1,
      "waves_per_eu": 1
    },
    "4391": {
      "BLOCK_M": 256,
      "BLOCK_N": 16,
      "BLOCK_K": 32,
      "BLOCK_C": 16,
      "NUM_KSPLIT": 8,
      "num_warps": 8,
      "num_stages": 2,
      "waves_per_eu": 2
    },
    "477": {
      "BLOCK_M": 32,
      "BLOCK_N": 16,
      "BLOCK_K": 64,
      "BLOCK_C": 32,
      "NUM_KSPLIT": 4,
      "num_warps": 4,
      "num_stages": 2,
      "waves_per_eu": 0
    },
    "2588": {
      "BLOCK_M": 64,
      "BLOCK_N": 16,
      "BLOCK_K": 256,
      "BLOCK_C": 16,
      "NUM_KSPLIT": 8,
      "num_warps": 8,
      "num_stages": 1,
      "waves_per_eu": 2
    },
    "2090": {
      "BLOCK_M": 64,
      "BLOCK_N": 16,
      "BLOCK_K": 64,
      "BLOCK_C": 256,
      "NUM_KSPLIT": 1,
      "num_warps": 2,
      "num_stages": 1,
      "waves_per_eu": 2
    },
    "215": {
      "BLOCK_M": 32,
      "BLOCK_N": 16,
      "BLOCK_K": 32,
      "BLOCK_C": 64,
      "NUM_KSPLIT": 8,
      "num_warps": 8,
      "num_stages": 2,
      "waves_per_eu": 2
    },
    "2961": {
      "BLOCK_M": 128,
      "BLOCK_N": 16,
      "BLOCK_K": 32,
      "BLOCK_C": 32,
      "NUM_KSPLIT": 1,
      "num_warps": 4,
      "num_stages": 2,
      "waves_per_eu": 0
    },
    "866": {
      "BLOCK_M": 32,
      "BLOCK_N": 16,
      "BLOCK_K": 128,
      "BLOCK_C": 64,
      "NUM_KSPLIT": 1,
      "num_warps": 2,
      "num_stages": 1,
      "waves_per_eu": 2
    },
    "1748": {
      "BLOCK_M": 64,
      "BLOCK_N": 16,
      "BLOCK_K": 32,
      "BLOCK_C": 256,
      "NUM_KSPLIT": 2,
      "num_warps": 2,
      "num_stages": 1,
      "waves_per_eu": 2
    },
    "5162": {
      "BLOCK_M": 256,
      "BLOCK_N": 16,
      "BLOCK_K": 128,
      "BLOCK_C": 32,
      "NUM_KSPLIT": 4,
      "num_warps": 8,
      "num_stages": 1,
      "waves_per_eu": 2
    },
    "1995": {
      "BLOCK_M": 64,
      "BLOCK_N": 16,
      "BLOCK_K": 64,
      "BLOCK_C": 64,
      "NUM_KSPLIT": 4,
      "num_warps": 8,
      "num_stages": 2,
      "waves_per_eu": 0
    },
    "5426": {
      "BLOCK_M": 256,
      "BLOCK_N": 16,
      "BLOCK_K": 256,
      "BLOCK_C": 16,
      "NUM_KSPLIT": 2,
      "num_warps": 4,
      "num_stages": 1,
      "waves_per_eu": 2
    },
    "3841": {
      "BLOCK_M": 128,
      "BLOCK_N": 16,
      "BLOCK_K": 128,
      "BLOCK_C": 128,
      "NUM_KSPLIT": 2,
      "num_warps": 4,
      "num_stages": 1,
      "waves_per_eu": 1
    },
    "5349": {
      "BLOCK_M": 256,
      "BLOCK_N": 16,
      "BLOCK_K": 128,
      "BLOCK_C": 256,
      "NUM_KSPLIT": 2,
      "num_warps": 2,
      "num_stages": 2,
      "waves_per_eu": 0
    },
    "56": {
      "BLOCK_M": 32,
      "BLOCK_N": 16,
      "BLOCK_K": 32,
      "BLOCK_C": 16,
      "NUM_KSPLIT": 8,
      "num_warps": 2,
      "num_stages": 1,
      "waves_per_eu": 2
    },
    "1411": {
      "BLOCK_M": 32,
      "BLOCK_N": 16,
      "BLOCK_K": 256,
      "BLOCK_C": 256,
      "NUM_KSPLIT": 4,
      "num_warps": 4,
      "num_stages": 1,
      "waves_per_eu": 1
    },
    "4761": {
      "BLOCK_M": 256,
      "BLOCK_N": 16,
      "BLOCK_K": 64,
      "BLOCK_C": 32,
      "NUM_KSPLIT": 1,
      "num_warps": 4,
      "num_stages": 2,
      "waves_per_eu": 0
    },
    "374": {
      "BLOCK_M": 32,
      "BLOCK_N": 16,
      "BLOCK_K": 64,
      "BLOCK_C": 16,
      "NUM_KSPLIT": 1,
      "num_warps": 8,
      "num_stages": 1,
      "waves_per_eu": 2
    },
    "4631": {
      "BLOCK_M": 256,
      "BLOCK_N": 16,
      "BLOCK_K": 32,
      "BLOCK_C": 256,
      "NUM_KSPLIT": 2,
      "num_warps": 2,
      "num_stages": 2,
      "waves_per_eu": 2
    },
    "285": {
      "BLOCK_M": 32,
      "BLOCK_N": 16,
      "BLOCK_K": 32,
      "BLOCK_C": 128,
      "NUM_KSPLIT": 8,
      "num_warps": 8,
      "num_stages": 2,
      "waves_per_eu": 0
    },
    "2304": {
      "BLOCK_M": 64,
      "BLOCK_N": 16,
      "BLOCK_K": 128,
      "BLOCK_C": 64,
      "NUM_KSPLIT": 1,
      "num_warps": 2,
      "num_stages": 1,
      "waves_per_eu": 0
    },
    "256": {
      "BLOCK_M": 32,
      "BLOCK_N": 16,
      "BLOCK_K": 32,
      "BLOCK_C": 128,
      "NUM_KSPLIT": 4,
      "num_warps": 2,
      "num_stages": 2,
      "waves_per_eu": 1
    },
    "4096": {
      "BLOCK_M": 128,
      "BLOCK_N": 16,
      "BLOCK_K": 256,
      "BLOCK_C": 32,
      "NUM_KSPLIT": 8,
      "num_warps": 4,
      "num_stages": 2,
      "waves_per_eu": 1
    },
    "1170": {
      "BLOCK_M": 32,
      "BLOCK_N": 16,
      "BLOCK_K": 256,
      "BLOCK_C": 32,
      "NUM_KSPLIT": 2,
      "num_warps": 2,
      "num_stages": 1,
      "waves_per_eu": 0
    },
    "2988": {
      "BLOCK_M": 128,
      "BLOCK_N": 16,
      "BLOCK_K": 32,
      "BLOCK_C": 32,
      "NUM_KSPLIT": 4,
      "num_warps": 2,
      "num_stages": 1,
      "waves_per_eu": 0
    },
    "221": {
      "BLOCK_M": 32,
      "BLOCK_N": 16,
      "BLOCK_K": 32,
      "BLOCK_C": 128,
      "NUM_KSPLIT": 1,
      "num_warps": 2,
      "num_stages": 2,
      "waves_per_eu": 2
    },
    "4677": {
      "BLOCK_M": 256,
      "BLOCK_N": 16,
      "BLOCK_K": 32,
      "BLOCK_C": 256,
      "NUM_KSPLIT": 8,
      "num_warps": 8,
      "num_stages": 2,
      "waves_per_eu": 0
    },
    "3001": {
      "BLOCK_M": 128,
      "BLOCK_N": 16,
      "BLOCK_K": 32,
      "BLOCK_C": 32,
      "NUM_KSPLIT": 4,
      "num_warps": 8,
      "num_stages": 1,
      "waves_per_eu": 1
    },
    "2751": {
      "BLOCK_M": 64,
      "BLOCK_N": 16,
      "BLOCK_K": 256,
      "BLOCK_C": 128,
      "NUM_KSPLIT": 1,
      "num_warps": 8,
      "num_stages": 2,
      "waves_per_eu": 0
    },
    "167": {
      "BLOCK_M": 32,
      "BLOCK_N": 16,
      "BLOCK_K": 32,
      "BLOCK_C": 64,
      "NUM_KSPLIT": 2,
      "num_warps": 2,
      "num_stages": 2,
      "waves_per_eu": 2
    },
    "5461": {
      "BLOCK_M": 256,
      "BLOCK_N": 16,
      "BLOCK_K": 256,
      "BLOCK_C": 16,
      "NUM_KSPLIT": 8,
      "num_warps": 4,
      "num_stages": 1,
      "waves_per_eu": 1
    },
    "901": {
      "BLOCK_M": 32,
      "BLOCK_N": 16,
      "BLOCK_K": 128,
      "BLOCK_C": 64,
      "NUM_KSPLIT": 4,
      "num_warps": 2,
      "num_stages": 1,
      "waves_per_eu": 1
    },
    "2744": {
      "BLOCK_M": 64,
      "BLOCK_N": 16,
      "BLOCK_K": 256,
      "BLOCK_C": 128,
      "NUM_KSPLIT": 1,
      "num_warps": 4,
      "num_stages": 1,
      "waves_per_eu": 2
    },
    "831": {
      "BLOCK_M": 32,
      "BLOCK_N": 16,
      "BLOCK_K": 128,
      "BLOCK_C": 32,
      "NUM_KSPLIT": 4,
      "num_warps": 2,
      "num_stages": 2,
      "waves_per_eu": 0
    },
    "101": {
      "BLOCK_M": 32,
      "BLOCK_N": 16,
      "BLOCK_K": 32,
      "BLOCK_C": 32,
      "NUM_KSPLIT": 2,
      "num_warps": 4,
      "num_stages": 2,
      "waves_per_eu": 2
    },
    "3436": {
      "BLOCK_M": 128,
      "BLOCK_N": 16,
      "BLOCK_K": 64,
      "BLOCK_C": 64,
      "NUM_KSPLIT": 4,
      "num_warps": 8,
      "num_stages": 2,
      "waves_per_eu": 1
    },
    "566": {
      "BLOCK_M": 32,
      "BLOCK_N": 16,
      "BLOCK_K": 64,
      "BLOCK_C": 64,
      "NUM_KSPLIT": 8,
      "num_warps": 4,
      "num_stages": 1,
      "waves_per_eu": 2
    },
    "1442": {
      "BLOCK_M": 64,
      "BLOCK_N": 16,
      "BLOCK_K": 32,
      "BLOCK_C": 16,
      "NUM_KSPLIT": 1,
      "num_warps": 2,
      "num_stages": 1,
      "waves_per_eu": 2
    },
    "3283": {
      "BLOCK_M": 128,
      "BLOCK_N": 16,
      "BLOCK_K": 64,
      "BLOCK_C": 16,
      "NUM_KSPLIT": 4,
      "num_warps": 4,
      "num_stages": 1,
      "waves_per_eu": 1
    },
    "873": {
      "BLOCK_M": 32,
      "BLOCK_N": 16,
      "BLOCK_K": 128,
      "BLOCK_C": 64,
      "NUM_KSPLIT": 1,
      "num_warps": 4,
      "num_stages": 2,
      "waves_per_eu": 0
    },
    "4443": {
      "BLOCK_M": 256,
      "BLOCK_N": 16,
      "BLOCK_K": 32,
      "BLOCK_C": 32,
      "NUM_KSPLIT": 4,
      "num_warps": 8,
      "num_stages": 2,
      "waves_per_eu": 0
    },
    "5329": {
      "BLOCK_M": 256,
      "BLOCK_N": 16,
      "BLOCK_K": 128,
      "BLOCK_C": 256,
      "NUM_KSPLIT": 1,
      "num_warps": 2,
      "num_stages": 1,
      "waves_per_eu": 1
    },
    "2948": {
      "BLOCK_M": 128,
      "BLOCK_N": 16,
      "BLOCK_K": 32,
      "BLOCK_C": 16,
      "NUM_KSPLIT": 8,
      "num_warps": 8,
      "num_stages": 1,
      "waves_per_eu": 2
    },
    "2093": {
      "BLOCK_M": 64,
      "BLOCK_N": 16,
      "BLOCK_K": 64,
      "BLOCK_C": 256,
      "NUM_KSPLIT": 1,
      "num_warps": 2,
      "num_stages": 2,
      "waves_per_eu": 2
    },
    "3637": {
      "BLOCK_M": 128,
      "BLOCK_N": 16,
      "BLOCK_K": 128,
      "BLOCK_C": 16,
      "NUM_KSPLIT": 4,
      "num_warps": 2,
      "num_stages": 1,
      "waves_per_eu": 1
    },
    "3620": {
      "BLOCK_M": 128,
      "BLOCK_N": 16,
      "BLOCK_K": 128,
      "BLOCK_C": 16,
      "NUM_KSPLIT": 2,
      "num_warps": 2,
      "num_stages": 1,
      "waves_per_eu": 2
    },
    "4370": {
      "BLOCK_M": 256,
      "BLOCK_N": 16,
      "BLOCK_K": 32,
      "BLOCK_C": 16,
      "NUM_KSPLIT": 4,
      "num_warps": 8,
      "num_stages": 1,
      "waves_per_eu": 2
    },
    "4751": {
      "BLOCK_M": 256,
      "BLOCK_N": 16,
      "BLOCK_K": 64,
      "BLOCK_C": 16,
      "NUM_KSPLIT": 8,
      "num_warps": 8,
      "num_stages": 2,
      "waves_per_eu": 2
    },
    "4387": {
      "BLOCK_M": 256,
      "BLOCK_N": 16,
      "BLOCK_K": 32,
      "BLOCK_C": 16,
      "NUM_KSPLIT": 8,
      "num_warps": 8,
      "num_stages": 1,
      "waves_per_eu": 1
    },
    "2952": {
      "BLOCK_M": 128,
      "BLOCK_N": 16,
      "BLOCK_K": 32,
      "BLOCK_C": 32,
      "NUM_KSPLIT": 1,
      "num_warps": 2,
      "num_stages": 1,
      "waves_per_eu": 0
    },
    "4999": {
      "BLOCK_M": 256,
      "BLOCK_N": 16,
      "BLOCK_K": 64,
      "BLOCK_C": 256,
      "NUM_KSPLIT": 2,
      "num_warps": 8,
      "num_stages": 1,
      "waves_per_eu": 1
    },
    "1663": {
      "BLOCK_M": 64,
      "BLOCK_N": 16,
      "BLOCK_K": 32,
      "BLOCK_C": 128,
      "NUM_KSPLIT": 1,
      "num_warps": 4,
      "num_stages": 1,
      "waves_per_eu": 1
    },
    "64": {
      "BLOCK_M": 32,
      "BLOCK_N": 16,
      "BLOCK_K": 32,
      "BLOCK_C": 16,
      "NUM_KSPLIT": 8,
      "num_warps": 4,
      "num_stages": 2,
      "waves_per_eu": 1
    },
    "739": {
      "BLOCK_M": 32,
      "BLOCK_N": 16,
      "BLOCK_K": 128,
      "BLOCK_C": 16,
      "NUM_KSPLIT": 2,
      "num_warps": 2,
      "num_stages": 1,
      "waves_per_eu": 1
    },
    "3491": {
      "BLOCK_M": 128,
      "BLOCK_N": 16,
      "BLOCK_K": 64,
      "BLOCK_C": 128,
      "NUM_KSPLIT": 2,
      "num_warps": 8,
      "num_stages": 2,
      "waves_per_eu": 2
    },
    "3670": {
      "BLOCK_M": 128,
      "BLOCK_N": 16,
      "BLOCK_K": 128,
      "BLOCK_C": 16,
      "NUM_KSPLIT": 8,
      "num_warps": 8,
      "num_stages": 2,
      "waves_per_eu": 1
    },
    "286": {
      "BLOCK_M": 32,
      "BLOCK_N": 16,
      "BLOCK_K": 32,
      "BLOCK_C": 128,
      "NUM_KSPLIT": 8,
      "num_warps": 8,
      "num_stages": 2,
      "waves_per_eu": 1
    },
    "3190": {
      "BLOCK_M": 128,
      "BLOCK_N": 16,
      "BLOCK_K": 32,
      "BLOCK_C": 256,
      "NUM_KSPLIT": 2,
      "num_warps": 2,
      "num_stages": 2,
      "waves_per_eu": 1
    },
    "4353": {
      "BLOCK_M": 256,
      "BLOCK_N": 16,
      "BLOCK_K": 32,
      "BLOCK_C": 16,
      "NUM_KSPLIT": 2,
      "num_warps": 8,
      "num_stages": 2,
      "waves_per_eu": 0
    },
    "2284": {
      "BLOCK_M": 64,
      "BLOCK_N": 16,
      "BLOCK_K": 128,
      "BLOCK_C": 32,
      "NUM_KSPLIT": 4,
      "num_warps": 8,
      "num_stages": 2,
      "waves_per_eu": 1
    },
    "2387": {
      "BLOCK_M": 64,
      "BLOCK_N": 16,
      "BLOCK_K": 128,
      "BLOCK_C": 128,
      "NUM_KSPLIT": 1,
      "num_warps": 4,
      "num_stages": 2,
      "waves_per_eu": 2
    },
    "3082": {
      "BLOCK_M": 128,
      "BLOCK_N": 16,
      "BLOCK_K": 32,
      "BLOCK_C": 64,
      "NUM_KSPLIT": 8,
      "num_warps": 2,
      "num_stages": 2,
      "waves_per_eu": 1
    },
    "2692": {
      "BLOCK_M": 64,
      "BLOCK_N": 16,
      "BLOCK_K": 256,
      "BLOCK_C": 64,
      "NUM_KSPLIT": 2,
      "num_warps": 4,
      "num_stages": 2,
      "waves_per_eu": 1
    },
    "1401": {
      "BLOCK_M": 32,
      "BLOCK_N": 16,
      "BLOCK_K": 256,
      "BLOCK_C": 256,
      "NUM_KSPLIT": 2,
      "num_warps": 8,
      "num_stages": 2,
      "waves_per_eu": 0
    },
    "2836": {
      "BLOCK_M": 64,
      "BLOCK_N": 16,
      "BLOCK_K": 256,
      "BLOCK_C": 256,
      "NUM_KSPLIT": 2,
      "num_warps": 4,
      "num_stages": 2,
      "waves_per_eu": 1
    },
    "432": {
      "BLOCK_M": 32,
      "BLOCK_N": 16,
      "BLOCK_K": 64,
      "BLOCK_C": 32,
      "NUM_KSPLIT": 1,
      "num_warps": 2,
      "num_stages": 1,
      "waves_per_eu": 0
    },
    "3964": {
      "BLOCK_M": 128,
      "BLOCK_N": 16,
      "BLOCK_K": 256,
      "BLOCK_C": 16,
      "NUM_KSPLIT": 1,
      "num_warps": 2,
      "num_stages": 2,
      "waves_per_eu": 1
    },
    "3666": {
      "BLOCK_M": 128,
      "BLOCK_N": 16,
      "BLOCK_K": 128,
      "BLOCK_C": 16,
      "NUM_KSPLIT": 8,
      "num_warps": 8,
      "num_stages": 1,
      "waves_per_eu": 0
    },
    "957": {
      "BLOCK_M": 32,
      "BLOCK_N": 16,
      "BLOCK_K": 128,
      "BLOCK_C": 128,
      "NUM_KSPLIT": 2,
      "num_warps": 2,
      "num_stages": 2,
      "waves_per_eu": 0
    },
    "5518": {
      "BLOCK_M": 256,
      "BLOCK_N": 16,
      "BLOCK_K": 256,
      "BLOCK_C": 32,
      "NUM_KSPLIT": 4,
      "num_warps": 4,
      "num_stages": 2,
      "waves_per_eu": 1
    },
    "5385": {
      "BLOCK_M": 256,
      "BLOCK_N": 16,
      "BLOCK_K": 128,
      "BLOCK_C": 256,
      "NUM_KSPLIT": 8,
      "num_warps": 2,
      "num_stages": 2,
      "waves_per_eu": 0
    },
    "5390": {
      "BLOCK_M": 256,
      "BLOCK_N": 16,
      "BLOCK_K": 128,
      "BLOCK_C": 256,
      "NUM_KSPLIT": 8,
      "num_warps": 4,
      "num_stages": 1,
      "waves_per_eu": 2
    },
    "2802": {
      "BLOCK_M": 64,
      "BLOCK_N": 16,
      "BLOCK_K": 256,
      "BLOCK_C": 128,
      "NUM_KSPLIT": 8,
      "num_warps": 8,
      "num_stages": 1,
      "waves_per_eu": 0
    },
    "1474": {
      "BLOCK_M": 64,
      "BLOCK_N": 16,
      "BLOCK_K": 32,
      "BLOCK_C": 16,
      "NUM_KSPLIT": 2,
      "num_warps": 8,
      "num_stages": 2,
      "waves_per_eu": 1
    },
    "894": {
      "BLOCK_M": 32,
      "BLOCK_N": 16,
      "BLOCK_K": 128,
      "BLOCK_C": 64,
      "NUM_KSPLIT": 2,
      "num_warps": 8,
      "num_stages": 1,
      "waves_per_eu": 0
    },
    "1875": {
      "BLOCK_M": 64,
      "BLOCK_N": 16,
      "BLOCK_K": 64,
      "BLOCK_C": 32,
      "NUM_KSPLIT": 1,
      "num_warps": 2,
      "num_stages": 2,
      "waves_per_eu": 0
    },
    "5603": {
