tuning_results_mhc/gfx950/raw_tuner_outputs/tested_configs_mhc_fused_mhc_sk20_M2048_n4_C128.json
{
  "kernel": "fused_mhc",
  "M": 2048,
  "n": 4,
  "C": 128,
  "sinkhorn_iters": 20,
  "config_file": "tuning_results/tuning_space_mhc.json",
  "tested_configs_successful": {
    "5017": {
      "BLOCK_M": 256,
      "BLOCK_N": 16,
      "BLOCK_K": 64,
      "BLOCK_C": 256,
      "NUM_KSPLIT": 4,
      "num_warps": 8,
      "num_stages": 1,
      "waves_per_eu": 1
    },
    "2395": {
      "BLOCK_M": 64,
      "BLOCK_N": 16,
      "BLOCK_K": 128,
      "BLOCK_C": 128,
      "NUM_KSPLIT": 2,
      "num_warps": 2,
      "num_stages": 1,
      "waves_per_eu": 1
    },
    "5559": {
      "BLOCK_M": 256,
      "BLOCK_N": 16,
      "BLOCK_K": 256,
      "BLOCK_C": 64,
      "NUM_KSPLIT": 1,
      "num_warps": 8,
      "num_stages": 2,
      "waves_per_eu": 0
    },
    "4169": {
      "BLOCK_M": 128,
      "BLOCK_N": 16,
      "BLOCK_K": 256,
      "BLOCK_C": 64,
      "NUM_KSPLIT": 8,
      "num_warps": 4,
      "num_stages": 2,
      "waves_per_eu": 2
    },
    "4707": {
      "BLOCK_M": 256,
      "BLOCK_N": 16,
      "BLOCK_K": 64,
      "BLOCK_C": 16,
      "NUM_KSPLIT": 2,
      "num_warps": 4,
      "num_stages": 2,
      "waves_per_eu": 0
    },
    "1839": {
      "BLOCK_M": 64,
      "BLOCK_N": 16,
      "BLOCK_K": 64,
      "BLOCK_C": 16,
      "NUM_KSPLIT": 4,
      "num_warps": 2,
      "num_stages": 2,
      "waves_per_eu": 0
    },
    "2995": {
      "BLOCK_M": 128,
      "BLOCK_N": 16,
      "BLOCK_K": 32,
      "BLOCK_C": 32,
      "NUM_KSPLIT": 4,
      "num_warps": 4,
      "num_stages": 1,
      "waves_per_eu": 1
    },
    "3263": {
      "BLOCK_M": 128,
      "BLOCK_N": 16,
      "BLOCK_K": 64,
      "BLOCK_C": 16,
      "NUM_KSPLIT": 2,
      "num_warps": 2,
      "num_stages": 2,
      "waves_per_eu": 2
    },
    "4216": {
      "BLOCK_M": 128,
      "BLOCK_N": 16,
      "BLOCK_K": 256,
      "BLOCK_C": 128,
      "NUM_KSPLIT": 4,
      "num_warps": 2,
      "num_stages": 2,
      "waves_per_eu": 1
    },
    "5210": {
      "BLOCK_M": 256,
      "BLOCK_N": 16,
      "BLOCK_K": 128,
      "BLOCK_C": 64,
      "NUM_KSPLIT": 2,
      "num_warps": 4,
      "num_stages": 1,
      "waves_per_eu": 2
    },
    "5141": {
      "BLOCK_M": 256,
      "BLOCK_N": 16,
      "BLOCK_K": 128,
      "BLOCK_C": 32,
      "NUM_KSPLIT": 2,
      "num_warps": 4,
      "num_stages": 2,
      "waves_per_eu": 2
    },
    "1077": {
      "BLOCK_M": 32,
      "BLOCK_N": 16,
      "BLOCK_K": 128,
      "BLOCK_C": 256,
      "NUM_KSPLIT": 8,
      "num_warps": 8,
      "num_stages": 2,
      "waves_per_eu": 0
    },
    "4991": {
      "BLOCK_M": 256,
      "BLOCK_N": 16,
      "BLOCK_K": 64,
      "BLOCK_C": 256,
      "NUM_KSPLIT": 2,
      "num_warps": 2,
      "num_stages": 2,
      "waves_per_eu": 2
    },
    "370": {
      "BLOCK_M": 32,
      "BLOCK_N": 16,
      "BLOCK_K": 64,
      "BLOCK_C": 16,
      "NUM_KSPLIT": 1,
      "num_warps": 4,
      "num_stages": 2,
      "waves_per_eu": 1
    },
    "3664": {
      "BLOCK_M": 128,
      "BLOCK_N": 16,
      "BLOCK_K": 128,
      "BLOCK_C": 16,
      "NUM_KSPLIT": 8,
      "num_warps": 4,
      "num_stages": 2,
      "waves_per_eu": 1
    },
    "4341": {
      "BLOCK_M": 256,
      "BLOCK_N": 16,
      "BLOCK_K": 32,
      "BLOCK_C": 16,
      "NUM_KSPLIT": 2,
      "num_warps": 2,
      "num_stages": 2,
      "waves_per_eu": 0
    },
    "2243": {
      "BLOCK_M": 64,
      "BLOCK_N": 16,
      "BLOCK_K": 128,
      "BLOCK_C": 32,
      "NUM_KSPLIT": 1,
      "num_warps": 4,
      "num_stages": 2,
      "waves_per_eu": 2
    },
    "2905": {
      "BLOCK_M": 128,
      "BLOCK_N": 16,
      "BLOCK_K": 32,
      "BLOCK_C": 16,
      "NUM_KSPLIT": 2,
      "num_warps": 4,
      "num_stages": 1,
      "waves_per_eu": 1
    },
    "4437": {
      "BLOCK_M": 256,
      "BLOCK_N": 16,
      "BLOCK_K": 32,
      "BLOCK_C": 32,
      "NUM_KSPLIT": 4,
      "num_warps": 4,
      "num_stages": 2,
      "waves_per_eu": 0
    },
    "1295": {
      "BLOCK_M": 32,
      "BLOCK_N": 16,
      "BLOCK_K": 256,
      "BLOCK_C": 64,
      "NUM_KSPLIT": 8,
      "num_warps": 8,
      "num_stages": 2,
      "waves_per_eu": 2
    },
    "836": {
      "BLOCK_M": 32,
      "BLOCK_N": 16,
      "BLOCK_K": 128,
      "BLOCK_C": 32,
      "NUM_KSPLIT": 4,
      "num_warps": 4,
      "num_stages": 1,
      "waves_per_eu": 2
    },
    "1468": {
      "BLOCK_M": 64,
      "BLOCK_N": 16,
      "BLOCK_K": 32,
      "BLOCK_C": 16,
      "NUM_KSPLIT": 2,
      "num_warps": 4,
      "num_stages": 2,
      "waves_per_eu": 1
    },
    "2170": {
      "BLOCK_M": 64,
      "BLOCK_N": 16,
      "BLOCK_K": 128,
      "BLOCK_C": 16,
      "NUM_KSPLIT": 1,
      "num_warps": 4,
      "num_stages": 2,
      "waves_per_eu": 1
    },
    "481": {
      "BLOCK_M": 32,
      "BLOCK_N": 16,
      "BLOCK_K": 64,
      "BLOCK_C": 32,
      "NUM_KSPLIT": 4,
      "num_warps": 8,
      "num_stages": 1,
      "waves_per_eu": 1
    },
    "2248": {
      "BLOCK_M": 64,
      "BLOCK_N": 16,
      "BLOCK_K": 128,
      "BLOCK_C": 32,
      "NUM_KSPLIT": 1,
      "num_warps": 8,
      "num_stages": 2,
      "waves_per_eu": 1
    },
    "3581": {
      "BLOCK_M": 128,
      "BLOCK_N": 16,
      "BLOCK_K": 64,
      "BLOCK_C": 256,
      "NUM_KSPLIT": 4,
      "num_warps": 8,
      "num_stages": 2,
      "waves_per_eu": 2
    },
    "86": {
      "BLOCK_M": 32,
      "BLOCK_N": 16,
      "BLOCK_K": 32,
      "BLOCK_C": 32,
      "NUM_KSPLIT": 1,
      "num_warps": 8,
      "num_stages": 1,
      "waves_per_eu": 2
    },
    "4187": {
      "BLOCK_M": 128,
      "BLOCK_N": 16,
      "BLOCK_K": 256,
      "BLOCK_C": 128,
      "NUM_KSPLIT": 1,
      "num_warps": 4,
      "num_stages": 2,
      "waves_per_eu": 2
    },
    "3179": {
      "BLOCK_M": 128,
      "BLOCK_N": 16,
      "BLOCK_K": 32,
      "BLOCK_C": 256,
      "NUM_KSPLIT": 1,
      "num_warps": 4,
      "num_stages": 2,
      "waves_per_eu": 2
    },
    "5078": {
      "BLOCK_M": 256,
      "BLOCK_N": 16,
      "BLOCK_K": 128,
      "BLOCK_C": 16,
      "NUM_KSPLIT": 4,
      "num_warps": 2,
      "num_stages": 1,
      "waves_per_eu": 2
    },
    "2351": {
      "BLOCK_M": 64,
      "BLOCK_N": 16,
      "BLOCK_K": 128,
      "BLOCK_C": 64,
      "NUM_KSPLIT": 4,
      "num_warps": 4,
      "num_stages": 2,
      "waves_per_eu": 2
    },
    "2884": {
      "BLOCK_M": 128,
      "BLOCK_N": 16,
      "BLOCK_K": 32,
      "BLOCK_C": 16,
      "NUM_KSPLIT": 1,
      "num_warps": 2,
      "num_stages": 2,
      "waves_per_eu": 1
    },
    "5527": {
      "BLOCK_M": 256,
      "BLOCK_N": 16,
      "BLOCK_K": 256,
      "BLOCK_C": 32,
      "NUM_KSPLIT": 8,
      "num_warps": 2,
      "num_stages": 1,
      "waves_per_eu": 1
    },
    "2873": {
      "BLOCK_M": 64,
      "BLOCK_N": 16,
      "BLOCK_K": 256,
      "BLOCK_C": 256,
      "NUM_KSPLIT": 8,
      "num_warps": 4,
      "num_stages": 2,
      "waves_per_eu": 2
    },
    "959": {
      "BLOCK_M": 32,
      "BLOCK_N": 16,
      "BLOCK_K": 128,
      "BLOCK_C": 128,
      "NUM_KSPLIT": 2,
      "num_warps": 2,
      "num_stages": 2,
      "waves_per_eu": 2
    },
    "1076": {
      "BLOCK_M": 32,
      "BLOCK_N": 16,
      "BLOCK_K": 128,
      "BLOCK_C": 256,
      "NUM_KSPLIT": 8,
      "num_warps": 8,
      "num_stages": 1,
      "waves_per_eu": 2
    },
    "1129": {
      "BLOCK_M": 32,
      "BLOCK_N": 16,
      "BLOCK_K": 256,
      "BLOCK_C": 16,
      "NUM_KSPLIT": 4,
      "num_warps": 8,
      "num_stages": 1,
      "waves_per_eu": 1
    },
    "4740": {
      "BLOCK_M": 256,
      "BLOCK_N": 16,
      "BLOCK_K": 64,
      "BLOCK_C": 16,
      "NUM_KSPLIT": 8,
      "num_warps": 4,
      "num_stages": 1,
      "waves_per_eu": 0
    },
    "1455": {
      "BLOCK_M": 64,
      "BLOCK_N": 16,
      "BLOCK_K": 32,
      "BLOCK_C": 16,
      "NUM_KSPLIT": 1,
      "num_warps": 8,
      "num_stages": 2,
      "waves_per_eu": 0
    },
    "1980": {
      "BLOCK_M": 64,
      "BLOCK_N": 16,
      "BLOCK_K": 64,
      "BLOCK_C": 64,
      "NUM_KSPLIT": 4,
      "num_warps": 2,
      "num_stages": 1,
      "waves_per_eu": 0
    },
    "4096": {
      "BLOCK_M": 128,
      "BLOCK_N": 16,
      "BLOCK_K": 256,
      "BLOCK_C": 32,
      "NUM_KSPLIT": 8,
      "num_warps": 4,
      "num_stages": 2,
      "waves_per_eu": 1
    },
    "3325": {
      "BLOCK_M": 128,
      "BLOCK_N": 16,
      "BLOCK_K": 64,
      "BLOCK_C": 32,
      "NUM_KSPLIT": 1,
      "num_warps": 8,
      "num_stages": 1,
      "waves_per_eu": 1
    },
    "266": {
      "BLOCK_M": 32,
      "BLOCK_N": 16,
      "BLOCK_K": 32,
      "BLOCK_C": 128,
      "NUM_KSPLIT": 4,
      "num_warps": 8,
      "num_stages": 1,
      "waves_per_eu": 2
    },
    "2435": {
      "BLOCK_M": 64,
      "BLOCK_N": 16,
      "BLOCK_K": 128,
      "BLOCK_C": 128,
      "NUM_KSPLIT": 8,
      "num_warps": 2,
      "num_stages": 2,
      "waves_per_eu": 2
    },
    "2706": {
      "BLOCK_M": 64,
      "BLOCK_N": 16,
      "BLOCK_K": 256,
      "BLOCK_C": 64,
      "NUM_KSPLIT": 4,
      "num_warps": 4,
      "num_stages": 1,
      "waves_per_eu": 0
    },
    "3811": {
      "BLOCK_M": 128,
      "BLOCK_N": 16,
      "BLOCK_K": 128,
      "BLOCK_C": 64,
      "NUM_KSPLIT": 8,
      "num_warps": 8,
      "num_stages": 1,
      "waves_per_eu": 1
    },
    "4215": {
      "BLOCK_M": 128,
      "BLOCK_N": 16,
      "BLOCK_K": 256,
      "BLOCK_C": 128,
      "NUM_KSPLIT": 4,
      "num_warps": 2,
      "num_stages": 2,
      "waves_per_eu": 0
    },
    "3189": {
      "BLOCK_M": 128,
      "BLOCK_N": 16,
      "BLOCK_K": 32,
      "BLOCK_C": 256,
      "NUM_KSPLIT": 2,
      "num_warps": 2,
      "num_stages": 2,
      "waves_per_eu": 0
    },
    "2855": {
      "BLOCK_M": 64,
      "BLOCK_N": 16,
      "BLOCK_K": 256,
      "BLOCK_C": 256,
      "NUM_KSPLIT": 4,
      "num_warps": 4,
      "num_stages": 2,
      "waves_per_eu": 2
    },
    "3044": {
      "BLOCK_M": 128,
      "BLOCK_N": 16,
      "BLOCK_K": 32,
      "BLOCK_C": 64,
      "NUM_KSPLIT": 2,
      "num_warps": 2,
      "num_stages": 1,
      "waves_per_eu": 2
    },
    "1274": {
      "BLOCK_M": 32,
      "BLOCK_N": 16,
      "BLOCK_K": 256,
      "BLOCK_C": 64,
      "NUM_KSPLIT": 4,
      "num_warps": 8,
      "num_stages": 1,
      "waves_per_eu": 2
    },
    "2131": {
      "BLOCK_M": 64,
      "BLOCK_N": 16,
      "BLOCK_K": 64,
      "BLOCK_C": 256,
      "NUM_KSPLIT": 4,
      "num_warps": 4,
      "num_stages": 1,
      "waves_per_eu": 1
    },
    "2059": {
      "BLOCK_M": 64,
      "BLOCK_N": 16,
      "BLOCK_K": 64,
      "BLOCK_C": 128,
      "NUM_KSPLIT": 4,
      "num_warps": 4,
      "num_stages": 1,
      "waves_per_eu": 1
    },
    "637": {
      "BLOCK_M": 32,
      "BLOCK_N": 16,
      "BLOCK_K": 64,
      "BLOCK_C": 128,
      "NUM_KSPLIT": 8,
      "num_warps": 4,
      "num_stages": 1,
      "waves_per_eu": 1
    },
    "2810": {
      "BLOCK_M": 64,
      "BLOCK_N": 16,
      "BLOCK_K": 256,
      "BLOCK_C": 256,
      "NUM_KSPLIT": 1,
      "num_warps": 2,
      "num_stages": 1,
      "waves_per_eu": 2
    },
    "1124": {
      "BLOCK_M": 32,
      "BLOCK_N": 16,
      "BLOCK_K": 256,
      "BLOCK_C": 16,
      "NUM_KSPLIT": 4,
      "num_warps": 4,
      "num_stages": 1,
      "waves_per_eu": 2
    },
    "3359": {
      "BLOCK_M": 128,
      "BLOCK_N": 16,
      "BLOCK_K": 64,
      "BLOCK_C": 32,
      "NUM_KSPLIT": 4,
      "num_warps": 4,
      "num_stages": 2,
      "waves_per_eu": 2
    },
    "3608": {
      "BLOCK_M": 128,
      "BLOCK_N": 16,
      "BLOCK_K": 128,
      "BLOCK_C": 16,
      "NUM_KSPLIT": 1,
      "num_warps": 4,
      "num_stages": 1,
      "waves_per_eu": 2
    },
    "4441": {
      "BLOCK_M": 256,
      "BLOCK_N": 16,
      "BLOCK_K": 32,
      "BLOCK_C": 32,
      "NUM_KSPLIT": 4,
      "num_warps": 8,
      "num_stages": 1,
      "waves_per_eu": 1
    },
    "5340": {
      "BLOCK_M": 256,
      "BLOCK_N": 16,
      "BLOCK_K": 128,
      "BLOCK_C": 256,
      "NUM_KSPLIT": 1,
      "num_warps": 8,
      "num_stages": 1,
      "waves_per_eu": 0
    },
    "2455": {
      "BLOCK_M": 64,
      "BLOCK_N": 16,
      "BLOCK_K": 128,
      "BLOCK_C": 256,
      "NUM_KSPLIT": 1,
      "num_warps": 4,
      "num_stages": 1,
      "waves_per_eu": 1
    },
    "1561": {
      "BLOCK_M": 64,
      "BLOCK_N": 16,
      "BLOCK_K": 32,
      "BLOCK_C": 32,
      "NUM_KSPLIT": 4,
      "num_warps": 8,
      "num_stages": 1,
      "waves_per_eu": 1
    },
    "3764": {
      "BLOCK_M": 128,
      "BLOCK_N": 16,
      "BLOCK_K": 128,
      "BLOCK_C": 64,
      "NUM_KSPLIT": 2,
      "num_warps": 2,
      "num_stages": 1,
      "waves_per_eu": 2
    },
    "1759": {
      "BLOCK_M": 64,
      "BLOCK_N": 16,
      "BLOCK_K": 32,
      "BLOCK_C": 256,
      "NUM_KSPLIT": 2,
      "num_warps": 8,
      "num_stages": 1,
      "waves_per_eu": 1
    },
    "589": {
      "BLOCK_M": 32,
      "BLOCK_N": 16,
      "BLOCK_K": 64,
      "BLOCK_C": 128,
      "NUM_KSPLIT": 1,
      "num_warps": 8,
      "num_stages": 1,
      "waves_per_eu": 1
    },
    "4931": {
      "BLOCK_M": 256,
      "BLOCK_N": 16,
      "BLOCK_K": 64,
      "BLOCK_C": 128,
      "NUM_KSPLIT": 2,
      "num_warps": 8,
      "num_stages": 2,
      "waves_per_eu": 2
    },
    "1082": {
      "BLOCK_M": 32,
      "BLOCK_N": 16,
      "BLOCK_K": 256,
      "BLOCK_C": 16,
      "NUM_KSPLIT": 1,
      "num_warps": 2,
      "num_stages": 1,
      "waves_per_eu": 2
    },
    "5090": {
      "BLOCK_M": 256,
      "BLOCK_N": 16,
      "BLOCK_K": 128,
      "BLOCK_C": 16,
      "NUM_KSPLIT": 4,
      "num_warps": 8,
      "num_stages": 1,
      "waves_per_eu": 2
    },
    "3329": {
      "BLOCK_M": 128,
      "BLOCK_N": 16,
      "BLOCK_K": 64,
      "BLOCK_C": 32,
      "NUM_KSPLIT": 1,
      "num_warps": 8,
      "num_stages": 2,
      "waves_per_eu": 2
    },
    "4197": {
      "BLOCK_M": 128,
      "BLOCK_N": 16,
      "BLOCK_K": 256,
      "BLOCK_C": 128,
      "NUM_KSPLIT": 2,
      "num_warps": 2,
      "num_stages": 2,
      "waves_per_eu": 0
    },
    "4462": {
      "BLOCK_M": 256,
      "BLOCK_N": 16,
      "BLOCK_K": 32,
      "BLOCK_C": 32,
      "NUM_KSPLIT": 8,
      "num_warps": 8,
      "num_stages": 2,
      "waves_per_eu": 1
    },
    "2960": {
      "BLOCK_M": 128,
      "BLOCK_N": 16,
      "BLOCK_K": 32,
      "BLOCK_C": 32,
      "NUM_KSPLIT": 1,
      "num_warps": 4,
      "num_stages": 1,
      "waves_per_eu": 2
    },
    "2140": {
      "BLOCK_M": 64,
      "BLOCK_N": 16,
      "BLOCK_K": 64,
      "BLOCK_C": 256,
      "NUM_KSPLIT": 4,
      "num_warps": 8,
      "num_stages": 2,
      "waves_per_eu": 1
    },
    "1388": {
      "BLOCK_M": 32,
      "BLOCK_N": 16,
      "BLOCK_K": 256,
      "BLOCK_C": 256,
      "NUM_KSPLIT": 2,
      "num_warps": 2,
      "num_stages": 1,
      "waves_per_eu": 2
    },
    "511": {
      "BLOCK_M": 32,
      "BLOCK_N": 16,
      "BLOCK_K": 64,
      "BLOCK_C": 64,
      "NUM_KSPLIT": 1,
      "num_warps": 4,
      "num_stages": 1,
      "waves_per_eu": 1
    },
    "2943": {
      "BLOCK_M": 128,
      "BLOCK_N": 16,
      "BLOCK_K": 32,
      "BLOCK_C": 16,
      "NUM_KSPLIT": 8,
      "num_warps": 4,
      "num_stages": 2,
      "waves_per_eu": 0
    },
    "3416": {
      "BLOCK_M": 128,
      "BLOCK_N": 16,
      "BLOCK_K": 64,
      "BLOCK_C": 64,
      "NUM_KSPLIT": 2,
      "num_warps": 8,
      "num_stages": 1,
      "waves_per_eu": 2
    },
    "1528": {
      "BLOCK_M": 64,
      "BLOCK_N": 16,
      "BLOCK_K": 32,
      "BLOCK_C": 32,
      "NUM_KSPLIT": 1,
      "num_warps": 8,
      "num_stages": 2,
      "waves_per_eu": 1
    },
    "5659": {
      "BLOCK_M": 256,
      "BLOCK_N": 16,
      "BLOCK_K": 256,
      "BLOCK_C": 128,
      "NUM_KSPLIT": 4,
      "num_warps": 4,
      "num_stages": 1,
      "waves_per_eu": 1
    },
    "3736": {
      "BLOCK_M": 128,
      "BLOCK_N": 16,
      "BLOCK_K": 128,
      "BLOCK_C": 32,
      "NUM_KSPLIT": 8,
      "num_warps": 4,
      "num_stages": 2,
      "waves_per_eu": 1
    },
    "3244": {
      "BLOCK_M": 128,
      "BLOCK_N": 16,
      "BLOCK_K": 64,
      "BLOCK_C": 16,
      "NUM_KSPLIT": 1,
      "num_warps": 2,
      "num_stages": 2,
      "waves_per_eu": 1
    },
    "50": {
      "BLOCK_M": 32,
      "BLOCK_N": 16,
      "BLOCK_K": 32,
      "BLOCK_C": 16,
      "NUM_KSPLIT": 4,
      "num_warps": 8,
      "num_stages": 1,
      "waves_per_eu": 2
    },
    "3254": {
      "BLOCK_M": 128,
      "BLOCK_N": 16,
      "BLOCK_K": 64,
      "BLOCK_C": 16,
      "NUM_KSPLIT": 1,
      "num_warps": 8,
      "num_stages": 1,
      "waves_per_eu": 2
    },
    "2225": {
      "BLOCK_M": 64,
      "BLOCK_N": 16,
      "BLOCK_K": 128,
      "BLOCK_C": 16,
      "NUM_KSPLIT": 8,
      "num_warps": 4,
      "num_stages": 2,
      "waves_per_eu": 2
    },
    "5585": {
      "BLOCK_M": 256,
      "BLOCK_N": 16,
      "BLOCK_K": 256,
      "BLOCK_C": 64,
      "NUM_KSPLIT": 4,
      "num_warps": 2,
      "num_stages": 2,
      "waves_per_eu": 2
    },
    "2495": {
      "BLOCK_M": 64,
      "BLOCK_N": 16,
      "BLOCK_K": 128,
      "BLOCK_C": 256,
      "NUM_KSPLIT": 4,
      "num_warps": 4,
      "num_stages": 2,
      "waves_per_eu": 2
    },
    "5227": {
      "BLOCK_M": 256,
      "BLOCK_N": 16,
      "BLOCK_K": 128,
      "BLOCK_C": 64,
      "NUM_KSPLIT": 4,
      "num_warps": 4,
      "num_stages": 1,
      "waves_per_eu": 1
    },
    "1117": {
      "BLOCK_M": 32,
      "BLOCK_N": 16,
      "BLOCK_K": 256,
      "BLOCK_C": 16,
      "NUM_KSPLIT": 4,
      "num_warps": 2,
      "num_stages": 1,
      "waves_per_eu": 1
    },
    "326": {
      "BLOCK_M": 32,
      "BLOCK_N": 16,
      "BLOCK_K": 32,
      "BLOCK_C": 256,
      "NUM_KSPLIT": 4,
      "num_warps": 2,
      "num_stages": 1,
      "waves_per_eu": 2
    },
    "3809": {
      "BLOCK_M": 128,
      "BLOCK_N": 16,
      "BLOCK_K": 128,
      "BLOCK_C": 64,
      "NUM_KSPLIT": 8,
      "num_warps": 4,
      "num_stages": 2,
      "waves_per_eu": 2
    },
    "1355": {
      "BLOCK_M": 32,
      "BLOCK_N": 16,
      "BLOCK_K": 256,
      "BLOCK_C": 128,
      "NUM_KSPLIT": 8,
      "num_warps": 2,
      "num_stages": 2,
      "waves_per_eu": 2
    },
    "2962": {
      "BLOCK_M": 128,
      "BLOCK_N": 16,
      "BLOCK_K": 32,
      "BLOCK_C": 32,
      "NUM_KSPLIT": 1,
      "num_warps": 4,
      "num_stages": 2,
      "waves_per_eu": 1
    },
    "3056": {
      "BLOCK_M": 128,
      "BLOCK_N": 16,
      "BLOCK_K": 32,
      "BLOCK_C": 64,
      "NUM_KSPLIT": 2,
      "num_warps": 8,
      "num_stages": 1,
      "waves_per_eu": 2
    },
    "5465": {
      "BLOCK_M": 256,
      "BLOCK_N": 16,
      "BLOCK_K": 256,
      "BLOCK_C": 16,
      "NUM_KSPLIT": 8,
      "num_warps": 4,
      "num_stages": 2,
      "waves_per_eu": 2
    },
    "1594": {
      "BLOCK_M": 64,
      "BLOCK_N": 16,
      "BLOCK_K": 32,
      "BLOCK_C": 64,
      "NUM_KSPLIT": 1,
      "num_warps": 4,
      "num_stages": 2,
      "waves_per_eu": 1
    },
    "3565": {
      "BLOCK_M": 128,
      "BLOCK_N": 16,
      "BLOCK_K": 64,
      "BLOCK_C": 256,
      "NUM_KSPLIT": 4,
      "num_warps": 2,
      "num_stages": 1,
      "waves_per_eu": 1
    },
    "3391": {
      "BLOCK_M": 128,
      "BLOCK_N": 16,
      "BLOCK_K": 64,
      "BLOCK_C": 64,
      "NUM_KSPLIT": 1,
      "num_warps": 4,
      "num_stages": 1,
      "waves_per_eu": 1
    },
    "4568": {
      "BLOCK_M": 256,
      "BLOCK_N": 16,
      "BLOCK_K": 32,
      "BLOCK_C": 128,
      "NUM_KSPLIT": 2,
      "num_warps": 8,
      "num_stages": 1,
      "waves_per_eu": 2
    },
    "3251": {
      "BLOCK_M": 128,
      "BLOCK_N": 16,
      "BLOCK_K": 64,
      "BLOCK_C": 16,
      "NUM_KSPLIT": 1,
      "num_warps": 4,
      "num_stages": 2,
      "waves_per_eu": 2
    },
    "2998": {
      "BLOCK_M": 128,
      "BLOCK_N": 16,
      "BLOCK_K": 32,
      "BLOCK_C": 32,
      "NUM_KSPLIT": 4,
      "num_warps": 4,
      "num_stages": 2,
      "waves_per_eu": 1
    },
    "2042": {
      "BLOCK_M": 64,
      "BLOCK_N": 16,
      "BLOCK_K": 64,
      "BLOCK_C": 128,
      "NUM_KSPLIT": 2,
      "num_warps": 4,
      "num_stages": 1,
      "waves_per_eu": 2
    },
    "3679": {
      "BLOCK_M": 128,
      "BLOCK_N": 16,
      "BLOCK_K": 128,
      "BLOCK_C": 32,
      "NUM_KSPLIT": 1,
      "num_warps": 4,
      "num_stages": 1,
      "waves_per_eu": 1
    },
    "406": {
      "BLOCK_M": 32,
      "BLOCK_N": 16,
      "BLOCK_K": 64,
      "BLOCK_C": 16,
      "NUM_KSPLIT": 4,
      "num_warps": 4,
      "num_stages": 2,
      "waves_per_eu": 1
    },
    "4520": {
      "BLOCK_M": 256,
      "BLOCK_N": 16,
      "BLOCK_K": 32,
      "BLOCK_C": 64,
      "NUM_KSPLIT": 8,
      "num_warps": 2,
      "num_stages": 1,
      "waves_per_eu": 2
    },
    "1313": {
      "BLOCK_M": 32,
      "BLOCK_N": 16,
      "BLOCK_K": 256,
      "BLOCK_C": 128,
      "NUM_KSPLIT": 1,
      "num_warps": 8,
      "num_stages": 2,
      "waves_per_eu": 2
    },
    "1297": {
      "BLOCK_M": 32,
      "BLOCK_N": 16,
      "BLOCK_K": 256,
      "BLOCK_C": 128,
      "NUM_KSPLIT": 1,
      "num_warps": 2,
      "num_stages": 1,
      "waves_per_eu": 1
    },
    "5164": {
      "BLOCK_M": 256,
      "BLOCK_N": 16,
      "BLOCK_K": 128,
      "BLOCK_C": 32,
      "NUM_KSPLIT": 4,
      "num_warps": 8,
      "num_stages": 2,
      "waves_per_eu": 1
    },
    "4607": {
      "BLOCK_M": 256,
      "BLOCK_N": 16,
      "BLOCK_K": 32,
      "BLOCK_C": 128,
      "NUM_KSPLIT": 8,
      "num_warps": 8,
      "num_stages": 2,
      "waves_per_eu": 2
    },
    "5588": {
      "BLOCK_M": 256,
      "BLOCK_N": 16,
      "BLOCK_K": 256,
      "BLOCK_C": 64,
      "NUM_KSPLIT": 4,
      "num_warps": 4,
      "num_stages": 1,
      "waves_per_eu": 2
    },
    "2054": {
      "BLOCK_M": 64,
      "BLOCK_N": 16,
      "BLOCK_K": 64,
      "BLOCK_C": 128,
      "NUM_KSPLIT": 4,
      "num_warps": 2,
      "num_stages": 1,
      "waves_per_eu": 2
    },
    "5232": {
      "BLOCK_M": 256,
      "BLOCK_N": 16,
      "BLOCK_K": 128,
      "BLOCK_C": 64,
      "NUM_KSPLIT": 4,
      "num_warps": 8,
      "num_stages": 1,
      "waves_per_eu": 0
    },
    "311": {
      "BLOCK_M": 32,
      "BLOCK_N": 16,
      "BLOCK_K": 32,
      "BLOCK_C": 256,
      "NUM_KSPLIT": 2,
      "num_warps": 2,
      "num_stages": 2,
      "waves_per_eu": 2
    },
    "4983": {
      "BLOCK_M": 256,
      "BLOCK_N": 16,
      "BLOCK_K": 64,
      "BLOCK_C": 256,
      "NUM_KSPLIT": 1,
      "num_warps": 8,
      "num_stages": 2,
      "waves_per_eu": 0
    },
    "4873": {
      "BLOCK_M": 256,
      "BLOCK_N": 16,
      "BLOCK_K": 64,
      "BLOCK_C": 64,
      "NUM_KSPLIT": 4,
      "num_warps": 8,
      "num_stages": 1,
      "waves_per_eu": 1
    },
    "973": {
      "BLOCK_M": 32,
      "BLOCK_N": 16,
      "BLOCK_K": 128,
      "BLOCK_C": 128,
      "NUM_KSPLIT": 4,
      "num_warps": 2,
      "num_stages": 1,
      "waves_per_eu": 1
    },
    "2399": {
      "BLOCK_M": 64,
      "BLOCK_N": 16,
      "BLOCK_K": 128,
      "BLOCK_C": 128,
      "NUM_KSPLIT": 2,
      "num_warps": 2,
      "num_stages": 2,
      "waves_per_eu": 2
    },
    "2220": {
      "BLOCK_M": 64,
      "BLOCK_N": 16,
      "BLOCK_K": 128,
      "BLOCK_C": 16,
      "NUM_KSPLIT": 8,
      "num_warps": 4,
      "num_stages": 1,
      "waves_per_eu": 0
    },
    "4358": {
      "BLOCK_M": 256,
      "BLOCK_N": 16,
      "BLOCK_K": 32,
      "BLOCK_C": 16,
      "NUM_KSPLIT": 4,
      "num_warps": 2,
      "num_stages": 1,
      "waves_per_eu": 2
    },
    "1613": {
      "BLOCK_M": 64,
      "BLOCK_N": 16,
      "BLOCK_K": 32,
      "BLOCK_C": 64,
      "NUM_KSPLIT": 2,
      "num_warps": 4,
      "num_stages": 2,
      "waves_per_eu": 2
    },
    "1740": {
      "BLOCK_M": 64,
      "BLOCK_N": 16,
      "BLOCK_K": 32,
      "BLOCK_C": 256,
      "NUM_KSPLIT": 1,
      "num_warps": 8,
      "num_stages": 1,
      "waves_per_eu": 0
    },
    "3515": {
      "BLOCK_M": 128,
      "BLOCK_N": 16,
      "BLOCK_K": 64,
      "BLOCK_C": 128,
      "NUM_KSPLIT": 8,
      "num_warps": 2,
      "num_stages": 2,
      "waves_per_eu": 2
    },
    "4794": {
      "BLOCK_M": 256,
      "BLOCK_N": 16,
      "BLOCK_K": 64,
      "BLOCK_C": 32,
      "NUM_KSPLIT": 4,
      "num_warps": 4,
      "num_stages": 1,
      "waves_per_eu": 0
    },
    "4373": {
      "BLOCK_M": 256,
      "BLOCK_N": 16,
      "BLOCK_K": 32,
      "BLOCK_C": 16,
      "NUM_KSPLIT": 4,
      "num_warps": 8,
      "num_stages": 2,
      "waves_per_eu": 2
    },
    "1443": {
      "BLOCK_M": 64,
      "BLOCK_N": 16,
      "BLOCK_K": 32,
      "BLOCK_C": 16,
      "NUM_KSPLIT": 1,
      "num_warps": 2,
      "num_stages": 2,
      "waves_per_eu": 0
    },
    "4413": {
      "BLOCK_M": 256,
      "BLOCK_N": 16,
      "BLOCK_K": 32,
      "BLOCK_C": 32,
      "NUM_KSPLIT": 2,
      "num_warps": 2,
      "num_stages": 2,
      "waves_per_eu": 0
    },
    "2558": {
      "BLOCK_M": 64,
      "BLOCK_N": 16,
      "BLOCK_K": 256,
      "BLOCK_C": 16,
      "NUM_KSPLIT": 4,
      "num_warps": 2,
      "num_stages": 1,
      "waves_per_eu": 2
    },
    "5385": {
      "BLOCK_M": 256,
      "BLOCK_N": 16,
      "BLOCK_K": 128,
      "BLOCK_C": 256,
      "NUM_KSPLIT": 8,
      "num_warps": 2,
      "num_stages": 2,
      "waves_per_eu": 0
    },
    "3604": {
      "BLOCK_M": 128,
      "BLOCK_N": 16,
      "BLOCK_K": 128,
      "BLOCK_C": 16,
      "NUM_KSPLIT": 1,
      "num_warps": 2,
      "num_stages": 2,
      "waves_per_eu": 1
    },
    "5572": {
      "BLOCK_M": 256,
      "BLOCK_N": 16,
      "BLOCK_K": 256,
      "BLOCK_C": 64,
      "NUM_KSPLIT": 2,
      "num_warps": 4,
      "num_stages": 2,
      "waves_per_eu": 1
    },
    "680": {
      "BLOCK_M": 32,
      "BLOCK_N": 16,
      "BLOCK_K": 64,
      "BLOCK_C": 256,
      "NUM_KSPLIT": 2,
      "num_warps": 8,
      "num_stages": 1,
      "waves_per_eu": 2
    },
    "2813": {
      "BLOCK_M": 64,
      "BLOCK_N": 16,
      "BLOCK_K": 256,
      "BLOCK_C": 256,
      "NUM_KSPLIT": 1,
      "num_warps": 2,
      "num_stages": 2,
      "waves_per_eu": 2
    },
    "2284": {
      "BLOCK_M": 64,
      "BLOCK_N": 16,
      "BLOCK_K": 128,
      "BLOCK_C": 32,
      "NUM_KSPLIT": 4,
      "num_warps": 8,
      "num_stages": 2,
      "waves_per_eu": 1
    },
    "188": {
      "BLOCK_M": 32,
      "BLOCK_N": 16,
      "BLOCK_K": 32,
      "BLOCK_C": 64,
      "NUM_KSPLIT": 4,
      "num_warps": 4,
      "num_stages": 1,
      "waves_per_eu": 2
    },
    "4726": {
      "BLOCK_M": 256,
      "BLOCK_N": 16,
      "BLOCK_K": 64,
      "BLOCK_C": 16,
      "NUM_KSPLIT": 4,
      "num_warps": 4,
      "num_stages": 2,
      "waves_per_eu": 1
    },
    "4357": {
      "BLOCK_M": 256,
      "BLOCK_N": 16,
      "BLOCK_K": 32,
      "BLOCK_C": 16,
      "NUM_KSPLIT": 4,
      "num_warps": 2,
      "num_stages": 1,
      "waves_per_eu": 1
    },
    "3829": {
      "BLOCK_M": 128,
      "BLOCK_N": 16,
      "BLOCK_K": 128,
      "BLOCK_C": 128,
      "NUM_KSPLIT": 1,
      "num_warps": 8,
      "num_stages": 1,
      "waves_per_eu": 1
    },
    "4963": {
      "BLOCK_M": 256,
      "BLOCK_N": 16,
      "BLOCK_K": 64,
      "BLOCK_C": 128,
      "NUM_KSPLIT": 8,
      "num_warps": 8,
      "num_stages": 1,
      "waves_per_eu": 1
    },
    "1606": {
      "BLOCK_M": 64,
      "BLOCK_N": 16,
      "BLOCK_K": 32,
      "BLOCK_C": 64,
      "NUM_KSPLIT": 2,
      "num_warps": 2,
      "num_stages": 2,
      "waves_per_eu": 1
    },
    "279": {
      "BLOCK_M": 32,
      "BLOCK_N": 16,
      "BLOCK_K": 32,
      "BLOCK_C": 128,
      "NUM_KSPLIT": 8,
      "num_warps": 4,
      "num_stages": 2,
      "waves_per_eu": 0
    },
    "4212": {
      "BLOCK_M": 128,
      "BLOCK_N": 16,
      "BLOCK_K": 256,
      "BLOCK_C": 128,
      "NUM_KSPLIT": 4,
      "num_warps": 2,
      "num_stages": 1,
      "waves_per_eu": 0
    },
    "4400": {
      "BLOCK_M": 256,
      "BLOCK_N": 16,
      "BLOCK_K": 32,
      "BLOCK_C": 32,
      "NUM_KSPLIT": 1,
      "num_warps": 4,
      "num_stages": 1,
      "waves_per_eu": 2
    },
    "2815": {
      "BLOCK_M": 64,
      "BLOCK_N": 16,
      "BLOCK_K": 256,
      "BLOCK_C": 256,
      "NUM_KSPLIT": 1,
      "num_warps": 4,
      "num_stages": 1,
      "waves_per_eu": 1
    },
    "1905": {
      "BLOCK_M": 64,
      "BLOCK_N": 16,
      "BLOCK_K": 64,
      "BLOCK_C": 32,
      "NUM_KSPLIT": 2,
      "num_warps": 8,
      "num_stages": 2,
      "waves_per_eu": 0
    },
    "1359": {
      "BLOCK_M": 32,
      "BLOCK_N": 16,
      "BLOCK_K": 256,
      "BLOCK_C": 128,
      "NUM_KSPLIT": 8,
      "num_warps": 4,
      "num_stages": 2,
      "waves_per_eu": 0
    },
    "1352": {
      "BLOCK_M": 32,
      "BLOCK_N": 16,
      "BLOCK_K": 256,
      "BLOCK_C": 128,
      "NUM_KSPLIT": 8,
      "num_warps": 2,
      "num_stages": 1,
      "waves_per_eu": 2
    },
    "512": {
      "BLOCK_M": 32,
      "BLOCK_N": 16,
      "BLOCK_K": 64,
      "BLOCK_C": 64,
      "NUM_KSPLIT": 1,
      "num_warps": 4,
      "num_stages": 1,
      "waves_per_eu": 2
    },
    "5421": {
      "BLOCK_M": 256,
      "BLOCK_N": 16,
      "BLOCK_K": 256,
      "BLOCK_C": 16,
      "NUM_KSPLIT": 2,
      "num_warps": 2,
      "num_stages": 2,
      "waves_per_eu": 0
    },
    "1992": {
      "BLOCK_M": 64,
      "BLOCK_N": 16,
      "BLOCK_K": 64,
      "BLOCK_C": 64,
      "NUM_KSPLIT": 4,
      "num_warps": 8,
      "num_stages": 1,
      "waves_per_eu": 0
    },
    "3199": {
      "BLOCK_M": 128,
      "BLOCK_N": 16,
      "BLOCK_K": 32,
      "BLOCK_C": 256,
      "NUM_KSPLIT": 2,
      "num_warps": 8,
      "num_stages": 1,
      "waves_per_eu": 1
    },
    "4806": {
      "BLOCK_M": 256,
      "BLOCK_N": 16,
      "BLOCK_K": 64,
      "BLOCK_C": 32,
      "NUM_KSPLIT": 8,
      "num_warps": 2,
      "num_stages": 1,
      "waves_per_eu": 0
    },
    "5367": {
      "BLOCK_M": 256,
      "BLOCK_N": 16,
      "BLOCK_K": 128,
      "BLOCK_C": 256,
      "NUM_KSPLIT": 4,
      "num_warps": 2,
      "num_stages": 2,
      "waves_per_eu": 0
    },
    "3011": {
      "BLOCK_M": 128,
      "BLOCK_N": 16,
      "BLOCK_K": 32,
      "BLOCK_C": 32,
      "NUM_KSPLIT": 8,
      "num_warps": 2,
      "num_stages": 2,
      "waves_per_eu": 2
    },
    "5364": {
      "BLOCK_M": 256,
      "BLOCK_N": 16,
      "BLOCK_K": 128,
      "BLOCK_C": 256,
      "NUM_KSPLIT": 4,
      "num_warps": 2,
      "num_stages": 1,
      "waves_per_eu": 0
    },
    "639": {
      "BLOCK_M": 32,
      "BLOCK_N": 16,
      "BLOCK_K": 64,
      "BLOCK_C": 128,
      "NUM_KSPLIT": 8,
      "num_warps": 4,
      "num_stages": 2,
      "waves_per_eu": 0
    },
    "136": {
      "BLOCK_M": 32,
      "BLOCK_N": 16,
      "BLOCK_K": 32,
      "BLOCK_C": 32,
      "NUM_KSPLIT": 8,
      "num_warps": 4,
      "num_stages": 2,
      "waves_per_eu": 1
    },
    "212": {
      "BLOCK_M": 32,
      "BLOCK_N": 16,
      "BLOCK_K": 32,
      "BLOCK_C": 64,
      "NUM_KSPLIT": 8,
      "num_warps": 8,
      "num_stages": 1,
      "waves_per_eu": 2
    },
    "2615": {
      "BLOCK_M": 64,
      "BLOCK_N": 16,
      "BLOCK_K": 256,
      "BLOCK_C": 32,
      "NUM_KSPLIT": 2,
      "num_warps": 2,
      "num_stages": 2,
      "waves_per_eu": 2
    },
    "913": {
      "BLOCK_M": 32,
      "BLOCK_N": 16,
      "BLOCK_K": 128,
      "BLOCK_C": 64,
      "NUM_KSPLIT": 4,
      "num_warps": 8,
      "num_stages": 1,
      "waves_per_eu": 1
    },
    "4795": {
      "BLOCK_M": 256,
      "BLOCK_N": 16,
      "BLOCK_K": 64,
      "BLOCK_C": 32,
      "NUM_KSPLIT": 4,
      "num_warps": 4,
      "num_stages": 1,
      "waves_per_eu": 1
    },
    "893": {
      "BLOCK_M": 32,
      "BLOCK_N": 16,
      "BLOCK_K": 128,
      "BLOCK_C": 64,
      "NUM_KSPLIT": 2,
      "num_warps": 4,
      "num_stages": 2,
      "waves_per_eu": 2
    },
    "1085": {
      "BLOCK_M": 32,
      "BLOCK_N": 16,
      "BLOCK_K": 256,
      "BLOCK_C": 16,
      "NUM_KSPLIT": 1,
      "num_warps": 2,
      "num_stages": 2,
      "waves_per_eu": 2
    },
    "1515": {
      "BLOCK_M": 64,
      "BLOCK_N": 16,
      "BLOCK_K": 32,
      "BLOCK_C": 32,
      "NUM_KSPLIT": 1,
      "num_warps": 2,
      "num_stages": 2,
      "waves_per_eu": 0
    },
    "2686": {
      "BLOCK_M": 64,
      "BLOCK_N": 16,
      "BLOCK_K": 256,
      "BLOCK_C": 64,
      "NUM_KSPLIT": 2,
      "num_warps": 2,
      "num_stages": 2,
      "waves_per_eu": 1
    },
    "4237": {
      "BLOCK_M": 128,
      "BLOCK_N": 16,
      "BLOCK_K": 256,
      "BLOCK_C": 128,
      "NUM_KSPLIT": 8,
      "num_warps": 4,
      "num_stages": 1,
      "waves_per_eu": 1
    },
    "5269": {
      "BLOCK_M": 256,
      "BLOCK_N": 16,
      "BLOCK_K": 128,
      "BLOCK_C": 128,
      "NUM_KSPLIT": 1,
      "num_warps": 8,
      "num_stages": 1,
      "waves_per_eu": 1
    },
    "3884": {
      "BLOCK_M": 128,
      "BLOCK_N": 16,
      "BLOCK_K": 128,
      "BLOCK_C": 128,
      "NUM_KSPLIT": 8,
      "num_warps": 8,
      "num_stages": 1,
      "waves_per_eu": 2
    },
    "4182": {
      "BLOCK_M": 128,
      "BLOCK_N": 16,
      "BLOCK_K": 256,
      "BLOCK_C": 128,
      "NUM_KSPLIT": 1,
      "num_warps": 4,
      "num_stages": 1,
      "waves_per_eu": 0
    },
    "2879": {
      "BLOCK_M": 64,
      "BLOCK_N": 16,
      "BLOCK_K": 256,
      "BLOCK_C": 256,
      "NUM_KSPLIT": 8,
      "num_warps": 8,
      "num_stages": 2,
      "waves_per_eu": 2
    },
    "3874": {
      "BLOCK_M": 128,
      "BLOCK_N": 16,
      "BLOCK_K": 128,
      "BLOCK_C": 128,
      "NUM_KSPLIT": 8,
      "num_warps": 2,
      "num_stages": 2,
      "waves_per_eu": 1
    },
    "648": {
      "BLOCK_M": 32,
      "BLOCK_N": 16,
      "BLOCK_K": 64,
      "BLOCK_C": 256,
      "NUM_KSPLIT": 1,
      "num_warps": 2,
      "num_stages": 1,
      "waves_per_eu": 0
    },
    "4501": {
      "BLOCK_M": 256,
      "BLOCK_N": 16,
      "BLOCK_K": 32,
      "BLOCK_C": 64,
      "NUM_KSPLIT": 4,
      "num_warps": 2,
      "num_stages": 1,
      "waves_per_eu": 1
    },
    "5676": {
      "BLOCK_M": 256,
      "BLOCK_N": 16,
      "BLOCK_K": 256,
      "BLOCK_C": 128,
      "NUM_KSPLIT": 8,
      "num_warps": 4,
      "num_stages": 1,
      "waves_per_eu": 0
    },
    "3670": {
      "BLOCK_M": 128,
      "BLOCK_N": 16,
      "BLOCK_K": 128,
      "BLOCK_C": 16,
      "NUM_KSPLIT": 8,
      "num_warps": 8,
      "num_stages": 2,
      "waves_per_eu": 1
    },
    "2158": {
      "BLOCK_M": 64,
      "BLOCK_N": 16,
      "BLOCK_K": 64,
      "BLOCK_C": 256,
      "NUM_KSPLIT": 8,
      "num_warps": 8,
      "num_stages": 2,
      "waves_per_eu": 1
    },
    "3621": {
      "BLOCK_M": 128,
      "BLOCK_N": 16,
      "BLOCK_K": 128,
      "BLOCK_C": 16,
      "NUM_KSPLIT": 2,
      "num_warps": 2,
      "num_stages": 2,
      "waves_per_eu": 0
    },
    "2110": {
      "BLOCK_M": 64,
      "BLOCK_N": 16,
      "BLOCK_K": 64,
      "BLOCK_C": 256,
      "NUM_KSPLIT": 2,
      "num_warps": 2,
      "num_stages": 2,
      "waves_per_eu": 1
    },
    "2543": {
      "BLOCK_M": 64,
      "BLOCK_N": 16,
      "BLOCK_K": 256,
      "BLOCK_C": 16,
      "NUM_KSPLIT": 2,
      "num_warps": 2,
      "num_stages": 2,
      "waves_per_eu": 2
    },
    "1173": {
      "BLOCK_M": 32,
      "BLOCK_N": 16,
      "BLOCK_K": 256,
      "BLOCK_C": 32,
      "NUM_KSPLIT": 2,
      "num_warps": 2,
      "num_stages": 2,
      "waves_per_eu": 0
    },
    "5701": {
      "BLOCK_M": 256,
      "BLOCK_N": 16,
      "BLOCK_K": 256,
      "BLOCK_C": 256,
      "NUM_KSPLIT": 1,
      "num_warps": 8,
      "num_stages": 1,
      "waves_per_eu": 1
    },
    "2185": {
      "BLOCK_M": 64,
      "BLOCK_N": 16,
      "BLOCK_K": 128,
      "BLOCK_C": 16,
      "NUM_KSPLIT": 2,
      "num_warps": 4,
      "num_stages": 1,
      "waves_per_eu": 1
    },
    "3252": {
      "BLOCK_M": 128,
      "BLOCK_N": 16,
      "BLOCK_K": 64,
      "BLOCK_C": 16,
      "NUM_KSPLIT": 1,
      "num_warps": 8,
      "num_stages": 1,
      "waves_per_eu": 0
    },
    "1336": {
      "BLOCK_M": 32,
      "BLOCK_N": 16,
      "BLOCK_K": 256,
      "BLOCK_C": 128,
      "NUM_KSPLIT": 4,
      "num_warps": 2,
      "num_stages": 2,
      "waves_per_eu": 1
    },
    "4891": {
      "BLOCK_M": 256,
      "BLOCK_N": 16,
      "BLOCK_K": 64,
      "BLOCK_C": 64,
      "NUM_KSPLIT": 8,
      "num_warps": 8,
      "num_stages": 1,
      "waves_per_eu": 1
    },
    "1092": {
      "BLOCK_M": 32,
      "BLOCK_N": 16,
      "BLOCK_K": 256,
      "BLOCK_C": 16,
      "NUM_KSPLIT": 1,
      "num_warps": 8,
      "num_stages": 1,
      "waves_per_eu": 0
    },
    "4289": {
      "BLOCK_M": 128,
      "BLOCK_N": 16,
      "BLOCK_K": 256,
      "BLOCK_C": 256,
      "NUM_KSPLIT": 4,
      "num_warps": 2,
      "num_stages": 2,
      "waves_per_eu": 2
    },
    "47": {
      "BLOCK_M": 32,
      "BLOCK_N": 16,
      "BLOCK_K": 32,
      "BLOCK_C": 16,
      "NUM_KSPLIT": 4,
      "num_warps": 4,
      "num_stages": 2,
      "waves_per_eu": 2
    },
    "1182": {
      "BLOCK_M": 32,
      "BLOCK_N": 16,
      "BLOCK_K": 256,
      "BLOCK_C": 32,
      "NUM_KSPLIT": 2,
      "num_warps": 8,
      "num_stages": 1,
      "waves_per_eu": 0
    },
    "2903": {
      "BLOCK_M": 128,
      "BLOCK_N": 16,
      "BLOCK_K": 32,
      "BLOCK_C": 16,
      "NUM_KSPLIT": 2,
      "num_warps": 2,
      "num_stages": 2,
      "waves_per_eu": 2
    },
    "3435": {
      "BLOCK_M": 128,
      "BLOCK_N": 16,
      "BLOCK_K": 64,
      "BLOCK_C": 64,
      "NUM_KSPLIT": 4,
      "num_warps": 8,
      "num_stages": 2,
      "waves_per_eu": 0
    },
    "4613": {
      "BLOCK_M": 256,
      "BLOCK_N": 16,
      "BLOCK_K": 32,
      "BLOCK_C": 256,
      "NUM_KSPLIT": 1,
      "num_warps": 2,
      "num_stages": 2,
      "waves_per_eu": 2
    },
    "1367": {
      "BLOCK_M": 32,
      "BLOCK_N": 16,
      "BLOCK_K": 256,
      "BLOCK_C": 128,
      "NUM_KSPLIT": 8,
      "num_warps": 8,
      "num_stages": 2,
      "waves_per_eu": 2
    },
    "1527": {
      "BLOCK_M": 64,
      "BLOCK_N": 16,
      "BLOCK_K": 32,
      "BLOCK_C": 32,
      "NUM_KSPLIT": 1,
      "num_warps": 8,
      "num_stages": 2,
      "waves_per_eu": 0
    },
    "4063": {
      "BLOCK_M": 128,
      "BLOCK_N": 16,
      "BLOCK_K": 256,
      "BLOCK_C": 32,
      "NUM_KSPLIT": 2,
      "num_warps": 8,
      "num_stages": 1,
      "waves_per_eu": 1
    },
    "3183": {
      "BLOCK_M": 128,
      "BLOCK_N": 16,
      "BLOCK_K": 32,
      "BLOCK_C": 256,
      "NUM_KSPLIT": 1,
      "num_warps": 8,
      "num_stages": 2,
      "waves_per_eu": 0
    },
    "3129": {
      "BLOCK_M": 128,
      "BLOCK_N": 16,
      "BLOCK_K": 32,
      "BLOCK_C": 128,
      "NUM_KSPLIT": 2,
      "num_warps": 8,
      "num_stages": 2,
      "waves_per_eu": 0
    },
    "199": {
      "BLOCK_M": 32,
      "BLOCK_N": 16,
      "BLOCK_K": 32,
      "BLOCK_C": 64,
      "NUM_KSPLIT": 8,
      "num_warps": 2,
      "num_stages": 1,
      "waves_per_eu": 1
    },
    "4047": {
      "BLOCK_M": 128,
      "BLOCK_N": 16,
      "BLOCK_K": 256,
      "BLOCK_C": 32,
      "NUM_KSPLIT": 1,
      "num_warps": 8,
      "num_stages": 2,
      "waves_per_eu": 0
    },
    "1767": {
      "BLOCK_M": 64,
      "BLOCK_N": 16,
      "BLOCK_K": 32,
      "BLOCK_C": 256,
      "NUM_KSPLIT": 4,
      "num_warps": 2,
      "num_stages": 2,
      "waves_per_eu": 0
    },
    "1886": {
      "BLOCK_M": 64,
      "BLOCK_N": 16,
      "BLOCK_K": 64,
      "BLOCK_C": 32,
      "NUM_KSPLIT": 1,
      "num_warps": 8,
      "num_stages": 1,
      "waves_per_eu": 2
    },
    "2084": {
      "BLOCK_M": 64,
      "BLOCK_N": 16,
      "BLOCK_K": 64,
      "BLOCK_C": 128,
      "NUM_KSPLIT": 8,
      "num_warps": 8,
      "num_stages": 1,
      "waves_per_eu": 2
    },
    "2354": {
      "BLOCK_M": 64,
      "BLOCK_N": 16,
      "BLOCK_K": 128,
      "BLOCK_C": 64,
      "NUM_KSPLIT": 4,
      "num_warps": 8,
      "num_stages": 1,
      "waves_per_eu": 2
    },
    "140": {
      "BLOCK_M": 32,
      "BLOCK_N": 16,
      "BLOCK_K": 32,
      "BLOCK_C": 32,
      "NUM_KSPLIT": 8,
      "num_warps": 8,
      "num_stages": 1,
      "waves_per_eu": 2
    },
    "3296": {
      "BLOCK_M": 128,
      "BLOCK_N": 16,
      "BLOCK_K": 64,
      "BLOCK_C": 16,
      "NUM_KSPLIT": 8,
      "num_warps": 2,
      "num_stages": 1,
      "waves_per_eu": 2
    },
    "559": {
      "BLOCK_M": 32,
      "BLOCK_N": 16,
      "BLOCK_K": 64,
      "BLOCK_C": 64,
      "NUM_KSPLIT": 8,
      "num_warps": 2,
      "num_stages": 1,
      "waves_per_eu": 1
    },
    "3467": {
      "BLOCK_M": 128,
      "BLOCK_N": 16,
      "BLOCK_K": 64,
      "BLOCK_C": 128,
      "NUM_KSPLIT": 1,
      "num_warps": 4,
      "num_stages": 2,
      "waves_per_eu": 2
    },
    "3334": {
      "BLOCK_M": 128,
      "BLOCK_N": 16,
      "BLOCK_K": 64,
      "BLOCK_C": 32,
      "NUM_KSPLIT": 2,
      "num_warps": 2,
      "num_stages": 2,
      "waves_per_eu": 1
    },
    "3585": {
      "BLOCK_M": 128,
      "BLOCK_N": 16,
      "BLOCK_K": 64,
      "BLOCK_C": 256,
      "NUM_KSPLIT": 8,
      "num_warps": 2,
      "num_stages": 2,
      "waves_per_eu": 0
    },
    "812": {
      "BLOCK_M": 32,
      "BLOCK_N": 16,
      "BLOCK_K": 128,
      "BLOCK_C": 32,
      "NUM_KSPLIT": 2,
      "num_warps": 2,
      "num_stages": 1,
      "waves_per_eu": 2
    },
    "3758": {
      "BLOCK_M": 128,
      "BLOCK_N": 16,
      "BLOCK_K": 128,
      "BLOCK_C": 64,
      "NUM_KSPLIT": 1,
      "num_warps": 8,
      "num_stages": 1,
      "waves_per_eu": 2
    },
    "108": {
      "BLOCK_M": 32,
      "BLOCK_N": 16,
      "BLOCK_K": 32,
      "BLOCK_C": 32,
      "NUM_KSPLIT": 4,
      "num_warps": 2,
      "num_stages": 1,
      "waves_per_eu": 0
    },
    "545": {
      "BLOCK_M": 32,
      "BLOCK_N": 16,
      "BLOCK_K": 64,
      "BLOCK_C": 64,
      "NUM_KSPLIT": 4,
      "num_warps": 2,
      "num_stages": 2,
      "waves_per_eu": 2
    },
    "671": {
      "BLOCK_M": 32,
      "BLOCK_N": 16,
      "BLOCK_K": 64,
      "BLOCK_C": 256,
      "NUM_KSPLIT": 2,
      "num_warps": 2,
      "num_stages": 2,
      "waves_per_eu": 2
    },
    "5246": {
      "BLOCK_M": 256,
      "BLOCK_N": 16,
      "BLOCK_K": 128,
      "BLOCK_C": 64,
      "NUM_KSPLIT": 8,
      "num_warps": 4,
      "num_stages": 1,
      "waves_per_eu": 2
    },
    "1727": {
      "BLOCK_M": 64,
      "BLOCK_N": 16,
      "BLOCK_K": 32,
      "BLOCK_C": 128,
      "NUM_KSPLIT": 8,
      "num_warps": 8,
      "num_stages": 2,
      "waves_per_eu": 2
    },
    "4042": {
      "BLOCK_M": 128,
      "BLOCK_N": 16,
      "BLOCK_K": 256,
      "BLOCK_C": 32,
      "NUM_KSPLIT": 1,
      "num_warps": 4,
      "num_stages": 2,
      "waves_per_eu": 1
    },
    "2647": {
      "BLOCK_M": 64,
      "BLOCK_N": 16,
      "BLOCK_K": 256,
      "BLOCK_C": 32,
      "NUM_KSPLIT": 8,
      "num_warps": 2,
      "num_stages": 1,
      "waves_per_eu": 1
    },
    "5647": {
      "BLOCK_M": 256,
      "BLOCK_N": 16,
      "BLOCK_K": 256,
      "BLOCK_C": 128,
      "NUM_KSPLIT": 2,
      "num_warps": 8,
      "num_stages": 1,
      "waves_per_eu": 1
    },
    "4851": {
      "BLOCK_M": 256,
      "BLOCK_N": 16,
      "BLOCK_K": 64,
      "BLOCK_C": 64,
      "NUM_KSPLIT": 2,
      "num_warps": 4,
      "num_stages": 2,
      "waves_per_eu": 0
    },
    "3354": {
      "BLOCK_M": 128,
      "BLOCK_N": 16,
      "BLOCK_K": 64,
      "BLOCK_C": 32,
      "NUM_KSPLIT": 4,
      "num_warps": 4,
      "num_stages": 1,
      "waves_per_eu": 0
    },
    "3520": {
      "BLOCK_M": 128,
      "BLOCK_N": 16,
      "BLOCK_K": 64,
      "BLOCK_C": 128,
      "NUM_KSPLIT": 8,
      "num_warps": 4,
      "num_stages": 2,
      "waves_per_eu": 1
    },
    "5114": {
      "BLOCK_M": 256,
      "BLOCK_N": 16,
      "BLOCK_K": 128,
      "BLOCK_C": 32,
      "NUM_KSPLIT": 1,
      "num_warps": 2,
      "num_stages": 1,
      "waves_per_eu": 2
    },
    "142": {
      "BLOCK_M": 32,
      "BLOCK_N": 16,
      "BLOCK_K": 32,
      "BLOCK_C": 32,
      "NUM_KSPLIT": 8,
      "num_warps": 8,
      "num_stages": 2,
      "waves_per_eu": 1
    },
    "3066": {
      "BLOCK_M": 128,
      "BLOCK_N": 16,
      "BLOCK_K": 32,
      "BLOCK_C": 64,
      "NUM_KSPLIT": 4,
      "num_warps": 4,
      "num_stages": 1,
      "waves_per_eu": 0
    },
    "1591": {
      "BLOCK_M": 64,
      "BLOCK_N": 16,
      "BLOCK_K": 32,
      "BLOCK_C": 64,
      "NUM_KSPLIT": 1,
      "num_warps": 4,
      "num_stages": 1,
      "waves_per_eu": 1
    },
    "5004": {
      "BLOCK_M": 256,
      "BLOCK_N": 16,
      "BLOCK_K": 64,
      "BLOCK_C": 256,
      "NUM_KSPLIT": 4,
      "num_warps": 2,
      "num_stages": 1,
      "waves_per_eu": 0
    },
    "2916": {
      "BLOCK_M": 128,
      "BLOCK_N": 16,
      "BLOCK_K": 32,
      "BLOCK_C": 16,
      "NUM_KSPLIT": 4,
      "num_warps": 2,
      "num_stages": 1,
      "waves_per_eu": 0
    },
    "3506": {
      "BLOCK_M": 128,
      "BLOCK_N": 16,
      "BLOCK_K": 64,
      "BLOCK_C": 128,
      "NUM_KSPLIT": 4,
      "num_warps": 8,
      "num_stages": 1,
      "waves_per_eu": 2
    },
    "4559": {
      "BLOCK_M": 256,
      "BLOCK_N": 16,
      "BLOCK_K": 32,
      "BLOCK_C": 128,
      "NUM_KSPLIT": 2,
      "num_warps": 2,
      "num_stages": 2,
      "waves_per_eu": 2
    },
    "333": {
      "BLOCK_M": 32,
      "BLOCK_N": 16,
      "BLOCK_K": 32,
      "BLOCK_C": 256,
      "NUM_KSPLIT": 4,
      "num_warps": 4,
      "num_stages": 2,
      "waves_per_eu": 0
    },
    "2024": {
      "BLOCK_M": 64,
      "BLOCK_N": 16,
      "BLOCK_K": 64,
      "BLOCK_C": 128,
      "NUM_KSPLIT": 1,
      "num_warps": 4,
      "num_stages": 1,
      "waves_per_eu": 2
    },
    "5218": {
      "BLOCK_M": 256,
      "BLOCK_N": 16,
      "BLOCK_K": 128,
      "BLOCK_C": 64,
      "NUM_KSPLIT": 2,
      "num_warps": 8,
      "num_stages": 2,
      "waves_per_eu": 1
    },
    "5053": {
      "BLOCK_M": 256,
      "BLOCK_N": 16,
      "BLOCK_K": 128,
      "BLOCK_C": 16,
      "NUM_KSPLIT": 1,
      "num_warps": 8,
      "num_stages": 1,
      "waves_per_eu": 1
    },
    "3388": {
      "BLOCK_M": 128,
      "BLOCK_N": 16,
      "BLOCK_K": 64,
      "BLOCK_C": 64,
      "NUM_KSPLIT": 1,
      "num_warps": 2,
      "num_stages": 2,
      "waves_per_eu": 1
    },
    "5652": {
      "BLOCK_M": 256,
      "BLOCK_N": 16,
      "BLOCK_K": 256,
      "BLOCK_C": 128,
      "NUM_KSPLIT": 4,
      "num_warps": 2,
      "num_stages": 1,
      "waves_per_eu": 0
    },
    "3197": {
      "BLOCK_M": 128,
      "BLOCK_N": 16,
      "BLOCK_K": 32,
      "BLOCK_C": 256,
      "NUM_KSPLIT": 2,
      "num_warps": 4,
      "num_stages": 2,
      "waves_per_eu": 2
    },
    "3026": {
      "BLOCK_M": 128,
      "BLOCK_N": 16,
      "BLOCK_K": 32,
      "BLOCK_C": 64,
      "NUM_KSPLIT": 1,
      "num_warps": 2,
      "num_stages": 1,
      "waves_per_eu": 2
    },
    "2680": {
      "BLOCK_M": 64,
      "BLOCK_N": 16,
      "BLOCK_K": 256,
      "BLOCK_C": 64,
      "NUM_KSPLIT": 1,
      "num_warps": 8,
      "num_stages": 2,
      "waves_per_eu": 1
    },
    "2146": {
      "BLOCK_M": 64,
      "BLOCK_N": 16,
      "BLOCK_K": 64,
      "BLOCK_C": 256,
      "NUM_KSPLIT": 8,
      "num_warps": 2,
      "num_stages": 2,
      "waves_per_eu": 1
    },
    "2663": {
      "BLOCK_M": 64,
      "BLOCK_N": 16,
      "BLOCK_K": 256,
      "BLOCK_C": 32,
      "NUM_KSPLIT": 8,
      "num_warps": 8,
      "num_stages": 2,
      "waves_per_eu": 2
    },
    "1669": {
      "BLOCK_M": 64,
      "BLOCK_N": 16,
      "BLOCK_K": 32,
      "BLOCK_C": 128,
      "NUM_KSPLIT": 1,
      "num_warps": 8,
      "num_stages": 1,
      "waves_per_eu": 1
    },
    "2627": {
      "BLOCK_M": 64,
      "BLOCK_N": 16,
      "BLOCK_K": 256,
      "BLOCK_C": 32,
      "NUM_KSPLIT": 2,
      "num_warps": 8,
      "num_stages": 2,
      "waves_per_eu": 2
    },
    "2271": {
      "BLOCK_M": 64,
      "BLOCK_N": 16,
      "BLOCK_K": 128,
      "BLOCK_C": 32,
      "NUM_KSPLIT": 4,
      "num_warps": 2,
      "num_stages": 2,
      "waves_per_eu": 0
    },
    "1212": {
      "BLOCK_M": 32,
      "BLOCK_N": 16,
      "BLOCK_K": 256,
      "BLOCK_C": 32,
      "NUM_KSPLIT": 8,
      "num_warps": 4,
      "num_stages": 1,
      "waves_per_eu": 0
    },
    "5477": {
      "BLOCK_M": 256,
      "BLOCK_N": 16,
      "BLOCK_K": 256,
      "BLOCK_C": 32,
      "NUM_KSPLIT": 1,
      "num_warps": 2,
      "num_stages": 2,
      "waves_per_eu": 2
    },
    "1230": {
      "BLOCK_M": 32,
      "BLOCK_N": 16,
      "BLOCK_K": 256,
      "BLOCK_C": 64,
      "NUM_KSPLIT": 1,
      "num_warps": 4,
      "num_stages": 1,
      "waves_per_eu": 0
    },
    "1116": {
      "BLOCK_M": 32,
      "BLOCK_N": 16,
      "BLOCK_K": 256,
      "BLOCK_C": 16,
      "NUM_KSPLIT": 4,
      "num_warps": 2,
      "num_stages": 1,
      "waves_per_eu": 0
    },
    "1345": {
      "BLOCK_M": 32,
      "BLOCK_N": 16,
      "BLOCK_K": 256,
      "BLOCK_C": 128,
      "NUM_KSPLIT": 4,
      "num_warps": 8,
      "num_stages": 1,
      "waves_per_eu": 1
    },
    "4802": {
      "BLOCK_M": 256,
      "BLOCK_N": 16,
      "BLOCK_K": 64,
      "BLOCK_C": 32,
      "NUM_KSPLIT": 4,
      "num_warps": 8,
      "num_stages": 1,
      "waves_per_eu": 2
    },
    "3943": {
      "BLOCK_M": 128,
      "BLOCK_N": 16,
      "BLOCK_K": 128,
      "BLOCK_C": 256,
      "NUM_KSPLIT": 8,
      "num_warps": 2,
      "num_stages": 1,
      "waves_per_eu": 1
    },
    "1622": {
      "BLOCK_M": 64,
      "BLOCK_N": 16,
      "BLOCK_K": 32,
      "BLOCK_C": 64,
      "NUM_KSPLIT": 4,
      "num_warps": 2,
      "num_stages": 1,
      "waves_per_eu": 2
    },
    "2716": {
      "BLOCK_M": 64,
      "BLOCK_N": 16,
      "BLOCK_K": 256,
      "BLOCK_C": 64,
      "NUM_KSPLIT": 4,
      "num_warps": 8,
      "num_stages": 2,
      "waves_per_eu": 1
    },
    "400": {
      "BLOCK_M": 32,
      "BLOCK_N": 16,
      "BLOCK_K": 64,
      "BLOCK_C": 16,
      "NUM_KSPLIT": 4,
      "num_warps": 2,
      "num_stages": 2,
      "waves_per_eu": 1
    },
    "869": {
      "BLOCK_M": 32,
      "BLOCK_N": 16,
      "BLOCK_K": 128,
      "BLOCK_C": 64,
      "NUM_KSPLIT": 1,
      "num_warps": 2,
      "num_stages": 2,
      "waves_per_eu": 2
    },
    "3038": {
      "BLOCK_M": 128,
      "BLOCK_N": 16,
      "BLOCK_K": 32,
      "BLOCK_C": 64,
      "NUM_KSPLIT": 1,
      "num_warps": 8,
      "num_stages": 1,
      "waves_per_eu": 2
    },
    "2304": {
      "BLOCK_M": 64,
      "BLOCK_N": 16,
      "BLOCK_K": 128,
      "BLOCK_C": 64,
      "NUM_KSPLIT": 1,
      "num_warps": 2,
      "num_stages": 1,
      "waves_per_eu": 0
    },
    "5046": {
      "BLOCK_M": 256,
      "BLOCK_N": 16,
      "BLOCK_K": 128,
      "BLOCK_C": 16,
      "NUM_KSPLIT": 1,
      "num_warps": 4,
      "num_stages": 1,
      "waves_per_eu": 0
    },
    "1963": {
      "BLOCK_M": 64,
      "BLOCK_N": 16,
      "BLOCK_K": 64,
      "BLOCK_C": 64,
      "NUM_KSPLIT": 2,
      "num_warps": 2,
      "num_stages": 1,
      "waves_per_eu": 1
    },
    "3193": {
      "BLOCK_M": 128,
      "BLOCK_N": 16,
      "BLOCK_K": 32,
      "BLOCK_C": 256,
      "NUM_KSPLIT": 2,
      "num_warps": 4,
      "num_stages": 1,
      "waves_per_eu": 1
    },
    "757": {
      "BLOCK_M": 32,
      "BLOCK_N": 16,
      "BLOCK_K": 128,
      "BLOCK_C": 16,
      "NUM_KSPLIT": 4,
      "num_warps": 2,
      "num_stages": 1,
      "waves_per_eu": 1
    },
    "4770": {
      "BLOCK_M": 256,
      "BLOCK_N": 16,
      "BLOCK_K": 64,
      "BLOCK_C": 32,
      "NUM_KSPLIT": 2,
      "num_warps": 2,
      "num_stages": 1,
      "waves_per_eu": 0
    },
    "1925": {
      "BLOCK_M": 64,
      "BLOCK_N": 16,
      "BLOCK_K": 64,
      "BLOCK_C": 32,
      "NUM_KSPLIT": 4,
      "num_warps": 8,
      "num_stages": 2,
      "waves_per_eu": 2
    },
    "278": {
      "BLOCK_M": 32,
      "BLOCK_N": 16,
      "BLOCK_K": 32,
      "BLOCK_C": 128,
      "NUM_KSPLIT": 8,
      "num_warps": 4,
      "num_stages": 1,
      "waves_per_eu": 2
    },
    "5265": {
      "BLOCK_M": 256,
      "BLOCK_N": 16,
      "BLOCK_K": 128,
      "BLOCK_C": 128,
      "NUM_KSPLIT": 1,
      "num_warps": 4,
      "num_stages": 2,
      "waves_per_eu": 0
    },
    "3976": {
      "BLOCK_M": 128,
      "BLOCK_N": 16,
      "BLOCK_K": 256,
      "BLOCK_C": 16,
      "NUM_KSPLIT": 1,
      "num_warps": 8,
      "num_stages": 2,
      "waves_per_eu": 1
    },
    "1056": {
      "BLOCK_M": 32,
      "BLOCK_N": 16,
      "BLOCK_K": 128,
      "BLOCK_C": 256,
      "NUM_KSPLIT": 4,
      "num_warps": 8,
      "num_stages": 1,
      "waves_per_eu": 0
    },
    "2937": {
      "BLOCK_M": 128,
      "BLOCK_N": 16,
      "BLOCK_K": 32,
      "BLOCK_C": 16,
      "NUM_KSPLIT": 8,
      "num_warps": 2,
      "num_stages": 2,
      "waves_per_eu": 0
    },
    "527": {
      "BLOCK_M": 32,
      "BLOCK_N": 16,
      "BLOCK_K": 64,
      "BLOCK_C": 64,
      "NUM_KSPLIT": 2,
      "num_warps": 2,
      "num_stages": 2,
      "waves_per_eu": 2
    },
    "2692": {
      "BLOCK_M": 64,
      "BLOCK_N": 16,
      "BLOCK_K": 256,
      "BLOCK_C": 64,
      "NUM_KSPLIT": 2,
      "num_warps": 4,
      "num_stages": 2,
      "waves_per_eu": 1
    },
    "1118": {
      "BLOCK_M": 32,
      "BLOCK_N": 16,
      "BLOCK_K": 256,
      "BLOCK_C": 16,
      "NUM_KSPLIT": 4,
      "num_warps": 2,
      "num_stages": 1,
      "waves_per_eu": 2
    },
    "3501": {
      "BLOCK_M": 128,
      "BLOCK_N": 16,
      "BLOCK_K": 64,
      "BLOCK_C": 128,
      "NUM_KSPLIT": 4,
      "num_warps": 4,
      "num_stages": 2,
      "waves_per_eu": 0
    },
    "1836": {
      "BLOCK_M": 64,
      "BLOCK_N": 16,
      "BLOCK_K": 64,
      "BLOCK_C": 16,
      "NUM_KSPLIT": 4,
      "num_warps": 2,
      "num_stages": 1,
      "waves_per_eu": 0
    },
    "741": {
      "BLOCK_M": 32,
      "BLOCK_N": 16,
      "BLOCK_K": 128,
      "BLOCK_C": 16,
      "NUM_KSPLIT": 2,
      "num_warps": 2,
      "num_stages": 2,
      "waves_per_eu": 0
    },
    "1881": {
      "BLOCK_M": 64,
      "BLOCK_N": 16,
      "BLOCK_K": 64,
      "BLOCK_C": 32,
      "NUM_KSPLIT": 1,
      "num_warps": 4,
      "num_stages": 2,
      "waves_per_eu": 0
    },
    "4232": {
      "BLOCK_M": 128,
      "BLOCK_N": 16,
      "BLOCK_K": 256,
      "BLOCK_C": 128,
      "NUM_KSPLIT": 8,
      "num_warps": 2,
      "num_stages": 1,
      "waves_per_eu": 2
    },
    "4235": {
      "BLOCK_M": 128,
      "BLOCK_N": 16,
      "BLOCK_K": 256,
      "BLOCK_C": 128,
      "NUM_KSPLIT": 8,
      "num_warps": 2,
      "num_stages": 2,
      "waves_per_eu": 2
    },
    "2519": {
      "BLOCK_M": 64,
      "BLOCK_N": 16,
      "BLOCK_K": 128,
      "BLOCK_C": 256,
      "NUM_KSPLIT": 8,
      "num_warps": 8,
      "num_stages": 2,
      "waves_per_eu": 2
    },
    "524": {
      "BLOCK_M": 32,
      "BLOCK_N": 16,
      "BLOCK_K": 64,
      "BLOCK_C": 64,
      "NUM_KSPLIT": 2,
      "num_warps": 2,
      "num_stages": 1,
      "waves_per_eu": 2
    },
    "1804": {
      "BLOCK_M": 64,
      "BLOCK_N": 16,
      "BLOCK_K": 64,
      "BLOCK_C": 16,
      "NUM_KSPLIT": 1,
      "num_warps": 2,
      "num_stages": 2,
      "waves_per_eu": 1
    },
    "4810": {
      "BLOCK_M": 256,
      "BLOCK_N": 16,
      "BLOCK_K": 64,
      "BLOCK_C": 32,
      "NUM_KSPLIT": 8,
      "num_warps": 2,
      "num_stages": 2,
      "waves_per_eu": 1
    },
    "5010": {
      "BLOCK_M": 256,
      "BLOCK_N": 16,
      "BLOCK_K": 64,
      "BLOCK_C": 256,
      "NUM_KSPLIT": 4,
      "num_warps": 4,
      "num_stages": 1,
      "waves_per_eu": 0
    },
    "2833": {
      "BLOCK_M": 64,
      "BLOCK_N": 16,
      "BLOCK_K": 256,
      "BLOCK_C": 256,
      "NUM_KSPLIT": 2,
      "num_warps": 4,
      "num_stages": 1,
      "waves_per_eu": 1
    },
    "1945": {
      "BLOCK_M": 64,
      "BLOCK_N": 16,
      "BLOCK_K": 64,
      "BLOCK_C": 64,
      "NUM_KSPLIT": 1,
      "num_warps": 2,
      "num_stages": 1,
      "waves_per_eu": 1
    },
    "5706": {
      "BLOCK_M": 256,
      "BLOCK_N": 16,
      "BLOCK_K": 256,
      "BLOCK_C": 256,
      "NUM_KSPLIT": 2,
      "num_warps": 2,
      "num_stages": 1,
      "waves_per_eu": 0
    },
    "565": {
      "BLOCK_M": 32,
      "BLOCK_N": 16,
      "BLOCK_K": 64,
      "BLOCK_C": 64,
      "NUM_KSPLIT": 8,
      "num_warps": 4,
      "num_stages": 1,
      "waves_per_eu": 1
    },
    "3609": {
      "BLOCK_M": 128,
      "BLOCK_N": 16,
      "BLOCK_K": 128,
      "BLOCK_C": 16,
      "NUM_KSPLIT": 1,
      "num_warps": 4,
      "num_stages": 2,
      "waves_per_eu": 0
    },
    "1519": {
      "BLOCK_M": 64,
      "BLOCK_N": 16,
      "BLOCK_K": 32,
      "BLOCK_C": 32,
      "NUM_KSPLIT": 1,
      "num_warps": 4,
      "num_stages": 1,
      "waves_per_eu": 1
    },
    "2441": {
      "BLOCK_M": 64,
      "BLOCK_N": 16,
      "BLOCK_K": 128,
      "BLOCK_C": 128,
      "NUM_KSPLIT": 8,
      "num_warps": 4,
      "num_stages": 2,
      "waves_per_eu": 2
    },
    "1583": {
      "BLOCK_M": 64,
      "BLOCK_N": 16,
      "BLOCK_K": 32,
      "BLOCK_C": 32,
      "NUM_KSPLIT": 8,
      "num_warps": 8,
      "num_stages": 2,
      "waves_per_eu": 2
    },
    "1100": {
      "BLOCK_M": 32,
      "BLOCK_N": 16,
      "BLOCK_K": 256,
      "BLOCK_C": 16,
      "NUM_KSPLIT": 2,
      "num_warps": 2,
      "num_stages": 1,
      "waves_per_eu": 2
    },
    "4135": {
      "BLOCK_M": 128,
      "BLOCK_N": 16,
      "BLOCK_K": 256,
      "BLOCK_C": 64,
      "NUM_KSPLIT": 2,
      "num_warps": 8,
      "num_stages": 1,
      "waves_per_eu": 1
    },
    "864": {
      "BLOCK_M": 32,
      "BLOCK_N": 16,
      "BLOCK_K": 128,
      "BLOCK_C": 64,
      "NUM_KSPLIT": 1,
      "num_warps": 2,
      "num_stages": 1,
      "waves_per_eu": 0
    },
    "4137": {
      "BLOCK_M": 128,
      "BLOCK_N": 16,
      "BLOCK_K": 256,
      "BLOCK_C": 64,
      "NUM_KSPLIT": 2,
      "num_warps": 8,
      "num_stages": 2,
      "waves_per_eu": 0
    },
    "5607": {
      "BLOCK_M": 256,
      "BLOCK_N": 16,
      "BLOCK_K": 256,
      "BLOCK_C": 64,
      "NUM_KSPLIT": 8,
      "num_warps": 4,
      "num_stages": 2,
      "waves_per_eu": 0
    },
    "2860": {
      "BLOCK_M": 64,
      "BLOCK_N": 16,
      "BLOCK_K": 256,
      "BLOCK_C": 256,
      "NUM_KSPLIT": 4,
      "num_warps": 8,
      "num_stages": 2,
      "waves_per_eu": 1
    },
    "1500": {
      "BLOCK_M": 64,
      "BLOCK_N": 16,
      "BLOCK_K": 32,
      "BLOCK_C": 16,
      "NUM_KSPLIT": 8,
      "num_warps": 4,
      "num_stages": 1,
      "waves_per_eu": 0
    },
    "3688": {
      "BLOCK_M": 128,
      "BLOCK_N": 16,
      "BLOCK_K": 128,
      "BLOCK_C": 32,
      "NUM_KSPLIT": 1,
      "num_warps": 8,
      "num_stages": 2,
      "waves_per_eu": 1
    },
    "4972": {
      "BLOCK_M": 256,
      "BLOCK_N": 16,
      "BLOCK_K": 64,
      "BLOCK_C": 256,
      "NUM_KSPLIT": 1,
      "num_warps": 2,
      "num_stages": 2,
      "waves_per_eu": 1
    },
    "3951": {
      "BLOCK_M": 128,
      "BLOCK_N": 16,
      "BLOCK_K": 128,
      "BLOCK_C": 256,
      "NUM_KSPLIT": 8,
      "num_warps": 4,
      "num_stages": 2,
      "waves_per_eu": 0
    },
    "1021": {
      "BLOCK_M": 32,
      "BLOCK_N": 16,
      "BLOCK_K": 128,
      "BLOCK_C": 256,
      "NUM_KSPLIT": 1,
      "num_warps": 8,
      "num_stages": 1,
      "waves_per_eu": 1
    },
    "4746": {
      "BLOCK_M": 256,
      "BLOCK_N": 16,
      "BLOCK_K": 64,
      "BLOCK_C": 16,
      "NUM_KSPLIT": 8,
      "num_warps": 8,
      "num_stages": 1,
      "waves_per_eu": 0
    },
    "1057": {
      "BLOCK_M": 32,
      "BLOCK_N": 16,
      "BLOCK_K": 128,
      "BLOCK_C": 256,
      "NUM_KSPLIT": 4,
      "num_warps": 8,
      "num_stages": 1,
      "waves_per_eu": 1
    },
    "4600": {
      "BLOCK_M": 256,
      "BLOCK_N": 16,
      "BLOCK_K": 32,
      "BLOCK_C": 128,
      "NUM_KSPLIT": 8,
      "num_warps": 4,
      "num_stages": 2,
      "waves_per_eu": 1
    },
    "5698": {
      "BLOCK_M": 256,
      "BLOCK_N": 16,
      "BLOCK_K": 256,
      "BLOCK_C": 256,
      "NUM_KSPLIT": 1,
      "num_warps": 4,
      "num_stages": 2,
      "waves_per_eu": 1
    },
    "4524": {
      "BLOCK_M": 256,
      "BLOCK_N": 16,
      "BLOCK_K": 32,
      "BLOCK_C": 64,
      "NUM_KSPLIT": 8,
      "num_warps": 4,
      "num_stages": 1,
      "waves_per_eu": 0
    },
    "2416": {
      "BLOCK_M": 64,
      "BLOCK_N": 16,
      "BLOCK_K": 128,
      "BLOCK_C": 128,
      "NUM_KSPLIT": 4,
      "num_warps": 2,
      "num_stages": 2,
      "waves_per_eu": 1
    },
    "2327": {
      "BLOCK_M": 64,
      "BLOCK_N": 16,
      "BLOCK_K": 128,
      "BLOCK_C": 64,
      "NUM_KSPLIT": 2,
      "num_warps": 2,
      "num_stages": 2,
      "waves_per_eu": 2
    },
    "5034": {
      "BLOCK_M": 256,
      "BLOCK_N": 16,
      "BLOCK_K": 64,
      "BLOCK_C": 256,
      "NUM_KSPLIT": 8,
      "num_warps": 8,
      "num_stages": 1,
      "waves_per_eu": 0
    },
    "3168": {
      "BLOCK_M": 128,
      "BLOCK_N": 16,
      "BLOCK_K": 32,
      "BLOCK_C": 256,
      "NUM_KSPLIT": 1,
      "num_warps": 2,
      "num_stages": 1,
      "waves_per_eu": 0
    },
    "497": {
      "BLOCK_M": 32,
      "BLOCK_N": 16,
      "BLOCK_K": 64,
      "BLOCK_C": 32,
      "NUM_KSPLIT": 8,
      "num_warps": 4,
      "num_stages": 2,
      "waves_per_eu": 2
    },
    "1402": {
      "BLOCK_M": 32,
      "BLOCK_N": 16,
      "BLOCK_K": 256,
      "BLOCK_C": 256,
      "NUM_KSPLIT": 2,
      "num_warps": 8,
      "num_stages": 2,
      "waves_per_eu": 1
    },
    "469": {
      "BLOCK_M": 32,
      "BLOCK_N": 16,
      "BLOCK_K": 64,
      "BLOCK_C": 32,
      "NUM_KSPLIT": 4,
      "num_warps": 2,
      "num_stages": 1,
      "waves_per_eu": 1
    },
    "932": {
      "BLOCK_M": 32,
      "BLOCK_N": 16,
      "BLOCK_K": 128,
      "BLOCK_C": 64,
      "NUM_KSPLIT": 8,
      "num_warps": 8,
      "num_stages": 1,
      "waves_per_eu": 2
    },
    "2898": {
      "BLOCK_M": 128,
      "BLOCK_N": 16,
      "BLOCK_K": 32,
      "BLOCK_C": 16,
      "NUM_KSPLIT": 2,
      "num_warps": 2,
      "num_stages": 1,
      "waves_per_eu": 0
    },
    "1778": {
      "BLOCK_M": 64,
      "BLOCK_N": 16,
      "BLOCK_K": 32,
      "BLOCK_C": 256,
      "NUM_KSPLIT": 4,
      "num_warps": 8,
      "num_stages": 1,
      "waves_per_eu": 2
    },
    "1370": {
      "BLOCK_M": 32,
      "BLOCK_N": 16,
      "BLOCK_K": 256,
      "BLOCK_C": 256,
      "NUM_KSPLIT": 1,
      "num_warps": 2,
      "num_stages": 1,
      "waves_per_eu": 2
    },
    "2852": {
      "BLOCK_M": 64,
      "BLOCK_N": 16,
      "BLOCK_K": 256,
      "BLOCK_C": 256,
      "NUM_KSPLIT": 4,
      "num_warps": 4,
      "num_stages": 1,
      "waves_per_eu": 2
    },
    "4433": {
      "BLOCK_M": 256,
      "BLOCK_N": 16,
      "BLOCK_K": 32,
      "BLOCK_C": 32,
      "NUM_KSPLIT": 4,
      "num_warps": 2,
      "num_stages": 2,
      "waves_per_eu": 2
    },
    "1147": {
      "BLOCK_M": 32,
      "BLOCK_N": 16,
      "BLOCK_K": 256,
      "BLOCK_C": 16,
      "NUM_KSPLIT": 8,
      "num_warps": 8,
      "num_stages": 1,
      "waves_per_eu": 1
    },
    "3051": {
      "BLOCK_M": 128,
      "BLOCK_N": 16,
      "BLOCK_K": 32,
      "BLOCK_C": 64,
      "NUM_KSPLIT": 2,
      "num_warps": 4,
      "num_stages": 2,
      "waves_per_eu": 0
    },
    "322": {
      "BLOCK_M": 32,
      "BLOCK_N": 16,
      "BLOCK_K": 32,
      "BLOCK_C": 256,
      "NUM_KSPLIT": 2,
      "num_warps": 8,
      "num_stages": 2,
      "waves_per_eu": 1
    },
    "977": {
      "BLOCK_M": 32,
      "BLOCK_N": 16,
      "BLOCK_K": 128,
      "BLOCK_C": 128,
      "NUM_KSPLIT": 4,
      "num_warps": 2,
      "num_stages": 2,
      "waves_per_eu": 2
    },
    "5216": {
      "BLOCK_M": 256,
      "BLOCK_N": 16,
      "BLOCK_K": 128,
      "BLOCK_C": 64,
      "NUM_KSPLIT": 2,
      "num_warps": 8,
      "num_stages": 1,
      "waves_per_eu": 2
    },
    "3387": {
      "BLOCK_M": 128,
      "BLOCK_N": 16,
      "BLOCK_K": 64,
      "BLOCK_C": 64,
      "NUM_KSPLIT": 1,
      "num_warps": 2,
      "num_stages": 2,
      "waves_per_eu": 0
    },
    "5723": {
      "BLOCK_M": 256,
      "BLOCK_N": 16,
      "BLOCK_K": 256,
      "BLOCK_C": 256,
      "NUM_KSPLIT": 2,
      "num_warps": 8,
      "num_stages": 2,
      "waves_per_eu": 2
    },
    "3459": {
      "BLOCK_M": 128,
      "BLOCK_N": 16,
      "BLOCK_K": 64,
      "BLOCK_C": 128,
      "NUM_KSPLIT": 1,
      "num_warps": 2,
      "num_stages": 2,
      "waves_per_eu": 0
    },
    "4083": {
      "BLOCK_M": 128,
      "BLOCK_N": 16,
      "BLOCK_K": 256,
      "BLOCK_C": 32,
      "NUM_KSPLIT": 4,
      "num_warps": 8,
      "num_stages": 2,
      "waves_per_eu": 0
    },
    "3543": {
      "BLOCK_M": 128,
      "BLOCK_N": 16,
      "BLOCK_K": 64,
      "BLOCK_C": 256,
      "NUM_KSPLIT": 1,
      "num_warps": 8,
      "num_stages": 2,
      "waves_per_eu": 0
    },
    "1633": {
      "BLOCK_M": 64,
      "BLOCK_N": 16,
      "BLOCK_K": 32,
      "BLOCK_C": 64,
      "NUM_KSPLIT": 4,
      "num_warps": 8,
      "num_stages": 1,
      "waves_per_eu": 1
    },
    "1028": {
      "BLOCK_M": 32,
      "BLOCK_N": 16,
      "BLOCK_K": 128,
      "BLOCK_C": 256,
      "NUM_KSPLIT": 2,
      "num_warps": 2,
      "num_stages": 1,
      "waves_per_eu": 2
    },
    "4852": {
      "BLOCK_M": 256,
      "BLOCK_N": 16,
      "BLOCK_K": 64,
      "BLOCK_C": 64,
      "NUM_KSPLIT": 2,
      "num_warps": 4,
      "num_stages": 2,
      "waves_per_eu": 1
    },
    "4967": {
      "BLOCK_M": 256,
      "BLOCK_N": 16,
      "BLOCK_K": 64,
      "BLOCK_C": 128,
      "NUM_KSPLIT": 8,
      "num_warps": 8,
      "num_stages": 2,
      "waves_per_eu": 2
    },
    "5045": {
      "BLOCK_M": 256,
      "BLOCK_N": 16,
      "BLOCK_K": 128,
      "BLOCK_C": 16,
      "NUM_KSPLIT": 1,
      "num_warps": 2,
      "num_stages": 2,
      "waves_per_eu": 2
    },
    "4022": {
      "BLOCK_M": 128,
      "BLOCK_N": 16,
      "BLOCK_K": 256,
      "BLOCK_C": 16,
      "NUM_KSPLIT": 8,
      "num_warps": 4,
      "num_stages": 1,
      "waves_per_eu": 2
    },
    "862": {
      "BLOCK_M": 32,
      "BLOCK_N": 16,
      "BLOCK_K": 128,
      "BLOCK_C": 32,
      "NUM_KSPLIT": 8,
      "num_warps": 8,
      "num_stages": 2,
      "waves_per_eu": 1
    },
    "54": {
      "BLOCK_M": 32,
      "BLOCK_N": 16,
      "BLOCK_K": 32,
      "BLOCK_C": 16,
      "NUM_KSPLIT": 8,
      "num_warps": 2,
      "num_stages": 1,
      "waves_per_eu": 0
    },
    "1179": {
      "BLOCK_M": 32,
      "BLOCK_N": 16,
      "BLOCK_K": 256,
      "BLOCK_C": 32,
      "NUM_KSPLIT": 2,
      "num_warps": 4,
      "num_stages": 2,
      "waves_per_eu": 0
    },
    "3210": {
      "BLOCK_M": 128,
      "BLOCK_N": 16,
      "BLOCK_K": 32,
      "BLOCK_C": 256,
      "NUM_KSPLIT": 4,
      "num_warps": 4,
      "num_stages": 1,
      "waves_per_eu": 0
    },
    "4006": {
      "BLOCK_M": 128,
      "BLOCK_N": 16,
      "BLOCK_K": 256,
      "BLOCK_C": 16,
      "NUM_KSPLIT": 4,
      "num_warps": 4,
      "num_stages": 2,
      "waves_per_eu": 1
    },
    "5693": {
      "BLOCK_M": 256,
      "BLOCK_N": 16,
      "BLOCK_K": 256,
      "BLOCK_C": 256,
      "NUM_KSPLIT": 1,
      "num_warps": 2,
      "num_stages": 2,
      "waves_per_eu": 2
    },
    "5051": {
      "BLOCK_M": 256,
      "BLOCK_N": 16,
      "BLOCK_K": 128,
      "BLOCK_C": 16,
      "NUM_KSPLIT": 1,
      "num_warps": 4,
      "num_stages": 2,
      "waves_per_eu": 2
    },
    "1971": {
      "BLOCK_M": 64,
      "BLOCK_N": 16,
      "BLOCK_K": 64,
      "BLOCK_C": 64,
      "NUM_KSPLIT": 2,
      "num_warps": 4,
      "num_stages": 2,
      "waves_per_eu": 0
    },
    "3012": {
      "BLOCK_M": 128,
      "BLOCK_N": 16,
      "BLOCK_K": 32,
      "BLOCK_C": 32,
      "NUM_KSPLIT": 8,
      "num_warps": 4,
      "num_stages": 1,
      "waves_per_eu": 0
    },
    "1196": {
      "BLOCK_M": 32,
      "BLOCK_N": 16,
      "BLOCK_K": 256,
      "BLOCK_C": 32,
      "NUM_KSPLIT": 4,
      "num_warps": 4,
      "num_stages": 1,
      "waves_per_eu": 2
    },
    "1568": {
      "BLOCK_M": 64,
      "BLOCK_N": 16,
      "BLOCK_K": 32,
      "BLOCK_C": 32,
      "NUM_KSPLIT": 8,
      "num_warps": 2,
      "num_stages": 1,
      "waves_per_eu": 2
    },
    "4484": {
      "BLOCK_M": 256,
      "BLOCK_N": 16,
      "BLOCK_K": 32,
      "BLOCK_C": 64,
      "NUM_KSPLIT": 2,
      "num_warps": 2,
      "num_stages": 1,
      "waves_per_eu": 2
    },
    "4949": {
      "BLOCK_M": 256,
      "BLOCK_N": 16,
      "BLOCK_K": 64,
      "BLOCK_C": 128,
      "NUM_KSPLIT": 4,
      "num_warps": 8,
      "num_stages": 2,
      "waves_per_eu": 2
    },
    "861": {
      "BLOCK_M": 32,
      "BLOCK_N": 16,
      "BLOCK_K": 128,
      "BLOCK_C": 32,
      "NUM_KSPLIT": 8,
      "num_warps": 8,
      "num_stages": 2,
      "waves_per_eu": 0
    },
    "3023": {
      "BLOCK_M": 128,
      "BLOCK_N": 16,
      "BLOCK_K": 32,
      "BLOCK_C": 32,
      "NUM_KSPLIT": 8,
      "num_warps": 8,
      "num_stages": 2,
      "waves_per_eu": 2
    },
    "5099": {
      "BLOCK_M": 256,
      "BLOCK_N": 16,
      "BLOCK_K": 128,
      "BLOCK_C": 16,
      "NUM_KSPLIT": 8,
      "num_warps": 2,
      "num_stages": 2,
      "waves_per_eu": 2
    },
    "1294": {
      "BLOCK_M": 32,
      "BLOCK_N": 16,
      "BLOCK_K": 256,
      "BLOCK_C": 64,
      "NUM_KSPLIT": 8,
      "num_warps": 8,
      "num_stages": 2,
      "waves_per_eu": 1
    },
    "5043": {
      "BLOCK_M": 256,
      "BLOCK_N": 16,
      "BLOCK_K": 128,
      "BLOCK_C": 16,
      "NUM_KSPLIT": 1,
      "num_warps": 2,
      "num_stages": 2,
      "waves_per_eu": 0
    },
    "2045": {
      "BLOCK_M": 64,
      "BLOCK_N": 16,
      "BLOCK_K": 64,
      "BLOCK_C": 128,
      "NUM_KSPLIT": 2,
      "num_warps": 4,
      "num_stages": 2,
      "waves_per_eu": 2
    },
    "5122": {
      "BLOCK_M": 256,
      "BLOCK_N": 16,
      "BLOCK_K": 128,
      "BLOCK_C": 32,
      "NUM_KSPLIT": 1,
      "num_warps": 4,
      "num_stages": 2,
      "waves_per_eu": 1
    },
    "1233": {
      "BLOCK_M": 32,
      "BLOCK_N": 16,
      "BLOCK_K": 256,
      "BLOCK_C": 64,
      "NUM_KSPLIT": 1,
      "num_warps": 4,
      "num_stages": 2,
      "waves_per_eu": 0
    },
    "2462": {
      "BLOCK_M": 64,
      "BLOCK_N": 16,
      "BLOCK_K": 128,
      "BLOCK_C": 256,
      "NUM_KSPLIT": 1,
      "num_warps": 8,
      "num_stages": 1,
      "waves_per_eu": 2
    },
    "3321": {
      "BLOCK_M": 128,
      "BLOCK_N": 16,
      "BLOCK_K": 64,
      "BLOCK_C": 32,
      "NUM_KSPLIT": 1,
      "num_warps": 4,
      "num_stages": 2,
      "waves_per_eu": 0
    },
    "2218": {
      "BLOCK_M": 64,
      "BLOCK_N": 16,
      "BLOCK_K": 128,
      "BLOCK_C": 16,
      "NUM_KSPLIT": 8,
      "num_warps": 2,
      "num_stages": 2,
      "waves_per_eu": 1
    },
    "561": {
      "BLOCK_M": 32,
      "BLOCK_N": 16,
      "BLOCK_K": 64,
      "BLOCK_C": 64,
      "NUM_KSPLIT": 8,
      "num_warps": 2,
      "num_stages": 2,
      "waves_per_eu": 0
    },
    "2532": {
      "BLOCK_M": 64,
      "BLOCK_N": 16,
      "BLOCK_K": 256,
      "BLOCK_C": 16,
      "NUM_KSPLIT": 1,
      "num_warps": 8,
      "num_stages": 1,
      "waves_per_eu": 0
    },
    "3323": {
      "BLOCK_M": 128,
      "BLOCK_N": 16,
      "BLOCK_K": 64,
      "BLOCK_C": 32,
      "NUM_KSPLIT": 1,
      "num_warps": 4,
      "num_stages": 2,
      "waves_per_eu": 2
    },
    "2461": {
      "BLOCK_M": 64,
      "BLOCK_N": 16,
      "BLOCK_K": 128,
      "BLOCK_C": 256,
      "NUM_KSPLIT": 1,
      "num_warps": 8,
      "num_stages": 1,
      "waves_per_eu": 1
    },
    "4942": {
      "BLOCK_M": 256,
      "BLOCK_N": 16,
      "BLOCK_K": 64,
      "BLOCK_C": 128,
      "NUM_KSPLIT": 4,
      "num_warps": 4,
      "num_stages": 2,
      "waves_per_eu": 1
    },
    "3905": {
      "BLOCK_M": 128,
      "BLOCK_N": 16,
      "BLOCK_K": 128,
      "BLOCK_C": 256,
      "NUM_KSPLIT": 1,
      "num_warps": 8,
      "num_stages": 2,
      "waves_per_eu": 2
    },
    "2363": {
      "BLOCK_M": 64,
      "BLOCK_N": 16,
      "BLOCK_K": 128,
      "BLOCK_C": 64,
      "NUM_KSPLIT": 8,
      "num_warps": 2,
      "num_stages": 2,
      "waves_per_eu": 2
    },
    "1608": {
      "BLOCK_M": 64,
      "BLOCK_N": 16,
      "BLOCK_K": 32,
      "BLOCK_C": 64,
      "NUM_KSPLIT": 2,
      "num_warps": 4,
      "num_stages": 1,
      "waves_per_eu": 0
    },
    "1429": {
      "BLOCK_M": 32,
      "BLOCK_N": 16,
      "BLOCK_K": 256,
      "BLOCK_C": 256,
      "NUM_KSPLIT": 8,
      "num_warps": 4,
      "num_stages": 1,
      "waves_per_eu": 1
    },
    "5734": {
      "BLOCK_M": 256,
      "BLOCK_N": 16,
      "BLOCK_K": 256,
      "BLOCK_C": 256,
      "NUM_KSPLIT": 4,
      "num_warps": 4,
      "num_stages": 2,
      "waves_per_eu": 1
    },
    "231": {
      "BLOCK_M": 32,
      "BLOCK_N": 16,
      "BLOCK_K": 32,
      "BLOCK_C": 128,
      "NUM_KSPLIT": 1,
      "num_warps": 8,
      "num_stages": 2,
      "waves_per_eu": 0
    },
    "4256": {
      "BLOCK_M": 128,
      "BLOCK_N": 16,
      "BLOCK_K": 256,
      "BLOCK_C": 256,
      "NUM_KSPLIT": 1,
      "num_warps": 4,
      "num_stages": 1,
      "waves_per_eu": 2
    },
    "900": {
      "BLOCK_M": 32,
      "BLOCK_N": 16,
      "BLOCK_K": 128,
      "BLOCK_C": 64,
      "NUM_KSPLIT": 4,
      "num_warps": 2,
      "num_stages": 1,
      "waves_per_eu": 0
    },
    "4152": {
      "BLOCK_M": 128,
      "BLOCK_N": 16,
      "BLOCK_K": 256,
      "BLOCK_C": 64,
      "NUM_KSPLIT": 4,
      "num_warps": 8,
      "num_stages": 1,
      "waves_per_eu": 0
    },
    "256": {
      "BLOCK_M": 32,
      "BLOCK_N": 16,
      "BLOCK_K": 32,
      "BLOCK_C": 128,
      "NUM_KSPLIT": 4,
      "num_warps": 2,
      "num_stages": 2,
      "waves_per_eu": 1
    },
    "2745": {
      "BLOCK_M": 64,
      "BLOCK_N": 16,
      "BLOCK_K": 256,
      "BLOCK_C": 128,
      "NUM_KSPLIT": 1,
      "num_warps": 4,
      "num_stages": 2,
      "waves_per_eu": 0
    },
    "1931": {
      "BLOCK_M": 64,
      "BLOCK_N": 16,
      "BLOCK_K": 64,
      "BLOCK_C": 32,
      "NUM_KSPLIT": 8,
      "num_warps": 2,
      "num_stages": 2,
      "waves_per_eu": 2
    },
    "1890": {
      "BLOCK_M": 64,
      "BLOCK_N": 16,
      "BLOCK_K": 64,
      "BLOCK_C": 32,
      "NUM_KSPLIT": 2,
      "num_warps": 2,
      "num_stages": 1,
      "waves_per_eu": 0
    },
    "3470": {
      "BLOCK_M": 128,
      "BLOCK_N": 16,
      "BLOCK_K": 64,
      "BLOCK_C": 128,
      "NUM_KSPLIT": 1,
      "num_warps": 8,
      "num_stages": 1,
      "waves_per_eu": 2
    },
    "787": {
      "BLOCK_M": 32,
      "BLOCK_N": 16,
      "BLOCK_K": 128,
      "BLOCK_C": 16,
      "NUM_KSPLIT": 8,
      "num_warps": 8,
      "num_stages": 1,
      "waves_per_eu": 1
    },
    "1373": {
      "BLOCK_M": 32,
      "BLOCK_N": 16,
      "BLOCK_K": 256,
      "BLOCK_C": 256,
      "NUM_KSPLIT": 1,
      "num_warps": 2,
      "num_stages": 2,
      "waves_per_eu": 2
    },
    "3641": {
      "BLOCK_M": 128,
      "BLOCK_N": 16,
      "BLOCK_K": 128,
      "BLOCK_C": 16,
      "NUM_KSPLIT": 4,
      "num_warps": 2,
      "num_stages": 2,
      "waves_per_eu": 2
    },
    "2331": {
      "BLOCK_M": 64,
      "BLOCK_N": 16,
      "BLOCK_K": 128,
      "BLOCK_C": 64,
      "NUM_KSPLIT": 2,
      "num_warps": 4,
      "num_stages": 2,
      "waves_per_eu": 0
    },
    "4728": {
      "BLOCK_M": 256,
      "BLOCK_N": 16,
      "BLOCK_K": 64,
      "BLOCK_C": 16,
      "NUM_KSPLIT": 4,
      "num_warps": 8,
      "num_stages": 1,
      "waves_per_eu": 0
    },
    "4496": {
      "BLOCK_M": 256,
      "BLOCK_N": 16,
      "BLOCK_K": 32,
      "BLOCK_C": 64,
      "NUM_KSPLIT": 2,
      "num_warps": 8,
      "num_stages": 1,
      "waves_per_eu": 2
    },
    "5454": {
      "BLOCK_M": 256,
      "BLOCK_N": 16,
      "BLOCK_K": 256,
      "BLOCK_C": 16,
      "NUM_KSPLIT": 8,
      "num_warps": 2,
      "num_stages": 1,
      "waves_per_eu": 0
    },
    "4468": {
      "BLOCK_M": 256,
      "BLOCK_N": 16,
      "BLOCK_K": 32,
      "BLOCK_C": 64,
      "NUM_KSPLIT": 1,
      "num_warps": 2,
      "num_stages": 2,
      "waves_per_eu": 1
    },
    "3301": {
      "BLOCK_M": 128,
      "BLOCK_N": 16,
      "BLOCK_K": 64,
      "BLOCK_C": 16,
      "NUM_KSPLIT": 8,
      "num_warps": 4,
      "num_stages": 1,
      "waves_per_eu": 1
    },
    "4576": {
      "BLOCK_M": 256,
      "BLOCK_N": 16,
      "BLOCK_K": 32,
      "BLOCK_C": 128,
      "NUM_KSPLIT": 4,
      "num_warps": 2,
      "num_stages": 2,
      "waves_per_eu": 1
    },
    "1871": {
      "BLOCK_M": 64,
      "BLOCK_N": 16,
      "BLOCK_K": 64,
      "BLOCK_C": 16,
      "NUM_KSPLIT": 8,
      "num_warps": 8,
      "num_stages": 2,
      "waves_per_eu": 2
    },
    "1157": {
      "BLOCK_M": 32,
      "BLOCK_N": 16,
      "BLOCK_K": 256,
      "BLOCK_C": 32,
      "NUM_KSPLIT": 1,
      "num_warps": 2,
      "num_stages": 2,
      "waves_per_eu": 2
    },
    "2797": {
      "BLOCK_M": 64,
      "BLOCK_N": 16,
      "BLOCK_K": 256,
      "BLOCK_C": 128,
      "NUM_KSPLIT": 8,
      "num_warps": 4,
      "num_stages": 1,
      "waves_per_eu": 1
    },
    "4327": {
      "BLOCK_M": 256,
      "BLOCK_N": 16,
      "BLOCK_K": 32,
      "BLOCK_C": 16,
      "NUM_KSPLIT": 1,
      "num_warps": 4,
      "num_stages": 1,
      "waves_per_eu": 1
    },
    "1362": {
      "BLOCK_M": 32,
      "BLOCK_N": 16,
      "BLOCK_K": 256,
      "BLOCK_C": 128,
      "NUM_KSPLIT": 8,
      "num_warps": 8,
      "num_stages": 1,
      "waves_per_eu": 0
    },
    "3784": {
      "BLOCK_M": 128,
      "BLOCK_N": 16,
      "BLOCK_K": 128,
      "BLOCK_C": 64,
      "NUM_KSPLIT": 4,
      "num_warps": 2,
      "num_stages": 2,
      "waves_per_eu": 1
    },
    "2451": {
      "BLOCK_M": 64,
      "BLOCK_N": 16,
      "BLOCK_K": 128,
      "BLOCK_C": 256,
      "NUM_KSPLIT": 1,
      "num_warps": 2,
      "num_stages": 2,
      "waves_per_eu": 0
    },
    "1798": {
      "BLOCK_M": 64,
      "BLOCK_N": 16,
      "BLOCK_K": 32,
      "BLOCK_C": 256,
      "NUM_KSPLIT": 8,
      "num_warps": 8,
      "num_stages": 2,
      "waves_per_eu": 1
    },
    "1146": {
      "BLOCK_M": 32,
      "BLOCK_N": 16,
      "BLOCK_K": 256,
      "BLOCK_C": 16,
      "NUM_KSPLIT": 8,
      "num_warps": 8,
      "num_stages": 1,
      "waves_per_eu": 0
    },
    "931": {
      "BLOCK_M": 32,
      "BLOCK_N": 16,
      "BLOCK_K": 128,
      "BLOCK_C": 64,
      "NUM_KSPLIT": 8,
      "num_warps": 8,
      "num_stages": 1,
      "waves_per_eu": 1
    },
    "3791": {
      "BLOCK_M": 128,
      "BLOCK_N": 16,
      "BLOCK_K": 128,
      "BLOCK_C": 64,
      "NUM_KSPLIT": 4,
      "num_warps": 4,
      "num_stages": 2,
      "waves_per_eu": 2
    },
    "3006": {
      "BLOCK_M": 128,
      "BLOCK_N": 16,
      "BLOCK_K": 32,
      "BLOCK_C": 32,
      "NUM_KSPLIT": 8,
      "num_warps": 2,
      "num_stages": 1,
      "waves_per_eu": 0
    },
    "3657": {
      "BLOCK_M": 128,
      "BLOCK_N": 16,
      "BLOCK_K": 128,
      "BLOCK_C": 16,
      "NUM_KSPLIT": 8,
      "num_warps": 2,
      "num_stages": 2,
      "waves_per_eu": 0
    },
    "5407": {
      "BLOCK_M": 256,
      "BLOCK_N": 16,
      "BLOCK_K": 256,
      "BLOCK_C": 16,
      "NUM_KSPLIT": 1,
      "num_warps": 4,
      "num_stages": 1,
      "waves_per_eu": 1
    },
    "4195": {
      "BLOCK_M": 128,
      "BLOCK_N": 16,
      "BLOCK_K": 256,
      "BLOCK_C": 128,
      "NUM_KSPLIT": 2,
      "num_warps": 2,
      "num_stages": 1,
      "waves_per_eu": 1
    },
    "4139": {
      "BLOCK_M": 128,
      "BLOCK_N": 16,
      "BLOCK_K": 256,
      "BLOCK_C": 64,
      "NUM_KSPLIT": 2,
      "num_warps": 8,
      "num_stages": 2,
      "waves_per_eu": 2
    },
    "2848": {
      "BLOCK_M": 64,
      "BLOCK_N": 16,
      "BLOCK_K": 256,
      "BLOCK_C": 256,
      "NUM_KSPLIT": 4,
      "num_warps": 2,
      "num_stages": 2,
      "waves_per_eu": 1
    },
    "3879": {
      "BLOCK_M": 128,
      "BLOCK_N": 16,
      "BLOCK_K": 128,
      "BLOCK_C": 128,
      "NUM_KSPLIT": 8,
      "num_warps": 4,
      "num_stages": 2,
      "waves_per_eu": 0
    },
    "3687": {
      "BLOCK_M": 128,
      "BLOCK_N": 16,
      "BLOCK_K": 128,
      "BLOCK_C": 32,
      "NUM_KSPLIT": 1,
      "num_warps": 8,
      "num_stages": 2,
      "waves_per_eu": 0
    },
    "1927": {
      "BLOCK_M": 64,
      "BLOCK_N": 16,
      "BLOCK_K": 64,
      "BLOCK_C": 32,
      "NUM_KSPLIT": 8,
      "num_warps": 2,
      "num_stages": 1,
      "waves_per_eu": 1
    },
    "879": {
      "BLOCK_M": 32,
      "BLOCK_N": 16,
      "BLOCK_K": 128,
      "BLOCK_C": 64,
      "NUM_KSPLIT": 1,
      "num_warps": 8,
      "num_stages": 2,
      "waves_per_eu": 0
    },
    "4687": {
      "BLOCK_M": 256,
      "BLOCK_N": 16,
      "BLOCK_K": 64,
      "BLOCK_C": 16,
      "NUM_KSPLIT": 1,
      "num_warps": 4,
      "num_stages": 1,
      "waves_per_eu": 1
    },
    "5405": {
      "BLOCK_M": 256,
      "BLOCK_N": 16,
      "BLOCK_K": 256,
      "BLOCK_C": 16,
      "NUM_KSPLIT": 1,
      "num_warps": 2,
      "num_stages": 2,
      "waves_per_eu": 2
    },
    "5540": {
      "BLOCK_M": 256,
      "BLOCK_N": 16,
      "BLOCK_K": 256,
      "BLOCK_C": 32,
      "NUM_KSPLIT": 8,
      "num_warps": 8,
      "num_stages": 1,
      "waves_per_eu": 2
    },
    "2749": {
      "BLOCK_M": 64,
      "BLOCK_N": 16,
      "BLOCK_K": 256,
      "BLOCK_C": 128,
      "NUM_KSPLIT": 1,
      "num_warps": 8,
      "num_stages": 1,
      "waves_per_eu": 1
    },
    "710": {
      "BLOCK_M": 32,
      "BLOCK_N": 16,
      "BLOCK_K": 64,
      "BLOCK_C": 256,
      "NUM_KSPLIT": 8,
      "num_warps": 4,
      "num_stages": 1,
      "waves_per_eu": 2
    },
    "2931": {
      "BLOCK_M": 128,
      "BLOCK_N": 16,
      "BLOCK_K": 32,
      "BLOCK_C": 16,
      "NUM_KSPLIT": 4,
      "num_warps": 8,
      "num_stages": 2,
      "waves_per_eu": 0
    },
    "2894": {
      "BLOCK_M": 128,
      "BLOCK_N": 16,
      "BLOCK_K": 32,
      "BLOCK_C": 16,
      "NUM_KSPLIT": 1,
      "num_warps": 8,
      "num_stages": 1,
      "waves_per_eu": 2
    },
    "5221": {
      "BLOCK_M": 256,
      "BLOCK_N": 16,
      "BLOCK_K": 128,
      "BLOCK_C": 64,
      "NUM_KSPLIT": 4,
      "num_warps": 2,
      "num_stages": 1,
      "waves_per_eu": 1
    },
    "3457": {
      "BLOCK_M": 128,
      "BLOCK_N": 16,
      "BLOCK_K": 64,
      "BLOCK_C": 128,
      "NUM_KSPLIT": 1,
      "num_warps": 2,
      "num_stages": 1,
      "waves_per_eu": 1
    },
    "2292": {
      "BLOCK_M": 64,
      "BLOCK_N": 16,
      "BLOCK_K": 128,
      "BLOCK_C": 32,
      "NUM_KSPLIT": 8,
      "num_warps": 4,
      "num_stages": 1,
      "waves_per_eu": 0
    },
    "2443": {
      "BLOCK_M": 64,
      "BLOCK_N": 16,
      "BLOCK_K": 128,
      "BLOCK_C": 128,
      "NUM_KSPLIT": 8,
      "num_warps": 8,
      "num_stages": 1,
      "waves_per_eu": 1
    },
    "4509": {
      "BLOCK_M": 256,
      "BLOCK_N": 16,
      "BLOCK_K": 32,
      "BLOCK_C": 64,
      "NUM_KSPLIT": 4,
      "num_warps": 4,
      "num_stages": 2,
      "waves_per_eu": 0
    },
    "2801": {
      "BLOCK_M": 64,
      "BLOCK_N": 16,
      "BLOCK_K": 256,
      "BLOCK_C": 128,
      "NUM_KSPLIT": 8,
      "num_warps": 4,
      "num_stages": 2,
      "waves_per_eu": 2
    },
    "3079": {
      "BLOCK_M": 128,
      "BLOCK_N": 16,
      "BLOCK_K": 32,
      "BLOCK_C": 64,
      "NUM_KSPLIT": 8,
      "num_warps": 2,
      "num_stages": 1,
      "waves_per_eu": 1
    },
    "4467": {
      "BLOCK_M": 256,
      "BLOCK_N": 16,
      "BLOCK_K": 32,
      "BLOCK_C": 64,
      "NUM_KSPLIT": 1,
      "num_warps": 2,
      "num_stages": 2,
      "waves_per_eu": 0
    },
    "1312": {
      "BLOCK_M": 32,
      "BLOCK_N": 16,
      "BLOCK_K": 256,
      "BLOCK_C": 128,
      "NUM_KSPLIT": 1,
      "num_warps": 8,
      "num_stages": 2,
      "waves_per_eu": 1
    },
    "1088": {
      "BLOCK_M": 32,
      "BLOCK_N": 16,
      "BLOCK_K": 256,
      "BLOCK_C": 16,
      "NUM_KSPLIT": 1,
      "num_warps": 4,
      "num_stages": 1,
      "waves_per_eu": 2
    },
    "1158": {
      "BLOCK_M": 32,
      "BLOCK_N": 16,
      "BLOCK_K": 256,
      "BLOCK_C": 32,
      "NUM_KSPLIT": 1,
      "num_warps": 4,
      "num_stages": 1,
      "waves_per_eu": 0
    },
    "3070": {
      "BLOCK_M": 128,
      "BLOCK_N": 16,
      "BLOCK_K": 32,
      "BLOCK_C": 64,
      "NUM_KSPLIT": 4,
      "num_warps": 4,
      "num_stages": 2,
      "waves_per_eu": 1
    },
    "4721": {
      "BLOCK_M": 256,
      "BLOCK_N": 16,
      "BLOCK_K": 64,
      "BLOCK_C": 16,
      "NUM_KSPLIT": 4,
      "num_warps": 2,
      "num_stages": 2,
      "waves_per_eu": 2
    },
    "1292": {
      "BLOCK_M": 32,
      "BLOCK_N": 16,
      "BLOCK_K": 256,
      "BLOCK_C": 64,
      "NUM_KSPLIT": 8,
      "num_warps": 8,
      "num_stages": 1,
      "waves_per_eu": 2
    },
    "10": {
      "BLOCK_M": 32,
      "BLOCK_N": 16,
      "BLOCK_K": 32,
      "BLOCK_C": 16,
      "NUM_KSPLIT": 1,
      "num_warps": 4,
      "num_stages": 2,
      "waves_per_eu": 1
    },
    "21": {
      "BLOCK_M": 32,
      "BLOCK_N": 16,
      "BLOCK_K": 32,
      "BLOCK_C": 16,
      "NUM_KSPLIT": 2,
      "num_warps": 2,
      "num_stages": 2,
      "waves_per_eu": 0
    },
    "4079": {
      "BLOCK_M": 128,
      "BLOCK_N": 16,
      "BLOCK_K": 256,
      "BLOCK_C": 32,
      "NUM_KSPLIT": 4,
      "num_warps": 4,
      "num_stages": 2,
      "waves_per_eu": 2
    },
    "138": {
      "BLOCK_M": 32,
      "BLOCK_N": 16,
      "BLOCK_K": 32,
      "BLOCK_C": 32,
      "NUM_KSPLIT": 8,
      "num_warps": 8,
      "num_stages": 1,
      "waves_per_eu": 0
    },
    "2808": {
      "BLOCK_M": 64,
      "BLOCK_N": 16,
      "BLOCK_K": 256,
      "BLOCK_C": 256,
      "NUM_KSPLIT": 1,
      "num_warps": 2,
      "num_stages": 1,
      "waves_per_eu": 0
    },
    "4184": {
      "BLOCK_M": 128,
      "BLOCK_N": 16,
      "BLOCK_K": 256,
      "BLOCK_C": 128,
      "NUM_KSPLIT": 1,
      "num_warps": 4,
      "num_stages": 1,
      "waves_per_eu": 2
    },
    "5440": {
      "BLOCK_M": 256,
      "BLOCK_N": 16,
      "BLOCK_K": 256,
      "BLOCK_C": 16,
      "NUM_KSPLIT": 4,
      "num_warps": 2,
      "num_stages": 2,
      "waves_per_eu": 1
    },
    "485": {
      "BLOCK_M": 32,
      "BLOCK_N": 16,
      "BLOCK_K": 64,
      "BLOCK_C": 32,
      "NUM_KSPLIT": 4,
      "num_warps": 8,
      "num_stages": 2,
      "waves_per_eu": 2
    },
    "625": {
      "BLOCK_M": 32,
      "BLOCK_N": 16,
      "BLOCK_K": 64,
      "BLOCK_C": 128,
      "NUM_KSPLIT": 4,
      "num_warps": 8,
      "num_stages": 1,
      "waves_per_eu": 1
    },
    "4264": {
      "BLOCK_M": 128,
      "BLOCK_N": 16,
      "BLOCK_K": 256,
      "BLOCK_C": 256,
      "NUM_KSPLIT": 1,
      "num_warps": 8,
      "num_stages": 2,
      "waves_per_eu": 1
    },
    "3492": {
      "BLOCK_M": 128,
      "BLOCK_N": 16,
      "BLOCK_K": 64,
      "BLOCK_C": 128,
      "NUM_KSPLIT": 4,
      "num_warps": 2,
      "num_stages": 1,
      "waves_per_eu": 0
    },
    "4989": {
      "BLOCK_M": 256,
      "BLOCK_N": 16,
      "BLOCK_K": 64,
      "BLOCK_C": 256,
      "NUM_KSPLIT": 2,
      "num_warps": 2,
      "num_stages": 2,
      "waves_per_eu": 0
    },
    "4835": {
      "BLOCK_M": 256,
      "BLOCK_N": 16,
      "BLOCK_K": 64,
      "BLOCK_C": 64,
      "NUM_KSPLIT": 1,
      "num_warps": 4,
      "num_stages": 2,
      "waves_per_eu": 2
    },
    "69": {
      "BLOCK_M": 32,
      "BLOCK_N": 16,
      "BLOCK_K": 32,
      "BLOCK_C": 16,
      "NUM_KSPLIT": 8,
      "num_warps": 8,
      "num_stages": 2,
      "waves_per_eu": 0
    },
    "3731": {
      "BLOCK_M": 128,
      "BLOCK_N": 16,
      "BLOCK_K": 128,
      "BLOCK_C": 32,
      "NUM_KSPLIT": 8,
      "num_warps": 2,
      "num_stages": 2,
      "waves_per_eu": 2
    },
    "1914": {
      "BLOCK_M": 64,
      "BLOCK_N": 16,
      "BLOCK_K": 64,
      "BLOCK_C": 32,
      "NUM_KSPLIT": 4,
      "num_warps": 4,
      "num_stages": 1,
      "waves_per_eu": 0
    },
    "4010": {
      "BLOCK_M": 128,
      "BLOCK_N": 16,
      "BLOCK_K": 256,
      "BLOCK_C": 16,
      "NUM_KSPLIT": 4,
      "num_warps": 8,
      "num_stages": 1,
      "waves_per_eu": 2
    },
    "3010": {
      "BLOCK_M": 128,
      "BLOCK_N": 16,
      "BLOCK_K": 32,
      "BLOCK_C": 32,
      "NUM_KSPLIT": 8,
      "num_warps": 2,
      "num_stages": 2,
      "waves_per_eu": 1
    },
    "4755": {
      "BLOCK_M": 256,
      "BLOCK_N": 16,
      "BLOCK_K": 64,
      "BLOCK_C": 32,
      "NUM_KSPLIT": 1,
      "num_warps": 2,
      "num_stages": 2,
      "waves_per_eu": 0
    },
    "445": {
      "BLOCK_M": 32,
      "BLOCK_N": 16,
      "BLOCK_K": 64,
      "BLOCK_C": 32,
      "NUM_KSPLIT": 1,
      "num_warps": 8,
      "num_stages": 1,
      "waves_per_eu": 1
    },
    "1198": {
      "BLOCK_M": 32,
      "BLOCK_N": 16,
      "BLOCK_K": 256,
      "BLOCK_C": 32,
      "NUM_KSPLIT": 4,
      "num_warps": 4,
      "num_stages": 2,
      "waves_per_eu": 1
    },
    "2490": {
      "BLOCK_M": 64,
      "BLOCK_N": 16,
      "BLOCK_K": 128,
      "BLOCK_C": 256,
      "NUM_KSPLIT": 4,
      "num_warps": 4,
      "num_stages": 1,
      "waves_per_eu": 0
    },
    "1685": {
      "BLOCK_M": 64,
      "BLOCK_N": 16,
      "BLOCK_K": 32,
      "BLOCK_C": 128,
      "NUM_KSPLIT": 2,
      "num_warps": 4,
      "num_stages": 2,
      "waves_per_eu": 2
    },
    "3875": {
      "BLOCK_M": 128,
      "BLOCK_N": 16,
      "BLOCK_K": 128,
      "BLOCK_C": 128,
      "NUM_KSPLIT": 8,
      "num_warps": 2,
      "num_stages": 2,
      "waves_per_eu": 2
    },
    "2958": {
      "BLOCK_M": 128,
      "BLOCK_N": 16,
      "BLOCK_K": 32,
      "BLOCK_C": 32,
      "NUM_KSPLIT": 1,
      "num_warps": 4,
      "num_stages": 1,
      "waves_per_eu": 0
    },
    "3411": {
      "BLOCK_M": 128,
      "BLOCK_N": 16,
      "BLOCK_K": 64,
      "BLOCK_C": 64,
      "NUM_KSPLIT": 2,
      "num_warps": 4,
      "num_stages": 2,
      "waves_per_eu": 0
    },
    "3574": {
      "BLOCK_M": 128,
      "BLOCK_N": 16,
      "BLOCK_K": 64,
      "BLOCK_C": 256,
      "NUM_KSPLIT": 4,
      "num_warps": 4,
      "num_stages": 2,
      "waves_per_eu": 1
    },
    "3796": {
      "BLOCK_M": 128,
      "BLOCK_N": 16,
      "BLOCK_K": 128,
      "BLOCK_C": 64,
      "NUM_KSPLIT": 4,
      "num_warps": 8,
      "num_stages": 2,
      "waves_per_eu": 1
    },
    "5418": {
      "BLOCK_M": 256,
      "BLOCK_N": 16,
      "BLOCK_K": 256,
      "BLOCK_C": 16,
      "NUM_KSPLIT": 2,
      "num_warps": 2,
      "num_stages": 1,
      "waves_per_eu": 0
    },
    "5110": {
      "BLOCK_M": 256,
      "BLOCK_N": 16,
      "BLOCK_K": 128,
      "BLOCK_C": 16,
      "NUM_KSPLIT": 8,
      "num_warps": 8,
      "num_stages": 2,
      "waves_per_eu": 1
    },
    "2763": {
      "BLOCK_M": 64,
      "BLOCK_N": 16,
      "BLOCK_K": 256,
      "BLOCK_C": 128,
      "NUM_KSPLIT": 2,
      "num_warps": 4,
      "num_stages": 2,
      "waves_per_eu": 0
    },
    "4254": {
      "BLOCK_M": 128,
      "BLOCK_N": 16,
      "BLOCK_K": 256,
      "BLOCK_C": 256,
      "NUM_KSPLIT": 1,
      "num_warps": 4,
      "num_stages": 1,
      "waves_per_eu": 0
    },
    "3967": {
      "BLOCK_M": 128,
      "BLOCK_N": 16,
      "BLOCK_K": 256,
      "BLOCK_C": 16,
      "NUM_KSPLIT": 1,
      "num_warps": 4,
      "num_stages": 1,
      "waves_per_eu": 1
    },
    "5158": {
      "BLOCK_M": 256,
      "BLOCK_N": 16,
      "BLOCK_K": 128,
      "BLOCK_C": 32,
      "NUM_KSPLIT": 4,
      "num_warps": 4,
      "num_stages": 2,
      "waves_per_eu": 1
    },
    "3042": {
      "BLOCK_M": 128,
      "BLOCK_N": 16,
      "BLOCK_K": 32,
      "BLOCK_C": 64,
      "NUM_KSPLIT": 2,
      "num_warps": 2,
      "num_stages": 1,
      "waves_per_eu": 0
    },
    "4587": {
      "BLOCK_M": 256,
      "BLOCK_N": 16,
      "BLOCK_K": 32,
      "BLOCK_C": 128,
      "NUM_KSPLIT": 4,
      "num_warps": 8,
      "num_stages": 2,
      "waves_per_eu": 0
    },
    "4402": {
      "BLOCK_M": 256,
      "BLOCK_N": 16,
      "BLOCK_K": 32,
      "BLOCK_C": 32,
      "NUM_KSPLIT": 1,
      "num_warps": 4,
      "num_stages": 2,
      "waves_per_eu": 1
    },
    "4324": {
      "BLOCK_M": 256,
      "BLOCK_N": 16,
      "BLOCK_K": 32,
      "BLOCK_C": 16,
      "NUM_KSPLIT": 1,
      "num_warps": 2,
      "num_stages": 2,
      "waves_per_eu": 1
    },
    "2389": {
      "BLOCK_M": 64,
      "BLOCK_N": 16,
      "BLOCK_K": 128,
      "BLOCK_C": 128,
      "NUM_KSPLIT": 1,
      "num_warps": 8,
      "num_stages": 1,
      "waves_per_eu": 1
    },
    "5066": {
      "BLOCK_M": 256,
      "BLOCK_N": 16,
      "BLOCK_K": 128,
      "BLOCK_C": 16,
      "NUM_KSPLIT": 2,
      "num_warps": 4,
      "num_stages": 1,
      "waves_per_eu": 2
    },
    "1328": {
      "BLOCK_M": 32,
      "BLOCK_N": 16,
      "BLOCK_K": 256,
      "BLOCK_C": 128,
      "NUM_KSPLIT": 2,
      "num_warps": 8,
      "num_stages": 1,
      "waves_per_eu": 2
    },
    "3370": {
      "BLOCK_M": 128,
      "BLOCK_N": 16,
      "BLOCK_K": 64,
      "BLOCK_C": 32,
      "NUM_KSPLIT": 8,
      "num_warps": 2,
      "num_stages": 2,
      "waves_per_eu": 1
    },
    "917": {
      "BLOCK_M": 32,
      "BLOCK_N": 16,
      "BLOCK_K": 128,
      "BLOCK_C": 64,
      "NUM_KSPLIT": 4,
      "num_warps": 8,
      "num_stages": 2,
      "waves_per_eu": 2
    },
    "4368": {
      "BLOCK_M": 256,
      "BLOCK_N": 16,
      "BLOCK_K": 32,
      "BLOCK_C": 16,
      "NUM_KSPLIT": 4,
      "num_warps": 8,
      "num_stages": 1,
      "waves_per_eu": 0
    },
    "1651": {
      "BLOCK_M": 64,
      "BLOCK_N": 16,
      "BLOCK_K": 32,
      "BLOCK_C": 64,
      "NUM_KSPLIT": 8,
      "num_warps": 8,
      "num_stages": 1,
      "waves_per_eu": 1
    },
    "5594": {
      "BLOCK_M": 256,
      "BLOCK_N": 16,
      "BLOCK_K": 256,
      "BLOCK_C": 64,
      "NUM_KSPLIT": 4,
      "num_warps": 8,
      "num_stages": 1,
      "waves_per_eu": 2
    },
    "4908": {
      "BLOCK_M": 256,
      "BLOCK_N": 16,
      "BLOCK_K": 64,
      "BLOCK_C": 128,
      "NUM_KSPLIT": 1,
      "num_warps": 8,
      "num_stages": 1,
      "waves_per_eu": 0
    },
    "3762": {
      "BLOCK_M": 128,
      "BLOCK_N": 16,
      "BLOCK_K": 128,
      "BLOCK_C": 64,
      "NUM_KSPLIT": 2,
      "num_warps": 2,
      "num_stages": 1,
      "waves_per_eu": 0
    },
    "4838": {
      "BLOCK_M": 256,
      "BLOCK_N": 16,
      "BLOCK_K": 64,
      "BLOCK_C": 64,
      "NUM_KSPLIT": 1,
      "num_warps": 8,
      "num_stages": 1,
      "waves_per_eu": 2
    },
    "954": {
      "BLOCK_M": 32,
      "BLOCK_N": 16,
      "BLOCK_K": 128,
      "BLOCK_C": 128,
      "NUM_KSPLIT": 2,
      "num_warps": 2,
      "num_stages": 1,
      "waves_per_eu": 0
    },
    "1995": {
      "BLOCK_M": 64,
      "BLOCK_N": 16,
      "BLOCK_K": 64,
      "BLOCK_C": 64,
      "NUM_KSPLIT": 4,
      "num_warps": 8,
      "num_stages": 2,
      "waves_per_eu": 0
    },
    "3799": {
      "BLOCK_M": 128,
      "BLOCK_N": 16,
      "BLOCK_K": 128,
      "BLOCK_C": 64,
      "NUM_KSPLIT": 8,
      "num_warps": 2,
      "num_stages": 1,
      "waves_per_eu": 1
    },
    "1560": {
      "BLOCK_M": 64,
      "BLOCK_N": 16,
      "BLOCK_K": 32,
      "BLOCK_C": 32,
      "NUM_KSPLIT": 4,
      "num_warps": 8,
      "num_stages": 1,
      "waves_per_eu": 0
    },
    "3298": {
      "BLOCK_M": 128,
      "BLOCK_N": 16,
      "BLOCK_K": 64,
      "BLOCK_C": 16,
      "NUM_KSPLIT": 8,
      "num_warps": 2,
      "num_stages": 2,
      "waves_per_eu": 1
    },
    "853": {
      "BLOCK_M": 32,
      "BLOCK_N": 16,
      "BLOCK_K": 128,
      "BLOCK_C": 32,
      "NUM_KSPLIT": 8,
      "num_warps": 4,
      "num_stages": 1,
      "waves_per_eu": 1
    },
    "966": {
      "BLOCK_M": 32,
      "BLOCK_N": 16,
      "BLOCK_K": 128,
      "BLOCK_C": 128,
      "NUM_KSPLIT": 2,
      "num_warps": 8,
      "num_stages": 1,
      "waves_per_eu": 0
    },
    "1276": {
      "BLOCK_M": 32,
      "BLOCK_N": 16,
      "BLOCK_K": 256,
      "BLOCK_C": 64,
      "NUM_KSPLIT": 4,
      "num_warps": 8,
      "num_stages": 2,
      "waves_per_eu": 1
    },
    "3363": {
      "BLOCK_M": 128,
      "BLOCK_N": 16,
      "BLOCK_K": 64,
      "BLOCK_C": 32,
      "NUM_KSPLIT": 4,
      "num_warps": 8,
      "num_stages": 2,
      "waves_per_eu": 0
    },
    "5274": {
      "BLOCK_M": 256,
      "BLOCK_N": 16,
      "BLOCK_K": 128,
      "BLOCK_C": 128,
      "NUM_KSPLIT": 2,
      "num_warps": 2,
      "num_stages": 1,
      "waves_per_eu": 0
    },
    "5679": {
      "BLOCK_M": 256,
      "BLOCK_N": 16,
      "BLOCK_K": 256,
      "BLOCK_C": 128,
      "NUM_KSPLIT": 8,
      "num_warps": 4,
      "num_stages": 2,
      "waves_per_eu": 0
    },
    "4883": {
      "BLOCK_M": 256,
      "BLOCK_N": 16,
      "BLOCK_K": 64,
      "BLOCK_C": 64,
      "NUM_KSPLIT": 8,
      "num_warps": 2,
      "num_stages": 2,
      "waves_per_eu": 2
    },
    "833": {
      "BLOCK_M": 32,
      "BLOCK_N": 16,
      "BLOCK_K": 128,
      "BLOCK_C": 32,
      "NUM_KSPLIT": 4,
      "num_warps": 2,
      "num_stages": 2,
      "waves_per_eu": 2
    },
    "3837": {
      "BLOCK_M": 128,
      "BLOCK_N": 16,
      "BLOCK_K": 128,
      "BLOCK_C": 128,
      "NUM_KSPLIT": 2,
      "num_warps": 2,
      "num_stages": 2,
      "waves_per_eu": 0
    },
    "2906": {
      "BLOCK_M": 128,
      "BLOCK_N": 16,
      "BLOCK_K": 32,
      "BLOCK_C": 16,
      "NUM_KSPLIT": 2,
      "num_warps": 4,
      "num_stages": 1,
      "waves_per_eu": 2
    },
    "690": {
      "BLOCK_M": 32,
      "BLOCK_N": 16,
      "BLOCK_K": 64,
      "BLOCK_C": 256,
      "NUM_KSPLIT": 4,
      "num_warps": 4,
      "num_stages": 1,
      "waves_per_eu": 0
    },
    "2499": {
      "BLOCK_M": 64,
      "BLOCK_N": 16,
      "BLOCK_K": 128,
      "BLOCK_C": 256,
      "NUM_KSPLIT": 4,
      "num_warps": 8,
      "num_stages": 2,
      "waves_per_eu": 0
    },
    "4789": {
      "BLOCK_M": 256,
      "BLOCK_N": 16,
      "BLOCK_K": 64,
      "BLOCK_C": 32,
      "NUM_KSPLIT": 4,
      "num_warps": 2,
      "num_stages": 1,
      "waves_per_eu": 1
    },
    "1236": {
      "BLOCK_M": 32,
      "BLOCK_N": 16,
      "BLOCK_K": 256,
      "BLOCK_C": 64,
      "NUM_KSPLIT": 1,
      "num_warps": 8,
      "num_stages": 1,
      "waves_per_eu": 0
    },
    "4596": {
      "BLOCK_M": 256,
      "BLOCK_N": 16,
      "BLOCK_K": 32,
      "BLOCK_C": 128,
      "NUM_KSPLIT": 8,
      "num_warps": 4,
      "num_stages": 1,
      "waves_per_eu": 0
    },
    "4733": {
      "BLOCK_M": 256,
      "BLOCK_N": 16,
      "BLOCK_K": 64,
      "BLOCK_C": 16,
      "NUM_KSPLIT": 4,
      "num_warps": 8,
      "num_stages": 2,
      "waves_per_eu": 2
    },
    "4874": {
      "BLOCK_M": 256,
      "BLOCK_N": 16,
      "BLOCK_K": 64,
      "BLOCK_C": 64,
      "NUM_KSPLIT": 4,
      "num_warps": 8,
      "num_stages": 1,
      "waves_per_eu": 2
    },
    "1557": {
      "BLOCK_M": 64,
      "BLOCK_N": 16,
      "BLOCK_K": 32,
      "BLOCK_C": 32,
      "NUM_KSPLIT": 4,
      "num_warps": 4,
      "num_stages": 2,
      "waves_per_eu": 0
    },
    "3471": {
      "BLOCK_M": 128,
      "BLOCK_N": 16,
      "BLOCK_K": 64,
      "BLOCK_C": 128,
      "NUM_KSPLIT": 1,
      "num_warps": 8,
      "num_stages": 2,
      "waves_per_eu": 0
    },
    "4391": {
      "BLOCK_M": 256,
      "BLOCK_N": 16,
      "BLOCK_K": 32,
      "BLOCK_C": 16,
      "NUM_KSPLIT": 8,
      "num_warps": 8,
      "num_stages": 2,
      "waves_per_eu": 2
    },
    "2052": {
      "BLOCK_M": 64,
      "BLOCK_N": 16,
      "BLOCK_K": 64,
      "BLOCK_C": 128,
      "NUM_KSPLIT": 4,
      "num_warps": 2,
      "num_stages": 1,
      "waves_per_eu": 0
    },
    "4647": {
      "BLOCK_M": 256,
      "BLOCK_N": 16,
      "BLOCK_K": 32,
      "BLOCK_C": 256,
      "NUM_KSPLIT": 4,
      "num_warps": 2,
      "num_stages": 2,
      "waves_per_eu": 0
    },
    "3612": {
      "BLOCK_M": 128,
      "BLOCK_N": 16,
      "BLOCK_K": 128,
      "BLOCK_C": 16,
      "NUM_KSPLIT": 1,
      "num_warps": 8,
      "num_stages": 1,
      "waves_per_eu": 0
    },
    "1435": {
      "BLOCK_M": 32,
      "BLOCK_N": 16,
      "BLOCK_K": 256,
      "BLOCK_C": 256,
      "NUM_KSPLIT": 8,
      "num_warps": 8,
      "num_stages": 1,
      "waves_per_eu": 1
    },
    "4425": {
      "BLOCK_M": 256,
      "BLOCK_N": 16,
      "BLOCK_K": 32,
      "BLOCK_C": 32,
      "NUM_KSPLIT": 2,
      "num_warps": 8,
      "num_stages": 2,
      "waves_per_eu": 0
    },
    "1423": {
      "BLOCK_M": 32,
      "BLOCK_N": 16,
      "BLOCK_K": 256,
      "BLOCK_C": 256,
      "NUM_KSPLIT": 8,
      "num_warps": 2,
      "num_stages": 1,
      "waves_per_eu": 1
    },
    "622": {
      "BLOCK_M": 32,
      "BLOCK_N": 16,
      "BLOCK_K": 64,
      "BLOCK_C": 128,
      "NUM_KSPLIT": 4,
      "num_warps": 4,
      "num_stages": 2,
      "waves_per_eu": 1
    },
    "541": {
      "BLOCK_M": 32,
      "BLOCK_N": 16,
      "BLOCK_K": 64,
      "BLOCK_C": 64,
      "NUM_KSPLIT": 4,
      "num_warps": 2,
      "num_stages": 1,
      "waves_per_eu": 1
    },
    "4535": {
      "BLOCK_M": 256,
      "BLOCK_N": 16,
      "BLOCK_K": 32,
      "BLOCK_C": 64,
      "NUM_KSPLIT": 8,
      "num_warps": 8,
      "num_stages": 2,
      "waves_per_eu": 2
    },
    "4643": {
      "BLOCK_M": 256,
      "BLOCK_N": 16,
      "BLOCK_K": 32,
      "BLOCK_C": 256,
      "NUM_KSPLIT": 2,
      "num_warps": 8,
      "num_stages": 2,
      "waves_per_eu": 2
    },
    "1016": {
      "BLOCK_M": 32,
      "BLOCK_N": 16,
      "BLOCK_K": 128,
      "BLOCK_C": 256,
      "NUM_KSPLIT": 1,
      "num_warps": 4,
      "num_stages": 1,
      "waves_per_eu": 2
    },
    "493": {
      "BLOCK_M": 32,
      "BLOCK_N": 16,
      "BLOCK_K": 64,
      "BLOCK_C": 32,
      "NUM_KSPLIT": 8,
      "num_warps": 4,
      "num_stages": 1,
      "waves_per_eu": 1
    },
    "1969": {
      "BLOCK_M": 64,
      "BLOCK_N": 16,
      "BLOCK_K": 64,
      "BLOCK_C": 64,
      "NUM_KSPLIT": 2,
      "num_warps": 4,
      "num_stages": 1,
      "waves_per_eu": 1
    },
    "2780": {
      "BLOCK_M": 64,
      "BLOCK_N": 16,
      "BLOCK_K": 256,
      "BLOCK_C": 128,
      "NUM_KSPLIT": 4,
      "num_warps": 4,
      "num_stages": 1,
      "waves_per_eu": 2
    },
    "866": {
      "BLOCK_M": 32,
      "BLOCK_N": 16,
      "BLOCK_K": 128,
      "BLOCK_C": 64,
      "NUM_KSPLIT": 1,
      "num_warps": 2,
      "num_stages": 1,
      "waves_per_eu": 2
    },
    "3318": {
      "BLOCK_M": 128,
      "BLOCK_N": 16,
      "BLOCK_K": 64,
      "BLOCK_C": 32,
      "NUM_KSPLIT": 1,
      "num_warps": 4,
      "num_stages": 1,
      "waves_per_eu": 0
    },
    "788": {
      "BLOCK_M": 32,
      "BLOCK_N": 16,
      "BLOCK_K": 128,
      "BLOCK_C": 16,
      "NUM_KSPLIT": 8,
      "num_warps": 8,
      "num_stages": 1,
      "waves_per_eu": 2
    },
    "476": {
      "BLOCK_M": 32,
      "BLOCK_N": 16,
      "BLOCK_K": 64,
      "BLOCK_C": 32,
      "NUM_KSPLIT": 4,
      "num_warps": 4,
      "num_stages": 1,
      "waves_per_eu": 2
    },
    "5691": {
      "BLOCK_M": 256,
      "BLOCK_N": 16,
      "BLOCK_K": 256,
      "BLOCK_C": 256,
      "NUM_KSPLIT": 1,
      "num_warps": 2,
      "num_stages": 2,
      "waves_per_eu": 0
    },
    "2752": {
      "BLOCK_M": 64,
      "BLOCK_N": 16,
      "BLOCK_K": 256,
      "BLOCK_C": 128,
      "NUM_KSPLIT": 1,
      "num_warps": 8,
      "num_stages": 2,
      "waves_per_eu": 1
    },
    "709": {
      "BLOCK_M": 32,
      "BLOCK_N": 16,
      "BLOCK_K": 64,
      "BLOCK_C": 256,
      "NUM_KSPLIT": 8,
      "num_warps": 4,
      "num_stages": 1,
      "waves_per_eu": 1
    },
    "634": {
      "BLOCK_M": 32,
      "BLOCK_N": 16,
      "BLOCK_K": 64,
      "BLOCK_C": 128,
      "NUM_KSPLIT": 8,
      "num_warps": 2,
      "num_stages": 2,
      "waves_per_eu": 1
    },
    "4211": {
      "BLOCK_M": 128,
      "BLOCK_N": 16,
      "BLOCK_K": 256,
      "BLOCK_C": 128,
      "NUM_KSPLIT": 2,
      "num_warps": 8,
      "num_stages": 2,
      "waves_per_eu": 2
    },
    "4050": {
      "BLOCK_M": 128,
      "BLOCK_N": 16,
      "BLOCK_K": 256,
      "BLOCK_C": 32,
      "NUM_KSPLIT": 2,
      "num_warps": 2,
      "num_stages": 1,
      "waves_per_eu": 0
    },
    "3071": {
      "BLOCK_M": 128,
      "BLOCK_N": 16,
      "BLOCK_K": 32,
      "BLOCK_C": 64,
      "NUM_KSPLIT": 4,
      "num_warps": 4,
      "num_stages": 2,
      "waves_per_eu": 2
    },
    "1665": {
      "BLOCK_M": 64,
      "BLOCK_N": 16,
      "BLOCK_K": 32,
      "BLOCK_C": 128,
      "NUM_KSPLIT": 1,
      "num_warps": 4,
      "num_stages": 2,
      "waves_per_eu": 0
    },
    "1973": {
      "BLOCK_M": 64,
      "BLOCK_N": 16,
      "BLOCK_K": 64,
      "BLOCK_C": 64,
      "NUM_KSPLIT": 2,
      "num_warps": 4,
      "num_stages": 2,
      "waves_per_eu": 2
    },
    "2651": {
      "BLOCK_M": 64,
      "BLOCK_N": 16,
      "BLOCK_K": 256,
      "BLOCK_C": 32,
      "NUM_KSPLIT": 8,
      "num_warps": 2,
      "num_stages": 2,
      "waves_per_eu": 2
    },
    "3423": {
      "BLOCK_M": 128,
      "BLOCK_N": 16,
      "BLOCK_K": 64,
      "BLOCK_C": 64,
      "NUM_KSPLIT": 4,
      "num_warps": 2,
      "num_stages": 2,
      "waves_per_eu": 0
    },
    "3352": {
      "BLOCK_M": 128,
      "BLOCK_N": 16,
      "BLOCK_K": 64,
      "BLOCK_C": 32,
      "NUM_KSPLIT": 4,
      "num_warps": 2,
      "num_stages": 2,
      "waves_per_eu": 1
    },
    "5279": {
      "BLOCK_M": 256,
      "BLOCK_N": 16,
      "BLOCK_K": 128,
      "BLOCK_C": 128,
      "NUM_KSPLIT": 2,
      "num_warps": 2,
      "num_stages": 2,
      "waves_per_eu": 2
    },
    "5209": {
      "BLOCK_M": 256,
      "BLOCK_N": 16,
      "BLOCK_K": 128,
      "BLOCK_C": 64,
      "NUM_KSPLIT": 2,
      "num_warps": 4,
      "num_stages": 1,
      "waves_per_eu": 1
    },
    "1321": {
      "BLOCK_M": 32,
      "BLOCK_N": 16,
      "BLOCK_K": 256,
      "BLOCK_C": 128,
      "NUM_KSPLIT": 2,
      "num_warps": 4,
      "num_stages": 1,
      "waves_per_eu": 1
    },
    "5665": {
      "BLOCK_M": 256,
      "BLOCK_N": 16,
      "BLOCK_K": 256,
      "BLOCK_C": 128,
      "NUM_KSPLIT": 4,
      "num_warps": 8,
      "num_stages": 1,
      "waves_per_eu": 1
    },
    "5431": {
      "BLOCK_M": 256,
      "BLOCK_N": 16,
      "BLOCK_K": 256,
      "BLOCK_C": 16,
      "NUM_KSPLIT": 2,
      "num_warps": 8,
      "num_stages": 1,
      "waves_per_eu": 1
    },
    "3603": {
      "BLOCK_M": 128,
      "BLOCK_N": 16,
      "BLOCK_K": 128,
      "BLOCK_C": 16,
      "NUM_KSPLIT": 1,
      "num_warps": 2,
      "num_stages": 2,
      "waves_per_eu": 0
    },
    "5047": {
      "BLOCK_M": 256,
      "BLOCK_N": 16,
      "BLOCK_K": 128,
      "BLOCK_C": 16,
      "NUM_KSPLIT": 1,
      "num_warps": 4,
      "num_stages": 1,
      "waves_per_eu": 1
    },
    "1728": {
      "BLOCK_M": 64,
      "BLOCK_N": 16,
      "BLOCK_K": 32,
      "BLOCK_C": 256,
      "NUM_KSPLIT": 1,
      "num_warps": 2,
      "num_stages": 1,
      "waves_per_eu": 0
    },
    "375": {
      "BLOCK_M": 32,
      "BLOCK_N": 16,
      "BLOCK_K": 64,
      "BLOCK_C": 16,
      "NUM_KSPLIT": 1,
      "num_warps": 8,
      "num_stages": 2,
      "waves_per_eu": 0
    },
    "4675": {
      "BLOCK_M": 256,
      "BLOCK_N": 16,
      "BLOCK_K": 32,
      "BLOCK_C": 256,
      "NUM_KSPLIT": 8,
      "num_warps": 8,
      "num_stages": 1,
      "waves_per_eu": 1
    },
    "2221": {
      "BLOCK_M": 64,
      "BLOCK_N": 16,
      "BLOCK_K": 128,
      "BLOCK_C": 16,
      "NUM_KSPLIT": 8,
      "num_warps": 4,
      "num_stages": 1,
      "waves_per_eu": 1
    },
    "2404": {
      "BLOCK_M": 64,
      "BLOCK_N": 16,
      "BLOCK_K": 128,
      "BLOCK_C": 128,
      "NUM_KSPLIT": 2,
      "num_warps": 4,
      "num_stages": 2,
      "waves_per_eu": 1
    },
    "46": {
      "BLOCK_M": 32,
      "BLOCK_N": 16,
      "BLOCK_K": 32,
      "BLOCK_C": 16,
      "NUM_KSPLIT": 4,
      "num_warps": 4,
      "num_stages": 2,
      "waves_per_eu": 1
    },
    "4176": {
      "BLOCK_M": 128,
      "BLOCK_N": 16,
      "BLOCK_K": 256,
      "BLOCK_C": 128,
      "NUM_KSPLIT": 1,
      "num_warps": 2,
      "num_stages": 1,
      "waves_per_eu": 0
    },
    "1477": {
      "BLOCK_M": 64,
      "BLOCK_N": 16,
      "BLOCK_K": 32,
      "BLOCK_C": 16,
      "NUM_KSPLIT": 4,
      "num_warps": 2,
      "num_stages": 1,
      "waves_per_eu": 1
    },
    "2257": {
      "BLOCK_M": 64,
      "BLOCK_N": 16,
      "BLOCK_K": 128,
      "BLOCK_C": 32,
      "NUM_KSPLIT": 2,
      "num_warps": 4,
      "num_stages": 1,
      "waves_per_eu": 1
    },
    "1586": {
      "BLOCK_M": 64,
      "BLOCK_N": 16,
      "BLOCK_K": 32,
      "BLOCK_C": 64,
      "NUM_KSPLIT": 1,
      "num_warps": 2,
      "num_stages": 1,
      "waves_per_eu": 2
    },
    "1668": {
      "BLOCK_M": 64,
      "BLOCK_N": 16,
      "BLOCK_K": 32,
      "BLOCK_C": 128,
      "NUM_KSPLIT": 1,
      "num_warps": 8,
      "num_stages": 1,
      "waves_per_eu": 0
    },
    "3728": {
      "BLOCK_M": 128,
      "BLOCK_N": 16,
      "BLOCK_K": 128,
      "BLOCK_C": 32,
      "NUM_KSPLIT": 8,
      "num_warps": 2,
      "num_stages": 1,
      "waves_per_eu": 2
    },
    "4478": {
      "BLOCK_M": 256,
      "BLOCK_N": 16,
      "BLOCK_K": 32,
      "BLOCK_C": 64,
      "NUM_KSPLIT": 1,
      "num_warps": 8,
      "num_stages": 1,
      "waves_per_eu": 2
    },
    "404": {
      "BLOCK_M": 32,
      "BLOCK_N": 16,
      "BLOCK_K": 64,
      "BLOCK_C": 16,
      "NUM_KSPLIT": 4,
      "num_warps": 4,
      "num_stages": 1,
      "waves_per_eu": 2
    },
    "3730": {
      "BLOCK_M": 128,
      "BLOCK_N": 16,
      "BLOCK_K": 128,
      "BLOCK_C": 32,
      "NUM_KSPLIT": 8,
      "num_warps": 2,
      "num_stages": 2,
      "waves_per_eu": 1
    },
    "4544": {
      "BLOCK_M": 256,
      "BLOCK_N": 16,
      "BLOCK_K": 32,
      "BLOCK_C": 128,
      "NUM_KSPLIT": 1,
      "num_warps": 4,
      "num_stages": 1,
      "waves_per_eu": 2
    },
    "1451": {
      "BLOCK_M": 64,
      "BLOCK_N": 16,
      "BLOCK_K": 32,
      "BLOCK_C": 16,
      "NUM_KSPLIT": 1,
      "num_warps": 4,
      "num_stages": 2,
      "waves_per_eu": 2
    },
    "5681": {
      "BLOCK_M": 256,
      "BLOCK_N": 16,
      "BLOCK_K": 256,
      "BLOCK_C": 128,
      "NUM_KSPLIT": 8,
      "num_warps": 4,
      "num_stages": 2,
      "waves_per_eu": 2
    },
    "325": {
      "BLOCK_M": 32,
      "BLOCK_N": 16,
      "BLOCK_K": 32,
      "BLOCK_C": 256,
      "NUM_KSPLIT": 4,
      "num_warps": 2,
      "num_stages": 1,
      "waves_per_eu": 1
    },
    "1382": {
      "BLOCK_M": 32,
      "BLOCK_N": 16,
      "BLOCK_K": 256,
      "BLOCK_C": 256,
      "NUM_KSPLIT": 1,
      "num_warps": 8,
      "num_stages": 1,
      "waves_per_eu": 2
    },
    "822": {
      "BLOCK_M": 32,
      "BLOCK_N": 16,
      "BLOCK_K": 128,
      "BLOCK_C": 32,
      "NUM_KSPLIT": 2,
      "num_warps": 8,
      "num_stages": 1,
      "waves_per_eu": 0
    },
    "3869": {
      "BLOCK_M": 128,
      "BLOCK_N": 16,
      "BLOCK_K": 128,
      "BLOCK_C": 128,
      "NUM_KSPLIT": 4,
      "num_warps": 8,
      "num_stages": 2,
      "waves_per_eu": 2
    },
    "4554": {
      "BLOCK_M": 256,
      "BLOCK_N": 16,
      "BLOCK_K": 32,
      "BLOCK_C": 128,
      "NUM_KSPLIT": 2,
      "num_warps": 2,
      "num_stages": 1,
      "waves_per_eu": 0
    },
    "4403": {
      "BLOCK_M": 256,
      "BLOCK_N": 16,
      "BLOCK_K": 32,
      "BLOCK_C": 32,
      "NUM_KSPLIT": 1,
      "num_warps": 4,
      "num_stages": 2,
      "waves_per_eu": 2
    },
    "2528": {
      "BLOCK_M": 64,
      "BLOCK_N": 16,
      "BLOCK_K": 256,
      "BLOCK_C": 16,
      "NUM_KSPLIT": 1,
      "num_warps": 4,
      "num_stages": 1,
      "waves_per_eu": 2
    },
    "1075": {
      "BLOCK_M": 32,
      "BLOCK_N": 16,
      "BLOCK_K": 128,
      "BLOCK_C": 256,
      "NUM_KSPLIT": 8,
      "num_warps": 8,
      "num_stages": 1,
      "waves_per_eu": 1
    },
    "991": {
      "BLOCK_M": 32,
      "BLOCK_N": 16,
      "BLOCK_K": 128,
      "BLOCK_C": 128,
      "NUM_KSPLIT": 8,
      "num_warps": 2,
      "num_stages": 1,
      "waves_per_eu": 1
    },
    "3259": {
      "BLOCK_M": 128,
      "BLOCK_N": 16,
      "BLOCK_K": 64,
      "BLOCK_C": 16,
      "NUM_KSPLIT": 2,
      "num_warps": 2,
      "num_stages": 1,
      "waves_per_eu": 1
    },
    "4129": {
      "BLOCK_M": 128,
      "BLOCK_N": 16,
      "BLOCK_K": 256,
      "BLOCK_C": 64,
      "NUM_KSPLIT": 2,
      "num_warps": 4,
      "num_stages": 1,
      "waves_per_eu": 1
    },
    "1630": {
      "BLOCK_M": 64,
      "BLOCK_N": 16,
      "BLOCK_K": 32,
      "BLOCK_C": 64,
      "NUM_KSPLIT": 4,
      "num_warps": 4,
      "num_stages": 2,
      "waves_per_eu": 1
    },
    "2956": {
      "BLOCK_M": 128,
      "BLOCK_N": 16,
      "BLOCK_K": 32,
      "BLOCK_C": 32,
      "NUM_KSPLIT": 1,
      "num_warps": 2,
      "num_stages": 2,
      "waves_per_eu": 1
    },
    "2765": {
      "BLOCK_M": 64,
      "BLOCK_N": 16,
      "BLOCK_K": 256,
      "BLOCK_C": 128,
      "NUM_KSPLIT": 2,
      "num_warps": 4,
      "num_stages": 2,
      "waves_per_eu": 2
    },
    "899": {
      "BLOCK_M": 32,
      "BLOCK_N": 16,
      "BLOCK_K": 128,
      "BLOCK_C": 64,
      "NUM_KSPLIT": 2,
      "num_warps": 8,
      "num_stages": 2,
      "waves_per_eu": 2
    },
    "3540": {
      "BLOCK_M": 128,
      "BLOCK_N": 16,
      "BLOCK_K": 64,
      "BLOCK_C": 256,
      "NUM_KSPLIT": 1,
      "num_warps": 8,
      "num_stages": 1,
      "waves_per_eu": 0
    },
    "3702": {
      "BLOCK_M": 128,
      "BLOCK_N": 16,
      "BLOCK_K": 128,
      "BLOCK_C": 32,
      "NUM_KSPLIT": 2,
      "num_warps": 8,
      "num_stages": 1,
      "waves_per_eu": 0
    },
    "3807": {
      "BLOCK_M": 128,
      "BLOCK_N": 16,
      "BLOCK_K": 128,
      "BLOCK_C": 64,
      "NUM_KSPLIT": 8,
      "num_warps": 4,
      "num_stages": 2,
      "waves_per_eu": 0
    },
    "5744": {
      "BLOCK_M": 256,
      "BLOCK_N": 16,
      "BLOCK_K": 256,
      "BLOCK_C": 256,
      "NUM_KSPLIT": 8,
      "num_warps": 2,
      "num_stages": 1,
      "waves_per_eu": 2
    },
    "5428": {
      "BLOCK_M": 256,
      "BLOCK_N": 16,
      "BLOCK_K": 256,
      "BLOCK_C": 16,
      "NUM_KSPLIT": 2,
      "num_warps": 4,
      "num_stages": 2,
      "waves_per_eu": 1
    },
    "5397": {
      "BLOCK_M": 256,
      "BLOCK_N": 16,
      "BLOCK_K": 128,
      "BLOCK_C": 256,
      "NUM_KSPLIT": 8,
      "num_warps": 8,
      "num_stages": 2,
      "waves_per_eu": 0
    },
    "3768": {
      "BLOCK_M": 128,
      "BLOCK_N": 16,
      "BLOCK_K": 128,
      "BLOCK_C": 64,
      "NUM_KSPLIT": 2,
      "num_warps": 4,
      "num_stages": 1,
      "waves_per_eu": 0
    },
    "3511": {
      "BLOCK_M": 128,
      "BLOCK_N": 16,
      "BLOCK_K": 64,
      "BLOCK_C": 128,
      "NUM_KSPLIT": 8,
      "num_warps": 2,
      "num_stages": 1,
      "waves_per_eu": 1
    },
    "1051": {
      "BLOCK_M": 32,
      "BLOCK_N": 16,
      "BLOCK_K": 128,
      "BLOCK_C": 256,
      "NUM_KSPLIT": 4,
      "num_warps": 4,
      "num_stages": 1,
      "waves_per_eu": 1
    },
    "2280": {
      "BLOCK_M": 64,
      "BLOCK_N": 16,
      "BLOCK_K": 128,
      "BLOCK_C": 32,
      "NUM_KSPLIT": 4,
      "num_warps": 8,
      "num_stages": 1,
      "waves_per_eu": 0
    },
    "5129": {
      "BLOCK_M": 256,
      "BLOCK_N": 16,
      "BLOCK_K": 128,
      "BLOCK_C": 32,
      "NUM_KSPLIT": 1,
      "num_warps": 8,
      "num_stages": 2,
      "waves_per_eu": 2
    },
    "3468": {
      "BLOCK_M": 128,
      "BLOCK_N": 16,
      "BLOCK_K": 64,
      "BLOCK_C": 128,
      "NUM_KSPLIT": 1,
      "num_warps": 8,
      "num_stages": 1,
      "waves_per_eu": 0
    },
    "3666": {
      "BLOCK_M": 128,
      "BLOCK_N": 16,
      "BLOCK_K": 128,
      "BLOCK_C": 16,
      "NUM_KSPLIT": 8,
      "num_warps": 8,
      "num_stages": 1,
      "waves_per_eu": 0
    },
    "351": {
      "BLOCK_M": 32,
      "BLOCK_N": 16,
      "BLOCK_K": 32,
      "BLOCK_C": 256,
      "NUM_KSPLIT": 8,
      "num_warps": 4,
      "num_stages": 2,
      "waves_per_eu": 0
    },
    "4918": {
      "BLOCK_M": 256,
      "BLOCK_N": 16,
      "BLOCK_K": 64,
      "BLOCK_C": 128,
      "NUM_KSPLIT": 2,
      "num_warps": 2,
      "num_stages": 2,
      "waves_per_eu": 1
    },
    "4912": {
      "BLOCK_M": 256,
      "BLOCK_N": 16,
      "BLOCK_K": 64,
      "BLOCK_C": 128,
      "NUM_KSPLIT": 1,
      "num_warps": 8,
      "num_stages": 2,
      "waves_per_eu": 1
    },
    "626": {
      "BLOCK_M": 32,
      "BLOCK_N": 16,
      "BLOCK_K": 64,
      "BLOCK_C": 128,
      "NUM_KSPLIT": 4,
      "num_warps": 8,
      "num_stages": 1,
      "waves_per_eu": 2
    },
    "4297": {
      "BLOCK_M": 128,
      "BLOCK_N": 16,
      "BLOCK_K": 256,
      "BLOCK_C": 256,
      "NUM_KSPLIT": 4,
      "num_warps": 8,
      "num_stages": 1,
      "waves_per_eu": 1
    },
    "918": {
      "BLOCK_M": 32,
      "BLOCK_N": 16,
      "BLOCK_K": 128,
      "BLOCK_C": 64,
      "NUM_KSPLIT": 8,
      "num_warps": 2,
      "num_stages": 1,
      "waves_per_eu": 0
    },
    "5739": {
      "BLOCK_M": 256,
      "BLOCK_N": 16,
      "BLOCK_K": 256,
      "BLOCK_C": 256,
      "NUM_KSPLIT": 4,
      "num_warps": 8,
      "num_stages": 2,
      "waves_per_eu": 0
    },
    "4353": {
      "BLOCK_M": 256,
      "BLOCK_N": 16,
      "BLOCK_K": 32,
      "BLOCK_C": 16,
      "NUM_KSPLIT": 2,
      "num_warps": 8,
      "num_stages": 2,
      "waves_per_eu": 0
    },
    "197": {
      "BLOCK_M": 32,
      "BLOCK_N": 16,
      "BLOCK_K": 32,
      "BLOCK_C": 64,
      "NUM_KSPLIT": 4,
      "num_warps": 8,
      "num_stages": 2,
      "waves_per_eu": 2
    },
    "4186": {
      "BLOCK_M": 128,
      "BLOCK_N": 16,
      "BLOCK_K": 256,
      "BLOCK_C": 128,
      "NUM_KSPLIT": 1,
      "num_warps": 4,
      "num_stages": 2,
      "waves_per_eu": 1
    },
    "2515": {
      "BLOCK_M": 64,
      "BLOCK_N": 16,
      "BLOCK_K": 128,
      "BLOCK_C": 256,
      "NUM_KSPLIT": 8,
      "num_warps": 8,
      "num_stages": 1,
      "waves_per_eu": 1
    },
    "91": {
      "BLOCK_M": 32,
      "BLOCK_N": 16,
      "BLOCK_K": 32,
      "BLOCK_C": 32,
      "NUM_KSPLIT": 2,
      "num_warps": 2,
      "num_stages": 1,
      "waves_per_eu": 1
    },
    "1436": {
      "BLOCK_M": 32,
      "BLOCK_N": 16,
      "BLOCK_K": 256,
      "BLOCK_C": 256,
      "NUM_KSPLIT": 8,
      "num_warps": 8,
      "num_stages": 1,
      "waves_per_eu": 2
    },
    "2610": {
      "BLOCK_M": 64,
      "BLOCK_N": 16,
      "BLOCK_K": 256,
      "BLOCK_C": 32,
      "NUM_KSPLIT": 2,
      "num_warps": 2,
      "num_stages": 1,
      "waves_per_eu": 0
    },
    "2757": {
      "BLOCK_M": 64,
      "BLOCK_N": 16,
      "BLOCK_K": 256,
      "BLOCK_C": 128,
      "NUM_KSPLIT": 2,
      "num_warps": 2,
      "num_stages": 2,
      "waves_per_eu": 0
    },
    "1102": {
      "BLOCK_M": 32,
      "BLOCK_N": 16,
      "BLOCK_K": 256,
      "BLOCK_C": 16,
      "NUM_KSPLIT": 2,
      "num_warps": 2,
      "num_stages": 2,
      "waves_per_eu": 1
    },
    "4840": {
      "BLOCK_M": 256,
      "BLOCK_N": 16,
      "BLOCK_K": 64,
      "BLOCK_C": 64,
      "NUM_KSPLIT": 1,
      "num_warps": 8,
      "num_stages": 2,
      "waves_per_eu": 1
    },
    "2262": {
      "BLOCK_M": 64,
      "BLOCK_N": 16,
      "BLOCK_K": 128,
      "BLOCK_C": 32,
      "NUM_KSPLIT": 2,
      "num_warps": 8,
      "num_stages": 1,
      "waves_per_eu": 0
    },
    "3570": {
      "BLOCK_M": 128,
      "BLOCK_N": 16,
      "BLOCK_K": 64,
      "BLOCK_C": 256,
      "NUM_KSPLIT": 4,
      "num_warps": 4,
      "num_stages": 1,
      "waves_per_eu": 0
    },
    "1255": {
      "BLOCK_M": 32,
      "BLOCK_N": 16,
      "BLOCK_K": 256,
      "BLOCK_C": 64,
      "NUM_KSPLIT": 2,
      "num_warps": 8,
      "num_stages": 1,
      "waves_per_eu": 1
    },
    "3173": {
      "BLOCK_M": 128,
      "BLOCK_N": 16,
      "BLOCK_K": 32,
      "BLOCK_C": 256,
      "NUM_KSPLIT": 1,
      "num_warps": 2,
      "num_stages": 2,
      "waves_per_eu": 2
    },
    "158": {
      "BLOCK_M": 32,
      "BLOCK_N": 16,
      "BLOCK_K": 32,
      "BLOCK_C": 64,
      "NUM_KSPLIT": 1,
      "num_warps": 8,
      "num_stages": 1,
      "waves_per_eu": 2
    },
    "4759": {
      "BLOCK_M": 256,
      "BLOCK_N": 16,
      "BLOCK_K": 64,
      "BLOCK_C": 32,
      "NUM_KSPLIT": 1,
      "num_warps": 4,
      "num_stages": 1,
      "waves_per_eu": 1
    },
    "612": {
      "BLOCK_M": 32,
      "BLOCK_N": 16,
      "BLOCK_K": 64,
      "BLOCK_C": 128,
      "NUM_KSPLIT": 4,
      "num_warps": 2,
      "num_stages": 1,
      "waves_per_eu": 0
    },
    "2947": {
      "BLOCK_M": 128,
      "BLOCK_N": 16,
      "BLOCK_K": 32,
      "BLOCK_C": 16,
      "NUM_KSPLIT": 8,
      "num_warps": 8,
      "num_stages": 1,
      "waves_per_eu": 1
    },
    "3748": {
      "BLOCK_M": 128,
      "BLOCK_N": 16,
      "BLOCK_K": 128,
      "BLOCK_C": 64,
      "NUM_KSPLIT": 1,
      "num_warps": 2,
      "num_stages": 2,
      "waves_per_eu": 1
    },
    "4271": {
      "BLOCK_M": 128,
      "BLOCK_N": 16,
      "BLOCK_K": 256,
      "BLOCK_C": 256,
      "NUM_KSPLIT": 2,
      "num_warps": 2,
      "num_stages": 2,
      "waves_per_eu": 2
    },
    "3356": {
      "BLOCK_M": 128,
      "BLOCK_N": 16,
      "BLOCK_K": 64,
      "BLOCK_C": 32,
      "NUM_KSPLIT": 4,
      "num_warps": 4,
      "num_stages": 1,
      "waves_per_eu": 2
    },
    "5341": {
      "BLOCK_M": 256,
      "BLOCK_N": 16,
      "BLOCK_K": 128,
      "BLOCK_C": 256,
      "NUM_KSPLIT": 1,
      "num_warps": 8,
      "num_stages": 1,
      "waves_per_eu": 1
    },
    "1315": {
      "BLOCK_M": 32,
      "BLOCK_N": 16,
      "BLOCK_K": 256,
      "BLOCK_C": 128,
      "NUM_KSPLIT": 2,
      "num_warps": 2,
      "num_stages": 1,
      "waves_per_eu": 1
    },
    "492": {
      "BLOCK_M": 32,
      "BLOCK_N": 16,
      "BLOCK_K": 64,
      "BLOCK_C": 32,
      "NUM_KSPLIT": 8,
      "num_warps": 4,
      "num_stages": 1,
      "waves_per_eu": 0
    },
    "4610": {
      "BLOCK_M": 256,
      "BLOCK_N": 16,
      "BLOCK_K": 32,
      "BLOCK_C": 256,
      "NUM_KSPLIT": 1,
      "num_warps": 2,
      "num_stages": 1,
      "waves_per_eu": 2
    },
    "5368": {
      "BLOCK_M": 256,
      "BLOCK_N": 16,
      "BLOCK_K": 128,
      "BLOCK_C": 256,
      "NUM_KSPLIT": 4,
      "num_warps": 2,
      "num_stages": 2,
      "waves_per_eu": 1
    },
    "187": {
      "BLOCK_M": 32,
      "BLOCK_N": 16,
      "BLOCK_K": 32,
      "BLOCK_C": 64,
      "NUM_KSPLIT": 4,
      "num_warps": 4,
      "num_stages": 1,
      "waves_per_eu": 1
    },
    "4906": {
      "BLOCK_M": 256,
      "BLOCK_N": 16,
      "BLOCK_K": 64,
      "BLOCK_C": 128,
      "NUM_KSPLIT": 1,
      "num_warps": 4,
      "num_stages": 2,
      "waves_per_eu": 1
    },
    "1392": {
      "BLOCK_M": 32,
      "BLOCK_N": 16,
      "BLOCK_K": 256,
      "BLOCK_C": 256,
      "NUM_KSPLIT": 2,
      "num_warps": 4,
      "num_stages": 1,
      "waves_per_eu": 0
    },
    "5208": {
      "BLOCK_M": 256,
      "BLOCK_N": 16,
      "BLOCK_K": 128,
      "BLOCK_C": 64,
      "NUM_KSPLIT": 2,
      "num_warps": 4,
      "num_stages": 1,
      "waves_per_eu": 0
    },
    "2977": {
      "BLOCK_M": 128,
      "BLOCK_N": 16,
      "BLOCK_K": 32,
      "BLOCK_C": 32,
      "NUM_KSPLIT": 2,
      "num_warps": 4,
      "num_stages": 1,
      "waves_per_eu": 1
    },
    "206": {
      "BLOCK_M": 32,
      "BLOCK_N": 16,
      "BLOCK_K": 32,
      "BLOCK_C": 64,
      "NUM_KSPLIT": 8,
      "num_warps": 4,
      "num_stages": 1,
      "waves_per_eu": 2
    },
    "1135": {
      "BLOCK_M": 32,
      "BLOCK_N": 16,
      "BLOCK_K": 256,
      "BLOCK_C": 16,
      "NUM_KSPLIT": 8,
      "num_warps": 2,
      "num_stages": 1,
      "waves_per_eu": 1
    },
    "5196": {
      "BLOCK_M": 256,
      "BLOCK_N": 16,
      "BLOCK_K": 128,
      "BLOCK_C": 64,
      "NUM_KSPLIT": 1,
      "num_warps": 8,
      "num_stages": 1,
      "waves_per_eu": 0
    },
    "5627": {
      "BLOCK_M": 256,
      "BLOCK_N": 16,
      "BLOCK_K": 256,
      "BLOCK_C": 128,
      "NUM_KSPLIT": 1,
      "num_warps": 4,
      "num_stages": 2,
      "waves_per_eu": 2
    },
    "4763": {
      "BLOCK_M": 256,
      "BLOCK_N": 16,
      "BLOCK_K": 64,
      "BLOCK_C": 32,
      "NUM_KSPLIT": 1,
      "num_warps": 4,
      "num_stages": 2,
      "waves_per_eu": 2
    },
    "2302": {
      "BLOCK_M": 64,
      "BLOCK_N": 16,
      "BLOCK_K": 128,
      "BLOCK_C": 32,
      "NUM_KSPLIT": 8,
      "num_warps": 8,
      "num_stages": 2,
      "waves_per_eu": 1
    },
    "2581": {
      "BLOCK_M": 64,
      "BLOCK_N": 16,
      "BLOCK_K": 256,
      "BLOCK_C": 16,
      "NUM_KSPLIT": 8,
      "num_warps": 4,
      "num_stages": 1,
      "waves_per_eu": 1
    },
    "2924": {
      "BLOCK_M": 128,
      "BLOCK_N": 16,
      "BLOCK_K": 32,
      "BLOCK_C": 16,
      "NUM_KSPLIT": 4,
      "num_warps": 4,
      "num_stages": 1,
      "waves_per_eu": 2
    },
    "5658": {
      "BLOCK_M": 256,
      "BLOCK_N": 16,
      "BLOCK_K": 256,
      "BLOCK_C": 128,
      "NUM_KSPLIT": 4,
      "num_warps": 4,
      "num_stages": 1,
      "waves_per_eu": 0
    },
    "3440": {
      "BLOCK_M": 128,
      "BLOCK_N": 16,
      "BLOCK_K": 64,
      "BLOCK_C": 64,
      "NUM_KSPLIT": 8,
      "num_warps": 2,
      "num_stages": 1,
      "waves_per_eu": 2
    },
    "3715": {
      "BLOCK_M": 128,
      "BLOCK_N": 16,
      "BLOCK_K": 128,
      "BLOCK_C": 32,
      "NUM_KSPLIT": 4,
      "num_warps": 4,
      "num_stages": 1,
      "waves_per_eu": 1
    },
    "2152": {
      "BLOCK_M": 64,
      "BLOCK_N": 16,
      "BLOCK_K": 64,
      "BLOCK_C": 256,
      "NUM_KSPLIT": 8,
      "num_warps": 4,
      "num_stages": 2,
      "waves_per_eu": 1
    },
    "1852": {
      "BLOCK_M": 64,
      "BLOCK_N": 16,
      "BLOCK_K": 64,
      "BLOCK_C": 16,
      "NUM_KSPLIT": 4,
      "num_warps": 8,
      "num_stages": 2,
      "waves_per_eu": 1
    },
    "1700": {
      "BLOCK_M": 64,
      "BLOCK_N": 16,
      "BLOCK_K": 32,
      "BLOCK_C": 128,
      "NUM_KSPLIT": 4,
      "num_warps": 4,
      "num_stages": 1,
      "waves_per_eu": 2
    },
    "4558": {
      "BLOCK_M": 256,
      "BLOCK_N": 16,
      "BLOCK_K": 32,
      "BLOCK_C": 128,
      "NUM_KSPLIT": 2,
      "num_warps": 2,
      "num_stages": 2,
      "waves_per_eu": 1
    },
    "3228": {
      "BLOCK_M": 128,
      "BLOCK_N": 16,
      "BLOCK_K": 32,
      "BLOCK_C": 256,
      "NUM_KSPLIT": 8,
      "num_warps": 4,
      "num_stages": 1,
      "waves_per_eu": 0
    },
    "5415": {
      "BLOCK_M": 256,
      "BLOCK_N": 16,
      "BLOCK_K": 256,
      "BLOCK_C": 16,
      "NUM_KSPLIT": 1,
      "num_warps": 8,
      "num_stages": 2,
      "waves_per_eu": 0
    },
    "1484": {
      "BLOCK_M": 64,
      "BLOCK_N": 16,
      "BLOCK_K": 32,
      "BLOCK_C": 16,
      "NUM_KSPLIT": 4,
      "num_warps": 4,
      "num_stages": 1,
      "waves_per_eu": 2
    },
    "173": {
      "BLOCK_M": 32,
      "BLOCK_N": 16,
      "BLOCK_K": 32,
      "BLOCK_C": 64,
      "NUM_KSPLIT": 2,
      "num_warps": 4,
      "num_stages": 2,
      "waves_per_eu": 2
    },
    "5673": {
      "BLOCK_M": 256,
      "BLOCK_N": 16,
      "BLOCK_K": 256,
      "BLOCK_C": 128,
      "NUM_KSPLIT": 8,
      "num_warps": 2,
      "num_stages": 2,
      "waves_per_eu": 0
    },
    "2908": {
      "BLOCK_M": 128,
      "BLOCK_N": 16,
      "BLOCK_K": 32,
      "BLOCK_C": 16,
      "NUM_KSPLIT": 2,
      "num_warps": 4,
      "num_stages": 2,
      "waves_per_eu": 1
    },
    "2206": {
      "BLOCK_M": 64,
      "BLOCK_N": 16,
      "BLOCK_K": 128,
      "BLOCK_C": 16,
      "NUM_KSPLIT": 4,
      "num_warps": 4,
      "num_stages": 2,
      "waves_per_eu": 1
    },
    "968": {
      "BLOCK_M": 32,
      "BLOCK_N": 16,
      "BLOCK_K": 128,
      "BLOCK_C": 128,
      "NUM_KSPLIT": 2,
      "num_warps": 8,
      "num_stages": 1,
      "waves_per_eu": 2
    },
    "1040": {
      "BLOCK_M": 32,
      "BLOCK_N": 16,
      "BLOCK_K": 128,
      "BLOCK_C": 256,
      "NUM_KSPLIT": 2,
      "num_warps": 8,
      "num_stages": 1,
      "waves_per_eu": 2
    },
    "2290": {
      "BLOCK_M": 64,
      "BLOCK_N": 16,
      "BLOCK_K": 128,
      "BLOCK_C": 32,
      "NUM_KSPLIT": 8,
      "num_warps": 2,
      "num_stages": 2,
      "waves_per_eu": 1
    },
    "531": {
      "BLOCK_M": 32,
      "BLOCK_N": 16,
      "BLOCK_K": 64,
      "BLOCK_C": 64,
      "NUM_KSPLIT": 2,
      "num_warps": 4,
      "num_stages": 2,
      "waves_per_eu": 0
    },
    "4919": {
      "BLOCK_M": 256,
      "BLOCK_N": 16,
      "BLOCK_K": 64,
      "BLOCK_C": 128,
      "NUM_KSPLIT": 2,
      "num_warps": 2,
      "num_stages": 2,
      "waves_per_eu": 2
    },
    "4743": {
      "BLOCK_M": 256,
      "BLOCK_N": 16,
      "BLOCK_K": 64,
      "BLOCK_C": 16,
      "NUM_KSPLIT": 8,
      "num_warps": 4,
      "num_stages": 2,
      "waves_per_eu": 0
    },
    "386": {
      "BLOCK_M": 32,
      "BLOCK_N": 16,
      "BLOCK_K": 64,
      "BLOCK_C": 16,
      "NUM_KSPLIT": 2,
      "num_warps": 4,
      "num_stages": 1,
      "waves_per_eu": 2
    },
    "4178": {
      "BLOCK_M": 128,
      "BLOCK_N": 16,
      "BLOCK_K": 256,
      "BLOCK_C": 128,
      "NUM_KSPLIT": 1,
      "num_warps": 2,
      "num_stages": 1,
      "waves_per_eu": 2
    },
    "1704": {
      "BLOCK_M": 64,
      "BLOCK_N": 16,
      "BLOCK_K": 32,
      "BLOCK_C": 128,
      "NUM_KSPLIT": 4,
      "num_warps": 8,
      "num_stages": 1,
      "waves_per_eu": 0
    },
    "1827": {
      "BLOCK_M": 64,
      "BLOCK_N": 16,
      "BLOCK_K": 64,
      "BLOCK_C": 16,
      "NUM_KSPLIT": 2,
      "num_warps": 4,
      "num_stages": 2,
      "waves_per_eu": 0
    },
    "3236": {
      "BLOCK_M": 128,
      "BLOCK_N": 16,
      "BLOCK_K": 32,
      "BLOCK_C": 256,
      "NUM_KSPLIT": 8,
      "num_warps": 8,
      "num_stages": 1,
      "waves_per_eu": 2
    },
    "1035": {
      "BLOCK_M": 32,
      "BLOCK_N": 16,
      "BLOCK_K": 128,
      "BLOCK_C": 256,
      "NUM_KSPLIT": 2,
      "num_warps": 4,
      "num_stages": 2,
      "waves_per_eu": 0
    },
    "4492": {
      "BLOCK_M": 256,
      "BLOCK_N": 16,
      "BLOCK_K": 32,
      "BLOCK_C": 64,
      "NUM_KSPLIT": 2,
      "num_warps": 4,
      "num_stages": 2,
      "waves_per_eu": 1
    },
    "3671": {
      "BLOCK_M": 128,
      "BLOCK_N": 16,
      "BLOCK_K": 128,
      "BLOCK_C": 16,
      "NUM_KSPLIT": 8,
      "num_warps": 8,
      "num_stages": 2,
      "waves_per_eu": 2
    },
    "5296": {
      "BLOCK_M": 256,
      "BLOCK_N": 16,
      "BLOCK_K": 128,
      "BLOCK_C": 128,
      "NUM_KSPLIT": 4,
      "num_warps": 2,
      "num_stages": 2,
      "waves_per_eu": 1
    },
    "4588": {
      "BLOCK_M": 256,
      "BLOCK_N": 16,
      "BLOCK_K": 32,
      "BLOCK_C": 128,
      "NUM_KSPLIT": 4,
      "num_warps": 8,
      "num_stages": 2,
      "waves_per_eu": 1
    },
    "2717": {
      "BLOCK_M": 64,
      "BLOCK_N": 16,
      "BLOCK_K": 256,
      "BLOCK_C": 64,
      "NUM_KSPLIT": 4,
      "num_warps": 8,
      "num_stages": 2,
      "waves_per_eu": 2
    },
    "4270": {
      "BLOCK_M": 128,
      "BLOCK_N": 16,
      "BLOCK_K": 256,
      "BLOCK_C": 256,
      "NUM_KSPLIT": 2,
      "num_warps": 2,
      "num_stages": 2,
      "waves_per_eu": 1
    },
    "4174": {
      "BLOCK_M": 128,
      "BLOCK_N": 16,
      "BLOCK_K": 256,
      "BLOCK_C": 64,
      "NUM_KSPLIT": 8,
      "num_warps": 8,
      "num_stages": 2,
      "waves_per_eu": 1
    },
    "5126": {
      "BLOCK_M": 256,
      "BLOCK_N": 16,
      "BLOCK_K": 128,
      "BLOCK_C": 32,
      "NUM_KSPLIT": 1,
      "num_warps": 8,
      "num_stages": 1,
      "waves_per_eu": 2
    },
    "4322": {
      "BLOCK_M": 256,
      "BLOCK_N": 16,
      "BLOCK_K": 32,
      "BLOCK_C": 16,
      "NUM_KSPLIT": 1,
      "num_warps": 2,
      "num_stages": 1,
      "waves_per_eu": 2
    },
    "4274": {
      "BLOCK_M": 128,
      "BLOCK_N": 16,
      "BLOCK_K": 256,
      "BLOCK_C": 256,
      "NUM_KSPLIT": 2,
      "num_warps": 4,
      "num_stages": 1,
      "waves_per_eu": 2
    },
    "1288": {
      "BLOCK_M": 32,
      "BLOCK_N": 16,
      "BLOCK_K": 256,
      "BLOCK_C": 64,
      "NUM_KSPLIT": 8,
      "num_warps": 4,
      "num_stages": 2,
      "waves_per_eu": 1
    },
    "45": {
      "BLOCK_M": 32,
      "BLOCK_N": 16,
      "BLOCK_K": 32,
      "BLOCK_C": 16,
      "NUM_KSPLIT": 4,
      "num_warps": 4,
      "num_stages": 2,
      "waves_per_eu": 0
    },
    "2513": {
      "BLOCK_M": 64,
      "BLOCK_N": 16,
      "BLOCK_K": 128,
      "BLOCK_C": 256,
      "NUM_KSPLIT": 8,
      "num_warps": 4,
      "num_stages": 2,
      "waves_per_eu": 2
    },
    "5005": {
      "BLOCK_M": 256,
      "BLOCK_N": 16,
      "BLOCK_K": 64,
      "BLOCK_C": 256,
      "NUM_KSPLIT": 4,
      "num_warps": 2,
      "num_stages": 1,
      "waves_per_eu": 1
    },
    "3054": {
      "BLOCK_M": 128,
      "BLOCK_N": 16,
      "BLOCK_K": 32,
      "BLOCK_C": 64,
      "NUM_KSPLIT": 2,
      "num_warps": 8,
      "num_stages": 1,
      "waves_per_eu": 0
    },
    "1956": {
      "BLOCK_M": 64,
      "BLOCK_N": 16,
      "BLOCK_K": 64,
      "BLOCK_C": 64,
      "NUM_KSPLIT": 1,
      "num_warps": 8,
      "num_stages": 1,
      "waves_per_eu": 0
    },
    "2358": {
      "BLOCK_M": 64,
      "BLOCK_N": 16,
      "BLOCK_K": 128,
      "BLOCK_C": 64,
      "NUM_KSPLIT": 8,
      "num_warps": 2,
      "num_stages": 1,
      "waves_per_eu": 0
    },
    "774": {
      "BLOCK_M": 32,
      "BLOCK_N": 16,
      "BLOCK_K": 128,
      "BLOCK_C": 16,
      "NUM_KSPLIT": 8,
      "num_warps": 2,
      "num_stages": 1,
      "waves_per_eu": 0
    },
    "107": {
      "BLOCK_M": 32,
      "BLOCK_N": 16,
      "BLOCK_K": 32,
      "BLOCK_C": 32,
      "NUM_KSPLIT": 2,
      "num_warps": 8,
      "num_stages": 2,
      "waves_per_eu": 2
    },
    "2317": {
      "BLOCK_M": 64,
      "BLOCK_N": 16,
      "BLOCK_K": 128,
      "BLOCK_C": 64,
      "NUM_KSPLIT": 1,
      "num_warps": 8,
      "num_stages": 1,
      "waves_per_eu": 1
    },
    "1366": {
      "BLOCK_M": 32,
      "BLOCK_N": 16,
      "BLOCK_K": 256,
      "BLOCK_C": 128,
      "NUM_KSPLIT": 8,
      "num_warps": 8,
      "num_stages": 2,
      "waves_per_eu": 1
    },
    "3692": {
      "BLOCK_M": 128,
      "BLOCK_N": 16,
      "BLOCK_K": 128,
      "BLOCK_C": 32,
      "NUM_KSPLIT": 2,
      "num_warps": 2,
      "num_stages": 1,
      "waves_per_eu": 2
    },
    "1994": {
      "BLOCK_M": 64,
      "BLOCK_N": 16,
      "BLOCK_K": 64,
      "BLOCK_C": 64,
      "NUM_KSPLIT": 4,
      "num_warps": 8,
      "num_stages": 1,
      "waves_per_eu": 2
    },
    "3349": {
      "BLOCK_M": 128,
      "BLOCK_N": 16,
      "BLOCK_K": 64,
      "BLOCK_C": 32,
      "NUM_KSPLIT": 4,
      "num_warps": 2,
      "num_stages": 1,
      "waves_per_eu": 1
    },
    "1720": {
      "BLOCK_M": 64,
      "BLOCK_N": 16,
      "BLOCK_K": 32,
      "BLOCK_C": 128,
      "NUM_KSPLIT": 8,
      "num_warps": 4,
      "num_stages": 2,
      "waves_per_eu": 1
    },
    "1796": {
      "BLOCK_M": 64,
      "BLOCK_N": 16,
      "BLOCK_K": 32,
      "BLOCK_C": 256,
      "NUM_KSPLIT": 8,
      "num_warps": 8,
      "num_stages": 1,
      "waves_per_eu": 2
    },
    "5038": {
      "BLOCK_M": 256,
      "BLOCK_N": 16,
      "BLOCK_K": 64,
      "BLOCK_C": 256,
      "NUM_KSPLIT": 8,
      "num_warps": 8,
      "num_stages": 2,
      "waves_per_eu": 1
    },
    "4181": {
      "BLOCK_M": 128,
      "BLOCK_N": 16,
      "BLOCK_K": 256,
      "BLOCK_C": 128,
      "NUM_KSPLIT": 1,
      "num_warps": 2,
      "num_stages": 2,
      "waves_per_eu": 2
    },
    "1031": {
      "BLOCK_M": 32,
      "BLOCK_N": 16,
      "BLOCK_K": 128,
      "BLOCK_C": 256,
      "NUM_KSPLIT": 2,
      "num_warps": 2,
      "num_stages": 2,
      "waves_per_eu": 2
    },
    "2874": {
      "BLOCK_M": 64,
      "BLOCK_N": 16,
      "BLOCK_K": 256,
      "BLOCK_C": 256,
      "NUM_KSPLIT": 8,
      "num_warps": 8,
      "num_stages": 1,
      "waves_per_eu": 0
    },
    "3476": {
      "BLOCK_M": 128,
      "BLOCK_N": 16,
      "BLOCK_K": 64,
      "BLOCK_C": 128,
      "NUM_KSPLIT": 2,
      "num_warps": 2,
      "num_stages": 1,
      "waves_per_eu": 2
    },
    "1311": {
      "BLOCK_M": 32,
      "BLOCK_N": 16,
      "BLOCK_K": 256,
      "BLOCK_C": 128,
      "NUM_KSPLIT": 1,
      "num_warps": 8,
      "num_stages": 2,
      "waves_per_eu": 0
    },
    "331": {
      "BLOCK_M": 32,
      "BLOCK_N": 16,
      "BLOCK_K": 32,
      "BLOCK_C": 256,
      "NUM_KSPLIT": 4,
      "num_warps": 4,
      "num_stages": 1,
      "waves_per_eu": 1
    },
    "5212": {
      "BLOCK_M": 256,
      "BLOCK_N": 16,
      "BLOCK_K": 128,
      "BLOCK_C": 64,
      "NUM_KSPLIT": 2,
      "num_warps": 4,
      "num_stages": 2,
      "waves_per_eu": 1
    },
    "2208": {
      "BLOCK_M": 64,
      "BLOCK_N": 16,
      "BLOCK_K": 128,
      "BLOCK_C": 16,
      "NUM_KSPLIT": 4,
      "num_warps": 8,
      "num_stages": 1,
      "waves_per_eu": 0
    },
    "5168": {
      "BLOCK_M": 256,
      "BLOCK_N": 16,
      "BLOCK_K": 128,
      "BLOCK_C": 32,
      "NUM_KSPLIT": 8,
      "num_warps": 2,
      "num_stages": 1,
      "waves_per_eu": 2
    },
    "873": {
      "BLOCK_M": 32,
      "BLOCK_N": 16,
      "BLOCK_K": 128,
      "BLOCK_C": 64,
      "NUM_KSPLIT": 1,
      "num_warps": 4,
      "num_stages": 2,
      "waves_per_eu": 0
    },
    "3770": {
      "BLOCK_M": 128,
      "BLOCK_N": 16,
      "BLOCK_K": 128,
      "BLOCK_C": 64,
      "NUM_KSPLIT": 2,
      "num_warps": 4,
      "num_stages": 1,
      "waves_per_eu": 2
    },
    "2751": {
      "BLOCK_M": 64,
      "BLOCK_N": 16,
      "BLOCK_K": 256,
      "BLOCK_C": 128,
      "NUM_KSPLIT": 1,
      "num_warps": 8,
      "num_stages": 2,
      "waves_per_eu": 0
    },
    "2657": {
      "BLOCK_M": 64,
      "BLOCK_N": 16,
      "BLOCK_K": 256,
      "BLOCK_C": 32,
      "NUM_KSPLIT": 8,
      "num_warps": 4,
      "num_stages": 2,
      "waves_per_eu": 2
    },
    "4411": {
      "BLOCK_M": 256,
      "BLOCK_N": 16,
      "BLOCK_K": 32,
      "BLOCK_C": 32,
      "NUM_KSPLIT": 2,
      "num_warps": 2,
      "num_stages": 1,
      "waves_per_eu": 1
    },
    "950": {
      "BLOCK_M": 32,
      "BLOCK_N": 16,
      "BLOCK_K": 128,
      "BLOCK_C": 128,
      "NUM_KSPLIT": 1,
      "num_warps": 8,
      "num_stages": 1,
      "waves_per_eu": 2
    },
    "3771": {
      "BLOCK_M": 128,
      "BLOCK_N": 16,
      "BLOCK_K": 128,
      "BLOCK_C": 64,
      "NUM_KSPLIT": 2,
      "num_warps": 4,
      "num_stages": 2,
      "waves_per_eu": 0
    },
    "5383": {
      "BLOCK_M": 256,
      "BLOCK_N": 16,
      "BLOCK_K": 128,
      "BLOCK_C": 256,
      "NUM_KSPLIT": 8,
      "num_warps": 2,
      "num_stages": 1,
      "waves_per_eu": 1
    },
    "4134": {
      "BLOCK_M": 128,
      "BLOCK_N": 16,
      "BLOCK_K": 256,
      "BLOCK_C": 64,
      "NUM_KSPLIT": 2,
      "num_warps": 8,
      "num_stages": 1,
      "waves_per_eu": 0
    },
    "190": {
      "BLOCK_M": 32,
      "BLOCK_N": 16,
      "BLOCK_K": 32,
      "BLOCK_C": 64,
      "NUM_KSPLIT": 4,
      "num_warps": 4,
      "num_stages": 2,
      "waves_per_eu": 1
    },
    "4581": {
      "BLOCK_M": 256,
      "BLOCK_N": 16,
      "BLOCK_K": 32,
      "BLOCK_C": 128,
      "NUM_KSPLIT": 4,
      "num_warps": 4,
      "num_stages": 2,
      "waves_per_eu": 0
    },
    "5645": {
      "BLOCK_M": 256,
      "BLOCK_N": 16,
      "BLOCK_K": 256,
      "BLOCK_C": 128,
      "NUM_KSPLIT": 2,
      "num_warps": 4,
      "num_stages": 2,
      "waves_per_eu": 2
    },
    "4805": {
      "BLOCK_M": 256,
      "BLOCK_N": 16,
      "BLOCK_K": 64,
      "BLOCK_C": 32,
      "NUM_KSPLIT": 4,
      "num_warps": 8,
      "num_stages": 2,
      "waves_per_eu": 2
    },
    "2618": {
      "BLOCK_M": 64,
      "BLOCK_N": 16,
      "BLOCK_K": 256,
      "BLOCK_C": 32,
      "NUM_KSPLIT": 2,
      "num_warps": 4,
      "num_stages": 1,
      "waves_per_eu": 2
    },
    "4092": {
      "BLOCK_M": 128,
      "BLOCK_N": 16,
      "BLOCK_K": 256,
      "BLOCK_C": 32,
      "NUM_KSPLIT": 8,
      "num_warps": 4,
      "num_stages": 1,
      "waves_per_eu": 0
    },
    "5674": {
      "BLOCK_M": 256,
      "BLOCK_N": 16,
      "BLOCK_K": 256,
      "BLOCK_C": 128,
      "NUM_KSPLIT": 8,
      "num_warps": 2,
      "num_stages": 2,
      "waves_per_eu": 1
    },
    "1943": {
      "BLOCK_M": 64,
      "BLOCK_N": 16,
      "BLOCK_K": 64,
      "BLOCK_C": 32,
      "NUM_KSPLIT": 8,
      "num_warps": 8,
      "num_stages": 2,
      "waves_per_eu": 2
    },
    "5097": {
      "BLOCK_M": 256,
      "BLOCK_N": 16,
      "BLOCK_K": 128,
      "BLOCK_C": 16,
      "NUM_KSPLIT": 8,
      "num_warps": 2,
      "num_stages": 2,
      "waves_per_eu": 0
    },
    "4267": {
      "BLOCK_M": 128,
      "BLOCK_N": 16,
      "BLOCK_K": 256,
      "BLOCK_C": 256,
      "NUM_KSPLIT": 2,
      "num_warps": 2,
      "num_stages": 1,
      "waves_per_eu": 1
    },
    "4871": {
      "BLOCK_M": 256,
      "BLOCK_N": 16,
      "BLOCK_K": 64,
      "BLOCK_C": 64,
      "NUM_KSPLIT": 4,
      "num_warps": 4,
      "num_stages": 2,
      "waves_per_eu": 2
    },
    "2557": {
      "BLOCK_M": 64,
      "BLOCK_N": 16,
      "BLOCK_K": 256,
      "BLOCK_C": 16,
      "NUM_KSPLIT": 4,
      "num_warps": 2,
      "num_stages": 1,
      "waves_per_eu": 1
    },
    "421": {
      "BLOCK_M": 32,
      "BLOCK_N": 16,
      "BLOCK_K": 64,
      "BLOCK_C": 16,
      "NUM_KSPLIT": 8,
      "num_warps": 4,
      "num_stages": 1,
      "waves_per_eu": 1
    },
    "4752": {
      "BLOCK_M": 256,
      "BLOCK_N": 16,
      "BLOCK_K": 64,
      "BLOCK_C": 32,
      "NUM_KSPLIT": 1,
      "num_warps": 2,
      "num_stages": 1,
      "waves_per_eu": 0
    },
    "5079": {
      "BLOCK_M": 256,
      "BLOCK_N": 16,
      "BLOCK_K": 128,
      "BLOCK_C": 16,
      "NUM_KSPLIT": 4,
      "num_warps": 2,
      "num_stages": 2,
      "waves_per_eu": 0
    },
    "5112": {
      "BLOCK_M": 256,
      "BLOCK_N": 16,
      "BLOCK_K": 128,
      "BLOCK_C": 32,
      "NUM_KSPLIT": 1,
      "num_warps": 2,
      "num_stages": 1,
      "waves_per_eu": 0
    },
    "4160": {
      "BLOCK_M": 128,
      "BLOCK_N": 16,
      "BLOCK_K": 256,
      "BLOCK_C": 64,
      "NUM_KSPLIT": 8,
      "num_warps": 2,
      "num_stages": 1,
      "waves_per_eu": 2
    },
    "4045": {
      "BLOCK_M": 128,
      "BLOCK_N": 16,
      "BLOCK_K": 256,
      "BLOCK_C": 32,
      "NUM_KSPLIT": 1,
      "num_warps": 8,
      "num_stages": 1,
      "waves_per_eu": 1
    },
    "2526": {
      "BLOCK_M": 64,
      "BLOCK_N": 16,
      "BLOCK_K": 256,
      "BLOCK_C": 16,
      "NUM_KSPLIT": 1,
      "num_warps": 4,
      "num_stages": 1,
      "waves_per_eu": 0
    },
    "4423": {
      "BLOCK_M": 256,
      "BLOCK_N": 16,
      "BLOCK_K": 32,
      "BLOCK_C": 32,
      "NUM_KSPLIT": 2,
      "num_warps": 8,
      "num_stages": 1,
      "waves_per_eu": 1
    },
    "3322": {
      "BLOCK_M": 128,
      "BLOCK_N": 16,
      "BLOCK_K": 64,
      "BLOCK_C": 32,
      "NUM_KSPLIT": 1,
      "num_warps": 4,
      "num_stages": 2,
      "waves_per_eu": 1
    },
    "3020": {
      "BLOCK_M": 128,
      "BLOCK_N": 16,
      "BLOCK_K": 32,
      "BLOCK_C": 32,
      "NUM_KSPLIT": 8,
      "num_warps": 8,
      "num_stages": 1,
      "waves_per_eu": 2
    },
    "689": {
      "BLOCK_M": 32,
      "BLOCK_N": 16,
      "BLOCK_K": 64,
      "BLOCK_C": 256,
      "NUM_KSPLIT": 4,
      "num_warps": 2,
      "num_stages": 2,
      "waves_per_eu": 2
    },
    "993": {
      "BLOCK_M": 32,
      "BLOCK_N": 16,
      "BLOCK_K": 128,
      "BLOCK_C": 128,
      "NUM_KSPLIT": 8,
      "num_warps": 2,
      "num_stages": 2,
      "waves_per_eu": 0
    },
    "3427": {
      "BLOCK_M": 128,
      "BLOCK_N": 16,
      "BLOCK_K": 64,
      "BLOCK_C": 64,
      "NUM_KSPLIT": 4,
      "num_warps": 4,
      "num_stages": 1,
      "waves_per_eu": 1
    },
    "301": {
      "BLOCK_M": 32,
      "BLOCK_N": 16,
      "BLOCK_K": 32,
      "BLOCK_C": 256,
      "NUM_KSPLIT": 1,
      "num_warps": 8,
      "num_stages": 1,
      "waves_per_eu": 1
    },
    "80": {
      "BLOCK_M": 32,
      "BLOCK_N": 16,
      "BLOCK_K": 32,
      "BLOCK_C": 32,
      "NUM_KSPLIT": 1,
      "num_warps": 4,
      "num_stages": 1,
      "waves_per_eu": 2
    },
    "1033": {
      "BLOCK_M": 32,
      "BLOCK_N": 16,
      "BLOCK_K": 128,
      "BLOCK_C": 256,
      "NUM_KSPLIT": 2,
      "num_warps": 4,
      "num_stages": 1,
      "waves_per_eu": 1
    },
    "4510": {
      "BLOCK_M": 256,
      "BLOCK_N": 16,
      "BLOCK_K": 32,
      "BLOCK_C": 64,
      "NUM_KSPLIT": 4,
      "num_warps": 4,
      "num_stages": 2,
      "waves_per_eu": 1
    },
    "5758": {
      "BLOCK_M": 256,
      "BLOCK_N": 16,
      "BLOCK_K": 256,
      "BLOCK_C": 256,
      "NUM_KSPLIT": 8,
      "num_warps": 8,
      "num_stages": 2,
      "waves_per_eu": 1
    },
    "5033": {
      "BLOCK_M": 256,
      "BLOCK_N": 16,
      "BLOCK_K": 64,
      "BLOCK_C": 256,
      "NUM_KSPLIT": 8,
      "num_warps": 4,
      "num_stages": 2,
      "waves_per_eu": 2
    },
    "2426": {
      "BLOCK_M": 64,
      "BLOCK_N": 16,
      "BLOCK_K": 128,
      "BLOCK_C": 128,
      "NUM_KSPLIT": 4,
      "num_warps": 8,
      "num_stages": 1,
      "waves_per_eu": 2
    },
    "337": {
      "BLOCK_M": 32,
      "BLOCK_N": 16,
      "BLOCK_K": 32,
      "BLOCK_C": 256,
      "NUM_KSPLIT": 4,
      "num_warps": 8,
      "num_stages": 1,
      "waves_per_eu": 1
    },
    "1471": {
      "BLOCK_M": 64,
      "BLOCK_N": 16,
      "BLOCK_K": 32,
      "BLOCK_C": 16,
      "NUM_KSPLIT": 2,
      "num_warps": 8,
      "num_stages": 1,
      "waves_per_eu": 1
    },
    "207": {
      "BLOCK_M": 32,
      "BLOCK_N": 16,
      "BLOCK_K": 32,
      "BLOCK_C": 64,
      "NUM_KSPLIT": 8,
      "num_warps": 4,
      "num_stages": 2,
      "waves_per_eu": 0
    },
    "615": {
      "BLOCK_M": 32,
      "BLOCK_N": 16,
      "BLOCK_K": 64,
      "BLOCK_C": 128,
      "NUM_KSPLIT": 4,
      "num_warps": 2,
      "num_stages": 2,
      "waves_per_eu": 0
    },
    "1432": {
      "BLOCK_M": 32,
      "BLOCK_N": 16,
      "BLOCK_K": 256,
      "BLOCK_C": 256,
      "NUM_KSPLIT": 8,
      "num_warps": 4,
      "num_stages": 2,
      "waves_per_eu": 1
    },
    "4714": {
      "BLOCK_M": 256,
      "BLOCK_N": 16,
      "BLOCK_K": 64,
      "BLOCK_C": 16,
      "NUM_KSPLIT": 2,
      "num_warps": 8,
      "num_stages": 2,
      "waves_per_eu": 1
    },
    "1386": {
      "BLOCK_M": 32,
      "BLOCK_N": 16,
      "BLOCK_K": 256,
      "BLOCK_C": 256,
      "NUM_KSPLIT": 2,
      "num_warps": 2,
      "num_stages": 1,
      "waves_per_eu": 0
    },
    "4813": {
      "BLOCK_M": 256,
      "BLOCK_N": 16,
      "BLOCK_K": 64,
      "BLOCK_C": 32,
      "NUM_KSPLIT": 8,
      "num_warps": 4,
      "num_stages": 1,
      "waves_per_eu": 1
    },
    "3746": {
      "BLOCK_M": 128,
      "BLOCK_N": 16,
      "BLOCK_K": 128,
      "BLOCK_C": 64,
      "NUM_KSPLIT": 1,
      "num_warps": 2,
      "num_stages": 1,
      "waves_per_eu": 2
    },
    "5030": {
      "BLOCK_M": 256,
      "BLOCK_N": 16,
      "BLOCK_K": 64,
      "BLOCK_C": 256,
      "NUM_KSPLIT": 8,
      "num_warps": 4,
      "num_stages": 1,
      "waves_per_eu": 2
    },
    "4552": {
      "BLOCK_M": 256,
      "BLOCK_N": 16,
      "BLOCK_K": 32,
      "BLOCK_C": 128,
      "NUM_KSPLIT": 1,
      "num_warps": 8,
      "num_stages": 2,
      "waves_per_eu": 1
    },
    "2425": {
      "BLOCK_M": 64,
      "BLOCK_N": 16,
      "BLOCK_K": 128,
      "BLOCK_C": 128,
      "NUM_KSPLIT": 4,
      "num_warps": 8,
      "num_stages": 1,
      "waves_per_eu": 1
    },
    "2282": {
      "BLOCK_M": 64,
      "BLOCK_N": 16,
      "BLOCK_K": 128,
      "BLOCK_C": 32,
      "NUM_KSPLIT": 4,
      "num_warps": 8,
      "num_stages": 1,
      "waves_per_eu": 2
    },
    "2098": {
      "BLOCK_M": 64,
      "BLOCK_N": 16,
      "BLOCK_K": 64,
      "BLOCK_C": 256,
      "NUM_KSPLIT": 1,
      "num_warps": 4,
      "num_stages": 2,
      "waves_per_eu": 1
    },
    "2414": {
      "BLOCK_M": 64,
      "BLOCK_N": 16,
      "BLOCK_K": 128,
      "BLOCK_C": 128,
      "NUM_KSPLIT": 4,
      "num_warps": 2,
      "num_stages": 1,
      "waves_per_eu": 2
    },
    "5544": {
      "BLOCK_M": 256,
      "BLOCK_N": 16,
      "BLOCK_K": 256,
      "BLOCK_C": 64,
      "NUM_KSPLIT": 1,
      "num_warps": 2,
      "num_stages": 1,
      "waves_per_eu": 0
    },
    "4693": {
      "BLOCK_M": 256,
      "BLOCK_N": 16,
      "BLOCK_K": 64,
      "BLOCK_C": 16,
      "NUM_KSPLIT": 1,
      "num_warps": 8,
      "num_stages": 1,
      "waves_per_eu": 1
    },
    "1070": {
      "BLOCK_M": 32,
      "BLOCK_N": 16,
      "BLOCK_K": 128,
      "BLOCK_C": 256,
      "NUM_KSPLIT": 8,
      "num_warps": 4,
      "num_stages": 1,
      "waves_per_eu": 2
    },
    "3084": {
      "BLOCK_M": 128,
      "BLOCK_N": 16,
      "BLOCK_K": 32,
      "BLOCK_C": 64,
      "NUM_KSPLIT": 8,
      "num_warps": 4,
      "num_stages": 1,
      "waves_per_eu": 0
    },
    "2224": {
      "BLOCK_M": 64,
      "BLOCK_N": 16,
      "BLOCK_K": 128,
      "BLOCK_C": 16,
      "NUM_KSPLIT": 8,
      "num_warps": 4,
      "num_stages": 2,
      "waves_per_eu": 1
    },
    "3935": {
      "BLOCK_M": 128,
      "BLOCK_N": 16,
      "BLOCK_K": 128,
      "BLOCK_C": 256,
      "NUM_KSPLIT": 4,
      "num_warps": 4,
      "num_stages": 2,
      "waves_per_eu": 2
    },
    "5547": {
      "BLOCK_M": 256,
      "BLOCK_N": 16,
      "BLOCK_K": 256,
      "BLOCK_C": 64,
      "NUM_KSPLIT": 1,
      "num_warps": 2,
      "num_stages": 2,
      "waves_per_eu": 0
    },
    "352": {
      "BLOCK_M": 32,
      "BLOCK_N": 16,
      "BLOCK_K": 32,
      "BLOCK_C": 256,
      "NUM_KSPLIT": 8,
      "num_warps": 4,
      "num_stages": 2,
      "waves_per_eu": 1
    },
    "58": {
      "BLOCK_M": 32,
      "BLOCK_N": 16,
      "BLOCK_K": 32,
      "BLOCK_C": 16,
      "NUM_KSPLIT": 8,
      "num_warps": 2,
      "num_stages": 2,
      "waves_per_eu": 1
    },
    "5402": {
      "BLOCK_M": 256,
      "BLOCK_N": 16,
      "BLOCK_K": 256,
      "BLOCK_C": 16,
      "NUM_KSPLIT": 1,
      "num_warps": 2,
      "num_stages": 1,
      "waves_per_eu": 2
    },
    "4658": {
      "BLOCK_M": 256,
      "BLOCK_N": 16,
      "BLOCK_K": 32,
      "BLOCK_C": 256,
      "NUM_KSPLIT": 4,
      "num_warps": 8,
      "num_stages": 1,
      "waves_per_eu": 2
    },
    "892": {
      "BLOCK_M": 32,
      "BLOCK_N": 16,
      "BLOCK_K": 128,
      "BLOCK_C": 64,
      "NUM_KSPLIT": 2,
      "num_warps": 4,
      "num_stages": 2,
      "waves_per_eu": 1
    },
    "388": {
      "BLOCK_M": 32,
      "BLOCK_N": 16,
      "BLOCK_K": 64,
      "BLOCK_C": 16,
      "NUM_KSPLIT": 2,
      "num_warps": 4,
      "num_stages": 2,
      "waves_per_eu": 1
    },
    "1": {
      "BLOCK_M": 32,
      "BLOCK_N": 16,
      "BLOCK_K": 32,
      "BLOCK_C": 16,
      "NUM_KSPLIT": 1,
      "num_warps": 2,
      "num_stages": 1,
      "waves_per_eu": 1
    },
    "5740": {
      "BLOCK_M": 256,
      "BLOCK_N": 16,
      "BLOCK_K": 256,
      "BLOCK_C": 256,
      "NUM_KSPLIT": 4,
      "num_warps": 8,
      "num_stages": 2,
      "waves_per_eu": 1
    },
    "5568": {
      "BLOCK_M": 256,
      "BLOCK_N": 16,
      "BLOCK_K": 256,
      "BLOCK_C": 64,
      "NUM_KSPLIT": 2,
      "num_warps": 4,
      "num_stages": 1,
      "waves_per_eu": 0
    },
    "1067": {
      "BLOCK_M": 32,
      "BLOCK_N": 16,
      "BLOCK_K": 128,
      "BLOCK_C": 256,
      "NUM_KSPLIT": 8,
      "num_warps": 2,
      "num_stages": 2,
      "waves_per_eu": 2
    },
    "4704": {
      "BLOCK_M": 256,
      "BLOCK_N": 16,
      "BLOCK_K": 64,
      "BLOCK_C": 16,
      "NUM_KSPLIT": 2,
      "num_warps": 4,
      "num_stages": 1,
      "waves_per_eu": 0
    },
    "5292": {
      "BLOCK_M": 256,
      "BLOCK_N": 16,
      "BLOCK_K": 128,
      "BLOCK_C": 128,
      "NUM_KSPLIT": 4,
      "num_warps": 2,
      "num_stages": 1,
      "waves_per_eu": 0
    },
    "5573": {
      "BLOCK_M": 256,
      "BLOCK_N": 16,
      "BLOCK_K": 256,
      "BLOCK_C": 64,
      "NUM_KSPLIT": 2,
      "num_warps": 4,
      "num_stages": 2,
      "waves_per_eu": 2
    },
    "3881": {
      "BLOCK_M": 128,
      "BLOCK_N": 16,
      "BLOCK_K": 128,
      "BLOCK_C": 128,
      "NUM_KSPLIT": 8,
      "num_warps": 4,
      "num_stages": 2,
      "waves_per_eu": 2
    },
    "3270": {
      "BLOCK_M": 128,
      "BLOCK_N": 16,
      "BLOCK_K": 64,
      "BLOCK_C": 16,
      "NUM_KSPLIT": 2,
      "num_warps": 8,
      "num_stages": 1,
      "waves_per_eu": 0
    },
    "5313": {
      "BLOCK_M": 256,
      "BLOCK_N": 16,
      "BLOCK_K": 128,
      "BLOCK_C": 128,
      "NUM_KSPLIT": 8,
      "num_warps": 2,
      "num_stages": 2,
      "waves_per_eu": 0
    },
    "447": {
      "BLOCK_M": 32,
      "BLOCK_N": 16,
      "BLOCK_K": 64,
      "BLOCK_C": 32,
      "NUM_KSPLIT": 1,
      "num_warps": 8,
      "num_stages": 2,
      "waves_per_eu": 0
    },
    "2747": {
      "BLOCK_M": 64,
      "BLOCK_N": 16,
      "BLOCK_K": 256,
      "BLOCK_C": 128,
      "NUM_KSPLIT": 1,
      "num_warps": 4,
      "num_stages": 2,
      "waves_per_eu": 2
    },
    "3579": {
      "BLOCK_M": 128,
      "BLOCK_N": 16,
      "BLOCK_K": 64,
      "BLOCK_C": 256,
      "NUM_KSPLIT": 4,
      "num_warps": 8,
      "num_stages": 2,
      "waves_per_eu": 0
    },
    "746": {
      "BLOCK_M": 32,
      "BLOCK_N": 16,
      "BLOCK_K": 128,
      "BLOCK_C": 16,
      "NUM_KSPLIT": 2,
      "num_warps": 4,
      "num_stages": 1,
      "waves_per_eu": 2
    },
    "780": {
      "BLOCK_M": 32,
      "BLOCK_N": 16,
      "BLOCK_K": 128,
      "BLOCK_C": 16,
      "NUM_KSPLIT": 8,
      "num_warps": 4,
      "num_stages": 1,
      "waves_per_eu": 0
    },
    "257": {
      "BLOCK_M": 32,
      "BLOCK_N": 16,
      "BLOCK_K": 32,
      "BLOCK_C": 128,
      "NUM_KSPLIT": 4,
      "num_warps": 2,
      "num_stages": 2,
      "waves_per_eu": 2
    },
    "2167": {
      "BLOCK_M": 64,
      "BLOCK_N": 16,
      "BLOCK_K": 128,
      "BLOCK_C": 16,
      "NUM_KSPLIT": 1,
      "num_warps": 4,
      "num_stages": 1,
      "waves_per_eu": 1
    },
    "4723": {
      "BLOCK_M": 256,
      "BLOCK_N": 16,
      "BLOCK_K": 64,
      "BLOCK_C": 16,
      "NUM_KSPLIT": 4,
      "num_warps": 4,
      "num_stages": 1,
      "waves_per_eu": 1
    },
    "4265": {
      "BLOCK_M": 128,
      "BLOCK_N": 16,
      "BLOCK_K": 256,
      "BLOCK_C": 256,
      "NUM_KSPLIT": 1,
      "num_warps": 8,
      "num_stages": 2,
      "waves_per_eu": 2
    },
    "3115": {
      "BLOCK_M": 128,
      "BLOCK_N": 16,
      "BLOCK_K": 32,
      "BLOCK_C": 128,
      "NUM_KSPLIT": 2,
      "num_warps": 2,
      "num_stages": 1,
      "waves_per_eu": 1
    },
    "4616": {
      "BLOCK_M": 256,
      "BLOCK_N": 16,
      "BLOCK_K": 32,
      "BLOCK_C": 256,
      "NUM_KSPLIT": 1,
      "num_warps": 4,
      "num_stages": 1,
      "waves_per_eu": 2
    },
    "1834": {
      "BLOCK_M": 64,
      "BLOCK_N": 16,
      "BLOCK_K": 64,
      "BLOCK_C": 16,
      "NUM_KSPLIT": 2,
      "num_warps": 8,
      "num_stages": 2,
      "waves_per_eu": 1
    },
    "2793": {
      "BLOCK_M": 64,
      "BLOCK_N": 16,
      "BLOCK_K": 256,
      "BLOCK_C": 128,
      "NUM_KSPLIT": 8,
      "num_warps": 2,
      "num_stages": 2,
      "waves_per_eu": 0
    },
    "978": {
      "BLOCK_M": 32,
      "BLOCK_N": 16,
      "BLOCK_K": 128,
      "BLOCK_C": 128,
      "NUM_KSPLIT": 4,
      "num_warps": 4,
      "num_stages": 1,
      "waves_per_eu": 0
    },
    "2677": {
      "BLOCK_M": 64,
      "BLOCK_N": 16,
      "BLOCK_K": 256,
      "BLOCK_C": 64,
      "NUM_KSPLIT": 1,
      "num_warps": 8,
      "num_stages": 1,
      "waves_per_eu": 1
    },
    "1415": {
      "BLOCK_M": 32,
      "BLOCK_N": 16,
      "BLOCK_K": 256,
      "BLOCK_C": 256,
      "NUM_KSPLIT": 4,
      "num_warps": 4,
      "num_stages": 2,
      "waves_per_eu": 2
    },
    "3036": {
      "BLOCK_M": 128,
      "BLOCK_N": 16,
      "BLOCK_K": 32,
      "BLOCK_C": 64,
      "NUM_KSPLIT": 1,
      "num_warps": 8,
      "num_stages": 1,
      "waves_per_eu": 0
    },
    "438": {
      "BLOCK_M": 32,
      "BLOCK_N": 16,
      "BLOCK_K": 64,
      "BLOCK_C": 32,
      "NUM_KSPLIT": 1,
      "num_warps": 4,
      "num_stages": 1,
      "waves_per_eu": 0
    },
    "2785": {
      "BLOCK_M": 64,
      "BLOCK_N": 16,
      "BLOCK_K": 256,
      "BLOCK_C": 128,
      "NUM_KSPLIT": 4,
      "num_warps": 8,
      "num_stages": 1,
      "waves_per_eu": 1
    },
    "1286": {
      "BLOCK_M": 32,
      "BLOCK_N": 16,
      "BLOCK_K": 256,
      "BLOCK_C": 64,
      "NUM_KSPLIT": 8,
      "num_warps": 4,
      "num_stages": 1,
      "waves_per_eu": 2
    },
    "312": {
      "BLOCK_M": 32,
      "BLOCK_N": 16,
      "BLOCK_K": 32,
      "BLOCK_C": 256,
      "NUM_KSPLIT": 2,
      "num_warps": 4,
      "num_stages": 1,
      "waves_per_eu": 0
    },
    "4615": {
      "BLOCK_M": 256,
      "BLOCK_N": 16,
      "BLOCK_K": 32,
      "BLOCK_C": 256,
      "NUM_KSPLIT": 1,
      "num_warps": 4,
      "num_stages": 1,
      "waves_per_eu": 1
    },
    "3546": {
      "BLOCK_M": 128,
      "BLOCK_N": 16,
      "BLOCK_K": 64,
      "BLOCK_C": 256,
      "NUM_KSPLIT": 2,
      "num_warps": 2,
      "num_stages": 1,
      "waves_per_eu": 0
    },
    "971": {
      "BLOCK_M": 32,
      "BLOCK_N": 16,
      "BLOCK_K": 128,
      "BLOCK_C": 128,
      "NUM_KSPLIT": 2,
      "num_warps": 8,
      "num_stages": 2,
      "waves_per_eu": 2
    },
    "4601": {
      "BLOCK_M": 256,
      "BLOCK_N": 16,
      "BLOCK_K": 32,
      "BLOCK_C": 128,
      "NUM_KSPLIT": 8,
      "num_warps": 4,
      "num_stages": 2,
      "waves_per_eu": 2
    },
    "3952": {
      "BLOCK_M": 128,
      "BLOCK_N": 16,
      "BLOCK_K": 128,
      "BLOCK_C": 256,
      "NUM_KSPLIT": 8,
      "num_warps": 4,
      "num_stages": 2,
      "waves_per_eu": 1
    },
    "602": {
      "BLOCK_M": 32,
      "BLOCK_N": 16,
      "BLOCK_K": 64,
      "BLOCK_C": 128,
      "NUM_KSPLIT": 2,
      "num_warps": 4,
      "num_stages": 1,
      "waves_per_eu": 2
    },
    "201": {
      "BLOCK_M": 32,
      "BLOCK_N": 16,
      "BLOCK_K": 32,
      "BLOCK_C": 64,
      "NUM_KSPLIT": 8,
      "num_warps": 2,
      "num_stages": 2,
      "waves_per_eu": 0
    },
    "3128": {
      "BLOCK_M": 128,
      "BLOCK_N": 16,
      "BLOCK_K": 32,
      "BLOCK_C": 128,
      "NUM_KSPLIT": 2,
      "num_warps": 8,
      "num_stages": 1,
      "waves_per_eu": 2
    },
    "2362": {
      "BLOCK_M": 64,
      "BLOCK_N": 16,
      "BLOCK_K": 128,
      "BLOCK_C": 64,
      "NUM_KSPLIT": 8,
      "num_warps": 2,
      "num_stages": 2,
      "waves_per_eu": 1
    },
    "3910": {
      "BLOCK_M": 128,
      "BLOCK_N": 16,
      "BLOCK_K": 128,
      "BLOCK_C": 256,
      "NUM_KSPLIT": 2,
      "num_warps": 2,
      "num_stages": 2,
      "waves_per_eu": 1
    },
    "1762": {
      "BLOCK_M": 64,
      "BLOCK_N": 16,
      "BLOCK_K": 32,
      "BLOCK_C": 256,
      "NUM_KSPLIT": 2,
      "num_warps": 8,
      "num_stages": 2,
      "waves_per_eu": 1
    },
    "5481": {
      "BLOCK_M": 256,
      "BLOCK_N": 16,
      "BLOCK_K": 256,
      "BLOCK_C": 32,
      "NUM_KSPLIT": 1,
      "num_warps": 4,
      "num_stages": 2,
      "waves_per_eu": 0
    },
    "55": {
      "BLOCK_M": 32,
      "BLOCK_N": 16,
      "BLOCK_K": 32,
      "BLOCK_C": 16,
      "NUM_KSPLIT": 8,
      "num_warps": 2,
      "num_stages": 1,
      "waves_per_eu": 1
    },
    "1243": {
      "BLOCK_M": 32,
      "BLOCK_N": 16,
      "BLOCK_K": 256,
      "BLOCK_C": 64,
      "NUM_KSPLIT": 2,
      "num_warps": 2,
      "num_stages": 1,
      "waves_per_eu": 1
    },
    "4329": {
      "BLOCK_M": 256,
      "BLOCK_N": 16,
      "BLOCK_K": 32,
      "BLOCK_C": 16,
      "NUM_KSPLIT": 1,
      "num_warps": 4,
      "num_stages": 2,
      "waves_per_eu": 0
    },
    "4321": {
      "BLOCK_M": 256,
      "BLOCK_N": 16,
      "BLOCK_K": 32,
      "BLOCK_C": 16,
      "NUM_KSPLIT": 1,
      "num_warps": 2,
      "num_stages": 1,
      "waves_per_eu": 1
    },
    "1659": {
      "BLOCK_M": 64,
      "BLOCK_N": 16,
      "BLOCK_K": 32,
      "BLOCK_C": 128,
      "NUM_KSPLIT": 1,
      "num_warps": 2,
      "num_stages": 2,
      "waves_per_eu": 0
    },
    "3486": {
      "BLOCK_M": 128,
      "BLOCK_N": 16,
      "BLOCK_K": 64,
      "BLOCK_C": 128,
      "NUM_KSPLIT": 2,
      "num_warps": 8,
      "num_stages": 1,
      "waves_per_eu": 0
    },
    "2890": {
      "BLOCK_M": 128,
      "BLOCK_N": 16,
      "BLOCK_K": 32,
      "BLOCK_C": 16,
      "NUM_KSPLIT": 1,
      "num_warps": 4,
      "num_stages": 2,
      "waves_per_eu": 1
    },
    "3047": {
      "BLOCK_M": 128,
      "BLOCK_N": 16,
      "BLOCK_K": 32,
      "BLOCK_C": 64,
      "NUM_KSPLIT": 2,
      "num_warps": 2,
      "num_stages": 2,
      "waves_per_eu": 2
    },
    "2711": {
      "BLOCK_M": 64,
      "BLOCK_N": 16,
      "BLOCK_K": 256,
      "BLOCK_C": 64,
      "NUM_KSPLIT": 4,
      "num_warps": 4,
      "num_stages": 2,
      "waves_per_eu": 2
    },
    "5295": {
      "BLOCK_M": 256,
      "BLOCK_N": 16,
      "BLOCK_K": 128,
      "BLOCK_C": 128,
      "NUM_KSPLIT": 4,
      "num_warps": 2,
      "num_stages": 2,
      "waves_per_eu": 0
    },
    "5751": {
      "BLOCK_M": 256,
      "BLOCK_N": 16,
      "BLOCK_K": 256,
      "BLOCK_C": 256,
      "NUM_KSPLIT": 8,
      "num_warps": 4,
      "num_stages": 2,
      "waves_per_eu": 0
    },
    "2550": {
      "BLOCK_M": 64,
      "BLOCK_N": 16,
      "BLOCK_K": 256,
      "BLOCK_C": 16,
      "NUM_KSPLIT": 2,
      "num_warps": 8,
      "num_stages": 1,
      "waves_per_eu": 0
    },
    "2819": {
      "BLOCK_M": 64,
      "BLOCK_N": 16,
      "BLOCK_K": 256,
      "BLOCK_C": 256,
      "NUM_KSPLIT": 1,
      "num_warps": 4,
      "num_stages": 2,
      "waves_per_eu": 2
    },
    "4536": {
      "BLOCK_M": 256,
      "BLOCK_N": 16,
      "BLOCK_K": 32,
      "BLOCK_C": 128,
      "NUM_KSPLIT": 1,
      "num_warps": 2,
      "num_stages": 1,
      "waves_per_eu": 0
    },
    "1794": {
      "BLOCK_M": 64,
      "BLOCK_N": 16,
      "BLOCK_K": 32,
      "BLOCK_C": 256,
      "NUM_KSPLIT": 8,
      "num_warps": 8,
      "num_stages": 1,
      "waves_per_eu": 0
    },
    "5195": {
      "BLOCK_M": 256,
      "BLOCK_N": 16,
      "BLOCK_K": 128,
      "BLOCK_C": 64,
      "NUM_KSPLIT": 1,
      "num_warps": 4,
      "num_stages": 2,
      "waves_per_eu": 2
    },
    "4244": {
      "BLOCK_M": 128,
      "BLOCK_N": 16,
      "BLOCK_K": 256,
      "BLOCK_C": 128,
      "NUM_KSPLIT": 8,
      "num_warps": 8,
      "num_stages": 1,
      "waves_per_eu": 2
    },
    "5147": {
      "BLOCK_M": 256,
      "BLOCK_N": 16,
      "BLOCK_K": 128,
      "BLOCK_C": 32,
      "NUM_KSPLIT": 2,
      "num_warps": 8,
      "num_stages": 2,
      "waves_per_eu": 2
    },
    "155": {
      "BLOCK_M": 32,
      "BLOCK_N": 16,
      "BLOCK_K": 32,
      "BLOCK_C": 64,
      "NUM_KSPLIT": 1,
      "num_warps": 4,
      "num_stages": 2,
      "waves_per_eu": 2
    },
    "4551": {
      "BLOCK_M": 256,
      "BLOCK_N": 16,
      "BLOCK_K": 32,
      "BLOCK_C": 128,
      "NUM_KSPLIT": 1,
      "num_warps": 8,
      "num_stages": 2,
      "waves_per_eu": 0
    },
    "4896": {
      "BLOCK_M": 256,
      "BLOCK_N": 16,
      "BLOCK_K": 64,
      "BLOCK_C": 128,
      "NUM_KSPLIT": 1,
      "num_warps": 2,
      "num_stages": 1,
      "waves_per_eu": 0
    },
    "5059": {
      "BLOCK_M": 256,
      "BLOCK_N": 16,
      "BLOCK_K": 128,
      "BLOCK_C": 16,
      "NUM_KSPLIT": 2,
      "num_warps": 2,
      "num_stages": 1,
      "waves_per_eu": 1
    },
    "930": {
      "BLOCK_M": 32,
      "BLOCK_N": 16,
      "BLOCK_K": 128,
      "BLOCK_C": 64,
      "NUM_KSPLIT": 8,
      "num_warps": 8,
      "num_stages": 1,
      "waves_per_eu": 0
    },
    "1868": {
      "BLOCK_M": 64,
      "BLOCK_N": 16,
      "BLOCK_K": 64,
      "BLOCK_C": 16,
      "NUM_KSPLIT": 8,
      "num_warps": 8,
      "num_stages": 1,
      "waves_per_eu": 2
    },
    "562": {
      "BLOCK_M": 32,
      "BLOCK_N": 16,
      "BLOCK_K": 64,
      "BLOCK_C": 64,
      "NUM_KSPLIT": 8,
      "num_warps": 2,
      "num_stages": 2,
      "waves_per_eu": 1
    },
    "987": {
      "BLOCK_M": 32,
      "BLOCK_N": 16,
      "BLOCK_K": 128,
      "BLOCK_C": 128,
      "NUM_KSPLIT": 4,
      "num_warps": 8,
      "num_stages": 2,
      "waves_per_eu": 0
    },
    "4899": {
      "BLOCK_M": 256,
      "BLOCK_N": 16,
      "BLOCK_K": 64,
      "BLOCK_C": 128,
      "NUM_KSPLIT": 1,
      "num_warps": 2,
      "num_stages": 2,
      "waves_per_eu": 0
    },
    "1880": {
      "BLOCK_M": 64,
      "BLOCK_N": 16,
      "BLOCK_K": 64,
      "BLOCK_C": 32,
      "NUM_KSPLIT": 1,
      "num_warps": 4,
      "num_stages": 1,
      "waves_per_eu": 2
    },
    "2531": {
      "BLOCK_M": 64,
      "BLOCK_N": 16,
      "BLOCK_K": 256,
      "BLOCK_C": 16,
      "NUM_KSPLIT": 1,
      "num_warps": 4,
      "num_stages": 2,
      "waves_per_eu": 2
    },
    "354": {
      "BLOCK_M": 32,
      "BLOCK_N": 16,
      "BLOCK_K": 32,
      "BLOCK_C": 256,
      "NUM_KSPLIT": 8,
      "num_warps": 8,
      "num_stages": 1,
      "waves_per_eu": 0
    },
    "579": {
      "BLOCK_M": 32,
      "BLOCK_N": 16,
      "BLOCK_K": 64,
      "BLOCK_C": 128,
      "NUM_KSPLIT": 1,
      "num_warps": 2,
      "num_stages": 2,
      "waves_per_eu": 0
    },
    "4336": {
      "BLOCK_M": 256,
      "BLOCK_N": 16,
      "BLOCK_K": 32,
      "BLOCK_C": 16,
      "NUM_KSPLIT": 1,
      "num_warps": 8,
      "num_stages": 2,
      "waves_per_eu": 1
    },
    "4940": {
      "BLOCK_M": 256,
      "BLOCK_N": 16,
      "BLOCK_K": 64,
      "BLOCK_C": 128,
      "NUM_KSPLIT": 4,
      "num_warps": 4,
      "num_stages": 1,
      "waves_per_eu": 2
    },
    "5384": {
      "BLOCK_M": 256,
      "BLOCK_N": 16,
      "BLOCK_K": 128,
      "BLOCK_C": 256,
      "NUM_KSPLIT": 8,
      "num_warps": 2,
      "num_stages": 1,
      "waves_per_eu": 2
    },
    "1107": {
      "BLOCK_M": 32,
      "BLOCK_N": 16,
      "BLOCK_K": 256,
      "BLOCK_C": 16,
      "NUM_KSPLIT": 2,
      "num_warps": 4,
      "num_stages": 2,
      "waves_per_eu": 0
    },
    "4016": {
      "BLOCK_M": 128,
      "BLOCK_N": 16,
      "BLOCK_K": 256,
      "BLOCK_C": 16,
      "NUM_KSPLIT": 8,
      "num_warps": 2,
      "num_stages": 1,
      "waves_per_eu": 2
    },
    "557": {
      "BLOCK_M": 32,
      "BLOCK_N": 16,
      "BLOCK_K": 64,
      "BLOCK_C": 64,
      "NUM_KSPLIT": 4,
      "num_warps": 8,
      "num_stages": 2,
      "waves_per_eu": 2
    },
    "2315": {
      "BLOCK_M": 64,
      "BLOCK_N": 16,
      "BLOCK_K": 128,
      "BLOCK_C": 64,
      "NUM_KSPLIT": 1,
      "num_warps": 4,
      "num_stages": 2,
      "waves_per_eu": 2
    },
    "1489": {
      "BLOCK_M": 64,
      "BLOCK_N": 16,
      "BLOCK_K": 32,
      "BLOCK_C": 16,
      "NUM_KSPLIT": 4,
      "num_warps": 8,
      "num_stages": 1,
      "waves_per_eu": 1
    },
    "3678": {
      "BLOCK_M": 128,
      "BLOCK_N": 16,
      "BLOCK_K": 128,
      "BLOCK_C": 32,
      "NUM_KSPLIT": 1,
      "num_warps": 4,
      "num_stages": 1,
      "waves_per_eu": 0
    },
    "2878": {
      "BLOCK_M": 64,
      "BLOCK_N": 16,
      "BLOCK_K": 256,
      "BLOCK_C": 256,
      "NUM_KSPLIT": 8,
      "num_warps": 8,
      "num_stages": 2,
      "waves_per_eu": 1
    },
    "627": {
      "BLOCK_M": 32,
      "BLOCK_N": 16,
      "BLOCK_K": 64,
      "BLOCK_C": 128,
      "NUM_KSPLIT": 4,
      "num_warps": 8,
      "num_stages": 2,
      "waves_per_eu": 0
    },
    "1342": {
      "BLOCK_M": 32,
      "BLOCK_N": 16,
      "BLOCK_K": 256,
      "BLOCK_C": 128,
      "NUM_KSPLIT": 4,
      "num_warps": 4,
      "num_stages": 2,
      "waves_per_eu": 1
    },
    "926": {
      "BLOCK_M": 32,
      "BLOCK_N": 16,
      "BLOCK_K": 128,
      "BLOCK_C": 64,
      "NUM_KSPLIT": 8,
      "num_warps": 4,
      "num_stages": 1,
      "waves_per_eu": 2
    },
    "5111": {
      "BLOCK_M": 256,
      "BLOCK_N": 16,
      "BLOCK_K": 128,
      "BLOCK_C": 16,
      "NUM_KSPLIT": 8,
      "num_warps": 8,
      "num_stages": 2,
      "waves_per_eu": 2
    },
    "2593": {
      "BLOCK_M": 64,
      "BLOCK_N": 16,
      "BLOCK_K": 256,
      "BLOCK_C": 32,
      "NUM_KSPLIT": 1,
      "num_warps": 2,
      "num_stages": 1,
      "waves_per_eu": 1
    },
    "3018": {
      "BLOCK_M": 128,
      "BLOCK_N": 16,
      "BLOCK_K": 32,
      "BLOCK_C": 32,
      "NUM_KSPLIT": 8,
      "num_warps": 8,
      "num_stages": 1,
      "waves_per_eu": 0
    },
    "367": {
      "BLOCK_M": 32,
      "BLOCK_N": 16,
      "BLOCK_K": 64,
      "BLOCK_C": 16,
      "NUM_KSPLIT": 1,
      "num_warps": 4,
      "num_stages": 1,
      "waves_per_eu": 1
    },
    "2036": {
      "BLOCK_M": 64,
      "BLOCK_N": 16,
      "BLOCK_K": 64,
      "BLOCK_C": 128,
      "NUM_KSPLIT": 2,
      "num_warps": 2,
      "num_stages": 1,
      "waves_per_eu": 2
    },
    "5420": {
      "BLOCK_M": 256,
      "BLOCK_N": 16,
      "BLOCK_K": 256,
      "BLOCK_C": 16,
      "NUM_KSPLIT": 2,
      "num_warps": 2,
      "num_stages": 1,
      "waves_per_eu": 2
    },
    "555": {
      "BLOCK_M": 32,
      "BLOCK_N": 16,
      "BLOCK_K": 64,
      "BLOCK_C": 64,
      "NUM_KSPLIT": 4,
      "num_warps": 8,
      "num_stages": 2,
      "waves_per_eu": 0
    },
    "5688": {
      "BLOCK_M": 256,
      "BLOCK_N": 16,
      "BLOCK_K": 256,
      "BLOCK_C": 256,
      "NUM_KSPLIT": 1,
      "num_warps": 2,
      "num_stages": 1,
      "waves_per_eu": 0
    },
    "5333": {
      "BLOCK_M": 256,
      "BLOCK_N": 16,
      "BLOCK_K": 128,
      "BLOCK_C": 256,
      "NUM_KSPLIT": 1,
      "num_warps": 2,
      "num_stages": 2,
      "waves_per_eu": 2
    },
    "766": {
      "BLOCK_M": 32,
      "BLOCK_N": 16,
      "BLOCK_K": 128,
      "BLOCK_C": 16,
      "NUM_KSPLIT": 4,
      "num_warps": 4,
      "num_stages": 2,
      "waves_per_eu": 1
    },
    "251": {
      "BLOCK_M": 32,
      "BLOCK_N": 16,
      "BLOCK_K": 32,
      "BLOCK_C": 128,
      "NUM_KSPLIT": 2,
      "num_warps": 8,
      "num_stages": 2,
      "waves_per_eu": 2
    },
    "2387": {
      "BLOCK_M": 64,
      "BLOCK_N": 16,
      "BLOCK_K": 128,
      "BLOCK_C": 128,
      "NUM_KSPLIT": 1,
      "num_warps": 4,
      "num_stages": 2,
      "waves_per_eu": 2
    },
    "1127": {
      "BLOCK_M": 32,
      "BLOCK_N": 16,
      "BLOCK_K": 256,
      "BLOCK_C": 16,
      "NUM_KSPLIT": 4,
      "num_warps": 4,
      "num_stages": 2,
      "waves_per_eu": 2
    },
    "651": {
      "BLOCK_M": 32,
      "BLOCK_N": 16,
      "BLOCK_K": 64,
      "BLOCK_C": 256,
      "NUM_KSPLIT": 1,
      "num_warps": 2,
      "num_stages": 2,
      "waves_per_eu": 0
    },
    "4839": {
      "BLOCK_M": 256,
      "BLOCK_N": 16,
      "BLOCK_K": 64,
      "BLOCK_C": 64,
      "NUM_KSPLIT": 1,
      "num_warps": 8,
      "num_stages": 2,
      "waves_per_eu": 0
    },
    "4865": {
      "BLOCK_M": 256,
      "BLOCK_N": 16,
      "BLOCK_K": 64,
      "BLOCK_C": 64,
      "NUM_KSPLIT": 4,
      "num_warps": 2,
      "num_stages": 2,
      "waves_per_eu": 2
    },
    "3104": {
      "BLOCK_M": 128,
      "BLOCK_N": 16,
      "BLOCK_K": 32,
      "BLOCK_C": 128,
      "NUM_KSPLIT": 1,
      "num_warps": 4,
      "num_stages": 1,
      "waves_per_eu": 2
    },
    "4744": {
      "BLOCK_M": 256,
      "BLOCK_N": 16,
      "BLOCK_K": 64,
      "BLOCK_C": 16,
      "NUM_KSPLIT": 8,
      "num_warps": 4,
      "num_stages": 2,
      "waves_per_eu": 1
    },
    "1629": {
      "BLOCK_M": 64,
      "BLOCK_N": 16,
      "BLOCK_K": 32,
      "BLOCK_C": 64,
      "NUM_KSPLIT": 4,
      "num_warps": 4,
      "num_stages": 2,
      "waves_per_eu": 0
    },
    "4041": {
      "BLOCK_M": 128,
      "BLOCK_N": 16,
      "BLOCK_K": 256,
      "BLOCK_C": 32,
      "NUM_KSPLIT": 1,
      "num_warps": 4,
      "num_stages": 2,
      "waves_per_eu": 0
    },
    "961": {
      "BLOCK_M": 32,
      "BLOCK_N": 16,
      "BLOCK_K": 128,
      "BLOCK_C": 128,
      "NUM_KSPLIT": 2,
      "num_warps": 4,
      "num_stages": 1,
      "waves_per_eu": 1
    },
    "1600": {
      "BLOCK_M": 64,
      "BLOCK_N": 16,
      "BLOCK_K": 32,
      "BLOCK_C": 64,
      "NUM_KSPLIT": 1,
      "num_warps": 8,
      "num_stages": 2,
      "waves_per_eu": 1
    },
    "3895": {
      "BLOCK_M": 128,
      "BLOCK_N": 16,
      "BLOCK_K": 128,
      "BLOCK_C": 256,
      "NUM_KSPLIT": 1,
      "num_warps": 4,
      "num_stages": 1,
      "waves_per_eu": 1
    },
    "3587": {
      "BLOCK_M": 128,
      "BLOCK_N": 16,
      "BLOCK_K": 64,
      "BLOCK_C": 256,
      "NUM_KSPLIT": 8,
      "num_warps": 2,
      "num_stages": 2,
      "waves_per_eu": 2
    },
    "3703": {
      "BLOCK_M": 128,
      "BLOCK_N": 16,
      "BLOCK_K": 128,
      "BLOCK_C": 32,
      "NUM_KSPLIT": 2,
      "num_warps": 8,
      "num_stages": 1,
      "waves_per_eu": 1
    },
    "2577": {
      "BLOCK_M": 64,
      "BLOCK_N": 16,
      "BLOCK_K": 256,
      "BLOCK_C": 16,
      "NUM_KSPLIT": 8,
      "num_warps": 2,
      "num_stages": 2,
      "waves_per_eu": 0
    },
    "3549": {
      "BLOCK_M": 128,
      "BLOCK_N": 16,
      "BLOCK_K": 64,
      "BLOCK_C": 256,
      "NUM_KSPLIT": 2,
      "num_warps": 2,
      "num_stages": 2,
      "waves_per_eu": 0
    },
    "2619": {
      "BLOCK_M": 64,
      "BLOCK_N": 16,
      "BLOCK_K": 256,
      "BLOCK_C": 32,
      "NUM_KSPLIT": 2,
      "num_warps": 4,
      "num_stages": 2,
      "waves_per_eu": 0
    },
    "3720": {
      "BLOCK_M": 128,
      "BLOCK_N": 16,
      "BLOCK_K": 128,
      "BLOCK_C": 32,
      "NUM_KSPLIT": 4,
      "num_warps": 8,
      "num_stages": 1,
      "waves_per_eu": 0
    },
    "3014": {
      "BLOCK_M": 128,
      "BLOCK_N": 16,
      "BLOCK_K": 32,
      "BLOCK_C": 32,
      "NUM_KSPLIT": 8,
      "num_warps": 4,
      "num_stages": 1,
      "waves_per_eu": 2
    },
    "3644": {
      "BLOCK_M": 128,
      "BLOCK_N": 16,
      "BLOCK_K": 128,
      "BLOCK_C": 16,
      "NUM_KSPLIT": 4,
      "num_warps": 4,
      "num_stages": 1,
      "waves_per_eu": 2
    },
    "2114": {
      "BLOCK_M": 64,
      "BLOCK_N": 16,
      "BLOCK_K": 64,
      "BLOCK_C": 256,
      "NUM_KSPLIT": 2,
      "num_warps": 4,
      "num_stages": 1,
      "waves_per_eu": 2
    },
    "5178": {
      "BLOCK_M": 256,
      "BLOCK_N": 16,
      "BLOCK_K": 128,
      "BLOCK_C": 32,
      "NUM_KSPLIT": 8,
      "num_warps": 8,
      "num_stages": 1,
      "waves_per_eu": 0
    },
    "4547": {
      "BLOCK_M": 256,
      "BLOCK_N": 16,
      "BLOCK_K": 32,
      "BLOCK_C": 128,
      "NUM_KSPLIT": 1,
      "num_warps": 4,
      "num_stages": 2,
      "waves_per_eu": 2
    },
    "1772": {
      "BLOCK_M": 64,
      "BLOCK_N": 16,
      "BLOCK_K": 32,
      "BLOCK_C": 256,
      "NUM_KSPLIT": 4,
      "num_warps": 4,
      "num_stages": 1,
      "waves_per_eu": 2
    },
    "3445": {
      "BLOCK_M": 128,
      "BLOCK_N": 16,
      "BLOCK_K": 64,
      "BLOCK_C": 64,
      "NUM_KSPLIT": 8,
      "num_warps": 4,
      "num_stages": 1,
      "waves_per_eu": 1
    },
    "330": {
      "BLOCK_M": 32,
      "BLOCK_N": 16,
      "BLOCK_K": 32,
      "BLOCK_C": 256,
      "NUM_KSPLIT": 4,
      "num_warps": 4,
      "num_stages": 1,
      "waves_per_eu": 0
    },
    "2129": {
      "BLOCK_M": 64,
      "BLOCK_N": 16,
      "BLOCK_K": 64,
      "BLOCK_C": 256,
      "NUM_KSPLIT": 4,
      "num_warps": 2,
      "num_stages": 2,
      "waves_per_eu": 2
    },
    "4556": {
      "BLOCK_M": 256,
      "BLOCK_N": 16,
      "BLOCK_K": 32,
      "BLOCK_C": 128,
      "NUM_KSPLIT": 2,
      "num_warps": 2,
      "num_stages": 1,
      "waves_per_eu": 2
    },
    "2261": {
      "BLOCK_M": 64,
      "BLOCK_N": 16,
      "BLOCK_K": 128,
      "BLOCK_C": 32,
      "NUM_KSPLIT": 2,
      "num_warps": 4,
      "num_stages": 2,
      "waves_per_eu": 2
    },
    "205": {
      "BLOCK_M": 32,
      "BLOCK_N": 16,
      "BLOCK_K": 32,
      "BLOCK_C": 64,
      "NUM_KSPLIT": 8,
      "num_warps": 4,
      "num_stages": 1,
      "waves_per_eu": 1
    },
    "3508": {
      "BLOCK_M": 128,
      "BLOCK_N": 16,
      "BLOCK_K": 64,
      "BLOCK_C": 128,
      "NUM_KSPLIT": 4,
      "num_warps": 8,
      "num_stages": 2,
      "waves_per_eu": 1
    },
    "3249": {
      "BLOCK_M": 128,
      "BLOCK_N": 16,
      "BLOCK_K": 64,
      "BLOCK_C": 16,
      "NUM_KSPLIT": 1,
      "num_warps": 4,
      "num_stages": 2,
      "waves_per_eu": 0
    },
    "32": {
      "BLOCK_M": 32,
      "BLOCK_N": 16,
      "BLOCK_K": 32,
      "BLOCK_C": 16,
      "NUM_KSPLIT": 2,
      "num_warps": 8,
      "num_stages": 1,
      "waves_per_eu": 2
    },
    "5580": {
      "BLOCK_M": 256,
      "BLOCK_N": 16,
      "BLOCK_K": 256,
      "BLOCK_C": 64,
      "NUM_KSPLIT": 4,
      "num_warps": 2,
      "num_stages": 1,
      "waves_per_eu": 0
    },
    "1529": {
      "BLOCK_M": 64,
      "BLOCK_N": 16,
      "BLOCK_K": 32,
      "BLOCK_C": 32,
      "NUM_KSPLIT": 1,
      "num_warps": 8,
      "num_stages": 2,
      "waves_per_eu": 2
    },
    "5092": {
      "BLOCK_M": 256,
      "BLOCK_N": 16,
      "BLOCK_K": 128,
      "BLOCK_C": 16,
      "NUM_KSPLIT": 4,
      "num_warps": 8,
      "num_stages": 2,
      "waves_per_eu": 1
    },
    "2371": {
      "BLOCK_M": 64,
      "BLOCK_N": 16,
      "BLOCK_K": 128,
      "BLOCK_C": 64,
      "NUM_KSPLIT": 8,
      "num_warps": 8,
      "num_stages": 1,
      "waves_per_eu": 1
    },
    "1507": {
      "BLOCK_M": 64,
      "BLOCK_N": 16,
      "BLOCK_K": 32,
      "BLOCK_C": 16,
      "NUM_KSPLIT": 8,
      "num_warps": 8,
      "num_stages": 1,
      "waves_per_eu": 1
    },
    "224": {
      "BLOCK_M": 32,
      "BLOCK_N": 16,
      "BLOCK_K": 32,
      "BLOCK_C": 128,
      "NUM_KSPLIT": 1,
      "num_warps": 4,
      "num_stages": 1,
      "waves_per_eu": 2
    },
    "314": {
      "BLOCK_M": 32,
      "BLOCK_N": 16,
      "BLOCK_K": 32,
      "BLOCK_C": 256,
      "NUM_KSPLIT": 2,
      "num_warps": 4,
      "num_stages": 1,
      "waves_per_eu": 2
    },
    "4428": {
      "BLOCK_M": 256,
      "BLOCK_N": 16,
      "BLOCK_K": 32,
      "BLOCK_C": 32,
      "NUM_KSPLIT": 4,
      "num_warps": 2,
      "num_stages": 1,
      "waves_per_eu": 0
    },
    "1962": {
      "BLOCK_M": 64,
      "BLOCK_N": 16,
      "BLOCK_K": 64,
      "BLOCK_C": 64,
      "NUM_KSPLIT": 2,
      "num_warps": 2,
      "num_stages": 1,
      "waves_per_eu": 0
    },
    "3737": {
      "BLOCK_M": 128,
      "BLOCK_N": 16,
      "BLOCK_K": 128,
      "BLOCK_C": 32,
      "NUM_KSPLIT": 8,
      "num_warps": 4,
      "num_stages": 2,
      "waves_per_eu": 2
    },
    "146": {
      "BLOCK_M": 32,
      "BLOCK_N": 16,
      "BLOCK_K": 32,
      "BLOCK_C": 64,
      "NUM_KSPLIT": 1,
      "num_warps": 2,
      "num_stages": 1,
      "waves_per_eu": 2
    },
    "4882": {
      "BLOCK_M": 256,
      "BLOCK_N": 16,
      "BLOCK_K": 64,
      "BLOCK_C": 64,
      "NUM_KSPLIT": 8,
      "num_warps": 2,
      "num_stages": 2,
      "waves_per_eu": 1
    },
    "3275": {
      "BLOCK_M": 128,
      "BLOCK_N": 16,
      "BLOCK_K": 64,
      "BLOCK_C": 16,
      "NUM_KSPLIT": 2,
      "num_warps": 8,
      "num_stages": 2,
      "waves_per_eu": 2
    },
    "4779": {
      "BLOCK_M": 256,
      "BLOCK_N": 16,
      "BLOCK_K": 64,
      "BLOCK_C": 32,
      "NUM_KSPLIT": 2,
      "num_warps": 4,
      "num_stages": 2,
      "waves_per_eu": 0
    },
    "2586": {
      "BLOCK_M": 64,
      "BLOCK_N": 16,
      "BLOCK_K": 256,
      "BLOCK_C": 16,
      "NUM_KSPLIT": 8,
      "num_warps": 8,
      "num_stages": 1,
      "waves_per_eu": 0
    },
    "1642": {
      "BLOCK_M": 64,
      "BLOCK_N": 16,
      "BLOCK_K": 32,
      "BLOCK_C": 64,
      "NUM_KSPLIT": 8,
      "num_warps": 2,
      "num_stages": 2,
      "waves_per_eu": 1
    },
    "5753": {
      "BLOCK_M": 256,
      "BLOCK_N": 16,
      "BLOCK_K": 256,
      "BLOCK_C": 256,
      "NUM_KSPLIT": 8,
      "num_warps": 4,
      "num_stages": 2,
      "waves_per_eu": 2
    },
    "4313": {
      "BLOCK_M": 128,
      "BLOCK_N": 16,
      "BLOCK_K": 256,
      "BLOCK_C": 256,
      "NUM_KSPLIT": 8,
      "num_warps": 4,
      "num_stages": 2,
      "waves_per_eu": 2
    },
    "1663": {
      "BLOCK_M": 64,
      "BLOCK_N": 16,
      "BLOCK_K": 32,
      "BLOCK_C": 128,
      "NUM_KSPLIT": 1,
      "num_warps": 4,
      "num_stages": 1,
      "waves_per_eu": 1
    },
    "460": {
      "BLOCK_M": 32,
      "BLOCK_N": 16,
      "BLOCK_K": 64,
      "BLOCK_C": 32,
      "NUM_KSPLIT": 2,
      "num_warps": 4,
      "num_stages": 2,
      "waves_per_eu": 1
    },
    "2870": {
      "BLOCK_M": 64,
      "BLOCK_N": 16,
      "BLOCK_K": 256,
      "BLOCK_C": 256,
      "NUM_KSPLIT": 8,
      "num_warps": 4,
      "num_stages": 1,
      "waves_per_eu": 2
    },
    "5243": {
      "BLOCK_M": 256,
      "BLOCK_N": 16,
      "BLOCK_K": 128,
      "BLOCK_C": 64,
      "NUM_KSPLIT": 8,
      "num_warps": 2,
      "num_stages": 2,
      "waves_per_eu": 2
    },
    "5235": {
      "BLOCK_M": 256,
      "BLOCK_N": 16,
      "BLOCK_K": 128,
      "BLOCK_C": 64,
      "NUM_KSPLIT": 4,
      "num_warps": 8,
      "num_stages": 2,
      "waves_per_eu": 0
    },
    "5060": {
      "BLOCK_M": 256,
      "BLOCK_N": 16,
      "BLOCK_K": 128,
      "BLOCK_C": 16,
      "NUM_KSPLIT": 2,
      "num_warps": 2,
      "num_stages": 1,
      "waves_per_eu": 2
    },
    "4950": {
      "BLOCK_M": 256,
      "BLOCK_N": 16,
      "BLOCK_K": 64,
      "BLOCK_C": 128,
      "NUM_KSPLIT": 8,
      "num_warps": 2,
      "num_stages": 1,
      "waves_per_eu": 0
    },
    "420": {
      "BLOCK_M": 32,
      "BLOCK_N": 16,
      "BLOCK_K": 64,
      "BLOCK_C": 16,
      "NUM_KSPLIT": 8,
      "num_warps": 4,
      "num_stages": 1,
      "waves_per_eu": 0
    },
    "5214": {
      "BLOCK_M": 256,
      "BLOCK_N": 16,
      "BLOCK_K": 128,
      "BLOCK_C": 64,
      "NUM_KSPLIT": 2,
      "num_warps": 8,
      "num_stages": 1,
      "waves_per_eu": 0
    },
    "3245": {
      "BLOCK_M": 128,
      "BLOCK_N": 16,
      "BLOCK_K": 64,
      "BLOCK_C": 16,
      "NUM_KSPLIT": 1,
      "num_warps": 2,
      "num_stages": 2,
      "waves_per_eu": 2
    },
    "101": {
      "BLOCK_M": 32,
      "BLOCK_N": 16,
      "BLOCK_K": 32,
      "BLOCK_C": 32,
      "NUM_KSPLIT": 2,
      "num_warps": 4,
      "num_stages": 2,
      "waves_per_eu": 2
    },
    "3942": {
      "BLOCK_M": 128,
      "BLOCK_N": 16,
      "BLOCK_K": 128,
      "BLOCK_C": 256,
      "NUM_KSPLIT": 8,
      "num_warps": 2,
      "num_stages": 1,
      "waves_per_eu": 0
    },
    "4053": {
      "BLOCK_M": 128,
      "BLOCK_N": 16,
      "BLOCK_K": 256,
      "BLOCK_C": 32,
      "NUM_KSPLIT": 2,
      "num_warps": 2,
      "num_stages": 2,
      "waves_per_eu": 0
    },
    "2228": {
      "BLOCK_M": 64,
      "BLOCK_N": 16,
      "BLOCK_K": 128,
      "BLOCK_C": 16,
      "NUM_KSPLIT": 8,
      "num_warps": 8,
      "num_stages": 1,
      "waves_per_eu": 2
    },
    "629": {
      "BLOCK_M": 32,
      "BLOCK_N": 16,
      "BLOCK_K": 64,
      "BLOCK_C": 128,
      "NUM_KSPLIT": 4,
      "num_warps": 8,
      "num_stages": 2,
      "waves_per_eu": 2
    },
    "2276": {
      "BLOCK_M": 64,
      "BLOCK_N": 16,
      "BLOCK_K": 128,
      "BLOCK_C": 32,
      "NUM_KSPLIT": 4,
      "num_warps": 4,
      "num_stages": 1,
      "waves_per_eu": 2
    },
    "2335": {
      "BLOCK_M": 64,
      "BLOCK_N": 16,
      "BLOCK_K": 128,
      "BLOCK_C": 64,
      "NUM_KSPLIT": 2,
      "num_warps": 8,
      "num_stages": 1,
      "waves_per_eu": 1
    },
    "631": {
      "BLOCK_M": 32,
      "BLOCK_N": 16,
      "BLOCK_K": 64,
      "BLOCK_C": 128,
      "NUM_KSPLIT": 8,
      "num_warps": 2,
      "num_stages": 1,
      "waves_per_eu": 1
    },
    "3421": {
      "BLOCK_M": 128,
      "BLOCK_N": 16,
      "BLOCK_K": 64,
      "BLOCK_C": 64,
      "NUM_KSPLIT": 4,
      "num_warps": 2,
      "num_stages": 1,
      "waves_per_eu": 1
    },
    "3740": {
      "BLOCK_M": 128,
      "BLOCK_N": 16,
      "BLOCK_K": 128,
      "BLOCK_C": 32,
      "NUM_KSPLIT": 8,
      "num_warps": 8,
      "num_stages": 1,
      "waves_per_eu": 2
    },
    "5720": {
      "BLOCK_M": 256,
      "BLOCK_N": 16,
      "BLOCK_K": 256,
      "BLOCK_C": 256,
      "NUM_KSPLIT": 2,
      "num_warps": 8,
      "num_stages": 1,
      "waves_per_eu": 2
    },
    "5107": {
      "BLOCK_M": 256,
      "BLOCK_N": 16,
      "BLOCK_K": 128,
      "BLOCK_C": 16,
      "NUM_KSPLIT": 8,
      "num_warps": 8,
      "num_stages": 1,
      "waves_per_eu": 1
    },
    "2173": {
      "BLOCK_M": 64,
      "BLOCK_N": 16,
      "BLOCK_K": 128,
      "BLOCK_C": 16,
      "NUM_KSPLIT": 1,
      "num_warps": 8,
      "num_stages": 1,
      "waves_per_eu": 1
    },
    "1523": {
      "BLOCK_M": 64,
      "BLOCK_N": 16,
      "BLOCK_K": 32,
      "BLOCK_C": 32,
      "NUM_KSPLIT": 1,
      "num_warps": 4,
      "num_stages": 2,
      "waves_per_eu": 2
    },
    "4845": {
      "BLOCK_M": 256,
      "BLOCK_N": 16,
      "BLOCK_K": 64,
      "BLOCK_C": 64,
      "NUM_KSPLIT": 2,
      "num_warps": 2,
      "num_stages": 2,
      "waves_per_eu": 0
    },
    "5427": {
      "BLOCK_M": 256,
      "BLOCK_N": 16,
      "BLOCK_K": 256,
      "BLOCK_C": 16,
      "NUM_KSPLIT": 2,
      "num_warps": 4,
      "num_stages": 2,
      "waves_per_eu": 0
    },
    "5014": {
      "BLOCK_M": 256,
      "BLOCK_N": 16,
      "BLOCK_K": 64,
      "BLOCK_C": 256,
      "NUM_KSPLIT": 4,
      "num_warps": 4,
      "num_stages": 2,
      "waves_per_eu": 1
    },
    "5551": {
      "BLOCK_M": 256,
      "BLOCK_N": 16,
      "BLOCK_K": 256,
      "BLOCK_C": 64,
      "NUM_KSPLIT": 1,
      "num_warps": 4,
      "num_stages": 1,
      "waves_per_eu": 1
    },
    "4291": {
      "BLOCK_M": 128,
      "BLOCK_N": 16,
      "BLOCK_K": 256,
      "BLOCK_C": 256,
      "NUM_KSPLIT": 4,
      "num_warps": 4,
      "num_stages": 1,
      "waves_per_eu": 1
    },
    "3086": {
      "BLOCK_M": 128,
      "BLOCK_N": 16,
      "BLOCK_K": 32,
      "BLOCK_C": 64,
      "NUM_KSPLIT": 8,
      "num_warps": 4,
      "num_stages": 1,
      "waves_per_eu": 2
    },
    "1795": {
      "BLOCK_M": 64,
      "BLOCK_N": 16,
      "BLOCK_K": 32,
      "BLOCK_C": 256,
      "NUM_KSPLIT": 8,
      "num_warps": 8,
      "num_stages": 1,
      "waves_per_eu": 1
    },
    "3718": {
      "BLOCK_M": 128,
      "BLOCK_N": 16,
      "BLOCK_K": 128,
      "BLOCK_C": 32,
      "NUM_KSPLIT": 4,
      "num_warps": 4,
      "num_stages": 2,
      "waves_per_eu": 1
    },
    "3622": {
      "BLOCK_M": 128,
      "BLOCK_N": 16,
      "BLOCK_K": 128,
      "BLOCK_C": 16,
      "NUM_KSPLIT": 2,
      "num_warps": 2,
      "num_stages": 2,
      "waves_per_eu": 1
    },
    "2253": {
      "BLOCK_M": 64,
      "BLOCK_N": 16,
      "BLOCK_K": 128,
      "BLOCK_C": 32,
      "NUM_KSPLIT": 2,
      "num_warps": 2,
      "num_stages": 2,
      "waves_per_eu": 0
    },
    "4648": {
      "BLOCK_M": 256,
      "BLOCK_N": 16,
      "BLOCK_K": 32,
      "BLOCK_C": 256,
      "NUM_KSPLIT": 4,
      "num_warps": 2,
      "num_stages": 2,
      "waves_per_eu": 1
    },
    "19": {
      "BLOCK_M": 32,
      "BLOCK_N": 16,
      "BLOCK_K": 32,
      "BLOCK_C": 16,
      "NUM_KSPLIT": 2,
      "num_warps": 2,
      "num_stages": 1,
      "waves_per_eu": 1
    },
    "4927": {
      "BLOCK_M": 256,
      "BLOCK_N": 16,
      "BLOCK_K": 64,
      "BLOCK_C": 128,
      "NUM_KSPLIT": 2,
      "num_warps": 8,
      "num_stages": 1,
      "waves_per_eu": 1
    },
    "2762": {
      "BLOCK_M": 64,
      "BLOCK_N": 16,
      "BLOCK_K": 256,
      "BLOCK_C": 128,
      "NUM_KSPLIT": 2,
      "num_warps": 4,
      "num_stages": 1,
      "waves_per_eu": 2
    },
    "2595": {
      "BLOCK_M": 64,
      "BLOCK_N": 16,
      "BLOCK_K": 256,
      "BLOCK_C": 32,
      "NUM_KSPLIT": 1,
      "num_warps": 2,
      "num_stages": 2,
      "waves_per_eu": 0
    },
    "4637": {
      "BLOCK_M": 256,
      "BLOCK_N": 16,
      "BLOCK_K": 32,
      "BLOCK_C": 256,
      "NUM_KSPLIT": 2,
      "num_warps": 4,
      "num_stages": 2,
      "waves_per_eu": 2
    },
    "4924": {
      "BLOCK_M": 256,
      "BLOCK_N": 16,
      "BLOCK_K": 64,
      "BLOCK_C": 128,
      "NUM_KSPLIT": 2,
      "num_warps": 4,
      "num_stages": 2,
      "waves_per_eu": 1
    },
    "402": {
      "BLOCK_M": 32,
      "BLOCK_N": 16,
      "BLOCK_K": 64,
      "BLOCK_C": 16,
      "NUM_KSPLIT": 4,
      "num_warps": 4,
      "num_stages": 1,
      "waves_per_eu": 0
    },
    "5628": {
      "BLOCK_M": 256,
      "BLOCK_N": 16,
      "BLOCK_K": 256,
      "BLOCK_C": 128,
      "NUM_KSPLIT": 1,
      "num_warps": 8,
      "num_stages": 1,
      "waves_per_eu": 0
    },
    "2145": {
      "BLOCK_M": 64,
      "BLOCK_N": 16,
      "BLOCK_K": 64,
      "BLOCK_C": 256,
      "NUM_KSPLIT": 8,
      "num_warps": 2,
      "num_stages": 2,
      "waves_per_eu": 0
    },
    "4674": {
      "BLOCK_M": 256,
      "BLOCK_N": 16,
      "BLOCK_K": 32,
      "BLOCK_C": 256,
      "NUM_KSPLIT": 8,
      "num_warps": 8,
      "num_stages": 1,
      "waves_per_eu": 0
    },
    "1020": {
      "BLOCK_M": 32,
      "BLOCK_N": 16,
      "BLOCK_K": 128,
      "BLOCK_C": 256,
      "NUM_KSPLIT": 1,
      "num_warps": 8,
      "num_stages": 1,
      "waves_per_eu": 0
    },
    "2633": {
      "BLOCK_M": 64,
      "BLOCK_N": 16,
      "BLOCK_K": 256,
      "BLOCK_C": 32,
      "NUM_KSPLIT": 4,
      "num_warps": 2,
      "num_stages": 2,
      "waves_per_eu": 2
    },
    "1184": {
      "BLOCK_M": 32,
      "BLOCK_N": 16,
      "BLOCK_K": 256,
      "BLOCK_C": 32,
      "NUM_KSPLIT": 2,
      "num_warps": 8,
      "num_stages": 1,
      "waves_per_eu": 2
    },
    "5451": {
      "BLOCK_M": 256,
      "BLOCK_N": 16,
      "BLOCK_K": 256,
      "BLOCK_C": 16,
      "NUM_KSPLIT": 4,
      "num_warps": 8,
      "num_stages": 2,
      "waves_per_eu": 0
    },
    "3760": {
      "BLOCK_M": 128,
      "BLOCK_N": 16,
      "BLOCK_K": 128,
      "BLOCK_C": 64,
      "NUM_KSPLIT": 1,
      "num_warps": 8,
      "num_stages": 2,
      "waves_per_eu": 1
    },
    "3447": {
      "BLOCK_M": 128,
      "BLOCK_N": 16,
      "BLOCK_K": 64,
      "BLOCK_C": 64,
      "NUM_KSPLIT": 8,
      "num_warps": 4,
      "num_stages": 2,
      "waves_per_eu": 0
    },
    "2272": {
      "BLOCK_M": 64,
      "BLOCK_N": 16,
      "BLOCK_K": 128,
      "BLOCK_C": 32,
      "NUM_KSPLIT": 4,
      "num_warps": 2,
      "num_stages": 2,
      "waves_per_eu": 1
    },
    "3180": {
      "BLOCK_M": 128,
      "BLOCK_N": 16,
      "BLOCK_K": 32,
      "BLOCK_C": 256,
      "NUM_KSPLIT": 1,
      "num_warps": 8,
      "num_stages": 1,
      "waves_per_eu": 0
    },
    "1993": {
      "BLOCK_M": 64,
      "BLOCK_N": 16,
      "BLOCK_K": 64,
      "BLOCK_C": 64,
      "NUM_KSPLIT": 4,
      "num_warps": 8,
      "num_stages": 1,
      "waves_per_eu": 1
    },
    "672": {
      "BLOCK_M": 32,
      "BLOCK_N": 16,
      "BLOCK_K": 64,
      "BLOCK_C": 256,
      "NUM_KSPLIT": 2,
      "num_warps": 4,
      "num_stages": 1,
      "waves_per_eu": 0
    },
    "4573": {
      "BLOCK_M": 256,
      "BLOCK_N": 16,
      "BLOCK_K": 32,
      "BLOCK_C": 128,
      "NUM_KSPLIT": 4,
      "num_warps": 2,
      "num_stages": 1,
      "waves_per_eu": 1
    },
    "967": {
      "BLOCK_M": 32,
      "BLOCK_N": 16,
      "BLOCK_K": 128,
      "BLOCK_C": 128,
      "NUM_KSPLIT": 2,
      "num_warps": 8,
      "num_stages": 1,
      "waves_per_eu": 1
    },
    "1344": {
      "BLOCK_M": 32,
      "BLOCK_N": 16,
      "BLOCK_K": 256,
      "BLOCK_C": 128,
      "NUM_KSPLIT": 4,
      "num_warps": 8,
      "num_stages": 1,
      "waves_per_eu": 0
    },
    "4629": {
      "BLOCK_M": 256,
      "BLOCK_N": 16,
      "BLOCK_K": 32,
      "BLOCK_C": 256,
      "NUM_KSPLIT": 2,
      "num_warps": 2,
      "num_stages": 2,
      "waves_per_eu": 0
    },
    "700": {
      "BLOCK_M": 32,
      "BLOCK_N": 16,
      "BLOCK_K": 64,
      "BLOCK_C": 256,
      "NUM_KSPLIT": 4,
      "num_warps": 8,
      "num_stages": 2,
      "waves_per_eu": 1
    },
    "79": {
      "BLOCK_M": 32,
      "BLOCK_N": 16,
      "BLOCK_K": 32,
      "BLOCK_C": 32,
      "NUM_KSPLIT": 1,
      "num_warps": 4,
      "num_stages": 1,
      "waves_per_eu": 1
    },
    "2004": {
      "BLOCK_M": 64,
      "BLOCK_N": 16,
      "BLOCK_K": 64,
      "BLOCK_C": 64,
      "NUM_KSPLIT": 8,
      "num_warps": 4,
      "num_stages": 1,
      "waves_per_eu": 0
    },
    "1476": {
      "BLOCK_M": 64,
      "BLOCK_N": 16,
      "BLOCK_K": 32,
      "BLOCK_C": 16,
      "NUM_KSPLIT": 4,
      "num_warps": 2,
      "num_stages": 1,
      "waves_per_eu": 0
    },
    "4943": {
      "BLOCK_M": 256,
      "BLOCK_N": 16,
      "BLOCK_K": 64,
      "BLOCK_C": 128,
      "NUM_KSPLIT": 4,
      "num_warps": 4,
      "num_stages": 2,
      "waves_per_eu": 2
    },
    "1405": {
      "BLOCK_M": 32,
      "BLOCK_N": 16,
      "BLOCK_K": 256,
      "BLOCK_C": 256,
      "NUM_KSPLIT": 4,
      "num_warps": 2,
      "num_stages": 1,
      "waves_per_eu": 1
    },
    "3154": {
      "BLOCK_M": 128,
      "BLOCK_N": 16,
      "BLOCK_K": 32,
      "BLOCK_C": 128,
      "NUM_KSPLIT": 8,
      "num_warps": 2,
      "num_stages": 2,
      "waves_per_eu": 1
    },
    "4014": {
      "BLOCK_M": 128,
      "BLOCK_N": 16,
      "BLOCK_K": 256,
      "BLOCK_C": 16,
      "NUM_KSPLIT": 8,
      "num_warps": 2,
      "num_stages": 1,
      "waves_per_eu": 0
    },
    "1319": {
      "BLOCK_M": 32,
      "BLOCK_N": 16,
      "BLOCK_K": 256,
      "BLOCK_C": 128,
      "NUM_KSPLIT": 2,
      "num_warps": 2,
      "num_stages": 2,
      "waves_per_eu": 2
    },
    "878": {
      "BLOCK_M": 32,
      "BLOCK_N": 16,
      "BLOCK_K": 128,
      "BLOCK_C": 64,
      "NUM_KSPLIT": 1,
      "num_warps": 8,
      "num_stages": 1,
      "waves_per_eu": 2
    },
    "5378": {
      "BLOCK_M": 256,
      "BLOCK_N": 16,
      "BLOCK_K": 128,
      "BLOCK_C": 256,
      "NUM_KSPLIT": 4,
      "num_warps": 8,
      "num_stages": 1,
      "waves_per_eu": 2
    },
    "3562": {
      "BLOCK_M": 128,
      "BLOCK_N": 16,
      "BLOCK_K": 64,
      "BLOCK_C": 256,
      "NUM_KSPLIT": 2,
      "num_warps": 8,
      "num_stages": 2,
      "waves_per_eu": 1
    },
    "3487": {
      "BLOCK_M": 128,
      "BLOCK_N": 16,
      "BLOCK_K": 64,
      "BLOCK_C": 128,
      "NUM_KSPLIT": 2,
      "num_warps": 8,
      "num_stages": 1,
      "waves_per_eu": 1
    },
    "2481": {
      "BLOCK_M": 64,
      "BLOCK_N": 16,
      "BLOCK_K": 128,
      "BLOCK_C": 256,
      "NUM_KSPLIT": 2,
      "num_warps": 8,
      "num_stages": 2,
      "waves_per_eu": 0
    },
    "48": {
      "BLOCK_M": 32,
      "BLOCK_N": 16,
      "BLOCK_K": 32,
      "BLOCK_C": 16,
      "NUM_KSPLIT": 4,
      "num_warps": 8,
      "num_stages": 1,
      "waves_per_eu": 0
    },
    "2294": {
      "BLOCK_M": 64,
      "BLOCK_N": 16,
      "BLOCK_K": 128,
      "BLOCK_C": 32,
      "NUM_KSPLIT": 8,
      "num_warps": 4,
      "num_stages": 1,
      "waves_per_eu": 2
    },
    "1961": {
      "BLOCK_M": 64,
      "BLOCK_N": 16,
      "BLOCK_K": 64,
      "BLOCK_C": 64,
      "NUM_KSPLIT": 1,
      "num_warps": 8,
      "num_stages": 2,
      "waves_per_eu": 2
    },
    "4995": {
      "BLOCK_M": 256,
      "BLOCK_N": 16,
      "BLOCK_K": 64,
      "BLOCK_C": 256,
      "NUM_KSPLIT": 2,
      "num_warps": 4,
      "num_stages": 2,
      "waves_per_eu": 0
    },
    "1470": {
      "BLOCK_M": 64,
      "BLOCK_N": 16,
      "BLOCK_K": 32,
      "BLOCK_C": 16,
      "NUM_KSPLIT": 2,
      "num_warps": 8,
      "num_stages": 1,
      "waves_per_eu": 0
    },
    "1522": {
      "BLOCK_M": 64,
      "BLOCK_N": 16,
      "BLOCK_K": 32,
      "BLOCK_C": 32,
      "NUM_KSPLIT": 1,
      "num_warps": 4,
      "num_stages": 2,
      "waves_per_eu": 1
    },
    "5069": {
      "BLOCK_M": 256,
      "BLOCK_N": 16,
      "BLOCK_K": 128,
      "BLOCK_C": 16,
      "NUM_KSPLIT": 2,
      "num_warps": 4,
      "num_stages": 2,
      "waves_per_eu": 2
    },
    "4405": {
      "BLOCK_M": 256,
      "BLOCK_N": 16,
      "BLOCK_K": 32,
      "BLOCK_C": 32,
      "NUM_KSPLIT": 1,
      "num_warps": 8,
      "num_stages": 1,
      "waves_per_eu": 1
    },
    "154": {
      "BLOCK_M": 32,
      "BLOCK_N": 16,
      "BLOCK_K": 32,
      "BLOCK_C": 64,
      "NUM_KSPLIT": 1,
      "num_warps": 4,
      "num_stages": 2,
      "waves_per_eu": 1
    },
    "3276": {
      "BLOCK_M": 128,
      "BLOCK_N": 16,
      "BLOCK_K": 64,
      "BLOCK_C": 16,
      "NUM_KSPLIT": 4,
      "num_warps": 2,
      "num_stages": 1,
      "waves_per_eu": 0
    },
    "1564": {
      "BLOCK_M": 64,
      "BLOCK_N": 16,
      "BLOCK_K": 32,
      "BLOCK_C": 32,
      "NUM_KSPLIT": 4,
      "num_warps": 8,
      "num_stages": 2,
      "waves_per_eu": 1
    },
    "2281": {
      "BLOCK_M": 64,
      "BLOCK_N": 16,
      "BLOCK_K": 128,
      "BLOCK_C": 32,
      "NUM_KSPLIT": 4,
      "num_warps": 8,
      "num_stages": 1,
      "waves_per_eu": 1
    },
    "2805": {
      "BLOCK_M": 64,
      "BLOCK_N": 16,
      "BLOCK_K": 256,
      "BLOCK_C": 128,
      "NUM_KSPLIT": 8,
      "num_warps": 8,
      "num_stages": 2,
      "waves_per_eu": 0
    },
    "5250": {
      "BLOCK_M": 256,
      "BLOCK_N": 16,
      "BLOCK_K": 128,
      "BLOCK_C": 64,
      "NUM_KSPLIT": 8,
      "num_warps": 8,
      "num_stages": 1,
      "waves_per_eu": 0
    },
    "2305": {
      "BLOCK_M": 64,
      "BLOCK_N": 16,
      "BLOCK_K": 128,
      "BLOCK_C": 64,
      "NUM_KSPLIT": 1,
      "num_warps": 2,
      "num_stages": 1,
      "waves_per_eu": 1
    },
    "1329": {
      "BLOCK_M": 32,
      "BLOCK_N": 16,
      "BLOCK_K": 256,
      "BLOCK_C": 128,
      "NUM_KSPLIT": 2,
      "num_warps": 8,
      "num_stages": 2,
      "waves_per_eu": 0
    },
    "3749": {
      "BLOCK_M": 128,
      "BLOCK_N": 16,
      "BLOCK_K": 128,
      "BLOCK_C": 64,
      "NUM_KSPLIT": 1,
      "num_warps": 2,
      "num_stages": 2,
      "waves_per_eu": 2
    },
    "3925": {
      "BLOCK_M": 128,
      "BLOCK_N": 16,
      "BLOCK_K": 128,
      "BLOCK_C": 256,
      "NUM_KSPLIT": 4,
      "num_warps": 2,
      "num_stages": 1,
      "waves_per_eu": 1
    },
    "2405": {
      "BLOCK_M": 64,
      "BLOCK_N": 16,
      "BLOCK_K": 128,
      "BLOCK_C": 128,
      "NUM_KSPLIT": 2,
      "num_warps": 4,
      "num_stages": 2,
      "waves_per_eu": 2
    },
    "4574": {
      "BLOCK_M": 256,
      "BLOCK_N": 16,
      "BLOCK_K": 32,
      "BLOCK_C": 128,
      "NUM_KSPLIT": 4,
      "num_warps": 2,
      "num_stages": 1,
      "waves_per_eu": 2
    },
    "309": {
      "BLOCK_M": 32,
      "BLOCK_N": 16,
      "BLOCK_K": 32,
      "BLOCK_C": 256,
      "NUM_KSPLIT": 2,
      "num_warps": 2,
      "num_stages": 2,
      "waves_per_eu": 0
    },
    "1469": {
      "BLOCK_M": 64,
      "BLOCK_N": 16,
      "BLOCK_K": 32,
      "BLOCK_C": 16,
      "NUM_KSPLIT": 2,
      "num_warps": 4,
      "num_stages": 2,
      "waves_per_eu": 2
    },
    "3148": {
      "BLOCK_M": 128,
      "BLOCK_N": 16,
      "BLOCK_K": 32,
      "BLOCK_C": 128,
      "NUM_KSPLIT": 4,
      "num_warps": 8,
      "num_stages": 2,
      "waves_per_eu": 1
    },
    "3436": {
      "BLOCK_M": 128,
      "BLOCK_N": 16,
      "BLOCK_K": 64,
      "BLOCK_C": 64,
      "NUM_KSPLIT": 4,
      "num_warps": 8,
      "num_stages": 2,
      "waves_per_eu": 1
    },
    "3668": {
      "BLOCK_M": 128,
      "BLOCK_N": 16,
      "BLOCK_K": 128,
      "BLOCK_C": 16,
      "NUM_KSPLIT": 8,
      "num_warps": 8,
      "num_stages": 1,
      "waves_per_eu": 2
    },
    "4992": {
      "BLOCK_M": 256,
      "BLOCK_N": 16,
      "BLOCK_K": 64,
      "BLOCK_C": 256,
      "NUM_KSPLIT": 2,
      "num_warps": 4,
      "num_stages": 1,
      "waves_per_eu": 0
    },
    "44": {
      "BLOCK_M": 32,
      "BLOCK_N": 16,
      "BLOCK_K": 32,
      "BLOCK_C": 16,
      "NUM_KSPLIT": 4,
      "num_warps": 4,
      "num_stages": 1,
      "waves_per_eu": 2
    },
    "1592": {
      "BLOCK_M": 64,
      "BLOCK_N": 16,
      "BLOCK_K": 32,
      "BLOCK_C": 64,
      "NUM_KSPLIT": 1,
      "num_warps": 4,
      "num_stages": 1,
      "waves_per_eu": 2
    },
    "4717": {
      "BLOCK_M": 256,
      "BLOCK_N": 16,
      "BLOCK_K": 64,
      "BLOCK_C": 16,
      "NUM_KSPLIT": 4,
      "num_warps": 2,
      "num_stages": 1,
      "waves_per_eu": 1
    },
    "4661": {
      "BLOCK_M": 256,
      "BLOCK_N": 16,
      "BLOCK_K": 32,
      "BLOCK_C": 256,
      "NUM_KSPLIT": 4,
      "num_warps": 8,
      "num_stages": 2,
      "waves_per_eu": 2
    },
    "854": {
      "BLOCK_M": 32,
      "BLOCK_N": 16,
      "BLOCK_K": 128,
      "BLOCK_C": 32,
      "NUM_KSPLIT": 8,
      "num_warps": 4,
      "num_stages": 1,
      "waves_per_eu": 2
    },
    "4832": {
      "BLOCK_M": 256,
      "BLOCK_N": 16,
      "BLOCK_K": 64,
      "BLOCK_C": 64,
      "NUM_KSPLIT": 1,
      "num_warps": 4,
      "num_stages": 1,
      "waves_per_eu": 2
    },
    "3871": {
      "BLOCK_M": 128,
      "BLOCK_N": 16,
      "BLOCK_K": 128,
      "BLOCK_C": 128,
      "NUM_KSPLIT": 8,
      "num_warps": 2,
      "num_stages": 1,
      "waves_per_eu": 1
    },
    "5077": {
      "BLOCK_M": 256,
      "BLOCK_N": 16,
      "BLOCK_K": 128,
      "BLOCK_C": 16,
      "NUM_KSPLIT": 4,
      "num_warps": 2,
      "num_stages": 1,
      "waves_per_eu": 1
    },
    "1317": {
      "BLOCK_M": 32,
      "BLOCK_N": 16,
      "BLOCK_K": 256,
      "BLOCK_C": 128,
      "NUM_KSPLIT": 2,
      "num_warps": 2,
      "num_stages": 2,
      "waves_per_eu": 0
    },
    "1883": {
      "BLOCK_M": 64,
      "BLOCK_N": 16,
      "BLOCK_K": 64,
      "BLOCK_C": 32,
      "NUM_KSPLIT": 1,
      "num_warps": 4,
      "num_stages": 2,
      "waves_per_eu": 2
    },
    "4970": {
      "BLOCK_M": 256,
      "BLOCK_N": 16,
      "BLOCK_K": 64,
      "BLOCK_C": 256,
      "NUM_KSPLIT": 1,
      "num_warps": 2,
      "num_stages": 1,
      "waves_per_eu": 2
    },
    "2205": {
      "BLOCK_M": 64,
      "BLOCK_N": 16,
      "BLOCK_K": 128,
      "BLOCK_C": 16,
      "NUM_KSPLIT": 4,
      "num_warps": 4,
      "num_stages": 2,
      "waves_per_eu": 0
    },
    "1688": {
      "BLOCK_M": 64,
      "BLOCK_N": 16,
      "BLOCK_K": 32,
      "BLOCK_C": 128,
      "NUM_KSPLIT": 2,
      "num_warps": 8,
      "num_stages": 1,
      "waves_per_eu": 2
    },
    "5756": {
      "BLOCK_M": 256,
      "BLOCK_N": 16,
      "BLOCK_K": 256,
      "BLOCK_C": 256,
      "NUM_KSPLIT": 8,
      "num_warps": 8,
      "num_stages": 1,
      "waves_per_eu": 2
    },
    "5417": {
      "BLOCK_M": 256,
      "BLOCK_N": 16,
      "BLOCK_K": 256,
      "BLOCK_C": 16,
      "NUM_KSPLIT": 1,
      "num_warps": 8,
      "num_stages": 2,
      "waves_per_eu": 2
    },
    "1936": {
      "BLOCK_M": 64,
      "BLOCK_N": 16,
      "BLOCK_K": 64,
      "BLOCK_C": 32,
      "NUM_KSPLIT": 8,
      "num_warps": 4,
      "num_stages": 2,
      "waves_per_eu": 1
    },
    "1930": {
      "BLOCK_M": 64,
      "BLOCK_N": 16,
      "BLOCK_K": 64,
      "BLOCK_C": 32,
      "NUM_KSPLIT": 8,
      "num_warps": 2,
      "num_stages": 2,
      "waves_per_eu": 1
    },
    "952": {
      "BLOCK_M": 32,
      "BLOCK_N": 16,
      "BLOCK_K": 128,
      "BLOCK_C": 128,
      "NUM_KSPLIT": 1,
      "num_warps": 8,
      "num_stages": 2,
      "waves_per_eu": 1
    },
    "3369": {
      "BLOCK_M": 128,
      "BLOCK_N": 16,
      "BLOCK_K": 64,
      "BLOCK_C": 32,
      "NUM_KSPLIT": 8,
      "num_warps": 2,
      "num_stages": 2,
      "waves_per_eu": 0
    },
    "3569": {
      "BLOCK_M": 128,
      "BLOCK_N": 16,
      "BLOCK_K": 64,
      "BLOCK_C": 256,
      "NUM_KSPLIT": 4,
      "num_warps": 2,
      "num_stages": 2,
      "waves_per_eu": 2
    },
    "2802": {
      "BLOCK_M": 64,
      "BLOCK_N": 16,
      "BLOCK_K": 256,
      "BLOCK_C": 128,
      "NUM_KSPLIT": 8,
      "num_warps": 8,
      "num_stages": 1,
      "waves_per_eu": 0
    },
    "3155": {
      "BLOCK_M": 128,
      "BLOCK_N": 16,
      "BLOCK_K": 32,
      "BLOCK_C": 128,
      "NUM_KSPLIT": 8,
      "num_warps": 2,
      "num_stages": 2,
      "waves_per_eu": 2
    },
    "431": {
      "BLOCK_M": 32,
      "BLOCK_N": 16,
      "BLOCK_K": 64,
      "BLOCK_C": 16,
      "NUM_KSPLIT": 8,
      "num_warps": 8,
      "num_stages": 2,
      "waves_per_eu": 2
    },
    "3532": {
      "BLOCK_M": 128,
      "BLOCK_N": 16,
      "BLOCK_K": 64,
      "BLOCK_C": 256,
      "NUM_KSPLIT": 1,
      "num_warps": 2,
      "num_stages": 2,
      "waves_per_eu": 1
    },
    "387": {
      "BLOCK_M": 32,
      "BLOCK_N": 16,
      "BLOCK_K": 64,
      "BLOCK_C": 16,
      "NUM_KSPLIT": 2,
      "num_warps": 4,
      "num_stages": 2,
      "waves_per_eu": 0
    },
    "3235": {
      "BLOCK_M": 128,
      "BLOCK_N": 16,
      "BLOCK_K": 32,
      "BLOCK_C": 256,
      "NUM_KSPLIT": 8,
      "num_warps": 8,
      "num_stages": 1,
      "waves_per_eu": 1
    },
    "2941": {
      "BLOCK_M": 128,
      "BLOCK_N": 16,
      "BLOCK_K": 32,
      "BLOCK_C": 16,
      "NUM_KSPLIT": 8,
      "num_warps": 4,
      "num_stages": 1,
      "waves_per_eu": 1
    },
    "726": {
      "BLOCK_M": 32,
      "BLOCK_N": 16,
      "BLOCK_K": 128,
      "BLOCK_C": 16,
      "NUM_KSPLIT": 1,
      "num_warps": 4,
      "num_stages": 1,
      "waves_per_eu": 0
    },
    "2839": {
      "BLOCK_M": 64,
      "BLOCK_N": 16,
      "BLOCK_K": 256,
      "BLOCK_C": 256,
      "NUM_KSPLIT": 2,
      "num_warps": 8,
      "num_stages": 1,
      "waves_per_eu": 1
    },
    "2822": {
      "BLOCK_M": 64,
      "BLOCK_N": 16,
      "BLOCK_K": 256,
      "BLOCK_C": 256,
      "NUM_KSPLIT": 1,
      "num_warps": 8,
      "num_stages": 1,
      "waves_per_eu": 2
    },
    "1612": {
      "BLOCK_M": 64,
      "BLOCK_N": 16,
      "BLOCK_K": 32,
      "BLOCK_C": 64,
      "NUM_KSPLIT": 2,
      "num_warps": 4,
      "num_stages": 2,
      "waves_per_eu": 1
    },
    "4935": {
      "BLOCK_M": 256,
      "BLOCK_N": 16,
      "BLOCK_K": 64,
      "BLOCK_C": 128,
      "NUM_KSPLIT": 4,
      "num_warps": 2,
      "num_stages": 2,
      "waves_per_eu": 0
    },
    "3832": {
      "BLOCK_M": 128,
      "BLOCK_N": 16,
      "BLOCK_K": 128,
      "BLOCK_C": 128,
      "NUM_KSPLIT": 1,
      "num_warps": 8,
      "num_stages": 2,
      "waves_per_eu": 1
    },
    "3497": {
      "BLOCK_M": 128,
      "BLOCK_N": 16,
      "BLOCK_K": 64,
      "BLOCK_C": 128,
      "NUM_KSPLIT": 4,
      "num_warps": 2,
      "num_stages": 2,
      "waves_per_eu": 2
    },
    "5632": {
      "BLOCK_M": 256,
      "BLOCK_N": 16,
      "BLOCK_K": 256,
      "BLOCK_C": 128,
      "NUM_KSPLIT": 1,
      "num_warps": 8,
      "num_stages": 2,
      "waves_per_eu": 1
    },
    "1008": {
      "BLOCK_M": 32,
      "BLOCK_N": 16,
      "BLOCK_K": 128,
      "BLOCK_C": 256,
      "NUM_KSPLIT": 1,
      "num_warps": 2,
      "num_stages": 1,
      "waves_per_eu": 0
    },
    "3916": {
      "BLOCK_M": 128,
      "BLOCK_N": 16,
      "BLOCK_K": 128,
      "BLOCK_C": 256,
      "NUM_KSPLIT": 2,
      "num_warps": 4,
      "num_stages": 2,
      "waves_per_eu": 1
    },
    "1900": {
      "BLOCK_M": 64,
      "BLOCK_N": 16,
      "BLOCK_K": 64,
      "BLOCK_C": 32,
      "NUM_KSPLIT": 2,
      "num_warps": 4,
      "num_stages": 2,
      "waves_per_eu": 1
    },
    "1853": {
      "BLOCK_M": 64,
      "BLOCK_N": 16,
      "BLOCK_K": 64,
      "BLOCK_C": 16,
      "NUM_KSPLIT": 4,
      "num_warps": 8,
      "num_stages": 2,
      "waves_per_eu": 2
    },
    "2347": {
      "BLOCK_M": 64,
      "BLOCK_N": 16,
      "BLOCK_K": 128,
      "BLOCK_C": 64,
      "NUM_KSPLIT": 4,
      "num_warps": 4,
      "num_stages": 1,
      "waves_per_eu": 1
    },
    "3316": {
      "BLOCK_M": 128,
      "BLOCK_N": 16,
      "BLOCK_K": 64,
      "BLOCK_C": 32,
      "NUM_KSPLIT": 1,
      "num_warps": 2,
      "num_stages": 2,
      "waves_per_eu": 1
    },
    "4304": {
      "BLOCK_M": 128,
      "BLOCK_N": 16,
      "BLOCK_K": 256,
      "BLOCK_C": 256,
      "NUM_KSPLIT": 8,
      "num_warps": 2,
      "num_stages": 1,
      "waves_per_eu": 2
    },
    "4153": {
      "BLOCK_M": 128,
      "BLOCK_N": 16,
      "BLOCK_K": 256,
      "BLOCK_C": 64,
      "NUM_KSPLIT": 4,
      "num_warps": 8,
      "num_stages": 1,
      "waves_per_eu": 1
    },
    "3385": {
      "BLOCK_M": 128,
      "BLOCK_N": 16,
      "BLOCK_K": 64,
      "BLOCK_C": 64,
      "NUM_KSPLIT": 1,
      "num_warps": 2,
      "num_stages": 1,
      "waves_per_eu": 1
    },
    "3877": {
      "BLOCK_M": 128,
      "BLOCK_N": 16,
      "BLOCK_K": 128,
      "BLOCK_C": 128,
      "NUM_KSPLIT": 8,
      "num_warps": 4,
      "num_stages": 1,
      "waves_per_eu": 1
    },
    "3992": {
      "BLOCK_M": 128,
      "BLOCK_N": 16,
      "BLOCK_K": 256,
      "BLOCK_C": 16,
      "NUM_KSPLIT": 2,
      "num_warps": 8,
      "num_stages": 1,
      "waves_per_eu": 2
    },
    "1502": {
      "BLOCK_M": 64,
      "BLOCK_N": 16,
      "BLOCK_K": 32,
      "BLOCK_C": 16,
      "NUM_KSPLIT": 8,
      "num_warps": 4,
      "num_stages": 1,
      "waves_per_eu": 2
    },
    "4463": {
      "BLOCK_M": 256,
      "BLOCK_N": 16,
      "BLOCK_K": 32,
      "BLOCK_C": 32,
      "NUM_KSPLIT": 8,
      "num_warps": 8,
      "num_stages": 2,
      "waves_per_eu": 2
    },
    "2648": {
      "BLOCK_M": 64,
      "BLOCK_N": 16,
      "BLOCK_K": 256,
      "BLOCK_C": 32,
      "NUM_KSPLIT": 8,
      "num_warps": 2,
      "num_stages": 1,
      "waves_per_eu": 2
    },
    "3507": {
      "BLOCK_M": 128,
      "BLOCK_N": 16,
      "BLOCK_K": 64,
      "BLOCK_C": 128,
      "NUM_KSPLIT": 4,
      "num_warps": 8,
      "num_stages": 2,
      "waves_per_eu": 0
    },
    "2464": {
      "BLOCK_M": 64,
      "BLOCK_N": 16,
      "BLOCK_K": 128,
      "BLOCK_C": 256,
      "NUM_KSPLIT": 1,
      "num_warps": 8,
      "num_stages": 2,
      "waves_per_eu": 1
    },
    "1536": {
      "BLOCK_M": 64,
      "BLOCK_N": 16,
      "BLOCK_K": 32,
      "BLOCK_C": 32,
      "NUM_KSPLIT": 2,
      "num_warps": 4,
      "num_stages": 1,
      "waves_per_eu": 0
    },
    "2774": {
      "BLOCK_M": 64,
      "BLOCK_N": 16,
      "BLOCK_K": 256,
      "BLOCK_C": 128,
      "NUM_KSPLIT": 4,
      "num_warps": 2,
      "num_stages": 1,
      "waves_per_eu": 2
    },
    "61": {
      "BLOCK_M": 32,
      "BLOCK_N": 16,
      "BLOCK_K": 32,
      "BLOCK_C": 16,
      "NUM_KSPLIT": 8,
      "num_warps": 4,
      "num_stages": 1,
      "waves_per_eu": 1
    },
    "699": {
      "BLOCK_M": 32,
      "BLOCK_N": 16,
      "BLOCK_K": 64,
      "BLOCK_C": 256,
      "NUM_KSPLIT": 4,
      "num_warps": 8,
      "num_stages": 2,
      "waves_per_eu": 0
    },
    "5217": {
      "BLOCK_M": 256,
      "BLOCK_N": 16,
      "BLOCK_K": 128,
      "BLOCK_C": 64,
      "NUM_KSPLIT": 2,
      "num_warps": 8,
      "num_stages": 2,
      "waves_per_eu": 0
    },
    "2634": {
      "BLOCK_M": 64,
      "BLOCK_N": 16,
      "BLOCK_K": 256,
      "BLOCK_C": 32,
      "NUM_KSPLIT": 4,
      "num_warps": 4,
      "num_stages": 1,
      "waves_per_eu": 0
    },
    "5161": {
      "BLOCK_M": 256,
      "BLOCK_N": 16,
      "BLOCK_K": 128,
      "BLOCK_C": 32,
      "NUM_KSPLIT": 4,
      "num_warps": 8,
      "num_stages": 1,
      "waves_per_eu": 1
    },
    "1000": {
      "BLOCK_M": 32,
      "BLOCK_N": 16,
      "BLOCK_K": 128,
      "BLOCK_C": 128,
      "NUM_KSPLIT": 8,
      "num_warps": 4,
      "num_stages": 2,
      "waves_per_eu": 1
    },
    "4221": {
      "BLOCK_M": 128,
      "BLOCK_N": 16,
      "BLOCK_K": 256,
      "BLOCK_C": 128,
      "NUM_KSPLIT": 4,
      "num_warps": 4,
      "num_stages": 2,
      "waves_per_eu": 0
    },
    "216": {
      "BLOCK_M": 32,
      "BLOCK_N": 16,
      "BLOCK_K": 32,
      "BLOCK_C": 128,
      "NUM_KSPLIT": 1,
      "num_warps": 2,
      "num_stages": 1,
      "waves_per_eu": 0
    },
    "5583": {
      "BLOCK_M": 256,
      "BLOCK_N": 16,
      "BLOCK_K": 256,
      "BLOCK_C": 64,
      "NUM_KSPLIT": 4,
      "num_warps": 2,
      "num_stages": 2,
      "waves_per_eu": 0
    },
    "2135": {
      "BLOCK_M": 64,
      "BLOCK_N": 16,
      "BLOCK_K": 64,
      "BLOCK_C": 256,
      "NUM_KSPLIT": 4,
      "num_warps": 4,
      "num_stages": 2,
      "waves_per_eu": 2
    },
    "5144": {
      "BLOCK_M": 256,
      "BLOCK_N": 16,
      "BLOCK_K": 128,
      "BLOCK_C": 32,
      "NUM_KSPLIT": 2,
      "num_warps": 8,
      "num_stages": 1,
      "waves_per_eu": 2
    },
    "2868": {
      "BLOCK_M": 64,
      "BLOCK_N": 16,
      "BLOCK_K": 256,
      "BLOCK_C": 256,
      "NUM_KSPLIT": 8,
      "num_warps": 4,
      "num_stages": 1,
      "waves_per_eu": 0
    },
    "5472": {
      "BLOCK_M": 256,
      "BLOCK_N": 16,
      "BLOCK_K": 256,
      "BLOCK_C": 32,
      "NUM_KSPLIT": 1,
      "num_warps": 2,
      "num_stages": 1,
      "waves_per_eu": 0
    },
    "1045": {
      "BLOCK_M": 32,
      "BLOCK_N": 16,
      "BLOCK_K": 128,
      "BLOCK_C": 256,
      "NUM_KSPLIT": 4,
      "num_warps": 2,
      "num_stages": 1,
      "waves_per_eu": 1
    },
    "4797": {
      "BLOCK_M": 256,
      "BLOCK_N": 16,
      "BLOCK_K": 64,
      "BLOCK_C": 32,
      "NUM_KSPLIT": 4,
      "num_warps": 4,
      "num_stages": 2,
      "waves_per_eu": 0
    },
    "636": {
      "BLOCK_M": 32,
      "BLOCK_N": 16,
      "BLOCK_K": 64,
      "BLOCK_C": 128,
      "NUM_KSPLIT": 8,
      "num_warps": 4,
      "num_stages": 1,
      "waves_per_eu": 0
    },
    "4829": {
      "BLOCK_M": 256,
      "BLOCK_N": 16,
      "BLOCK_K": 64,
      "BLOCK_C": 64,
      "NUM_KSPLIT": 1,
      "num_warps": 2,
      "num_stages": 2,
      "waves_per_eu": 2
    },
    "4534": {
      "BLOCK_M": 256,
      "BLOCK_N": 16,
      "BLOCK_K": 32,
      "BLOCK_C": 64,
      "NUM_KSPLIT": 8,
      "num_warps": 8,
      "num_stages": 2,
      "waves_per_eu": 1
    },
    "5579": {
      "BLOCK_M": 256,
      "BLOCK_N": 16,
      "BLOCK_K": 256,
      "BLOCK_C": 64,
      "NUM_KSPLIT": 2,
      "num_warps": 8,
      "num_stages": 2,
      "waves_per_eu": 2
    },
    "3597": {
      "BLOCK_M": 128,
      "BLOCK_N": 16,
      "BLOCK_K": 64,
      "BLOCK_C": 256,
      "NUM_KSPLIT": 8,
      "num_warps": 8,
      "num_stages": 2,
      "waves_per_eu": 0
    },
    "582": {
      "BLOCK_M": 32,
      "BLOCK_N": 16,
      "BLOCK_K": 64,
      "BLOCK_C": 128,
      "NUM_KSPLIT": 1,
      "num_warps": 4,
      "num_stages": 1,
      "waves_per_eu": 0
    },
    "1003": {
      "BLOCK_M": 32,
      "BLOCK_N": 16,
      "BLOCK_K": 128,
      "BLOCK_C": 128,
      "NUM_KSPLIT": 8,
      "num_warps": 8,
      "num_stages": 1,
      "waves_per_eu": 1
    },
    "4688": {
      "BLOCK_M": 256,
      "BLOCK_N": 16,
      "BLOCK_K": 64,
      "BLOCK_C": 16,
      "NUM_KSPLIT": 1,
      "num_warps": 4,
      "num_stages": 1,
      "waves_per_eu": 2
    },
    "1825": {
      "BLOCK_M": 64,
      "BLOCK_N": 16,
      "BLOCK_K": 64,
      "BLOCK_C": 16,
      "NUM_KSPLIT": 2,
      "num_warps": 4,
      "num_stages": 1,
      "waves_per_eu": 1
    },
    "111": {
      "BLOCK_M": 32,
      "BLOCK_N": 16,
      "BLOCK_K": 32,
      "BLOCK_C": 32,
      "NUM_KSPLIT": 4,
      "num_warps": 2,
      "num_stages": 2,
      "waves_per_eu": 0
    },
    "1887": {
      "BLOCK_M": 64,
      "BLOCK_N": 16,
      "BLOCK_K": 64,
      "BLOCK_C": 32,
      "NUM_KSPLIT": 1,
      "num_warps": 8,
      "num_stages": 2,
      "waves_per_eu": 0
    },
    "1027": {
      "BLOCK_M": 32,
      "BLOCK_N": 16,
      "BLOCK_K": 128,
      "BLOCK_C": 256,
      "NUM_KSPLIT": 2,
      "num_warps": 2,
      "num_stages": 1,
      "waves_per_eu": 1
    },
    "4594": {
      "BLOCK_M": 256,
      "BLOCK_N": 16,
      "BLOCK_K": 32,
      "BLOCK_C": 128,
      "NUM_KSPLIT": 8,
      "num_warps": 2,
      "num_stages": 2,
      "waves_per_eu": 1
    },
    "13": {
      "BLOCK_M": 32,
      "BLOCK_N": 16,
      "BLOCK_K": 32,
      "BLOCK_C": 16,
      "NUM_KSPLIT": 1,
      "num_warps": 8,
      "num_stages": 1,
      "waves_per_eu": 1
    },
    "796": {
      "BLOCK_M": 32,
      "BLOCK_N": 16,
      "BLOCK_K": 128,
      "BLOCK_C": 32,
      "NUM_KSPLIT": 1,
      "num_warps": 2,
      "num_stages": 2,
      "waves_per_eu": 1
    },
    "2824": {
      "BLOCK_M": 64,
      "BLOCK_N": 16,
      "BLOCK_K": 256,
      "BLOCK_C": 256,
      "NUM_KSPLIT": 1,
      "num_warps": 8,
      "num_stages": 2,
      "waves_per_eu": 1
    },
    "1983": {
      "BLOCK_M": 64,
      "BLOCK_N": 16,
      "BLOCK_K": 64,
      "BLOCK_C": 64,
      "NUM_KSPLIT": 4,
      "num_warps": 2,
      "num_stages": 2,
      "waves_per_eu": 0
    },
    "1004": {
      "BLOCK_M": 32,
      "BLOCK_N": 16,
      "BLOCK_K": 128,
      "BLOCK_C": 128,
      "NUM_KSPLIT": 8,
      "num_warps": 8,
      "num_stages": 1,
      "waves_per_eu": 2
    },
    "3927": {
      "BLOCK_M": 128,
      "BLOCK_N": 16,
      "BLOCK_K": 128,
      "BLOCK_C": 256,
      "NUM_KSPLIT": 4,
      "num_warps": 2,
      "num_stages": 2,
      "waves_per_eu": 0
    },
    "2953": {
      "BLOCK_M": 128,
      "BLOCK_N": 16,
      "BLOCK_K": 32,
      "BLOCK_C": 32,
      "NUM_KSPLIT": 1,
      "num_warps": 2,
      "num_stages": 1,
      "waves_per_eu": 1
    },
    "890": {
      "BLOCK_M": 32,
      "BLOCK_N": 16,
      "BLOCK_K": 128,
      "BLOCK_C": 64,
      "NUM_KSPLIT": 2,
      "num_warps": 4,
      "num_stages": 1,
      "waves_per_eu": 2
    },
    "3890": {
      "BLOCK_M": 128,
      "BLOCK_N": 16,
      "BLOCK_K": 128,
      "BLOCK_C": 256,
      "NUM_KSPLIT": 1,
      "num_warps": 2,
      "num_stages": 1,
      "waves_per_eu": 2
    },
    "5569": {
      "BLOCK_M": 256,
      "BLOCK_N": 16,
      "BLOCK_K": 256,
      "BLOCK_C": 64,
      "NUM_KSPLIT": 2,
      "num_warps": 4,
      "num_stages": 1,
      "waves_per_eu": 1
    },
    "1923": {
      "BLOCK_M": 64,
      "BLOCK_N": 16,
      "BLOCK_K": 64,
      "BLOCK_C": 32,
      "NUM_KSPLIT": 4,
      "num_warps": 8,
      "num_stages": 2,
      "waves_per_eu": 0
    },
    "3592": {
      "BLOCK_M": 128,
      "BLOCK_N": 16,
      "BLOCK_K": 64,
      "BLOCK_C": 256,
      "NUM_KSPLIT": 8,
      "num_warps": 4,
      "num_stages": 2,
      "waves_per_eu": 1
    },
    "5565": {
      "BLOCK_M": 256,
      "BLOCK_N": 16,
      "BLOCK_K": 256,
      "BLOCK_C": 64,
      "NUM_KSPLIT": 2,
      "num_warps": 2,
      "num_stages": 2,
      "waves_per_eu": 0
    },
    "4685": {
      "BLOCK_M": 256,
      "BLOCK_N": 16,
      "BLOCK_K": 64,
      "BLOCK_C": 16,
      "NUM_KSPLIT": 1,
      "num_warps": 2,
      "num_stages": 2,
      "waves_per_eu": 2
    },
    "384": {
      "BLOCK_M": 32,
      "BLOCK_N": 16,
      "BLOCK_K": 64,
      "BLOCK_C": 16,
      "NUM_KSPLIT": 2,
      "num_warps": 4,
      "num_stages": 1,
      "waves_per_eu": 0
    },
    "1078": {
      "BLOCK_M": 32,
      "BLOCK_N": 16,
      "BLOCK_K": 128,
      "BLOCK_C": 256,
      "NUM_KSPLIT": 8,
      "num_warps": 8,
      "num_stages": 2,
      "waves_per_eu": 1
    },
    "133": {
      "BLOCK_M": 32,
      "BLOCK_N": 16,
      "BLOCK_K": 32,
      "BLOCK_C": 32,
      "NUM_KSPLIT": 8,
      "num_warps": 4,
      "num_stages": 1,
      "waves_per_eu": 1
    },
    "2510": {
      "BLOCK_M": 64,
      "BLOCK_N": 16,
      "BLOCK_K": 128,
      "BLOCK_C": 256,
      "NUM_KSPLIT": 8,
      "num_warps": 4,
      "num_stages": 1,
      "waves_per_eu": 2
    },
    "537": {
      "BLOCK_M": 32,
      "BLOCK_N": 16,
      "BLOCK_K": 64,
      "BLOCK_C": 64,
      "NUM_KSPLIT": 2,
      "num_warps": 8,
      "num_stages": 2,
      "waves_per_eu": 0
    },
    "1156": {
      "BLOCK_M": 32,
      "BLOCK_N": 16,
      "BLOCK_K": 256,
      "BLOCK_C": 32,
      "NUM_KSPLIT": 1,
      "num_warps": 2,
      "num_stages": 2,
      "waves_per_eu": 1
    },
    "4657": {
      "BLOCK_M": 256,
      "BLOCK_N": 16,
      "BLOCK_K": 32,
      "BLOCK_C": 256,
      "NUM_KSPLIT": 4,
      "num_warps": 8,
      "num_stages": 1,
      "waves_per_eu": 1
    },
    "1713": {
      "BLOCK_M": 64,
      "BLOCK_N": 16,
      "BLOCK_K": 32,
      "BLOCK_C": 128,
      "NUM_KSPLIT": 8,
      "num_warps": 2,
      "num_stages": 2,
      "waves_per_eu": 0
    },
    "5677": {
      "BLOCK_M": 256,
      "BLOCK_N": 16,
      "BLOCK_K": 256,
      "BLOCK_C": 128,
      "NUM_KSPLIT": 8,
      "num_warps": 4,
      "num_stages": 1,
      "waves_per_eu": 1
    },
    "5177": {
      "BLOCK_M": 256,
      "BLOCK_N": 16,
      "BLOCK_K": 128,
      "BLOCK_C": 32,
      "NUM_KSPLIT": 8,
      "num_warps": 4,
      "num_stages": 2,
      "waves_per_eu": 2
    },
    "2739": {
      "BLOCK_M": 64,
      "BLOCK_N": 16,
      "BLOCK_K": 256,
      "BLOCK_C": 128,
      "NUM_KSPLIT": 1,
      "num_warps": 2,
      "num_stages": 2,
      "waves_per_eu": 0
    },
    "5008": {
      "BLOCK_M": 256,
      "BLOCK_N": 16,
      "BLOCK_K": 64,
      "BLOCK_C": 256,
      "NUM_KSPLIT": 4,
      "num_warps": 2,
      "num_stages": 2,
      "waves_per_eu": 1
    },
    "761": {
      "BLOCK_M": 32,
      "BLOCK_N": 16,
      "BLOCK_K": 128,
      "BLOCK_C": 16,
      "NUM_KSPLIT": 4,
      "num_warps": 2,
      "num_stages": 2,
      "waves_per_eu": 2
    },
    "1207": {
      "BLOCK_M": 32,
      "BLOCK_N": 16,
      "BLOCK_K": 256,
      "BLOCK_C": 32,
      "NUM_KSPLIT": 8,
      "num_warps": 2,
      "num_stages": 1,
      "waves_per_eu": 1
    },
    "982": {
      "BLOCK_M": 32,
      "BLOCK_N": 16,
      "BLOCK_K": 128,
      "BLOCK_C": 128,
      "NUM_KSPLIT": 4,
      "num_warps": 4,
      "num_stages": 2,
      "waves_per_eu": 1
    },
    "344": {
      "BLOCK_M": 32,
      "BLOCK_N": 16,
      "BLOCK_K": 32,
      "BLOCK_C": 256,
      "NUM_KSPLIT": 8,
      "num_warps": 2,
      "num_stages": 1,
      "waves_per_eu": 2
    },
    "1894": {
      "BLOCK_M": 64,
      "BLOCK_N": 16,
      "BLOCK_K": 64,
      "BLOCK_C": 32,
      "NUM_KSPLIT": 2,
      "num_warps": 2,
      "num_stages": 2,
      "waves_per_eu": 1
    },
    "4583": {
      "BLOCK_M": 256,
      "BLOCK_N": 16,
      "BLOCK_K": 32,
      "BLOCK_C": 128,
      "NUM_KSPLIT": 4,
      "num_warps": 4,
      "num_stages": 2,
      "waves_per_eu": 2
    },
    "5503": {
      "BLOCK_M": 256,
      "BLOCK_N": 16,
      "BLOCK_K": 256,
      "BLOCK_C": 32,
      "NUM_KSPLIT": 2,
      "num_warps": 8,
      "num_stages": 1,
      "waves_per_eu": 1
    },
    "3853": {
      "BLOCK_M": 128,
      "BLOCK_N": 16,
      "BLOCK_K": 128,
      "BLOCK_C": 128,
      "NUM_KSPLIT": 4,
      "num_warps": 2,
      "num_stages": 1,
      "waves_per_eu": 1
    },
    "3379": {
      "BLOCK_M": 128,
      "BLOCK_N": 16,
      "BLOCK_K": 64,
      "BLOCK_C": 32,
      "NUM_KSPLIT": 8,
      "num_warps": 8,
      "num_stages": 1,
      "waves_per_eu": 1
    },
    "222": {
      "BLOCK_M": 32,
      "BLOCK_N": 16,
      "BLOCK_K": 32,
      "BLOCK_C": 128,
      "NUM_KSPLIT": 1,
      "num_warps": 4,
      "num_stages": 1,
      "waves_per_eu": 0
    },
    "4590": {
      "BLOCK_M": 256,
      "BLOCK_N": 16,
      "BLOCK_K": 32,
      "BLOCK_C": 128,
      "NUM_KSPLIT": 8,
      "num_warps": 2,
      "num_stages": 1,
      "waves_per_eu": 0
    },
    "532": {
      "BLOCK_M": 32,
      "BLOCK_N": 16,
      "BLOCK_K": 64,
      "BLOCK_C": 64,
      "NUM_KSPLIT": 2,
      "num_warps": 4,
      "num_stages": 2,
      "waves_per_eu": 1
    },
    "5601": {
      "BLOCK_M": 256,
      "BLOCK_N": 16,
      "BLOCK_K": 256,
      "BLOCK_C": 64,
      "NUM_KSPLIT": 8,
      "num_warps": 2,
      "num_stages": 2,
      "waves_per_eu": 0
    },
    "4614": {
      "BLOCK_M": 256,
      "BLOCK_N": 16,
      "BLOCK_K": 32,
      "BLOCK_C": 256,
      "NUM_KSPLIT": 1,
      "num_warps": 4,
      "num_stages": 1,
      "waves_per_eu": 0
    },
    "1256": {
      "BLOCK_M": 32,
      "BLOCK_N": 16,
      "BLOCK_K": 256,
      "BLOCK_C": 64,
      "NUM_KSPLIT": 2,
      "num_warps": 8,
      "num_stages": 1,
      "waves_per_eu": 2
    },
    "1491": {
      "BLOCK_M": 64,
      "BLOCK_N": 16,
      "BLOCK_K": 32,
      "BLOCK_C": 16,
      "NUM_KSPLIT": 4,
      "num_warps": 8,
      "num_stages": 2,
      "waves_per_eu": 0
    },
    "2609": {
      "BLOCK_M": 64,
      "BLOCK_N": 16,
      "BLOCK_K": 256,
      "BLOCK_C": 32,
      "NUM_KSPLIT": 1,
      "num_warps": 8,
      "num_stages": 2,
      "waves_per_eu": 2
    },
    "4491": {
      "BLOCK_M": 256,
      "BLOCK_N": 16,
      "BLOCK_K": 32,
      "BLOCK_C": 64,
      "NUM_KSPLIT": 2,
      "num_warps": 4,
      "num_stages": 2,
      "waves_per_eu": 0
    },
    "1394": {
      "BLOCK_M": 32,
      "BLOCK_N": 16,
      "BLOCK_K": 256,
      "BLOCK_C": 256,
      "NUM_KSPLIT": 2,
      "num_warps": 4,
      "num_stages": 1,
      "waves_per_eu": 2
    },
    "4880": {
      "BLOCK_M": 256,
      "BLOCK_N": 16,
      "BLOCK_K": 64,
      "BLOCK_C": 64,
      "NUM_KSPLIT": 8,
      "num_warps": 2,
      "num_stages": 1,
      "waves_per_eu": 2
    },
    "1662": {
      "BLOCK_M": 64,
      "BLOCK_N": 16,
      "BLOCK_K": 32,
      "BLOCK_C": 128,
      "NUM_KSPLIT": 1,
      "num_warps": 4,
      "num_stages": 1,
      "waves_per_eu": 0
    },
    "4052": {
      "BLOCK_M": 128,
      "BLOCK_N": 16,
      "BLOCK_K": 256,
      "BLOCK_C": 32,
      "NUM_KSPLIT": 2,
      "num_warps": 2,
      "num_stages": 1,
      "waves_per_eu": 2
    },
    "3863": {
      "BLOCK_M": 128,
      "BLOCK_N": 16,
      "BLOCK_K": 128,
      "BLOCK_C": 128,
      "NUM_KSPLIT": 4,
      "num_warps": 4,
      "num_stages": 2,
      "waves_per_eu": 2
    },
    "4624": {
      "BLOCK_M": 256,
      "BLOCK_N": 16,
      "BLOCK_K": 32,
      "BLOCK_C": 256,
      "NUM_KSPLIT": 1,
      "num_warps": 8,
      "num_stages": 2,
      "waves_per_eu": 1
    },
    "1420": {
      "BLOCK_M": 32,
      "BLOCK_N": 16,
      "BLOCK_K": 256,
      "BLOCK_C": 256,
      "NUM_KSPLIT": 4,
      "num_warps": 8,
      "num_stages": 2,
      "waves_per_eu": 1
    },
    "4451": {
      "BLOCK_M": 256,
      "BLOCK_N": 16,
      "BLOCK_K": 32,
      "BLOCK_C": 32,
      "NUM_KSPLIT": 8,
      "num_warps": 2,
      "num_stages": 2,
      "waves_per_eu": 2
    },
    "846": {
      "BLOCK_M": 32,
      "BLOCK_N": 16,
      "BLOCK_K": 128,
      "BLOCK_C": 32,
      "NUM_KSPLIT": 8,
      "num_warps": 2,
      "num_stages": 1,
      "waves_per_eu": 0
    },
    "4523": {
      "BLOCK_M": 256,
      "BLOCK_N": 16,
      "BLOCK_K": 32,
      "BLOCK_C": 64,
      "NUM_KSPLIT": 8,
      "num_warps": 2,
      "num_stages": 2,
      "waves_per_eu": 2
    },
    "5433": {
      "BLOCK_M": 256,
      "BLOCK_N": 16,
      "BLOCK_K": 256,
      "BLOCK_C": 16,
      "NUM_KSPLIT": 2,
      "num_warps": 8,
      "num_stages": 2,
      "waves_per_eu": 0
    },
    "4359": {
      "BLOCK_M": 256,
      "BLOCK_N": 16,
      "BLOCK_K": 32,
      "BLOCK_C": 16,
      "NUM_KSPLIT": 4,
      "num_warps": 2,
      "num_stages": 2,
      "waves_per_eu": 0
    },
    "5206": {
      "BLOCK_M": 256,
      "BLOCK_N": 16,
      "BLOCK_K": 128,
      "BLOCK_C": 64,
      "NUM_KSPLIT": 2,
      "num_warps": 2,
      "num_stages": 2,
      "waves_per_eu": 1
    },
    "712": {
      "BLOCK_M": 32,
      "BLOCK_N": 16,
      "BLOCK_K": 64,
      "BLOCK_C": 256,
      "NUM_KSPLIT": 8,
      "num_warps": 4,
      "num_stages": 2,
      "waves_per_eu": 1
    },
    "941": {
      "BLOCK_M": 32,
      "BLOCK_N": 16,
      "BLOCK_K": 128,
      "BLOCK_C": 128,
      "NUM_KSPLIT": 1,
      "num_warps": 2,
      "num_stages": 2,
      "waves_per_eu": 2
    },
    "5424": {
      "BLOCK_M": 256,
      "BLOCK_N": 16,
      "BLOCK_K": 256,
      "BLOCK_C": 16,
      "NUM_KSPLIT": 2,
      "num_warps": 4,
      "num_stages": 1,
      "waves_per_eu": 0
    },
    "1559": {
      "BLOCK_M": 64,
      "BLOCK_N": 16,
      "BLOCK_K": 32,
      "BLOCK_C": 32,
      "NUM_KSPLIT": 4,
      "num_warps": 4,
      "num_stages": 2,
      "waves_per_eu": 2
    },
    "3145": {
      "BLOCK_M": 128,
      "BLOCK_N": 16,
      "BLOCK_K": 32,
      "BLOCK_C": 128,
      "NUM_KSPLIT": 4,
      "num_warps": 8,
      "num_stages": 1,
      "waves_per_eu": 1
    },
    "3806": {
      "BLOCK_M": 128,
      "BLOCK_N": 16,
      "BLOCK_K": 128,
      "BLOCK_C": 64,
      "NUM_KSPLIT": 8,
      "num_warps": 4,
      "num_stages": 1,
      "waves_per_eu": 2
    },
    "1369": {
      "BLOCK_M": 32,
      "BLOCK_N": 16,
      "BLOCK_K": 256,
      "BLOCK_C": 256,
      "NUM_KSPLIT": 1,
      "num_warps": 2,
      "num_stages": 1,
      "waves_per_eu": 1
    },
    "11": {
      "BLOCK_M": 32,
      "BLOCK_N": 16,
      "BLOCK_K": 32,
      "BLOCK_C": 16,
      "NUM_KSPLIT": 1,
      "num_warps": 4,
      "num_stages": 2,
      "waves_per_eu": 2
    },
    "3390": {
      "BLOCK_M": 128,
      "BLOCK_N": 16,
      "BLOCK_K": 64,
      "BLOCK_C": 64,
      "NUM_KSPLIT": 1,
      "num_warps": 4,
      "num_stages": 1,
      "waves_per_eu": 0
    },
    "1332": {
      "BLOCK_M": 32,
      "BLOCK_N": 16,
      "BLOCK_K": 256,
      "BLOCK_C": 128,
      "NUM_KSPLIT": 4,
      "num_warps": 2,
      "num_stages": 1,
      "waves_per_eu": 0
    },
    "4921": {
      "BLOCK_M": 256,
      "BLOCK_N": 16,
      "BLOCK_K": 64,
      "BLOCK_C": 128,
      "NUM_KSPLIT": 2,
      "num_warps": 4,
      "num_stages": 1,
      "waves_per_eu": 1
    },
    "4729": {
      "BLOCK_M": 256,
      "BLOCK_N": 16,
      "BLOCK_K": 64,
      "BLOCK_C": 16,
      "NUM_KSPLIT": 4,
      "num_warps": 8,
      "num_stages": 1,
      "waves_per_eu": 1
    },
    "391": {
      "BLOCK_M": 32,
      "BLOCK_N": 16,
      "BLOCK_K": 64,
      "BLOCK_C": 16,
      "NUM_KSPLIT": 2,
      "num_warps": 8,
      "num_stages": 1,
      "waves_per_eu": 1
    },
    "4665": {
      "BLOCK_M": 256,
      "BLOCK_N": 16,
      "BLOCK_K": 32,
      "BLOCK_C": 256,
      "NUM_KSPLIT": 8,
      "num_warps": 2,
      "num_stages": 2,
      "waves_per_eu": 0
    },
    "1396": {
      "BLOCK_M": 32,
      "BLOCK_N": 16,
      "BLOCK_K": 256,
      "BLOCK_C": 256,
      "NUM_KSPLIT": 2,
      "num_warps": 4,
      "num_stages": 2,
      "waves_per_eu": 1
    },
    "5225": {
      "BLOCK_M": 256,
      "BLOCK_N": 16,
      "BLOCK_K": 128,
      "BLOCK_C": 64,
      "NUM_KSPLIT": 4,
      "num_warps": 2,
      "num_stages": 2,
      "waves_per_eu": 2
    },
    "3498": {
      "BLOCK_M": 128,
      "BLOCK_N": 16,
      "BLOCK_K": 64,
      "BLOCK_C": 128,
      "NUM_KSPLIT": 4,
      "num_warps": 4,
      "num_stages": 1,
      "waves_per_eu": 0
    },
    "1570": {
      "BLOCK_M": 64,
      "BLOCK_N": 16,
      "BLOCK_K": 32,
      "BLOCK_C": 32,
      "NUM_KSPLIT": 8,
      "num_warps": 2,
      "num_stages": 2,
      "waves_per_eu": 1
    },
    "5468": {
      "BLOCK_M": 256,
      "BLOCK_N": 16,
      "BLOCK_K": 256,
      "BLOCK_C": 16,
      "NUM_KSPLIT": 8,
      "num_warps": 8,
      "num_stages": 1,
      "waves_per_eu": 2
    },
    "3774": {
      "BLOCK_M": 128,
      "BLOCK_N": 16,
      "BLOCK_K": 128,
      "BLOCK_C": 64,
      "NUM_KSPLIT": 2,
      "num_warps": 8,
      "num_stages": 1,
      "waves_per_eu": 0
    },
    "1874": {
      "BLOCK_M": 64,
      "BLOCK_N": 16,
      "BLOCK_K": 64,
      "BLOCK_C": 32,
      "NUM_KSPLIT": 1,
      "num_warps": 2,
      "num_stages": 1,
      "waves_per_eu": 2
    },
    "1734": {
      "BLOCK_M": 64,
      "BLOCK_N": 16,
      "BLOCK_K": 32,
      "BLOCK_C": 256,
      "NUM_KSPLIT": 1,
      "num_warps": 4,
      "num_stages": 1,
      "waves_per_eu": 0
    },
    "4985": {
      "BLOCK_M": 256,
      "BLOCK_N": 16,
      "BLOCK_K": 64,
      "BLOCK_C": 256,
      "NUM_KSPLIT": 1,
      "num_warps": 8,
      "num_stages": 2,
      "waves_per_eu": 2
    },
    "616": {
      "BLOCK_M": 32,
      "BLOCK_N": 16,
      "BLOCK_K": 64,
      "BLOCK_C": 128,
      "NUM_KSPLIT": 4,
      "num_warps": 2,
      "num_stages": 2,
      "waves_per_eu": 1
    },
    "1580": {
      "BLOCK_M": 64,
      "BLOCK_N": 16,
      "BLOCK_K": 32,
      "BLOCK_C": 32,
      "NUM_KSPLIT": 8,
      "num_warps": 8,
      "num_stages": 1,
      "waves_per_eu": 2
    },
    "1273": {
      "BLOCK_M": 32,
      "BLOCK_N": 16,
      "BLOCK_K": 256,
      "BLOCK_C": 64,
      "NUM_KSPLIT": 4,
      "num_warps": 8,
      "num_stages": 1,
      "waves_per_eu": 1
    },
    "5704": {
      "BLOCK_M": 256,
      "BLOCK_N": 16,
      "BLOCK_K": 256,
      "BLOCK_C": 256,
      "NUM_KSPLIT": 1,
      "num_warps": 8,
      "num_stages": 2,
      "waves_per_eu": 1
    },
    "3488": {
      "BLOCK_M": 128,
      "BLOCK_N": 16,
      "BLOCK_K": 64,
      "BLOCK_C": 128,
      "NUM_KSPLIT": 2,
      "num_warps": 8,
      "num_stages": 1,
      "waves_per_eu": 2
    },
    "4531": {
      "BLOCK_M": 256,
      "BLOCK_N": 16,
      "BLOCK_K": 32,
      "BLOCK_C": 64,
      "NUM_KSPLIT": 8,
      "num_warps": 8,
      "num_stages": 1,
      "waves_per_eu": 1
    },
    "5755": {
      "BLOCK_M": 256,
      "BLOCK_N": 16,
      "BLOCK_K": 256,
      "BLOCK_C": 256,
      "NUM_KSPLIT": 8,
      "num_warps": 8,
      "num_stages": 1,
      "waves_per_eu": 1
    },
    "938": {
      "BLOCK_M": 32,
      "BLOCK_N": 16,
      "BLOCK_K": 128,
      "BLOCK_C": 128,
      "NUM_KSPLIT": 1,
      "num_warps": 2,
      "num_stages": 1,
      "waves_per_eu": 2
    },
    "5716": {
      "BLOCK_M": 256,
      "BLOCK_N": 16,
      "BLOCK_K": 256,
      "BLOCK_C": 256,
      "NUM_KSPLIT": 2,
      "num_warps": 4,
      "num_stages": 2,
      "waves_per_eu": 1
    },
    "4171": {
      "BLOCK_M": 128,
      "BLOCK_N": 16,
      "BLOCK_K": 256,
      "BLOCK_C": 64,
      "NUM_KSPLIT": 8,
      "num_warps": 8,
      "num_stages": 1,
      "waves_per_eu": 1
    },
    "1280": {
      "BLOCK_M": 32,
      "BLOCK_N": 16,
      "BLOCK_K": 256,
      "BLOCK_C": 64,
      "NUM_KSPLIT": 8,
      "num_warps": 2,
      "num_stages": 1,
      "waves_per_eu": 2
    },
    "4543": {
      "BLOCK_M": 256,
      "BLOCK_N": 16,
      "BLOCK_K": 32,
      "BLOCK_C": 128,
      "NUM_KSPLIT": 1,
      "num_warps": 4,
      "num_stages": 1,
      "waves_per_eu": 1
    },
    "607": {
      "BLOCK_M": 32,
      "BLOCK_N": 16,
      "BLOCK_K": 64,
      "BLOCK_C": 128,
      "NUM_KSPLIT": 2,
      "num_warps": 8,
      "num_stages": 1,
      "waves_per_eu": 1
    },
    "156": {
      "BLOCK_M": 32,
      "BLOCK_N": 16,
      "BLOCK_K": 32,
      "BLOCK_C": 64,
      "NUM_KSPLIT": 1,
      "num_warps": 8,
      "num_stages": 1,
      "waves_per_eu": 0
    },
    "4065": {
      "BLOCK_M": 128,
      "BLOCK_N": 16,
      "BLOCK_K": 256,
      "BLOCK_C": 32,
      "NUM_KSPLIT": 2,
      "num_warps": 8,
      "num_stages": 2,
      "waves_per_eu": 0
    },
    "2364": {
      "BLOCK_M": 64,
      "BLOCK_N": 16,
      "BLOCK_K": 128,
      "BLOCK_C": 64,
      "NUM_KSPLIT": 8,
      "num_warps": 4,
      "num_stages": 1,
      "waves_per_eu": 0
    },
    "3286": {
      "BLOCK_M": 128,
      "BLOCK_N": 16,
      "BLOCK_K": 64,
      "BLOCK_C": 16,
      "NUM_KSPLIT": 4,
      "num_warps": 4,
      "num_stages": 2,
      "waves_per_eu": 1
    },
    "3553": {
      "BLOCK_M": 128,
      "BLOCK_N": 16,
      "BLOCK_K": 64,
      "BLOCK_C": 256,
      "NUM_KSPLIT": 2,
      "num_warps": 4,
      "num_stages": 1,
      "waves_per_eu": 1
    },
    "39": {
      "BLOCK_M": 32,
      "BLOCK_N": 16,
      "BLOCK_K": 32,
      "BLOCK_C": 16,
      "NUM_KSPLIT": 4,
      "num_warps": 2,
      "num_stages": 2,
      "waves_per_eu": 0
    },
    "3100": {
      "BLOCK_M": 128,
      "BLOCK_N": 16,
      "BLOCK_K": 32,
      "BLOCK_C": 128,
      "NUM_KSPLIT": 1,
      "num_warps": 2,
      "num_stages": 2,
      "waves_per_eu": 1
    },
    "2313": {
      "BLOCK_M": 64,
      "BLOCK_N": 16,
      "BLOCK_K": 128,
      "BLOCK_C": 64,
      "NUM_KSPLIT": 1,
      "num_warps": 4,
      "num_stages": 2,
      "waves_per_eu": 0
    },
    "195": {
      "BLOCK_M": 32,
      "BLOCK_N": 16,
      "BLOCK_K": 32,
      "BLOCK_C": 64,
      "NUM_KSPLIT": 4,
      "num_warps": 8,
      "num_stages": 2,
      "waves_per_eu": 0
    },
    "1627": {
      "BLOCK_M": 64,
      "BLOCK_N": 16,
      "BLOCK_K": 32,
      "BLOCK_C": 64,
      "NUM_KSPLIT": 4,
      "num_warps": 4,
      "num_stages": 1,
      "waves_per_eu": 1
    },
    "771": {
      "BLOCK_M": 32,
      "BLOCK_N": 16,
      "BLOCK_K": 128,
      "BLOCK_C": 16,
      "NUM_KSPLIT": 4,
      "num_warps": 8,
      "num_stages": 2,
      "waves_per_eu": 0
    },
    "405": {
      "BLOCK_M": 32,
      "BLOCK_N": 16,
      "BLOCK_K": 64,
      "BLOCK_C": 16,
      "NUM_KSPLIT": 4,
      "num_warps": 4,
      "num_stages": 2,
      "waves_per_eu": 0
    },
    "1692": {
      "BLOCK_M": 64,
      "BLOCK_N": 16,
      "BLOCK_K": 32,
      "BLOCK_C": 128,
      "NUM_KSPLIT": 4,
      "num_warps": 2,
      "num_stages": 1,
      "waves_per_eu": 0
    },
    "172": {
      "BLOCK_M": 32,
      "BLOCK_N": 16,
      "BLOCK_K": 32,
      "BLOCK_C": 64,
      "NUM_KSPLIT": 2,
      "num_warps": 4,
      "num_stages": 2,
      "waves_per_eu": 1
    },
    "3212": {
      "BLOCK_M": 128,
      "BLOCK_N": 16,
      "BLOCK_K": 32,
      "BLOCK_C": 256,
      "NUM_KSPLIT": 4,
      "num_warps": 4,
      "num_stages": 1,
      "waves_per_eu": 2
    },
    "1899": {
      "BLOCK_M": 64,
      "BLOCK_N": 16,
      "BLOCK_K": 64,
      "BLOCK_C": 32,
      "NUM_KSPLIT": 2,
      "num_warps": 4,
      "num_stages": 2,
      "waves_per_eu": 0
    },
    "3141": {
      "BLOCK_M": 128,
      "BLOCK_N": 16,
      "BLOCK_K": 32,
      "BLOCK_C": 128,
      "NUM_KSPLIT": 4,
      "num_warps": 4,
      "num_stages": 2,
      "waves_per_eu": 0
    },
    "3305": {
      "BLOCK_M": 128,
      "BLOCK_N": 16,
      "BLOCK_K": 64,
      "BLOCK_C": 16,
      "NUM_KSPLIT": 8,
      "num_warps": 4,
      "num_stages": 2,
      "waves_per_eu": 2
    },
    "5457": {
      "BLOCK_M": 256,
      "BLOCK_N": 16,
      "BLOCK_K": 256,
      "BLOCK_C": 16,
      "NUM_KSPLIT": 8,
      "num_warps": 2,
      "num_stages": 2,
      "waves_per_eu": 0
    },
    "4988": {
      "BLOCK_M": 256,
      "BLOCK_N": 16,
      "BLOCK_K": 64,
      "BLOCK_C": 256,
      "NUM_KSPLIT": 2,
      "num_warps": 2,
      "num_stages": 1,
      "waves_per_eu": 2
    },
    "1677": {
      "BLOCK_M": 64,
      "BLOCK_N": 16,
      "BLOCK_K": 32,
      "BLOCK_C": 128,
      "NUM_KSPLIT": 2,
      "num_warps": 2,
      "num_stages": 2,
      "waves_per_eu": 0
    },
    "1671": {
      "BLOCK_M": 64,
      "BLOCK_N": 16,
      "BLOCK_K": 32,
      "BLOCK_C": 128,
      "NUM_KSPLIT": 1,
      "num_warps": 8,
      "num_stages": 2,
      "waves_per_eu": 0
    },
    "1445": {
      "BLOCK_M": 64,
      "BLOCK_N": 16,
      "BLOCK_K": 32,
      "BLOCK_C": 16,
      "NUM_KSPLIT": 1,
      "num_warps": 2,
      "num_stages": 2,
      "waves_per_eu": 2
    },
    "2835": {
      "BLOCK_M": 64,
      "BLOCK_N": 16,
      "BLOCK_K": 256,
      "BLOCK_C": 256,
      "NUM_KSPLIT": 2,
      "num_warps": 4,
      "num_stages": 2,
      "waves_per_eu": 0
    },
    "241": {
      "BLOCK_M": 32,
      "BLOCK_N": 16,
      "BLOCK_K": 32,
      "BLOCK_C": 128,
      "NUM_KSPLIT": 2,
      "num_warps": 4,
      "num_stages": 1,
      "waves_per_eu": 1
    },
    "2649": {
      "BLOCK_M": 64,
      "BLOCK_N": 16,
      "BLOCK_K": 256,
      "BLOCK_C": 32,
      "NUM_KSPLIT": 8,
      "num_warps": 2,
      "num_stages": 2,
      "waves_per_eu": 0
    },
    "5067": {
      "BLOCK_M": 256,
      "BLOCK_N": 16,
      "BLOCK_K": 128,
      "BLOCK_C": 16,
      "NUM_KSPLIT": 2,
      "num_warps": 4,
      "num_stages": 2,
      "waves_per_eu": 0
    },
    "4754": {
      "BLOCK_M": 256,
      "BLOCK_N": 16,
      "BLOCK_K": 64,
      "BLOCK_C": 32,
      "NUM_KSPLIT": 1,
      "num_warps": 2,
      "num_stages": 1,
      "waves_per_eu": 2
    },
    "4936": {
      "BLOCK_M": 256,
      "BLOCK_N": 16,
      "BLOCK_K": 64,
      "BLOCK_C": 128,
      "NUM_KSPLIT": 4,
      "num_warps": 2,
      "num_stages": 2,
      "waves_per_eu": 1
    },
    "2250": {
      "BLOCK_M": 64,
      "BLOCK_N": 16,
      "BLOCK_K": 128,
      "BLOCK_C": 32,
      "NUM_KSPLIT": 2,
      "num_warps": 2,
      "num_stages": 1,
      "waves_per_eu": 0
    },
    "2614": {
      "BLOCK_M": 64,
      "BLOCK_N": 16,
      "BLOCK_K": 256,
      "BLOCK_C": 32,
      "NUM_KSPLIT": 2,
      "num_warps": 2,
      "num_stages": 2,
      "waves_per_eu": 1
    },
    "1857": {
      "BLOCK_M": 64,
      "BLOCK_N": 16,
      "BLOCK_K": 64,
      "BLOCK_C": 16,
      "NUM_KSPLIT": 8,
      "num_warps": 2,
      "num_stages": 2,
      "waves_per_eu": 0
    },
    "2938": {
      "BLOCK_M": 128,
      "BLOCK_N": 16,
      "BLOCK_K": 32,
      "BLOCK_C": 16,
      "NUM_KSPLIT": 8,
      "num_warps": 2,
      "num_stages": 2,
      "waves_per_eu": 1
    },
    "2541": {
      "BLOCK_M": 64,
      "BLOCK_N": 16,
      "BLOCK_K": 256,
      "BLOCK_C": 16,
      "NUM_KSPLIT": 2,
      "num_warps": 2,
      "num_stages": 2,
      "waves_per_eu": 0
    },
    "2006": {
      "BLOCK_M": 64,
      "BLOCK_N": 16,
      "BLOCK_K": 64,
      "BLOCK_C": 64,
      "NUM_KSPLIT": 8,
      "num_warps": 4,
      "num_stages": 1,
      "waves_per_eu": 2
    },
    "3358": {
      "BLOCK_M": 128,
      "BLOCK_N": 16,
      "BLOCK_K": 64,
      "BLOCK_C": 32,
      "NUM_KSPLIT": 4,
      "num_warps": 4,
      "num_stages": 2,
      "waves_per_eu": 1
    },
    "2489": {
      "BLOCK_M": 64,
      "BLOCK_N": 16,
      "BLOCK_K": 128,
      "BLOCK_C": 256,
      "NUM_KSPLIT": 4,
      "num_warps": 2,
      "num_stages": 2,
      "waves_per_eu": 2
    },
    "5028": {
      "BLOCK_M": 256,
      "BLOCK_N": 16,
      "BLOCK_K": 64,
      "BLOCK_C": 256,
      "NUM_KSPLIT": 8,
      "num_warps": 4,
      "num_stages": 1,
      "waves_per_eu": 0
    },
    "5262": {
      "BLOCK_M": 256,
      "BLOCK_N": 16,
      "BLOCK_K": 128,
      "BLOCK_C": 128,
      "NUM_KSPLIT": 1,
      "num_warps": 4,
      "num_stages": 1,
      "waves_per_eu": 0
    },
    "2666": {
      "BLOCK_M": 64,
      "BLOCK_N": 16,
      "BLOCK_K": 256,
      "BLOCK_C": 64,
      "NUM_KSPLIT": 1,
      "num_warps": 2,
      "num_stages": 1,
      "waves_per_eu": 2
    },
    "5312": {
      "BLOCK_M": 256,
      "BLOCK_N": 16,
      "BLOCK_K": 128,
      "BLOCK_C": 128,
      "NUM_KSPLIT": 8,
      "num_warps": 2,
      "num_stages": 1,
      "waves_per_eu": 2
    },
    "3101": {
      "BLOCK_M": 128,
      "BLOCK_N": 16,
      "BLOCK_K": 32,
      "BLOCK_C": 128,
      "NUM_KSPLIT": 1,
      "num_warps": 2,
      "num_stages": 2,
      "waves_per_eu": 2
    },
    "5297": {
      "BLOCK_M": 256,
      "BLOCK_N": 16,
      "BLOCK_K": 128,
      "BLOCK_C": 128,
      "NUM_KSPLIT": 4,
      "num_warps": 2,
      "num_stages": 2,
      "waves_per_eu": 2
    },
    "1217": {
      "BLOCK_M": 32,
      "BLOCK_N": 16,
      "BLOCK_K": 256,
      "BLOCK_C": 32,
      "NUM_KSPLIT": 8,
      "num_warps": 4,
      "num_stages": 2,
      "waves_per_eu": 2
    },
    "3136": {
      "BLOCK_M": 128,
      "BLOCK_N": 16,
      "BLOCK_K": 32,
      "BLOCK_C": 128,
      "NUM_KSPLIT": 4,
      "num_warps": 2,
      "num_stages": 2,
      "waves_per_eu": 1
    },
    "2691": {
      "BLOCK_M": 64,
      "BLOCK_N": 16,
      "BLOCK_K": 256,
      "BLOCK_C": 64,
      "NUM_KSPLIT": 2,
      "num_warps": 4,
      "num_stages": 2,
      "waves_per_eu": 0
    },
    "1562": {
      "BLOCK_M": 64,
      "BLOCK_N": 16,
      "BLOCK_K": 32,
      "BLOCK_C": 32,
      "NUM_KSPLIT": 4,
      "num_warps": 8,
      "num_stages": 1,
      "waves_per_eu": 2
    },
    "3847": {
      "BLOCK_M": 128,
      "BLOCK_N": 16,
      "BLOCK_K": 128,
      "BLOCK_C": 128,
      "NUM_KSPLIT": 2,
      "num_warps": 8,
      "num_stages": 1,
      "waves_per_eu": 1
    },
    "4007": {
      "BLOCK_M": 128,
      "BLOCK_N": 16,
      "BLOCK_K": 256,
      "BLOCK_C": 16,
      "NUM_KSPLIT": 4,
      "num_warps": 4,
      "num_stages": 2,
      "waves_per_eu": 2
    },
    "3907": {
      "BLOCK_M": 128,
      "BLOCK_N": 16,
      "BLOCK_K": 128,
      "BLOCK_C": 256,
      "NUM_KSPLIT": 2,
      "num_warps": 2,
      "num_stages": 1,
      "waves_per_eu": 1
    },
    "972": {
      "BLOCK_M": 32,
      "BLOCK_N": 16,
      "BLOCK_K": 128,
      "BLOCK_C": 128,
      "NUM_KSPLIT": 4,
      "num_warps": 2,
      "num_stages": 1,
      "waves_per_eu": 0
    },
    "708": {
      "BLOCK_M": 32,
      "BLOCK_N": 16,
      "BLOCK_K": 64,
      "BLOCK_C": 256,
      "NUM_KSPLIT": 8,
      "num_warps": 4,
      "num_stages": 1,
      "waves_per_eu": 0
    },
    "329": {
      "BLOCK_M": 32,
      "BLOCK_N": 16,
      "BLOCK_K": 32,
      "BLOCK_C": 256,
      "NUM_KSPLIT": 4,
      "num_warps": 2,
      "num_stages": 2,
      "waves_per_eu": 2
    },
    "4098": {
      "BLOCK_M": 128,
      "BLOCK_N": 16,
      "BLOCK_K": 256,
      "BLOCK_C": 32,
      "NUM_KSPLIT": 8,
      "num_warps": 8,
      "num_stages": 1,
      "waves_per_eu": 0
    },
    "1201": {
      "BLOCK_M": 32,
      "BLOCK_N": 16,
      "BLOCK_K": 256,
      "BLOCK_C": 32,
      "NUM_KSPLIT": 4,
      "num_warps": 8,
      "num_stages": 1,
      "waves_per_eu": 1
    },
    "97": {
      "BLOCK_M": 32,
      "BLOCK_N": 16,
      "BLOCK_K": 32,
      "BLOCK_C": 32,
      "NUM_KSPLIT": 2,
      "num_warps": 4,
      "num_stages": 1,
      "waves_per_eu": 1
    },
    "2625": {
      "BLOCK_M": 64,
      "BLOCK_N": 16,
      "BLOCK_K": 256,
      "BLOCK_C": 32,
      "NUM_KSPLIT": 2,
      "num_warps": 8,
      "num_stages": 2,
      "waves_per_eu": 0
    },
    "3683": {
      "BLOCK_M": 128,
      "BLOCK_N": 16,
      "BLOCK_K": 128,
      "BLOCK_C": 32,
      "NUM_KSPLIT": 1,
      "num_warps": 4,
      "num_stages": 2,
      "waves_per_eu": 2
    },
    "3351": {
      "BLOCK_M": 128,
      "BLOCK_N": 16,
      "BLOCK_K": 64,
      "BLOCK_C": 32,
      "NUM_KSPLIT": 4,
      "num_warps": 2,
      "num_stages": 2,
      "waves_per_eu": 0
    },
    "211": {
      "BLOCK_M": 32,
      "BLOCK_N": 16,
      "BLOCK_K": 32,
      "BLOCK_C": 64,
      "NUM_KSPLIT": 8,
      "num_warps": 8,
      "num_stages": 1,
      "waves_per_eu": 1
    },
    "781": {
      "BLOCK_M": 32,
      "BLOCK_N": 16,
      "BLOCK_K": 128,
      "BLOCK_C": 16,
      "NUM_KSPLIT": 8,
      "num_warps": 4,
      "num_stages": 1,
      "waves_per_eu": 1
    },
    "828": {
      "BLOCK_M": 32,
      "BLOCK_N": 16,
      "BLOCK_K": 128,
      "BLOCK_C": 32,
      "NUM_KSPLIT": 4,
      "num_warps": 2,
      "num_stages": 1,
      "waves_per_eu": 0
    },
    "955": {
      "BLOCK_M": 32,
      "BLOCK_N": 16,
      "BLOCK_K": 128,
      "BLOCK_C": 128,
      "NUM_KSPLIT": 2,
      "num_warps": 2,
      "num_stages": 1,
      "waves_per_eu": 1
    },
    "1830": {
      "BLOCK_M": 64,
      "BLOCK_N": 16,
      "BLOCK_K": 64,
      "BLOCK_C": 16,
      "NUM_KSPLIT": 2,
      "num_warps": 8,
      "num_stages": 1,
      "waves_per_eu": 0
    },
    "4622": {
      "BLOCK_M": 256,
      "BLOCK_N": 16,
      "BLOCK_K": 32,
      "BLOCK_C": 256,
      "NUM_KSPLIT": 1,
      "num_warps": 8,
      "num_stages": 1,
      "waves_per_eu": 2
    },
    "2003": {
      "BLOCK_M": 64,
      "BLOCK_N": 16,
      "BLOCK_K": 64,
      "BLOCK_C": 64,
      "NUM_KSPLIT": 8,
      "num_warps": 2,
      "num_stages": 2,
      "waves_per_eu": 2
    },
    "1710": {
      "BLOCK_M": 64,
      "BLOCK_N": 16,
      "BLOCK_K": 32,
      "BLOCK_C": 128,
      "NUM_KSPLIT": 8,
      "num_warps": 2,
      "num_stages": 1,
      "waves_per_eu": 0
    },
    "179": {
      "BLOCK_M": 32,
      "BLOCK_N": 16,
      "BLOCK_K": 32,
      "BLOCK_C": 64,
      "NUM_KSPLIT": 2,
      "num_warps": 8,
      "num_stages": 2,
      "waves_per_eu": 2
    },
    "3218": {
      "BLOCK_M": 128,
      "BLOCK_N": 16,
      "BLOCK_K": 32,
      "BLOCK_C": 256,
      "NUM_KSPLIT": 4,
      "num_warps": 8,
      "num_stages": 1,
      "waves_per_eu": 2
    },
    "5549": {
      "BLOCK_M": 256,
      "BLOCK_N": 16,
      "BLOCK_K": 256,
      "BLOCK_C": 64,
      "NUM_KSPLIT": 1,
      "num_warps": 2,
      "num_stages": 2,
      "waves_per_eu": 2
    },
    "29": {
      "BLOCK_M": 32,
      "BLOCK_N": 16,
      "BLOCK_K": 32,
      "BLOCK_C": 16,
      "NUM_KSPLIT": 2,
      "num_warps": 4,
      "num_stages": 2,
      "waves_per_eu": 2
    },
    "3882": {
      "BLOCK_M": 128,
      "BLOCK_N": 16,
      "BLOCK_K": 128,
      "BLOCK_C": 128,
      "NUM_KSPLIT": 8,
      "num_warps": 8,
      "num_stages": 1,
      "waves_per_eu": 0
    },
    "1290": {
      "BLOCK_M": 32,
      "BLOCK_N": 16,
      "BLOCK_K": 256,
      "BLOCK_C": 64,
      "NUM_KSPLIT": 8,
      "num_warps": 8,
      "num_stages": 1,
      "waves_per_eu": 0
    },
    "847": {
      "BLOCK_M": 32,
      "BLOCK_N": 16,
      "BLOCK_K": 128,
      "BLOCK_C": 32,
      "NUM_KSPLIT": 8,
      "num_warps": 2,
      "num_stages": 1,
      "waves_per_eu": 1
    },
    "5289": {
      "BLOCK_M": 256,
      "BLOCK_N": 16,
      "BLOCK_K": 128,
      "BLOCK_C": 128,
      "NUM_KSPLIT": 2,
      "num_warps": 8,
      "num_stages": 2,
      "waves_per_eu": 0
    },
    "4114": {
      "BLOCK_M": 128,
      "BLOCK_N": 16,
      "BLOCK_K": 256,
      "BLOCK_C": 64,
      "NUM_KSPLIT": 1,
      "num_warps": 4,
      "num_stages": 2,
      "waves_per_eu": 1
    },
    "3404": {
      "BLOCK_M": 128,
      "BLOCK_N": 16,
      "BLOCK_K": 64,
      "BLOCK_C": 64,
      "NUM_KSPLIT": 2,
      "num_warps": 2,
      "num_stages": 1,
      "waves_per_eu": 2
    },
    "5635": {
      "BLOCK_M": 256,
      "BLOCK_N": 16,
      "BLOCK_K": 256,
      "BLOCK_C": 128,
      "NUM_KSPLIT": 2,
      "num_warps": 2,
      "num_stages": 1,
      "waves_per_eu": 1
    },
    "4113": {
      "BLOCK_M": 128,
      "BLOCK_N": 16,
      "BLOCK_K": 256,
      "BLOCK_C": 64,
      "NUM_KSPLIT": 1,
      "num_warps": 4,
      "num_stages": 2,
      "waves_per_eu": 0
    },
    "5175": {
      "BLOCK_M": 256,
      "BLOCK_N": 16,
      "BLOCK_K": 128,
      "BLOCK_C": 32,
      "NUM_KSPLIT": 8,
      "num_warps": 4,
      "num_stages": 2,
      "waves_per_eu": 0
    },
    "4440": {
      "BLOCK_M": 256,
      "BLOCK_N": 16,
      "BLOCK_K": 32,
      "BLOCK_C": 32,
      "NUM_KSPLIT": 4,
      "num_warps": 8,
      "num_stages": 1,
      "waves_per_eu": 0
    },
    "4498": {
      "BLOCK_M": 256,
      "BLOCK_N": 16,
      "BLOCK_K": 32,
      "BLOCK_C": 64,
      "NUM_KSPLIT": 2,
      "num_warps": 8,
      "num_stages": 2,
      "waves_per_eu": 1
    },
    "2457": {
      "BLOCK_M": 64,
      "BLOCK_N": 16,
      "BLOCK_K": 128,
      "BLOCK_C": 256,
      "NUM_KSPLIT": 1,
      "num_warps": 4,
      "num_stages": 2,
      "waves_per_eu": 0
    },
    "5641": {
      "BLOCK_M": 256,
      "BLOCK_N": 16,
      "BLOCK_K": 256,
      "BLOCK_C": 128,
      "NUM_KSPLIT": 2,
      "num_warps": 4,
      "num_stages": 1,
      "waves_per_eu": 1
    },
    "3052": {
      "BLOCK_M": 128,
      "BLOCK_N": 16,
      "BLOCK_K": 32,
      "BLOCK_C": 64,
      "NUM_KSPLIT": 2,
      "num_warps": 4,
      "num_stages": 2,
      "waves_per_eu": 1
    },
    "2238": {
      "BLOCK_M": 64,
      "BLOCK_N": 16,
      "BLOCK_K": 128,
      "BLOCK_C": 32,
      "NUM_KSPLIT": 1,
      "num_warps": 4,
      "num_stages": 1,
      "waves_per_eu": 0
    },
    "2667": {
      "BLOCK_M": 64,
      "BLOCK_N": 16,
      "BLOCK_K": 256,
      "BLOCK_C": 64,
      "NUM_KSPLIT": 1,
      "num_warps": 2,
      "num_stages": 2,
      "waves_per_eu": 0
    },
    "2212": {
      "BLOCK_M": 64,
      "BLOCK_N": 16,
      "BLOCK_K": 128,
      "BLOCK_C": 16,
      "NUM_KSPLIT": 4,
      "num_warps": 8,
      "num_stages": 2,
      "waves_per_eu": 1
    },
    "5730": {
      "BLOCK_M": 256,
      "BLOCK_N": 16,
      "BLOCK_K": 256,
      "BLOCK_C": 256,
      "NUM_KSPLIT": 4,
      "num_warps": 4,
      "num_stages": 1,
      "waves_per_eu": 0
    },
    "3572": {
      "BLOCK_M": 128,
      "BLOCK_N": 16,
      "BLOCK_K": 64,
      "BLOCK_C": 256,
      "NUM_KSPLIT": 4,
      "num_warps": 4,
      "num_stages": 1,
      "waves_per_eu": 2
    },
    "2309": {
      "BLOCK_M": 64,
      "BLOCK_N": 16,
      "BLOCK_K": 128,
      "BLOCK_C": 64,
      "NUM_KSPLIT": 1,
      "num_warps": 2,
      "num_stages": 2,
      "waves_per_eu": 2
    },
    "1901": {
      "BLOCK_M": 64,
      "BLOCK_N": 16,
      "BLOCK_K": 64,
      "BLOCK_C": 32,
      "NUM_KSPLIT": 2,
      "num_warps": 4,
      "num_stages": 2,
      "waves_per_eu": 2
    },
    "4642": {
      "BLOCK_M": 256,
      "BLOCK_N": 16,
      "BLOCK_K": 32,
      "BLOCK_C": 256,
      "NUM_KSPLIT": 2,
      "num_warps": 8,
      "num_stages": 2,
      "waves_per_eu": 1
    },
    "4409": {
      "BLOCK_M": 256,
      "BLOCK_N": 16,
      "BLOCK_K": 32,
      "BLOCK_C": 32,
      "NUM_KSPLIT": 1,
      "num_warps": 8,
      "num_stages": 2,
      "waves_per_eu": 2
    },
    "5732": {
      "BLOCK_M": 256,
      "BLOCK_N": 16,
      "BLOCK_K": 256,
      "BLOCK_C": 256,
      "NUM_KSPLIT": 4,
      "num_warps": 4,
      "num_stages": 1,
      "waves_per_eu": 2
    },
    "232": {
      "BLOCK_M": 32,
      "BLOCK_N": 16,
      "BLOCK_K": 32,
      "BLOCK_C": 128,
      "NUM_KSPLIT": 1,
      "num_warps": 8,
      "num_stages": 2,
      "waves_per_eu": 1
    },
    "845": {
      "BLOCK_M": 32,
      "BLOCK_N": 16,
      "BLOCK_K": 128,
      "BLOCK_C": 32,
      "NUM_KSPLIT": 4,
      "num_warps": 8,
      "num_stages": 2,
      "waves_per_eu": 2
    },
    "2254": {
      "BLOCK_M": 64,
      "BLOCK_N": 16,
      "BLOCK_K": 128,
      "BLOCK_C": 32,
      "NUM_KSPLIT": 2,
      "num_warps": 2,
      "num_stages": 2,
      "waves_per_eu": 1
    },
    "3261": {
      "BLOCK_M": 128,
      "BLOCK_N": 16,
      "BLOCK_K": 64,
      "BLOCK_C": 16,
      "NUM_KSPLIT": 2,
      "num_warps": 2,
      "num_stages": 2,
      "waves_per_eu": 0
    },
    "2334": {
      "BLOCK_M": 64,
      "BLOCK_N": 16,
      "BLOCK_K": 128,
      "BLOCK_C": 64,
      "NUM_KSPLIT": 2,
      "num_warps": 8,
      "num_stages": 1,
      "waves_per_eu": 0
    },
    "1861": {
      "BLOCK_M": 64,
      "BLOCK_N": 16,
      "BLOCK_K": 64,
      "BLOCK_C": 16,
      "NUM_KSPLIT": 8,
      "num_warps": 4,
      "num_stages": 1,
      "waves_per_eu": 1
    },
    "5636": {
      "BLOCK_M": 256,
      "BLOCK_N": 16,
      "BLOCK_K": 256,
      "BLOCK_C": 128,
      "NUM_KSPLIT": 2,
      "num_warps": 2,
      "num_stages": 1,
      "waves_per_eu": 2
    },
    "817": {
      "BLOCK_M": 32,
      "BLOCK_N": 16,
      "BLOCK_K": 128,
      "BLOCK_C": 32,
      "NUM_KSPLIT": 2,
      "num_warps": 4,
      "num_stages": 1,
      "waves_per_eu": 1
    },
    "2840": {
      "BLOCK_M": 64,
      "BLOCK_N": 16,
      "BLOCK_K": 256,
      "BLOCK_C": 256,
      "NUM_KSPLIT": 2,
      "num_warps": 8,
      "num_stages": 1,
      "waves_per_eu": 2
    },
    "3747": {
      "BLOCK_M": 128,
      "BLOCK_N": 16,
      "BLOCK_K": 128,
      "BLOCK_C": 64,
      "NUM_KSPLIT": 1,
      "num_warps": 2,
      "num_stages": 2,
      "waves_per_eu": 0
    },
    "624": {
      "BLOCK_M": 32,
      "BLOCK_N": 16,
      "BLOCK_K": 64,
      "BLOCK_C": 128,
      "NUM_KSPLIT": 4,
      "num_warps": 8,
      "num_stages": 1,
      "waves_per_eu": 0
    },
    "1719": {
      "BLOCK_M": 64,
      "BLOCK_N": 16,
      "BLOCK_K": 32,
      "BLOCK_C": 128,
      "NUM_KSPLIT": 8,
