tuning_results_mhc/gfx950/raw_tuner_outputs/tested_configs_mhc_fused_mhc_sk20_M1024_n4_C1024.json
{
  "kernel": "fused_mhc",
  "M": 1024,
  "n": 4,
  "C": 1024,
  "sinkhorn_iters": 20,
  "config_file": "tuning_results/tuning_space_mhc.json",
  "tested_configs_successful": {
    "121": {
      "BLOCK_M": 32,
      "BLOCK_N": 16,
      "BLOCK_K": 32,
      "BLOCK_C": 32,
      "NUM_KSPLIT": 4,
      "num_warps": 8,
      "num_stages": 1,
      "waves_per_eu": 1
    },
    "2794": {
      "BLOCK_M": 64,
      "BLOCK_N": 16,
      "BLOCK_K": 256,
      "BLOCK_C": 128,
      "NUM_KSPLIT": 8,
      "num_warps": 2,
      "num_stages": 2,
      "waves_per_eu": 1
    },
    "910": {
      "BLOCK_M": 32,
      "BLOCK_N": 16,
      "BLOCK_K": 128,
      "BLOCK_C": 64,
      "NUM_KSPLIT": 4,
      "num_warps": 4,
      "num_stages": 2,
      "waves_per_eu": 1
    },
    "2489": {
      "BLOCK_M": 64,
      "BLOCK_N": 16,
      "BLOCK_K": 128,
      "BLOCK_C": 256,
      "NUM_KSPLIT": 4,
      "num_warps": 2,
      "num_stages": 2,
      "waves_per_eu": 2
    },
    "3832": {
      "BLOCK_M": 128,
      "BLOCK_N": 16,
      "BLOCK_K": 128,
      "BLOCK_C": 128,
      "NUM_KSPLIT": 1,
      "num_warps": 8,
      "num_stages": 2,
      "waves_per_eu": 1
    },
    "4344": {
      "BLOCK_M": 256,
      "BLOCK_N": 16,
      "BLOCK_K": 32,
      "BLOCK_C": 16,
      "NUM_KSPLIT": 2,
      "num_warps": 4,
      "num_stages": 1,
      "waves_per_eu": 0
    },
    "3293": {
      "BLOCK_M": 128,
      "BLOCK_N": 16,
      "BLOCK_K": 64,
      "BLOCK_C": 16,
      "NUM_KSPLIT": 4,
      "num_warps": 8,
      "num_stages": 2,
      "waves_per_eu": 2
    },
    "5499": {
      "BLOCK_M": 256,
      "BLOCK_N": 16,
      "BLOCK_K": 256,
      "BLOCK_C": 32,
      "NUM_KSPLIT": 2,
      "num_warps": 4,
      "num_stages": 2,
      "waves_per_eu": 0
    },
    "664": {
      "BLOCK_M": 32,
      "BLOCK_N": 16,
      "BLOCK_K": 64,
      "BLOCK_C": 256,
      "NUM_KSPLIT": 1,
      "num_warps": 8,
      "num_stages": 2,
      "waves_per_eu": 1
    },
    "2904": {
      "BLOCK_M": 128,
      "BLOCK_N": 16,
      "BLOCK_K": 32,
      "BLOCK_C": 16,
      "NUM_KSPLIT": 2,
      "num_warps": 4,
      "num_stages": 1,
      "waves_per_eu": 0
    },
    "2877": {
      "BLOCK_M": 64,
      "BLOCK_N": 16,
      "BLOCK_K": 256,
      "BLOCK_C": 256,
      "NUM_KSPLIT": 8,
      "num_warps": 8,
      "num_stages": 2,
      "waves_per_eu": 0
    },
    "1341": {
      "BLOCK_M": 32,
      "BLOCK_N": 16,
      "BLOCK_K": 256,
      "BLOCK_C": 128,
      "NUM_KSPLIT": 4,
      "num_warps": 4,
      "num_stages": 2,
      "waves_per_eu": 0
    },
    "5281": {
      "BLOCK_M": 256,
      "BLOCK_N": 16,
      "BLOCK_K": 128,
      "BLOCK_C": 128,
      "NUM_KSPLIT": 2,
      "num_warps": 4,
      "num_stages": 1,
      "waves_per_eu": 1
    },
    "5235": {
      "BLOCK_M": 256,
      "BLOCK_N": 16,
      "BLOCK_K": 128,
      "BLOCK_C": 64,
      "NUM_KSPLIT": 4,
      "num_warps": 8,
      "num_stages": 2,
      "waves_per_eu": 0
    },
    "5696": {
      "BLOCK_M": 256,
      "BLOCK_N": 16,
      "BLOCK_K": 256,
      "BLOCK_C": 256,
      "NUM_KSPLIT": 1,
      "num_warps": 4,
      "num_stages": 1,
      "waves_per_eu": 2
    },
    "1424": {
      "BLOCK_M": 32,
      "BLOCK_N": 16,
      "BLOCK_K": 256,
      "BLOCK_C": 256,
      "NUM_KSPLIT": 8,
      "num_warps": 2,
      "num_stages": 1,
      "waves_per_eu": 2
    },
    "3536": {
      "BLOCK_M": 128,
      "BLOCK_N": 16,
      "BLOCK_K": 64,
      "BLOCK_C": 256,
      "NUM_KSPLIT": 1,
      "num_warps": 4,
      "num_stages": 1,
      "waves_per_eu": 2
    },
    "4051": {
      "BLOCK_M": 128,
      "BLOCK_N": 16,
      "BLOCK_K": 256,
      "BLOCK_C": 32,
      "NUM_KSPLIT": 2,
      "num_warps": 2,
      "num_stages": 1,
      "waves_per_eu": 1
    },
    "4008": {
      "BLOCK_M": 128,
      "BLOCK_N": 16,
      "BLOCK_K": 256,
      "BLOCK_C": 16,
      "NUM_KSPLIT": 4,
      "num_warps": 8,
      "num_stages": 1,
      "waves_per_eu": 0
    },
    "1835": {
      "BLOCK_M": 64,
      "BLOCK_N": 16,
      "BLOCK_K": 64,
      "BLOCK_C": 16,
      "NUM_KSPLIT": 2,
      "num_warps": 8,
      "num_stages": 2,
      "waves_per_eu": 2
    },
    "855": {
      "BLOCK_M": 32,
      "BLOCK_N": 16,
      "BLOCK_K": 128,
      "BLOCK_C": 32,
      "NUM_KSPLIT": 8,
      "num_warps": 4,
      "num_stages": 2,
      "waves_per_eu": 0
    },
    "4331": {
      "BLOCK_M": 256,
      "BLOCK_N": 16,
      "BLOCK_K": 32,
      "BLOCK_C": 16,
      "NUM_KSPLIT": 1,
      "num_warps": 4,
      "num_stages": 2,
      "waves_per_eu": 2
    },
    "5257": {
      "BLOCK_M": 256,
      "BLOCK_N": 16,
      "BLOCK_K": 128,
      "BLOCK_C": 128,
      "NUM_KSPLIT": 1,
      "num_warps": 2,
      "num_stages": 1,
      "waves_per_eu": 1
    },
    "3941": {
      "BLOCK_M": 128,
      "BLOCK_N": 16,
      "BLOCK_K": 128,
      "BLOCK_C": 256,
      "NUM_KSPLIT": 4,
      "num_warps": 8,
      "num_stages": 2,
      "waves_per_eu": 2
    },
    "5378": {
      "BLOCK_M": 256,
      "BLOCK_N": 16,
      "BLOCK_K": 128,
      "BLOCK_C": 256,
      "NUM_KSPLIT": 4,
      "num_warps": 8,
      "num_stages": 1,
      "waves_per_eu": 2
    },
    "2763": {
      "BLOCK_M": 64,
      "BLOCK_N": 16,
      "BLOCK_K": 256,
      "BLOCK_C": 128,
      "NUM_KSPLIT": 2,
      "num_warps": 4,
      "num_stages": 2,
      "waves_per_eu": 0
    },
    "3033": {
      "BLOCK_M": 128,
      "BLOCK_N": 16,
      "BLOCK_K": 32,
      "BLOCK_C": 64,
      "NUM_KSPLIT": 1,
      "num_warps": 4,
      "num_stages": 2,
      "waves_per_eu": 0
    },
    "858": {
      "BLOCK_M": 32,
      "BLOCK_N": 16,
      "BLOCK_K": 128,
      "BLOCK_C": 32,
      "NUM_KSPLIT": 8,
      "num_warps": 8,
      "num_stages": 1,
      "waves_per_eu": 0
    },
    "4075": {
      "BLOCK_M": 128,
      "BLOCK_N": 16,
      "BLOCK_K": 256,
      "BLOCK_C": 32,
      "NUM_KSPLIT": 4,
      "num_warps": 4,
      "num_stages": 1,
      "waves_per_eu": 1
    },
    "5233": {
      "BLOCK_M": 256,
      "BLOCK_N": 16,
      "BLOCK_K": 128,
      "BLOCK_C": 64,
      "NUM_KSPLIT": 4,
      "num_warps": 8,
      "num_stages": 1,
      "waves_per_eu": 1
    },
    "5649": {
      "BLOCK_M": 256,
      "BLOCK_N": 16,
      "BLOCK_K": 256,
      "BLOCK_C": 128,
      "NUM_KSPLIT": 2,
      "num_warps": 8,
      "num_stages": 2,
      "waves_per_eu": 0
    },
    "1579": {
      "BLOCK_M": 64,
      "BLOCK_N": 16,
      "BLOCK_K": 32,
      "BLOCK_C": 32,
      "NUM_KSPLIT": 8,
      "num_warps": 8,
      "num_stages": 1,
      "waves_per_eu": 1
    },
    "5524": {
      "BLOCK_M": 256,
      "BLOCK_N": 16,
      "BLOCK_K": 256,
      "BLOCK_C": 32,
      "NUM_KSPLIT": 4,
      "num_warps": 8,
      "num_stages": 2,
      "waves_per_eu": 1
    },
    "5214": {
      "BLOCK_M": 256,
      "BLOCK_N": 16,
      "BLOCK_K": 128,
      "BLOCK_C": 64,
      "NUM_KSPLIT": 2,
      "num_warps": 8,
      "num_stages": 1,
      "waves_per_eu": 0
    },
    "4184": {
      "BLOCK_M": 128,
      "BLOCK_N": 16,
      "BLOCK_K": 256,
      "BLOCK_C": 128,
      "NUM_KSPLIT": 1,
      "num_warps": 4,
      "num_stages": 1,
      "waves_per_eu": 2
    },
    "3705": {
      "BLOCK_M": 128,
      "BLOCK_N": 16,
      "BLOCK_K": 128,
      "BLOCK_C": 32,
      "NUM_KSPLIT": 2,
      "num_warps": 8,
      "num_stages": 2,
      "waves_per_eu": 0
    },
    "1666": {
      "BLOCK_M": 64,
      "BLOCK_N": 16,
      "BLOCK_K": 32,
      "BLOCK_C": 128,
      "NUM_KSPLIT": 1,
      "num_warps": 4,
      "num_stages": 2,
      "waves_per_eu": 1
    },
    "4823": {
      "BLOCK_M": 256,
      "BLOCK_N": 16,
      "BLOCK_K": 64,
      "BLOCK_C": 32,
      "NUM_KSPLIT": 8,
      "num_warps": 8,
      "num_stages": 2,
      "waves_per_eu": 2
    },
    "3240": {
      "BLOCK_M": 128,
      "BLOCK_N": 16,
      "BLOCK_K": 64,
      "BLOCK_C": 16,
      "NUM_KSPLIT": 1,
      "num_warps": 2,
      "num_stages": 1,
      "waves_per_eu": 0
    },
    "4597": {
      "BLOCK_M": 256,
      "BLOCK_N": 16,
      "BLOCK_K": 32,
      "BLOCK_C": 128,
      "NUM_KSPLIT": 8,
      "num_warps": 4,
      "num_stages": 1,
      "waves_per_eu": 1
    },
    "167": {
      "BLOCK_M": 32,
      "BLOCK_N": 16,
      "BLOCK_K": 32,
      "BLOCK_C": 64,
      "NUM_KSPLIT": 2,
      "num_warps": 2,
      "num_stages": 2,
      "waves_per_eu": 2
    },
    "1546": {
      "BLOCK_M": 64,
      "BLOCK_N": 16,
      "BLOCK_K": 32,
      "BLOCK_C": 32,
      "NUM_KSPLIT": 2,
      "num_warps": 8,
      "num_stages": 2,
      "waves_per_eu": 1
    },
    "1174": {
      "BLOCK_M": 32,
      "BLOCK_N": 16,
      "BLOCK_K": 256,
      "BLOCK_C": 32,
      "NUM_KSPLIT": 2,
      "num_warps": 2,
      "num_stages": 2,
      "waves_per_eu": 1
    },
    "2854": {
      "BLOCK_M": 64,
      "BLOCK_N": 16,
      "BLOCK_K": 256,
      "BLOCK_C": 256,
      "NUM_KSPLIT": 4,
      "num_warps": 4,
      "num_stages": 2,
      "waves_per_eu": 1
    },
    "1542": {
      "BLOCK_M": 64,
      "BLOCK_N": 16,
      "BLOCK_K": 32,
      "BLOCK_C": 32,
      "NUM_KSPLIT": 2,
      "num_warps": 8,
      "num_stages": 1,
      "waves_per_eu": 0
    },
    "2228": {
      "BLOCK_M": 64,
      "BLOCK_N": 16,
      "BLOCK_K": 128,
      "BLOCK_C": 16,
      "NUM_KSPLIT": 8,
      "num_warps": 8,
      "num_stages": 1,
      "waves_per_eu": 2
    },
    "3829": {
      "BLOCK_M": 128,
      "BLOCK_N": 16,
      "BLOCK_K": 128,
      "BLOCK_C": 128,
      "NUM_KSPLIT": 1,
      "num_warps": 8,
      "num_stages": 1,
      "waves_per_eu": 1
    },
    "756": {
      "BLOCK_M": 32,
      "BLOCK_N": 16,
      "BLOCK_K": 128,
      "BLOCK_C": 16,
      "NUM_KSPLIT": 4,
      "num_warps": 2,
      "num_stages": 1,
      "waves_per_eu": 0
    },
    "5346": {
      "BLOCK_M": 256,
      "BLOCK_N": 16,
      "BLOCK_K": 128,
      "BLOCK_C": 256,
      "NUM_KSPLIT": 2,
      "num_warps": 2,
      "num_stages": 1,
      "waves_per_eu": 0
    },
    "5322": {
      "BLOCK_M": 256,
      "BLOCK_N": 16,
      "BLOCK_K": 128,
      "BLOCK_C": 128,
      "NUM_KSPLIT": 8,
      "num_warps": 8,
      "num_stages": 1,
      "waves_per_eu": 0
    },
    "4727": {
      "BLOCK_M": 256,
      "BLOCK_N": 16,
      "BLOCK_K": 64,
      "BLOCK_C": 16,
      "NUM_KSPLIT": 4,
      "num_warps": 4,
      "num_stages": 2,
      "waves_per_eu": 2
    },
    "3054": {
      "BLOCK_M": 128,
      "BLOCK_N": 16,
      "BLOCK_K": 32,
      "BLOCK_C": 64,
      "NUM_KSPLIT": 2,
      "num_warps": 8,
      "num_stages": 1,
      "waves_per_eu": 0
    },
    "2601": {
      "BLOCK_M": 64,
      "BLOCK_N": 16,
      "BLOCK_K": 256,
      "BLOCK_C": 32,
      "NUM_KSPLIT": 1,
      "num_warps": 4,
      "num_stages": 2,
      "waves_per_eu": 0
    },
    "2775": {
      "BLOCK_M": 64,
      "BLOCK_N": 16,
      "BLOCK_K": 256,
      "BLOCK_C": 128,
      "NUM_KSPLIT": 4,
      "num_warps": 2,
      "num_stages": 2,
      "waves_per_eu": 0
    },
    "477": {
      "BLOCK_M": 32,
      "BLOCK_N": 16,
      "BLOCK_K": 64,
      "BLOCK_C": 32,
      "NUM_KSPLIT": 4,
      "num_warps": 4,
      "num_stages": 2,
      "waves_per_eu": 0
    },
    "401": {
      "BLOCK_M": 32,
      "BLOCK_N": 16,
      "BLOCK_K": 64,
      "BLOCK_C": 16,
      "NUM_KSPLIT": 4,
      "num_warps": 2,
      "num_stages": 2,
      "waves_per_eu": 2
    },
    "5689": {
      "BLOCK_M": 256,
      "BLOCK_N": 16,
      "BLOCK_K": 256,
      "BLOCK_C": 256,
      "NUM_KSPLIT": 1,
      "num_warps": 2,
      "num_stages": 1,
      "waves_per_eu": 1
    },
    "4393": {
      "BLOCK_M": 256,
      "BLOCK_N": 16,
      "BLOCK_K": 32,
      "BLOCK_C": 32,
      "NUM_KSPLIT": 1,
      "num_warps": 2,
      "num_stages": 1,
      "waves_per_eu": 1
    },
    "4269": {
      "BLOCK_M": 128,
      "BLOCK_N": 16,
      "BLOCK_K": 256,
      "BLOCK_C": 256,
      "NUM_KSPLIT": 2,
      "num_warps": 2,
      "num_stages": 2,
      "waves_per_eu": 0
    },
    "3624": {
      "BLOCK_M": 128,
      "BLOCK_N": 16,
      "BLOCK_K": 128,
      "BLOCK_C": 16,
      "NUM_KSPLIT": 2,
      "num_warps": 4,
      "num_stages": 1,
      "waves_per_eu": 0
    },
    "1404": {
      "BLOCK_M": 32,
      "BLOCK_N": 16,
      "BLOCK_K": 256,
      "BLOCK_C": 256,
      "NUM_KSPLIT": 4,
      "num_warps": 2,
      "num_stages": 1,
      "waves_per_eu": 0
    },
    "4633": {
      "BLOCK_M": 256,
      "BLOCK_N": 16,
      "BLOCK_K": 32,
      "BLOCK_C": 256,
      "NUM_KSPLIT": 2,
      "num_warps": 4,
      "num_stages": 1,
      "waves_per_eu": 1
    },
    "3854": {
      "BLOCK_M": 128,
      "BLOCK_N": 16,
      "BLOCK_K": 128,
      "BLOCK_C": 128,
      "NUM_KSPLIT": 4,
      "num_warps": 2,
      "num_stages": 1,
      "waves_per_eu": 2
    },
    "1435": {
      "BLOCK_M": 32,
      "BLOCK_N": 16,
      "BLOCK_K": 256,
      "BLOCK_C": 256,
      "NUM_KSPLIT": 8,
      "num_warps": 8,
      "num_stages": 1,
      "waves_per_eu": 1
    },
    "184": {
      "BLOCK_M": 32,
      "BLOCK_N": 16,
      "BLOCK_K": 32,
      "BLOCK_C": 64,
      "NUM_KSPLIT": 4,
      "num_warps": 2,
      "num_stages": 2,
      "waves_per_eu": 1
    },
    "235": {
      "BLOCK_M": 32,
      "BLOCK_N": 16,
      "BLOCK_K": 32,
      "BLOCK_C": 128,
      "NUM_KSPLIT": 2,
      "num_warps": 2,
      "num_stages": 1,
      "waves_per_eu": 1
    },
    "2625": {
      "BLOCK_M": 64,
      "BLOCK_N": 16,
      "BLOCK_K": 256,
      "BLOCK_C": 32,
      "NUM_KSPLIT": 2,
      "num_warps": 8,
      "num_stages": 2,
      "waves_per_eu": 0
    },
    "2448": {
      "BLOCK_M": 64,
      "BLOCK_N": 16,
      "BLOCK_K": 128,
      "BLOCK_C": 256,
      "NUM_KSPLIT": 1,
      "num_warps": 2,
      "num_stages": 1,
      "waves_per_eu": 0
    },
    "2769": {
      "BLOCK_M": 64,
      "BLOCK_N": 16,
      "BLOCK_K": 256,
      "BLOCK_C": 128,
      "NUM_KSPLIT": 2,
      "num_warps": 8,
      "num_stages": 2,
      "waves_per_eu": 0
    },
    "5643": {
      "BLOCK_M": 256,
      "BLOCK_N": 16,
      "BLOCK_K": 256,
      "BLOCK_C": 128,
      "NUM_KSPLIT": 2,
      "num_warps": 4,
      "num_stages": 2,
      "waves_per_eu": 0
    },
    "5613": {
      "BLOCK_M": 256,
      "BLOCK_N": 16,
      "BLOCK_K": 256,
      "BLOCK_C": 64,
      "NUM_KSPLIT": 8,
      "num_warps": 8,
      "num_stages": 2,
      "waves_per_eu": 0
    },
    "76": {
      "BLOCK_M": 32,
      "BLOCK_N": 16,
      "BLOCK_K": 32,
      "BLOCK_C": 32,
      "NUM_KSPLIT": 1,
      "num_warps": 2,
      "num_stages": 2,
      "waves_per_eu": 1
    },
    "4093": {
      "BLOCK_M": 128,
      "BLOCK_N": 16,
      "BLOCK_K": 256,
      "BLOCK_C": 32,
      "NUM_KSPLIT": 8,
      "num_warps": 4,
      "num_stages": 1,
      "waves_per_eu": 1
    },
    "1507": {
      "BLOCK_M": 64,
      "BLOCK_N": 16,
      "BLOCK_K": 32,
      "BLOCK_C": 16,
      "NUM_KSPLIT": 8,
      "num_warps": 8,
      "num_stages": 1,
      "waves_per_eu": 1
    },
    "5347": {
      "BLOCK_M": 256,
      "BLOCK_N": 16,
      "BLOCK_K": 128,
      "BLOCK_C": 256,
      "NUM_KSPLIT": 2,
      "num_warps": 2,
      "num_stages": 1,
      "waves_per_eu": 1
    },
    "1751": {
      "BLOCK_M": 64,
      "BLOCK_N": 16,
      "BLOCK_K": 32,
      "BLOCK_C": 256,
      "NUM_KSPLIT": 2,
      "num_warps": 2,
      "num_stages": 2,
      "waves_per_eu": 2
    },
    "2202": {
      "BLOCK_M": 64,
      "BLOCK_N": 16,
      "BLOCK_K": 128,
      "BLOCK_C": 16,
      "NUM_KSPLIT": 4,
      "num_warps": 4,
      "num_stages": 1,
      "waves_per_eu": 0
    },
    "1353": {
      "BLOCK_M": 32,
      "BLOCK_N": 16,
      "BLOCK_K": 256,
      "BLOCK_C": 128,
      "NUM_KSPLIT": 8,
      "num_warps": 2,
      "num_stages": 2,
      "waves_per_eu": 0
    },
    "1511": {
      "BLOCK_M": 64,
      "BLOCK_N": 16,
      "BLOCK_K": 32,
      "BLOCK_C": 16,
      "NUM_KSPLIT": 8,
      "num_warps": 8,
      "num_stages": 2,
      "waves_per_eu": 2
    },
    "2251": {
      "BLOCK_M": 64,
      "BLOCK_N": 16,
      "BLOCK_K": 128,
      "BLOCK_C": 32,
      "NUM_KSPLIT": 2,
      "num_warps": 2,
      "num_stages": 1,
      "waves_per_eu": 1
    },
    "633": {
      "BLOCK_M": 32,
      "BLOCK_N": 16,
      "BLOCK_K": 64,
      "BLOCK_C": 128,
      "NUM_KSPLIT": 8,
      "num_warps": 2,
      "num_stages": 2,
      "waves_per_eu": 0
    },
    "1298": {
      "BLOCK_M": 32,
      "BLOCK_N": 16,
      "BLOCK_K": 256,
      "BLOCK_C": 128,
      "NUM_KSPLIT": 1,
      "num_warps": 2,
      "num_stages": 1,
      "waves_per_eu": 2
    },
    "3699": {
      "BLOCK_M": 128,
      "BLOCK_N": 16,
      "BLOCK_K": 128,
      "BLOCK_C": 32,
      "NUM_KSPLIT": 2,
      "num_warps": 4,
      "num_stages": 2,
      "waves_per_eu": 0
    },
    "5597": {
      "BLOCK_M": 256,
      "BLOCK_N": 16,
      "BLOCK_K": 256,
      "BLOCK_C": 64,
      "NUM_KSPLIT": 4,
      "num_warps": 8,
      "num_stages": 2,
      "waves_per_eu": 2
    },
    "614": {
      "BLOCK_M": 32,
      "BLOCK_N": 16,
      "BLOCK_K": 64,
      "BLOCK_C": 128,
      "NUM_KSPLIT": 4,
      "num_warps": 2,
      "num_stages": 1,
      "waves_per_eu": 2
    },
    "5262": {
      "BLOCK_M": 256,
      "BLOCK_N": 16,
      "BLOCK_K": 128,
      "BLOCK_C": 128,
      "NUM_KSPLIT": 1,
      "num_warps": 4,
      "num_stages": 1,
      "waves_per_eu": 0
    },
    "3695": {
      "BLOCK_M": 128,
      "BLOCK_N": 16,
      "BLOCK_K": 128,
      "BLOCK_C": 32,
      "NUM_KSPLIT": 2,
      "num_warps": 2,
      "num_stages": 2,
      "waves_per_eu": 2
    },
    "653": {
      "BLOCK_M": 32,
      "BLOCK_N": 16,
      "BLOCK_K": 64,
      "BLOCK_C": 256,
      "NUM_KSPLIT": 1,
      "num_warps": 2,
      "num_stages": 2,
      "waves_per_eu": 2
    },
    "1312": {
      "BLOCK_M": 32,
      "BLOCK_N": 16,
      "BLOCK_K": 256,
      "BLOCK_C": 128,
      "NUM_KSPLIT": 1,
      "num_warps": 8,
      "num_stages": 2,
      "waves_per_eu": 1
    },
    "4997": {
      "BLOCK_M": 256,
      "BLOCK_N": 16,
      "BLOCK_K": 64,
      "BLOCK_C": 256,
      "NUM_KSPLIT": 2,
      "num_warps": 4,
      "num_stages": 2,
      "waves_per_eu": 2
    },
    "494": {
      "BLOCK_M": 32,
      "BLOCK_N": 16,
      "BLOCK_K": 64,
      "BLOCK_C": 32,
      "NUM_KSPLIT": 8,
      "num_warps": 4,
      "num_stages": 1,
      "waves_per_eu": 2
    },
    "5286": {
      "BLOCK_M": 256,
      "BLOCK_N": 16,
      "BLOCK_K": 128,
      "BLOCK_C": 128,
      "NUM_KSPLIT": 2,
      "num_warps": 8,
      "num_stages": 1,
      "waves_per_eu": 0
    },
    "2011": {
      "BLOCK_M": 64,
      "BLOCK_N": 16,
      "BLOCK_K": 64,
      "BLOCK_C": 64,
      "NUM_KSPLIT": 8,
      "num_warps": 8,
      "num_stages": 1,
      "waves_per_eu": 1
    },
    "1399": {
      "BLOCK_M": 32,
      "BLOCK_N": 16,
      "BLOCK_K": 256,
      "BLOCK_C": 256,
      "NUM_KSPLIT": 2,
      "num_warps": 8,
      "num_stages": 1,
      "waves_per_eu": 1
    },
    "4335": {
      "BLOCK_M": 256,
      "BLOCK_N": 16,
      "BLOCK_K": 32,
      "BLOCK_C": 16,
      "NUM_KSPLIT": 1,
      "num_warps": 8,
      "num_stages": 2,
      "waves_per_eu": 0
    },
    "526": {
      "BLOCK_M": 32,
      "BLOCK_N": 16,
      "BLOCK_K": 64,
      "BLOCK_C": 64,
      "NUM_KSPLIT": 2,
      "num_warps": 2,
      "num_stages": 2,
      "waves_per_eu": 1
    },
    "259": {
      "BLOCK_M": 32,
      "BLOCK_N": 16,
      "BLOCK_K": 32,
      "BLOCK_C": 128,
      "NUM_KSPLIT": 4,
      "num_warps": 4,
      "num_stages": 1,
      "waves_per_eu": 1
    },
    "4820": {
      "BLOCK_M": 256,
      "BLOCK_N": 16,
      "BLOCK_K": 64,
      "BLOCK_C": 32,
      "NUM_KSPLIT": 8,
      "num_warps": 8,
      "num_stages": 1,
      "waves_per_eu": 2
    },
    "22": {
      "BLOCK_M": 32,
      "BLOCK_N": 16,
      "BLOCK_K": 32,
      "BLOCK_C": 16,
      "NUM_KSPLIT": 2,
      "num_warps": 2,
      "num_stages": 2,
      "waves_per_eu": 1
    },
    "211": {
      "BLOCK_M": 32,
      "BLOCK_N": 16,
      "BLOCK_K": 32,
      "BLOCK_C": 64,
      "NUM_KSPLIT": 8,
      "num_warps": 8,
      "num_stages": 1,
      "waves_per_eu": 1
    },
    "950": {
      "BLOCK_M": 32,
      "BLOCK_N": 16,
      "BLOCK_K": 128,
      "BLOCK_C": 128,
      "NUM_KSPLIT": 1,
      "num_warps": 8,
      "num_stages": 1,
      "waves_per_eu": 2
    },
    "3521": {
      "BLOCK_M": 128,
      "BLOCK_N": 16,
      "BLOCK_K": 64,
      "BLOCK_C": 128,
      "NUM_KSPLIT": 8,
      "num_warps": 4,
      "num_stages": 2,
      "waves_per_eu": 2
    },
    "5465": {
      "BLOCK_M": 256,
      "BLOCK_N": 16,
      "BLOCK_K": 256,
      "BLOCK_C": 16,
      "NUM_KSPLIT": 8,
      "num_warps": 4,
      "num_stages": 2,
      "waves_per_eu": 2
    },
    "4042": {
      "BLOCK_M": 128,
      "BLOCK_N": 16,
      "BLOCK_K": 256,
      "BLOCK_C": 32,
      "NUM_KSPLIT": 1,
      "num_warps": 4,
      "num_stages": 2,
      "waves_per_eu": 1
    },
    "1153": {
      "BLOCK_M": 32,
      "BLOCK_N": 16,
      "BLOCK_K": 256,
      "BLOCK_C": 32,
      "NUM_KSPLIT": 1,
      "num_warps": 2,
      "num_stages": 1,
      "waves_per_eu": 1
    },
    "4132": {
      "BLOCK_M": 128,
      "BLOCK_N": 16,
      "BLOCK_K": 256,
      "BLOCK_C": 64,
      "NUM_KSPLIT": 2,
      "num_warps": 4,
      "num_stages": 2,
      "waves_per_eu": 1
    },
    "2660": {
      "BLOCK_M": 64,
      "BLOCK_N": 16,
      "BLOCK_K": 256,
      "BLOCK_C": 32,
      "NUM_KSPLIT": 8,
      "num_warps": 8,
      "num_stages": 1,
      "waves_per_eu": 2
    },
    "5749": {
      "BLOCK_M": 256,
      "BLOCK_N": 16,
      "BLOCK_K": 256,
      "BLOCK_C": 256,
      "NUM_KSPLIT": 8,
      "num_warps": 4,
      "num_stages": 1,
      "waves_per_eu": 1
    },
    "5353": {
      "BLOCK_M": 256,
      "BLOCK_N": 16,
      "BLOCK_K": 128,
      "BLOCK_C": 256,
      "NUM_KSPLIT": 2,
      "num_warps": 4,
      "num_stages": 1,
      "waves_per_eu": 1
    },
    "4211": {
      "BLOCK_M": 128,
      "BLOCK_N": 16,
      "BLOCK_K": 256,
      "BLOCK_C": 128,
      "NUM_KSPLIT": 2,
      "num_warps": 8,
      "num_stages": 2,
      "waves_per_eu": 2
    },
    "5566": {
      "BLOCK_M": 256,
      "BLOCK_N": 16,
      "BLOCK_K": 256,
      "BLOCK_C": 64,
      "NUM_KSPLIT": 2,
      "num_warps": 2,
      "num_stages": 2,
      "waves_per_eu": 1
    },
    "3384": {
      "BLOCK_M": 128,
      "BLOCK_N": 16,
      "BLOCK_K": 64,
      "BLOCK_C": 64,
      "NUM_KSPLIT": 1,
      "num_warps": 2,
      "num_stages": 1,
      "waves_per_eu": 0
    },
    "2042": {
      "BLOCK_M": 64,
      "BLOCK_N": 16,
      "BLOCK_K": 64,
      "BLOCK_C": 128,
      "NUM_KSPLIT": 2,
      "num_warps": 4,
      "num_stages": 1,
      "waves_per_eu": 2
    },
    "66": {
      "BLOCK_M": 32,
      "BLOCK_N": 16,
      "BLOCK_K": 32,
      "BLOCK_C": 16,
      "NUM_KSPLIT": 8,
      "num_warps": 8,
      "num_stages": 1,
      "waves_per_eu": 0
    },
    "5708": {
      "BLOCK_M": 256,
      "BLOCK_N": 16,
      "BLOCK_K": 256,
      "BLOCK_C": 256,
      "NUM_KSPLIT": 2,
      "num_warps": 2,
      "num_stages": 1,
      "waves_per_eu": 2
    },
    "5580": {
      "BLOCK_M": 256,
      "BLOCK_N": 16,
      "BLOCK_K": 256,
      "BLOCK_C": 64,
      "NUM_KSPLIT": 4,
      "num_warps": 2,
      "num_stages": 1,
      "waves_per_eu": 0
    },
    "4057": {
      "BLOCK_M": 128,
      "BLOCK_N": 16,
      "BLOCK_K": 256,
      "BLOCK_C": 32,
      "NUM_KSPLIT": 2,
      "num_warps": 4,
      "num_stages": 1,
      "waves_per_eu": 1
    },
    "828": {
      "BLOCK_M": 32,
      "BLOCK_N": 16,
      "BLOCK_K": 128,
      "BLOCK_C": 32,
      "NUM_KSPLIT": 4,
      "num_warps": 2,
      "num_stages": 1,
      "waves_per_eu": 0
    },
    "3899": {
      "BLOCK_M": 128,
      "BLOCK_N": 16,
      "BLOCK_K": 128,
      "BLOCK_C": 256,
      "NUM_KSPLIT": 1,
      "num_warps": 4,
      "num_stages": 2,
      "waves_per_eu": 2
    },
    "3937": {
      "BLOCK_M": 128,
      "BLOCK_N": 16,
      "BLOCK_K": 128,
      "BLOCK_C": 256,
      "NUM_KSPLIT": 4,
      "num_warps": 8,
      "num_stages": 1,
      "waves_per_eu": 1
    },
    "4379": {
      "BLOCK_M": 256,
      "BLOCK_N": 16,
      "BLOCK_K": 32,
      "BLOCK_C": 16,
      "NUM_KSPLIT": 8,
      "num_warps": 2,
      "num_stages": 2,
      "waves_per_eu": 2
    },
    "4674": {
      "BLOCK_M": 256,
      "BLOCK_N": 16,
      "BLOCK_K": 32,
      "BLOCK_C": 256,
      "NUM_KSPLIT": 8,
      "num_warps": 8,
      "num_stages": 1,
      "waves_per_eu": 0
    },
    "1582": {
      "BLOCK_M": 64,
      "BLOCK_N": 16,
      "BLOCK_K": 32,
      "BLOCK_C": 32,
      "NUM_KSPLIT": 8,
      "num_warps": 8,
      "num_stages": 2,
      "waves_per_eu": 1
    },
    "5066": {
      "BLOCK_M": 256,
      "BLOCK_N": 16,
      "BLOCK_K": 128,
      "BLOCK_C": 16,
      "NUM_KSPLIT": 2,
      "num_warps": 4,
      "num_stages": 1,
      "waves_per_eu": 2
    },
    "5219": {
      "BLOCK_M": 256,
      "BLOCK_N": 16,
      "BLOCK_K": 128,
      "BLOCK_C": 64,
      "NUM_KSPLIT": 2,
      "num_warps": 8,
      "num_stages": 2,
      "waves_per_eu": 2
    },
    "3847": {
      "BLOCK_M": 128,
      "BLOCK_N": 16,
      "BLOCK_K": 128,
      "BLOCK_C": 128,
      "NUM_KSPLIT": 2,
      "num_warps": 8,
      "num_stages": 1,
      "waves_per_eu": 1
    },
    "1606": {
      "BLOCK_M": 64,
      "BLOCK_N": 16,
      "BLOCK_K": 32,
      "BLOCK_C": 64,
      "NUM_KSPLIT": 2,
      "num_warps": 2,
      "num_stages": 2,
      "waves_per_eu": 1
    },
    "4249": {
      "BLOCK_M": 128,
      "BLOCK_N": 16,
      "BLOCK_K": 256,
      "BLOCK_C": 256,
      "NUM_KSPLIT": 1,
      "num_warps": 2,
      "num_stages": 1,
      "waves_per_eu": 1
    },
    "2508": {
      "BLOCK_M": 64,
      "BLOCK_N": 16,
      "BLOCK_K": 128,
      "BLOCK_C": 256,
      "NUM_KSPLIT": 8,
      "num_warps": 4,
      "num_stages": 1,
      "waves_per_eu": 0
    },
    "4558": {
      "BLOCK_M": 256,
      "BLOCK_N": 16,
      "BLOCK_K": 32,
      "BLOCK_C": 128,
      "NUM_KSPLIT": 2,
      "num_warps": 2,
      "num_stages": 2,
      "waves_per_eu": 1
    },
    "3915": {
      "BLOCK_M": 128,
      "BLOCK_N": 16,
      "BLOCK_K": 128,
      "BLOCK_C": 256,
      "NUM_KSPLIT": 2,
      "num_warps": 4,
      "num_stages": 2,
      "waves_per_eu": 0
    },
    "2424": {
      "BLOCK_M": 64,
      "BLOCK_N": 16,
      "BLOCK_K": 128,
      "BLOCK_C": 128,
      "NUM_KSPLIT": 4,
      "num_warps": 8,
      "num_stages": 1,
      "waves_per_eu": 0
    },
    "4112": {
      "BLOCK_M": 128,
      "BLOCK_N": 16,
      "BLOCK_K": 256,
      "BLOCK_C": 64,
      "NUM_KSPLIT": 1,
      "num_warps": 4,
      "num_stages": 1,
      "waves_per_eu": 2
    },
    "1360": {
      "BLOCK_M": 32,
      "BLOCK_N": 16,
      "BLOCK_K": 256,
      "BLOCK_C": 128,
      "NUM_KSPLIT": 8,
      "num_warps": 4,
      "num_stages": 2,
      "waves_per_eu": 1
    },
    "2188": {
      "BLOCK_M": 64,
      "BLOCK_N": 16,
      "BLOCK_K": 128,
      "BLOCK_C": 16,
      "NUM_KSPLIT": 2,
      "num_warps": 4,
      "num_stages": 2,
      "waves_per_eu": 1
    },
    "3314": {
      "BLOCK_M": 128,
      "BLOCK_N": 16,
      "BLOCK_K": 64,
      "BLOCK_C": 32,
      "NUM_KSPLIT": 1,
      "num_warps": 2,
      "num_stages": 1,
      "waves_per_eu": 2
    },
    "5487": {
      "BLOCK_M": 256,
      "BLOCK_N": 16,
      "BLOCK_K": 256,
      "BLOCK_C": 32,
      "NUM_KSPLIT": 1,
      "num_warps": 8,
      "num_stages": 2,
      "waves_per_eu": 0
    },
    "761": {
      "BLOCK_M": 32,
      "BLOCK_N": 16,
      "BLOCK_K": 128,
      "BLOCK_C": 16,
      "NUM_KSPLIT": 4,
      "num_warps": 2,
      "num_stages": 2,
      "waves_per_eu": 2
    },
    "3885": {
      "BLOCK_M": 128,
      "BLOCK_N": 16,
      "BLOCK_K": 128,
      "BLOCK_C": 128,
      "NUM_KSPLIT": 8,
      "num_warps": 8,
      "num_stages": 2,
      "waves_per_eu": 0
    },
    "3125": {
      "BLOCK_M": 128,
      "BLOCK_N": 16,
      "BLOCK_K": 32,
      "BLOCK_C": 128,
      "NUM_KSPLIT": 2,
      "num_warps": 4,
      "num_stages": 2,
      "waves_per_eu": 2
    },
    "2235": {
      "BLOCK_M": 64,
      "BLOCK_N": 16,
      "BLOCK_K": 128,
      "BLOCK_C": 32,
      "NUM_KSPLIT": 1,
      "num_warps": 2,
      "num_stages": 2,
      "waves_per_eu": 0
    },
    "616": {
      "BLOCK_M": 32,
      "BLOCK_N": 16,
      "BLOCK_K": 64,
      "BLOCK_C": 128,
      "NUM_KSPLIT": 4,
      "num_warps": 2,
      "num_stages": 2,
      "waves_per_eu": 1
    },
    "943": {
      "BLOCK_M": 32,
      "BLOCK_N": 16,
      "BLOCK_K": 128,
      "BLOCK_C": 128,
      "NUM_KSPLIT": 1,
      "num_warps": 4,
      "num_stages": 1,
      "waves_per_eu": 1
    },
    "1872": {
      "BLOCK_M": 64,
      "BLOCK_N": 16,
      "BLOCK_K": 64,
      "BLOCK_C": 32,
      "NUM_KSPLIT": 1,
      "num_warps": 2,
      "num_stages": 1,
      "waves_per_eu": 0
    },
    "4206": {
      "BLOCK_M": 128,
      "BLOCK_N": 16,
      "BLOCK_K": 256,
      "BLOCK_C": 128,
      "NUM_KSPLIT": 2,
      "num_warps": 8,
      "num_stages": 1,
      "waves_per_eu": 0
    },
    "3199": {
      "BLOCK_M": 128,
      "BLOCK_N": 16,
      "BLOCK_K": 32,
      "BLOCK_C": 256,
      "NUM_KSPLIT": 2,
      "num_warps": 8,
      "num_stages": 1,
      "waves_per_eu": 1
    },
    "294": {
      "BLOCK_M": 32,
      "BLOCK_N": 16,
      "BLOCK_K": 32,
      "BLOCK_C": 256,
      "NUM_KSPLIT": 1,
      "num_warps": 4,
      "num_stages": 1,
      "waves_per_eu": 0
    },
    "1886": {
      "BLOCK_M": 64,
      "BLOCK_N": 16,
      "BLOCK_K": 64,
      "BLOCK_C": 32,
      "NUM_KSPLIT": 1,
      "num_warps": 8,
      "num_stages": 1,
      "waves_per_eu": 2
    },
    "2890": {
      "BLOCK_M": 128,
      "BLOCK_N": 16,
      "BLOCK_K": 32,
      "BLOCK_C": 16,
      "NUM_KSPLIT": 1,
      "num_warps": 4,
      "num_stages": 2,
      "waves_per_eu": 1
    },
    "5283": {
      "BLOCK_M": 256,
      "BLOCK_N": 16,
      "BLOCK_K": 128,
      "BLOCK_C": 128,
      "NUM_KSPLIT": 2,
      "num_warps": 4,
      "num_stages": 2,
      "waves_per_eu": 0
    },
    "347": {
      "BLOCK_M": 32,
      "BLOCK_N": 16,
      "BLOCK_K": 32,
      "BLOCK_C": 256,
      "NUM_KSPLIT": 8,
      "num_warps": 2,
      "num_stages": 2,
      "waves_per_eu": 2
    },
    "5127": {
      "BLOCK_M": 256,
      "BLOCK_N": 16,
      "BLOCK_K": 128,
      "BLOCK_C": 32,
      "NUM_KSPLIT": 1,
      "num_warps": 8,
      "num_stages": 2,
      "waves_per_eu": 0
    },
    "3181": {
      "BLOCK_M": 128,
      "BLOCK_N": 16,
      "BLOCK_K": 32,
      "BLOCK_C": 256,
      "NUM_KSPLIT": 1,
      "num_warps": 8,
      "num_stages": 1,
      "waves_per_eu": 1
    },
    "136": {
      "BLOCK_M": 32,
      "BLOCK_N": 16,
      "BLOCK_K": 32,
      "BLOCK_C": 32,
      "NUM_KSPLIT": 8,
      "num_warps": 4,
      "num_stages": 2,
      "waves_per_eu": 1
    },
    "4933": {
      "BLOCK_M": 256,
      "BLOCK_N": 16,
      "BLOCK_K": 64,
      "BLOCK_C": 128,
      "NUM_KSPLIT": 4,
      "num_warps": 2,
      "num_stages": 1,
      "waves_per_eu": 1
    },
    "3085": {
      "BLOCK_M": 128,
      "BLOCK_N": 16,
      "BLOCK_K": 32,
      "BLOCK_C": 64,
      "NUM_KSPLIT": 8,
      "num_warps": 4,
      "num_stages": 1,
      "waves_per_eu": 1
    },
    "4810": {
      "BLOCK_M": 256,
      "BLOCK_N": 16,
      "BLOCK_K": 64,
      "BLOCK_C": 32,
      "NUM_KSPLIT": 8,
      "num_warps": 2,
      "num_stages": 2,
      "waves_per_eu": 1
    },
    "814": {
      "BLOCK_M": 32,
      "BLOCK_N": 16,
      "BLOCK_K": 128,
      "BLOCK_C": 32,
      "NUM_KSPLIT": 2,
      "num_warps": 2,
      "num_stages": 2,
      "waves_per_eu": 1
    },
    "3073": {
      "BLOCK_M": 128,
      "BLOCK_N": 16,
      "BLOCK_K": 32,
      "BLOCK_C": 64,
      "NUM_KSPLIT": 4,
      "num_warps": 8,
      "num_stages": 1,
      "waves_per_eu": 1
    },
    "4080": {
      "BLOCK_M": 128,
      "BLOCK_N": 16,
      "BLOCK_K": 256,
      "BLOCK_C": 32,
      "NUM_KSPLIT": 4,
      "num_warps": 8,
      "num_stages": 1,
      "waves_per_eu": 0
    },
    "2621": {
      "BLOCK_M": 64,
      "BLOCK_N": 16,
      "BLOCK_K": 256,
      "BLOCK_C": 32,
      "NUM_KSPLIT": 2,
      "num_warps": 4,
      "num_stages": 2,
      "waves_per_eu": 2
    },
    "1555": {
      "BLOCK_M": 64,
      "BLOCK_N": 16,
      "BLOCK_K": 32,
      "BLOCK_C": 32,
      "NUM_KSPLIT": 4,
      "num_warps": 4,
      "num_stages": 1,
      "waves_per_eu": 1
    },
    "2832": {
      "BLOCK_M": 64,
      "BLOCK_N": 16,
      "BLOCK_K": 256,
      "BLOCK_C": 256,
      "NUM_KSPLIT": 2,
      "num_warps": 4,
      "num_stages": 1,
      "waves_per_eu": 0
    },
    "2842": {
      "BLOCK_M": 64,
      "BLOCK_N": 16,
      "BLOCK_K": 256,
      "BLOCK_C": 256,
      "NUM_KSPLIT": 2,
      "num_warps": 8,
      "num_stages": 2,
      "waves_per_eu": 1
    },
    "5263": {
      "BLOCK_M": 256,
      "BLOCK_N": 16,
      "BLOCK_K": 128,
      "BLOCK_C": 128,
      "NUM_KSPLIT": 1,
      "num_warps": 4,
      "num_stages": 1,
      "waves_per_eu": 1
    },
    "251": {
      "BLOCK_M": 32,
      "BLOCK_N": 16,
      "BLOCK_K": 32,
      "BLOCK_C": 128,
      "NUM_KSPLIT": 2,
      "num_warps": 8,
      "num_stages": 2,
      "waves_per_eu": 2
    },
    "5167": {
      "BLOCK_M": 256,
      "BLOCK_N": 16,
      "BLOCK_K": 128,
      "BLOCK_C": 32,
      "NUM_KSPLIT": 8,
      "num_warps": 2,
      "num_stages": 1,
      "waves_per_eu": 1
    },
    "1001": {
      "BLOCK_M": 32,
      "BLOCK_N": 16,
      "BLOCK_K": 128,
      "BLOCK_C": 128,
      "NUM_KSPLIT": 8,
      "num_warps": 4,
      "num_stages": 2,
      "waves_per_eu": 2
    },
    "1651": {
      "BLOCK_M": 64,
      "BLOCK_N": 16,
      "BLOCK_K": 32,
      "BLOCK_C": 64,
      "NUM_KSPLIT": 8,
      "num_warps": 8,
      "num_stages": 1,
      "waves_per_eu": 1
    },
    "2526": {
      "BLOCK_M": 64,
      "BLOCK_N": 16,
      "BLOCK_K": 256,
      "BLOCK_C": 16,
      "NUM_KSPLIT": 1,
      "num_warps": 4,
      "num_stages": 1,
      "waves_per_eu": 0
    },
    "1957": {
      "BLOCK_M": 64,
      "BLOCK_N": 16,
      "BLOCK_K": 64,
      "BLOCK_C": 64,
      "NUM_KSPLIT": 1,
      "num_warps": 8,
      "num_stages": 1,
      "waves_per_eu": 1
    },
    "5435": {
      "BLOCK_M": 256,
      "BLOCK_N": 16,
      "BLOCK_K": 256,
      "BLOCK_C": 16,
      "NUM_KSPLIT": 2,
      "num_warps": 8,
      "num_stages": 2,
      "waves_per_eu": 2
    },
    "5256": {
      "BLOCK_M": 256,
      "BLOCK_N": 16,
      "BLOCK_K": 128,
      "BLOCK_C": 128,
      "NUM_KSPLIT": 1,
      "num_warps": 2,
      "num_stages": 1,
      "waves_per_eu": 0
    },
    "546": {
      "BLOCK_M": 32,
      "BLOCK_N": 16,
      "BLOCK_K": 64,
      "BLOCK_C": 64,
      "NUM_KSPLIT": 4,
      "num_warps": 4,
      "num_stages": 1,
      "waves_per_eu": 0
    },
    "5382": {
      "BLOCK_M": 256,
      "BLOCK_N": 16,
      "BLOCK_K": 128,
      "BLOCK_C": 256,
      "NUM_KSPLIT": 8,
      "num_warps": 2,
      "num_stages": 1,
      "waves_per_eu": 0
    },
    "1885": {
      "BLOCK_M": 64,
      "BLOCK_N": 16,
      "BLOCK_K": 64,
      "BLOCK_C": 32,
      "NUM_KSPLIT": 1,
      "num_warps": 8,
      "num_stages": 1,
      "waves_per_eu": 1
    },
    "2387": {
      "BLOCK_M": 64,
      "BLOCK_N": 16,
      "BLOCK_K": 128,
      "BLOCK_C": 128,
      "NUM_KSPLIT": 1,
      "num_warps": 4,
      "num_stages": 2,
      "waves_per_eu": 2
    },
    "3888": {
      "BLOCK_M": 128,
      "BLOCK_N": 16,
      "BLOCK_K": 128,
      "BLOCK_C": 256,
      "NUM_KSPLIT": 1,
      "num_warps": 2,
      "num_stages": 1,
      "waves_per_eu": 0
    },
    "2927": {
      "BLOCK_M": 128,
      "BLOCK_N": 16,
      "BLOCK_K": 32,
      "BLOCK_C": 16,
      "NUM_KSPLIT": 4,
      "num_warps": 4,
      "num_stages": 2,
      "waves_per_eu": 2
    },
    "4914": {
      "BLOCK_M": 256,
      "BLOCK_N": 16,
      "BLOCK_K": 64,
      "BLOCK_C": 128,
      "NUM_KSPLIT": 2,
      "num_warps": 2,
      "num_stages": 1,
      "waves_per_eu": 0
    },
    "2742": {
      "BLOCK_M": 64,
      "BLOCK_N": 16,
      "BLOCK_K": 256,
      "BLOCK_C": 128,
      "NUM_KSPLIT": 1,
      "num_warps": 4,
      "num_stages": 1,
      "waves_per_eu": 0
    },
    "5738": {
      "BLOCK_M": 256,
      "BLOCK_N": 16,
      "BLOCK_K": 256,
      "BLOCK_C": 256,
      "NUM_KSPLIT": 4,
      "num_warps": 8,
      "num_stages": 1,
      "waves_per_eu": 2
    },
    "4064": {
      "BLOCK_M": 128,
      "BLOCK_N": 16,
      "BLOCK_K": 256,
      "BLOCK_C": 32,
      "NUM_KSPLIT": 2,
      "num_warps": 8,
      "num_stages": 1,
      "waves_per_eu": 2
    },
    "4320": {
      "BLOCK_M": 256,
      "BLOCK_N": 16,
      "BLOCK_K": 32,
      "BLOCK_C": 16,
      "NUM_KSPLIT": 1,
      "num_warps": 2,
      "num_stages": 1,
      "waves_per_eu": 0
    },
    "5310": {
      "BLOCK_M": 256,
      "BLOCK_N": 16,
      "BLOCK_K": 128,
      "BLOCK_C": 128,
      "NUM_KSPLIT": 8,
      "num_warps": 2,
      "num_stages": 1,
      "waves_per_eu": 0
    },
    "2290": {
      "BLOCK_M": 64,
      "BLOCK_N": 16,
      "BLOCK_K": 128,
      "BLOCK_C": 32,
      "NUM_KSPLIT": 8,
      "num_warps": 2,
      "num_stages": 2,
      "waves_per_eu": 1
    },
    "520": {
      "BLOCK_M": 32,
      "BLOCK_N": 16,
      "BLOCK_K": 64,
      "BLOCK_C": 64,
      "NUM_KSPLIT": 1,
      "num_warps": 8,
      "num_stages": 2,
      "waves_per_eu": 1
    },
    "1892": {
      "BLOCK_M": 64,
      "BLOCK_N": 16,
      "BLOCK_K": 64,
      "BLOCK_C": 32,
      "NUM_KSPLIT": 2,
      "num_warps": 2,
      "num_stages": 1,
      "waves_per_eu": 2
    },
    "85": {
      "BLOCK_M": 32,
      "BLOCK_N": 16,
      "BLOCK_K": 32,
      "BLOCK_C": 32,
      "NUM_KSPLIT": 1,
      "num_warps": 8,
      "num_stages": 1,
      "waves_per_eu": 1
    },
    "2425": {
      "BLOCK_M": 64,
      "BLOCK_N": 16,
      "BLOCK_K": 128,
      "BLOCK_C": 128,
      "NUM_KSPLIT": 4,
      "num_warps": 8,
      "num_stages": 1,
      "waves_per_eu": 1
    },
    "5288": {
      "BLOCK_M": 256,
      "BLOCK_N": 16,
      "BLOCK_K": 128,
      "BLOCK_C": 128,
      "NUM_KSPLIT": 2,
      "num_warps": 8,
      "num_stages": 1,
      "waves_per_eu": 2
    },
    "3345": {
      "BLOCK_M": 128,
      "BLOCK_N": 16,
      "BLOCK_K": 64,
      "BLOCK_C": 32,
      "NUM_KSPLIT": 2,
      "num_warps": 8,
      "num_stages": 2,
      "waves_per_eu": 0
    },
    "5509": {
      "BLOCK_M": 256,
      "BLOCK_N": 16,
      "BLOCK_K": 256,
      "BLOCK_C": 32,
      "NUM_KSPLIT": 4,
      "num_warps": 2,
      "num_stages": 1,
      "waves_per_eu": 1
    },
    "1604": {
      "BLOCK_M": 64,
      "BLOCK_N": 16,
      "BLOCK_K": 32,
      "BLOCK_C": 64,
      "NUM_KSPLIT": 2,
      "num_warps": 2,
      "num_stages": 1,
      "waves_per_eu": 2
    },
    "5670": {
      "BLOCK_M": 256,
      "BLOCK_N": 16,
      "BLOCK_K": 256,
      "BLOCK_C": 128,
      "NUM_KSPLIT": 8,
      "num_warps": 2,
      "num_stages": 1,
      "waves_per_eu": 0
    },
    "4410": {
      "BLOCK_M": 256,
      "BLOCK_N": 16,
      "BLOCK_K": 32,
      "BLOCK_C": 32,
      "NUM_KSPLIT": 2,
      "num_warps": 2,
      "num_stages": 1,
      "waves_per_eu": 0
    },
    "2198": {
      "BLOCK_M": 64,
      "BLOCK_N": 16,
      "BLOCK_K": 128,
      "BLOCK_C": 16,
      "NUM_KSPLIT": 4,
      "num_warps": 2,
      "num_stages": 1,
      "waves_per_eu": 2
    },
    "1439": {
      "BLOCK_M": 32,
      "BLOCK_N": 16,
      "BLOCK_K": 256,
      "BLOCK_C": 256,
      "NUM_KSPLIT": 8,
      "num_warps": 8,
      "num_stages": 2,
      "waves_per_eu": 2
    },
    "2412": {
      "BLOCK_M": 64,
      "BLOCK_N": 16,
      "BLOCK_K": 128,
      "BLOCK_C": 128,
      "NUM_KSPLIT": 4,
      "num_warps": 2,
      "num_stages": 1,
      "waves_per_eu": 0
    },
    "2866": {
      "BLOCK_M": 64,
      "BLOCK_N": 16,
      "BLOCK_K": 256,
      "BLOCK_C": 256,
      "NUM_KSPLIT": 8,
      "num_warps": 2,
      "num_stages": 2,
      "waves_per_eu": 1
    },
    "2372": {
      "BLOCK_M": 64,
      "BLOCK_N": 16,
      "BLOCK_K": 128,
      "BLOCK_C": 64,
      "NUM_KSPLIT": 8,
      "num_warps": 8,
      "num_stages": 1,
      "waves_per_eu": 2
    },
    "5125": {
      "BLOCK_M": 256,
      "BLOCK_N": 16,
      "BLOCK_K": 128,
      "BLOCK_C": 32,
      "NUM_KSPLIT": 1,
      "num_warps": 8,
      "num_stages": 1,
      "waves_per_eu": 1
    },
    "2597": {
      "BLOCK_M": 64,
      "BLOCK_N": 16,
      "BLOCK_K": 256,
      "BLOCK_C": 32,
      "NUM_KSPLIT": 1,
      "num_warps": 2,
      "num_stages": 2,
      "waves_per_eu": 2
    },
    "3758": {
      "BLOCK_M": 128,
      "BLOCK_N": 16,
      "BLOCK_K": 128,
      "BLOCK_C": 64,
      "NUM_KSPLIT": 1,
      "num_warps": 8,
      "num_stages": 1,
      "waves_per_eu": 2
    },
    "1822": {
      "BLOCK_M": 64,
      "BLOCK_N": 16,
      "BLOCK_K": 64,
      "BLOCK_C": 16,
      "NUM_KSPLIT": 2,
      "num_warps": 2,
      "num_stages": 2,
      "waves_per_eu": 1
    },
    "2900": {
      "BLOCK_M": 128,
      "BLOCK_N": 16,
      "BLOCK_K": 32,
      "BLOCK_C": 16,
      "NUM_KSPLIT": 2,
      "num_warps": 2,
      "num_stages": 1,
      "waves_per_eu": 2
    },
    "2364": {
      "BLOCK_M": 64,
      "BLOCK_N": 16,
      "BLOCK_K": 128,
      "BLOCK_C": 64,
      "NUM_KSPLIT": 8,
      "num_warps": 4,
      "num_stages": 1,
      "waves_per_eu": 0
    },
    "4286": {
      "BLOCK_M": 128,
      "BLOCK_N": 16,
      "BLOCK_K": 256,
      "BLOCK_C": 256,
      "NUM_KSPLIT": 4,
      "num_warps": 2,
      "num_stages": 1,
      "waves_per_eu": 2
    },
    "5014": {
      "BLOCK_M": 256,
      "BLOCK_N": 16,
      "BLOCK_K": 64,
      "BLOCK_C": 256,
      "NUM_KSPLIT": 4,
      "num_warps": 4,
      "num_stages": 2,
      "waves_per_eu": 1
    },
    "5318": {
      "BLOCK_M": 256,
      "BLOCK_N": 16,
      "BLOCK_K": 128,
      "BLOCK_C": 128,
      "NUM_KSPLIT": 8,
      "num_warps": 4,
      "num_stages": 1,
      "waves_per_eu": 2
    },
    "127": {
      "BLOCK_M": 32,
      "BLOCK_N": 16,
      "BLOCK_K": 32,
      "BLOCK_C": 32,
      "NUM_KSPLIT": 8,
      "num_warps": 2,
      "num_stages": 1,
      "waves_per_eu": 1
    },
    "885": {
      "BLOCK_M": 32,
      "BLOCK_N": 16,
      "BLOCK_K": 128,
      "BLOCK_C": 64,
      "NUM_KSPLIT": 2,
      "num_warps": 2,
      "num_stages": 2,
      "waves_per_eu": 0
    },
    "4077": {
      "BLOCK_M": 128,
      "BLOCK_N": 16,
      "BLOCK_K": 256,
      "BLOCK_C": 32,
      "NUM_KSPLIT": 4,
      "num_warps": 4,
      "num_stages": 2,
      "waves_per_eu": 0
    },
    "5108": {
      "BLOCK_M": 256,
      "BLOCK_N": 16,
      "BLOCK_K": 128,
      "BLOCK_C": 16,
      "NUM_KSPLIT": 8,
      "num_warps": 8,
      "num_stages": 1,
      "waves_per_eu": 2
    },
    "5001": {
      "BLOCK_M": 256,
      "BLOCK_N": 16,
      "BLOCK_K": 64,
      "BLOCK_C": 256,
      "NUM_KSPLIT": 2,
      "num_warps": 8,
      "num_stages": 2,
      "waves_per_eu": 0
    },
    "4056": {
      "BLOCK_M": 128,
      "BLOCK_N": 16,
      "BLOCK_K": 256,
      "BLOCK_C": 32,
      "NUM_KSPLIT": 2,
      "num_warps": 4,
      "num_stages": 1,
      "waves_per_eu": 0
    },
    "5381": {
      "BLOCK_M": 256,
      "BLOCK_N": 16,
      "BLOCK_K": 128,
      "BLOCK_C": 256,
      "NUM_KSPLIT": 4,
      "num_warps": 8,
      "num_stages": 2,
      "waves_per_eu": 2
    },
    "1531": {
      "BLOCK_M": 64,
      "BLOCK_N": 16,
      "BLOCK_K": 32,
      "BLOCK_C": 32,
      "NUM_KSPLIT": 2,
      "num_warps": 2,
      "num_stages": 1,
      "waves_per_eu": 1
    },
    "4127": {
      "BLOCK_M": 128,
      "BLOCK_N": 16,
      "BLOCK_K": 256,
      "BLOCK_C": 64,
      "NUM_KSPLIT": 2,
      "num_warps": 2,
      "num_stages": 2,
      "waves_per_eu": 2
    },
    "3157": {
      "BLOCK_M": 128,
      "BLOCK_N": 16,
      "BLOCK_K": 32,
      "BLOCK_C": 128,
      "NUM_KSPLIT": 8,
      "num_warps": 4,
      "num_stages": 1,
      "waves_per_eu": 1
    },
    "3554": {
      "BLOCK_M": 128,
      "BLOCK_N": 16,
      "BLOCK_K": 64,
      "BLOCK_C": 256,
      "NUM_KSPLIT": 2,
      "num_warps": 4,
      "num_stages": 1,
      "waves_per_eu": 2
    },
    "2483": {
      "BLOCK_M": 64,
      "BLOCK_N": 16,
      "BLOCK_K": 128,
      "BLOCK_C": 256,
      "NUM_KSPLIT": 2,
      "num_warps": 8,
      "num_stages": 2,
      "waves_per_eu": 2
    },
    "5758": {
      "BLOCK_M": 256,
      "BLOCK_N": 16,
      "BLOCK_K": 256,
      "BLOCK_C": 256,
      "NUM_KSPLIT": 8,
      "num_warps": 8,
      "num_stages": 2,
      "waves_per_eu": 1
    },
    "5130": {
      "BLOCK_M": 256,
      "BLOCK_N": 16,
      "BLOCK_K": 128,
      "BLOCK_C": 32,
      "NUM_KSPLIT": 2,
      "num_warps": 2,
      "num_stages": 1,
      "waves_per_eu": 0
    },
    "775": {
      "BLOCK_M": 32,
      "BLOCK_N": 16,
      "BLOCK_K": 128,
      "BLOCK_C": 16,
      "NUM_KSPLIT": 8,
      "num_warps": 2,
      "num_stages": 1,
      "waves_per_eu": 1
    },
    "5486": {
      "BLOCK_M": 256,
      "BLOCK_N": 16,
      "BLOCK_K": 256,
      "BLOCK_C": 32,
      "NUM_KSPLIT": 1,
      "num_warps": 8,
      "num_stages": 1,
      "waves_per_eu": 2
    },
    "1492": {
      "BLOCK_M": 64,
      "BLOCK_N": 16,
      "BLOCK_K": 32,
      "BLOCK_C": 16,
      "NUM_KSPLIT": 4,
      "num_warps": 8,
      "num_stages": 2,
      "waves_per_eu": 1
    },
    "3274": {
      "BLOCK_M": 128,
      "BLOCK_N": 16,
      "BLOCK_K": 64,
      "BLOCK_C": 16,
      "NUM_KSPLIT": 2,
      "num_warps": 8,
      "num_stages": 2,
      "waves_per_eu": 1
    },
    "2609": {
      "BLOCK_M": 64,
      "BLOCK_N": 16,
      "BLOCK_K": 256,
      "BLOCK_C": 32,
      "NUM_KSPLIT": 1,
      "num_warps": 8,
      "num_stages": 2,
      "waves_per_eu": 2
    },
    "2203": {
      "BLOCK_M": 64,
      "BLOCK_N": 16,
      "BLOCK_K": 128,
      "BLOCK_C": 16,
      "NUM_KSPLIT": 4,
      "num_warps": 4,
      "num_stages": 1,
      "waves_per_eu": 1
    },
    "34": {
      "BLOCK_M": 32,
      "BLOCK_N": 16,
      "BLOCK_K": 32,
      "BLOCK_C": 16,
      "NUM_KSPLIT": 2,
      "num_warps": 8,
      "num_stages": 2,
      "waves_per_eu": 1
    },
    "2297": {
      "BLOCK_M": 64,
      "BLOCK_N": 16,
      "BLOCK_K": 128,
      "BLOCK_C": 32,
      "NUM_KSPLIT": 8,
      "num_warps": 4,
      "num_stages": 2,
      "waves_per_eu": 2
    },
    "3974": {
      "BLOCK_M": 128,
      "BLOCK_N": 16,
      "BLOCK_K": 256,
      "BLOCK_C": 16,
      "NUM_KSPLIT": 1,
      "num_warps": 8,
      "num_stages": 1,
      "waves_per_eu": 2
    },
    "1293": {
      "BLOCK_M": 32,
      "BLOCK_N": 16,
      "BLOCK_K": 256,
      "BLOCK_C": 64,
      "NUM_KSPLIT": 8,
      "num_warps": 8,
      "num_stages": 2,
      "waves_per_eu": 0
    },
    "4343": {
      "BLOCK_M": 256,
      "BLOCK_N": 16,
      "BLOCK_K": 32,
      "BLOCK_C": 16,
      "NUM_KSPLIT": 2,
      "num_warps": 2,
      "num_stages": 2,
      "waves_per_eu": 2
    },
    "2350": {
      "BLOCK_M": 64,
      "BLOCK_N": 16,
      "BLOCK_K": 128,
      "BLOCK_C": 64,
      "NUM_KSPLIT": 4,
      "num_warps": 4,
      "num_stages": 2,
      "waves_per_eu": 1
    },
    "4084": {
      "BLOCK_M": 128,
      "BLOCK_N": 16,
      "BLOCK_K": 256,
      "BLOCK_C": 32,
      "NUM_KSPLIT": 4,
      "num_warps": 8,
      "num_stages": 2,
      "waves_per_eu": 1
    },
    "3494": {
      "BLOCK_M": 128,
      "BLOCK_N": 16,
      "BLOCK_K": 64,
      "BLOCK_C": 128,
      "NUM_KSPLIT": 4,
      "num_warps": 2,
      "num_stages": 1,
      "waves_per_eu": 2
    },
    "4945": {
      "BLOCK_M": 256,
      "BLOCK_N": 16,
      "BLOCK_K": 64,
      "BLOCK_C": 128,
      "NUM_KSPLIT": 4,
      "num_warps": 8,
      "num_stages": 1,
      "waves_per_eu": 1
    },
    "417": {
      "BLOCK_M": 32,
      "BLOCK_N": 16,
      "BLOCK_K": 64,
      "BLOCK_C": 16,
      "NUM_KSPLIT": 8,
      "num_warps": 2,
      "num_stages": 2,
      "waves_per_eu": 0
    },
    "2670": {
      "BLOCK_M": 64,
      "BLOCK_N": 16,
      "BLOCK_K": 256,
      "BLOCK_C": 64,
      "NUM_KSPLIT": 1,
      "num_warps": 4,
      "num_stages": 1,
      "waves_per_eu": 0
    },
    "1960": {
      "BLOCK_M": 64,
      "BLOCK_N": 16,
      "BLOCK_K": 64,
      "BLOCK_C": 64,
      "NUM_KSPLIT": 1,
      "num_warps": 8,
      "num_stages": 2,
      "waves_per_eu": 1
    },
    "3343": {
      "BLOCK_M": 128,
      "BLOCK_N": 16,
      "BLOCK_K": 64,
      "BLOCK_C": 32,
      "NUM_KSPLIT": 2,
      "num_warps": 8,
      "num_stages": 1,
      "waves_per_eu": 1
    },
    "3055": {
      "BLOCK_M": 128,
      "BLOCK_N": 16,
      "BLOCK_K": 32,
      "BLOCK_C": 64,
      "NUM_KSPLIT": 2,
      "num_warps": 8,
      "num_stages": 1,
      "waves_per_eu": 1
    },
    "5418": {
      "BLOCK_M": 256,
      "BLOCK_N": 16,
      "BLOCK_K": 256,
      "BLOCK_C": 16,
      "NUM_KSPLIT": 2,
      "num_warps": 2,
      "num_stages": 1,
      "waves_per_eu": 0
    },
    "4469": {
      "BLOCK_M": 256,
      "BLOCK_N": 16,
      "BLOCK_K": 32,
      "BLOCK_C": 64,
      "NUM_KSPLIT": 1,
      "num_warps": 2,
      "num_stages": 2,
      "waves_per_eu": 2
    },
    "1398": {
      "BLOCK_M": 32,
      "BLOCK_N": 16,
      "BLOCK_K": 256,
      "BLOCK_C": 256,
      "NUM_KSPLIT": 2,
      "num_warps": 8,
      "num_stages": 1,
      "waves_per_eu": 0
    },
    "3354": {
      "BLOCK_M": 128,
      "BLOCK_N": 16,
      "BLOCK_K": 64,
      "BLOCK_C": 32,
      "NUM_KSPLIT": 4,
      "num_warps": 4,
      "num_stages": 1,
      "waves_per_eu": 0
    },
    "3194": {
      "BLOCK_M": 128,
      "BLOCK_N": 16,
      "BLOCK_K": 32,
      "BLOCK_C": 256,
      "NUM_KSPLIT": 2,
      "num_warps": 4,
      "num_stages": 1,
      "waves_per_eu": 2
    },
    "3763": {
      "BLOCK_M": 128,
      "BLOCK_N": 16,
      "BLOCK_K": 128,
      "BLOCK_C": 64,
      "NUM_KSPLIT": 2,
      "num_warps": 2,
      "num_stages": 1,
      "waves_per_eu": 1
    },
    "566": {
      "BLOCK_M": 32,
      "BLOCK_N": 16,
      "BLOCK_K": 64,
      "BLOCK_C": 64,
      "NUM_KSPLIT": 8,
      "num_warps": 4,
      "num_stages": 1,
      "waves_per_eu": 2
    },
    "2479": {
      "BLOCK_M": 64,
      "BLOCK_N": 16,
      "BLOCK_K": 128,
      "BLOCK_C": 256,
      "NUM_KSPLIT": 2,
      "num_warps": 8,
      "num_stages": 1,
      "waves_per_eu": 1
    },
    "3060": {
      "BLOCK_M": 128,
      "BLOCK_N": 16,
      "BLOCK_K": 32,
      "BLOCK_C": 64,
      "NUM_KSPLIT": 4,
      "num_warps": 2,
      "num_stages": 1,
      "waves_per_eu": 0
    },
    "1820": {
      "BLOCK_M": 64,
      "BLOCK_N": 16,
      "BLOCK_K": 64,
      "BLOCK_C": 16,
      "NUM_KSPLIT": 2,
      "num_warps": 2,
      "num_stages": 1,
      "waves_per_eu": 2
    },
    "2497": {
      "BLOCK_M": 64,
      "BLOCK_N": 16,
      "BLOCK_K": 128,
      "BLOCK_C": 256,
      "NUM_KSPLIT": 4,
      "num_warps": 8,
      "num_stages": 1,
      "waves_per_eu": 1
    },
    "1913": {
      "BLOCK_M": 64,
      "BLOCK_N": 16,
      "BLOCK_K": 64,
      "BLOCK_C": 32,
      "NUM_KSPLIT": 4,
      "num_warps": 2,
      "num_stages": 2,
      "waves_per_eu": 2
    },
    "4228": {
      "BLOCK_M": 128,
      "BLOCK_N": 16,
      "BLOCK_K": 256,
      "BLOCK_C": 128,
      "NUM_KSPLIT": 4,
      "num_warps": 8,
      "num_stages": 2,
      "waves_per_eu": 1
    },
    "2992": {
      "BLOCK_M": 128,
      "BLOCK_N": 16,
      "BLOCK_K": 32,
      "BLOCK_C": 32,
      "NUM_KSPLIT": 4,
      "num_warps": 2,
      "num_stages": 2,
      "waves_per_eu": 1
    },
    "5232": {
      "BLOCK_M": 256,
      "BLOCK_N": 16,
      "BLOCK_K": 128,
      "BLOCK_C": 64,
      "NUM_KSPLIT": 4,
      "num_warps": 8,
      "num_stages": 1,
      "waves_per_eu": 0
    },
    "735": {
      "BLOCK_M": 32,
      "BLOCK_N": 16,
      "BLOCK_K": 128,
      "BLOCK_C": 16,
      "NUM_KSPLIT": 1,
      "num_warps": 8,
      "num_stages": 2,
      "waves_per_eu": 0
    },
    "4593": {
      "BLOCK_M": 256,
      "BLOCK_N": 16,
      "BLOCK_K": 32,
      "BLOCK_C": 128,
      "NUM_KSPLIT": 8,
      "num_warps": 2,
      "num_stages": 2,
      "waves_per_eu": 0
    },
    "771": {
      "BLOCK_M": 32,
      "BLOCK_N": 16,
      "BLOCK_K": 128,
      "BLOCK_C": 16,
      "NUM_KSPLIT": 4,
      "num_warps": 8,
      "num_stages": 2,
      "waves_per_eu": 0
    },
    "5471": {
      "BLOCK_M": 256,
      "BLOCK_N": 16,
      "BLOCK_K": 256,
      "BLOCK_C": 16,
      "NUM_KSPLIT": 8,
      "num_warps": 8,
      "num_stages": 2,
      "waves_per_eu": 2
    },
    "5529": {
      "BLOCK_M": 256,
      "BLOCK_N": 16,
      "BLOCK_K": 256,
      "BLOCK_C": 32,
      "NUM_KSPLIT": 8,
      "num_warps": 2,
      "num_stages": 2,
      "waves_per_eu": 0
    },
    "3641": {
      "BLOCK_M": 128,
      "BLOCK_N": 16,
      "BLOCK_K": 128,
      "BLOCK_C": 16,
      "NUM_KSPLIT": 4,
      "num_warps": 2,
      "num_stages": 2,
      "waves_per_eu": 2
    },
    "1069": {
      "BLOCK_M": 32,
      "BLOCK_N": 16,
      "BLOCK_K": 128,
      "BLOCK_C": 256,
      "NUM_KSPLIT": 8,
      "num_warps": 4,
      "num_stages": 1,
      "waves_per_eu": 1
    },
    "3329": {
      "BLOCK_M": 128,
      "BLOCK_N": 16,
      "BLOCK_K": 64,
      "BLOCK_C": 32,
      "NUM_KSPLIT": 1,
      "num_warps": 8,
      "num_stages": 2,
      "waves_per_eu": 2
    },
    "4640": {
      "BLOCK_M": 256,
      "BLOCK_N": 16,
      "BLOCK_K": 32,
      "BLOCK_C": 256,
      "NUM_KSPLIT": 2,
      "num_warps": 8,
      "num_stages": 1,
      "waves_per_eu": 2
    },
    "3156": {
      "BLOCK_M": 128,
      "BLOCK_N": 16,
      "BLOCK_K": 32,
      "BLOCK_C": 128,
      "NUM_KSPLIT": 8,
      "num_warps": 4,
      "num_stages": 1,
      "waves_per_eu": 0
    },
    "2072": {
      "BLOCK_M": 64,
      "BLOCK_N": 16,
      "BLOCK_K": 64,
      "BLOCK_C": 128,
      "NUM_KSPLIT": 8,
      "num_warps": 2,
      "num_stages": 1,
      "waves_per_eu": 2
    },
    "5240": {
      "BLOCK_M": 256,
      "BLOCK_N": 16,
      "BLOCK_K": 128,
      "BLOCK_C": 64,
      "NUM_KSPLIT": 8,
      "num_warps": 2,
      "num_stages": 1,
      "waves_per_eu": 2
    },
    "2071": {
      "BLOCK_M": 64,
      "BLOCK_N": 16,
      "BLOCK_K": 64,
      "BLOCK_C": 128,
      "NUM_KSPLIT": 8,
      "num_warps": 2,
      "num_stages": 1,
      "waves_per_eu": 1
    },
    "3894": {
      "BLOCK_M": 128,
      "BLOCK_N": 16,
      "BLOCK_K": 128,
      "BLOCK_C": 256,
      "NUM_KSPLIT": 1,
      "num_warps": 4,
      "num_stages": 1,
      "waves_per_eu": 0
    },
    "1631": {
      "BLOCK_M": 64,
      "BLOCK_N": 16,
      "BLOCK_K": 32,
      "BLOCK_C": 64,
      "NUM_KSPLIT": 4,
      "num_warps": 4,
      "num_stages": 2,
      "waves_per_eu": 2
    },
    "2792": {
      "BLOCK_M": 64,
      "BLOCK_N": 16,
      "BLOCK_K": 256,
      "BLOCK_C": 128,
      "NUM_KSPLIT": 8,
      "num_warps": 2,
      "num_stages": 1,
      "waves_per_eu": 2
    },
    "3048": {
      "BLOCK_M": 128,
      "BLOCK_N": 16,
      "BLOCK_K": 32,
      "BLOCK_C": 64,
      "NUM_KSPLIT": 2,
      "num_warps": 4,
      "num_stages": 1,
      "waves_per_eu": 0
    },
    "4386": {
      "BLOCK_M": 256,
      "BLOCK_N": 16,
      "BLOCK_K": 32,
      "BLOCK_C": 16,
      "NUM_KSPLIT": 8,
      "num_warps": 8,
      "num_stages": 1,
      "waves_per_eu": 0
    },
    "681": {
      "BLOCK_M": 32,
      "BLOCK_N": 16,
      "BLOCK_K": 64,
      "BLOCK_C": 256,
      "NUM_KSPLIT": 2,
      "num_warps": 8,
      "num_stages": 2,
      "waves_per_eu": 0
    },
    "891": {
      "BLOCK_M": 32,
      "BLOCK_N": 16,
      "BLOCK_K": 128,
      "BLOCK_C": 64,
      "NUM_KSPLIT": 2,
      "num_warps": 4,
      "num_stages": 2,
      "waves_per_eu": 0
    },
    "4665": {
      "BLOCK_M": 256,
      "BLOCK_N": 16,
      "BLOCK_K": 32,
      "BLOCK_C": 256,
      "NUM_KSPLIT": 8,
      "num_warps": 2,
      "num_stages": 2,
      "waves_per_eu": 0
    },
    "4738": {
      "BLOCK_M": 256,
      "BLOCK_N": 16,
      "BLOCK_K": 64,
      "BLOCK_C": 16,
      "NUM_KSPLIT": 8,
      "num_warps": 2,
      "num_stages": 2,
      "waves_per_eu": 1
    },
    "2126": {
      "BLOCK_M": 64,
      "BLOCK_N": 16,
      "BLOCK_K": 64,
      "BLOCK_C": 256,
      "NUM_KSPLIT": 4,
      "num_warps": 2,
      "num_stages": 1,
      "waves_per_eu": 2
    },
    "4752": {
      "BLOCK_M": 256,
      "BLOCK_N": 16,
      "BLOCK_K": 64,
      "BLOCK_C": 32,
      "NUM_KSPLIT": 1,
      "num_warps": 2,
      "num_stages": 1,
      "waves_per_eu": 0
    },
    "1162": {
      "BLOCK_M": 32,
      "BLOCK_N": 16,
      "BLOCK_K": 256,
      "BLOCK_C": 32,
      "NUM_KSPLIT": 1,
      "num_warps": 4,
      "num_stages": 2,
      "waves_per_eu": 1
    },
    "2853": {
      "BLOCK_M": 64,
      "BLOCK_N": 16,
      "BLOCK_K": 256,
      "BLOCK_C": 256,
      "NUM_KSPLIT": 4,
      "num_warps": 4,
      "num_stages": 2,
      "waves_per_eu": 0
    },
    "1557": {
      "BLOCK_M": 64,
      "BLOCK_N": 16,
      "BLOCK_K": 32,
      "BLOCK_C": 32,
      "NUM_KSPLIT": 4,
      "num_warps": 4,
      "num_stages": 2,
      "waves_per_eu": 0
    },
    "4036": {
      "BLOCK_M": 128,
      "BLOCK_N": 16,
      "BLOCK_K": 256,
      "BLOCK_C": 32,
      "NUM_KSPLIT": 1,
      "num_warps": 2,
      "num_stages": 2,
      "waves_per_eu": 1
    },
    "1869": {
      "BLOCK_M": 64,
      "BLOCK_N": 16,
      "BLOCK_K": 64,
      "BLOCK_C": 16,
      "NUM_KSPLIT": 8,
      "num_warps": 8,
      "num_stages": 2,
      "waves_per_eu": 0
    },
    "3591": {
      "BLOCK_M": 128,
      "BLOCK_N": 16,
      "BLOCK_K": 64,
      "BLOCK_C": 256,
      "NUM_KSPLIT": 8,
      "num_warps": 4,
      "num_stages": 2,
      "waves_per_eu": 0
    },
    "1124": {
      "BLOCK_M": 32,
      "BLOCK_N": 16,
      "BLOCK_K": 256,
      "BLOCK_C": 16,
      "NUM_KSPLIT": 4,
      "num_warps": 4,
      "num_stages": 1,
      "waves_per_eu": 2
    },
    "4153": {
      "BLOCK_M": 128,
      "BLOCK_N": 16,
      "BLOCK_K": 256,
      "BLOCK_C": 64,
      "NUM_KSPLIT": 4,
      "num_warps": 8,
      "num_stages": 1,
      "waves_per_eu": 1
    },
    "1593": {
      "BLOCK_M": 64,
      "BLOCK_N": 16,
      "BLOCK_K": 32,
      "BLOCK_C": 64,
      "NUM_KSPLIT": 1,
      "num_warps": 4,
      "num_stages": 2,
      "waves_per_eu": 0
    },
    "4060": {
      "BLOCK_M": 128,
      "BLOCK_N": 16,
      "BLOCK_K": 256,
      "BLOCK_C": 32,
      "NUM_KSPLIT": 2,
      "num_warps": 4,
      "num_stages": 2,
      "waves_per_eu": 1
    },
    "2849": {
      "BLOCK_M": 64,
      "BLOCK_N": 16,
      "BLOCK_K": 256,
      "BLOCK_C": 256,
      "NUM_KSPLIT": 4,
      "num_warps": 2,
      "num_stages": 2,
      "waves_per_eu": 2
    },
    "1525": {
      "BLOCK_M": 64,
      "BLOCK_N": 16,
      "BLOCK_K": 32,
      "BLOCK_C": 32,
      "NUM_KSPLIT": 1,
      "num_warps": 8,
      "num_stages": 1,
      "waves_per_eu": 1
    },
    "4119": {
      "BLOCK_M": 128,
      "BLOCK_N": 16,
      "BLOCK_K": 256,
      "BLOCK_C": 64,
      "NUM_KSPLIT": 1,
      "num_warps": 8,
      "num_stages": 2,
      "waves_per_eu": 0
    },
    "2459": {
      "BLOCK_M": 64,
      "BLOCK_N": 16,
      "BLOCK_K": 128,
      "BLOCK_C": 256,
      "NUM_KSPLIT": 1,
      "num_warps": 4,
      "num_stages": 2,
      "waves_per_eu": 2
    },
    "3285": {
      "BLOCK_M": 128,
      "BLOCK_N": 16,
      "BLOCK_K": 64,
      "BLOCK_C": 16,
      "NUM_KSPLIT": 4,
      "num_warps": 4,
      "num_stages": 2,
      "waves_per_eu": 0
    },
    "575": {
      "BLOCK_M": 32,
      "BLOCK_N": 16,
      "BLOCK_K": 64,
      "BLOCK_C": 64,
      "NUM_KSPLIT": 8,
      "num_warps": 8,
      "num_stages": 2,
      "waves_per_eu": 2
    },
    "7": {
      "BLOCK_M": 32,
      "BLOCK_N": 16,
      "BLOCK_K": 32,
      "BLOCK_C": 16,
      "NUM_KSPLIT": 1,
      "num_warps": 4,
      "num_stages": 1,
      "waves_per_eu": 1
    },
    "29": {
      "BLOCK_M": 32,
      "BLOCK_N": 16,
      "BLOCK_K": 32,
      "BLOCK_C": 16,
      "NUM_KSPLIT": 2,
      "num_warps": 4,
      "num_stages": 2,
      "waves_per_eu": 2
    },
    "3262": {
      "BLOCK_M": 128,
      "BLOCK_N": 16,
      "BLOCK_K": 64,
      "BLOCK_C": 16,
      "NUM_KSPLIT": 2,
      "num_warps": 2,
      "num_stages": 2,
      "waves_per_eu": 1
    },
    "634": {
      "BLOCK_M": 32,
      "BLOCK_N": 16,
      "BLOCK_K": 64,
      "BLOCK_C": 128,
      "NUM_KSPLIT": 8,
      "num_warps": 2,
      "num_stages": 2,
      "waves_per_eu": 1
    },
    "1975": {
      "BLOCK_M": 64,
      "BLOCK_N": 16,
      "BLOCK_K": 64,
      "BLOCK_C": 64,
      "NUM_KSPLIT": 2,
      "num_warps": 8,
      "num_stages": 1,
      "waves_per_eu": 1
    },
    "3948": {
      "BLOCK_M": 128,
      "BLOCK_N": 16,
      "BLOCK_K": 128,
      "BLOCK_C": 256,
      "NUM_KSPLIT": 8,
      "num_warps": 4,
      "num_stages": 1,
      "waves_per_eu": 0
    },
    "4371": {
      "BLOCK_M": 256,
      "BLOCK_N": 16,
      "BLOCK_K": 32,
      "BLOCK_C": 16,
      "NUM_KSPLIT": 4,
      "num_warps": 8,
      "num_stages": 2,
      "waves_per_eu": 0
    },
    "1082": {
      "BLOCK_M": 32,
      "BLOCK_N": 16,
      "BLOCK_K": 256,
      "BLOCK_C": 16,
      "NUM_KSPLIT": 1,
      "num_warps": 2,
      "num_stages": 1,
      "waves_per_eu": 2
    },
    "3953": {
      "BLOCK_M": 128,
      "BLOCK_N": 16,
      "BLOCK_K": 128,
      "BLOCK_C": 256,
      "NUM_KSPLIT": 8,
      "num_warps": 4,
      "num_stages": 2,
      "waves_per_eu": 2
    },
    "2550": {
      "BLOCK_M": 64,
      "BLOCK_N": 16,
      "BLOCK_K": 256,
      "BLOCK_C": 16,
      "NUM_KSPLIT": 2,
      "num_warps": 8,
      "num_stages": 1,
      "waves_per_eu": 0
    },
    "4883": {
      "BLOCK_M": 256,
      "BLOCK_N": 16,
      "BLOCK_K": 64,
      "BLOCK_C": 64,
      "NUM_KSPLIT": 8,
      "num_warps": 2,
      "num_stages": 2,
      "waves_per_eu": 2
    },
    "4394": {
      "BLOCK_M": 256,
      "BLOCK_N": 16,
      "BLOCK_K": 32,
      "BLOCK_C": 32,
      "NUM_KSPLIT": 1,
      "num_warps": 2,
      "num_stages": 1,
      "waves_per_eu": 2
    },
    "822": {
      "BLOCK_M": 32,
      "BLOCK_N": 16,
      "BLOCK_K": 128,
      "BLOCK_C": 32,
      "NUM_KSPLIT": 2,
      "num_warps": 8,
      "num_stages": 1,
      "waves_per_eu": 0
    },
    "2517": {
      "BLOCK_M": 64,
      "BLOCK_N": 16,
      "BLOCK_K": 128,
      "BLOCK_C": 256,
      "NUM_KSPLIT": 8,
      "num_warps": 8,
      "num_stages": 2,
      "waves_per_eu": 0
    },
    "969": {
      "BLOCK_M": 32,
      "BLOCK_N": 16,
      "BLOCK_K": 128,
      "BLOCK_C": 128,
      "NUM_KSPLIT": 2,
      "num_warps": 8,
      "num_stages": 2,
      "waves_per_eu": 0
    },
    "3821": {
      "BLOCK_M": 128,
      "BLOCK_N": 16,
      "BLOCK_K": 128,
      "BLOCK_C": 128,
      "NUM_KSPLIT": 1,
      "num_warps": 2,
      "num_stages": 2,
      "waves_per_eu": 2
    },
    "2629": {
      "BLOCK_M": 64,
      "BLOCK_N": 16,
      "BLOCK_K": 256,
      "BLOCK_C": 32,
      "NUM_KSPLIT": 4,
      "num_warps": 2,
      "num_stages": 1,
      "waves_per_eu": 1
    },
    "5299": {
      "BLOCK_M": 256,
      "BLOCK_N": 16,
      "BLOCK_K": 128,
      "BLOCK_C": 128,
      "NUM_KSPLIT": 4,
      "num_warps": 4,
      "num_stages": 1,
      "waves_per_eu": 1
    },
    "333": {
      "BLOCK_M": 32,
      "BLOCK_N": 16,
      "BLOCK_K": 32,
      "BLOCK_C": 256,
      "NUM_KSPLIT": 4,
      "num_warps": 4,
      "num_stages": 2,
      "waves_per_eu": 0
    },
    "1021": {
      "BLOCK_M": 32,
      "BLOCK_N": 16,
      "BLOCK_K": 128,
      "BLOCK_C": 256,
      "NUM_KSPLIT": 1,
      "num_warps": 8,
      "num_stages": 1,
      "waves_per_eu": 1
    },
    "137": {
      "BLOCK_M": 32,
      "BLOCK_N": 16,
      "BLOCK_K": 32,
      "BLOCK_C": 32,
      "NUM_KSPLIT": 8,
      "num_warps": 4,
      "num_stages": 2,
      "waves_per_eu": 2
    },
    "1064": {
      "BLOCK_M": 32,
      "BLOCK_N": 16,
      "BLOCK_K": 128,
      "BLOCK_C": 256,
      "NUM_KSPLIT": 8,
      "num_warps": 2,
      "num_stages": 1,
      "waves_per_eu": 2
    },
    "4907": {
      "BLOCK_M": 256,
      "BLOCK_N": 16,
      "BLOCK_K": 64,
      "BLOCK_C": 128,
      "NUM_KSPLIT": 1,
      "num_warps": 4,
      "num_stages": 2,
      "waves_per_eu": 2
    },
    "450": {
      "BLOCK_M": 32,
      "BLOCK_N": 16,
      "BLOCK_K": 64,
      "BLOCK_C": 32,
      "NUM_KSPLIT": 2,
      "num_warps": 2,
      "num_stages": 1,
      "waves_per_eu": 0
    },
    "3582": {
      "BLOCK_M": 128,
      "BLOCK_N": 16,
      "BLOCK_K": 64,
      "BLOCK_C": 256,
      "NUM_KSPLIT": 8,
      "num_warps": 2,
      "num_stages": 1,
      "waves_per_eu": 0
    },
    "3026": {
      "BLOCK_M": 128,
      "BLOCK_N": 16,
      "BLOCK_K": 32,
      "BLOCK_C": 64,
      "NUM_KSPLIT": 1,
      "num_warps": 2,
      "num_stages": 1,
      "waves_per_eu": 2
    },
    "404": {
      "BLOCK_M": 32,
      "BLOCK_N": 16,
      "BLOCK_K": 64,
      "BLOCK_C": 16,
      "NUM_KSPLIT": 4,
      "num_warps": 4,
      "num_stages": 1,
      "waves_per_eu": 2
    },
    "2399": {
      "BLOCK_M": 64,
      "BLOCK_N": 16,
      "BLOCK_K": 128,
      "BLOCK_C": 128,
      "NUM_KSPLIT": 2,
      "num_warps": 2,
      "num_stages": 2,
      "waves_per_eu": 2
    },
    "1176": {
      "BLOCK_M": 32,
      "BLOCK_N": 16,
      "BLOCK_K": 256,
      "BLOCK_C": 32,
      "NUM_KSPLIT": 2,
      "num_warps": 4,
      "num_stages": 1,
      "waves_per_eu": 0
    },
    "1680": {
      "BLOCK_M": 64,
      "BLOCK_N": 16,
      "BLOCK_K": 32,
      "BLOCK_C": 128,
      "NUM_KSPLIT": 2,
      "num_warps": 4,
      "num_stages": 1,
      "waves_per_eu": 0
    },
    "4224": {
      "BLOCK_M": 128,
      "BLOCK_N": 16,
      "BLOCK_K": 256,
      "BLOCK_C": 128,
      "NUM_KSPLIT": 4,
      "num_warps": 8,
      "num_stages": 1,
      "waves_per_eu": 0
    },
    "173": {
      "BLOCK_M": 32,
      "BLOCK_N": 16,
      "BLOCK_K": 32,
      "BLOCK_C": 64,
      "NUM_KSPLIT": 2,
      "num_warps": 4,
      "num_stages": 2,
      "waves_per_eu": 2
    },
    "5083": {
      "BLOCK_M": 256,
      "BLOCK_N": 16,
      "BLOCK_K": 128,
      "BLOCK_C": 16,
      "NUM_KSPLIT": 4,
      "num_warps": 4,
      "num_stages": 1,
      "waves_per_eu": 1
    },
    "4017": {
      "BLOCK_M": 128,
      "BLOCK_N": 16,
      "BLOCK_K": 256,
      "BLOCK_C": 16,
      "NUM_KSPLIT": 8,
      "num_warps": 2,
      "num_stages": 2,
      "waves_per_eu": 0
    },
    "2487": {
      "BLOCK_M": 64,
      "BLOCK_N": 16,
      "BLOCK_K": 128,
      "BLOCK_C": 256,
      "NUM_KSPLIT": 4,
      "num_warps": 2,
      "num_stages": 2,
      "waves_per_eu": 0
    },
    "5217": {
      "BLOCK_M": 256,
      "BLOCK_N": 16,
      "BLOCK_K": 128,
      "BLOCK_C": 64,
      "NUM_KSPLIT": 2,
      "num_warps": 8,
      "num_stages": 2,
      "waves_per_eu": 0
    },
    "4317": {
      "BLOCK_M": 128,
      "BLOCK_N": 16,
      "BLOCK_K": 256,
      "BLOCK_C": 256,
      "NUM_KSPLIT": 8,
      "num_warps": 8,
      "num_stages": 2,
      "waves_per_eu": 0
    },
    "5372": {
      "BLOCK_M": 256,
      "BLOCK_N": 16,
      "BLOCK_K": 128,
      "BLOCK_C": 256,
      "NUM_KSPLIT": 4,
      "num_warps": 4,
      "num_stages": 1,
      "waves_per_eu": 2
    },
    "3816": {
      "BLOCK_M": 128,
      "BLOCK_N": 16,
      "BLOCK_K": 128,
      "BLOCK_C": 128,
      "NUM_KSPLIT": 1,
      "num_warps": 2,
      "num_stages": 1,
      "waves_per_eu": 0
    },
    "5493": {
      "BLOCK_M": 256,
      "BLOCK_N": 16,
      "BLOCK_K": 256,
      "BLOCK_C": 32,
      "NUM_KSPLIT": 2,
      "num_warps": 2,
      "num_stages": 2,
      "waves_per_eu": 0
    },
    "4623": {
      "BLOCK_M": 256,
      "BLOCK_N": 16,
      "BLOCK_K": 32,
      "BLOCK_C": 256,
      "NUM_KSPLIT": 1,
      "num_warps": 8,
      "num_stages": 2,
      "waves_per_eu": 0
    },
    "3439": {
      "BLOCK_M": 128,
      "BLOCK_N": 16,
      "BLOCK_K": 64,
      "BLOCK_C": 64,
      "NUM_KSPLIT": 8,
      "num_warps": 2,
      "num_stages": 1,
      "waves_per_eu": 1
    },
    "1741": {
      "BLOCK_M": 64,
      "BLOCK_N": 16,
      "BLOCK_K": 32,
      "BLOCK_C": 256,
      "NUM_KSPLIT": 1,
      "num_warps": 8,
      "num_stages": 1,
      "waves_per_eu": 1
    },
    "2976": {
      "BLOCK_M": 128,
      "BLOCK_N": 16,
      "BLOCK_K": 32,
      "BLOCK_C": 32,
      "NUM_KSPLIT": 2,
      "num_warps": 4,
      "num_stages": 1,
      "waves_per_eu": 0
    },
    "4490": {
      "BLOCK_M": 256,
      "BLOCK_N": 16,
      "BLOCK_K": 32,
      "BLOCK_C": 64,
      "NUM_KSPLIT": 2,
      "num_warps": 4,
      "num_stages": 1,
      "waves_per_eu": 2
    },
    "4432": {
      "BLOCK_M": 256,
      "BLOCK_N": 16,
      "BLOCK_K": 32,
      "BLOCK_C": 32,
      "NUM_KSPLIT": 4,
      "num_warps": 2,
      "num_stages": 2,
      "waves_per_eu": 1
    },
    "2619": {
      "BLOCK_M": 64,
      "BLOCK_N": 16,
      "BLOCK_K": 256,
      "BLOCK_C": 32,
      "NUM_KSPLIT": 2,
      "num_warps": 4,
      "num_stages": 2,
      "waves_per_eu": 0
    },
    "3271": {
      "BLOCK_M": 128,
      "BLOCK_N": 16,
      "BLOCK_K": 64,
      "BLOCK_C": 16,
      "NUM_KSPLIT": 2,
      "num_warps": 8,
      "num_stages": 1,
      "waves_per_eu": 1
    },
    "4915": {
      "BLOCK_M": 256,
      "BLOCK_N": 16,
      "BLOCK_K": 64,
      "BLOCK_C": 128,
      "NUM_KSPLIT": 2,
      "num_warps": 2,
      "num_stages": 1,
      "waves_per_eu": 1
    },
    "2444": {
      "BLOCK_M": 64,
      "BLOCK_N": 16,
      "BLOCK_K": 128,
      "BLOCK_C": 128,
      "NUM_KSPLIT": 8,
      "num_warps": 8,
      "num_stages": 1,
      "waves_per_eu": 2
    },
    "1196": {
      "BLOCK_M": 32,
      "BLOCK_N": 16,
      "BLOCK_K": 256,
      "BLOCK_C": 32,
      "NUM_KSPLIT": 4,
      "num_warps": 4,
      "num_stages": 1,
      "waves_per_eu": 2
    },
    "1641": {
      "BLOCK_M": 64,
      "BLOCK_N": 16,
      "BLOCK_K": 32,
      "BLOCK_C": 64,
      "NUM_KSPLIT": 8,
      "num_warps": 2,
      "num_stages": 2,
      "waves_per_eu": 0
    },
    "3964": {
      "BLOCK_M": 128,
      "BLOCK_N": 16,
      "BLOCK_K": 256,
      "BLOCK_C": 16,
      "NUM_KSPLIT": 1,
      "num_warps": 2,
      "num_stages": 2,
      "waves_per_eu": 1
    },
    "275": {
      "BLOCK_M": 32,
      "BLOCK_N": 16,
      "BLOCK_K": 32,
      "BLOCK_C": 128,
      "NUM_KSPLIT": 8,
      "num_warps": 2,
      "num_stages": 2,
      "waves_per_eu": 2
    },
    "5542": {
      "BLOCK_M": 256,
      "BLOCK_N": 16,
      "BLOCK_K": 256,
      "BLOCK_C": 32,
      "NUM_KSPLIT": 8,
      "num_warps": 8,
      "num_stages": 2,
      "waves_per_eu": 1
    },
    "5352": {
      "BLOCK_M": 256,
      "BLOCK_N": 16,
      "BLOCK_K": 128,
      "BLOCK_C": 256,
      "NUM_KSPLIT": 2,
      "num_warps": 4,
      "num_stages": 1,
      "waves_per_eu": 0
    },
    "1880": {
      "BLOCK_M": 64,
      "BLOCK_N": 16,
      "BLOCK_K": 64,
      "BLOCK_C": 32,
      "NUM_KSPLIT": 1,
      "num_warps": 4,
      "num_stages": 1,
      "waves_per_eu": 2
    },
    "1926": {
      "BLOCK_M": 64,
      "BLOCK_N": 16,
      "BLOCK_K": 64,
      "BLOCK_C": 32,
      "NUM_KSPLIT": 8,
      "num_warps": 2,
      "num_stages": 1,
      "waves_per_eu": 0
    },
    "4801": {
      "BLOCK_M": 256,
      "BLOCK_N": 16,
      "BLOCK_K": 64,
      "BLOCK_C": 32,
      "NUM_KSPLIT": 4,
      "num_warps": 8,
      "num_stages": 1,
      "waves_per_eu": 1
    },
    "8": {
      "BLOCK_M": 32,
      "BLOCK_N": 16,
      "BLOCK_K": 32,
      "BLOCK_C": 16,
      "NUM_KSPLIT": 1,
      "num_warps": 4,
      "num_stages": 1,
      "waves_per_eu": 2
    },
    "2500": {
      "BLOCK_M": 64,
      "BLOCK_N": 16,
      "BLOCK_K": 128,
      "BLOCK_C": 256,
      "NUM_KSPLIT": 4,
      "num_warps": 8,
      "num_stages": 2,
      "waves_per_eu": 1
    },
    "962": {
      "BLOCK_M": 32,
      "BLOCK_N": 16,
      "BLOCK_K": 128,
      "BLOCK_C": 128,
      "NUM_KSPLIT": 2,
      "num_warps": 4,
      "num_stages": 1,
      "waves_per_eu": 2
    },
    "5043": {
      "BLOCK_M": 256,
      "BLOCK_N": 16,
      "BLOCK_K": 128,
      "BLOCK_C": 16,
      "NUM_KSPLIT": 1,
      "num_warps": 2,
      "num_stages": 2,
      "waves_per_eu": 0
    },
    "3462": {
      "BLOCK_M": 128,
      "BLOCK_N": 16,
      "BLOCK_K": 64,
      "BLOCK_C": 128,
      "NUM_KSPLIT": 1,
      "num_warps": 4,
      "num_stages": 1,
      "waves_per_eu": 0
    },
    "383": {
      "BLOCK_M": 32,
      "BLOCK_N": 16,
      "BLOCK_K": 64,
      "BLOCK_C": 16,
      "NUM_KSPLIT": 2,
      "num_warps": 2,
      "num_stages": 2,
      "waves_per_eu": 2
    },
    "5740": {
      "BLOCK_M": 256,
      "BLOCK_N": 16,
      "BLOCK_K": 256,
      "BLOCK_C": 256,
      "NUM_KSPLIT": 4,
      "num_warps": 8,
      "num_stages": 2,
      "waves_per_eu": 1
    },
    "2856": {
      "BLOCK_M": 64,
      "BLOCK_N": 16,
      "BLOCK_K": 256,
      "BLOCK_C": 256,
      "NUM_KSPLIT": 4,
      "num_warps": 8,
      "num_stages": 1,
      "waves_per_eu": 0
    },
    "678": {
      "BLOCK_M": 32,
      "BLOCK_N": 16,
      "BLOCK_K": 64,
      "BLOCK_C": 256,
      "NUM_KSPLIT": 2,
      "num_warps": 8,
      "num_stages": 1,
      "waves_per_eu": 0
    },
    "1473": {
      "BLOCK_M": 64,
      "BLOCK_N": 16,
      "BLOCK_K": 32,
      "BLOCK_C": 16,
      "NUM_KSPLIT": 2,
      "num_warps": 8,
      "num_stages": 2,
      "waves_per_eu": 0
    },
    "990": {
      "BLOCK_M": 32,
      "BLOCK_N": 16,
      "BLOCK_K": 128,
      "BLOCK_C": 128,
      "NUM_KSPLIT": 8,
      "num_warps": 2,
      "num_stages": 1,
      "waves_per_eu": 0
    },
    "4375": {
      "BLOCK_M": 256,
      "BLOCK_N": 16,
      "BLOCK_K": 32,
      "BLOCK_C": 16,
      "NUM_KSPLIT": 8,
      "num_warps": 2,
      "num_stages": 1,
      "waves_per_eu": 1
    },
    "1969": {
      "BLOCK_M": 64,
      "BLOCK_N": 16,
      "BLOCK_K": 64,
      "BLOCK_C": 64,
      "NUM_KSPLIT": 2,
      "num_warps": 4,
      "num_stages": 1,
      "waves_per_eu": 1
    },
    "4462": {
      "BLOCK_M": 256,
      "BLOCK_N": 16,
      "BLOCK_K": 32,
      "BLOCK_C": 32,
      "NUM_KSPLIT": 8,
      "num_warps": 8,
      "num_stages": 2,
      "waves_per_eu": 1
    },
    "4843": {
      "BLOCK_M": 256,
      "BLOCK_N": 16,
      "BLOCK_K": 64,
      "BLOCK_C": 64,
      "NUM_KSPLIT": 2,
      "num_warps": 2,
      "num_stages": 1,
      "waves_per_eu": 1
    },
    "1984": {
      "BLOCK_M": 64,
      "BLOCK_N": 16,
      "BLOCK_K": 64,
      "BLOCK_C": 64,
      "NUM_KSPLIT": 4,
      "num_warps": 2,
      "num_stages": 2,
      "waves_per_eu": 1
    },
    "2727": {
      "BLOCK_M": 64,
      "BLOCK_N": 16,
      "BLOCK_K": 256,
      "BLOCK_C": 64,
      "NUM_KSPLIT": 8,
      "num_warps": 4,
      "num_stages": 2,
      "waves_per_eu": 0
    },
    "371": {
      "BLOCK_M": 32,
      "BLOCK_N": 16,
      "BLOCK_K": 64,
      "BLOCK_C": 16,
      "NUM_KSPLIT": 1,
      "num_warps": 4,
      "num_stages": 2,
      "waves_per_eu": 2
    },
    "2593": {
      "BLOCK_M": 64,
      "BLOCK_N": 16,
      "BLOCK_K": 256,
      "BLOCK_C": 32,
      "NUM_KSPLIT": 1,
      "num_warps": 2,
      "num_stages": 1,
      "waves_per_eu": 1
    },
    "5202": {
      "BLOCK_M": 256,
      "BLOCK_N": 16,
      "BLOCK_K": 128,
      "BLOCK_C": 64,
      "NUM_KSPLIT": 2,
      "num_warps": 2,
      "num_stages": 1,
      "waves_per_eu": 0
    },
    "4128": {
      "BLOCK_M": 128,
      "BLOCK_N": 16,
      "BLOCK_K": 256,
      "BLOCK_C": 64,
      "NUM_KSPLIT": 2,
      "num_warps": 4,
      "num_stages": 1,
      "waves_per_eu": 0
    },
    "1240": {
      "BLOCK_M": 32,
      "BLOCK_N": 16,
      "BLOCK_K": 256,
      "BLOCK_C": 64,
      "NUM_KSPLIT": 1,
      "num_warps": 8,
      "num_stages": 2,
      "waves_per_eu": 1
    },
    "3383": {
      "BLOCK_M": 128,
      "BLOCK_N": 16,
      "BLOCK_K": 64,
      "BLOCK_C": 32,
      "NUM_KSPLIT": 8,
      "num_warps": 8,
      "num_stages": 2,
      "waves_per_eu": 2
    },
    "2622": {
      "BLOCK_M": 64,
      "BLOCK_N": 16,
      "BLOCK_K": 256,
      "BLOCK_C": 32,
      "NUM_KSPLIT": 2,
      "num_warps": 8,
      "num_stages": 1,
      "waves_per_eu": 0
    },
    "1275": {
      "BLOCK_M": 32,
      "BLOCK_N": 16,
      "BLOCK_K": 256,
      "BLOCK_C": 64,
      "NUM_KSPLIT": 4,
      "num_warps": 8,
      "num_stages": 2,
      "waves_per_eu": 0
    },
    "3947": {
      "BLOCK_M": 128,
      "BLOCK_N": 16,
      "BLOCK_K": 128,
      "BLOCK_C": 256,
      "NUM_KSPLIT": 8,
      "num_warps": 2,
      "num_stages": 2,
      "waves_per_eu": 2
    },
    "5289": {
      "BLOCK_M": 256,
      "BLOCK_N": 16,
      "BLOCK_K": 128,
      "BLOCK_C": 128,
      "NUM_KSPLIT": 2,
      "num_warps": 8,
      "num_stages": 2,
      "waves_per_eu": 0
    },
    "2932": {
      "BLOCK_M": 128,
      "BLOCK_N": 16,
      "BLOCK_K": 32,
      "BLOCK_C": 16,
      "NUM_KSPLIT": 4,
      "num_warps": 8,
      "num_stages": 2,
      "waves_per_eu": 1
    },
    "159": {
      "BLOCK_M": 32,
      "BLOCK_N": 16,
      "BLOCK_K": 32,
      "BLOCK_C": 64,
      "NUM_KSPLIT": 1,
      "num_warps": 8,
      "num_stages": 2,
      "waves_per_eu": 0
    },
    "911": {
      "BLOCK_M": 32,
      "BLOCK_N": 16,
      "BLOCK_K": 128,
      "BLOCK_C": 64,
      "NUM_KSPLIT": 4,
      "num_warps": 4,
      "num_stages": 2,
      "waves_per_eu": 2
    },
    "3818": {
      "BLOCK_M": 128,
      "BLOCK_N": 16,
      "BLOCK_K": 128,
      "BLOCK_C": 128,
      "NUM_KSPLIT": 1,
      "num_warps": 2,
      "num_stages": 1,
      "waves_per_eu": 2
    },
    "1301": {
      "BLOCK_M": 32,
      "BLOCK_N": 16,
      "BLOCK_K": 256,
      "BLOCK_C": 128,
      "NUM_KSPLIT": 1,
      "num_warps": 2,
      "num_stages": 2,
      "waves_per_eu": 2
    },
    "2779": {
      "BLOCK_M": 64,
      "BLOCK_N": 16,
      "BLOCK_K": 256,
      "BLOCK_C": 128,
      "NUM_KSPLIT": 4,
      "num_warps": 4,
      "num_stages": 1,
      "waves_per_eu": 1
    },
    "1712": {
      "BLOCK_M": 64,
      "BLOCK_N": 16,
      "BLOCK_K": 32,
      "BLOCK_C": 128,
      "NUM_KSPLIT": 8,
      "num_warps": 2,
      "num_stages": 1,
      "waves_per_eu": 2
    },
    "157": {
      "BLOCK_M": 32,
      "BLOCK_N": 16,
      "BLOCK_K": 32,
      "BLOCK_C": 64,
      "NUM_KSPLIT": 1,
      "num_warps": 8,
      "num_stages": 1,
      "waves_per_eu": 1
    },
    "2928": {
      "BLOCK_M": 128,
      "BLOCK_N": 16,
      "BLOCK_K": 32,
      "BLOCK_C": 16,
      "NUM_KSPLIT": 4,
      "num_warps": 8,
      "num_stages": 1,
      "waves_per_eu": 0
    },
    "4455": {
      "BLOCK_M": 256,
      "BLOCK_N": 16,
      "BLOCK_K": 32,
      "BLOCK_C": 32,
      "NUM_KSPLIT": 8,
      "num_warps": 4,
      "num_stages": 2,
      "waves_per_eu": 0
    },
    "2755": {
      "BLOCK_M": 64,
      "BLOCK_N": 16,
      "BLOCK_K": 256,
      "BLOCK_C": 128,
      "NUM_KSPLIT": 2,
      "num_warps": 2,
      "num_stages": 1,
      "waves_per_eu": 1
    },
    "2503": {
      "BLOCK_M": 64,
      "BLOCK_N": 16,
      "BLOCK_K": 128,
      "BLOCK_C": 256,
      "NUM_KSPLIT": 8,
      "num_warps": 2,
      "num_stages": 1,
      "waves_per_eu": 1
    },
    "1065": {
      "BLOCK_M": 32,
      "BLOCK_N": 16,
      "BLOCK_K": 128,
      "BLOCK_C": 256,
      "NUM_KSPLIT": 8,
      "num_warps": 2,
      "num_stages": 2,
      "waves_per_eu": 0
    },
    "4592": {
      "BLOCK_M": 256,
      "BLOCK_N": 16,
      "BLOCK_K": 32,
      "BLOCK_C": 128,
      "NUM_KSPLIT": 8,
      "num_warps": 2,
      "num_stages": 1,
      "waves_per_eu": 2
    },
    "2585": {
      "BLOCK_M": 64,
      "BLOCK_N": 16,
      "BLOCK_K": 256,
      "BLOCK_C": 16,
      "NUM_KSPLIT": 8,
      "num_warps": 4,
      "num_stages": 2,
      "waves_per_eu": 2
    },
    "589": {
      "BLOCK_M": 32,
      "BLOCK_N": 16,
      "BLOCK_K": 64,
      "BLOCK_C": 128,
      "NUM_KSPLIT": 1,
      "num_warps": 8,
      "num_stages": 1,
      "waves_per_eu": 1
    },
    "4942": {
      "BLOCK_M": 256,
      "BLOCK_N": 16,
      "BLOCK_K": 64,
      "BLOCK_C": 128,
      "NUM_KSPLIT": 4,
      "num_warps": 4,
      "num_stages": 2,
      "waves_per_eu": 1
    },
    "132": {
      "BLOCK_M": 32,
      "BLOCK_N": 16,
      "BLOCK_K": 32,
      "BLOCK_C": 32,
      "NUM_KSPLIT": 8,
      "num_warps": 4,
      "num_stages": 1,
      "waves_per_eu": 0
    },
    "5447": {
      "BLOCK_M": 256,
      "BLOCK_N": 16,
      "BLOCK_K": 256,
      "BLOCK_C": 16,
      "NUM_KSPLIT": 4,
      "num_warps": 4,
      "num_stages": 2,
      "waves_per_eu": 2
    },
    "1589": {
      "BLOCK_M": 64,
      "BLOCK_N": 16,
      "BLOCK_K": 32,
      "BLOCK_C": 64,
      "NUM_KSPLIT": 1,
      "num_warps": 2,
      "num_stages": 2,
      "waves_per_eu": 2
    },
    "4567": {
      "BLOCK_M": 256,
      "BLOCK_N": 16,
      "BLOCK_K": 32,
      "BLOCK_C": 128,
      "NUM_KSPLIT": 2,
      "num_warps": 8,
      "num_stages": 1,
      "waves_per_eu": 1
    },
    "452": {
      "BLOCK_M": 32,
      "BLOCK_N": 16,
      "BLOCK_K": 64,
      "BLOCK_C": 32,
      "NUM_KSPLIT": 2,
      "num_warps": 2,
      "num_stages": 1,
      "waves_per_eu": 2
    },
    "3572": {
      "BLOCK_M": 128,
      "BLOCK_N": 16,
      "BLOCK_K": 64,
      "BLOCK_C": 256,
      "NUM_KSPLIT": 4,
      "num_warps": 4,
      "num_stages": 1,
      "waves_per_eu": 2
    },
    "2486": {
      "BLOCK_M": 64,
      "BLOCK_N": 16,
      "BLOCK_K": 128,
      "BLOCK_C": 256,
      "NUM_KSPLIT": 4,
      "num_warps": 2,
      "num_stages": 1,
      "waves_per_eu": 2
    },
    "1692": {
      "BLOCK_M": 64,
      "BLOCK_N": 16,
      "BLOCK_K": 32,
      "BLOCK_C": 128,
      "NUM_KSPLIT": 4,
      "num_warps": 2,
      "num_stages": 1,
      "waves_per_eu": 0
    },
    "1506": {
      "BLOCK_M": 64,
      "BLOCK_N": 16,
      "BLOCK_K": 32,
      "BLOCK_C": 16,
      "NUM_KSPLIT": 8,
      "num_warps": 8,
      "num_stages": 1,
      "waves_per_eu": 0
    },
    "3606": {
      "BLOCK_M": 128,
      "BLOCK_N": 16,
      "BLOCK_K": 128,
      "BLOCK_C": 16,
      "NUM_KSPLIT": 1,
      "num_warps": 4,
      "num_stages": 1,
      "waves_per_eu": 0
    },
    "3651": {
      "BLOCK_M": 128,
      "BLOCK_N": 16,
      "BLOCK_K": 128,
      "BLOCK_C": 16,
      "NUM_KSPLIT": 4,
      "num_warps": 8,
      "num_stages": 2,
      "waves_per_eu": 0
    },
    "3169": {
      "BLOCK_M": 128,
      "BLOCK_N": 16,
      "BLOCK_K": 32,
      "BLOCK_C": 256,
      "NUM_KSPLIT": 1,
      "num_warps": 2,
      "num_stages": 1,
      "waves_per_eu": 1
    },
    "444": {
      "BLOCK_M": 32,
      "BLOCK_N": 16,
      "BLOCK_K": 64,
      "BLOCK_C": 32,
      "NUM_KSPLIT": 1,
      "num_warps": 8,
      "num_stages": 1,
      "waves_per_eu": 0
    },
    "28": {
      "BLOCK_M": 32,
      "BLOCK_N": 16,
      "BLOCK_K": 32,
      "BLOCK_C": 16,
      "NUM_KSPLIT": 2,
      "num_warps": 4,
      "num_stages": 2,
      "waves_per_eu": 1
    },
    "2675": {
      "BLOCK_M": 64,
      "BLOCK_N": 16,
      "BLOCK_K": 256,
      "BLOCK_C": 64,
      "NUM_KSPLIT": 1,
      "num_warps": 4,
      "num_stages": 2,
      "waves_per_eu": 2
    },
    "5627": {
      "BLOCK_M": 256,
      "BLOCK_N": 16,
      "BLOCK_K": 256,
      "BLOCK_C": 128,
      "NUM_KSPLIT": 1,
      "num_warps": 4,
      "num_stages": 2,
      "waves_per_eu": 2
    },
    "429": {
      "BLOCK_M": 32,
      "BLOCK_N": 16,
      "BLOCK_K": 64,
      "BLOCK_C": 16,
      "NUM_KSPLIT": 8,
      "num_warps": 8,
      "num_stages": 2,
      "waves_per_eu": 0
    },
    "2075": {
      "BLOCK_M": 64,
      "BLOCK_N": 16,
      "BLOCK_K": 64,
      "BLOCK_C": 128,
      "NUM_KSPLIT": 8,
      "num_warps": 2,
      "num_stages": 2,
      "waves_per_eu": 2
    },
    "2661": {
      "BLOCK_M": 64,
      "BLOCK_N": 16,
      "BLOCK_K": 256,
      "BLOCK_C": 32,
      "NUM_KSPLIT": 8,
      "num_warps": 8,
      "num_stages": 2,
      "waves_per_eu": 0
    },
    "3296": {
      "BLOCK_M": 128,
      "BLOCK_N": 16,
      "BLOCK_K": 64,
      "BLOCK_C": 16,
      "NUM_KSPLIT": 8,
      "num_warps": 2,
      "num_stages": 1,
      "waves_per_eu": 2
    },
    "2678": {
      "BLOCK_M": 64,
      "BLOCK_N": 16,
      "BLOCK_K": 256,
      "BLOCK_C": 64,
      "NUM_KSPLIT": 1,
      "num_warps": 8,
      "num_stages": 1,
      "waves_per_eu": 2
    },
    "3409": {
      "BLOCK_M": 128,
      "BLOCK_N": 16,
      "BLOCK_K": 64,
      "BLOCK_C": 64,
      "NUM_KSPLIT": 2,
      "num_warps": 4,
      "num_stages": 1,
      "waves_per_eu": 1
    },
    "1479": {
      "BLOCK_M": 64,
      "BLOCK_N": 16,
      "BLOCK_K": 32,
      "BLOCK_C": 16,
      "NUM_KSPLIT": 4,
      "num_warps": 2,
      "num_stages": 2,
      "waves_per_eu": 0
    },
    "5165": {
      "BLOCK_M": 256,
      "BLOCK_N": 16,
      "BLOCK_K": 128,
      "BLOCK_C": 32,
      "NUM_KSPLIT": 4,
      "num_warps": 8,
      "num_stages": 2,
      "waves_per_eu": 2
    },
    "2635": {
      "BLOCK_M": 64,
      "BLOCK_N": 16,
      "BLOCK_K": 256,
      "BLOCK_C": 32,
      "NUM_KSPLIT": 4,
      "num_warps": 4,
      "num_stages": 1,
      "waves_per_eu": 1
    },
    "3230": {
      "BLOCK_M": 128,
      "BLOCK_N": 16,
      "BLOCK_K": 32,
      "BLOCK_C": 256,
      "NUM_KSPLIT": 8,
      "num_warps": 4,
      "num_stages": 1,
      "waves_per_eu": 2
    },
    "3645": {
      "BLOCK_M": 128,
      "BLOCK_N": 16,
      "BLOCK_K": 128,
      "BLOCK_C": 16,
      "NUM_KSPLIT": 4,
      "num_warps": 4,
      "num_stages": 2,
      "waves_per_eu": 0
    },
    "3880": {
      "BLOCK_M": 128,
      "BLOCK_N": 16,
      "BLOCK_K": 128,
      "BLOCK_C": 128,
      "NUM_KSPLIT": 8,
      "num_warps": 4,
      "num_stages": 2,
      "waves_per_eu": 1
    },
    "5329": {
      "BLOCK_M": 256,
      "BLOCK_N": 16,
      "BLOCK_K": 128,
      "BLOCK_C": 256,
      "NUM_KSPLIT": 1,
      "num_warps": 2,
      "num_stages": 1,
      "waves_per_eu": 1
    },
    "1201": {
      "BLOCK_M": 32,
      "BLOCK_N": 16,
      "BLOCK_K": 256,
      "BLOCK_C": 32,
      "NUM_KSPLIT": 4,
      "num_warps": 8,
      "num_stages": 1,
      "waves_per_eu": 1
    },
    "4250": {
      "BLOCK_M": 128,
      "BLOCK_N": 16,
      "BLOCK_K": 256,
      "BLOCK_C": 256,
      "NUM_KSPLIT": 1,
      "num_warps": 2,
      "num_stages": 1,
      "waves_per_eu": 2
    },
    "114": {
      "BLOCK_M": 32,
      "BLOCK_N": 16,
      "BLOCK_K": 32,
      "BLOCK_C": 32,
      "NUM_KSPLIT": 4,
      "num_warps": 4,
      "num_stages": 1,
      "waves_per_eu": 0
    },
    "954": {
      "BLOCK_M": 32,
      "BLOCK_N": 16,
      "BLOCK_K": 128,
      "BLOCK_C": 128,
      "NUM_KSPLIT": 2,
      "num_warps": 2,
      "num_stages": 1,
      "waves_per_eu": 0
    },
    "1904": {
      "BLOCK_M": 64,
      "BLOCK_N": 16,
      "BLOCK_K": 64,
      "BLOCK_C": 32,
      "NUM_KSPLIT": 2,
      "num_warps": 8,
      "num_stages": 1,
      "waves_per_eu": 2
    },
    "5038": {
      "BLOCK_M": 256,
      "BLOCK_N": 16,
      "BLOCK_K": 64,
      "BLOCK_C": 256,
      "NUM_KSPLIT": 8,
      "num_warps": 8,
      "num_stages": 2,
      "waves_per_eu": 1
    },
    "5153": {
      "BLOCK_M": 256,
      "BLOCK_N": 16,
      "BLOCK_K": 128,
      "BLOCK_C": 32,
      "NUM_KSPLIT": 4,
      "num_warps": 2,
      "num_stages": 2,
      "waves_per_eu": 2
    },
    "5732": {
      "BLOCK_M": 256,
      "BLOCK_N": 16,
      "BLOCK_K": 256,
      "BLOCK_C": 256,
      "NUM_KSPLIT": 4,
      "num_warps": 4,
      "num_stages": 1,
      "waves_per_eu": 2
    },
    "2219": {
      "BLOCK_M": 64,
      "BLOCK_N": 16,
      "BLOCK_K": 128,
      "BLOCK_C": 16,
      "NUM_KSPLIT": 8,
      "num_warps": 2,
      "num_stages": 2,
      "waves_per_eu": 2
    },
    "1657": {
      "BLOCK_M": 64,
      "BLOCK_N": 16,
      "BLOCK_K": 32,
      "BLOCK_C": 128,
      "NUM_KSPLIT": 1,
      "num_warps": 2,
      "num_stages": 1,
      "waves_per_eu": 1
    },
    "732": {
      "BLOCK_M": 32,
      "BLOCK_N": 16,
      "BLOCK_K": 128,
      "BLOCK_C": 16,
      "NUM_KSPLIT": 1,
      "num_warps": 8,
      "num_stages": 1,
      "waves_per_eu": 0
    },
    "644": {
      "BLOCK_M": 32,
      "BLOCK_N": 16,
      "BLOCK_K": 64,
      "BLOCK_C": 128,
      "NUM_KSPLIT": 8,
      "num_warps": 8,
      "num_stages": 1,
      "waves_per_eu": 2
    },
    "3346": {
      "BLOCK_M": 128,
      "BLOCK_N": 16,
      "BLOCK_K": 64,
      "BLOCK_C": 32,
      "NUM_KSPLIT": 2,
      "num_warps": 8,
      "num_stages": 2,
      "waves_per_eu": 1
    },
    "192": {
      "BLOCK_M": 32,
      "BLOCK_N": 16,
      "BLOCK_K": 32,
      "BLOCK_C": 64,
      "NUM_KSPLIT": 4,
      "num_warps": 8,
      "num_stages": 1,
      "waves_per_eu": 0
    },
    "2895": {
      "BLOCK_M": 128,
      "BLOCK_N": 16,
      "BLOCK_K": 32,
      "BLOCK_C": 16,
      "NUM_KSPLIT": 1,
      "num_warps": 8,
      "num_stages": 2,
      "waves_per_eu": 0
    },
    "2857": {
      "BLOCK_M": 64,
      "BLOCK_N": 16,
      "BLOCK_K": 256,
      "BLOCK_C": 256,
      "NUM_KSPLIT": 4,
      "num_warps": 8,
      "num_stages": 1,
      "waves_per_eu": 1
    },
    "2481": {
      "BLOCK_M": 64,
      "BLOCK_N": 16,
      "BLOCK_K": 128,
      "BLOCK_C": 256,
      "NUM_KSPLIT": 2,
      "num_warps": 8,
      "num_stages": 2,
      "waves_per_eu": 0
    },
    "350": {
      "BLOCK_M": 32,
      "BLOCK_N": 16,
      "BLOCK_K": 32,
      "BLOCK_C": 256,
      "NUM_KSPLIT": 8,
      "num_warps": 4,
      "num_stages": 1,
      "waves_per_eu": 2
    },
    "865": {
      "BLOCK_M": 32,
      "BLOCK_N": 16,
      "BLOCK_K": 128,
      "BLOCK_C": 64,
      "NUM_KSPLIT": 1,
      "num_warps": 2,
      "num_stages": 1,
      "waves_per_eu": 1
    },
    "4534": {
      "BLOCK_M": 256,
      "BLOCK_N": 16,
      "BLOCK_K": 32,
      "BLOCK_C": 64,
      "NUM_KSPLIT": 8,
      "num_warps": 8,
      "num_stages": 2,
      "waves_per_eu": 1
    },
    "3702": {
      "BLOCK_M": 128,
      "BLOCK_N": 16,
      "BLOCK_K": 128,
      "BLOCK_C": 32,
      "NUM_KSPLIT": 2,
      "num_warps": 8,
      "num_stages": 1,
      "waves_per_eu": 0
    },
    "3006": {
      "BLOCK_M": 128,
      "BLOCK_N": 16,
      "BLOCK_K": 32,
      "BLOCK_C": 32,
      "NUM_KSPLIT": 8,
      "num_warps": 2,
      "num_stages": 1,
      "waves_per_eu": 0
    },
    "354": {
      "BLOCK_M": 32,
      "BLOCK_N": 16,
      "BLOCK_K": 32,
      "BLOCK_C": 256,
      "NUM_KSPLIT": 8,
      "num_warps": 8,
      "num_stages": 1,
      "waves_per_eu": 0
    },
    "3467": {
      "BLOCK_M": 128,
      "BLOCK_N": 16,
      "BLOCK_K": 64,
      "BLOCK_C": 128,
      "NUM_KSPLIT": 1,
      "num_warps": 4,
      "num_stages": 2,
      "waves_per_eu": 2
    },
    "993": {
      "BLOCK_M": 32,
      "BLOCK_N": 16,
      "BLOCK_K": 128,
      "BLOCK_C": 128,
      "NUM_KSPLIT": 8,
      "num_warps": 2,
      "num_stages": 2,
      "waves_per_eu": 0
    },
    "4021": {
      "BLOCK_M": 128,
      "BLOCK_N": 16,
      "BLOCK_K": 256,
      "BLOCK_C": 16,
      "NUM_KSPLIT": 8,
      "num_warps": 4,
      "num_stages": 1,
      "waves_per_eu": 1
    },
    "4220": {
      "BLOCK_M": 128,
      "BLOCK_N": 16,
      "BLOCK_K": 256,
      "BLOCK_C": 128,
      "NUM_KSPLIT": 4,
      "num_warps": 4,
      "num_stages": 1,
      "waves_per_eu": 2
    },
    "3835": {
      "BLOCK_M": 128,
      "BLOCK_N": 16,
      "BLOCK_K": 128,
      "BLOCK_C": 128,
      "NUM_KSPLIT": 2,
      "num_warps": 2,
      "num_stages": 1,
      "waves_per_eu": 1
    },
    "2627": {
      "BLOCK_M": 64,
      "BLOCK_N": 16,
      "BLOCK_K": 256,
      "BLOCK_C": 32,
      "NUM_KSPLIT": 2,
      "num_warps": 8,
      "num_stages": 2,
      "waves_per_eu": 2
    },
    "1577": {
      "BLOCK_M": 64,
      "BLOCK_N": 16,
      "BLOCK_K": 32,
      "BLOCK_C": 32,
      "NUM_KSPLIT": 8,
      "num_warps": 4,
      "num_stages": 2,
      "waves_per_eu": 2
    },
    "2216": {
      "BLOCK_M": 64,
      "BLOCK_N": 16,
      "BLOCK_K": 128,
      "BLOCK_C": 16,
      "NUM_KSPLIT": 8,
      "num_warps": 2,
      "num_stages": 1,
      "waves_per_eu": 2
    },
    "330": {
      "BLOCK_M": 32,
      "BLOCK_N": 16,
      "BLOCK_K": 32,
      "BLOCK_C": 256,
      "NUM_KSPLIT": 4,
      "num_warps": 4,
      "num_stages": 1,
      "waves_per_eu": 0
    },
    "3415": {
      "BLOCK_M": 128,
      "BLOCK_N": 16,
      "BLOCK_K": 64,
      "BLOCK_C": 64,
      "NUM_KSPLIT": 2,
      "num_warps": 8,
      "num_stages": 1,
      "waves_per_eu": 1
    },
    "4880": {
      "BLOCK_M": 256,
      "BLOCK_N": 16,
      "BLOCK_K": 64,
      "BLOCK_C": 64,
      "NUM_KSPLIT": 8,
      "num_warps": 2,
      "num_stages": 1,
      "waves_per_eu": 2
    },
    "93": {
      "BLOCK_M": 32,
      "BLOCK_N": 16,
      "BLOCK_K": 32,
      "BLOCK_C": 32,
      "NUM_KSPLIT": 2,
      "num_warps": 2,
      "num_stages": 2,
      "waves_per_eu": 0
    },
    "2442": {
      "BLOCK_M": 64,
      "BLOCK_N": 16,
      "BLOCK_K": 128,
      "BLOCK_C": 128,
      "NUM_KSPLIT": 8,
      "num_warps": 8,
      "num_stages": 1,
      "waves_per_eu": 0
    },
    "5664": {
      "BLOCK_M": 256,
      "BLOCK_N": 16,
      "BLOCK_K": 256,
      "BLOCK_C": 128,
      "NUM_KSPLIT": 4,
      "num_warps": 8,
      "num_stages": 1,
      "waves_per_eu": 0
    },
    "4530": {
      "BLOCK_M": 256,
      "BLOCK_N": 16,
      "BLOCK_K": 32,
      "BLOCK_C": 64,
      "NUM_KSPLIT": 8,
      "num_warps": 8,
      "num_stages": 1,
      "waves_per_eu": 0
    },
    "788": {
      "BLOCK_M": 32,
      "BLOCK_N": 16,
      "BLOCK_K": 128,
      "BLOCK_C": 16,
      "NUM_KSPLIT": 8,
      "num_warps": 8,
      "num_stages": 1,
      "waves_per_eu": 2
    },
    "5707": {
      "BLOCK_M": 256,
      "BLOCK_N": 16,
      "BLOCK_K": 256,
      "BLOCK_C": 256,
      "NUM_KSPLIT": 2,
      "num_warps": 2,
      "num_stages": 1,
      "waves_per_eu": 1
    },
    "1013": {
      "BLOCK_M": 32,
      "BLOCK_N": 16,
      "BLOCK_K": 128,
      "BLOCK_C": 256,
      "NUM_KSPLIT": 1,
      "num_warps": 2,
      "num_stages": 2,
      "waves_per_eu": 2
    },
    "1475": {
      "BLOCK_M": 64,
      "BLOCK_N": 16,
      "BLOCK_K": 32,
      "BLOCK_C": 16,
      "NUM_KSPLIT": 2,
      "num_warps": 8,
      "num_stages": 2,
      "waves_per_eu": 2
    },
    "1963": {
      "BLOCK_M": 64,
      "BLOCK_N": 16,
      "BLOCK_K": 64,
      "BLOCK_C": 64,
      "NUM_KSPLIT": 2,
      "num_warps": 2,
      "num_stages": 1,
      "waves_per_eu": 1
    },
    "2040": {
      "BLOCK_M": 64,
      "BLOCK_N": 16,
      "BLOCK_K": 64,
      "BLOCK_C": 128,
      "NUM_KSPLIT": 2,
      "num_warps": 4,
      "num_stages": 1,
      "waves_per_eu": 0
    },
    "2451": {
      "BLOCK_M": 64,
      "BLOCK_N": 16,
      "BLOCK_K": 128,
      "BLOCK_C": 256,
      "NUM_KSPLIT": 1,
      "num_warps": 2,
      "num_stages": 2,
      "waves_per_eu": 0
    },
    "772": {
      "BLOCK_M": 32,
      "BLOCK_N": 16,
      "BLOCK_K": 128,
      "BLOCK_C": 16,
      "NUM_KSPLIT": 4,
      "num_warps": 8,
      "num_stages": 2,
      "waves_per_eu": 1
    },
    "4180": {
      "BLOCK_M": 128,
      "BLOCK_N": 16,
      "BLOCK_K": 256,
      "BLOCK_C": 128,
      "NUM_KSPLIT": 1,
      "num_warps": 2,
      "num_stages": 2,
      "waves_per_eu": 1
    },
    "852": {
      "BLOCK_M": 32,
      "BLOCK_N": 16,
      "BLOCK_K": 128,
      "BLOCK_C": 32,
      "NUM_KSPLIT": 8,
      "num_warps": 4,
      "num_stages": 1,
      "waves_per_eu": 0
    },
    "296": {
      "BLOCK_M": 32,
      "BLOCK_N": 16,
      "BLOCK_K": 32,
      "BLOCK_C": 256,
      "NUM_KSPLIT": 1,
      "num_warps": 4,
      "num_stages": 1,
      "waves_per_eu": 2
    },
    "2570": {
      "BLOCK_M": 64,
      "BLOCK_N": 16,
      "BLOCK_K": 256,
      "BLOCK_C": 16,
      "NUM_KSPLIT": 4,
      "num_warps": 8,
      "num_stages": 1,
      "waves_per_eu": 2
    },
    "1026": {
      "BLOCK_M": 32,
      "BLOCK_N": 16,
      "BLOCK_K": 128,
      "BLOCK_C": 256,
      "NUM_KSPLIT": 2,
      "num_warps": 2,
      "num_stages": 1,
      "waves_per_eu": 0
    },
    "1652": {
      "BLOCK_M": 64,
      "BLOCK_N": 16,
      "BLOCK_K": 32,
      "BLOCK_C": 64,
      "NUM_KSPLIT": 8,
      "num_warps": 8,
      "num_stages": 1,
      "waves_per_eu": 2
    },
    "1260": {
      "BLOCK_M": 32,
      "BLOCK_N": 16,
      "BLOCK_K": 256,
      "BLOCK_C": 64,
      "NUM_KSPLIT": 4,
      "num_warps": 2,
      "num_stages": 1,
      "waves_per_eu": 0
    },
    "4825": {
      "BLOCK_M": 256,
      "BLOCK_N": 16,
      "BLOCK_K": 64,
      "BLOCK_C": 64,
      "NUM_KSPLIT": 1,
      "num_warps": 2,
      "num_stages": 1,
      "waves_per_eu": 1
    },
    "5172": {
      "BLOCK_M": 256,
      "BLOCK_N": 16,
      "BLOCK_K": 128,
      "BLOCK_C": 32,
      "NUM_KSPLIT": 8,
      "num_warps": 4,
      "num_stages": 1,
      "waves_per_eu": 0
    },
    "4647": {
      "BLOCK_M": 256,
      "BLOCK_N": 16,
      "BLOCK_K": 32,
      "BLOCK_C": 256,
      "NUM_KSPLIT": 4,
      "num_warps": 2,
      "num_stages": 2,
      "waves_per_eu": 0
    },
    "74": {
      "BLOCK_M": 32,
      "BLOCK_N": 16,
      "BLOCK_K": 32,
      "BLOCK_C": 32,
      "NUM_KSPLIT": 1,
      "num_warps": 2,
      "num_stages": 1,
      "waves_per_eu": 2
    },
    "2345": {
      "BLOCK_M": 64,
      "BLOCK_N": 16,
      "BLOCK_K": 128,
      "BLOCK_C": 64,
      "NUM_KSPLIT": 4,
      "num_warps": 2,
      "num_stages": 2,
      "waves_per_eu": 2
    },
    "5228": {
      "BLOCK_M": 256,
      "BLOCK_N": 16,
      "BLOCK_K": 128,
      "BLOCK_C": 64,
      "NUM_KSPLIT": 4,
      "num_warps": 4,
      "num_stages": 1,
      "waves_per_eu": 2
    },
    "5575": {
      "BLOCK_M": 256,
      "BLOCK_N": 16,
      "BLOCK_K": 256,
      "BLOCK_C": 64,
      "NUM_KSPLIT": 2,
      "num_warps": 8,
      "num_stages": 1,
      "waves_per_eu": 1
    },
    "3556": {
      "BLOCK_M": 128,
      "BLOCK_N": 16,
      "BLOCK_K": 64,
      "BLOCK_C": 256,
      "NUM_KSPLIT": 2,
      "num_warps": 4,
      "num_stages": 2,
      "waves_per_eu": 1
    },
    "104": {
      "BLOCK_M": 32,
      "BLOCK_N": 16,
      "BLOCK_K": 32,
      "BLOCK_C": 32,
      "NUM_KSPLIT": 2,
      "num_warps": 8,
      "num_stages": 1,
      "waves_per_eu": 2
    },
    "3643": {
      "BLOCK_M": 128,
      "BLOCK_N": 16,
      "BLOCK_K": 128,
      "BLOCK_C": 16,
      "NUM_KSPLIT": 4,
      "num_warps": 4,
      "num_stages": 1,
      "waves_per_eu": 1
    },
    "1194": {
      "BLOCK_M": 32,
      "BLOCK_N": 16,
      "BLOCK_K": 256,
      "BLOCK_C": 32,
      "NUM_KSPLIT": 4,
      "num_warps": 4,
      "num_stages": 1,
      "waves_per_eu": 0
    },
    "1057": {
      "BLOCK_M": 32,
      "BLOCK_N": 16,
      "BLOCK_K": 128,
      "BLOCK_C": 256,
      "NUM_KSPLIT": 4,
      "num_warps": 8,
      "num_stages": 1,
      "waves_per_eu": 1
    },
    "3108": {
      "BLOCK_M": 128,
      "BLOCK_N": 16,
      "BLOCK_K": 32,
      "BLOCK_C": 128,
      "NUM_KSPLIT": 1,
      "num_warps": 8,
      "num_stages": 1,
      "waves_per_eu": 0
    },
    "5324": {
      "BLOCK_M": 256,
      "BLOCK_N": 16,
      "BLOCK_K": 128,
      "BLOCK_C": 128,
      "NUM_KSPLIT": 8,
      "num_warps": 8,
      "num_stages": 1,
      "waves_per_eu": 2
    },
    "3042": {
      "BLOCK_M": 128,
      "BLOCK_N": 16,
      "BLOCK_K": 32,
      "BLOCK_C": 64,
      "NUM_KSPLIT": 2,
      "num_warps": 2,
      "num_stages": 1,
      "waves_per_eu": 0
    },
    "2318": {
      "BLOCK_M": 64,
      "BLOCK_N": 16,
      "BLOCK_K": 128,
      "BLOCK_C": 64,
      "NUM_KSPLIT": 1,
      "num_warps": 8,
      "num_stages": 1,
      "waves_per_eu": 2
    },
    "4818": {
      "BLOCK_M": 256,
      "BLOCK_N": 16,
      "BLOCK_K": 64,
      "BLOCK_C": 32,
      "NUM_KSPLIT": 8,
      "num_warps": 8,
      "num_stages": 1,
      "waves_per_eu": 0
    },
    "3174": {
      "BLOCK_M": 128,
      "BLOCK_N": 16,
      "BLOCK_K": 32,
      "BLOCK_C": 256,
      "NUM_KSPLIT": 1,
      "num_warps": 4,
      "num_stages": 1,
      "waves_per_eu": 0
    },
    "254": {
      "BLOCK_M": 32,
      "BLOCK_N": 16,
      "BLOCK_K": 32,
      "BLOCK_C": 128,
      "NUM_KSPLIT": 4,
      "num_warps": 2,
      "num_stages": 1,
      "waves_per_eu": 2
    },
    "297": {
      "BLOCK_M": 32,
      "BLOCK_N": 16,
      "BLOCK_K": 32,
      "BLOCK_C": 256,
      "NUM_KSPLIT": 1,
      "num_warps": 4,
      "num_stages": 2,
      "waves_per_eu": 0
    },
    "3828": {
      "BLOCK_M": 128,
      "BLOCK_N": 16,
      "BLOCK_K": 128,
      "BLOCK_C": 128,
      "NUM_KSPLIT": 1,
      "num_warps": 8,
      "num_stages": 1,
      "waves_per_eu": 0
    },
    "280": {
      "BLOCK_M": 32,
      "BLOCK_N": 16,
      "BLOCK_K": 32,
      "BLOCK_C": 128,
      "NUM_KSPLIT": 8,
      "num_warps": 4,
      "num_stages": 2,
      "waves_per_eu": 1
    },
    "3337": {
      "BLOCK_M": 128,
      "BLOCK_N": 16,
      "BLOCK_K": 64,
      "BLOCK_C": 32,
      "NUM_KSPLIT": 2,
      "num_warps": 4,
      "num_stages": 1,
      "waves_per_eu": 1
    },
    "329": {
      "BLOCK_M": 32,
      "BLOCK_N": 16,
      "BLOCK_K": 32,
      "BLOCK_C": 256,
      "NUM_KSPLIT": 4,
      "num_warps": 2,
      "num_stages": 2,
      "waves_per_eu": 2
    },
    "2303": {
      "BLOCK_M": 64,
      "BLOCK_N": 16,
      "BLOCK_K": 128,
      "BLOCK_C": 32,
      "NUM_KSPLIT": 8,
      "num_warps": 8,
      "num_stages": 2,
      "waves_per_eu": 2
    },
    "5553": {
      "BLOCK_M": 256,
      "BLOCK_N": 16,
      "BLOCK_K": 256,
      "BLOCK_C": 64,
      "NUM_KSPLIT": 1,
      "num_warps": 4,
      "num_stages": 2,
      "waves_per_eu": 0
    },
    "2527": {
      "BLOCK_M": 64,
      "BLOCK_N": 16,
      "BLOCK_K": 256,
      "BLOCK_C": 16,
      "NUM_KSPLIT": 1,
      "num_warps": 4,
      "num_stages": 1,
      "waves_per_eu": 1
    },
    "5683": {
      "BLOCK_M": 256,
      "BLOCK_N": 16,
      "BLOCK_K": 256,
      "BLOCK_C": 128,
      "NUM_KSPLIT": 8,
      "num_warps": 8,
      "num_stages": 1,
      "waves_per_eu": 1
    },
    "1128": {
      "BLOCK_M": 32,
      "BLOCK_N": 16,
      "BLOCK_K": 256,
      "BLOCK_C": 16,
      "NUM_KSPLIT": 4,
      "num_warps": 8,
      "num_stages": 1,
      "waves_per_eu": 0
    },
    "3503": {
      "BLOCK_M": 128,
      "BLOCK_N": 16,
      "BLOCK_K": 64,
      "BLOCK_C": 128,
      "NUM_KSPLIT": 4,
      "num_warps": 4,
      "num_stages": 2,
      "waves_per_eu": 2
    },
    "5017": {
      "BLOCK_M": 256,
      "BLOCK_N": 16,
      "BLOCK_K": 64,
      "BLOCK_C": 256,
      "NUM_KSPLIT": 4,
      "num_warps": 8,
      "num_stages": 1,
      "waves_per_eu": 1
    },
    "4439": {
      "BLOCK_M": 256,
      "BLOCK_N": 16,
      "BLOCK_K": 32,
      "BLOCK_C": 32,
      "NUM_KSPLIT": 4,
      "num_warps": 4,
      "num_stages": 2,
      "waves_per_eu": 2
    },
    "5703": {
      "BLOCK_M": 256,
      "BLOCK_N": 16,
      "BLOCK_K": 256,
      "BLOCK_C": 256,
      "NUM_KSPLIT": 1,
      "num_warps": 8,
      "num_stages": 2,
      "waves_per_eu": 0
    },
    "5639": {
      "BLOCK_M": 256,
      "BLOCK_N": 16,
      "BLOCK_K": 256,
      "BLOCK_C": 128,
      "NUM_KSPLIT": 2,
      "num_warps": 2,
      "num_stages": 2,
      "waves_per_eu": 2
    },
    "1930": {
      "BLOCK_M": 64,
      "BLOCK_N": 16,
      "BLOCK_K": 64,
      "BLOCK_C": 32,
      "NUM_KSPLIT": 8,
      "num_warps": 2,
      "num_stages": 2,
      "waves_per_eu": 1
    },
    "3058": {
      "BLOCK_M": 128,
      "BLOCK_N": 16,
      "BLOCK_K": 32,
      "BLOCK_C": 64,
      "NUM_KSPLIT": 2,
      "num_warps": 8,
      "num_stages": 2,
      "waves_per_eu": 1
    },
    "4485": {
      "BLOCK_M": 256,
      "BLOCK_N": 16,
      "BLOCK_K": 32,
      "BLOCK_C": 64,
      "NUM_KSPLIT": 2,
      "num_warps": 2,
      "num_stages": 2,
      "waves_per_eu": 0
    },
    "3985": {
      "BLOCK_M": 128,
      "BLOCK_N": 16,
      "BLOCK_K": 256,
      "BLOCK_C": 16,
      "NUM_KSPLIT": 2,
      "num_warps": 4,
      "num_stages": 1,
      "waves_per_eu": 1
    },
    "3141": {
      "BLOCK_M": 128,
      "BLOCK_N": 16,
      "BLOCK_K": 32,
      "BLOCK_C": 128,
      "NUM_KSPLIT": 4,
      "num_warps": 4,
      "num_stages": 2,
      "waves_per_eu": 0
    },
    "3067": {
      "BLOCK_M": 128,
      "BLOCK_N": 16,
      "BLOCK_K": 32,
      "BLOCK_C": 64,
      "NUM_KSPLIT": 4,
      "num_warps": 4,
      "num_stages": 1,
      "waves_per_eu": 1
    },
    "1946": {
      "BLOCK_M": 64,
      "BLOCK_N": 16,
      "BLOCK_K": 64,
      "BLOCK_C": 64,
      "NUM_KSPLIT": 1,
      "num_warps": 2,
      "num_stages": 1,
      "waves_per_eu": 2
    },
    "180": {
      "BLOCK_M": 32,
      "BLOCK_N": 16,
      "BLOCK_K": 32,
      "BLOCK_C": 64,
      "NUM_KSPLIT": 4,
      "num_warps": 2,
      "num_stages": 1,
      "waves_per_eu": 0
    },
    "725": {
      "BLOCK_M": 32,
      "BLOCK_N": 16,
      "BLOCK_K": 128,
      "BLOCK_C": 16,
      "NUM_KSPLIT": 1,
      "num_warps": 2,
      "num_stages": 2,
      "waves_per_eu": 2
    },
    "2158": {
      "BLOCK_M": 64,
      "BLOCK_N": 16,
      "BLOCK_K": 64,
      "BLOCK_C": 256,
      "NUM_KSPLIT": 8,
      "num_warps": 8,
      "num_stages": 2,
      "waves_per_eu": 1
    },
    "2862": {
      "BLOCK_M": 64,
      "BLOCK_N": 16,
      "BLOCK_K": 256,
      "BLOCK_C": 256,
      "NUM_KSPLIT": 8,
      "num_warps": 2,
      "num_stages": 1,
      "waves_per_eu": 0
    },
    "4401": {
      "BLOCK_M": 256,
      "BLOCK_N": 16,
      "BLOCK_K": 32,
      "BLOCK_C": 32,
      "NUM_KSPLIT": 1,
      "num_warps": 4,
      "num_stages": 2,
      "waves_per_eu": 0
    },
    "410": {
      "BLOCK_M": 32,
      "BLOCK_N": 16,
      "BLOCK_K": 64,
      "BLOCK_C": 16,
      "NUM_KSPLIT": 4,
      "num_warps": 8,
      "num_stages": 1,
      "waves_per_eu": 2
    },
    "1391": {
      "BLOCK_M": 32,
      "BLOCK_N": 16,
      "BLOCK_K": 256,
      "BLOCK_C": 256,
      "NUM_KSPLIT": 2,
      "num_warps": 2,
      "num_stages": 2,
      "waves_per_eu": 2
    },
    "5470": {
      "BLOCK_M": 256,
      "BLOCK_N": 16,
      "BLOCK_K": 256,
      "BLOCK_C": 16,
      "NUM_KSPLIT": 8,
      "num_warps": 8,
      "num_stages": 2,
      "waves_per_eu": 1
    },
    "1700": {
      "BLOCK_M": 64,
      "BLOCK_N": 16,
      "BLOCK_K": 32,
      "BLOCK_C": 128,
      "NUM_KSPLIT": 4,
      "num_warps": 4,
      "num_stages": 1,
      "waves_per_eu": 2
    },
    "1906": {
      "BLOCK_M": 64,
      "BLOCK_N": 16,
      "BLOCK_K": 64,
      "BLOCK_C": 32,
      "NUM_KSPLIT": 2,
      "num_warps": 8,
      "num_stages": 2,
      "waves_per_eu": 1
    },
    "177": {
      "BLOCK_M": 32,
      "BLOCK_N": 16,
      "BLOCK_K": 32,
      "BLOCK_C": 64,
      "NUM_KSPLIT": 2,
      "num_warps": 8,
      "num_stages": 2,
      "waves_per_eu": 0
    },
    "2789": {
      "BLOCK_M": 64,
      "BLOCK_N": 16,
      "BLOCK_K": 256,
      "BLOCK_C": 128,
      "NUM_KSPLIT": 4,
      "num_warps": 8,
      "num_stages": 2,
      "waves_per_eu": 2
    },
    "301": {
      "BLOCK_M": 32,
      "BLOCK_N": 16,
      "BLOCK_K": 32,
      "BLOCK_C": 256,
      "NUM_KSPLIT": 1,
      "num_warps": 8,
      "num_stages": 1,
      "waves_per_eu": 1
    },
    "3813": {
      "BLOCK_M": 128,
      "BLOCK_N": 16,
      "BLOCK_K": 128,
      "BLOCK_C": 64,
      "NUM_KSPLIT": 8,
      "num_warps": 8,
      "num_stages": 2,
      "waves_per_eu": 0
    },
    "1261": {
      "BLOCK_M": 32,
      "BLOCK_N": 16,
      "BLOCK_K": 256,
      "BLOCK_C": 64,
      "NUM_KSPLIT": 4,
      "num_warps": 2,
      "num_stages": 1,
      "waves_per_eu": 1
    },
    "4984": {
      "BLOCK_M": 256,
      "BLOCK_N": 16,
      "BLOCK_K": 64,
      "BLOCK_C": 256,
      "NUM_KSPLIT": 1,
      "num_warps": 8,
      "num_stages": 2,
      "waves_per_eu": 1
    },
    "1766": {
      "BLOCK_M": 64,
      "BLOCK_N": 16,
      "BLOCK_K": 32,
      "BLOCK_C": 256,
      "NUM_KSPLIT": 4,
      "num_warps": 2,
      "num_stages": 1,
      "waves_per_eu": 2
    },
    "5602": {
      "BLOCK_M": 256,
      "BLOCK_N": 16,
      "BLOCK_K": 256,
      "BLOCK_C": 64,
      "NUM_KSPLIT": 8,
      "num_warps": 2,
      "num_stages": 2,
      "waves_per_eu": 1
    },
    "5090": {
      "BLOCK_M": 256,
      "BLOCK_N": 16,
      "BLOCK_K": 128,
      "BLOCK_C": 16,
      "NUM_KSPLIT": 4,
      "num_warps": 8,
      "num_stages": 1,
      "waves_per_eu": 2
    },
    "1783": {
      "BLOCK_M": 64,
      "BLOCK_N": 16,
      "BLOCK_K": 32,
      "BLOCK_C": 256,
      "NUM_KSPLIT": 8,
      "num_warps": 2,
      "num_stages": 1,
      "waves_per_eu": 1
    },
    "2736": {
      "BLOCK_M": 64,
      "BLOCK_N": 16,
      "BLOCK_K": 256,
      "BLOCK_C": 128,
      "NUM_KSPLIT": 1,
      "num_warps": 2,
      "num_stages": 1,
      "waves_per_eu": 0
    },
    "1905": {
      "BLOCK_M": 64,
      "BLOCK_N": 16,
      "BLOCK_K": 64,
      "BLOCK_C": 32,
      "NUM_KSPLIT": 2,
      "num_warps": 8,
      "num_stages": 2,
      "waves_per_eu": 0
    },
    "3740": {
      "BLOCK_M": 128,
      "BLOCK_N": 16,
      "BLOCK_K": 128,
      "BLOCK_C": 32,
      "NUM_KSPLIT": 8,
      "num_warps": 8,
      "num_stages": 1,
      "waves_per_eu": 2
    },
    "5537": {
      "BLOCK_M": 256,
      "BLOCK_N": 16,
      "BLOCK_K": 256,
      "BLOCK_C": 32,
      "NUM_KSPLIT": 8,
      "num_warps": 4,
      "num_stages": 2,
      "waves_per_eu": 2
    },
    "1624": {
      "BLOCK_M": 64,
      "BLOCK_N": 16,
      "BLOCK_K": 32,
      "BLOCK_C": 64,
      "NUM_KSPLIT": 4,
      "num_warps": 2,
      "num_stages": 2,
      "waves_per_eu": 1
    },
    "3360": {
      "BLOCK_M": 128,
      "BLOCK_N": 16,
      "BLOCK_K": 64,
      "BLOCK_C": 32,
      "NUM_KSPLIT": 4,
      "num_warps": 8,
      "num_stages": 1,
      "waves_per_eu": 0
    },
    "1915": {
      "BLOCK_M": 64,
      "BLOCK_N": 16,
      "BLOCK_K": 64,
      "BLOCK_C": 32,
      "NUM_KSPLIT": 4,
      "num_warps": 4,
      "num_stages": 1,
      "waves_per_eu": 1
    },
    "1263": {
      "BLOCK_M": 32,
      "BLOCK_N": 16,
      "BLOCK_K": 256,
      "BLOCK_C": 64,
      "NUM_KSPLIT": 4,
      "num_warps": 2,
      "num_stages": 2,
      "waves_per_eu": 0
    },
    "3405": {
      "BLOCK_M": 128,
      "BLOCK_N": 16,
      "BLOCK_K": 64,
      "BLOCK_C": 64,
      "NUM_KSPLIT": 2,
      "num_warps": 2,
      "num_stages": 2,
      "waves_per_eu": 0
    },
    "999": {
      "BLOCK_M": 32,
      "BLOCK_N": 16,
      "BLOCK_K": 128,
      "BLOCK_C": 128,
      "NUM_KSPLIT": 8,
      "num_warps": 4,
      "num_stages": 2,
      "waves_per_eu": 0
    },
    "4792": {
      "BLOCK_M": 256,
      "BLOCK_N": 16,
      "BLOCK_K": 64,
      "BLOCK_C": 32,
      "NUM_KSPLIT": 4,
      "num_warps": 2,
      "num_stages": 2,
      "waves_per_eu": 1
    },
    "3600": {
      "BLOCK_M": 128,
      "BLOCK_N": 16,
      "BLOCK_K": 128,
      "BLOCK_C": 16,
      "NUM_KSPLIT": 1,
      "num_warps": 2,
      "num_stages": 1,
      "waves_per_eu": 0
    },
    "4387": {
      "BLOCK_M": 256,
      "BLOCK_N": 16,
      "BLOCK_K": 32,
      "BLOCK_C": 16,
      "NUM_KSPLIT": 8,
      "num_warps": 8,
      "num_stages": 1,
      "waves_per_eu": 1
    },
    "2256": {
      "BLOCK_M": 64,
      "BLOCK_N": 16,
      "BLOCK_K": 128,
      "BLOCK_C": 32,
      "NUM_KSPLIT": 2,
      "num_warps": 4,
      "num_stages": 1,
      "waves_per_eu": 0
    },
    "3258": {
      "BLOCK_M": 128,
      "BLOCK_N": 16,
      "BLOCK_K": 64,
      "BLOCK_C": 16,
      "NUM_KSPLIT": 2,
      "num_warps": 2,
      "num_stages": 1,
      "waves_per_eu": 0
    },
    "4981": {
      "BLOCK_M": 256,
      "BLOCK_N": 16,
      "BLOCK_K": 64,
      "BLOCK_C": 256,
      "NUM_KSPLIT": 1,
      "num_warps": 8,
      "num_stages": 1,
      "waves_per_eu": 1
    },
    "2255": {
      "BLOCK_M": 64,
      "BLOCK_N": 16,
      "BLOCK_K": 128,
      "BLOCK_C": 32,
      "NUM_KSPLIT": 2,
      "num_warps": 2,
      "num_stages": 2,
      "waves_per_eu": 2
    },
    "5565": {
      "BLOCK_M": 256,
      "BLOCK_N": 16,
      "BLOCK_K": 256,
      "BLOCK_C": 64,
      "NUM_KSPLIT": 2,
      "num_warps": 2,
      "num_stages": 2,
      "waves_per_eu": 0
    },
    "4217": {
      "BLOCK_M": 128,
      "BLOCK_N": 16,
      "BLOCK_K": 256,
      "BLOCK_C": 128,
      "NUM_KSPLIT": 4,
      "num_warps": 2,
      "num_stages": 2,
      "waves_per_eu": 2
    },
    "1096": {
      "BLOCK_M": 32,
      "BLOCK_N": 16,
      "BLOCK_K": 256,
      "BLOCK_C": 16,
      "NUM_KSPLIT": 1,
      "num_warps": 8,
      "num_stages": 2,
      "waves_per_eu": 1
    },
    "811": {
      "BLOCK_M": 32,
      "BLOCK_N": 16,
      "BLOCK_K": 128,
      "BLOCK_C": 32,
      "NUM_KSPLIT": 2,
      "num_warps": 2,
      "num_stages": 1,
      "waves_per_eu": 1
    },
    "642": {
      "BLOCK_M": 32,
      "BLOCK_N": 16,
      "BLOCK_K": 64,
      "BLOCK_C": 128,
      "NUM_KSPLIT": 8,
      "num_warps": 8,
      "num_stages": 1,
      "waves_per_eu": 0
    },
    "1867": {
      "BLOCK_M": 64,
      "BLOCK_N": 16,
      "BLOCK_K": 64,
      "BLOCK_C": 16,
      "NUM_KSPLIT": 8,
      "num_warps": 8,
      "num_stages": 1,
      "waves_per_eu": 1
    },
    "1362": {
      "BLOCK_M": 32,
      "BLOCK_N": 16,
      "BLOCK_K": 256,
      "BLOCK_C": 128,
      "NUM_KSPLIT": 8,
      "num_warps": 8,
      "num_stages": 1,
      "waves_per_eu": 0
    },
    "4071": {
      "BLOCK_M": 128,
      "BLOCK_N": 16,
      "BLOCK_K": 256,
      "BLOCK_C": 32,
      "NUM_KSPLIT": 4,
      "num_warps": 2,
      "num_stages": 2,
      "waves_per_eu": 0
    },
    "3241": {
      "BLOCK_M": 128,
      "BLOCK_N": 16,
      "BLOCK_K": 64,
      "BLOCK_C": 16,
      "NUM_KSPLIT": 1,
      "num_warps": 2,
      "num_stages": 1,
      "waves_per_eu": 1
    },
    "1323": {
      "BLOCK_M": 32,
      "BLOCK_N": 16,
      "BLOCK_K": 256,
      "BLOCK_C": 128,
      "NUM_KSPLIT": 2,
      "num_warps": 4,
      "num_stages": 2,
      "waves_per_eu": 0
    },
    "3172": {
      "BLOCK_M": 128,
      "BLOCK_N": 16,
      "BLOCK_K": 32,
      "BLOCK_C": 256,
      "NUM_KSPLIT": 1,
      "num_warps": 2,
      "num_stages": 2,
      "waves_per_eu": 1
    },
    "3747": {
      "BLOCK_M": 128,
      "BLOCK_N": 16,
      "BLOCK_K": 128,
      "BLOCK_C": 64,
      "NUM_KSPLIT": 1,
      "num_warps": 2,
      "num_stages": 2,
      "waves_per_eu": 0
    },
    "5443": {
      "BLOCK_M": 256,
      "BLOCK_N": 16,
      "BLOCK_K": 256,
      "BLOCK_C": 16,
      "NUM_KSPLIT": 4,
      "num_warps": 4,
      "num_stages": 1,
      "waves_per_eu": 1
    },
    "4025": {
      "BLOCK_M": 128,
      "BLOCK_N": 16,
      "BLOCK_K": 256,
      "BLOCK_C": 16,
      "NUM_KSPLIT": 8,
      "num_warps": 4,
      "num_stages": 2,
      "waves_per_eu": 2
    },
    "4241": {
      "BLOCK_M": 128,
      "BLOCK_N": 16,
      "BLOCK_K": 256,
      "BLOCK_C": 128,
      "NUM_KSPLIT": 8,
      "num_warps": 4,
      "num_stages": 2,
      "waves_per_eu": 2
    },
    "4048": {
      "BLOCK_M": 128,
      "BLOCK_N": 16,
      "BLOCK_K": 256,
      "BLOCK_C": 32,
      "NUM_KSPLIT": 1,
      "num_warps": 8,
      "num_stages": 2,
      "waves_per_eu": 1
    },
    "4218": {
      "BLOCK_M": 128,
      "BLOCK_N": 16,
      "BLOCK_K": 256,
      "BLOCK_C": 128,
      "NUM_KSPLIT": 4,
      "num_warps": 4,
      "num_stages": 1,
      "waves_per_eu": 0
    },
    "4644": {
      "BLOCK_M": 256,
      "BLOCK_N": 16,
      "BLOCK_K": 32,
      "BLOCK_C": 256,
      "NUM_KSPLIT": 4,
      "num_warps": 2,
      "num_stages": 1,
      "waves_per_eu": 0
    },
    "4312": {
      "BLOCK_M": 128,
      "BLOCK_N": 16,
      "BLOCK_K": 256,
      "BLOCK_C": 256,
      "NUM_KSPLIT": 8,
      "num_warps": 4,
      "num_stages": 2,
      "waves_per_eu": 1
    },
    "4221": {
      "BLOCK_M": 128,
      "BLOCK_N": 16,
      "BLOCK_K": 256,
      "BLOCK_C": 128,
      "NUM_KSPLIT": 4,
      "num_warps": 4,
      "num_stages": 2,
      "waves_per_eu": 0
    },
    "1662": {
      "BLOCK_M": 64,
      "BLOCK_N": 16,
      "BLOCK_K": 32,
      "BLOCK_C": 128,
      "NUM_KSPLIT": 1,
      "num_warps": 4,
      "num_stages": 1,
      "waves_per_eu": 0
    },
    "270": {
      "BLOCK_M": 32,
      "BLOCK_N": 16,
      "BLOCK_K": 32,
      "BLOCK_C": 128,
      "NUM_KSPLIT": 8,
      "num_warps": 2,
      "num_stages": 1,
      "waves_per_eu": 0
    },
    "4761": {
      "BLOCK_M": 256,
      "BLOCK_N": 16,
      "BLOCK_K": 64,
      "BLOCK_C": 32,
      "NUM_KSPLIT": 1,
      "num_warps": 4,
      "num_stages": 2,
      "waves_per_eu": 0
    },
    "1228": {
      "BLOCK_M": 32,
      "BLOCK_N": 16,
      "BLOCK_K": 256,
      "BLOCK_C": 64,
      "NUM_KSPLIT": 1,
      "num_warps": 2,
      "num_stages": 2,
      "waves_per_eu": 1
    },
    "2110": {
      "BLOCK_M": 64,
      "BLOCK_N": 16,
      "BLOCK_K": 64,
      "BLOCK_C": 256,
      "NUM_KSPLIT": 2,
      "num_warps": 2,
      "num_stages": 2,
      "waves_per_eu": 1
    },
    "2060": {
      "BLOCK_M": 64,
      "BLOCK_N": 16,
      "BLOCK_K": 64,
      "BLOCK_C": 128,
      "NUM_KSPLIT": 4,
      "num_warps": 4,
      "num_stages": 1,
      "waves_per_eu": 2
    },
    "4135": {
      "BLOCK_M": 128,
      "BLOCK_N": 16,
      "BLOCK_K": 256,
      "BLOCK_C": 64,
      "NUM_KSPLIT": 2,
      "num_warps": 8,
      "num_stages": 1,
      "waves_per_eu": 1
    },
    "2733": {
      "BLOCK_M": 64,
      "BLOCK_N": 16,
      "BLOCK_K": 256,
      "BLOCK_C": 64,
      "NUM_KSPLIT": 8,
      "num_warps": 8,
      "num_stages": 2,
      "waves_per_eu": 0
    },
    "2045": {
      "BLOCK_M": 64,
      "BLOCK_N": 16,
      "BLOCK_K": 64,
      "BLOCK_C": 128,
      "NUM_KSPLIT": 2,
      "num_warps": 4,
      "num_stages": 2,
      "waves_per_eu": 2
    },
    "2676": {
      "BLOCK_M": 64,
      "BLOCK_N": 16,
      "BLOCK_K": 256,
      "BLOCK_C": 64,
      "NUM_KSPLIT": 1,
      "num_warps": 8,
      "num_stages": 1,
      "waves_per_eu": 0
    },
    "2915": {
      "BLOCK_M": 128,
      "BLOCK_N": 16,
      "BLOCK_K": 32,
      "BLOCK_C": 16,
      "NUM_KSPLIT": 2,
      "num_warps": 8,
      "num_stages": 2,
      "waves_per_eu": 2
    },
    "2496": {
      "BLOCK_M": 64,
      "BLOCK_N": 16,
      "BLOCK_K": 128,
      "BLOCK_C": 256,
      "NUM_KSPLIT": 4,
      "num_warps": 8,
      "num_stages": 1,
      "waves_per_eu": 0
    },
    "4973": {
      "BLOCK_M": 256,
      "BLOCK_N": 16,
      "BLOCK_K": 64,
      "BLOCK_C": 256,
      "NUM_KSPLIT": 1,
      "num_warps": 2,
      "num_stages": 2,
      "waves_per_eu": 2
    },
    "2417": {
      "BLOCK_M": 64,
      "BLOCK_N": 16,
      "BLOCK_K": 128,
      "BLOCK_C": 128,
      "NUM_KSPLIT": 4,
      "num_warps": 2,
      "num_stages": 2,
      "waves_per_eu": 2
    },
    "4475": {
      "BLOCK_M": 256,
      "BLOCK_N": 16,
      "BLOCK_K": 32,
      "BLOCK_C": 64,
      "NUM_KSPLIT": 1,
      "num_warps": 4,
      "num_stages": 2,
      "waves_per_eu": 2
    },
    "3991": {
      "BLOCK_M": 128,
      "BLOCK_N": 16,
      "BLOCK_K": 256,
      "BLOCK_C": 16,
      "NUM_KSPLIT": 2,
      "num_warps": 8,
      "num_stages": 1,
      "waves_per_eu": 1
    },
    "2979": {
      "BLOCK_M": 128,
      "BLOCK_N": 16,
      "BLOCK_K": 32,
      "BLOCK_C": 32,
      "NUM_KSPLIT": 2,
      "num_warps": 4,
      "num_stages": 2,
      "waves_per_eu": 0
    },
    "2351": {
      "BLOCK_M": 64,
      "BLOCK_N": 16,
      "BLOCK_K": 128,
      "BLOCK_C": 64,
      "NUM_KSPLIT": 4,
      "num_warps": 4,
      "num_stages": 2,
      "waves_per_eu": 2
    },
    "448": {
      "BLOCK_M": 32,
      "BLOCK_N": 16,
      "BLOCK_K": 64,
      "BLOCK_C": 32,
      "NUM_KSPLIT": 1,
      "num_warps": 8,
      "num_stages": 2,
      "waves_per_eu": 1
    },
    "713": {
      "BLOCK_M": 32,
      "BLOCK_N": 16,
      "BLOCK_K": 64,
      "BLOCK_C": 256,
      "NUM_KSPLIT": 8,
      "num_warps": 4,
      "num_stages": 2,
      "waves_per_eu": 2
    },
    "4301": {
      "BLOCK_M": 128,
      "BLOCK_N": 16,
      "BLOCK_K": 256,
      "BLOCK_C": 256,
      "NUM_KSPLIT": 4,
      "num_warps": 8,
      "num_stages": 2,
      "waves_per_eu": 2
    },
    "1458": {
      "BLOCK_M": 64,
      "BLOCK_N": 16,
      "BLOCK_K": 32,
      "BLOCK_C": 16,
      "NUM_KSPLIT": 2,
      "num_warps": 2,
      "num_stages": 1,
      "waves_per_eu": 0
    },
    "107": {
      "BLOCK_M": 32,
      "BLOCK_N": 16,
      "BLOCK_K": 32,
      "BLOCK_C": 32,
      "NUM_KSPLIT": 2,
      "num_warps": 8,
      "num_stages": 2,
      "waves_per_eu": 2
    },
    "2051": {
      "BLOCK_M": 64,
      "BLOCK_N": 16,
      "BLOCK_K": 64,
      "BLOCK_C": 128,
      "NUM_KSPLIT": 2,
      "num_warps": 8,
      "num_stages": 2,
      "waves_per_eu": 2
    },
    "5148": {
      "BLOCK_M": 256,
      "BLOCK_N": 16,
      "BLOCK_K": 128,
      "BLOCK_C": 32,
      "NUM_KSPLIT": 4,
      "num_warps": 2,
      "num_stages": 1,
      "waves_per_eu": 0
    },
    "5483": {
      "BLOCK_M": 256,
      "BLOCK_N": 16,
      "BLOCK_K": 256,
      "BLOCK_C": 32,
      "NUM_KSPLIT": 1,
      "num_warps": 4,
      "num_stages": 2,
      "waves_per_eu": 2
    },
    "194": {
      "BLOCK_M": 32,
      "BLOCK_N": 16,
      "BLOCK_K": 32,
      "BLOCK_C": 64,
      "NUM_KSPLIT": 4,
      "num_warps": 8,
      "num_stages": 1,
      "waves_per_eu": 2
    },
    "3226": {
      "BLOCK_M": 128,
      "BLOCK_N": 16,
      "BLOCK_K": 32,
      "BLOCK_C": 256,
      "NUM_KSPLIT": 8,
      "num_warps": 2,
      "num_stages": 2,
      "waves_per_eu": 1
    },
    "5467": {
      "BLOCK_M": 256,
      "BLOCK_N": 16,
      "BLOCK_K": 256,
      "BLOCK_C": 16,
      "NUM_KSPLIT": 8,
      "num_warps": 8,
      "num_stages": 1,
      "waves_per_eu": 1
    },
    "4120": {
      "BLOCK_M": 128,
      "BLOCK_N": 16,
      "BLOCK_K": 256,
      "BLOCK_C": 64,
      "NUM_KSPLIT": 1,
      "num_warps": 8,
      "num_stages": 2,
      "waves_per_eu": 1
    },
    "4779": {
      "BLOCK_M": 256,
      "BLOCK_N": 16,
      "BLOCK_K": 64,
      "BLOCK_C": 32,
      "NUM_KSPLIT": 2,
      "num_warps": 4,
      "num_stages": 2,
      "waves_per_eu": 0
    },
    "5380": {
      "BLOCK_M": 256,
      "BLOCK_N": 16,
      "BLOCK_K": 128,
      "BLOCK_C": 256,
      "NUM_KSPLIT": 4,
      "num_warps": 8,
      "num_stages": 2,
      "waves_per_eu": 1
    },
    "2554": {
      "BLOCK_M": 64,
      "BLOCK_N": 16,
      "BLOCK_K": 256,
      "BLOCK_C": 16,
      "NUM_KSPLIT": 2,
      "num_warps": 8,
      "num_stages": 2,
      "waves_per_eu": 1
    },
    "5596": {
      "BLOCK_M": 256,
      "BLOCK_N": 16,
      "BLOCK_K": 256,
      "BLOCK_C": 64,
      "NUM_KSPLIT": 4,
      "num_warps": 8,
      "num_stages": 2,
      "waves_per_eu": 1
    },
    "4243": {
      "BLOCK_M": 128,
      "BLOCK_N": 16,
      "BLOCK_K": 256,
      "BLOCK_C": 128,
      "NUM_KSPLIT": 8,
      "num_warps": 8,
      "num_stages": 1,
      "waves_per_eu": 1
    },
    "3716": {
      "BLOCK_M": 128,
      "BLOCK_N": 16,
      "BLOCK_K": 128,
      "BLOCK_C": 32,
      "NUM_KSPLIT": 4,
      "num_warps": 4,
      "num_stages": 1,
      "waves_per_eu": 2
    },
    "436": {
      "BLOCK_M": 32,
      "BLOCK_N": 16,
      "BLOCK_K": 64,
      "BLOCK_C": 32,
      "NUM_KSPLIT": 1,
      "num_warps": 2,
      "num_stages": 2,
      "waves_per_eu": 1
    },
    "2028": {
      "BLOCK_M": 64,
      "BLOCK_N": 16,
      "BLOCK_K": 64,
      "BLOCK_C": 128,
      "NUM_KSPLIT": 1,
      "num_warps": 8,
      "num_stages": 1,
      "waves_per_eu": 0
    },
    "2968": {
      "BLOCK_M": 128,
      "BLOCK_N": 16,
      "BLOCK_K": 32,
      "BLOCK_C": 32,
      "NUM_KSPLIT": 1,
      "num_warps": 8,
      "num_stages": 2,
      "waves_per_eu": 1
    },
    "355": {
      "BLOCK_M": 32,
      "BLOCK_N": 16,
      "BLOCK_K": 32,
      "BLOCK_C": 256,
      "NUM_KSPLIT": 8,
      "num_warps": 8,
      "num_stages": 1,
      "waves_per_eu": 1
    },
    "487": {
      "BLOCK_M": 32,
      "BLOCK_N": 16,
      "BLOCK_K": 64,
      "BLOCK_C": 32,
      "NUM_KSPLIT": 8,
      "num_warps": 2,
      "num_stages": 1,
      "waves_per_eu": 1
    },
    "659": {
      "BLOCK_M": 32,
      "BLOCK_N": 16,
      "BLOCK_K": 64,
      "BLOCK_C": 256,
      "NUM_KSPLIT": 1,
      "num_warps": 4,
      "num_stages": 2,
      "waves_per_eu": 2
    },
    "5184": {
      "BLOCK_M": 256,
      "BLOCK_N": 16,
      "BLOCK_K": 128,
      "BLOCK_C": 64,
      "NUM_KSPLIT": 1,
      "num_warps": 2,
      "num_stages": 1,
      "waves_per_eu": 0
    },
    "5109": {
      "BLOCK_M": 256,
      "BLOCK_N": 16,
      "BLOCK_K": 128,
      "BLOCK_C": 16,
      "NUM_KSPLIT": 8,
      "num_warps": 8,
      "num_stages": 2,
      "waves_per_eu": 0
    },
    "1130": {
      "BLOCK_M": 32,
      "BLOCK_N": 16,
      "BLOCK_K": 256,
      "BLOCK_C": 16,
      "NUM_KSPLIT": 4,
      "num_warps": 8,
      "num_stages": 1,
      "waves_per_eu": 2
    },
    "4754": {
      "BLOCK_M": 256,
      "BLOCK_N": 16,
      "BLOCK_K": 64,
      "BLOCK_C": 32,
      "NUM_KSPLIT": 1,
      "num_warps": 2,
      "num_stages": 1,
      "waves_per_eu": 2
    },
    "3180": {
      "BLOCK_M": 128,
      "BLOCK_N": 16,
      "BLOCK_K": 32,
      "BLOCK_C": 256,
      "NUM_KSPLIT": 1,
      "num_warps": 8,
      "num_stages": 1,
      "waves_per_eu": 0
    },
    "2599": {
      "BLOCK_M": 64,
      "BLOCK_N": 16,
      "BLOCK_K": 256,
      "BLOCK_C": 32,
      "NUM_KSPLIT": 1,
      "num_warps": 4,
      "num_stages": 1,
      "waves_per_eu": 1
    },
    "5507": {
      "BLOCK_M": 256,
      "BLOCK_N": 16,
      "BLOCK_K": 256,
      "BLOCK_C": 32,
      "NUM_KSPLIT": 2,
      "num_warps": 8,
      "num_stages": 2,
      "waves_per_eu": 2
    },
    "4373": {
      "BLOCK_M": 256,
      "BLOCK_N": 16,
      "BLOCK_K": 32,
      "BLOCK_C": 16,
      "NUM_KSPLIT": 4,
      "num_warps": 8,
      "num_stages": 2,
      "waves_per_eu": 2
    },
    "3163": {
      "BLOCK_M": 128,
      "BLOCK_N": 16,
      "BLOCK_K": 32,
      "BLOCK_C": 128,
      "NUM_KSPLIT": 8,
      "num_warps": 8,
      "num_stages": 1,
      "waves_per_eu": 1
    },
    "5021": {
      "BLOCK_M": 256,
      "BLOCK_N": 16,
      "BLOCK_K": 64,
      "BLOCK_C": 256,
      "NUM_KSPLIT": 4,
      "num_warps": 8,
      "num_stages": 2,
      "waves_per_eu": 2
    },
    "349": {
      "BLOCK_M": 32,
      "BLOCK_N": 16,
      "BLOCK_K": 32,
      "BLOCK_C": 256,
      "NUM_KSPLIT": 8,
      "num_warps": 4,
      "num_stages": 1,
      "waves_per_eu": 1
    },
    "523": {
      "BLOCK_M": 32,
      "BLOCK_N": 16,
      "BLOCK_K": 64,
      "BLOCK_C": 64,
      "NUM_KSPLIT": 2,
      "num_warps": 2,
      "num_stages": 1,
      "waves_per_eu": 1
    },
    "98": {
      "BLOCK_M": 32,
      "BLOCK_N": 16,
      "BLOCK_K": 32,
      "BLOCK_C": 32,
      "NUM_KSPLIT": 2,
      "num_warps": 4,
      "num_stages": 1,
      "waves_per_eu": 2
    },
    "2088": {
      "BLOCK_M": 64,
      "BLOCK_N": 16,
      "BLOCK_K": 64,
      "BLOCK_C": 256,
      "NUM_KSPLIT": 1,
      "num_warps": 2,
      "num_stages": 1,
      "waves_per_eu": 0
    },
    "650": {
      "BLOCK_M": 32,
      "BLOCK_N": 16,
      "BLOCK_K": 64,
      "BLOCK_C": 256,
      "NUM_KSPLIT": 1,
      "num_warps": 2,
      "num_stages": 1,
      "waves_per_eu": 2
    },
    "3331": {
      "BLOCK_M": 128,
      "BLOCK_N": 16,
      "BLOCK_K": 64,
      "BLOCK_C": 32,
      "NUM_KSPLIT": 2,
      "num_warps": 2,
      "num_stages": 1,
      "waves_per_eu": 1
    },
    "4423": {
      "BLOCK_M": 256,
      "BLOCK_N": 16,
      "BLOCK_K": 32,
      "BLOCK_C": 32,
      "NUM_KSPLIT": 2,
      "num_warps": 8,
      "num_stages": 1,
      "waves_per_eu": 1
    },
    "411": {
      "BLOCK_M": 32,
      "BLOCK_N": 16,
      "BLOCK_K": 64,
      "BLOCK_C": 16,
      "NUM_KSPLIT": 4,
      "num_warps": 8,
      "num_stages": 2,
      "waves_per_eu": 0
    },
    "1332": {
      "BLOCK_M": 32,
      "BLOCK_N": 16,
      "BLOCK_K": 256,
      "BLOCK_C": 128,
      "NUM_KSPLIT": 4,
      "num_warps": 2,
      "num_stages": 1,
      "waves_per_eu": 0
    },
    "2384": {
      "BLOCK_M": 64,
      "BLOCK_N": 16,
      "BLOCK_K": 128,
      "BLOCK_C": 128,
      "NUM_KSPLIT": 1,
      "num_warps": 4,
      "num_stages": 1,
      "waves_per_eu": 2
    },
    "4091": {
      "BLOCK_M": 128,
      "BLOCK_N": 16,
      "BLOCK_K": 256,
      "BLOCK_C": 32,
      "NUM_KSPLIT": 8,
      "num_warps": 2,
      "num_stages": 2,
      "waves_per_eu": 2
    },
    "1655": {
      "BLOCK_M": 64,
      "BLOCK_N": 16,
      "BLOCK_K": 32,
      "BLOCK_C": 64,
      "NUM_KSPLIT": 8,
      "num_warps": 8,
      "num_stages": 2,
      "waves_per_eu": 2
    },
    "5054": {
      "BLOCK_M": 256,
      "BLOCK_N": 16,
      "BLOCK_K": 128,
      "BLOCK_C": 16,
      "NUM_KSPLIT": 1,
      "num_warps": 8,
      "num_stages": 1,
      "waves_per_eu": 2
    },
    "3132": {
      "BLOCK_M": 128,
      "BLOCK_N": 16,
      "BLOCK_K": 32,
      "BLOCK_C": 128,
      "NUM_KSPLIT": 4,
      "num_warps": 2,
      "num_stages": 1,
      "waves_per_eu": 0
    },
    "3075": {
      "BLOCK_M": 128,
      "BLOCK_N": 16,
      "BLOCK_K": 32,
      "BLOCK_C": 64,
      "NUM_KSPLIT": 4,
      "num_warps": 8,
      "num_stages": 2,
      "waves_per_eu": 0
    },
    "3228": {
      "BLOCK_M": 128,
      "BLOCK_N": 16,
      "BLOCK_K": 32,
      "BLOCK_C": 256,
      "NUM_KSPLIT": 8,
      "num_warps": 4,
      "num_stages": 1,
      "waves_per_eu": 0
    },
    "5358": {
      "BLOCK_M": 256,
      "BLOCK_N": 16,
      "BLOCK_K": 128,
      "BLOCK_C": 256,
      "NUM_KSPLIT": 2,
      "num_warps": 8,
      "num_stages": 1,
      "waves_per_eu": 0
    },
    "156": {
      "BLOCK_M": 32,
      "BLOCK_N": 16,
      "BLOCK_K": 32,
      "BLOCK_C": 64,
      "NUM_KSPLIT": 1,
      "num_warps": 8,
      "num_stages": 1,
      "waves_per_eu": 0
    },
    "3839": {
      "BLOCK_M": 128,
      "BLOCK_N": 16,
      "BLOCK_K": 128,
      "BLOCK_C": 128,
      "NUM_KSPLIT": 2,
      "num_warps": 2,
      "num_stages": 2,
      "waves_per_eu": 2
    },
    "1609": {
      "BLOCK_M": 64,
      "BLOCK_N": 16,
      "BLOCK_K": 32,
      "BLOCK_C": 64,
      "NUM_KSPLIT": 2,
      "num_warps": 4,
      "num_stages": 1,
      "waves_per_eu": 1
    },
    "1866": {
      "BLOCK_M": 64,
      "BLOCK_N": 16,
      "BLOCK_K": 64,
      "BLOCK_C": 16,
      "NUM_KSPLIT": 8,
      "num_warps": 8,
      "num_stages": 1,
      "waves_per_eu": 0
    },
    "2924": {
      "BLOCK_M": 128,
      "BLOCK_N": 16,
      "BLOCK_K": 32,
      "BLOCK_C": 16,
      "NUM_KSPLIT": 4,
      "num_warps": 4,
      "num_stages": 1,
      "waves_per_eu": 2
    },
    "4655": {
      "BLOCK_M": 256,
      "BLOCK_N": 16,
      "BLOCK_K": 32,
      "BLOCK_C": 256,
      "NUM_KSPLIT": 4,
      "num_warps": 4,
      "num_stages": 2,
      "waves_per_eu": 2
    },
    "1733": {
      "BLOCK_M": 64,
      "BLOCK_N": 16,
      "BLOCK_K": 32,
      "BLOCK_C": 256,
      "NUM_KSPLIT": 1,
      "num_warps": 2,
      "num_stages": 2,
      "waves_per_eu": 2
    },
    "4370": {
      "BLOCK_M": 256,
      "BLOCK_N": 16,
      "BLOCK_K": 32,
      "BLOCK_C": 16,
      "NUM_KSPLIT": 4,
      "num_warps": 8,
      "num_stages": 1,
      "waves_per_eu": 2
    },
    "1488": {
      "BLOCK_M": 64,
      "BLOCK_N": 16,
      "BLOCK_K": 32,
      "BLOCK_C": 16,
      "NUM_KSPLIT": 4,
      "num_warps": 8,
      "num_stages": 1,
      "waves_per_eu": 0
    },
    "609": {
      "BLOCK_M": 32,
      "BLOCK_N": 16,
      "BLOCK_K": 64,
      "BLOCK_C": 128,
      "NUM_KSPLIT": 2,
      "num_warps": 8,
      "num_stages": 2,
      "waves_per_eu": 0
    },
    "4906": {
      "BLOCK_M": 256,
      "BLOCK_N": 16,
      "BLOCK_K": 64,
      "BLOCK_C": 128,
      "NUM_KSPLIT": 1,
      "num_warps": 4,
      "num_stages": 2,
      "waves_per_eu": 1
    },
    "144": {
      "BLOCK_M": 32,
      "BLOCK_N": 16,
      "BLOCK_K": 32,
      "BLOCK_C": 64,
      "NUM_KSPLIT": 1,
      "num_warps": 2,
      "num_stages": 1,
      "waves_per_eu": 0
    },
    "2699": {
      "BLOCK_M": 64,
      "BLOCK_N": 16,
      "BLOCK_K": 256,
      "BLOCK_C": 64,
      "NUM_KSPLIT": 2,
      "num_warps": 8,
      "num_stages": 2,
      "waves_per_eu": 2
    },
    "522": {
      "BLOCK_M": 32,
      "BLOCK_N": 16,
      "BLOCK_K": 64,
      "BLOCK_C": 64,
      "NUM_KSPLIT": 2,
      "num_warps": 2,
      "num_stages": 1,
      "waves_per_eu": 0
    },
    "1943": {
      "BLOCK_M": 64,
      "BLOCK_N": 16,
      "BLOCK_K": 64,
      "BLOCK_C": 32,
      "NUM_KSPLIT": 8,
      "num_warps": 8,
      "num_stages": 2,
      "waves_per_eu": 2
    },
    "1780": {
      "BLOCK_M": 64,
      "BLOCK_N": 16,
      "BLOCK_K": 32,
      "BLOCK_C": 256,
      "NUM_KSPLIT": 4,
      "num_warps": 8,
      "num_stages": 2,
      "waves_per_eu": 1
    },
    "5605": {
      "BLOCK_M": 256,
      "BLOCK_N": 16,
      "BLOCK_K": 256,
      "BLOCK_C": 64,
      "NUM_KSPLIT": 8,
      "num_warps": 4,
      "num_stages": 1,
      "waves_per_eu": 1
    },
    "4666": {
      "BLOCK_M": 256,
      "BLOCK_N": 16,
      "BLOCK_K": 32,
      "BLOCK_C": 256,
      "NUM_KSPLIT": 8,
      "num_warps": 2,
      "num_stages": 2,
      "waves_per_eu": 1
    },
    "3752": {
      "BLOCK_M": 128,
      "BLOCK_N": 16,
      "BLOCK_K": 128,
      "BLOCK_C": 64,
      "NUM_KSPLIT": 1,
      "num_warps": 4,
      "num_stages": 1,
      "waves_per_eu": 2
    },
    "480": {
      "BLOCK_M": 32,
      "BLOCK_N": 16,
      "BLOCK_K": 64,
      "BLOCK_C": 32,
      "NUM_KSPLIT": 4,
      "num_warps": 8,
      "num_stages": 1,
      "waves_per_eu": 0
    },
    "3965": {
      "BLOCK_M": 128,
      "BLOCK_N": 16,
      "BLOCK_K": 256,
      "BLOCK_C": 16,
      "NUM_KSPLIT": 1,
      "num_warps": 2,
      "num_stages": 2,
      "waves_per_eu": 2
    },
    "972": {
      "BLOCK_M": 32,
      "BLOCK_N": 16,
      "BLOCK_K": 128,
      "BLOCK_C": 128,
      "NUM_KSPLIT": 4,
      "num_warps": 2,
      "num_stages": 1,
      "waves_per_eu": 0
    },
    "1306": {
      "BLOCK_M": 32,
      "BLOCK_N": 16,
      "BLOCK_K": 256,
      "BLOCK_C": 128,
      "NUM_KSPLIT": 1,
      "num_warps": 4,
      "num_stages": 2,
      "waves_per_eu": 1
    },
    "2102": {
      "BLOCK_M": 64,
      "BLOCK_N": 16,
      "BLOCK_K": 64,
      "BLOCK_C": 256,
      "NUM_KSPLIT": 1,
      "num_warps": 8,
      "num_stages": 1,
      "waves_per_eu": 2
    },
    "1726": {
      "BLOCK_M": 64,
      "BLOCK_N": 16,
      "BLOCK_K": 32,
      "BLOCK_C": 128,
      "NUM_KSPLIT": 8,
      "num_warps": 8,
      "num_stages": 2,
      "waves_per_eu": 1
    },
    "2165": {
      "BLOCK_M": 64,
      "BLOCK_N": 16,
      "BLOCK_K": 128,
      "BLOCK_C": 16,
      "NUM_KSPLIT": 1,
      "num_warps": 2,
      "num_stages": 2,
      "waves_per_eu": 2
    },
    "753": {
      "BLOCK_M": 32,
      "BLOCK_N": 16,
      "BLOCK_K": 128,
      "BLOCK_C": 16,
      "NUM_KSPLIT": 2,
      "num_warps": 8,
      "num_stages": 2,
      "waves_per_eu": 0
    },
    "5220": {
      "BLOCK_M": 256,
      "BLOCK_N": 16,
      "BLOCK_K": 128,
      "BLOCK_C": 64,
      "NUM_KSPLIT": 4,
      "num_warps": 2,
      "num_stages": 1,
      "waves_per_eu": 0
    },
    "4717": {
      "BLOCK_M": 256,
      "BLOCK_N": 16,
      "BLOCK_K": 64,
      "BLOCK_C": 16,
      "NUM_KSPLIT": 4,
      "num_warps": 2,
      "num_stages": 1,
      "waves_per_eu": 1
    },
    "1824": {
      "BLOCK_M": 64,
      "BLOCK_N": 16,
      "BLOCK_K": 64,
      "BLOCK_C": 16,
      "NUM_KSPLIT": 2,
      "num_warps": 4,
      "num_stages": 1,
      "waves_per_eu": 0
    },
    "2138": {
      "BLOCK_M": 64,
      "BLOCK_N": 16,
      "BLOCK_K": 64,
      "BLOCK_C": 256,
      "NUM_KSPLIT": 4,
      "num_warps": 8,
      "num_stages": 1,
      "waves_per_eu": 2
    },
    "4947": {
      "BLOCK_M": 256,
      "BLOCK_N": 16,
      "BLOCK_K": 64,
      "BLOCK_C": 128,
      "NUM_KSPLIT": 4,
      "num_warps": 8,
      "num_stages": 2,
      "waves_per_eu": 0
    },
    "1302": {
      "BLOCK_M": 32,
      "BLOCK_N": 16,
      "BLOCK_K": 256,
      "BLOCK_C": 128,
      "NUM_KSPLIT": 1,
      "num_warps": 4,
      "num_stages": 1,
      "waves_per_eu": 0
    },
    "5678": {
      "BLOCK_M": 256,
      "BLOCK_N": 16,
      "BLOCK_K": 256,
      "BLOCK_C": 128,
      "NUM_KSPLIT": 8,
      "num_warps": 4,
      "num_stages": 1,
      "waves_per_eu": 2
    },
    "2973": {
      "BLOCK_M": 128,
      "BLOCK_N": 16,
      "BLOCK_K": 32,
      "BLOCK_C": 32,
      "NUM_KSPLIT": 2,
      "num_warps": 2,
      "num_stages": 2,
      "waves_per_eu": 0
    },
    "4316": {
      "BLOCK_M": 128,
      "BLOCK_N": 16,
      "BLOCK_K": 256,
      "BLOCK_C": 256,
      "NUM_KSPLIT": 8,
      "num_warps": 8,
      "num_stages": 1,
      "waves_per_eu": 2
    },
    "2557": {
      "BLOCK_M": 64,
      "BLOCK_N": 16,
      "BLOCK_K": 256,
      "BLOCK_C": 16,
      "NUM_KSPLIT": 4,
      "num_warps": 2,
      "num_stages": 1,
      "waves_per_eu": 1
    },
    "391": {
      "BLOCK_M": 32,
      "BLOCK_N": 16,
      "BLOCK_K": 64,
      "BLOCK_C": 16,
      "NUM_KSPLIT": 2,
      "num_warps": 8,
      "num_stages": 1,
      "waves_per_eu": 1
    },
    "1608": {
      "BLOCK_M": 64,
      "BLOCK_N": 16,
      "BLOCK_K": 32,
      "BLOCK_C": 64,
      "NUM_KSPLIT": 2,
      "num_warps": 4,
      "num_stages": 1,
      "waves_per_eu": 0
    },
    "2222": {
      "BLOCK_M": 64,
      "BLOCK_N": 16,
      "BLOCK_K": 128,
      "BLOCK_C": 16,
      "NUM_KSPLIT": 8,
      "num_warps": 4,
      "num_stages": 1,
      "waves_per_eu": 2
    },
    "4212": {
      "BLOCK_M": 128,
      "BLOCK_N": 16,
      "BLOCK_K": 256,
      "BLOCK_C": 128,
      "NUM_KSPLIT": 4,
      "num_warps": 2,
      "num_stages": 1,
      "waves_per_eu": 0
    },
    "2157": {
      "BLOCK_M": 64,
      "BLOCK_N": 16,
      "BLOCK_K": 64,
      "BLOCK_C": 256,
      "NUM_KSPLIT": 8,
      "num_warps": 8,
      "num_stages": 2,
      "waves_per_eu": 0
    },
    "2002": {
      "BLOCK_M": 64,
      "BLOCK_N": 16,
      "BLOCK_K": 64,
      "BLOCK_C": 64,
      "NUM_KSPLIT": 8,
      "num_warps": 2,
      "num_stages": 2,
      "waves_per_eu": 1
    },
    "1499": {
      "BLOCK_M": 64,
      "BLOCK_N": 16,
      "BLOCK_K": 32,
      "BLOCK_C": 16,
      "NUM_KSPLIT": 8,
      "num_warps": 2,
      "num_stages": 2,
      "waves_per_eu": 2
    },
    "5617": {
      "BLOCK_M": 256,
      "BLOCK_N": 16,
      "BLOCK_K": 256,
      "BLOCK_C": 128,
      "NUM_KSPLIT": 1,
      "num_warps": 2,
      "num_stages": 1,
      "waves_per_eu": 1
    },
    "1992": {
      "BLOCK_M": 64,
      "BLOCK_N": 16,
      "BLOCK_K": 64,
      "BLOCK_C": 64,
      "NUM_KSPLIT": 4,
      "num_warps": 8,
      "num_stages": 1,
      "waves_per_eu": 0
    },
    "2476": {
      "BLOCK_M": 64,
      "BLOCK_N": 16,
      "BLOCK_K": 128,
      "BLOCK_C": 256,
      "NUM_KSPLIT": 2,
      "num_warps": 4,
      "num_stages": 2,
      "waves_per_eu": 1
    },
    "2930": {
      "BLOCK_M": 128,
      "BLOCK_N": 16,
      "BLOCK_K": 32,
      "BLOCK_C": 16,
      "NUM_KSPLIT": 4,
      "num_warps": 8,
      "num_stages": 1,
      "waves_per_eu": 2
    },
    "2163": {
      "BLOCK_M": 64,
      "BLOCK_N": 16,
      "BLOCK_K": 128,
      "BLOCK_C": 16,
      "NUM_KSPLIT": 1,
      "num_warps": 2,
      "num_stages": 2,
      "waves_per_eu": 0
    },
    "3447": {
      "BLOCK_M": 128,
      "BLOCK_N": 16,
      "BLOCK_K": 64,
      "BLOCK_C": 64,
      "NUM_KSPLIT": 8,
      "num_warps": 4,
      "num_stages": 2,
      "waves_per_eu": 0
    },
    "336": {
      "BLOCK_M": 32,
      "BLOCK_N": 16,
      "BLOCK_K": 32,
      "BLOCK_C": 256,
      "NUM_KSPLIT": 4,
      "num_warps": 8,
      "num_stages": 1,
      "waves_per_eu": 0
    },
    "2344": {
      "BLOCK_M": 64,
      "BLOCK_N": 16,
      "BLOCK_K": 128,
      "BLOCK_C": 64,
      "NUM_KSPLIT": 4,
      "num_warps": 2,
      "num_stages": 2,
      "waves_per_eu": 1
    },
    "256": {
      "BLOCK_M": 32,
      "BLOCK_N": 16,
      "BLOCK_K": 32,
      "BLOCK_C": 128,
      "NUM_KSPLIT": 4,
      "num_warps": 2,
      "num_stages": 2,
      "waves_per_eu": 1
    },
    "5387": {
      "BLOCK_M": 256,
      "BLOCK_N": 16,
      "BLOCK_K": 128,
      "BLOCK_C": 256,
      "NUM_KSPLIT": 8,
      "num_warps": 2,
      "num_stages": 2,
      "waves_per_eu": 2
    },
    "4016": {
      "BLOCK_M": 128,
      "BLOCK_N": 16,
      "BLOCK_K": 256,
      "BLOCK_C": 16,
      "NUM_KSPLIT": 8,
      "num_warps": 2,
      "num_stages": 1,
      "waves_per_eu": 2
    },
    "923": {
      "BLOCK_M": 32,
      "BLOCK_N": 16,
      "BLOCK_K": 128,
      "BLOCK_C": 64,
      "NUM_KSPLIT": 8,
      "num_warps": 2,
      "num_stages": 2,
      "waves_per_eu": 2
    },
    "4990": {
      "BLOCK_M": 256,
      "BLOCK_N": 16,
      "BLOCK_K": 64,
      "BLOCK_C": 256,
      "NUM_KSPLIT": 2,
      "num_warps": 2,
      "num_stages": 2,
      "waves_per_eu": 1
    },
    "714": {
      "BLOCK_M": 32,
      "BLOCK_N": 16,
      "BLOCK_K": 64,
      "BLOCK_C": 256,
      "NUM_KSPLIT": 8,
      "num_warps": 8,
      "num_stages": 1,
      "waves_per_eu": 0
    },
    "2590": {
      "BLOCK_M": 64,
      "BLOCK_N": 16,
      "BLOCK_K": 256,
      "BLOCK_C": 16,
      "NUM_KSPLIT": 8,
      "num_warps": 8,
      "num_stages": 2,
      "waves_per_eu": 1
    },
    "3746": {
      "BLOCK_M": 128,
      "BLOCK_N": 16,
      "BLOCK_K": 128,
      "BLOCK_C": 64,
      "NUM_KSPLIT": 1,
      "num_warps": 2,
      "num_stages": 1,
      "waves_per_eu": 2
    },
    "2087": {
      "BLOCK_M": 64,
      "BLOCK_N": 16,
      "BLOCK_K": 64,
      "BLOCK_C": 128,
      "NUM_KSPLIT": 8,
      "num_warps": 8,
      "num_stages": 2,
      "waves_per_eu": 2
    },
    "5266": {
      "BLOCK_M": 256,
      "BLOCK_N": 16,
      "BLOCK_K": 128,
      "BLOCK_C": 128,
      "NUM_KSPLIT": 1,
      "num_warps": 4,
      "num_stages": 2,
      "waves_per_eu": 1
    },
    "4863": {
      "BLOCK_M": 256,
      "BLOCK_N": 16,
      "BLOCK_K": 64,
      "BLOCK_C": 64,
      "NUM_KSPLIT": 4,
      "num_warps": 2,
      "num_stages": 2,
      "waves_per_eu": 0
    },
    "2612": {
      "BLOCK_M": 64,
      "BLOCK_N": 16,
      "BLOCK_K": 256,
      "BLOCK_C": 32,
      "NUM_KSPLIT": 2,
      "num_warps": 2,
      "num_stages": 1,
      "waves_per_eu": 2
    },
    "4114": {
      "BLOCK_M": 128,
      "BLOCK_N": 16,
      "BLOCK_K": 256,
      "BLOCK_C": 64,
      "NUM_KSPLIT": 1,
      "num_warps": 4,
      "num_stages": 2,
      "waves_per_eu": 1
    },
    "3449": {
      "BLOCK_M": 128,
      "BLOCK_N": 16,
      "BLOCK_K": 64,
      "BLOCK_C": 64,
      "NUM_KSPLIT": 8,
      "num_warps": 4,
      "num_stages": 2,
      "waves_per_eu": 2
    },
    "5497": {
      "BLOCK_M": 256,
      "BLOCK_N": 16,
      "BLOCK_K": 256,
      "BLOCK_C": 32,
      "NUM_KSPLIT": 2,
      "num_warps": 4,
      "num_stages": 1,
      "waves_per_eu": 1
    },
    "3398": {
      "BLOCK_M": 128,
      "BLOCK_N": 16,
      "BLOCK_K": 64,
      "BLOCK_C": 64,
      "NUM_KSPLIT": 1,
      "num_warps": 8,
      "num_stages": 1,
      "waves_per_eu": 2
    },
    "3011": {
      "BLOCK_M": 128,
      "BLOCK_N": 16,
      "BLOCK_K": 32,
      "BLOCK_C": 32,
      "NUM_KSPLIT": 8,
      "num_warps": 2,
      "num_stages": 2,
      "waves_per_eu": 2
    },
    "3911": {
      "BLOCK_M": 128,
      "BLOCK_N": 16,
      "BLOCK_K": 128,
      "BLOCK_C": 256,
      "NUM_KSPLIT": 2,
      "num_warps": 2,
      "num_stages": 2,
      "waves_per_eu": 2
    },
    "3066": {
      "BLOCK_M": 128,
      "BLOCK_N": 16,
      "BLOCK_K": 32,
      "BLOCK_C": 64,
      "NUM_KSPLIT": 4,
      "num_warps": 4,
      "num_stages": 1,
      "waves_per_eu": 0
    },
    "4786": {
      "BLOCK_M": 256,
      "BLOCK_N": 16,
      "BLOCK_K": 64,
      "BLOCK_C": 32,
      "NUM_KSPLIT": 2,
      "num_warps": 8,
      "num_stages": 2,
      "waves_per_eu": 1
    },
    "1841": {
      "BLOCK_M": 64,
      "BLOCK_N": 16,
      "BLOCK_K": 64,
      "BLOCK_C": 16,
      "NUM_KSPLIT": 4,
      "num_warps": 2,
      "num_stages": 2,
      "waves_per_eu": 2
    },
    "5589": {
      "BLOCK_M": 256,
      "BLOCK_N": 16,
      "BLOCK_K": 256,
      "BLOCK_C": 64,
      "NUM_KSPLIT": 4,
      "num_warps": 4,
      "num_stages": 2,
      "waves_per_eu": 0
    },
    "3933": {
      "BLOCK_M": 128,
      "BLOCK_N": 16,
      "BLOCK_K": 128,
      "BLOCK_C": 256,
      "NUM_KSPLIT": 4,
      "num_warps": 4,
      "num_stages": 2,
      "waves_per_eu": 0
    },
    "1352": {
      "BLOCK_M": 32,
      "BLOCK_N": 16,
      "BLOCK_K": 256,
      "BLOCK_C": 128,
      "NUM_KSPLIT": 8,
      "num_warps": 2,
      "num_stages": 1,
      "waves_per_eu": 2
    },
    "3479": {
      "BLOCK_M": 128,
      "BLOCK_N": 16,
      "BLOCK_K": 64,
      "BLOCK_C": 128,
      "NUM_KSPLIT": 2,
      "num_warps": 2,
      "num_stages": 2,
      "waves_per_eu": 2
    },
    "1428": {
      "BLOCK_M": 32,
      "BLOCK_N": 16,
      "BLOCK_K": 256,
      "BLOCK_C": 256,
      "NUM_KSPLIT": 8,
      "num_warps": 4,
      "num_stages": 1,
      "waves_per_eu": 0
    },
    "5723": {
      "BLOCK_M": 256,
      "BLOCK_N": 16,
      "BLOCK_K": 256,
      "BLOCK_C": 256,
      "NUM_KSPLIT": 2,
      "num_warps": 8,
      "num_stages": 2,
      "waves_per_eu": 2
    },
    "4729": {
      "BLOCK_M": 256,
      "BLOCK_N": 16,
      "BLOCK_K": 64,
      "BLOCK_C": 16,
      "NUM_KSPLIT": 4,
      "num_warps": 8,
      "num_stages": 1,
      "waves_per_eu": 1
    },
    "2125": {
      "BLOCK_M": 64,
      "BLOCK_N": 16,
      "BLOCK_K": 64,
      "BLOCK_C": 256,
      "NUM_KSPLIT": 4,
      "num_warps": 2,
      "num_stages": 1,
      "waves_per_eu": 1
    },
    "2878": {
      "BLOCK_M": 64,
      "BLOCK_N": 16,
      "BLOCK_K": 256,
      "BLOCK_C": 256,
      "NUM_KSPLIT": 8,
      "num_warps": 8,
      "num_stages": 2,
      "waves_per_eu": 1
    },
    "2683": {
      "BLOCK_M": 64,
      "BLOCK_N": 16,
      "BLOCK_K": 256,
      "BLOCK_C": 64,
      "NUM_KSPLIT": 2,
      "num_warps": 2,
      "num_stages": 1,
      "waves_per_eu": 1
    },
    "164": {
      "BLOCK_M": 32,
      "BLOCK_N": 16,
      "BLOCK_K": 32,
      "BLOCK_C": 64,
      "NUM_KSPLIT": 2,
      "num_warps": 2,
      "num_stages": 1,
      "waves_per_eu": 2
    },
    "763": {
      "BLOCK_M": 32,
      "BLOCK_N": 16,
      "BLOCK_K": 128,
      "BLOCK_C": 16,
      "NUM_KSPLIT": 4,
      "num_warps": 4,
      "num_stages": 1,
      "waves_per_eu": 1
    },
    "4263": {
      "BLOCK_M": 128,
      "BLOCK_N": 16,
      "BLOCK_K": 256,
      "BLOCK_C": 256,
      "NUM_KSPLIT": 1,
      "num_warps": 8,
      "num_stages": 2,
      "waves_per_eu": 0
    },
    "2270": {
      "BLOCK_M": 64,
      "BLOCK_N": 16,
      "BLOCK_K": 128,
      "BLOCK_C": 32,
      "NUM_KSPLIT": 4,
      "num_warps": 2,
      "num_stages": 1,
      "waves_per_eu": 2
    },
    "4027": {
      "BLOCK_M": 128,
      "BLOCK_N": 16,
      "BLOCK_K": 256,
      "BLOCK_C": 16,
      "NUM_KSPLIT": 8,
      "num_warps": 8,
      "num_stages": 1,
      "waves_per_eu": 1
    },
    "317": {
      "BLOCK_M": 32,
      "BLOCK_N": 16,
      "BLOCK_K": 32,
      "BLOCK_C": 256,
      "NUM_KSPLIT": 2,
      "num_warps": 4,
      "num_stages": 2,
      "waves_per_eu": 2
    },
    "2200": {
      "BLOCK_M": 64,
      "BLOCK_N": 16,
      "BLOCK_K": 128,
      "BLOCK_C": 16,
      "NUM_KSPLIT": 4,
      "num_warps": 2,
      "num_stages": 2,
      "waves_per_eu": 1
    },
    "3792": {
      "BLOCK_M": 128,
      "BLOCK_N": 16,
      "BLOCK_K": 128,
      "BLOCK_C": 64,
      "NUM_KSPLIT": 4,
      "num_warps": 8,
      "num_stages": 1,
      "waves_per_eu": 0
    },
    "5258": {
      "BLOCK_M": 256,
      "BLOCK_N": 16,
      "BLOCK_K": 128,
      "BLOCK_C": 128,
      "NUM_KSPLIT": 1,
      "num_warps": 2,
      "num_stages": 1,
      "waves_per_eu": 2
    },
    "991": {
      "BLOCK_M": 32,
      "BLOCK_N": 16,
      "BLOCK_K": 128,
      "BLOCK_C": 128,
      "NUM_KSPLIT": 8,
      "num_warps": 2,
      "num_stages": 1,
      "waves_per_eu": 1
    },
    "4342": {
      "BLOCK_M": 256,
      "BLOCK_N": 16,
      "BLOCK_K": 32,
      "BLOCK_C": 16,
      "NUM_KSPLIT": 2,
      "num_warps": 2,
      "num_stages": 2,
      "waves_per_eu": 1
    },
    "2796": {
      "BLOCK_M": 64,
      "BLOCK_N": 16,
      "BLOCK_K": 256,
      "BLOCK_C": 128,
      "NUM_KSPLIT": 8,
      "num_warps": 4,
      "num_stages": 1,
      "waves_per_eu": 0
    },
    "2533": {
      "BLOCK_M": 64,
      "BLOCK_N": 16,
      "BLOCK_K": 256,
      "BLOCK_C": 16,
      "NUM_KSPLIT": 1,
      "num_warps": 8,
      "num_stages": 1,
      "waves_per_eu": 1
    },
    "5472": {
      "BLOCK_M": 256,
      "BLOCK_N": 16,
      "BLOCK_K": 256,
      "BLOCK_C": 32,
      "NUM_KSPLIT": 1,
      "num_warps": 2,
      "num_stages": 1,
      "waves_per_eu": 0
    },
    "1088": {
      "BLOCK_M": 32,
      "BLOCK_N": 16,
      "BLOCK_K": 256,
      "BLOCK_C": 16,
      "NUM_KSPLIT": 1,
      "num_warps": 4,
      "num_stages": 1,
      "waves_per_eu": 2
    },
    "1612": {
      "BLOCK_M": 64,
      "BLOCK_N": 16,
      "BLOCK_K": 32,
      "BLOCK_C": 64,
      "NUM_KSPLIT": 2,
      "num_warps": 4,
      "num_stages": 2,
      "waves_per_eu": 1
    },
    "3802": {
      "BLOCK_M": 128,
      "BLOCK_N": 16,
      "BLOCK_K": 128,
      "BLOCK_C": 64,
      "NUM_KSPLIT": 8,
      "num_warps": 2,
      "num_stages": 2,
      "waves_per_eu": 1
    },
    "5276": {
      "BLOCK_M": 256,
      "BLOCK_N": 16,
      "BLOCK_K": 128,
      "BLOCK_C": 128,
      "NUM_KSPLIT": 2,
      "num_warps": 2,
      "num_stages": 1,
      "waves_per_eu": 2
    },
    "224": {
      "BLOCK_M": 32,
      "BLOCK_N": 16,
      "BLOCK_K": 32,
      "BLOCK_C": 128,
      "NUM_KSPLIT": 1,
      "num_warps": 4,
      "num_stages": 1,
      "waves_per_eu": 2
    },
    "3402": {
      "BLOCK_M": 128,
      "BLOCK_N": 16,
      "BLOCK_K": 64,
      "BLOCK_C": 64,
      "NUM_KSPLIT": 2,
      "num_warps": 2,
      "num_stages": 1,
      "waves_per_eu": 0
    },
    "4705": {
      "BLOCK_M": 256,
      "BLOCK_N": 16,
      "BLOCK_K": 64,
      "BLOCK_C": 16,
      "NUM_KSPLIT": 2,
      "num_warps": 4,
      "num_stages": 1,
      "waves_per_eu": 1
    },
    "2499": {
      "BLOCK_M": 64,
      "BLOCK_N": 16,
      "BLOCK_K": 128,
      "BLOCK_C": 256,
      "NUM_KSPLIT": 4,
      "num_warps": 8,
      "num_stages": 2,
      "waves_per_eu": 0
    },
    "5389": {
      "BLOCK_M": 256,
      "BLOCK_N": 16,
      "BLOCK_K": 128,
      "BLOCK_C": 256,
      "NUM_KSPLIT": 8,
      "num_warps": 4,
      "num_stages": 1,
      "waves_per_eu": 1
    },
    "1808": {
      "BLOCK_M": 64,
      "BLOCK_N": 16,
      "BLOCK_K": 64,
      "BLOCK_C": 16,
      "NUM_KSPLIT": 1,
      "num_warps": 4,
      "num_stages": 1,
      "waves_per_eu": 2
    },
    "4618": {
      "BLOCK_M": 256,
      "BLOCK_N": 16,
      "BLOCK_K": 32,
      "BLOCK_C": 256,
      "NUM_KSPLIT": 1,
      "num_warps": 4,
      "num_stages": 2,
      "waves_per_eu": 1
    },
    "3793": {
      "BLOCK_M": 128,
      "BLOCK_N": 16,
      "BLOCK_K": 128,
      "BLOCK_C": 64,
      "NUM_KSPLIT": 4,
      "num_warps": 8,
      "num_stages": 1,
      "waves_per_eu": 1
    },
    "4176": {
      "BLOCK_M": 128,
      "BLOCK_N": 16,
      "BLOCK_K": 256,
      "BLOCK_C": 128,
      "NUM_KSPLIT": 1,
      "num_warps": 2,
      "num_stages": 1,
      "waves_per_eu": 0
    },
    "568": {
      "BLOCK_M": 32,
      "BLOCK_N": 16,
      "BLOCK_K": 64,
      "BLOCK_C": 64,
      "NUM_KSPLIT": 8,
      "num_warps": 4,
      "num_stages": 2,
      "waves_per_eu": 1
    },
    "4568": {
      "BLOCK_M": 256,
      "BLOCK_N": 16,
      "BLOCK_K": 32,
      "BLOCK_C": 128,
      "NUM_KSPLIT": 2,
      "num_warps": 8,
      "num_stages": 1,
      "waves_per_eu": 2
    },
    "4322": {
      "BLOCK_M": 256,
      "BLOCK_N": 16,
      "BLOCK_K": 32,
      "BLOCK_C": 16,
      "NUM_KSPLIT": 1,
      "num_warps": 2,
      "num_stages": 1,
      "waves_per_eu": 2
    },
    "1": {
      "BLOCK_M": 32,
      "BLOCK_N": 16,
      "BLOCK_K": 32,
      "BLOCK_C": 16,
      "NUM_KSPLIT": 1,
      "num_warps": 2,
      "num_stages": 1,
      "waves_per_eu": 1
    },
    "3514": {
      "BLOCK_M": 128,
      "BLOCK_N": 16,
      "BLOCK_K": 64,
      "BLOCK_C": 128,
      "NUM_KSPLIT": 8,
      "num_warps": 2,
      "num_stages": 2,
      "waves_per_eu": 1
    },
    "446": {
      "BLOCK_M": 32,
      "BLOCK_N": 16,
      "BLOCK_K": 64,
      "BLOCK_C": 32,
      "NUM_KSPLIT": 1,
      "num_warps": 8,
      "num_stages": 1,
      "waves_per_eu": 2
    },
    "4179": {
      "BLOCK_M": 128,
      "BLOCK_N": 16,
      "BLOCK_K": 256,
      "BLOCK_C": 128,
      "NUM_KSPLIT": 1,
      "num_warps": 2,
      "num_stages": 2,
      "waves_per_eu": 0
    },
    "3427": {
      "BLOCK_M": 128,
      "BLOCK_N": 16,
      "BLOCK_K": 64,
      "BLOCK_C": 64,
      "NUM_KSPLIT": 4,
      "num_warps": 4,
      "num_stages": 1,
      "waves_per_eu": 1
    },
    "3610": {
      "BLOCK_M": 128,
      "BLOCK_N": 16,
      "BLOCK_K": 128,
      "BLOCK_C": 16,
      "NUM_KSPLIT": 1,
      "num_warps": 4,
      "num_stages": 2,
      "waves_per_eu": 1
    },
    "3003": {
      "BLOCK_M": 128,
      "BLOCK_N": 16,
      "BLOCK_K": 32,
      "BLOCK_C": 32,
      "NUM_KSPLIT": 4,
      "num_warps": 8,
      "num_stages": 2,
      "waves_per_eu": 0
    },
    "2949": {
      "BLOCK_M": 128,
      "BLOCK_N": 16,
      "BLOCK_K": 32,
      "BLOCK_C": 16,
      "NUM_KSPLIT": 8,
      "num_warps": 8,
      "num_stages": 2,
      "waves_per_eu": 0
    },
    "3448": {
      "BLOCK_M": 128,
      "BLOCK_N": 16,
      "BLOCK_K": 64,
      "BLOCK_C": 64,
      "NUM_KSPLIT": 8,
      "num_warps": 4,
      "num_stages": 2,
      "waves_per_eu": 1
    },
    "5101": {
      "BLOCK_M": 256,
      "BLOCK_N": 16,
      "BLOCK_K": 128,
      "BLOCK_C": 16,
      "NUM_KSPLIT": 8,
      "num_warps": 4,
      "num_stages": 1,
      "waves_per_eu": 1
    },
    "2099": {
      "BLOCK_M": 64,
      "BLOCK_N": 16,
      "BLOCK_K": 64,
      "BLOCK_C": 256,
      "NUM_KSPLIT": 1,
      "num_warps": 4,
      "num_stages": 2,
      "waves_per_eu": 2
    },
    "4934": {
      "BLOCK_M": 256,
      "BLOCK_N": 16,
      "BLOCK_K": 64,
      "BLOCK_C": 128,
      "NUM_KSPLIT": 4,
      "num_warps": 2,
      "num_stages": 1,
      "waves_per_eu": 2
    },
    "1348": {
      "BLOCK_M": 32,
      "BLOCK_N": 16,
      "BLOCK_K": 256,
      "BLOCK_C": 128,
      "NUM_KSPLIT": 4,
      "num_warps": 8,
      "num_stages": 2,
      "waves_per_eu": 1
    },
    "5619": {
      "BLOCK_M": 256,
      "BLOCK_N": 16,
      "BLOCK_K": 256,
      "BLOCK_C": 128,
      "NUM_KSPLIT": 1,
      "num_warps": 2,
      "num_stages": 2,
      "waves_per_eu": 0
    },
    "3368": {
      "BLOCK_M": 128,
      "BLOCK_N": 16,
      "BLOCK_K": 64,
      "BLOCK_C": 32,
      "NUM_KSPLIT": 8,
      "num_warps": 2,
      "num_stages": 1,
      "waves_per_eu": 2
    },
    "1347": {
      "BLOCK_M": 32,
      "BLOCK_N": 16,
      "BLOCK_K": 256,
      "BLOCK_C": 128,
      "NUM_KSPLIT": 4,
      "num_warps": 8,
      "num_stages": 2,
      "waves_per_eu": 0
    },
    "313": {
      "BLOCK_M": 32,
      "BLOCK_N": 16,
      "BLOCK_K": 32,
      "BLOCK_C": 256,
      "NUM_KSPLIT": 2,
      "num_warps": 4,
      "num_stages": 1,
      "waves_per_eu": 1
    },
    "1286": {
      "BLOCK_M": 32,
      "BLOCK_N": 16,
      "BLOCK_K": 256,
      "BLOCK_C": 64,
      "NUM_KSPLIT": 8,
      "num_warps": 4,
      "num_stages": 1,
      "waves_per_eu": 2
    },
    "1559": {
      "BLOCK_M": 64,
      "BLOCK_N": 16,
      "BLOCK_K": 32,
      "BLOCK_C": 32,
      "NUM_KSPLIT": 4,
      "num_warps": 4,
      "num_stages": 2,
      "waves_per_eu": 2
    },
    "1047": {
      "BLOCK_M": 32,
      "BLOCK_N": 16,
      "BLOCK_K": 128,
      "BLOCK_C": 256,
      "NUM_KSPLIT": 4,
      "num_warps": 2,
      "num_stages": 2,
      "waves_per_eu": 0
    },
    "2883": {
      "BLOCK_M": 128,
      "BLOCK_N": 16,
      "BLOCK_K": 32,
      "BLOCK_C": 16,
      "NUM_KSPLIT": 1,
      "num_warps": 2,
      "num_stages": 2,
      "waves_per_eu": 0
    },
    "2379": {
      "BLOCK_M": 64,
      "BLOCK_N": 16,
      "BLOCK_K": 128,
      "BLOCK_C": 128,
      "NUM_KSPLIT": 1,
      "num_warps": 2,
      "num_stages": 2,
      "waves_per_eu": 0
    },
    "530": {
      "BLOCK_M": 32,
      "BLOCK_N": 16,
      "BLOCK_K": 64,
      "BLOCK_C": 64,
      "NUM_KSPLIT": 2,
      "num_warps": 4,
      "num_stages": 1,
      "waves_per_eu": 2
    },
    "677": {
      "BLOCK_M": 32,
      "BLOCK_N": 16,
      "BLOCK_K": 64,
      "BLOCK_C": 256,
      "NUM_KSPLIT": 2,
      "num_warps": 4,
      "num_stages": 2,
      "waves_per_eu": 2
    },
    "3373": {
      "BLOCK_M": 128,
      "BLOCK_N": 16,
      "BLOCK_K": 64,
      "BLOCK_C": 32,
      "NUM_KSPLIT": 8,
      "num_warps": 4,
      "num_stages": 1,
      "waves_per_eu": 1
    },
    "491": {
      "BLOCK_M": 32,
      "BLOCK_N": 16,
      "BLOCK_K": 64,
      "BLOCK_C": 32,
      "NUM_KSPLIT": 8,
      "num_warps": 2,
      "num_stages": 2,
      "waves_per_eu": 2
    },
    "3735": {
      "BLOCK_M": 128,
      "BLOCK_N": 16,
      "BLOCK_K": 128,
      "BLOCK_C": 32,
      "NUM_KSPLIT": 8,
      "num_warps": 4,
      "num_stages": 2,
      "waves_per_eu": 0
    },
    "627": {
      "BLOCK_M": 32,
      "BLOCK_N": 16,
      "BLOCK_K": 64,
      "BLOCK_C": 128,
      "NUM_KSPLIT": 4,
      "num_warps": 8,
      "num_stages": 2,
      "waves_per_eu": 0
    },
    "1365": {
      "BLOCK_M": 32,
      "BLOCK_N": 16,
      "BLOCK_K": 256,
      "BLOCK_C": 128,
      "NUM_KSPLIT": 8,
      "num_warps": 8,
      "num_stages": 2,
      "waves_per_eu": 0
    },
    "843": {
      "BLOCK_M": 32,
      "BLOCK_N": 16,
      "BLOCK_K": 128,
      "BLOCK_C": 32,
      "NUM_KSPLIT": 4,
      "num_warps": 8,
      "num_stages": 2,
      "waves_per_eu": 0
    },
    "4117": {
      "BLOCK_M": 128,
      "BLOCK_N": 16,
      "BLOCK_K": 256,
      "BLOCK_C": 64,
      "NUM_KSPLIT": 1,
      "num_warps": 8,
      "num_stages": 1,
      "waves_per_eu": 1
    },
    "1529": {
      "BLOCK_M": 64,
      "BLOCK_N": 16,
      "BLOCK_K": 32,
      "BLOCK_C": 32,
      "NUM_KSPLIT": 1,
      "num_warps": 8,
      "num_stages": 2,
      "waves_per_eu": 2
    },
    "5201": {
      "BLOCK_M": 256,
      "BLOCK_N": 16,
      "BLOCK_K": 128,
      "BLOCK_C": 64,
      "NUM_KSPLIT": 1,
      "num_warps": 8,
      "num_stages": 2,
      "waves_per_eu": 2
    },
    "3901": {
      "BLOCK_M": 128,
      "BLOCK_N": 16,
      "BLOCK_K": 128,
      "BLOCK_C": 256,
      "NUM_KSPLIT": 1,
      "num_warps": 8,
      "num_stages": 1,
      "waves_per_eu": 1
    },
    "4450": {
      "BLOCK_M": 256,
      "BLOCK_N": 16,
      "BLOCK_K": 32,
      "BLOCK_C": 32,
      "NUM_KSPLIT": 8,
      "num_warps": 2,
      "num_stages": 2,
      "waves_per_eu": 1
    },
    "782": {
      "BLOCK_M": 32,
      "BLOCK_N": 16,
      "BLOCK_K": 128,
      "BLOCK_C": 16,
      "NUM_KSPLIT": 8,
      "num_warps": 4,
      "num_stages": 1,
      "waves_per_eu": 2
    },
    "4483": {
      "BLOCK_M": 256,
      "BLOCK_N": 16,
      "BLOCK_K": 32,
      "BLOCK_C": 64,
      "NUM_KSPLIT": 2,
      "num_warps": 2,
      "num_stages": 1,
      "waves_per_eu": 1
    },
    "4546": {
      "BLOCK_M": 256,
      "BLOCK_N": 16,
      "BLOCK_K": 32,
      "BLOCK_C": 128,
      "NUM_KSPLIT": 1,
      "num_warps": 4,
      "num_stages": 2,
      "waves_per_eu": 1
    },
    "1727": {
      "BLOCK_M": 64,
      "BLOCK_N": 16,
      "BLOCK_K": 32,
      "BLOCK_C": 128,
      "NUM_KSPLIT": 8,
      "num_warps": 8,
      "num_stages": 2,
      "waves_per_eu": 2
    },
    "1291": {
      "BLOCK_M": 32,
      "BLOCK_N": 16,
      "BLOCK_K": 256,
      "BLOCK_C": 64,
      "NUM_KSPLIT": 8,
      "num_warps": 8,
      "num_stages": 1,
      "waves_per_eu": 1
    },
    "5645": {
      "BLOCK_M": 256,
      "BLOCK_N": 16,
      "BLOCK_K": 256,
      "BLOCK_C": 128,
      "NUM_KSPLIT": 2,
      "num_warps": 4,
      "num_stages": 2,
      "waves_per_eu": 2
    },
    "1725": {
      "BLOCK_M": 64,
      "BLOCK_N": 16,
      "BLOCK_K": 32,
      "BLOCK_C": 128,
      "NUM_KSPLIT": 8,
      "num_warps": 8,
      "num_stages": 2,
      "waves_per_eu": 0
    },
    "4852": {
      "BLOCK_M": 256,
      "BLOCK_N": 16,
      "BLOCK_K": 64,
      "BLOCK_C": 64,
      "NUM_KSPLIT": 2,
      "num_warps": 4,
      "num_stages": 2,
      "waves_per_eu": 1
    },
    "1256": {
      "BLOCK_M": 32,
      "BLOCK_N": 16,
      "BLOCK_K": 256,
      "BLOCK_C": 64,
      "NUM_KSPLIT": 2,
      "num_warps": 8,
      "num_stages": 1,
      "waves_per_eu": 2
    },
    "4235": {
      "BLOCK_M": 128,
      "BLOCK_N": 16,
      "BLOCK_K": 256,
      "BLOCK_C": 128,
      "NUM_KSPLIT": 8,
      "num_warps": 2,
      "num_stages": 2,
      "waves_per_eu": 2
    },
    "2435": {
      "BLOCK_M": 64,
      "BLOCK_N": 16,
      "BLOCK_K": 128,
      "BLOCK_C": 128,
      "NUM_KSPLIT": 8,
      "num_warps": 2,
      "num_stages": 2,
      "waves_per_eu": 2
    },
    "2005": {
      "BLOCK_M": 64,
      "BLOCK_N": 16,
      "BLOCK_K": 64,
      "BLOCK_C": 64,
      "NUM_KSPLIT": 8,
      "num_warps": 4,
      "num_stages": 1,
      "waves_per_eu": 1
    },
    "4430": {
      "BLOCK_M": 256,
      "BLOCK_N": 16,
      "BLOCK_K": 32,
      "BLOCK_C": 32,
      "NUM_KSPLIT": 4,
      "num_warps": 2,
      "num_stages": 1,
      "waves_per_eu": 2
    },
    "5350": {
      "BLOCK_M": 256,
      "BLOCK_N": 16,
      "BLOCK_K": 128,
      "BLOCK_C": 256,
      "NUM_KSPLIT": 2,
      "num_warps": 2,
      "num_stages": 2,
      "waves_per_eu": 1
    },
    "2021": {
      "BLOCK_M": 64,
      "BLOCK_N": 16,
      "BLOCK_K": 64,
      "BLOCK_C": 128,
      "NUM_KSPLIT": 1,
      "num_warps": 2,
      "num_stages": 2,
      "waves_per_eu": 2
    },
    "580": {
      "BLOCK_M": 32,
      "BLOCK_N": 16,
      "BLOCK_K": 64,
      "BLOCK_C": 128,
      "NUM_KSPLIT": 1,
      "num_warps": 2,
      "num_stages": 2,
      "waves_per_eu": 1
    },
    "3428": {
      "BLOCK_M": 128,
      "BLOCK_N": 16,
      "BLOCK_K": 64,
      "BLOCK_C": 64,
      "NUM_KSPLIT": 4,
      "num_warps": 4,
      "num_stages": 1,
      "waves_per_eu": 2
    },
    "743": {
      "BLOCK_M": 32,
      "BLOCK_N": 16,
      "BLOCK_K": 128,
      "BLOCK_C": 16,
      "NUM_KSPLIT": 2,
      "num_warps": 2,
      "num_stages": 2,
      "waves_per_eu": 2
    },
    "1988": {
      "BLOCK_M": 64,
      "BLOCK_N": 16,
      "BLOCK_K": 64,
      "BLOCK_C": 64,
      "NUM_KSPLIT": 4,
      "num_warps": 4,
      "num_stages": 1,
      "waves_per_eu": 2
    },
    "585": {
      "BLOCK_M": 32,
      "BLOCK_N": 16,
      "BLOCK_K": 64,
      "BLOCK_C": 128,
      "NUM_KSPLIT": 1,
      "num_warps": 4,
      "num_stages": 2,
      "waves_per_eu": 0
    },
    "965": {
      "BLOCK_M": 32,
      "BLOCK_N": 16,
      "BLOCK_K": 128,
      "BLOCK_C": 128,
      "NUM_KSPLIT": 2,
      "num_warps": 4,
      "num_stages": 2,
      "waves_per_eu": 2
    },
    "5197": {
      "BLOCK_M": 256,
      "BLOCK_N": 16,
      "BLOCK_K": 128,
      "BLOCK_C": 64,
      "NUM_KSPLIT": 1,
      "num_warps": 8,
      "num_stages": 1,
      "waves_per_eu": 1
    },
    "560": {
      "BLOCK_M": 32,
      "BLOCK_N": 16,
      "BLOCK_K": 64,
      "BLOCK_C": 64,
      "NUM_KSPLIT": 8,
      "num_warps": 2,
      "num_stages": 1,
      "waves_per_eu": 2
    },
    "3027": {
      "BLOCK_M": 128,
      "BLOCK_N": 16,
      "BLOCK_K": 32,
      "BLOCK_C": 64,
      "NUM_KSPLIT": 1,
      "num_warps": 2,
      "num_stages": 2,
      "waves_per_eu": 0
    },
    "2529": {
      "BLOCK_M": 64,
      "BLOCK_N": 16,
      "BLOCK_K": 256,
      "BLOCK_C": 16,
      "NUM_KSPLIT": 1,
      "num_warps": 4,
      "num_stages": 2,
      "waves_per_eu": 0
    },
    "4421": {
      "BLOCK_M": 256,
      "BLOCK_N": 16,
      "BLOCK_K": 32,
      "BLOCK_C": 32,
      "NUM_KSPLIT": 2,
      "num_warps": 4,
      "num_stages": 2,
      "waves_per_eu": 2
    },
    "1170": {
      "BLOCK_M": 32,
      "BLOCK_N": 16,
      "BLOCK_K": 256,
      "BLOCK_C": 32,
      "NUM_KSPLIT": 2,
      "num_warps": 2,
      "num_stages": 1,
      "waves_per_eu": 0
    },
    "1585": {
      "BLOCK_M": 64,
      "BLOCK_N": 16,
      "BLOCK_K": 32,
      "BLOCK_C": 64,
      "NUM_KSPLIT": 1,
      "num_warps": 2,
      "num_stages": 1,
      "waves_per_eu": 1
    },
    "3551": {
      "BLOCK_M": 128,
      "BLOCK_N": 16,
      "BLOCK_K": 64,
      "BLOCK_C": 256,
      "NUM_KSPLIT": 2,
      "num_warps": 2,
      "num_stages": 2,
      "waves_per_eu": 2
    },
    "3083": {
      "BLOCK_M": 128,
      "BLOCK_N": 16,
      "BLOCK_K": 32,
      "BLOCK_C": 64,
      "NUM_KSPLIT": 8,
      "num_warps": 2,
      "num_stages": 2,
      "waves_per_eu": 2
    },
    "5000": {
      "BLOCK_M": 256,
      "BLOCK_N": 16,
      "BLOCK_K": 64,
      "BLOCK_C": 256,
      "NUM_KSPLIT": 2,
      "num_warps": 8,
      "num_stages": 1,
      "waves_per_eu": 2
    },
    "5020": {
      "BLOCK_M": 256,
      "BLOCK_N": 16,
      "BLOCK_K": 64,
      "BLOCK_C": 256,
      "NUM_KSPLIT": 4,
      "num_warps": 8,
      "num_stages": 2,
      "waves_per_eu": 1
    },
    "325": {
      "BLOCK_M": 32,
      "BLOCK_N": 16,
      "BLOCK_K": 32,
      "BLOCK_C": 256,
      "NUM_KSPLIT": 4,
      "num_warps": 2,
      "num_stages": 1,
      "waves_per_eu": 1
    },
    "5186": {
      "BLOCK_M": 256,
      "BLOCK_N": 16,
      "BLOCK_K": 128,
      "BLOCK_C": 64,
      "NUM_KSPLIT": 1,
      "num_warps": 2,
      "num_stages": 1,
      "waves_per_eu": 2
    },
    "3242": {
      "BLOCK_M": 128,
      "BLOCK_N": 16,
      "BLOCK_K": 64,
      "BLOCK_C": 16,
      "NUM_KSPLIT": 1,
      "num_warps": 2,
      "num_stages": 1,
      "waves_per_eu": 2
    },
    "115": {
      "BLOCK_M": 32,
      "BLOCK_N": 16,
      "BLOCK_K": 32,
      "BLOCK_C": 32,
      "NUM_KSPLIT": 4,
      "num_warps": 4,
      "num_stages": 1,
      "waves_per_eu": 1
    },
    "5655": {
      "BLOCK_M": 256,
      "BLOCK_N": 16,
      "BLOCK_K": 256,
      "BLOCK_C": 128,
      "NUM_KSPLIT": 4,
      "num_warps": 2,
      "num_stages": 2,
      "waves_per_eu": 0
    },
    "3515": {
      "BLOCK_M": 128,
      "BLOCK_N": 16,
      "BLOCK_K": 64,
      "BLOCK_C": 128,
      "NUM_KSPLIT": 8,
      "num_warps": 2,
      "num_stages": 2,
      "waves_per_eu": 2
    },
    "5692": {
      "BLOCK_M": 256,
      "BLOCK_N": 16,
      "BLOCK_K": 256,
      "BLOCK_C": 256,
      "NUM_KSPLIT": 1,
      "num_warps": 2,
      "num_stages": 2,
      "waves_per_eu": 1
    },
    "4050": {
      "BLOCK_M": 128,
      "BLOCK_N": 16,
      "BLOCK_K": 256,
      "BLOCK_C": 32,
      "NUM_KSPLIT": 2,
      "num_warps": 2,
      "num_stages": 1,
      "waves_per_eu": 0
    },
    "3561": {
      "BLOCK_M": 128,
      "BLOCK_N": 16,
      "BLOCK_K": 64,
      "BLOCK_C": 256,
      "NUM_KSPLIT": 2,
      "num_warps": 8,
      "num_stages": 2,
      "waves_per_eu": 0
    },
    "3917": {
      "BLOCK_M": 128,
      "BLOCK_N": 16,
      "BLOCK_K": 128,
      "BLOCK_C": 256,
      "NUM_KSPLIT": 2,
      "num_warps": 4,
      "num_stages": 2,
      "waves_per_eu": 2
    },
    "4049": {
      "BLOCK_M": 128,
      "BLOCK_N": 16,
      "BLOCK_K": 256,
      "BLOCK_C": 32,
      "NUM_KSPLIT": 1,
      "num_warps": 8,
      "num_stages": 2,
      "waves_per_eu": 2
    },
    "2624": {
      "BLOCK_M": 64,
      "BLOCK_N": 16,
      "BLOCK_K": 256,
      "BLOCK_C": 32,
      "NUM_KSPLIT": 2,
      "num_warps": 8,
      "num_stages": 1,
      "waves_per_eu": 2
    },
    "697": {
      "BLOCK_M": 32,
      "BLOCK_N": 16,
      "BLOCK_K": 64,
      "BLOCK_C": 256,
      "NUM_KSPLIT": 4,
      "num_warps": 8,
      "num_stages": 1,
      "waves_per_eu": 1
    },
    "5135": {
      "BLOCK_M": 256,
      "BLOCK_N": 16,
      "BLOCK_K": 128,
      "BLOCK_C": 32,
      "NUM_KSPLIT": 2,
      "num_warps": 2,
      "num_stages": 2,
      "waves_per_eu": 2
    },
    "5179": {
      "BLOCK_M": 256,
      "BLOCK_N": 16,
      "BLOCK_K": 128,
      "BLOCK_C": 32,
      "NUM_KSPLIT": 8,
      "num_warps": 8,
      "num_stages": 1,
      "waves_per_eu": 1
    },
    "672": {
      "BLOCK_M": 32,
      "BLOCK_N": 16,
      "BLOCK_K": 64,
      "BLOCK_C": 256,
      "NUM_KSPLIT": 2,
      "num_warps": 4,
      "num_stages": 1,
      "waves_per_eu": 0
    },
    "2239": {
      "BLOCK_M": 64,
      "BLOCK_N": 16,
      "BLOCK_K": 128,
      "BLOCK_C": 32,
      "NUM_KSPLIT": 1,
      "num_warps": 4,
      "num_stages": 1,
      "waves_per_eu": 1
    },
    "1538": {
      "BLOCK_M": 64,
      "BLOCK_N": 16,
      "BLOCK_K": 32,
      "BLOCK_C": 32,
      "NUM_KSPLIT": 2,
      "num_warps": 4,
      "num_stages": 1,
      "waves_per_eu": 2
    },
    "4420": {
      "BLOCK_M": 256,
      "BLOCK_N": 16,
      "BLOCK_K": 32,
      "BLOCK_C": 32,
      "NUM_KSPLIT": 2,
      "num_warps": 4,
      "num_stages": 2,
      "waves_per_eu": 1
    },
    "3760": {
      "BLOCK_M": 128,
      "BLOCK_N": 16,
      "BLOCK_K": 128,
      "BLOCK_C": 64,
      "NUM_KSPLIT": 1,
      "num_warps": 8,
      "num_stages": 2,
      "waves_per_eu": 1
    },
    "955": {
      "BLOCK_M": 32,
      "BLOCK_N": 16,
      "BLOCK_K": 128,
      "BLOCK_C": 128,
      "NUM_KSPLIT": 2,
      "num_warps": 2,
      "num_stages": 1,
      "waves_per_eu": 1
    },
    "5536": {
      "BLOCK_M": 256,
      "BLOCK_N": 16,
      "BLOCK_K": 256,
      "BLOCK_C": 32,
      "NUM_KSPLIT": 8,
      "num_warps": 4,
      "num_stages": 2,
      "waves_per_eu": 1
    },
    "5506": {
      "BLOCK_M": 256,
      "BLOCK_N": 16,
      "BLOCK_K": 256,
      "BLOCK_C": 32,
      "NUM_KSPLIT": 2,
      "num_warps": 8,
      "num_stages": 2,
      "waves_per_eu": 1
    },
    "124": {
      "BLOCK_M": 32,
      "BLOCK_N": 16,
      "BLOCK_K": 32,
      "BLOCK_C": 32,
      "NUM_KSPLIT": 4,
      "num_warps": 8,
      "num_stages": 2,
      "waves_per_eu": 1
    },
    "3362": {
      "BLOCK_M": 128,
      "BLOCK_N": 16,
      "BLOCK_K": 64,
      "BLOCK_C": 32,
      "NUM_KSPLIT": 4,
      "num_warps": 8,
      "num_stages": 1,
      "waves_per_eu": 2
    },
    "1707": {
      "BLOCK_M": 64,
      "BLOCK_N": 16,
      "BLOCK_K": 32,
      "BLOCK_C": 128,
      "NUM_KSPLIT": 4,
      "num_warps": 8,
      "num_stages": 2,
      "waves_per_eu": 0
    },
    "5174": {
      "BLOCK_M": 256,
      "BLOCK_N": 16,
      "BLOCK_K": 128,
      "BLOCK_C": 32,
      "NUM_KSPLIT": 8,
      "num_warps": 4,
      "num_stages": 1,
      "waves_per_eu": 2
    },
    "3170": {
      "BLOCK_M": 128,
      "BLOCK_N": 16,
      "BLOCK_K": 32,
      "BLOCK_C": 256,
      "NUM_KSPLIT": 1,
      "num_warps": 2,
      "num_stages": 1,
      "waves_per_eu": 2
    },
    "310": {
      "BLOCK_M": 32,
      "BLOCK_N": 16,
      "BLOCK_K": 32,
      "BLOCK_C": 256,
      "NUM_KSPLIT": 2,
      "num_warps": 2,
      "num_stages": 2,
      "waves_per_eu": 1
    },
    "264": {
      "BLOCK_M": 32,
      "BLOCK_N": 16,
      "BLOCK_K": 32,
      "BLOCK_C": 128,
      "NUM_KSPLIT": 4,
      "num_warps": 8,
      "num_stages": 1,
      "waves_per_eu": 0
    },
    "3850": {
      "BLOCK_M": 128,
      "BLOCK_N": 16,
      "BLOCK_K": 128,
      "BLOCK_C": 128,
      "NUM_KSPLIT": 2,
      "num_warps": 8,
      "num_stages": 2,
      "waves_per_eu": 1
    },
    "2161": {
      "BLOCK_M": 64,
      "BLOCK_N": 16,
      "BLOCK_K": 128,
      "BLOCK_C": 16,
      "NUM_KSPLIT": 1,
      "num_warps": 2,
      "num_stages": 1,
      "waves_per_eu": 1
    },
    "150": {
      "BLOCK_M": 32,
      "BLOCK_N": 16,
      "BLOCK_K": 32,
      "BLOCK_C": 64,
      "NUM_KSPLIT": 1,
      "num_warps": 4,
      "num_stages": 1,
      "waves_per_eu": 0
    },
    "622": {
      "BLOCK_M": 32,
      "BLOCK_N": 16,
      "BLOCK_K": 64,
      "BLOCK_C": 128,
      "NUM_KSPLIT": 4,
      "num_warps": 4,
      "num_stages": 2,
      "waves_per_eu": 1
    },
    "3739": {
      "BLOCK_M": 128,
      "BLOCK_N": 16,
      "BLOCK_K": 128,
      "BLOCK_C": 32,
      "NUM_KSPLIT": 8,
      "num_warps": 8,
      "num_stages": 1,
      "waves_per_eu": 1
    },
    "257": {
      "BLOCK_M": 32,
      "BLOCK_N": 16,
      "BLOCK_K": 32,
      "BLOCK_C": 128,
      "NUM_KSPLIT": 4,
      "num_warps": 2,
      "num_stages": 2,
      "waves_per_eu": 2
    },
    "3516": {
      "BLOCK_M": 128,
      "BLOCK_N": 16,
      "BLOCK_K": 64,
      "BLOCK_C": 128,
      "NUM_KSPLIT": 8,
      "num_warps": 4,
      "num_stages": 1,
      "waves_per_eu": 0
    },
    "4045": {
      "BLOCK_M": 128,
      "BLOCK_N": 16,
      "BLOCK_K": 256,
      "BLOCK_C": 32,
      "NUM_KSPLIT": 1,
      "num_warps": 8,
      "num_stages": 1,
      "waves_per_eu": 1
    },
    "1288": {
      "BLOCK_M": 32,
      "BLOCK_N": 16,
      "BLOCK_K": 256,
      "BLOCK_C": 64,
      "NUM_KSPLIT": 8,
      "num_warps": 4,
      "num_stages": 2,
      "waves_per_eu": 1
    },
    "4129": {
      "BLOCK_M": 128,
      "BLOCK_N": 16,
      "BLOCK_K": 256,
      "BLOCK_C": 64,
      "NUM_KSPLIT": 2,
      "num_warps": 4,
      "num_stages": 1,
      "waves_per_eu": 1
    },
    "2429": {
      "BLOCK_M": 64,
      "BLOCK_N": 16,
      "BLOCK_K": 128,
      "BLOCK_C": 128,
      "NUM_KSPLIT": 4,
      "num_warps": 8,
      "num_stages": 2,
      "waves_per_eu": 2
    },
    "4449": {
      "BLOCK_M": 256,
      "BLOCK_N": 16,
      "BLOCK_K": 32,
      "BLOCK_C": 32,
      "NUM_KSPLIT": 8,
      "num_warps": 2,
      "num_stages": 2,
      "waves_per_eu": 0
    },
    "3825": {
      "BLOCK_M": 128,
      "BLOCK_N": 16,
      "BLOCK_K": 128,
      "BLOCK_C": 128,
      "NUM_KSPLIT": 1,
      "num_warps": 4,
      "num_stages": 2,
      "waves_per_eu": 0
    },
    "892": {
      "BLOCK_M": 32,
      "BLOCK_N": 16,
      "BLOCK_K": 128,
      "BLOCK_C": 64,
      "NUM_KSPLIT": 2,
      "num_warps": 4,
      "num_stages": 2,
      "waves_per_eu": 1
    },
    "4345": {
      "BLOCK_M": 256,
      "BLOCK_N": 16,
      "BLOCK_K": 32,
      "BLOCK_C": 16,
      "NUM_KSPLIT": 2,
      "num_warps": 4,
      "num_stages": 1,
      "waves_per_eu": 1
    },
    "1103": {
      "BLOCK_M": 32,
      "BLOCK_N": 16,
      "BLOCK_K": 256,
      "BLOCK_C": 16,
      "NUM_KSPLIT": 2,
      "num_warps": 2,
      "num_stages": 2,
      "waves_per_eu": 2
    },
    "1033": {
      "BLOCK_M": 32,
      "BLOCK_N": 16,
      "BLOCK_K": 128,
      "BLOCK_C": 256,
      "NUM_KSPLIT": 2,
      "num_warps": 4,
      "num_stages": 1,
      "waves_per_eu": 1
    },
    "2799": {
      "BLOCK_M": 64,
      "BLOCK_N": 16,
      "BLOCK_K": 256,
      "BLOCK_C": 128,
      "NUM_KSPLIT": 8,
      "num_warps": 4,
      "num_stages": 2,
      "waves_per_eu": 0
    },
    "4576": {
      "BLOCK_M": 256,
      "BLOCK_N": 16,
      "BLOCK_K": 32,
      "BLOCK_C": 128,
      "NUM_KSPLIT": 4,
      "num_warps": 2,
      "num_stages": 2,
      "waves_per_eu": 1
    },
    "2848": {
      "BLOCK_M": 64,
      "BLOCK_N": 16,
      "BLOCK_K": 256,
      "BLOCK_C": 256,
      "NUM_KSPLIT": 4,
      "num_warps": 2,
      "num_stages": 2,
      "waves_per_eu": 1
    },
    "4038": {
      "BLOCK_M": 128,
      "BLOCK_N": 16,
      "BLOCK_K": 256,
      "BLOCK_C": 32,
      "NUM_KSPLIT": 1,
      "num_warps": 4,
      "num_stages": 1,
      "waves_per_eu": 0
    },
    "1784": {
      "BLOCK_M": 64,
      "BLOCK_N": 16,
      "BLOCK_K": 32,
      "BLOCK_C": 256,
      "NUM_KSPLIT": 8,
      "num_warps": 2,
      "num_stages": 1,
      "waves_per_eu": 2
    },
    "4259": {
      "BLOCK_M": 128,
      "BLOCK_N": 16,
      "BLOCK_K": 256,
      "BLOCK_C": 256,
      "NUM_KSPLIT": 1,
      "num_warps": 4,
      "num_stages": 2,
      "waves_per_eu": 2
    },
    "3677": {
      "BLOCK_M": 128,
      "BLOCK_N": 16,
      "BLOCK_K": 128,
      "BLOCK_C": 32,
      "NUM_KSPLIT": 1,
      "num_warps": 2,
      "num_stages": 2,
      "waves_per_eu": 2
    },
    "2784": {
      "BLOCK_M": 64,
      "BLOCK_N": 16,
      "BLOCK_K": 256,
      "BLOCK_C": 128,
      "NUM_KSPLIT": 4,
      "num_warps": 8,
      "num_stages": 1,
      "waves_per_eu": 0
    },
    "3710": {
      "BLOCK_M": 128,
      "BLOCK_N": 16,
      "BLOCK_K": 128,
      "BLOCK_C": 32,
      "NUM_KSPLIT": 4,
      "num_warps": 2,
      "num_stages": 1,
      "waves_per_eu": 2
    },
    "1023": {
      "BLOCK_M": 32,
      "BLOCK_N": 16,
      "BLOCK_K": 128,
      "BLOCK_C": 256,
      "NUM_KSPLIT": 1,
      "num_warps": 8,
      "num_stages": 2,
      "waves_per_eu": 0
    },
    "195": {
      "BLOCK_M": 32,
      "BLOCK_N": 16,
      "BLOCK_K": 32,
      "BLOCK_C": 64,
      "NUM_KSPLIT": 4,
      "num_warps": 8,
      "num_stages": 2,
      "waves_per_eu": 0
    },
    "4061": {
      "BLOCK_M": 128,
      "BLOCK_N": 16,
      "BLOCK_K": 256,
      "BLOCK_C": 32,
      "NUM_KSPLIT": 2,
      "num_warps": 4,
      "num_stages": 2,
      "waves_per_eu": 2
    },
    "2987": {
      "BLOCK_M": 128,
      "BLOCK_N": 16,
      "BLOCK_K": 32,
      "BLOCK_C": 32,
      "NUM_KSPLIT": 2,
      "num_warps": 8,
      "num_stages": 2,
      "waves_per_eu": 2
    },
    "528": {
      "BLOCK_M": 32,
      "BLOCK_N": 16,
      "BLOCK_K": 64,
      "BLOCK_C": 64,
      "NUM_KSPLIT": 2,
      "num_warps": 4,
      "num_stages": 1,
      "waves_per_eu": 0
    },
    "5229": {
      "BLOCK_M": 256,
      "BLOCK_N": 16,
      "BLOCK_K": 128,
      "BLOCK_C": 64,
      "NUM_KSPLIT": 4,
      "num_warps": 4,
      "num_stages": 2,
      "waves_per_eu": 0
    },
    "1643": {
      "BLOCK_M": 64,
      "BLOCK_N": 16,
      "BLOCK_K": 32,
      "BLOCK_C": 64,
      "NUM_KSPLIT": 8,
      "num_warps": 2,
      "num_stages": 2,
      "waves_per_eu": 2
    },
    "4875": {
      "BLOCK_M": 256,
      "BLOCK_N": 16,
      "BLOCK_K": 64,
      "BLOCK_C": 64,
      "NUM_KSPLIT": 4,
      "num_warps": 8,
      "num_stages": 2,
      "waves_per_eu": 0
    },
    "897": {
      "BLOCK_M": 32,
      "BLOCK_N": 16,
      "BLOCK_K": 128,
      "BLOCK_C": 64,
      "NUM_KSPLIT": 2,
      "num_warps": 8,
      "num_stages": 2,
      "waves_per_eu": 0
    },
    "3500": {
      "BLOCK_M": 128,
      "BLOCK_N": 16,
      "BLOCK_K": 64,
      "BLOCK_C": 128,
      "NUM_KSPLIT": 4,
      "num_warps": 4,
      "num_stages": 1,
      "waves_per_eu": 2
    },
    "3335": {
      "BLOCK_M": 128,
      "BLOCK_N": 16,
      "BLOCK_K": 64,
      "BLOCK_C": 32,
      "NUM_KSPLIT": 2,
      "num_warps": 2,
      "num_stages": 2,
      "waves_per_eu": 2
    },
    "3770": {
      "BLOCK_M": 128,
      "BLOCK_N": 16,
      "BLOCK_K": 128,
      "BLOCK_C": 64,
      "NUM_KSPLIT": 2,
      "num_warps": 4,
      "num_stages": 1,
      "waves_per_eu": 2
    },
    "281": {
      "BLOCK_M": 32,
      "BLOCK_N": 16,
      "BLOCK_K": 32,
      "BLOCK_C": 128,
      "NUM_KSPLIT": 8,
      "num_warps": 4,
      "num_stages": 2,
      "waves_per_eu": 2
    },
    "733": {
      "BLOCK_M": 32,
      "BLOCK_N": 16,
      "BLOCK_K": 128,
      "BLOCK_C": 16,
      "NUM_KSPLIT": 1,
      "num_warps": 8,
      "num_stages": 1,
      "waves_per_eu": 1
    },
    "3257": {
      "BLOCK_M": 128,
      "BLOCK_N": 16,
      "BLOCK_K": 64,
      "BLOCK_C": 16,
      "NUM_KSPLIT": 1,
      "num_warps": 8,
      "num_stages": 2,
      "waves_per_eu": 2
    },
    "61": {
      "BLOCK_M": 32,
      "BLOCK_N": 16,
      "BLOCK_K": 32,
      "BLOCK_C": 16,
      "NUM_KSPLIT": 8,
      "num_warps": 4,
      "num_stages": 1,
      "waves_per_eu": 1
    },
    "1907": {
      "BLOCK_M": 64,
      "BLOCK_N": 16,
      "BLOCK_K": 64,
      "BLOCK_C": 32,
      "NUM_KSPLIT": 2,
      "num_warps": 8,
      "num_stages": 2,
      "waves_per_eu": 2
    },
    "4265": {
      "BLOCK_M": 128,
      "BLOCK_N": 16,
      "BLOCK_K": 256,
      "BLOCK_C": 256,
      "NUM_KSPLIT": 1,
      "num_warps": 8,
      "num_stages": 2,
      "waves_per_eu": 2
    },
    "686": {
      "BLOCK_M": 32,
      "BLOCK_N": 16,
      "BLOCK_K": 64,
      "BLOCK_C": 256,
      "NUM_KSPLIT": 4,
      "num_warps": 2,
      "num_stages": 1,
      "waves_per_eu": 2
    },
    "515": {
      "BLOCK_M": 32,
      "BLOCK_N": 16,
      "BLOCK_K": 64,
      "BLOCK_C": 64,
      "NUM_KSPLIT": 1,
      "num_warps": 4,
      "num_stages": 2,
      "waves_per_eu": 2
    },
    "288": {
      "BLOCK_M": 32,
      "BLOCK_N": 16,
      "BLOCK_K": 32,
      "BLOCK_C": 256,
      "NUM_KSPLIT": 1,
      "num_warps": 2,
      "num_stages": 1,
      "waves_per_eu": 0
    },
    "1504": {
      "BLOCK_M": 64,
      "BLOCK_N": 16,
      "BLOCK_K": 32,
      "BLOCK_C": 16,
      "NUM_KSPLIT": 8,
      "num_warps": 4,
      "num_stages": 2,
      "waves_per_eu": 1
    },
    "1178": {
      "BLOCK_M": 32,
      "BLOCK_N": 16,
      "BLOCK_K": 256,
      "BLOCK_C": 32,
      "NUM_KSPLIT": 2,
      "num_warps": 4,
      "num_stages": 1,
      "waves_per_eu": 2
    },
    "5396": {
      "BLOCK_M": 256,
      "BLOCK_N": 16,
      "BLOCK_K": 128,
      "BLOCK_C": 256,
      "NUM_KSPLIT": 8,
      "num_warps": 8,
      "num_stages": 1,
      "waves_per_eu": 2
    },
    "4246": {
      "BLOCK_M": 128,
      "BLOCK_N": 16,
      "BLOCK_K": 256,
      "BLOCK_C": 128,
      "NUM_KSPLIT": 8,
      "num_warps": 8,
      "num_stages": 2,
      "waves_per_eu": 1
    },
    "2081": {
      "BLOCK_M": 64,
      "BLOCK_N": 16,
      "BLOCK_K": 64,
      "BLOCK_C": 128,
      "NUM_KSPLIT": 8,
      "num_warps": 4,
      "num_stages": 2,
      "waves_per_eu": 2
    },
    "4574": {
      "BLOCK_M": 256,
      "BLOCK_N": 16,
      "BLOCK_K": 32,
      "BLOCK_C": 128,
      "NUM_KSPLIT": 4,
      "num_warps": 2,
      "num_stages": 1,
      "waves_per_eu": 2
    },
    "1250": {
      "BLOCK_M": 32,
      "BLOCK_N": 16,
      "BLOCK_K": 256,
      "BLOCK_C": 64,
      "NUM_KSPLIT": 2,
      "num_warps": 4,
      "num_stages": 1,
      "waves_per_eu": 2
    },
    "582": {
      "BLOCK_M": 32,
      "BLOCK_N": 16,
      "BLOCK_K": 64,
      "BLOCK_C": 128,
      "NUM_KSPLIT": 1,
      "num_warps": 4,
      "num_stages": 1,
      "waves_per_eu": 0
    },
    "794": {
      "BLOCK_M": 32,
      "BLOCK_N": 16,
      "BLOCK_K": 128,
      "BLOCK_C": 32,
      "NUM_KSPLIT": 1,
      "num_warps": 2,
      "num_stages": 1,
      "waves_per_eu": 2
    },
    "1444": {
      "BLOCK_M": 64,
      "BLOCK_N": 16,
      "BLOCK_K": 32,
      "BLOCK_C": 16,
      "NUM_KSPLIT": 1,
      "num_warps": 2,
      "num_stages": 2,
      "waves_per_eu": 1
    },
    "4360": {
      "BLOCK_M": 256,
      "BLOCK_N": 16,
      "BLOCK_K": 32,
      "BLOCK_C": 16,
      "NUM_KSPLIT": 4,
      "num_warps": 2,
      "num_stages": 2,
      "waves_per_eu": 1
    },
    "4278": {
      "BLOCK_M": 128,
      "BLOCK_N": 16,
      "BLOCK_K": 256,
      "BLOCK_C": 256,
      "NUM_KSPLIT": 2,
      "num_warps": 8,
      "num_stages": 1,
      "waves_per_eu": 0
    },
    "4586": {
      "BLOCK_M": 256,
      "BLOCK_N": 16,
      "BLOCK_K": 32,
      "BLOCK_C": 128,
      "NUM_KSPLIT": 4,
      "num_warps": 8,
      "num_stages": 1,
      "waves_per_eu": 2
    },
    "4770": {
      "BLOCK_M": 256,
      "BLOCK_N": 16,
      "BLOCK_K": 64,
      "BLOCK_C": 32,
      "NUM_KSPLIT": 2,
      "num_warps": 2,
      "num_stages": 1,
      "waves_per_eu": 0
    },
    "812": {
      "BLOCK_M": 32,
      "BLOCK_N": 16,
      "BLOCK_K": 128,
      "BLOCK_C": 32,
      "NUM_KSPLIT": 2,
      "num_warps": 2,
      "num_stages": 1,
      "waves_per_eu": 2
    },
    "1853": {
      "BLOCK_M": 64,
      "BLOCK_N": 16,
      "BLOCK_K": 64,
      "BLOCK_C": 16,
      "NUM_KSPLIT": 4,
      "num_warps": 8,
      "num_stages": 2,
      "waves_per_eu": 2
    },
    "3446": {
      "BLOCK_M": 128,
      "BLOCK_N": 16,
      "BLOCK_K": 64,
      "BLOCK_C": 64,
      "NUM_KSPLIT": 8,
      "num_warps": 4,
      "num_stages": 1,
      "waves_per_eu": 2
    },
    "4300": {
      "BLOCK_M": 128,
      "BLOCK_N": 16,
      "BLOCK_K": 256,
      "BLOCK_C": 256,
      "NUM_KSPLIT": 4,
      "num_warps": 8,
      "num_stages": 2,
      "waves_per_eu": 1
    },
    "2551": {
      "BLOCK_M": 64,
      "BLOCK_N": 16,
      "BLOCK_K": 256,
      "BLOCK_C": 16,
      "NUM_KSPLIT": 2,
      "num_warps": 8,
      "num_stages": 1,
      "waves_per_eu": 1
    },
    "647": {
      "BLOCK_M": 32,
      "BLOCK_N": 16,
      "BLOCK_K": 64,
      "BLOCK_C": 128,
      "NUM_KSPLIT": 8,
      "num_warps": 8,
      "num_stages": 2,
      "waves_per_eu": 2
    },
    "2682": {
      "BLOCK_M": 64,
      "BLOCK_N": 16,
      "BLOCK_K": 256,
      "BLOCK_C": 64,
      "NUM_KSPLIT": 2,
      "num_warps": 2,
      "num_stages": 1,
      "waves_per_eu": 0
    },
    "4671": {
      "BLOCK_M": 256,
      "BLOCK_N": 16,
      "BLOCK_K": 32,
      "BLOCK_C": 256,
      "NUM_KSPLIT": 8,
      "num_warps": 4,
      "num_stages": 2,
      "waves_per_eu": 0
    },
    "4131": {
      "BLOCK_M": 128,
      "BLOCK_N": 16,
      "BLOCK_K": 256,
      "BLOCK_C": 64,
      "NUM_KSPLIT": 2,
      "num_warps": 4,
      "num_stages": 2,
      "waves_per_eu": 0
    },
    "2278": {
      "BLOCK_M": 64,
      "BLOCK_N": 16,
      "BLOCK_K": 128,
      "BLOCK_C": 32,
      "NUM_KSPLIT": 4,
      "num_warps": 4,
      "num_stages": 2,
      "waves_per_eu": 1
    },
    "3562": {
      "BLOCK_M": 128,
      "BLOCK_N": 16,
      "BLOCK_K": 64,
      "BLOCK_C": 256,
      "NUM_KSPLIT": 2,
      "num_warps": 8,
      "num_stages": 2,
      "waves_per_eu": 1
    },
    "4651": {
      "BLOCK_M": 256,
      "BLOCK_N": 16,
      "BLOCK_K": 32,
      "BLOCK_C": 256,
      "NUM_KSPLIT": 4,
      "num_warps": 4,
      "num_stages": 1,
      "waves_per_eu": 1
    },
    "4205": {
      "BLOCK_M": 128,
      "BLOCK_N": 16,
      "BLOCK_K": 256,
      "BLOCK_C": 128,
      "NUM_KSPLIT": 2,
      "num_warps": 4,
      "num_stages": 2,
      "waves_per_eu": 2
    },
    "2598": {
      "BLOCK_M": 64,
      "BLOCK_N": 16,
      "BLOCK_K": 256,
      "BLOCK_C": 32,
      "NUM_KSPLIT": 1,
      "num_warps": 4,
      "num_stages": 1,
      "waves_per_eu": 0
    },
    "618": {
      "BLOCK_M": 32,
      "BLOCK_N": 16,
      "BLOCK_K": 64,
      "BLOCK_C": 128,
      "NUM_KSPLIT": 4,
      "num_warps": 4,
      "num_stages": 1,
      "waves_per_eu": 0
    },
    "4978": {
      "BLOCK_M": 256,
      "BLOCK_N": 16,
      "BLOCK_K": 64,
      "BLOCK_C": 256,
      "NUM_KSPLIT": 1,
      "num_warps": 4,
      "num_stages": 2,
      "waves_per_eu": 1
    },
    "2663": {
      "BLOCK_M": 64,
      "BLOCK_N": 16,
      "BLOCK_K": 256,
      "BLOCK_C": 32,
      "NUM_KSPLIT": 8,
      "num_warps": 8,
      "num_stages": 2,
      "waves_per_eu": 2
    },
    "3849": {
      "BLOCK_M": 128,
      "BLOCK_N": 16,
      "BLOCK_K": 128,
      "BLOCK_C": 128,
      "NUM_KSPLIT": 2,
      "num_warps": 8,
      "num_stages": 2,
      "waves_per_eu": 0
    },
    "344": {
      "BLOCK_M": 32,
      "BLOCK_N": 16,
      "BLOCK_K": 32,
      "BLOCK_C": 256,
      "NUM_KSPLIT": 8,
      "num_warps": 2,
      "num_stages": 1,
      "waves_per_eu": 2
    },
    "1044": {
      "BLOCK_M": 32,
      "BLOCK_N": 16,
      "BLOCK_K": 128,
      "BLOCK_C": 256,
      "NUM_KSPLIT": 4,
      "num_warps": 2,
      "num_stages": 1,
      "waves_per_eu": 0
    },
    "35": {
      "BLOCK_M": 32,
      "BLOCK_N": 16,
      "BLOCK_K": 32,
      "BLOCK_C": 16,
      "NUM_KSPLIT": 2,
      "num_warps": 8,
      "num_stages": 2,
      "waves_per_eu": 2
    },
    "4541": {
      "BLOCK_M": 256,
      "BLOCK_N": 16,
      "BLOCK_K": 32,
      "BLOCK_C": 128,
      "NUM_KSPLIT": 1,
      "num_warps": 2,
      "num_stages": 2,
      "waves_per_eu": 2
    },
    "4723": {
      "BLOCK_M": 256,
      "BLOCK_N": 16,
      "BLOCK_K": 64,
      "BLOCK_C": 16,
      "NUM_KSPLIT": 4,
      "num_warps": 4,
      "num_stages": 1,
      "waves_per_eu": 1
    },
    "3573": {
      "BLOCK_M": 128,
      "BLOCK_N": 16,
      "BLOCK_K": 64,
      "BLOCK_C": 256,
      "NUM_KSPLIT": 4,
      "num_warps": 4,
      "num_stages": 2,
      "waves_per_eu": 0
    },
    "1175": {
      "BLOCK_M": 32,
      "BLOCK_N": 16,
      "BLOCK_K": 256,
      "BLOCK_C": 32,
      "NUM_KSPLIT": 2,
      "num_warps": 2,
      "num_stages": 2,
      "waves_per_eu": 2
    },
    "2717": {
      "BLOCK_M": 64,
      "BLOCK_N": 16,
      "BLOCK_K": 256,
      "BLOCK_C": 64,
      "NUM_KSPLIT": 4,
      "num_warps": 8,
      "num_stages": 2,
      "waves_per_eu": 2
    },
    "5111": {
      "BLOCK_M": 256,
      "BLOCK_N": 16,
      "BLOCK_K": 128,
      "BLOCK_C": 16,
      "NUM_KSPLIT": 8,
      "num_warps": 8,
      "num_stages": 2,
      "waves_per_eu": 2
    },
    "442": {
      "BLOCK_M": 32,
      "BLOCK_N": 16,
      "BLOCK_K": 64,
      "BLOCK_C": 32,
      "NUM_KSPLIT": 1,
      "num_warps": 4,
      "num_stages": 2,
      "waves_per_eu": 1
    },
    "1787": {
      "BLOCK_M": 64,
      "BLOCK_N": 16,
      "BLOCK_K": 32,
      "BLOCK_C": 256,
      "NUM_KSPLIT": 8,
      "num_warps": 2,
      "num_stages": 2,
      "waves_per_eu": 2
    },
    "2147": {
      "BLOCK_M": 64,
      "BLOCK_N": 16,
      "BLOCK_K": 64,
      "BLOCK_C": 256,
      "NUM_KSPLIT": 8,
      "num_warps": 2,
      "num_stages": 2,
      "waves_per_eu": 2
    },
    "3188": {
      "BLOCK_M": 128,
      "BLOCK_N": 16,
      "BLOCK_K": 32,
      "BLOCK_C": 256,
      "NUM_KSPLIT": 2,
      "num_warps": 2,
      "num_stages": 1,
      "waves_per_eu": 2
    },
    "2946": {
      "BLOCK_M": 128,
      "BLOCK_N": 16,
      "BLOCK_K": 32,
      "BLOCK_C": 16,
      "NUM_KSPLIT": 8,
      "num_warps": 8,
      "num_stages": 1,
      "waves_per_eu": 0
    },
    "3982": {
      "BLOCK_M": 128,
      "BLOCK_N": 16,
      "BLOCK_K": 256,
      "BLOCK_C": 16,
      "NUM_KSPLIT": 2,
      "num_warps": 2,
      "num_stages": 2,
      "waves_per_eu": 1
    },
    "946": {
      "BLOCK_M": 32,
      "BLOCK_N": 16,
      "BLOCK_K": 128,
      "BLOCK_C": 128,
      "NUM_KSPLIT": 1,
      "num_warps": 4,
      "num_stages": 2,
      "waves_per_eu": 1
    },
    "4716": {
      "BLOCK_M": 256,
      "BLOCK_N": 16,
      "BLOCK_K": 64,
      "BLOCK_C": 16,
      "NUM_KSPLIT": 4,
      "num_warps": 2,
      "num_stages": 1,
      "waves_per_eu": 0
    },
    "2967": {
      "BLOCK_M": 128,
      "BLOCK_N": 16,
      "BLOCK_K": 32,
      "BLOCK_C": 32,
      "NUM_KSPLIT": 1,
      "num_warps": 8,
      "num_stages": 2,
      "waves_per_eu": 0
    },
    "2880": {
      "BLOCK_M": 128,
      "BLOCK_N": 16,
      "BLOCK_K": 32,
      "BLOCK_C": 16,
      "NUM_KSPLIT": 1,
      "num_warps": 2,
      "num_stages": 1,
      "waves_per_eu": 0
    },
    "1192": {
      "BLOCK_M": 32,
      "BLOCK_N": 16,
      "BLOCK_K": 256,
      "BLOCK_C": 32,
      "NUM_KSPLIT": 4,
      "num_warps": 2,
      "num_stages": 2,
      "waves_per_eu": 1
    },
    "548": {
      "BLOCK_M": 32,
      "BLOCK_N": 16,
      "BLOCK_K": 64,
      "BLOCK_C": 64,
      "NUM_KSPLIT": 4,
      "num_warps": 4,
      "num_stages": 1,
      "waves_per_eu": 2
    },
    "1233": {
      "BLOCK_M": 32,
      "BLOCK_N": 16,
      "BLOCK_K": 256,
      "BLOCK_C": 64,
      "NUM_KSPLIT": 1,
      "num_warps": 4,
      "num_stages": 2,
      "waves_per_eu": 0
    },
    "1663": {
      "BLOCK_M": 64,
      "BLOCK_N": 16,
      "BLOCK_K": 32,
      "BLOCK_C": 128,
      "NUM_KSPLIT": 1,
      "num_warps": 4,
      "num_stages": 1,
      "waves_per_eu": 1
    },
    "2394": {
      "BLOCK_M": 64,
      "BLOCK_N": 16,
      "BLOCK_K": 128,
      "BLOCK_C": 128,
      "NUM_KSPLIT": 2,
      "num_warps": 2,
      "num_stages": 1,
      "waves_per_eu": 0
    },
    "2938": {
      "BLOCK_M": 128,
      "BLOCK_N": 16,
      "BLOCK_K": 32,
      "BLOCK_C": 16,
      "NUM_KSPLIT": 8,
      "num_warps": 2,
      "num_stages": 2,
      "waves_per_eu": 1
    },
    "4726": {
      "BLOCK_M": 256,
      "BLOCK_N": 16,
      "BLOCK_K": 64,
      "BLOCK_C": 16,
      "NUM_KSPLIT": 4,
      "num_warps": 4,
      "num_stages": 2,
      "waves_per_eu": 1
    },
    "3731": {
      "BLOCK_M": 128,
      "BLOCK_N": 16,
      "BLOCK_K": 128,
      "BLOCK_C": 32,
      "NUM_KSPLIT": 8,
      "num_warps": 2,
      "num_stages": 2,
      "waves_per_eu": 2
    },
    "2907": {
      "BLOCK_M": 128,
      "BLOCK_N": 16,
      "BLOCK_K": 32,
      "BLOCK_C": 16,
      "NUM_KSPLIT": 2,
      "num_warps": 4,
      "num_stages": 2,
      "waves_per_eu": 0
    },
    "2151": {
      "BLOCK_M": 64,
      "BLOCK_N": 16,
      "BLOCK_K": 64,
      "BLOCK_C": 256,
      "NUM_KSPLIT": 8,
      "num_warps": 4,
      "num_stages": 2,
      "waves_per_eu": 0
    },
    "3035": {
      "BLOCK_M": 128,
      "BLOCK_N": 16,
      "BLOCK_K": 32,
      "BLOCK_C": 64,
      "NUM_KSPLIT": 1,
      "num_warps": 4,
      "num_stages": 2,
      "waves_per_eu": 2
    },
    "4368": {
      "BLOCK_M": 256,
      "BLOCK_N": 16,
      "BLOCK_K": 32,
      "BLOCK_C": 16,
      "NUM_KSPLIT": 4,
      "num_warps": 8,
      "num_stages": 1,
      "waves_per_eu": 0
    },
    "5099": {
      "BLOCK_M": 256,
      "BLOCK_N": 16,
      "BLOCK_K": 128,
      "BLOCK_C": 16,
      "NUM_KSPLIT": 8,
      "num_warps": 2,
      "num_stages": 2,
      "waves_per_eu": 2
    },
    "1746": {
      "BLOCK_M": 64,
      "BLOCK_N": 16,
      "BLOCK_K": 32,
      "BLOCK_C": 256,
      "NUM_KSPLIT": 2,
      "num_warps": 2,
      "num_stages": 1,
      "waves_per_eu": 0
    },
    "3765": {
      "BLOCK_M": 128,
      "BLOCK_N": 16,
      "BLOCK_K": 128,
      "BLOCK_C": 64,
      "NUM_KSPLIT": 2,
      "num_warps": 2,
      "num_stages": 2,
      "waves_per_eu": 0
    },
    "3436": {
      "BLOCK_M": 128,
      "BLOCK_N": 16,
      "BLOCK_K": 64,
      "BLOCK_C": 64,
      "NUM_KSPLIT": 4,
      "num_warps": 8,
      "num_stages": 2,
      "waves_per_eu": 1
    },
    "2181": {
      "BLOCK_M": 64,
      "BLOCK_N": 16,
      "BLOCK_K": 128,
      "BLOCK_C": 16,
      "NUM_KSPLIT": 2,
      "num_warps": 2,
      "num_stages": 2,
      "waves_per_eu": 0
    },
    "5064": {
      "BLOCK_M": 256,
      "BLOCK_N": 16,
      "BLOCK_K": 128,
      "BLOCK_C": 16,
      "NUM_KSPLIT": 2,
      "num_warps": 4,
      "num_stages": 1,
      "waves_per_eu": 0
    },
    "1464": {
      "BLOCK_M": 64,
      "BLOCK_N": 16,
      "BLOCK_K": 32,
      "BLOCK_C": 16,
      "NUM_KSPLIT": 2,
      "num_warps": 4,
      "num_stages": 1,
      "waves_per_eu": 0
    },
    "1310": {
      "BLOCK_M": 32,
      "BLOCK_N": 16,
      "BLOCK_K": 256,
      "BLOCK_C": 128,
      "NUM_KSPLIT": 1,
      "num_warps": 8,
      "num_stages": 1,
      "waves_per_eu": 2
    },
    "2505": {
      "BLOCK_M": 64,
      "BLOCK_N": 16,
      "BLOCK_K": 128,
      "BLOCK_C": 256,
      "NUM_KSPLIT": 8,
      "num_warps": 2,
      "num_stages": 2,
      "waves_per_eu": 0
    },
    "2714": {
      "BLOCK_M": 64,
      "BLOCK_N": 16,
      "BLOCK_K": 256,
      "BLOCK_C": 64,
      "NUM_KSPLIT": 4,
      "num_warps": 8,
      "num_stages": 1,
      "waves_per_eu": 2
    },
    "4126": {
      "BLOCK_M": 128,
      "BLOCK_N": 16,
      "BLOCK_K": 256,
      "BLOCK_C": 64,
      "NUM_KSPLIT": 2,
      "num_warps": 2,
      "num_stages": 2,
      "waves_per_eu": 1
    },
    "4520": {
      "BLOCK_M": 256,
      "BLOCK_N": 16,
      "BLOCK_K": 32,
      "BLOCK_C": 64,
      "NUM_KSPLIT": 8,
      "num_warps": 2,
      "num_stages": 1,
      "waves_per_eu": 2
    },
    "5647": {
      "BLOCK_M": 256,
      "BLOCK_N": 16,
      "BLOCK_K": 256,
      "BLOCK_C": 128,
      "NUM_KSPLIT": 2,
      "num_warps": 8,
      "num_stages": 1,
      "waves_per_eu": 1
    },
    "186": {
      "BLOCK_M": 32,
      "BLOCK_N": 16,
      "BLOCK_K": 32,
      "BLOCK_C": 64,
      "NUM_KSPLIT": 4,
      "num_warps": 4,
      "num_stages": 1,
      "waves_per_eu": 0
    },
    "1761": {
      "BLOCK_M": 64,
      "BLOCK_N": 16,
      "BLOCK_K": 32,
      "BLOCK_C": 256,
      "NUM_KSPLIT": 2,
      "num_warps": 8,
      "num_stages": 2,
      "waves_per_eu": 0
    },
    "2575": {
      "BLOCK_M": 64,
      "BLOCK_N": 16,
      "BLOCK_K": 256,
      "BLOCK_C": 16,
      "NUM_KSPLIT": 8,
      "num_warps": 2,
      "num_stages": 1,
      "waves_per_eu": 1
    },
    "3972": {
      "BLOCK_M": 128,
      "BLOCK_N": 16,
      "BLOCK_K": 256,
      "BLOCK_C": 16,
      "NUM_KSPLIT": 1,
      "num_warps": 8,
      "num_stages": 1,
      "waves_per_eu": 0
    },
    "5097": {
      "BLOCK_M": 256,
      "BLOCK_N": 16,
      "BLOCK_K": 128,
      "BLOCK_C": 16,
      "NUM_KSPLIT": 8,
      "num_warps": 2,
      "num_stages": 2,
      "waves_per_eu": 0
    },
    "331": {
      "BLOCK_M": 32,
      "BLOCK_N": 16,
      "BLOCK_K": 32,
      "BLOCK_C": 256,
      "NUM_KSPLIT": 4,
      "num_warps": 4,
      "num_stages": 1,
      "waves_per_eu": 1
    },
    "3139": {
      "BLOCK_M": 128,
      "BLOCK_N": 16,
      "BLOCK_K": 32,
      "BLOCK_C": 128,
      "NUM_KSPLIT": 4,
      "num_warps": 4,
      "num_stages": 1,
      "waves_per_eu": 1
    },
    "4377": {
      "BLOCK_M": 256,
      "BLOCK_N": 16,
      "BLOCK_K": 32,
      "BLOCK_C": 16,
      "NUM_KSPLIT": 8,
      "num_warps": 2,
      "num_stages": 2,
      "waves_per_eu": 0
    },
    "1640": {
      "BLOCK_M": 64,
      "BLOCK_N": 16,
      "BLOCK_K": 32,
      "BLOCK_C": 64,
      "NUM_KSPLIT": 8,
      "num_warps": 2,
      "num_stages": 1,
      "waves_per_eu": 2
    },
    "3701": {
      "BLOCK_M": 128,
      "BLOCK_N": 16,
      "BLOCK_K": 128,
      "BLOCK_C": 32,
      "NUM_KSPLIT": 2,
      "num_warps": 4,
      "num_stages": 2,
      "waves_per_eu": 2
    },
    "840": {
      "BLOCK_M": 32,
      "BLOCK_N": 16,
      "BLOCK_K": 128,
      "BLOCK_C": 32,
      "NUM_KSPLIT": 4,
      "num_warps": 8,
      "num_stages": 1,
      "waves_per_eu": 0
    },
    "655": {
      "BLOCK_M": 32,
      "BLOCK_N": 16,
      "BLOCK_K": 64,
      "BLOCK_C": 256,
      "NUM_KSPLIT": 1,
      "num_warps": 4,
      "num_stages": 1,
      "waves_per_eu": 1
    },
    "77": {
      "BLOCK_M": 32,
      "BLOCK_N": 16,
      "BLOCK_K": 32,
      "BLOCK_C": 32,
      "NUM_KSPLIT": 1,
      "num_warps": 2,
      "num_stages": 2,
      "waves_per_eu": 2
    },
    "3907": {
      "BLOCK_M": 128,
      "BLOCK_N": 16,
      "BLOCK_K": 128,
      "BLOCK_C": 256,
      "NUM_KSPLIT": 2,
      "num_warps": 2,
      "num_stages": 1,
      "waves_per_eu": 1
    },
    "449": {
      "BLOCK_M": 32,
      "BLOCK_N": 16,
      "BLOCK_K": 64,
      "BLOCK_C": 32,
      "NUM_KSPLIT": 1,
      "num_warps": 8,
      "num_stages": 2,
      "waves_per_eu": 2
    },
    "5209": {
      "BLOCK_M": 256,
      "BLOCK_N": 16,
      "BLOCK_K": 128,
      "BLOCK_C": 64,
      "NUM_KSPLIT": 2,
      "num_warps": 4,
      "num_stages": 1,
      "waves_per_eu": 1
    },
    "2274": {
      "BLOCK_M": 64,
      "BLOCK_N": 16,
      "BLOCK_K": 128,
      "BLOCK_C": 32,
      "NUM_KSPLIT": 4,
      "num_warps": 4,
      "num_stages": 1,
      "waves_per_eu": 0
    },
    "4703": {
      "BLOCK_M": 256,
      "BLOCK_N": 16,
      "BLOCK_K": 64,
      "BLOCK_C": 16,
      "NUM_KSPLIT": 2,
      "num_warps": 2,
      "num_stages": 2,
      "waves_per_eu": 2
    },
    "3812": {
      "BLOCK_M": 128,
      "BLOCK_N": 16,
      "BLOCK_K": 128,
      "BLOCK_C": 64,
      "NUM_KSPLIT": 8,
      "num_warps": 8,
      "num_stages": 1,
      "waves_per_eu": 2
    },
    "4431": {
      "BLOCK_M": 256,
      "BLOCK_N": 16,
      "BLOCK_K": 32,
      "BLOCK_C": 32,
      "NUM_KSPLIT": 4,
      "num_warps": 2,
      "num_stages": 2,
      "waves_per_eu": 0
    },
    "424": {
      "BLOCK_M": 32,
      "BLOCK_N": 16,
      "BLOCK_K": 64,
      "BLOCK_C": 16,
      "NUM_KSPLIT": 8,
      "num_warps": 4,
      "num_stages": 2,
      "waves_per_eu": 1
    },
    "1388": {
      "BLOCK_M": 32,
      "BLOCK_N": 16,
      "BLOCK_K": 256,
      "BLOCK_C": 256,
      "NUM_KSPLIT": 2,
      "num_warps": 2,
      "num_stages": 1,
      "waves_per_eu": 2
    },
    "4504": {
      "BLOCK_M": 256,
      "BLOCK_N": 16,
      "BLOCK_K": 32,
      "BLOCK_C": 64,
      "NUM_KSPLIT": 4,
      "num_warps": 2,
      "num_stages": 2,
      "waves_per_eu": 1
    },
    "5504": {
      "BLOCK_M": 256,
      "BLOCK_N": 16,
      "BLOCK_K": 256,
      "BLOCK_C": 32,
      "NUM_KSPLIT": 2,
      "num_warps": 8,
      "num_stages": 1,
      "waves_per_eu": 2
    },
    "4280": {
      "BLOCK_M": 128,
      "BLOCK_N": 16,
      "BLOCK_K": 256,
      "BLOCK_C": 256,
      "NUM_KSPLIT": 2,
      "num_warps": 8,
      "num_stages": 1,
      "waves_per_eu": 2
    },
    "5599": {
      "BLOCK_M": 256,
      "BLOCK_N": 16,
      "BLOCK_K": 256,
      "BLOCK_C": 64,
      "NUM_KSPLIT": 8,
      "num_warps": 2,
      "num_stages": 1,
      "waves_per_eu": 1
    },
    "5604": {
      "BLOCK_M": 256,
      "BLOCK_N": 16,
      "BLOCK_K": 256,
      "BLOCK_C": 64,
      "NUM_KSPLIT": 8,
      "num_warps": 4,
      "num_stages": 1,
      "waves_per_eu": 0
    },
    "1644": {
      "BLOCK_M": 64,
      "BLOCK_N": 16,
      "BLOCK_K": 32,
      "BLOCK_C": 64,
      "NUM_KSPLIT": 8,
      "num_warps": 4,
      "num_stages": 1,
      "waves_per_eu": 0
    },
    "5304": {
      "BLOCK_M": 256,
      "BLOCK_N": 16,
      "BLOCK_K": 128,
      "BLOCK_C": 128,
      "NUM_KSPLIT": 4,
      "num_warps": 8,
      "num_stages": 1,
      "waves_per_eu": 0
    },
    "1964": {
      "BLOCK_M": 64,
      "BLOCK_N": 16,
      "BLOCK_K": 64,
      "BLOCK_C": 64,
      "NUM_KSPLIT": 2,
      "num_warps": 2,
      "num_stages": 1,
      "waves_per_eu": 2
    },
    "2150": {
      "BLOCK_M": 64,
      "BLOCK_N": 16,
      "BLOCK_K": 64,
      "BLOCK_C": 256,
      "NUM_KSPLIT": 8,
      "num_warps": 4,
      "num_stages": 1,
      "waves_per_eu": 2
    },
    "4980": {
      "BLOCK_M": 256,
      "BLOCK_N": 16,
      "BLOCK_K": 64,
      "BLOCK_C": 256,
      "NUM_KSPLIT": 1,
      "num_warps": 8,
      "num_stages": 1,
      "waves_per_eu": 0
    },
    "4962": {
      "BLOCK_M": 256,
      "BLOCK_N": 16,
      "BLOCK_K": 64,
      "BLOCK_C": 128,
      "NUM_KSPLIT": 8,
      "num_warps": 8,
      "num_stages": 1,
      "waves_per_eu": 0
    },
    "908": {
      "BLOCK_M": 32,
      "BLOCK_N": 16,
      "BLOCK_K": 128,
      "BLOCK_C": 64,
      "NUM_KSPLIT": 4,
      "num_warps": 4,
      "num_stages": 1,
      "waves_per_eu": 2
    },
    "1919": {
      "BLOCK_M": 64,
      "BLOCK_N": 16,
      "BLOCK_K": 64,
      "BLOCK_C": 32,
      "NUM_KSPLIT": 4,
      "num_warps": 4,
      "num_stages": 2,
      "waves_per_eu": 2
    },
    "3547": {
      "BLOCK_M": 128,
      "BLOCK_N": 16,
      "BLOCK_K": 64,
      "BLOCK_C": 256,
      "NUM_KSPLIT": 2,
      "num_warps": 2,
      "num_stages": 1,
      "waves_per_eu": 1
    },
    "2054": {
      "BLOCK_M": 64,
      "BLOCK_N": 16,
      "BLOCK_K": 64,
      "BLOCK_C": 128,
      "NUM_KSPLIT": 4,
      "num_warps": 2,
      "num_stages": 1,
      "waves_per_eu": 2
    },
    "4402": {
      "BLOCK_M": 256,
      "BLOCK_N": 16,
      "BLOCK_K": 32,
      "BLOCK_C": 32,
      "NUM_KSPLIT": 1,
      "num_warps": 4,
      "num_stages": 2,
      "waves_per_eu": 1
    },
    "5555": {
      "BLOCK_M": 256,
      "BLOCK_N": 16,
      "BLOCK_K": 256,
      "BLOCK_C": 64,
      "NUM_KSPLIT": 1,
      "num_warps": 4,
      "num_stages": 2,
      "waves_per_eu": 2
    },
    "5659": {
      "BLOCK_M": 256,
      "BLOCK_N": 16,
      "BLOCK_K": 256,
      "BLOCK_C": 128,
      "NUM_KSPLIT": 4,
      "num_warps": 4,
      "num_stages": 1,
      "waves_per_eu": 1
    },
    "1851": {
      "BLOCK_M": 64,
      "BLOCK_N": 16,
      "BLOCK_K": 64,
      "BLOCK_C": 16,
      "NUM_KSPLIT": 4,
      "num_warps": 8,
      "num_stages": 2,
      "waves_per_eu": 0
    },
    "4708": {
      "BLOCK_M": 256,
      "BLOCK_N": 16,
      "BLOCK_K": 64,
      "BLOCK_C": 16,
      "NUM_KSPLIT": 2,
      "num_warps": 4,
      "num_stages": 2,
      "waves_per_eu": 1
    },
    "1491": {
      "BLOCK_M": 64,
      "BLOCK_N": 16,
      "BLOCK_K": 32,
      "BLOCK_C": 16,
      "NUM_KSPLIT": 4,
      "num_warps": 8,
      "num_stages": 2,
      "waves_per_eu": 0
    },
    "2208": {
      "BLOCK_M": 64,
      "BLOCK_N": 16,
      "BLOCK_K": 128,
      "BLOCK_C": 16,
      "NUM_KSPLIT": 4,
      "num_warps": 8,
      "num_stages": 1,
      "waves_per_eu": 0
    },
    "3238": {
      "BLOCK_M": 128,
      "BLOCK_N": 16,
      "BLOCK_K": 32,
      "BLOCK_C": 256,
      "NUM_KSPLIT": 8,
      "num_warps": 8,
      "num_stages": 2,
      "waves_per_eu": 1
    },
    "4447": {
      "BLOCK_M": 256,
      "BLOCK_N": 16,
      "BLOCK_K": 32,
      "BLOCK_C": 32,
      "NUM_KSPLIT": 8,
      "num_warps": 2,
      "num_stages": 1,
      "waves_per_eu": 1
    },
    "3183": {
      "BLOCK_M": 128,
      "BLOCK_N": 16,
      "BLOCK_K": 32,
      "BLOCK_C": 256,
      "NUM_KSPLIT": 1,
      "num_warps": 8,
      "num_stages": 2,
      "waves_per_eu": 0
    },
    "4737": {
      "BLOCK_M": 256,
      "BLOCK_N": 16,
      "BLOCK_K": 64,
      "BLOCK_C": 16,
      "NUM_KSPLIT": 8,
      "num_warps": 2,
      "num_stages": 2,
      "waves_per_eu": 0
    },
    "5432": {
      "BLOCK_M": 256,
      "BLOCK_N": 16,
      "BLOCK_K": 256,
      "BLOCK_C": 16,
      "NUM_KSPLIT": 2,
      "num_warps": 8,
      "num_stages": 1,
      "waves_per_eu": 2
    },
    "1173": {
      "BLOCK_M": 32,
      "BLOCK_N": 16,
      "BLOCK_K": 256,
      "BLOCK_C": 32,
      "NUM_KSPLIT": 2,
      "num_warps": 2,
      "num_stages": 2,
      "waves_per_eu": 0
    },
    "1730": {
      "BLOCK_M": 64,
      "BLOCK_N": 16,
      "BLOCK_K": 32,
      "BLOCK_C": 256,
      "NUM_KSPLIT": 1,
      "num_warps": 2,
      "num_stages": 1,
      "waves_per_eu": 2
    },
    "2677": {
      "BLOCK_M": 64,
      "BLOCK_N": 16,
      "BLOCK_K": 256,
      "BLOCK_C": 64,
      "NUM_KSPLIT": 1,
      "num_warps": 8,
      "num_stages": 1,
      "waves_per_eu": 1
    },
    "2058": {
      "BLOCK_M": 64,
      "BLOCK_N": 16,
      "BLOCK_K": 64,
      "BLOCK_C": 128,
      "NUM_KSPLIT": 4,
      "num_warps": 4,
      "num_stages": 1,
      "waves_per_eu": 0
    },
    "3164": {
      "BLOCK_M": 128,
      "BLOCK_N": 16,
      "BLOCK_K": 32,
      "BLOCK_C": 128,
      "NUM_KSPLIT": 8,
      "num_warps": 8,
      "num_stages": 1,
      "waves_per_eu": 2
    },
    "427": {
      "BLOCK_M": 32,
      "BLOCK_N": 16,
      "BLOCK_K": 64,
      "BLOCK_C": 16,
      "NUM_KSPLIT": 8,
      "num_warps": 8,
      "num_stages": 1,
      "waves_per_eu": 1
    },
    "364": {
      "BLOCK_M": 32,
      "BLOCK_N": 16,
      "BLOCK_K": 64,
      "BLOCK_C": 16,
      "NUM_KSPLIT": 1,
      "num_warps": 2,
      "num_stages": 2,
      "waves_per_eu": 1
    },
    "23": {
      "BLOCK_M": 32,
      "BLOCK_N": 16,
      "BLOCK_K": 32,
      "BLOCK_C": 16,
      "NUM_KSPLIT": 2,
      "num_warps": 2,
      "num_stages": 2,
      "waves_per_eu": 2
    },
    "731": {
      "BLOCK_M": 32,
      "BLOCK_N": 16,
      "BLOCK_K": 128,
      "BLOCK_C": 16,
      "NUM_KSPLIT": 1,
      "num_warps": 4,
      "num_stages": 2,
      "waves_per_eu": 2
    },
    "4589": {
      "BLOCK_M": 256,
      "BLOCK_N": 16,
      "BLOCK_K": 32,
      "BLOCK_C": 128,
      "NUM_KSPLIT": 4,
      "num_warps": 8,
      "num_stages": 2,
      "waves_per_eu": 2
    },
    "1221": {
      "BLOCK_M": 32,
      "BLOCK_N": 16,
      "BLOCK_K": 256,
      "BLOCK_C": 32,
      "NUM_KSPLIT": 8,
      "num_warps": 8,
      "num_stages": 2,
      "waves_per_eu": 0
    },
    "3670": {
      "BLOCK_M": 128,
      "BLOCK_N": 16,
      "BLOCK_K": 128,
      "BLOCK_C": 16,
      "NUM_KSPLIT": 8,
      "num_warps": 8,
      "num_stages": 2,
      "waves_per_eu": 1
    },
    "5373": {
      "BLOCK_M": 256,
      "BLOCK_N": 16,
      "BLOCK_K": 128,
      "BLOCK_C": 256,
      "NUM_KSPLIT": 4,
      "num_warps": 4,
      "num_stages": 2,
      "waves_per_eu": 0
    },
    "4581": {
      "BLOCK_M": 256,
      "BLOCK_N": 16,
      "BLOCK_K": 32,
      "BLOCK_C": 128,
      "NUM_KSPLIT": 4,
      "num_warps": 4,
      "num_stages": 2,
      "waves_per_eu": 0
    },
    "149": {
      "BLOCK_M": 32,
      "BLOCK_N": 16,
      "BLOCK_K": 32,
      "BLOCK_C": 64,
      "NUM_KSPLIT": 1,
      "num_warps": 2,
      "num_stages": 2,
      "waves_per_eu": 2
    },
    "5533": {
      "BLOCK_M": 256,
      "BLOCK_N": 16,
      "BLOCK_K": 256,
      "BLOCK_C": 32,
      "NUM_KSPLIT": 8,
      "num_warps": 4,
      "num_stages": 1,
      "waves_per_eu": 1
    },
    "2630": {
      "BLOCK_M": 64,
      "BLOCK_N": 16,
      "BLOCK_K": 256,
      "BLOCK_C": 32,
      "NUM_KSPLIT": 4,
      "num_warps": 2,
      "num_stages": 1,
      "waves_per_eu": 2
    },
    "5402": {
      "BLOCK_M": 256,
      "BLOCK_N": 16,
      "BLOCK_K": 256,
      "BLOCK_C": 16,
      "NUM_KSPLIT": 1,
      "num_warps": 2,
      "num_stages": 1,
      "waves_per_eu": 2
    },
    "3425": {
      "BLOCK_M": 128,
      "BLOCK_N": 16,
      "BLOCK_K": 64,
      "BLOCK_C": 64,
      "NUM_KSPLIT": 4,
      "num_warps": 2,
      "num_stages": 2,
      "waves_per_eu": 2
    },
    "4482": {
      "BLOCK_M": 256,
      "BLOCK_N": 16,
      "BLOCK_K": 32,
      "BLOCK_C": 64,
      "NUM_KSPLIT": 2,
      "num_warps": 2,
      "num_stages": 1,
      "waves_per_eu": 0
    },
    "4548": {
      "BLOCK_M": 256,
      "BLOCK_N": 16,
      "BLOCK_K": 32,
      "BLOCK_C": 128,
      "NUM_KSPLIT": 1,
      "num_warps": 8,
      "num_stages": 1,
      "waves_per_eu": 0
    },
    "1093": {
      "BLOCK_M": 32,
      "BLOCK_N": 16,
      "BLOCK_K": 256,
      "BLOCK_C": 16,
      "NUM_KSPLIT": 1,
      "num_warps": 8,
      "num_stages": 1,
      "waves_per_eu": 1
    },
    "4926": {
      "BLOCK_M": 256,
      "BLOCK_N": 16,
      "BLOCK_K": 64,
      "BLOCK_C": 128,
      "NUM_KSPLIT": 2,
      "num_warps": 8,
      "num_stages": 1,
      "waves_per_eu": 0
    },
    "1248": {
      "BLOCK_M": 32,
      "BLOCK_N": 16,
      "BLOCK_K": 256,
      "BLOCK_C": 64,
      "NUM_KSPLIT": 2,
      "num_warps": 4,
      "num_stages": 1,
      "waves_per_eu": 0
    },
    "643": {
      "BLOCK_M": 32,
      "BLOCK_N": 16,
      "BLOCK_K": 64,
      "BLOCK_C": 128,
      "NUM_KSPLIT": 8,
      "num_warps": 8,
      "num_stages": 1,
      "waves_per_eu": 1
    },
    "3588": {
      "BLOCK_M": 128,
      "BLOCK_N": 16,
      "BLOCK_K": 64,
      "BLOCK_C": 256,
      "NUM_KSPLIT": 8,
      "num_warps": 4,
      "num_stages": 1,
      "waves_per_eu": 0
    },
    "3119": {
      "BLOCK_M": 128,
      "BLOCK_N": 16,
      "BLOCK_K": 32,
      "BLOCK_C": 128,
      "NUM_KSPLIT": 2,
      "num_warps": 2,
      "num_stages": 2,
      "waves_per_eu": 2
    },
    "4266": {
      "BLOCK_M": 128,
      "BLOCK_N": 16,
      "BLOCK_K": 256,
      "BLOCK_C": 256,
      "NUM_KSPLIT": 2,
      "num_warps": 2,
      "num_stages": 1,
      "waves_per_eu": 0
    },
    "2112": {
      "BLOCK_M": 64,
      "BLOCK_N": 16,
      "BLOCK_K": 64,
      "BLOCK_C": 256,
      "NUM_KSPLIT": 2,
      "num_warps": 4,
      "num_stages": 1,
      "waves_per_eu": 0
    },
    "2168": {
      "BLOCK_M": 64,
      "BLOCK_N": 16,
      "BLOCK_K": 128,
      "BLOCK_C": 16,
      "NUM_KSPLIT": 1,
      "num_warps": 4,
      "num_stages": 1,
      "waves_per_eu": 2
    },
    "519": {
      "BLOCK_M": 32,
      "BLOCK_N": 16,
      "BLOCK_K": 64,
      "BLOCK_C": 64,
      "NUM_KSPLIT": 1,
      "num_warps": 8,
      "num_stages": 2,
      "waves_per_eu": 0
    },
    "2215": {
      "BLOCK_M": 64,
      "BLOCK_N": 16,
      "BLOCK_K": 128,
      "BLOCK_C": 16,
      "NUM_KSPLIT": 8,
      "num_warps": 2,
      "num_stages": 1,
      "waves_per_eu": 1
    },
    "903": {
      "BLOCK_M": 32,
      "BLOCK_N": 16,
      "BLOCK_K": 128,
      "BLOCK_C": 64,
      "NUM_KSPLIT": 4,
      "num_warps": 2,
      "num_stages": 2,
      "waves_per_eu": 0
    },
    "3113": {
      "BLOCK_M": 128,
      "BLOCK_N": 16,
      "BLOCK_K": 32,
      "BLOCK_C": 128,
      "NUM_KSPLIT": 1,
      "num_warps": 8,
      "num_stages": 2,
      "waves_per_eu": 2
    },
    "5356": {
      "BLOCK_M": 256,
      "BLOCK_N": 16,
      "BLOCK_K": 128,
      "BLOCK_C": 256,
      "NUM_KSPLIT": 2,
      "num_warps": 4,
      "num_stages": 2,
      "waves_per_eu": 1
    },
    "228": {
      "BLOCK_M": 32,
      "BLOCK_N": 16,
      "BLOCK_K": 32,
      "BLOCK_C": 128,
      "NUM_KSPLIT": 1,
      "num_warps": 8,
      "num_stages": 1,
      "waves_per_eu": 0
    },
    "2651": {
      "BLOCK_M": 64,
      "BLOCK_N": 16,
      "BLOCK_K": 256,
      "BLOCK_C": 32,
      "NUM_KSPLIT": 8,
      "num_warps": 2,
      "num_stages": 2,
      "waves_per_eu": 2
    },
    "4707": {
      "BLOCK_M": 256,
      "BLOCK_N": 16,
      "BLOCK_K": 64,
      "BLOCK_C": 16,
      "NUM_KSPLIT": 2,
      "num_warps": 4,
      "num_stages": 2,
      "waves_per_eu": 0
    },
    "4079": {
      "BLOCK_M": 128,
      "BLOCK_N": 16,
      "BLOCK_K": 256,
      "BLOCK_C": 32,
      "NUM_KSPLIT": 4,
      "num_warps": 4,
      "num_stages": 2,
      "waves_per_eu": 2
    },
    "3799": {
      "BLOCK_M": 128,
      "BLOCK_N": 16,
      "BLOCK_K": 128,
      "BLOCK_C": 64,
      "NUM_KSPLIT": 8,
      "num_warps": 2,
      "num_stages": 1,
      "waves_per_eu": 1
    },
    "5092": {
      "BLOCK_M": 256,
      "BLOCK_N": 16,
      "BLOCK_K": 128,
      "BLOCK_C": 16,
      "NUM_KSPLIT": 4,
      "num_warps": 8,
      "num_stages": 2,
      "waves_per_eu": 1
    },
    "4336": {
      "BLOCK_M": 256,
      "BLOCK_N": 16,
      "BLOCK_K": 32,
      "BLOCK_C": 16,
      "NUM_KSPLIT": 1,
      "num_warps": 8,
      "num_stages": 2,
      "waves_per_eu": 1
    },
    "2985": {
      "BLOCK_M": 128,
      "BLOCK_N": 16,
      "BLOCK_K": 32,
      "BLOCK_C": 32,
      "NUM_KSPLIT": 2,
      "num_warps": 8,
      "num_stages": 2,
      "waves_per_eu": 0
    },
    "3886": {
      "BLOCK_M": 128,
      "BLOCK_N": 16,
      "BLOCK_K": 128,
      "BLOCK_C": 128,
      "NUM_KSPLIT": 8,
      "num_warps": 8,
      "num_stages": 2,
      "waves_per_eu": 1
    },
    "4587": {
      "BLOCK_M": 256,
      "BLOCK_N": 16,
      "BLOCK_K": 32,
      "BLOCK_C": 128,
      "NUM_KSPLIT": 4,
      "num_warps": 8,
      "num_stages": 2,
      "waves_per_eu": 0
    },
    "2511": {
      "BLOCK_M": 64,
      "BLOCK_N": 16,
      "BLOCK_K": 128,
      "BLOCK_C": 256,
      "NUM_KSPLIT": 8,
      "num_warps": 4,
      "num_stages": 2,
      "waves_per_eu": 0
    },
    "252": {
      "BLOCK_M": 32,
      "BLOCK_N": 16,
      "BLOCK_K": 32,
      "BLOCK_C": 128,
      "NUM_KSPLIT": 4,
      "num_warps": 2,
      "num_stages": 1,
      "waves_per_eu": 0
    },
    "5271": {
      "BLOCK_M": 256,
      "BLOCK_N": 16,
      "BLOCK_K": 128,
      "BLOCK_C": 128,
      "NUM_KSPLIT": 1,
      "num_warps": 8,
      "num_stages": 2,
      "waves_per_eu": 0
    },
    "5160": {
      "BLOCK_M": 256,
      "BLOCK_N": 16,
      "BLOCK_K": 128,
      "BLOCK_C": 32,
      "NUM_KSPLIT": 4,
      "num_warps": 8,
      "num_stages": 1,
      "waves_per_eu": 0
    },
    "4961": {
      "BLOCK_M": 256,
      "BLOCK_N": 16,
      "BLOCK_K": 64,
      "BLOCK_C": 128,
      "NUM_KSPLIT": 8,
      "num_warps": 4,
      "num_stages": 2,
      "waves_per_eu": 2
    },
    "648": {
      "BLOCK_M": 32,
      "BLOCK_N": 16,
      "BLOCK_K": 64,
      "BLOCK_C": 256,
      "NUM_KSPLIT": 1,
      "num_warps": 2,
      "num_stages": 1,
      "waves_per_eu": 0
    },
    "959": {
      "BLOCK_M": 32,
      "BLOCK_N": 16,
      "BLOCK_K": 128,
      "BLOCK_C": 128,
      "NUM_KSPLIT": 2,
      "num_warps": 2,
      "num_stages": 2,
      "waves_per_eu": 2
    },
    "4861": {
      "BLOCK_M": 256,
      "BLOCK_N": 16,
      "BLOCK_K": 64,
      "BLOCK_C": 64,
      "NUM_KSPLIT": 4,
      "num_warps": 2,
      "num_stages": 1,
      "waves_per_eu": 1
    },
    "1459": {
      "BLOCK_M": 64,
      "BLOCK_N": 16,
      "BLOCK_K": 32,
      "BLOCK_C": 16,
      "NUM_KSPLIT": 2,
      "num_warps": 2,
      "num_stages": 1,
      "waves_per_eu": 1
    },
    "4488": {
      "BLOCK_M": 256,
      "BLOCK_N": 16,
      "BLOCK_K": 32,
      "BLOCK_C": 64,
      "NUM_KSPLIT": 2,
      "num_warps": 4,
      "num_stages": 1,
      "waves_per_eu": 0
    },
    "2164": {
      "BLOCK_M": 64,
      "BLOCK_N": 16,
      "BLOCK_K": 128,
      "BLOCK_C": 16,
      "NUM_KSPLIT": 1,
      "num_warps": 2,
      "num_stages": 2,
      "waves_per_eu": 1
    },
    "3076": {
      "BLOCK_M": 128,
      "BLOCK_N": 16,
      "BLOCK_K": 32,
      "BLOCK_C": 64,
      "NUM_KSPLIT": 4,
      "num_warps": 8,
      "num_stages": 2,
      "waves_per_eu": 1
    },
    "5694": {
      "BLOCK_M": 256,
      "BLOCK_N": 16,
      "BLOCK_K": 256,
      "BLOCK_C": 256,
      "NUM_KSPLIT": 1,
      "num_warps": 4,
      "num_stages": 1,
      "waves_per_eu": 0
    },
    "378": {
      "BLOCK_M": 32,
      "BLOCK_N": 16,
      "BLOCK_K": 64,
      "BLOCK_C": 16,
      "NUM_KSPLIT": 2,
      "num_warps": 2,
      "num_stages": 1,
      "waves_per_eu": 0
    },
    "2844": {
      "BLOCK_M": 64,
      "BLOCK_N": 16,
      "BLOCK_K": 256,
      "BLOCK_C": 256,
      "NUM_KSPLIT": 4,
      "num_warps": 2,
      "num_stages": 1,
      "waves_per_eu": 0
    },
    "437": {
      "BLOCK_M": 32,
      "BLOCK_N": 16,
      "BLOCK_K": 64,
      "BLOCK_C": 32,
      "NUM_KSPLIT": 1,
      "num_warps": 2,
      "num_stages": 2,
      "waves_per_eu": 2
    },
    "5660": {
      "BLOCK_M": 256,
      "BLOCK_N": 16,
      "BLOCK_K": 256,
      "BLOCK_C": 128,
      "NUM_KSPLIT": 4,
      "num_warps": 4,
      "num_stages": 1,
      "waves_per_eu": 2
    },
    "2471": {
      "BLOCK_M": 64,
      "BLOCK_N": 16,
      "BLOCK_K": 128,
      "BLOCK_C": 256,
      "NUM_KSPLIT": 2,
      "num_warps": 2,
      "num_stages": 2,
      "waves_per_eu": 2
    },
    "4826": {
      "BLOCK_M": 256,
      "BLOCK_N": 16,
      "BLOCK_K": 64,
      "BLOCK_C": 64,
      "NUM_KSPLIT": 1,
      "num_warps": 2,
      "num_stages": 1,
      "waves_per_eu": 2
    },
    "54": {
      "BLOCK_M": 32,
      "BLOCK_N": 16,
      "BLOCK_K": 32,
      "BLOCK_C": 16,
      "NUM_KSPLIT": 8,
      "num_warps": 2,
      "num_stages": 1,
      "waves_per_eu": 0
    },
    "1675": {
      "BLOCK_M": 64,
      "BLOCK_N": 16,
      "BLOCK_K": 32,
      "BLOCK_C": 128,
      "NUM_KSPLIT": 2,
      "num_warps": 2,
      "num_stages": 1,
      "waves_per_eu": 1
    },
    "1152": {
      "BLOCK_M": 32,
      "BLOCK_N": 16,
      "BLOCK_K": 256,
      "BLOCK_C": 32,
      "NUM_KSPLIT": 1,
      "num_warps": 2,
      "num_stages": 1,
      "waves_per_eu": 0
    },
    "5026": {
      "BLOCK_M": 256,
      "BLOCK_N": 16,
      "BLOCK_K": 64,
      "BLOCK_C": 256,
      "NUM_KSPLIT": 8,
      "num_warps": 2,
      "num_stages": 2,
      "waves_per_eu": 1
    },
    "37": {
      "BLOCK_M": 32,
      "BLOCK_N": 16,
      "BLOCK_K": 32,
      "BLOCK_C": 16,
      "NUM_KSPLIT": 4,
      "num_warps": 2,
      "num_stages": 1,
      "waves_per_eu": 1
    },
    "258": {
      "BLOCK_M": 32,
      "BLOCK_N": 16,
      "BLOCK_K": 32,
      "BLOCK_C": 128,
      "NUM_KSPLIT": 4,
      "num_warps": 4,
      "num_stages": 1,
      "waves_per_eu": 0
    },
    "4692": {
      "BLOCK_M": 256,
      "BLOCK_N": 16,
      "BLOCK_K": 64,
      "BLOCK_C": 16,
      "NUM_KSPLIT": 1,
      "num_warps": 8,
      "num_stages": 1,
      "waves_per_eu": 0
    },
    "3778": {
      "BLOCK_M": 128,
      "BLOCK_N": 16,
      "BLOCK_K": 128,
      "BLOCK_C": 64,
      "NUM_KSPLIT": 2,
      "num_warps": 8,
      "num_stages": 2,
      "waves_per_eu": 1
    },
    "4460": {
      "BLOCK_M": 256,
      "BLOCK_N": 16,
      "BLOCK_K": 32,
      "BLOCK_C": 32,
      "NUM_KSPLIT": 8,
      "num_warps": 8,
      "num_stages": 1,
      "waves_per_eu": 2
    },
    "53": {
      "BLOCK_M": 32,
      "BLOCK_N": 16,
      "BLOCK_K": 32,
      "BLOCK_C": 16,
      "NUM_KSPLIT": 4,
      "num_warps": 8,
      "num_stages": 2,
      "waves_per_eu": 2
    },
    "5171": {
      "BLOCK_M": 256,
      "BLOCK_N": 16,
      "BLOCK_K": 128,
      "BLOCK_C": 32,
      "NUM_KSPLIT": 8,
      "num_warps": 2,
      "num_stages": 2,
      "waves_per_eu": 2
    },
    "4507": {
      "BLOCK_M": 256,
      "BLOCK_N": 16,
      "BLOCK_K": 32,
      "BLOCK_C": 64,
      "NUM_KSPLIT": 4,
      "num_warps": 4,
      "num_stages": 1,
      "waves_per_eu": 1
    },
    "1402": {
      "BLOCK_M": 32,
      "BLOCK_N": 16,
      "BLOCK_K": 256,
      "BLOCK_C": 256,
      "NUM_KSPLIT": 2,
      "num_warps": 8,
      "num_stages": 2,
      "waves_per_eu": 1
    },
    "5095": {
      "BLOCK_M": 256,
      "BLOCK_N": 16,
      "BLOCK_K": 128,
      "BLOCK_C": 16,
      "NUM_KSPLIT": 8,
      "num_warps": 2,
      "num_stages": 1,
      "waves_per_eu": 1
    },
    "1087": {
      "BLOCK_M": 32,
      "BLOCK_N": 16,
      "BLOCK_K": 256,
      "BLOCK_C": 16,
      "NUM_KSPLIT": 1,
      "num_warps": 4,
      "num_stages": 1,
      "waves_per_eu": 1
    },
    "3944": {
      "BLOCK_M": 128,
      "BLOCK_N": 16,
      "BLOCK_K": 128,
      "BLOCK_C": 256,
      "NUM_KSPLIT": 8,
      "num_warps": 2,
      "num_stages": 1,
      "waves_per_eu": 2
    },
    "133": {
      "BLOCK_M": 32,
      "BLOCK_N": 16,
      "BLOCK_K": 32,
      "BLOCK_C": 32,
      "NUM_KSPLIT": 8,
      "num_warps": 4,
      "num_stages": 1,
      "waves_per_eu": 1
    },
    "866": {
      "BLOCK_M": 32,
      "BLOCK_N": 16,
      "BLOCK_K": 128,
      "BLOCK_C": 64,
      "NUM_KSPLIT": 1,
      "num_warps": 2,
      "num_stages": 1,
      "waves_per_eu": 2
    },
    "0": {
      "BLOCK_M": 32,
      "BLOCK_N": 16,
      "BLOCK_K": 32,
      "BLOCK_C": 16,
      "NUM_KSPLIT": 1,
      "num_warps": 2,
      "num_stages": 1,
      "waves_per_eu": 0
    },
    "1523": {
      "BLOCK_M": 64,
      "BLOCK_N": 16,
      "BLOCK_K": 32,
      "BLOCK_C": 32,
      "NUM_KSPLIT": 1,
      "num_warps": 4,
      "num_stages": 2,
      "waves_per_eu": 2
    },
    "902": {
      "BLOCK_M": 32,
      "BLOCK_N": 16,
      "BLOCK_K": 128,
      "BLOCK_C": 64,
      "NUM_KSPLIT": 4,
      "num_warps": 2,
      "num_stages": 1,
      "waves_per_eu": 2
    },
    "5302": {
      "BLOCK_M": 256,
      "BLOCK_N": 16,
      "BLOCK_K": 128,
      "BLOCK_C": 128,
      "NUM_KSPLIT": 4,
      "num_warps": 4,
      "num_stages": 2,
      "waves_per_eu": 1
    },
    "3363": {
      "BLOCK_M": 128,
      "BLOCK_N": 16,
      "BLOCK_K": 64,
      "BLOCK_C": 32,
      "NUM_KSPLIT": 4,
      "num_warps": 8,
      "num_stages": 2,
      "waves_per_eu": 0
    },
    "1468": {
      "BLOCK_M": 64,
      "BLOCK_N": 16,
      "BLOCK_K": 32,
      "BLOCK_C": 16,
      "NUM_KSPLIT": 2,
      "num_warps": 4,
      "num_stages": 2,
      "waves_per_eu": 1
    },
    "942": {
      "BLOCK_M": 32,
      "BLOCK_N": 16,
      "BLOCK_K": 128,
      "BLOCK_C": 128,
      "NUM_KSPLIT": 1,
      "num_warps": 4,
      "num_stages": 1,
      "waves_per_eu": 0
    },
    "617": {
      "BLOCK_M": 32,
      "BLOCK_N": 16,
      "BLOCK_K": 64,
      "BLOCK_C": 128,
      "NUM_KSPLIT": 4,
      "num_warps": 2,
      "num_stages": 2,
      "waves_per_eu": 2
    },
    "5236": {
      "BLOCK_M": 256,
      "BLOCK_N": 16,
      "BLOCK_K": 128,
      "BLOCK_C": 64,
      "NUM_KSPLIT": 4,
      "num_warps": 8,
      "num_stages": 2,
      "waves_per_eu": 1
    },
    "2942": {
      "BLOCK_M": 128,
      "BLOCK_N": 16,
      "BLOCK_K": 32,
      "BLOCK_C": 16,
      "NUM_KSPLIT": 8,
      "num_warps": 4,
      "num_stages": 1,
      "waves_per_eu": 2
    },
    "3175": {
      "BLOCK_M": 128,
      "BLOCK_N": 16,
      "BLOCK_K": 32,
      "BLOCK_C": 256,
      "NUM_KSPLIT": 1,
      "num_warps": 4,
      "num_stages": 1,
      "waves_per_eu": 1
    },
    "4986": {
      "BLOCK_M": 256,
      "BLOCK_N": 16,
      "BLOCK_K": 64,
      "BLOCK_C": 256,
      "NUM_KSPLIT": 2,
      "num_warps": 2,
      "num_stages": 1,
      "waves_per_eu": 0
    },
    "3970": {
      "BLOCK_M": 128,
      "BLOCK_N": 16,
      "BLOCK_K": 256,
      "BLOCK_C": 16,
      "NUM_KSPLIT": 1,
      "num_warps": 4,
      "num_stages": 2,
      "waves_per_eu": 1
    },
    "4059": {
      "BLOCK_M": 128,
      "BLOCK_N": 16,
      "BLOCK_K": 256,
      "BLOCK_C": 32,
      "NUM_KSPLIT": 2,
      "num_warps": 4,
      "num_stages": 2,
      "waves_per_eu": 0
    },
    "3193": {
      "BLOCK_M": 128,
      "BLOCK_N": 16,
      "BLOCK_K": 32,
      "BLOCK_C": 256,
      "NUM_KSPLIT": 2,
      "num_warps": 4,
      "num_stages": 1,
      "waves_per_eu": 1
    },
    "2118": {
      "BLOCK_M": 64,
      "BLOCK_N": 16,
      "BLOCK_K": 64,
      "BLOCK_C": 256,
      "NUM_KSPLIT": 2,
      "num_warps": 8,
      "num_stages": 1,
      "waves_per_eu": 0
    },
    "2046": {
      "BLOCK_M": 64,
      "BLOCK_N": 16,
      "BLOCK_K": 64,
      "BLOCK_C": 128,
      "NUM_KSPLIT": 2,
      "num_warps": 8,
      "num_stages": 1,
      "waves_per_eu": 0
    },
    "3047": {
      "BLOCK_M": 128,
      "BLOCK_N": 16,
      "BLOCK_K": 32,
      "BLOCK_C": 64,
      "NUM_KSPLIT": 2,
      "num_warps": 2,
      "num_stages": 2,
      "waves_per_eu": 2
    },
    "4297": {
      "BLOCK_M": 128,
      "BLOCK_N": 16,
      "BLOCK_K": 256,
      "BLOCK_C": 256,
      "NUM_KSPLIT": 4,
      "num_warps": 8,
      "num_stages": 1,
      "waves_per_eu": 1
    },
    "2617": {
      "BLOCK_M": 64,
      "BLOCK_N": 16,
      "BLOCK_K": 256,
      "BLOCK_C": 32,
      "NUM_KSPLIT": 2,
      "num_warps": 4,
      "num_stages": 1,
      "waves_per_eu": 1
    },
    "3840": {
      "BLOCK_M": 128,
      "BLOCK_N": 16,
      "BLOCK_K": 128,
      "BLOCK_C": 128,
      "NUM_KSPLIT": 2,
      "num_warps": 4,
      "num_stages": 1,
      "waves_per_eu": 0
    },
    "2404": {
      "BLOCK_M": 64,
      "BLOCK_N": 16,
      "BLOCK_K": 128,
      "BLOCK_C": 128,
      "NUM_KSPLIT": 2,
      "num_warps": 4,
      "num_stages": 2,
      "waves_per_eu": 1
    },
    "720": {
      "BLOCK_M": 32,
      "BLOCK_N": 16,
      "BLOCK_K": 128,
      "BLOCK_C": 16,
      "NUM_KSPLIT": 1,
      "num_warps": 2,
      "num_stages": 1,
      "waves_per_eu": 0
    },
    "968": {
      "BLOCK_M": 32,
      "BLOCK_N": 16,
      "BLOCK_K": 128,
      "BLOCK_C": 128,
      "NUM_KSPLIT": 2,
      "num_warps": 8,
      "num_stages": 1,
      "waves_per_eu": 2
    },
    "2780": {
      "BLOCK_M": 64,
      "BLOCK_N": 16,
      "BLOCK_K": 256,
      "BLOCK_C": 128,
      "NUM_KSPLIT": 4,
      "num_warps": 4,
      "num_stages": 1,
      "waves_per_eu": 2
    },
    "1564": {
      "BLOCK_M": 64,
      "BLOCK_N": 16,
      "BLOCK_K": 32,
      "BLOCK_C": 32,
      "NUM_KSPLIT": 4,
      "num_warps": 8,
      "num_stages": 2,
      "waves_per_eu": 1
    },
    "1899": {
      "BLOCK_M": 64,
      "BLOCK_N": 16,
      "BLOCK_K": 64,
      "BLOCK_C": 32,
      "NUM_KSPLIT": 2,
      "num_warps": 4,
      "num_stages": 2,
      "waves_per_eu": 0
    },
    "2793": {
      "BLOCK_M": 64,
      "BLOCK_N": 16,
      "BLOCK_K": 256,
      "BLOCK_C": 128,
      "NUM_KSPLIT": 8,
      "num_warps": 2,
      "num_stages": 2,
      "waves_per_eu": 0
    },
    "3159": {
      "BLOCK_M": 128,
      "BLOCK_N": 16,
      "BLOCK_K": 32,
      "BLOCK_C": 128,
      "NUM_KSPLIT": 8,
      "num_warps": 4,
      "num_stages": 2,
      "waves_per_eu": 0
    },
    "269": {
      "BLOCK_M": 32,
      "BLOCK_N": 16,
      "BLOCK_K": 32,
      "BLOCK_C": 128,
      "NUM_KSPLIT": 4,
      "num_warps": 8,
      "num_stages": 2,
      "waves_per_eu": 2
    },
    "5713": {
      "BLOCK_M": 256,
      "BLOCK_N": 16,
      "BLOCK_K": 256,
      "BLOCK_C": 256,
      "NUM_KSPLIT": 2,
      "num_warps": 4,
      "num_stages": 1,
      "waves_per_eu": 1
    },
    "1204": {
      "BLOCK_M": 32,
      "BLOCK_N": 16,
      "BLOCK_K": 256,
      "BLOCK_C": 32,
      "NUM_KSPLIT": 4,
      "num_warps": 8,
      "num_stages": 2,
      "waves_per_eu": 1
    },
    "1070": {
      "BLOCK_M": 32,
      "BLOCK_N": 16,
      "BLOCK_K": 128,
      "BLOCK_C": 256,
      "NUM_KSPLIT": 8,
      "num_warps": 4,
      "num_stages": 1,
      "waves_per_eu": 2
    },
    "4923": {
      "BLOCK_M": 256,
      "BLOCK_N": 16,
      "BLOCK_K": 64,
      "BLOCK_C": 128,
      "NUM_KSPLIT": 2,
      "num_warps": 4,
      "num_stages": 2,
      "waves_per_eu": 0
    },
    "2402": {
      "BLOCK_M": 64,
      "BLOCK_N": 16,
      "BLOCK_K": 128,
      "BLOCK_C": 128,
      "NUM_KSPLIT": 2,
      "num_warps": 4,
      "num_stages": 1,
      "waves_per_eu": 2
    },
    "1077": {
      "BLOCK_M": 32,
      "BLOCK_N": 16,
      "BLOCK_K": 128,
      "BLOCK_C": 256,
      "NUM_KSPLIT": 8,
      "num_warps": 8,
      "num_stages": 2,
      "waves_per_eu": 0
    },
    "1933": {
      "BLOCK_M": 64,
      "BLOCK_N": 16,
      "BLOCK_K": 64,
      "BLOCK_C": 32,
      "NUM_KSPLIT": 8,
      "num_warps": 4,
      "num_stages": 1,
      "waves_per_eu": 1
    },
    "906": {
      "BLOCK_M": 32,
      "BLOCK_N": 16,
      "BLOCK_K": 128,
      "BLOCK_C": 64,
      "NUM_KSPLIT": 4,
      "num_warps": 4,
      "num_stages": 1,
      "waves_per_eu": 0
    },
    "4895": {
      "BLOCK_M": 256,
      "BLOCK_N": 16,
      "BLOCK_K": 64,
      "BLOCK_C": 64,
      "NUM_KSPLIT": 8,
      "num_warps": 8,
      "num_stages": 2,
      "waves_per_eu": 2
    },
    "247": {
      "BLOCK_M": 32,
      "BLOCK_N": 16,
      "BLOCK_K": 32,
      "BLOCK_C": 128,
      "NUM_KSPLIT": 2,
      "num_warps": 8,
      "num_stages": 1,
      "waves_per_eu": 1
    },
    "4458": {
      "BLOCK_M": 256,
      "BLOCK_N": 16,
      "BLOCK_K": 32,
      "BLOCK_C": 32,
      "NUM_KSPLIT": 8,
      "num_warps": 8,
      "num_stages": 1,
      "waves_per_eu": 0
    },
    "3642": {
      "BLOCK_M": 128,
      "BLOCK_N": 16,
      "BLOCK_K": 128,
      "BLOCK_C": 16,
      "NUM_KSPLIT": 4,
      "num_warps": 4,
      "num_stages": 1,
      "waves_per_eu": 0
    },
    "760": {
      "BLOCK_M": 32,
      "BLOCK_N": 16,
      "BLOCK_K": 128,
      "BLOCK_C": 16,
      "NUM_KSPLIT": 4,
      "num_warps": 2,
      "num_stages": 2,
      "waves_per_eu": 1
    },
    "1434": {
      "BLOCK_M": 32,
      "BLOCK_N": 16,
      "BLOCK_K": 256,
      "BLOCK_C": 256,
      "NUM_KSPLIT": 8,
      "num_warps": 8,
      "num_stages": 1,
      "waves_per_eu": 0
    },
    "5552": {
      "BLOCK_M": 256,
      "BLOCK_N": 16,
      "BLOCK_K": 256,
      "BLOCK_C": 64,
      "NUM_KSPLIT": 1,
      "num_warps": 4,
      "num_stages": 1,
      "waves_per_eu": 2
    },
    "4918": {
      "BLOCK_M": 256,
      "BLOCK_N": 16,
      "BLOCK_K": 64,
      "BLOCK_C": 128,
      "NUM_KSPLIT": 2,
      "num_warps": 2,
      "num_stages": 2,
      "waves_per_eu": 1
    },
    "3809": {
      "BLOCK_M": 128,
      "BLOCK_N": 16,
      "BLOCK_K": 128,
      "BLOCK_C": 64,
      "NUM_KSPLIT": 8,
      "num_warps": 4,
      "num_stages": 2,
      "waves_per_eu": 2
    },
    "1385": {
      "BLOCK_M": 32,
      "BLOCK_N": 16,
      "BLOCK_K": 256,
      "BLOCK_C": 256,
      "NUM_KSPLIT": 1,
      "num_warps": 8,
      "num_stages": 2,
      "waves_per_eu": 2
    },
    "5701": {
      "BLOCK_M": 256,
      "BLOCK_N": 16,
      "BLOCK_K": 256,
      "BLOCK_C": 256,
      "NUM_KSPLIT": 1,
      "num_warps": 8,
      "num_stages": 1,
      "waves_per_eu": 1
    },
    "5500": {
      "BLOCK_M": 256,
      "BLOCK_N": 16,
      "BLOCK_K": 256,
      "BLOCK_C": 32,
      "NUM_KSPLIT": 2,
      "num_warps": 4,
      "num_stages": 2,
      "waves_per_eu": 1
    },
    "4201": {
      "BLOCK_M": 128,
      "BLOCK_N": 16,
      "BLOCK_K": 256,
      "BLOCK_C": 128,
      "NUM_KSPLIT": 2,
      "num_warps": 4,
      "num_stages": 1,
      "waves_per_eu": 1
    },
    "4254": {
      "BLOCK_M": 128,
      "BLOCK_N": 16,
      "BLOCK_K": 256,
      "BLOCK_C": 256,
      "NUM_KSPLIT": 1,
      "num_warps": 4,
      "num_stages": 1,
      "waves_per_eu": 0
    },
    "3420": {
      "BLOCK_M": 128,
      "BLOCK_N": 16,
      "BLOCK_K": 64,
      "BLOCK_C": 64,
      "NUM_KSPLIT": 4,
      "num_warps": 2,
      "num_stages": 1,
      "waves_per_eu": 0
    },
    "1690": {
      "BLOCK_M": 64,
      "BLOCK_N": 16,
      "BLOCK_K": 32,
      "BLOCK_C": 128,
      "NUM_KSPLIT": 2,
      "num_warps": 8,
      "num_stages": 2,
      "waves_per_eu": 1
    },
    "3801": {
      "BLOCK_M": 128,
      "BLOCK_N": 16,
      "BLOCK_K": 128,
      "BLOCK_C": 64,
      "NUM_KSPLIT": 8,
      "num_warps": 2,
      "num_stages": 2,
      "waves_per_eu": 0
    },
    "779": {
      "BLOCK_M": 32,
      "BLOCK_N": 16,
      "BLOCK_K": 128,
      "BLOCK_C": 16,
      "NUM_KSPLIT": 8,
      "num_warps": 2,
      "num_stages": 2,
      "waves_per_eu": 2
    },
    "741": {
      "BLOCK_M": 32,
      "BLOCK_N": 16,
      "BLOCK_K": 128,
      "BLOCK_C": 16,
      "NUM_KSPLIT": 2,
      "num_warps": 2,
      "num_stages": 2,
      "waves_per_eu": 0
    },
    "1454": {
      "BLOCK_M": 64,
      "BLOCK_N": 16,
      "BLOCK_K": 32,
      "BLOCK_C": 16,
      "NUM_KSPLIT": 1,
      "num_warps": 8,
      "num_stages": 1,
      "waves_per_eu": 2
    },
    "4366": {
      "BLOCK_M": 256,
      "BLOCK_N": 16,
      "BLOCK_K": 32,
      "BLOCK_C": 16,
      "NUM_KSPLIT": 4,
      "num_warps": 4,
      "num_stages": 2,
      "waves_per_eu": 1
    },
    "1392": {
      "BLOCK_M": 32,
      "BLOCK_N": 16,
      "BLOCK_K": 256,
      "BLOCK_C": 256,
      "NUM_KSPLIT": 2,
      "num_warps": 4,
      "num_stages": 1,
      "waves_per_eu": 0
    },
    "4745": {
      "BLOCK_M": 256,
      "BLOCK_N": 16,
      "BLOCK_K": 64,
      "BLOCK_C": 16,
      "NUM_KSPLIT": 8,
      "num_warps": 4,
      "num_stages": 2,
      "waves_per_eu": 2
    },
    "4289": {
      "BLOCK_M": 128,
      "BLOCK_N": 16,
      "BLOCK_K": 256,
      "BLOCK_C": 256,
      "NUM_KSPLIT": 4,
      "num_warps": 2,
      "num_stages": 2,
      "waves_per_eu": 2
    },
    "4288": {
      "BLOCK_M": 128,
      "BLOCK_N": 16,
      "BLOCK_K": 256,
      "BLOCK_C": 256,
      "NUM_KSPLIT": 4,
      "num_warps": 2,
      "num_stages": 2,
      "waves_per_eu": 1
    },
    "4552": {
      "BLOCK_M": 256,
      "BLOCK_N": 16,
      "BLOCK_K": 32,
      "BLOCK_C": 128,
      "NUM_KSPLIT": 1,
      "num_warps": 8,
      "num_stages": 2,
      "waves_per_eu": 1
    },
    "277": {
      "BLOCK_M": 32,
      "BLOCK_N": 16,
      "BLOCK_K": 32,
      "BLOCK_C": 128,
      "NUM_KSPLIT": 8,
      "num_warps": 4,
      "num_stages": 1,
      "waves_per_eu": 1
    },
    "3102": {
      "BLOCK_M": 128,
      "BLOCK_N": 16,
      "BLOCK_K": 32,
      "BLOCK_C": 128,
      "NUM_KSPLIT": 1,
      "num_warps": 4,
      "num_stages": 1,
      "waves_per_eu": 0
    },
    "1086": {
      "BLOCK_M": 32,
      "BLOCK_N": 16,
      "BLOCK_K": 256,
      "BLOCK_C": 16,
      "NUM_KSPLIT": 1,
      "num_warps": 4,
      "num_stages": 1,
      "waves_per_eu": 0
    },
    "2455": {
      "BLOCK_M": 64,
      "BLOCK_N": 16,
      "BLOCK_K": 128,
      "BLOCK_C": 256,
      "NUM_KSPLIT": 1,
      "num_warps": 4,
      "num_stages": 1,
      "waves_per_eu": 1
    },
    "214": {
      "BLOCK_M": 32,
      "BLOCK_N": 16,
      "BLOCK_K": 32,
      "BLOCK_C": 64,
      "NUM_KSPLIT": 8,
      "num_warps": 8,
      "num_stages": 2,
      "waves_per_eu": 1
    },
    "2886": {
      "BLOCK_M": 128,
      "BLOCK_N": 16,
      "BLOCK_K": 32,
      "BLOCK_C": 16,
      "NUM_KSPLIT": 1,
      "num_warps": 4,
      "num_stages": 1,
      "waves_per_eu": 0
    },
    "1141": {
      "BLOCK_M": 32,
      "BLOCK_N": 16,
      "BLOCK_K": 256,
      "BLOCK_C": 16,
      "NUM_KSPLIT": 8,
      "num_warps": 4,
      "num_stages": 1,
      "waves_per_eu": 1
    },
    "2980": {
      "BLOCK_M": 128,
      "BLOCK_N": 16,
      "BLOCK_K": 32,
      "BLOCK_C": 32,
      "NUM_KSPLIT": 2,
      "num_warps": 4,
      "num_stages": 2,
      "waves_per_eu": 1
    },
    "1677": {
      "BLOCK_M": 64,
      "BLOCK_N": 16,
      "BLOCK_K": 32,
      "BLOCK_C": 128,
      "NUM_KSPLIT": 2,
      "num_warps": 2,
      "num_stages": 2,
      "waves_per_eu": 0
    },
    "3870": {
      "BLOCK_M": 128,
      "BLOCK_N": 16,
      "BLOCK_K": 128,
      "BLOCK_C": 128,
      "NUM_KSPLIT": 8,
      "num_warps": 2,
      "num_stages": 1,
      "waves_per_eu": 0
    },
    "4202": {
      "BLOCK_M": 128,
      "BLOCK_N": 16,
      "BLOCK_K": 256,
      "BLOCK_C": 128,
      "NUM_KSPLIT": 2,
      "num_warps": 4,
      "num_stages": 1,
      "waves_per_eu": 2
    },
    "4691": {
      "BLOCK_M": 256,
      "BLOCK_N": 16,
      "BLOCK_K": 64,
      "BLOCK_C": 16,
      "NUM_KSPLIT": 1,
      "num_warps": 4,
      "num_stages": 2,
      "waves_per_eu": 2
    },
    "626": {
      "BLOCK_M": 32,
      "BLOCK_N": 16,
      "BLOCK_K": 64,
      "BLOCK_C": 128,
      "NUM_KSPLIT": 4,
      "num_warps": 8,
      "num_stages": 1,
      "waves_per_eu": 2
    },
    "1687": {
      "BLOCK_M": 64,
      "BLOCK_N": 16,
      "BLOCK_K": 32,
      "BLOCK_C": 128,
      "NUM_KSPLIT": 2,
      "num_warps": 8,
      "num_stages": 1,
      "waves_per_eu": 1
    },
    "1982": {
      "BLOCK_M": 64,
      "BLOCK_N": 16,
      "BLOCK_K": 64,
      "BLOCK_C": 64,
      "NUM_KSPLIT": 4,
      "num_warps": 2,
      "num_stages": 1,
      "waves_per_eu": 2
    },
    "4384": {
      "BLOCK_M": 256,
      "BLOCK_N": 16,
      "BLOCK_K": 32,
      "BLOCK_C": 16,
      "NUM_KSPLIT": 8,
      "num_warps": 4,
      "num_stages": 2,
      "waves_per_eu": 1
    },
    "482": {
      "BLOCK_M": 32,
      "BLOCK_N": 16,
      "BLOCK_K": 64,
      "BLOCK_C": 32,
      "NUM_KSPLIT": 4,
      "num_warps": 8,
      "num_stages": 1,
      "waves_per_eu": 2
    },
    "4099": {
      "BLOCK_M": 128,
      "BLOCK_N": 16,
      "BLOCK_K": 256,
      "BLOCK_C": 32,
      "NUM_KSPLIT": 8,
      "num_warps": 8,
      "num_stages": 1,
      "waves_per_eu": 1
    },
    "1656": {
      "BLOCK_M": 64,
      "BLOCK_N": 16,
      "BLOCK_K": 32,
      "BLOCK_C": 128,
      "NUM_KSPLIT": 1,
      "num_warps": 2,
      "num_stages": 1,
      "waves_per_eu": 0
    },
    "4706": {
      "BLOCK_M": 256,
      "BLOCK_N": 16,
      "BLOCK_K": 64,
      "BLOCK_C": 16,
      "NUM_KSPLIT": 2,
      "num_warps": 4,
      "num_stages": 1,
      "waves_per_eu": 2
    },
    "5756": {
      "BLOCK_M": 256,
      "BLOCK_N": 16,
      "BLOCK_K": 256,
      "BLOCK_C": 256,
      "NUM_KSPLIT": 8,
      "num_warps": 8,
      "num_stages": 1,
      "waves_per_eu": 2
    },
    "5514": {
      "BLOCK_M": 256,
      "BLOCK_N": 16,
      "BLOCK_K": 256,
      "BLOCK_C": 32,
      "NUM_KSPLIT": 4,
      "num_warps": 4,
      "num_stages": 1,
      "waves_per_eu": 0
    },
    "4890": {
      "BLOCK_M": 256,
      "BLOCK_N": 16,
      "BLOCK_K": 64,
      "BLOCK_C": 64,
      "NUM_KSPLIT": 8,
      "num_warps": 8,
      "num_stages": 1,
      "waves_per_eu": 0
    },
    "2073": {
      "BLOCK_M": 64,
      "BLOCK_N": 16,
      "BLOCK_K": 64,
      "BLOCK_C": 128,
      "NUM_KSPLIT": 8,
      "num_warps": 2,
      "num_stages": 2,
      "waves_per_eu": 0
    },
    "2134": {
      "BLOCK_M": 64,
      "BLOCK_N": 16,
      "BLOCK_K": 64,
      "BLOCK_C": 256,
      "NUM_KSPLIT": 4,
      "num_warps": 4,
      "num_stages": 2,
      "waves_per_eu": 1
    },
    "1071": {
      "BLOCK_M": 32,
      "BLOCK_N": 16,
      "BLOCK_K": 128,
      "BLOCK_C": 256,
      "NUM_KSPLIT": 8,
      "num_warps": 4,
      "num_stages": 2,
      "waves_per_eu": 0
    },
    "4711": {
      "BLOCK_M": 256,
      "BLOCK_N": 16,
      "BLOCK_K": 64,
      "BLOCK_C": 16,
      "NUM_KSPLIT": 2,
      "num_warps": 8,
      "num_stages": 1,
      "waves_per_eu": 1
    },
    "5137": {
      "BLOCK_M": 256,
      "BLOCK_N": 16,
      "BLOCK_K": 128,
      "BLOCK_C": 32,
      "NUM_KSPLIT": 2,
      "num_warps": 4,
      "num_stages": 1,
      "waves_per_eu": 1
    },
    "746": {
      "BLOCK_M": 32,
      "BLOCK_N": 16,
      "BLOCK_K": 128,
      "BLOCK_C": 16,
      "NUM_KSPLIT": 2,
      "num_warps": 4,
      "num_stages": 1,
      "waves_per_eu": 2
    },
    "3087": {
      "BLOCK_M": 128,
      "BLOCK_N": 16,
      "BLOCK_K": 32,
      "BLOCK_C": 64,
      "NUM_KSPLIT": 8,
      "num_warps": 4,
      "num_stages": 2,
      "waves_per_eu": 0
    },
    "801": {
      "BLOCK_M": 32,
      "BLOCK_N": 16,
      "BLOCK_K": 128,
      "BLOCK_C": 32,
      "NUM_KSPLIT": 1,
      "num_warps": 4,
      "num_stages": 2,
      "waves_per_eu": 0
    },
    "3445": {
      "BLOCK_M": 128,
      "BLOCK_N": 16,
      "BLOCK_K": 64,
      "BLOCK_C": 64,
      "NUM_KSPLIT": 8,
      "num_warps": 4,
      "num_stages": 1,
      "waves_per_eu": 1
    },
    "1811": {
      "BLOCK_M": 64,
      "BLOCK_N": 16,
      "BLOCK_K": 64,
      "BLOCK_C": 16,
      "NUM_KSPLIT": 1,
      "num_warps": 4,
      "num_stages": 2,
      "waves_per_eu": 2
    },
    "3239": {
      "BLOCK_M": 128,
      "BLOCK_N": 16,
      "BLOCK_K": 32,
      "BLOCK_C": 256,
      "NUM_KSPLIT": 8,
      "num_warps": 8,
      "num_stages": 2,
      "waves_per_eu": 2
    },
    "2502": {
      "BLOCK_M": 64,
      "BLOCK_N": 16,
      "BLOCK_K": 128,
      "BLOCK_C": 256,
      "NUM_KSPLIT": 8,
      "num_warps": 2,
      "num_stages": 1,
      "waves_per_eu": 0
    },
    "3273": {
      "BLOCK_M": 128,
      "BLOCK_N": 16,
      "BLOCK_K": 64,
      "BLOCK_C": 16,
      "NUM_KSPLIT": 2,
      "num_warps": 8,
      "num_stages": 2,
      "waves_per_eu": 0
    },
    "5359": {
      "BLOCK_M": 256,
      "BLOCK_N": 16,
      "BLOCK_K": 128,
      "BLOCK_C": 256,
      "NUM_KSPLIT": 2,
      "num_warps": 8,
      "num_stages": 1,
      "waves_per_eu": 1
    },
    "4145": {
      "BLOCK_M": 128,
      "BLOCK_N": 16,
      "BLOCK_K": 256,
      "BLOCK_C": 64,
      "NUM_KSPLIT": 4,
      "num_warps": 2,
      "num_stages": 2,
      "waves_per_eu": 2
    },
    "3730": {
      "BLOCK_M": 128,
      "BLOCK_N": 16,
      "BLOCK_K": 128,
      "BLOCK_C": 32,
      "NUM_KSPLIT": 8,
      "num_warps": 2,
      "num_stages": 2,
      "waves_per_eu": 1
    },
    "957": {
      "BLOCK_M": 32,
      "BLOCK_N": 16,
      "BLOCK_K": 128,
      "BLOCK_C": 128,
      "NUM_KSPLIT": 2,
      "num_warps": 2,
      "num_stages": 2,
      "waves_per_eu": 0
    },
    "5080": {
      "BLOCK_M": 256,
      "BLOCK_N": 16,
      "BLOCK_K": 128,
      "BLOCK_C": 16,
      "NUM_KSPLIT": 4,
      "num_warps": 2,
      "num_stages": 2,
      "waves_per_eu": 1
    },
    "4700": {
      "BLOCK_M": 256,
      "BLOCK_N": 16,
      "BLOCK_K": 64,
      "BLOCK_C": 16,
      "NUM_KSPLIT": 2,
      "num_warps": 2,
      "num_stages": 1,
      "waves_per_eu": 2
    },
    "128": {
      "BLOCK_M": 32,
      "BLOCK_N": 16,
      "BLOCK_K": 32,
      "BLOCK_C": 32,
      "NUM_KSPLIT": 8,
      "num_warps": 2,
      "num_stages": 1,
      "waves_per_eu": 2
    },
    "1807": {
      "BLOCK_M": 64,
      "BLOCK_N": 16,
      "BLOCK_K": 64,
      "BLOCK_C": 16,
      "NUM_KSPLIT": 1,
      "num_warps": 4,
      "num_stages": 1,
      "waves_per_eu": 1
    },
    "3852": {
      "BLOCK_M": 128,
      "BLOCK_N": 16,
      "BLOCK_K": 128,
      "BLOCK_C": 128,
      "NUM_KSPLIT": 4,
      "num_warps": 2,
      "num_stages": 1,
      "waves_per_eu": 0
    },
    "921": {
      "BLOCK_M": 32,
      "BLOCK_N": 16,
      "BLOCK_K": 128,
      "BLOCK_C": 64,
      "NUM_KSPLIT": 8,
      "num_warps": 2,
      "num_stages": 2,
      "waves_per_eu": 0
    },
    "641": {
      "BLOCK_M": 32,
      "BLOCK_N": 16,
      "BLOCK_K": 64,
      "BLOCK_C": 128,
      "NUM_KSPLIT": 8,
      "num_warps": 4,
      "num_stages": 2,
      "waves_per_eu": 2
    },
    "187": {
      "BLOCK_M": 32,
      "BLOCK_N": 16,
      "BLOCK_K": 32,
      "BLOCK_C": 64,
      "NUM_KSPLIT": 4,
      "num_warps": 4,
      "num_stages": 1,
      "waves_per_eu": 1
    },
    "612": {
      "BLOCK_M": 32,
      "BLOCK_N": 16,
      "BLOCK_K": 64,
      "BLOCK_C": 128,
      "NUM_KSPLIT": 4,
      "num_warps": 2,
      "num_stages": 1,
      "waves_per_eu": 0
    },
    "4106": {
      "BLOCK_M": 128,
      "BLOCK_N": 16,
      "BLOCK_K": 256,
      "BLOCK_C": 64,
      "NUM_KSPLIT": 1,
      "num_warps": 2,
      "num_stages": 1,
      "waves_per_eu": 2
    },
    "2363": {
      "BLOCK_M": 64,
      "BLOCK_N": 16,
      "BLOCK_K": 128,
      "BLOCK_C": 64,
      "NUM_KSPLIT": 8,
      "num_warps": 2,
      "num_stages": 2,
      "waves_per_eu": 2
    },
    "2638": {
      "BLOCK_M": 64,
      "BLOCK_N": 16,
      "BLOCK_K": 256,
      "BLOCK_C": 32,
      "NUM_KSPLIT": 4,
      "num_warps": 4,
      "num_stages": 2,
      "waves_per_eu": 1
    },
    "2549": {
      "BLOCK_M": 64,
      "BLOCK_N": 16,
      "BLOCK_K": 256,
      "BLOCK_C": 16,
      "NUM_KSPLIT": 2,
      "num_warps": 4,
      "num_stages": 2,
      "waves_per_eu": 2
    },
    "4661": {
      "BLOCK_M": 256,
      "BLOCK_N": 16,
      "BLOCK_K": 32,
      "BLOCK_C": 256,
      "NUM_KSPLIT": 4,
      "num_warps": 8,
      "num_stages": 2,
      "waves_per_eu": 2
    },
    "5679": {
      "BLOCK_M": 256,
      "BLOCK_N": 16,
      "BLOCK_K": 256,
      "BLOCK_C": 128,
      "NUM_KSPLIT": 8,
      "num_warps": 4,
      "num_stages": 2,
      "waves_per_eu": 0
    },
    "1721": {
      "BLOCK_M": 64,
      "BLOCK_N": 16,
      "BLOCK_K": 32,
      "BLOCK_C": 128,
      "NUM_KSPLIT": 8,
      "num_warps": 4,
      "num_stages": 2,
      "waves_per_eu": 2
    },
    "864": {
      "BLOCK_M": 32,
      "BLOCK_N": 16,
      "BLOCK_K": 128,
      "BLOCK_C": 64,
      "NUM_KSPLIT": 1,
      "num_warps": 2,
      "num_stages": 1,
      "waves_per_eu": 0
    },
    "5414": {
      "BLOCK_M": 256,
      "BLOCK_N": 16,
      "BLOCK_K": 256,
      "BLOCK_C": 16,
      "NUM_KSPLIT": 1,
      "num_warps": 8,
      "num_stages": 1,
      "waves_per_eu": 2
    },
    "1254": {
      "BLOCK_M": 32,
      "BLOCK_N": 16,
      "BLOCK_K": 256,
      "BLOCK_C": 64,
      "NUM_KSPLIT": 2,
      "num_warps": 8,
      "num_stages": 1,
      "waves_per_eu": 0
    },
    "2766": {
      "BLOCK_M": 64,
      "BLOCK_N": 16,
      "BLOCK_K": 256,
      "BLOCK_C": 128,
      "NUM_KSPLIT": 2,
      "num_warps": 8,
      "num_stages": 1,
      "waves_per_eu": 0
    },
    "15": {
      "BLOCK_M": 32,
      "BLOCK_N": 16,
      "BLOCK_K": 32,
      "BLOCK_C": 16,
      "NUM_KSPLIT": 1,
      "num_warps": 8,
      "num_stages": 2,
      "waves_per_eu": 0
    },
    "2381": {
      "BLOCK_M": 64,
      "BLOCK_N": 16,
      "BLOCK_K": 128,
      "BLOCK_C": 128,
      "NUM_KSPLIT": 1,
      "num_warps": 2,
      "num_stages": 2,
      "waves_per_eu": 2
    },
    "5312": {
      "BLOCK_M": 256,
      "BLOCK_N": 16,
      "BLOCK_K": 128,
      "BLOCK_C": 128,
      "NUM_KSPLIT": 8,
      "num_warps": 2,
      "num_stages": 1,
      "waves_per_eu": 2
    },
    "2831": {
      "BLOCK_M": 64,
      "BLOCK_N": 16,
      "BLOCK_K": 256,
      "BLOCK_C": 256,
      "NUM_KSPLIT": 2,
      "num_warps": 2,
      "num_stages": 2,
      "waves_per_eu": 2
    },
    "1821": {
      "BLOCK_M": 64,
      "BLOCK_N": 16,
      "BLOCK_K": 64,
      "BLOCK_C": 16,
      "NUM_KSPLIT": 2,
      "num_warps": 2,
      "num_stages": 2,
      "waves_per_eu": 0
    },
    "3662": {
      "BLOCK_M": 128,
      "BLOCK_N": 16,
      "BLOCK_K": 128,
      "BLOCK_C": 16,
      "NUM_KSPLIT": 8,
      "num_warps": 4,
      "num_stages": 1,
      "waves_per_eu": 2
    },
    "5592": {
      "BLOCK_M": 256,
      "BLOCK_N": 16,
      "BLOCK_K": 256,
      "BLOCK_C": 64,
      "NUM_KSPLIT": 4,
      "num_warps": 8,
      "num_stages": 1,
      "waves_per_eu": 0
    },
    "5261": {
      "BLOCK_M": 256,
      "BLOCK_N": 16,
      "BLOCK_K": 128,
      "BLOCK_C": 128,
      "NUM_KSPLIT": 1,
      "num_warps": 2,
      "num_stages": 2,
      "waves_per_eu": 2
    },
    "4348": {
      "BLOCK_M": 256,
      "BLOCK_N": 16,
      "BLOCK_K": 32,
      "BLOCK_C": 16,
      "NUM_KSPLIT": 2,
      "num_warps": 4,
      "num_stages": 2,
      "waves_per_eu": 1
    },
    "241": {
      "BLOCK_M": 32,
      "BLOCK_N": 16,
      "BLOCK_K": 32,
      "BLOCK_C": 128,
      "NUM_KSPLIT": 2,
      "num_warps": 4,
      "num_stages": 1,
      "waves_per_eu": 1
    },
    "308": {
      "BLOCK_M": 32,
      "BLOCK_N": 16,
      "BLOCK_K": 32,
      "BLOCK_C": 256,
      "NUM_KSPLIT": 2,
      "num_warps": 2,
      "num_stages": 1,
      "waves_per_eu": 2
    },
    "5205": {
      "BLOCK_M": 256,
      "BLOCK_N": 16,
      "BLOCK_K": 128,
      "BLOCK_C": 64,
      "NUM_KSPLIT": 2,
      "num_warps": 2,
      "num_stages": 2,
      "waves_per_eu": 0
    },
    "3689": {
      "BLOCK_M": 128,
      "BLOCK_N": 16,
      "BLOCK_K": 128,
      "BLOCK_C": 32,
      "NUM_KSPLIT": 1,
      "num_warps": 8,
      "num_stages": 2,
      "waves_per_eu": 2
    },
    "1633": {
      "BLOCK_M": 64,
      "BLOCK_N": 16,
      "BLOCK_K": 32,
      "BLOCK_C": 64,
      "NUM_KSPLIT": 4,
      "num_warps": 8,
      "num_stages": 1,
      "waves_per_eu": 1
    },
    "96": {
      "BLOCK_M": 32,
      "BLOCK_N": 16,
      "BLOCK_K": 32,
      "BLOCK_C": 32,
      "NUM_KSPLIT": 2,
      "num_warps": 4,
      "num_stages": 1,
      "waves_per_eu": 0
    },
    "1769": {
      "BLOCK_M": 64,
      "BLOCK_N": 16,
      "BLOCK_K": 32,
      "BLOCK_C": 256,
      "NUM_KSPLIT": 4,
      "num_warps": 2,
      "num_stages": 2,
      "waves_per_eu": 2
    },
    "579": {
      "BLOCK_M": 32,
      "BLOCK_N": 16,
      "BLOCK_K": 64,
      "BLOCK_C": 128,
      "NUM_KSPLIT": 1,
      "num_warps": 2,
      "num_stages": 2,
      "waves_per_eu": 0
    },
    "3672": {
      "BLOCK_M": 128,
      "BLOCK_N": 16,
      "BLOCK_K": 128,
      "BLOCK_C": 32,
      "NUM_KSPLIT": 1,
      "num_warps": 2,
      "num_stages": 1,
      "waves_per_eu": 0
    },
    "3764": {
      "BLOCK_M": 128,
      "BLOCK_N": 16,
      "BLOCK_K": 128,
      "BLOCK_C": 64,
      "NUM_KSPLIT": 2,
      "num_warps": 2,
      "num_stages": 1,
      "waves_per_eu": 2
    },
    "989": {
      "BLOCK_M": 32,
      "BLOCK_N": 16,
      "BLOCK_K": 128,
      "BLOCK_C": 128,
      "NUM_KSPLIT": 4,
      "num_warps": 8,
      "num_stages": 2,
      "waves_per_eu": 2
    },
    "1591": {
      "BLOCK_M": 64,
      "BLOCK_N": 16,
      "BLOCK_K": 32,
      "BLOCK_C": 64,
      "NUM_KSPLIT": 1,
      "num_warps": 4,
      "num_stages": 1,
      "waves_per_eu": 1
    },
    "451": {
      "BLOCK_M": 32,
      "BLOCK_N": 16,
      "BLOCK_K": 64,
      "BLOCK_C": 32,
      "NUM_KSPLIT": 2,
      "num_warps": 2,
      "num_stages": 1,
      "waves_per_eu": 1
    },
    "2954": {
      "BLOCK_M": 128,
      "BLOCK_N": 16,
      "BLOCK_K": 32,
      "BLOCK_C": 32,
      "NUM_KSPLIT": 1,
      "num_warps": 2,
      "num_stages": 1,
      "waves_per_eu": 2
    },
    "462": {
      "BLOCK_M": 32,
      "BLOCK_N": 16,
      "BLOCK_K": 64,
      "BLOCK_C": 32,
      "NUM_KSPLIT": 2,
      "num_warps": 8,
      "num_stages": 1,
      "waves_per_eu": 0
    },
    "502": {
      "BLOCK_M": 32,
      "BLOCK_N": 16,
      "BLOCK_K": 64,
      "BLOCK_C": 32,
      "NUM_KSPLIT": 8,
      "num_warps": 8,
      "num_stages": 2,
      "waves_per_eu": 1
    },
    "5009": {
      "BLOCK_M": 256,
      "BLOCK_N": 16,
      "BLOCK_K": 64,
      "BLOCK_C": 256,
      "NUM_KSPLIT": 4,
      "num_warps": 2,
      "num_stages": 2,
      "waves_per_eu": 2
    },
    "1701": {
      "BLOCK_M": 64,
      "BLOCK_N": 16,
      "BLOCK_K": 32,
      "BLOCK_C": 128,
      "NUM_KSPLIT": 4,
      "num_warps": 4,
      "num_stages": 2,
      "waves_per_eu": 0
    },
    "55": {
      "BLOCK_M": 32,
      "BLOCK_N": 16,
      "BLOCK_K": 32,
      "BLOCK_C": 16,
      "NUM_KSPLIT": 8,
      "num_warps": 2,
      "num_stages": 1,
      "waves_per_eu": 1
    },
    "4817": {
      "BLOCK_M": 256,
      "BLOCK_N": 16,
      "BLOCK_K": 64,
      "BLOCK_C": 32,
      "NUM_KSPLIT": 8,
      "num_warps": 4,
      "num_stages": 2,
      "waves_per_eu": 2
    },
    "4803": {
      "BLOCK_M": 256,
      "BLOCK_N": 16,
      "BLOCK_K": 64,
      "BLOCK_C": 32,
      "NUM_KSPLIT": 4,
      "num_warps": 8,
      "num_stages": 2,
      "waves_per_eu": 0
    },
    "1562": {
      "BLOCK_M": 64,
      "BLOCK_N": 16,
      "BLOCK_K": 32,
      "BLOCK_C": 32,
      "NUM_KSPLIT": 4,
      "num_warps": 8,
      "num_stages": 1,
      "waves_per_eu": 2
    },
    "4122": {
      "BLOCK_M": 128,
      "BLOCK_N": 16,
      "BLOCK_K": 256,
      "BLOCK_C": 64,
      "NUM_KSPLIT": 2,
      "num_warps": 2,
      "num_stages": 1,
      "waves_per_eu": 0
    },
    "3688": {
      "BLOCK_M": 128,
      "BLOCK_N": 16,
      "BLOCK_K": 128,
      "BLOCK_C": 32,
      "NUM_KSPLIT": 1,
      "num_warps": 8,
      "num_stages": 2,
      "waves_per_eu": 1
    },
    "3112": {
      "BLOCK_M": 128,
      "BLOCK_N": 16,
      "BLOCK_K": 32,
      "BLOCK_C": 128,
      "NUM_KSPLIT": 1,
      "num_warps": 8,
      "num_stages": 2,
      "waves_per_eu": 1
    },
    "889": {
      "BLOCK_M": 32,
      "BLOCK_N": 16,
      "BLOCK_K": 128,
      "BLOCK_C": 64,
      "NUM_KSPLIT": 2,
      "num_warps": 4,
      "num_stages": 1,
      "waves_per_eu": 1
    },
    "2246": {
      "BLOCK_M": 64,
      "BLOCK_N": 16,
      "BLOCK_K": 128,
      "BLOCK_C": 32,
      "NUM_KSPLIT": 1,
      "num_warps": 8,
      "num_stages": 1,
      "waves_per_eu": 2
    },
    "607": {
      "BLOCK_M": 32,
      "BLOCK_N": 16,
      "BLOCK_K": 64,
      "BLOCK_C": 128,
      "NUM_KSPLIT": 2,
      "num_warps": 8,
      "num_stages": 1,
      "waves_per_eu": 1
    },
    "2189": {
      "BLOCK_M": 64,
      "BLOCK_N": 16,
      "BLOCK_K": 128,
      "BLOCK_C": 16,
      "NUM_KSPLIT": 2,
      "num_warps": 4,
      "num_stages": 2,
      "waves_per_eu": 2
    },
    "574": {
      "BLOCK_M": 32,
      "BLOCK_N": 16,
      "BLOCK_K": 64,
      "BLOCK_C": 64,
      "NUM_KSPLIT": 8,
      "num_warps": 8,
      "num_stages": 2,
      "waves_per_eu": 1
    },
    "4473": {
      "BLOCK_M": 256,
      "BLOCK_N": 16,
      "BLOCK_K": 32,
      "BLOCK_C": 64,
      "NUM_KSPLIT": 1,
      "num_warps": 4,
      "num_stages": 2,
      "waves_per_eu": 0
    },
    "1848": {
      "BLOCK_M": 64,
      "BLOCK_N": 16,
      "BLOCK_K": 64,
      "BLOCK_C": 16,
      "NUM_KSPLIT": 4,
      "num_warps": 8,
      "num_stages": 1,
      "waves_per_eu": 0
    },
    "384": {
      "BLOCK_M": 32,
      "BLOCK_N": 16,
      "BLOCK_K": 64,
      "BLOCK_C": 16,
      "NUM_KSPLIT": 2,
      "num_warps": 4,
      "num_stages": 1,
      "waves_per_eu": 0
    },
    "2834": {
      "BLOCK_M": 64,
      "BLOCK_N": 16,
      "BLOCK_K": 256,
      "BLOCK_C": 256,
      "NUM_KSPLIT": 2,
      "num_warps": 4,
      "num_stages": 1,
      "waves_per_eu": 2
    },
    "3295": {
      "BLOCK_M": 128,
      "BLOCK_N": 16,
      "BLOCK_K": 64,
      "BLOCK_C": 16,
      "NUM_KSPLIT": 8,
      "num_warps": 2,
      "num_stages": 1,
      "waves_per_eu": 1
    },
    "5410": {
      "BLOCK_M": 256,
      "BLOCK_N": 16,
      "BLOCK_K": 256,
      "BLOCK_C": 16,
      "NUM_KSPLIT": 1,
      "num_warps": 4,
      "num_stages": 2,
      "waves_per_eu": 1
    },
    "1626": {
      "BLOCK_M": 64,
      "BLOCK_N": 16,
      "BLOCK_K": 32,
      "BLOCK_C": 64,
      "NUM_KSPLIT": 4,
      "num_warps": 4,
      "num_stages": 1,
      "waves_per_eu": 0
    },
    "1085": {
      "BLOCK_M": 32,
      "BLOCK_N": 16,
      "BLOCK_K": 256,
      "BLOCK_C": 16,
      "NUM_KSPLIT": 1,
      "num_warps": 2,
      "num_stages": 2,
      "waves_per_eu": 2
    },
    "1805": {
      "BLOCK_M": 64,
      "BLOCK_N": 16,
      "BLOCK_K": 64,
      "BLOCK_C": 16,
      "NUM_KSPLIT": 1,
      "num_warps": 2,
      "num_stages": 2,
      "waves_per_eu": 2
    },
    "4645": {
      "BLOCK_M": 256,
      "BLOCK_N": 16,
      "BLOCK_K": 32,
      "BLOCK_C": 256,
      "NUM_KSPLIT": 4,
      "num_warps": 2,
      "num_stages": 1,
      "waves_per_eu": 1
    },
    "1922": {
      "BLOCK_M": 64,
      "BLOCK_N": 16,
      "BLOCK_K": 64,
      "BLOCK_C": 32,
      "NUM_KSPLIT": 4,
      "num_warps": 8,
      "num_stages": 1,
      "waves_per_eu": 2
    },
    "3541": {
      "BLOCK_M": 128,
      "BLOCK_N": 16,
      "BLOCK_K": 64,
      "BLOCK_C": 256,
      "NUM_KSPLIT": 1,
      "num_warps": 8,
      "num_stages": 1,
      "waves_per_eu": 1
    },
    "2592": {
      "BLOCK_M": 64,
      "BLOCK_N": 16,
      "BLOCK_K": 256,
      "BLOCK_C": 32,
      "NUM_KSPLIT": 1,
      "num_warps": 2,
